id	corpus	subreddit	date
wcj1xn	an interesting bitcoin read from 2011 this guy must be a time traveler removed 	Bitcoin	2022_08_01
wcigs5	bull24coin com legit has anyone heard of or used this platform 	Bitcoin	2022_08_01
wchpsa	question about sparrow wallet coinjoin how many coinjoin mixes is sufficient is 3 or 4 the sweet spot or would more mixes be required 	Bitcoin	2022_08_01
wchnfb	finally got an online job after waiting for months i was depressed from 5 months as i applied for many jobs but rejected from all then i tried to apply for an online job and eventually a website hired me fast forward to now i am employed from a month and got a payout of 3700 this month don t worry you will also get a good job soon for your curiosity i found the job here https linktr ee free jobs 	Bitcoin	2022_08_01
wchmke	slowly then all at once major israeli credit card provider launches bitcoin rewards card spare me the anti israel bs nan	Bitcoin	2022_08_01
wcfm2b	07 31 22 join flarexrp discord discord com invite flarexrp flarexrp discord gt gt gt invite link discord com invite flarexrp https discord com invite flarexrp official discord for the following partner subs r xrp r ripple r flarenetwork r songbird r evernode channels 1 announcements 2 news and media 3 infographics and visual aids categories 1 exchanges amp wallets fintech defi amp nfts investing cryptocurrency 2 interledger protocol ripplex polysign 3 xrpl labs xumm bifrost d cent exodus and more special perks for flarexrp discord server boosters 	XRP	2022_08_01
wcw0e5	new xrpl dex application receives 100k in xrpl grants digital journal nan	XRP	2022_08_01
wcvxjo	new xrpl dex application receives 100k in xrpl grants digital journal nan	XRP	2022_08_01
wccsr6	do banks have to buy xrp to use the odl service removed 	XRP	2022_08_01
wccomz	this is the beginning i am the definition of army this game ended long time ago this is war i am a victim remote nueral monitoring you wanna know more removed 	XRP	2022_08_01
wce128	 how to get rich with bitcoin even if you have no clue about technology removed 	solana	2022_08_01
wcmv66	solana candy machine sugar mainnet is not working please help removed 	solana	2022_08_01
wcx5j9	solana blockchain shows a higher decentralization than other major blockchains in the crypto sector is solana blockchain more centralized than decentralized removed 	solana	2022_08_01
wcx2ef	solana space stores will attract 100k users to the solana blockchain monthly ceo of solana is the solana space stores capable of attracting 100k users monthly removed 	solana	2022_08_01
wcxryn	sol usdc 123 apr on orca whirlpool but 13 1 on raydium i mainly use raydium but today i decided that i will add some orca to my bag of spl token that why i went directly on orca website and i noticed this difference both are calculate based on the last 24h do somebody now why is it like that because then i should move all my sol usdc to orca whirlpool instead of classic pool	solana	2022_08_01
w2mol3	scaramucci halts withdrawals in a fund after stock crypto swoon nan	Bitcoin	2022_07_20
w2mkzd	bitcoin let s all come in and discuss some people say the bull market is coming what do you think 	Bitcoin	2022_07_20
w2mhhc	total cryptocurrency market cap returns to 1 trillion bitcoin stands at 22 000 ether surges to 1 500 removed 	Bitcoin	2022_07_20
w2mfzh	total cryptocurrency market cap returns to 1 trillion bitcoin stands at 22 000 ether surges to 1 500 removed 	Bitcoin	2022_07_20
w2macy	new ath in 2023 it seems like a new ath for this year is pretty much impossible i see some bears here and elsewhere saying that it will take till 2025 and even 2026 to see a new ath would it be reasonable to hope for a new ath next year or is that just a fantasy what are the chances we see one next year 	Bitcoin	2022_07_20
w2w4ek	three arrows capital 3ac su zhu and kyle davies may have purchased a 50 million yacht with borrowed funds nan	ethereum	2022_07_20
w2vw8x	crypto more popular than mutual funds among millennials survey shows nan	ethereum	2022_07_20
w2vtit	building a way to discover new dapps everyday what do you guys think nan	ethereum	2022_07_20
w2vqiq	crypto asset manager valkyrie looks to raise 30m for its new vc arm nan	ethereum	2022_07_20
w2u25x	i admittedly don t know much about the topic but i am wondering if quantum computing will destroy the crypto market as we know it today will ethereum 2 0 be resistant to quantum attacks is it smart to invest in both crypto and quantum computing stocks removed 	ethereum	2022_07_20
w2ozuw	sologenic check it out if you haven t low market cap gem easy 100 times returned and it s built on xrp nan	XRP	2022_07_20
w36clo	ripple is one of the few cryptos supposedly compliant with iso 20022 nan	XRP	2022_07_20
w30zr7	subcommittee on investor protection entrepreneurship and capital markets grills sec enforcement director nan	XRP	2022_07_20
w2spsn	thinking of investing in xrp coin insanely cheap prices xrp amp sec lawsuit update nan	XRP	2022_07_20
w2j434	07 19 22 join flarexrp discord discord com invite flarexrp flarexrp discord gt gt gt invite link discord com invite flarexrp https discord com invite flarexrp official discord for the following partner subs r xrp r ripple r flarenetwork r songbird r evernode channels 1 announcements 2 news and media 3 infographics and visual aids categories 1 exchanges amp wallets fintech defi amp nfts investing cryptocurrency 2 interledger protocol ripplex polysign 3 xrpl labs xumm bifrost d cent exodus and more special perks for flarexrp discord server boosters 	XRP	2022_07_20
w33lsx	play to earn buy nft miners and create passive crypto income by mining online btc eth bnb matic doge sol removed 	Polkadot	2022_07_20
ymxq0c	join crypto today by earning massive profits daily weekly monthly contact me for more details nan	Bitcoin	2022_11_06
ymxnfv	you must see this ai generated video on grimes lyrics delicate weapon cyberpunk nan	Bitcoin	2022_11_06
ymwe9b	what s the value of an infinitely tall stack of 1 bills nan	Bitcoin	2022_11_06
ymw9uk	fed is not slowing down with btc gandalf state of bitcoin ep 47 nan	Bitcoin	2022_11_06
ymvxen	is blockchain really necessary after a short period of development and especially after the industrial revolution people have a clear perception of the finiteness of the earth s resources to solve this problem people have created the internet an infinite resource space but is the internet really infinite and is that infinity good or bad blockchain is one of the next development solutions of the internet what effect does blockchain have for the development of the internet and is it really the inevitable development of the internet 	Bitcoin	2022_11_06
ymno52	i have a question can anybody send me 10 worth of ethereum and i give u a paysafe card sounds strange but you would help me a lot nan	ethereum	2022_11_06
ymmzym	take a look i think it s worth it the bidding war is starting nan	ethereum	2022_11_06
ymmx3f	looking for ethereum and bitcoin olny wallet hello guys i m looking for ethereum and bitcoin only wallet i ve got mycelium but it shows no network connection at the ethereum wallet most of the times and the error is a yellow triangle with and exclamation mark i m using andoid thanks	ethereum	2022_11_06
ymmmcm	where can i buy safely buy ethereum without the transaction getting cancelled by my bank as i am a minor its quite hard for me to access safe websites to buy from without the transaction being rejected by my bank	ethereum	2022_11_06
ymmlgl	where can i buy safely buy ethereum without the transaction getting cancelled by my bank removed 	ethereum	2022_11_06
ymjjfj	11 05 22 join xrplounge discord discord com invite xrplounge xrplounge discord gt gt gt invite link discord com invite xrplounge https discord com invite xrplounge official discord for the following partner subs r xrp r ripple r flarenetwork r songbird r evernode channels 1 announcements 2 news and media 3 infographics and visual aids categories 1 exchanges amp wallets fintech defi amp nfts investing cryptocurrency 2 interledger protocol ripplex polysign 3 xrpl labs xumm bifrost d cent exodus and more special perks for xrplounge discord server boosters 	XRP	2022_11_06
ymgzw1	alchemy crypto cypher 11 4 22 xrp news amp much more nan	XRP	2022_11_06
ymtr5j	first culture marketplace create buy sell explore images memes and gifs nan	XRP	2022_11_06
ymyzzb	who has an ellipal wallet i have money trapped in usdc and want to sell it but it s saying i need mining fees i thought you didn t need to pay for usdc nan	XRP	2022_11_06
ymmowf	ripple struggles above 0 44 as bears threaten to short nan	XRP	2022_11_06
yn1u3l	polkadot at the bear market san fransisco blockchain week ser have ya heard nan	Polkadot	2022_11_06
ymzt0m	web3 foundation asserts dot is not a security after 3 years of meetings with the sec removed 	Polkadot	2022_11_06
w0ya94	anyone trying to make a quick 500 in ny at home add my snap i got you queenbean326 removed 	Bitcoin	2022_07_18
w0wsiv	any way to purchase btc anonymously i dont like giving big companies my personal id and shit and i wanna know if theres an anonymous way 2 do this	Bitcoin	2022_07_18
w0wm0b	 serious i m a set it and forget it type of person i had crypto on voyager and i m just hearing about it can someone eli5 i understand they declared bankruptcy what does that mean for my crypto is it gone is the company doing something to repay us or am i shit out of luck 	Bitcoin	2022_07_18
w0wlyk	my purpose in life is to troll buttcoin posts removed 	Bitcoin	2022_07_18
w0w59n	is it true that in russia it is prohibited to transfer or accept digital financial assets as a consideration for transferred goods performed works rendered services as well as in any other way that allows one to assume payment for goods works services by a digital financial asset except as otherwise provided by federal laws 	Bitcoin	2022_07_18
w0xtx3	otherside xyz uses stadia s tech to stream the game on the browser basically the title details here if required my own post https www reddit com r stadia comments w0xsm7 big news othersidexyz yuga uses google cloud https www reddit com r stadia comments w0xsm7 big news othersidexyz yuga uses google cloud 	ethereum	2022_07_18
w1a6oc	is there a crypto company doing what fiverr does is there a crypto company doing what fiverr does fiverr is really good for freelancing is there currently a site fiverr offering to do business with crypto payments thanks	ethereum	2022_07_18
w1a52f	is there a crypto company doing what fiverr does removed 	ethereum	2022_07_18
w18am2	 nft mint only 1 000 nfts floor price is 0 31 eth nan	ethereum	2022_07_18
w180j0	help lost my eth sent on cronos beta network any ideas about how to recover removed 	ethereum	2022_07_18
w1am7u	eth heads when you tell them you like solana cos the fees are low nan	solana	2022_07_18
w176u0	finalized max confirmations hey there amp x200b i am not able to mint error message finalized max confirmations amp x200b anyone knows whats going on amp x200b thanks	solana	2022_07_18
w16k16	why is the majority of sol not liquid staked over 95 of staked sol is delegated to individual validators instead of with a liquid stake pool there are real risks to liquid stake pools risk of depeg namely but also real risks to delegating to a single validator slashing namely so why is the proportion so skewed view poll https www reddit com poll w16k16 	solana	2022_07_18
w1h0et	solana mobile saga who is this phone for now i m not a genius or any kind of fanboy when i comes to new phones or web3 topics for the last few weeks i saw this project all over my social media and know i want to ask who is this phone for and why is it worth to upgrade to a web3 phone 	solana	2022_07_18
w1e6bu	help anyone know a platform for using nfts to vote on proposals 	solana	2022_07_18
w0y2j9	w3f grant recipient prosopo founder chris taylor talks battling bots polkadot decoded 2022 berlin nan	Polkadot	2022_07_18
w1374z	too busy to stay updated on astar here is a 5 min tldr of the weeks news to help you stay informed nan	Polkadot	2022_07_18
w1e6y7	bonus episode with jusup11 host of the alpha podcast w nvrland labs space monkeys podcast 064 nan	Polkadot	2022_07_18
wxbaki	why does digital currency thrive these days cryptocurrency https fullhouseclubs com cryptocurrency payment review is the present and the future but how long thingsthatmakeyougohmm cryptocurrencypayments digitalcurrency	Bitcoin	2022_08_26
wxba43	crypto atm firm to go public with 885m spac deal nan	Bitcoin	2022_08_26
wx8oio	cake wallet does anyone know the best way to get someone to send bitcoin from binance to my wallet it says a minimum of 0 001 btc to send with btc network can i change this to other networks and still get my money on cake wallet 	Bitcoin	2022_08_26
wx8hb0	bitcoin and crypto adoption country users usa 46 million india 27 million pakistan 26 million nigeria 22 million vietnam 20 million china 20 million brazil 16 million https twitter com jon favr status 1562716646686334977 https twitter com jon favr status 1562716646686334977 	Bitcoin	2022_08_26
wx8a90	indian otc india s first cryptocurrency exchange that allows you to invest into tokenized funds making bitcoin available for every indian nan	Bitcoin	2022_08_26
wx7m7l	gmx staking rewards calculator dear defi enthusiasts and gmx fans i have developed a gmx staking calculator which should simply show you how much esgmx eth rewards you are earning from staking the gmx token the gmx calculator is based on live data from the gmx exchange and uses the 7 day average of fee revenue which gets distributed to gmx holders check out the gmx calculator gmxstaking com https gmxstaking com please let me know any suggestions feedback so i can improve the website or add new features 	ethereum	2022_08_26
wx7gw9	whats the rockepool staking risk hope the community can help me with some perspective i know the whole point of the eth merge is to move to proof of stake so cool if you cant be your own validator and go with one of the popular staking options rocketpool and get reth it s right to say your taking risks of the bridge being hacked and losing all your eth and could it happen that reth depegs is there a particular reason why rocketpool is less vulnerable 	ethereum	2022_08_26
wx632h	how to raise seed funding for web 3 start up hey there i am exploring entrepreneurship and trying to startup on a idea which i have pre planned so now i want to really harness the power of web3 defi and crypto to raise funds and make a good brand out of it but i am really unaware of how can i raise seed funds since right now i am at idea stage with my startup therefore i would like to know from reddit how can i do it i would appreciate brief description thank you	ethereum	2022_08_26
wx4ewp	ledger eth gift hey ledger peeps i want to gift a kid a ledger nano with eth loaded on it any ideas if possible and what s the best way to do it 	ethereum	2022_08_26
wxhq0b	if i leave my eth in trezor wallet will i get both the eths and ethw tokens post merge removed 	ethereum	2022_08_26
wxf152	full proposal including all details for changing the flare flr token distribution mechanics have been published nan	XRP	2022_08_26
wx3zgc	08 25 22 join flarexrp discord discord com invite flarexrp flarexrp discord gt gt gt invite link discord com invite flarexrp https discord com invite flarexrp official discord for the following partner subs r xrp r ripple r flarenetwork r songbird r evernode channels 1 announcements 2 news and media 3 infographics and visual aids categories 1 exchanges amp wallets fintech defi amp nfts investing cryptocurrency 2 interledger protocol ripplex polysign 3 xrpl labs xumm bifrost d cent exodus and more special perks for flarexrp discord server boosters 	XRP	2022_08_26
wxnoai	mark cuban slams sec chair gary gensler for his take on crypto nan	XRP	2022_08_26
wxk3t5	if wef adopts xrp as a global currency i don t see it going more than 1usd removed 	XRP	2022_08_26
wxf9w4	thecollege nfts follow discord amp twitter now to get the freemint whitelists nft nan	solana	2022_08_26
wxoavv	degods token dust is the number 1 trending spl token on solana up 100 in the last days nan	solana	2022_08_26
wxnmmr	the best solana nft tools part i matrica solswatch and solanafloor nan	solana	2022_08_26
wxi3gq	build your solana project with talent you can trust using freeflow get connected with a network of vetted secure blockchain developers to ensure your next launch is smooth and safe nan	solana	2022_08_26
wx9npe	can anyone guide on how to create staking dapp for a solana nft nan	solana	2022_08_26
vt9b2z	i made a commitment to stack sats this year with a certain end goal in sight but shit it s getting exhausting bitcoin life is a hard slog nan	Bitcoin	2022_07_08
vt9032	this is without a doubt the most embarrassing bitcoin discussion i have ever seen nan	Bitcoin	2022_07_08
vt8l6l	stop saving cash make money work for you money viral foryou bitcoin explore viralvideo video nan	Bitcoin	2022_07_08
vt8k9q	waterjug challenge save all your change for the next year get money money foryou explore nan	Bitcoin	2022_07_08
vt8f2a	bitcoin problems just some guy who s really into bitcoin and wants to fix improve on bitcoin what is the current problem with bitcoin what could possibly dramatically help out with the net work i just really want to be a part of helping bitcoin succeed or at least try 	Bitcoin	2022_07_08
vtchze	lol that ens post name https opensea io assets ethereum 0x57f1887a8bf19b14fc0df6fd9b2acc9af147ea85 91935371695976285802090358007475942732042646073194419906195791053467406774906 https opensea io assets ethereum 0x57f1887a8bf19b14fc0df6fd9b2acc9af147ea85 91935371695976285802090358007475942732042646073194419906195791053467406774906 	ethereum	2022_07_08
vtbss4	how to get test large quantities of test eth removed 	ethereum	2022_07_08
vtbspn	ethereum transaction fees have dropped to their lowest level since december 2020 nan	ethereum	2022_07_08
vtkuhk	how to download the complete ethereum blockchain hello all i would like to conduct a content analysis of the ethereum blockchain as part of a research project ideally i download it so that i can explore the entire dataset using bigdata methods at this point my question how would you proceed to download this almost 800 gbyte and which tools are best suited for this 	ethereum	2022_07_08
vtkmjy	uni s floor 0 035eth once this collection is sold out 20 of eth made will be given to one of the collector who owns atleast one nft from this collection nan	ethereum	2022_07_08
vt9cv7	07 07 22 join flarexrp discord discord com invite flarexrp flarexrp discord gt gt gt invite link discord com invite flarexrp https discord com invite flarexrp official discord for the following partner subs r xrp r ripple r flarenetwork r songbird r evernode channels 1 announcements 2 news and media 3 infographics and visual aids categories 1 exchanges amp wallets fintech defi amp nfts investing cryptocurrency 2 interledger protocol ripplex polysign 3 xrpl labs xumm bifrost d cent exodus and more special perks for flarexrp discord server boosters 	XRP	2022_07_08
vt8z5k	dogecoin dogecoin price free dogecoin wallet faucet lottery and dice nan	XRP	2022_07_08
vt8yw9	dogecoin dogecoin price free dogecoin wallet faucet lottery and dice removed 	XRP	2022_07_08
vt7rop	xrp ledger s latest milestone is actually huge says legal expert jeremy hogan nan	XRP	2022_07_08
vtlzed	ripple xrp the secret disclosed jeremy hogan what secvsripple all about nan	XRP	2022_07_08
trxskd	get paid for testing out free apps with elitezap removed 	Bitcoin	2022_03_31
trxc51	the crypto couple fixes greenpeace s fud video let s all hijack changethecode on twitter nan	Bitcoin	2022_03_31
trwsx1	bitcoin is fueling monetary change some people don t like that youtube nan	Bitcoin	2022_03_31
trwldk	i put an order in for 5 000 worth of btc at 47 240 but then it literally bought 6200 worth and i swear i did not have a previous order in or fat finger anything coin base pro literally bought extra bitcoin for me without me wanting to its in my order history but not my buy book nan	Bitcoin	2022_03_31
trwbio	airdrop 5000 join group telegram https t me smarty payment bot start 1684659639 removed 	Bitcoin	2022_03_31
trwstx	what is ethereum 2 0 and why does it matter nan	ethereum	2022_03_31
trv7ic	new nft project that could be the next big gem metaplayersnfts nan	ethereum	2022_03_31
truwqm	this is how i will look at you if you say music nfts are a scam nan	ethereum	2022_03_31
trub1o	hi guys i have some money locked up on my trustwallet which i really need but i don t have any eth to cover the 15 fee i would really appreciate it if anyone could bless me so i can get the money to pay my rent nan	ethereum	2022_03_31
ts1cb1	made a tool that automatically inserts eth transactions into google docs for easier storage and processing pm me to learn more nan	ethereum	2022_03_31
trxsnt	03 30 22 join flarexrp discord discord com invite flarexrp flarexrp discord gt gt gt invite link discord com invite flarexrp https discord com invite flarexrp official discord for the following partner subs r xrp r ripple r flarenetwork r songbird r flarefinance r evernode channels 1 announcements 2 news and media 3 infographics and visual aids categories 1 exchanges amp wallets fintech defi amp nfts investing cryptocurrency 2 interledger protocol ripplex polysign 3 xrpl labs xumm bifrost d cent exodus and more special perks for flarexrp discord server boosters 	XRP	2022_03_31
truot5	jumbo ticket believes in giving back to the society that s why we have created jtt jumbo ticket trust is an initiative through which we support the needy by keeping aside 1 from every tickets purchased by our customers are you ready to make a change nan	XRP	2022_03_31
ts2gu7	furious bitcoiners call ripple s co founder judas for giving 5m to greenpeace climate campaign coinmarketcap nan	XRP	2022_03_31
ts81d6	stunning bitcoin and ethereum statement from manager of ripple removed 	XRP	2022_03_31
ts6uq1	xrp spark drop did this ever get deposited or did i miss something removed 	XRP	2022_03_31
trudl6	does msol i used on port finance as the collateral increasing in value i mean as long as it s no longer in my account does staked msol increases in value when it s loaned 	solana	2022_03_31
ts18tw	random bg punks v1 collection of 111 unique punks only private minting soon join discord removed 	solana	2022_03_31
ts3mmr	solana node updated to the v1 9 12 version removed 	solana	2022_03_31
ts30ew	vivaion metaverse is one of the hottest projects on solana nan	solana	2022_03_31
ts1xyz	phantom wallet hi i have my sol on solflare and it s currently staked with a validator is there anyway to like swap from my solflare wallet to phantom wallet i headed some people saying if i import my seed in another wallet it shows my portfolio is it true i really want to know if i import my solflare seed to phantom can i really use phantom wallet please help	solana	2022_03_31
tru63u	the recent ronin bridge hack once again illustrates the need for secure and future proof scaling solutions especially those designed to support interoperability between blockchains at the level of consensus darwinia network solves this lesstrustmoretruth web3 polkadot nan	Polkadot	2022_03_31
ts8u96	polkadot is in miami during bitcoin 2022 april 6 at 2pm edt join the miami beach edition for an introduction to polkadot to learn about the advantages of the network hear the latest on the cross chain bridge connecting polkadot with bitcoin as well as hear from speakers from parity tech nan	Polkadot	2022_03_31
ts4u3x	polkadot panel is polkadot web3 s pathway to interoperability starting soon at diffusion events removed 	Polkadot	2022_03_31
tse019	where can i buy trade sell native dot for us user removed 	Polkadot	2022_03_31
tsdrc6	what are bags unapplied slashes option to cancel reporters i nominated a validator who got slashed had 525 dot and now 250 dot staked so the 221 from the screenshot doesn t add up nan	Polkadot	2022_03_31
umddbn	if you sign up now get a free 1000 paypal gift card instantly removed 	Bitcoin	2022_05_11
umdc3m	if you sign up now get a free 1000 paypal gift card instantly removed 	Bitcoin	2022_05_11
umd8ai	how many of you look your portfolio value in terms of btc since few months now i have had a mental shift where i have moved all my portfolio tracking software to btc i end up only tracking how much of btc i have in this market turmoil i thought i would fall back to fiat but i surprisingly i did not i am just wondering am i in minority thinking like this or there is a big majority who measure their portfolio in btc now 	Bitcoin	2022_05_11
umcho0	this killed me amp x200b https preview redd it 8rcmfg96ily81 png width 960 amp format png amp auto webp amp s 21ba298a9a39b77198d620d272b59bd84cc5c699	Bitcoin	2022_05_11
umcgj6	this this is why yield app is the best cefi platform out there nan	Bitcoin	2022_05_11
umcfqo	using beefy finance to earn 10 000 apy on your crypto holdings nan	ethereum	2022_05_11
umcakl	 luxury ens i am rich eth now on sale nan	ethereum	2022_05_11
umblqc	victim of fraud and all i have is wallet address hey everyone i could really use some help last year i was victim of fraud during a mental health crisis and some fraudsters made me buy eth on my name i can t remember how i got it and all i have is the wallet address 0xd5624df2b1a760fe83024a1094c0592a1c0416f4 i ve just checked and the account has been used a lot and i m afraid i might be in trouble in the future for this any ideas on how to recover the wallet 	ethereum	2022_05_11
umbe82	i have a small holding in eth where should i stake them nan	ethereum	2022_05_11
umb9l8	luna foundation guard is now selling all of its bitcoins to save ust peg what is happening nan	ethereum	2022_05_11
um9jff	easiest 5 you ve ever made just vote in a telegram contest for my brothers entry and send me a screenshot removed 	solana	2022_05_11
