id	corpus	subreddit	date
um7nmi	just like my mum angel protects me from the bears nan	solana	2022_05_11
um6v6b	interacting with raydium and other amms with cli hello everyone i am a new developer and i m sure that this is a noob question but i was hoping that i could get some help interacting with raydium and other amms with cli thank you for any help that you can provide 	solana	2022_05_11
um6dsa	solana tokenomics please i am invested in sol somewhat i ve had a small bag for a while i am considering investing more while the price has plunged i ve mostly steered clear of investing in sol since my initial investment primarily because i don t understand the tokenomics as an investor only how does solana make me money i am stuck at the no max supply i ve read through other posts and i m just not getting it 	solana	2022_05_11
umejff	seen the news wanna talk about stablecoin design join hubble protocol s town hall tonight at 5 pm utc on discord link inside hubble protocol s monthly town hall is coming up today we ll be going over what we ve accomplished in the past month upcoming releases partnerships and community initiatives and of course stablecoin design and maintaining usdh s peg today may 10 17 00 utc discord see you there https discord com events 901231379587670066 968288124260220958 https discord com events 901231379587670066 968288124260220958 	solana	2022_05_11
ump8z6	what are the top 3 ethereum developer training programs removed 	Polkadot	2022_05_11
umcbk5	why is polkadots market cap so large and community so small removed 	Polkadot	2022_05_11
umvwpr	how to stake your polkadot dot on acala ldot liquid staking nan	Polkadot	2022_05_11
umvhds	ser where are the photography nfts americas 2 0 on rmrk amp kusama ser have ya heard may 10 2022 nan	Polkadot	2022_05_11
sg7jpy	when to take some of the profits out i m new to btc and i ve entered the market not that long ago question is when do i cash out some of the profits from btc or eth what do i do so that if the market goes down i don t lose some of the profits do i sell only the profit made do i sell all and re enter the market with a limit at a lower price the support line maybe do i sell half profit	Bitcoin	2022_01_31
sg7925	is imf on the wrong side of history as it issues yet another warning to el salvador nan	Bitcoin	2022_01_31
sg70m5	divorced but available for new cubs i m looking for a young age i m okay financially i ll take care of you responsibilities removed 	Bitcoin	2022_01_31
sg6s07	exchange value vs use value does bitcoin back itself removed 	Bitcoin	2022_01_31
sg64wf	breaking up is not the only thing that greg makes a hash of nan	Bitcoin	2022_01_31
sfzwhp	saitamask issues i downloaded saitamask yesterday and it was working fine now today the app won t even open for me i cleared history cache etc and it s still won t load i turned the phone on and off and still nothing i also uninstalled it and reinstalled it and still nothing anyone else having the issues or know how i can fix them please help i want to buy the lily token that comes out tomorrow according to saitama	ethereum	2022_01_31
sfzdtz	please help all of my saitama tokens were stolen today i never gave out my passphrase to anyone but it was all transferred into this wallet is there anyone who can help me nan	ethereum	2022_01_31
sfz4kw	did i just lose half a million dollars by sending weth to weth s contract address please tell me that i didn t https etherscan io tx 0x96a7155b44b77c173e7c534ae1ceca536ba2ce534012ff844cf8c1737bc54921 https etherscan io tx 0x96a7155b44b77c173e7c534ae1ceca536ba2ce534012ff844cf8c1737bc54921 	ethereum	2022_01_31
sfz07q	i made a terrible mistake and sent weth to weth s contract address did i lose all that money 	ethereum	2022_01_31
sfyt5d	how do you get eth back from weth do you send weth to this https etherscan io address 0xc02aaa39b223fe8d0a0e5c4f27ead9083c756cc2 contract address again 	ethereum	2022_01_31
sg3qmx	anyone have an update on the solo airdrop specifically for uphold exchange removed 	XRP	2022_01_31
sg1bni	01 30 22 join flarexrp discord discord com invite flarexrp flarexrp discord gt gt gt invite link discord com invite flarexrp https discord com invite flarexrp official discord for the following partner subs r xrp r ripple r flarenetwork r songbird r flarefinance r evernode channels 1 announcements 2 news and media 3 infographics and visual aids categories 1 exchanges amp wallets fintech defi amp nfts investing cryptocurrency 2 interledger protocol ripplex polysign 3 xrpl labs xumm bifrost d cent exodus and more special perks for flarexrp discord server boosters 	XRP	2022_01_31
sg53uo	xrp sold by ripple surges 46 in q4 717m compared to previous quarter nan	XRP	2022_01_31
sg50pm	cross chain bridge allbridge adds support for xrp ledger as it s 12th chain to bridge to and from nan	XRP	2022_01_31
sg91v2	if two banks are using the xrp ledger aren t they really the same removed 	XRP	2022_01_31
sg1ltb	buy polka dots with paypal balance i just want to buy 1 dot removed 	Polkadot	2022_01_31
sgbn4f	on mobile i can t access the discord as soon as i tap the i get this message and since i can t get verified i can t even message mods thoughts nan	Polkadot	2022_01_31
sgioev	fc barcelona seals deal with polkadot for 110m usd for nect 5 years nan	Polkadot	2022_01_31
sgg9as	astar staking rewards less than inflation during staking festival removed 	Polkadot	2022_01_31
sg65qn	question regarding participating in parachain auctions on binance bdot removed 	Polkadot	2022_01_31
x9o8ud	satoshi 2010 i m sure that in 20 years there will either be very large transaction volume or no volume nan	Bitcoin	2022_09_10
x9o6ma	usdt transfer time why usdt transfers take longer than btc for those who can help to explain i am very grateful	Bitcoin	2022_09_10
x9nyz0	with new prime minister uk still wants to be crypto hub treasury official nan	Bitcoin	2022_09_10
x9mxik	best way to learn and invest in crypto currency removed 	Bitcoin	2022_09_10
x9lvgr	for best cashapp methods carding swiping methods bank logs paypal cashapp logs join the swiping atms eazy discord server nan	Bitcoin	2022_09_10
x9oanz	ethereum founder gavin wood wrote about having sex with a preteen girl dying from aids on his blog he says it was just fiction nan	ethereum	2022_09_10
x9ln7j	why does paris update use ttd why does the paris update use ttd instead of a specified block height i don t quite get the idea is it to be in time with the bellatrix update why the merge isn t providing replay attacks also is it related to smart contract compatibility 	ethereum	2022_09_10
x9lb4s	yep again i have a 8 month old made during ath s now this i m being 100 too nan	ethereum	2022_09_10
x9z7rg	now it s official binance exchange will list baby doge coin babydoge will be launched today removed 	ethereum	2022_09_10
x9z4yn	good news for nft fans don t miss the moment nan	ethereum	2022_09_10
x9z9xc	good news for nft fans don t miss the moment nan	XRP	2022_09_10
x9xprj	are they trying to us residents from buying xrp removed 	XRP	2022_09_10
x9wvvo	a 2019 talk by david schwartz on international payments but still seems relevant today nan	XRP	2022_09_10
x9l6ea	09 09 22 join flarexrp discord discord com invite flarexrp flarexrp discord gt gt gt invite link discord com invite flarexrp https discord com invite flarexrp official discord for the following partner subs r xrp r ripple r flarenetwork r songbird r evernode channels 1 announcements 2 news and media 3 infographics and visual aids categories 1 exchanges amp wallets fintech defi amp nfts investing cryptocurrency 2 interledger protocol ripplex polysign 3 xrpl labs xumm bifrost d cent exodus and more special perks for flarexrp discord server boosters 	XRP	2022_09_10
x9keid	br1 is starting its closed beta they are funding accounts with usdc as every kill you get in game is worth 1 and you spawn for 1 nan	solana	2022_09_10
x9hmul	portal https t me prodevinuportal community owned we all build together safu launch date sept 10 2020 the next big change coming to bsc the next big crypto that will develop its own use utility for real world expenses we are thr change join us https prodevinu finance removed 	solana	2022_09_10
x9g5ik	token name vee nft telegram https t me zeenft dc presale time 01 25 19 00 pm 01 29 17 00 pm soft hard cap 300 bnb 600 bnb min max 0 02 bnb 5 bnb presale rate 2 bnb 560000000000 0 vee nft liquidity 70 lockup 200 days https t me zeenft dc website veefriends com removed 	solana	2022_09_10
x9z70u	now it s official binance exchange will list baby doge coin babydoge will be launched today that s huge don t miss the opportunity guys the official announcement from binance we are excited to announce that baby dodge coin babydoge will be launched today on binance exchange at 10 00 pm utc september 9 don t miss your chance for a possible 10x we can still buy baby doge coin babydoge on pancakeswap at a great price https pancakeswap finance swap babydoge 1 amp outputcurrency 0x20a72ea5955c3ba166f7ddafb6ade3c98efcaf2e https pancakeswap finance swap babydoge 1 amp outputcurrency 0x20a72ea5955c3ba166f7ddafb6ade3c98efcaf2e 	solana	2022_09_10
x9z1ya	is 65k tps the absolute upper limit for solana over the long term i know currently solana s theoretical limit is 65k tps but will that be the absolute max tps forever does the max tps also scale over time 	solana	2022_09_10
x9s4rc	polkadot biweekly aventus network has won the latest parachain lease auction bitcountry pioneer and nan	Polkadot	2022_09_10
x9qwrc	introducing sora card a unique self custodial crypto debit card built for the interoperable future for all parachain tokens removed 	Polkadot	2022_09_10
x9qu19	introducing sora card a unique self custodial crypto debit card built for the interoperable future for all parachain tokens removed 	Polkadot	2022_09_10
x9pbd1	everything you need to know about astar network from wasm amp evm smart contract support to swanky suite and dapp staking all made simple in this 101 thread by subwallet nan	Polkadot	2022_09_10
