Unnamed: 0	all_awardings	archived	associated_award	author	author_flair_background_color	author_flair_css_class	author_flair_richtext	author_flair_template_id	author_flair_text	author_flair_text_color	author_flair_type	author_fullname	author_patreon_flair	author_premium	body	body_sha1	can_gild	collapsed	collapsed_because_crowd_control	collapsed_reason	collapsed_reason_code	comment_type	controversiality	created_utc	distinguished	gilded	gildings	id	is_submitter	link_id	locked	no_follow	parent_id	permalink	retrieved_utc	score	score_hidden	send_replies	stickied	subreddit	subreddit_id	subreddit_name_prefixed	subreddit_type	top_awarded_type	total_awards_received	treatment_tags	unrepliable_reason	corpus	support	knowledge	conflict	power	similarity	fun	status	trust	identity	romance
0	[]	False		Exact_Combination_38			[]				text	t2_cy22ka6c	False	False	Not available where I live. 😔	50e76c9c7eaa6392809dc514ee223789d982924a	True	False					0	1664510350		0	{}	iqgiw8a	False	t3_xrmvvo	False	True	t1_iqfuud6	/r/Bitcoin/comments/xrmvvo/it_feels_like_bitcoin_is_an_an_accumulation_stage/iqgiw8a/	1664510364	1	True	True	False	Bitcoin	t5_2s3qj	r/Bitcoin	public		0	[]		not available where i live 	0.44745293259620667	0.4964761435985565	0.33626285195350647	0.4861069619655609	0.5219008326530457	0.51919025182724	0.4312523305416107	0.41304081678390503	0.5211793780326843	0.4977434575557709
1	[]	False		tldrpg			[]				text	t2_k96gi	False	False	"I dont rely on coindesk’s opinion of Craig Wrong and neither should you.

https://youtu.be/4jdR6DtegXQ"	b34f6f05fec15a3e5ffa375a2b06d076df5bcf7f	True	False					0	1664510336		0	{}	iqgivbx	False	t3_xrj88m	False	True	t3_xrj88m	/r/Bitcoin/comments/xrj88m/is_craig_wright_getting_any_closer_to_proving_the/iqgivbx/	1664510348	1	True	True	False	Bitcoin	t5_2s3qj	r/Bitcoin	public		0	[]		i dont rely on coindesk s opinion of craig wrong and neither should you https youtu be 4jdr6dtegxq	0.17210663855075836	0.45208582282066345	0.7243262529373169	0.06806903332471848	0.04901013523340225	0.030836233869194984	0.31763985753059387	0.07838957011699677	0.4670323431491852	0.0001828218810260296
2	[]	False		caploves1019			[]				text	t2_eqsg1	False	False	Clearly you should get more corn 🌽 that's the simplest possible way to explain things.	7b5cb81f320b44f5e297797244d256d83ca04788	True	False					0	1664510326		0	{}	iqgiuqk	False	t3_xrrjm3	False	False	t3_xrrjm3	/r/Bitcoin/comments/xrrjm3/11_year_resistancesupport/iqgiuqk/	1664510340	1	True	True	False	Bitcoin	t5_2s3qj	r/Bitcoin	public		0	[]		clearly you should get more corn that s the simplest possible way to explain things 	0.3183460235595703	0.802219569683075	0.2603745460510254	0.4731549024581909	0.3516044318675995	0.5171972513198853	0.17650316655635834	0.00010503830708330497	0.3891850411891937	0.004477302078157663
3	[]	False		Regret-Select			[]				text	t2_88l2pdbp	False	False	"There's some sites that are like free faucets

You can't really earn much, but you can claim 1 time every 60 minutes. You can gamble on the site if you want.

Solar panel + Bitcoin miner would be green to produce Bitcoin.

I'd you use CashApp, you can pay using their debit card. You get ""boosts"" you can select that give you free Bitcoin. Sometimes 10% back as Bitcoin on restaurant purchase, maximum $7.50 worth of Bitcoin. Sometimes a 5% back from restaurants in Bitcoin. Usually once a week, not always. But free Bitcoin back either way, if you happen to be eating out anyways.

You can try using the Brave browser. If you like it, you can be able ads. Up to 10 ads an hour. Willingly clicking and willing letting these ads pop up, you get rewarded in BAT. You could convert BAT to Bitcoin, if you strictly just wanted to stick with Bitcoin. Probably not much as far as a reward, but it's more than if you hadn't allowed this ads to pop up. Payout is once a month, and there is a minimum amount you need in order to first withdraw."	ebfa1041fbcbddf9ffc5928fa9f205be547b4007	True	False					0	1664510320		0	{}	iqgiudr	False	t3_xrmvvo	False	True	t3_xrmvvo	/r/Bitcoin/comments/xrmvvo/it_feels_like_bitcoin_is_an_an_accumulation_stage/iqgiudr/	1664510333	1	True	True	False	Bitcoin	t5_2s3qj	r/Bitcoin	public		0	[]		there s some sites that are like free faucets you can t really earn much but you can claim 1 time every 60 minutes you can gamble on the site if you want solar panel bitcoin miner would be green to produce bitcoin i d you use cashapp you can pay using their debit card you get boosts you can select that give you free bitcoin sometimes 10 back as bitcoin on restaurant purchase maximum 7 50 worth of bitcoin sometimes a 5 back from restaurants in bitcoin usually once a week not always but free bitcoin back either way if you happen to be eating out anyways you can try using the brave browser if you like it you can be able ads up to 10 ads an hour willingly clicking and willing letting these ads pop up you get rewarded in bat you could convert bat to bitcoin if you strictly just wanted to stick with bitcoin probably not much as far as a reward but it s more than if you hadn t allowed this ads to pop up payout is once a month and there is a minimum amount you need in order to first withdraw 	0.0025865728966891766	0.9887804985046387	0.14973212778568268	0.0962037444114685	0.00809487421065569	0.36054548621177673	0.06766356527805328	8.478354516228137e-07	0.1886182278394699	0.1261175125837326
4	[]	False		ryker_69			[]				text	t2_vq4ovj	False	False	Wow you dca 2k per paycheck… that’s a fat check!	dc7d013ad9d0b9ba45e0abc6b13a21b69586eb0a	True	False					0	1664510316		0	{}	iqgiu2o	False	t3_xrbi7v	False	True	t3_xrbi7v	/r/Bitcoin/comments/xrbi7v/another_paycheck_another_01_btc_for_me/iqgiu2o/	1664510333	1	True	True	False	Bitcoin	t5_2s3qj	r/Bitcoin	public		0	[]		wow you dca 2k per paycheck that s a fat check 	0.25813716650009155	0.5796622633934021	0.48364701867103577	0.09016464650630951	0.2755657136440277	0.6758483648300171	0.2472464144229889	0.03692442551255226	0.4158877730369568	0.002719914074987173
5	[]	False		tjackson_12			[]				text	t2_ypbhq5c	False	False	Roger that	69b7765a1edad0ce081c53455962ec4080fbba8d	True	False					0	1664510314		0	{}	iqgitym	False	t3_xqyxxs	False	True	t1_iqgh4x4	/r/Bitcoin/comments/xqyxxs/daily_discussion_september_29_2022/iqgitym/	1664510326	1	True	True	False	Bitcoin	t5_2s3qj	r/Bitcoin	public		0	[]		roger that	0.47765108942985535	0.45752719044685364	0.49612873792648315	0.480715811252594	0.4701003432273865	0.5526854395866394	0.5030339360237122	0.4718534052371979	0.47740504145622253	0.5441489815711975
6	[]	False		pbfarmr			[]				text	t2_a6ozw5v	False	False	"Yes, it’s worthless wrt earning rewards.  Don’t think of it as wasted.  Instead, think of it as a subset of the total compute power required to secure the network.  

Global footprint is quantified as follows: A solution has a certain difficulty, that difficulty requires a given hashrate to maintain 10m block times, that hashrate requires a certain amount of energy."	d28f5311ef01f99829f946388c2af250e1f3c74f	True	False					0	1664510275		0	{}	iqgirig	False	t3_xrr5lr	False	True	t3_xrr5lr	/r/Bitcoin/comments/xrr5lr/help_me_understand_miners_compete_to_solve_the/iqgirig/	1664510288	1	True	True	False	Bitcoin	t5_2s3qj	r/Bitcoin	public		0	[]		yes it s worthless wrt earning rewards don t think of it as wasted instead think of it as a subset of the total compute power required to secure the network global footprint is quantified as follows a solution has a certain difficulty that difficulty requires a given hashrate to maintain 10m block times that hashrate requires a certain amount of energy 	0.0027568135410547256	0.9891104102134705	0.1635027378797531	0.08994275331497192	0.0074140108190476894	0.19127775728702545	0.11032633483409882	8.424562452091777e-07	0.4181775450706482	0.033024292439222336
7	[]	False		zoomxnotorious			[]				text	t2_7vxi5r4s	False	False	Yeah, there's nothing hard about it. It's pretty simple stuff.	b2eb1e7335a00fab3d52e719420592b9f6094d39	True	False					0	1664510260		0	{}	iqgiqje	False	t3_xqyxxs	False	True	t1_iqdwrae	/r/Bitcoin/comments/xqyxxs/daily_discussion_september_29_2022/iqgiqje/	1664510273	1	True	True	False	Bitcoin	t5_2s3qj	r/Bitcoin	public		0	[]		yeah there s nothing hard about it it s pretty simple stuff 	0.42887818813323975	0.3701426386833191	0.3994767665863037	0.057484738528728485	0.6197583079338074	0.8900572657585144	0.18203844130039215	0.1403008997440338	0.4192265272140503	0.005236248020082712
8	[]	False		Rtbrosk			[]				text	t2_7i9xvv9q	False	False	heating and cooling large buildings with your company's name on top of them is unsustainable	203750248d115684145cd47760fdd79dfa84d12a	True	False					0	1664510251		0	{}	iqgipwz	False	t3_xrfqxh	False	True	t3_xrfqxh	/r/Bitcoin/comments/xrfqxh/technology_university_of_new_mexico_researchers/iqgipwz/	1664510266	1	True	True	False	Bitcoin	t5_2s3qj	r/Bitcoin	public		0	[]		heating and cooling large buildings with your company s name on top of them is unsustainable	0.1608760803937912	0.8757835626602173	0.21634924411773682	0.7443305850028992	0.3900738060474396	0.3204677700996399	0.15860362350940704	0.7700455188751221	0.4718031585216522	0.008465496823191643
9	[]	False		artniSintra			[]				text	t2_2ilns35x	False	False	When did this happen?	7aaa40cb0c8ea25a2dcea9b596baf726a45e36ac	True	False					0	1664510221		0	{}	iqgio06	False	t3_xravq2	False	True	t3_xravq2	/r/Bitcoin/comments/xravq2/ecb_chief_lagarde_we_stand_for_bankers_if_central/iqgio06/	1664510236	1	True	True	False	Bitcoin	t5_2s3qj	r/Bitcoin	public		0	[]		when did this happen 	0.49246400594711304	0.4697711765766144	0.4413500428199768	0.5242143273353577	0.5087368488311768	0.6484096050262451	0.45569926500320435	0.4282413721084595	0.4480513036251068	0.3068234622478485
10	[]	False		ColegDropOut			[]				text	t2_8bvov	False	False	#1 way is the Cash App… They have a “bitcoin roundup” that rounds up all your transactions and you get the difference in btc. They also offer 5% and 10% “boosts” every once in a while for spending at a restaurant (5-10% in btc of the amount spent). It’s pretty cool.	69c92c7f73ec1a87028fd392c2897e641a5fad97	True	False					0	1664510162		0	{}	iqgik7w	False	t3_xrmvvo	False	True	t3_xrmvvo	/r/Bitcoin/comments/xrmvvo/it_feels_like_bitcoin_is_an_an_accumulation_stage/iqgik7w/	1664510175	1	True	True	False	Bitcoin	t5_2s3qj	r/Bitcoin	public		0	[]		 1 way is the cash app they have a bitcoin roundup that rounds up all your transactions and you get the difference in btc they also offer 5 and 10 boosts every once in a while for spending at a restaurant 5 10 in btc of the amount spent it s pretty cool 	0.01805536076426506	0.9883812069892883	0.2901032865047455	0.948060154914856	0.008203010074794292	0.7951907515525818	0.07974445819854736	8.314740966852696e-07	0.2385398894548416	0.08349818736314774
11	[]	False		soks86			[]				text	t2_5xrnh	False	False	"Yes, because the final piece of successful work is a rather simple and low energy in itself.  Finding a successful solution has no relationship to the amount of effort it took to find it. It's just chance, like flipping a coin. If it lands heads, your next toss isn't any more likely to be tails.

For your second question, hashrate \* difficulty = probability-of-solving. Since we know the difficulty we can watch the rate of block discovery to determine the probability and then we can calculate the effort being put into the network to achieve the rate of new blocks.

This will always be an estimate but will give you an average, over time, which itself should be accurate.

There is one more variable, which is how much hashrate people are getting per unit of electricity. I'm not sure how this is calculated but I would assume you look at modern, profitable hardware, and extrapolate. Maybe there's a better way (self reporting?) but I'm not sure on this detail."	74364563aff77174f5b7898005c528328624129f	True	False					0	1664510119		0	{}	iqgihey	False	t3_xrr5lr	False	True	t3_xrr5lr	/r/Bitcoin/comments/xrr5lr/help_me_understand_miners_compete_to_solve_the/iqgihey/	1664510129	1	True	True	False	Bitcoin	t5_2s3qj	r/Bitcoin	public		0	[]		yes because the final piece of successful work is a rather simple and low energy in itself finding a successful solution has no relationship to the amount of effort it took to find it it s just chance like flipping a coin if it lands heads your next toss isn t any more likely to be tails for your second question hashrate difficulty probability of solving since we know the difficulty we can watch the rate of block discovery to determine the probability and then we can calculate the effort being put into the network to achieve the rate of new blocks this will always be an estimate but will give you an average over time which itself should be accurate there is one more variable which is how much hashrate people are getting per unit of electricity i m not sure how this is calculated but i would assume you look at modern profitable hardware and extrapolate maybe there s a better way self reporting but i m not sure on this detail 	0.003245237050577998	0.9874609112739563	0.12376076728105545	0.01638585515320301	0.009055281057953835	0.44989505410194397	0.08220499008893967	8.517343417224765e-07	0.28291958570480347	0.011856164783239365
12	[]	False		el_johannon			[]				text	t2_7kmv7iqn	False	False	Download it.	e467109d3ded2f82040fd0e28326d090fbae2e16	True	False					0	1664510100		0	{}	iqgig9m	False	t3_xrmvvo	False	False	t3_xrmvvo	/r/Bitcoin/comments/xrmvvo/it_feels_like_bitcoin_is_an_an_accumulation_stage/iqgig9m/	1664510115	1	True	True	False	Bitcoin	t5_2s3qj	r/Bitcoin	public		0	[]		download it 	0.4527672827243805	0.5468844175338745	0.46445780992507935	0.5260815620422363	0.44882693886756897	0.46771517395973206	0.41713082790374756	0.4974520802497864	0.49299049377441406	0.37171709537506104
13	[]	False		8bitb4rt			[]				text	t2_nu02ybm0	False	False	Came to say this, being a mysterious entity with no manager defeated the Karen's.	750abc7122853770a9d35eea8d51c9287b9af4dd	True	False					0	1664510074		0	{}	iqgiemp	False	t3_xrr4lc	False	True	t1_iqghw5e	/r/Bitcoin/comments/xrr4lc/what_is_satoshis_second_most_significant/iqgiemp/	1664510092	1	True	True	False	Bitcoin	t5_2s3qj	r/Bitcoin	public		0	[]		came to say this being a mysterious entity with no manager defeated the karen s 	0.18650321662425995	0.6279675364494324	0.41908013820648193	0.34415575861930847	0.5313456058502197	0.5831841230392456	0.217987522482872	1.1267632089584367e-06	0.4539267420768738	0.00947780441492796
14	[]	False		minorthreatmikey			[]				text	t2_w0dyp	False	False	"All of these involve “purchasing” haha but still, doesn’t feel like it.

1) blockfi card gets me 1.5% back on btc on every purchase
2) stake $stx to earn sats daily
3) hourly purchase on strike

I get bitcoin constantly coming in daily on all 3 fronts and it _doesn’t feel_ like I’ve made any purchases"	93fc42578a8dd41c08966511a7228a703f7c92bc	True	False					0	1664510019		0	{}	iqgib47	False	t3_xrmvvo	False	True	t3_xrmvvo	/r/Bitcoin/comments/xrmvvo/it_feels_like_bitcoin_is_an_an_accumulation_stage/iqgib47/	1664510038	1	True	True	False	Bitcoin	t5_2s3qj	r/Bitcoin	public		0	[]		all of these involve purchasing haha but still doesn t feel like it 1 blockfi card gets me 1 5 back on btc on every purchase 2 stake stx to earn sats daily 3 hourly purchase on strike i get bitcoin constantly coming in daily on all 3 fronts and it doesn t feel like i ve made any purchases	0.003762694075703621	0.9877326488494873	0.3210006058216095	0.013565817847847939	0.9887696504592896	0.4791956841945648	0.09730609506368637	8.481063673571043e-07	0.25163233280181885	0.007963648065924644
15	[]	False		R_Kotex_Cylborg			[]				text	t2_a3839sld	False	True	everyone dogs season 2 and season 1 of TD was way better, but season 2 holds some powerful insights on corruption among the ranks that make it relevant to some of humanity's dirtiest secrets.	5964b50edbe3b1c35a810fc4f713c129d1a0b018	True	False					0	1664510006		0	{}	iqgia9z	False	t3_xr4uw6	False	True	t3_xr4uw6	/r/Bitcoin/comments/xr4uw6/exclusive_footage_of_what_is_going_on_inside/iqgia9z/	1664510022	1	True	True	False	Bitcoin	t5_2s3qj	r/Bitcoin	public		0	[]		everyone dogs season 2 and season 1 of td was way better but season 2 holds some powerful insights on corruption among the ranks that make it relevant to some of humanity s dirtiest secrets 	0.016056358814239502	0.9786459803581238	0.5413858294487	0.032109469175338745	0.01858855038881302	0.49824267625808716	0.12127786874771118	8.326564397975744e-07	0.3182317614555359	0.015254156664013863
16	[]	False		DudeIncogneto			[]			dark	text	t2_9p6akwkr	False	False	Oops all debt	cbfb70307cc7707292259f63d4437d527448767e	True	False					0	1664509857		0	{}	iqgi0n1	False	t3_xrai5n	False	True	t3_xrai5n	/r/Bitcoin/comments/xrai5n/stanley_druckenmiller_were_getting_to_the_point/iqgi0n1/	1664509870	1	True	True	False	Bitcoin	t5_2s3qj	r/Bitcoin	public		0	[]		oops all debt	0.4719010293483734	0.44190722703933716	0.5882280468940735	0.4728759825229645	0.48728787899017334	0.46658724546432495	0.4518446624279022	0.45567798614501953	0.4800802767276764	0.29813942313194275
17	[]	False		Harley__07		noob	[{'e': 'text', 't': 'redditor for 4 weeks'}]	2ec8e69e-6c36-11e9-a04b-0afb553d4ea6	redditor for 4 weeks	dark	richtext	t2_ry2s2ely	False	False	"Over the last week, the GBP collapsed against all major currencies — particluarly BTC — setting new lows.  
  
Two years of reckless spending, negligent monetary policies, and relentless money printing finally caught up with the Bank of England, who now finds itself between a rock and a hard place: raise rates, risking defaulting on its debt and inducing a recession, or admit incompetence and let the GBP drop and lose more ground in the international landscape.

[https://medium.com/coinmonks/everyone-is-talking-about-this-new-shitcoin-dont-fall-for-the-scam-b27e32e9acf1](https://medium.com/coinmonks/everyone-is-talking-about-this-new-shitcoin-dont-fall-for-the-scam-b27e32e9acf1)"	63bb1a8f411f6042ff445a2c04a55f0334d44413	True	False					0	1664509849		0	{}	iqgi02p	False	t3_xr3ipd	False	True	t3_xr3ipd	/r/Bitcoin/comments/xr3ipd/in_2021_bank_of_england_warned_that_bitcoin_could/iqgi02p/	1664509862	1	True	True	False	Bitcoin	t5_2s3qj	r/Bitcoin	public		0	[]		over the last week the gbp collapsed against all major currencies particluarly btc setting new lows two years of reckless spending negligent monetary policies and relentless money printing finally caught up with the bank of england who now finds itself between a rock and a hard place raise rates risking defaulting on its debt and inducing a recession or admit incompetence and let the gbp drop and lose more ground in the international landscape https medium com coinmonks everyone is talking about this new shitcoin dont fall for the scam b27e32e9acf1 https medium com coinmonks everyone is talking about this new shitcoin dont fall for the scam b27e32e9acf1 	0.000778687244746834	0.9952835440635681	0.6713929772377014	0.974994957447052	0.996911883354187	0.05569007620215416	0.10884491354227066	8.486565548082581e-07	0.2951023280620575	9.294115443481132e-05
18	[]	False		Pitiful_Rutabaga			[]				text	t2_3zfppd5q	False	False	"They wouldn’t rely on volunteers. They’d run their own node. If you want to know for sure that you’re not being lied to, you run your own node. 

That’s the way it works. Some say that running a node is helping the network. I suppose that’s true. But the most important reason people run nodes is because they want their own copy of the blockchain running on the software of their choice. Remember, this is opt in."	7827ab1cd4cdaebd6761e455b485a5d0f0637e62	True	False					0	1664509835		0	{}	iqghz8c	False	t3_xqv7ft	False	True	t1_iqdha10	/r/Bitcoin/comments/xqv7ft/all_the_currencies_crashing_against_the_usd_were/iqghz8c/	1664509846	1	True	True	False	Bitcoin	t5_2s3qj	r/Bitcoin	public		0	[]		they wouldn t rely on volunteers they d run their own node if you want to know for sure that you re not being lied to you run your own node that s the way it works some say that running a node is helping the network i suppose that s true but the most important reason people run nodes is because they want their own copy of the blockchain running on the software of their choice remember this is opt in 	0.0030388880986720324	0.9880059361457825	0.5965426564216614	0.94427090883255	0.008793286979198456	0.3724179267883301	0.07154454290866852	8.666352186992299e-07	0.4284423291683197	0.05103270709514618
19	[]	False		Disavowed_Rogue			[]				text	t2_y1v51	False	False	Disappearing	53ab0f1a32dedb4bf2de82b4b948288e76e3b8a5	True	False					0	1664509789		0	{}	iqghw5e	False	t3_xrr4lc	False	True	t3_xrr4lc	/r/Bitcoin/comments/xrr4lc/what_is_satoshis_second_most_significant/iqghw5e/	1664509801	1	True	True	False	Bitcoin	t5_2s3qj	r/Bitcoin	public		0	[]		disappearing	0.470066100358963	0.5163410902023315	0.5593392252922058	0.5034860968589783	0.5037859082221985	0.5175285339355469	0.46452727913856506	0.48316919803619385	0.4900534749031067	0.6204171180725098
20	[]	False		mamabearx0x0			[]				text	t2_6hmsr6hy	False	False	We’ll be ok cause we’re rich is what he meant	3bc957bfd7f5bee356f67c0443d033b85be50b97	True	False					0	1664509742		0	{}	iqght14	False	t3_xrai5n	False	True	t3_xrai5n	/r/Bitcoin/comments/xrai5n/stanley_druckenmiller_were_getting_to_the_point/iqght14/	1664509754	1	True	True	False	Bitcoin	t5_2s3qj	r/Bitcoin	public		0	[]		we ll be ok cause we re rich is what he meant	0.5801459550857544	0.31585022807121277	0.5137806534767151	0.21087637543678284	0.5415780544281006	0.4975767135620117	0.4232727885246277	0.6161701679229736	0.44487470388412476	0.023460129275918007
21	[]	False		R_Kotex_Cylborg			[]				text	t2_a3839sld	False	True	They should be running scared because they don't wanna have to wipe they own assess esp bc they shit stinks worse than everyone else... and they know it.	964a946b182d75190553d098cc74eb3c93538670	True	False					0	1664509690		0	{}	iqghpoo	False	t3_xr4uw6	False	True	t3_xr4uw6	/r/Bitcoin/comments/xr4uw6/exclusive_footage_of_what_is_going_on_inside/iqghpoo/	1664509707	1	True	True	False	Bitcoin	t5_2s3qj	r/Bitcoin	public		0	[]		they should be running scared because they don t wanna have to wipe they own assess esp bc they shit stinks worse than everyone else and they know it 	0.009363972581923008	0.454093337059021	0.9403197765350342	0.018554439768195152	0.014227908104658127	0.556392252445221	0.0655701607465744	8.07451726814179e-07	0.36013126373291016	0.008953875862061977
22	[]	False		stetter_labs		noob	[{'e': 'text', 't': 'redditor for 3 days'}]	2ec8e69e-6c36-11e9-a04b-0afb553d4ea6	redditor for 3 days	dark	richtext	t2_qswah7a6	False	False	Haha fair you can stake your bitcoin sure for some yield. But it’s not called proof of stake. Proof of stake is a consensus mechanism and bitcoins consensus is proof of work.	507b88e9b1c2a35122a4b2f6bbbeb4d525668748	True	False					0	1664509672		0	{}	iqghoja	False	t3_xrmvvo	False	True	t1_iqghgmr	/r/Bitcoin/comments/xrmvvo/it_feels_like_bitcoin_is_an_an_accumulation_stage/iqghoja/	1664509691	1	True	True	False	Bitcoin	t5_2s3qj	r/Bitcoin	public		0	[]		haha fair you can stake your bitcoin sure for some yield but it s not called proof of stake proof of stake is a consensus mechanism and bitcoins consensus is proof of work 	0.01675969734787941	0.9607499837875366	0.7166623473167419	0.11407674849033356	0.008102528750896454	0.24197909235954285	0.13786375522613525	8.73385715749464e-07	0.45163941383361816	0.0027406513690948486
23	[]	False		jas_khoo			[]				text	t2_ek948xlx	False	False	Well that's true lol, that's some weird level for sure.	46b08121045647011a4e2b533c2aab8e11557f2b	True	False					0	1664509611		0	{}	iqghkie	False	t3_xrdven	False	True	t1_iqf8s8f	/r/Bitcoin/comments/xrdven/pound_imploding_uk_bitcoin_volume_exploding/iqghkie/	1664509629	1	True	True	False	Bitcoin	t5_2s3qj	r/Bitcoin	public		0	[]		well that s true lol that s some weird level for sure 	0.31958624720573425	0.4573766589164734	0.15477071702480316	0.05322660133242607	0.6745837926864624	0.8802261352539062	0.3162597417831421	0.5972390174865723	0.4013515114784241	0.0025409585796296597
24	[]	False		Rtbrosk			[]				text	t2_7i9xvv9q	False	False	ask stupid questions on reddit	98a734deb76567830d2cc3713fef2b3a0efaf518	True	False					0	1664509594		0	{}	iqghjbv	False	t3_xrmvvo	False	True	t3_xrmvvo	/r/Bitcoin/comments/xrmvvo/it_feels_like_bitcoin_is_an_an_accumulation_stage/iqghjbv/	1664509613	1	True	True	False	Bitcoin	t5_2s3qj	r/Bitcoin	public		0	[]		ask stupid questions on reddit	0.37609654664993286	0.3724707365036011	0.798180103302002	0.4686809778213501	0.36006665229797363	0.5686686635017395	0.4789612591266632	0.51301509141922	0.4242188036441803	0.015410836786031723
25	[]	False		hoosehouse			[]				text	t2_u0svk8a	False	False	"I’m balls deep on both btc and Gme. I take no offense. 

Seeing the rules change when bets go wrong… just another reason for btc. 

All profits from Gme will go into btc for me."	db0018498162cf9fa97ce7670e2f844dad916968	True	False					0	1664509583		0	{}	iqghimb	False	t3_xrkj6a	False	True	t3_xrkj6a	/r/Bitcoin/comments/xrkj6a/has_anyone_seen_eat_the_rich_the_gamestop_saga/iqghimb/	1664509597	1	True	True	False	Bitcoin	t5_2s3qj	r/Bitcoin	public		0	[]		i m balls deep on both btc and gme i take no offense seeing the rules change when bets go wrong just another reason for btc all profits from gme will go into btc for me 	0.015278659760951996	0.9537725448608398	0.8407565951347351	0.020648229867219925	0.7639986276626587	0.5039909482002258	0.08492694795131683	8.123029147100169e-07	0.22171363234519958	0.021703898906707764
