Unnamed: 0	all_awardings	allow_live_comments	author	author_flair_css_class	author_flair_richtext	author_flair_text	author_flair_type	author_fullname	author_is_blocked	author_patreon_flair	author_premium	awarders	can_mod_post	contest_mode	created_utc	domain	full_link	gildings	id	is_created_from_ads_ui	is_crosspostable	is_meta	is_original_content	is_reddit_media_domain	is_robot_indexable	is_self	is_video	link_flair_background_color	link_flair_richtext	link_flair_text_color	link_flair_type	locked	media_only	no_follow	num_comments	num_crossposts	over_18	parent_whitelist_status	permalink	pinned	post_hint	preview	pwls	retrieved_on	score	selftext	send_replies	spoiler	stickied	subreddit	subreddit_id	subreddit_subscribers	subreddit_type	thumbnail	thumbnail_height	thumbnail_width	title	total_awards_received	treatment_tags	upvote_ratio	url	url_overridden_by_dest	whitelist_status	wls	author_flair_template_id	author_flair_text_color	removed_by_category	media_metadata	media	media_embed	secure_media	secure_media_embed	distinguished	suggested_sort	author_flair_background_color	link_flair_text	gallery_data	is_gallery	crosspost_parent	crosspost_parent_list	author_cakeday	link_flair_template_id	concated	corpus	support	knowledge	conflict	power	similarity	fun	status	trust	identity	romance
0	[]	False	TriggerSouth39		[]		text	t2_7yfrr30a	False	False	False	[]	False	False	1642924747	i.redd.it	https://www.reddit.com/r/Bitcoin/comments/saok2p/bitcoin_exchange_reserve_are_still_decreasing/	{}	saok2p	False	True	False	False	True	True	False	False		[]	dark	text	False	False	True	0	0	False	all_ads	/r/Bitcoin/comments/saok2p/bitcoin_exchange_reserve_are_still_decreasing/	False	image	{'enabled': True, 'images': [{'id': 'OP_v2sE_3JDvZ79EH7yJGdFXeEuSAoJ5DSSE4HBSWM8', 'resolutions': [{'height': 216, 'url': 'https://preview.redd.it/x1dabsa99ed81.jpg?width=108&amp;crop=smart&amp;auto=webp&amp;s=ca3a8680d13c6c29376fdf747dffcb4242effc02', 'width': 108}, {'height': 432, 'url': 'https://preview.redd.it/x1dabsa99ed81.jpg?width=216&amp;crop=smart&amp;auto=webp&amp;s=362802b9b7fe9a15a27b253a4ea9374add9340f4', 'width': 216}, {'height': 640, 'url': 'https://preview.redd.it/x1dabsa99ed81.jpg?width=320&amp;crop=smart&amp;auto=webp&amp;s=d2599f9462c6e877bb2c49321c7e105fe099ab0e', 'width': 320}, {'height': 1280, 'url': 'https://preview.redd.it/x1dabsa99ed81.jpg?width=640&amp;crop=smart&amp;auto=webp&amp;s=3c633127e326f93ae47bb26a15526f3c65f78976', 'width': 640}], 'source': {'height': 1792, 'url': 'https://preview.redd.it/x1dabsa99ed81.jpg?auto=webp&amp;s=d6c5c2060c95d63f3b79da9e0c3a3c1804fd8bc4', 'width': 828}, 'variants': {}}]}	6	1642924758	1		True	False	False	Bitcoin	t5_2s3qj	3821322	public	https://b.thumbs.redditmedia.com/7mdkT_jJ0jeSE7c3oXdHxZeI-31v1PFtThfTxtOVo4Q.jpg	140.0	140.0	Bitcoin Exchange reserve are still decreasing. What do you think?	0	[]	1.0	https://i.redd.it/x1dabsa99ed81.jpg	https://i.redd.it/x1dabsa99ed81.jpg	all_ads	6																			"Bitcoin Exchange reserve are still decreasing. What do you think?
"	bitcoin exchange reserve are still decreasing what do you think nan	0.42970049381256104	0.44132480025291443	0.46632319688796997	0.6061493754386902	0.3784453272819519	0.5294245481491089	0.32470694184303284	0.7815890312194824	0.4944814145565033	0.011675202287733555
1	[]	False	MaddyMaddison	noob	[{'e': 'text', 't': 'redditor for 1 week'}]	redditor for 1 week	richtext	t2_ifuolmk3	False	False	False	[]	False	False	1642924640	i.redd.it	https://www.reddit.com/r/Bitcoin/comments/saoj3l/hodlling_at_least_you_lose_only_if_you_sell_down/	{}	saoj3l	False	True	False	False	True	True	False	False		[]	dark	text	False	False	True	0	0	False	all_ads	/r/Bitcoin/comments/saoj3l/hodlling_at_least_you_lose_only_if_you_sell_down/	False	image	{'enabled': True, 'images': [{'id': 'MJ9MUmkOl39nx4crNKpySJ3cNqGubFfWYjanaWnlKgQ', 'resolutions': [{'height': 68, 'url': 'https://preview.redd.it/aazpfgrx8ed81.jpg?width=108&amp;crop=smart&amp;auto=webp&amp;s=edf064890187d84445f04c59d837e30b6f8cda3f', 'width': 108}, {'height': 137, 'url': 'https://preview.redd.it/aazpfgrx8ed81.jpg?width=216&amp;crop=smart&amp;auto=webp&amp;s=bd9025d0228c64220ff928e877f26322ae802d46', 'width': 216}, {'height': 203, 'url': 'https://preview.redd.it/aazpfgrx8ed81.jpg?width=320&amp;crop=smart&amp;auto=webp&amp;s=3e002d2659a99bb12eb62ccb02552a9b4d918bc5', 'width': 320}, {'height': 406, 'url': 'https://preview.redd.it/aazpfgrx8ed81.jpg?width=640&amp;crop=smart&amp;auto=webp&amp;s=e25fbbcc6d1f5bd9967d9f16fd9dcd1f4dc3985e', 'width': 640}, {'height': 609, 'url': 'https://preview.redd.it/aazpfgrx8ed81.jpg?width=960&amp;crop=smart&amp;auto=webp&amp;s=39008fc26088783c37b2e916960afa864afb5a96', 'width': 960}, {'height': 685, 'url': 'https://preview.redd.it/aazpfgrx8ed81.jpg?width=1080&amp;crop=smart&amp;auto=webp&amp;s=13fc572687707be8c24f3889273f0f4be1311c1b', 'width': 1080}], 'source': {'height': 1180, 'url': 'https://preview.redd.it/aazpfgrx8ed81.jpg?auto=webp&amp;s=74d198a302664d17105d14d893fa4705a98da653', 'width': 1860}, 'variants': {}}]}	6	1642924650	1		True	False	False	Bitcoin	t5_2s3qj	3821321	public	https://b.thumbs.redditmedia.com/5Q38tECV8iGSD9weiTD6VnE7hX0akB_SZhpjnLh4lHY.jpg	88.0	140.0	HODLling at least, you lose only if you sell. Down 55% on my portfolio.	0	[]	1.0	https://i.redd.it/aazpfgrx8ed81.jpg	https://i.redd.it/aazpfgrx8ed81.jpg	all_ads	6	2ec8e69e-6c36-11e9-a04b-0afb553d4ea6	dark																	"HODLling at least, you lose only if you sell. Down 55% on my portfolio.
"	hodlling at least you lose only if you sell down 55 on my portfolio nan	0.31348171830177307	0.5302636027336121	0.45550888776779175	0.6762574911117554	0.36236628890037537	0.48151203989982605	0.1825256049633026	1.1990912298642797e-06	0.2848338782787323	0.04234613850712776
2	[]	False	HolyyShib	noob	[{'e': 'text', 't': 'redditor for 4 weeks'}]	redditor for 4 weeks	richtext	t2_hx7xy92f	False	False	False	[]	False	False	1642924229	self.Bitcoin	https://www.reddit.com/r/Bitcoin/comments/saof9k/i_couldve_had_hundreds_of_thousands_of_extra/	{}	saof9k	False	True	False	False	False	True	True	False		[]	dark	text	False	False	True	0	0	False	all_ads	/r/Bitcoin/comments/saof9k/i_couldve_had_hundreds_of_thousands_of_extra/	False			6	1642924239	1	"Take this from someone who’s been around for multiple cycles and thought the same about the fees as those who use Coinbase today. I made the same excuses as those who use it today back then about the fees being “not that bad”. 

I didn’t even realize that there was a mark up on Bitcoin’s market price on Coinbase for my first 3 years when I was doing so either that contributed to me getting way less Bitcoin for my dollars.

Like I said in the title, I could’ve had hundreds of thousands of more dollars in Bitcoin if I had used Coinbase Pro, known as GDAx at the time, instead of using Coinbase because it was easier to use.

The fees are a bitch in the long run vatos once you realize how much less Bitcoin they make you get. With Coinbase Pro being free too, there’s no reason not to use it and avoid the ten times more expensive fees on Coinbase, as well as their price mark up on Bitcoin’s price that they add on Coinbase.

My story is that I bought on Coinbase for my first 3 years before I finally sat down and did the math of the fees and up charge of Bitcoin’s market price on Coinbase compared to Coinbase Pro, which again is free to use. 

Look at the price they charge you on Coinbase and look at the price charts at the same time. The markup today is close to $300 dollars more than its market price at any given time. 

So had I bought on Coinbase Pro those first 3 years when I started, I’d have an extra six figures in returns today on top of what I’ve made over the years. That’s hundreds of thousands of extra dollars in Bitcoin that Coinbase had me miss out on thanks to my ignorance in not using Coinbase Pro instead, which at the time was called GDAX. 

It doesn’t seem like much in the present, but in the long run it’s a bitch of a missed opportunity that will burn you and make you which you could punch your early buyer self in the face.

Back in my day the mark up on Bitcoin’s market price was only $3 dollars so I didn’t think of it much like many who use Coinbase today don’t think about the price mark up much. When I switched to pro, the markup on Bitcoin’s market price was averaging $30 dollars. Today, the average Coinbase markup on Bitcoin’s price is close to $300 dollars

Don’t let future you see that you could’ve had so much more Bitcoin in their coffers just because of the convenience of using Coinbase while Coinbase Pro with no markup and 10 times less fees, is free to use"	True	False	False	Bitcoin	t5_2s3qj	3821307	public	self			I could’ve had HUNDREDS of THOUSANDS of EXTRA DOLLARS worth of ₿ITCOIN today, if I had bought on Coinbase Pro(known as GDAX back then) for my first 3 years, instead of just buying on Coinbase like I did instead, because it was “convenient”. Learn from my mistake	0	[]	1.0	https://www.reddit.com/r/Bitcoin/comments/saof9k/i_couldve_had_hundreds_of_thousands_of_extra/		all_ads	6	2ec8e69e-6c36-11e9-a04b-0afb553d4ea6	dark																	"I could’ve had HUNDREDS of THOUSANDS of EXTRA DOLLARS worth of ₿ITCOIN today, if I had bought on Coinbase Pro(known as GDAX back then) for my first 3 years, instead of just buying on Coinbase like I did instead, because it was “convenient”. Learn from my mistake
Take this from someone who’s been around for multiple cycles and thought the same about the fees as those who use Coinbase today. I made the same excuses as those who use it today back then about the fees being “not that bad”. 

I didn’t even realize that there was a mark up on Bitcoin’s market price on Coinbase for my first 3 years when I was doing so either that contributed to me getting way less Bitcoin for my dollars.

Like I said in the title, I could’ve had hundreds of thousands of more dollars in Bitcoin if I had used Coinbase Pro, known as GDAx at the time, instead of using Coinbase because it was easier to use.

The fees are a bitch in the long run vatos once you realize how much less Bitcoin they make you get. With Coinbase Pro being free too, there’s no reason not to use it and avoid the ten times more expensive fees on Coinbase, as well as their price mark up on Bitcoin’s price that they add on Coinbase.

My story is that I bought on Coinbase for my first 3 years before I finally sat down and did the math of the fees and up charge of Bitcoin’s market price on Coinbase compared to Coinbase Pro, which again is free to use. 

Look at the price they charge you on Coinbase and look at the price charts at the same time. The markup today is close to $300 dollars more than its market price at any given time. 

So had I bought on Coinbase Pro those first 3 years when I started, I’d have an extra six figures in returns today on top of what I’ve made over the years. That’s hundreds of thousands of extra dollars in Bitcoin that Coinbase had me miss out on thanks to my ignorance in not using Coinbase Pro instead, which at the time was called GDAX. 

It doesn’t seem like much in the present, but in the long run it’s a bitch of a missed opportunity that will burn you and make you which you could punch your early buyer self in the face.

Back in my day the mark up on Bitcoin’s market price was only $3 dollars so I didn’t think of it much like many who use Coinbase today don’t think about the price mark up much. When I switched to pro, the markup on Bitcoin’s market price was averaging $30 dollars. Today, the average Coinbase markup on Bitcoin’s price is close to $300 dollars

Don’t let future you see that you could’ve had so much more Bitcoin in their coffers just because of the convenience of using Coinbase while Coinbase Pro with no markup and 10 times less fees, is free to use"	i could ve had hundreds of thousands of extra dollars worth of itcoin today if i had bought on coinbase pro known as gdax back then for my first 3 years instead of just buying on coinbase like i did instead because it was convenient learn from my mistake take this from someone who s been around for multiple cycles and thought the same about the fees as those who use coinbase today i made the same excuses as those who use it today back then about the fees being not that bad i didn t even realize that there was a mark up on bitcoin s market price on coinbase for my first 3 years when i was doing so either that contributed to me getting way less bitcoin for my dollars like i said in the title i could ve had hundreds of thousands of more dollars in bitcoin if i had used coinbase pro known as gdax at the time instead of using coinbase because it was easier to use the fees are a bitch in the long run vatos once you realize how much less bitcoin they make you get with coinbase pro being free too there s no reason not to use it and avoid the ten times more expensive fees on coinbase as well as their price mark up on bitcoin s price that they add on coinbase my story is that i bought on coinbase for my first 3 years before i finally sat down and did the math of the fees and up charge of bitcoin s market price on coinbase compared to coinbase pro which again is free to use look at the price they charge you on coinbase and look at the price charts at the same time the markup today is close to 300 dollars more than its market price at any given time so had i bought on coinbase pro those first 3 years when i started i d have an extra six figures in returns today on top of what i ve made over the years that s hundreds of thousands of extra dollars in bitcoin that coinbase had me miss out on thanks to my ignorance in not using coinbase pro instead which at the time was called gdax it doesn t seem like much in the present but in the long run it s a bitch of a missed opportunity that will burn you and make you which you could punch your early buyer self in the face back in my day the mark up on bitcoin s market price was only 3 dollars so i didn t think of it much like many who use coinbase today don t think about the price mark up much when i switched to pro the markup on bitcoin s market price was averaging 30 dollars today the average coinbase markup on bitcoin s price is close to 300 dollars don t let future you see that you could ve had so much more bitcoin in their coffers just because of the convenience of using coinbase while coinbase pro with no markup and 10 times less fees is free to use	0.002258511260151863	0.9893146753311157	0.30465584993362427	0.9634512066841125	0.007503880187869072	0.1852262318134308	0.06697879731655121	8.450948598692776e-07	0.322241872549057	0.006453768815845251
3	[]	False	china_visa_q_123		[]		text	t2_b1l89goi	False	False	False	[]	False	False	1642924060	i.redd.it	https://www.reddit.com/r/Bitcoin/comments/saodn3/bottom_signal_right_here_folks_d/	{}	saodn3	False	True	False	False	True	True	False	False		[]	dark	text	False	False	True	0	0	False	all_ads	/r/Bitcoin/comments/saodn3/bottom_signal_right_here_folks_d/	False	image	{'enabled': True, 'images': [{'id': 'huxXAbE4qiqjFyk36VQii-ylzfxBi_CSDDZFg9_2srM', 'resolutions': [{'height': 65, 'url': 'https://preview.redd.it/jqizaek77ed81.png?width=108&amp;crop=smart&amp;auto=webp&amp;s=b3a48de2e81e99f4617bbea87d855666b0dd08f2', 'width': 108}, {'height': 130, 'url': 'https://preview.redd.it/jqizaek77ed81.png?width=216&amp;crop=smart&amp;auto=webp&amp;s=ab2a6b7f6aa10e81963696f93de9f592fb5fa9ef', 'width': 216}, {'height': 193, 'url': 'https://preview.redd.it/jqizaek77ed81.png?width=320&amp;crop=smart&amp;auto=webp&amp;s=3468e022f6c1ad5976d968c78965dfb8ff4309be', 'width': 320}], 'source': {'height': 348, 'url': 'https://preview.redd.it/jqizaek77ed81.png?auto=webp&amp;s=c279ecc46a43e37983829f65933fb878947a05b0', 'width': 576}, 'variants': {}}]}	6	1642924071	1		True	False	False	Bitcoin	t5_2s3qj	3821298	public	https://a.thumbs.redditmedia.com/Z18cxiTD8D_Al_DuTSaE4sRHP0eA43w8l6vWVC8h214.jpg	84.0	140.0	Bottom signal right here folks... :D	0	[]	1.0	https://i.redd.it/jqizaek77ed81.png	https://i.redd.it/jqizaek77ed81.png	all_ads	6																			"Bottom signal right here folks... :D
"	bottom signal right here folks d nan	0.4932715892791748	0.3295099437236786	0.5531888604164124	0.5569720268249512	0.48016563057899475	0.6769779920578003	0.5183990001678467	0.26891329884529114	0.41203850507736206	0.046120453625917435
4	[]	False	Steevas		[]		text	t2_uexpfr6	False	False	False	[]	False	False	1642924050	self.Bitcoin	https://www.reddit.com/r/Bitcoin/comments/saodk6/finding_the_link_between_two_bitcoin_addresses/	{}	saodk6	False	True	False	False	False	True	True	False		[]	dark	text	False	False	True	0	0	False	all_ads	/r/Bitcoin/comments/saodk6/finding_the_link_between_two_bitcoin_addresses/	False			6	1642924061	1	Is there a tool where I could check the shortest link/path between two addresses? Let's say I have an address from 5 years ago and want to have a look how I got to the current address. I know it is possible to go transaction by transaction in bitcoin explorer but that would be a lot of clicking. Ideally I would want something a list of transactions in one place.	True	False	False	Bitcoin	t5_2s3qj	3821295	public	self			Finding the link between two bitcoin addresses	0	[]	1.0	https://www.reddit.com/r/Bitcoin/comments/saodk6/finding_the_link_between_two_bitcoin_addresses/		all_ads	6																			"Finding the link between two bitcoin addresses
Is there a tool where I could check the shortest link/path between two addresses? Let's say I have an address from 5 years ago and want to have a look how I got to the current address. I know it is possible to go transaction by transaction in bitcoin explorer but that would be a lot of clicking. Ideally I would want something a list of transactions in one place."	finding the link between two bitcoin addresses is there a tool where i could check the shortest link path between two addresses let s say i have an address from 5 years ago and want to have a look how i got to the current address i know it is possible to go transaction by transaction in bitcoin explorer but that would be a lot of clicking ideally i would want something a list of transactions in one place 	0.0026634258683770895	0.988816499710083	0.12265550345182419	0.046781446784734726	0.9945396780967712	0.30379778146743774	0.07587381452322006	8.508632163284346e-07	0.2793514132499695	0.04171355813741684
5	[]	False	china_visa_q_123		[]		text	t2_b1l89goi	False	False	False	[]	False	False	1642923945	forbes.com	https://www.reddit.com/r/Bitcoin/comments/saocp1/like_the_1929_crashnew_crypto_winter_warning_as/	{}	saocp1	False	False	False	False	False	False	False	False		[]	dark	text	False	False	True	0	0	False	all_ads	/r/Bitcoin/comments/saocp1/like_the_1929_crashnew_crypto_winter_warning_as/	False	link	{'enabled': False, 'images': [{'id': '6RIuM7Oznq6QcIpDO5cBC7hCE9sAZJlWf7LbVb4-vPA', 'resolutions': [{'height': 72, 'url': 'https://external-preview.redd.it/VEj3oZ2IUwC-1S65ZlZMgiurheLeTipq7W3dfpej91k.jpg?width=108&amp;crop=smart&amp;auto=webp&amp;s=91c8c10b34edc14bf737860ab09db350531df3fb', 'width': 108}, {'height': 144, 'url': 'https://external-preview.redd.it/VEj3oZ2IUwC-1S65ZlZMgiurheLeTipq7W3dfpej91k.jpg?width=216&amp;crop=smart&amp;auto=webp&amp;s=354512712750c3edf748759ab4925bcea82bb119', 'width': 216}, {'height': 213, 'url': 'https://external-preview.redd.it/VEj3oZ2IUwC-1S65ZlZMgiurheLeTipq7W3dfpej91k.jpg?width=320&amp;crop=smart&amp;auto=webp&amp;s=5e495ebae86969af80016ab4e16dd1eff81f1e51', 'width': 320}, {'height': 426, 'url': 'https://external-preview.redd.it/VEj3oZ2IUwC-1S65ZlZMgiurheLeTipq7W3dfpej91k.jpg?width=640&amp;crop=smart&amp;auto=webp&amp;s=66fe4e96be8633118cecd0f513a01e1e1cd8a67e', 'width': 640}, {'height': 640, 'url': 'https://external-preview.redd.it/VEj3oZ2IUwC-1S65ZlZMgiurheLeTipq7W3dfpej91k.jpg?width=960&amp;crop=smart&amp;auto=webp&amp;s=a4fbc1b123f2240d775fe6c0736b0cd6ac6fd71b', 'width': 960}, {'height': 720, 'url': 'https://external-preview.redd.it/VEj3oZ2IUwC-1S65ZlZMgiurheLeTipq7W3dfpej91k.jpg?width=1080&amp;crop=smart&amp;auto=webp&amp;s=7f82e53cc32a1dea354c7f23aa85e2b1768c15be', 'width': 1080}], 'source': {'height': 800, 'url': 'https://external-preview.redd.it/VEj3oZ2IUwC-1S65ZlZMgiurheLeTipq7W3dfpej91k.jpg?auto=webp&amp;s=3ca49a6aa7f942b43e6c7127ba255f666b221d44', 'width': 1200}, 'variants': {}}]}	6	1642923956	1		True	False	False	Bitcoin	t5_2s3qj	3821290	public	https://b.thumbs.redditmedia.com/6QiPK1WUovrSvFwkT-aqrGI0rtM_0UlSV8ApfGdq4Io.jpg	93.0	140.0	Like ‘The 1929 Crash’—New Crypto Winter Warning As Sell-Off Wipes $1.5 Trillion From The Combined Bitcoin, Ethereum, Solana, BNB, Cardano And XRP Price	0	[]	1.0	https://www.forbes.com/sites/billybambrough/2022/01/22/like-the-1929-crash-new-crypto-winter-warning-as-sell-off-wipes-15-trillion-from-the-combined-bitcoin-ethereum-solana-bnb-cardano-and-xrp-price/	https://www.forbes.com/sites/billybambrough/2022/01/22/like-the-1929-crash-new-crypto-winter-warning-as-sell-off-wipes-15-trillion-from-the-combined-bitcoin-ethereum-solana-bnb-cardano-and-xrp-price/	all_ads	6			moderator																"Like ‘The 1929 Crash’—New Crypto Winter Warning As Sell-Off Wipes $1.5 Trillion From The Combined Bitcoin, Ethereum, Solana, BNB, Cardano And XRP Price
"	like the 1929 crash new crypto winter warning as sell off wipes 1 5 trillion from the combined bitcoin ethereum solana bnb cardano and xrp price nan	0.01462386641651392	0.9722423553466797	0.40642109513282776	0.1416148692369461	0.09341277927160263	0.22140580415725708	0.2981773912906647	8.647066920275392e-07	0.44908544421195984	0.005324560683220625
6	[]	False	TopResponsible1119		[]		text	t2_7871ygbj	False	False	False	[]	False	False	1642923938	self.Bitcoin	https://www.reddit.com/r/Bitcoin/comments/saocn9/confused_on_when_to_buy/	{}	saocn9	False	True	False	False	False	True	True	False		[]	dark	text	False	False	True	0	0	False	all_ads	/r/Bitcoin/comments/saocn9/confused_on_when_to_buy/	False			6	1642923949	1	I recently decided to buy 0.3-0.4 bitcoin. I bought 0.1 at 39k. Now I'm confused on whether i should buy the rest right now or wait for it to dip even more. I'm planning on holding for atleast 4-5 years.	True	False	False	Bitcoin	t5_2s3qj	3821290	public	self			Confused on when to buy.	0	[]	1.0	https://www.reddit.com/r/Bitcoin/comments/saocn9/confused_on_when_to_buy/		all_ads	6																			"Confused on when to buy.
I recently decided to buy 0.3-0.4 bitcoin. I bought 0.1 at 39k. Now I'm confused on whether i should buy the rest right now or wait for it to dip even more. I'm planning on holding for atleast 4-5 years."	confused on when to buy i recently decided to buy 0 3 0 4 bitcoin i bought 0 1 at 39k now i m confused on whether i should buy the rest right now or wait for it to dip even more i m planning on holding for atleast 4 5 years 	0.0036883594002574682	0.9865573048591614	0.16798821091651917	0.1889524608850479	0.29788738489151	0.5149065852165222	0.08047010749578476	8.465467544738203e-07	0.13982705771923065	0.015258118510246277
7	[]	False	Zimmermann255		[]		text	t2_a3gbqj4a	False	False	False	[]	False	False	1642923718	self.Bitcoin	https://www.reddit.com/r/Bitcoin/comments/saoapn/what_is_the_best_app_to_track_my_bitcoin/	{}	saoapn	False	True	False	False	False	True	True	False		[]	dark	text	False	False	False	0	0	False	all_ads	/r/Bitcoin/comments/saoapn/what_is_the_best_app_to_track_my_bitcoin/	False			6	1642923728	1		True	False	False	Bitcoin	t5_2s3qj	3821278	public	self			What is the best app to track my Bitcoin investing progress? It's hard on Apps like Robinhood and Coinbase to tell if i'm losing or gaining. They only really track the market.	0	[]	1.0	https://www.reddit.com/r/Bitcoin/comments/saoapn/what_is_the_best_app_to_track_my_bitcoin/		all_ads	6																			"What is the best app to track my Bitcoin investing progress? It's hard on Apps like Robinhood and Coinbase to tell if i'm losing or gaining. They only really track the market.
"	what is the best app to track my bitcoin investing progress it s hard on apps like robinhood and coinbase to tell if i m losing or gaining they only really track the market nan	0.1399911344051361	0.9817284941673279	0.17457912862300873	0.0326957181096077	0.05253509432077408	0.5205296874046326	0.09546458721160889	9.866899972621468e-07	0.28779008984565735	0.07526946812868118
