Unnamed: 0	all_awardings	archived	associated_award	author	author_flair_background_color	author_flair_css_class	author_flair_richtext	author_flair_template_id	author_flair_text	author_flair_text_color	author_flair_type	author_fullname	author_patreon_flair	author_premium	body	body_sha1	can_gild	collapsed	collapsed_because_crowd_control	collapsed_reason	collapsed_reason_code	comment_type	controversiality	created_utc	distinguished	gilded	gildings	id	is_submitter	link_id	locked	no_follow	parent_id	permalink	retrieved_utc	score	score_hidden	send_replies	stickied	subreddit	subreddit_id	subreddit_name_prefixed	subreddit_type	top_awarded_type	total_awards_received	treatment_tags	unrepliable_reason	corpus	support	knowledge	conflict	power	similarity	fun	status	trust	identity	romance
132	[]	False		fartyhardy			[]				text	t2_80kvysqj	False	False	Hey guys. Op tried this in various subreddits. Don't support this 3rd world country beggar.	37b46f489bfbf51e882a897f82309cc7a184cebc	True	False					0	1658300475		0	{}	igvykjy	False	t3_w3epbb	False	True	t3_w3epbb	/r/Bitcoin/comments/w3epbb/could_someone_send_me_just_one_dollar_in_bitcoin/igvykjy/	1658300487	1	True	True	False	Bitcoin	t5_2s3qj	r/Bitcoin	public		0	[]		hey guys op tried this in various subreddits don t support this 3rd world country beggar 	0.2965664863586426	0.4604528844356537	0.16733863949775696	0.14670723676681519	0.4324203431606293	0.7566431760787964	0.48317545652389526	0.3571792542934418	0.4707934856414795	0.011595312505960464
133	[]	False		SonSuave			[]				text	t2_1000b4kb	False	False	Foh read my situation	253137bec10849b833a1953c80629594b07406e0	True	False					0	1658300469		0	{}	igvyk7z	True	t3_w3epbb	False	True	t1_igvtncx	/r/Bitcoin/comments/w3epbb/could_someone_send_me_just_one_dollar_in_bitcoin/igvyk7z/	1658300480	1	True	True	False	Bitcoin	t5_2s3qj	r/Bitcoin	public		0	[]		foh read my situation	0.5087777972221375	0.35692280530929565	0.4028526246547699	0.4043753147125244	0.47597357630729675	0.6261268258094788	0.5528560876846313	0.48618021607398987	0.45949938893318176	0.15859220921993256
134	[]	False		badmotivator11			[]				text	t2_xud8r	False	False	Ah, tanks and the Chinese public. Name a more classic combo.	42d6d5ab9ce4755271ee7581052fc656a546fb0c	True	False					0	1658300447		0	{}	igvyj6k	False	t3_w3evna	False	True	t3_w3evna	/r/Bitcoin/comments/w3evna/china_ccp_tanks_protecting_banks_because_the_bank/igvyj6k/	1658300459	1	True	True	False	Bitcoin	t5_2s3qj	r/Bitcoin	public		0	[]		ah tanks and the chinese public name a more classic combo 	0.16892296075820923	0.6440157890319824	0.25836050510406494	0.252508282661438	0.39083346724510193	0.526923656463623	0.27546176314353943	0.0044663334265351295	0.481804758310318	0.0036316001787781715
135	[]	False		SonSuave			[]				text	t2_1000b4kb	False	False	Like atleast try to provide help and not just yell SCAMMER . I lKnow people do get taken advantage of but I’m so tired of texting at this point. Humanity has no trust in eachother at all. Now, if whoever sends the dollar, I want them to wait until I send it back. And then post something with a screenshots showing  I was indeed not trying to scam at all.	395537a42aa82ae808911e24dd60f66d6021574e	True	False					0	1658300429		0	{}	igvyiao	True	t3_w3epbb	False	True	t1_igvy3d8	/r/Bitcoin/comments/w3epbb/could_someone_send_me_just_one_dollar_in_bitcoin/igvyiao/	1658300444	1	True	True	False	Bitcoin	t5_2s3qj	r/Bitcoin	public		0	[]		like atleast try to provide help and not just yell scammer i lknow people do get taken advantage of but i m so tired of texting at this point humanity has no trust in eachother at all now if whoever sends the dollar i want them to wait until i send it back and then post something with a screenshots showing i was indeed not trying to scam at all 	0.08370896428823471	0.9886513948440552	0.9603899717330933	0.017212841659784317	0.007787555456161499	0.5390805602073669	0.06086760759353638	8.459657010462251e-07	0.1498677283525467	0.018946312367916107
136	[]	False		LiteratureUsual614			[]			dark	text	t2_ftiw5eu0	False	False	Thanks. I’ll implement the pass phrase suggestion.	d34523b037d2b5db30e69bb761be14e1706ddde7	True	False					0	1658300429		0	{}	igvyi90	True	t3_w3fgxf	False	True	t1_igvxkbi	/r/Bitcoin/comments/w3fgxf/btc_cold_storage/igvyi90/	1658300444	1	True	True	False	Bitcoin	t5_2s3qj	r/Bitcoin	public		0	[]		thanks i ll implement the pass phrase suggestion 	0.4858276844024658	0.4287755489349365	0.14359554648399353	0.35641852021217346	0.44687730073928833	0.4513995945453644	0.7469720840454102	0.6343952417373657	0.34567293524742126	0.011224855668842793
137	[]	False		Constant-Ad9398			[]				text	t2_bvxcsd8l	False	False	Not your paper not your fiat	7bc49f3af61c3d7283534914db8ecf5e9104e7f6	True	False					0	1658300404		0	{}	igvygzo	False	t3_w3evna	False	False	t3_w3evna	/r/Bitcoin/comments/w3evna/china_ccp_tanks_protecting_banks_because_the_bank/igvygzo/	1658300416	1	True	True	False	Bitcoin	t5_2s3qj	r/Bitcoin	public		0	[]		not your paper not your fiat	0.437233030796051	0.40177565813064575	0.5679797530174255	0.5234124064445496	0.3618701696395874	0.2993408739566803	0.43920332193374634	0.34026414155960083	0.47736993432044983	0.029607431963086128
138	[]	False		ImStillRollin			[]				text	t2_1609dq	False	False	"&gt; Try it, you'll see that you don't need to do KYC and that there's the best out there currently.

What?"	e0f8a9d0a02a0456b9140b7d2750fe3aef7d3761	True	False					0	1658300383		0	{}	igvyg04	True	t3_w1wjf7	False	True	t1_igo3e3n	/r/Bitcoin/comments/w1wjf7/decentralized_exchange/igvyg04/	1658300396	1	True	True	False	Bitcoin	t5_2s3qj	r/Bitcoin	public		0	[]		 gt try it you ll see that you don t need to do kyc and that there s the best out there currently what 	0.33982551097869873	0.7681692838668823	0.09904783219099045	0.5337059497833252	0.019706858322024345	0.4569073021411896	0.08017922192811966	9.806805110201822e-07	0.36262986063957214	0.03082997351884842
139	[]	False		Lord_DF			[]				text	t2_cer77	False	False	I think you belong just by buying and holding without short selling. No need to show it via clothing.	666ab3296ff62fbaf1b9290b42fe9e875ca6c5b4	True	False					0	1658300369		0	{}	igvyfc2	False	t3_w3fnt9	False	True	t3_w3fnt9	/r/Bitcoin/comments/w3fnt9/bitcoin_culture/igvyfc2/	1658300382	1	True	True	False	Bitcoin	t5_2s3qj	r/Bitcoin	public		0	[]		i think you belong just by buying and holding without short selling no need to show it via clothing 	0.1713111698627472	0.6791589856147766	0.34431013464927673	0.051567260175943375	0.39826375246047974	0.43507716059684753	0.1362544596195221	1.384131223858276e-06	0.3588278591632843	0.007683611009269953
140	[]	False		igadjeed			[]				text	t2_vy03v	False	True	Chinese bank protests are not relevant to Bitcoin	8c5b8a9ec185d298661e8fb5f05c35057a4e0a40	True	False					0	1658300352		0	{}	igvyeiv	False	t3_w3evna	False	True	t3_w3evna	/r/Bitcoin/comments/w3evna/china_ccp_tanks_protecting_banks_because_the_bank/igvyeiv/	1658300362	1	True	True	False	Bitcoin	t5_2s3qj	r/Bitcoin	public		0	[]		chinese bank protests are not relevant to bitcoin	0.12817145884037018	0.6779097318649292	0.6399862766265869	0.6078189015388489	0.299834281206131	0.0252534132450819	0.3510414958000183	0.2581481635570526	0.5520979166030884	1.0691970601328649e-05
141	[]	False		bakalenko			[]				text	t2_kdgu11tt	False	False	This was the real reason why I never trust any shitty wallet because I knew something like this will happen for sure and that's why I am just good with cold wallets.	5d5d80b43ab6eaae125fc08c5e2102d45745fd5f	True	False					0	1658300347		0	{}	igvye95	False	t3_w2lcbr	False	False	t3_w2lcbr	/r/Bitcoin/comments/w2lcbr/i_was_stupid_enough_to_lend_my_btc_to_celsius_my/igvye95/	1658300361	1	True	True	False	Bitcoin	t5_2s3qj	r/Bitcoin	public		0	[]		this was the real reason why i never trust any shitty wallet because i knew something like this will happen for sure and that s why i am just good with cold wallets 	0.011604382656514645	0.3898988664150238	0.6233696341514587	0.008628440089523792	0.8261827230453491	0.6106947660446167	0.0890396386384964	8.562250286558992e-07	0.25789204239845276	0.02296902798116207
142	[]	False		ImStillRollin			[]				text	t2_1609dq	False	False	"&gt; and most voted are positive about Bisq,

Yes, but that's not what this post is about.  Positive reviews are not the same as being decentralized."	5d4c83c6f56240aca9edc934cbf56d72d5cf7286	True	False					0	1658300338		0	{}	igvydv1	True	t3_w1wjf7	False	True	t1_igqzu1o	/r/Bitcoin/comments/w1wjf7/decentralized_exchange/igvydv1/	1658300349	1	True	True	False	Bitcoin	t5_2s3qj	r/Bitcoin	public		0	[]		 gt and most voted are positive about bisq yes but that s not what this post is about positive reviews are not the same as being decentralized 	0.10543043166399002	0.7933500409126282	0.6332647204399109	0.08661588281393051	0.5001498460769653	0.26597630977630615	0.16775529086589813	1.976728071895195e-06	0.6344820857048035	0.003021261189132929
143	[]	False		sushishishi			[]				text	t2_5trnmmk8	False	False	Damn, I just commented a few days ago that at least they don’t have tanks out, I spoke too soon….	70398e16dd9d24ec4581b8b2a17d6b42f8cd0956	True	False					0	1658300302		0	{}	igvyc3b	False	t3_w3evna	False	True	t3_w3evna	/r/Bitcoin/comments/w3evna/china_ccp_tanks_protecting_banks_because_the_bank/igvyc3b/	1658300313	1	True	True	False	Bitcoin	t5_2s3qj	r/Bitcoin	public		0	[]		damn i just commented a few days ago that at least they don t have tanks out i spoke too soon 	0.1027592122554779	0.5487501621246338	0.4808284342288971	0.019621269777417183	0.5093259811401367	0.5857428312301636	0.19626566767692566	8.480133146804292e-07	0.2660078704357147	0.004568047355860472
144	[]	False		Bitcoin__Hodler			[]			dark	text	t2_jtjwgqh6	False	False	Indeed, the bubbles &amp; scams get bigger	71b239358ba7433c71e2c1854f36aa622a91bec4	True	False					0	1658300287		0	{}	igvybdf	False	t3_w2qrf3	False	True	t1_igse30e	/r/Bitcoin/comments/w2qrf3/not_your_keys_not_your_bitcoin_celsius_lawyers/igvybdf/	1658300300	1	True	True	False	Bitcoin	t5_2s3qj	r/Bitcoin	public		0	[]		indeed the bubbles amp scams get bigger	0.3173862099647522	0.5987128615379333	0.5320723652839661	0.3237755596637726	0.4519668519496918	0.7028861045837402	0.3507431149482727	0.38409799337387085	0.39881980419158936	0.014720479026436806
145	[]	False		Qeimat			[]				text	t2_a7l3pj64	False	False	I am glad that I have learned these shits right now man.	2a59d174180fec0fba18719138d923256df2a037	True	False					0	1658300276		0	{}	igvyatg	False	t3_w2lcbr	False	True	t1_igr262f	/r/Bitcoin/comments/w2lcbr/i_was_stupid_enough_to_lend_my_btc_to_celsius_my/igvyatg/	1658300286	1	True	True	False	Bitcoin	t5_2s3qj	r/Bitcoin	public		0	[]		i am glad that i have learned these shits right now man 	0.5653236508369446	0.1746172159910202	0.38721922039985657	0.05009103938937187	0.5764278173446655	0.6039480566978455	0.8707883358001709	0.6896436810493469	0.3629694879055023	0.011015253141522408
146	[]	False		Bitcoin__Hodler			[]			dark	text	t2_jtjwgqh6	False	False	"&gt; Talk about an expensive lesson.

The best lessons in life"	b777c5315d5030d5a1353e75a542b156a3048ae5	True	False					0	1658300262		0	{}	igvya63	False	t3_w2qrf3	False	True	t1_igsbmg7	/r/Bitcoin/comments/w2qrf3/not_your_keys_not_your_bitcoin_celsius_lawyers/igvya63/	1658300272	1	True	True	False	Bitcoin	t5_2s3qj	r/Bitcoin	public		0	[]		 gt talk about an expensive lesson the best lessons in life	0.31195053458213806	0.757707953453064	0.2246645838022232	0.3545231521129608	0.4264618158340454	0.4993158280849457	0.22808487713336945	0.7365491986274719	0.39204707741737366	0.035977862775325775
147	[]	False		Bitcoin__Hodler			[]			dark	text	t2_jtjwgqh6	False	False	plot twist: tank drivers want to withdraw their cash	9ddc012e1064d46f3938d22ee668097df3515c49	True	False					0	1658300222		0	{}	igvy883	False	t3_w3evna	False	True	t3_w3evna	/r/Bitcoin/comments/w3evna/china_ccp_tanks_protecting_banks_because_the_bank/igvy883/	1658300234	1	True	True	False	Bitcoin	t5_2s3qj	r/Bitcoin	public		0	[]		plot twist tank drivers want to withdraw their cash	0.28119197487831116	0.6364027261734009	0.49470990896224976	0.5638584494590759	0.32697537541389465	0.49373844265937805	0.2653513550758362	0.13674917817115784	0.4193347096443176	0.006389713380485773
148	[]	False		ImStillRollin			[]				text	t2_1609dq	False	False	??  No it doesn't.	4f5c4fdc9ddf20fe8335352d4ea84d808c9b1620	True	False					0	1658300207		0	{}	igvy7j1	True	t3_w1wjf7	False	False	t1_igmvpa1	/r/Bitcoin/comments/w1wjf7/decentralized_exchange/igvy7j1/	1658300218	1	True	True	False	Bitcoin	t5_2s3qj	r/Bitcoin	public		0	[]		 no it doesn t 	0.4718897342681885	0.4817140996456146	0.589309573173523	0.5058148503303528	0.4840075671672821	0.6604428291320801	0.34699320793151855	0.4266023635864258	0.4817116856575012	0.18359826505184174
149	[]	False		customtoggle			[]				text	t2_387p5a	False	False	*Like a bat outta hell*	340cbb0bf0d172cbbf1a75e98a0fde9aa8d648c8	True	False					0	1658300191		0	{}	igvy6ru	False	t3_w3dlb8	False	True	t1_igvw3ee	/r/Bitcoin/comments/w3dlb8/i_know_some_of_you_are_happy_about_the_stacking/igvy6ru/	1658300205	1	True	True	False	Bitcoin	t5_2s3qj	r/Bitcoin	public		0	[]		 like a bat outta hell 	0.4703196585178375	0.33350464701652527	0.7344914078712463	0.3260294497013092	0.4796959459781647	0.5942777395248413	0.3579942286014557	0.27868497371673584	0.4022025465965271	0.4544728100299835
150	[]	False		poopdeckocupado			[]			dark	text	t2_issmabn9	False	False	"""I have a shitload of easily transferrable, relatively untraceable currency""

https://xkcd.com/538/"	c1e785fca575c0498d3ff5a9cfa1380edbaa8680	True	False					0	1658300189		0	{}	igvy6p1	False	t3_w329ll	False	True	t1_igtpps6	/r/Bitcoin/comments/w329ll/btc_holder/igvy6p1/	1658300201	1	True	True	False	Bitcoin	t5_2s3qj	r/Bitcoin	public		0	[]		 i have a shitload of easily transferrable relatively untraceable currency https xkcd com 538 	0.04361947253346443	0.8582045435905457	0.5376284718513489	0.030685001984238625	0.3624979257583618	0.2996862232685089	0.27500858902931213	0.5765841007232666	0.5038748979568481	2.0370098354760557e-05
151	[]	False		ImStillRollin			[]				text	t2_1609dq	False	False	Who said it wasn't?	359f43b18bfb43ef0856c2a17296be3fcf31eac6	True	False					0	1658300188		0	{}	igvy6np	True	t3_w1wjf7	False	True	t1_igp9peu	/r/Bitcoin/comments/w1wjf7/decentralized_exchange/igvy6np/	1658300199	1	True	True	False	Bitcoin	t5_2s3qj	r/Bitcoin	public		0	[]		who said it wasn t 	0.47781750559806824	0.4591371715068817	0.5632594227790833	0.5168624520301819	0.5034529566764832	0.8072234392166138	0.4206976592540741	0.4786188006401062	0.45623287558555603	0.2108580470085144
152	[]	False		bleeeeghh			[]				text	t2_5flat	False	False	Only if the stock market goes into a super bear market too I think.	f0bf37e2d7f71699d5ddff73b455f2b6f940c011	True	False					0	1658300177		0	{}	igvy62p	False	t3_w2k8pl	False	True	t1_igtkdmn	/r/Bitcoin/comments/w2k8pl/daily_discussion_july_19_2022/igvy62p/	1658300191	1	True	True	False	Bitcoin	t5_2s3qj	r/Bitcoin	public		0	[]		only if the stock market goes into a super bear market too i think 	0.14705027639865875	0.7611899375915527	0.2541976869106293	0.6271438002586365	0.37342795729637146	0.45826250314712524	0.13771817088127136	6.069790742913028e-06	0.39579835534095764	0.004469968844205141
153	[]	False		No_Yogurtcloset_2547			[]				text	t2_7u7gnuyg	False	False	There are alternative investments to bitcoin. Something that produces a cashflow, something that is not new tech but boring and cheap but battle tested. There is no need to go all-in into bitcoin. Never has been, never will be and it was never intended to. It is not set in stone that bitcoin succeeds, so why go all in? If it's value proposition turns out to be true, you dont need several coins, you dont even need one full coin. If it turns out to be untrue or different, it will have a ceiling like all investments do hence its risk/return profile is comparable to other investments. And many companies are cheap now as well. Diversification is king.	77837a17b9f3ac530ae6d957fcea8c76c6a079fc	True	False					0	1658300176		0	{}	igvy607	False	t3_w31kud	False	True	t1_igvr7lb	/r/Bitcoin/comments/w31kud/i_sold_my_house_on_friday_and_today/igvy607/	1658300188	1	True	True	False	Bitcoin	t5_2s3qj	r/Bitcoin	public		0	[]		there are alternative investments to bitcoin something that produces a cashflow something that is not new tech but boring and cheap but battle tested there is no need to go all in into bitcoin never has been never will be and it was never intended to it is not set in stone that bitcoin succeeds so why go all in if it s value proposition turns out to be true you dont need several coins you dont even need one full coin if it turns out to be untrue or different it will have a ceiling like all investments do hence its risk return profile is comparable to other investments and many companies are cheap now as well diversification is king 	0.002735199872404337	0.9885417222976685	0.528268039226532	0.032832834869623184	0.00900462456047535	0.2560664415359497	0.09294001013040543	8.557727824154426e-07	0.5322705507278442	0.003956835251301527
154	[]	False		[deleted]						dark					[removed]	fe993932d6dced4c0a879e9aa5d7a6e0fbb467f5	True	False					0	1658300154		0	{}	igvy4xh	False	t3_w2llxp	False	True	t1_igsis7d	/r/Bitcoin/comments/w2llxp/bitcoin_made_it_easy/igvy4xh/	1658300167	1	True	True	False	Bitcoin	t5_2s3qj	r/Bitcoin	public		0	[]		 removed 	0.46707504987716675	0.5148742198944092	0.5170193910598755	0.5029740929603577	0.4936113953590393	0.5123135447502136	0.45383262634277344	0.4847692549228668	0.4981911778450012	0.5145108103752136
155	[]	False		ThePaleHorse616		noob	[{'e': 'text', 't': 'redditor for 3 months'}]	2ec8e69e-6c36-11e9-a04b-0afb553d4ea6	redditor for 3 months	dark	richtext	t2_mjkaeiwr	False	False	Buy the rumor and sell the news.	316e448a2450c03ec56c3dffe2c8b49bdfa3cc98	True	False					0	1658300138		0	{}	igvy44f	False	t3_w2qfxs	False	True	t3_w2qfxs	/r/Bitcoin/comments/w2qfxs/isnt_it_funny_how_the_mt_gox_coins_will_flood_the/igvy44f/	1658300149	1	True	True	False	Bitcoin	t5_2s3qj	r/Bitcoin	public		0	[]		buy the rumor and sell the news 	0.29831671714782715	0.561698853969574	0.45552513003349304	0.5808587670326233	0.4335847795009613	0.6899054646492004	0.2702846825122833	0.5413204431533813	0.40225502848625183	0.05994197353720665
156	[]	False		SonSuave			[]				text	t2_1000b4kb	False	False	Could someone just send one mere dollar. Who knows I’ll probably help you out in the future if I can get this fixed. A lot of money in this account. So whoever even takes a shot at helping will be given some coin ofc	4027562e58a4b81a0b5a1dc79a2106eaf02341ad	True	False					0	1658300123		0	{}	igvy3d8	True	t3_w3epbb	False	True	t1_igvtnn3	/r/Bitcoin/comments/w3epbb/could_someone_send_me_just_one_dollar_in_bitcoin/igvy3d8/	1658300136	1	True	True	False	Bitcoin	t5_2s3qj	r/Bitcoin	public		0	[]		could someone just send one mere dollar who knows i ll probably help you out in the future if i can get this fixed a lot of money in this account so whoever even takes a shot at helping will be given some coin ofc	0.2547479271888733	0.9850191473960876	0.2943778932094574	0.023391731083393097	0.010398260317742825	0.353141188621521	0.088286854326725	8.300908120872919e-07	0.17541711032390594	0.02352272905409336
157	[]	False		daokimxuan			[]				text	t2_fl150xwe	False	False	I have good quality headphone though that would be good enough for me.	c01e9e8ec00367c1cddaaf017e77768e76d0513d	True	False					0	1658300099		0	{}	igvy26k	False	t3_w2k8pl	False	True	t1_igsl9i1	/r/Bitcoin/comments/w2k8pl/daily_discussion_july_19_2022/igvy26k/	1658300113	1	True	True	False	Bitcoin	t5_2s3qj	r/Bitcoin	public		0	[]		i have good quality headphone though that would be good enough for me 	0.7089816331863403	0.42755523324012756	0.048408448696136475	0.06087687239050865	0.49820876121520996	0.68433678150177	0.7934563755989075	0.8992488980293274	0.352356880903244	0.02081850729882717
158	[]	False		aradchenko			[]				text	t2_cgji6uvv	False	False	This is more like a lot of people are going to go in this way.	b591344da7e45dadf04bd6f7d0fa985f2ea7ca70	True	False					0	1658300085		0	{}	igvy1fi	False	t3_w2p3x5	False	True	t1_igs1rtx	/r/Bitcoin/comments/w2p3x5/what_are_things_that_could_actually_kill_bitcoin/igvy1fi/	1658300099	1	True	True	False	Bitcoin	t5_2s3qj	r/Bitcoin	public		0	[]		this is more like a lot of people are going to go in this way 	0.5626062154769897	0.5563538074493408	0.5234769582748413	0.11853742599487305	0.6832257509231567	0.42037755250930786	0.14534056186676025	0.5855719447135925	0.4023607671260834	0.01187932025641203
159	[]	False		Bitcoin__Hodler			[]			dark	text	t2_jtjwgqh6	False	False	&gt;Putin has to lower it NAOW!	8485a8201facbc6d57de115a9d207cac987415aa	True	False					0	1658300038		0	{}	igvxz1i	False	t3_w2uvyy	False	True	t3_w2uvyy	/r/Bitcoin/comments/w2uvyy/nobody_is_worried_about_inflation_it_will_only/igvxz1i/	1658300051	1	True	True	False	Bitcoin	t5_2s3qj	r/Bitcoin	public		0	[]		 gt putin has to lower it naow 	0.24288444221019745	0.5896662473678589	0.6058558225631714	0.3820570707321167	0.3994770050048828	0.140585795044899	0.3789360821247101	0.6862866282463074	0.456574410200119	0.0033024002332240343
160	[]	False		IntelligentFan9178			[]				text	t2_a1j18wmu	False	False	And this is why China will never go to war with the US, they need all their resources to protect CCP assets from their own people...	d03aef6955fa4b1a647920a77e60fc5a38a74f67	True	False					0	1658300036		0	{}	igvxyxo	False	t3_w3evna	False	True	t3_w3evna	/r/Bitcoin/comments/w3evna/china_ccp_tanks_protecting_banks_because_the_bank/igvxyxo/	1658300051	1	True	True	False	Bitcoin	t5_2s3qj	r/Bitcoin	public		0	[]		and this is why china will never go to war with the us they need all their resources to protect ccp assets from their own people 	0.31268346309661865	0.9287497401237488	0.8146336078643799	0.38883906602859497	0.08411002904176712	0.342259019613266	0.07978670299053192	8.932153150453814e-07	0.42652106285095215	0.009472863748669624
161	[]	False		Bitcoin__Hodler			[]			dark	text	t2_jtjwgqh6	False	False	There is still a little chance that Dorian is Satoshi... :-p	db9d3971353cbc83408ab3e650b9c0ee250c554c	True	False					0	1658300010		0	{}	igvxxnl	False	t3_w3avtm	False	True	t1_igvgd2c	/r/Bitcoin/comments/w3avtm/the_decentralised_digital_currency_ceo_spoke/igvxxnl/	1658300023	1	True	True	False	Bitcoin	t5_2s3qj	r/Bitcoin	public		0	[]		there is still a little chance that dorian is satoshi p	0.6011542677879333	0.6222657561302185	0.37954267859458923	0.2692699134349823	0.4393412172794342	0.31428444385528564	0.285895437002182	0.36762240529060364	0.4613083302974701	0.010624455288052559
162	[]	False		R0T4R1			[]				text	t2_84pmpunn	False	False	When th gov tells you to stay calm, freak the tf out. When the gov tells you to panic, stay calm	457b208bed6c9c7ddd9da4e7a56336fea5d9c82c	True	False					0	1658300007		0	{}	igvxxhg	False	t3_w2uvyy	False	True	t3_w2uvyy	/r/Bitcoin/comments/w2uvyy/nobody_is_worried_about_inflation_it_will_only/igvxxhg/	1658300023	1	True	True	False	Bitcoin	t5_2s3qj	r/Bitcoin	public		0	[]		when th gov tells you to stay calm freak the tf out when the gov tells you to panic stay calm	0.1890963464975357	0.6544383764266968	0.1526554971933365	0.8557790517807007	0.1846114993095398	0.7449898719787598	0.12226524949073792	8.417471235588891e-07	0.23282472789287567	0.005142396315932274
163	[]	False		[deleted]						dark					[removed]	fe993932d6dced4c0a879e9aa5d7a6e0fbb467f5	True	False					0	1658300005		0	{}	igvxxe6	False	t3_w332cv	False	True	t1_igv3g1q	/r/Bitcoin/comments/w332cv/my_daughter_want_to_invest_into_something_for_her/igvxxe6/	1658300015	1	True	True	False	Bitcoin	t5_2s3qj	r/Bitcoin	public		0	[]		 removed 	0.46707504987716675	0.5148742198944092	0.5170193910598755	0.5029740929603577	0.4936113953590393	0.5123135447502136	0.45383262634277344	0.4847692549228668	0.4981911778450012	0.5145108103752136
164	[]	False		zver139			[]				text	t2_a0m8gclh	False	False	The way they are using i can certainly say that this is the case.	760018c09ef64c01f5db886d717b9e6dbf6c5de1	True	False					0	1658299985		0	{}	igvxwhy	False	t3_w2uvyy	False	True	t1_igv65xy	/r/Bitcoin/comments/w2uvyy/nobody_is_worried_about_inflation_it_will_only/igvxwhy/	1658299996	1	True	True	False	Bitcoin	t5_2s3qj	r/Bitcoin	public		0	[]		the way they are using i can certainly say that this is the case 	0.3613588213920593	0.687404215335846	0.27021217346191406	0.3436739444732666	0.49207019805908203	0.39358577132225037	0.1577305942773819	0.32488176226615906	0.5087937712669373	0.0039239246398210526
165	[]	False		Mundane-Pomelo-1878			[]				text	t2_96av0olb	False	False	Henan square massacre	8339c77887227954f1784258c276c818214009c3	True	False					0	1658299979		0	{}	igvxw8a	False	t3_w3evna	False	True	t3_w3evna	/r/Bitcoin/comments/w3evna/china_ccp_tanks_protecting_banks_because_the_bank/igvxw8a/	1658299989	1	True	True	False	Bitcoin	t5_2s3qj	r/Bitcoin	public		0	[]		henan square massacre	0.429093599319458	0.5202606916427612	0.4699854254722595	0.4965480864048004	0.4288650155067444	0.39519357681274414	0.472491055727005	0.4519400894641876	0.5066620111465454	0.3661287724971771
