Unnamed: 0	all_awardings	archived	associated_award	author	author_flair_background_color	author_flair_css_class	author_flair_richtext	author_flair_template_id	author_flair_text	author_flair_text_color	author_flair_type	author_fullname	author_patreon_flair	author_premium	body	body_sha1	can_gild	collapsed	collapsed_because_crowd_control	collapsed_reason	collapsed_reason_code	comment_type	controversiality	created_utc	distinguished	gilded	gildings	id	is_submitter	link_id	locked	no_follow	parent_id	permalink	retrieved_utc	score	score_hidden	send_replies	stickied	subreddit	subreddit_id	subreddit_name_prefixed	subreddit_type	top_awarded_type	total_awards_received	treatment_tags	unrepliable_reason	corpus	support	knowledge	conflict	power	similarity	fun	status	trust	identity	romance
32	[]	False		[deleted]						dark					[removed]	fe993932d6dced4c0a879e9aa5d7a6e0fbb467f5	True	False					0	1658302866		0	{}	igw1nqv	False	t3_w3fgxf	False	True	t3_w3fgxf	/r/Bitcoin/comments/w3fgxf/btc_cold_storage/igw1nqv/	1658302880	1	True	True	False	Bitcoin	t5_2s3qj	r/Bitcoin	public		0	[]		 removed 	0.46707504987716675	0.5148742198944092	0.5170193910598755	0.5029740929603577	0.4936113953590393	0.5123135447502136	0.45383262634277344	0.4847692549228668	0.4981911778450012	0.5145108103752136
33	[]	False		arbalest_22			[]				text	t2_42pt37zs	False	False	And then he stops replying. lol	0943bfd1e462535e11b7a471e6f78185d60b81b9	True	False					0	1658302850		0	{}	igw1n1m	False	t3_w329ll	False	True	t1_igud4sg	/r/Bitcoin/comments/w329ll/btc_holder/igw1n1m/	1658302861	1	True	True	False	Bitcoin	t5_2s3qj	r/Bitcoin	public		0	[]		and then he stops replying lol	0.4248396158218384	0.35465097427368164	0.6171363592147827	0.4206244647502899	0.4303409159183502	0.7375120520591736	0.3882679343223572	0.5616584420204163	0.3667064905166626	0.18266603350639343
34	[]	False		shart_leakage			[]			dark	text	t2_aiwyg3m6	False	False	Ungovernment yourself	1dc73154e0353d895104f238b083da9554b3e9bf	True	False					0	1658302846		0	{}	igw1mve	False	t3_w3evna	False	True	t1_igvygzo	/r/Bitcoin/comments/w3evna/china_ccp_tanks_protecting_banks_because_the_bank/igw1mve/	1658302859	1	True	True	False	Bitcoin	t5_2s3qj	r/Bitcoin	public		0	[]		ungovernment yourself	0.5196489095687866	0.46076902747154236	0.560422420501709	0.4545094966888428	0.45612987875938416	0.5671176314353943	0.4773939549922943	0.4834921956062317	0.45923560857772827	0.4116928279399872
35	[]	False		Yes_Daddy_Bezos			[]				text	t2_97by5g0t	False	False	Relax guys it's national bank day.	1263dba24742fb9fe2c1f12188994cbb9b638dd2	True	False					0	1658302807		0	{}	igw1l3p	False	t3_w3evna	False	True	t3_w3evna	/r/Bitcoin/comments/w3evna/china_ccp_tanks_protecting_banks_because_the_bank/igw1l3p/	1658302818	1	True	True	False	Bitcoin	t5_2s3qj	r/Bitcoin	public		0	[]		relax guys it s national bank day 	0.49193307757377625	0.41226595640182495	0.15925787389278412	0.5485928058624268	0.48410332202911377	0.8544477224349976	0.443229615688324	0.5978833436965942	0.4712149500846863	0.007076626177877188
36	[]	False		ScottONcoin			[]				text	t2_esdw987c	False	False	Possibly so can't be that sure about that though. Like what if everything changes all of suddenly?	3e001c59636dabfb5ff6d63639b724fac426eebe	True	False					0	1658302799		0	{}	igw1kq6	False	t3_w2k8pl	False	True	t1_igsgtfm	/r/Bitcoin/comments/w2k8pl/daily_discussion_july_19_2022/igw1kq6/	1658302810	1	True	True	False	Bitcoin	t5_2s3qj	r/Bitcoin	public		0	[]		possibly so can t be that sure about that though like what if everything changes all of suddenly 	0.4600564241409302	0.7794196605682373	0.17777198553085327	0.03564208000898361	0.4851662516593933	0.3875236511230469	0.09834633767604828	0.32154381275177	0.4795615077018738	0.0028853800613433123
37	[]	False		NefariousnessSome945			[]				text	t2_99pdxt7y	False	False	"In Argentina we use Facebook groups and meet face to face in a public space or a ""cueva"" (illegal exchange office)."	59bdc7ce93a33c83c0d4e05686f9852555937db0	True	False					0	1658302754		0	{}	igw1io2	False	t3_w2x6ie	False	True	t3_w2x6ie	/r/Bitcoin/comments/w2x6ie/alternatives_to_exchanges/igw1io2/	1658302770	1	True	True	False	Bitcoin	t5_2s3qj	r/Bitcoin	public		0	[]		in argentina we use facebook groups and meet face to face in a public space or a cueva illegal exchange office 	0.14079827070236206	0.836258053779602	0.4605802893638611	0.49374911189079285	0.19738887250423431	0.20286718010902405	0.12936682999134064	0.22610154747962952	0.4841082692146301	0.007325954269617796
38	[]	False		fernandes328			[]				text	t2_d1c4pok1	False	False	It took me a while to actually decode the whole comment of yours.	ccd04dc769711fa2c3bafb6486ac03814fc1b5fa	True	False					0	1658302705		0	{}	igw1geq	False	t3_w2uvyy	False	True	t1_iguilxq	/r/Bitcoin/comments/w2uvyy/nobody_is_worried_about_inflation_it_will_only/igw1geq/	1658302716	1	True	True	False	Bitcoin	t5_2s3qj	r/Bitcoin	public		0	[]		it took me a while to actually decode the whole comment of yours 	0.21780738234519958	0.498854398727417	0.5365532040596008	0.20739760994911194	0.47767508029937744	0.47931796312332153	0.22378528118133545	0.00247895997017622	0.3143918812274933	0.005648814607411623
39	[]	False		dsasov			[]				text	t2_bcjutx7j	False	False	This is the last option I can see right now and I am laughing literally.	4ff0444c7b22968a20f38c3236ff657389cc2e77	True	False					0	1658302676		0	{}	igw1f2x	False	t3_w2p3x5	False	True	t1_igrx4t7	/r/Bitcoin/comments/w2p3x5/what_are_things_that_could_actually_kill_bitcoin/igw1f2x/	1658302689	1	True	True	False	Bitcoin	t5_2s3qj	r/Bitcoin	public		0	[]		this is the last option i can see right now and i am laughing literally 	0.2561885118484497	0.4910438358783722	0.33253541588783264	0.2370685487985611	0.5101118683815002	0.8867464661598206	0.18678893148899078	0.6889657974243164	0.34398528933525085	0.014623068273067474
40	[]	False		NefariousnessSome945			[]				text	t2_99pdxt7y	False	False	"Incredibly on point.
Also, I'd love to get 50btc in a few months 🤣"	f5def96ae73ae0c6a152217884008ae0fcbe1ff6	True	False					0	1658302674		0	{}	igw1ezo	False	t3_w3fa8k	False	True	t3_w3fa8k	/r/Bitcoin/comments/w3fa8k/shitcoin/igw1ezo/	1658302689	1	True	True	False	Bitcoin	t5_2s3qj	r/Bitcoin	public		0	[]		incredibly on point also i d love to get 50btc in a few months 	0.3748124837875366	0.4446786344051361	0.12695690989494324	0.06838999688625336	0.4107762575149536	0.4297336935997009	0.5753708481788635	0.15617536008358002	0.32488375902175903	0.498759388923645
41	[]	False		suggest-Name			[]				text	t2_635rlfcu	False	False	I mean it’s not going to go up by itself	e55e3e33fa1fbb566808d02d281422e50865074a	True	False					0	1658302670		0	{}	igw1et7	False	t3_w32z4w	False	True	t3_w32z4w	/r/Bitcoin/comments/w32z4w/i_bought_sum_bitcoin/igw1et7/	1658302682	1	True	True	False	Bitcoin	t5_2s3qj	r/Bitcoin	public		0	[]		i mean it s not going to go up by itself	0.4776727557182312	0.44873255491256714	0.6112364530563354	0.24993754923343658	0.47453340888023376	0.5018095970153809	0.17104685306549072	0.020146796479821205	0.4246092736721039	0.01566159725189209
42	[]	False		ivawka81			[]				text	t2_7ubvz95l	False	False	But you have to admit that we are facing the issue of the inflation.	775622cf8ecf239b974a36daba6680251e04814d	True	False					0	1658302571		0	{}	igw1abx	False	t3_w2uvyy	False	True	t1_igu8ksn	/r/Bitcoin/comments/w2uvyy/nobody_is_worried_about_inflation_it_will_only/igw1abx/	1658302582	1	True	True	False	Bitcoin	t5_2s3qj	r/Bitcoin	public		0	[]		but you have to admit that we are facing the issue of the inflation 	0.298092782497406	0.5181406140327454	0.5780652761459351	0.5749264359474182	0.44084057211875916	0.3306114971637726	0.34139344096183777	0.05995716527104378	0.44565439224243164	0.013792445883154869
43	[]	False		NefariousnessSome945			[]				text	t2_99pdxt7y	False	False	Even if they sold it all at once (almost impossible) it would only represent like 2 hours of what's traded every day. The FUD would be more impactful than the selling itself.	a4b0b73f9cdd4a9924827ea19db26ae75a1c0941	True	False					0	1658302563		0	{}	igw19x9	False	t3_w2qfxs	False	True	t3_w2qfxs	/r/Bitcoin/comments/w2qfxs/isnt_it_funny_how_the_mt_gox_coins_will_flood_the/igw19x9/	1658302575	1	True	True	False	Bitcoin	t5_2s3qj	r/Bitcoin	public		0	[]		even if they sold it all at once almost impossible it would only represent like 2 hours of what s traded every day the fud would be more impactful than the selling itself 	0.00837008934468031	0.9807400703430176	0.5268715023994446	0.018573829904198647	0.7719821333885193	0.387105256319046	0.07006702572107315	8.347356015292462e-07	0.35569071769714355	0.012284072116017342
44	[]	False		Professional-Tea2397			[]				text	t2_af3onnet	False	False	Wait are you saying that you believe that the Hoover Dam was just sitting there spewing out electricity not connected to the grid? Are you insane?	3a954a772612da43daf34f61bcbb11ab509db643	True	False					0	1658302420		0	{}	igw137u	False	t3_w19i32	False	True	t1_igt5is7	/r/Bitcoin/comments/w19i32/bitcoin_mining_and_stabilizing_the_power_grid_is/igw137u/	1658302434	1	True	True	False	Bitcoin	t5_2s3qj	r/Bitcoin	public		0	[]		wait are you saying that you believe that the hoover dam was just sitting there spewing out electricity not connected to the grid are you insane 	0.02226349338889122	0.7624869346618652	0.9420119524002075	0.8064822554588318	0.39493459463119507	0.5118246674537659	0.07930955290794373	8.76006708949717e-07	0.28625279664993286	0.004954288713634014
45	[]	False		blario			[]				text	t2_1wbe	False	False	You’re referring to lose its value on exchanges. Stop depending on exchanges.  They don’t like you. They steal from you and treat you as a piggy bank. These cryptocurrencies were never meant to be speculative tools on exchanges.  Stop conflating your fiat world ideas with decentralized, limited supply currencies.  They don’t mix. These are meant to be **money**.  That means trading goods and services. What needs to happen is employers employ in bitcoin and merchants sell for bitcoin.  Nothing to do with exchanges.	2557bfb77b684ebf17dfe5371bdbae1b84e66417	True	False					0	1658302374		0	{}	igw114y	False	t3_w22lcp	False	True	t1_igvgu93	/r/Bitcoin/comments/w22lcp/the_cantillon_effect/igw114y/	1658302386	1	True	True	False	Bitcoin	t5_2s3qj	r/Bitcoin	public		0	[]		you re referring to lose its value on exchanges stop depending on exchanges they don t like you they steal from you and treat you as a piggy bank these cryptocurrencies were never meant to be speculative tools on exchanges stop conflating your fiat world ideas with decentralized limited supply currencies they don t mix these are meant to be money that means trading goods and services what needs to happen is employers employ in bitcoin and merchants sell for bitcoin nothing to do with exchanges 	0.0025901575572788715	0.9887434244155884	0.3370884656906128	0.06595314294099808	0.007554016076028347	0.3330850899219513	0.09670577943325043	8.430470188613981e-07	0.33696430921554565	0.011590542271733284
46	[]	False		PortKrona		noob	[{'e': 'text', 't': 'redditor for 7 weeks'}]	2ec8e69e-6c36-11e9-a04b-0afb553d4ea6	redditor for 7 weeks	dark	richtext	t2_nr4t0cd4	False	False	Found the shitcoiner	4cf63586036e9bba355f4478749acc47c55b2727	True	False					0	1658302373		0	{}	igw113a	False	t3_w39gpr	False	True	t1_igvtiwc	/r/Bitcoin/comments/w39gpr/jack_mallers_destroys_proof_of_stake_at_crypto/igw113a/	1658302386	1	True	True	False	Bitcoin	t5_2s3qj	r/Bitcoin	public		0	[]		found the shitcoiner	0.3944520354270935	0.5843340158462524	0.46617716550827026	0.47615915536880493	0.49087464809417725	0.2178855836391449	0.4602830111980438	0.488208532333374	0.48278936743736267	0.5645517706871033
47	[]	False		coinfreekz			[]				text	t2_es2cr	False	False	Nope that's coping. You've could've taken profit and it's still a significant amount if your target is only 100k and be enjoying the profits now and even bought back your original position. But you got greedy for that last drop so there you go massive profit loss, not to mention and more importantly you've lost time which you will never buy back.	372d70846cc1c35347b9036fb2ca47f2466c8731	True	False					0	1658302347		0	{}	igw0zvu	False	t3_w1n06x	False	True	t1_igremg0	/r/Bitcoin/comments/w1n06x/hard_truth_if_btc_reaches_1_mil_im_selling/igw0zvu/	1658302358	1	True	True	False	Bitcoin	t5_2s3qj	r/Bitcoin	public		0	[]		nope that s coping you ve could ve taken profit and it s still a significant amount if your target is only 100k and be enjoying the profits now and even bought back your original position but you got greedy for that last drop so there you go massive profit loss not to mention and more importantly you ve lost time which you will never buy back 	0.003366427030414343	0.9888705015182495	0.5230711698532104	0.020130565389990807	0.9917275905609131	0.5376293659210205	0.06168070808053017	8.417583785558236e-07	0.16150085628032684	0.09616915136575699
48	[]	False		91DarioASR			[]				text	t2_l2kzjw7	False	False	In Italy you can still use shitcoins.club and buy/sell 15,000€ daily NO KYC. I’m a customer and I their atm are great	794e8e4dfab48a2659c3865ea9a131060e746494	True	False					0	1658302333		0	{}	igw0z8t	False	t3_w3brw9	False	False	t3_w3brw9	/r/Bitcoin/comments/w3brw9/kycaml_getting_out_of_hand_has_the_government_won/igw0z8t/	1658302345	1	True	True	False	Bitcoin	t5_2s3qj	r/Bitcoin	public		0	[]		in italy you can still use shitcoins club and buy sell 15 000 daily no kyc i m a customer and i their atm are great	0.12115240097045898	0.9009796380996704	0.04313970357179642	0.07389704138040543	0.012548122555017471	0.5116809010505676	0.1972893327474594	0.9618854522705078	0.4206595718860626	0.03311964124441147
49	[]	False		katryskam			[]				text	t2_b82uxvks	False	False	yes, because they missed the chance and now they are butthurt.	5515356e59e1b8b660827677c65e58081d846a32	True	False					0	1658302292		0	{}	igw0xbf	False	t3_w2sf05	False	True	t1_iguy0fw	/r/Bitcoin/comments/w2sf05/this_is_the_first_bitcoin_cycle_i_havent_heard_a/igw0xbf/	1658302304	1	True	True	False	Bitcoin	t5_2s3qj	r/Bitcoin	public		0	[]		yes because they missed the chance and now they are butthurt 	0.43822288513183594	0.41760510206222534	0.6117609143257141	0.2684847116470337	0.38835710287094116	0.5216655135154724	0.33118242025375366	0.011935923248529434	0.38336682319641113	0.0787837877869606
50	[]	False		Ryan61701			[]				text	t2_dqv8wttj	False	False	I know that, but they are very smart when it comes for their house.	ed0fd60a057718a47ca5cde9869706cc2654bab2	True	False					0	1658302290		0	{}	igw0x7w	False	t3_w2uvyy	False	True	t1_iguwlen	/r/Bitcoin/comments/w2uvyy/nobody_is_worried_about_inflation_it_will_only/igw0x7w/	1658302304	1	True	True	False	Bitcoin	t5_2s3qj	r/Bitcoin	public		0	[]		i know that but they are very smart when it comes for their house 	0.4867801368236542	0.4451430141925812	0.12521357834339142	0.1017906442284584	0.5697829723358154	0.6489362120628357	0.28442734479904175	0.6556402444839478	0.45595166087150574	0.007439195178449154
51	[]	False		wtfsperday			[]				text	t2_3hq9vhfl	False	False	 🎵I don’t practice Santeria, ain’t got no crystal ball. I had a million dollars, but I’d spent it all🎵	a23e43cb0b87d07243ed8476c1dce12c39b34ade	True	False					0	1658302222		0	{}	igw0u54	False	t3_w3dt7e	False	True	t3_w3dt7e	/r/Bitcoin/comments/w3dt7e/daily_discussion_july_20_2022/igw0u54/	1658302233	1	True	True	False	Bitcoin	t5_2s3qj	r/Bitcoin	public		0	[]		 i don t practice santeria ain t got no crystal ball i had a million dollars but i d spent it all 	0.05128944665193558	0.6778448820114136	0.3986837863922119	0.016320304945111275	0.07941288501024246	0.6081642508506775	0.1893116980791092	8.049690904954332e-07	0.2733646035194397	0.012149201706051826
52	[]	False		[deleted]						dark					[removed]	fe993932d6dced4c0a879e9aa5d7a6e0fbb467f5	True	False					0	1658302214		0	{}	igw0tqy	False	t3_w3evna	False	True	t1_igvwabv	/r/Bitcoin/comments/w3evna/china_ccp_tanks_protecting_banks_because_the_bank/igw0tqy/	1658302225	1	True	True	False	Bitcoin	t5_2s3qj	r/Bitcoin	public		0	[]		 removed 	0.46707504987716675	0.5148742198944092	0.5170193910598755	0.5029740929603577	0.4936113953590393	0.5123135447502136	0.45383262634277344	0.4847692549228668	0.4981911778450012	0.5145108103752136
53	[]	False		3699878			[]				text	t2_f7w4fxkm	False	False	Haha just some pleasure and relaxation is indeed needed though sometimes!	461bdf13829bc664555d91d83962712c2aacc562	True	False					0	1658302141		0	{}	igw0qer	False	t3_w2k8pl	False	True	t1_igs7l6h	/r/Bitcoin/comments/w2k8pl/daily_discussion_july_19_2022/igw0qer/	1658302157	1	True	True	False	Bitcoin	t5_2s3qj	r/Bitcoin	public		0	[]		haha just some pleasure and relaxation is indeed needed though sometimes 	0.5462828278541565	0.4004760980606079	0.05117287486791611	0.04975903779268265	0.44722890853881836	0.9613276124000549	0.5902987718582153	0.6090900301933289	0.40594130754470825	0.00441590603441
54	[]	False		jfitie			[]				text	t2_204q97pb	False	False	Electrum	9730e282f198e8ce159faa6647b936d7121511ad	True	False					0	1658302138		0	{}	igw0q8v	False	t3_w37oh6	False	True	t3_w37oh6	/r/Bitcoin/comments/w37oh6/whats_a_good_mobile_phone_wallet/igw0q8v/	1658302150	1	True	True	False	Bitcoin	t5_2s3qj	r/Bitcoin	public		0	[]		electrum	0.45527780055999756	0.5284785628318787	0.5102639198303223	0.4888724386692047	0.4953496754169464	0.41415730118751526	0.47550708055496216	0.4876159727573395	0.5080080628395081	0.4516560733318329
55	[]	False		recessiontime			[]				text	t2_b0q3e	False	False	"OP I'm just going to say you are talking to the wrong people and on the wrong forum (Reddit). 

Sorry to hear Europe is cucked but it is what it is. Eventually you might have to move where you are treated best."	5cf03e107d2931a9214cdd6aef304a09721e8ee2	True	False					0	1658302134		0	{}	igw0q2g	False	t3_w3brw9	False	True	t3_w3brw9	/r/Bitcoin/comments/w3brw9/kycaml_getting_out_of_hand_has_the_government_won/igw0q2g/	1658302150	1	True	True	False	Bitcoin	t5_2s3qj	r/Bitcoin	public		0	[]		op i m just going to say you are talking to the wrong people and on the wrong forum reddit sorry to hear europe is cucked but it is what it is eventually you might have to move where you are treated best 	0.037576012313365936	0.7781950235366821	0.8626179695129395	0.014702259562909603	0.043877314776182175	0.3561089038848877	0.06552314013242722	8.385798651033838e-07	0.2786852717399597	0.047592613846063614
56	[]	False		L0tt1ce			[]				text	t2_37e4ehfm	False	False	Shut the fuck up tankie shill.	dff73934a56120f357bc9351354d5cf2957ba2df	True	False					0	1658302063		0	{}	igw0msk	False	t3_w3evna	False	False	t1_igw08pw	/r/Bitcoin/comments/w3evna/china_ccp_tanks_protecting_banks_because_the_bank/igw0msk/	1658302075	1	True	False	False	Bitcoin	t5_2s3qj	r/Bitcoin	public		0	[]		shut the fuck up tankie shill 	0.2927456796169281	0.33656635880470276	0.8681851625442505	0.5856195688247681	0.3952796757221222	0.5032925009727478	0.2955736219882965	0.1485801786184311	0.36962890625	0.007193025667220354
57	[]	False		flylikelucyinthesky		noob	[{'e': 'text', 't': 'redditor for 1 week'}]	2ec8e69e-6c36-11e9-a04b-0afb553d4ea6	redditor for 1 week	dark	richtext	t2_ps434q2q	False	False	I don’t know the laws for non us citizens. Hope you find some resolve in your country	a3d2d7dd4d2833a16ae82b21ebfce5139edcfbcd	True	False					0	1658302053		0	{}	igw0md9	True	t3_w2lcbr	False	True	t1_igw093v	/r/Bitcoin/comments/w2lcbr/i_was_stupid_enough_to_lend_my_btc_to_celsius_my/igw0md9/	1658302068	1	True	True	False	Bitcoin	t5_2s3qj	r/Bitcoin	public		0	[]		i don t know the laws for non us citizens hope you find some resolve in your country	0.4329572021961212	0.4727049171924591	0.11553660035133362	0.2621001899242401	0.2495863139629364	0.40530574321746826	0.5121815800666809	1.0671450354493572e-06	0.3938480019569397	0.004486927296966314
58	[]	False		[deleted]						dark					[removed]	fe993932d6dced4c0a879e9aa5d7a6e0fbb467f5	True	False					0	1658302053		0	{}	igw0mbs	False	t3_w2sf05	False	True	t1_igvica9	/r/Bitcoin/comments/w2sf05/this_is_the_first_bitcoin_cycle_i_havent_heard_a/igw0mbs/	1658302068	1	True	True	False	Bitcoin	t5_2s3qj	r/Bitcoin	public		0	[]		 removed 	0.46707504987716675	0.5148742198944092	0.5170193910598755	0.5029740929603577	0.4936113953590393	0.5123135447502136	0.45383262634277344	0.4847692549228668	0.4981911778450012	0.5145108103752136
59	[]	False		BananaBoners			[]				text	t2_5uxuktq9	False	False	Luckily you still have those 20 moldy dicks a day 👌	9f6b99512aa17c17c664274f3fe061874a9add1e	True	False					0	1658301972		0	{}	igw0ind	True	t3_w1w63n	False	True	t1_igvd7wx	/r/Bitcoin/comments/w1w63n/rnexo_banning_and_censoring_comments_about/igw0ind/	1658301985	1	True	True	False	Bitcoin	t5_2s3qj	r/Bitcoin	public		0	[]		luckily you still have those 20 moldy dicks a day 	0.3168167471885681	0.2763311266899109	0.5423616170883179	0.1302994340658188	0.3678155243396759	0.5695884227752686	0.3614000380039215	0.26903659105300903	0.38586801290512085	0.0058499909937381744
60	[]	False		Jimbo300000			[]				text	t2_5v9asbnj	False	False	I don’t really know much about coins lol, I don’t even have my own account I asked my parents to buy it for me	784c4213871808727bd8b2bacb113c31c4df4fb3	True	False					0	1658301967		0	{}	igw0if2	True	t3_w32z4w	False	False	t1_igvwa8u	/r/Bitcoin/comments/w32z4w/i_bought_sum_bitcoin/igw0if2/	1658301979	1	True	True	False	Bitcoin	t5_2s3qj	r/Bitcoin	public		0	[]		i don t really know much about coins lol i don t even have my own account i asked my parents to buy it for me	0.011671137064695358	0.2785402238368988	0.01200081780552864	0.013007168658077717	0.050257306545972824	0.8126114010810852	0.5236634612083435	8.110210387712868e-07	0.2531163990497589	0.04932636395096779
61	[]	False		BashCo			[]				text	t2_d7sse	False	True	Maybe they do.	c55a2da2abe100cf8954c6da13bbb46f16e73908	True	False					0	1658301958		0	{}	igw0i0i	False	t3_w2qrf3	False	True	t1_igvzdz6	/r/Bitcoin/comments/w2qrf3/not_your_keys_not_your_bitcoin_celsius_lawyers/igw0i0i/	1658301971	1	True	True	False	Bitcoin	t5_2s3qj	r/Bitcoin	public		0	[]		maybe they do 	0.5170541405677795	0.428594708442688	0.5030535459518433	0.47596850991249084	0.4868229627609253	0.6349766254425049	0.41026222705841064	0.4672269821166992	0.48593834042549133	0.3322159945964813
62	[]	False		jeandupont_elefant			[]				text	t2_c6hzw8ty	False	False	"So, that worked for you.  But how does it work in 15 years time when bitcoin has become the defacto standard, as you say sound money?  Need to save up enough to buy house outright still?  

Given average house price in US to pretax household income is 8 years, that suggests that households have to save for 24 years before they can buy (assume of 100 income, 50 goes on tax and rent, 25 on living costs, 25 on saving for a house)"	b9f69aa835c1f755cf5f872475ebcd1a20e9c096	True	False					0	1658301947		0	{}	igw0hh9	False	t3_w2gutg	False	True	t1_igrqsv4	/r/Bitcoin/comments/w2gutg/theres_many_people_who_wont_buy_bitcoin_because/igw0hh9/	1658301958	1	True	True	False	Bitcoin	t5_2s3qj	r/Bitcoin	public		0	[]		so that worked for you but how does it work in 15 years time when bitcoin has become the defacto standard as you say sound money need to save up enough to buy house outright still given average house price in us to pretax household income is 8 years that suggests that households have to save for 24 years before they can buy assume of 100 income 50 goes on tax and rent 25 on living costs 25 on saving for a house 	0.0023790141567587852	0.9891015887260437	0.10246193408966064	0.16798821091651917	0.007636599708348513	0.2590099275112152	0.0932655781507492	7.314377512557257e-07	0.20749607682228088	0.05143524706363678
63	[]	False		vasyanepupkin			[]				text	t2_gsuzo0s6	False	False	celsius is just being so bad and rough on the people, we never used it tho lol.	2266fc4b3babf1652a2f75c10df15c3d901ac49f	True	False					0	1658301945		0	{}	igw0heg	False	t3_w2qrf3	False	True	t1_igsakdg	/r/Bitcoin/comments/w2qrf3/not_your_keys_not_your_bitcoin_celsius_lawyers/igw0heg/	1658301958	1	True	True	False	Bitcoin	t5_2s3qj	r/Bitcoin	public		0	[]		celsius is just being so bad and rough on the people we never used it tho lol 	0.19721607863903046	0.45143574476242065	0.6939999461174011	0.015170350670814514	0.5086283087730408	0.7235192060470581	0.11979633569717407	1.4453426047111861e-05	0.36441299319267273	0.011654773727059364
64	[]	False		Tali-ho			[]			dark	text	t2_bgrny0fy	False	True	"Why can't I claim for ""mental anguish"" caused by reading all the threads about it, and it's impact on the overall price.. Seems only fair."	79ef4a28c75f6c3b367779161a9bc17465086d2b	True	False					0	1658301942		0	{}	igw0h9n	False	t3_w2qayo	False	True	t3_w2qayo	/r/Bitcoin/comments/w2qayo/file_your_claim_against_celsius/igw0h9n/	1658301954	1	True	True	False	Bitcoin	t5_2s3qj	r/Bitcoin	public		0	[]		why can t i claim for mental anguish caused by reading all the threads about it and it s impact on the overall price seems only fair 	0.05030651390552521	0.9102067351341248	0.6793012022972107	0.02758619748055935	0.503644585609436	0.4808405637741089	0.1303585171699524	8.371574722332298e-07	0.4115109145641327	0.03212343156337738
