Unnamed: 0	all_awardings	archived	associated_award	author	author_flair_background_color	author_flair_css_class	author_flair_richtext	author_flair_template_id	author_flair_text	author_flair_text_color	author_flair_type	author_fullname	author_patreon_flair	author_premium	body	body_sha1	can_gild	collapsed	collapsed_because_crowd_control	collapsed_reason	collapsed_reason_code	comment_type	controversiality	created_utc	distinguished	gilded	gildings	id	is_submitter	link_id	locked	no_follow	parent_id	permalink	retrieved_utc	score	score_hidden	send_replies	stickied	subreddit	subreddit_id	subreddit_name_prefixed	subreddit_type	top_awarded_type	total_awards_received	treatment_tags	unrepliable_reason	corpus	support	knowledge	conflict	power	similarity	fun	status	trust	identity	romance
87	[]	False		abk2090			[]				text	t2_ep29b0qu	False	False	Lol what the fuck are they targeting? They need to understand the importance of BTC but nah they are not getting it which is just something shitty to see right now.	20d7025f71df09b67a20fd3d5c169a61933ed968	True	False					0	1664508078		0	{}	iqgemtk	False	t3_xr3ipd	False	True	t3_xr3ipd	/r/Bitcoin/comments/xr3ipd/in_2021_bank_of_england_warned_that_bitcoin_could/iqgemtk/	1664508090	1	True	True	False	Bitcoin	t5_2s3qj	r/Bitcoin	public		0	[]		lol what the fuck are they targeting they need to understand the importance of btc but nah they are not getting it which is just something shitty to see right now 	0.02294941432774067	0.5428116321563721	0.9676247835159302	0.010941475629806519	0.01785617135465145	0.5434699058532715	0.051004309207201004	8.488249250149238e-07	0.43725839257240295	0.016681253910064697
88	[]	False		ejjVAL			[]				text	t2_g1r4qmtm	False	False	Doesn’t matter if it’s custodial. Adoption is adoption. Let’s go!	9111a7ba56d7c73b0ec074885b3a98975897cd94	True	False					0	1664508058		0	{}	iqgela4	False	t3_xrdb4m	False	True	t3_xrdb4m	/r/Bitcoin/comments/xrdb4m/omg_bitcoin_apple/iqgela4/	1664508075	1	True	True	False	Bitcoin	t5_2s3qj	r/Bitcoin	public		0	[]		doesn t matter if it s custodial adoption is adoption let s go 	0.28498777747154236	0.7273914217948914	0.2885853052139282	0.7685562968254089	0.4527270197868347	0.4488505721092224	0.22189955413341522	1.3317586535777082e-06	0.43168359994888306	0.002483161399140954
89	[]	False		Secure-Rich3501		noob	[{'e': 'text', 't': 'redditor for 2 days'}]	2ec8e69e-6c36-11e9-a04b-0afb553d4ea6	redditor for 2 days	dark	richtext	t2_q8ctudsb	False	False	Because he looks like ET	a42e4ddf95da6d5196de99e4e07e6bc5f1c5db42	True	False					0	1664508043		0	{}	iqgek4y	False	t3_xriint	False	True	t1_iqez8mg	/r/Bitcoin/comments/xriint/art_collage_of_the_biggest_more_negative/iqgek4y/	1664508059	1	True	True	False	Bitcoin	t5_2s3qj	r/Bitcoin	public		0	[]		because he looks like et	0.4431047737598419	0.4644736647605896	0.5195117592811584	0.3951692283153534	0.5708614587783813	0.556840181350708	0.3814009726047516	0.5171297788619995	0.4982888996601105	0.5760115385055542
90	[]	False		Aishamar			[]				text	t2_dkqnjlja	False	False	Is that what I think it is?	eb0c744c5fd906faaab062df99cc2232b7d39da2	True	False					0	1664508040		0	{}	iqgejz1	False	t3_xr6z9k	False	True	t3_xr6z9k	/r/Bitcoin/comments/xr6z9k/bank_of_england_in_big_trouble_the_purchases_will/iqgejz1/	1664508060	1	True	True	False	Bitcoin	t5_2s3qj	r/Bitcoin	public		0	[]		is that what i think it is 	0.4623343348503113	0.4369051158428192	0.45936644077301025	0.3822456896305084	0.5182711482048035	0.5580902695655823	0.3253523111343384	0.5905203819274902	0.5512418746948242	0.11244459450244904
91	[]	False		SuperSan93			[]				text	t2_5ptkv8hj	False	False	I’ve tried a few. Muun wallet has been the most suitable for myself.	3cdaebf31135a5a6455845038731e163998cb192	True	False					0	1664508034		0	{}	iqgejhk	False	t3_xrns93	False	True	t3_xrns93	/r/Bitcoin/comments/xrns93/whats_the_very_best_bitcoin_lightning_wallet/iqgejhk/	1664508051	1	True	True	False	Bitcoin	t5_2s3qj	r/Bitcoin	public		0	[]		i ve tried a few muun wallet has been the most suitable for myself 	0.33234861493110657	0.5080176591873169	0.07529041171073914	0.1355258673429489	0.3667447865009308	0.5953722596168518	0.40928664803504944	0.7861791849136353	0.40755483508110046	0.13457506895065308
92	[]	False		mrASSMAN			[]				text	t2_322c2	False	False	It is imploding.	4228ee7300e18c4ca68c8ddabcdd0f858d74ec57	True	False					0	1664508029		0	{}	iqgej0t	False	t3_xrdven	False	True	t1_iqg479t	/r/Bitcoin/comments/xrdven/pound_imploding_uk_bitcoin_volume_exploding/iqgej0t/	1664508044	1	True	True	False	Bitcoin	t5_2s3qj	r/Bitcoin	public		0	[]		it is imploding 	0.4742504358291626	0.500318706035614	0.546990156173706	0.5251883864402771	0.500027596950531	0.5205124020576477	0.38927894830703735	0.5125718116760254	0.5412346720695496	0.38491091132164
93	[]	False		Secure-Rich3501		noob	[{'e': 'text', 't': 'redditor for 2 days'}]	2ec8e69e-6c36-11e9-a04b-0afb553d4ea6	redditor for 2 days	dark	richtext	t2_q8ctudsb	False	False	Craig Wright fake?  It is looking like his court appearances are demonstrating He is Satoshi	5b8f68b93d9a7b7c221a92e573129fc2ef4468a4	True	False					0	1664508025		0	{}	iqgeirk	False	t3_xriint	False	True	t3_xriint	/r/Bitcoin/comments/xriint/art_collage_of_the_biggest_more_negative/iqgeirk/	1664508036	1	True	True	False	Bitcoin	t5_2s3qj	r/Bitcoin	public		0	[]		craig wright fake it is looking like his court appearances are demonstrating he is satoshi	0.02891385182738304	0.4162789285182953	0.6144077181816101	0.027560779824852943	0.3795393109321594	0.12443283945322037	0.18763121962547302	4.414315480971709e-05	0.4561334550380707	5.542789585888386e-05
94	[]	False		sailhard22			[]				text	t2_2ng8fww	False	False	Most people will realize when it’s too late. Our curse is that we realized too early 😆	00003ba97e24d440990815986791a800e38c39e2	True	False					0	1664507995		0	{}	iqgegiq	False	t3_xrdven	False	True	t3_xrdven	/r/Bitcoin/comments/xrdven/pound_imploding_uk_bitcoin_volume_exploding/iqgegiq/	1664508013	1	True	True	False	Bitcoin	t5_2s3qj	r/Bitcoin	public		0	[]		most people will realize when it s too late our curse is that we realized too early 	0.22556890547275543	0.6204862594604492	0.27710792422294617	0.19800451397895813	0.585387110710144	0.6335743069648743	0.17690244317054749	0.5657749176025391	0.42202305793762207	0.00664124172180891
95	[]	False		ok46reddit			[]			dark	text	t2_cdvd3qao	False	False	Oil.	2bb98f1c8a043f415656bf8f61a25fb520b0199e	True	False					0	1664507988		0	{}	iqgefyg	False	t3_xqsbfk	False	True	t1_iqgcw0l	/r/Bitcoin/comments/xqsbfk/what_happens_to_bitcoin_in_an_event_of_internet/iqgefyg/	1664508006	1	True	True	False	Bitcoin	t5_2s3qj	r/Bitcoin	public		0	[]		oil 	0.4682089686393738	0.5351271033287048	0.5114153027534485	0.5360755920410156	0.48718926310539246	0.4444163739681244	0.45239776372909546	0.4855404198169708	0.49697864055633545	0.5374683141708374
96	[]	False		mrASSMAN			[]				text	t2_322c2	False	False	I guess that explains all the bullish support it’s gotten lately	200da03370956a32a5e77423345eb0caa0aa0c05	True	False					0	1664507977		0	{}	iqgef5n	False	t3_xrdven	False	True	t3_xrdven	/r/Bitcoin/comments/xrdven/pound_imploding_uk_bitcoin_volume_exploding/iqgef5n/	1664507990	1	True	True	False	Bitcoin	t5_2s3qj	r/Bitcoin	public		0	[]		i guess that explains all the bullish support it s gotten lately	0.3614545166492462	0.4673939347267151	0.32701823115348816	0.21974483132362366	0.6241025328636169	0.5340573787689209	0.37541916966438293	0.6339885592460632	0.3916533291339874	0.0022925592493265867
97	[]	False		GildedSilverBitcoins			[]			dark	text	t2_g9029x9r	False	False	"Ironic that the pension funds were literally bailed out by the chancellor. 

Genesis Block 2: Satoshi Boogaloo"	765bd4104afb0cc830d2d222af4de7328dc0e678	True	False					0	1664507937		0	{}	iqgeca8	False	t3_xrdven	False	True	t3_xrdven	/r/Bitcoin/comments/xrdven/pound_imploding_uk_bitcoin_volume_exploding/iqgeca8/	1664507952	1	True	True	False	Bitcoin	t5_2s3qj	r/Bitcoin	public		0	[]		ironic that the pension funds were literally bailed out by the chancellor genesis block 2 satoshi boogaloo	0.06070483475923538	0.7397778034210205	0.599170982837677	0.22149991989135742	0.5750094652175903	0.38888654112815857	0.21679933369159698	1.225928713211033e-06	0.43432825803756714	0.0010315508116036654
98	[]	False		Beginning_Mix1160			[]				text	t2_a0gnfgnz	False	False	Shakepay baby	a3610a67fdb0d1b9e63ce5d2019b09264391bfd6	True	False					0	1664507855		0	{}	iqge6bz	False	t3_xrmvvo	False	True	t3_xrmvvo	/r/Bitcoin/comments/xrmvvo/it_feels_like_bitcoin_is_an_an_accumulation_stage/iqge6bz/	1664507866	1	True	True	False	Bitcoin	t5_2s3qj	r/Bitcoin	public		0	[]		shakepay baby	0.48044872283935547	0.5084679126739502	0.42474550008773804	0.45569369196891785	0.47925305366516113	0.5250861048698425	0.4987199902534485	0.4749082326889038	0.463184118270874	0.6675047278404236
99	[]	False		PopularDrumming			[]				text	t2_na6gwm7g	False	False	Estonia is pretty into tech. Saw little robots everywhere in Talinn delivering food recently. Tiny population though	4bd89f806054df8a915171e9e4eed0c9b38738b1	True	False					0	1664507844		0	{}	iqge5iq	False	t3_xl5jon	False	True	t3_xl5jon	/r/Bitcoin/comments/xl5jon/estonia_approves_first_bitcoin_crypto_bank_after/iqge5iq/	1664507859	1	True	True	False	Bitcoin	t5_2s3qj	r/Bitcoin	public		0	[]		estonia is pretty into tech saw little robots everywhere in talinn delivering food recently tiny population though	0.18597036600112915	0.8745486736297607	0.2624955177307129	0.04113924130797386	0.5443471670150757	0.35064661502838135	0.25153449177742004	0.12243957817554474	0.4969826638698578	0.0020097175147384405
100	[]	False		yolomobile			[]				text	t2_b0mra	False	False	I use the Coinbase 4% back debit card (Bitcoin) to pay my Citibank double cash 2% back credit card statement, pretty sure it’s a loophole because you have to call the automated line at citi to be able to pay the statement with a debit card, but it works. Haven’t been saving shit in this environment but it feels really nice accumulating ~$60-80 in bitcoin every month	7ed380dccaff59284b037e576c5f5b7383e0be8b	True	False					0	1664507841		0	{}	iqge5c0	False	t3_xrmvvo	False	True	t3_xrmvvo	/r/Bitcoin/comments/xrmvvo/it_feels_like_bitcoin_is_an_an_accumulation_stage/iqge5c0/	1664507859	1	True	True	False	Bitcoin	t5_2s3qj	r/Bitcoin	public		0	[]		i use the coinbase 4 back debit card bitcoin to pay my citibank double cash 2 back credit card statement pretty sure it s a loophole because you have to call the automated line at citi to be able to pay the statement with a debit card but it works haven t been saving shit in this environment but it feels really nice accumulating 60 80 in bitcoin every month	0.0023349772673100233	0.9888443350791931	0.2945553660392761	0.010984793305397034	0.007503933273255825	0.513417661190033	0.10450231283903122	8.528682542419119e-07	0.2586611807346344	0.009193059988319874
101	[]	False		[deleted]						dark					[removed]	fe993932d6dced4c0a879e9aa5d7a6e0fbb467f5	True	False					0	1664507814		0	{}	iqge3ct	False	t3_xln00j	False	True	t3_xln00j	/r/Bitcoin/comments/xln00j/estonia_approves_first_bitcoin_crypto_bank_after/iqge3ct/	1664507828	1	True	True	False	Bitcoin	t5_2s3qj	r/Bitcoin	public		0	[]		 removed 	0.46707504987716675	0.5148742198944092	0.5170193910598755	0.5029740929603577	0.4936113953590393	0.5123135447502136	0.45383262634277344	0.4847692549228668	0.4981911778450012	0.5145108103752136
102	[]	False		1fastdak			[]				text	t2_4em8r	False	False	As a long time holder, I'm  sorry to say this but short term price fluctuations mean nothing.  We could hold here for months and then fall by 50% before bouncing to 30K. Could be straight up manipulation could be actual buy and hold accumulation fucking up the bears. Its not possible to know but im still feeling pretty confident long term.	54b8183cc53a62f44b63540061c9a64187749aef	True	False					0	1664507770		0	{}	iqge08b	False	t3_xrezks	False	True	t3_xrezks	/r/Bitcoin/comments/xrezks/will_btc_start_outperforming_the_stock_market/iqge08b/	1664507781	1	True	True	False	Bitcoin	t5_2s3qj	r/Bitcoin	public		0	[]		as a long time holder i m sorry to say this but short term price fluctuations mean nothing we could hold here for months and then fall by 50 before bouncing to 30k could be straight up manipulation could be actual buy and hold accumulation fucking up the bears its not possible to know but im still feeling pretty confident long term 	0.004471734631806612	0.9873217940330505	0.7950806617736816	0.015349161811172962	0.00891551561653614	0.46662256121635437	0.08039433509111404	8.449400752397196e-07	0.24553698301315308	0.03190525248646736
103	[]	False		GeneralWarcraft		noob	[{'e': 'text', 't': 'redditor for 4 days'}]	2ec8e69e-6c36-11e9-a04b-0afb553d4ea6	redditor for 4 days	dark	richtext	t2_ssq3yor8	False	False	Bitcoin doesn't have gas fees.	952309b94a7a5fdc9c136c79e4bc1283c77844b4	True	False					0	1664507706		0	{}	iqgdvst	False	t3_xrns93	False	True	t3_xrns93	/r/Bitcoin/comments/xrns93/whats_the_very_best_bitcoin_lightning_wallet/iqgdvst/	1664507720	1	True	True	False	Bitcoin	t5_2s3qj	r/Bitcoin	public		0	[]		bitcoin doesn t have gas fees 	0.42790356278419495	0.5965535044670105	0.49294981360435486	0.5126367211341858	0.4143475592136383	0.45660170912742615	0.3771539032459259	0.4362684488296509	0.45201459527015686	0.023415457457304
104	[]	False		bitmegalomaniac			[]				text	t2_oyf55	False	False	"Your rules dude, I asked the question first, you have yet to answer.

Don't like it?  Ummm, perhaps you change the rules.  You made em."	6c59ae9da89453e28198dea2c0321974af7424f1	True	False					0	1664507701		0	{}	iqgdved	False	t3_xqg8yr	False	True	t1_iqg9u95	/r/Bitcoin/comments/xqg8yr/hello_taro_building_the_taproot_of_the_worlds/iqgdved/	1664507712	1	True	True	False	Bitcoin	t5_2s3qj	r/Bitcoin	public		0	[]		your rules dude i asked the question first you have yet to answer don t like it ummm perhaps you change the rules you made em 	0.009507632814347744	0.42914679646492004	0.4871394634246826	0.36642834544181824	0.015455055050551891	0.6528220772743225	0.22579416632652283	5.927091478952207e-05	0.31103262305259705	0.009482174180448055
105	[]	False		CrypoFiend			[]			dark	text	t2_e7z7annz	False	False	I am assuming it is a custodial wallet.	d33d8caa02304c81b5b2ec5704505d0e3aa11748	True	False					0	1664507688		0	{}	iqgdufm	False	t3_xrdb4m	False	True	t3_xrdb4m	/r/Bitcoin/comments/xrdb4m/omg_bitcoin_apple/iqgdufm/	1664507705	1	True	True	False	Bitcoin	t5_2s3qj	r/Bitcoin	public		0	[]		i am assuming it is a custodial wallet 	0.4160654842853546	0.48387008905410767	0.40870723128318787	0.45775505900382996	0.4617413282394409	0.35514846444129944	0.42924386262893677	0.4810630977153778	0.48779043555259705	0.24239905178546906
106	[]	False		cchamberpot			[]				text	t2_gcktkm48	False	False	I'm waiting for a big green candle, c'mon btc do that now please.	a30c22baadfd5e10a1ddf5a79c260d438aac047b	True	False					0	1664507677		0	{}	iqgdtkq	False	t3_xqyxxs	False	True	t1_iqecert	/r/Bitcoin/comments/xqyxxs/daily_discussion_september_29_2022/iqgdtkq/	1664507690	1	True	True	False	Bitcoin	t5_2s3qj	r/Bitcoin	public		0	[]		i m waiting for a big green candle c mon btc do that now please 	0.5539084672927856	0.41976889967918396	0.19207368791103363	0.09833668172359467	0.3081505596637726	0.49620407819747925	0.4125058352947235	0.8773192167282104	0.3499758839607239	0.004055077210068703
107	[]	False		Last-Associate-9471			[]				text	t2_9g1kjecz	False	False	Provide a good or service in exchange.	74ea2bbafefb2269010b63d961ba6a04121b0924	True	False					0	1664507638		0	{}	iqgdqtn	False	t3_xrmvvo	False	True	t3_xrmvvo	/r/Bitcoin/comments/xrmvvo/it_feels_like_bitcoin_is_an_an_accumulation_stage/iqgdqtn/	1664507651	1	True	True	False	Bitcoin	t5_2s3qj	r/Bitcoin	public		0	[]		provide a good or service in exchange 	0.6121906638145447	0.6117697954177856	0.17648661136627197	0.478619784116745	0.46207451820373535	0.3561396300792694	0.4312242567539215	0.5083678960800171	0.46667250990867615	0.28828251361846924
108	[]	False		staycurrent11			[]				text	t2_hr2l3wm6	False	False	Yeah you win, He's going to win it boys. This will be the shit here.	719b65ca4cd4f010d4a2c473dc1c78b5cf3f76a9	True	False					0	1664507628		0	{}	iqgdq3v	False	t3_xqyxxs	False	True	t1_iqfqt4w	/r/Bitcoin/comments/xqyxxs/daily_discussion_september_29_2022/iqgdq3v/	1664507643	1	True	True	False	Bitcoin	t5_2s3qj	r/Bitcoin	public		0	[]		yeah you win he s going to win it boys this will be the shit here 	0.476256787776947	0.23333801329135895	0.6854223012924194	0.05166683718562126	0.4904855787754059	0.6842049360275269	0.14294759929180145	0.0008021864341571927	0.21754693984985352	0.009318100288510323
109	[]	False		CrypoFiend			[]			dark	text	t2_e7z7annz	False	False	User is  Spamming Anti-Bitcoin posts everywhere .	eaf533da5bf0712270ac56f57c3e6af6427b29f4	True	False					0	1664507585		0	{}	iqgdn5y	False	t3_xrg6u6	False	True	t3_xrg6u6	/r/Bitcoin/comments/xrg6u6/between_2016_and_2021_the_carbon_emissions/iqgdn5y/	1664507604	1	True	True	False	Bitcoin	t5_2s3qj	r/Bitcoin	public		0	[]		user is spamming anti bitcoin posts everywhere 	0.16732822358608246	0.6523134708404541	0.8244765400886536	0.4199455976486206	0.4135937988758087	0.5745651125907898	0.4179297089576721	0.5747512578964233	0.4444226920604706	0.003288473468273878
110	[]	False		nueve			[]				text	t2_53llo	False	False	Fold card. Ask me for my referral code if you wanna signup. https://foldapp.com/	5510c0b34cc2846b19dea735fb726c24ef7ead1a	True	False					0	1664507550		0	{}	iqgdkjg	False	t3_xrmvvo	False	True	t3_xrmvvo	/r/Bitcoin/comments/xrmvvo/it_feels_like_bitcoin_is_an_an_accumulation_stage/iqgdkjg/	1664507565	1	True	True	False	Bitcoin	t5_2s3qj	r/Bitcoin	public		0	[]		fold card ask me for my referral code if you wanna signup https foldapp com 	0.2934504747390747	0.4589482247829437	0.12194035947322845	0.6239134669303894	0.1255040168762207	0.21762467920780182	0.4484255909919739	0.6009607911109924	0.3419767916202545	0.000693094334565103
111	[]	False		dylan6091			[]				text	t2_unid5s6	False	False	"All I hear is ""give me power, I need power."""	dff0f7f3fe8066608b30ee4b5eb6b875ce55b9b7	True	False					0	1664507509		0	{}	iqgdhkn	False	t3_xrevv0	False	True	t1_iqemsu3	/r/Bitcoin/comments/xrevv0/bitcoin_could_double_in_price_says_us_regulator/iqgdhkn/	1664507526	1	True	True	False	Bitcoin	t5_2s3qj	r/Bitcoin	public		0	[]		all i hear is give me power i need power 	0.49209120869636536	0.3276326656341553	0.24280275404453278	0.21591685712337494	0.45352181792259216	0.4515824317932129	0.6428321003913879	0.6975346207618713	0.3315493166446686	0.024012383073568344
112	[]	False		dinosaurasteroid		noob	[{'e': 'text', 't': 'redditor for 1 week'}]	2ec8e69e-6c36-11e9-a04b-0afb553d4ea6	redditor for 1 week	dark	richtext	t2_sjc53aup	False	False	You have to call the customer support line. And hodl.	dd3f5ed093c962df0e8be15ffbb54e3a45a2787d	True	False					0	1664507495		0	{}	iqgdgiy	False	t3_xre9wy	False	True	t3_xre9wy	/r/Bitcoin/comments/xre9wy/how_does_btc_handle_people_losing_it/iqgdgiy/	1664507511	1	True	True	False	Bitcoin	t5_2s3qj	r/Bitcoin	public		0	[]		you have to call the customer support line and hodl 	0.475271999835968	0.6153075695037842	0.2860196828842163	0.7831974029541016	0.23623546957969666	0.012849031016230583	0.4620925486087799	0.2862541377544403	0.3744770586490631	0.00027817441150546074
113	[]	False		Nauty313			[]				text	t2_ghj2dz9c	False	False	"Well there are less users on the IOS that's why the numbers are low.

That's the reason for it, however low numbers don't mean that the application isn't good."	d8467b13877913b36dcbee09eb3b01c54b122f2f	True	False					0	1664507471		0	{}	iqgdew1	False	t3_xqyxxs	False	True	t1_iqd0ie0	/r/Bitcoin/comments/xqyxxs/daily_discussion_september_29_2022/iqgdew1/	1664507489	1	True	True	False	Bitcoin	t5_2s3qj	r/Bitcoin	public		0	[]		well there are less users on the ios that s why the numbers are low that s the reason for it however low numbers don t mean that the application isn t good 	0.010385310277342796	0.9866988658905029	0.44163650274276733	0.027905456721782684	0.6565532088279724	0.7497720718383789	0.08398919552564621	8.543294711671479e-07	0.41754165291786194	0.0028006527572870255
114	[]	False		PLUNDERAAR			[]				text	t2_emddgtjq	False	False	It's done you bankers, you guys have fucked it enough already.	ee315baac6fa4cc75570d8c234239cc2f13d7dbb	True	False					0	1664507465		0	{}	iqgdef6	False	t3_xqyxxs	False	False	t1_iqcojvi	/r/Bitcoin/comments/xqyxxs/daily_discussion_september_29_2022/iqgdef6/	1664507481	1	True	True	False	Bitcoin	t5_2s3qj	r/Bitcoin	public		0	[]		it s done you bankers you guys have fucked it enough already 	0.4240463078022003	0.2100478708744049	0.5824166536331177	0.39611926674842834	0.41275349259376526	0.6308797001838684	0.32159683108329773	0.016614893451333046	0.35034841299057007	0.004941449500620365
115	[]	False		CrypoFiend			[]			dark	text	t2_e7z7annz	False	False	They have some pretty good stock picks, except they advise it is always a good time to buy.	0a2d781250eefe45d179b9dcb3a27acf81a7e2bd	True	False					0	1664507384		0	{}	iqgd8jx	False	t3_xrey58	False	True	t1_iqeoy0u	/r/Bitcoin/comments/xrey58/just_how_outrageous_is_a_500000_price_target_for/iqgd8jx/	1664507396	1	True	True	False	Bitcoin	t5_2s3qj	r/Bitcoin	public		0	[]		they have some pretty good stock picks except they advise it is always a good time to buy 	0.6479383707046509	0.6261988878250122	0.03756910562515259	0.045914292335510254	0.5331557393074036	0.5000180602073669	0.22878238558769226	0.9098110795021057	0.3571835160255432	0.003752474905923009
116	[]	False		sgtslaughterTV			[]				text	t2_1lpw021l	False	False	https://1ml.com/ - but this says there is only a little more than 4,900 BTC locked.	e64be3237ab4628db4900d649ed90f012f050bfd	True	False					0	1664507373		0	{}	iqgd7mu	False	t3_xriovn	False	True	t3_xriovn	/r/Bitcoin/comments/xriovn/lightning_slowly_reached_5k_btc_locked_amount/iqgd7mu/	1664507388	1	True	True	False	Bitcoin	t5_2s3qj	r/Bitcoin	public		0	[]		https 1ml com but this says there is only a little more than 4 900 btc locked 	0.10623767971992493	0.9149104356765747	0.31676027178764343	0.24953143298625946	0.32048556208610535	0.3348970413208008	0.14427414536476135	1.1662760925901239e-06	0.41722121834754944	0.0013265111483633518
117	[]	False		theekman			[]				text	t2_f2u8s	False	False	The point of bitcoin is so ppl wont just get shit for free… buy it or mine it.	7bb87b052f26d7a6b86b36b14561a2df5bde9bb9	True	False					0	1664507359		0	{}	iqgd6lk	False	t3_xrmvvo	False	True	t3_xrmvvo	/r/Bitcoin/comments/xrmvvo/it_feels_like_bitcoin_is_an_an_accumulation_stage/iqgd6lk/	1664507373	1	True	True	False	Bitcoin	t5_2s3qj	r/Bitcoin	public		0	[]		the point of bitcoin is so ppl wont just get shit for free buy it or mine it 	0.11531999707221985	0.4926961362361908	0.9239205121994019	0.035303015261888504	0.1654329001903534	0.500744640827179	0.07424066215753555	0.0026894034817814827	0.2790639102458954	0.004827652592211962
118	[]	False		EgonHorsePuncher			[]				text	t2_6dma55mj	False	False	In 5 years time the current price will look super cheap by comparison. Unless of course something unprecedented disrupts BTC. Something that would require many nations to get involved in.	5044eac3deee0f589c5e4529a0002d886795a818	True	False					0	1664507357		0	{}	iqgd6ft	False	t3_xrmipv	False	True	t1_iqg020o	/r/Bitcoin/comments/xrmipv/a_friend_is_decided_that_bitcoin_will_drop_to_500/iqgd6ft/	1664507373	1	True	True	False	Bitcoin	t5_2s3qj	r/Bitcoin	public		0	[]		in 5 years time the current price will look super cheap by comparison unless of course something unprecedented disrupts btc something that would require many nations to get involved in 	0.011542019434273243	0.9855108261108398	0.42345282435417175	0.8687070608139038	0.5825092196464539	0.4331676959991455	0.09535586833953857	2.4302521524077747e-06	0.4705331325531006	0.006139660254120827
119	[]	False		[deleted]						dark					[removed]	fe993932d6dced4c0a879e9aa5d7a6e0fbb467f5	True	False					0	1664507258		0	{}	iqgczbk	False	t3_xqyxxs	False	True	t1_iqgcngd	/r/Bitcoin/comments/xqyxxs/daily_discussion_september_29_2022/iqgczbk/	1664507271	1	True	True	False	Bitcoin	t5_2s3qj	r/Bitcoin	public		0	[]		 removed 	0.46707504987716675	0.5148742198944092	0.5170193910598755	0.5029740929603577	0.4936113953590393	0.5123135447502136	0.45383262634277344	0.4847692549228668	0.4981911778450012	0.5145108103752136
120	[]	False		CrypoFiend			[]			dark	text	t2_e7z7annz	False	False	No you went on a anti left/anti school rant and that is what he was complaining about. Read your reply bro.	db1d9e5f5e9458c7fdf49ef0d34455bf7ef0b921	True	False					0	1664507224		0	{}	iqgcwv3	False	t3_xrfqxh	False	True	t1_iqf5702	/r/Bitcoin/comments/xrfqxh/technology_university_of_new_mexico_researchers/iqgcwv3/	1664507241	1	True	True	False	Bitcoin	t5_2s3qj	r/Bitcoin	public		0	[]		no you went on a anti left anti school rant and that is what he was complaining about read your reply bro 	0.00936115998774767	0.32522904872894287	0.9689075946807861	0.4047420918941498	0.2626284062862396	0.693794310092926	0.09610692411661148	8.373739319722517e-07	0.23528772592544556	0.006985281128436327
121	[]	False		sean488			[]				text	t2_7v02l	False	False	"It also has zero value where there is no market for it.

Just like anything else.

But what has had and will continue to have the largest market, in your lifetime?"	77a8cdab885e7ba5826c7c550a6eb6b3e2b803ff	True	False					0	1664507213		0	{}	iqgcw0l	False	t3_xqsbfk	False	True	t1_iqg7qeh	/r/Bitcoin/comments/xqsbfk/what_happens_to_bitcoin_in_an_event_of_internet/iqgcw0l/	1664507225	1	True	True	False	Bitcoin	t5_2s3qj	r/Bitcoin	public		0	[]		it also has zero value where there is no market for it just like anything else but what has had and will continue to have the largest market in your lifetime 	0.023897936567664146	0.9864358305931091	0.39755311608314514	0.5986613631248474	0.7051866054534912	0.39132416248321533	0.0818653330206871	8.70667918206891e-07	0.3320062458515167	0.029764244332909584
