Unnamed: 0	all_awardings	allow_live_comments	author	author_flair_css_class	author_flair_richtext	author_flair_template_id	author_flair_text	author_flair_text_color	author_flair_type	author_fullname	author_is_blocked	author_patreon_flair	author_premium	awarders	can_mod_post	contest_mode	created_utc	domain	full_link	gildings	id	is_created_from_ads_ui	is_crosspostable	is_meta	is_original_content	is_reddit_media_domain	is_robot_indexable	is_self	is_video	link_flair_background_color	link_flair_richtext	link_flair_text_color	link_flair_type	locked	media_only	no_follow	num_comments	num_crossposts	over_18	parent_whitelist_status	permalink	pinned	pwls	retrieved_on	score	selftext	send_replies	spoiler	stickied	subreddit	subreddit_id	subreddit_subscribers	subreddit_type	thumbnail	title	total_awards_received	treatment_tags	upvote_ratio	url	whitelist_status	wls	media	media_embed	post_hint	preview	removed_by_category	secure_media	secure_media_embed	thumbnail_height	thumbnail_width	url_overridden_by_dest	link_flair_text	author_flair_background_color	media_metadata	distinguished	suggested_sort	gallery_data	is_gallery	concated	corpus	support	knowledge	conflict	power	similarity	fun	status	trust	identity	romance
0	[]	False	NoShip7475	noob	[{'e': 'text', 't': 'redditor for 3 months'}]	2ec8e69e-6c36-11e9-a04b-0afb553d4ea6	redditor for 3 months	dark	richtext	t2_etpwak36	False	False	False	[]	False	False	1642305125	self.Bitcoin	https://www.reddit.com/r/Bitcoin/comments/s52rsq/safe_public_address/	{}	s52rsq	False	True	False	False	False	True	True	False		[]	dark	text	False	False	True	0	0	False	all_ads	/r/Bitcoin/comments/s52rsq/safe_public_address/	False	6	1642305135	1	"A kid in my neighborhood wants to start doing ""compliance cuts"" for people who, for whatever reason, cannot cut their grass and aren't in a financial position to deal with the fallout. He wants to make a sign with Venmo / PayPal and CashApp QR codes so people can donate so that he can keep affording to do it. He wants to take Bitcoin too but I told him you shouldn't reuse an address with Bitcoin.

I don't really do more than buy and HODL, how can I get this kid set up safely to accept donations?"	True	False	False	Bitcoin	t5_2s3qj	3791841	public	self	Safe public address?	0	[]	1.0	https://www.reddit.com/r/Bitcoin/comments/s52rsq/safe_public_address/	all_ads	6																		"Safe public address?
A kid in my neighborhood wants to start doing ""compliance cuts"" for people who, for whatever reason, cannot cut their grass and aren't in a financial position to deal with the fallout. He wants to make a sign with Venmo / PayPal and CashApp QR codes so people can donate so that he can keep affording to do it. He wants to take Bitcoin too but I told him you shouldn't reuse an address with Bitcoin.

I don't really do more than buy and HODL, how can I get this kid set up safely to accept donations?"	safe public address a kid in my neighborhood wants to start doing compliance cuts for people who for whatever reason cannot cut their grass and aren t in a financial position to deal with the fallout he wants to make a sign with venmo paypal and cashapp qr codes so people can donate so that he can keep affording to do it he wants to take bitcoin too but i told him you shouldn t reuse an address with bitcoin i don t really do more than buy and hodl how can i get this kid set up safely to accept donations 	0.41529932618141174	0.9888517260551453	0.05965011566877365	0.9512766599655151	0.007948214188218117	0.6319819688796997	0.08970239758491516	8.420313406531932e-07	0.17135365307331085	0.030504625290632248
1	[]	False	Glittering_Soil_427		[]				text	t2_ikcwsxdv	False	False	False	[]	False	False	1642304755	youtu.be	https://www.reddit.com/r/Bitcoin/comments/s52ner/sec_securities_and_exchange_commission_files_suit/	{}	s52ner	False	False	False	False	False	False	False	False		[]	dark	text	False	False	True	0	0	False	all_ads	/r/Bitcoin/comments/s52ner/sec_securities_and_exchange_commission_files_suit/	False	6	1642304765	1		True	False	False	Bitcoin	t5_2s3qj	3791824	public	https://b.thumbs.redditmedia.com/naiG7H6HlgZCm794YE6cL8E5nwXMQObVnVrHC_BfbmI.jpg	SEC (Securities and Exchange Commission) Files Suit Against Marvin Capital and Citadel/ AMC Stock	0	[]	1.0	https://youtu.be/mGtIUTlnA5w	all_ads	6	"{'oembed': {'author_name': 'Banking With Billy', 'author_url': 'https://www.youtube.com/channel/UC0e9BHD57bqGHsLpdfYUVYA', 'height': 200, 'html': '&lt;iframe width=""356"" height=""200"" src=""https://www.youtube.com/embed/mGtIUTlnA5w?feature=oembed&amp;enablejsapi=1"" frameborder=""0"" allow=""accelerometer; autoplay; clipboard-write; encrypted-media; gyroscope; picture-in-picture"" allowfullscreen&gt;&lt;/iframe&gt;', 'provider_name': 'YouTube', 'provider_url': 'https://www.youtube.com/', 'thumbnail_height': 360, 'thumbnail_url': 'https://i.ytimg.com/vi/mGtIUTlnA5w/hqdefault.jpg', 'thumbnail_width': 480, 'title': 'SEC (Securities and Exchange Commission) Files Suit Against Marvin Capital and Citadel/ AMC Stock', 'type': 'video', 'version': '1.0', 'width': 356}, 'type': 'youtube.com'}"	"{'content': '&lt;iframe width=""356"" height=""200"" src=""https://www.youtube.com/embed/mGtIUTlnA5w?feature=oembed&amp;enablejsapi=1"" frameborder=""0"" allow=""accelerometer; autoplay; clipboard-write; encrypted-media; gyroscope; picture-in-picture"" allowfullscreen&gt;&lt;/iframe&gt;', 'height': 200, 'scrolling': False, 'width': 356}"	rich:video	{'enabled': False, 'images': [{'id': 'G8mMzeQnShHVxYs8NFz9ue0TjGDpDIvFRPdWS1ITIUs', 'resolutions': [{'height': 81, 'url': 'https://external-preview.redd.it/jDtfcFJyBM0PVuzMtalj-mQWYflIKjtQU7qrergSsu0.jpg?width=108&amp;crop=smart&amp;auto=webp&amp;s=adc17170d795429255a3726cc7e8bd6effa472db', 'width': 108}, {'height': 162, 'url': 'https://external-preview.redd.it/jDtfcFJyBM0PVuzMtalj-mQWYflIKjtQU7qrergSsu0.jpg?width=216&amp;crop=smart&amp;auto=webp&amp;s=e459a3463bb395cb09ff560fdb2a8ec9ba4d8018', 'width': 216}, {'height': 240, 'url': 'https://external-preview.redd.it/jDtfcFJyBM0PVuzMtalj-mQWYflIKjtQU7qrergSsu0.jpg?width=320&amp;crop=smart&amp;auto=webp&amp;s=498682f578939abcbce8938fbb55e2b38fee3cf9', 'width': 320}], 'source': {'height': 360, 'url': 'https://external-preview.redd.it/jDtfcFJyBM0PVuzMtalj-mQWYflIKjtQU7qrergSsu0.jpg?auto=webp&amp;s=a5eb43c57705efc6f47abac63948aca32f93e1b1', 'width': 480}, 'variants': {}}]}	moderator	"{'oembed': {'author_name': 'Banking With Billy', 'author_url': 'https://www.youtube.com/channel/UC0e9BHD57bqGHsLpdfYUVYA', 'height': 200, 'html': '&lt;iframe width=""356"" height=""200"" src=""https://www.youtube.com/embed/mGtIUTlnA5w?feature=oembed&amp;enablejsapi=1"" frameborder=""0"" allow=""accelerometer; autoplay; clipboard-write; encrypted-media; gyroscope; picture-in-picture"" allowfullscreen&gt;&lt;/iframe&gt;', 'provider_name': 'YouTube', 'provider_url': 'https://www.youtube.com/', 'thumbnail_height': 360, 'thumbnail_url': 'https://i.ytimg.com/vi/mGtIUTlnA5w/hqdefault.jpg', 'thumbnail_width': 480, 'title': 'SEC (Securities and Exchange Commission) Files Suit Against Marvin Capital and Citadel/ AMC Stock', 'type': 'video', 'version': '1.0', 'width': 356}, 'type': 'youtube.com'}"	"{'content': '&lt;iframe width=""356"" height=""200"" src=""https://www.youtube.com/embed/mGtIUTlnA5w?feature=oembed&amp;enablejsapi=1"" frameborder=""0"" allow=""accelerometer; autoplay; clipboard-write; encrypted-media; gyroscope; picture-in-picture"" allowfullscreen&gt;&lt;/iframe&gt;', 'height': 200, 'media_domain_url': 'https://www.redditmedia.com/mediaembed/s52ner', 'scrolling': False, 'width': 356}"	105.0	140.0	https://youtu.be/mGtIUTlnA5w								"SEC (Securities and Exchange Commission) Files Suit Against Marvin Capital and Citadel/ AMC Stock
"	sec securities and exchange commission files suit against marvin capital and citadel amc stock nan	0.05296849459409714	0.8137641549110413	0.3274708688259125	0.7707195281982422	0.2067340463399887	0.3304023742675781	0.3077203333377838	0.5230421423912048	0.4870564341545105	0.009457251988351345
2	[]	False	olad999	noob	[{'e': 'text', 't': 'redditor for a day'}]	2ec8e69e-6c36-11e9-a04b-0afb553d4ea6	redditor for a day	dark	richtext	t2_imic4m0e	False	False	False	[]	False	False	1642304252	self.Bitcoin	https://www.reddit.com/r/Bitcoin/comments/s52hl5/the_surprising_wealthbuilding_secret_of/	{}	s52hl5	False	True	False	False	False	True	True	False		[]	dark	text	False	False	False	0	0	False	all_ads	/r/Bitcoin/comments/s52hl5/the_surprising_wealthbuilding_secret_of/	False	6	1642304263	1	" ""How To Get Rich With Bitcoin Even If  You Have No Clue About Technology"" The surprising wealth-building secret ??

Wondering if you should invest in Bitcoin? If you've been around any kid of financial news lately, you've no doubt heard about the meteoric rise in the world's most well-known cryptocurrency.

&amp;#x200B;

And if you're like a lot of people right about now, you're probably wondering, ""Bitcoin - yes or no?""

&amp;#x200B;

Should you invest? Is it a good option? And what the heck is Bitcoin anyway?"	True	False	False	Bitcoin	t5_2s3qj	3791801	public	self	The surprising wealth-building secret of	0	[]	1.0	https://www.reddit.com/r/Bitcoin/comments/s52hl5/the_surprising_wealthbuilding_secret_of/	all_ads	6																		"The surprising wealth-building secret of
 ""How To Get Rich With Bitcoin Even If  You Have No Clue About Technology"" The surprising wealth-building secret ??

Wondering if you should invest in Bitcoin? If you've been around any kid of financial news lately, you've no doubt heard about the meteoric rise in the world's most well-known cryptocurrency.

&amp;#x200B;

And if you're like a lot of people right about now, you're probably wondering, ""Bitcoin - yes or no?""

&amp;#x200B;

Should you invest? Is it a good option? And what the heck is Bitcoin anyway?"	the surprising wealth building secret of how to get rich with bitcoin even if you have no clue about technology the surprising wealth building secret wondering if you should invest in bitcoin if you ve been around any kid of financial news lately you ve no doubt heard about the meteoric rise in the world s most well known cryptocurrency amp x200b and if you re like a lot of people right about now you re probably wondering bitcoin yes or no amp x200b should you invest is it a good option and what the heck is bitcoin anyway 	0.0023009213618934155	0.9895983934402466	0.5002372860908508	0.030778393149375916	0.007365034427493811	0.49484241008758545	0.06468649953603745	8.284505383926444e-07	0.30220213532447815	0.016696199774742126
3	[]	False	Lopsided-Basis-7673		[]				text	t2_dmoxxvko	False	False	False	[]	False	False	1642303941	discord.gg	https://www.reddit.com/r/Bitcoin/comments/s52e3f/join_the_trillionaire_thugs_discord_server/	{}	s52e3f	False	False	False	False	False	False	False	False		[]	dark	text	False	False	True	0	0	False	all_ads	/r/Bitcoin/comments/s52e3f/join_the_trillionaire_thugs_discord_server/	False	6	1642303951	1		True	False	False	Bitcoin	t5_2s3qj	3791787	public	https://a.thumbs.redditmedia.com/VqPqZaJHG5ZSp4avtmedbpRc_JBVjMqbq8PCweKEkf8.jpg	Join the Trillionaire Thugs Discord Server!	0	[]	1.0	https://discord.gg/Wb7bnYDA	all_ads	6			link	{'enabled': False, 'images': [{'id': '_1TKafrtSMp0ND1ycBeh_8h5Z1zpqOYQxKPbvEeZ8GI', 'resolutions': [{'height': 56, 'url': 'https://external-preview.redd.it/fpyWsGI2IvGNLuXSoub0Y5YPbgQr2bxN9SZZoWo1Y84.jpg?width=108&amp;crop=smart&amp;auto=webp&amp;s=571ef83305d475b1e173e7d1e855f310b67ff988', 'width': 108}, {'height': 112, 'url': 'https://external-preview.redd.it/fpyWsGI2IvGNLuXSoub0Y5YPbgQr2bxN9SZZoWo1Y84.jpg?width=216&amp;crop=smart&amp;auto=webp&amp;s=8c05f445586f8e8570a3bee348fb376e9f4e1108', 'width': 216}, {'height': 166, 'url': 'https://external-preview.redd.it/fpyWsGI2IvGNLuXSoub0Y5YPbgQr2bxN9SZZoWo1Y84.jpg?width=320&amp;crop=smart&amp;auto=webp&amp;s=59598bada0805c06d9862de2db24c14f876fe345', 'width': 320}], 'source': {'height': 267, 'url': 'https://external-preview.redd.it/fpyWsGI2IvGNLuXSoub0Y5YPbgQr2bxN9SZZoWo1Y84.jpg?auto=webp&amp;s=af1f673e2b810a70b0c58ee3cd1a15de1d98249f', 'width': 512}, 'variants': {}}]}	reddit			73.0	140.0	https://discord.gg/Wb7bnYDA								"Join the Trillionaire Thugs Discord Server!
"	join the trillionaire thugs discord server nan	0.33953073620796204	0.36570045351982117	0.7263320088386536	0.4690141975879669	0.397726833820343	0.31115397810935974	0.39815834164619446	0.35196274518966675	0.5009902715682983	0.004504191689193249
4	[]	False	katie_collom	noob	[{'e': 'text', 't': 'redditor for 4 days'}]	2ec8e69e-6c36-11e9-a04b-0afb553d4ea6	redditor for 4 days	dark	richtext	t2_iho2fdxr	False	False	False	[]	False	False	1642302977	self.Bitcoin	https://www.reddit.com/r/Bitcoin/comments/s522d3/was_not_at_first_but_after_doing_my_own_little/	{}	s522d3	False	True	False	False	False	True	True	False		[]	dark	text	False	False	True	0	0	False	all_ads	/r/Bitcoin/comments/s522d3/was_not_at_first_but_after_doing_my_own_little/	False	6	1642302995	1		True	False	False	Bitcoin	t5_2s3qj	3791750	public	self	Was not at first but after doing my own little research on Bitcoin, I'm bullish on it.it has always been constant with rise in price,plus being limited in amount, it's definitely going 100k surely.	0	[]	1.0	https://www.reddit.com/r/Bitcoin/comments/s522d3/was_not_at_first_but_after_doing_my_own_little/	all_ads	6																		"Was not at first but after doing my own little research on Bitcoin, I'm bullish on it.it has always been constant with rise in price,plus being limited in amount, it's definitely going 100k surely.
"	was not at first but after doing my own little research on bitcoin i m bullish on it it has always been constant with rise in price plus being limited in amount it s definitely going 100k surely nan	0.005323378834873438	0.9819199442863464	0.4162546992301941	0.010116617195308208	0.9257834553718567	0.6496986746788025	0.1116979718208313	8.6208251559583e-07	0.3634430170059204	0.013217994943261147
5	[]	False	dheerajgrg777		[]				text	t2_imoc8iln	False	False	False	[]	False	False	1642302435	swagbuckssn.xyz	https://www.reddit.com/r/Bitcoin/comments/s51wp9/be_ready_to_earn_more_money/	{}	s51wp9	False	False	False	False	False	False	False	False		[]	dark	text	False	False	True	0	0	False	all_ads	/r/Bitcoin/comments/s51wp9/be_ready_to_earn_more_money/	False	6	1642302445	1		True	False	False	Bitcoin	t5_2s3qj	3791731	public	default	Be ready to earn more money😇	0	[]	1.0	https://swagbuckssn.xyz/8333937625921	all_ads	6					reddit					https://swagbuckssn.xyz/8333937625921								"Be ready to earn more money😇
"	be ready to earn more money nan	0.6036929488182068	0.4902627766132355	0.2757291793823242	0.5584055185317993	0.35129615664482117	0.4754142165184021	0.4297294318675995	0.6264384388923645	0.36644041538238525	0.2510083019733429
6	[]	False	New-Basil-8889		[]				text	t2_e9qz5595	False	False	False	[]	False	False	1642301470	self.Bitcoin	https://www.reddit.com/r/Bitcoin/comments/s51l2h/gold_market_cap_11t_btc_08t_if_btc_replaces_gold/	{}	s51l2h	False	True	False	False	False	True	True	False		[]	dark	text	False	False	True	0	0	False	all_ads	/r/Bitcoin/comments/s51l2h/gold_market_cap_11t_btc_08t_if_btc_replaces_gold/	False	6	1642301481	1	Gold is primarily a speculative asset used as a hard/sound money alternative to inflationary fiat currency. BTC probably fills this role better than gold, owing to it having none of the impracticalities of investing in metal.	True	False	False	Bitcoin	t5_2s3qj	3791707	public	self	Gold Market Cap = 11T. BTC = 0.8T. If BTC replaces Gold, 1 BTC = $400K.	0	[]	1.0	https://www.reddit.com/r/Bitcoin/comments/s51l2h/gold_market_cap_11t_btc_08t_if_btc_replaces_gold/	all_ads	6																		"Gold Market Cap = 11T. BTC = 0.8T. If BTC replaces Gold, 1 BTC = $400K.
Gold is primarily a speculative asset used as a hard/sound money alternative to inflationary fiat currency. BTC probably fills this role better than gold, owing to it having none of the impracticalities of investing in metal."	gold market cap 11t btc 0 8t if btc replaces gold 1 btc 400k gold is primarily a speculative asset used as a hard sound money alternative to inflationary fiat currency btc probably fills this role better than gold owing to it having none of the impracticalities of investing in metal 	0.002949733752757311	0.9882965683937073	0.5142791867256165	0.03734328970313072	0.008181418292224407	0.20451323688030243	0.11059067398309708	8.641890190119739e-07	0.4362375736236572	0.02550060674548149
7	[]	False	felipebrunet	noob	[{'e': 'text', 't': 'redditor for 6 weeks'}]	2ec8e69e-6c36-11e9-a04b-0afb553d4ea6	redditor for 6 weeks	dark	richtext	t2_biierz81	False	False	False	[]	False	False	1642300637	self.Bitcoin	https://www.reddit.com/r/Bitcoin/comments/s51bbj/conditional_multisig_walletsoftware_available/	{}	s51bbj	False	True	False	False	False	True	True	False		[]	dark	text	False	False	True	0	0	False	all_ads	/r/Bitcoin/comments/s51bbj/conditional_multisig_walletsoftware_available/	False	6	1642300647	1	Hi all. I have read in the Mastering Bitcoin book that bitcoin allows the creation of multisig wallets with the option to reduce the required signatures after some condition is met (like a time threshold). Do you know what programs are out there that allow the creation of these wallets? I am sort of giving advice to a real estate company that would like to start accepting BTC. I am interested in taproot wallets since I heard multisig txs are cheaper in taproot.	True	False	False	Bitcoin	t5_2s3qj	3791680	public	self	Conditional multisig wallet-software available. Ideally with taproot address	0	[]	1.0	https://www.reddit.com/r/Bitcoin/comments/s51bbj/conditional_multisig_walletsoftware_available/	all_ads	6																		"Conditional multisig wallet-software available. Ideally with taproot address
Hi all. I have read in the Mastering Bitcoin book that bitcoin allows the creation of multisig wallets with the option to reduce the required signatures after some condition is met (like a time threshold). Do you know what programs are out there that allow the creation of these wallets? I am sort of giving advice to a real estate company that would like to start accepting BTC. I am interested in taproot wallets since I heard multisig txs are cheaper in taproot."	conditional multisig wallet software available ideally with taproot address hi all i have read in the mastering bitcoin book that bitcoin allows the creation of multisig wallets with the option to reduce the required signatures after some condition is met like a time threshold do you know what programs are out there that allow the creation of these wallets i am sort of giving advice to a real estate company that would like to start accepting btc i am interested in taproot wallets since i heard multisig txs are cheaper in taproot 	0.0023980354890227318	0.9888952970504761	0.2635357081890106	0.025302419438958168	0.007818670012056828	0.4104037880897522	0.17082341015338898	8.495780434714106e-07	0.4057007431983948	0.006200290285050869
8	[]	False	BlazingPalm		[]				text	t2_77bt7	False	False	False	[]	False	False	1642300291	self.Bitcoin	https://www.reddit.com/r/Bitcoin/comments/s517bh/btc_mining_details/	{}	s517bh	False	True	False	False	False	True	True	False		[]	dark	text	False	False	True	0	0	False	all_ads	/r/Bitcoin/comments/s517bh/btc_mining_details/	False	6	1642300301	1	"Came across this article today:

https://decrypt.co/90364/astronomically-lucky-tiny-crypto-miners-defy-odds-win-bitcoin-jackpot

It highlights something I’ve never understood about the mining process: we’re usually told a simplified version of how mining works and that all the miners “compete” to solve the algorithm to have the privilege of adding a new block to chain and earning (currently) 6.25 BTC reward. 

But I was always curious how all the rest of the miners got anything if the full reward goes to a single entity every time. How would a small to medium miner “mine” .01 BTC over several weeks then? Is the hash rate actually pooled and distributed widely among all miners, or…?  Thanks for weighing in, this is something that I’ve never fully understood."	True	False	False	Bitcoin	t5_2s3qj	3791674	public	self	BTC mining details	0	[]	1.0	https://www.reddit.com/r/Bitcoin/comments/s517bh/btc_mining_details/	all_ads	6			self	{'enabled': False, 'images': [{'id': '5UZLCkJ9whch2xSShi9kI-rYNa00KQKrcZzT2MKLQVM', 'resolutions': [{'height': 54, 'url': 'https://external-preview.redd.it/SLZfa7QEEQGuf62uu8wwJl-ldT4FRt2XiHLjj8xyt5M.jpg?width=108&amp;crop=smart&amp;auto=webp&amp;s=e67aa248e52ca32a4f73a71ee07d5ca06ce656b8', 'width': 108}, {'height': 108, 'url': 'https://external-preview.redd.it/SLZfa7QEEQGuf62uu8wwJl-ldT4FRt2XiHLjj8xyt5M.jpg?width=216&amp;crop=smart&amp;auto=webp&amp;s=7f1108f26ece06000d5604f9bd85bdbcfecae908', 'width': 216}, {'height': 160, 'url': 'https://external-preview.redd.it/SLZfa7QEEQGuf62uu8wwJl-ldT4FRt2XiHLjj8xyt5M.jpg?width=320&amp;crop=smart&amp;auto=webp&amp;s=cba0f82674ea0c847a3760d1d0ead66526121d42', 'width': 320}, {'height': 320, 'url': 'https://external-preview.redd.it/SLZfa7QEEQGuf62uu8wwJl-ldT4FRt2XiHLjj8xyt5M.jpg?width=640&amp;crop=smart&amp;auto=webp&amp;s=812416ef906dee4d59298486e8d57cbdb780fe38', 'width': 640}, {'height': 480, 'url': 'https://external-preview.redd.it/SLZfa7QEEQGuf62uu8wwJl-ldT4FRt2XiHLjj8xyt5M.jpg?width=960&amp;crop=smart&amp;auto=webp&amp;s=24e356416025644f03f9129a973735b873b4ad16', 'width': 960}], 'source': {'height': 512, 'url': 'https://external-preview.redd.it/SLZfa7QEEQGuf62uu8wwJl-ldT4FRt2XiHLjj8xyt5M.jpg?auto=webp&amp;s=fff137581df6a80889fbcd3c1ae343a014ab2126', 'width': 1024}, 'variants': {}}]}														"BTC mining details
Came across this article today:

https://decrypt.co/90364/astronomically-lucky-tiny-crypto-miners-defy-odds-win-bitcoin-jackpot

It highlights something I’ve never understood about the mining process: we’re usually told a simplified version of how mining works and that all the miners “compete” to solve the algorithm to have the privilege of adding a new block to chain and earning (currently) 6.25 BTC reward. 

But I was always curious how all the rest of the miners got anything if the full reward goes to a single entity every time. How would a small to medium miner “mine” .01 BTC over several weeks then? Is the hash rate actually pooled and distributed widely among all miners, or…?  Thanks for weighing in, this is something that I’ve never fully understood."	btc mining details came across this article today https decrypt co 90364 astronomically lucky tiny crypto miners defy odds win bitcoin jackpot it highlights something i ve never understood about the mining process we re usually told a simplified version of how mining works and that all the miners compete to solve the algorithm to have the privilege of adding a new block to chain and earning currently 6 25 btc reward but i was always curious how all the rest of the miners got anything if the full reward goes to a single entity every time how would a small to medium miner mine 01 btc over several weeks then is the hash rate actually pooled and distributed widely among all miners or thanks for weighing in this is something that i ve never fully understood 	0.0027593905106186867	0.9875596165657043	0.0401996485888958	0.009778731502592564	0.009230801835656166	0.6191982626914978	0.11675414443016052	8.378755751436984e-07	0.4034476578235626	0.013795902952551842
