87	[]	False	sniper_venom		[]				text	t2_5k7cizqz	False	False	False	[]	False	False	1642354160	youtu.be	https://www.reddit.com/r/Bitcoin/comments/s5gqce/lifestyle_of_bitcoin_billionaires/	{}	s5gqce	False	True	False	False	False	True	False	False		[]	dark	text	False	False	True	0	0	False	all_ads	/r/Bitcoin/comments/s5gqce/lifestyle_of_bitcoin_billionaires/	False	6	1642354170	1		True	False	False	Bitcoin	t5_2s3qj	3794110	public	https://b.thumbs.redditmedia.com/bJPDVx8pyEFhVQGef-K9dEhFgxp4XWeGrlXx0l36eww.jpg	Lifestyle of Bitcoin Billionaires💲🤑	0	[]	1.0	https://youtu.be/wlVxqsGIX6w	all_ads	6	"{'oembed': {'author_name': 'Billionaire Lifestyle Motivation', 'author_url': 'https://www.youtube.com/channel/UC6Jekrb7HtWoDwZYY2s-XEA', 'height': 200, 'html': '&lt;iframe width=""356"" height=""200"" src=""https://www.youtube.com/embed/wlVxqsGIX6w?feature=oembed&amp;enablejsapi=1"" frameborder=""0"" allow=""accelerometer; autoplay; clipboard-write; encrypted-media; gyroscope; picture-in-picture"" allowfullscreen&gt;&lt;/iframe&gt;', 'provider_name': 'YouTube', 'provider_url': 'https://www.youtube.com/', 'thumbnail_height': 360, 'thumbnail_url': 'https://i.ytimg.com/vi/wlVxqsGIX6w/hqdefault.jpg', 'thumbnail_width': 480, 'title': 'Billionaire Lifestyle 2022 💲 | BILLIONAIRE Lifestyle Motivation | Luxury Lifestyle | #11', 'type': 'video', 'version': '1.0', 'width': 356}, 'type': 'youtube.com'}"	"{'content': '&lt;iframe width=""356"" height=""200"" src=""https://www.youtube.com/embed/wlVxqsGIX6w?feature=oembed&amp;enablejsapi=1"" frameborder=""0"" allow=""accelerometer; autoplay; clipboard-write; encrypted-media; gyroscope; picture-in-picture"" allowfullscreen&gt;&lt;/iframe&gt;', 'height': 200, 'scrolling': False, 'width': 356}"	rich:video	{'enabled': False, 'images': [{'id': 'HXJRIB1kk9Hn-u9noCX6R7kqQvU8gvvmlCb7JfINNh4', 'resolutions': [{'height': 81, 'url': 'https://external-preview.redd.it/SbKeo2-ApBWd8UcXcyCIrBVNgntXVyDhXx0NtElNKX4.jpg?width=108&amp;crop=smart&amp;auto=webp&amp;s=4aa87102b0be6d478c23249d5888194da4ca95d4', 'width': 108}, {'height': 162, 'url': 'https://external-preview.redd.it/SbKeo2-ApBWd8UcXcyCIrBVNgntXVyDhXx0NtElNKX4.jpg?width=216&amp;crop=smart&amp;auto=webp&amp;s=650dde0d1949a9b50e74c6878575a2cbb8608e28', 'width': 216}, {'height': 240, 'url': 'https://external-preview.redd.it/SbKeo2-ApBWd8UcXcyCIrBVNgntXVyDhXx0NtElNKX4.jpg?width=320&amp;crop=smart&amp;auto=webp&amp;s=ed3c0fb0a4658491eb79fe6818621cb0027c805e', 'width': 320}], 'source': {'height': 360, 'url': 'https://external-preview.redd.it/SbKeo2-ApBWd8UcXcyCIrBVNgntXVyDhXx0NtElNKX4.jpg?auto=webp&amp;s=ae58afa1cfe1ef2c753113b17c8ab2e59e6d9927', 'width': 480}, 'variants': {}}]}		"{'oembed': {'author_name': 'Billionaire Lifestyle Motivation', 'author_url': 'https://www.youtube.com/channel/UC6Jekrb7HtWoDwZYY2s-XEA', 'height': 200, 'html': '&lt;iframe width=""356"" height=""200"" src=""https://www.youtube.com/embed/wlVxqsGIX6w?feature=oembed&amp;enablejsapi=1"" frameborder=""0"" allow=""accelerometer; autoplay; clipboard-write; encrypted-media; gyroscope; picture-in-picture"" allowfullscreen&gt;&lt;/iframe&gt;', 'provider_name': 'YouTube', 'provider_url': 'https://www.youtube.com/', 'thumbnail_height': 360, 'thumbnail_url': 'https://i.ytimg.com/vi/wlVxqsGIX6w/hqdefault.jpg', 'thumbnail_width': 480, 'title': 'Billionaire Lifestyle 2022 💲 | BILLIONAIRE Lifestyle Motivation | Luxury Lifestyle | #11', 'type': 'video', 'version': '1.0', 'width': 356}, 'type': 'youtube.com'}"	"{'content': '&lt;iframe width=""356"" height=""200"" src=""https://www.youtube.com/embed/wlVxqsGIX6w?feature=oembed&amp;enablejsapi=1"" frameborder=""0"" allow=""accelerometer; autoplay; clipboard-write; encrypted-media; gyroscope; picture-in-picture"" allowfullscreen&gt;&lt;/iframe&gt;', 'height': 200, 'media_domain_url': 'https://www.redditmedia.com/mediaembed/s5gqce', 'scrolling': False, 'width': 356}"	105.0	140.0	https://youtu.be/wlVxqsGIX6w								"Lifestyle of Bitcoin Billionaires💲🤑
"	lifestyle of bitcoin billionaires nan	0.45311251282691956	0.5212216377258301	0.5432698130607605	0.4152996242046356	0.4522693157196045	0.43767285346984863	0.489184707403183	0.5010496973991394	0.5006230473518372	0.31219881772994995
88	[]	False	DocumentingBitcoin		[]			dark	text	t2_afokkrub	False	False	False	[]	False	False	1642353693	i.redd.it	https://www.reddit.com/r/Bitcoin/comments/s5gk6s/thirteen_years_ago_today_satoshi_nakamoto_gave_us/	{}	s5gk6s	False	True	False	False	True	True	False	False		[]	dark	text	False	False	True	4	0	False	all_ads	/r/Bitcoin/comments/s5gk6s/thirteen_years_ago_today_satoshi_nakamoto_gave_us/	False	6	1642353704	1		True	False	False	Bitcoin	t5_2s3qj	3794087	public	https://b.thumbs.redditmedia.com/wvuGTeITlLVCFR95t_0qsmKl5Hte3Q1_XGyHeYXIW-k.jpg	Thirteen years ago today, Satoshi Nakamoto gave us all some of the most important advice that has possibly ever been given...	0	[]	1.0	https://i.redd.it/lg5jc4w733c81.png	all_ads	6			image	{'enabled': True, 'images': [{'id': 's6VN-ymLelW5_azb3neMmc3OJweUe6FgGGerQMSaEdA', 'resolutions': [{'height': 64, 'url': 'https://preview.redd.it/lg5jc4w733c81.png?width=108&amp;crop=smart&amp;auto=webp&amp;s=5e05f8a943e11d5382aa1edae975f87730235e4b', 'width': 108}, {'height': 129, 'url': 'https://preview.redd.it/lg5jc4w733c81.png?width=216&amp;crop=smart&amp;auto=webp&amp;s=626753c549fb2b6e55ad980787342d0e91cbcbbf', 'width': 216}, {'height': 191, 'url': 'https://preview.redd.it/lg5jc4w733c81.png?width=320&amp;crop=smart&amp;auto=webp&amp;s=d6e78904b3b1500f784c52e186ab3ecd405c285e', 'width': 320}, {'height': 382, 'url': 'https://preview.redd.it/lg5jc4w733c81.png?width=640&amp;crop=smart&amp;auto=webp&amp;s=6bdee0343f4fddbeaf031e3012729e51254c21fa', 'width': 640}, {'height': 573, 'url': 'https://preview.redd.it/lg5jc4w733c81.png?width=960&amp;crop=smart&amp;auto=webp&amp;s=320b243b027491725f15b07cca7a193d8a26af86', 'width': 960}, {'height': 645, 'url': 'https://preview.redd.it/lg5jc4w733c81.png?width=1080&amp;crop=smart&amp;auto=webp&amp;s=81ccaf41197da28616375e531eef776091f4fd78', 'width': 1080}], 'source': {'height': 842, 'url': 'https://preview.redd.it/lg5jc4w733c81.png?auto=webp&amp;s=74d9a9bdc8b0d58be91e00bf8a0a8bda2b9ee519', 'width': 1409}, 'variants': {}}]}				83.0	140.0	https://i.redd.it/lg5jc4w733c81.png								"Thirteen years ago today, Satoshi Nakamoto gave us all some of the most important advice that has possibly ever been given...
"	thirteen years ago today satoshi nakamoto gave us all some of the most important advice that has possibly ever been given nan	0.35436999797821045	0.8284775614738464	0.16384254395961761	0.34210702776908875	0.651872992515564	0.5284023284912109	0.4884420931339264	0.8437714576721191	0.3740483224391937	0.11435290426015854
89	[]	False	easydoesit245		[]				text	t2_aikhrjnv	False	False	False	[]	False	False	1642353558	self.Bitcoin	https://www.reddit.com/r/Bitcoin/comments/s5gig1/crypto_experts/	{}	s5gig1	False	True	False	False	False	True	True	False		[]	dark	text	False	False	True	0	0	False	all_ads	/r/Bitcoin/comments/s5gig1/crypto_experts/	False	6	1642353568	1	Everyone talks like experts, every poster including me have no f.....n clue. Everyone talking out their a..! All guess work, everyone has been wrong.	True	False	False	Bitcoin	t5_2s3qj	3794080	public	self	Crypto experts	0	[]	1.0	https://www.reddit.com/r/Bitcoin/comments/s5gig1/crypto_experts/	all_ads	6																		"Crypto experts
Everyone talks like experts, every poster including me have no f.....n clue. Everyone talking out their a..! All guess work, everyone has been wrong."	crypto experts everyone talks like experts every poster including me have no f n clue everyone talking out their a all guess work everyone has been wrong 	0.038799967616796494	0.6171928644180298	0.7636009454727173	0.018319275230169296	0.7641505002975464	0.47032085061073303	0.1578800231218338	0.0017580302665010095	0.25357431173324585	0.012301383540034294
90	[]	False	Kozy98		[]				text	t2_ekxbycbd	False	False	False	[]	False	False	1642353292	self.Bitcoin	https://www.reddit.com/r/Bitcoin/comments/s5gewr/am_i_doing_this_right/	{}	s5gewr	False	True	False	False	False	True	True	False		[]	dark	text	False	False	True	0	0	False	all_ads	/r/Bitcoin/comments/s5gewr/am_i_doing_this_right/	False	6	1642353303	1	"Still learning about all of it. Currently hodling my btc in electrum. Made a wallet backup on a usb as well as the seed phrase + noted it on paper. What else should/could I do for security. Should I save the private keys as well or is it enough to have my seedphrase? 

Would most likely have it as a cold storage. For transactions in case I would use btc as payment I have some sats in Coinbase. 

Any tips for a beginner?"	True	False	False	Bitcoin	t5_2s3qj	3794063	public	self	Am I doing this right?	0	[]	1.0	https://www.reddit.com/r/Bitcoin/comments/s5gewr/am_i_doing_this_right/	all_ads	6																		"Am I doing this right?
Still learning about all of it. Currently hodling my btc in electrum. Made a wallet backup on a usb as well as the seed phrase + noted it on paper. What else should/could I do for security. Should I save the private keys as well or is it enough to have my seedphrase? 

Would most likely have it as a cold storage. For transactions in case I would use btc as payment I have some sats in Coinbase. 

Any tips for a beginner?"	am i doing this right still learning about all of it currently hodling my btc in electrum made a wallet backup on a usb as well as the seed phrase noted it on paper what else should could i do for security should i save the private keys as well or is it enough to have my seedphrase would most likely have it as a cold storage for transactions in case i would use btc as payment i have some sats in coinbase any tips for a beginner 	0.002292534103617072	0.9902456998825073	0.07751768827438354	0.015763092786073685	0.9951441287994385	0.33871763944625854	0.11970829963684082	8.673835623085324e-07	0.25960808992385864	0.004779298789799213
91	[]	False	ApeMoe	noob	[{'e': 'text', 't': 'redditor for 6 weeks'}]	2ec8e69e-6c36-11e9-a04b-0afb553d4ea6	redditor for 6 weeks	dark	richtext	t2_ev0zvqmo	False	False	False	[]	False	False	1642352351	self.Bitcoin	https://www.reddit.com/r/Bitcoin/comments/s5g1s8/best_placewallet_to_keepbuy_your_bitcoin/	{}	s5g1s8	False	True	False	False	False	True	True	False		[]	dark	text	False	False	True	0	0	False	all_ads	/r/Bitcoin/comments/s5g1s8/best_placewallet_to_keepbuy_your_bitcoin/	False	6	1642352361	1	Im new into bitcoin and i was wondering where to buy/keep bitcoin ?	True	False	False	Bitcoin	t5_2s3qj	3794007	public	self	Best place/wallet to keep/buy your bitcoin?	0	[]	1.0	https://www.reddit.com/r/Bitcoin/comments/s5g1s8/best_placewallet_to_keepbuy_your_bitcoin/	all_ads	6																		"Best place/wallet to keep/buy your bitcoin?
Im new into bitcoin and i was wondering where to buy/keep bitcoin ?"	best place wallet to keep buy your bitcoin im new into bitcoin and i was wondering where to buy keep bitcoin 	0.6014807820320129	0.6730887293815613	0.1769132912158966	0.04829079657793045	0.01321545708924532	0.1978837251663208	0.12751014530658722	0.8399617671966553	0.2966757118701935	0.00023326970404013991
92	[]	False	RonTate		[]				text	t2_12kw1tph	False	False	False	[]	False	False	1642352211	markethive.com	https://www.reddit.com/r/Bitcoin/comments/s5g009/ukraine_demonstrates_how_bitcoin_can_transform/	{}	s5g009	False	True	False	False	False	True	False	False		[]	dark	text	False	False	True	0	0	False	all_ads	/r/Bitcoin/comments/s5g009/ukraine_demonstrates_how_bitcoin_can_transform/	False	6	1642352222	1		True	False	False	Bitcoin	t5_2s3qj	3793999	public	https://b.thumbs.redditmedia.com/JPuHUpFJgqCXPWBV-fflXEtZXsmRUhDd0HQLSTsDPpA.jpg	Ukraine Demonstrates How Bitcoin Can Transform Developing Countries	0	[]	1.0	https://markethive.com/rico40/blog/ukrainedemonstrateshowbitcoincantransformdevelopingcountries	all_ads	6			link	{'enabled': False, 'images': [{'id': 'W5c8q1sKbMdmulrisPe2p9VP5LN8I0epO81AewPyQCI', 'resolutions': [{'height': 60, 'url': 'https://external-preview.redd.it/KaD5yMuTRFMZZ_y-EdIUcrWFP8afSguH2lF9MkcBdGo.jpg?width=108&amp;crop=smart&amp;auto=webp&amp;s=146e6af588d5d13f3f2472495b80a22e1fbe32e4', 'width': 108}, {'height': 121, 'url': 'https://external-preview.redd.it/KaD5yMuTRFMZZ_y-EdIUcrWFP8afSguH2lF9MkcBdGo.jpg?width=216&amp;crop=smart&amp;auto=webp&amp;s=76d4f72ff15a9231531a1e4fa5cc7c616d9df474', 'width': 216}, {'height': 180, 'url': 'https://external-preview.redd.it/KaD5yMuTRFMZZ_y-EdIUcrWFP8afSguH2lF9MkcBdGo.jpg?width=320&amp;crop=smart&amp;auto=webp&amp;s=a3d6e5a05c20383fb5dbd1f6715a2881653b68c1', 'width': 320}, {'height': 360, 'url': 'https://external-preview.redd.it/KaD5yMuTRFMZZ_y-EdIUcrWFP8afSguH2lF9MkcBdGo.jpg?width=640&amp;crop=smart&amp;auto=webp&amp;s=0dd170924fc4b178a8b8bc337fef44ccfc246d08', 'width': 640}, {'height': 540, 'url': 'https://external-preview.redd.it/KaD5yMuTRFMZZ_y-EdIUcrWFP8afSguH2lF9MkcBdGo.jpg?width=960&amp;crop=smart&amp;auto=webp&amp;s=d615b7f74dd4d350709b7579a33105fbf98fae8c', 'width': 960}, {'height': 607, 'url': 'https://external-preview.redd.it/KaD5yMuTRFMZZ_y-EdIUcrWFP8afSguH2lF9MkcBdGo.jpg?width=1080&amp;crop=smart&amp;auto=webp&amp;s=e2ea74f288a884bfcb243b621fb1cff54c00c978', 'width': 1080}], 'source': {'height': 675, 'url': 'https://external-preview.redd.it/KaD5yMuTRFMZZ_y-EdIUcrWFP8afSguH2lF9MkcBdGo.jpg?auto=webp&amp;s=ddc202812e97269940f08e7295af0aef1580e847', 'width': 1200}, 'variants': {}}]}				78.0	140.0	https://markethive.com/rico40/blog/ukrainedemonstrateshowbitcoincantransformdevelopingcountries								"Ukraine Demonstrates How Bitcoin Can Transform Developing Countries
"	ukraine demonstrates how bitcoin can transform developing countries nan	0.42278537154197693	0.7340484261512756	0.2842983901500702	0.45144137740135193	0.41357895731925964	0.177044078707695	0.4135282039642334	0.6586569547653198	0.5091524124145508	0.06236543506383896
93	[]	False	wattzson		[]				text	t2_p3fzz	False	False	False	[]	False	False	1642352148	self.Bitcoin	https://www.reddit.com/r/Bitcoin/comments/s5fz6f/how_japan_proved_printing_money_can_be_a_great/	{}	s5fz6f	False	True	False	False	False	True	True	False		[]	dark	text	False	False	True	0	0	False	all_ads	/r/Bitcoin/comments/s5fz6f/how_japan_proved_printing_money_can_be_a_great/	False	6	1642352159	1	"Curious what others think about this.

[https://www.washingtonpost.com/news/wonk/wp/2017/05/16/how-japan-proved-printing-money-can-be-a-great-idea/](https://www.washingtonpost.com/news/wonk/wp/2017/05/16/how-japan-proved-printing-money-can-be-a-great-idea/)"	True	False	False	Bitcoin	t5_2s3qj	3793996	public	self	How Japan proved printing money can be a great idea	0	[]	1.0	https://www.reddit.com/r/Bitcoin/comments/s5fz6f/how_japan_proved_printing_money_can_be_a_great/	all_ads	6			self	{'enabled': False, 'images': [{'id': 'mNYaEU9ZqyXlAOVMU1iSgJW_JFe3o8DraucB9wQf0Jk', 'resolutions': [{'height': 72, 'url': 'https://external-preview.redd.it/J9pfDV_9M7KiGqK0stx--pSBraBNnoOh9VcE2dM9kAk.jpg?width=108&amp;crop=smart&amp;auto=webp&amp;s=f763502c2d4c945b99d652e50c84713faab00fb5', 'width': 108}, {'height': 144, 'url': 'https://external-preview.redd.it/J9pfDV_9M7KiGqK0stx--pSBraBNnoOh9VcE2dM9kAk.jpg?width=216&amp;crop=smart&amp;auto=webp&amp;s=a150e2778f01aa47c61db3ea3af3ee8566329820', 'width': 216}, {'height': 213, 'url': 'https://external-preview.redd.it/J9pfDV_9M7KiGqK0stx--pSBraBNnoOh9VcE2dM9kAk.jpg?width=320&amp;crop=smart&amp;auto=webp&amp;s=8108b6214f21a9d023ed480ccfcbf12352fd3f32', 'width': 320}, {'height': 426, 'url': 'https://external-preview.redd.it/J9pfDV_9M7KiGqK0stx--pSBraBNnoOh9VcE2dM9kAk.jpg?width=640&amp;crop=smart&amp;auto=webp&amp;s=8bf07b0dd6c7376a652eae659f99d983767acdea', 'width': 640}, {'height': 640, 'url': 'https://external-preview.redd.it/J9pfDV_9M7KiGqK0stx--pSBraBNnoOh9VcE2dM9kAk.jpg?width=960&amp;crop=smart&amp;auto=webp&amp;s=5ee26a6ef7b34ad8d004e9bb8656300adf9fa968', 'width': 960}], 'source': {'height': 640, 'url': 'https://external-preview.redd.it/J9pfDV_9M7KiGqK0stx--pSBraBNnoOh9VcE2dM9kAk.jpg?auto=webp&amp;s=6cbaddbbdbf4a1f9283dc2439b6def2bbc9e719b', 'width': 960}, 'variants': {}}]}														"How Japan proved printing money can be a great idea
Curious what others think about this.

[https://www.washingtonpost.com/news/wonk/wp/2017/05/16/how-japan-proved-printing-money-can-be-a-great-idea/](https://www.washingtonpost.com/news/wonk/wp/2017/05/16/how-japan-proved-printing-money-can-be-a-great-idea/)"	how japan proved printing money can be a great idea curious what others think about this https www washingtonpost com news wonk wp 2017 05 16 how japan proved printing money can be a great idea https www washingtonpost com news wonk wp 2017 05 16 how japan proved printing money can be a great idea 	0.010896014980971813	0.9890255331993103	0.03365793451666832	0.036927323788404465	0.0076306103728711605	0.5073984861373901	0.1299145221710205	8.186207764993014e-07	0.3762083351612091	0.023054704070091248
94	[]	False	ZealousidealOkra176		[]				text	t2_5qti4go7	False	False	False	[]	False	False	1642351911	self.Bitcoin	https://www.reddit.com/r/Bitcoin/comments/s5fw36/what_happened_to_crytpo_winter/	{}	s5fw36	False	True	False	False	False	True	True	False		[]	dark	text	False	False	True	0	0	False	all_ads	/r/Bitcoin/comments/s5fw36/what_happened_to_crytpo_winter/	False	6	1642351921	1	"What happened to that 80 percent drop?
Is it safe to say, the cycle is different now that crypto is so popular now than it was then? Evolved?
Bitcoin is at 43k and thats light. At some point its going to shoot up.. HODL FOLKS

Random side question:
At what point will bitcoin start to become harder to mine? 95 percent? I understand they say the last 1 percent will take 100 years. What about the last 96,97,98 percent? Shouldnt that takes YEARS as well?"	True	False	False	Bitcoin	t5_2s3qj	3793977	public	self	What happened to Crytpo Winter?	0	[]	1.0	https://www.reddit.com/r/Bitcoin/comments/s5fw36/what_happened_to_crytpo_winter/	all_ads	6																		"What happened to Crytpo Winter?
What happened to that 80 percent drop?
Is it safe to say, the cycle is different now that crypto is so popular now than it was then? Evolved?
Bitcoin is at 43k and thats light. At some point its going to shoot up.. HODL FOLKS

Random side question:
At what point will bitcoin start to become harder to mine? 95 percent? I understand they say the last 1 percent will take 100 years. What about the last 96,97,98 percent? Shouldnt that takes YEARS as well?"	what happened to crytpo winter what happened to that 80 percent drop is it safe to say the cycle is different now that crypto is so popular now than it was then evolved bitcoin is at 43k and thats light at some point its going to shoot up hodl folks random side question at what point will bitcoin start to become harder to mine 95 percent i understand they say the last 1 percent will take 100 years what about the last 96 97 98 percent shouldnt that takes years as well 	0.003133550053462386	0.9880394339561462	0.5594101548194885	0.24050195515155792	0.9944947361946106	0.27650144696235657	0.08078136295080185	8.336202199643594e-07	0.3118879199028015	0.027040965855121613
95	[]	False	TanyaSkokol		[]				text	t2_a4qohc5x	False	False	False	[]	False	False	1642351873	binance.com	https://www.reddit.com/r/Bitcoin/comments/s5fvlz/реферальная_программа_для_друзей_приглашайте_и/	{}	s5fvlz	False	True	False	False	False	True	False	False		[]	dark	text	False	False	True	0	0	False	all_ads	/r/Bitcoin/comments/s5fvlz/реферальная_программа_для_друзей_приглашайте_и/	False	6	1642351884	1		True	False	False	Bitcoin	t5_2s3qj	3793976	public	https://a.thumbs.redditmedia.com/kIr-Xa-nkpfIrXfbl1ZkK0f_CudhZ-Dx8nxMOxoQKg4.jpg	Реферальная программа для друзей | Приглашайте и зарабатывайте | Binance Official	0	[]	1.0	https://www.binance.com/ru/activity/referral-entry?fromActivityPage=true&amp;ref=LIMIT_HNRG2Q63&amp;utm_campaign=web_share_link&amp;utm_source=reddit	all_ads	6			link	{'enabled': False, 'images': [{'id': 'LohGMNJICUYB1MpCCMpBfB9YqXkmUXqaCbLQQvW2nMQ', 'resolutions': [{'height': 60, 'url': 'https://external-preview.redd.it/Q2x1AisRYZYutywfjgj8sM2BQdqkOAyqChN_MhgJ2_Q.jpg?width=108&amp;crop=smart&amp;auto=webp&amp;s=1c1ebdcb1f1a852fe45ac92915cba875ecd523f4', 'width': 108}, {'height': 121, 'url': 'https://external-preview.redd.it/Q2x1AisRYZYutywfjgj8sM2BQdqkOAyqChN_MhgJ2_Q.jpg?width=216&amp;crop=smart&amp;auto=webp&amp;s=21e56cbf2ee3b0a38fe04696eb99f77dbcb891a1', 'width': 216}, {'height': 180, 'url': 'https://external-preview.redd.it/Q2x1AisRYZYutywfjgj8sM2BQdqkOAyqChN_MhgJ2_Q.jpg?width=320&amp;crop=smart&amp;auto=webp&amp;s=928a836df87cf19d93a745f220adc8ca260865f8', 'width': 320}, {'height': 360, 'url': 'https://external-preview.redd.it/Q2x1AisRYZYutywfjgj8sM2BQdqkOAyqChN_MhgJ2_Q.jpg?width=640&amp;crop=smart&amp;auto=webp&amp;s=e889d156793758f6d7b4336faed8f0dc57473320', 'width': 640}, {'height': 540, 'url': 'https://external-preview.redd.it/Q2x1AisRYZYutywfjgj8sM2BQdqkOAyqChN_MhgJ2_Q.jpg?width=960&amp;crop=smart&amp;auto=webp&amp;s=04de73bec79ee5f196da6a2bda10d544e5addaea', 'width': 960}, {'height': 607, 'url': 'https://external-preview.redd.it/Q2x1AisRYZYutywfjgj8sM2BQdqkOAyqChN_MhgJ2_Q.jpg?width=1080&amp;crop=smart&amp;auto=webp&amp;s=0a2ae8d0b10e3d5bccc6610c6c31ade185f011ca', 'width': 1080}], 'source': {'height': 900, 'url': 'https://external-preview.redd.it/Q2x1AisRYZYutywfjgj8sM2BQdqkOAyqChN_MhgJ2_Q.jpg?auto=webp&amp;s=25c1c9f7a42dbf3ae219f61c8f80e87d4e17d30d', 'width': 1600}, 'variants': {}}]}				78.0	140.0	https://www.binance.com/ru/activity/referral-entry?fromActivityPage=true&amp;ref=LIMIT_HNRG2Q63&amp;utm_campaign=web_share_link&amp;utm_source=reddit								"Реферальная программа для друзей | Приглашайте и зарабатывайте | Binance Official
"	 binance official nan	0.4701630771160126	0.47035762667655945	0.48577210307121277	0.4561181664466858	0.45404478907585144	0.5487059950828552	0.5054483413696289	0.47496336698532104	0.49391406774520874	0.41113823652267456
96	[]	False	Bitcoin_is_plan_A		[]			dark	text	t2_aij0dbgt	False	False	True	[]	False	False	1642351504	twitter.com	https://www.reddit.com/r/Bitcoin/comments/s5fqtu/it_seems_tonga_will_become_a_vulcanomininghub_too/	{}	s5fqtu	False	True	False	False	False	True	False	False		[]	dark	text	False	False	True	0	0	False	all_ads	/r/Bitcoin/comments/s5fqtu/it_seems_tonga_will_become_a_vulcanomininghub_too/	False	6	1642351515	1		True	False	False	Bitcoin	t5_2s3qj	3793961	public	default	It seems Tonga will become a Vulcano-Mining-Hub too	0	[]	1.0	https://twitter.com/LordFusitua/status/1481799664575782914	all_ads	6										https://twitter.com/LordFusitua/status/1481799664575782914								"It seems Tonga will become a Vulcano-Mining-Hub too
"	it seems tonga will become a vulcano mining hub too nan	0.29646822810173035	0.6881257891654968	0.31211546063423157	0.3167392611503601	0.30888551473617554	0.3113182783126831	0.36518973112106323	0.6178487539291382	0.4765539765357971	0.4159538447856903
97	[]	False	Uchiha-Anbu	noob	[{'e': 'text', 't': 'redditor for 3 weeks'}]	2ec8e69e-6c36-11e9-a04b-0afb553d4ea6	redditor for 3 weeks	dark	richtext	t2_htlmx981	False	False	False	[]	False	False	1642351503	self.Bitcoin	https://www.reddit.com/r/Bitcoin/comments/s5fqt8/how_much_makes_it_worth_it/	{}	s5fqt8	False	True	False	False	False	True	True	False		[]	dark	text	False	False	True	0	0	False	all_ads	/r/Bitcoin/comments/s5fqt8/how_much_makes_it_worth_it/	False	6	1642351513	1	Given a timeframe of say 5 years…In your (collective) opinion, how much BTC will it take to have a significant financial impact if hodling? .05? .25? .50? 1.0? More? As a reference, let’s use an average US middle class income.	True	False	False	Bitcoin	t5_2s3qj	3793961	public	self	How much makes it worth it?	0	[]	1.0	https://www.reddit.com/r/Bitcoin/comments/s5fqt8/how_much_makes_it_worth_it/	all_ads	6																		"How much makes it worth it?
Given a timeframe of say 5 years…In your (collective) opinion, how much BTC will it take to have a significant financial impact if hodling? .05? .25? .50? 1.0? More? As a reference, let’s use an average US middle class income."	how much makes it worth it given a timeframe of say 5 years in your collective opinion how much btc will it take to have a significant financial impact if hodling 05 25 50 1 0 more as a reference let s use an average us middle class income 	0.23521970212459564	0.9876482486724854	0.32989004254341125	0.531586229801178	0.008995335549116135	0.4288845956325531	0.08063588291406631	8.373315836252004e-07	0.3725568652153015	0.035764940083026886
