Unnamed: 0	all_awardings	archived	associated_award	author	author_flair_background_color	author_flair_css_class	author_flair_richtext	author_flair_template_id	author_flair_text	author_flair_text_color	author_flair_type	author_fullname	author_patreon_flair	author_premium	body	body_sha1	can_gild	collapsed	collapsed_because_crowd_control	collapsed_reason	collapsed_reason_code	comment_type	controversiality	created_utc	distinguished	gilded	gildings	id	is_submitter	link_id	locked	no_follow	parent_id	permalink	retrieved_utc	score	score_hidden	send_replies	stickied	subreddit	subreddit_id	subreddit_name_prefixed	subreddit_type	top_awarded_type	total_awards_received	treatment_tags	unrepliable_reason	corpus	support	knowledge	conflict	power	similarity	fun	status	trust	identity	romance
57	[]	False		sean488			[]				text	t2_7v02l	False	False	"It could.

It could also lose 2/3 of its value.

NOBODY KNOWS"	c40d6f8c090beb4df4b54914c276391584b970af	True	False					0	1664508720		0	{}	iqgfvkx	False	t3_xrevv0	False	True	t3_xrevv0	/r/Bitcoin/comments/xrevv0/bitcoin_could_double_in_price_says_us_regulator/iqgfvkx/	1664508736	1	True	True	False	Bitcoin	t5_2s3qj	r/Bitcoin	public		0	[]		it could it could also lose 2 3 of its value nobody knows	0.3606402277946472	0.7610737085342407	0.40058380365371704	0.7011651992797852	0.3572819232940674	0.5209969282150269	0.16645121574401855	0.007135883904993534	0.37372568249702454	0.009672591462731361
58	[]	False		tldrpg			[]				text	t2_k96gi	False	False	Lmao	f01af540b3ca4638a70d274cbf46764e6adb2afb	True	False					0	1664508706		0	{}	iqgfunf	False	t3_xriint	False	True	t1_iqgeirk	/r/Bitcoin/comments/xriint/art_collage_of_the_biggest_more_negative/iqgfunf/	1664508722	1	True	True	False	Bitcoin	t5_2s3qj	r/Bitcoin	public		0	[]		lmao	0.46658632159233093	0.45472052693367004	0.5962644815444946	0.4626682698726654	0.4821292459964752	0.6307445764541626	0.49055832624435425	0.4832184314727783	0.47141769528388977	0.4812931716442108
59	[]	False		C01n_sh1LL			[]				text	t2_yzybqnq	False	False	It's literally free money. How is it not worth using? I get $30+ worth of BTC just for paying my bills with it.	daeeca7559494eb4554be43574172ce140ee50ac	True	False					0	1664508693		0	{}	iqgftrr	False	t3_xrmvvo	False	True	t1_iqg6ubc	/r/Bitcoin/comments/xrmvvo/it_feels_like_bitcoin_is_an_an_accumulation_stage/iqgftrr/	1664508705	1	True	True	False	Bitcoin	t5_2s3qj	r/Bitcoin	public		0	[]		it s literally free money how is it not worth using i get 30 worth of btc just for paying my bills with it 	0.3426695764064789	0.9307167530059814	0.45864298939704895	0.03781513497233391	0.10183869302272797	0.41054391860961914	0.0766303539276123	8.154106012625562e-07	0.2643388509750366	0.014065028168261051
60	[]	False		tldrpg			[]				text	t2_k96gi	False	False	Google ‘faketoshi’	3dae4755699fed4ec12ab7746e1b519d06865282	True	False					0	1664508678		0	{}	iqgfsr7	False	t3_xriint	False	True	t1_iqgf1ti	/r/Bitcoin/comments/xriint/art_collage_of_the_biggest_more_negative/iqgfsr7/	1664508690	1	True	True	False	Bitcoin	t5_2s3qj	r/Bitcoin	public		0	[]		google faketoshi 	0.42856648564338684	0.5201229453086853	0.45587268471717834	0.446767657995224	0.4650970697402954	0.26614171266555786	0.4833088517189026	0.47547274827957153	0.48199012875556946	0.1464432030916214
61	[]	False		perdooky			[]				text	t2_auy3e	False	False	"Dotted line almost up towards all time 12 month high for google trends ""how to buy bitcoin"" in UK: https://trends.google.com/trends/explore?geo=GB&amp;q=how%20to%20buy%20bitcoin"	799b7782510809ae985f220774aa09c9b0c695b6	True	False					0	1664508672		0	{}	iqgfsc3	False	t3_xrdven	False	True	t3_xrdven	/r/Bitcoin/comments/xrdven/pound_imploding_uk_bitcoin_volume_exploding/iqgfsc3/	1664508690	1	True	True	False	Bitcoin	t5_2s3qj	r/Bitcoin	public		0	[]		dotted line almost up towards all time 12 month high for google trends how to buy bitcoin in uk https trends google com trends explore geo gb amp q how 20to 20buy 20bitcoin	0.0019341681618243456	0.9954355359077454	0.048859208822250366	0.06457481533288956	0.8872687816619873	0.05032510310411453	0.21288402378559113	8.506434028276999e-07	0.4701022505760193	1.5565257854177617e-05
62	[]	False		MoneySG24			[]				text	t2_y0jer	False	False	what show is this?	6a6ef9908a8f058133a57f90df11622ff8b4d9aa	True	False					0	1664508671		0	{}	iqgfsaa	False	t3_xrg1w4	False	True	t3_xrg1w4	/r/Bitcoin/comments/xrg1w4/keep_stacking_sats_will_win/iqgfsaa/	1664508682	1	True	True	False	Bitcoin	t5_2s3qj	r/Bitcoin	public		0	[]		what show is this 	0.46150416135787964	0.5055023431777954	0.44626545906066895	0.5357193946838379	0.47537752985954285	0.53924959897995	0.45368683338165283	0.4766694903373718	0.4913565516471863	0.33443325757980347
63	[]	False		TonySenese			[]				text	t2_elnz10yp	False	False	"It doesn't get any better from this, this probably is the shit.

This is as good as it gets, everything dropped but btc didn't. That's how good it was."	1e07827a5641d4fbb75143d16eff0f3c4f2830d4	True	False					0	1664508664		0	{}	iqgfrtf	False	t3_xqyxxs	False	False	t1_iqe1itm	/r/Bitcoin/comments/xqyxxs/daily_discussion_september_29_2022/iqgfrtf/	1664508683	1	True	True	False	Bitcoin	t5_2s3qj	r/Bitcoin	public		0	[]		it doesn t get any better from this this probably is the shit this is as good as it gets everything dropped but btc didn t that s how good it was 	0.0883629322052002	0.9597037434577942	0.7625272870063782	0.008587876334786415	0.5478587746620178	0.8152310848236084	0.06718948483467102	8.518269396518008e-07	0.35851627588272095	0.014138887636363506
64	[]	False		lavazzalove			[]				text	t2_7ne0d	False	False	The free stuff is just leads generation mechanism for their paid services.	409649032e265304e7dc528b36628f698f1aa257	True	False					0	1664508661		0	{}	iqgfrje	False	t3_xrey58	False	True	t1_iqffsnq	/r/Bitcoin/comments/xrey58/just_how_outrageous_is_a_500000_price_target_for/iqgfrje/	1664508675	1	True	True	False	Bitcoin	t5_2s3qj	r/Bitcoin	public		0	[]		the free stuff is just leads generation mechanism for their paid services 	0.23577183485031128	0.8075209856033325	0.404326468706131	0.3486904501914978	0.4783494770526886	0.41686809062957764	0.22207506000995636	0.40496689081192017	0.37060222029685974	0.0009977886220440269
65	[]	False		polloponzi			[]				text	t2_62fsc95g	False	True	Craig Wright	eb918f456674fd62bf27200a9835005228dd4d4d	True	False					0	1664508659		0	{}	iqgfrgd	True	t3_xriint	False	True	t1_iqgf1ti	/r/Bitcoin/comments/xriint/art_collage_of_the_biggest_more_negative/iqgfrgd/	1664508675	1	True	True	False	Bitcoin	t5_2s3qj	r/Bitcoin	public		0	[]		craig wright	0.4528694748878479	0.40324270725250244	0.5223466157913208	0.4786817729473114	0.47388574481010437	0.5910652875900269	0.5086694359779358	0.4737820029258728	0.45449042320251465	0.4929371476173401
66	[]	False		mciblast			[]				text	t2_838l0iag	False	False	If it's not us then who can you tell a little more about that huh?	968558ab3cf58aa9ec5176210820f17c8d88b25e	True	False					0	1664508648		0	{}	iqgfqqm	False	t3_xqyxxs	False	True	t1_iqcspab	/r/Bitcoin/comments/xqyxxs/daily_discussion_september_29_2022/iqgfqqm/	1664508667	1	True	True	False	Bitcoin	t5_2s3qj	r/Bitcoin	public		0	[]		if it s not us then who can you tell a little more about that huh 	0.3971438705921173	0.536753237247467	0.5023107528686523	0.6809276938438416	0.3350531756877899	0.5610758662223816	0.08037380129098892	8.979873200587463e-07	0.33945801854133606	0.018510114401578903
67	[]	False		Nada_Lives			[]				text	t2_4yjkrfk	False	False	Not your retirement fiat. Not your retirement Bitcoin.	171b357b1efcb6e640afc95e86d5081f9a7e5626	True	False					0	1664508632		0	{}	iqgfpnc	False	t3_xrq7ft	False	True	t3_xrq7ft	/r/Bitcoin/comments/xrq7ft/regulation_to_allow_bitcoin_in_401k_plans_incoming/iqgfpnc/	1664508651	1	True	True	False	Bitcoin	t5_2s3qj	r/Bitcoin	public		0	[]		not your retirement fiat not your retirement bitcoin 	0.445416122674942	0.4192160665988922	0.5033956170082092	0.5556278228759766	0.24375087022781372	0.05664545297622681	0.43294504284858704	0.26026132702827454	0.48940619826316833	0.0001449476258130744
68	[]	False		mtsorens			[]				text	t2_2s5q9kp	False	True	This is the way	c2b8ec15768920aca0cdf91c105d5e8a7cb1cef3	True	False					0	1664508605		0	{}	iqgfnq0	False	t3_xrmvvo	False	True	t1_iqge5c0	/r/Bitcoin/comments/xrmvvo/it_feels_like_bitcoin_is_an_an_accumulation_stage/iqgfnq0/	1664508620	1	True	True	False	Bitcoin	t5_2s3qj	r/Bitcoin	public		0	[]		this is the way	0.4956483840942383	0.5096455812454224	0.4449433982372284	0.5132778882980347	0.489803671836853	0.5338488817214966	0.4392101466655731	0.5120147466659546	0.4932752847671509	0.36377185583114624
69	[]	False		hatschky			[]				text	t2_75ehanb4	False	False	The wheel just keeps on turning, it just keeps on going like this.	71a369ad98733c185ac20a2fbfb059583e487017	True	False					0	1664508605		0	{}	iqgfnp7	False	t3_xqyxxs	False	True	t1_iqc0lku	/r/Bitcoin/comments/xqyxxs/daily_discussion_september_29_2022/iqgfnp7/	1664508620	1	True	True	False	Bitcoin	t5_2s3qj	r/Bitcoin	public		0	[]		the wheel just keeps on turning it just keeps on going like this 	0.31404244899749756	0.5748038291931152	0.6588583588600159	0.15015041828155518	0.520938515663147	0.6881883144378662	0.1155325248837471	0.023917879909276962	0.25520798563957214	0.003889125306159258
70	[]	False		polloponzi			[]				text	t2_62fsc95g	False	True	"&gt;ET

**ET**hereum

🤔"	00ffb8275823e0df220fbbe8912708ee78e5141a	True	False					0	1664508597		0	{}	iqgfn7f	True	t3_xriint	False	True	t1_iqgek4y	/r/Bitcoin/comments/xriint/art_collage_of_the_biggest_more_negative/iqgfn7f/	1664508612	1	True	True	False	Bitcoin	t5_2s3qj	r/Bitcoin	public		0	[]		 gt et et hereum 	0.2629006505012512	0.5594057440757751	0.42630261182785034	0.46746957302093506	0.46826866269111633	0.40643733739852905	0.49306386709213257	0.5450922846794128	0.49561014771461487	0.351057231426239
71	[]	False		bitcoin_islander			[]			dark	text	t2_kx3qokux	False	False	No one wants it but everyone will use it since they like free fiat airdrops	ea2cd8cd60aef2d09cedb2319ec9e7a63591a4d8	True	False					0	1664508593		0	{}	iqgfmy8	False	t3_xravq2	False	True	t1_iqdujf9	/r/Bitcoin/comments/xravq2/ecb_chief_lagarde_we_stand_for_bankers_if_central/iqgfmy8/	1664508604	1	True	True	False	Bitcoin	t5_2s3qj	r/Bitcoin	public		0	[]		no one wants it but everyone will use it since they like free fiat airdrops	0.35632768273353577	0.7220129370689392	0.314951092004776	0.43060219287872314	0.4626699686050415	0.1571188122034073	0.14185985922813416	0.5285682678222656	0.411955863237381	0.0009149213437922299
72	[]	False		Secure-Rich3501		noob	[{'e': 'text', 't': 'redditor for 2 days'}]	2ec8e69e-6c36-11e9-a04b-0afb553d4ea6	redditor for 2 days	dark	richtext	t2_q8ctudsb	False	False	"Have you seen the comparisons of gold mining compared to Bitcoin?
Do you understand what cyanide tailings are?  Do you know how much the ecosystem is disrupted by mining?  Do you know what chemicals they use to treat the dirt?

Does Bitcoin mining involve fossil fuel burning massive bulldozers and caterpillars of various types?  

Do you understand how Bitcoin can offset utility company expenses when it comes to unreliable sources of energy like solar and wind?  Do you understand how Bitcoin mining can use energy that is wasted and pollutes the atmosphere, burn off and other unusable forms of excess energy from power plants that Bitcoin mining could utilize.  

When renewables are producing too much energy because of lots of sun and wind that energy doesn't need to be wasted but can generate income for renewable energy companies and when they have excess stored energy they can use it to mine Bitcoin and this extra revenue can expand the use of renewables.  And any energy allocation potential that is set up to mine Bitcoin can be cut off during high demand periods of the grid.  Bitcoin can generate another resource of income and balance out the on and off varieties of energy demand and energy production from variable renewable energy sources."	9838b26ccc6b093dfef489cc0be01bbf7644f479	True	False					0	1664508586		0	{}	iqgfmg1	False	t3_xrpg92	False	True	t3_xrpg92	/r/Bitcoin/comments/xrpg92/the_world_needs_bitcoin_as_a_universal_legal/iqgfmg1/	1664508605	1	True	True	False	Bitcoin	t5_2s3qj	r/Bitcoin	public		0	[]		have you seen the comparisons of gold mining compared to bitcoin do you understand what cyanide tailings are do you know how much the ecosystem is disrupted by mining do you know what chemicals they use to treat the dirt does bitcoin mining involve fossil fuel burning massive bulldozers and caterpillars of various types do you understand how bitcoin can offset utility company expenses when it comes to unreliable sources of energy like solar and wind do you understand how bitcoin mining can use energy that is wasted and pollutes the atmosphere burn off and other unusable forms of excess energy from power plants that bitcoin mining could utilize when renewables are producing too much energy because of lots of sun and wind that energy doesn t need to be wasted but can generate income for renewable energy companies and when they have excess stored energy they can use it to mine bitcoin and this extra revenue can expand the use of renewables and any energy allocation potential that is set up to mine bitcoin can be cut off during high demand periods of the grid bitcoin can generate another resource of income and balance out the on and off varieties of energy demand and energy production from variable renewable energy sources 	0.002965744584798813	0.9880021810531616	0.2948422431945801	0.9362884759902954	0.9937272071838379	0.16568231582641602	0.12143795937299728	8.380481517633598e-07	0.3342253863811493	0.014635825529694557
73	[]	False		jdog1949			[]				text	t2_90kd6q1g	False	False	I believe world bankers (WEF) will eventually huddle and develop a one world currency (electronic, call it Ebuck), now technically feasible, using full force of all world governments, force everyone to exchange any and all currency at WEF determined value for Ebucks. People will have a deadline to exchange after which their currency will have no value and cannot be used or recognized by anyone for any transaction. Any attempt at using anything else will be criminal with strict enforcement. Governments can then track every nickel, electronically, worldwide 🌐. No more cash under the mattress, no gig economy, no under the table transactions, no tax avoidance, no cheating, no money laundering, ever again. Nothing can be bought or sold outside one world Ebuck currency regime. Huge benefits to governments, iron fisted enforced compliance by people utterly subjugated to the almighty Ebuck. Only governments will have economic power. A currency twist on 1984. Those who control the currency control all. I believe something similar to this is being studied even now.	069f230e79798feeddc99ba9bb744145a59e6869	True	False					0	1664508582		0	{}	iqgfm4l	False	t3_xqv7ft	False	True	t3_xqv7ft	/r/Bitcoin/comments/xqv7ft/all_the_currencies_crashing_against_the_usd_were/iqgfm4l/	1664508597	1	True	True	False	Bitcoin	t5_2s3qj	r/Bitcoin	public		0	[]		i believe world bankers wef will eventually huddle and develop a one world currency electronic call it ebuck now technically feasible using full force of all world governments force everyone to exchange any and all currency at wef determined value for ebucks people will have a deadline to exchange after which their currency will have no value and cannot be used or recognized by anyone for any transaction any attempt at using anything else will be criminal with strict enforcement governments can then track every nickel electronically worldwide no more cash under the mattress no gig economy no under the table transactions no tax avoidance no cheating no money laundering ever again nothing can be bought or sold outside one world ebuck currency regime huge benefits to governments iron fisted enforced compliance by people utterly subjugated to the almighty ebuck only governments will have economic power a currency twist on 1984 those who control the currency control all i believe something similar to this is being studied even now 	0.0025332369841635227	0.9881792068481445	0.7859773635864258	0.9489377737045288	0.0090312659740448	0.3873059153556824	0.06748121976852417	8.454849762529193e-07	0.5016473531723022	0.03969258442521095
74	[]	False		Evil-B			[]				text	t2_ehg58ur7	False	False	Steal it.	0c0e6bce27716602e694f657d79f1cf84b0533eb	True	False					0	1664508570		0	{}	iqgfldo	False	t3_xrmvvo	False	True	t3_xrmvvo	/r/Bitcoin/comments/xrmvvo/it_feels_like_bitcoin_is_an_an_accumulation_stage/iqgfldo/	1664508582	1	True	True	False	Bitcoin	t5_2s3qj	r/Bitcoin	public		0	[]		steal it 	0.4447191655635834	0.4885382354259491	0.5531885027885437	0.4928855299949646	0.4756363332271576	0.5946410894393921	0.4223114848136902	0.5011411905288696	0.4731983244419098	0.5004479289054871
75	[]	False		tecampanero			[]				text	t2_13frfd	False	False	without having to buy?....I guess kidnapping and robbing people of their seed phrases is an option.....	2a75c4635d0e859aab6f6f84e85c40fcbcae6295	True	False					0	1664508565		0	{}	iqgfl0g	False	t3_xrmvvo	False	True	t3_xrmvvo	/r/Bitcoin/comments/xrmvvo/it_feels_like_bitcoin_is_an_an_accumulation_stage/iqgfl0g/	1664508582	1	True	True	False	Bitcoin	t5_2s3qj	r/Bitcoin	public		0	[]		without having to buy i guess kidnapping and robbing people of their seed phrases is an option 	0.15270888805389404	0.6151988506317139	0.7236959934234619	0.07136719673871994	0.20947806537151337	0.23791305720806122	0.12142623215913773	0.5288792252540588	0.4780234694480896	0.0032243779860436916
76	[]	False		sean488			[]				text	t2_7v02l	False	False	It's made me a pretty good living.	189d680bff2ca307477d1c8103cc97687f8cdd49	True	False					0	1664508557		0	{}	iqgfkeu	False	t3_xqsbfk	False	True	t1_iqgefyg	/r/Bitcoin/comments/xqsbfk/what_happens_to_bitcoin_in_an_event_of_internet/iqgfkeu/	1664508574	1	True	True	False	Bitcoin	t5_2s3qj	r/Bitcoin	public		0	[]		it s made me a pretty good living 	0.5277573466300964	0.3445304334163666	0.3204943537712097	0.2323494553565979	0.5593114495277405	0.7637854218482971	0.4195399880409241	0.2650575041770935	0.44099757075309753	0.144587442278862
77	[]	False		Responsible_Water840			[]				text	t2_cj7oj5bf	False	False	I believe you crypto people give a great deal of imports to volume… tell me, what is the volume of the gbp?	73c7e5acd6994b549acc475893ccdd02cf8dca5e	True	False					0	1664508339		0	{}	iqgf5f4	False	t3_xr3ipd	False	True	t3_xr3ipd	/r/Bitcoin/comments/xr3ipd/in_2021_bank_of_england_warned_that_bitcoin_could/iqgf5f4/	1664508357	1	True	True	False	Bitcoin	t5_2s3qj	r/Bitcoin	public		0	[]		i believe you crypto people give a great deal of imports to volume tell me what is the volume of the gbp 	0.11460661143064499	0.744749128818512	0.21015185117721558	0.12173863500356674	0.2432287335395813	0.43112149834632874	0.17398224771022797	0.735875129699707	0.29302549362182617	0.017615294083952904
78	[]	False		Arjunan1			[]				text	t2_lua7a5j	False	False	"Who is the ""FAKE"" guy?"	bfc55298dfbd4e642b6a8c106e2911d33ea9f0ca	True	False					0	1664508288		0	{}	iqgf1ti	False	t3_xriint	False	True	t3_xriint	/r/Bitcoin/comments/xriint/art_collage_of_the_biggest_more_negative/iqgf1ti/	1664508302	1	True	True	False	Bitcoin	t5_2s3qj	r/Bitcoin	public		0	[]		who is the fake guy 	0.3630993664264679	0.4498589038848877	0.6687518358230591	0.46787941455841064	0.4982355237007141	0.7184027433395386	0.31473207473754883	0.5023097991943359	0.44715288281440735	0.32766687870025635
79	[]	False		silverfox0155			[]				text	t2_4qtz82vj	False	False	Accept Bitcoin at any business you start	01975656723fbaa4ef628a47d5f0531ddca4d7f4	True	False					0	1664508246		0	{}	iqgeyvk	False	t3_xrmvvo	False	True	t3_xrmvvo	/r/Bitcoin/comments/xrmvvo/it_feels_like_bitcoin_is_an_an_accumulation_stage/iqgeyvk/	1664508257	1	True	True	False	Bitcoin	t5_2s3qj	r/Bitcoin	public		0	[]		accept bitcoin at any business you start	0.537149965763092	0.4868818521499634	0.5592517256736755	0.6042490005493164	0.4486084282398224	0.4599718451499939	0.4080960154533386	0.5092159509658813	0.3939448595046997	0.2610836625099182
80	[]	False		ZeChief			[]				text	t2_1r1gk3y4	False	False	It is not in an accumulation phase. It is still in a downtrend from a purely technical standpoint. Still getting lower highs and lower lows if you check the weekly chart since November. An accumulation stage would mean that the market bottoms out without clearly lower highs and lower lows. Please someone correct me if I am wrong.	cac14c09b194446517c1de2e35c752e18af42d22	True	False					0	1664508241		0	{}	iqgeyiu	False	t3_xrmvvo	False	True	t3_xrmvvo	/r/Bitcoin/comments/xrmvvo/it_feels_like_bitcoin_is_an_an_accumulation_stage/iqgeyiu/	1664508257	1	True	True	False	Bitcoin	t5_2s3qj	r/Bitcoin	public		0	[]		it is not in an accumulation phase it is still in a downtrend from a purely technical standpoint still getting lower highs and lower lows if you check the weekly chart since november an accumulation stage would mean that the market bottoms out without clearly lower highs and lower lows please someone correct me if i am wrong 	0.0028076462913304567	0.9877102375030518	0.882721483707428	0.013038801029324532	0.8942651748657227	0.39411622285842896	0.08578469604253769	8.438216241302143e-07	0.26843589544296265	0.09820692986249924
81	[]	False		mrASSMAN			[]				text	t2_322c2	False	False	Honestly whether physical currency or not isn’t really relevant.. a dollar is a dollar	af0773284aafb4036d86a360f4bb6363899e8fe6	True	False					0	1664508194		0	{}	iqgev3y	False	t3_xr3ipd	False	True	t1_iqgbtyg	/r/Bitcoin/comments/xr3ipd/in_2021_bank_of_england_warned_that_bitcoin_could/iqgev3y/	1664508205	1	True	True	False	Bitcoin	t5_2s3qj	r/Bitcoin	public		0	[]		honestly whether physical currency or not isn t really relevant a dollar is a dollar	0.05532464012503624	0.7769413590431213	0.649179995059967	0.10054746270179749	0.20659498870372772	0.30821335315704346	0.1679333597421646	1.1062212479373557e-06	0.4667525887489319	0.0007796810823492706
82	[]	False		xxx375kl			[]				text	t2_jl3hmv0g	False	False	Lol this is crypto market and you don't know much about it.	9959c637cddc9d4a6153943a98d02e59a700456d	True	False					0	1664508143		0	{}	iqgerjw	False	t3_xqlgq7	False	True	t1_iqcterp	/r/Bitcoin/comments/xqlgq7/being_british_and_watching_the_pound_collapse/iqgerjw/	1664508159	1	True	True	False	Bitcoin	t5_2s3qj	r/Bitcoin	public		0	[]		lol this is crypto market and you don t know much about it 	0.15079057216644287	0.6098991632461548	0.2715471386909485	0.14234627783298492	0.24473881721496582	0.5439568161964417	0.2696616053581238	0.7005050182342529	0.4347877502441406	0.0041257236152887344
83	[]	False		Secure-Rich3501		noob	[{'e': 'text', 't': 'redditor for 2 days'}]	2ec8e69e-6c36-11e9-a04b-0afb553d4ea6	redditor for 2 days	dark	richtext	t2_q8ctudsb	False	False	Worthy at least given his early history writing about Bitcoin and getting paid in Bitcoin.  Writing for Bitcoin magazine	d482dac9eff9c3b42eaa73f90ee15ed573848eeb	True	False					0	1664508130		0	{}	iqgeqn3	False	t3_xriint	False	True	t1_iqf2vs9	/r/Bitcoin/comments/xriint/art_collage_of_the_biggest_more_negative/iqgeqn3/	1664508144	1	True	True	False	Bitcoin	t5_2s3qj	r/Bitcoin	public		0	[]		worthy at least given his early history writing about bitcoin and getting paid in bitcoin writing for bitcoin magazine	0.1412619650363922	0.8117516040802002	0.4019013047218323	0.06101639196276665	0.09359291940927505	0.2296290248632431	0.31189486384391785	0.8336676955223083	0.31893327832221985	0.0035848645493388176
84	[]	False		giahuylpu			[]				text	t2_iu6tqhyb	False	False	Why should it? Did something happen? I don't think so.	7e069d6295af7a3f6bbc1745370e02c98adbbbcb	True	False					0	1664508105		0	{}	iqgeota	False	t3_xqyxxs	False	True	t1_iqeskpw	/r/Bitcoin/comments/xqyxxs/daily_discussion_september_29_2022/iqgeota/	1664508121	1	True	True	False	Bitcoin	t5_2s3qj	r/Bitcoin	public		0	[]		why should it did something happen i don t think so 	0.3892916738986969	0.37590017914772034	0.44236060976982117	0.27166855335235596	0.4009147584438324	0.7986711263656616	0.22711433470249176	0.013764582574367523	0.4494844973087311	0.020493382588028908
85	[]	False		SydZzZ			[]				text	t2_o9kzh	False	False	This isn’t 2010 bro where you get 10 bitcoins for completing a captcha	b12bab4a1d688fd0be0234632345c41a8422a4a7	True	False					0	1664508103		0	{}	iqgeood	False	t3_xrmvvo	False	True	t3_xrmvvo	/r/Bitcoin/comments/xrmvvo/it_feels_like_bitcoin_is_an_an_accumulation_stage/iqgeood/	1664508114	1	True	True	False	Bitcoin	t5_2s3qj	r/Bitcoin	public		0	[]		this isn t 2010 bro where you get 10 bitcoins for completing a captcha	0.27678990364074707	0.5142611265182495	0.2270480990409851	0.06969093531370163	0.20754790306091309	0.20513969659805298	0.4372282922267914	0.0025550604332238436	0.30285975337028503	0.0012876936234533787
86	[]	False		FUDnot			[]			dark	text	t2_ckg0lw9s	False	False	lolli still gives you free btc every day. it's not much... ususally like 42 sats or so. But its something!	4ea6d606082f67a2af70cf6cd7fdafa7e5954b79	True	False					0	1664508090		0	{}	iqgenri	False	t3_xrmvvo	False	True	t3_xrmvvo	/r/Bitcoin/comments/xrmvvo/it_feels_like_bitcoin_is_an_an_accumulation_stage/iqgenri/	1664508106	1	True	True	False	Bitcoin	t5_2s3qj	r/Bitcoin	public		0	[]		lolli still gives you free btc every day it s not much ususally like 42 sats or so but its something 	0.41833844780921936	0.8123981356620789	0.46431905031204224	0.015195263549685478	0.24095693230628967	0.4774719476699829	0.08703354746103287	0.10109797865152359	0.5028766989707947	0.012563375756144524
