39	[]	False	gen66		[]				text	t2_io6sw	False	False	True	[]	False	False	1642330257	i.redd.it	https://www.reddit.com/r/Bitcoin/comments/s59f7n/20_minutes_into_schiff_and_chill/	{}	s59f7n	False	False	False	False	True	False	False	False		[]	dark	text	False	False	True	0	0	False	all_ads	/r/Bitcoin/comments/s59f7n/20_minutes_into_schiff_and_chill/	False	6	1642330267	1		True	False	False	Bitcoin	t5_2s3qj	3792827	public	https://b.thumbs.redditmedia.com/T9ZjAfpPP91NE8bLFjnoHTTtU7CAHhgdrMXjFeY3JYw.jpg	20 minutes into Schiff and chill…	0	[]	1.0	https://i.redd.it/l1b9284j51c81.jpg	all_ads	6			image	{'enabled': True, 'images': [{'id': 'RkpjyIXo40B9Nxt8x8KSfgGfZRWNXHk-e7aAz9qbU34', 'resolutions': [{'height': 161, 'url': 'https://preview.redd.it/l1b9284j51c81.jpg?width=108&amp;crop=smart&amp;auto=webp&amp;s=efb527e6565d480dd2e48e2a6f80e5e552b3f03a', 'width': 108}, {'height': 323, 'url': 'https://preview.redd.it/l1b9284j51c81.jpg?width=216&amp;crop=smart&amp;auto=webp&amp;s=3a9d3d774a608e29553cc12caf980fc22346df2f', 'width': 216}, {'height': 478, 'url': 'https://preview.redd.it/l1b9284j51c81.jpg?width=320&amp;crop=smart&amp;auto=webp&amp;s=7912504a02b8fd6adf45243f3dec72a619e0f881', 'width': 320}], 'source': {'height': 748, 'url': 'https://preview.redd.it/l1b9284j51c81.jpg?auto=webp&amp;s=7016608ec4bca135f07731b5a204262d26cc3341', 'width': 500}, 'variants': {}}]}	automod_filtered			140.0	140.0	https://i.redd.it/l1b9284j51c81.jpg								"20 minutes into Schiff and chill…
"	20 minutes into schiff and chill nan	0.4705784022808075	0.5217642784118652	0.3134639263153076	0.3517637848854065	0.3340883255004883	0.46249037981033325	0.358999103307724	0.44022971391677856	0.41694608330726624	0.2825489342212677
40	[]	False	Bitcoin_is_plan_A		[]			dark	text	t2_aij0dbgt	False	False	True	[]	False	False	1642330133	youtube.com	https://www.reddit.com/r/Bitcoin/comments/s59dxs/10_myths_about_government_debt/	{}	s59dxs	False	True	False	False	False	True	False	False		[]	dark	text	False	False	True	0	0	False	all_ads	/r/Bitcoin/comments/s59dxs/10_myths_about_government_debt/	False	6	1642330143	1		True	False	False	Bitcoin	t5_2s3qj	3792826	public	https://b.thumbs.redditmedia.com/aGyCFJL-d-gYhKLOxr5ejidfmUPqXys_AzMoDJAYkug.jpg	10 Myths About Government Debt	0	[]	1.0	https://www.youtube.com/watch?v=EPjrFjAxwlw	all_ads	6	"{'oembed': {'author_name': 'Learn Liberty', 'author_url': 'https://www.youtube.com/c/LearnLiberty', 'height': 200, 'html': '&lt;iframe width=""356"" height=""200"" src=""https://www.youtube.com/embed/EPjrFjAxwlw?feature=oembed&amp;enablejsapi=1"" frameborder=""0"" allow=""accelerometer; autoplay; clipboard-write; encrypted-media; gyroscope; picture-in-picture"" allowfullscreen&gt;&lt;/iframe&gt;', 'provider_name': 'YouTube', 'provider_url': 'https://www.youtube.com/', 'thumbnail_height': 360, 'thumbnail_url': 'https://i.ytimg.com/vi/EPjrFjAxwlw/hqdefault.jpg', 'thumbnail_width': 480, 'title': 'Prof. Antony Davies: 10 Myths About Government Debt', 'type': 'video', 'version': '1.0', 'width': 356}, 'type': 'youtube.com'}"	"{'content': '&lt;iframe width=""356"" height=""200"" src=""https://www.youtube.com/embed/EPjrFjAxwlw?feature=oembed&amp;enablejsapi=1"" frameborder=""0"" allow=""accelerometer; autoplay; clipboard-write; encrypted-media; gyroscope; picture-in-picture"" allowfullscreen&gt;&lt;/iframe&gt;', 'height': 200, 'scrolling': False, 'width': 356}"	rich:video	{'enabled': False, 'images': [{'id': 'vKjqQHwqtQNr76_RMUE0oc0Hx-i2Rq2Ja7qevs1EX8E', 'resolutions': [{'height': 81, 'url': 'https://external-preview.redd.it/V3-kTdeqRnk-mtt96fCooh3ooVt-X8OEVEdv0oXWOyM.jpg?width=108&amp;crop=smart&amp;auto=webp&amp;s=6832b835c435695995fce973dfa3b026c7655225', 'width': 108}, {'height': 162, 'url': 'https://external-preview.redd.it/V3-kTdeqRnk-mtt96fCooh3ooVt-X8OEVEdv0oXWOyM.jpg?width=216&amp;crop=smart&amp;auto=webp&amp;s=aa2a1bb9b11f026a31c3c8cd106e13ab988632a9', 'width': 216}, {'height': 240, 'url': 'https://external-preview.redd.it/V3-kTdeqRnk-mtt96fCooh3ooVt-X8OEVEdv0oXWOyM.jpg?width=320&amp;crop=smart&amp;auto=webp&amp;s=ec6fa679908537ffeeb206206c97653c5cdce755', 'width': 320}], 'source': {'height': 360, 'url': 'https://external-preview.redd.it/V3-kTdeqRnk-mtt96fCooh3ooVt-X8OEVEdv0oXWOyM.jpg?auto=webp&amp;s=fda24dbbfa559f42ef2d9efb1376c60b5d669b80', 'width': 480}, 'variants': {}}]}		"{'oembed': {'author_name': 'Learn Liberty', 'author_url': 'https://www.youtube.com/c/LearnLiberty', 'height': 200, 'html': '&lt;iframe width=""356"" height=""200"" src=""https://www.youtube.com/embed/EPjrFjAxwlw?feature=oembed&amp;enablejsapi=1"" frameborder=""0"" allow=""accelerometer; autoplay; clipboard-write; encrypted-media; gyroscope; picture-in-picture"" allowfullscreen&gt;&lt;/iframe&gt;', 'provider_name': 'YouTube', 'provider_url': 'https://www.youtube.com/', 'thumbnail_height': 360, 'thumbnail_url': 'https://i.ytimg.com/vi/EPjrFjAxwlw/hqdefault.jpg', 'thumbnail_width': 480, 'title': 'Prof. Antony Davies: 10 Myths About Government Debt', 'type': 'video', 'version': '1.0', 'width': 356}, 'type': 'youtube.com'}"	"{'content': '&lt;iframe width=""356"" height=""200"" src=""https://www.youtube.com/embed/EPjrFjAxwlw?feature=oembed&amp;enablejsapi=1"" frameborder=""0"" allow=""accelerometer; autoplay; clipboard-write; encrypted-media; gyroscope; picture-in-picture"" allowfullscreen&gt;&lt;/iframe&gt;', 'height': 200, 'media_domain_url': 'https://www.redditmedia.com/mediaembed/s59dxs', 'scrolling': False, 'width': 356}"	105.0	140.0	https://www.youtube.com/watch?v=EPjrFjAxwlw								"10 Myths About Government Debt
"	10 myths about government debt nan	0.365456759929657	0.6141047477722168	0.5677337050437927	0.520194947719574	0.41908204555511475	0.23001930117607117	0.36935949325561523	0.4292123317718506	0.5001121163368225	0.026649234816432
41	[]	False	Ur-Majestic		[]				text	t2_8q9zdbn7	False	False	False	[]	False	False	1642330107	self.Bitcoin	https://www.reddit.com/r/Bitcoin/comments/s59dpq/central_bank_digital_currency_cbdc_has_no_place/	{}	s59dpq	False	True	False	False	False	True	True	False		[]	dark	text	False	False	True	0	0	False	all_ads	/r/Bitcoin/comments/s59dpq/central_bank_digital_currency_cbdc_has_no_place/	False	6	1642330118	1	IMO	True	False	False	Bitcoin	t5_2s3qj	3792825	public	self	Central Bank Digital Currency (CBDC) has no place in the crypto world. It's exactly the opposite of what humanity wants/needs.	0	[]	1.0	https://www.reddit.com/r/Bitcoin/comments/s59dpq/central_bank_digital_currency_cbdc_has_no_place/	all_ads	6																		"Central Bank Digital Currency (CBDC) has no place in the crypto world. It's exactly the opposite of what humanity wants/needs.
IMO"	central bank digital currency cbdc has no place in the crypto world it s exactly the opposite of what humanity wants needs imo	0.010681305080652237	0.9779012203216553	0.5622778534889221	0.8157751560211182	0.448068767786026	0.3276989161968231	0.11303549259901047	0.5504446625709534	0.5048518776893616	0.00697903661057353
42	[]	False	Taro_Secret		[]				text	t2_8rlxsb7w	False	False	False	[]	False	False	1642330075	/r/Bitcoin/comments/s59dgl/httpsdiscordgg8jgbqat6a5/	https://www.reddit.com/r/Bitcoin/comments/s59dgl/httpsdiscordgg8jgbqat6a5/	{}	s59dgl	False	True	False	False	False	True	False	True		[]	dark	text	False	False	True	0	0	False	all_ads	/r/Bitcoin/comments/s59dgl/httpsdiscordgg8jgbqat6a5/	False	6	1642330086	1		True	False	False	Bitcoin	t5_2s3qj	3792825	public	https://b.thumbs.redditmedia.com/vFaATnHZP0GX1PRWa7Gx73gTz2wWs7DzuxEqsRQ4aUY.jpg	https://discord.gg/8jgbQAT6a5	0	[]	1.0	https://v.redd.it/fyo6133y41c81	all_ads	6			hosted:video	{'enabled': False, 'images': [{'id': 'LTtTuYCPDhjWmxXVCLDrdlkqV9bggzDTJtxqc79uodg', 'resolutions': [{'height': 108, 'url': 'https://external-preview.redd.it/q-2PozYQQ97pysQyWjfuVhvz-vIm8t0_TnaVui5aEaI.png?width=108&amp;crop=smart&amp;format=pjpg&amp;auto=webp&amp;s=675c6edfac047212bcf73ff385e2a13fe4880c4f', 'width': 108}, {'height': 216, 'url': 'https://external-preview.redd.it/q-2PozYQQ97pysQyWjfuVhvz-vIm8t0_TnaVui5aEaI.png?width=216&amp;crop=smart&amp;format=pjpg&amp;auto=webp&amp;s=a4f1d7f7c820cfc1cda473770c77e7e3432cdaef', 'width': 216}, {'height': 320, 'url': 'https://external-preview.redd.it/q-2PozYQQ97pysQyWjfuVhvz-vIm8t0_TnaVui5aEaI.png?width=320&amp;crop=smart&amp;format=pjpg&amp;auto=webp&amp;s=51cf6ed446861bc7b3af59b0ee5d68cd3a22e095', 'width': 320}, {'height': 640, 'url': 'https://external-preview.redd.it/q-2PozYQQ97pysQyWjfuVhvz-vIm8t0_TnaVui5aEaI.png?width=640&amp;crop=smart&amp;format=pjpg&amp;auto=webp&amp;s=5d1a237da99fa8c10a4052ab4d0254d801651b78', 'width': 640}, {'height': 960, 'url': 'https://external-preview.redd.it/q-2PozYQQ97pysQyWjfuVhvz-vIm8t0_TnaVui5aEaI.png?width=960&amp;crop=smart&amp;format=pjpg&amp;auto=webp&amp;s=14b6e31bba866be7d5fff0d027d1d3f0467ab9e1', 'width': 960}], 'source': {'height': 1000, 'url': 'https://external-preview.redd.it/q-2PozYQQ97pysQyWjfuVhvz-vIm8t0_TnaVui5aEaI.png?format=pjpg&amp;auto=webp&amp;s=f98d52b1bbe83d21eb3c1f1770aefd239b36f98d', 'width': 1000}, 'variants': {}}]}				140.0	140.0	https://v.redd.it/fyo6133y41c81								"https://discord.gg/8jgbQAT6a5
"	https discord gg 8jgbqat6a5 nan	0.3677976429462433	0.44166165590286255	0.5308513045310974	0.4750845730304718	0.4178348481655121	0.5632880330085754	0.48290741443634033	0.37306851148605347	0.48898932337760925	0.09890539199113846
43	[]	False	AsifShiraz99		[]				text	t2_4m8ixf23	False	False	False	[]	False	False	1642330025	self.Bitcoin	https://www.reddit.com/r/Bitcoin/comments/s59d37/onion_routing_fiat_payments_to_buy_bitcoin/	{}	s59d37	False	True	False	False	False	True	True	False		[]	dark	text	False	False	True	0	0	False	all_ads	/r/Bitcoin/comments/s59d37/onion_routing_fiat_payments_to_buy_bitcoin/	False	6	1642330036	1	"I live in a country where Bitcoin exchanges are not permitted. Most people buy binance P2P, but then binance may get banned too, and most transactions on binance are bank routed anyways. 

I was thinking, what if there was a way to use Tor concepts in real life face to face exchanges. E g. a person stakes some Bitcoin on some decentralized escrow protocol, and then volunteers to onion route cash for facilitating Bitcoin sales.

When A wants to buy Bitcoin from D on bisq or lightning, the Bitcoin part is all secure, but the face to face cash part is difficult, and risky. In this mechanism, if there is an App that finds a random, obfuscated route between A and D, lets say involving B and C.  App then tells A to give cash to B, without disclosing it is for D. Then app tells B and deliver it to C. All the while, like lightning, B and C getting a commission for this routing.  And money they are moving is always less than the Bitcoin they have staked. Eventually it reaches D and transaction is committed on bisq or lightnig.

The major benefit over A meeting directly with D is when government wants to prevent people from transacting in Bitcoin, and is actively seeking to stop such transactions and/or arrest the people involved, or simply to be able to identify and track them, for harassment and fear ongering. But in this approach, the physical exchanges are also obfuscated ad hidden from trackability.

Does anybody see this possible, and of value? Can it be another step to full censorship resistance?"	True	False	False	Bitcoin	t5_2s3qj	3792824	public	self	Onion routing fiat payments to buy bitcoin	0	[]	1.0	https://www.reddit.com/r/Bitcoin/comments/s59d37/onion_routing_fiat_payments_to_buy_bitcoin/	all_ads	6																		"Onion routing fiat payments to buy bitcoin
I live in a country where Bitcoin exchanges are not permitted. Most people buy binance P2P, but then binance may get banned too, and most transactions on binance are bank routed anyways. 

I was thinking, what if there was a way to use Tor concepts in real life face to face exchanges. E g. a person stakes some Bitcoin on some decentralized escrow protocol, and then volunteers to onion route cash for facilitating Bitcoin sales.

When A wants to buy Bitcoin from D on bisq or lightning, the Bitcoin part is all secure, but the face to face cash part is difficult, and risky. In this mechanism, if there is an App that finds a random, obfuscated route between A and D, lets say involving B and C.  App then tells A to give cash to B, without disclosing it is for D. Then app tells B and deliver it to C. All the while, like lightning, B and C getting a commission for this routing.  And money they are moving is always less than the Bitcoin they have staked. Eventually it reaches D and transaction is committed on bisq or lightnig.

The major benefit over A meeting directly with D is when government wants to prevent people from transacting in Bitcoin, and is actively seeking to stop such transactions and/or arrest the people involved, or simply to be able to identify and track them, for harassment and fear ongering. But in this approach, the physical exchanges are also obfuscated ad hidden from trackability.

Does anybody see this possible, and of value? Can it be another step to full censorship resistance?"	onion routing fiat payments to buy bitcoin i live in a country where bitcoin exchanges are not permitted most people buy binance p2p but then binance may get banned too and most transactions on binance are bank routed anyways i was thinking what if there was a way to use tor concepts in real life face to face exchanges e g a person stakes some bitcoin on some decentralized escrow protocol and then volunteers to onion route cash for facilitating bitcoin sales when a wants to buy bitcoin from d on bisq or lightning the bitcoin part is all secure but the face to face cash part is difficult and risky in this mechanism if there is an app that finds a random obfuscated route between a and d lets say involving b and c app then tells a to give cash to b without disclosing it is for d then app tells b and deliver it to c all the while like lightning b and c getting a commission for this routing and money they are moving is always less than the bitcoin they have staked eventually it reaches d and transaction is committed on bisq or lightnig the major benefit over a meeting directly with d is when government wants to prevent people from transacting in bitcoin and is actively seeking to stop such transactions and or arrest the people involved or simply to be able to identify and track them for harassment and fear ongering but in this approach the physical exchanges are also obfuscated ad hidden from trackability does anybody see this possible and of value can it be another step to full censorship resistance 	0.0020514570642262697	0.9891639947891235	0.6928192377090454	0.9578951597213745	0.007442311849445105	0.18848758935928345	0.06653233617544174	8.533148729839013e-07	0.41068997979164124	0.0033370843157172203
44	[]	False	AldiPahlavie2	noob	[{'e': 'text', 't': 'redditor for 3 weeks'}]	2ec8e69e-6c36-11e9-a04b-0afb553d4ea6	redditor for 3 weeks	dark	richtext	t2_hszgpxqb	False	False	False	[]	False	False	1642329377	self.Bitcoin	https://www.reddit.com/r/Bitcoin/comments/s597py/best_project_from_animalia/	{}	s597py	False	False	False	False	False	False	True	False		[]	dark	text	False	False	True	0	0	False	all_ads	/r/Bitcoin/comments/s597py/best_project_from_animalia/	False	6	1642329388	1	[removed]	True	False	False	Bitcoin	t5_2s3qj	3792799	public	self	Best project from Animalia	0	[]	1.0	https://www.reddit.com/r/Bitcoin/comments/s597py/best_project_from_animalia/	all_ads	6					reddit													"Best project from Animalia
[removed]"	best project from animalia removed 	0.5361788868904114	0.594963550567627	0.3343315124511719	0.4682086110115051	0.4847394526004791	0.3447742760181427	0.4148699939250946	0.5686196684837341	0.467566579580307	0.440419465303421
45	[]	False	Z0MB13GUMMYB34R		[]				text	t2_33wnl9xy	False	False	False	[]	False	False	1642329130	self.Bitcoin	https://www.reddit.com/r/Bitcoin/comments/s595ok/trying_to_redeem_bitnovo_vouchers_and_i_cant/	{}	s595ok	False	True	False	False	False	True	True	False		[]	dark	text	False	False	False	0	0	False	all_ads	/r/Bitcoin/comments/s595ok/trying_to_redeem_bitnovo_vouchers_and_i_cant/	False	6	1642329141	1	I’ve been at this for an hour at least can someone help	True	False	False	Bitcoin	t5_2s3qj	3792788	public	self	Trying to redeem Bitnovo vouchers and I can’t select the coin and it wont let me click continue. Urgent	0	[]	1.0	https://www.reddit.com/r/Bitcoin/comments/s595ok/trying_to_redeem_bitnovo_vouchers_and_i_cant/	all_ads	6																		"Trying to redeem Bitnovo vouchers and I can’t select the coin and it wont let me click continue. Urgent
I’ve been at this for an hour at least can someone help"	trying to redeem bitnovo vouchers and i can t select the coin and it wont let me click continue urgent i ve been at this for an hour at least can someone help	0.12072782963514328	0.9137637615203857	0.20124055445194244	0.014058583416044712	0.00904980581253767	0.5832861661911011	0.08191229403018951	8.261971515821642e-07	0.1505834013223648	0.005954813212156296
46	[]	False	ucrtaohx		[]				text	t2_cje84l2h	False	False	False	[]	False	False	1642328916	coinbynews.com	https://www.reddit.com/r/Bitcoin/comments/s593jl/jpmorgan_survey_result_bitcoin_60000/	{}	s593jl	False	True	False	False	False	True	False	False		[]	dark	text	False	False	True	0	0	False	all_ads	/r/Bitcoin/comments/s593jl/jpmorgan_survey_result_bitcoin_60000/	False	6	1642328926	1		True	False	False	Bitcoin	t5_2s3qj	3792775	public	https://b.thumbs.redditmedia.com/fC9K_1WTCAweRWRPDFSyfSmZHk6Z4oQwjLNHV_pNZ3E.jpg	JPMorgan Survey Result; Bitcoin $60,000	0	[]	1.0	https://coinbynews.com/jpmorgan-survey-result-bitcoin-60000	all_ads	6			link	{'enabled': False, 'images': [{'id': 'YSfVprk64Vy519SLt54QRKmPsHwIR6vXSC6gTDY22Ro', 'resolutions': [{'height': 56, 'url': 'https://external-preview.redd.it/7A-KuSGaxekFyxoTIQm3z3Sap9cRxqtP6_82dN8h2a4.jpg?width=108&amp;crop=smart&amp;auto=webp&amp;s=974d591e33eddd8ba3907b51434225b0a36f0120', 'width': 108}, {'height': 113, 'url': 'https://external-preview.redd.it/7A-KuSGaxekFyxoTIQm3z3Sap9cRxqtP6_82dN8h2a4.jpg?width=216&amp;crop=smart&amp;auto=webp&amp;s=fc87e38f16a3e29ac9039aabdf759e06ddcd2c19', 'width': 216}, {'height': 168, 'url': 'https://external-preview.redd.it/7A-KuSGaxekFyxoTIQm3z3Sap9cRxqtP6_82dN8h2a4.jpg?width=320&amp;crop=smart&amp;auto=webp&amp;s=ca5741299e1fd60e4c7dd23d98a50cd39b816ff3', 'width': 320}, {'height': 336, 'url': 'https://external-preview.redd.it/7A-KuSGaxekFyxoTIQm3z3Sap9cRxqtP6_82dN8h2a4.jpg?width=640&amp;crop=smart&amp;auto=webp&amp;s=9c942d63a42d332f7e95c789b7dc8d40926c3743', 'width': 640}, {'height': 504, 'url': 'https://external-preview.redd.it/7A-KuSGaxekFyxoTIQm3z3Sap9cRxqtP6_82dN8h2a4.jpg?width=960&amp;crop=smart&amp;auto=webp&amp;s=0e3b8db9aed4792db1fffa5d409db2806e7e77c7', 'width': 960}, {'height': 567, 'url': 'https://external-preview.redd.it/7A-KuSGaxekFyxoTIQm3z3Sap9cRxqtP6_82dN8h2a4.jpg?width=1080&amp;crop=smart&amp;auto=webp&amp;s=a2e93ecff964e169700037c86b29747784a9226e', 'width': 1080}], 'source': {'height': 630, 'url': 'https://external-preview.redd.it/7A-KuSGaxekFyxoTIQm3z3Sap9cRxqtP6_82dN8h2a4.jpg?auto=webp&amp;s=96ff62ef4ddd9620c4feedc5af4e5367423644ee', 'width': 1200}, 'variants': {}}]}				73.0	140.0	https://coinbynews.com/jpmorgan-survey-result-bitcoin-60000								"JPMorgan Survey Result; Bitcoin $60,000
"	jpmorgan survey result bitcoin 60 000 nan	0.31260907649993896	0.6888629198074341	0.3537469208240509	0.4086712598800659	0.38417693972587585	0.39879971742630005	0.40922242403030396	0.47116634249687195	0.472137987613678	0.00718412222340703
47	[]	False	Delicious-Cod7535	noob	[{'e': 'text', 't': 'redditor for a day'}]	2ec8e69e-6c36-11e9-a04b-0afb553d4ea6	redditor for a day	dark	richtext	t2_im5f8tr3	False	False	False	[]	False	False	1642328167	join.monzo.com	https://www.reddit.com/r/Bitcoin/comments/s58x0y/youre_invited_to_join_monzo_and_get_5/	{}	s58x0y	False	True	False	False	False	True	False	False		[]	dark	text	False	False	True	0	0	False	all_ads	/r/Bitcoin/comments/s58x0y/youre_invited_to_join_monzo_and_get_5/	False	6	1642328177	1		True	False	False	Bitcoin	t5_2s3qj	3792732	public	https://b.thumbs.redditmedia.com/4kgYDfpQz0_G3m7AN_hLurq11-G64HOkDoWGl1TJEYc.jpg	🎉 You’re invited to join Monzo, and get £5!	0	[]	1.0	https://join.monzo.com/c/kt5ncvv	all_ads	6			link	{'enabled': False, 'images': [{'id': 'eyzEILGxIAfXuyVAM_F5CLX94rQ0RACVZW3558LkTXQ', 'resolutions': [{'height': 56, 'url': 'https://external-preview.redd.it/A2AuX-MQSaV85IGDsRzVqfuwbDStVtoL1tPFYvZ9xdY.jpg?width=108&amp;crop=smart&amp;auto=webp&amp;s=b115d02c83e71d652aa4a0ff2b11f660460de8f6', 'width': 108}, {'height': 113, 'url': 'https://external-preview.redd.it/A2AuX-MQSaV85IGDsRzVqfuwbDStVtoL1tPFYvZ9xdY.jpg?width=216&amp;crop=smart&amp;auto=webp&amp;s=8bdccf6d05d2d58a21deca1cc8af81b0abb0a676', 'width': 216}, {'height': 168, 'url': 'https://external-preview.redd.it/A2AuX-MQSaV85IGDsRzVqfuwbDStVtoL1tPFYvZ9xdY.jpg?width=320&amp;crop=smart&amp;auto=webp&amp;s=d0a4f3d6ad31da7898dd88235d505295783efdc2', 'width': 320}, {'height': 336, 'url': 'https://external-preview.redd.it/A2AuX-MQSaV85IGDsRzVqfuwbDStVtoL1tPFYvZ9xdY.jpg?width=640&amp;crop=smart&amp;auto=webp&amp;s=44f71c7170d8172a08de771cb2b977d6a9ee8e47', 'width': 640}, {'height': 504, 'url': 'https://external-preview.redd.it/A2AuX-MQSaV85IGDsRzVqfuwbDStVtoL1tPFYvZ9xdY.jpg?width=960&amp;crop=smart&amp;auto=webp&amp;s=af0202bfc74633a7090796abb52c0e80dde11ba4', 'width': 960}, {'height': 567, 'url': 'https://external-preview.redd.it/A2AuX-MQSaV85IGDsRzVqfuwbDStVtoL1tPFYvZ9xdY.jpg?width=1080&amp;crop=smart&amp;auto=webp&amp;s=988f26a777466b52a55e2d8c5840cece7991e6ff', 'width': 1080}], 'source': {'height': 630, 'url': 'https://external-preview.redd.it/A2AuX-MQSaV85IGDsRzVqfuwbDStVtoL1tPFYvZ9xdY.jpg?auto=webp&amp;s=5b2199f712b8b1ca3c39c785d042be9a0f22f0a1', 'width': 1200}, 'variants': {}}]}				73.0	140.0	https://join.monzo.com/c/kt5ncvv								"🎉 You’re invited to join Monzo, and get £5!
"	 you re invited to join monzo and get 5 nan	0.6084417104721069	0.42580193281173706	0.22848276793956757	0.4901661276817322	0.21064011752605438	0.51579350233078	0.5831855535507202	0.025308294221758842	0.33639365434646606	0.09236038476228714
48	[]	False	sniketor		[]				text	t2_dzrausjn	False	False	False	[]	False	False	1642326155	self.Bitcoin	https://www.reddit.com/r/Bitcoin/comments/s58fuf/bitcoin_avatar_with_a_red_glow_collectible/	{}	s58fuf	False	False	False	False	False	False	True	False		[]	dark	text	False	False	True	0	0	False	all_ads	/r/Bitcoin/comments/s58fuf/bitcoin_avatar_with_a_red_glow_collectible/	False	6	1642326165	1	[removed]	True	False	False	Bitcoin	t5_2s3qj	3792657	public	self	Bitcoin avatar with a red glow collectible	0	[]	1.0	https://www.reddit.com/r/Bitcoin/comments/s58fuf/bitcoin_avatar_with_a_red_glow_collectible/	all_ads	6			self	{'enabled': False, 'images': [{'id': 'D_pzZomQ9EFTjSIMNdmeIiuJ8Pp3c1EqYYNkdj1ODsI', 'resolutions': [{'height': 108, 'url': 'https://external-preview.redd.it/qQqO8UhT1SfEOwRk6SPjH2A7CWbR-z4ZbTvqn7N8mLA.jpg?width=108&amp;crop=smart&amp;auto=webp&amp;s=8e8dcf8d2f8c3dfb9ac76b2e91baa9a0ae1d57fe', 'width': 108}, {'height': 216, 'url': 'https://external-preview.redd.it/qQqO8UhT1SfEOwRk6SPjH2A7CWbR-z4ZbTvqn7N8mLA.jpg?width=216&amp;crop=smart&amp;auto=webp&amp;s=babb4eaf89747cf79553684a80169ae16de97950', 'width': 216}, {'height': 320, 'url': 'https://external-preview.redd.it/qQqO8UhT1SfEOwRk6SPjH2A7CWbR-z4ZbTvqn7N8mLA.jpg?width=320&amp;crop=smart&amp;auto=webp&amp;s=640f82f49aea4d0184b25eec1b64bc135427f0be', 'width': 320}, {'height': 640, 'url': 'https://external-preview.redd.it/qQqO8UhT1SfEOwRk6SPjH2A7CWbR-z4ZbTvqn7N8mLA.jpg?width=640&amp;crop=smart&amp;auto=webp&amp;s=9f8fa9c5c94f9f7fb84ddf323b90eec09bb751e6', 'width': 640}], 'source': {'height': 800, 'url': 'https://external-preview.redd.it/qQqO8UhT1SfEOwRk6SPjH2A7CWbR-z4ZbTvqn7N8mLA.jpg?auto=webp&amp;s=c5741cd8bddc88214bcbc6a20d9b82e93e24bb9d', 'width': 800}, 'variants': {}}]}	moderator													"Bitcoin avatar with a red glow collectible
[removed]"	bitcoin avatar with a red glow collectible removed 	0.3019935190677643	0.5784297585487366	0.48512181639671326	0.3136823773384094	0.41983562707901	0.5465500354766846	0.3540966510772705	0.4831954836845398	0.46495530009269714	0.7660577297210693
49	[]	False	TeamWaifus		[]				text	t2_igwhtwvn	False	False	False	[]	False	False	1642325935	self.Bitcoin	https://www.reddit.com/r/Bitcoin/comments/s58dq4/teamwaifus/	{}	s58dq4	False	False	False	False	False	False	True	False		[]	dark	text	False	False	True	0	0	False	all_ads	/r/Bitcoin/comments/s58dq4/teamwaifus/	False	6	1642325945	1	[removed]	True	False	False	Bitcoin	t5_2s3qj	3792646	public	self	TeamWaifus	0	[]	1.0	https://www.reddit.com/r/Bitcoin/comments/s58dq4/teamwaifus/	all_ads	6			self	{'enabled': False, 'images': [{'id': 'Garwy84FCYd6zzhnOduHs3agZphYfhlzL2QtqLYhHUE', 'resolutions': [{'height': 108, 'url': 'https://external-preview.redd.it/20CGtDHMMkCpYODFwVabA7b5-fWABjeng3Q7U9KnYIU.jpg?width=108&amp;crop=smart&amp;auto=webp&amp;s=011c9d3aaaf7101644dc9485155f1b0bb781d5dd', 'width': 108}, {'height': 216, 'url': 'https://external-preview.redd.it/20CGtDHMMkCpYODFwVabA7b5-fWABjeng3Q7U9KnYIU.jpg?width=216&amp;crop=smart&amp;auto=webp&amp;s=35218be0ee482f5ca3302b69b3a1002be115b9b1', 'width': 216}], 'source': {'height': 256, 'url': 'https://external-preview.redd.it/20CGtDHMMkCpYODFwVabA7b5-fWABjeng3Q7U9KnYIU.jpg?auto=webp&amp;s=ea6e5cadaa7f4b4967695c9c2648a95d300a96a6', 'width': 256}, 'variants': {}}]}	moderator													"TeamWaifus
[removed]"	teamwaifus removed 	0.457691490650177	0.5326730012893677	0.5209501385688782	0.45789244771003723	0.4686628580093384	0.4511174261569977	0.4526541233062744	0.4781453013420105	0.49568992853164673	0.44422122836112976
