144	[]	False	peelman1978		[]		text	t2_gg00a	False	False	False	[]	False	False	1642977377	i.redd.it	https://www.reddit.com/r/Bitcoin/comments/sb60at/i_finished_my_sunday_soccer_game_and_got_this/	{}	sb60at	False	True	False	False	True	True	False	False		[]	dark	text	False	False	True	0	0	False	all_ads	/r/Bitcoin/comments/sb60at/i_finished_my_sunday_soccer_game_and_got_this/	False	image	{'enabled': True, 'images': [{'id': 'VScjbj8ntfGdBZS_IwXmh-xOunj4jW6Rb5r3pd5fTfg', 'resolutions': [{'height': 136, 'url': 'https://preview.redd.it/vg71zc6rlid81.jpg?width=108&amp;crop=smart&amp;auto=webp&amp;s=0c95350f691b7a220c4492254933c0b4bbfd2e69', 'width': 108}, {'height': 272, 'url': 'https://preview.redd.it/vg71zc6rlid81.jpg?width=216&amp;crop=smart&amp;auto=webp&amp;s=caf85ffa05b0c1ac0f47e562a4924371de32303b', 'width': 216}, {'height': 403, 'url': 'https://preview.redd.it/vg71zc6rlid81.jpg?width=320&amp;crop=smart&amp;auto=webp&amp;s=a26e3bd8c57fc8e9980626f9bfa9267a93c11c4d', 'width': 320}, {'height': 807, 'url': 'https://preview.redd.it/vg71zc6rlid81.jpg?width=640&amp;crop=smart&amp;auto=webp&amp;s=725c221c41477d8f449840612ae6daea30dfbaa6', 'width': 640}, {'height': 1210, 'url': 'https://preview.redd.it/vg71zc6rlid81.jpg?width=960&amp;crop=smart&amp;auto=webp&amp;s=0ed9e7d4927cb39041b19ac84fc43774e36ca6bb', 'width': 960}, {'height': 1361, 'url': 'https://preview.redd.it/vg71zc6rlid81.jpg?width=1080&amp;crop=smart&amp;auto=webp&amp;s=e6938c428e9400c1bbc210327af02c30270dc96e', 'width': 1080}], 'source': {'height': 1464, 'url': 'https://preview.redd.it/vg71zc6rlid81.jpg?auto=webp&amp;s=f85cdda96f4a2917b4865e6c1df814e41164440a', 'width': 1161}, 'variants': {}}]}	6	1642977388	1		True	False	False	Bitcoin	t5_2s3qj	3824043	public	https://b.thumbs.redditmedia.com/b-bXAz8iRJd4Km7We1e1eBoNyOgQRjeQgceStSzbJcM.jpg	140.0	140.0	I finished my Sunday soccer game and got this from my 8 year old son. I had to oblige and got him a wallet with $500 BTC.	0	[]	1.0	https://i.redd.it/vg71zc6rlid81.jpg	https://i.redd.it/vg71zc6rlid81.jpg	all_ads	6																			"I finished my Sunday soccer game and got this from my 8 year old son. I had to oblige and got him a wallet with $500 BTC.
"	i finished my sunday soccer game and got this from my 8 year old son i had to oblige and got him a wallet with 500 btc nan	0.009766294620931149	0.22625166177749634	0.2000412493944168	0.021069258451461792	0.7725088596343994	0.9938194155693054	0.44555947184562683	8.6513477981498e-07	0.2174234688282013	0.016728060320019722
145	[]	False	engineheat		[]		text	t2_33bizuj	False	False	False	[]	False	False	1642976867	self.Bitcoin	https://www.reddit.com/r/Bitcoin/comments/sb5tac/whats_your_strategynear_term_plans/	{}	sb5tac	False	True	False	False	False	True	True	False		[]	dark	text	False	False	True	0	0	False	all_ads	/r/Bitcoin/comments/sb5tac/whats_your_strategynear_term_plans/	False			6	1642976878	1	" With the crash in bitcoin, I hope to hear what someone of you is planning to do (or thoughts) to navigate the crash.

DCA back in once bitcoin drops to $30k? $20k? or now? I'm new to crypto investing. I purchased a bit when it was near peak and sold before it dropped too low so my loss aren't too bad.

PS: Are there ways to set alerts once the price of a certain coin go above or below a set threshold (set by you)? Or make an auto purchase or sell? I'm new to Coinbase.

Thanks"	True	False	False	Bitcoin	t5_2s3qj	3824009	public	self			what's your strategy/near term plans?	0	[]	1.0	https://www.reddit.com/r/Bitcoin/comments/sb5tac/whats_your_strategynear_term_plans/		all_ads	6																			"what's your strategy/near term plans?
 With the crash in bitcoin, I hope to hear what someone of you is planning to do (or thoughts) to navigate the crash.

DCA back in once bitcoin drops to $30k? $20k? or now? I'm new to crypto investing. I purchased a bit when it was near peak and sold before it dropped too low so my loss aren't too bad.

PS: Are there ways to set alerts once the price of a certain coin go above or below a set threshold (set by you)? Or make an auto purchase or sell? I'm new to Coinbase.

Thanks"	what s your strategy near term plans with the crash in bitcoin i hope to hear what someone of you is planning to do or thoughts to navigate the crash dca back in once bitcoin drops to 30k 20k or now i m new to crypto investing i purchased a bit when it was near peak and sold before it dropped too low so my loss aren t too bad ps are there ways to set alerts once the price of a certain coin go above or below a set threshold set by you or make an auto purchase or sell i m new to coinbase thanks	0.0019773137755692005	0.9901556968688965	0.2434220165014267	0.9522550702095032	0.007256022188812494	0.40628600120544434	0.11522186547517776	8.302522473968565e-07	0.22127747535705566	0.0017740913899615407
146	[]	False	WangLUL		[]		text	t2_1964ho	False	False	False	[]	False	False	1642976251	i.redd.it	https://www.reddit.com/r/Bitcoin/comments/sb5koh/who_else_likes_curves/	{}	sb5koh	False	True	False	False	True	True	False	False		[]	dark	text	False	False	True	0	0	False	all_ads	/r/Bitcoin/comments/sb5koh/who_else_likes_curves/	False	image	{'enabled': True, 'images': [{'id': 'RFTXg9GFI9ypzoj4q78cmTHwy7iaMbGBJiATxgKcEt0', 'resolutions': [{'height': 98, 'url': 'https://preview.redd.it/qy7cy4wbiid81.png?width=108&amp;crop=smart&amp;auto=webp&amp;s=8760253717717550531a7495f61dc67c16a7e2d7', 'width': 108}, {'height': 197, 'url': 'https://preview.redd.it/qy7cy4wbiid81.png?width=216&amp;crop=smart&amp;auto=webp&amp;s=01ce9a143913e8a86f43bc52e047447bdaebe8dd', 'width': 216}, {'height': 292, 'url': 'https://preview.redd.it/qy7cy4wbiid81.png?width=320&amp;crop=smart&amp;auto=webp&amp;s=3fe06ed800d0963a0aba39a84cf18dea42334902', 'width': 320}, {'height': 584, 'url': 'https://preview.redd.it/qy7cy4wbiid81.png?width=640&amp;crop=smart&amp;auto=webp&amp;s=c1b613368ce761b39495d975b23bb00d4f0fd109', 'width': 640}], 'source': {'height': 697, 'url': 'https://preview.redd.it/qy7cy4wbiid81.png?auto=webp&amp;s=516cf1ae622f9ffa099dfd5873934cb94e52a679', 'width': 763}, 'variants': {}}]}	6	1642976262	1		True	False	False	Bitcoin	t5_2s3qj	3823973	public	https://a.thumbs.redditmedia.com/sSoInfuDRhDBKwhEvY4bYC9eVVZTux7i-Eo3ew1oxp0.jpg	127.0	140.0	Who else likes curves ?	0	[]	1.0	https://i.redd.it/qy7cy4wbiid81.png	https://i.redd.it/qy7cy4wbiid81.png	all_ads	6																			"Who else likes curves ?
"	who else likes curves nan	0.4552595019340515	0.4363596737384796	0.48607194423675537	0.3667329251766205	0.506125271320343	0.665304958820343	0.49343881011009216	0.5294947028160095	0.4552706778049469	0.4369572699069977
147	[]	False	NWordButItIsFrom1945		[]		text	t2_ae7zt85g	False	False	False	[]	False	False	1642976110	self.Bitcoin	https://www.reddit.com/r/Bitcoin/comments/sb5irn/wish/	{}	sb5irn	False	False	False	False	False	False	True	False		[{'e': 'text', 't': 'comment as submission'}]	dark	richtext	False	False	True	0	0	False	all_ads	/r/Bitcoin/comments/sb5irn/wish/	False			6	1642976121	1	[removed]	True	False	False	Bitcoin	t5_2s3qj	3823967	public	self			Wish	0	[]	1.0	https://www.reddit.com/r/Bitcoin/comments/sb5irn/wish/		all_ads	6			moderator									comment as submission							"Wish
[removed]"	wish removed 	0.5252423286437988	0.4438382089138031	0.4291418492794037	0.47957247495651245	0.48030024766921997	0.4925849139690399	0.5165747404098511	0.5118061304092407	0.4765324294567108	0.5534424781799316
148	[]	False	LeslieMarston		[]		text	t2_r8nrve7	False	False	False	[]	False	False	1642975476	zdnet.com	https://www.reddit.com/r/Bitcoin/comments/sb59kf/amazon_bitcoin_scam/	{}	sb59kf	False	True	False	False	False	True	False	False		[]	dark	text	False	False	True	0	0	False	all_ads	/r/Bitcoin/comments/sb59kf/amazon_bitcoin_scam/	False	link	{'enabled': False, 'images': [{'id': 'dCXUBLVyMKfiHs6AXTHDQOWfT-AdreRAHDuk7uGd1FA', 'resolutions': [{'height': 81, 'url': 'https://external-preview.redd.it/eEJ4MGHst7QzLBNzQAl_-03P_fCCe7m3vL9SRTTeQig.jpg?width=108&amp;crop=smart&amp;auto=webp&amp;s=956f2b3725f7364e0c75ca50bf2ae15d944da0d7', 'width': 108}, {'height': 162, 'url': 'https://external-preview.redd.it/eEJ4MGHst7QzLBNzQAl_-03P_fCCe7m3vL9SRTTeQig.jpg?width=216&amp;crop=smart&amp;auto=webp&amp;s=418cae628eaacdc21a083c618e21ed1a6b790a4c', 'width': 216}, {'height': 240, 'url': 'https://external-preview.redd.it/eEJ4MGHst7QzLBNzQAl_-03P_fCCe7m3vL9SRTTeQig.jpg?width=320&amp;crop=smart&amp;auto=webp&amp;s=5ad02f739714108f8f05be6e346588e00072b486', 'width': 320}, {'height': 480, 'url': 'https://external-preview.redd.it/eEJ4MGHst7QzLBNzQAl_-03P_fCCe7m3vL9SRTTeQig.jpg?width=640&amp;crop=smart&amp;auto=webp&amp;s=7a4820a10f0d4eee7428342b1de6e5b2715bd3ec', 'width': 640}], 'source': {'height': 578, 'url': 'https://external-preview.redd.it/eEJ4MGHst7QzLBNzQAl_-03P_fCCe7m3vL9SRTTeQig.jpg?auto=webp&amp;s=71aa776f09832419a631fb62d1477572acaa6405', 'width': 770}, 'variants': {}}]}	6	1642975486	1		True	False	False	Bitcoin	t5_2s3qj	3823938	public	https://b.thumbs.redditmedia.com/UMKuCTeT8Bjo3D_Y-oXZ94bJNua6pBj6Yn4e-Do_Bpg.jpg	105.0	140.0	Amazon bitcoin scam	0	[]	1.0	https://www.zdnet.com/article/amazon-fake-crypto-token-investment-scam-steals-bitcoin-from-victims/	https://www.zdnet.com/article/amazon-fake-crypto-token-investment-scam-steals-bitcoin-from-victims/	all_ads	6																			"Amazon bitcoin scam
"	amazon bitcoin scam nan	0.42140236496925354	0.5041542649269104	0.477265328168869	0.4307235777378082	0.4527786374092102	0.46413716673851013	0.46620315313339233	0.5192639827728271	0.45013999938964844	0.6324071884155273
149	[]	False	Confident-Chicken727		[]		text	t2_bctsi34b	False	False	False	[]	False	False	1642975448	self.Bitcoin	https://www.reddit.com/r/Bitcoin/comments/sb596n/shibfén_inu_burning_erc20_shiba_inu_bnb_rewards/	{}	sb596n	False	False	False	False	False	False	True	False		[]	dark	text	False	False	True	0	0	False	all_ads	/r/Bitcoin/comments/sb596n/shibfén_inu_burning_erc20_shiba_inu_bnb_rewards/	False	self	{'enabled': False, 'images': [{'id': 'f5ZK2S_MHomh7jopZIGcrPKjoHZA58n4fGrcIG8ETro', 'resolutions': [{'height': 60, 'url': 'https://external-preview.redd.it/0OLjNl7Tji-2IctB70H_6X_MTQrK3jmI_ocbdE6RR64.jpg?width=108&amp;crop=smart&amp;auto=webp&amp;s=3ed86c307a1847e4c32e90216373d359840cffb1', 'width': 108}, {'height': 121, 'url': 'https://external-preview.redd.it/0OLjNl7Tji-2IctB70H_6X_MTQrK3jmI_ocbdE6RR64.jpg?width=216&amp;crop=smart&amp;auto=webp&amp;s=fe2df6adc05221ccc2d04ce85c775fc7797ccd06', 'width': 216}, {'height': 180, 'url': 'https://external-preview.redd.it/0OLjNl7Tji-2IctB70H_6X_MTQrK3jmI_ocbdE6RR64.jpg?width=320&amp;crop=smart&amp;auto=webp&amp;s=c3db01038c7f2d591ec55205e08a2098e4f956b0', 'width': 320}, {'height': 360, 'url': 'https://external-preview.redd.it/0OLjNl7Tji-2IctB70H_6X_MTQrK3jmI_ocbdE6RR64.jpg?width=640&amp;crop=smart&amp;auto=webp&amp;s=9ed26d485aa92e0f7151cac7136077d17f4d7769', 'width': 640}, {'height': 540, 'url': 'https://external-preview.redd.it/0OLjNl7Tji-2IctB70H_6X_MTQrK3jmI_ocbdE6RR64.jpg?width=960&amp;crop=smart&amp;auto=webp&amp;s=9f748998746285c3afc17fc5329c2da3f84797ce', 'width': 960}, {'height': 607, 'url': 'https://external-preview.redd.it/0OLjNl7Tji-2IctB70H_6X_MTQrK3jmI_ocbdE6RR64.jpg?width=1080&amp;crop=smart&amp;auto=webp&amp;s=17b93ef5c100020e9899b544d1d9ee6a9acaa604', 'width': 1080}], 'source': {'height': 900, 'url': 'https://external-preview.redd.it/0OLjNl7Tji-2IctB70H_6X_MTQrK3jmI_ocbdE6RR64.jpg?auto=webp&amp;s=7dc0fd65484e035d41f8673eec6ea738bc3ef06a', 'width': 1600}, 'variants': {}}]}	6	1642975458	1	[removed]	True	False	False	Bitcoin	t5_2s3qj	3823936	public	self			SHIBFÉN INU| 🔥Burning erc20 Shiba Inu| Bnb Rewards| ShibaArmy Come Join Us| Audited And Doxxed ✅ | Now trading |	0	[]	1.0	https://www.reddit.com/r/Bitcoin/comments/sb596n/shibfén_inu_burning_erc20_shiba_inu_bnb_rewards/		all_ads	6			moderator																"SHIBFÉN INU| 🔥Burning erc20 Shiba Inu| Bnb Rewards| ShibaArmy Come Join Us| Audited And Doxxed ✅ | Now trading |
[removed]"	shibf n inu burning erc20 shiba inu bnb rewards shibaarmy come join us audited and doxxed now trading removed 	0.3102893829345703	0.6644036769866943	0.24150654673576355	0.17803868651390076	0.04078822582960129	0.33151987195014954	0.39250120520591736	8.669378530612448e-07	0.41001370549201965	0.025890450924634933
150	[]	False	PrivateMonero	noob	[{'e': 'text', 't': 'redditor for 2 months'}]	redditor for 2 months	richtext	t2_cbh9agt1	False	False	False	[]	False	False	1642975311	self.Bitcoin	https://www.reddit.com/r/Bitcoin/comments/sb57bp/can_someone_find_my_main_wallet_from_a_lightning/	{}	sb57bp	False	True	False	False	False	True	True	False		[]	dark	text	False	False	True	0	0	False	all_ads	/r/Bitcoin/comments/sb57bp/can_someone_find_my_main_wallet_from_a_lightning/	False			6	1642975322	1	If I send someone a lightning transaction can they find my main btc wallet from that, or is it different because it’s settled off the main chain	True	False	False	Bitcoin	t5_2s3qj	3823926	public	self			Can someone find my main wallet from a lightning transaction?	0	[]	1.0	https://www.reddit.com/r/Bitcoin/comments/sb57bp/can_someone_find_my_main_wallet_from_a_lightning/		all_ads	6	2ec8e69e-6c36-11e9-a04b-0afb553d4ea6	dark																	"Can someone find my main wallet from a lightning transaction?
If I send someone a lightning transaction can they find my main btc wallet from that, or is it different because it’s settled off the main chain"	can someone find my main wallet from a lightning transaction if i send someone a lightning transaction can they find my main btc wallet from that or is it different because it s settled off the main chain	0.006321893539279699	0.9845414161682129	0.4388691484928131	0.01691933162510395	0.06456753611564636	0.6047458648681641	0.07141954451799393	8.537105031791725e-07	0.41096484661102295	0.008850960060954094
151	[]	False	amritk25		[]		text	t2_5bvjvboy	False	False	False	[]	False	False	1642974874	self.Bitcoin	https://www.reddit.com/r/Bitcoin/comments/sb50ug/difference_between_bitcoin_address/	{}	sb50ug	False	True	False	False	False	True	True	False		[]	dark	text	False	False	True	0	0	False	all_ads	/r/Bitcoin/comments/sb50ug/difference_between_bitcoin_address/	False			6	1642974885	1	"Hi all, if someone can dumb it down to me regarding the different bitcoin address. For example I'm trying to receive bitcoin but the address starts with bc vs my exchange address that start with 3. My 
1. what's the differences
2. If I'm sending between these different bitcoin address are there risk of me losing my bitcoin. 3tobc or vice versa. 

Thanks"	True	False	False	Bitcoin	t5_2s3qj	3823912	public	self			Difference between bitcoin address	0	[]	1.0	https://www.reddit.com/r/Bitcoin/comments/sb50ug/difference_between_bitcoin_address/		all_ads	6																			"Difference between bitcoin address
Hi all, if someone can dumb it down to me regarding the different bitcoin address. For example I'm trying to receive bitcoin but the address starts with bc vs my exchange address that start with 3. My 
1. what's the differences
2. If I'm sending between these different bitcoin address are there risk of me losing my bitcoin. 3tobc or vice versa. 

Thanks"	difference between bitcoin address hi all if someone can dumb it down to me regarding the different bitcoin address for example i m trying to receive bitcoin but the address starts with bc vs my exchange address that start with 3 my 1 what s the differences 2 if i m sending between these different bitcoin address are there risk of me losing my bitcoin 3tobc or vice versa thanks	0.0027266431134194136	0.9879143834114075	0.7661107778549194	0.04270626977086067	0.9944644570350647	0.41450235247612	0.12591905891895294	8.306261065627041e-07	0.3490956425666809	0.07474525272846222
152	[]	False	shiroyashadanna		[]		text	t2_1e18z6wr	False	False	False	[]	False	False	1642974008	self.Bitcoin	https://www.reddit.com/r/Bitcoin/comments/sb4od9/a_portfolio_with_btc_stocks_and_fiat_cash_flow_is/	{}	sb4od9	False	True	False	False	False	True	True	False		[]	dark	text	False	False	True	0	0	False	all_ads	/r/Bitcoin/comments/sb4od9/a_portfolio_with_btc_stocks_and_fiat_cash_flow_is/	False			6	1642974019	1	"Ok everyone's been doing the emotional support by telling newbies to hodl or buy more. That's cool. But to me BTC is not an investment, it is money + store of value (SoV). Companies (stocks) are investment. I invest in good companies with products that I use daily. I keep BTC as money as long term SoV. And I have a fiat job.

Now I don't sell BTC, but I do sell stocks; they are investments after all, meaning I will realize gains when I see fit. This is where I love BTC crashes. When I sell stocks, I have to pay capital gain taxes. When I use BTC for purchasing goods, it is treated as selling for fiat then buy with fiat. Thus, this can make capital gains/losses.

=&gt; Whenever I buy with BTC, I use the BTC that I bought with higher price as my cost basis, thus realizing a loss. I then can use this loss to offset the gains from my investments. This allows me use BTC as money and SoV (never sell my BTC), invest in companies I believe in, and offset my taxes."	True	False	False	Bitcoin	t5_2s3qj	3823872	public	self			A portfolio with BTC, stocks, and fiat cash flow is a wonderful combination	0	[]	1.0	https://www.reddit.com/r/Bitcoin/comments/sb4od9/a_portfolio_with_btc_stocks_and_fiat_cash_flow_is/		all_ads	6																			"A portfolio with BTC, stocks, and fiat cash flow is a wonderful combination
Ok everyone's been doing the emotional support by telling newbies to hodl or buy more. That's cool. But to me BTC is not an investment, it is money + store of value (SoV). Companies (stocks) are investment. I invest in good companies with products that I use daily. I keep BTC as money as long term SoV. And I have a fiat job.

Now I don't sell BTC, but I do sell stocks; they are investments after all, meaning I will realize gains when I see fit. This is where I love BTC crashes. When I sell stocks, I have to pay capital gain taxes. When I use BTC for purchasing goods, it is treated as selling for fiat then buy with fiat. Thus, this can make capital gains/losses.

=&gt; Whenever I buy with BTC, I use the BTC that I bought with higher price as my cost basis, thus realizing a loss. I then can use this loss to offset the gains from my investments. This allows me use BTC as money and SoV (never sell my BTC), invest in companies I believe in, and offset my taxes."	a portfolio with btc stocks and fiat cash flow is a wonderful combination ok everyone s been doing the emotional support by telling newbies to hodl or buy more that s cool but to me btc is not an investment it is money store of value sov companies stocks are investment i invest in good companies with products that i use daily i keep btc as money as long term sov and i have a fiat job now i don t sell btc but i do sell stocks they are investments after all meaning i will realize gains when i see fit this is where i love btc crashes when i sell stocks i have to pay capital gain taxes when i use btc for purchasing goods it is treated as selling for fiat then buy with fiat thus this can make capital gains losses gt whenever i buy with btc i use the btc that i bought with higher price as my cost basis thus realizing a loss i then can use this loss to offset the gains from my investments this allows me use btc as money and sov never sell my btc invest in companies i believe in and offset my taxes 	0.0028471979312598705	0.9877393841743469	0.35849088430404663	0.11138351261615753	0.00856807455420494	0.4145301878452301	0.09593332558870316	8.520796086486371e-07	0.35384973883628845	0.03043934516608715
153	[]	False	CoinCorner_Sam		[]		text	t2_fospv9k6	False	False	False	[]	False	False	1642973421	gpucoin.wordpress.com	https://www.reddit.com/r/Bitcoin/comments/sb4g3h/chivo_el_salvadors_official_bitcoin_wallet_has/	{}	sb4g3h	False	True	False	False	False	True	False	False		[]	dark	text	False	False	True	0	0	False	all_ads	/r/Bitcoin/comments/sb4g3h/chivo_el_salvadors_official_bitcoin_wallet_has/	False	link	{'enabled': False, 'images': [{'id': 'G5HwffeJL1_atC3214PT5ZVc7wGHJhQQJ8I4y_v7_ug', 'resolutions': [{'height': 71, 'url': 'https://external-preview.redd.it/QC_59aknlbT9odoioe3P4wbFt4qcofTyHb7GNd1hiTw.jpg?width=108&amp;crop=smart&amp;auto=webp&amp;s=f5454a6cf0708ff37dcfc9f594016f51d73627f5', 'width': 108}, {'height': 143, 'url': 'https://external-preview.redd.it/QC_59aknlbT9odoioe3P4wbFt4qcofTyHb7GNd1hiTw.jpg?width=216&amp;crop=smart&amp;auto=webp&amp;s=34665e7c939ab6b52d1985c2633414afd935eb96', 'width': 216}, {'height': 213, 'url': 'https://external-preview.redd.it/QC_59aknlbT9odoioe3P4wbFt4qcofTyHb7GNd1hiTw.jpg?width=320&amp;crop=smart&amp;auto=webp&amp;s=f9fe7a8cd82578754445ba92ed2ab7630a130b2c', 'width': 320}, {'height': 426, 'url': 'https://external-preview.redd.it/QC_59aknlbT9odoioe3P4wbFt4qcofTyHb7GNd1hiTw.jpg?width=640&amp;crop=smart&amp;auto=webp&amp;s=a87f86eb244a3167a4556d98a369952dea6f4a16', 'width': 640}, {'height': 639, 'url': 'https://external-preview.redd.it/QC_59aknlbT9odoioe3P4wbFt4qcofTyHb7GNd1hiTw.jpg?width=960&amp;crop=smart&amp;auto=webp&amp;s=b9ec63e9058ef94d88263a004d3a27f50fb91591', 'width': 960}, {'height': 719, 'url': 'https://external-preview.redd.it/QC_59aknlbT9odoioe3P4wbFt4qcofTyHb7GNd1hiTw.jpg?width=1080&amp;crop=smart&amp;auto=webp&amp;s=75b1176f30f24e7ce9a4a9ea2b493710fc7bde02', 'width': 1080}], 'source': {'height': 773, 'url': 'https://external-preview.redd.it/QC_59aknlbT9odoioe3P4wbFt4qcofTyHb7GNd1hiTw.jpg?auto=webp&amp;s=0dd6e71d2f361ac5f67b9ac7f4aa1bc7db4aeca9', 'width': 1160}, 'variants': {}}]}	6	1642973432	1		True	False	False	Bitcoin	t5_2s3qj	3823821	public	https://b.thumbs.redditmedia.com/P8Z1FMhj_wHc7_PfaX8CX_xjx5M3eX96lh4waYL98dk.jpg	93.0	140.0	Chivo, El Salvador’s official Bitcoin wallet, has managed to onboard 70% of the unbanked population in El Salvador	0	[]	1.0	https://gpucoin.wordpress.com/2022/01/23/el-salvadors-bitcoin-wallet-onboards-4m-users-with-netki-partnership/	https://gpucoin.wordpress.com/2022/01/23/el-salvadors-bitcoin-wallet-onboards-4m-users-with-netki-partnership/	all_ads	6		dark																	"Chivo, El Salvador’s official Bitcoin wallet, has managed to onboard 70% of the unbanked population in El Salvador
"	chivo el salvador s official bitcoin wallet has managed to onboard 70 of the unbanked population in el salvador nan	0.057712264358997345	0.8934923410415649	0.2191835343837738	0.26353001594543457	0.036230869591236115	0.35384389758110046	0.23416325449943542	8.902440526981081e-07	0.49538055062294006	0.0047334590926766396
154	[]	False	MaleficentChoice3		[]		text	t2_6akdvl1d	False	False	False	[]	False	False	1642973388	self.Bitcoin	https://www.reddit.com/r/Bitcoin/comments/sb4fi1/api_service_to_detect_unconfirmed_transaction/	{}	sb4fi1	False	False	False	False	False	False	True	False		[]	dark	text	False	False	True	0	0	False	all_ads	/r/Bitcoin/comments/sb4fi1/api_service_to_detect_unconfirmed_transaction/	False	self	{'enabled': False, 'images': [{'id': 'VAno78dsrsPtpauB0BlpiHjDQ7aXBpVRFkEUNM0gqeY', 'resolutions': [{'height': 56, 'url': 'https://external-preview.redd.it/6jErZ2VhwKdFdPfS3alx68WA7JXBdwxHpIHRiaeKk9c.jpg?width=108&amp;crop=smart&amp;auto=webp&amp;s=ab9d1266f3f571ef5c76825a4cfafe951fe3ec70', 'width': 108}, {'height': 113, 'url': 'https://external-preview.redd.it/6jErZ2VhwKdFdPfS3alx68WA7JXBdwxHpIHRiaeKk9c.jpg?width=216&amp;crop=smart&amp;auto=webp&amp;s=7ea6fb10604ccfd2fb2c7dd7a2aa6597bb17fa69', 'width': 216}, {'height': 168, 'url': 'https://external-preview.redd.it/6jErZ2VhwKdFdPfS3alx68WA7JXBdwxHpIHRiaeKk9c.jpg?width=320&amp;crop=smart&amp;auto=webp&amp;s=c46626659e5d1498d7ebbbb7ba625ac9764dc6c0', 'width': 320}, {'height': 336, 'url': 'https://external-preview.redd.it/6jErZ2VhwKdFdPfS3alx68WA7JXBdwxHpIHRiaeKk9c.jpg?width=640&amp;crop=smart&amp;auto=webp&amp;s=543785a2afa7881505bd986f755eea9bc2b0c357', 'width': 640}, {'height': 504, 'url': 'https://external-preview.redd.it/6jErZ2VhwKdFdPfS3alx68WA7JXBdwxHpIHRiaeKk9c.jpg?width=960&amp;crop=smart&amp;auto=webp&amp;s=3b96b23c3a44961f13326f2754dd3e3c07a57c9f', 'width': 960}, {'height': 567, 'url': 'https://external-preview.redd.it/6jErZ2VhwKdFdPfS3alx68WA7JXBdwxHpIHRiaeKk9c.jpg?width=1080&amp;crop=smart&amp;auto=webp&amp;s=c7884155decfb17415052e9912aa9fc0b48312cb', 'width': 1080}], 'source': {'height': 630, 'url': 'https://external-preview.redd.it/6jErZ2VhwKdFdPfS3alx68WA7JXBdwxHpIHRiaeKk9c.jpg?auto=webp&amp;s=78c894515729f92d6011548a98c8ae35d21b1a5d', 'width': 1200}, 'variants': {}}]}	6	1642973398	1	[removed]	True	False	False	Bitcoin	t5_2s3qj	3823819	public	self			API service to detect unconfirmed transaction	0	[]	1.0	https://www.reddit.com/r/Bitcoin/comments/sb4fi1/api_service_to_detect_unconfirmed_transaction/		all_ads	6		dark	moderator																"API service to detect unconfirmed transaction
[removed]"	api service to detect unconfirmed transaction removed 	0.2668800950050354	0.7371171712875366	0.1965494453907013	0.5078917741775513	0.4745798110961914	0.19221580028533936	0.3512042760848999	0.4420373737812042	0.4841880202293396	0.02133234217762947
