Unnamed: 0	all_awardings	archived	associated_award	author	author_flair_background_color	author_flair_css_class	author_flair_richtext	author_flair_template_id	author_flair_text	author_flair_text_color	author_flair_type	author_fullname	author_patreon_flair	author_premium	body	body_sha1	can_gild	collapsed	collapsed_because_crowd_control	collapsed_reason	collapsed_reason_code	comment_type	controversiality	created_utc	distinguished	gilded	gildings	id	is_submitter	link_id	locked	no_follow	parent_id	permalink	retrieved_utc	score	score_hidden	send_replies	stickied	subreddit	subreddit_id	subreddit_name_prefixed	subreddit_type	top_awarded_type	total_awards_received	treatment_tags	unrepliable_reason	author_cakeday	corpus	support	knowledge	conflict	power	similarity	fun	status	trust	identity	romance
0	[]	False		peterpesta			[]				text	t2_fyesfrzv	False	False	Well the recession will be the deciding factor we can't predict the exact year but it will last for some more time till the economy of major countries improve, and they can make some investment	deff10aaf7a159e5112adbe97e0430c5c3388a4d	True	False					0	1657943950		0	{}	igcqt8s	False	t3_vzgbf7	False	True	t1_igbhdjz	/r/Bitcoin/comments/vzgbf7/daily_discussion_july_15_2022/igcqt8s/	1657943967	1	True	True	False	Bitcoin	t5_2s3qj	r/Bitcoin	public		0	[]			well the recession will be the deciding factor we can t predict the exact year but it will last for some more time till the economy of major countries improve and they can make some investment	0.09103574603796005	0.9875217080116272	0.195066899061203	0.9206076264381409	0.36053434014320374	0.31825584173202515	0.07666856050491333	8.4402842048803e-07	0.2801625430583954	0.006995744537562132
1	[]	False		sztormwariat			[]				text	t2_1k9livvr	False	False	Inflation of money supply can only be caused by printing.	b9d751ca63ffc894acad05eecb689542c061216a	True	False					0	1657943920		0	{}	igcqrac	False	t3_vztfsa	False	True	t1_igc571t	/r/Bitcoin/comments/vztfsa/politics_vs_science/igcqrac/	1657943931	1	True	True	False	Bitcoin	t5_2s3qj	r/Bitcoin	public		0	[]			inflation of money supply can only be caused by printing 	0.31073322892189026	0.7652846574783325	0.5022733807563782	0.749108076095581	0.3222771883010864	0.3454729914665222	0.26155462861061096	0.42113685607910156	0.4563280940055847	0.01239770743995905
2	[]	False		Ok_Aerie3546			[]				text	t2_809nb64s	False	False	Nope	2f35cebebca8fe8591e4487face7cc9e00405a9d	True	False					0	1657943914		0	{}	igcqqwq	False	t3_w06pnj	False	False	t3_w06pnj	/r/Bitcoin/comments/w06pnj/anyone_fearful_that_the_operating_cost_of_bitcoin/igcqqwq/	1657943925	1	True	True	False	Bitcoin	t5_2s3qj	r/Bitcoin	public		0	[]			nope	0.45941171050071716	0.449476420879364	0.5755079388618469	0.49167680740356445	0.4881529211997986	0.5686283111572266	0.46058768033981323	0.4850040078163147	0.487048864364624	0.5246333479881287
3	[]	False		general010			[]				text	t2_bg631	False	False	no.	b7b372ae8465344f3482ff62ad123fc1595e1127	True	False					0	1657943907		0	{}	igcqqfj	False	t3_w02c9i	False	False	t1_igcn5ks	/r/Bitcoin/comments/w02c9i/how_to_obtain_bitcoin_from_my_paypal_balancefunds/igcqqfj/	1657943919	1	True	True	False	Bitcoin	t5_2s3qj	r/Bitcoin	public		0	[]			no 	0.48560506105422974	0.5060324668884277	0.552438497543335	0.5165206789970398	0.49183720350265503	0.4923526644706726	0.4438704252243042	0.4987156093120575	0.4971311092376709	0.4656928777694702
4	[]	False		sciencetaco			[]				text	t2_i95b7	False	False	"It’s worth it to take some time learn about how the mining process works. 

Miners don’t “process” transactions. Even a cheap raspberry pi computer can do that. Even an average laptop from 2009 can do it…after all that’s what the network was running on initially. 

What miners are doing is the proof of work. They’re trying to randomly guess the hash to a block of transactions that falls within a specified range. This takes just as much energy to find a block filled with transactions as it does an empty block. 

So even if more transactions happen, the mining energy doesn’t necessarily go up. 

In addition to that, we are in the process of having small transactions migrated to another layer called Lightning. These transactions happen off-chain and don’t require mining."	1d33c5281e6f71819ee17ba7254eba994cb8ca61	True	False					0	1657943878		0	{}	igcqoko	False	t3_w06pnj	False	True	t1_igcnev9	/r/Bitcoin/comments/w06pnj/anyone_fearful_that_the_operating_cost_of_bitcoin/igcqoko/	1657943890	1	True	True	False	Bitcoin	t5_2s3qj	r/Bitcoin	public		0	[]			it s worth it to take some time learn about how the mining process works miners don t process transactions even a cheap raspberry pi computer can do that even an average laptop from 2009 can do it after all that s what the network was running on initially what miners are doing is the proof of work they re trying to randomly guess the hash to a block of transactions that falls within a specified range this takes just as much energy to find a block filled with transactions as it does an empty block so even if more transactions happen the mining energy doesn t necessarily go up in addition to that we are in the process of having small transactions migrated to another layer called lightning these transactions happen off chain and don t require mining 	0.0027620855253189802	0.9868887662887573	0.3030332028865814	0.03996775671839714	0.009045496582984924	0.42945533990859985	0.10795418173074722	8.398803856835002e-07	0.37470322847366333	0.018706750124692917
5	[]	False		konokonohamaru			[]			dark	text	t2_6jwvp2vq	False	False	Only in the sense that politicians and climate alarmists will try to kill it	66fc04b67db37ca3edfff496c7441c96e0cdc64a	True	False					0	1657943819		0	{}	igcqkn9	False	t3_w06pnj	False	True	t3_w06pnj	/r/Bitcoin/comments/w06pnj/anyone_fearful_that_the_operating_cost_of_bitcoin/igcqkn9/	1657943829	1	True	True	False	Bitcoin	t5_2s3qj	r/Bitcoin	public		0	[]			only in the sense that politicians and climate alarmists will try to kill it	0.15091101825237274	0.7860668301582336	0.82098788022995	0.6080692410469055	0.3652447462081909	0.34537532925605774	0.16008174419403076	0.3078312873840332	0.4183027446269989	0.0035886375699192286
6	[]	False		DizelEnergy			[]				text	t2_eel56kej	False	False	Well if this happen than we will get rich easily, By buying price is 30k and I got good amount of Bitcoin it will just double my investment with the lowest risk involved on such a high capital we should go for it	9fbcf506ed6713ec3bd0e7f1d4550f6d1eabc152	True	False					0	1657943805		0	{}	igcqjrt	False	t3_vzgbf7	False	True	t1_igbiojw	/r/Bitcoin/comments/vzgbf7/daily_discussion_july_15_2022/igcqjrt/	1657943817	1	True	True	False	Bitcoin	t5_2s3qj	r/Bitcoin	public		0	[]			well if this happen than we will get rich easily by buying price is 30k and i got good amount of bitcoin it will just double my investment with the lowest risk involved on such a high capital we should go for it	0.04938856512308121	0.9879541397094727	0.2815588414669037	0.050176966935396194	0.7748148441314697	0.4217575192451477	0.07461289316415787	8.034788265831594e-07	0.2715836763381958	0.013390669599175453
7	[]	False		Keith_Kong			[]			dark	text	t2_3dg2xckd	False	False	Haha yeah probably more likely to play out that way long before real estate gets demonetized.	5123be7428a7c65ec158d319d335864acfed54c7	True	False					0	1657943803		0	{}	igcqjmj	True	t3_w02akl	False	True	t1_igcozao	/r/Bitcoin/comments/w02akl/historical_us_home_prices_a_monetization_story/igcqjmj/	1657943816	1	True	True	False	Bitcoin	t5_2s3qj	r/Bitcoin	public		0	[]			haha yeah probably more likely to play out that way long before real estate gets demonetized 	0.24521629512310028	0.5232773423194885	0.3732759952545166	0.020333541557192802	0.5554524064064026	0.7603000402450562	0.17643652856349945	0.013443626463413239	0.3191785216331482	0.0158986896276474
8	[]	False		Stocksugardaddy			[]			dark	text	t2_jt5eqqsv	False	False	Central banks are so scare of Bitcoin, they hide their fear with carbon footprint	12532ad5b92dc6e2fc9c6c64d8f538d1cf0cf7a5	True	False					0	1657943775		0	{}	igcqht9	False	t3_w0518w	False	True	t3_w0518w	/r/Bitcoin/comments/w0518w/german_article_on_ecb_report_claiming_bitcoin/igcqht9/	1657943786	1	True	True	False	Bitcoin	t5_2s3qj	r/Bitcoin	public		0	[]			central banks are so scare of bitcoin they hide their fear with carbon footprint	0.14789853990077972	0.6863934397697449	0.8169689178466797	0.5564599633216858	0.36725589632987976	0.1903320997953415	0.188569113612175	0.5757185816764832	0.4991816580295563	0.008293425664305687
9	[]	False		Quindarious_Anon			[]				text	t2_692z3qxy	False	False	So true	8e252cfe31bab8809bdfd3d0c3a0864e80086599	True	False					0	1657943755		0	{}	igcqgim	False	t3_vztfsa	False	True	t1_igacntg	/r/Bitcoin/comments/vztfsa/politics_vs_science/igcqgim/	1657943772	1	True	True	False	Bitcoin	t5_2s3qj	r/Bitcoin	public		0	[]			so true	0.49968579411506653	0.4731254577636719	0.4760657548904419	0.4982847571372986	0.5039370656013489	0.5247431397438049	0.5333351492881775	0.5315425395965576	0.5164222717285156	0.5612595677375793
10	[]	False		yogaruncrypto		noob	[{'e': 'text', 't': 'redditor for 3 months'}]	2ec8e69e-6c36-11e9-a04b-0afb553d4ea6	redditor for 3 months	dark	richtext	t2_ms8cc2nr	False	False	Is that $0.07 at the beginning of 2022 or the end of 2022?	fbd56dae1ffa226629b31e866bd27de632d04acc	True	False					0	1657943714		0	{}	igcqduo	False	t3_vzp89g	False	True	t1_igaii2m	/r/Bitcoin/comments/vzp89g/you_said_bitcoin_was_stable/igcqduo/	1657943729	1	True	True	False	Bitcoin	t5_2s3qj	r/Bitcoin	public		0	[]			is that 0 07 at the beginning of 2022 or the end of 2022 	0.11847148835659027	0.8630841374397278	0.7108668088912964	0.45074257254600525	0.38615086674690247	0.021071912720799446	0.11828337609767914	9.247040111404203e-07	0.407680481672287	7.490813004551455e-05
11	[]	False		Quindarious_Anon			[]				text	t2_692z3qxy	False	False	Fractional reserve lending isn't a thing. It's just a fantasy that economists tell themselves because they have no idea how banks actually work.	37df1b3ec58523f732a60d4acb155c60a3755689	True	False					0	1657943709		0	{}	igcqdh3	False	t3_vztfsa	False	True	t1_igb33cc	/r/Bitcoin/comments/vztfsa/politics_vs_science/igcqdh3/	1657943722	1	True	True	False	Bitcoin	t5_2s3qj	r/Bitcoin	public		0	[]			fractional reserve lending isn t a thing it s just a fantasy that economists tell themselves because they have no idea how banks actually work 	0.04212288558483124	0.9052202105522156	0.7084073424339294	0.04077039659023285	0.20221461355686188	0.3623097836971283	0.07536912709474564	8.594860787525249e-07	0.47155240178108215	0.005219454877078533
12	[]	False		bakalenko			[]				text	t2_kdgu11tt	False	False	To look good and out of love for bitcoin at the end, we get it why you are saying that they look stupid and stuff but I don't think that's stupid, it's just another normal thing.	32e81a03ab96cd85b3ed711e2d66b148ef5ccd31	True	False					0	1657943661		0	{}	igcqadc	False	t3_vz9zpn	False	True	t3_vz9zpn	/r/Bitcoin/comments/vz9zpn/why_would_people_wear_bitcoin_merch_in_public/igcqadc/	1657943674	1	True	True	False	Bitcoin	t5_2s3qj	r/Bitcoin	public		0	[]			to look good and out of love for bitcoin at the end we get it why you are saying that they look stupid and stuff but i don t think that s stupid it s just another normal thing 	0.27770480513572693	0.32227301597595215	0.9465323686599731	0.008286725729703903	0.4143769145011902	0.892390787601471	0.05982653796672821	8.368406270164996e-07	0.20131810009479523	0.011892536655068398
13	[]	False		Stealthfriar2			[]				text	t2_d8s1pw16	False	False	We are glad that we have something like bitcoin with us, we should be happy to see it and we are investing in dips, we are going to be so good in coming time.	22bb900b7938f5d602f66fc320a8a8d8c3279b8d	True	False					0	1657943632		0	{}	igcq8do	False	t3_vzp89g	False	True	t3_vzp89g	/r/Bitcoin/comments/vzp89g/you_said_bitcoin_was_stable/igcq8do/	1657943645	1	True	True	False	Bitcoin	t5_2s3qj	r/Bitcoin	public		0	[]			we are glad that we have something like bitcoin with us we should be happy to see it and we are investing in dips we are going to be so good in coming time 	0.9197949171066284	0.43212002515792847	0.09209195524454117	0.016186431050300598	0.9926345944404602	0.5506353974342346	0.9552722573280334	8.61748901570536e-07	0.29177314043045044	0.02730722352862358
14	[]	False		Quindarious_Anon			[]				text	t2_692z3qxy	False	False	Y'all complaining about inflation. Well get ready for deflation and then we'll talk	811fa0593479a26c818862d09e3a00d0bf7cc0f3	True	False					0	1657943587		0	{}	igcq5e2	False	t3_vztfsa	False	True	t3_vztfsa	/r/Bitcoin/comments/vztfsa/politics_vs_science/igcq5e2/	1657943599	1	True	True	False	Bitcoin	t5_2s3qj	r/Bitcoin	public		0	[]			y all complaining about inflation well get ready for deflation and then we ll talk	0.2283472865819931	0.4978249967098236	0.4702030122280121	0.1768662929534912	0.35302457213401794	0.6165459156036377	0.2681933045387268	0.5212662816047668	0.286953330039978	0.007618084084242582
15	[]	False		dundi06			[]				text	t2_fuk8v3uq	False	False	Lmao I can't stop laughing on these things for sure man.	1a3ba1e1a527bbc5b4bf2cf5978c70306a4181c3	True	False					0	1657943572		0	{}	igcq4ha	False	t3_vz9zpn	False	True	t1_ig8dj0p	/r/Bitcoin/comments/vz9zpn/why_would_people_wear_bitcoin_merch_in_public/igcq4ha/	1657943584	1	True	True	False	Bitcoin	t5_2s3qj	r/Bitcoin	public		0	[]			lmao i can t stop laughing on these things for sure man 	0.2547265887260437	0.21996037662029266	0.6432220339775085	0.03843836113810539	0.37335050106048584	0.9799376130104065	0.29073938727378845	0.015632933005690575	0.29162609577178955	0.004317827522754669
16	[]	False		Quindarious_Anon			[]				text	t2_692z3qxy	False	False	Need a debt jubilee	0fb85f2ed0bed33cef8b6a4c0ea89520dab0292e	True	False					0	1657943555		0	{}	igcq3dr	False	t3_vztfsa	False	True	t1_igay6rh	/r/Bitcoin/comments/vztfsa/politics_vs_science/igcq3dr/	1657943569	1	True	True	False	Bitcoin	t5_2s3qj	r/Bitcoin	public		0	[]			need a debt jubilee	0.5777720808982849	0.5354950428009033	0.44298768043518066	0.535733699798584	0.384494423866272	0.2880687117576599	0.44905057549476624	0.4246102273464203	0.4625438451766968	0.2708066403865814
17	[]	False		GivemeyourNFTs		noob	[{'e': 'text', 't': 'redditor for 2 months'}]	2ec8e69e-6c36-11e9-a04b-0afb553d4ea6	redditor for 2 months	dark	richtext	t2_n3hn0kd5	False	False	Niiiiiiice	8a1225ac6160f1e260167d1f7dd355156df9a60f	True	False					0	1657943533		0	{}	igcq1xx	False	t3_vztbzp	False	True	t3_vztbzp	/r/Bitcoin/comments/vztbzp/just_a_small_portion_of_my_bitcoin_shirt_and/igcq1xx/	1657943548	1	True	True	False	Bitcoin	t5_2s3qj	r/Bitcoin	public		0	[]			niiiiiiice	0.4630463123321533	0.5352395176887512	0.508516252040863	0.4709847569465637	0.4710223376750946	0.1883898675441742	0.5232471227645874	0.4854360520839691	0.48512938618659973	0.4087046682834625
18	[]	False		Quindarious_Anon			[]				text	t2_692z3qxy	False	False	They are booing you, but you're right.	5fc94067a8963b374865421604380753da43ffc0	True	False					0	1657943478		0	{}	igcpydq	False	t3_vztfsa	False	True	t1_igax2pc	/r/Bitcoin/comments/vztfsa/politics_vs_science/igcpydq/	1657943491	1	True	True	False	Bitcoin	t5_2s3qj	r/Bitcoin	public		0	[]			they are booing you but you re right 	0.46066462993621826	0.1907794326543808	0.7676611542701721	0.3954780399799347	0.3884066641330719	0.7608460783958435	0.37471872568130493	0.13981746137142181	0.46710386872291565	0.07722797989845276
19	[]	False		[deleted]						dark					[removed]	fe993932d6dced4c0a879e9aa5d7a6e0fbb467f5	True	False					0	1657943466		0	{}	igcpxhw	False	t3_vzgbf7	False	True	t3_vzgbf7	/r/Bitcoin/comments/vzgbf7/daily_discussion_july_15_2022/igcpxhw/	1657943476	1	True	True	False	Bitcoin	t5_2s3qj	r/Bitcoin	public		0	[]			 removed 	0.46707504987716675	0.5148742198944092	0.5170193910598755	0.5029740929603577	0.4936113953590393	0.5123135447502136	0.45383262634277344	0.4847692549228668	0.4981911778450012	0.5145108103752136
20	[]	False		Niifaal			[]				text	t2_egtou452	False	False	Kind of right, we are just good without things like that.	e9d4c9ccbf928124d8a51fd6667878d15cc1b714	True	False					0	1657943445		0	{}	igcpw54	False	t3_vz9zpn	False	True	t1_ig8kod2	/r/Bitcoin/comments/vz9zpn/why_would_people_wear_bitcoin_merch_in_public/igcpw54/	1657943463	1	True	True	False	Bitcoin	t5_2s3qj	r/Bitcoin	public		0	[]			kind of right we are just good without things like that 	0.6261574625968933	0.2930927574634552	0.538206160068512	0.1524520069360733	0.6184168457984924	0.6213679909706116	0.38555389642715454	0.77782142162323	0.44562214612960815	0.007950681261718273
21	[]	False		LukeAeon			[]				text	t2_9dagbqmd	False	False	1 btc = everything/21000000	43544fd988b567750adea0515e98d6b458f37909	True	False					0	1657943442		0	{}	igcpvz7	False	t3_vzp89g	False	True	t1_igcaspk	/r/Bitcoin/comments/vzp89g/you_said_bitcoin_was_stable/igcpvz7/	1657943455	1	True	True	False	Bitcoin	t5_2s3qj	r/Bitcoin	public		0	[]			1 btc everything 21000000	0.4877292811870575	0.5485338568687439	0.5508909821510315	0.5034148693084717	0.42733001708984375	0.41370049118995667	0.44761744141578674	0.32957279682159424	0.47491297125816345	0.3022053837776184
22	[]	False		forzagesu			[]				text	t2_13dlti	False	False	This may be the dumbest post I've ever seen	054cfa3315a5e6ecc23936998039c3687392d9ab	True	False					0	1657943356		0	{}	igcpq7k	False	t3_vztfsa	False	True	t3_vztfsa	/r/Bitcoin/comments/vztfsa/politics_vs_science/igcpq7k/	1657943368	1	True	True	False	Bitcoin	t5_2s3qj	r/Bitcoin	public		0	[]			this may be the dumbest post i ve ever seen	0.23519004881381989	0.40321671962738037	0.723416268825531	0.17882633209228516	0.40397775173187256	0.7356903553009033	0.4831993281841278	0.4204411506652832	0.40566936135292053	0.04882436245679855
23	[]	False		Quindarious_Anon			[]				text	t2_692z3qxy	False	False	The problem is the supply chain, not the money	1bb40aecbdbac0f5344b3682473cb81be34910b2	True	False					0	1657943312		0	{}	igcpncd	False	t3_vztfsa	False	True	t1_igaajkq	/r/Bitcoin/comments/vztfsa/politics_vs_science/igcpncd/	1657943324	1	True	True	False	Bitcoin	t5_2s3qj	r/Bitcoin	public		0	[]			the problem is the supply chain not the money	0.29875776171684265	0.722886323928833	0.623854398727417	0.6728292107582092	0.4779984951019287	0.34701141715049744	0.19390380382537842	0.23699286580085754	0.44229236245155334	0.03935594856739044
24	[]	False		AtlaStar			[]				text	t2_j2prp	False	False	"Yeah you are super wrong about Keynesian and half wrong about monetarist economics...like just dead ass wrong in general though

The Monetarist school is pretty much the first half plus what you said Keynesian economics is about...the monetarist school is all about central banking and Milton Friedmans modified QTM.

Keynesian economics was all about countercyclical policies; deficit spending on infrastructure and what not to heat up the economy along with tax cuts, and tax increases to cool it down...Keynes was all about using the legislative branch to control monetary targets because of the belief that wages and prices lagged behind the actual supply and demand curve...as such that would lead to shortages of goods or surpluses when otherwise the supply and demand was perfectly accounted for."	16848736ec2d3dadecebdca6e93766322ff0aafe	True	False					0	1657943310		0	{}	igcpn6l	False	t3_w05hd1	False	True	t1_igcihqj	/r/Bitcoin/comments/w05hd1/wouldnt_a_perfect_currencymoney_neither/igcpn6l/	1657943324	1	True	True	False	Bitcoin	t5_2s3qj	r/Bitcoin	public		0	[]			yeah you are super wrong about keynesian and half wrong about monetarist economics like just dead ass wrong in general though the monetarist school is pretty much the first half plus what you said keynesian economics is about the monetarist school is all about central banking and milton friedmans modified qtm keynesian economics was all about countercyclical policies deficit spending on infrastructure and what not to heat up the economy along with tax cuts and tax increases to cool it down keynes was all about using the legislative branch to control monetary targets because of the belief that wages and prices lagged behind the actual supply and demand curve as such that would lead to shortages of goods or surpluses when otherwise the supply and demand was perfectly accounted for 	0.0025518457405269146	0.9886053204536438	0.8365197777748108	0.9412674903869629	0.9941974878311157	0.5980620980262756	0.09641203284263611	8.417133585680858e-07	0.41806116700172424	0.06312984973192215
25	[]	False		nybhh			[]				text	t2_135hak	False	False	Well typed and thank you for taking your time to write and share that.  Unfortunately I have no rewards to offer at the moment but you deserve one.	d3b178635d87c14edb45fa53b68b74c319dc5534	True	False					0	1657943304		0	{}	igcpmsc	False	t3_w05hd1	False	True	t1_igcihqj	/r/Bitcoin/comments/w05hd1/wouldnt_a_perfect_currencymoney_neither/igcpmsc/	1657943317	1	True	True	False	Bitcoin	t5_2s3qj	r/Bitcoin	public		0	[]			well typed and thank you for taking your time to write and share that unfortunately i have no rewards to offer at the moment but you deserve one 	0.8784167170524597	0.42237716913223267	0.001867402344942093	0.018164008855819702	0.0119464211165905	0.4868369698524475	0.9713597893714905	0.12693095207214355	0.1689695119857788	0.03741026669740677
26	[]	False		GroundbreakingBed940			[]				text	t2_4m9bk41b	False	False	Unless ur buying btc for your kids... shame,shame,shame	d0eaf6c78ed811d0a4458cca6d5f78dde9c4f12c	True	False					0	1657943292		0	{}	igcpm11	False	t3_w06gs3	False	True	t3_w06gs3	/r/Bitcoin/comments/w06gs3/not_paying_child_support_to_buy_more_bitcoin/igcpm11/	1657943304	1	True	True	False	Bitcoin	t5_2s3qj	r/Bitcoin	public		0	[]			unless ur buying btc for your kids shame shame shame	0.40165823698043823	0.17139635980129242	0.8571057319641113	0.20439934730529785	0.3437170684337616	0.7645264863967896	0.45016562938690186	0.63539719581604	0.36843106150627136	0.0038521878886967897
27	[]	False		bstardif			[]				text	t2_h6oaw	False	False	Yes, likely bitcoin wouldn't have worked then. However we have the chance now to create better government protections and self custody is easier and more secure than it ever was with gold. Also with a larger world and many nations as well as ease of travel nations may end up creating more incentives for people to move there in order to have people live and spend and pay taxes in their country. Now that could absolutely work both ways where governments make incentives for the rich instead. But then the people could simply not move to those country's and refuse to give up their private keys. Whereas before gold could be taken through force. With things like multisig signing devices Even torture wouldn't be enough to take someone's private keys. So the incentive is a carrot not a stick to get someone's money.	f0b2e20e356c9253bbbb65bf049d616c352930a1	True	False					0	1657943265		0	{}	igcpk98	False	t3_w05hd1	False	True	t1_igcoh50	/r/Bitcoin/comments/w05hd1/wouldnt_a_perfect_currencymoney_neither/igcpk98/	1657943275	1	True	True	False	Bitcoin	t5_2s3qj	r/Bitcoin	public		0	[]			yes likely bitcoin wouldn t have worked then however we have the chance now to create better government protections and self custody is easier and more secure than it ever was with gold also with a larger world and many nations as well as ease of travel nations may end up creating more incentives for people to move there in order to have people live and spend and pay taxes in their country now that could absolutely work both ways where governments make incentives for the rich instead but then the people could simply not move to those country s and refuse to give up their private keys whereas before gold could be taken through force with things like multisig signing devices even torture wouldn t be enough to take someone s private keys so the incentive is a carrot not a stick to get someone s money 	0.002847005845978856	0.9881193041801453	0.5418296456336975	0.9510338306427002	0.008331096731126308	0.3991052508354187	0.06209132820367813	8.522502525920572e-07	0.19979573786258698	0.011800752952694893
28	[]	False		Quindarious_Anon			[]				text	t2_692z3qxy	False	False	"Ight, because Milton Friedman is ""science."""	045c45ebfa74f333136834bed759a8eee7e12e8e	True	False					0	1657943246		0	{}	igcpj2h	False	t3_vztfsa	False	True	t3_vztfsa	/r/Bitcoin/comments/vztfsa/politics_vs_science/igcpj2h/	1657943258	1	True	True	False	Bitcoin	t5_2s3qj	r/Bitcoin	public		0	[]			ight because milton friedman is science 	0.33331775665283203	0.500471293926239	0.5585843920707703	0.3896556496620178	0.46137744188308716	0.6496842503547668	0.4413853883743286	0.38633692264556885	0.49924731254577637	0.09193554520606995
29	[]	False		lkopfer			[]				text	t2_5tb3gqom	False	False	Lmao look at Bitcoin price relative to major stock indexes. It’s almost the same graph. U all have been bamboozled into investing into a currency that follows the economy regardless.	f74ec692f86f4465cb1752ecd00e62bc82f791bc	True	False					0	1657943236		0	{}	igcpidk	False	t3_vzp89g	False	True	t3_vzp89g	/r/Bitcoin/comments/vzp89g/you_said_bitcoin_was_stable/igcpidk/	1657943247	1	True	True	False	Bitcoin	t5_2s3qj	r/Bitcoin	public		0	[]			lmao look at bitcoin price relative to major stock indexes it s almost the same graph u all have been bamboozled into investing into a currency that follows the economy regardless 	0.004887826275080442	0.9839065074920654	0.615040123462677	0.0240738894790411	0.7393077611923218	0.2842060327529907	0.0903654620051384	0.3303617238998413	0.4939022660255432	0.003209561575204134
