Unnamed: 0	all_awardings	archived	associated_award	author	author_flair_background_color	author_flair_css_class	author_flair_richtext	author_flair_template_id	author_flair_text	author_flair_text_color	author_flair_type	author_fullname	author_patreon_flair	author_premium	body	body_sha1	can_gild	collapsed	collapsed_because_crowd_control	collapsed_reason	collapsed_reason_code	comment_type	controversiality	created_utc	distinguished	gilded	gildings	id	is_submitter	link_id	locked	no_follow	parent_id	permalink	retrieved_utc	score	score_hidden	send_replies	stickied	subreddit	subreddit_id	subreddit_name_prefixed	subreddit_type	top_awarded_type	total_awards_received	treatment_tags	unrepliable_reason	author_cakeday	corpus	support	knowledge	conflict	power	similarity	fun	status	trust	identity	romance
137	[]	False		bstardif			[]				text	t2_h6oaw	False	False	"Monetarily vs kayensian vs austrian.

Monetary theory is that money is injected into the economy at a perfect rate no matter what and the rest of the economy is left to figure itself out. Because technology is naturally deflationary prices should remain relatively stagnant. 

Kaynsian is that money and interest rates are controlled on an as needed basis along with price and comodity control in many sectors all controlled by a central authority.

Austrian, money should be deflationary so that saving is incentivised as an inflationary environment pushes spending by giving people a high time preference (spend money sooner rather than later) in Austrian economics companies must compete harder to convince people to buy their services or products. This can slow the economy however with kaynesian you ha e growth for the sake of growth, with no quality improvement  incentivises bad business practices, waste of resources, bad resource management, and a constant push for a quick buck. 

Under Austrian company's will need to create better, higher quality, products. Because this will mean a more expensive process to create these products technology will likely advance to find ways to create these products cheaply while remaining of high quality and usefulness in order to convince the consumer to spend their money.

I should say I'm biased so it's possible I haven't represented all sides fairly."	b5db013f4e4545d829db777580b470fa353a1071	True	False					0	1657939550		0	{}	igcihqj	False	t3_w05hd1	False	True	t3_w05hd1	/r/Bitcoin/comments/w05hd1/wouldnt_a_perfect_currencymoney_neither/igcihqj/	1657939562	1	True	True	False	Bitcoin	t5_2s3qj	r/Bitcoin	public		0	[]			monetarily vs kayensian vs austrian monetary theory is that money is injected into the economy at a perfect rate no matter what and the rest of the economy is left to figure itself out because technology is naturally deflationary prices should remain relatively stagnant kaynsian is that money and interest rates are controlled on an as needed basis along with price and comodity control in many sectors all controlled by a central authority austrian money should be deflationary so that saving is incentivised as an inflationary environment pushes spending by giving people a high time preference spend money sooner rather than later in austrian economics companies must compete harder to convince people to buy their services or products this can slow the economy however with kaynesian you ha e growth for the sake of growth with no quality improvement incentivises bad business practices waste of resources bad resource management and a constant push for a quick buck under austrian company s will need to create better higher quality products because this will mean a more expensive process to create these products technology will likely advance to find ways to create these products cheaply while remaining of high quality and usefulness in order to convince the consumer to spend their money i should say i m biased so it s possible i haven t represented all sides fairly 	0.0028881938196718693	0.9877611398696899	0.05992260202765465	0.01680980809032917	0.9940029978752136	0.5330979228019714	0.12253221124410629	8.546652452423587e-07	0.4106331169605255	0.004211354535073042
138	[]	False		addiyao		noob	[{'e': 'text', 't': 'redditor for 3 months'}]	2ec8e69e-6c36-11e9-a04b-0afb553d4ea6	redditor for 3 months	dark	richtext	t2_mrld5cgv	False	False	We all know it's going to be so good in coming months.	27735464480fca9db220157d3f06a80d324fe329	True	False					0	1657939547		0	{}	igcihjo	False	t3_vzp89g	False	True	t1_igaift7	/r/Bitcoin/comments/vzp89g/you_said_bitcoin_was_stable/igcihjo/	1657939562	1	True	True	False	Bitcoin	t5_2s3qj	r/Bitcoin	public		0	[]			we all know it s going to be so good in coming months 	0.6101900339126587	0.4232759475708008	0.17241311073303223	0.31893011927604675	0.6354364156723022	0.5755260586738586	0.33508533239364624	0.6699995994567871	0.34506961703300476	0.012592809274792671
139	[]	False		MifuneKinski			[]				text	t2_58fy2	False	False	Hey global inflation is worse than us inflation so maybe it's not the dollar printing	3b290fd78f5bd33185e311794ea49692a7457a7a	True	False					0	1657939535		0	{}	igcigod	False	t3_vztfsa	False	True	t3_vztfsa	/r/Bitcoin/comments/vztfsa/politics_vs_science/igcigod/	1657939548	1	True	True	False	Bitcoin	t5_2s3qj	r/Bitcoin	public		0	[]			hey global inflation is worse than us inflation so maybe it s not the dollar printing	0.04520324245095253	0.6804789304733276	0.6317960023880005	0.409803569316864	0.3744230568408966	0.4395809769630432	0.14181800186634064	1.1484421520435717e-06	0.4396875202655792	0.0022202336695045233
140	[]	False		Drboobiesmd			[]				text	t2_83symvbp	False	False	It’s possible but computationally impractical, and based on present computing speeds it would take longer than a human lifespan to crack so it’s really only theoretically possible; computers haven’t even been around long enough for it to have ever happened once.	f317a16decda803ca45b35be3d2e6c84a258c228	True	False					0	1657939534		0	{}	igciglo	False	t3_vzyzjx	False	True	t3_vzyzjx	/r/Bitcoin/comments/vzyzjx/is_it_possible_to_reverseengineer_an_extended/igciglo/	1657939548	1	True	True	False	Bitcoin	t5_2s3qj	r/Bitcoin	public		0	[]			it s possible but computationally impractical and based on present computing speeds it would take longer than a human lifespan to crack so it s really only theoretically possible computers haven t even been around long enough for it to have ever happened once 	0.0029338733293116093	0.9887332916259766	0.09886171668767929	0.008526341989636421	0.013016213662922382	0.6206008791923523	0.07007836550474167	8.456269142698147e-07	0.2694634199142456	0.01720079407095909
141	[]	False		[deleted]						dark					[removed]	fe993932d6dced4c0a879e9aa5d7a6e0fbb467f5	True	False					0	1657939505		0	{}	igciejj	False	t3_vz9zpn	False	True	t3_vz9zpn	/r/Bitcoin/comments/vz9zpn/why_would_people_wear_bitcoin_merch_in_public/igciejj/	1657939518	1	True	True	False	Bitcoin	t5_2s3qj	r/Bitcoin	public		0	[]			 removed 	0.46707504987716675	0.5148742198944092	0.5170193910598755	0.5029740929603577	0.4936113953590393	0.5123135447502136	0.45383262634277344	0.4847692549228668	0.4981911778450012	0.5145108103752136
142	[]	False		Short_Syllabub_303			[]				text	t2_g8eih8oa	False	False	You don’t have to try to insult me. Your purposefully being obtuse to the negatives of a deflationary currency are dishonest. It’s not wrong to point out the flaws that it’s not just “people not buying fidget spinners and 80 pairs of shoes”	93a1a71390f3ea144c937eed029c33bb77421b3e	True	False					0	1657939471		0	{}	igcic6v	False	t3_w05hd1	False	True	t1_igci2qd	/r/Bitcoin/comments/w05hd1/wouldnt_a_perfect_currencymoney_neither/igcic6v/	1657939483	1	True	True	False	Bitcoin	t5_2s3qj	r/Bitcoin	public		0	[]			you don t have to try to insult me your purposefully being obtuse to the negatives of a deflationary currency are dishonest it s not wrong to point out the flaws that it s not just people not buying fidget spinners and 80 pairs of shoes 	0.00207231636159122	0.9700418710708618	0.9135133624076843	0.013982881791889668	0.007052763365209103	0.4558587968349457	0.09545194357633591	8.448924972981331e-07	0.444133460521698	0.0017926977016031742
143	[]	False		[deleted]						dark					[removed]	fe993932d6dced4c0a879e9aa5d7a6e0fbb467f5	True	False					0	1657939461		0	{}	igcibgm	False	t3_vzv6dx	False	True	t3_vzv6dx	/r/Bitcoin/comments/vzv6dx/posted_this_graph_of_my_portfolio_on_a_stock_site/igcibgm/	1657939474	1	True	True	False	Bitcoin	t5_2s3qj	r/Bitcoin	public		0	[]			 removed 	0.46707504987716675	0.5148742198944092	0.5170193910598755	0.5029740929603577	0.4936113953590393	0.5123135447502136	0.45383262634277344	0.4847692549228668	0.4981911778450012	0.5145108103752136
144	[]	False		gamercer			[]				text	t2_fnzdg	False	False	Why is that ideal? That would betray a principle of the incorruptibility property that makes bitcoin superior to a currency that would be tied to populations.	f075bb51101483d2024572c4ad8ba655ff13e42f	True	False					0	1657939460		0	{}	igcibgc	False	t3_w05hd1	False	True	t1_igcffp5	/r/Bitcoin/comments/w05hd1/wouldnt_a_perfect_currencymoney_neither/igcibgc/	1657939474	1	True	True	False	Bitcoin	t5_2s3qj	r/Bitcoin	public		0	[]			why is that ideal that would betray a principle of the incorruptibility property that makes bitcoin superior to a currency that would be tied to populations 	0.021359676495194435	0.9552367329597473	0.5527976155281067	0.12075577676296234	0.22674055397510529	0.13903185725212097	0.10274779051542282	0.8013738989830017	0.5394265055656433	0.005979658104479313
145	[]	False		3dbolt			[]				text	t2_h45kuixv	False	False	Yeah and that became very popular in main stream as well	24bdd85875f76c4f46953e743576265bd4b08b6f	True	False					0	1657939398		0	{}	igci71y	False	t3_vzgbf7	False	True	t1_ig9q6yn	/r/Bitcoin/comments/vzgbf7/daily_discussion_july_15_2022/igci71y/	1657939410	1	True	True	False	Bitcoin	t5_2s3qj	r/Bitcoin	public		0	[]			yeah and that became very popular in main stream as well	0.348217248916626	0.5808148384094238	0.08350828289985657	0.13391181826591492	0.6687583923339844	0.5797184109687805	0.36328694224357605	0.6493637561798096	0.590711772441864	0.09282208234071732
146	[]	False		MaybeImNaked			[]				text	t2_3siwy	False	False	You're just using random buzzwords and aphorisms without really understanding anything. It sounds like you're advocating for a deflationary currency without thinking of the implications.	20e4817db48a198e212b5acf5a4a6a6f4cbe07c8	True	False					0	1657939377		0	{}	igci5l3	False	t3_vztfsa	False	True	t1_igc8p20	/r/Bitcoin/comments/vztfsa/politics_vs_science/igci5l3/	1657939393	1	True	True	False	Bitcoin	t5_2s3qj	r/Bitcoin	public		0	[]			you re just using random buzzwords and aphorisms without really understanding anything it sounds like you re advocating for a deflationary currency without thinking of the implications 	0.020783716812729836	0.9638323783874512	0.7615410685539246	0.015186551958322525	0.028972532600164413	0.26197218894958496	0.11360161006450653	8.501494903612183e-07	0.45091596245765686	0.004065551329404116
147	[]	False		SmoothGoing			[]			dark	text	t2_aihchwkb	False	False	You are free to concentrate your wealth and reap all the benefits. In any environment. Someone else did it. Why not you? Too busy hanging out on reddit?	f073ded13883ac8b990a670266e1e922fc72c607	True	False					0	1657939337		0	{}	igci2qd	False	t3_w05hd1	False	True	t1_igchfxm	/r/Bitcoin/comments/w05hd1/wouldnt_a_perfect_currencymoney_neither/igci2qd/	1657939349	1	True	True	False	Bitcoin	t5_2s3qj	r/Bitcoin	public		0	[]			you are free to concentrate your wealth and reap all the benefits in any environment someone else did it why not you too busy hanging out on reddit 	0.41097894310951233	0.9452473521232605	0.8038802146911621	0.833602249622345	0.017463793978095055	0.5753853917121887	0.08142998814582825	0.3825334906578064	0.31707122921943665	0.00746558140963316
148	[]	False		[deleted]						dark					[removed]	fe993932d6dced4c0a879e9aa5d7a6e0fbb467f5	True	False					0	1657939284		0	{}	igchz27	False	t3_w014pv	False	True	t1_igcelwk	/r/Bitcoin/comments/w014pv/how_many_of_you_remember_this_roger_vers_tweet/igchz27/	1657939297	1	True	True	False	Bitcoin	t5_2s3qj	r/Bitcoin	public		0	[]			 removed 	0.46707504987716675	0.5148742198944092	0.5170193910598755	0.5029740929603577	0.4936113953590393	0.5123135447502136	0.45383262634277344	0.4847692549228668	0.4981911778450012	0.5145108103752136
149	[]	False		TenshiS			[]				text	t2_4nvmm	False	False	"I thought the ECB exists solely for the purpose of keeping inflation in check? And are non political and with zero legislative power? 

And here they are, worst inflation in decades, yet all they care about is the climate, all of a sudden.

Most obvious diversion tactic I've ever seen."	f6f4dcb47987be4323e4154762f9627ba22e9a89	True	False					0	1657939161		0	{}	igchq84	True	t3_w0518w	False	False	t3_w0518w	/r/Bitcoin/comments/w0518w/german_article_on_ecb_report_claiming_bitcoin/igchq84/	1657939173	1	True	True	False	Bitcoin	t5_2s3qj	r/Bitcoin	public		0	[]			i thought the ecb exists solely for the purpose of keeping inflation in check and are non political and with zero legislative power and here they are worst inflation in decades yet all they care about is the climate all of a sudden most obvious diversion tactic i ve ever seen 	0.0028763955924659967	0.9873283505439758	0.859219491481781	0.017112845554947853	0.009383246302604675	0.6655128002166748	0.11282774060964584	8.524234544893261e-07	0.4092092514038086	0.021015433594584465
150	[]	False		HlIlM			[]				text	t2_jklydjgc	False	False	A fixed amount of currency means the role of money is owned.  'Spenders' will inevitably transfer more and more money to hoarders/savers.  In the Great Depression, people with money (  gold )  demanded ~20% real rates of interest and held the economy hostage in a deflationary spiral.  All society needed was a stable medium of exchange, but that role was owned and exploited for profit.	61b41d0e903ca902cd9ba560c476cb2f35ce831e	True	False					0	1657939152		0	{}	igchpls	False	t3_w05hd1	False	True	t3_w05hd1	/r/Bitcoin/comments/w05hd1/wouldnt_a_perfect_currencymoney_neither/igchpls/	1657939166	1	True	True	False	Bitcoin	t5_2s3qj	r/Bitcoin	public		0	[]			a fixed amount of currency means the role of money is owned spenders will inevitably transfer more and more money to hoarders savers in the great depression people with money gold demanded 20 real rates of interest and held the economy hostage in a deflationary spiral all society needed was a stable medium of exchange but that role was owned and exploited for profit 	0.0030729263089597225	0.9868829846382141	0.3295319080352783	0.9245051145553589	0.00955831166356802	0.5192421078681946	0.1091904416680336	8.340631438841228e-07	0.42176273465156555	0.07976263761520386
151	[]	False		ColdFusion3456		noob	[{'e': 'text', 't': 'redditor for 3 months'}]	2ec8e69e-6c36-11e9-a04b-0afb553d4ea6	redditor for 3 months	dark	richtext	t2_mne9y608	False	False	Whoever drew that is golden. They deserve a BTC	93df4f65bb322fb96825441ee95fa237407cb272	True	False					0	1657939096		0	{}	igchlq0	False	t3_vzp89g	False	True	t3_vzp89g	/r/Bitcoin/comments/vzp89g/you_said_bitcoin_was_stable/igchlq0/	1657939107	1	True	True	False	Bitcoin	t5_2s3qj	r/Bitcoin	public		0	[]			whoever drew that is golden they deserve a btc	0.3253711462020874	0.3299182057380676	0.5210217833518982	0.13630682229995728	0.39539653062820435	0.04656076803803444	0.42601731419563293	0.2109554558992386	0.45267805457115173	0.0012760303216055036
152	[]	False		Short_Syllabub_303			[]				text	t2_g8eih8oa	False	False	"Not sure what you mean. 

If inflationary causes people to lose value in their money. (Which is good for wealth distribution as you stated large millionaires are effected more)

then deflationary creates wealth concentration and benefits the wealthy the most."	743cdec380683870f60c96b18b6c2177af8221d4	True	False					0	1657939014		0	{}	igchfxm	False	t3_w05hd1	False	False	t1_igch4ic	/r/Bitcoin/comments/w05hd1/wouldnt_a_perfect_currencymoney_neither/igchfxm/	1657939027	1	True	True	False	Bitcoin	t5_2s3qj	r/Bitcoin	public		0	[]			not sure what you mean if inflationary causes people to lose value in their money which is good for wealth distribution as you stated large millionaires are effected more then deflationary creates wealth concentration and benefits the wealthy the most 	0.018725810572504997	0.9869118928909302	0.49366986751556396	0.5681690573692322	0.1264277547597885	0.2384684979915619	0.09875728189945221	8.494038752360211e-07	0.544511079788208	0.00412004953250289
153	[]	False		[deleted]						dark					[removed]	fe993932d6dced4c0a879e9aa5d7a6e0fbb467f5	True	False					0	1657938999		0	{}	igchew6	False	t3_vzgbf7	False	True	t3_vzgbf7	/r/Bitcoin/comments/vzgbf7/daily_discussion_july_15_2022/igchew6/	1657939013	1	True	True	False	Bitcoin	t5_2s3qj	r/Bitcoin	public		0	[]			 removed 	0.46707504987716675	0.5148742198944092	0.5170193910598755	0.5029740929603577	0.4936113953590393	0.5123135447502136	0.45383262634277344	0.4847692549228668	0.4981911778450012	0.5145108103752136
154	[]	False		FighthouseWednesdays		noob	[{'e': 'text', 't': 'redditor for 1 week'}]	2ec8e69e-6c36-11e9-a04b-0afb553d4ea6	redditor for 1 week	dark	richtext	t2_ph8xat1f	False	False	We're still early	8638a2573a08e1ba6155423e49a6373647d456eb	True	False					0	1657938963		0	{}	igchcav	False	t3_vznbx7	False	True	t3_vznbx7	/r/Bitcoin/comments/vznbx7/they_sell_bitcoin_candy_on_a_german_gas_station/igchcav/	1657938976	1	True	True	False	Bitcoin	t5_2s3qj	r/Bitcoin	public		0	[]			we re still early	0.5456497669219971	0.45723047852516174	0.35351982712745667	0.5761545300483704	0.49269065260887146	0.567051351070404	0.5091941356658936	0.4844648540019989	0.48025861382484436	0.5016688704490662
155	[]	False		[deleted]						dark					[removed]	fe993932d6dced4c0a879e9aa5d7a6e0fbb467f5	True	False					0	1657938951		0	{}	igchbeh	False	t3_w03id8	False	True	t3_w03id8	/r/Bitcoin/comments/w03id8/i_own_nothing_yet_im_a_hoarder_what_am_i/igchbeh/	1657938961	1	True	True	False	Bitcoin	t5_2s3qj	r/Bitcoin	public		0	[]			 removed 	0.46707504987716675	0.5148742198944092	0.5170193910598755	0.5029740929603577	0.4936113953590393	0.5123135447502136	0.45383262634277344	0.4847692549228668	0.4981911778450012	0.5145108103752136
156	[]	False		nybhh			[]				text	t2_135hak	False	False	Mike drop	de827e282a53d057f3360678ec01ee20273796ab	True	False					0	1657938950		0	{}	igchbb2	False	t3_w05hd1	False	True	t1_igcglu5	/r/Bitcoin/comments/w05hd1/wouldnt_a_perfect_currencymoney_neither/igchbb2/	1657938961	1	True	True	False	Bitcoin	t5_2s3qj	r/Bitcoin	public		0	[]			mike drop	0.4306289851665497	0.456868976354599	0.4673818051815033	0.51637202501297	0.45831844210624695	0.6933978796005249	0.5000544786453247	0.44930264353752136	0.4280242323875427	0.2565889358520508
157	[]	False		ScamJustice			[]				text	t2_63flt8uy	False	False	Shitcoins are hampering Bitcoin's rise	30fc0ccb0def1bfa3d55a09e19bede4a822c9462	True	False					0	1657938903		0	{}	igch7z1	False	t3_vzgbf7	False	True	t3_vzgbf7	/r/Bitcoin/comments/vzgbf7/daily_discussion_july_15_2022/igch7z1/	1657938917	1	True	True	False	Bitcoin	t5_2s3qj	r/Bitcoin	public		0	[]			shitcoins are hampering bitcoin s rise	0.4380215108394623	0.5564061403274536	0.5887634754180908	0.4812124967575073	0.393608033657074	0.3759191036224365	0.4196467995643616	0.4795823097229004	0.5071711540222168	0.04862767830491066
158	[]	False		TenshiS			[]				text	t2_4nvmm	False	False	Especially the fact their only proposed solution to carbon footprint is an outright ban is telling.	0cd8493793c521036930439e211d16e0d38dea3a	True	False					0	1657938902		0	{}	igch7x9	True	t3_w0518w	False	False	t1_igcdzre	/r/Bitcoin/comments/w0518w/german_article_on_ecb_report_claiming_bitcoin/igch7x9/	1657938917	1	True	True	False	Bitcoin	t5_2s3qj	r/Bitcoin	public		0	[]			especially the fact their only proposed solution to carbon footprint is an outright ban is telling 	0.097883440554142	0.8258609771728516	0.6457271575927734	0.6138270497322083	0.437068372964859	0.466390460729599	0.13598309457302094	1.627945948712295e-06	0.5176727771759033	0.00499179819598794
159	[]	False		SmoothGoing			[]			dark	text	t2_aihchwkb	False	False	No one would earn it, they just wouldn't lose it in the first place.	84df571987a62030e020e4ea2dd041d4be6747c6	True	False					0	1657938855		0	{}	igch4ic	False	t3_w05hd1	False	True	t1_igcglu5	/r/Bitcoin/comments/w05hd1/wouldnt_a_perfect_currencymoney_neither/igch4ic/	1657938866	1	True	True	False	Bitcoin	t5_2s3qj	r/Bitcoin	public		0	[]			no one would earn it they just wouldn t lose it in the first place 	0.26083558797836304	0.6112891435623169	0.4671745002269745	0.6003626585006714	0.36858829855918884	0.6552355885505676	0.1186559721827507	1.0887325515795965e-05	0.40283605456352234	0.00784058403223753
160	[]	False		[deleted]						dark					[removed]	fe993932d6dced4c0a879e9aa5d7a6e0fbb467f5	True	False					0	1657938849		0	{}	igch42o	False	t3_vztfsa	False	True	t3_vztfsa	/r/Bitcoin/comments/vztfsa/politics_vs_science/igch42o/	1657938860	1	True	True	False	Bitcoin	t5_2s3qj	r/Bitcoin	public		0	[]			 removed 	0.46707504987716675	0.5148742198944092	0.5170193910598755	0.5029740929603577	0.4936113953590393	0.5123135447502136	0.45383262634277344	0.4847692549228668	0.4981911778450012	0.5145108103752136
161	[]	False		[deleted]						dark					[removed]	fe993932d6dced4c0a879e9aa5d7a6e0fbb467f5	True	False					0	1657938841		0	{}	igch3kg	False	t3_w03id8	False	True	t3_w03id8	/r/Bitcoin/comments/w03id8/i_own_nothing_yet_im_a_hoarder_what_am_i/igch3kg/	1657938853	1	True	True	False	Bitcoin	t5_2s3qj	r/Bitcoin	public		0	[]			 removed 	0.46707504987716675	0.5148742198944092	0.5170193910598755	0.5029740929603577	0.4936113953590393	0.5123135447502136	0.45383262634277344	0.4847692549228668	0.4981911778450012	0.5145108103752136
162	[]	False		stroseph			[]				text	t2_1vonezy	False	False	I said 100 million satoshis 1 Bitcoin be	24772d55cdd5ba8e5a89d352907c4e217bd50f1a	True	False					0	1657938824		0	{}	igch2cg	False	t3_vzp89g	False	True	t3_vzp89g	/r/Bitcoin/comments/vzp89g/you_said_bitcoin_was_stable/igch2cg/	1657938837	1	True	True	False	Bitcoin	t5_2s3qj	r/Bitcoin	public		0	[]			i said 100 million satoshis 1 bitcoin be	0.43219369649887085	0.6023975610733032	0.4811931848526001	0.3471026122570038	0.4255756139755249	0.30628183484077454	0.43479123711586	0.48435431718826294	0.44141972064971924	0.04049014300107956
163	[]	False		TonySenese			[]				text	t2_elnz10yp	False	False	Damn man that's my fucking dream or something like that.	f8a6fa046fc66db956471347e12325dae142f6ea	True	False					0	1657938775		0	{}	igcgywn	False	t3_vz9zpn	False	True	t1_ig8ksu4	/r/Bitcoin/comments/vz9zpn/why_would_people_wear_bitcoin_merch_in_public/igcgywn/	1657938786	1	True	True	False	Bitcoin	t5_2s3qj	r/Bitcoin	public		0	[]			damn man that s my fucking dream or something like that 	0.13766799867153168	0.12221214175224304	0.8461828231811523	0.050514400005340576	0.5188367366790771	0.6353472471237183	0.15152767300605774	0.005390464793890715	0.43180572986602783	0.0065953549928963184
164	[]	False		surprise074			[]				text	t2_aafr7hgg	False	False	There are only 4 guarantees in this life. Birth, Aging, Sickness, and Death. And no....not taxes too. There are people that don't pay those. Faith in BTC doesn't guarantee an outcome of your liking. Rationalizing going all in is what addicts do, and that party never lasts. Put in enough to do well, but not enough to destroy your lifestyle if it doesn't work out.	45deff5864576f52597a7b130e6e5ddbad01b449	True	False					0	1657938752		0	{}	igcgx8y	False	t3_vzxrxe	False	True	t1_igbpt0t	/r/Bitcoin/comments/vzxrxe/going_all_in/igcgx8y/	1657938763	1	True	True	False	Bitcoin	t5_2s3qj	r/Bitcoin	public		0	[]			there are only 4 guarantees in this life birth aging sickness and death and no not taxes too there are people that don t pay those faith in btc doesn t guarantee an outcome of your liking rationalizing going all in is what addicts do and that party never lasts put in enough to do well but not enough to destroy your lifestyle if it doesn t work out 	0.0038458798080682755	0.9885010719299316	0.9033406376838684	0.024810945615172386	0.008959323167800903	0.5178505778312683	0.06381586939096451	8.415167940256651e-07	0.35909509658813477	0.028576146811246872
165	[]	False		acegarrettjuan			[]				text	t2_463epxxh	False	False	SCHY is the bigger one.	6e27c3d7908188c1d63cd7634176f24f65bcec74	True	False					0	1657938655		0	{}	igcgqe7	True	t3_vzv6dx	False	True	t1_igc7zki	/r/Bitcoin/comments/vzv6dx/posted_this_graph_of_my_portfolio_on_a_stock_site/igcgqe7/	1657938667	1	True	True	False	Bitcoin	t5_2s3qj	r/Bitcoin	public		0	[]		True	schy is the bigger one 	0.448165625333786	0.534997820854187	0.5002917647361755	0.465130090713501	0.4891168177127838	0.5267223715782166	0.38465890288352966	0.48153403401374817	0.4836989939212799	0.3699570298194885
