Unnamed: 0	all_awardings	archived	associated_award	author	author_flair_background_color	author_flair_css_class	author_flair_richtext	author_flair_template_id	author_flair_text	author_flair_text_color	author_flair_type	author_fullname	author_patreon_flair	author_premium	body	body_sha1	can_gild	collapsed	collapsed_because_crowd_control	collapsed_reason	collapsed_reason_code	comment_type	controversiality	created_utc	distinguished	gilded	gildings	id	is_submitter	link_id	locked	no_follow	parent_id	permalink	retrieved_utc	score	score_hidden	send_replies	stickied	subreddit	subreddit_id	subreddit_name_prefixed	subreddit_type	top_awarded_type	total_awards_received	treatment_tags	unrepliable_reason	author_cakeday	corpus	support	knowledge	conflict	power	similarity	fun	status	trust	identity	romance
280	[]	False		soggypoopsock			[]				text	t2_5n3t8q8y	False	False	This is the first I’m hearing of this and obviously you can tell this is the opening of some world, terrible sample to show people what the game is like. Still really silly that people are looking at this and assuming this is a majority of the experience. I’m assuming everyone spread out and started building or looting or whatever this game is about.	b7ff86719cba58225b4abbb372183ea1839d8ffd	True	False					0	1658004515		0	{}	igftcgh	False	t3_w0nb4j	False	True	t1_igfi1p9	/r/ethereum/comments/w0nb4j/first_gameplay_footage_of_yugas_metaverse/igftcgh/	1658004529	1	False	True	False	ethereum	t5_2zf9m	r/ethereum	public		0	[]			this is the first i m hearing of this and obviously you can tell this is the opening of some world terrible sample to show people what the game is like still really silly that people are looking at this and assuming this is a majority of the experience i m assuming everyone spread out and started building or looting or whatever this game is about 	0.002523493953049183	0.9881195425987244	0.8346245884895325	0.02441532537341118	0.9936098456382751	0.5863107442855835	0.057783547788858414	8.498762440467544e-07	0.2296038568019867	0.01474875770509243
281	[]	False		False798			[]				text	t2_fbfec	False	False	😞👍	67781122cc799e7ad72efcbb7c4df66f91ab908d	True	False					0	1658004423		0	{}	igft4y5	False	t3_w0nb4j	False	True	t1_igfowvs	/r/ethereum/comments/w0nb4j/first_gameplay_footage_of_yugas_metaverse/igft4y5/	1658004438	1	False	True	False	ethereum	t5_2zf9m	r/ethereum	public		0	[]			 	0.4871354103088379	0.5098868012428284	0.5124213099479675	0.5155720114707947	0.4910793602466583	0.4970635175704956	0.49484649300575256	0.48481839895248413	0.4902850091457367	0.5123646259307861
282	[]	False		soggypoopsock			[]				text	t2_5n3t8q8y	False	False	how is this not lagging to shit with 5000 players crammed into the same map	8660aaf0e6e1c63c1e4f59726970b1018ba889d8	True	False					0	1658004396		0	{}	igft2om	False	t3_w0nb4j	False	True	t3_w0nb4j	/r/ethereum/comments/w0nb4j/first_gameplay_footage_of_yugas_metaverse/igft2om/	1658004407	1	False	True	False	ethereum	t5_2zf9m	r/ethereum	public		0	[]			how is this not lagging to shit with 5000 players crammed into the same map	0.17399628460407257	0.5863858461380005	0.8376703262329102	0.12047356367111206	0.3395175635814667	0.5031203627586365	0.13255362212657928	1.733394128677901e-05	0.4760657548904419	0.006951289717108011
283	[]	False		FewMagazine938			[]				text	t2_bbflc379	False	False	Push push push	b96607d0cdc1a9306d7638556ae4a93b46aa9126	True	False					0	1658004071		0	{}	igfsc37	False	t3_w0p4yv	False	False	t3_w0p4yv	/r/ethereum/comments/w0p4yv/over_150_million_liquidated_as_eth_price/igfsc37/	1658004082	1	False	True	False	ethereum	t5_2zf9m	r/ethereum	public		0	[]			push push push	0.4522329270839691	0.5204533338546753	0.5624614357948303	0.5593171715736389	0.42204493284225464	0.4043940603733063	0.399408221244812	0.4656120836734772	0.4254395663738251	0.04385121166706085
284	[]	False		bigmike02			[]				text	t2_12if7a	False	False	https://ethereum.stackexchange.com/questions/10055/is-each-ethereum-address-shared-by-theoretically-2-96-private-keys	3965dc56fb08289fcc22d971babe474a7a1fa20e	True	False					0	1658003983		0	{}	igfs4t9	False	t3_w0lftx	False	True	t1_igfdpsz	/r/ethereum/comments/w0lftx/new_eth_wallet_has_eth_in_it_for_2_years_small/igfs4t9/	1658003999	1	False	True	False	ethereum	t5_2zf9m	r/ethereum	public		0	[]			https ethereum stackexchange com questions 10055 is each ethereum address shared by theoretically 2 96 private keys	0.1898675113916397	0.8410389423370361	0.28680363297462463	0.6034612059593201	0.10908517241477966	0.2544912099838257	0.3854847550392151	0.6801533699035645	0.47143346071243286	0.01300256047397852
285	[]	False		Martin1209			[]				text	t2_37vr36	False	False	Who is the merger between?	d71bc083e3f52a7e53e65417f726a15d2d0fbf2d	True	False					0	1658003800		0	{}	igfrprv	False	t3_w0mthy	False	True	t3_w0mthy	/r/ethereum/comments/w0mthy/ethereum_developers_give_estimated_date_for_the/igfrprv/	1658003812	1	False	True	False	ethereum	t5_2zf9m	r/ethereum	public		0	[]			who is the merger between 	0.419268399477005	0.568541944026947	0.42142000794410706	0.57000732421875	0.5158059597015381	0.3202293813228607	0.3598838150501251	0.5212817192077637	0.5335129499435425	0.4888298809528351
286	[]	False		Olmops			[]				text	t2_85wf41f	False	False	The Merge will change the block time that is now 13 seconds and change on average to fixed 12 seconds. That gives the chain 9 or 10 percent of extra throughput capacity.	9cdc53afacba823fe53008aae2d46d69d1bac755	True	False					0	1658003795		0	{}	igfrpc9	False	t3_w0nc6k	False	True	t3_w0nc6k	/r/ethereum/comments/w0nc6k/will_the_merge_also_increase_the_gas_limit/igfrpc9/	1658003810	1	False	True	False	ethereum	t5_2zf9m	r/ethereum	public		0	[]			the merge will change the block time that is now 13 seconds and change on average to fixed 12 seconds that gives the chain 9 or 10 percent of extra throughput capacity 	0.00740829249843955	0.9862444996833801	0.1920347809791565	0.9289171099662781	0.7338123321533203	0.21958060562610626	0.09199198335409164	8.466460599265702e-07	0.2900581955909729	0.011659367009997368
287	[]	False		MilesPower			[]				text	t2_imetr	False	False	So is this operating on some decentralised gaming platform or am I totally missing the point? I am so lost as to how the fuck crypto/nfts have anything to do with the cluster fuck visuals I'm seeing.	8241ea1580e9cb99b6493675baaab83c797d7bba	True	False					0	1658003689		0	{}	igfrgk6	False	t3_w0nb4j	False	True	t3_w0nb4j	/r/ethereum/comments/w0nb4j/first_gameplay_footage_of_yugas_metaverse/igfrgk6/	1658003702	1	False	True	False	ethereum	t5_2zf9m	r/ethereum	public		0	[]			so is this operating on some decentralised gaming platform or am i totally missing the point i am so lost as to how the fuck crypto nfts have anything to do with the cluster fuck visuals i m seeing 	0.003920210525393486	0.9768227338790894	0.9179781079292297	0.020224668085575104	0.7404404282569885	0.6439364552497864	0.09489515423774719	7.211658044070646e-07	0.34696149826049805	0.037024032324552536
288	[]	False		tgejesse			[]				text	t2_k8q9w	False	False	Exactly. It’s not possible.	04fbd2715161795cae5d2ad0eac7575562fddfde	True	False					0	1658003644		0	{}	igfrd02	False	t3_w0lftx	False	True	t1_igfdk5x	/r/ethereum/comments/w0lftx/new_eth_wallet_has_eth_in_it_for_2_years_small/igfrd02/	1658003656	1	False	True	False	ethereum	t5_2zf9m	r/ethereum	public		0	[]			exactly it s not possible 	0.5012633800506592	0.5249066948890686	0.38930150866508484	0.5373438000679016	0.515734076499939	0.6134073734283447	0.3681504726409912	0.4705459475517273	0.5371670126914978	0.13575389981269836
289	[]	False		BrainPicker3			[]				text	t2_os5rv	False	False	The type of thinking that led to robber barons in the 1800s and their the inevitable market crash during the Great Depression.	869c999214328238f4c88c42db9f3d9b7f1b7306	True	False					0	1658003461		0	{}	igfqy50	False	t3_w0g7oy	False	True	t1_igffcsn	/r/ethereum/comments/w0g7oy/us_treasury_invites_public_to_provide_input_on/igfqy50/	1658003473	1	False	True	False	ethereum	t5_2zf9m	r/ethereum	public		0	[]			the type of thinking that led to robber barons in the 1800s and their the inevitable market crash during the great depression 	0.03723965957760811	0.84531170129776	0.5033950805664062	0.2308986485004425	0.5437862873077393	0.5329054594039917	0.11840968579053879	8.659363857077551e-07	0.40302208065986633	0.011952952481806278
290	[]	False		[deleted]						dark					[removed]	fe993932d6dced4c0a879e9aa5d7a6e0fbb467f5	True	False					0	1658003410		0	{}	igfqu0p	False	t3_w0nb4j	False	True	t3_w0nb4j	/r/ethereum/comments/w0nb4j/first_gameplay_footage_of_yugas_metaverse/igfqu0p/	1658003422	1	False	True	False	ethereum	t5_2zf9m	r/ethereum	public		0	[]			 removed 	0.46707504987716675	0.5148742198944092	0.5170193910598755	0.5029740929603577	0.4936113953590393	0.5123135447502136	0.45383262634277344	0.4847692549228668	0.4981911778450012	0.5145108103752136
291	[]	False		Loupak_			[]				text	t2_lpys7	False	False	But with NFTEEEES BRO	c498a1a954c418dd7e2237ab4284e8b61ec66691	True	False					0	1658003336		0	{}	igfqo6e	False	t3_w0nb4j	False	True	t1_igfmu4c	/r/ethereum/comments/w0nb4j/first_gameplay_footage_of_yugas_metaverse/igfqo6e/	1658003347	1	False	True	False	ethereum	t5_2zf9m	r/ethereum	public		0	[]			but with nfteeees bro	0.4750024676322937	0.4504604637622833	0.43491366505622864	0.4192230999469757	0.47914451360702515	0.5100831985473633	0.5348235964775085	0.5073071122169495	0.4740704894065857	0.4057610332965851
292	[]	False		dododuk			[]				text	t2_5g0nsecj	False	False	Pure chaos. Take my money!	1f3eb4776d1b2a95eec2658d9bd7de57e7f9fe76	True	False					0	1658003119		0	{}	igfq6lt	False	t3_w0nb4j	False	True	t1_igfdjmv	/r/ethereum/comments/w0nb4j/first_gameplay_footage_of_yugas_metaverse/igfq6lt/	1658003135	1	False	True	False	ethereum	t5_2zf9m	r/ethereum	public		0	[]			pure chaos take my money 	0.4380384385585785	0.44011732935905457	0.5060224533081055	0.4595852792263031	0.46175017952919006	0.5455827713012695	0.456786185503006	0.4864311218261719	0.386031836271286	0.2575714588165283
293	[]	False		[deleted]						dark					[removed]	fe993932d6dced4c0a879e9aa5d7a6e0fbb467f5	True	False					0	1658003118		0	{}	igfq6hk	False	t3_w0nb4j	False	True	t3_w0nb4j	/r/ethereum/comments/w0nb4j/first_gameplay_footage_of_yugas_metaverse/igfq6hk/	1658003129	1	False	True	False	ethereum	t5_2zf9m	r/ethereum	public		0	[]			 removed 	0.46707504987716675	0.5148742198944092	0.5170193910598755	0.5029740929603577	0.4936113953590393	0.5123135447502136	0.45383262634277344	0.4847692549228668	0.4981911778450012	0.5145108103752136
294	[]	False		[deleted]						dark					[removed]	fe993932d6dced4c0a879e9aa5d7a6e0fbb467f5	True	False					0	1658003095		0	{}	igfq4ij	False	t3_w0lftx	False	True	t3_w0lftx	/r/ethereum/comments/w0lftx/new_eth_wallet_has_eth_in_it_for_2_years_small/igfq4ij/	1658003106	1	False	True	False	ethereum	t5_2zf9m	r/ethereum	public		0	[]			 removed 	0.46707504987716675	0.5148742198944092	0.5170193910598755	0.5029740929603577	0.4936113953590393	0.5123135447502136	0.45383262634277344	0.4847692549228668	0.4981911778450012	0.5145108103752136
295	[]	False		j1mmie			[]				text	t2_4chhd	False	False	That's pretty impressive to me. Lots of players moving around pretty smoothly. The graphics look fine, metaverse isn't about visuals (yet) we have a lot of other more important stuff to solve first	96b3872e5fcce59508b22d4ffd9d08f268abdd53	True	False					0	1658003031		0	{}	igfpzct	False	t3_w0nb4j	False	True	t3_w0nb4j	/r/ethereum/comments/w0nb4j/first_gameplay_footage_of_yugas_metaverse/igfpzct/	1658003045	1	False	True	False	ethereum	t5_2zf9m	r/ethereum	public		0	[]			that s pretty impressive to me lots of players moving around pretty smoothly the graphics look fine metaverse isn t about visuals yet we have a lot of other more important stuff to solve first	0.09437206387519836	0.912392795085907	0.1282094120979309	0.011081431061029434	0.9914345741271973	0.9956396818161011	0.12309463322162628	8.552146937290672e-07	0.3735194504261017	0.007144737057387829
296	[]	False		swn999			[]				text	t2_8sc3ve0	False	False	Ledger Nano S plus, under 100$.	3653ebd2d750eff0f3f39e48416249dc9f49bb91	True	False					0	1658002782		0	{}	igfpekz	False	t3_w0ov2j	False	True	t3_w0ov2j	/r/ethereum/comments/w0ov2j/how_secure_how_wallets_are/igfpekz/	1658002796	1	False	True	False	ethereum	t5_2zf9m	r/ethereum	public		0	[]			ledger nano s plus under 100 	0.26216912269592285	0.7211535573005676	0.2242760807275772	0.4733266830444336	0.5008625388145447	0.2303951531648636	0.3520490825176239	0.4385261535644531	0.47998926043510437	0.0024047591723501682
297	[]	False		DI0nysOO2			[]				text	t2_hddinwo5	False	False	Vr chat without big breasted anime girls	f128913192421ecc09cccbc4ffa81b2e9d2d6fd3	True	False					0	1658002567		0	{}	igfowvs	False	t3_w0nb4j	False	True	t3_w0nb4j	/r/ethereum/comments/w0nb4j/first_gameplay_footage_of_yugas_metaverse/igfowvs/	1658002577	1	False	True	False	ethereum	t5_2zf9m	r/ethereum	public		0	[]			vr chat without big breasted anime girls	0.27426981925964355	0.36146867275238037	0.4082947373390198	0.1991754025220871	0.44329819083213806	0.7290157079696655	0.3889675438404083	0.5355031490325928	0.47337621450424194	0.8070470094680786
298	[]	False		BlankEris			[]				text	t2_j0a5jyh	False	False	I told them they should enforce existing securities laws against the ethereum foundation.	4d54e51d4fbc34a0692c07979849b9092bb72079	True	False					0	1658002344		0	{}	igfoesv	False	t3_w0g7oy	False	True	t3_w0g7oy	/r/ethereum/comments/w0g7oy/us_treasury_invites_public_to_provide_input_on/igfoesv/	1658002356	1	False	True	False	ethereum	t5_2zf9m	r/ethereum	public		0	[]			i told them they should enforce existing securities laws against the ethereum foundation 	0.14492526650428772	0.689664363861084	0.6003930568695068	0.8201643228530884	0.3738265633583069	0.16092516481876373	0.2620276212692261	0.6699637770652771	0.5254015326499939	0.0008666718495078385
299	[]	False		JPcyborg23			[]				text	t2_9y5ug	False	False	r/theydidthemath	4a8c74256fd3757beeb3d7a085db3ffc923577db	True	False					0	1658002322		0	{}	igfocwn	False	t3_w0lftx	False	True	t1_igfgqiv	/r/ethereum/comments/w0lftx/new_eth_wallet_has_eth_in_it_for_2_years_small/igfocwn/	1658002334	1	False	True	False	ethereum	t5_2zf9m	r/ethereum	public		0	[]			r theydidthemath	0.4418601989746094	0.5249523520469666	0.5244749784469604	0.4676855802536011	0.46811559796333313	0.29452842473983765	0.5062530636787415	0.4404374957084656	0.4804748296737671	0.3903222680091858
300	[]	False		DKIPurple			[]				text	t2_1nihso3r	False	False	OP do you have a link to the original stream? Cause the quality is 💩	fa277e88d2b69f58817fe87e38d1d90cbb7ed57a	True	False					0	1658002234		0	{}	igfo5q1	False	t3_w0nb4j	False	True	t3_w0nb4j	/r/ethereum/comments/w0nb4j/first_gameplay_footage_of_yugas_metaverse/igfo5q1/	1658002250	1	False	True	False	ethereum	t5_2zf9m	r/ethereum	public		0	[]			op do you have a link to the original stream cause the quality is 	0.3668443560600281	0.6917052865028381	0.28778982162475586	0.53205806016922	0.34467563033103943	0.3327481746673584	0.1913200169801712	1.1727152923413087e-05	0.4435863494873047	0.048988472670316696
301	[]	False		iwakan			[]				text	t2_17hauh	False	False	You are welcome to suggest changes to the website to add the information you want and then send a pull request. It's open source after all.	6b6aa01e48af420d60f37d62543ea75a7c152517	True	False					0	1658002204		0	{}	igfo38t	False	t3_vwbamb	False	True	t1_ig3vc9e	/r/ethereum/comments/vwbamb/frequently_asked_questions_weekly_discussion/igfo38t/	1658002216	1	False	True	False	ethereum	t5_2zf9m	r/ethereum	public		0	[]			you are welcome to suggest changes to the website to add the information you want and then send a pull request it s open source after all 	0.650387704372406	0.9451960325241089	0.01895597018301487	0.8775482773780823	0.011441663838922977	0.4717927873134613	0.10346394032239914	8.616346462986257e-07	0.2538466453552246	0.07990511506795883
302	[]	False		Sct1787			[]				text	t2_btl26	False	False	I appreciate people like who do the thorough work. Respect.	78aa304e95b48d6bcb75fbe9ec2954a620767ebf	True	False					0	1658002061		0	{}	igfnrjh	False	t3_w0lftx	False	False	t1_igfgqiv	/r/ethereum/comments/w0lftx/new_eth_wallet_has_eth_in_it_for_2_years_small/igfnrjh/	1658002076	1	False	True	False	ethereum	t5_2zf9m	r/ethereum	public		0	[]			i appreciate people like who do the thorough work respect 	0.6862647533416748	0.24572230875492096	0.12613411247730255	0.2209208756685257	0.5151629447937012	0.27331432700157166	0.8422341346740723	0.6846663951873779	0.41105708479881287	0.011072097346186638
303	[]	False		PplOfRedditArePansys			[]				text	t2_l3kejvxx	False	False	Would of helped if you uploaded the video in visible quality lmao	0a34cb717203ad69f3ce80f4168eeb09560c769c	True	False					0	1658001901		0	{}	igfne44	False	t3_w0nb4j	False	False	t3_w0nb4j	/r/ethereum/comments/w0nb4j/first_gameplay_footage_of_yugas_metaverse/igfne44/	1658001916	1	False	True	False	ethereum	t5_2zf9m	r/ethereum	public		0	[]			would of helped if you uploaded the video in visible quality lmao	0.3745415508747101	0.6662508249282837	0.4427066743373871	0.4694101810455322	0.3788182735443115	0.4665861129760742	0.2535537779331207	0.1910640448331833	0.42932695150375366	0.10588937252759933
304	[]	False		AlexisAM_			[]				text	t2_g3w6oftu	False	False	Nice! a genshing impact copycat without mechanics or graphics...	6c71ca73fa5dc2dfaea780e3eb66f483c32b174f	True	False					0	1658001806		0	{}	igfn65f	False	t3_w0nb4j	False	True	t3_w0nb4j	/r/ethereum/comments/w0nb4j/first_gameplay_footage_of_yugas_metaverse/igfn65f/	1658001819	1	False	True	False	ethereum	t5_2zf9m	r/ethereum	public		0	[]			nice a genshing impact copycat without mechanics or graphics 	0.45693907141685486	0.5470737218856812	0.5143967866897583	0.1701296716928482	0.48216232657432556	0.4447379410266876	0.2908439636230469	0.5487285852432251	0.47914785146713257	0.014230884611606598
305	[]	False		Taschentuch9			[]				text	t2_9lpc3	False	False	So, basically second life?	3189293f736f0ad8dac037616893f46610f25568	True	False					0	1658001659		0	{}	igfmu4c	False	t3_w0nb4j	False	True	t1_igfllrf	/r/ethereum/comments/w0nb4j/first_gameplay_footage_of_yugas_metaverse/igfmu4c/	1658001672	1	False	True	False	ethereum	t5_2zf9m	r/ethereum	public		0	[]			so basically second life 	0.46807828545570374	0.47869133949279785	0.42576318979263306	0.4768828749656677	0.5088078379631042	0.5793594717979431	0.4600334167480469	0.5382131934165955	0.5021172165870667	0.5392796993255615
306	[]	False		hanniabu			[]				text	t2_fzasvrv	False	True	I'll believe it when I see it. There were many times statements like this are made by projects in an effort to gain acceptance and then never commit.	1ed06c6df29fc88fd29be37df392815caa2d49b5	True	False					0	1657986230		0	{}	igemoyu	False	t3_vzlbb5	False	True	t1_igdfg1n	/r/ethereum/comments/vzlbb5/im_incredibly_excited_about_polygon_being_a_part/igemoyu/	1657986244	1	False	True	False	ethereum	t5_2zf9m	r/ethereum	public		0	[]			i ll believe it when i see it there were many times statements like this are made by projects in an effort to gain acceptance and then never commit 	0.04892384260892868	0.8639096021652222	0.2862379550933838	0.022271644324064255	0.8326511383056641	0.33400559425354004	0.1261436492204666	8.555597901249712e-07	0.40429791808128357	0.009865024127066135
307	[]	False		TaxExempt			[]				text	t2_32dub	False	False	If the bait is real, someone can steal it with MEV.	30e1f455c72fbf1a729a9f84ccc0b30d3af943b9	True	False					0	1657985886		0	{}	igelw9s	False	t3_w0dmad	False	True	t1_igdo0ot	/r/ethereum/comments/w0dmad/what_is_this_scam/igelw9s/	1657985897	1	False	True	False	ethereum	t5_2zf9m	r/ethereum	public		0	[]			if the bait is real someone can steal it with mev 	0.11202248930931091	0.7308618426322937	0.6277217864990234	0.334421843290329	0.3798295259475708	0.20516027510166168	0.1377319097518921	0.00038073473842814565	0.3935739994049072	0.0006545986980199814
308	[]	False		Olmops			[]				text	t2_85wf41f	False	False	I would not already take the day off as this is just a rough plan and no official announcement yet. Maybe it shifts a week or two, but we are definitely getting close!	d0f70124ebe001e134cb46516660d801d73cbd81	True	False					0	1657985498		0	{}	igekzqy	False	t3_w0g74a	False	False	t3_w0g74a	/r/ethereum/comments/w0g74a/add_to_your_calendar_ethereum_eth_event_mainnet/igekzqy/	1657985511	1	False	True	False	ethereum	t5_2zf9m	r/ethereum	public		0	[]			i would not already take the day off as this is just a rough plan and no official announcement yet maybe it shifts a week or two but we are definitely getting close 	0.16293202340602875	0.9173442721366882	0.4462857246398926	0.020901022478938103	0.11202304065227509	0.6228677034378052	0.07515083253383636	8.531049502380483e-07	0.28648045659065247	0.03444720432162285
309	[]	False		EnvironmentalRip636			[]				text	t2_7p7eqc4k	False	False	!	0ab8318acaf6e678dd02e2b5c343ed41111b393d	True	False					0	1657985376		0	{}	igekpov	False	t3_w0dmad	False	True	t1_ige1izm	/r/ethereum/comments/w0dmad/what_is_this_scam/igekpov/	1657985387	1	False	True	False	ethereum	t5_2zf9m	r/ethereum	public		0	[]			 	0.4871354103088379	0.5098868012428284	0.5124213099479675	0.5155720114707947	0.4910793602466583	0.4970635175704956	0.49484649300575256	0.48481839895248413	0.4902850091457367	0.5123646259307861
310	[]	False		brasilmiggy			[]				text	t2_8n1h1z6s	False	False	I know Python before getting into this so I’d say Python, but if your blank slate you might need to also do some learning on Python or JavaScript…	3ebd9d0138fa5526c665a2fb04a1433ce77d5d5d	True	False					0	1657984838		0	{}	igejgy0	False	t3_w050yi	False	True	t1_igej10u	/r/ethereum/comments/w050yi/im_trying_to_learn_how_to_deploy_a_smart_contract/igejgy0/	1657984849	1	False	True	False	ethereum	t5_2zf9m	r/ethereum	public		0	[]			i know python before getting into this so i d say python but if your blank slate you might need to also do some learning on python or javascript 	0.011371423490345478	0.8665334582328796	0.07748658210039139	0.015703435987234116	0.05030570179224014	0.3825831413269043	0.07338196784257889	8.638486974632542e-07	0.2778242230415344	0.029297616332769394
311	[]	False		allthew4yup			[]				text	t2_a4ga93b7	False	False	"Is Javascript and hardhat more eaiser to learn then phyton? 


Like ive heard that you need to understand java before working with solidity"	2ffc6aafcd1d3e140fd7a59b095f64d8b5e5d547	True	False					0	1657984646		0	{}	igej10u	True	t3_w050yi	False	True	t1_igd0pqy	/r/ethereum/comments/w050yi/im_trying_to_learn_how_to_deploy_a_smart_contract/igej10u/	1657984659	1	False	True	False	ethereum	t5_2zf9m	r/ethereum	public		0	[]			is javascript and hardhat more eaiser to learn then phyton like ive heard that you need to understand java before working with solidity	0.32528018951416016	0.8484627604484558	0.039623577147722244	0.08031070232391357	0.026135457679629326	0.3674768805503845	0.12127576768398285	0.002322760410606861	0.3274894654750824	0.03067479096353054
312	[]	False		lylesback2			[]				text	t2_9qzvq	False	False	Look at the wallet address on etherscan, you'll likely see people depositing eth and it immediately gets withdrawn to another account	442a8679accbbbb12f4c117686b8aa906017e8b7	True	False					0	1657984261		0	{}	igei5xt	False	t3_w0dmad	False	False	t3_w0dmad	/r/ethereum/comments/w0dmad/what_is_this_scam/igei5xt/	1657984273	1	False	True	False	ethereum	t5_2zf9m	r/ethereum	public		0	[]			look at the wallet address on etherscan you ll likely see people depositing eth and it immediately gets withdrawn to another account	0.1136067733168602	0.8404509425163269	0.5621805787086487	0.7269944548606873	0.2435850203037262	0.46547675132751465	0.11685992032289505	8.787109777586011e-07	0.35217779874801636	0.009045988321304321
313	[]	False		civilian_discourse			[]				text	t2_4cdgo7h9	False	False	Irrelevant to the conversation	cf0cd5d744f7af51de4dd4745c803b043c5dbc91	True	False					0	1657984233		0	{}	igei3mm	False	t3_vw8o6y	False	True	t1_ige8ecd	/r/ethereum/comments/vw8o6y/after_the_merge_will_miners_have_an_incentive/igei3mm/	1657984249	1	False	True	False	ethereum	t5_2zf9m	r/ethereum	public		0	[]			irrelevant to the conversation	0.3635782301425934	0.4817810654640198	0.697664737701416	0.43223506212234497	0.44695547223091125	0.4650345742702484	0.42604267597198486	0.41683074831962585	0.4532500207424164	0.20180349051952362
314	[]	False		Olmops			[]				text	t2_85wf41f	False	False	Oops. Edited. Thank you!.	130385fb172ce40d2f4ad7bfbaa09bf3c1db2b5e	True	False					0	1657984073		0	{}	igehqup	False	t3_w0d2cv	False	True	t1_ige5a2y	/r/ethereum/comments/w0d2cv/deeper_questions_about_ethereum_consensus_and/igehqup/	1657984084	1	False	True	False	ethereum	t5_2zf9m	r/ethereum	public		0	[]			oops edited thank you 	0.5944586396217346	0.2277768850326538	0.3973780572414398	0.35074496269226074	0.4324692487716675	0.6388715505599976	0.7106959223747253	0.43348947167396545	0.4025154113769531	0.16372418403625488
315	[]	False		raresanevoice			[]				text	t2_11c3tw	False	False	Brilliant use case	b29407572fbadf7a41735ae92b144b3f18bd6399	True	False					0	1657983446		0	{}	igegbuc	False	t3_w0ibso	False	True	t3_w0ibso	/r/ethereum/comments/w0ibso/lillianfinance_medical_finance_blockchain/igegbuc/	1657983462	1	False	True	False	ethereum	t5_2zf9m	r/ethereum	public		0	[]			brilliant use case	0.47556477785110474	0.5118941068649292	0.36013028025627136	0.4757058322429657	0.47957971692085266	0.5386635065078735	0.5063807964324951	0.49971312284469604	0.48138922452926636	0.3292907476425171
