Unnamed: 0	all_awardings	archived	associated_award	author	author_flair_background_color	author_flair_css_class	author_flair_richtext	author_flair_template_id	author_flair_text	author_flair_text_color	author_flair_type	author_fullname	author_patreon_flair	author_premium	body	body_sha1	can_gild	collapsed	collapsed_because_crowd_control	collapsed_reason	collapsed_reason_code	comment_type	controversiality	created_utc	distinguished	gilded	gildings	id	is_submitter	link_id	locked	no_follow	parent_id	permalink	retrieved_utc	score	score_hidden	send_replies	stickied	subreddit	subreddit_id	subreddit_name_prefixed	subreddit_type	top_awarded_type	total_awards_received	treatment_tags	unrepliable_reason	corpus	support	knowledge	conflict	power	similarity	fun	status	trust	identity	romance
0	[]	False		AWilfred11			[]				text	t2_4wlze05j	False	False	Telling someone to shut up instead of a reasonable response…how ironic	fa08583986324a66f0cc32600a0a2bfc0a62e76f	True	False					0	1658304011		0	{}	igw32yg	False	t3_w3evna	False	True	t1_igw0msk	/r/Bitcoin/comments/w3evna/china_ccp_tanks_protecting_banks_because_the_bank/igw32yg/	1658304021	1	True	True	False	Bitcoin	t5_2s3qj	r/Bitcoin	public		0	[]		telling someone to shut up instead of a reasonable response how ironic	0.4333396553993225	0.4365083575248718	0.8475349545478821	0.6158233880996704	0.2904442250728607	0.32136523723602295	0.1919054538011551	0.0006743977428413928	0.3093652129173279	0.004805078264325857
1	[]	False		RoscoRoscoMan			[]				text	t2_177dt9	False	False	"Muun for small amounts for everyday use on your phone. Electrum for longer storage of small/medium amounts if you don't want to buy a hardware wallet. Coldcard for best security for medium/large amounts for long storage.

I'd by Coldcard right away for cold storage and use Muun for hot wallet. Goodluck and do your own research on everyone's suggestions. Don't trust anyone."	da28e2a1cd64b142a48cf3f943a72afa72bc8ec3	True	False					0	1658303935		0	{}	igw2zhs	False	t3_w2ncr9	False	True	t3_w2ncr9	/r/Bitcoin/comments/w2ncr9/whats_the_best_at_crypto_wallet_for_a_beginner/igw2zhs/	1658303947	1	True	True	False	Bitcoin	t5_2s3qj	r/Bitcoin	public		0	[]		muun for small amounts for everyday use on your phone electrum for longer storage of small medium amounts if you don t want to buy a hardware wallet coldcard for best security for medium large amounts for long storage i d by coldcard right away for cold storage and use muun for hot wallet goodluck and do your own research on everyone s suggestions don t trust anyone 	0.003096005180850625	0.9881987571716309	0.009333932772278786	0.05878402292728424	0.008648485876619816	0.5277613997459412	0.15268734097480774	8.229227432821062e-07	0.24689345061779022	0.021924318745732307
2	[]	False		P21nl75glRQP873B			[]				text	t2_dj7sm8wu	False	False	I hope they came up with some strong solution to stop that.	99d2e2e51c088d2dffde277e927ee4d8924096a6	True	False					0	1658303908		0	{}	igw2yc7	False	t3_w2uvyy	False	True	t1_igssr0e	/r/Bitcoin/comments/w2uvyy/nobody_is_worried_about_inflation_it_will_only/igw2yc7/	1658303919	1	True	True	False	Bitcoin	t5_2s3qj	r/Bitcoin	public		0	[]		i hope they came up with some strong solution to stop that 	0.6962440609931946	0.41550445556640625	0.16267701983451843	0.27538493275642395	0.5879033803939819	0.4558907747268677	0.42586296796798706	0.7184325456619263	0.32743698358535767	0.005077569745481014
3	[]	False		dwhsmart			[]				text	t2_jks93atc	False	False	The way we are going it will be hard for us to get the Food.	c5e0c2fe5a5e2ddf7aeae44e8873ce53bb5fe1ff	True	False					0	1658303873		0	{}	igw2wrc	False	t3_w2uvyy	False	False	t1_igt8rbd	/r/Bitcoin/comments/w2uvyy/nobody_is_worried_about_inflation_it_will_only/igw2wrc/	1658303886	1	True	True	False	Bitcoin	t5_2s3qj	r/Bitcoin	public		0	[]		the way we are going it will be hard for us to get the food 	0.6716266870498657	0.48830896615982056	0.31591492891311646	0.5166073441505432	0.4575807452201843	0.5027459859848022	0.1624881774187088	0.4740481376647949	0.2860587537288666	0.00696962745860219
4	[]	False		No1degenerategambler			[]				text	t2_4yqqdcvk	False	False	Bitcoin Fixes this	6459df472a6db9da40acff9ff23839d8ec6a699d	True	False					0	1658303868		0	{}	igw2wk6	False	t3_w3evna	False	True	t3_w3evna	/r/Bitcoin/comments/w3evna/china_ccp_tanks_protecting_banks_because_the_bank/igw2wk6/	1658303879	1	True	True	False	Bitcoin	t5_2s3qj	r/Bitcoin	public		0	[]		bitcoin fixes this	0.508836030960083	0.5399201512336731	0.48267441987991333	0.4642913341522217	0.45084577798843384	0.5336512923240662	0.48648563027381897	0.5285285711288452	0.447749525308609	0.3099414110183716
5	[]	False		Ringlikewindsor			[]				text	t2_fr85s1oq	False	False	I don't think that anyone knows anything for the surety here.	bc8e87b401d6e9d84cd8fb8af9f1bf5d99666331	True	False					0	1658303809		0	{}	igw2txt	False	t3_w2sf05	False	True	t1_igu9jqd	/r/Bitcoin/comments/w2sf05/this_is_the_first_bitcoin_cycle_i_havent_heard_a/igw2txt/	1658303821	1	True	True	False	Bitcoin	t5_2s3qj	r/Bitcoin	public		0	[]		i don t think that anyone knows anything for the surety here 	0.3202762305736542	0.3960287570953369	0.35378459095954895	0.11373762786388397	0.3629966080188751	0.4974205195903778	0.33223122358322144	0.03096216358244419	0.3834456503391266	0.021414656192064285
6	[]	False		formal-explorer-2718			[]			dark	text	t2_cggmkb5f	False	False	"&gt; Which, if bitcoin were to become a monetary standard

What do you mean by a ""monetary standard""? Are you envisioning goods and services would be priced in Bitcoin? What about contracts like debts, salaries, rents, subscriptions, lines of credit, refunds, insurance, taxes, leverage, annuities, etc.?

&gt; ... is impossible

It is absolutely possible. Just because something is being used as a monetary standard, doesn't mean its ""value"" is proportional to its supply.

If a substantial amount of debts were denominated in Bitcoin, it would probably make Bitcoin *more* volatile, not less. Debts mean there is a constant demand of people who need to make fixed Bitcoin payments; if there isn't enough Bitcoin supply to satisfy this demand Bitcoin ""moons"" and the debtors go bankrupt (this includes companies paying negotiated salaries, people paying mortgages, people still paying off taxes from last year, companies who have already agreed to buy something at a fixed price, etc.).

This was historically a big problem with Gold as a unit of account, and there were quite a few financial panics, mass bankruptcies, and deflations that essentially amounted to a vicious cycle of Gold mooning and Gold debtors going bankrupt.

Of course, people can and do use Bitcoin today to pay for purchases and settle debts denominated using other units of account (c.f. Bitpay and El Salvador's experiment). People can also already use credit cards to buy goods and services and then pay of the credit card using Bitcoin at the end of the month, which is almost the same thing (well, if they didn't want *any* Fiat exposure, even negative Fiat exposure, they'd have to sell some Bitcoin every time they made a credit card purchase).

If could become more popular for this purpose, but this won't necessarily give it a more predictable or stable value (unless its future popularity is predictable and also its investment demand also predictable). Assets with high expected return also tend to have high volatility. If you want something which minimizes your risk of substantial short term loss (for any reason), it probably won't have good long term returns (savings accounts are a good example of this)."	db0ae5f4ccf6ff56336a76b2803c4bceb23801f1	True	False					0	1658303763		0	{}	igw2rw6	False	t3_w2uvyy	False	False	t1_igvdki8	/r/Bitcoin/comments/w2uvyy/nobody_is_worried_about_inflation_it_will_only/igw2rw6/	1658303777	1	True	True	False	Bitcoin	t5_2s3qj	r/Bitcoin	public		0	[]		 gt which if bitcoin were to become a monetary standard what do you mean by a monetary standard are you envisioning goods and services would be priced in bitcoin what about contracts like debts salaries rents subscriptions lines of credit refunds insurance taxes leverage annuities etc gt is impossible it is absolutely possible just because something is being used as a monetary standard doesn t mean its value is proportional to its supply if a substantial amount of debts were denominated in bitcoin it would probably make bitcoin more volatile not less debts mean there is a constant demand of people who need to make fixed bitcoin payments if there isn t enough bitcoin supply to satisfy this demand bitcoin moons and the debtors go bankrupt this includes companies paying negotiated salaries people paying mortgages people still paying off taxes from last year companies who have already agreed to buy something at a fixed price etc this was historically a big problem with gold as a unit of account and there were quite a few financial panics mass bankruptcies and deflations that essentially amounted to a vicious cycle of gold mooning and gold debtors going bankrupt of course people can and do use bitcoin today to pay for purchases and settle debts denominated using other units of account c f bitpay and el salvador s experiment people can also already use credit cards to buy goods and services and then pay of the credit card using bitcoin at the end of the month which is almost the same thing well if they didn t want any fiat exposure even negative fiat exposure they d have to sell some bitcoin every time they made a credit card purchase if could become more popular for this purpose but this won t necessarily give it a more predictable or stable value unless its future popularity is predictable and also its investment demand also predictable assets with high expected return also tend to have high volatility if you want something which minimizes your risk of substantial short term loss for any reason it probably won t have good long term returns savings accounts are a good example of this 	0.002396942814812064	0.9894188642501831	0.09498429298400879	0.012349504977464676	0.007496128790080547	0.3431176245212555	0.08878345787525177	8.430349112131807e-07	0.366397500038147	0.001930359983816743
7	[]	False		user_name_checks_out			[]				text	t2_lapk6	False	False	"&gt; I'm laying in bed

*lying"	795412f575e0d0839127c155709b79c9b52fbce3	True	False					0	1658303733		0	{}	igw2qir	False	t3_w3dt7e	False	True	t1_igvv6b8	/r/Bitcoin/comments/w3dt7e/daily_discussion_july_20_2022/igw2qir/	1658303745	1	True	True	False	Bitcoin	t5_2s3qj	r/Bitcoin	public		0	[]		 gt i m laying in bed lying	0.3410206437110901	0.44087740778923035	0.46836039423942566	0.39544063806533813	0.4996153712272644	0.5442975759506226	0.33687326312065125	0.7678848505020142	0.41046252846717834	0.5729507803916931
8	[]	False		cryptocartelio			[]				text	t2_43mq4ci1	False	False	Oh yes. I knew that, bought some btc at 18,7k and 19.8k, thanks to free forwarded post at www.cryptocartel.co so i joined them, and they have gathered top analysts on crypto at one place, easy to compare and use this tool for buying or selling	1961224746a7db866527795ede0696ab2ea15322	True	False					0	1658303728		0	{}	igw2q9n	False	t3_w2uvyy	False	True	t3_w2uvyy	/r/Bitcoin/comments/w2uvyy/nobody_is_worried_about_inflation_it_will_only/igw2q9n/	1658303738	1	True	True	False	Bitcoin	t5_2s3qj	r/Bitcoin	public		0	[]		oh yes i knew that bought some btc at 18 7k and 19 8k thanks to free forwarded post at www cryptocartel co so i joined them and they have gathered top analysts on crypto at one place easy to compare and use this tool for buying or selling	0.006408486049622297	0.9851341247558594	0.04761170595884323	0.06127852201461792	0.015942184254527092	0.355501264333725	0.08894866704940796	8.468527994409669e-07	0.28223559260368347	0.00904634315520525
9	[]	False		mroriginal7			[]				text	t2_79id3gm1	False	False	"Hacked your wallet/cracked you seed phrase? The whole security of btc relies on that being (basically) an impossibility.
If they found your seed written down then it would have to be someone close to you, unless you were robbed, at which case did you report it and obtain a crime number? What else got stolen? Did you claim on insurance? Probably not in all cases...

If someone hacked your cex account did you report that to your cex? There are a host of legal consequences here."	63e090b0e17f17e8407cc7eb6a168facad625ffa	True	False					0	1658303689		0	{}	igw2oi2	False	t3_w2p3x5	False	True	t1_igu1mn5	/r/Bitcoin/comments/w2p3x5/what_are_things_that_could_actually_kill_bitcoin/igw2oi2/	1658303702	1	True	True	False	Bitcoin	t5_2s3qj	r/Bitcoin	public		0	[]		hacked your wallet cracked you seed phrase the whole security of btc relies on that being basically an impossibility if they found your seed written down then it would have to be someone close to you unless you were robbed at which case did you report it and obtain a crime number what else got stolen did you claim on insurance probably not in all cases if someone hacked your cex account did you report that to your cex there are a host of legal consequences here 	0.002571326680481434	0.9886497259140015	0.949357271194458	0.06834608316421509	0.007477122358977795	0.1972952038049698	0.07712558656930923	8.359169214600115e-07	0.2570662200450897	0.018571365624666214
10	[]	False		Deancrypt			[]				text	t2_qs0vivx	False	False	"You dont recognise Dorian Prentice satoshi nakamoto when you see him!? 

Shame on you ."	655cc95b74201901c462a4eb5183bd49cf2477b6	True	False					0	1658303602		0	{}	igw2kn2	False	t3_w3avtm	False	True	t1_igvo9g0	/r/Bitcoin/comments/w3avtm/the_decentralised_digital_currency_ceo_spoke/igw2kn2/	1658303615	1	True	True	False	Bitcoin	t5_2s3qj	r/Bitcoin	public		0	[]		you dont recognise dorian prentice satoshi nakamoto when you see him shame on you 	0.4260256290435791	0.32489025592803955	0.8000855445861816	0.19446446001529694	0.05080057680606842	0.5192468166351318	0.34529101848602295	0.08988840878009796	0.3344540596008301	0.14315733313560486
11	[]	False		morett23			[]				text	t2_h9kzzslj	False	False	Absolutely right wanted and this is the first matter of time right now.	89aa143132824139a2c3b78cf0a0d504e5f47d1d	True	False					0	1658303600		0	{}	igw2kjz	False	t3_w2p3x5	False	True	t1_igrztii	/r/Bitcoin/comments/w2p3x5/what_are_things_that_could_actually_kill_bitcoin/igw2kjz/	1658303615	1	True	True	False	Bitcoin	t5_2s3qj	r/Bitcoin	public		0	[]		absolutely right wanted and this is the first matter of time right now 	0.36534231901168823	0.5514795184135437	0.42911165952682495	0.5845987796783447	0.36575600504875183	0.4712478816509247	0.34517037868499756	0.756503701210022	0.3827362656593323	0.07520443946123123
12	[]	False		-Mr_Unknown-			[]				text	t2_9cipss4	False	False	I won’t move until I hear from the President of Blockchain™️.	c83666c7a803eb1e17176661101ffc5a0b142fa8	True	False					0	1658303536		0	{}	igw2hq6	False	t3_w3avtm	False	True	t3_w3avtm	/r/Bitcoin/comments/w3avtm/the_decentralised_digital_currency_ceo_spoke/igw2hq6/	1658303547	1	True	True	False	Bitcoin	t5_2s3qj	r/Bitcoin	public		0	[]		i won t move until i hear from the president of blockchain 	0.21702247858047485	0.5401222705841064	0.3426920771598816	0.11908837407827377	0.3809719681739807	0.09520260989665985	0.34489676356315613	0.02219439670443535	0.3390685021877289	8.150890789693221e-05
13	[]	False		Perfect_Orgsm			[]				text	t2_ikp14	False	False	Yup, atleast 50x better	ebcfb4e1d14dc055983c3c32a713918e59f2d290	True	False					0	1658303496		0	{}	igw2fzz	False	t3_w2t9j2	False	False	t1_igu307u	/r/Bitcoin/comments/w2t9j2/a_brief_history_of_fiat_inflation/igw2fzz/	1658303507	1	True	True	False	Bitcoin	t5_2s3qj	r/Bitcoin	public		0	[]		yup atleast 50x better	0.45045870542526245	0.4601938724517822	0.4981347918510437	0.34877437353134155	0.44414931535720825	0.5633020401000977	0.4497378170490265	0.45924079418182373	0.4518536925315857	0.23359279334545135
14	[]	False		classicsxdx			[]				text	t2_7y1rutu4	False	False	You are absolutely right about that and this is a network should work.	d15428866e0117bc3d0488279daa686639424ad8	True	False					0	1658303481		0	{}	igw2fcl	False	t3_w2p3x5	False	True	t1_igs3q2d	/r/Bitcoin/comments/w2p3x5/what_are_things_that_could_actually_kill_bitcoin/igw2fcl/	1658303493	1	True	True	False	Bitcoin	t5_2s3qj	r/Bitcoin	public		0	[]		you are absolutely right about that and this is a network should work 	0.42054063081741333	0.6132388114929199	0.4351327419281006	0.6330761909484863	0.3711017370223999	0.27459752559661865	0.26865774393081665	0.6863202452659607	0.4649433195590973	0.004530343227088451
15	[]	False		coinfreekz			[]				text	t2_es2cr	False	False	Yup made more gains compounding leverage shorts in the bear market than longing in the bull market \^\_\_\^. So much fun to short when gravity and common sense is on your side. I hate longing and riding these idiot's hodler's delusion...	bb6a70a9d45c60795ad0ebee097942b3ac81e889	True	False					0	1658303460		0	{}	igw2egj	False	t3_w329ll	False	True	t1_igtr4rd	/r/Bitcoin/comments/w329ll/btc_holder/igw2egj/	1658303472	1	True	True	False	Bitcoin	t5_2s3qj	r/Bitcoin	public		0	[]		yup made more gains compounding leverage shorts in the bear market than longing in the bull market so much fun to short when gravity and common sense is on your side i hate longing and riding these idiot s hodler s delusion 	0.002271956531330943	0.988192617893219	0.7165404558181763	0.013871492817997932	0.011726262979209423	0.9949997663497925	0.11899720132350922	8.657744388074207e-07	0.3697512745857239	0.004499673843383789
16	[]	False		[deleted]						dark					[removed]	fe993932d6dced4c0a879e9aa5d7a6e0fbb467f5	True	False					0	1658303447		0	{}	igw2dxc	False	t3_w3evna	False	True	t1_igvz05a	/r/Bitcoin/comments/w3evna/china_ccp_tanks_protecting_banks_because_the_bank/igw2dxc/	1658303459	1	True	True	False	Bitcoin	t5_2s3qj	r/Bitcoin	public		0	[]		 removed 	0.46707504987716675	0.5148742198944092	0.5170193910598755	0.5029740929603577	0.4936113953590393	0.5123135447502136	0.45383262634277344	0.4847692549228668	0.4981911778450012	0.5145108103752136
17	[]	False		Ironmangopal			[]				text	t2_fihu63ws	False	False	Good bullish case for Bitcoin.. do you think so?	d0f3fba0764fef75fc5e0d9099952355c6082f80	True	False					0	1658303366		0	{}	igw2abn	False	t3_w3evna	False	True	t3_w3evna	/r/Bitcoin/comments/w3evna/china_ccp_tanks_protecting_banks_because_the_bank/igw2abn/	1658303377	1	True	True	False	Bitcoin	t5_2s3qj	r/Bitcoin	public		0	[]		good bullish case for bitcoin do you think so 	0.5978984832763672	0.36029043793678284	0.4919315576553345	0.4768476188182831	0.48368483781814575	0.5227270722389221	0.5322918891906738	0.8363656997680664	0.3868359923362732	0.01644052565097809
