45	[]	False	EverydayCryptoNet		[]		text	t2_dmdh01us	False	False	False	[]	False	False	1659269318	self.Bitcoin	https://www.reddit.com/r/Bitcoin/comments/wcn8pk/best_free_cryptocurrency_telegram_bots/	{}	wcn8pk	False	True	False	False	False	True	True	False		[]	dark	text	False	False	True	0	0	False	all_ads	/r/Bitcoin/comments/wcn8pk/best_free_cryptocurrency_telegram_bots/	False	6		1659269328	1	"[http://everydaycrypto.net/2022/01/08/best-free-cryptocurrency-bots-en-iyi-ucretsiz-kripto-botlari/](http://everydaycrypto.net/2022/01/08/best-free-cryptocurrency-bots-en-iyi-ucretsiz-kripto-botlari/)

I suggest **3, 4, 31, 36, 41**"	True	False	False	Bitcoin	t5_2s3qj	4443636	public	self	Best Free Cryptocurrency Telegram Bots	0	[]	1.0	https://www.reddit.com/r/Bitcoin/comments/wcn8pk/best_free_cryptocurrency_telegram_bots/	all_ads	6							dark													"Best Free Cryptocurrency Telegram Bots
[http://everydaycrypto.net/2022/01/08/best-free-cryptocurrency-bots-en-iyi-ucretsiz-kripto-botlari/](http://everydaycrypto.net/2022/01/08/best-free-cryptocurrency-bots-en-iyi-ucretsiz-kripto-botlari/)

I suggest **3, 4, 31, 36, 41**"	best free cryptocurrency telegram bots http everydaycrypto net 2022 01 08 best free cryptocurrency bots en iyi ucretsiz kripto botlari http everydaycrypto net 2022 01 08 best free cryptocurrency bots en iyi ucretsiz kripto botlari i suggest 3 4 31 36 41 	0.009350870735943317	0.9946548938751221	0.2220303863286972	0.06324224174022675	0.0034113277215510607	0.044525597244501114	0.3207698464393616	8.366953920813103e-07	0.4203207194805145	0.0008851830498315394
46	[]	False	Investon001		[]		text	t2_qeg57bpn	False	False	False	[]	False	False	1659269307	self.Bitcoin	https://www.reddit.com/r/Bitcoin/comments/wcn8l8/recover_all_your_lost_crypto_how/	{}	wcn8l8	False	False	False	False	False	False	True	False		[]	dark	text	False	False	True	0	0	False	all_ads	/r/Bitcoin/comments/wcn8l8/recover_all_your_lost_crypto_how/	False	6	reddit	1659269317	1	[removed]	True	False	False	Bitcoin	t5_2s3qj	4443634	public	self	Recover all your lost crypto! How?	0	[]	1.0	https://www.reddit.com/r/Bitcoin/comments/wcn8l8/recover_all_your_lost_crypto_how/	all_ads	6																				"Recover all your lost crypto! How?
[removed]"	recover all your lost crypto how removed 	0.514068603515625	0.5088551640510559	0.483397513628006	0.4127320945262909	0.4587995707988739	0.3854944407939911	0.3577072024345398	0.5669119358062744	0.44476205110549927	0.0821264460682869
47	[]	False	redlunaarmy		[]		text	t2_qdz9i08n	False	False	False	[]	False	False	1659311016	i.redd.it	https://www.reddit.com/r/Bitcoin/comments/wd2gfa/redluna_is_the_next_1000x_bsc_project_of_the_year/	{}	wd2gfa	False	False	False	False	True	False	False	False		[]	dark	text	False	False	True	0	0	False	all_ads	/r/Bitcoin/comments/wd2gfa/redluna_is_the_next_1000x_bsc_project_of_the_year/	False	6	reddit	1659311027	1		True	False	False	Bitcoin	t5_2s3qj	4445035	public	https://a.thumbs.redditmedia.com/oQBXStV2KZmDuTnhwiQpZVyth00OI29xWJwDq2bT0r0.jpg	Redluna is the next 1000x BSC project of the year ❤️❤️❤️ Redluna is listed on #coinmarketcap and #coingecko	0	[]	1.0	https://i.redd.it/5ulna6s1qze91.jpg	all_ads	6	image	{'enabled': True, 'images': [{'id': 'JD0Ba-f08UBCijmZY13qRmClyh8Tq_h7pC3IlegDo3Q', 'resolutions': [{'height': 60, 'url': 'https://preview.redd.it/5ulna6s1qze91.jpg?width=108&amp;crop=smart&amp;auto=webp&amp;s=2705267fc1237ddc1e08e7543f7a17bdf5f4317b', 'width': 108}, {'height': 120, 'url': 'https://preview.redd.it/5ulna6s1qze91.jpg?width=216&amp;crop=smart&amp;auto=webp&amp;s=bb0bb867e6e20f7a7d3a1a4c147e184ed877feef', 'width': 216}, {'height': 178, 'url': 'https://preview.redd.it/5ulna6s1qze91.jpg?width=320&amp;crop=smart&amp;auto=webp&amp;s=a598c57d9447c77a7c1b0a4eed6ae5466813c2b8', 'width': 320}, {'height': 357, 'url': 'https://preview.redd.it/5ulna6s1qze91.jpg?width=640&amp;crop=smart&amp;auto=webp&amp;s=63e5cdeddcf4ef75742eb5f02087c80469a65691', 'width': 640}, {'height': 536, 'url': 'https://preview.redd.it/5ulna6s1qze91.jpg?width=960&amp;crop=smart&amp;auto=webp&amp;s=787b2a099448975acfd92466cbeff23b6d9a9fcb', 'width': 960}, {'height': 603, 'url': 'https://preview.redd.it/5ulna6s1qze91.jpg?width=1080&amp;crop=smart&amp;auto=webp&amp;s=c072ba1db1038edfd2be0ce6e32c5308e4971267', 'width': 1080}], 'source': {'height': 715, 'url': 'https://preview.redd.it/5ulna6s1qze91.jpg?auto=webp&amp;s=b62f6dd9e41433fe681e2f4c1e0859143b934e31', 'width': 1280}, 'variants': {}}]}	78.0	140.0	https://i.redd.it/5ulna6s1qze91.jpg															"Redluna is the next 1000x BSC project of the year ❤️❤️❤️ Redluna is listed on #coinmarketcap and #coingecko
"	redluna is the next 1000x bsc project of the year redluna is listed on coinmarketcap and coingecko nan	0.1809483915567398	0.8632177710533142	0.351091206073761	0.637312650680542	0.12603892385959625	0.349582701921463	0.2719939351081848	2.4080857201624895e-06	0.442964106798172	0.004656418226659298
48	[]	False	Darken-kun		[]		text	t2_ca04x21f	False	False	True	[]	False	False	1659310679	self.Bitcoin	https://www.reddit.com/r/Bitcoin/comments/wd2c5i/my_personal_experience_with_bitcoin_versus_a/	{}	wd2c5i	False	True	False	False	False	True	True	False		[]	dark	text	False	False	True	0	0	False	all_ads	/r/Bitcoin/comments/wd2c5i/my_personal_experience_with_bitcoin_versus_a/	False	6		1659310689	1	"A little fun fact about the experience I had with Bitcoin and that unfamous hardfork.

A few weeks ago, some user donated me a small amount of the copycat coin to try and convince me that it's faster and more scalable. It took 15 minutes to receive it.

In the other hand, today I made a peer-2-peer BTC purchase opting for the slowest transaction fee possible (1 sat/vByte). I received it in 4 minutes."	True	False	False	Bitcoin	t5_2s3qj	4445027	public	self	My personal experience with Bitcoin versus a copycat.	0	[]	1.0	https://www.reddit.com/r/Bitcoin/comments/wd2c5i/my_personal_experience_with_bitcoin_versus_a/	all_ads	6																				"My personal experience with Bitcoin versus a copycat.
A little fun fact about the experience I had with Bitcoin and that unfamous hardfork.

A few weeks ago, some user donated me a small amount of the copycat coin to try and convince me that it's faster and more scalable. It took 15 minutes to receive it.

In the other hand, today I made a peer-2-peer BTC purchase opting for the slowest transaction fee possible (1 sat/vByte). I received it in 4 minutes."	my personal experience with bitcoin versus a copycat a little fun fact about the experience i had with bitcoin and that unfamous hardfork a few weeks ago some user donated me a small amount of the copycat coin to try and convince me that it s faster and more scalable it took 15 minutes to receive it in the other hand today i made a peer 2 peer btc purchase opting for the slowest transaction fee possible 1 sat vbyte i received it in 4 minutes 	0.002702204044908285	0.9881715178489685	0.14276374876499176	0.030882004648447037	0.9940886497497559	0.9974004030227661	0.1396227777004242	8.491220455653092e-07	0.25084352493286133	0.028329947963356972
49	[]	False	jeremyvr46		[]		text	t2_77ylegs7	False	False	False	[]	False	False	1659310426	self.Bitcoin	https://www.reddit.com/r/Bitcoin/comments/wd2914/dca_taxes_nightmare/	{}	wd2914	False	True	False	False	False	True	True	False		[]	dark	text	False	False	False	0	0	False	all_ads	/r/Bitcoin/comments/wd2914/dca_taxes_nightmare/	False	6		1659310436	1	"Hi guys, 
After finally getting into BTC today and setting up a daily DCA on Strike, a couple people commented in my other post about the massive headache it would generate should I ever sell with a gain. (We’re talking MAYBE and YEARS from now if all goes according to plan). 
I tried to read as much as possible on this topic today (my wife is wondering why I’m so much on my phone today haha!) and am thinking that if I keep a spreadsheet with every transactions details on it, as provided by Strike in each transaction emails, it should make filing taxes rather smooth. 
What is your take on it? Any DCA suggestion? I really like the daily buy but if it turns out being a nightmare someday, then I’d rather change it to weekly. 
Cheers fellow BitCoiners! *insert non existing BitCoin emoji*"	True	False	False	Bitcoin	t5_2s3qj	4445016	public	self	DCA + Taxes = Nightmare?	0	[]	1.0	https://www.reddit.com/r/Bitcoin/comments/wd2914/dca_taxes_nightmare/	all_ads	6																				"DCA + Taxes = Nightmare?
Hi guys, 
After finally getting into BTC today and setting up a daily DCA on Strike, a couple people commented in my other post about the massive headache it would generate should I ever sell with a gain. (We’re talking MAYBE and YEARS from now if all goes according to plan). 
I tried to read as much as possible on this topic today (my wife is wondering why I’m so much on my phone today haha!) and am thinking that if I keep a spreadsheet with every transactions details on it, as provided by Strike in each transaction emails, it should make filing taxes rather smooth. 
What is your take on it? Any DCA suggestion? I really like the daily buy but if it turns out being a nightmare someday, then I’d rather change it to weekly. 
Cheers fellow BitCoiners! *insert non existing BitCoin emoji*"	dca taxes nightmare hi guys after finally getting into btc today and setting up a daily dca on strike a couple people commented in my other post about the massive headache it would generate should i ever sell with a gain we re talking maybe and years from now if all goes according to plan i tried to read as much as possible on this topic today my wife is wondering why i m so much on my phone today haha and am thinking that if i keep a spreadsheet with every transactions details on it as provided by strike in each transaction emails it should make filing taxes rather smooth what is your take on it any dca suggestion i really like the daily buy but if it turns out being a nightmare someday then i d rather change it to weekly cheers fellow bitcoiners insert non existing bitcoin emoji 	0.002341540064662695	0.9886811971664429	0.38304972648620605	0.015215976163744926	0.007729852572083473	0.23165245354175568	0.16636981070041656	8.677219511810108e-07	0.2834838628768921	0.0024928476195782423
50	[]	False	prison-break-rick		[]		text	t2_15afzgy5	False	False	False	[]	False	False	1659309791	reddit.com	https://www.reddit.com/r/Bitcoin/comments/wd2107/is_this_a_scam/	{}	wd2107	False	False	False	False	False	False	False	False		[]	dark	text	False	False	True	1	0	False	all_ads	/r/Bitcoin/comments/wd2107/is_this_a_scam/	False	6	moderator	1659309802	1		True	False	False	Bitcoin	t5_2s3qj	4444993	public	https://b.thumbs.redditmedia.com/PE6JPNFTht6G212wF6y_d3z6Zz04oqdrl8Se6sRkMmg.jpg	is this a scam?	0	[]	1.0	https://www.reddit.com/gallery/wd2107	all_ads	6			138.0	140.0	https://www.reddit.com/gallery/wd2107											True				"is this a scam?
"	is this a scam nan	0.4407360255718231	0.5133854746818542	0.4869788587093353	0.42656296491622925	0.44862887263298035	0.5436818599700928	0.4429270625114441	0.43185219168663025	0.44953233003616333	0.34197309613227844
51	[]	False	Clay_PalmData		[]		text	t2_of9yhi1d	False	False	False	[]	False	False	1659309424	self.Bitcoin	https://www.reddit.com/r/Bitcoin/comments/wd1wa9/asic_mining_hardware_for_sale_731/	{}	wd1wa9	False	False	False	False	False	False	True	False		[]	dark	text	False	False	True	0	0	False	all_ads	/r/Bitcoin/comments/wd1wa9/asic_mining_hardware_for_sale_731/	False	6	moderator	1659309434	1	[removed]	True	False	False	Bitcoin	t5_2s3qj	4444994	public	https://b.thumbs.redditmedia.com/l_eVjy5xCfrsscGGpYNYHFxUegMb2w8DoN4eIt0MhVw.jpg	Asic Mining Hardware For Sale 7/31	0	[]	1.0	https://www.reddit.com/r/Bitcoin/comments/wd1wa9/asic_mining_hardware_for_sale_731/	all_ads	6			140.0	140.0																"Asic Mining Hardware For Sale 7/31
[removed]"	asic mining hardware for sale 7 31 removed 	0.23047690093517303	0.8171847462654114	0.241580992937088	0.6653820276260376	0.385225385427475	0.42178773880004883	0.3848131597042084	0.438027024269104	0.4085662066936493	0.015116012655198574
52	[]	False	mundo-inaudito24	noob	[{'e': 'text', 't': 'redditor for 4 weeks'}]	redditor for 4 weeks	richtext	t2_pi416vr8	False	False	False	[]	False	False	1659309028	binance.com	https://www.reddit.com/r/Bitcoin/comments/wd1r8c/hola_si_te_unes_a_binance_usando_mi_enlace_de/	{}	wd1r8c	False	True	False	False	False	True	False	False		[]	dark	text	False	False	True	0	0	False	all_ads	/r/Bitcoin/comments/wd1r8c/hola_si_te_unes_a_binance_usando_mi_enlace_de/	False	6		1659309039	1		False	False	False	Bitcoin	t5_2s3qj	4444977	public	https://a.thumbs.redditmedia.com/tMJfGsxu2-73iguYwfJrBYSrZIDA_WWmXzhQD-I2lm4.jpg	¡Hola! Si te unes a Binance usando mi enlace de recomendación, puedes desbloquear cajas misteriosas por un valor de hasta 500 $ cada una.	0	[]	1.0	https://www.binance.com/es/activity/referral-entry/JLMBX?fromActivityPage=true&amp;ref=LIMIT_JLM58ZIY&amp;utm_campaign=web_share_link&amp;utm_source=reddit	all_ads	6	link	{'enabled': False, 'images': [{'id': 'UT5WNvYa1EgwShuuoNuQNCScMpz0K800Ri8Yez_etQY', 'resolutions': [{'height': 60, 'url': 'https://external-preview.redd.it/OTmJ0ZZqEEEOonEzrmN0fkX-K2VLOU4CHdjilYd8TTg.jpg?width=108&amp;crop=smart&amp;auto=webp&amp;s=14de091d1bf6171e4c442da94fd53fee2d689f83', 'width': 108}, {'height': 121, 'url': 'https://external-preview.redd.it/OTmJ0ZZqEEEOonEzrmN0fkX-K2VLOU4CHdjilYd8TTg.jpg?width=216&amp;crop=smart&amp;auto=webp&amp;s=e222b1d6ea87264f692f509ec64942c2d0ee5bcf', 'width': 216}, {'height': 180, 'url': 'https://external-preview.redd.it/OTmJ0ZZqEEEOonEzrmN0fkX-K2VLOU4CHdjilYd8TTg.jpg?width=320&amp;crop=smart&amp;auto=webp&amp;s=1d213a58dcca5e8406683bfd936418a3ed64dc1b', 'width': 320}, {'height': 360, 'url': 'https://external-preview.redd.it/OTmJ0ZZqEEEOonEzrmN0fkX-K2VLOU4CHdjilYd8TTg.jpg?width=640&amp;crop=smart&amp;auto=webp&amp;s=e6ab0ff3ac2a49eebbac3ec2faad4b2b592aa0ba', 'width': 640}, {'height': 540, 'url': 'https://external-preview.redd.it/OTmJ0ZZqEEEOonEzrmN0fkX-K2VLOU4CHdjilYd8TTg.jpg?width=960&amp;crop=smart&amp;auto=webp&amp;s=68ace4e1896f809ad74f54ceffafa2e46a3c1ed5', 'width': 960}, {'height': 607, 'url': 'https://external-preview.redd.it/OTmJ0ZZqEEEOonEzrmN0fkX-K2VLOU4CHdjilYd8TTg.jpg?width=1080&amp;crop=smart&amp;auto=webp&amp;s=085e0bfa9af1796a20c91957409c7884139441c1', 'width': 1080}], 'source': {'height': 900, 'url': 'https://external-preview.redd.it/OTmJ0ZZqEEEOonEzrmN0fkX-K2VLOU4CHdjilYd8TTg.jpg?auto=webp&amp;s=4da5b9e0f534724fceb1115a9746c4b242c5aeb0', 'width': 1600}, 'variants': {}}]}	78.0	140.0	https://www.binance.com/es/activity/referral-entry/JLMBX?fromActivityPage=true&amp;ref=LIMIT_JLM58ZIY&amp;utm_campaign=web_share_link&amp;utm_source=reddit		dark	2ec8e69e-6c36-11e9-a04b-0afb553d4ea6												"¡Hola! Si te unes a Binance usando mi enlace de recomendación, puedes desbloquear cajas misteriosas por un valor de hasta 500 $ cada una.
"	 hola si te unes a binance usando mi enlace de recomendaci n puedes desbloquear cajas misteriosas por un valor de hasta 500 cada una nan	0.05770260468125343	0.836146354675293	0.36015555262565613	0.04275957867503166	0.010202648118138313	0.6811901330947876	0.376205176115036	0.8280329704284668	0.4901106357574463	0.01749143749475479
53	[]	False	Kennedy2345		[]		text	t2_lqiuxpid	False	False	False	[]	False	False	1659308993	self.Bitcoin	https://www.reddit.com/r/Bitcoin/comments/wd1qqo/bingx_crypto_social_trading_network/	{}	wd1qqo	False	False	False	False	False	False	True	False		[]	dark	text	False	False	True	0	0	False	all_ads	/r/Bitcoin/comments/wd1qqo/bingx_crypto_social_trading_network/	False	6	reddit	1659309003	1	[removed]	True	False	False	Bitcoin	t5_2s3qj	4444974	public	self	BingX Crypto Social Trading Network	0	[]	1.0	https://www.reddit.com/r/Bitcoin/comments/wd1qqo/bingx_crypto_social_trading_network/	all_ads	6																				"BingX Crypto Social Trading Network
[removed]"	bingx crypto social trading network removed 	0.3404817283153534	0.664101243019104	0.4538559019565582	0.5611743330955505	0.4350773096084595	0.22584977746009827	0.38774552941322327	0.5069112181663513	0.48742014169692993	0.019047660753130913
54	[]	False	Spacialjumper	noob	[{'e': 'text', 't': 'redditor for 1 week'}]	redditor for 1 week	richtext	t2_kppixus9	False	False	False	[]	False	False	1659308983	self.Bitcoin	https://www.reddit.com/r/Bitcoin/comments/wd1qmj/strike_withdraw/	{}	wd1qmj	False	True	False	False	False	True	True	False		[]	dark	text	False	False	True	0	0	False	all_ads	/r/Bitcoin/comments/wd1qmj/strike_withdraw/	False	6		1659308994	1	Deposited 50 USD through bank transfer on strike a few days ago but still don’t see the withdraw even pending on my account. How long does this usually take?	True	False	False	Bitcoin	t5_2s3qj	4444974	public	self	Strike withdraw	0	[]	1.0	https://www.reddit.com/r/Bitcoin/comments/wd1qmj/strike_withdraw/	all_ads	6							dark	2ec8e69e-6c36-11e9-a04b-0afb553d4ea6												"Strike withdraw
Deposited 50 USD through bank transfer on strike a few days ago but still don’t see the withdraw even pending on my account. How long does this usually take?"	strike withdraw deposited 50 usd through bank transfer on strike a few days ago but still don t see the withdraw even pending on my account how long does this usually take 	0.02055731974542141	0.9832217693328857	0.27204152941703796	0.9026959538459778	0.1850879043340683	0.4880427122116089	0.06993577629327774	8.448135417893354e-07	0.2850627899169922	0.007209658157080412
55	[]	False	solaropposites93		[]		text	t2_6a3b5t7t	False	False	False	[]	False	False	1659308678	self.Bitcoin	https://www.reddit.com/r/Bitcoin/comments/wd1mkn/bitcoin_wallet/	{}	wd1mkn	False	True	False	False	False	True	True	False		[]	dark	text	False	False	True	0	0	False	all_ads	/r/Bitcoin/comments/wd1mkn/bitcoin_wallet/	False	6		1659308689	1	How secure is Coinomi as a bitcoin wallet on the Apple AppStore?	True	False	False	Bitcoin	t5_2s3qj	4444965	public	self	Bitcoin wallet	0	[]	1.0	https://www.reddit.com/r/Bitcoin/comments/wd1mkn/bitcoin_wallet/	all_ads	6																				"Bitcoin wallet
How secure is Coinomi as a bitcoin wallet on the Apple AppStore?"	bitcoin wallet how secure is coinomi as a bitcoin wallet on the apple appstore 	0.48171642422676086	0.7240673303604126	0.3741847276687622	0.2972539961338043	0.13728177547454834	0.2897825837135315	0.20217444002628326	0.8671478629112244	0.39307522773742676	0.010364125482738018
56	[]	False	btc-congratulatr-guy	noob	[{'e': 'text', 't': 'redditor for 1 week'}]	redditor for 1 week	richtext	t2_qdfev6hi	False	False	False	[]	False	False	1659308439	self.Bitcoin	https://www.reddit.com/r/Bitcoin/comments/wd1jcd/hey_new_full_coiners_congratulations/	{}	wd1jcd	False	True	False	False	False	True	True	False		[]	dark	text	False	False	True	0	0	False	all_ads	/r/Bitcoin/comments/wd1jcd/hey_new_full_coiners_congratulations/	False	6		1659308449	1	Tall you new owners of a full Bitcoin, I just want to acknowledge you and offer my sincere congrats.  You know who you are. You know that ID'ing yourself as a whole coiner is bad opsec. Yet, its human nature to crave some kind of pat on the back for being so damn clever.  So here it is.  CONGRATS!  YOU DID IT!!	True	False	False	Bitcoin	t5_2s3qj	4444960	public	self	Hey, new Full Coiners: Congratulations!	0	[]	1.0	https://www.reddit.com/r/Bitcoin/comments/wd1jcd/hey_new_full_coiners_congratulations/	all_ads	6							dark	2ec8e69e-6c36-11e9-a04b-0afb553d4ea6												"Hey, new Full Coiners: Congratulations!
Tall you new owners of a full Bitcoin, I just want to acknowledge you and offer my sincere congrats.  You know who you are. You know that ID'ing yourself as a whole coiner is bad opsec. Yet, its human nature to crave some kind of pat on the back for being so damn clever.  So here it is.  CONGRATS!  YOU DID IT!!"	hey new full coiners congratulations tall you new owners of a full bitcoin i just want to acknowledge you and offer my sincere congrats you know who you are you know that id ing yourself as a whole coiner is bad opsec yet its human nature to crave some kind of pat on the back for being so damn clever so here it is congrats you did it 	0.9115278124809265	0.16569358110427856	0.005180322099477053	0.009053741581737995	0.008380033075809479	0.9001146554946899	0.9752935171127319	8.017069035304303e-07	0.16972167789936066	0.003725251881405711
57	[]	False	_BitBull_	noob	[{'e': 'text', 't': 'redditor for 3 months'}]	redditor for 3 months	richtext	t2_mrmgqpp0	False	False	False	[]	False	False	1659308213	twitter.com	https://www.reddit.com/r/Bitcoin/comments/wd1g8a/bitull_on_twitter/	{}	wd1g8a	False	True	False	False	False	True	False	False		[]	dark	text	False	False	True	0	0	False	all_ads	/r/Bitcoin/comments/wd1g8a/bitull_on_twitter/	False	6		1659308224	1		False	False	False	Bitcoin	t5_2s3qj	4444955	public	https://b.thumbs.redditmedia.com/eICaPVlgWBhMJVYekR5ge8IMpo0DWzwH7Q5SEmxrF_M.jpg	Bit₿ull📈 on Twitter	0	[]	1.0	https://twitter.com/fp0618/status/1553860925966503937?s=21&amp;t=cmf3wSLhhCNtQEnKEbefBA	all_ads	6	link	{'enabled': False, 'images': [{'id': 'dOHuNrY-GlLYjFtRop_n_uZHcmwsot3vO2grHjjP724', 'resolutions': [{'height': 65, 'url': 'https://external-preview.redd.it/wg7RlHl5X2W00soCWaeKu1G4wFmiTL7wRak9Mxi2dB8.jpg?width=108&amp;crop=smart&amp;auto=webp&amp;s=ec059195b024b2db204cfa87a36f8ec02c2820f3', 'width': 108}], 'source': {'height': 85, 'url': 'https://external-preview.redd.it/wg7RlHl5X2W00soCWaeKu1G4wFmiTL7wRak9Mxi2dB8.jpg?auto=webp&amp;s=6a9caa571a39e70c188df1eafb53a8409f826448', 'width': 140}, 'variants': {}}]}	85.0	140.0	https://twitter.com/fp0618/status/1553860925966503937?s=21&amp;t=cmf3wSLhhCNtQEnKEbefBA		dark	2ec8e69e-6c36-11e9-a04b-0afb553d4ea6			"{'oembed': {'author_name': 'Bit₿ull📈', 'author_url': 'https://twitter.com/FP0618', 'cache_age': 3153600000, 'height': None, 'html': '&lt;blockquote class=""twitter-video""&gt;&lt;p lang=""und"" dir=""ltr""&gt;618 run &lt;a href=""https://twitter.com/hashtag/BITCOIN?src=hash&amp;amp;ref_src=twsrc%5Etfw""&gt;#BITCOIN&lt;/a&gt; &lt;a href=""https://t.co/2DX3UKL6wV""&gt;pic.twitter.com/2DX3UKL6wV&lt;/a&gt;&lt;/p&gt;&amp;mdash; Bit₿ull📈 (@FP0618) &lt;a href=""https://twitter.com/FP0618/status/1553860925966503937?ref_src=twsrc%5Etfw""&gt;July 31, 2022&lt;/a&gt;&lt;/blockquote&gt;\n&lt;script async src=""https://platform.twitter.com/widgets.js"" charset=""utf-8""&gt;&lt;/script&gt;\n', 'provider_name': 'Twitter', 'provider_url': 'https://twitter.com', 'type': 'rich', 'url': 'https://twitter.com/FP0618/status/1553860925966503937', 'version': '1.0', 'width': 350}, 'type': 'twitter.com'}"	"{'content': '&lt;blockquote class=""twitter-video""&gt;&lt;p lang=""und"" dir=""ltr""&gt;618 run &lt;a href=""https://twitter.com/hashtag/BITCOIN?src=hash&amp;amp;ref_src=twsrc%5Etfw""&gt;#BITCOIN&lt;/a&gt; &lt;a href=""https://t.co/2DX3UKL6wV""&gt;pic.twitter.com/2DX3UKL6wV&lt;/a&gt;&lt;/p&gt;&amp;mdash; Bit₿ull📈 (@FP0618) &lt;a href=""https://twitter.com/FP0618/status/1553860925966503937?ref_src=twsrc%5Etfw""&gt;July 31, 2022&lt;/a&gt;&lt;/blockquote&gt;\n&lt;script async src=""https://platform.twitter.com/widgets.js"" charset=""utf-8""&gt;&lt;/script&gt;\n', 'height': 200, 'scrolling': False, 'width': 350}"	"{'oembed': {'author_name': 'Bit₿ull📈', 'author_url': 'https://twitter.com/FP0618', 'cache_age': 3153600000, 'height': None, 'html': '&lt;blockquote class=""twitter-video""&gt;&lt;p lang=""und"" dir=""ltr""&gt;618 run &lt;a href=""https://twitter.com/hashtag/BITCOIN?src=hash&amp;amp;ref_src=twsrc%5Etfw""&gt;#BITCOIN&lt;/a&gt; &lt;a href=""https://t.co/2DX3UKL6wV""&gt;pic.twitter.com/2DX3UKL6wV&lt;/a&gt;&lt;/p&gt;&amp;mdash; Bit₿ull📈 (@FP0618) &lt;a href=""https://twitter.com/FP0618/status/1553860925966503937?ref_src=twsrc%5Etfw""&gt;July 31, 2022&lt;/a&gt;&lt;/blockquote&gt;\n&lt;script async src=""https://platform.twitter.com/widgets.js"" charset=""utf-8""&gt;&lt;/script&gt;\n', 'provider_name': 'Twitter', 'provider_url': 'https://twitter.com', 'type': 'rich', 'url': 'https://twitter.com/FP0618/status/1553860925966503937', 'version': '1.0', 'width': 350}, 'type': 'twitter.com'}"	"{'content': '&lt;blockquote class=""twitter-video""&gt;&lt;p lang=""und"" dir=""ltr""&gt;618 run &lt;a href=""https://twitter.com/hashtag/BITCOIN?src=hash&amp;amp;ref_src=twsrc%5Etfw""&gt;#BITCOIN&lt;/a&gt; &lt;a href=""https://t.co/2DX3UKL6wV""&gt;pic.twitter.com/2DX3UKL6wV&lt;/a&gt;&lt;/p&gt;&amp;mdash; Bit₿ull📈 (@FP0618) &lt;a href=""https://twitter.com/FP0618/status/1553860925966503937?ref_src=twsrc%5Etfw""&gt;July 31, 2022&lt;/a&gt;&lt;/blockquote&gt;\n&lt;script async src=""https://platform.twitter.com/widgets.js"" charset=""utf-8""&gt;&lt;/script&gt;\n', 'height': 200, 'media_domain_url': 'https://www.redditmedia.com/mediaembed/wd1g8a', 'scrolling': False, 'width': 350}"						"Bit₿ull📈 on Twitter
"	bit ull on twitter nan	0.4922533333301544	0.3362575173377991	0.47964930534362793	0.31945592164993286	0.4575902819633484	0.8209444880485535	0.5274638533592224	0.4103299379348755	0.4124968945980072	0.3412131667137146
