Unnamed: 0	all_awardings	archived	associated_award	author	author_flair_background_color	author_flair_css_class	author_flair_richtext	author_flair_template_id	author_flair_text	author_flair_text_color	author_flair_type	author_fullname	author_patreon_flair	author_premium	body	body_sha1	can_gild	collapsed	collapsed_because_crowd_control	collapsed_reason	collapsed_reason_code	comment_type	controversiality	created_utc	distinguished	gilded	gildings	id	is_submitter	link_id	locked	no_follow	parent_id	permalink	retrieved_utc	score	score_hidden	send_replies	stickied	subreddit	subreddit_id	subreddit_name_prefixed	subreddit_type	top_awarded_type	total_awards_received	treatment_tags	unrepliable_reason	author_cakeday	corpus	support	knowledge	conflict	power	similarity	fun	status	trust	identity	romance
454	[]	False		[deleted]						dark					[removed]	fe993932d6dced4c0a879e9aa5d7a6e0fbb467f5	True	False					0	1657976071		0	{}	ige187c	False	t3_w0dxz9	False	True	t3_w0dxz9	/r/solana/comments/w0dxz9/wallet_not_showing_when_i_recover/ige187c/	1657976083	1	False	True	False	solana	t5_hcs2n	r/solana	public		0	[]			 removed 	0.46707504987716675	0.5148742198944092	0.5170193910598755	0.5029740929603577	0.4936113953590393	0.5123135447502136	0.45383262634277344	0.4847692549228668	0.4981911778450012	0.5145108103752136
455	[]	False		OccamsPhasers			[]				text	t2_5377g9zj	False	False	"There seems to be a few different questionable things happening regarding Solana

https://dailyhodl.com/2022/07/08/investors-file-lawsuit-against-solana-labs-alleging-sol-is-highly-centralized-unregistered-security/"	fb8b8e6c2045773262106d04d93df1d8b449cefb	True	False					0	1657975786		0	{}	ige0pv6	False	t3_w04wow	False	True	t3_w04wow	/r/solana/comments/w04wow/why_is_sol_criticized_so_heavy_for_not_being_as/ige0pv6/	1657975797	1	False	True	False	solana	t5_hcs2n	r/solana	public		0	[]			there seems to be a few different questionable things happening regarding solana https dailyhodl com 2022 07 08 investors file lawsuit against solana labs alleging sol is highly centralized unregistered security 	0.015436844900250435	0.9464572668075562	0.7667927742004395	0.4319179654121399	0.988553524017334	0.16529779136180878	0.1740207076072693	0.004415926989167929	0.5656955242156982	0.0029040647204965353
456	[]	False		tnycman			[]				text	t2_7cwq8fsq	False	False	Don't tell me you were at the bar shitfaced when you wrote this..	9e7ed4a43d28899f9ba3e8d9c48b0f631f495645	True	False					0	1657975296		0	{}	igdzud5	False	t3_w07ojt	False	True	t3_w07ojt	/r/solana/comments/w07ojt/dear_solana_community/igdzud5/	1657975313	1	False	True	False	solana	t5_hcs2n	r/solana	public		0	[]			don t tell me you were at the bar shitfaced when you wrote this 	0.11140318214893341	0.2875988185405731	0.6073175668716431	0.2671324610710144	0.3394794464111328	0.7515522241592407	0.27332207560539246	2.9492032354028197e-06	0.28103160858154297	0.007942715659737587
457	[]	False		rqnyc			[]				text	t2_5ytpce6x	False	False	 Coz SOL is now the position next to ETH, getting a lot of heat from ADA boys	ac39516a2370b3dadf8534fd40b8d7b6eea47b3a	True	False					0	1657974864		0	{}	igdz32t	False	t3_w04wow	False	True	t3_w04wow	/r/solana/comments/w04wow/why_is_sol_criticized_so_heavy_for_not_being_as/igdz32t/	1657974876	1	False	True	False	solana	t5_hcs2n	r/solana	public		0	[]			 coz sol is now the position next to eth getting a lot of heat from ada boys	0.1873205602169037	0.7374082207679749	0.4769018292427063	0.1457611620426178	0.3551912009716034	0.5285212993621826	0.1674250066280365	2.0480831608438166e-06	0.31716811656951904	0.04523872584104538
458	[]	False		Itsyaboyerik13			[]				text	t2_9wmy3ymt	False	False	The only point of cryptocurrencies is decentralization	e980596013c7aefaccb74f6b4c8dc81f2dae1808	True	False					0	1657974852		0	{}	igdz2ap	False	t3_w04wow	False	False	t3_w04wow	/r/solana/comments/w04wow/why_is_sol_criticized_so_heavy_for_not_being_as/igdz2ap/	1657974867	1	False	True	False	solana	t5_hcs2n	r/solana	public		0	[]			the only point of cryptocurrencies is decentralization	0.3329743444919586	0.6283250451087952	0.5719184279441833	0.5191618204116821	0.4124658405780792	0.2966410219669342	0.3547830581665039	0.2910439372062683	0.5182284116744995	0.09546347707509995
459	[]	False		IAmTheLostBoy			[]				text	t2_4ybal04	False	False	Nah, I sold at 190-240 to invest in other projects. Solana has too many network issues for my liking.	c44fc13a78a29a1c070003966683b78fc9460b50	True	False					0	1657973172		0	{}	igdw88f	False	t3_w04wow	False	True	t1_igdvba0	/r/solana/comments/w04wow/why_is_sol_criticized_so_heavy_for_not_being_as/igdw88f/	1657973183	1	False	True	False	solana	t5_hcs2n	r/solana	public		0	[]			nah i sold at 190 240 to invest in other projects solana has too many network issues for my liking 	0.2718755900859833	0.777201235294342	0.2572726607322693	0.0752924382686615	0.5337247252464294	0.4678947627544403	0.2673128843307495	8.87259659521078e-07	0.4204760491847992	0.02309715561568737
460	[]	False		ZackAttackin23			[]				text	t2_i17jgylc	False	False	Lol...... kinda 😂😂😂😂	3868a6243f943619c7cfaecde32d49e59505c23b	True	False					0	1658015357		0	{}	igggta8	True	t3_w07ojt	False	True	t1_igdzud5	/r/solana/comments/w07ojt/dear_solana_community/igggta8/	1658015368	1	False	True	False	solana	t5_hcs2n	r/solana	public		0	[]			lol kinda 	0.44278478622436523	0.3590731620788574	0.564531683921814	0.389711856842041	0.4964359700679779	0.8287538290023804	0.46760523319244385	0.49105966091156006	0.4640202522277832	0.593326210975647
461	[]	False		AutoModerator			[]				text	t2_6l4z3	False	True	"WARNING: 
1) Do not trust DMs from anyone offering to help/support you with your funds (Scammers)! 
2) Never give out your Seed Phrase and DO NOT ENTER it on ANY websites sent to you.
3) MODS or Community Managers will NEVER DM you first regarding your funds/wallet.


*I am a bot, and this action was performed automatically. Please [contact the moderators of this subreddit](/message/compose/?to=/r/solana) if you have any questions or concerns.*"	14dd8b569135602c5532d6566410f9a64883f0a5	True	False					0	1658015352	moderator	0	{}	igggsu9	False	t3_w0ts6e	True	True	t3_w0ts6e	/r/solana/comments/w0ts6e/vogaye_for_paradise_solana_listen_to_earn/igggsu9/	1658015366	1	True	False	True	solana	t5_hcs2n	r/solana	public		0	[]			warning 1 do not trust dms from anyone offering to help support you with your funds scammers 2 never give out your seed phrase and do not enter it on any websites sent to you 3 mods or community managers will never dm you first regarding your funds wallet i am a bot and this action was performed automatically please contact the moderators of this subreddit message compose to r solana if you have any questions or concerns 	0.011870771646499634	0.988234281539917	0.4694240689277649	0.9483896493911743	0.008167698048055172	0.244121253490448	0.10070517659187317	8.339779924426693e-07	0.30487555265426636	0.01920556277036667
462	[]	False		Current_North4661			[]				text	t2_56j1meum	False	False	99% sure this is a scam. Can Mods confirm or stop this post?	6cefd60fa5b14b42683b5d911a4cf21d1b105828	True	False					0	1658015321		0	{}	igggqj1	False	t3_w0j9rs	False	True	t3_w0j9rs	/r/solana/comments/w0j9rs/instant_unstaking_for_all/igggqj1/	1658015331	1	False	True	False	solana	t5_hcs2n	r/solana	public		0	[]			99 sure this is a scam can mods confirm or stop this post 	0.32204151153564453	0.7032486200332642	0.6307864189147949	0.36048588156700134	0.2620236575603485	0.43341997265815735	0.17554615437984467	4.811438702745363e-05	0.3571559190750122	0.0031252673361450434
463	[]	False		Reqhead			[]				text	t2_wx1cri8	False	False	Exactly this. It was the illiquidity of the underlying Eth that was miss priced in Steth. Should have been at a discount. Msol still carries some smart contract risk I’m sure - but the peg shouldn’t vary much at all since msol can be redeemed for underlying sol - whereas steth cannot be redeeemd for underlying Eth	08a676fdaf5fb8a28cee075f2f3f4597aee67585	True	False					0	1658014245		0	{}	iggei3d	False	t3_w0j9rs	False	True	t1_igg5aa7	/r/solana/comments/w0j9rs/instant_unstaking_for_all/iggei3d/	1658014258	1	False	True	False	solana	t5_hcs2n	r/solana	public		0	[]			exactly this it was the illiquidity of the underlying eth that was miss priced in steth should have been at a discount msol still carries some smart contract risk i m sure but the peg shouldn t vary much at all since msol can be redeemed for underlying sol whereas steth cannot be redeeemd for underlying eth	0.0027034252416342497	0.9885186553001404	0.5298598408699036	0.016223223879933357	0.9931386113166809	0.26631030440330505	0.1754976212978363	8.763141750023351e-07	0.48281386494636536	0.004694371484220028
464	[]	False		InfiniteState			[]				text	t2_gslj9	False	False	If you think Terra is twice as decentralized as ETH, I don’t know what to tell you. Have a jello cup and try not to use sharp objects.	6e6b098c22cf2b22b7042a07eb58471cb8da3934	True	False					0	1658014177		0	{}	iggecxs	False	t3_w04wow	False	True	t1_iggb8op	/r/solana/comments/w04wow/why_is_sol_criticized_so_heavy_for_not_being_as/iggecxs/	1658014189	1	False	True	False	solana	t5_hcs2n	r/solana	public		0	[]			if you think terra is twice as decentralized as eth i don t know what to tell you have a jello cup and try not to use sharp objects 	0.02209242433309555	0.9274451732635498	0.2567336857318878	0.030981356278061867	0.018358269706368446	0.32810792326927185	0.07818877696990967	8.54355562296405e-07	0.3687649667263031	0.016717130318284035
465	[]	False		Stones02			[]				text	t2_3z4x5pjk	False	False	"Because SOL is truly only vaguely decentralised. 
I'm sorry but only holding sol back to 120$ since I bought long ago on Phemex  
So sad"	47fb985dff2aacf67d90a1655a511ecebdd4c3ba	True	False					0	1658013758		0	{}	iggdhiz	False	t3_w04wow	False	True	t3_w04wow	/r/solana/comments/w04wow/why_is_sol_criticized_so_heavy_for_not_being_as/iggdhiz/	1658013774	1	False	True	False	solana	t5_hcs2n	r/solana	public		0	[]			because sol is truly only vaguely decentralised i m sorry but only holding sol back to 120 since i bought long ago on phemex so sad	0.08904750645160675	0.6670321822166443	0.15516814589500427	0.01600724644958973	0.31266623735427856	0.5904441475868225	0.18814603984355927	8.632483172732464e-07	0.3402574956417084	0.025173066183924675
466	[]	False		Reqhead			[]				text	t2_wx1cri8	False	False	Eth is 3. That is correct. Lido, coinbase and Binance I believe are over the threshold.	188bf9bc009d4f9f30c529cbf90b6b2d618965c1	True	False					0	1658012686		0	{}	iggb8op	False	t3_w04wow	False	True	t1_igfwpir	/r/solana/comments/w04wow/why_is_sol_criticized_so_heavy_for_not_being_as/iggb8op/	1658012699	1	False	True	False	solana	t5_hcs2n	r/solana	public		0	[]			eth is 3 that is correct lido coinbase and binance i believe are over the threshold 	0.15745939314365387	0.7828896045684814	0.6889623999595642	0.2824755609035492	0.28477707505226135	0.31722453236579895	0.27838844060897827	0.6151466965675354	0.46908196806907654	0.00337157747708261
467	[]	False		OneWhoPossess			[]				text	t2_1t216ius	False	False	🤭🤭🤭🤭🤭	a29d11b93849feec3cf4c3f4f53d473c21932568	True	False					0	1658012686		0	{}	iggb8o3	False	t3_w07ojt	False	True	t3_w07ojt	/r/solana/comments/w07ojt/dear_solana_community/iggb8o3/	1658012699	1	False	True	False	solana	t5_hcs2n	r/solana	public		0	[]			 	0.4871354103088379	0.5098868012428284	0.5124213099479675	0.5155720114707947	0.4910793602466583	0.4970635175704956	0.49484649300575256	0.48481839895248413	0.4902850091457367	0.5123646259307861
468	[]	False		SSWaverider			[]				text	t2_pe3p08uu	False	False	Definitely checking this one out!	49df76c9202845f4154224061718c993327affd7	True	False					0	1658011048		0	{}	igg7rpo	False	t3_v59y6s	False	True	t1_ig8zt5z	/r/solana/comments/v59y6s/top_solana_games_to_look_for_in_2022_nftandgamefi/igg7rpo/	1658011060	1	False	True	False	solana	t5_hcs2n	r/solana	public		0	[]			definitely checking this one out 	0.504580020904541	0.4257667064666748	0.2907239496707916	0.44566264748573303	0.5237293839454651	0.719974935054779	0.556613028049469	0.488260418176651	0.4209522306919098	0.14406807720661163
469	[]	False		OGRiskStaker			[]				text	t2_pe3g9oqa	False	False	Another epic game to watch out on Solana!	a07a81f075d507d348c10fbb68cbaec5017d5df9	True	False					0	1658011015		0	{}	igg7p9g	False	t3_v59y6s	False	True	t1_ig8zt5z	/r/solana/comments/v59y6s/top_solana_games_to_look_for_in_2022_nftandgamefi/igg7p9g/	1658011031	1	False	True	False	solana	t5_hcs2n	r/solana	public		0	[]			another epic game to watch out on solana 	0.21547679603099823	0.48555538058280945	0.5016249418258667	0.20147128403186798	0.44747892022132874	0.631923258304596	0.26756706833839417	0.13584277033805847	0.37112295627593994	0.03870473802089691
470	[]	False		Ikisuke			[]				text	t2_b87m4	False	False	Is this your adress?	df3967294fdd72a3dcc77655cb64c59f7ba4b3bc	True	False					0	1658010200		0	{}	igg5xdh	False	t3_pexe3a	False	True	t1_hhw32at	/r/solana/comments/pexe3a/is_it_posiible_to_burn_minted_nft/igg5xdh/	1658010214	1	False	True	False	solana	t5_hcs2n	r/solana	public		0	[]			is this your adress 	0.526563286781311	0.4155680239200592	0.47100117802619934	0.49818551540374756	0.4475981593132019	0.5638824701309204	0.48696351051330566	0.5215308666229248	0.4718824028968811	0.2511709928512573
471	[]	False		munkeymoney			[]				text	t2_hvy9e020	False	False	Hell yeah!  🤑	8f006ce8aa44cacf26c05bc6084d98e8a6ae2296	True	False					0	1658010129		0	{}	igg5rsa	False	t3_w07ojt	False	True	t1_igfsv4z	/r/solana/comments/w07ojt/dear_solana_community/igg5rsa/	1658010143	1	False	True	False	solana	t5_hcs2n	r/solana	public		0	[]			hell yeah 	0.46807917952537537	0.3590233027935028	0.6822056174278259	0.4204309284687042	0.4975653886795044	0.6870099902153015	0.45411771535873413	0.46579933166503906	0.4451725482940674	0.5056532025337219
472	[]	False		rykerbyker1115			[]				text	t2_c0iuq17l	False	False	"You could probably do 100,000 trans per sec on an apple laptop  lol ""centralized"" -so yes  without the Byzantine generals problem , no decentralization absolutely no purpose to any of this."	e585adf7c9ca21cb77c8f24a4b2a580d9f653bf8	True	False					0	1658009913		0	{}	igg5awi	False	t3_w04wow	False	True	t1_igecjq9	/r/solana/comments/w04wow/why_is_sol_criticized_so_heavy_for_not_being_as/igg5awi/	1658009926	1	False	True	False	solana	t5_hcs2n	r/solana	public		0	[]			you could probably do 100 000 trans per sec on an apple laptop lol centralized so yes without the byzantine generals problem no decentralization absolutely no purpose to any of this 	0.004139198921620846	0.9816519021987915	0.8026227951049805	0.008869271725416183	0.008803474716842175	0.31332844495773315	0.09683864563703537	8.404933851124952e-07	0.4403945803642273	0.002255810424685478
473	[]	False		FunEarnings			[]				text	t2_92eu1zhu	False	False	"Small clarification, Solana stake pool tokens like mSOL and bSOL will not lose peg when there are mass withdrawals in the same way as stETH. This is because with stETH, the ETH in the pool is locked until the merge to Eth2, so you can't withdraw directly from the pool (not until the merge), and selling happening on secondary markets caused the price to drop. 

With stake pools on Solana, you can redeem SOL directly from the pool at the correct price without causing the token to depeg, as you're withdrawing right from the source. This is because with Solana, there's no merge lockup or anything, the worst that happens is that you withdraw as a stake account that takes 2-3 days to unlock."	7c75b37c05502ae703508e4b049d099c64538a43	True	False					0	1658009905		0	{}	igg5aa7	False	t3_w0j9rs	False	True	t1_igg2cgn	/r/solana/comments/w0j9rs/instant_unstaking_for_all/igg5aa7/	1658009918	1	False	True	False	solana	t5_hcs2n	r/solana	public		0	[]			small clarification solana stake pool tokens like msol and bsol will not lose peg when there are mass withdrawals in the same way as steth this is because with steth the eth in the pool is locked until the merge to eth2 so you can t withdraw directly from the pool not until the merge and selling happening on secondary markets caused the price to drop with stake pools on solana you can redeem sol directly from the pool at the correct price without causing the token to depeg as you re withdrawing right from the source this is because with solana there s no merge lockup or anything the worst that happens is that you withdraw as a stake account that takes 2 3 days to unlock 	0.0021366735454648733	0.9893096685409546	0.8577752709388733	0.01715526171028614	0.007906169630587101	0.4614740014076233	0.06824757158756256	8.475872732560674e-07	0.31562355160713196	0.01730925776064396
474	[]	False		Morning_Star_Ritual			[]				text	t2_40olg	False	False	Please spend some time learning before you post. What are you referring? When did they “vote your money away?” Are you talking about Solend? That had nothing to do with the chain.	b85c8283eb7227453024a3867ecf91ebc69c2c78	True	False					0	1658009860		0	{}	igg56ue	False	t3_w04wow	False	True	t1_igdbw5x	/r/solana/comments/w04wow/why_is_sol_criticized_so_heavy_for_not_being_as/igg56ue/	1658009875	1	False	True	False	solana	t5_hcs2n	r/solana	public		0	[]			please spend some time learning before you post what are you referring when did they vote your money away are you talking about solend that had nothing to do with the chain 	0.12151452898979187	0.8520602583885193	0.8257719874382019	0.8755729794502258	0.015554027631878853	0.29160940647125244	0.0709407702088356	8.596343832323328e-07	0.259355366230011	0.016393842175602913
475	[]	False		raptorjesus69			[]				text	t2_8pz00	False	False	In case someone is wondering the added risk is msol or bsol could lose it's peg in event of massive withdrawals like steth did. There could also be issues and fees with whatever defi exchange you use. What you get in exchange is not having to wait for an epoch to unstake which is a few days	e60d8f67a3f779a15debabc5894d1a55af7f6e6c	True	False					0	1658008539		0	{}	igg2cgn	False	t3_w0j9rs	False	True	t1_igfbhki	/r/solana/comments/w0j9rs/instant_unstaking_for_all/igg2cgn/	1658008550	1	False	True	False	solana	t5_hcs2n	r/solana	public		0	[]			in case someone is wondering the added risk is msol or bsol could lose it s peg in event of massive withdrawals like steth did there could also be issues and fees with whatever defi exchange you use what you get in exchange is not having to wait for an epoch to unstake which is a few days	0.0025743257720023394	0.9884390234947205	0.25283733010292053	0.02469116821885109	0.007800476625561714	0.4776269495487213	0.06909865140914917	8.59830322497146e-07	0.3231620192527771	0.0072934506461024284
476	[]	False		[deleted]						dark					[removed]	fe993932d6dced4c0a879e9aa5d7a6e0fbb467f5	True	False					0	1658006722		0	{}	igfydhm	False	t3_w07ojt	False	True	t3_w07ojt	/r/solana/comments/w07ojt/dear_solana_community/igfydhm/	1658006733	1	False	True	False	solana	t5_hcs2n	r/solana	public		0	[]			 removed 	0.46707504987716675	0.5148742198944092	0.5170193910598755	0.5029740929603577	0.4936113953590393	0.5123135447502136	0.45383262634277344	0.4847692549228668	0.4981911778450012	0.5145108103752136
477	[]	False		ansi09			[{'e': 'text', 't': 'Moderator'}]		Moderator	dark	richtext	t2_nrj91	False	False	"I wouldn't risk using this dApp, not famous, probably not audited, probably malicious, not worth the risk.

You may call me EXTRA paranoid but i won't use this. 

# Use it at your own risk folks."	e4339915abac008ed572cb00ed3f64d963d33ae1	True	False					0	1658006462	moderator	0	{}	igfxsoo	False	t3_w0j9rs	False	True	t3_w0j9rs	/r/solana/comments/w0j9rs/instant_unstaking_for_all/igfxsoo/	1658006475	1	True	True	True	solana	t5_hcs2n	r/solana	public		0	[]			i wouldn t risk using this dapp not famous probably not audited probably malicious not worth the risk you may call me extra paranoid but i won t use this use it at your own risk folks 	0.004204890690743923	0.9832407832145691	0.8330701589584351	0.015513855032622814	0.017878428101539612	0.5091403722763062	0.06879747658967972	8.381904876841872e-07	0.3232010304927826	0.004938943777233362
478	[]	False		InfiniteState			[]				text	t2_gslj9	False	False	No way are these correct. It lists $RUNE as a 24 and Terra 2.0 as a 6. lol.	8b3d8730bc73d9a99be28aa689d43496d9d3d8d3	True	False					0	1658005978		0	{}	igfwpir	False	t3_w04wow	False	True	t1_igfnf4n	/r/solana/comments/w04wow/why_is_sol_criticized_so_heavy_for_not_being_as/igfwpir/	1658005989	1	False	True	False	solana	t5_hcs2n	r/solana	public		0	[]			no way are these correct it lists rune as a 24 and terra 2 0 as a 6 lol 	0.09965208172798157	0.806576669216156	0.381376713514328	0.0723109319806099	0.2298750877380371	0.5507263541221619	0.12912273406982422	1.171217036244343e-06	0.39318931102752686	0.01110804546624422
479	[]	False		NePlusUltra89			[]				text	t2_11x3d9	False	False	The entry fee to run a node is substantially higher than other projects the founders have even talked about this , due to this entry the only people who can run a node are those who are already wealthy , win you look at it in comparison to other projects entry is much lower meaning more people can run more nodes it’s all about planning solana has said over time this would go down but for now it remains	a1600f7acb29e9846492bee9f215a538ac843ecc	True	False					0	1658004428		0	{}	igft5ad	False	t3_w04wow	False	True	t3_w04wow	/r/solana/comments/w04wow/why_is_sol_criticized_so_heavy_for_not_being_as/igft5ad/	1658004439	1	False	True	False	solana	t5_hcs2n	r/solana	public		0	[]			the entry fee to run a node is substantially higher than other projects the founders have even talked about this due to this entry the only people who can run a node are those who are already wealthy win you look at it in comparison to other projects entry is much lower meaning more people can run more nodes it s all about planning solana has said over time this would go down but for now it remains	0.002825847826898098	0.9879410862922668	0.5248406529426575	0.9606117010116577	0.00976219680160284	0.4707111716270447	0.05751735344529152	8.543441367692139e-07	0.29430055618286133	0.06224304065108299
480	[]	False		GettinWiggyWiddit			[]				text	t2_71onlsf	False	False	Sitting at 26 now	52d344d09923a726fae6a7e2fad57b3f3d49013c	True	False					0	1658004303		0	{}	igfsv4z	False	t3_w07ojt	False	True	t1_ige9nn0	/r/solana/comments/w07ojt/dear_solana_community/igfsv4z/	1658004318	1	False	True	False	solana	t5_hcs2n	r/solana	public		0	[]			sitting at 26 now	0.4424702823162079	0.5029824376106262	0.5292915105819702	0.48005473613739014	0.47795167565345764	0.6459377408027649	0.39393752813339233	0.41258981823921204	0.4378493130207062	0.361444890499115
481	[]	False		kshinlol			[]				text	t2_cq3jbw3u	False	False	Unpopular opinion: No one really cares about decentralization. They care about the value of their own crypto so they can cash out to their native fiat... issued by their central bank.	ea0a768eb84abac42352abbc629ba2e9973535bf	True	False					0	1658002892		0	{}	igfpnva	False	t3_w04wow	False	True	t3_w04wow	/r/solana/comments/w04wow/why_is_sol_criticized_so_heavy_for_not_being_as/igfpnva/	1658002909	1	False	True	False	solana	t5_hcs2n	r/solana	public		0	[]			unpopular opinion no one really cares about decentralization they care about the value of their own crypto so they can cash out to their native fiat issued by their central bank 	0.040576763451099396	0.9320858716964722	0.6842323541641235	0.7281768918037415	0.04660709574818611	0.2737993896007538	0.12299570441246033	0.08625268936157227	0.5487121939659119	0.00998874194920063
482	[]	False		rangerxx2			[]				text	t2_miyy5azj	False	False	"anyone who wants to get rid of scam tokens and rug NFTs , send them to me :

GU6HNrfxkp3p6cq4Uk2sQN5SsRt1bXVkscMXvfZe3DbZ"	c6534837bbb4599b700bb60daf6ff3b019c3043b	True	False					0	1658002461		0	{}	igfooc4	False	t3_w02sjs	False	True	t3_w02sjs	/r/solana/comments/w02sjs/trying_to_get_sol_nfts_out_of_trust_wallet/igfooc4/	1658002478	1	False	True	False	solana	t5_hcs2n	r/solana	public		0	[]			anyone who wants to get rid of scam tokens and rug nfts send them to me gu6hnrfxkp3p6cq4uk2sqn5ssrt1bxvkscmxvfze3dbz	0.4225672483444214	0.6351949572563171	0.6005401015281677	0.0652790442109108	0.012646437622606754	0.08340538293123245	0.20012860000133514	0.0007715965039096773	0.27175790071487427	0.00015317164070438594
483	[]	False		Pkickel92			[]				text	t2_1761kz	False	False	Having certain applications affected by proof of history is one of the reasons there is criticism. That's the point  trying to make. Everything that has popped up has been fixed but things keep popping up. The network needs to be reliable to draw users	c466c608777b121cefb176ae8cfaad7d8e484917	True	False					0	1658002089		0	{}	igfntt1	False	t3_w04wow	False	True	t1_igfn4q5	/r/solana/comments/w04wow/why_is_sol_criticized_so_heavy_for_not_being_as/igfntt1/	1658002099	1	False	True	False	solana	t5_hcs2n	r/solana	public		0	[]			having certain applications affected by proof of history is one of the reasons there is criticism that s the point trying to make everything that has popped up has been fixed but things keep popping up the network needs to be reliable to draw users	0.0028113946318626404	0.9898161888122559	0.7877374887466431	0.012362341396510601	0.38887879252433777	0.43902477622032166	0.088474340736866	8.39186213852372e-07	0.21709810197353363	0.00546948192641139
