Unnamed: 0	all_awardings	archived	associated_award	author	author_flair_background_color	author_flair_css_class	author_flair_richtext	author_flair_template_id	author_flair_text	author_flair_text_color	author_flair_type	author_fullname	author_patreon_flair	author_premium	body	body_sha1	can_gild	collapsed	collapsed_because_crowd_control	collapsed_reason	collapsed_reason_code	comment_type	controversiality	created_utc	distinguished	gilded	gildings	id	is_submitter	link_id	locked	no_follow	parent_id	permalink	retrieved_utc	score	score_hidden	send_replies	stickied	subreddit	subreddit_id	subreddit_name_prefixed	subreddit_type	top_awarded_type	total_awards_received	treatment_tags	unrepliable_reason	corpus	support	knowledge	conflict	power	similarity	fun	status	trust	identity	romance
122	[]	False		Userid77			[]				text	t2_c5z5lptl	False	False	Buy an ASIC and mine it	55d15b5ff26431c93b41983c0866c7585c16391c	True	False					0	1664507211		0	{}	iqgcvwv	False	t3_xrmvvo	False	True	t3_xrmvvo	/r/Bitcoin/comments/xrmvvo/it_feels_like_bitcoin_is_an_an_accumulation_stage/iqgcvwv/	1664507226	1	True	True	False	Bitcoin	t5_2s3qj	r/Bitcoin	public		0	[]		buy an asic and mine it	0.35454151034355164	0.6278534531593323	0.3543504774570465	0.6005392074584961	0.3871462643146515	0.47493845224380493	0.37188461422920227	0.5894006490707397	0.45788896083831787	0.22269606590270996
123	[]	False		Serenityprayer69		noob	[{'e': 'text', 't': 'redditor for 3 months'}]	2ec8e69e-6c36-11e9-a04b-0afb553d4ea6	redditor for 3 months	dark	richtext	t2_odi4lc6n	False	False	Printing money isn't meant to fight inflation it causes it. Raising interest rates fights inflation. I'm not even going to address the second statement.. When the world switches to alternative energy Bitcoin mining will be environmentally friendly. Perhaps that's what needs addressing. Until then even an electric car is using electricity generated at a coal plant	d747af26201d6688771da076d26c79d7ed50e173	True	False					0	1664507192		0	{}	iqgcuj0	False	t3_xrpg92	False	True	t3_xrpg92	/r/Bitcoin/comments/xrpg92/the_world_needs_bitcoin_as_a_universal_legal/iqgcuj0/	1664507211	1	True	True	False	Bitcoin	t5_2s3qj	r/Bitcoin	public		0	[]		printing money isn t meant to fight inflation it causes it raising interest rates fights inflation i m not even going to address the second statement when the world switches to alternative energy bitcoin mining will be environmentally friendly perhaps that s what needs addressing until then even an electric car is using electricity generated at a coal plant	0.002579855965450406	0.987815260887146	0.37683331966400146	0.024050552397966385	0.009000425226986408	0.38605472445487976	0.09124051779508591	8.572397973694024e-07	0.35043472051620483	0.005434314254671335
124	[]	False		jlbslqqs			[]				text	t2_ea38wzh1	False	False	I don't know but yeah I want to know that simple shit.	cc7d0b2a18054de9a19351d6e8ed92de1102ecaa	True	False					0	1664507159		0	{}	iqgcs4e	False	t3_xr3ipd	False	True	t1_iqcqscw	/r/Bitcoin/comments/xr3ipd/in_2021_bank_of_england_warned_that_bitcoin_could/iqgcs4e/	1664507171	1	True	True	False	Bitcoin	t5_2s3qj	r/Bitcoin	public		0	[]		i don t know but yeah i want to know that simple shit 	0.3669566214084625	0.16952663660049438	0.2329222708940506	0.027992213144898415	0.3609064519405365	0.6789997220039368	0.4848165512084961	0.06605180352926254	0.3457891345024109	0.0022017089650034904
125	[]	False		ejjVAL			[]				text	t2_g1r4qmtm	False	False	It’s science!	28689fe3873dd4763cccca1b7a2306df2b8b0042	True	False					0	1664507097		0	{}	iqgcngd	False	t3_xqyxxs	False	True	t1_iqgcle6	/r/Bitcoin/comments/xqyxxs/daily_discussion_september_29_2022/iqgcngd/	1664507110	1	True	True	False	Bitcoin	t5_2s3qj	r/Bitcoin	public		0	[]		it s science 	0.474287748336792	0.5431505441665649	0.45069438219070435	0.5316464900970459	0.48773708939552307	0.6081918478012085	0.4473547339439392	0.4967622756958008	0.5002122521400452	0.25329849123954773
126	[]	False		CrypoFiend			[]			dark	text	t2_e7z7annz	False	False	How about Bitcoin vs Facebook	cdcf050eeb30225871528ab048cbb8d0f1e005a9	True	False					0	1664507093		0	{}	iqgcn5j	False	t3_xrfqxh	False	True	t1_iqfnbof	/r/Bitcoin/comments/xrfqxh/technology_university_of_new_mexico_researchers/iqgcn5j/	1664507110	1	True	True	False	Bitcoin	t5_2s3qj	r/Bitcoin	public		0	[]		how about bitcoin vs facebook	0.4687095880508423	0.5321009159088135	0.4859980344772339	0.4569986164569855	0.4746365249156952	0.6458026170730591	0.4427292048931122	0.5006964206695557	0.4479040503501892	0.16231849789619446
127	[]	False		Stocksugardaddy			[]			dark	text	t2_jt5eqqsv	False	False	That's why	f6be500f45d01345f3eae5f5ac353d32da79fb0b	True	False					0	1664507051		0	{}	iqgck49	False	t3_xrfqxh	False	True	t1_iqf43kw	/r/Bitcoin/comments/xrfqxh/technology_university_of_new_mexico_researchers/iqgck49/	1664507065	1	True	True	False	Bitcoin	t5_2s3qj	r/Bitcoin	public		0	[]		that s why	0.47937509417533875	0.49947839975357056	0.5278778076171875	0.5281610488891602	0.5076225399971008	0.588287889957428	0.4265771508216858	0.46703144907951355	0.5042847990989685	0.3334483504295349
128	[]	False		NeitherOpportunity17			[]				text	t2_8j0x02hu	False	False	"I use Shakepay they give you 2% back of whatever you spend. So like you pay for gas, a snack, grocery’s whatever you get 2 % back in btc so I think that’s pretty neat. I use it. 

Sign up with my link, it’s in my bio and we'll each get $30 to buy crypto. Promo is over end of September"	05535ff63db96a95409ca209768f4455f1f6302b	True	False					0	1664507038		0	{}	iqgcj6y	False	t3_xrmvvo	False	True	t3_xrmvvo	/r/Bitcoin/comments/xrmvvo/it_feels_like_bitcoin_is_an_an_accumulation_stage/iqgcj6y/	1664507050	1	True	True	False	Bitcoin	t5_2s3qj	r/Bitcoin	public		0	[]		i use shakepay they give you 2 back of whatever you spend so like you pay for gas a snack grocery s whatever you get 2 back in btc so i think that s pretty neat i use it sign up with my link it s in my bio and we ll each get 30 to buy crypto promo is over end of september	0.008813583292067051	0.9878450036048889	0.007418499793857336	0.022690685465931892	0.007882134057581425	0.9933551549911499	0.08012307435274124	8.585439559283259e-07	0.20069998502731323	0.011288563720881939
129	[]	False		ejjVAL			[]				text	t2_g1r4qmtm	False	False	Ironic	7c460439b3282a76862128d012c2b49c826bf865	True	False					0	1664507024		0	{}	iqgci75	False	t3_xqyxxs	False	True	t1_iqgc18q	/r/Bitcoin/comments/xqyxxs/daily_discussion_september_29_2022/iqgci75/	1664507042	1	True	True	False	Bitcoin	t5_2s3qj	r/Bitcoin	public		0	[]		ironic	0.4775392413139343	0.47987622022628784	0.5616970062255859	0.47738808393478394	0.5020854473114014	0.5898932218551636	0.48801642656326294	0.48128440976142883	0.4992341101169586	0.4603731334209442
130	[]	False		CrypoFiend			[]			dark	text	t2_e7z7annz	False	False	Elizabeth Warren	fbb8c9151acb8d09714c9c6144e2b3433dd1a9af	True	False					0	1664507021		0	{}	iqgci00	False	t3_xrfqxh	False	True	t1_iqf43kw	/r/Bitcoin/comments/xrfqxh/technology_university_of_new_mexico_researchers/iqgci00/	1664507035	1	True	True	False	Bitcoin	t5_2s3qj	r/Bitcoin	public		0	[]		elizabeth warren	0.4799075722694397	0.442826509475708	0.4874040484428406	0.4682464003562927	0.4674983322620392	0.5297769904136658	0.5103892683982849	0.47417280077934265	0.48549017310142517	0.833042323589325
131	[]	False		Aishamar			[]				text	t2_dkqnjlja	False	False	Absolutely. The whole world will feel the big hit when it goes up. Though they might be little bit silent for now because we are in Bear market.	9fb8e852d4e1a7b0db0d04da47a4b4eea32e3cfa	True	False					0	1664506967		0	{}	iqgce1k	False	t3_xr3ipd	False	True	t1_iqgc2e2	/r/Bitcoin/comments/xr3ipd/in_2021_bank_of_england_warned_that_bitcoin_could/iqgce1k/	1664506979	1	True	True	False	Bitcoin	t5_2s3qj	r/Bitcoin	public		0	[]		absolutely the whole world will feel the big hit when it goes up though they might be little bit silent for now because we are in bear market 	0.19354918599128723	0.8941097855567932	0.5959000587463379	0.01075684279203415	0.7210522294044495	0.4543217718601227	0.08366193622350693	3.5699329146154923e-06	0.2651483118534088	0.0053223539143800735
132	[]	False		dinosaurasteroid		noob	[{'e': 'text', 't': 'redditor for 1 week'}]	2ec8e69e-6c36-11e9-a04b-0afb553d4ea6	redditor for 1 week	dark	richtext	t2_sjc53aup	False	False	Thomas the Tank?	80b4c74a2e82689e6235b30890e10d7ccf9d107d	True	False					0	1664506930		0	{}	iqgcbdn	False	t3_xrdven	False	True	t1_iqfm2jr	/r/Bitcoin/comments/xrdven/pound_imploding_uk_bitcoin_volume_exploding/iqgcbdn/	1664506940	1	True	True	False	Bitcoin	t5_2s3qj	r/Bitcoin	public		0	[]		thomas the tank 	0.4573065936565399	0.4718112647533417	0.4504658877849579	0.48414191603660583	0.4758002758026123	0.5776652693748474	0.43519526720046997	0.47551611065864563	0.4745141267776489	0.3862069845199585
133	[]	False		8bitb4rt			[]				text	t2_nu02ybm0	False	False	This person sounds like they may be poor in the future.	166a3e83b0ef612eb774450d310628ec3e95ec99	True	False					0	1664506928		0	{}	iqgcb8e	False	t3_xrpg92	False	True	t1_iqg9xus	/r/Bitcoin/comments/xrpg92/the_world_needs_bitcoin_as_a_universal_legal/iqgcb8e/	1664506940	1	True	True	False	Bitcoin	t5_2s3qj	r/Bitcoin	public		0	[]		this person sounds like they may be poor in the future 	0.4557299315929413	0.5549228191375732	0.5341271758079529	0.11642736196517944	0.5511236786842346	0.28042349219322205	0.2644081115722656	0.33894240856170654	0.4827570617198944	0.028432181105017662
134	[]	False		Numerous_Fee_3770			[]				text	t2_93dh7v64	False	False	In India there's a company called Gosats that provide a card you can fill with fiat. For every fiat transaction with the card, you get some Sats. You get very few sats per transaction, but it's very satisfying to know you're collecting sats EVERYDAY. See if there's a similar service in your country.	cf01fb650cc2625c46809957facb83f9aa8f0546	True	False					0	1664506908		0	{}	iqgc9tc	False	t3_xrmvvo	False	True	t3_xrmvvo	/r/Bitcoin/comments/xrmvvo/it_feels_like_bitcoin_is_an_an_accumulation_stage/iqgc9tc/	1664506925	1	True	True	False	Bitcoin	t5_2s3qj	r/Bitcoin	public		0	[]		in india there s a company called gosats that provide a card you can fill with fiat for every fiat transaction with the card you get some sats you get very few sats per transaction but it s very satisfying to know you re collecting sats everyday see if there s a similar service in your country 	0.002735752612352371	0.9893786311149597	0.002558528445661068	0.015639061108231544	0.008218717761337757	0.36369097232818604	0.08347095549106598	8.537934945707093e-07	0.32745328545570374	0.00527816079556942
135	[]	False		dinosaurasteroid		noob	[{'e': 'text', 't': 'redditor for 1 week'}]	2ec8e69e-6c36-11e9-a04b-0afb553d4ea6	redditor for 1 week	dark	richtext	t2_sjc53aup	False	False	"Lol. Well said.

I even read ""Happy Coke Day"" because I was laughing so hard."	7a6cada869bf7a9667bbeba32721e5aa53a2e642	True	False					0	1664506874		0	{}	iqgc7gx	False	t3_xrdven	False	True	t1_iqe9piw	/r/Bitcoin/comments/xrdven/pound_imploding_uk_bitcoin_volume_exploding/iqgc7gx/	1664506887	1	True	True	False	Bitcoin	t5_2s3qj	r/Bitcoin	public		0	[]		lol well said i even read happy coke day because i was laughing so hard 	0.41580358147621155	0.14382672309875488	0.2168353646993637	0.010341315530240536	0.5147201418876648	0.9904725551605225	0.7727531790733337	0.6717761158943176	0.3102297782897949	0.004999963566660881
136	[]	False		DrDMoney			[]				text	t2_dksyo	False	False	The ending was cliche garbage, imo. Still one of my favorite shows.	843442dc6ef4563601c3cdf2bcbde61775e1b5de	True	False					0	1664506869		0	{}	iqgc71h	False	t3_xr4uw6	False	True	t1_iqfu90t	/r/Bitcoin/comments/xr4uw6/exclusive_footage_of_what_is_going_on_inside/iqgc71h/	1664506888	1	True	True	False	Bitcoin	t5_2s3qj	r/Bitcoin	public		0	[]		the ending was cliche garbage imo still one of my favorite shows 	0.1261170357465744	0.3500804305076599	0.808569073677063	0.05264170467853546	0.4707244038581848	0.7287610173225403	0.2642360031604767	5.4191757953958586e-05	0.37205466628074646	0.048980407416820526
137	[]	False		ew8aaa			[]				text	t2_mu6459ei	False	False	It will go up and yeah I am talking about BTC right now.	ea9b763d21089da42dc3df53250375f2c1a5666b	True	False					0	1664506806		0	{}	iqgc2e2	False	t3_xr3ipd	False	True	t1_iqclc44	/r/Bitcoin/comments/xr3ipd/in_2021_bank_of_england_warned_that_bitcoin_could/iqgc2e2/	1664506825	1	True	True	False	Bitcoin	t5_2s3qj	r/Bitcoin	public		0	[]		it will go up and yeah i am talking about btc right now 	0.6012301445007324	0.32074102759361267	0.6808325052261353	0.29660850763320923	0.4729689657688141	0.47355520725250244	0.23742416501045227	0.6235963702201843	0.3250417411327362	0.008085507899522781
138	[]	False		Eddybitcoin			[]				text	t2_48x0k8vr	False	False	"This foolio said ""our children's future"". Lmao they have no future after this Biden Administration. They will be slaves for life."	e4fcfb6a308cee42f866199d6aeee75a8f0e68e8	True	False					0	1664506783		0	{}	iqgc0mr	False	t3_xrg6u6	False	True	t3_xrg6u6	/r/Bitcoin/comments/xrg6u6/between_2016_and_2021_the_carbon_emissions/iqgc0mr/	1664506802	1	True	True	False	Bitcoin	t5_2s3qj	r/Bitcoin	public		0	[]		this foolio said our children s future lmao they have no future after this biden administration they will be slaves for life 	0.2754534184932709	0.5560392141342163	0.776046872138977	0.08157021552324295	0.43163737654685974	0.2373529076576233	0.20883779227733612	0.0003159560728818178	0.3782455027103424	0.005858324468135834
139	[]	False		dinosaurasteroid		noob	[{'e': 'text', 't': 'redditor for 1 week'}]	2ec8e69e-6c36-11e9-a04b-0afb553d4ea6	redditor for 1 week	dark	richtext	t2_sjc53aup	False	False	"EURUSD 0.5 here we come!!!
GBPUSD 0.7 here we come!!!"	1f8c8c56697f48c49e24272a35e569ff6aaf5dd0	True	False					0	1664506775		0	{}	iqgc01m	False	t3_xrdven	False	True	t1_iqeqyow	/r/Bitcoin/comments/xrdven/pound_imploding_uk_bitcoin_volume_exploding/iqgc01m/	1664506786	1	True	True	False	Bitcoin	t5_2s3qj	r/Bitcoin	public		0	[]		eurusd 0 5 here we come gbpusd 0 7 here we come 	0.44175347685813904	0.4142830967903137	0.39879849553108215	0.48342370986938477	0.5279932022094727	0.7850408554077148	0.5866209864616394	9.442181863050791e-07	0.2852611839771271	0.009102469310164452
140	[]	False		brotherRozo			[]				text	t2_4kj6x6f6	False	False	He’s named a few price targets before and it’s lead me to believe that he never reveals the actual target, and just sets targets that way any manipulators will try to get him liquidated, but end up just giving him a good discount instead	b82fd49b6b088dd93782b7cf8d995e309ca021d2	True	False					0	1664506767		0	{}	iqgbzhb	False	t3_xrmipv	False	True	t1_iqg9dp4	/r/Bitcoin/comments/xrmipv/a_friend_is_decided_that_bitcoin_will_drop_to_500/iqgbzhb/	1664506779	1	True	True	False	Bitcoin	t5_2s3qj	r/Bitcoin	public		0	[]		he s named a few price targets before and it s lead me to believe that he never reveals the actual target and just sets targets that way any manipulators will try to get him liquidated but end up just giving him a good discount instead	0.003301105694845319	0.9878227710723877	0.8240762948989868	0.018885143101215363	0.9903092980384827	0.466319739818573	0.06310161203145981	8.425213877671922e-07	0.1557605266571045	0.030294163152575493
141	[]	False		Ok_Aerie3546			[]				text	t2_809nb64s	False	True	Yayyy!!!! More paper bitcoin!!! /s	f843d47d56cf37e4cec58cc71ff4c0c36bf2f71a	True	False					0	1664506755		0	{}	iqgbyiy	False	t3_xrq7ft	False	True	t3_xrq7ft	/r/Bitcoin/comments/xrq7ft/regulation_to_allow_bitcoin_in_401k_plans_incoming/iqgbyiy/	1664506771	1	True	True	False	Bitcoin	t5_2s3qj	r/Bitcoin	public		0	[]		yayyy more paper bitcoin s	0.42180299758911133	0.5809327363967896	0.33576393127441406	0.4831477403640747	0.39592695236206055	0.31607916951179504	0.5361697673797607	0.4596606194972992	0.45655348896980286	0.18945397436618805
142	[]	False		DudeIncogneto			[]			dark	text	t2_9p6akwkr	False	False	"This is by no means a comprehensive guide but a good place to start understanding lightning with some suggestions for wallets, nodes etc. 

https://bitcoiner.guide/lightning/"	4fff6519a92002099421fe6993b2d5f970ebffd1	True	False					0	1664506739		0	{}	iqgbxc3	False	t3_xr9rmq	False	True	t1_iqg8jir	/r/Bitcoin/comments/xr9rmq/4900_btc_the_relentless_growth_across_the_entire/iqgbxc3/	1664506757	1	True	True	False	Bitcoin	t5_2s3qj	r/Bitcoin	public		0	[]		this is by no means a comprehensive guide but a good place to start understanding lightning with some suggestions for wallets nodes etc https bitcoiner guide lightning 	0.5824877619743347	0.9758648872375488	0.06554453074932098	0.1256282776594162	0.1683415323495865	0.32387688755989075	0.21364380419254303	8.492588676745072e-07	0.36515599489212036	0.002080316189676523
143	[]	False		formal-explorer-2718			[]			dark	text	t2_cggmkb5f	False	False	"&gt; they swapped their currency to USD

Did they swap to physical cash or interest-bearing USD deposits?

&gt; primarily it is to weather the economic storms

Yeah, at short timescales the interest isn't that important. Forgoing interest by investing in USD banknotes (or non-interest-bearing USD in checking accounts, Venmo, etc.) still usually isn't a good idea though."	57d0ae1d1e9d2491da11c87e8c56ae65d4f8cc1e	True	False					0	1664506694		0	{}	iqgbtyg	False	t3_xr3ipd	False	True	t1_iqfyt3a	/r/Bitcoin/comments/xr3ipd/in_2021_bank_of_england_warned_that_bitcoin_could/iqgbtyg/	1664506710	1	True	True	False	Bitcoin	t5_2s3qj	r/Bitcoin	public		0	[]		 gt they swapped their currency to usd did they swap to physical cash or interest bearing usd deposits gt primarily it is to weather the economic storms yeah at short timescales the interest isn t that important forgoing interest by investing in usd banknotes or non interest bearing usd in checking accounts venmo etc still usually isn t a good idea though 	0.002579513704404235	0.9882789850234985	0.12090400606393814	0.013738250359892845	0.008477071300148964	0.6362654566764832	0.10967927426099777	8.409752467741782e-07	0.45512741804122925	0.004833344370126724
144	[]	False		crucelee			[]				text	t2_ob919	False	False	Yes however i think the uk won't be allowed to do that	0db1d8b60958650f0fadcde47debdc049e2b6280	True	False					0	1664506682		0	{}	iqgbt1u	False	t3_xrdven	False	True	t1_iqfmhw5	/r/Bitcoin/comments/xrdven/pound_imploding_uk_bitcoin_volume_exploding/iqgbt1u/	1664506702	1	True	True	False	Bitcoin	t5_2s3qj	r/Bitcoin	public		0	[]		yes however i think the uk won t be allowed to do that	0.20175708830356598	0.5419716835021973	0.22197294235229492	0.11399234086275101	0.4076090157032013	0.53756183385849	0.28673529624938965	0.027805211022496223	0.41879570484161377	0.004661207552999258
145	[]	False		[deleted]						dark					[removed]	fe993932d6dced4c0a879e9aa5d7a6e0fbb467f5	True	False					0	1664506668		0	{}	iqgbs1h	False	t3_xrmvvo	False	True	t3_xrmvvo	/r/Bitcoin/comments/xrmvvo/it_feels_like_bitcoin_is_an_an_accumulation_stage/iqgbs1h/	1664506686	1	True	True	False	Bitcoin	t5_2s3qj	r/Bitcoin	public		0	[]		 removed 	0.46707504987716675	0.5148742198944092	0.5170193910598755	0.5029740929603577	0.4936113953590393	0.5123135447502136	0.45383262634277344	0.4847692549228668	0.4981911778450012	0.5145108103752136
146	[]	False		emanresubmud		noob	[{'e': 'text', 't': 'redditor for 4 days'}]	2ec8e69e-6c36-11e9-a04b-0afb553d4ea6	redditor for 4 days	dark	richtext	t2_ss5diiom	False	False	Rewards cards like Fold or BlockFi	16f5a527e1dbb356019c7f3b0c5a47476626e9db	True	False					0	1664506659		0	{}	iqgbrc4	False	t3_xrmvvo	False	True	t3_xrmvvo	/r/Bitcoin/comments/xrmvvo/it_feels_like_bitcoin_is_an_an_accumulation_stage/iqgbrc4/	1664506670	1	True	True	False	Bitcoin	t5_2s3qj	r/Bitcoin	public		0	[]		rewards cards like fold or blockfi	0.4692132771015167	0.5095955729484558	0.26938754320144653	0.30547645688056946	0.43789979815483093	0.18052805960178375	0.43677759170532227	0.4221072494983673	0.4772070050239563	0.017912529408931732
147	[]	False		ndreamer			[]				text	t2_65ivi	False	False	USD certainly helped, it's up massively on all majors.	b70a8c2411c56fe0144f4d6f2b807f58fb9064b1	True	False					0	1664506545		0	{}	iqgbj3d	False	t3_xrdven	False	True	t1_iqg5iwz	/r/Bitcoin/comments/xrdven/pound_imploding_uk_bitcoin_volume_exploding/iqgbj3d/	1664506562	1	True	True	False	Bitcoin	t5_2s3qj	r/Bitcoin	public		0	[]		usd certainly helped it s up massively on all majors 	0.4730176329612732	0.6309819221496582	0.30466917157173157	0.520491361618042	0.5418052673339844	0.5649394392967224	0.40121427178382874	0.47565510869026184	0.3911076784133911	0.004522951785475016
148	[]	False		DudeIncogneto			[]			dark	text	t2_9p6akwkr	False	False	Lots of work to be done to try and convince operators to use their off gas for bitcoin mining. If the ones who do it are profitable we will obviously see more and more operators taking the plunge	f926d7a075ddbe7c059bef0dc33156415807629a	True	False					0	1664506538		0	{}	iqgbijw	False	t3_xrn5s4	False	True	t3_xrn5s4	/r/Bitcoin/comments/xrn5s4/research_shows_oil_field_flaring_emits_nearly/iqgbijw/	1664506555	1	True	True	False	Bitcoin	t5_2s3qj	r/Bitcoin	public		0	[]		lots of work to be done to try and convince operators to use their off gas for bitcoin mining if the ones who do it are profitable we will obviously see more and more operators taking the plunge	0.28676941990852356	0.9848266839981079	0.08012599498033524	0.9209073781967163	0.009102869778871536	0.38887089490890503	0.09357811510562897	8.590828315391263e-07	0.23203204572200775	0.006378089543431997
149	[]	False		ChevalBlanc			[]				text	t2_13xstv	False	False	Get your salary paid in bitcoin. You won't need to buy it.	3d78e1d920df383b08077ca8aad8ff5511416bcf	True	False					0	1664506532		0	{}	iqgbi4h	False	t3_xrmvvo	False	True	t3_xrmvvo	/r/Bitcoin/comments/xrmvvo/it_feels_like_bitcoin_is_an_an_accumulation_stage/iqgbi4h/	1664506547	1	True	True	False	Bitcoin	t5_2s3qj	r/Bitcoin	public		0	[]		get your salary paid in bitcoin you won t need to buy it 	0.4327562749385834	0.6123618483543396	0.314298152923584	0.7797362804412842	0.14367550611495972	0.5016627311706543	0.21230167150497437	0.8368643522262573	0.318659245967865	0.02396240457892418
150	[]	False		emanresubmud		noob	[{'e': 'text', 't': 'redditor for 4 days'}]	2ec8e69e-6c36-11e9-a04b-0afb553d4ea6	redditor for 4 days	dark	richtext	t2_ss5diiom	False	False	Good. More energy for ASICs	20035b3a143e387c8d94e034a61b581f32a9fd69	True	False					0	1664506502		0	{}	iqgbg1n	False	t3_xrn5s4	False	True	t3_xrn5s4	/r/Bitcoin/comments/xrn5s4/research_shows_oil_field_flaring_emits_nearly/iqgbg1n/	1664506519	1	True	True	False	Bitcoin	t5_2s3qj	r/Bitcoin	public		0	[]		good more energy for asics	0.5699015855789185	0.5443472862243652	0.25387707352638245	0.50864577293396	0.4663197994232178	0.4629714787006378	0.6058979630470276	0.6227981448173523	0.41724711656570435	0.14433355629444122
151	[]	False		Kekeven101			[]				text	t2_gbjkom6u	False	False	Scam	de94a346155c907233fc3ed52ffb0edcbfe98a74	True	False					0	1664506463		0	{}	iqgbd6x	False	t3_xr1vhe	False	True	t3_xr1vhe	/r/Bitcoin/comments/xr1vhe/big_news_on_social_media_today/iqgbd6x/	1664506480	1	True	True	False	Bitcoin	t5_2s3qj	r/Bitcoin	public		0	[]		scam	0.46788135170936584	0.5160990953445435	0.5559200644493103	0.5118333101272583	0.4812588691711426	0.45101407170295715	0.47815030813217163	0.49142447113990784	0.46448954939842224	0.47094351053237915
152	[]	False		reggie_crypto			[]				text	t2_8t1g7etd	False	False	It does transfer wealth from the impatient to the patient... And much of it is held in many countries, including Russia.	495afd2d436f6a58079b7e6dd4dbdda4c0b01a3e	True	False					0	1664506434		0	{}	iqgbb3x	False	t3_xrpg92	False	True	t1_iqg9xus	/r/Bitcoin/comments/xrpg92/the_world_needs_bitcoin_as_a_universal_legal/iqgbb3x/	1664506449	1	True	True	False	Bitcoin	t5_2s3qj	r/Bitcoin	public		0	[]		it does transfer wealth from the impatient to the patient and much of it is held in many countries including russia 	0.15045364201068878	0.9257521033287048	0.446481853723526	0.44498491287231445	0.2943010926246643	0.27090317010879517	0.12313684821128845	8.909497637432651e-07	0.5346684455871582	0.002867704024538398
153	[]	False		Socialists-Suck			[]				text	t2_dsqbomjs	False	False	The paper from these academics is very similar to the one the White House commisioned earlier this year.  The same flawed arguments and assumptions.  [Nic Carter‘s rebuttal blows up all the same arguments.](https://medium.com/@nic__carter/comments-on-the-white-house-report-on-the-climate-implications-of-crypto-mining-8d65d30ec942)	056ac5971d31a6f79f5cab02be67820acaab0c61	True	False					0	1664506392		0	{}	iqgb845	False	t3_xrhiop	False	True	t1_iqfev8o	/r/Bitcoin/comments/xrhiop/i_dont_understand_how_normies_uncritically_eat_up/iqgb845/	1664506409	1	True	True	False	Bitcoin	t5_2s3qj	r/Bitcoin	public		0	[]		the paper from these academics is very similar to the one the white house commisioned earlier this year the same flawed arguments and assumptions nic carter s rebuttal blows up all the same arguments https medium com nic carter comments on the white house report on the climate implications of crypto mining 8d65d30ec942 	0.0007085637771524489	0.9951589703559875	0.8173234462738037	0.025246361270546913	0.9967018961906433	0.03379148989915848	0.17755720019340515	8.510531301908486e-07	0.4053158164024353	3.731373726623133e-05
