117	[]	False	levelsnpatterns		[]		text	t2_qnto5zcj	False	False	False	[]	False	False	1659227071	youtube.com	https://www.reddit.com/r/Bitcoin/comments/wcbky1/dlf_share_latest_analysis_targets_dlf_share_news/	{}	wcbky1	False	False	False	False	False	False	False	False		[]	dark	text	False	False	True	0	0	False	all_ads	/r/Bitcoin/comments/wcbky1/dlf_share_latest_analysis_targets_dlf_share_news/	False	6	reddit	1659227082	1		True	False	False	Bitcoin	t5_2s3qj	4442274	public	https://b.thumbs.redditmedia.com/2b_zGkTMTHd70kQpqybBfPdhGwzWPUw1PgNx4ZISIdA.jpg	DLF Share Latest Analysis &amp; Targets | DLF Share News &amp; Trading Strategy ...	0	[]	1.0	https://youtube.com/watch?v=OfhlaIx_eeM&amp;feature=share	all_ads	6	rich:video	{'enabled': False, 'images': [{'id': 'E6grkoje9wjnWb3FW2w-4XZXYSYQ3GBKYsxZGZAO1V4', 'resolutions': [{'height': 81, 'url': 'https://external-preview.redd.it/J7J750py7fhSywD-5dqoFySWNHtZf3-UgX76xpJGDBI.jpg?width=108&amp;crop=smart&amp;auto=webp&amp;s=d60d7558219f8c3b163c3e07e91930e9123c04bb', 'width': 108}, {'height': 162, 'url': 'https://external-preview.redd.it/J7J750py7fhSywD-5dqoFySWNHtZf3-UgX76xpJGDBI.jpg?width=216&amp;crop=smart&amp;auto=webp&amp;s=bcd4ccd639fd3c6d679ef4bc1a4a59c20f98e3c9', 'width': 216}, {'height': 240, 'url': 'https://external-preview.redd.it/J7J750py7fhSywD-5dqoFySWNHtZf3-UgX76xpJGDBI.jpg?width=320&amp;crop=smart&amp;auto=webp&amp;s=0afce59b459d8e95379bb26fb3e93438ebfaab7c', 'width': 320}], 'source': {'height': 360, 'url': 'https://external-preview.redd.it/J7J750py7fhSywD-5dqoFySWNHtZf3-UgX76xpJGDBI.jpg?auto=webp&amp;s=b0a8a8bc9bddc50f70897f23a8ee479bade3234a', 'width': 480}, 'variants': {}}]}	105.0	140.0	https://youtube.com/watch?v=OfhlaIx_eeM&amp;feature=share						"{'oembed': {'author_name': 'Trading Levels &amp; Patterns', 'author_url': 'https://www.youtube.com/channel/UCZRh2YMrBdjEi1VX_H3DyoQ', 'height': 200, 'html': '&lt;iframe width=""356"" height=""200"" src=""https://www.youtube.com/embed/OfhlaIx_eeM?feature=oembed&amp;enablejsapi=1"" frameborder=""0"" allow=""accelerometer; autoplay; clipboard-write; encrypted-media; gyroscope; picture-in-picture"" allowfullscreen title=""DLF Share Latest Analysis &amp; Targets | DLF Share News &amp; Trading Strategy  | #shorts #dlf #dlfshare""&gt;&lt;/iframe&gt;', 'provider_name': 'YouTube', 'provider_url': 'https://www.youtube.com/', 'thumbnail_height': 360, 'thumbnail_url': 'https://i.ytimg.com/vi/OfhlaIx_eeM/hqdefault.jpg', 'thumbnail_width': 480, 'title': 'DLF Share Latest Analysis &amp; Targets | DLF Share News &amp; Trading Strategy  | #shorts #dlf #dlfshare', 'type': 'video', 'version': '1.0', 'width': 356}, 'type': 'youtube.com'}"	"{'content': '&lt;iframe width=""356"" height=""200"" src=""https://www.youtube.com/embed/OfhlaIx_eeM?feature=oembed&amp;enablejsapi=1"" frameborder=""0"" allow=""accelerometer; autoplay; clipboard-write; encrypted-media; gyroscope; picture-in-picture"" allowfullscreen title=""DLF Share Latest Analysis &amp; Targets | DLF Share News &amp; Trading Strategy  | #shorts #dlf #dlfshare""&gt;&lt;/iframe&gt;', 'height': 200, 'scrolling': False, 'width': 356}"	"{'oembed': {'author_name': 'Trading Levels &amp; Patterns', 'author_url': 'https://www.youtube.com/channel/UCZRh2YMrBdjEi1VX_H3DyoQ', 'height': 200, 'html': '&lt;iframe width=""356"" height=""200"" src=""https://www.youtube.com/embed/OfhlaIx_eeM?feature=oembed&amp;enablejsapi=1"" frameborder=""0"" allow=""accelerometer; autoplay; clipboard-write; encrypted-media; gyroscope; picture-in-picture"" allowfullscreen title=""DLF Share Latest Analysis &amp; Targets | DLF Share News &amp; Trading Strategy  | #shorts #dlf #dlfshare""&gt;&lt;/iframe&gt;', 'provider_name': 'YouTube', 'provider_url': 'https://www.youtube.com/', 'thumbnail_height': 360, 'thumbnail_url': 'https://i.ytimg.com/vi/OfhlaIx_eeM/hqdefault.jpg', 'thumbnail_width': 480, 'title': 'DLF Share Latest Analysis &amp; Targets | DLF Share News &amp; Trading Strategy  | #shorts #dlf #dlfshare', 'type': 'video', 'version': '1.0', 'width': 356}, 'type': 'youtube.com'}"	"{'content': '&lt;iframe width=""356"" height=""200"" src=""https://www.youtube.com/embed/OfhlaIx_eeM?feature=oembed&amp;enablejsapi=1"" frameborder=""0"" allow=""accelerometer; autoplay; clipboard-write; encrypted-media; gyroscope; picture-in-picture"" allowfullscreen title=""DLF Share Latest Analysis &amp; Targets | DLF Share News &amp; Trading Strategy  | #shorts #dlf #dlfshare""&gt;&lt;/iframe&gt;', 'height': 200, 'media_domain_url': 'https://www.redditmedia.com/mediaembed/wcbky1', 'scrolling': False, 'width': 356}"						"DLF Share Latest Analysis &amp; Targets | DLF Share News &amp; Trading Strategy ...
"	dlf share latest analysis amp targets dlf share news amp trading strategy nan	0.16127045452594757	0.8402386903762817	0.2706291377544403	0.7324350476264954	0.45262375473976135	0.3724275827407837	0.47036057710647583	0.7590275406837463	0.4202430248260498	0.003524836851283908
118	[]	False	MathmaticMorpheus		[]		text	t2_coyf1967	False	False	False	[]	False	False	1659226667	self.Bitcoin	https://www.reddit.com/r/Bitcoin/comments/wcbg6b/moving_bitcoin_to_hard_wallet/	{}	wcbg6b	False	True	False	False	False	True	True	False		[]	dark	text	False	False	False	0	0	False	all_ads	/r/Bitcoin/comments/wcbg6b/moving_bitcoin_to_hard_wallet/	False	6		1659226678	1	I’m trying to move my bitcoin off an exchange but I don’t have a laptop with windows or Mac OS. It’s an acer… should I just buy a new laptop? Is there a way I can take the bitcoin off exchange with just an iPhone? I have a ledger nano s plus.	True	False	False	Bitcoin	t5_2s3qj	4442262	public	self	Moving bitcoin to hard wallet	0	[]	1.0	https://www.reddit.com/r/Bitcoin/comments/wcbg6b/moving_bitcoin_to_hard_wallet/	all_ads	6																				"Moving bitcoin to hard wallet
I’m trying to move my bitcoin off an exchange but I don’t have a laptop with windows or Mac OS. It’s an acer… should I just buy a new laptop? Is there a way I can take the bitcoin off exchange with just an iPhone? I have a ledger nano s plus."	moving bitcoin to hard wallet i m trying to move my bitcoin off an exchange but i don t have a laptop with windows or mac os it s an acer should i just buy a new laptop is there a way i can take the bitcoin off exchange with just an iphone i have a ledger nano s plus 	0.0027631735429167747	0.9886493682861328	0.234234020113945	0.02359936013817787	0.008373378776013851	0.4850859045982361	0.07837394624948502	8.689906394465652e-07	0.22957926988601685	0.0070310416631400585
119	[]	False	ScientistDapper6070		[]		text	t2_c89p7zad	False	False	False	[]	False	False	1659226437	i.redd.it	https://www.reddit.com/r/Bitcoin/comments/wcbdh7/i_think_im_right_follow_for_more_tips/	{}	wcbdh7	False	True	False	False	True	True	False	False		[]	dark	text	False	False	False	0	0	False	all_ads	/r/Bitcoin/comments/wcbdh7/i_think_im_right_follow_for_more_tips/	False	6		1659226448	1		True	False	False	Bitcoin	t5_2s3qj	4442257	public	https://b.thumbs.redditmedia.com/eMlOyBLRkTjoq7xaTTAxugRcBi1DWyTxiv8yb7pBNoQ.jpg	I think I’m right…. Follow for more tips….	0	[]	1.0	https://i.redd.it/g7k22isjqse91.jpg	all_ads	6	image	{'enabled': True, 'images': [{'id': '4L5ulp2Os_vH4mQsBoH0ili-Fg-Hn_YoD7_71tq_Q78', 'resolutions': [{'height': 216, 'url': 'https://preview.redd.it/g7k22isjqse91.jpg?width=108&amp;crop=smart&amp;auto=webp&amp;s=0578edd6b097fdeaba8413cfc29430b284f3c8d2', 'width': 108}, {'height': 432, 'url': 'https://preview.redd.it/g7k22isjqse91.jpg?width=216&amp;crop=smart&amp;auto=webp&amp;s=bf6f87bdbcc154ab6897578f12165a0d74b4d44c', 'width': 216}, {'height': 640, 'url': 'https://preview.redd.it/g7k22isjqse91.jpg?width=320&amp;crop=smart&amp;auto=webp&amp;s=f7280f483d633a133a5396bd24e16dcbbe5afdd9', 'width': 320}, {'height': 1280, 'url': 'https://preview.redd.it/g7k22isjqse91.jpg?width=640&amp;crop=smart&amp;auto=webp&amp;s=7e5a52627824e26c5e6c3357e72f1fee1089a125', 'width': 640}, {'height': 1920, 'url': 'https://preview.redd.it/g7k22isjqse91.jpg?width=960&amp;crop=smart&amp;auto=webp&amp;s=422d54e5266149b934fb0a45398c28c802c12ad0', 'width': 960}, {'height': 2160, 'url': 'https://preview.redd.it/g7k22isjqse91.jpg?width=1080&amp;crop=smart&amp;auto=webp&amp;s=b20ffc4a6f7c3a0fe6b9d39de2debf78b222862d', 'width': 1080}], 'source': {'height': 2778, 'url': 'https://preview.redd.it/g7k22isjqse91.jpg?auto=webp&amp;s=cd4dc7c84619c68c1ff138ab68b10d32b88edc2e', 'width': 1284}, 'variants': {}}]}	140.0	140.0	https://i.redd.it/g7k22isjqse91.jpg															"I think I’m right…. Follow for more tips….
"	i think i m right follow for more tips nan	0.5323082208633423	0.37692469358444214	0.07985001057386398	0.17140084505081177	0.5144117474555969	0.5713514089584351	0.7245348691940308	0.864262580871582	0.32885879278182983	0.007951749488711357
120	[]	False	Awkward_Pride_5138	noob	[{'e': 'text', 't': 'redditor for 3 months'}]	redditor for 3 months	richtext	t2_n4t7p5hb	False	False	False	[]	False	False	1659225760	self.Bitcoin	https://www.reddit.com/r/Bitcoin/comments/wcb5bq/where_are_we_in_the_current_market_cycle_what_can/	{}	wcb5bq	False	True	False	False	False	True	True	False		[]	dark	text	False	False	False	0	0	False	all_ads	/r/Bitcoin/comments/wcb5bq/where_are_we_in_the_current_market_cycle_what_can/	False	6		1659225771	1	"&amp;#x200B;

https://preview.redd.it/7cpt8fudose91.png?width=1200&amp;format=png&amp;auto=webp&amp;s=c71de7c7b38a9ade6dac4ebe41442e4b46822f09"	True	False	False	Bitcoin	t5_2s3qj	4442236	public	https://b.thumbs.redditmedia.com/yokdvJntKB3Il4ZqzXe5cdE9HK-v2iCGWkg6ik8ethg.jpg	Where are we in the current Market Cycle? What can we expect in the near future?	0	[]	1.0	https://www.reddit.com/r/Bitcoin/comments/wcb5bq/where_are_we_in_the_current_market_cycle_what_can/	all_ads	6			95.0	140.0			dark	2ec8e69e-6c36-11e9-a04b-0afb553d4ea6									{'7cpt8fudose91': {'e': 'Image', 'id': '7cpt8fudose91', 'm': 'image/png', 'p': [{'u': 'https://preview.redd.it/7cpt8fudose91.png?width=108&amp;crop=smart&amp;auto=webp&amp;s=c37034b77dd520563a1a907f298c1c0a5e0e57b2', 'x': 108, 'y': 73}, {'u': 'https://preview.redd.it/7cpt8fudose91.png?width=216&amp;crop=smart&amp;auto=webp&amp;s=7b8283ce4cf7539ffc8263f9e4b45097608f8373', 'x': 216, 'y': 147}, {'u': 'https://preview.redd.it/7cpt8fudose91.png?width=320&amp;crop=smart&amp;auto=webp&amp;s=53662d1ae9ba037eb386d8a26293edc755477be0', 'x': 320, 'y': 218}, {'u': 'https://preview.redd.it/7cpt8fudose91.png?width=640&amp;crop=smart&amp;auto=webp&amp;s=5482db4b7f0edd12601f0138abf2603fb17a47ab', 'x': 640, 'y': 437}, {'u': 'https://preview.redd.it/7cpt8fudose91.png?width=960&amp;crop=smart&amp;auto=webp&amp;s=3b292ece37fcf23fdc08472a397e3714d837809e', 'x': 960, 'y': 656}, {'u': 'https://preview.redd.it/7cpt8fudose91.png?width=1080&amp;crop=smart&amp;auto=webp&amp;s=e8b7855622371b4dd74eae694d9dafd5d14458d3', 'x': 1080, 'y': 738}], 's': {'u': 'https://preview.redd.it/7cpt8fudose91.png?width=1200&amp;format=png&amp;auto=webp&amp;s=c71de7c7b38a9ade6dac4ebe41442e4b46822f09', 'x': 1200, 'y': 820}, 'status': 'valid'}}			"Where are we in the current Market Cycle? What can we expect in the near future?
&amp;#x200B;

https://preview.redd.it/7cpt8fudose91.png?width=1200&amp;format=png&amp;auto=webp&amp;s=c71de7c7b38a9ade6dac4ebe41442e4b46822f09"	where are we in the current market cycle what can we expect in the near future amp x200b https preview redd it 7cpt8fudose91 png width 1200 amp format png amp auto webp amp s c71de7c7b38a9ade6dac4ebe41442e4b46822f09	0.0019152992172166705	0.9950096607208252	0.14403124153614044	0.9595454335212708	0.8856156468391418	0.1272026151418686	0.2306504100561142	8.755865792409168e-07	0.4996614456176758	0.00010457100142957643
121	[]	False	Rod44546		[]		text	t2_9s2d68pr	False	False	False	[]	False	False	1659268291	youtube.com	https://www.reddit.com/r/Bitcoin/comments/wcmxwm/call_of_duty_warzone_plunder/	{}	wcmxwm	False	True	False	False	False	True	False	False		[]	dark	text	False	False	True	0	0	False	all_ads	/r/Bitcoin/comments/wcmxwm/call_of_duty_warzone_plunder/	False	6		1659268302	1		True	False	False	Bitcoin	t5_2s3qj	4443597	public	https://b.thumbs.redditmedia.com/HDfN5m4HAQjKHXflf0fzFSMtAOg35VZF6QOllBPrQoI.jpg	Call of Duty Warzone. Plunder	0	[]	1.0	https://youtube.com/clip/UgkxJrvvGFIykuHukGlkPcrAlH29gDs9S1x7	all_ads	6	link	{'enabled': False, 'images': [{'id': 'VtXpX02hOa2Ede1OTX9DNBUbAQLHhj8_B8HeoimQzi8', 'resolutions': [{'height': 108, 'url': 'https://external-preview.redd.it/cWbi7-pT08SOu3UUURlvAx2ubmLRFs3xHih5tj-TLZs.jpg?width=108&amp;crop=smart&amp;auto=webp&amp;s=a627a7b77a85a517c8468ea3a2c7b080f726dc7f', 'width': 108}, {'height': 216, 'url': 'https://external-preview.redd.it/cWbi7-pT08SOu3UUURlvAx2ubmLRFs3xHih5tj-TLZs.jpg?width=216&amp;crop=smart&amp;auto=webp&amp;s=094ad6a9f060255475e167b3a98c7459042875c4', 'width': 216}, {'height': 320, 'url': 'https://external-preview.redd.it/cWbi7-pT08SOu3UUURlvAx2ubmLRFs3xHih5tj-TLZs.jpg?width=320&amp;crop=smart&amp;auto=webp&amp;s=9a451f24a558654aafbddb2a68898421307d81cf', 'width': 320}, {'height': 640, 'url': 'https://external-preview.redd.it/cWbi7-pT08SOu3UUURlvAx2ubmLRFs3xHih5tj-TLZs.jpg?width=640&amp;crop=smart&amp;auto=webp&amp;s=1fd9bcb2f1fc44212df0fe10259abaeb95ddcc12', 'width': 640}, {'height': 960, 'url': 'https://external-preview.redd.it/cWbi7-pT08SOu3UUURlvAx2ubmLRFs3xHih5tj-TLZs.jpg?width=960&amp;crop=smart&amp;auto=webp&amp;s=2f38de69c227191ea6e5fe2e0121258421be9846', 'width': 960}, {'height': 1080, 'url': 'https://external-preview.redd.it/cWbi7-pT08SOu3UUURlvAx2ubmLRFs3xHih5tj-TLZs.jpg?width=1080&amp;crop=smart&amp;auto=webp&amp;s=62f904a666d31178a89d2a015a41b12686d335f7', 'width': 1080}], 'source': {'height': 1200, 'url': 'https://external-preview.redd.it/cWbi7-pT08SOu3UUURlvAx2ubmLRFs3xHih5tj-TLZs.jpg?auto=webp&amp;s=c7b059f8fd49c6466944224739f41e3a9a1ef143', 'width': 1200}, 'variants': {}}]}	140.0	140.0	https://youtube.com/clip/UgkxJrvvGFIykuHukGlkPcrAlH29gDs9S1x7		dark													"Call of Duty Warzone. Plunder
"	call of duty warzone plunder nan	0.3821966350078583	0.45134490728378296	0.6453354358673096	0.5048410296440125	0.3816744089126587	0.4434545934200287	0.4471341669559479	0.32259100675582886	0.4535769522190094	0.3270663917064667
122	[]	False	bestsloper		[]		text	t2_dtin929o	False	False	False	[]	False	False	1659266901	self.Bitcoin	https://www.reddit.com/r/Bitcoin/comments/wcmjvs/best_exchange_for_bitcolin/	{}	wcmjvs	False	True	False	False	False	True	True	False		[]	dark	text	False	False	True	0	0	False	all_ads	/r/Bitcoin/comments/wcmjvs/best_exchange_for_bitcolin/	False	6		1659266912	1	"I have always, and only used Coinbase. The fees aren't crazy, but they can be a little high sometimes. I am buying a house for me and my family, and I need to liquidate some bitcoin for the down payment. I WILL DCA back in, but for now, the best option for me is to sell some of my holdings, I will still be a full-coiner, I am not selling all.  
So, other than Coinbase, what is the best, quickest, cheapest fee exchange to sell and withdraw FIAT?   
Thanks!!"	True	False	False	Bitcoin	t5_2s3qj	4443557	public	self	best exchange for Bitcolin?	0	[]	1.0	https://www.reddit.com/r/Bitcoin/comments/wcmjvs/best_exchange_for_bitcolin/	all_ads	6							dark													"best exchange for Bitcolin?
I have always, and only used Coinbase. The fees aren't crazy, but they can be a little high sometimes. I am buying a house for me and my family, and I need to liquidate some bitcoin for the down payment. I WILL DCA back in, but for now, the best option for me is to sell some of my holdings, I will still be a full-coiner, I am not selling all.  
So, other than Coinbase, what is the best, quickest, cheapest fee exchange to sell and withdraw FIAT?   
Thanks!!"	best exchange for bitcolin i have always and only used coinbase the fees aren t crazy but they can be a little high sometimes i am buying a house for me and my family and i need to liquidate some bitcoin for the down payment i will dca back in but for now the best option for me is to sell some of my holdings i will still be a full coiner i am not selling all so other than coinbase what is the best quickest cheapest fee exchange to sell and withdraw fiat thanks 	0.0024158062878996134	0.988598108291626	0.13517141342163086	0.026828628033399582	0.008082693442702293	0.20768940448760986	0.14711374044418335	8.336909331774223e-07	0.23182469606399536	0.004748542793095112
123	[]	False	DanielWalker12		[]		text	t2_b7b15cof	False	False	False	[]	False	False	1659266821	blockworks.co	https://www.reddit.com/r/Bitcoin/comments/wcmj4h/bitcoinfocused_startup_adds_krakens_dan_held/	{}	wcmj4h	False	True	False	False	False	True	False	False		[]	dark	text	False	False	True	0	0	False	all_ads	/r/Bitcoin/comments/wcmj4h/bitcoinfocused_startup_adds_krakens_dan_held/	False	6		1659266831	1		True	False	False	Bitcoin	t5_2s3qj	4443555	public	default	Bitcoin-focused Startup Adds Kraken’s Dan Held	0	[]	1.0	https://blockworks.co/bitcoin-focused-startup-adds-krakens-dan-held/?utm	all_ads	6					https://blockworks.co/bitcoin-focused-startup-adds-krakens-dan-held/?utm															"Bitcoin-focused Startup Adds Kraken’s Dan Held
"	bitcoin focused startup adds kraken s dan held nan	0.301842600107193	0.6576728224754333	0.3022006154060364	0.4165758192539215	0.49592259526252747	0.6662221550941467	0.39384979009628296	0.6861395239830017	0.45373857021331787	0.004990242421627045
124	[]	False	Fiach_Dubh		[]		text	t2_7kh5n	False	False	True	[]	False	False	1659266796	i.redd.it	https://www.reddit.com/r/Bitcoin/comments/wcmiwy/tapsigners_are_shipping_new_kind_of_secure_cheap/	{}	wcmiwy	False	True	False	False	True	True	False	False		[]	dark	text	False	False	False	0	0	False	all_ads	/r/Bitcoin/comments/wcmiwy/tapsigners_are_shipping_new_kind_of_secure_cheap/	False	6		1659266806	1		True	False	False	Bitcoin	t5_2s3qj	4443553	public	https://b.thumbs.redditmedia.com/43c9A5ijebFZ02inj8U0RwI3c9Tz3BAj-kCDG0Argwc.jpg	Tapsigner's are Shipping. New kind of secure &amp; cheap NFC hardware wallet that pairs well with a phone wallet.	0	[]	1.0	https://i.redd.it/y2sfyxq52we91.jpg	all_ads	6	image	{'enabled': True, 'images': [{'id': 'OK0zCGbrVegLlNqU_R3Y2IUE1ZoKIysGRmQRg7M8oeY', 'resolutions': [{'height': 144, 'url': 'https://preview.redd.it/y2sfyxq52we91.jpg?width=108&amp;crop=smart&amp;auto=webp&amp;s=99eec7f8e2f2b020a92cc0d9502b0b55c6116ac1', 'width': 108}, {'height': 288, 'url': 'https://preview.redd.it/y2sfyxq52we91.jpg?width=216&amp;crop=smart&amp;auto=webp&amp;s=9c9db2884261696e36af7625c1266651870098cd', 'width': 216}, {'height': 426, 'url': 'https://preview.redd.it/y2sfyxq52we91.jpg?width=320&amp;crop=smart&amp;auto=webp&amp;s=aec422851e455f40ec0bf592d16f5c18c0b4ebca', 'width': 320}, {'height': 853, 'url': 'https://preview.redd.it/y2sfyxq52we91.jpg?width=640&amp;crop=smart&amp;auto=webp&amp;s=21cdb2ae31dabcce27eb8db9bc37c6286bacd86d', 'width': 640}], 'source': {'height': 900, 'url': 'https://preview.redd.it/y2sfyxq52we91.jpg?auto=webp&amp;s=5139b36b75f0edd9cb14dc69cc6fb263eeb5699f', 'width': 675}, 'variants': {}}]}	140.0	140.0	https://i.redd.it/y2sfyxq52we91.jpg															"Tapsigner's are Shipping. New kind of secure &amp; cheap NFC hardware wallet that pairs well with a phone wallet.
"	tapsigner s are shipping new kind of secure amp cheap nfc hardware wallet that pairs well with a phone wallet nan	0.15639792382717133	0.9291774034500122	0.05197892338037491	0.1352773904800415	0.3068705201148987	0.4393995702266693	0.2228141576051712	0.04693183675408363	0.42650067806243896	0.010761314071714878
125	[]	False	MyNameIsIgglePiggle		[]		text	t2_3h01gfzo	False	False	False	[]	False	False	1659266737	labs.openai.com	https://www.reddit.com/r/Bitcoin/comments/wcmibz/remember_boys_hodl/	{}	wcmibz	False	True	False	False	False	True	False	False		[]	dark	text	False	False	False	0	0	False	all_ads	/r/Bitcoin/comments/wcmibz/remember_boys_hodl/	False	6		1659266748	1		True	False	False	Bitcoin	t5_2s3qj	4443551	public	https://b.thumbs.redditmedia.com/a1MdgUZmoMEQl1kTjJdrrlMJT8F647F6bPjK8iEDIVA.jpg	Remember boys HODL	0	[]	1.0	https://labs.openai.com/s/yvoV0wPbSLH96H1brPkjPSHX	all_ads	6	link	{'enabled': False, 'images': [{'id': 'TdYnp1rI1XgpREVXRsvMiMvtTDL0sg-jnWejkIwwRn0', 'resolutions': [{'height': 108, 'url': 'https://external-preview.redd.it/d62nbFyU3qLnTLOLK400zpxhJt8EMnxCmmPqHbzmBUg.jpg?width=108&amp;crop=smart&amp;auto=webp&amp;s=c63b4164c7cf164bf86d1227e0fe2d8588833547', 'width': 108}, {'height': 216, 'url': 'https://external-preview.redd.it/d62nbFyU3qLnTLOLK400zpxhJt8EMnxCmmPqHbzmBUg.jpg?width=216&amp;crop=smart&amp;auto=webp&amp;s=ce2943a011eb435526bce0c4deb17628b7b486fa', 'width': 216}, {'height': 320, 'url': 'https://external-preview.redd.it/d62nbFyU3qLnTLOLK400zpxhJt8EMnxCmmPqHbzmBUg.jpg?width=320&amp;crop=smart&amp;auto=webp&amp;s=43f5d01b2eba0e8fe1a73ba167abedee4f8bc4f8', 'width': 320}, {'height': 640, 'url': 'https://external-preview.redd.it/d62nbFyU3qLnTLOLK400zpxhJt8EMnxCmmPqHbzmBUg.jpg?width=640&amp;crop=smart&amp;auto=webp&amp;s=12434516edc4dfe6090f13162db00e12cc16cc2a', 'width': 640}, {'height': 960, 'url': 'https://external-preview.redd.it/d62nbFyU3qLnTLOLK400zpxhJt8EMnxCmmPqHbzmBUg.jpg?width=960&amp;crop=smart&amp;auto=webp&amp;s=91152a47bbf7254d8607536d65a6d7b9cde9fd26', 'width': 960}], 'source': {'height': 1024, 'url': 'https://external-preview.redd.it/d62nbFyU3qLnTLOLK400zpxhJt8EMnxCmmPqHbzmBUg.jpg?auto=webp&amp;s=8501c90ae93256759e88847fccc9e9f0bbd780c0', 'width': 1024}, 'variants': {}}]}	140.0	140.0	https://labs.openai.com/s/yvoV0wPbSLH96H1brPkjPSHX															"Remember boys HODL
"	remember boys hodl nan	0.46696844696998596	0.35678213834762573	0.35742002725601196	0.309226393699646	0.48237258195877075	0.71980881690979	0.5341745615005493	0.4413589537143707	0.47095197439193726	0.5633670091629028
126	[]	False	Dependent_Raccoon850	noob	[{'e': 'text', 't': 'redditor for 1 week'}]	redditor for 1 week	richtext	t2_qaw30cb6	False	False	False	[]	False	False	1659265607	/r/Bitcoin/comments/wcm7pk/blokforge_10000_ths_miner/	https://www.reddit.com/r/Bitcoin/comments/wcm7pk/blokforge_10000_ths_miner/	{}	wcm7pk	False	True	False	False	False	True	False	True		[]	dark	text	False	False	True	0	0	False	all_ads	/r/Bitcoin/comments/wcm7pk/blokforge_10000_ths_miner/	False	6		1659265617	1		True	False	False	Bitcoin	t5_2s3qj	4443528	public	https://b.thumbs.redditmedia.com/cH3WYQqWL3LWasJTZSEhvfFPrHQ5ecm-3GVX7CSadlo.jpg	Blokforge 10000 TH/s Miner.	0	[]	1.0	https://v.redd.it/6kwy7nxuyve91	all_ads	6	hosted:video	{'enabled': False, 'images': [{'id': '_Wrtr8ktJpAM7qUwues9rHnNZW1VEQ0atIU5rwegz5U', 'resolutions': [{'height': 144, 'url': 'https://external-preview.redd.it/3jmSfNEWKHyxNdON7mo8PQqTE8BhTYF7eVrk6FFyhvc.png?width=108&amp;crop=smart&amp;format=pjpg&amp;auto=webp&amp;s=187923af3b072e55319ebb7aada99a22f7dc4345', 'width': 108}, {'height': 288, 'url': 'https://external-preview.redd.it/3jmSfNEWKHyxNdON7mo8PQqTE8BhTYF7eVrk6FFyhvc.png?width=216&amp;crop=smart&amp;format=pjpg&amp;auto=webp&amp;s=272b38374da416ff81ea3b7a2ae7ecb03d7a4e5b', 'width': 216}, {'height': 426, 'url': 'https://external-preview.redd.it/3jmSfNEWKHyxNdON7mo8PQqTE8BhTYF7eVrk6FFyhvc.png?width=320&amp;crop=smart&amp;format=pjpg&amp;auto=webp&amp;s=a3b456deb7418ae2748f6e5e3cd36925cd480deb', 'width': 320}], 'source': {'height': 640, 'url': 'https://external-preview.redd.it/3jmSfNEWKHyxNdON7mo8PQqTE8BhTYF7eVrk6FFyhvc.png?format=pjpg&amp;auto=webp&amp;s=cd50e1b684460b62584d1b7ba94dba9803bd2d63', 'width': 480}, 'variants': {}}]}	140.0	140.0	https://v.redd.it/6kwy7nxuyve91		dark	2ec8e69e-6c36-11e9-a04b-0afb553d4ea6												"Blokforge 10000 TH/s Miner.
"	blokforge 10000 th s miner nan	0.4461625814437866	0.5159134864807129	0.3506227433681488	0.47955456376075745	0.40875044465065	0.4498332738876343	0.4994356334209442	0.358598530292511	0.45742669701576233	0.3574514091014862
127	[]	False	DistributionSad1486	noob	[{'e': 'text', 't': 'redditor for 1 week'}]	redditor for 1 week	richtext	t2_qdylyan0	False	False	False	[]	False	False	1659264135	self.Bitcoin	https://www.reddit.com/r/Bitcoin/comments/wclujt/lightning_channel_life_duration_question/	{}	wclujt	False	True	False	False	False	True	True	False		[]	dark	text	False	False	False	0	0	False	all_ads	/r/Bitcoin/comments/wclujt/lightning_channel_life_duration_question/	False	6		1659264146	1	Is there any life duration that is recommended for a lightning channel to stay open?  I mean in theory I could open a channel today and not close it for a 100 years and so only the opening transaction will ever be recorded on the blockchain.  Is it just an irrelevant topic ?	True	False	False	Bitcoin	t5_2s3qj	4443485	public	self	Lightning channel life duration question	0	[]	1.0	https://www.reddit.com/r/Bitcoin/comments/wclujt/lightning_channel_life_duration_question/	all_ads	6							dark	2ec8e69e-6c36-11e9-a04b-0afb553d4ea6												"Lightning channel life duration question
Is there any life duration that is recommended for a lightning channel to stay open?  I mean in theory I could open a channel today and not close it for a 100 years and so only the opening transaction will ever be recorded on the blockchain.  Is it just an irrelevant topic ?"	lightning channel life duration question is there any life duration that is recommended for a lightning channel to stay open i mean in theory i could open a channel today and not close it for a 100 years and so only the opening transaction will ever be recorded on the blockchain is it just an irrelevant topic 	0.0024599009193480015	0.9890989065170288	0.17453058063983917	0.030477402731776237	0.007899671792984009	0.5008642077445984	0.06872181594371796	8.484137765663036e-07	0.2678874135017395	0.0034190916921943426
