Unnamed: 0	all_awardings	archived	associated_award	author	author_flair_background_color	author_flair_css_class	author_flair_richtext	author_flair_template_id	author_flair_text	author_flair_text_color	author_flair_type	author_fullname	author_patreon_flair	author_premium	body	body_sha1	can_gild	collapsed	collapsed_because_crowd_control	collapsed_reason	collapsed_reason_code	comment_type	controversiality	created_utc	distinguished	gilded	gildings	id	is_submitter	link_id	locked	no_follow	parent_id	permalink	retrieved_utc	score	score_hidden	send_replies	stickied	subreddit	subreddit_id	subreddit_name_prefixed	subreddit_type	top_awarded_type	total_awards_received	treatment_tags	unrepliable_reason	corpus	support	knowledge	conflict	power	similarity	fun	status	trust	identity	romance
98	[]	False		Philbot_			[]				text	t2_11b8b5	False	False	The purpose of cryptocurrency and bitcoin is not tax evasion.	da13032d0806f2544b6db7837e5b8de1eb95c5e4	True	False					0	1658301137		0	{}	igvzfsq	False	t3_w3brw9	False	True	t3_w3brw9	/r/Bitcoin/comments/w3brw9/kycaml_getting_out_of_hand_has_the_government_won/igvzfsq/	1658301150	1	True	True	False	Bitcoin	t5_2s3qj	r/Bitcoin	public		0	[]		the purpose of cryptocurrency and bitcoin is not tax evasion 	0.371015340089798	0.6654031276702881	0.7153420448303223	0.47895678877830505	0.22312401235103607	0.25028693675994873	0.2779926657676697	0.6233687400817871	0.49843618273735046	0.009337315335869789
99	[]	False		Bitcoin__Hodler			[]			dark	text	t2_jtjwgqh6	False	False	try RoboSats	1d898ccaec352dad8250048284c835d2060921e7	True	False					0	1658301124		0	{}	igvzf6x	False	t3_w2x6ie	False	True	t3_w2x6ie	/r/Bitcoin/comments/w2x6ie/alternatives_to_exchanges/igvzf6x/	1658301137	1	True	True	False	Bitcoin	t5_2s3qj	r/Bitcoin	public		0	[]		try robosats	0.5095570087432861	0.5248211622238159	0.4861784279346466	0.47944799065589905	0.44462716579437256	0.2586706280708313	0.4751725196838379	0.503767192363739	0.47366848587989807	0.17830228805541992
100	[]	False		0DayOTM			[]				text	t2_8lqkijfq	False	False	"""Garbage in, garbage out.""

These politicians aren't coming from nowhere. They are a reflection of our country. If we don't resolve the cultural and educational issues with this country, it won't get better."	007f24a4939eae94eefdc7156f91f9adc48e09ef	True	False					0	1658301108		0	{}	igvzefc	False	t3_w2uvyy	False	True	t1_igu7463	/r/Bitcoin/comments/w2uvyy/nobody_is_worried_about_inflation_it_will_only/igvzefc/	1658301122	1	True	True	False	Bitcoin	t5_2s3qj	r/Bitcoin	public		0	[]		 garbage in garbage out these politicians aren t coming from nowhere they are a reflection of our country if we don t resolve the cultural and educational issues with this country it won t get better 	0.005677970591932535	0.9201810359954834	0.8664144277572632	0.04765307530760765	0.25254061818122864	0.6666150689125061	0.10714474320411682	8.262853725682362e-07	0.425136536359787	0.013189278542995453
101	[]	False		GrayBox1313			[]				text	t2_6gkogbeq	False	True	Banks may not be your friend but your cash has FDIC insurance incase they go under.	a43c3ecc79875e561a00a9a254899fe53b4264cd	True	False					0	1658301099		0	{}	igvzdz6	False	t3_w2qrf3	False	True	t1_igsbmg7	/r/Bitcoin/comments/w2qrf3/not_your_keys_not_your_bitcoin_celsius_lawyers/igvzdz6/	1658301111	1	True	True	False	Bitcoin	t5_2s3qj	r/Bitcoin	public		0	[]		banks may not be your friend but your cash has fdic insurance incase they go under 	0.5009422898292542	0.6358334422111511	0.4609909951686859	0.5577135682106018	0.17564041912555695	0.4777059257030487	0.17889147996902466	0.1719159483909607	0.4282566010951996	0.011440730653703213
102	[]	False		Kirk8829			[]				text	t2_36lt63zp	False	False	“Let’s be more like China” says global elite	40caf2e52ca56d18c547afcddf57c39a5450f16b	True	False					0	1658301092		0	{}	igvzdn5	False	t3_w3evna	False	True	t3_w3evna	/r/Bitcoin/comments/w3evna/china_ccp_tanks_protecting_banks_because_the_bank/igvzdn5/	1658301104	1	True	True	False	Bitcoin	t5_2s3qj	r/Bitcoin	public		0	[]		 let s be more like china says global elite	0.3911297023296356	0.6189968585968018	0.4865674674510956	0.5633179545402527	0.493529736995697	0.260855108499527	0.3196687698364258	0.5478143692016602	0.49740222096443176	0.01242087222635746
103	[]	False		Bitcoin__Hodler			[]			dark	text	t2_jtjwgqh6	False	False	the only valid option.	be96bdec459d748589da0bc4a270b5653258b67c	True	False					0	1658301087		0	{}	igvzdde	False	t3_w332cv	False	True	t3_w332cv	/r/Bitcoin/comments/w332cv/my_daughter_want_to_invest_into_something_for_her/igvzdde/	1658301101	1	True	True	False	Bitcoin	t5_2s3qj	r/Bitcoin	public		0	[]		the only valid option 	0.4123600721359253	0.5397378206253052	0.44169729948043823	0.5789735317230225	0.48356103897094727	0.4525861442089081	0.40711793303489685	0.4554119408130646	0.47964394092559814	0.3151804506778717
104	[]	False		ImStillRollin			[]				text	t2_1609dq	False	False	"That's new to me, thanks.  It's not great though.  Look at this: https://learn.robosats.com/read/en/#disputes

Who are these ""Staff"" who resolve disputes?  Are they actual staff of robosats?  That's pretty centralized  What contact methods do they use?  Are they private?  What can they do with your data?  Do they have a responsibility to keep it safe and private?

So I'm glad to know about this but I'll wait for a real decentralized system, where I can use whatever client I want.  If you have to use their software, it's not decentralized.  Imagine if you had to use a Coinbase wallet or has to use Bitcoin Core.  That's a world we need to get away from (centralized ecosystems) not add more layers to."	943a710bcfdad914f09d207faf23199f9c3f7e5c	True	False					0	1658301047		0	{}	igvzbgx	True	t3_w1wjf7	False	True	t1_igs9sh3	/r/Bitcoin/comments/w1wjf7/decentralized_exchange/igvzbgx/	1658301060	1	True	True	False	Bitcoin	t5_2s3qj	r/Bitcoin	public		0	[]		that s new to me thanks it s not great though look at this https learn robosats com read en disputes who are these staff who resolve disputes are they actual staff of robosats that s pretty centralized what contact methods do they use are they private what can they do with your data do they have a responsibility to keep it safe and private so i m glad to know about this but i ll wait for a real decentralized system where i can use whatever client i want if you have to use their software it s not decentralized imagine if you had to use a coinbase wallet or has to use bitcoin core that s a world we need to get away from centralized ecosystems not add more layers to 	0.0008462620317004621	0.9956375956535339	0.11651745438575745	0.06309425085783005	0.9970376491546631	0.05523812770843506	0.07298125326633453	8.263294830612722e-07	0.31200963258743286	0.00029522523982450366
105	[]	False		Bitcoin__Hodler			[]			dark	text	t2_jtjwgqh6	False	False	&gt;The results of this survey show that the members of the BMC and participants in the survey are currently utilizing electricity with a 66.8% sustainable power mix	5d95383bffc611c0c04a2b8c902cc4e08dee33db	True	False					0	1658301035		0	{}	igvzaxd	False	t3_w346wn	False	False	t3_w346wn	/r/Bitcoin/comments/w346wn/bitcoin_mining_electricity_mix_increased_to_595/igvzaxd/	1658301046	1	True	True	False	Bitcoin	t5_2s3qj	r/Bitcoin	public		0	[]		 gt the results of this survey show that the members of the bmc and participants in the survey are currently utilizing electricity with a 66 8 sustainable power mix	0.022945106029510498	0.9827653765678406	0.10197409242391586	0.9357442259788513	0.3968154191970825	0.2852535545825958	0.1744888573884964	0.44292962551116943	0.45838215947151184	0.004637934733182192
106	[]	False		TopAlert2383			[]				text	t2_bncpq2er	False	False	Bro, just sell now and buy back at 30k. The good Ole buy high sell low always works.	5b257e50fae379784bfeda48a0d3670908bd109b	True	False					0	1658301021		0	{}	igvzaad	False	t3_w32ars	False	True	t3_w32ars	/r/Bitcoin/comments/w32ars/is_it_wise_to_sell_now_and_buy_back_july_26th/igvzaad/	1658301033	1	True	True	False	Bitcoin	t5_2s3qj	r/Bitcoin	public		0	[]		bro just sell now and buy back at 30k the good ole buy high sell low always works 	0.28558385372161865	0.61761873960495	0.3216344118118286	0.22307948768138885	0.525112509727478	0.5441585779190063	0.14298130571842194	0.7839959859848022	0.3124440908432007	0.002583187073469162
107	[]	False		SonSuave			[]				text	t2_1000b4kb	False	False	You can’t even afford to risk it. If your young that genuinely concerns me.pm me your wallet address ill hook you up when this is taken car of.	aa955ddd0f911c97b6edc8de22bed45403d44f07	True	False					0	1658301018		0	{}	igvza4v	True	t3_w3epbb	False	True	t1_igvyqu0	/r/Bitcoin/comments/w3epbb/could_someone_send_me_just_one_dollar_in_bitcoin/igvza4v/	1658301033	1	True	True	False	Bitcoin	t5_2s3qj	r/Bitcoin	public		0	[]		you can t even afford to risk it if your young that genuinely concerns me pm me your wallet address ill hook you up when this is taken car of 	0.06308107823133469	0.6273492574691772	0.5114651918411255	0.4488776624202728	0.0057707615196704865	0.22722414135932922	0.07995303720235825	8.78027378803381e-07	0.2339145988225937	0.0019380298908799887
108	[]	False		Bitcoin__Hodler			[]			dark	text	t2_jtjwgqh6	False	False	dorian21@gmx.net	a558ad51d05144224b41d4fc223d1daec5e8dd6f	True	False					0	1658301000		0	{}	igvz9ao	False	t3_w346wn	False	True	t1_iguua28	/r/Bitcoin/comments/w346wn/bitcoin_mining_electricity_mix_increased_to_595/igvz9ao/	1658301012	1	True	True	False	Bitcoin	t5_2s3qj	r/Bitcoin	public		0	[]		dorian21 gmx net	0.4601285457611084	0.5713105797767639	0.4997607469558716	0.386211633682251	0.3765062689781189	0.39600637555122375	0.4366239905357361	0.48459717631340027	0.47103893756866455	0.20467668771743774
109	[]	False		hellsmajor001		noob	[{'e': 'text', 't': 'redditor for 4 weeks'}]	2ec8e69e-6c36-11e9-a04b-0afb553d4ea6	redditor for 4 weeks	dark	richtext	t2_ozv3bxe4	False	False	like I said , I go with the truth , don't talk with brain dead lefties. period. stop tagging my username, thanks.	7b996dc71e9ddf16602f5cf1df8dcef0552230e8	True	False					0	1658300992		0	{}	igvz8x0	False	t3_w0m477	False	True	t1_igkwqno	/r/Bitcoin/comments/w0m477/elizabeth_warren_and_other_democratic_lawmakers/igvz8x0/	1658301005	1	True	True	False	Bitcoin	t5_2s3qj	r/Bitcoin	public		0	[]		like i said i go with the truth don t talk with brain dead lefties period stop tagging my username thanks 	0.044092077761888504	0.404821515083313	0.7797154188156128	0.018521660938858986	0.47325998544692993	0.729850709438324	0.3297039568424225	8.937942038755864e-05	0.29873916506767273	0.0011838276404887438
110	[]	False		Revolutionary-Egg582			[]			dark	text	t2_98387hco	False	False	Coinbase starts packing golden parachute	dae76b0a77165521423dfd5779618457333ab08c	True	False					0	1658300987		0	{}	igvz8mi	False	t3_w3evna	False	False	t3_w3evna	/r/Bitcoin/comments/w3evna/china_ccp_tanks_protecting_banks_because_the_bank/igvz8mi/	1658300998	1	True	True	False	Bitcoin	t5_2s3qj	r/Bitcoin	public		0	[]		coinbase starts packing golden parachute	0.5054541230201721	0.4862811267375946	0.36183419823646545	0.4468193054199219	0.41949501633644104	0.6756144165992737	0.4135279357433319	0.42447829246520996	0.41568294167518616	0.609050989151001
111	[]	False		infopocalypse			[]			dark	text	t2_a9qv9j4f	False	False	Just think Trudeau &amp; every WEF politician idolizes China &amp; wants that for here.	bf66e5e365210ba98e182103b50bb9a63eb520f7	True	False					0	1658300900		0	{}	igvz4lt	False	t3_w3evna	False	True	t3_w3evna	/r/Bitcoin/comments/w3evna/china_ccp_tanks_protecting_banks_because_the_bank/igvz4lt/	1658300912	1	True	True	False	Bitcoin	t5_2s3qj	r/Bitcoin	public		0	[]		just think trudeau amp every wef politician idolizes china amp wants that for here 	0.2045489102602005	0.6896317005157471	0.45787525177001953	0.16821324825286865	0.36071452498435974	0.4574786126613617	0.29743340611457825	0.04554956778883934	0.4359782040119171	0.0047037024050951
112	[]	False		sizzlingrecourse46			[]				text	t2_8mt386mx	False	False	Do you mean 1.000 years or 1M years?	531b61712654621f2b1030e733e8e81630b10e42	True	False					0	1658300900		0	{}	igvz4lb	False	t3_w2wmmk	False	True	t3_w2wmmk	/r/Bitcoin/comments/w2wmmk/after_many_years_will_bitcoin_disappear/igvz4lb/	1658300912	1	True	True	False	Bitcoin	t5_2s3qj	r/Bitcoin	public		0	[]		do you mean 1 000 years or 1m years 	0.42397570610046387	0.610042154788971	0.4437549114227295	0.6080421805381775	0.37219271063804626	0.3072025179862976	0.2380073219537735	0.02104255184531212	0.4157922863960266	0.09647303074598312
113	[]	False		frugaleringenieur			[]				text	t2_5dm2mw07	False	False	Timechain	612a1c0ba5f5b59f0bf6c4b842ee50512d5e9ebd	True	False					0	1658300869		0	{}	igvz353	False	t3_w3dt7e	False	True	t1_igvykk0	/r/Bitcoin/comments/w3dt7e/daily_discussion_july_20_2022/igvz353/	1658300879	1	True	True	False	Bitcoin	t5_2s3qj	r/Bitcoin	public		0	[]		timechain	0.4630463123321533	0.5352395176887512	0.5127844214439392	0.4709847569465637	0.4710223376750946	0.1883898675441742	0.5000308752059937	0.4854360520839691	0.48816636204719543	0.4087046682834625
114	[]	False		SonSuave			[]				text	t2_1000b4kb	False	False	I tried this in two subreddits, not many, that’s irrelevant though. I don’t need your money I’m trying to test out the functionality of it Jesus. If you don’t have as much as a dollar than good luck man. Or even a dollar that’ll be givin back.	98c8d4306cf8b1f5920278b53b23c791ed7b4e2a	True	False					0	1658300861		0	{}	igvz2rq	True	t3_w3epbb	False	True	t1_igvyu9d	/r/Bitcoin/comments/w3epbb/could_someone_send_me_just_one_dollar_in_bitcoin/igvz2rq/	1658300872	1	True	True	False	Bitcoin	t5_2s3qj	r/Bitcoin	public		0	[]		i tried this in two subreddits not many that s irrelevant though i don t need your money i m trying to test out the functionality of it jesus if you don t have as much as a dollar than good luck man or even a dollar that ll be givin back 	0.003950844518840313	0.9874384999275208	0.40810877084732056	0.015135597437620163	0.008700626902282238	0.5309358239173889	0.0717855840921402	8.410602276853751e-07	0.224625363945961	0.02009078487753868
115	[]	False		ImStillRollin			[]				text	t2_1609dq	False	False	I'd read the thread I linked to if you really think that.  But it might just be your reaction to things you don't like.	ae826f63595507a26c5b383afd6b40941768f3a3	True	False					0	1658300838		0	{}	igvz1o3	True	t3_w1wjf7	False	True	t1_ignsau7	/r/Bitcoin/comments/w1wjf7/decentralized_exchange/igvz1o3/	1658300850	1	True	True	False	Bitcoin	t5_2s3qj	r/Bitcoin	public		0	[]		i d read the thread i linked to if you really think that but it might just be your reaction to things you don t like 	0.10407602787017822	0.3997515141963959	0.5919322967529297	0.010644709691405296	0.6830929517745972	0.7017917633056641	0.07771312445402145	8.71444683525624e-07	0.2763606905937195	0.043036751449108124
116	[]	False		PeekaB00_			[]				text	t2_3sdyjcod	False	False	This happened 2 days ago in Shandong, which is across the country from Henan. If what you claimed was actually happening, why do the people look so calm, and why are there only a couple tweets about this?	3b8d0085544097f5e5add52773ba3f91cd5da9a4	True	False					0	1658300807		0	{}	igvz05a	False	t3_w3evna	False	True	t3_w3evna	/r/Bitcoin/comments/w3evna/china_ccp_tanks_protecting_banks_because_the_bank/igvz05a/	1658300822	1	True	True	False	Bitcoin	t5_2s3qj	r/Bitcoin	public		0	[]		this happened 2 days ago in shandong which is across the country from henan if what you claimed was actually happening why do the people look so calm and why are there only a couple tweets about this 	0.004611000884324312	0.987221896648407	0.6637011766433716	0.024800749495625496	0.9898815751075745	0.6930239796638489	0.07265612483024597	8.411805652031035e-07	0.36219125986099243	0.007254476193338633
117	[]	False		fartyhardy			[]				text	t2_80kvysqj	False	False	For what? The truth? Go out and work like normal people.	6be4ea506b42064ccf940d474325e97663ab24f8	True	False					0	1658300764		0	{}	igvyy45	False	t3_w3epbb	False	True	t1_igvyu5f	/r/Bitcoin/comments/w3epbb/could_someone_send_me_just_one_dollar_in_bitcoin/igvyy45/	1658300775	1	True	True	False	Bitcoin	t5_2s3qj	r/Bitcoin	public		0	[]		for what the truth go out and work like normal people 	0.5180006623268127	0.4992656111717224	0.55406653881073	0.5860151648521423	0.5215491652488708	0.4531439542770386	0.23987644910812378	0.4411223828792572	0.344243586063385	0.013102692551910877
118	[]	False		sizzlingrecourse46			[]				text	t2_8mt386mx	False	False	I'm more into my entry strategy right now	8379447da70d4b6212de2bdd4c245ac31f10fc91	True	False					0	1658300761		0	{}	igvyxxt	False	t3_w2ytft	False	True	t3_w2ytft	/r/Bitcoin/comments/w2ytft/what_is_your_exit_strategy/igvyxxt/	1658300773	1	True	True	False	Bitcoin	t5_2s3qj	r/Bitcoin	public		0	[]		i m more into my entry strategy right now	0.37275758385658264	0.5642005801200867	0.3095569312572479	0.37638482451438904	0.5085137486457825	0.3765881359577179	0.3793426752090454	0.8268378973007202	0.4104977250099182	0.15715926885604858
119	[]	False		Knurlinger			[]				text	t2_gvhxc	False	False	Passphrase is awesome. Store the seed in multiple places, passphrase either in different places or in a password manager (only the Passphrase, not the seed!)	fc8af383b608825332abaaf5b58266bf1a78b8b4	True	False					0	1658300711		0	{}	igvyvlu	False	t3_w3fgxf	False	True	t1_igvyi90	/r/Bitcoin/comments/w3fgxf/btc_cold_storage/igvyvlu/	1658300726	1	True	True	False	Bitcoin	t5_2s3qj	r/Bitcoin	public		0	[]		passphrase is awesome store the seed in multiple places passphrase either in different places or in a password manager only the passphrase not the seed 	0.02172659896314144	0.9834272861480713	0.22891865670681	0.048302531242370605	0.48636749386787415	0.23592139780521393	0.08537966758012772	0.00959963258355856	0.5202467441558838	0.004905296489596367
120	[]	False		fartyhardy			[]				text	t2_80kvysqj	False	False	You tested this in maaaany subreddits. Look at the mirror and try not to cry over what a loser you are.	9d56c5e8f91402d41ba3781adcb06545da8131d5	True	False					0	1658300683		0	{}	igvyu9d	False	t3_w3epbb	False	True	t1_igvys0l	/r/Bitcoin/comments/w3epbb/could_someone_send_me_just_one_dollar_in_bitcoin/igvyu9d/	1658300698	1	True	True	False	Bitcoin	t5_2s3qj	r/Bitcoin	public		0	[]		you tested this in maaaany subreddits look at the mirror and try not to cry over what a loser you are 	0.21347783505916595	0.7397181391716003	0.8693591356277466	0.3155200481414795	0.5770208835601807	0.46784377098083496	0.09696405380964279	0.02947264164686203	0.3451176583766937	0.01924167573451996
121	[]	False		SonSuave			[]				text	t2_1000b4kb	False	False	And I also take down the post, and yiu make an apology	ac19ed2a1b0bb34cc0bd032556141a6134b88488	True	False					0	1658300681		0	{}	igvyu5f	True	t3_w3epbb	False	True	t1_igvys0l	/r/Bitcoin/comments/w3epbb/could_someone_send_me_just_one_dollar_in_bitcoin/igvyu5f/	1658300692	1	True	True	False	Bitcoin	t5_2s3qj	r/Bitcoin	public		0	[]		and i also take down the post and yiu make an apology	0.4424314498901367	0.4961557686328888	0.3940321207046509	0.41046541929244995	0.41685643792152405	0.3374362885951996	0.3544388711452484	0.6329314112663269	0.33669009804725647	0.02167101763188839
122	[]	False		SonSuave			[]				text	t2_1000b4kb	False	False	"I’m concerned for my Coinbase account. I bet my mothers and fathers life I’ll send back the doller
Once I test this"	39054f2985a5149199bed687be7342ed49383cc3	True	False					0	1658300636		0	{}	igvys0l	True	t3_w3epbb	False	True	t1_igvykjy	/r/Bitcoin/comments/w3epbb/could_someone_send_me_just_one_dollar_in_bitcoin/igvys0l/	1658300650	1	True	True	False	Bitcoin	t5_2s3qj	r/Bitcoin	public		0	[]		i m concerned for my coinbase account i bet my mothers and fathers life i ll send back the doller once i test this	0.5106803178787231	0.32356858253479004	0.06393924355506897	0.021129406988620758	0.7171833515167236	0.5904689431190491	0.9249992370605469	0.17548657953739166	0.26437118649482727	0.014055820181965828
123	[]	False		klasspirate			[]				text	t2_cd7e9	False	True	We're the government, now trust us with all your guns and money.	289376d8f7093152824fde15e585e560ad75eb87	True	False					0	1658300614		0	{}	igvyqzw	False	t3_w3evna	False	True	t3_w3evna	/r/Bitcoin/comments/w3evna/china_ccp_tanks_protecting_banks_because_the_bank/igvyqzw/	1658300629	1	True	True	False	Bitcoin	t5_2s3qj	r/Bitcoin	public		0	[]		we re the government now trust us with all your guns and money 	0.39994293451309204	0.4371720552444458	0.6882733106613159	0.828679621219635	0.4681163728237152	0.38651522994041443	0.3170747458934784	0.10377257317304611	0.39846840500831604	0.0019678971730172634
124	[]	False		fartyhardy			[]				text	t2_80kvysqj	False	False	Haha you will never get out of poverty by online begging and obviously lying.	5a02a0716ea54b83be7149fe265af866373be68f	True	False					0	1658300611		0	{}	igvyqu0	False	t3_w3epbb	False	True	t1_igvyiao	/r/Bitcoin/comments/w3epbb/could_someone_send_me_just_one_dollar_in_bitcoin/igvyqu0/	1658300622	1	True	True	False	Bitcoin	t5_2s3qj	r/Bitcoin	public		0	[]		haha you will never get out of poverty by online begging and obviously lying 	0.38598525524139404	0.35640373826026917	0.830644965171814	0.06150153651833534	0.21572129428386688	0.4026692807674408	0.23178589344024658	0.20369771122932434	0.31181013584136963	0.006223262287676334
125	[]	False		igadjeed			[]				text	t2_vy03v	False	True	No blockchain here, only Bitcoin	7e02e7625faffbf7460511b40205200918022e5d	True	False					0	1658300582		0	{}	igvypfx	False	t3_w3euy5	False	True	t3_w3euy5	/r/Bitcoin/comments/w3euy5/blockchain_market/igvypfx/	1658300595	1	True	True	False	Bitcoin	t5_2s3qj	r/Bitcoin	public		0	[]		no blockchain here only bitcoin	0.4965292811393738	0.4951583445072174	0.5116177201271057	0.413518488407135	0.45540928840637207	0.31376680731773376	0.4522269368171692	0.5035043358802795	0.4919920563697815	0.02780669555068016
126	[]	False		Garlen1			[]				text	t2_uyvyhfh	False	False	But Only when the stock market gives it permission too...	550bd6a91f7b6c4e9ce72a6e43b3a6d1ff702685	True	False					0	1658300533		0	{}	igvyn6w	False	t3_w3e6su	False	True	t3_w3e6su	/r/Bitcoin/comments/w3e6su/bitcoin_going_up/igvyn6w/	1658300546	1	True	True	False	Bitcoin	t5_2s3qj	r/Bitcoin	public		0	[]		but only when the stock market gives it permission too 	0.2615197002887726	0.7374877333641052	0.17539677023887634	0.631982684135437	0.4370858371257782	0.5316991806030273	0.21315905451774597	0.1468552052974701	0.44842296838760376	0.08208511769771576
127	[]	False		wsyczhcxj			[]				text	t2_f3w4qq1k	False	False	Atleast we are seeing a good video clip after a long time	f3d42d1c2d61abb942a811e6eff42d7e72609a1b	True	False					0	1658300532		0	{}	igvyn55	False	t3_w2uvyy	False	True	t1_igv4bw4	/r/Bitcoin/comments/w2uvyy/nobody_is_worried_about_inflation_it_will_only/igvyn55/	1658300546	1	True	True	False	Bitcoin	t5_2s3qj	r/Bitcoin	public		0	[]		atleast we are seeing a good video clip after a long time	0.457698792219162	0.42104941606521606	0.1673675924539566	0.16155968606472015	0.5213318467140198	0.6550772190093994	0.3205327093601227	0.05863829702138901	0.35966724157333374	0.023547351360321045
128	[]	False		No-Research8107			[]			dark	text	t2_52jiolhb	False	False	"When Craig Wright invented bitcoin the population of Australia was 21 million.

&gt;!Obviously this is a joke and Craig Wright is not Satoshi.!&lt;"	90149f67c31fb788eaf7f8b9b2fa23202e917064	True	False					0	1658300522		0	{}	igvymop	False	t3_w35fyv	False	True	t3_w35fyv	/r/Bitcoin/comments/w35fyv/shower_thought_is_the_maximum_amount_of_btc_based/igvymop/	1658300532	1	True	True	False	Bitcoin	t5_2s3qj	r/Bitcoin	public		0	[]		when craig wright invented bitcoin the population of australia was 21 million gt obviously this is a joke and craig wright is not satoshi lt 	0.0044617243111133575	0.857032299041748	0.6527652144432068	0.014313910156488419	0.041394755244255066	0.8780356645584106	0.1352028101682663	8.537064104530145e-07	0.4345771372318268	0.0023567057214677334
129	[]	False		igadjeed			[]				text	t2_vy03v	False	True	"No blockchain here, only 
Bitcoin"	bdb5fd445abb96036c3d0481cc885b940eabd808	True	False					0	1658300519		0	{}	igvymjh	False	t3_w3ey1z	False	True	t3_w3ey1z	/r/Bitcoin/comments/w3ey1z/we_all_wonder_about_blockchain_and_its_future_but/igvymjh/	1658300532	1	True	True	False	Bitcoin	t5_2s3qj	r/Bitcoin	public		0	[]		no blockchain here only bitcoin	0.4965292811393738	0.4951583445072174	0.5116177201271057	0.413518488407135	0.45540928840637207	0.31376680731773376	0.4522269368171692	0.5035043358802795	0.4919920563697815	0.02780669555068016
130	[]	False		TexMex404			[]				text	t2_h9ljkqsm	False	False	Buy only. I will thank myself in 10 years!	ccd74e8ed350b55c35b51f370d9b7ee7b0747fe4	True	False					0	1658300504		0	{}	igvylv9	False	t3_w2sf05	False	True	t3_w2sf05	/r/Bitcoin/comments/w2sf05/this_is_the_first_bitcoin_cycle_i_havent_heard_a/igvylv9/	1658300519	1	True	True	False	Bitcoin	t5_2s3qj	r/Bitcoin	public		0	[]		buy only i will thank myself in 10 years 	0.7526993155479431	0.17236845195293427	0.08096156269311905	0.19262224435806274	0.37976542115211487	0.36480480432510376	0.6397252082824707	0.7788794636726379	0.34826913475990295	0.09658608585596085
131	[]	False		fckndan			[]				text	t2_tqx8a	False	True	Tick tock, &gt;!next block.!&lt;	c0364beb671bcf4c6d38e6ffffaf5e13fef79f41	True	False					0	1658300475		0	{}	igvykk0	False	t3_w3dt7e	False	True	t3_w3dt7e	/r/Bitcoin/comments/w3dt7e/daily_discussion_july_20_2022/igvykk0/	1658300487	1	True	True	False	Bitcoin	t5_2s3qj	r/Bitcoin	public		0	[]		tick tock gt next block lt 	0.2823813855648041	0.5523390173912048	0.4150327444076538	0.5323464870452881	0.4454703629016876	0.5115149021148682	0.3454812467098236	0.4928889274597168	0.40656760334968567	0.07006267458200455
