Unnamed: 0	all_awardings	archived	associated_award	author	author_flair_background_color	author_flair_css_class	author_flair_template_id	author_flair_text	author_flair_text_color	body	body_sha1	can_gild	collapsed	collapsed_because_crowd_control	collapsed_reason	collapsed_reason_code	comment_type	controversiality	created_utc	distinguished	gilded	gildings	id	is_submitter	link_id	locked	no_follow	parent_id	permalink	retrieved_utc	score	score_hidden	send_replies	stickied	subreddit	subreddit_id	subreddit_name_prefixed	subreddit_type	top_awarded_type	total_awards_received	treatment_tags	unrepliable_reason	author_flair_richtext	author_flair_type	author_fullname	author_patreon_flair	author_premium	author_cakeday	corpus	support	knowledge	conflict	power	similarity	fun	status	trust	identity	romance
158	[]	False		GuardedAirplane						"&gt;	From the observers point of view the withdraw could have originated from any of the deposits.

Why? Could it be you have MIXED your coins with others?

&gt;	This does not change the fact that the receipt is a mathematical claim to your coins.

This is not true. It is a claim for an amount equal to your original deposit, but because ETH uses an account system it is not possible to receive “your” coins as this concept does not exist in the protocol. The system only works because you are mixing your coins with others actively.

Systems such as Monero (which pre-dates TC by several years) are legally acceptable as they:

1) don’t require active coordination with other users to work (i.e. you don’t have to worry about there being enough ETH in the pool to conceal your transactions)

2) Don’t actually mix funds, so it can be easily proven no coordination took place

Number 2) is essentially important as it is how it is even possible to sanction TC in the first place. All funds go to a limited set of known wallets for mixing, so regulators just have to mark those as bad. In non-mixing protocols, they can simply label the criminals directly instead of the whole system."	e02c39a19ffaf08e0765ee8fc839303c19a963ce	True	False					0	1660830914		0	{}	iksnz7u	False	t3_wqzq0i	False	False	t1_iksf9hc	/r/ethereum/comments/wqzq0i/zkbased_privacy_tools_are_truly_not_mixers_you/iksnz7u/	1660830927	1	False	True	False	ethereum	t5_2zf9m	r/ethereum	public		0	[]		[]	text	t2_wzocv	False	False		 gt from the observers point of view the withdraw could have originated from any of the deposits why could it be you have mixed your coins with others gt this does not change the fact that the receipt is a mathematical claim to your coins this is not true it is a claim for an amount equal to your original deposit but because eth uses an account system it is not possible to receive your coins as this concept does not exist in the protocol the system only works because you are mixing your coins with others actively systems such as monero which pre dates tc by several years are legally acceptable as they 1 don t require active coordination with other users to work i e you don t have to worry about there being enough eth in the pool to conceal your transactions 2 don t actually mix funds so it can be easily proven no coordination took place number 2 is essentially important as it is how it is even possible to sanction tc in the first place all funds go to a limited set of known wallets for mixing so regulators just have to mark those as bad in non mixing protocols they can simply label the criminals directly instead of the whole system 	0.0022454848513007164	0.988784670829773	0.7868327498435974	0.9412502646446228	0.008149419911205769	0.3327811062335968	0.06477338820695877	8.478103836750961e-07	0.45666274428367615	0.003506098175421357
159	[]	False		Web3Alchemist_eth						Do you really have ETH in a wallet that you actually own? Run your wallet on Etherscan and see. If not you dont actually own any ETH you just get to play with Robinhoods. Total scam. Use Kraken	4d8e642d9523b6b8156c23d7af80dc7788a95cf8	True	False					0	1660830503		0	{}	iksmzh3	False	t3_wqy5b4	False	True	t3_wqy5b4	/r/ethereum/comments/wqy5b4/f_robinhood/iksmzh3/	1660830518	1	False	True	False	ethereum	t5_2zf9m	r/ethereum	public		0	[]		[]	text	t2_nifwz4xj	False	False		do you really have eth in a wallet that you actually own run your wallet on etherscan and see if not you dont actually own any eth you just get to play with robinhoods total scam use kraken	0.017695315182209015	0.927191972732544	0.8567410111427307	0.02384537272155285	0.008869602344930172	0.292132705450058	0.07488599419593811	0.9946765899658203	0.26272934675216675	0.008923723362386227
160	[]	False		cannedshrimp						"Switching from POW is definitely a historic moment. A lot of risks to take for only one real benefit - a step toward increasing scalability via sharding. 

The energy stuff is complete BS. I am a massive proponent of renewables and dropping our dependence on fossil fuels. The framing of energy usage in this video is entirely naive and more spin than reality."	bb2fe828d113975800d06f6a827a0853d9acbdef	True	False					0	1660830427		0	{}	iksmt0m	False	t3_wrjg3g	False	True	t3_wrjg3g	/r/ethereum/comments/wrjg3g/what_do_you_guys_think/iksmt0m/	1660830439	1	False	True	False	ethereum	t5_2zf9m	r/ethereum	public		0	[]		[]	text	t2_al51k	False	False		switching from pow is definitely a historic moment a lot of risks to take for only one real benefit a step toward increasing scalability via sharding the energy stuff is complete bs i am a massive proponent of renewables and dropping our dependence on fossil fuels the framing of energy usage in this video is entirely naive and more spin than reality 	0.0025364754255861044	0.9892242550849915	0.8314023017883301	0.028270812705159187	0.9941664934158325	0.448795348405838	0.09040917456150055	8.46928742248565e-07	0.4747680425643921	0.009681886062026024
161	[]	False		coinfeeds-bot						"tldr; De University of Ethereum (UETH), a decentralized global educational platform initiated by the Ethereum community, has announced the initial speakers attending its ""Ethereum a New Era"" event. The all-star lineup includes Vitalik Buterin, Co-Founder of Ethereum, Justin Drake, Aya Miyaguchi, Aditya Asgaonkar, Dankrad Feist, Danny Ryan, Cy Li, and Keith Chen. The event is open to blockchain enthusiasts as well as industry experts.

*This summary is auto generated by a bot and not meant to replace reading the original article. As always, DYOR.*"	1ee63f7bc1be34366b2275d21ef06ac7159e16ef	True	False					0	1660830373		0	{}	iksmog7	False	t3_wri7c9	False	True	t3_wri7c9	/r/ethereum/comments/wri7c9/vitalik_buterin_to_discuss_ethereums_upcoming/iksmog7/	1660830384	1	False	True	False	ethereum	t5_2zf9m	r/ethereum	public		0	[]		[]	text	t2_8ihxazi7	False	False		tldr de university of ethereum ueth a decentralized global educational platform initiated by the ethereum community has announced the initial speakers attending its ethereum a new era event the all star lineup includes vitalik buterin co founder of ethereum justin drake aya miyaguchi aditya asgaonkar dankrad feist danny ryan cy li and keith chen the event is open to blockchain enthusiasts as well as industry experts this summary is auto generated by a bot and not meant to replace reading the original article as always dyor 	0.0008188073989003897	0.9952871799468994	0.13025569915771484	0.01708948239684105	0.004218767862766981	0.1952071636915207	0.13980251550674438	8.364799555238278e-07	0.4097411632537842	0.00021497481793630868
162	[]	False		37Schmeckles						I declare these documents, declassified	55bcc14bddb8c485f3dd62d28544fb9b7d227e47	True	False					0	1660830347		0	{}	iksmmeo	False	t3_wrf95b	False	False	t1_iksknb3	/r/ethereum/comments/wrf95b/how_is_the_difficulty_bomb_activated/iksmmeo/	1660830359	1	False	True	False	ethereum	t5_2zf9m	r/ethereum	public		0	[]		[]	text	t2_882ie3kn	False	False		i declare these documents declassified	0.3456669747829437	0.4966815710067749	0.509453535079956	0.48949918150901794	0.4404028654098511	0.3456175625324249	0.44049176573753357	0.5233766436576843	0.5343568921089172	0.06485500186681747
163	[]	False		WilliamShattnerpants						What I think is, if your only way of communicating your message is via a video, it’s spam.	6d6ba8229d74c09c4d3938cf55c72aeb52babaaa	True	False					0	1660830304		0	{}	iksmisz	False	t3_wrjg3g	False	True	t3_wrjg3g	/r/ethereum/comments/wrjg3g/what_do_you_guys_think/iksmisz/	1660830319	1	False	True	False	ethereum	t5_2zf9m	r/ethereum	public		0	[]		[]	text	t2_1i6kvg7v	False	False		what i think is if your only way of communicating your message is via a video it s spam 	0.3964187204837799	0.6428885459899902	0.6085582375526428	0.06637726724147797	0.2206420600414276	0.5696746706962585	0.13241539895534515	4.073487616551574e-06	0.3676948845386505	0.005156530532985926
164	[]	False		Tyra3l						Yes and no. They can't tell when the target block will exactly happen, but they make guestimates based on current/past network activity/difficulty.	4d50e2986e88f70ff2ecf6d2d4f06dae2c5ef0c6	True	False					0	1660830263		0	{}	iksmfax	False	t3_wrf95b	False	True	t1_iksi1g3	/r/ethereum/comments/wrf95b/how_is_the_difficulty_bomb_activated/iksmfax/	1660830273	1	False	True	False	ethereum	t5_2zf9m	r/ethereum	public		0	[]		[]	text	t2_6gsrm	False	False		yes and no they can t tell when the target block will exactly happen but they make guestimates based on current past network activity difficulty 	0.04497137665748596	0.9449080228805542	0.47483575344085693	0.36308807134628296	0.39103204011917114	0.30491188168525696	0.11315278708934784	8.515686999999161e-07	0.42491286993026733	0.0014849500730633736
165	[]	False		CleanYourLobster85						Yeah, I'm not super excited for the merge.  POS definately has cons and we could just up with a centralised shitcoin	fca73c301355fb1b27c167c732d108cf3e9e5f15	True	False					0	1660830253		0	{}	iksmej1	False	t3_wrjg3g	False	True	t3_wrjg3g	/r/ethereum/comments/wrjg3g/what_do_you_guys_think/iksmej1/	1660830265	1	False	True	False	ethereum	t5_2zf9m	r/ethereum	public		0	[]		[]	text	t2_57c83uh7	False	False		yeah i m not super excited for the merge pos definately has cons and we could just up with a centralised shitcoin	0.5032192468643188	0.6189773678779602	0.09654323756694794	0.004401997197419405	0.8233131766319275	0.10005664080381393	0.3105503022670746	0.07055462896823883	0.3482072353363037	2.964720260933973e-05
166	[]	False		Maswasnos						If you really want to dump PoW ETH, the safest way to do it is probably to keep ETH on the exchange you're going to sell PoW ETH on. The exchange will handle the background stuff and you'll be credited with both kinds of ETH.	4e2fc85d4f0ff80ab7f3db41205fa686e02b3532	True	False					0	1660830020		0	{}	iksluxu	False	t3_wrikle	False	True	t1_iksl4k2	/r/ethereum/comments/wrikle/lets_say_i_have_ethsnx_erc20_token_nft_in_a/iksluxu/	1660830032	1	False	True	False	ethereum	t5_2zf9m	r/ethereum	public		0	[]		[]	text	t2_nr2mp	False	True		if you really want to dump pow eth the safest way to do it is probably to keep eth on the exchange you re going to sell pow eth on the exchange will handle the background stuff and you ll be credited with both kinds of eth 	0.030278652906417847	0.9827038645744324	0.17573127150535583	0.021672584116458893	0.007813241332769394	0.38631248474121094	0.10408344119787216	8.760734999668784e-07	0.22953715920448303	0.007364748045802116
167	[]	False		koajatcheedi						"Yes, it does not matter which kind of wallet you use. Your wallet is signing your transaction with your private key and afterwards you send it to the blockchain where the transaction and the signature is public. An attacker only needs to copy the transaction and the signature and send it to the other network.  


But to mention it: that will only work if the two chains have the same chain id. If the PoW fork is changing their chain id after their hard fork, replay attacks will not be possible."	8fd979b1090653c5c137121406ba4e8363028f21	True	False					0	1660829863		0	{}	ikslhu8	False	t3_wrikle	False	True	t1_ikskosb	/r/ethereum/comments/wrikle/lets_say_i_have_ethsnx_erc20_token_nft_in_a/ikslhu8/	1660829875	1	False	True	False	ethereum	t5_2zf9m	r/ethereum	public		0	[]		[]	text	t2_quw56j0e	False	False		yes it does not matter which kind of wallet you use your wallet is signing your transaction with your private key and afterwards you send it to the blockchain where the transaction and the signature is public an attacker only needs to copy the transaction and the signature and send it to the other network but to mention it that will only work if the two chains have the same chain id if the pow fork is changing their chain id after their hard fork replay attacks will not be possible 	0.0025384908076375723	0.9885404706001282	0.5785066485404968	0.013120184652507305	0.008567791432142258	0.348879337310791	0.06970637291669846	8.412255283474224e-07	0.35412564873695374	0.01153955515474081
168	[]	False		WorldSpark						What is the best way to avoid replay attack and also get pow coins and keep your coins and NFT and erc20 safe ?	57771c4802cbc806358c4e441969fecdcdc17507	True	False					0	1660829704		0	{}	iksl4k2	True	t3_wrikle	False	True	t1_iksffyt	/r/ethereum/comments/wrikle/lets_say_i_have_ethsnx_erc20_token_nft_in_a/iksl4k2/	1660829717	1	False	True	False	ethereum	t5_2zf9m	r/ethereum	public		0	[]		[]	text	t2_azm0om9	False	False	True	what is the best way to avoid replay attack and also get pow coins and keep your coins and nft and erc20 safe 	0.06510648876428604	0.9104353785514832	0.11445116996765137	0.03112076222896576	0.03086395561695099	0.3321837782859802	0.15320216119289398	9.765004733708338e-07	0.3561381697654724	0.002405910287052393
169	[]	False		shim__						The concept has been around for years but the bomb has been defused and redeployed multiple times.	d76d4e3124da0caebcdcf72ee12c813c8157f7b6	True	False					0	1660829658		0	{}	iksl0ri	False	t3_wrf95b	False	True	t1_iksi1g3	/r/ethereum/comments/wrf95b/how_is_the_difficulty_bomb_activated/iksl0ri/	1660829670	1	False	True	False	ethereum	t5_2zf9m	r/ethereum	public		0	[]		[]	text	t2_ke5mi	False	False		the concept has been around for years but the bomb has been defused and redeployed multiple times 	0.07803461700677872	0.8592878580093384	0.5404952168464661	0.30907484889030457	0.5399203300476074	0.7062747478485107	0.19222955405712128	0.6558336615562439	0.4332413077354431	0.0024437319952994585
170	[]	False		Vashe00						L2s definitely aren’t going anywhere. I think I remember reading a quote from him that said in the future he hopes all transactions will go through L2s	549bae9baf3bd91f9d49081a8f5f3fc1c8300378	True	False					0	1660829564		0	{}	ikskswp	True	t3_wri7c9	False	True	t1_ikskir7	/r/ethereum/comments/wri7c9/vitalik_buterin_to_discuss_ethereums_upcoming/ikskswp/	1660829577	1	False	True	False	ethereum	t5_2zf9m	r/ethereum	public		0	[]		[]	text	t2_b962u	False	False		l2s definitely aren t going anywhere i think i remember reading a quote from him that said in the future he hopes all transactions will go through l2s	0.20354652404785156	0.7568097114562988	0.18393903970718384	0.008097256533801556	0.6347771286964417	0.04493856802582741	0.14012831449508667	8.51484230679489e-07	0.23281139135360718	0.0004475946188904345
171	[]	False		WorldSpark						Will this attack play out on ledger HW as well because it needs your approval from device to approve a transfer ?	3c9313419c88577fa90a26186a2d160ba19d8602	True	False					0	1660829513		0	{}	ikskosb	True	t3_wrikle	False	False	t1_ikseu60	/r/ethereum/comments/wrikle/lets_say_i_have_ethsnx_erc20_token_nft_in_a/ikskosb/	1660829524	1	False	True	False	ethereum	t5_2zf9m	r/ethereum	public		0	[]		[]	text	t2_azm0om9	False	False	True	will this attack play out on ledger hw as well because it needs your approval from device to approve a transfer 	0.1449233591556549	0.9151569604873657	0.16509762406349182	0.17573456466197968	0.4039188623428345	0.2215653508901596	0.10312284529209137	8.988234867501887e-07	0.3431069850921631	0.0011589189525693655
172	[]	False		Lexsteel11						Vitalik screams out his front window “I DECLARE- DIFFICULTYYYYY!!”	622016d70b2f0fa915594a1539543865bfef8c15	True	False					0	1660829496		0	{}	iksknb3	False	t3_wrf95b	False	True	t3_wrf95b	/r/ethereum/comments/wrf95b/how_is_the_difficulty_bomb_activated/iksknb3/	1660829508	1	False	True	False	ethereum	t5_2zf9m	r/ethereum	public		0	[]		[]	text	t2_b5dd6	False	False		vitalik screams out his front window i declare difficultyyyyy 	0.22165724635124207	0.3109382092952728	0.5893236398696899	0.22436408698558807	0.4498973488807678	0.19728906452655792	0.3357006311416626	0.061854373663663864	0.39080846309661865	0.0058587524108588696
173	[]	False		Either-Advantage						Yup. People telling me that Polygon is going to be obsolete when the merge happens is just silly. L2s are not going anywhere, ETH has even changed it's roadmap to rely on them. Way too much misconception needs to be cleared.	7c823e6dd966b89c0a59d97907de6fa39be764e0	True	False					0	1660829439		0	{}	ikskir7	False	t3_wri7c9	False	True	t1_iksjopp	/r/ethereum/comments/wri7c9/vitalik_buterin_to_discuss_ethereums_upcoming/ikskir7/	1660829454	1	False	True	False	ethereum	t5_2zf9m	r/ethereum	public		0	[]		[]	text	t2_5mwofcum	False	False		yup people telling me that polygon is going to be obsolete when the merge happens is just silly l2s are not going anywhere eth has even changed it s roadmap to rely on them way too much misconception needs to be cleared 	0.0028299770783632994	0.9841014742851257	0.8347668647766113	0.011811528354883194	0.9139452576637268	0.38968995213508606	0.08129338175058365	8.417350727540907e-07	0.36647024750709534	0.006201195530593395
174	[]	False		Jezzes						Making it 100% Centralized	3f2bc293eaaec7f2c1a6b7699a7e4c89ba7a8c53	True	False					0	1660829387		0	{}	ikskegr	False	t3_wrjg3g	False	True	t3_wrjg3g	/r/ethereum/comments/wrjg3g/what_do_you_guys_think/ikskegr/	1660829400	1	False	True	False	ethereum	t5_2zf9m	r/ethereum	public		0	[]		[]	text	t2_90x4p	False	False		making it 100 centralized	0.46471697092056274	0.5657859444618225	0.43499746918678284	0.45393452048301697	0.4490630030632019	0.31186196208000183	0.3994080722332001	0.48090076446533203	0.5026560425758362	0.14202682673931122
175	[]	False		[deleted]					dark	[removed]	fe993932d6dced4c0a879e9aa5d7a6e0fbb467f5	True	False					0	1660829341		0	{}	ikskanz	False	t3_wpqmo1	False	True	t3_wpqmo1	/r/ethereum/comments/wpqmo1/ama_we_are_the_go_ethereum_geth_team_18_august/ikskanz/	1660829353	1	False	True	False	ethereum	t5_2zf9m	r/ethereum	public		0	[]								 removed 	0.46707504987716675	0.5148742198944092	0.5170193910598755	0.5029740929603577	0.4936113953590393	0.5123135447502136	0.45383262634277344	0.4847692549228668	0.4981911778450012	0.5145108103752136
176	[]	False		AutoModerator						"Your submission was removed from /r/ethereum due to being too short. All text submissions must be at least 60 characters long.

*I am a bot, and this action was performed automatically. Please [contact the moderators of this subreddit](/message/compose/?to=/r/ethereum) if you have any questions or concerns.*"	f5350acfa4ebeaa5482eb2be2e6daa9c2d3776c0	True	False					0	1660829302	moderator	0	{}	iksk7i4	False	t3_wrjlwg	False	True	t3_wrjlwg	/r/ethereum/comments/wrjlwg/will_the_ant_miner_e9_be_less_profitable_when_eth/iksk7i4/	1660829315	1	False	False	False	ethereum	t5_2zf9m	r/ethereum	public		0	[]		[]	text	t2_6l4z3	False	True		your submission was removed from r ethereum due to being too short all text submissions must be at least 60 characters long i am a bot and this action was performed automatically please contact the moderators of this subreddit message compose to r ethereum if you have any questions or concerns 	0.003361653070896864	0.9877400994300842	0.3758471608161926	0.14455313980579376	0.008221076801419258	0.24413546919822693	0.11215468496084213	8.340520025740261e-07	0.331838995218277	0.019277073442935944
177	[]	False		Rtbrosk						XRP founders got all that pre mined coin that they thought all the stupid retail people in the workd was going to be their exit liquiity.....but when the SEC declares it a security......that dream is gone	46f71c7762fedf0d11f806eff19a13a6067b473e	True	False					0	1660829158		0	{}	iksjvkw	False	t3_wrgnln	False	True	t3_wrgnln	/r/ethereum/comments/wrgnln/vitalik_buterin_takes_aim_at_ripple_xrp_they/iksjvkw/	1660829173	1	False	True	False	ethereum	t5_2zf9m	r/ethereum	public		0	[]		[]	text	t2_7i9xvv9q	False	False		xrp founders got all that pre mined coin that they thought all the stupid retail people in the workd was going to be their exit liquiity but when the sec declares it a security that dream is gone	0.0033215468283742666	0.9793197512626648	0.7877476215362549	0.03783804550766945	0.9223222732543945	0.4382350742816925	0.0703161284327507	8.435536642537045e-07	0.4366154074668884	0.04730985313653946
178	[]	False		Vashe00						Yeah I hope that gets cleared up as well... I feel like over the last few days I have just seen quote after quote from him. It would be nice to hear him address everything	1b7041a00858309fcec976cee701400d63ec9e6a	True	False					0	1660829076		0	{}	iksjopp	True	t3_wri7c9	False	True	t1_iksig8q	/r/ethereum/comments/wri7c9/vitalik_buterin_to_discuss_ethereums_upcoming/iksjopp/	1660829087	1	False	True	False	ethereum	t5_2zf9m	r/ethereum	public		0	[]		[]	text	t2_b962u	False	False		yeah i hope that gets cleared up as well i feel like over the last few days i have just seen quote after quote from him it would be nice to hear him address everything	0.4909948706626892	0.43851304054260254	0.25589755177497864	0.009718300774693489	0.9687392711639404	0.6163544654846191	0.0997488796710968	8.458737852379272e-07	0.12361985445022583	0.015132716856896877
179	[]	False		[deleted]					dark	[removed]	fe993932d6dced4c0a879e9aa5d7a6e0fbb467f5	True	False					0	1660829057		0	{}	iksjn7d	False	t3_wpqmo1	False	True	t1_ikm9dbw	/r/ethereum/comments/wpqmo1/ama_we_are_the_go_ethereum_geth_team_18_august/iksjn7d/	1660829071	1	False	True	False	ethereum	t5_2zf9m	r/ethereum	public		0	[]								 removed 	0.46707504987716675	0.5148742198944092	0.5170193910598755	0.5029740929603577	0.4936113953590393	0.5123135447502136	0.45383262634277344	0.4847692549228668	0.4981911778450012	0.5145108103752136
180	[]	False		karalabe				Ethereum Foundation - Péter Szilágyi	dark	"EF is a non profit. On network launch it received an allocation of 11.9M Ether to steward the protocol until funds run out (https://etherscan.io/tx/0x9c81f44c29ff0226f835cd0a8a2f2a7eca6db52a711f8211b566fd15d3e0e8d4). At the time of launch this was worth about $9.6M. 

Currently there's about 341K Ether left from the original allocation: [https://etherscan.io/address/0xde0b295669a9fd93d5f28d9ec85e40f4cb697bae](https://etherscan.io/address/0xde0b295669a9fd93d5f28d9ec85e40f4cb697bae) \+ I assume some FIAT, but I don't have access to finances. EF is using these funds for grants, conferences and funding internal teams."	6462e53c51c96aa4eed2f2cc3e937583277572a1	True	False					0	1660829019		0	{}	iksjk31	False	t3_wpqmo1	False	False	t1_iksbx42	/r/ethereum/comments/wpqmo1/ama_we_are_the_go_ethereum_geth_team_18_august/iksjk31/	1660829031	1	False	True	False	ethereum	t5_2zf9m	r/ethereum	public		0	[]		[]	text	t2_cwe1u	False	False		ef is a non profit on network launch it received an allocation of 11 9m ether to steward the protocol until funds run out https etherscan io tx 0x9c81f44c29ff0226f835cd0a8a2f2a7eca6db52a711f8211b566fd15d3e0e8d4 at the time of launch this was worth about 9 6m currently there s about 341k ether left from the original allocation https etherscan io address 0xde0b295669a9fd93d5f28d9ec85e40f4cb697bae https etherscan io address 0xde0b295669a9fd93d5f28d9ec85e40f4cb697bae i assume some fiat but i don t have access to finances ef is using these funds for grants conferences and funding internal teams 	0.0028392758686095476	0.9891743659973145	0.08959003537893295	0.03818557783961296	0.007813263684511185	0.1825403869152069	0.14547359943389893	8.612386181994225e-07	0.4287528693675995	0.0016708122566342354
181	[]	False		throwaway275275275						Or such that it's likely he's not a shareholder of anything and just trying to scam someone	4f1ce343bf68aa0cd41719e191bfc43cc5c0b1a1	True	False					0	1660828941		0	{}	iksjdos	False	t3_wrb40d	False	True	t1_iks2vsz	/r/ethereum/comments/wrb40d/how_can_i_contact_a_wallet_owner/iksjdos/	1660828954	1	False	True	False	ethereum	t5_2zf9m	r/ethereum	public		0	[]		[]	text	t2_75ddo3ki	False	False		or such that it s likely he s not a shareholder of anything and just trying to scam someone	0.10399758070707321	0.7920749187469482	0.87028568983078	0.22942215204238892	0.3103225529193878	0.3008696138858795	0.08147671073675156	8.562413427171123e-07	0.3524780571460724	0.009727033786475658
182	[]	False		[deleted]					dark	[removed]	fe993932d6dced4c0a879e9aa5d7a6e0fbb467f5	True	False					0	1660828898		0	{}	iksja9f	False	t3_wpqmo1	False	True	t1_ikrmel5	/r/ethereum/comments/wpqmo1/ama_we_are_the_go_ethereum_geth_team_18_august/iksja9f/	1660828910	1	False	True	False	ethereum	t5_2zf9m	r/ethereum	public		0	[]								 removed 	0.46707504987716675	0.5148742198944092	0.5170193910598755	0.5029740929603577	0.4936113953590393	0.5123135447502136	0.45383262634277344	0.4847692549228668	0.4981911778450012	0.5145108103752136
