Unnamed: 0	all_awardings	archived	associated_award	author	author_flair_background_color	author_flair_css_class	author_flair_template_id	author_flair_text	author_flair_text_color	body	body_sha1	can_gild	collapsed	collapsed_because_crowd_control	collapsed_reason	collapsed_reason_code	comment_type	controversiality	created_utc	distinguished	gilded	gildings	id	is_submitter	link_id	locked	no_follow	parent_id	permalink	retrieved_utc	score	score_hidden	send_replies	stickied	subreddit	subreddit_id	subreddit_name_prefixed	subreddit_type	top_awarded_type	total_awards_received	treatment_tags	unrepliable_reason	author_flair_richtext	author_flair_type	author_fullname	author_patreon_flair	author_premium	author_cakeday	corpus	support	knowledge	conflict	power	similarity	fun	status	trust	identity	romance
0	[]	False		[deleted]					dark	[removed]	fe993932d6dced4c0a879e9aa5d7a6e0fbb467f5	True	False					0	1660809538		0	{}	ikrp2c8	False	t3_wr5cg8	False	True	t1_ikrlyt3	/r/ethereum/comments/wr5cg8/censorship_resistance_uasf/ikrp2c8/	1660809549	1	False	True	False	ethereum	t5_2zf9m	r/ethereum	public		0	[]								 removed 	0.46707504987716675	0.5148742198944092	0.5170193910598755	0.5029740929603577	0.4936113953590393	0.5123135447502136	0.45383262634277344	0.4847692549228668	0.4981911778450012	0.5145108103752136
1	[]	False		karalabe				Ethereum Foundation - Péter Szilágyi	dark	To further expand, Geth also has some plans to distribute beacon state on the devp2p network and allow Geth-only nodes to follow the merged network without a beacon client. This would be a tiny subset of the beacon protocol and would only allow following  (maybe with a 1 block delay) and not validating. Still, for most people who don't validate or don't care about a 14s delay, it might be simpler than having to run 2 different software side by side.	67db101dea900de943284f402f630a35cf4777d1	True	False					0	1660809521		0	{}	ikrp1kx	False	t3_wpqmo1	False	True	t1_ikm8h0b	/r/ethereum/comments/wpqmo1/ama_we_are_the_go_ethereum_geth_team_18_august/ikrp1kx/	1660809532	1	False	True	False	ethereum	t5_2zf9m	r/ethereum	public		0	[]		[]	text	t2_cwe1u	False	False		to further expand geth also has some plans to distribute beacon state on the devp2p network and allow geth only nodes to follow the merged network without a beacon client this would be a tiny subset of the beacon protocol and would only allow following maybe with a 1 block delay and not validating still for most people who don t validate or don t care about a 14s delay it might be simpler than having to run 2 different software side by side 	0.0028276622761040926	0.9882128834724426	0.296599805355072	0.9377054572105408	0.00886341743171215	0.4688766300678253	0.0770471915602684	8.639764246254344e-07	0.39445656538009644	0.022218408063054085
2	[]	False		Jacobsendy						One of the fixes is account management and control, as well as easy authorization of users. Protocols facilitating cross-chain identities will play major role in improving DeFi services and its adoption.	c76f2b455d8008074bb3e23604a8154448dc8406	True	False					0	1660809389		0	{}	ikrovtl	False	t3_wqtmz2	False	True	t1_ikogntd	/r/ethereum/comments/wqtmz2/what_will_happen_to_defi_sooner_or_later/ikrovtl/	1660809400	1	False	True	False	ethereum	t5_2zf9m	r/ethereum	public		0	[]		[]	text	t2_cg7evqra	False	False		one of the fixes is account management and control as well as easy authorization of users protocols facilitating cross chain identities will play major role in improving defi services and its adoption 	0.04307461902499199	0.9866588115692139	0.07267110049724579	0.7568895816802979	0.8627009391784668	0.25273603200912476	0.1867111474275589	0.3747645616531372	0.4957352578639984	0.007254939991980791
3	[]	False		karalabe				Ethereum Foundation - Péter Szilágyi	dark	"The short answer is that we don't care about forks of Geth.

The longer form answer would be that we have the luxury of not having to care about people who fork our code. Being fully funded by the EF, we can focus on the needs of the Ethereum network without having to tailor for others. This in the long term is IMHO important, because we can do very wild internal changes that are good for us, but might be painful on forks that made some tweaks (e.g. one of our releases caused a consensus split in Avalanche because our snapshot data model was incompatible with their cross chain transfers).

Whilst we definitely will not make changes just to make other people's lives harder, we also will not omit a good change just because it will make some fork's life harder. Our policy is that Geth is OSS, everyone is free to fork it, but forking entails maintenance. Nobody should expect to run with our code and then have us fix issues that they encounter.

\&gt; And would it be right to assume that if there were ever changes on the roadmap that complicate alt-ecosystems roadmaps, they would just need to use an older version, fork, and work from there?

That is correct. Their options are either to minimize their changes and keep surfing the releases (e.g. Optimism), or if they do deep changes, then sooner or later they'll need a full dev team if the codebases diverge. I would really advise people to avoid doing the latter, it's insane to review PRs on Geth as is, I can't imagine how it would be to mutate our code into something else on a day to day basis."	f4ad5a3427de2fe3dd4e018cf99284cace48ef60	True	False					0	1660809338		0	{}	ikrotn1	False	t3_wpqmo1	False	True	t1_iki4c7b	/r/ethereum/comments/wpqmo1/ama_we_are_the_go_ethereum_geth_team_18_august/ikrotn1/	1660809352	1	False	True	False	ethereum	t5_2zf9m	r/ethereum	public		0	[]		[]	text	t2_cwe1u	False	False		the short answer is that we don t care about forks of geth the longer form answer would be that we have the luxury of not having to care about people who fork our code being fully funded by the ef we can focus on the needs of the ethereum network without having to tailor for others this in the long term is imho important because we can do very wild internal changes that are good for us but might be painful on forks that made some tweaks e g one of our releases caused a consensus split in avalanche because our snapshot data model was incompatible with their cross chain transfers whilst we definitely will not make changes just to make other people s lives harder we also will not omit a good change just because it will make some fork s life harder our policy is that geth is oss everyone is free to fork it but forking entails maintenance nobody should expect to run with our code and then have us fix issues that they encounter gt and would it be right to assume that if there were ever changes on the roadmap that complicate alt ecosystems roadmaps they would just need to use an older version fork and work from there that is correct their options are either to minimize their changes and keep surfing the releases e g optimism or if they do deep changes then sooner or later they ll need a full dev team if the codebases diverge i would really advise people to avoid doing the latter it s insane to review prs on geth as is i can t imagine how it would be to mutate our code into something else on a day to day basis 	0.0021294003818184137	0.9891954660415649	0.5773165225982666	0.010325301438570023	0.007345499936491251	0.5028079152107239	0.06424149870872498	8.41262419726263e-07	0.22684788703918457	0.015314586460590363
4	[]	False		guillaumeballet				Go Ethereum @ EF - Guillaume Ballet	dark	Erigon is turning go-ethereum into a C++ client with bits of rust, so your hopes lie there.	5ccbf12f5125fb67823cf126c651a650b4ddbd21	True	False					0	1660809325		0	{}	ikrot22	False	t3_wpqmo1	False	True	t1_ikiijx0	/r/ethereum/comments/wpqmo1/ama_we_are_the_go_ethereum_geth_team_18_august/ikrot22/	1660809337	1	False	True	False	ethereum	t5_2zf9m	r/ethereum	public		0	[]		[]	text	t2_rjbmkbhd	False	False		erigon is turning go ethereum into a c client with bits of rust so your hopes lie there 	0.3925535976886749	0.7958279252052307	0.6168654561042786	0.15188048779964447	0.14027023315429688	0.4441952109336853	0.13882695138454437	1.2541129308374366e-06	0.38933590054512024	0.02198108844459057
5	[]	False		nishinoran						"Yup, would definitely love to see dApps be a lot less ""online""."	ae19c471349983171e7566643461c8f169a30e62	True	False					0	1660809045		0	{}	ikroglt	False	t3_wr64xs	False	True	t1_ikrfsjr	/r/ethereum/comments/wr64xs/front_end_javascript_has_been_a_colossal_mistake/ikroglt/	1660809057	1	False	True	False	ethereum	t5_2zf9m	r/ethereum	public		0	[]		[]	text	t2_u34rs	False	False		yup would definitely love to see dapps be a lot less online 	0.6043183207511902	0.3625030815601349	0.15551115572452545	0.05832349881529808	0.4165706932544708	0.36959347128868103	0.5101906657218933	0.5472338199615479	0.43364453315734863	0.4724012613296509
6	[]	False		karalabe				Ethereum Foundation - Péter Szilágyi	dark	We have never received any request to do such a thing, or to even think about how we would do such a thing. Since it is a loaded topic where people can have varying and heated feelings, I think this topic is best left alone until - if ever - such a scenario arises.	64a82777d8a7e8fbf24c28186c10001f6f0eefc6	True	False					0	1660808948		0	{}	ikroc8n	False	t3_wpqmo1	False	True	t1_ikivhdc	/r/ethereum/comments/wpqmo1/ama_we_are_the_go_ethereum_geth_team_18_august/ikroc8n/	1660808963	1	False	True	False	ethereum	t5_2zf9m	r/ethereum	public		0	[]		[]	text	t2_cwe1u	False	False		we have never received any request to do such a thing or to even think about how we would do such a thing since it is a loaded topic where people can have varying and heated feelings i think this topic is best left alone until if ever such a scenario arises 	0.003555185627192259	0.9881334900856018	0.6605367660522461	0.013112819753587246	0.007875931449234486	0.4353838264942169	0.07869391143321991	8.182680062418513e-07	0.38529473543167114	0.018890731036663055
7	[]	False		makesnosenseatall						Flashbots is already censoring transactions. Source: https://twitter.com/bantg/status/1559948198508118016	393eb6964dbf1f8c83590e489c864eb9e15a5d58	True	False					0	1660808844		0	{}	ikro7hw	False	t3_wr5cg8	False	False	t3_wr5cg8	/r/ethereum/comments/wr5cg8/censorship_resistance_uasf/ikro7hw/	1660808855	1	False	True	False	ethereum	t5_2zf9m	r/ethereum	public		0	[]		[]	text	t2_63z1i	False	False		flashbots is already censoring transactions source https twitter com bantg status 1559948198508118016	0.08215170353651047	0.8465766906738281	0.41203129291534424	0.6828181147575378	0.1837703436613083	0.07521718740463257	0.35256680846214294	0.20808807015419006	0.48907455801963806	1.0327854397473857e-05
8	[]	False		[deleted]					dark	[removed]	fe993932d6dced4c0a879e9aa5d7a6e0fbb467f5	True	False					0	1660808793		0	{}	ikro56d	False	t3_wqvf3s	False	True	t1_ikqyr14	/r/ethereum/comments/wqvf3s/question_about_staking/ikro56d/	1660808806	1	False	True	False	ethereum	t5_2zf9m	r/ethereum	public		0	[]								 removed 	0.46707504987716675	0.5148742198944092	0.5170193910598755	0.5029740929603577	0.4936113953590393	0.5123135447502136	0.45383262634277344	0.4847692549228668	0.4981911778450012	0.5145108103752136
9	[]	False		[deleted]					dark	[removed]	fe993932d6dced4c0a879e9aa5d7a6e0fbb467f5	True	False					0	1660808783		0	{}	ikro4qo	False	t3_wqvf3s	False	True	t3_wqvf3s	/r/ethereum/comments/wqvf3s/question_about_staking/ikro4qo/	1660808795	1	False	True	False	ethereum	t5_2zf9m	r/ethereum	public		0	[]								 removed 	0.46707504987716675	0.5148742198944092	0.5170193910598755	0.5029740929603577	0.4936113953590393	0.5123135447502136	0.45383262634277344	0.4847692549228668	0.4981911778450012	0.5145108103752136
10	[]	False		karalabe				Ethereum Foundation - Péter Szilágyi	dark	"Snap sync is already pretty much that. Each client has a different internal data model, so you still need to retrieve all the data and transform it into your own local format. Most of the time is spent on writing the data to disk, not really verifying it.

The only verification you could maybe shave off are a few hashings, but it's always nice for data integrity to check that. E.g. checking the entire snapshot data on mainnet is 7 minutes. In the grand scheme of things, that's not much to save vs. being sure the data was correct."	33a8429f6097121b03c7a7325aa7eb78418f7e39	True	False					0	1660808721		0	{}	ikro1xx	False	t3_wpqmo1	False	True	t1_ikiaamd	/r/ethereum/comments/wpqmo1/ama_we_are_the_go_ethereum_geth_team_18_august/ikro1xx/	1660808734	1	False	True	False	ethereum	t5_2zf9m	r/ethereum	public		0	[]		[]	text	t2_cwe1u	False	False		snap sync is already pretty much that each client has a different internal data model so you still need to retrieve all the data and transform it into your own local format most of the time is spent on writing the data to disk not really verifying it the only verification you could maybe shave off are a few hashings but it s always nice for data integrity to check that e g checking the entire snapshot data on mainnet is 7 minutes in the grand scheme of things that s not much to save vs being sure the data was correct 	0.0026384061202406883	0.9889615178108215	0.0031288631726056337	0.03673497959971428	0.9941352605819702	0.44357696175575256	0.07000365853309631	8.48344996029482e-07	0.33340558409690857	0.007647260092198849
11	[]	False		hashzzz						UD is centralized, ENS is decentralized	029393cc2bcb7de59ebb7aa62f201d33bd8b28d7	True	False					0	1660808694		0	{}	ikro0pw	False	t3_wqpsoa	False	True	t3_wqpsoa	/r/ethereum/comments/wqpsoa/why_ens_domains_are_more_popular_than_unstoppable/ikro0pw/	1660808706	1	False	True	False	ethereum	t5_2zf9m	r/ethereum	public		0	[]		[]	text	t2_4pcz0ap0	False	False		ud is centralized ens is decentralized	0.34072980284690857	0.6005744338035583	0.5920052528381348	0.5139558911323547	0.5030304193496704	0.3415603041648865	0.3480786085128784	0.4270871877670288	0.5654788017272949	0.0587480328977108
12	[]	False		herospidermine						"&gt;Irrelevant

you forgot to say why

&gt;it's people being close together

being close to one member of a community does not make you a member of that community. visiting your son in prison doesn't make you a prisoner. that's beyond obvious.

&gt;give away power to an elite

Yeah, and the voters are completely uninvolved. Or if they're involved, they're helpless. Their arms literally cannot hold a pitchfork. They're constitutionally incapable of revolting, due to genetic engineering. Na. Sorry to inform you that you are morally responsible for your vote.

&gt;Where is it, exactly?

Literally anywhere except the US. Unless you're too timid."	b58eab7b80fa4797d7a337bf6f40c5d78208472a	True	False					0	1660808250		0	{}	ikrnghi	False	t3_wpyzyp	False	True	t1_ikqwgyg	/r/ethereum/comments/wpyzyp/vitalik_buterin_wishes_to_burn_the_ethers_of_the/ikrnghi/	1660808263	1	False	True	False	ethereum	t5_2zf9m	r/ethereum	public		0	[]		[]	text	t2_n7fbeb9r	False	False		 gt irrelevant you forgot to say why gt it s people being close together being close to one member of a community does not make you a member of that community visiting your son in prison doesn t make you a prisoner that s beyond obvious gt give away power to an elite yeah and the voters are completely uninvolved or if they re involved they re helpless their arms literally cannot hold a pitchfork they re constitutionally incapable of revolting due to genetic engineering na sorry to inform you that you are morally responsible for your vote gt where is it exactly literally anywhere except the us unless you re too timid 	0.0024629426188766956	0.9883341789245605	0.9339694380760193	0.010403212159872055	0.008459806442260742	0.44581717252731323	0.07531295716762543	8.34606623811851e-07	0.381757915019989	0.009096037596464157
13	[]	False		throwaway275275275						Can you post this in your native language ?	bc59c78a92256a871c078ee2819f27767d66b9ce	True	False					0	1660808247		0	{}	ikrngcm	False	t3_wrb40d	False	True	t1_ikrj637	/r/ethereum/comments/wrb40d/how_can_i_contact_a_wallet_owner/ikrngcm/	1660808258	1	False	True	False	ethereum	t5_2zf9m	r/ethereum	public		0	[]		[]	text	t2_75ddo3ki	False	False		can you post this in your native language 	0.4407763183116913	0.5424577593803406	0.32783499360084534	0.501857340335846	0.39262980222702026	0.4188123941421509	0.4657251536846161	0.59376460313797	0.5140217542648315	0.054853178560733795
14	[]	False		karalabe				Ethereum Foundation - Péter Szilágyi	dark	"Our next highest priority is pruning. This was always the Achilles heel of Geth. Luckily we've managed to figure out a version that seems to work well and we can ship in in a few months (we figured out how to do it a long time ago, but it needed a new data model, which was incompatible with fast sync, so we needed  a new sync (snap sync), but that needed a new acceleration structure (snapshots)).

My guess is that there will be a few protocol updates afterwards on the EVM level, getting rid of SELFDESTRUCT, adding support for withdrawals, hopefully blob transactions to help L2s a lot. These I think are all realistic for early next year.

As for long term, there's a fairly strong push for Verkle trees, but there are still some design issues that we don't see eye to eye on, so that's a moving target. The idea is nice, we just need to find the practical sweet spot before we commit to it. If that could enable stateless clients, that would be an absolute win for the ecosystem."	9ad9dfa7d4a1fd06758f367718b4d239ff572764	True	False					0	1660807877		0	{}	ikrmzwh	False	t3_wpqmo1	False	True	t1_ikia0qx	/r/ethereum/comments/wpqmo1/ama_we_are_the_go_ethereum_geth_team_18_august/ikrmzwh/	1660807890	1	False	True	False	ethereum	t5_2zf9m	r/ethereum	public		0	[]		[]	text	t2_cwe1u	False	False		our next highest priority is pruning this was always the achilles heel of geth luckily we ve managed to figure out a version that seems to work well and we can ship in in a few months we figured out how to do it a long time ago but it needed a new data model which was incompatible with fast sync so we needed a new sync snap sync but that needed a new acceleration structure snapshots my guess is that there will be a few protocol updates afterwards on the evm level getting rid of selfdestruct adding support for withdrawals hopefully blob transactions to help l2s a lot these i think are all realistic for early next year as for long term there s a fairly strong push for verkle trees but there are still some design issues that we don t see eye to eye on so that s a moving target the idea is nice we just need to find the practical sweet spot before we commit to it if that could enable stateless clients that would be an absolute win for the ecosystem 	0.002547676209360361	0.9890797734260559	0.002778918482363224	0.018500540405511856	0.008631201460957527	0.4063766896724701	0.08401554822921753	8.555606427762541e-07	0.20620983839035034	0.013257483951747417
15	[]	False		Koolaidolio						Loopring smart wallet for you	27751c58405c55f1a1757d2de0f5bad58b6aa8fd	True	False					0	1660807870		0	{}	ikrmzlb	False	t3_wqy5b4	False	True	t3_wqy5b4	/r/ethereum/comments/wqy5b4/f_robinhood/ikrmzlb/	1660807883	1	False	True	False	ethereum	t5_2zf9m	r/ethereum	public		0	[]		[]	text	t2_6kstr	False	True		loopring smart wallet for you	0.558401346206665	0.43459755182266235	0.3828102946281433	0.4708431661128998	0.40787506103515625	0.5612604022026062	0.5110817551612854	0.5206358432769775	0.40726953744888306	0.2276226431131363
16	[]	False		[deleted]					dark	[removed]	fe993932d6dced4c0a879e9aa5d7a6e0fbb467f5	True	False					0	1660807712		0	{}	ikrmsb7	False	t3_wqzq0i	False	True	t3_wqzq0i	/r/ethereum/comments/wqzq0i/zkbased_privacy_tools_are_truly_not_mixers_you/ikrmsb7/	1660807724	1	False	True	False	ethereum	t5_2zf9m	r/ethereum	public		0	[]								 removed 	0.46707504987716675	0.5148742198944092	0.5170193910598755	0.5029740929603577	0.4936113953590393	0.5123135447502136	0.45383262634277344	0.4847692549228668	0.4981911778450012	0.5145108103752136
17	[]	False		karalabe				Ethereum Foundation - Péter Szilágyi	dark	"\&gt; What do you like about working at the EF?

The loosely organized nature.

\&gt; What do you dislike about working at the EF?

The loosely organized nature.

:P

\---

The EF admittedly changed a lot in these past 8 years. Originally it was a very tight nit group of mostly programmers mostly working on exactly the same things. This meant that it was very easy to pick up conversations with people and everybody knew everyone else (except the board members, we don't talk about them ;P ).

Currently there are many teams working on many things and it's not always obvious who to reach and how if you want something resolved. Of course the upside of this is that there are a lot more people helping out with non-programming stuff too, so you have a higher chance of getting your problems heard vs. when you had to talk to the CEO for a plane ticket :).

On coding side, EF became much ""less relevant"", in that most developments happening in Ethereum world happens on the outside. I guess this can be called a success for the ecosystem, but it does make working here feel like being a bit out of the loop, since all the cool stuff happens on top of the platform. Sometimes I feel that it would be nice if EF also had some interesting projects on top, not just at the protocol level.

Also, researchers and especially Danny is weird. I don't trust that guy ;)"	9dcd6af11da13cdf561ee42147380e367af2ff14	True	False					0	1660807457		0	{}	ikrmgna	False	t3_wpqmo1	False	True	t1_ikigp13	/r/ethereum/comments/wpqmo1/ama_we_are_the_go_ethereum_geth_team_18_august/ikrmgna/	1660807469	1	False	True	False	ethereum	t5_2zf9m	r/ethereum	public		0	[]		[]	text	t2_cwe1u	False	False		 gt what do you like about working at the ef the loosely organized nature gt what do you dislike about working at the ef the loosely organized nature p the ef admittedly changed a lot in these past 8 years originally it was a very tight nit group of mostly programmers mostly working on exactly the same things this meant that it was very easy to pick up conversations with people and everybody knew everyone else except the board members we don t talk about them p currently there are many teams working on many things and it s not always obvious who to reach and how if you want something resolved of course the upside of this is that there are a lot more people helping out with non programming stuff too so you have a higher chance of getting your problems heard vs when you had to talk to the ceo for a plane ticket on coding side ef became much less relevant in that most developments happening in ethereum world happens on the outside i guess this can be called a success for the ecosystem but it does make working here feel like being a bit out of the loop since all the cool stuff happens on top of the platform sometimes i feel that it would be nice if ef also had some interesting projects on top not just at the protocol level also researchers and especially danny is weird i don t trust that guy 	0.0023807801771909	0.9886561632156372	0.07063208520412445	0.010069365613162518	0.9941447377204895	0.7975731492042542	0.09385884553194046	8.323594897774456e-07	0.25056371092796326	0.0072735571302473545
18	[]	False		edmundedgar				reality.eth	dark	"When Ethereum got started I read a lot of optimistic stuff about light clients, but it seems like so far they haven't got much traction. Part of the problem seems to be that there's a lack of nodes serving data to them, geth turns it off by default, and there hasn't been much communication asking people to turn it on.

Are the current generation of light clients valuable? Is it helpful for people running nodes to turn on `--light.serve`? Or are we better just forgetting about light clients until various new technical stuff gets done after the merge?"	1fa7c8d8c50c96820246160c3d2456df97b6d8c7	True	False					0	1660807412		0	{}	ikrmel5	False	t3_wpqmo1	False	True	t3_wpqmo1	/r/ethereum/comments/wpqmo1/ama_we_are_the_go_ethereum_geth_team_18_august/ikrmel5/	1660807427	1	False	True	False	ethereum	t5_2zf9m	r/ethereum	public		0	[]		[]	text	t2_b8j29	False	False		when ethereum got started i read a lot of optimistic stuff about light clients but it seems like so far they haven t got much traction part of the problem seems to be that there s a lack of nodes serving data to them geth turns it off by default and there hasn t been much communication asking people to turn it on are the current generation of light clients valuable is it helpful for people running nodes to turn on light serve or are we better just forgetting about light clients until various new technical stuff gets done after the merge 	0.0026166243478655815	0.987957775592804	0.3429794907569885	0.0158438291400671	0.9940088987350464	0.5848093032836914	0.07771991193294525	8.469343697470322e-07	0.2388438880443573	0.007665743585675955
19	[]	False		[deleted]					dark	[removed]	fe993932d6dced4c0a879e9aa5d7a6e0fbb467f5	True	False					0	1660807372		0	{}	ikrmcrd	False	t3_wqy5b4	False	True	t3_wqy5b4	/r/ethereum/comments/wqy5b4/f_robinhood/ikrmcrd/	1660807383	1	False	True	False	ethereum	t5_2zf9m	r/ethereum	public		0	[]								 removed 	0.46707504987716675	0.5148742198944092	0.5170193910598755	0.5029740929603577	0.4936113953590393	0.5123135447502136	0.45383262634277344	0.4847692549228668	0.4981911778450012	0.5145108103752136
20	[]	False		Azephiar						You just described substrate and substrate connect.	a3de37d0dee78f056f938757f1db3d4ee983bf56	True	False					0	1660807359		0	{}	ikrmc7a	False	t3_wr64xs	False	True	t3_wr64xs	/r/ethereum/comments/wr64xs/front_end_javascript_has_been_a_colossal_mistake/ikrmc7a/	1660807376	1	False	True	False	ethereum	t5_2zf9m	r/ethereum	public		0	[]		[]	text	t2_cr7090gf	False	False		you just described substrate and substrate connect 	0.28103604912757874	0.6146084070205688	0.40649208426475525	0.30696558952331543	0.4582040011882782	0.27271002531051636	0.4480292797088623	0.3860623240470886	0.538327157497406	0.24342888593673706
