Unnamed: 0	all_awardings	archived	associated_award	author	author_flair_background_color	author_flair_css_class	author_flair_template_id	author_flair_text	author_flair_text_color	body	body_sha1	can_gild	collapsed	collapsed_because_crowd_control	collapsed_reason	collapsed_reason_code	comment_type	controversiality	created_utc	distinguished	gilded	gildings	id	is_submitter	link_id	locked	no_follow	parent_id	permalink	retrieved_utc	score	score_hidden	send_replies	stickied	subreddit	subreddit_id	subreddit_name_prefixed	subreddit_type	top_awarded_type	total_awards_received	treatment_tags	unrepliable_reason	author_flair_richtext	author_flair_type	author_fullname	author_patreon_flair	author_premium	author_cakeday	corpus	support	knowledge	conflict	power	similarity	fun	status	trust	identity	romance
74	[]	False		sagarbansal21						In order to get mass adoption, we do need regulatory licenses from countries around the world. Projects like Scallop are on a mission to bank all the people.	d9a65a46226536a22202f060c903aed7fc1dfc50	True	False					0	1660799836		0	{}	ikrc3xz	False	t3_wmswnz	False	True	t3_wmswnz	/r/ethereum/comments/wmswnz/is_regulation_required_for_defi_to_provide_banks/ikrc3xz/	1660799847	1	False	True	False	ethereum	t5_2zf9m	r/ethereum	public		0	[]		[]	text	t2_1gjrqhbe	False	False		in order to get mass adoption we do need regulatory licenses from countries around the world projects like scallop are on a mission to bank all the people 	0.047209564596414566	0.984931468963623	0.15600253641605377	0.9403248429298401	0.38426539301872253	0.3409629166126251	0.08559837192296982	0.000569306081160903	0.4470546543598175	0.005577570758759975
75	[]	False		GodMonero						monero better	5b7e1c26821c29594db0beae35ec1d086f051b9e	True	False					0	1660799465		0	{}	ikrbjhk	False	t3_wr8hx5	False	True	t3_wr8hx5	/r/ethereum/comments/wr8hx5/i_want_to_start_mining_eth_i_dont_know_how_to_can/ikrbjhk/	1660799479	1	False	True	False	ethereum	t5_2zf9m	r/ethereum	public		0	[]		[]	text	t2_larmmz8	False	False		monero better	0.5028546452522278	0.5168009996414185	0.48969143629074097	0.4567185342311859	0.4695378839969635	0.4708506464958191	0.47595706582069397	0.48871082067489624	0.4826070964336395	0.3919508159160614
76	[]	False		themoneydownloader						Duh	d4833aeda7799fc502a70163b28f8897c63208f4	True	False					0	1660799343		0	{}	ikrbcsh	False	t3_wqy5b4	False	True	t3_wqy5b4	/r/ethereum/comments/wqy5b4/f_robinhood/ikrbcsh/	1660799353	1	False	True	False	ethereum	t5_2zf9m	r/ethereum	public		0	[]		[]	text	t2_bredk6el	False	False		duh	0.4781513512134552	0.46192917227745056	0.5710604786872864	0.48498567938804626	0.49638843536376953	0.5841977000236511	0.46735328435897827	0.4788679778575897	0.4803788363933563	0.5462176203727722
77	[]	False		[deleted]					dark	[removed]	fe993932d6dced4c0a879e9aa5d7a6e0fbb467f5	True	False					0	1660799299		0	{}	ikrbae8	False	t3_wpyzyp	False	True	t1_ikooghj	/r/ethereum/comments/wpyzyp/vitalik_buterin_wishes_to_burn_the_ethers_of_the/ikrbae8/	1660799312	1	False	True	False	ethereum	t5_2zf9m	r/ethereum	public		0	[]								 removed 	0.46707504987716675	0.5148742198944092	0.5170193910598755	0.5029740929603577	0.4936113953590393	0.5123135447502136	0.45383262634277344	0.4847692549228668	0.4981911778450012	0.5145108103752136
78	[]	False		marabutt						The things that put me off using it are the energy inefficencies, the high cost and low throughput of transactions, the highly unstable value of the currencies . I might look after the merge.	d323e5a66c8f6d6a7d0196d91830602ae3541419	True	False					0	1660799040		0	{}	ikravwo	False	t3_wqtmz2	False	True	t3_wqtmz2	/r/ethereum/comments/wqtmz2/what_will_happen_to_defi_sooner_or_later/ikravwo/	1660799053	1	False	True	False	ethereum	t5_2zf9m	r/ethereum	public		0	[]		[]	text	t2_xuonn	False	False		the things that put me off using it are the energy inefficencies the high cost and low throughput of transactions the highly unstable value of the currencies i might look after the merge 	0.02627621777355671	0.9792390465736389	0.42910799384117126	0.6479931473731995	0.40483325719833374	0.3439229428768158	0.08653522282838821	8.48781155582401e-07	0.41880109906196594	0.06814201176166534
79	[]	False		wood8						"DeFi: code is law

CeFi: third party is law"	cf2a3d4c2483721eef1436eaf22a46c7457a954f	True	False					0	1660798936		0	{}	ikraq5t	False	t3_wqtmz2	False	False	t1_ikpgkvy	/r/ethereum/comments/wqtmz2/what_will_happen_to_defi_sooner_or_later/ikraq5t/	1660798947	1	False	True	False	ethereum	t5_2zf9m	r/ethereum	public		0	[]		[]	text	t2_t442qv4	False	False		defi code is law cefi third party is law	0.18829120695590973	0.7444008588790894	0.5232482552528381	0.6955581903457642	0.36943167448043823	0.36343875527381897	0.33794766664505005	0.24692752957344055	0.5807241797447205	0.008428187109529972
80	[]	False		wood8						So you think somehow defi is more likely to have problem than cefi?	9f4a95e6052a90fcbbb75d9e5c7c25c7866f4c98	True	False					0	1660798867		0	{}	ikrama7	False	t3_wqtmz2	False	True	t1_ikp0rhh	/r/ethereum/comments/wqtmz2/what_will_happen_to_defi_sooner_or_later/ikrama7/	1660798878	1	False	True	False	ethereum	t5_2zf9m	r/ethereum	public		0	[]		[]	text	t2_t442qv4	False	False		so you think somehow defi is more likely to have problem than cefi 	0.17354559898376465	0.6877501010894775	0.5086333751678467	0.08348226547241211	0.319595605134964	0.07650642096996307	0.24150481820106506	0.2687145173549652	0.4901268780231476	7.624986756127328e-05
81	[]	False		iPhone40						Monero doesn’t do smart contracts	44139718770fe884ebc23195e806d41061a0c9fa	True	False					0	1660798620		0	{}	ikra8ic	False	t3_wr3412	False	True	t1_ikqsdyk	/r/ethereum/comments/wr3412/tornado_cash_alternatives/ikra8ic/	1660798634	1	False	True	False	ethereum	t5_2zf9m	r/ethereum	public		0	[]		[]	text	t2_dq3grhna	False	False		monero doesn t do smart contracts	0.49406692385673523	0.5128830671310425	0.4717238247394562	0.4901476204395294	0.4096493721008301	0.5151806473731995	0.37866178154945374	0.282950758934021	0.4735706150531769	0.02797698602080345
82	[]	False		pale_blue_dots						"Yes. Thank you. 

Robinhood and nearly all the other brokerages save a very, very few all don't charge fees on trades because *the customers i.e. ""you"" ARE the product.* 

They're using your info and data and shares against you to drive the price down in convoluted and nutbally, lobbying-induced *cheating* to put it simply. 

Hell, when you buy a share at almost every single last brokerage, the share isn't even technically yours. It's not in your name. It's in ""Street Name"" which is, technically, owned by not even the brokerage, but a (criminal, in all honesty and simplicity) organization called Cede and Co. andor the DTCC - which, as mentioned before, can be used against you by the hedge funds and what not in various opaque lending mechanisms and other super-psycho derivative type things."	3795920067350e5252d3a9dd31508eb74a0445b7	True	False					0	1660797889		0	{}	ikr92o7	False	t3_wqy5b4	False	False	t1_ikq5itu	/r/ethereum/comments/wqy5b4/f_robinhood/ikr92o7/	1660797901	1	False	True	False	ethereum	t5_2zf9m	r/ethereum	public		0	[]		[]	text	t2_29wiw875	False	False		yes thank you robinhood and nearly all the other brokerages save a very very few all don t charge fees on trades because the customers i e you are the product they re using your info and data and shares against you to drive the price down in convoluted and nutbally lobbying induced cheating to put it simply hell when you buy a share at almost every single last brokerage the share isn t even technically yours it s not in your name it s in street name which is technically owned by not even the brokerage but a criminal in all honesty and simplicity organization called cede and co andor the dtcc which as mentioned before can be used against you by the hedge funds and what not in various opaque lending mechanisms and other super psycho derivative type things 	0.002332226140424609	0.9886268973350525	0.5944111943244934	0.01902088336646557	0.008544872514903545	0.34100237488746643	0.09945707768201828	8.377157882932806e-07	0.5529261827468872	0.005589880049228668
83	[]	False		pale_blue_dots						"Don't feed into that person's antagonism and anger towards you. Be the better and bigger man, man. No need to call him an ""idiot"" - as good as that feels in the moment. It's all good, my friend... just wanting to put that out there. I'm with ya."	9004ca4f47b4d9f6fdbd8589a39858f71f53746c	True	False					0	1660797583		0	{}	ikr8ks1	False	t3_wqy5b4	False	True	t1_ikpzib5	/r/ethereum/comments/wqy5b4/f_robinhood/ikr8ks1/	1660797595	1	False	True	False	ethereum	t5_2zf9m	r/ethereum	public		0	[]		[]	text	t2_29wiw875	False	False		don t feed into that person s antagonism and anger towards you be the better and bigger man man no need to call him an idiot as good as that feels in the moment it s all good my friend just wanting to put that out there i m with ya 	0.002728548366576433	0.398314893245697	0.9486076831817627	0.011217898689210415	0.008441458456218243	0.6652586460113525	0.06318008154630661	8.010343890418881e-07	0.1359662115573883	0.035929057747125626
84	[]	False		EricC137						If you don’t like Robinhood you’ll hate coinbase. It’s pretty much the same thing but with high fees and they scam you on prices if you buy or sell. Want to sell some crypto? The price they offer is lower than current market value. Want to buy? Well guess what, that same asset is now worth more than current market value. It’s a literal scam	ef8c26f686f27ddb8137bd0a402c26e9dda482f0	True	False					0	1660797054		0	{}	ikr7oys	False	t3_wqy5b4	False	True	t3_wqy5b4	/r/ethereum/comments/wqy5b4/f_robinhood/ikr7oys/	1660797064	1	False	True	False	ethereum	t5_2zf9m	r/ethereum	public		0	[]		[]	text	t2_orrbmuh	False	False		if you don t like robinhood you ll hate coinbase it s pretty much the same thing but with high fees and they scam you on prices if you buy or sell want to sell some crypto the price they offer is lower than current market value want to buy well guess what that same asset is now worth more than current market value it s a literal scam	0.002221937058493495	0.9890907406806946	0.4668484926223755	0.016371604055166245	0.00793847069144249	0.4066203236579895	0.08410555124282837	8.477376240989543e-07	0.3666158616542816	0.0016823762562125921
85	[]	False		MothsAflame						ILV	b92ccbb30abfa1b42fee129138d05fbfacd83bbf	True	False					0	1660796902		0	{}	ikr7fqe	False	t3_wqh15g	False	True	t3_wqh15g	/r/ethereum/comments/wqh15g/what_will_be_the_next_hyped_market/ikr7fqe/	1660796915	1	False	True	False	ethereum	t5_2zf9m	r/ethereum	public		0	[]		[]	text	t2_dtjxn	False	False		ilv	0.4630463123321533	0.5352395176887512	0.4963502883911133	0.4709847569465637	0.4710223376750946	0.1883898675441742	0.49946311116218567	0.4854360520839691	0.5007144808769226	0.4087046682834625
86	[]	False		[deleted]					dark	[removed]	fe993932d6dced4c0a879e9aa5d7a6e0fbb467f5	True	False					0	1660796765		0	{}	ikr77f7	False	t3_wqpsoa	False	True	t3_wqpsoa	/r/ethereum/comments/wqpsoa/why_ens_domains_are_more_popular_than_unstoppable/ikr77f7/	1660796779	1	False	True	False	ethereum	t5_2zf9m	r/ethereum	public		0	[]								 removed 	0.46707504987716675	0.5148742198944092	0.5170193910598755	0.5029740929603577	0.4936113953590393	0.5123135447502136	0.45383262634277344	0.4847692549228668	0.4981911778450012	0.5145108103752136
87	[]	False		alpacadaver						Exactly, there are no UTXOs so it's just addition and subtraction.	4ff2c8ec50c77948bf6470b69cf4cd168773df2c	True	False					0	1660796036		0	{}	ikr5yen	False	t3_wqzq0i	False	True	t1_ikr096a	/r/ethereum/comments/wqzq0i/zkbased_privacy_tools_are_truly_not_mixers_you/ikr5yen/	1660796051	1	False	True	False	ethereum	t5_2zf9m	r/ethereum	public		0	[]		[]	text	t2_2auzs18n	False	False		exactly there are no utxos so it s just addition and subtraction 	0.38580167293548584	0.6352604627609253	0.2813441753387451	0.4016639292240143	0.5727640390396118	0.41109922528266907	0.29009097814559937	0.5295854806900024	0.47065889835357666	0.0007904092781245708
88	[]	False		KindaNeat420						Cold wallets are ideal, CB wallet isn’t cold. Go with Ledger or Trezor. If you want to use a warm wallet, MetaMask is the way to go	e74996924000c21dd87ba6d99e847d7a72f574c2	True	False					0	1660795863		0	{}	ikr5niv	False	t3_wqy5b4	False	True	t1_ikqpgca	/r/ethereum/comments/wqy5b4/f_robinhood/ikr5niv/	1660795878	1	False	True	False	ethereum	t5_2zf9m	r/ethereum	public		0	[]		[]	text	t2_1f5593gv	False	False		cold wallets are ideal cb wallet isn t cold go with ledger or trezor if you want to use a warm wallet metamask is the way to go	0.32463011145591736	0.937545657157898	0.05269796401262283	0.05509369447827339	0.009375404566526413	0.2932572066783905	0.08098391443490982	8.321364362018357e-07	0.3420140743255615	0.02287624217569828
89	[]	False		CryptoMundi						Why the fuck does anyone use robinhood?!?!? Get out!	6f51c472c4ea7242e2e91d259b9739f49e3dfc8f	True	False					0	1660795795		0	{}	ikr5j5b	False	t3_wqy5b4	False	True	t3_wqy5b4	/r/ethereum/comments/wqy5b4/f_robinhood/ikr5j5b/	1660795808	1	False	True	False	ethereum	t5_2zf9m	r/ethereum	public		0	[]		[]	text	t2_a3hp93tm	False	False		why the fuck does anyone use robinhood get out 	0.21362081170082092	0.4292924404144287	0.7914663553237915	0.45198920369148254	0.3214379847049713	0.4759555459022522	0.18553011119365692	0.006341427098959684	0.40087825059890747	0.008947772905230522
90	[]	False		Perleflamme						"&gt;Circle and Tether who obviously will choose the compliant chain so this is where defi and chain value will remain. Non compliant chain will face an impossible uphill battle. PoS is a circus.

Non sensical. It's a user activated fork, not a slash. People retain all their stablecoins, regardless of which branch stablecoins decide to live on. People will simply sell their stablecoins where they don't want to use it and buy back whatever they want on the other chain.

Besides, it has absolutely nothing to do with PoS. Biggest miners can be coerced just the same. Even worse, they're very easy to spot and coerce, contrary to big stakers. And on top of it, there's no way to get rid of such 51% consensus attack in PoW.

PoS is a direct upgrade to PoW."	faec7f72de5fb2f07feae0cc1381f4be047f5666	True	False					0	1660795628		0	{}	ikr58h4	False	t3_wr5cg8	False	True	t1_ikqwyf9	/r/ethereum/comments/wr5cg8/censorship_resistance_uasf/ikr58h4/	1660795641	1	False	True	False	ethereum	t5_2zf9m	r/ethereum	public		0	[]		[]	text	t2_13pqgo	False	False		 gt circle and tether who obviously will choose the compliant chain so this is where defi and chain value will remain non compliant chain will face an impossible uphill battle pos is a circus non sensical it s a user activated fork not a slash people retain all their stablecoins regardless of which branch stablecoins decide to live on people will simply sell their stablecoins where they don t want to use it and buy back whatever they want on the other chain besides it has absolutely nothing to do with pos biggest miners can be coerced just the same even worse they re very easy to spot and coerce contrary to big stakers and on top of it there s no way to get rid of such 51 consensus attack in pow pos is a direct upgrade to pow 	0.001897068927064538	0.9908677339553833	0.7163048982620239	0.9542719721794128	0.0066389236599206924	0.24671465158462524	0.09234972298145294	8.511140094924485e-07	0.2812853753566742	0.00322831142693758
91	[]	False		Routine-Doughnut-431						Recommend mining Either	b70eed4599e24b6f6c5b63fdd561241d6e1af927	True	False					0	1660795625		0	{}	ikr58al	False	t3_wr8hx5	False	True	t3_wr8hx5	/r/ethereum/comments/wr8hx5/i_want_to_start_mining_eth_i_dont_know_how_to_can/ikr58al/	1660795638	1	False	True	False	ethereum	t5_2zf9m	r/ethereum	public		0	[]		[]	text	t2_a1qy88qd	False	False		recommend mining either	0.4796473979949951	0.5610952377319336	0.38208258152008057	0.6032839417457581	0.48065584897994995	0.33027955889701843	0.47537490725517273	0.4940057694911957	0.49707654118537903	0.35866567492485046
92	[]	False		pale_blue_dots						"People should definitely know that when you ""buy"" a share from a brokerage (like Robinhood, TD Ameritrade, Fidelity, Schwab, etc, etc, etc...) that that share IS NOT in your name, but something called ""street name."" That basically means, in crypto terms, ""not your keys, not your coins."" Furthermore, ""they"" - being the brokerages and associates like hedge funds and so on - can then use those shares against you in convoluted and loophole imbued fuckery and backstabbing to drive the price down of that same share/company."	9acedbe3b29d3d9363356cfee36121d457f05062	True	False					0	1660795577		0	{}	ikr5578	False	t3_wqy5b4	False	True	t1_ikpcjav	/r/ethereum/comments/wqy5b4/f_robinhood/ikr5578/	1660795592	1	False	True	False	ethereum	t5_2zf9m	r/ethereum	public		0	[]		[]	text	t2_29wiw875	False	False		people should definitely know that when you buy a share from a brokerage like robinhood td ameritrade fidelity schwab etc etc etc that that share is not in your name but something called street name that basically means in crypto terms not your keys not your coins furthermore they being the brokerages and associates like hedge funds and so on can then use those shares against you in convoluted and loophole imbued fuckery and backstabbing to drive the price down of that same share company 	0.0026918179355561733	0.9872734546661377	0.840596616268158	0.09980785846710205	0.9942301511764526	0.32515615224838257	0.09162676334381104	8.447064487882017e-07	0.3951364755630493	0.04277285933494568
93	[]	False		[deleted]					dark	[removed]	fe993932d6dced4c0a879e9aa5d7a6e0fbb467f5	True	False					0	1660795564		0	{}	ikr54c9	False	t3_wqy5b4	False	True	t1_ikqah61	/r/ethereum/comments/wqy5b4/f_robinhood/ikr54c9/	1660795576	1	False	True	False	ethereum	t5_2zf9m	r/ethereum	public		0	[]								 removed 	0.46707504987716675	0.5148742198944092	0.5170193910598755	0.5029740929603577	0.4936113953590393	0.5123135447502136	0.45383262634277344	0.4847692549228668	0.4981911778450012	0.5145108103752136
94	[]	False		KindaNeat420						Don’t use CB for Eth staking! I regret locking it up all the time, and they constantly lower the rate. When I staked a couple, it was 7%, then started consistently dropping. Use Lido for staking Eth	bda3c154ee80c1a1391534a6e2852610b23dbced	True	False					0	1660795547		0	{}	ikr5374	False	t3_wqy5b4	False	True	t3_wqy5b4	/r/ethereum/comments/wqy5b4/f_robinhood/ikr5374/	1660795561	1	False	True	False	ethereum	t5_2zf9m	r/ethereum	public		0	[]		[]	text	t2_1f5593gv	False	False		don t use cb for eth staking i regret locking it up all the time and they constantly lower the rate when i staked a couple it was 7 then started consistently dropping use lido for staking eth	0.005726892035454512	0.9654927253723145	0.6553393006324768	0.0272105373442173	0.015288878232240677	0.6008878946304321	0.10999959707260132	8.436783218712662e-07	0.27839556336402893	0.007125064264982939
95	[]	False		DukeThorion						So if you buy any NFT, whoever sold it to you can just take it back at will?	e0948820e7c09de9a79884403a63bd9b9681b93b	True	False					0	1660795401		0	{}	ikr4thy	False	t3_wqpsoa	False	True	t1_ikorats	/r/ethereum/comments/wqpsoa/why_ens_domains_are_more_popular_than_unstoppable/ikr4thy/	1660795413	1	False	True	False	ethereum	t5_2zf9m	r/ethereum	public		0	[]		[]	text	t2_52xtdh0x	False	False		so if you buy any nft whoever sold it to you can just take it back at will 	0.2750568389892578	0.670198917388916	0.419657438993454	0.4780600070953369	0.2796003818511963	0.6132491230964661	0.0785699412226677	6.271815800573677e-05	0.2524600028991699	0.04921067878603935
96	[]	False		Far_Guarantee_2465						Or look into running a pos Eth validator node.  invest 60k into Eth and run your own node.  Just a thought but this question is super late in the Eth pow phase.  You must be super new to Eth.	666a126aaea3ed77defc79049c3744495c2f4417	True	False					0	1660795383		0	{}	ikr4sbw	False	t3_wr8hx5	False	True	t1_ikr093a	/r/ethereum/comments/wr8hx5/i_want_to_start_mining_eth_i_dont_know_how_to_can/ikr4sbw/	1660795395	1	False	True	False	ethereum	t5_2zf9m	r/ethereum	public		0	[]		[]	text	t2_9kw2tbtr	False	False		or look into running a pos eth validator node invest 60k into eth and run your own node just a thought but this question is super late in the eth pow phase you must be super new to eth 	0.00430610915645957	0.9885324239730835	0.2607520520687103	0.019831014797091484	0.009285894222557545	0.2968045771121979	0.08943679183721542	8.802550723885361e-07	0.3103488087654114	0.0021436347160488367
97	[]	False		PeanutButterCumbot						I did not.	0e687add0dc04c42bbfbc455e2be8899d17880e8	True	False					0	1660795310		0	{}	ikr4ndl	False	t3_wpyzyp	False	True	t1_iknp9l8	/r/ethereum/comments/wpyzyp/vitalik_buterin_wishes_to_burn_the_ethers_of_the/ikr4ndl/	1660795322	1	False	True	False	ethereum	t5_2zf9m	r/ethereum	public		0	[]		[]	text	t2_90pa6de0	False	False		i did not 	0.48744383454322815	0.41790103912353516	0.48901835083961487	0.4512733221054077	0.49506574869155884	0.5759782791137695	0.5045792460441589	0.4863104522228241	0.49914151430130005	0.4006614089012146
98	[]	False		charmquark8						No more than the big mining pools have controlled Ethereum's destiny.  (e.g not much)	402de32ebaff6d843407284b8fd3ad45057f81d2	True	False					0	1660838324		0	{}	ikt6h27	False	t3_wrlr5q	False	True	t3_wrlr5q	/r/ethereum/comments/wrlr5q/will_the_exchanges_control_ethereums_destiny/ikt6h27/	1660838337	1	False	True	False	ethereum	t5_2zf9m	r/ethereum	public		0	[]		[]	text	t2_d1b5402	False	False		no more than the big mining pools have controlled ethereum s destiny e g not much 	0.08409418165683746	0.856918454170227	0.3337455093860626	0.5726927518844604	0.5253039598464966	0.3003285229206085	0.25656142830848694	0.00039280118653550744	0.48696404695510864	0.002809451660141349
99	[]	False		OrigamiMax						Probably their response to Tornado Cash	4c9720d8557adb0db09225b8962576ce23b96334	True	False					0	1660838118		0	{}	ikt5y3u	False	t3_wret3c	False	True	t1_iksoa3d	/r/ethereum/comments/wret3c/a_standard_for_a_web3_app_store_so_user_can_run/ikt5y3u/	1660838130	1	False	True	False	ethereum	t5_2zf9m	r/ethereum	public		0	[]		[]	text	t2_1oczulq5	False	False		probably their response to tornado cash	0.5016065835952759	0.5026309490203857	0.4173274040222168	0.4541590213775635	0.43208467960357666	0.49892204999923706	0.4288922846317291	0.40013906359672546	0.42453646659851074	0.11337665468454361
100	[]	False		Simple_Yam						"It's completely visible on-chain. Since the delay is of 7 days for that key's activation, we can suppose that you have enough time to monitor it or receive a notification. Your full access key should be able to delete it instantly preferably.

If you've completely lost access to your account you need to closely monitor newly added keys for that 7 days period on-chain and contact the service in case more than 1 key is generated.

It's as if you'd be using a bank, but one that can only access your funds in the worst case scenario for a very short period of time. 

There's no way to recover a lost account without trusting someone somewhere for at least a period of time."	192144d3fe0d0750f5a89b6c49ea07895f4c053e	True	False					0	1660837775		0	{}	ikt52w7	False	t3_wrfruo	False	True	t1_ikt1b9j	/r/ethereum/comments/wrfruo/the_future_of_key_management_a_poc_and_thought/ikt52w7/	1660837787	1	False	True	False	ethereum	t5_2zf9m	r/ethereum	public		0	[]		[]	text	t2_62brrad7	False	False		it s completely visible on chain since the delay is of 7 days for that key s activation we can suppose that you have enough time to monitor it or receive a notification your full access key should be able to delete it instantly preferably if you ve completely lost access to your account you need to closely monitor newly added keys for that 7 days period on chain and contact the service in case more than 1 key is generated it s as if you d be using a bank but one that can only access your funds in the worst case scenario for a very short period of time there s no way to recover a lost account without trusting someone somewhere for at least a period of time 	0.0019426284125074744	0.9898111820220947	0.391003280878067	0.965286374092102	0.007195667829364538	0.4022134840488434	0.06787999719381332	8.693453992236755e-07	0.17593003809452057	0.02857375144958496
101	[]	False		EarthHuman0exe						“You are living through the biggest crpyto event of all time”….yeah were living through EVERY crypto event. Crypto is still a baby wym	4a1efe1d2f4418bb9500bf822340933f09a39f07	True	False					0	1660837599		0	{}	ikt4n53	False	t3_wrjg3g	False	True	t3_wrjg3g	/r/ethereum/comments/wrjg3g/what_do_you_guys_think/ikt4n53/	1660837611	1	False	True	False	ethereum	t5_2zf9m	r/ethereum	public		0	[]		[]	text	t2_qwudmqxz	False	False		 you are living through the biggest crpyto event of all time yeah were living through every crypto event crypto is still a baby wym	0.03765431046485901	0.9401975274085999	0.23856164515018463	0.005164116621017456	0.6591538190841675	0.17576003074645996	0.18446624279022217	3.053872933378443e-05	0.45139527320861816	0.00017235778796020895
