Unnamed: 0	all_awardings	archived	associated_award	author	author_flair_background_color	author_flair_css_class	author_flair_richtext	author_flair_template_id	author_flair_text	author_flair_text_color	author_flair_type	author_fullname	author_patreon_flair	author_premium	body	body_sha1	can_gild	collapsed	collapsed_because_crowd_control	collapsed_reason	collapsed_reason_code	comment_type	controversiality	created_utc	distinguished	gilded	gildings	id	is_submitter	link_id	locked	no_follow	parent_id	permalink	retrieved_utc	score	score_hidden	send_replies	stickied	subreddit	subreddit_id	subreddit_name_prefixed	subreddit_type	top_awarded_type	total_awards_received	treatment_tags	unrepliable_reason	corpus	support	knowledge	conflict	power	similarity	fun	status	trust	identity	romance
278	[]	False		[deleted]						dark					[removed]	fe993932d6dced4c0a879e9aa5d7a6e0fbb467f5	True	False					0	1647714767		0	{}	i1b68g7	False	t3_thbk6q	False	True	t1_i1a24i3	/r/XRP/comments/thbk6q/xrph_airdrop_coming_soon/i1b68g7/	1647714779	1	True	True	False	XRP	t5_2ruj5	r/XRP	public		0	[]		 removed 	0.46707504987716675	0.5148742198944092	0.5170193910598755	0.5029740929603577	0.4936113953590393	0.5123135447502136	0.45383262634277344	0.4847692549228668	0.4981911778450012	0.5145108103752136
279	[]	False		[deleted]						dark					[removed]	fe993932d6dced4c0a879e9aa5d7a6e0fbb467f5	True	False					0	1647714763		0	{}	i1b681v	False	t3_thbk6q	False	True	t1_i17gvxi	/r/XRP/comments/thbk6q/xrph_airdrop_coming_soon/i1b681v/	1647714779	1	True	True	False	XRP	t5_2ruj5	r/XRP	public		0	[]		 removed 	0.46707504987716675	0.5148742198944092	0.5170193910598755	0.5029740929603577	0.4936113953590393	0.5123135447502136	0.45383262634277344	0.4847692549228668	0.4981911778450012	0.5145108103752136
280	[]	False		[deleted]						dark					[removed]	fe993932d6dced4c0a879e9aa5d7a6e0fbb467f5	True	False					0	1647714755		0	{}	i1b67ec	False	t3_thbk6q	False	True	t1_i17elme	/r/XRP/comments/thbk6q/xrph_airdrop_coming_soon/i1b67ec/	1647714768	1	True	True	False	XRP	t5_2ruj5	r/XRP	public		0	[]		 removed 	0.46707504987716675	0.5148742198944092	0.5170193910598755	0.5029740929603577	0.4936113953590393	0.5123135447502136	0.45383262634277344	0.4847692549228668	0.4981911778450012	0.5145108103752136
281	[]	False		JustTrackingCrypto2			[]				text	t2_koilt3nl	False	False	And how many accounts do you own on that website? Sounds like you're laundering money by giving yourself a shitload of coins.	a9692ffb3e7d56585f753ebf89f1202a85b9f965	True	False					0	1647712810		0	{}	i1b1kri	False	t3_thbk6q	False	True	t1_i1a2com	/r/XRP/comments/thbk6q/xrph_airdrop_coming_soon/i1b1kri/	1647712828	1	True	True	False	XRP	t5_2ruj5	r/XRP	public		0	[]		and how many accounts do you own on that website sounds like you re laundering money by giving yourself a shitload of coins 	0.13144446909427643	0.9250303506851196	0.4862043559551239	0.06183291971683502	0.1567268669605255	0.379106342792511	0.12831616401672363	0.01435022335499525	0.35122209787368774	0.0015929921064525843
282	[]	False		Original-Adagio-1142			[]				text	t2_d55oxedh	False	False	What's going on with the Spark Airdrop?	0b542697cfbc65614928b06c873329719829af61	True	False					0	1647712752		0	{}	i1b1fnq	False	t3_thbk6q	False	True	t3_thbk6q	/r/XRP/comments/thbk6q/xrph_airdrop_coming_soon/i1b1fnq/	1647712767	1	True	True	False	XRP	t5_2ruj5	r/XRP	public		0	[]		what s going on with the spark airdrop 	0.39491960406303406	0.6111230850219727	0.4606899917125702	0.542824923992157	0.5034985542297363	0.678568422794342	0.32106348872184753	0.35751965641975403	0.4043363332748413	0.01446837093681097
283	[]	False		Disturbed_Area_			[]				text	t2_8pw7xeiu	False	False	"Surely... if you are someone with multiple wallets, then you are facing a few issues such as the xrp worth of your tokens, the reserve and available XRP per wallet.. Understanding if the set Limit orders have been filled yet or not... Or even have trading view charts for the XRP L tokens without having to look for massive strings as the URL, then our site will ease all these troubles.. you will have everything in one place after logging in.. and everything you ever need to deal with multiple addresses is there.. the beauty of it all, you dont have to login with xumm.. you simply can add the public address and all the info will be displayed for your viewing pleasure...  


It would be amazing if you could join the conversation on discord with the founders for any further questions.."	baf89fa0ca097c8daba3c1819bb20aa73a8cb511	True	False					0	1647710249		0	{}	i1avih7	False	t3_thbk6q	False	True	t1_i1auaab	/r/XRP/comments/thbk6q/xrph_airdrop_coming_soon/i1avih7/	1647710262	1	True	True	False	XRP	t5_2ruj5	r/XRP	public		0	[]		surely if you are someone with multiple wallets then you are facing a few issues such as the xrp worth of your tokens the reserve and available xrp per wallet understanding if the set limit orders have been filled yet or not or even have trading view charts for the xrp l tokens without having to look for massive strings as the url then our site will ease all these troubles you will have everything in one place after logging in and everything you ever need to deal with multiple addresses is there the beauty of it all you dont have to login with xumm you simply can add the public address and all the info will be displayed for your viewing pleasure it would be amazing if you could join the conversation on discord with the founders for any further questions 	0.002632351126521826	0.9883570075035095	0.01172549370676279	0.020790284499526024	0.008493663743138313	0.3485428988933563	0.09861350804567337	8.432270988123491e-07	0.18787869811058044	0.002359114121645689
284	[]	False		Disturbed_Area_			[]				text	t2_8pw7xeiu	False	False	We understand the seriousness of the Utility.. We have explained it in the discord in more detail... It would be amazing if you could come join the conversation in discord with us.. Unfortunately unable to share the discord link due to the auto-moderation bot..	26fa8d946ecdadbce63137ed5f61c759be924042	True	False					0	1647710011		0	{}	i1auybv	False	t3_thbk6q	False	True	t1_i1ar5fs	/r/XRP/comments/thbk6q/xrph_airdrop_coming_soon/i1auybv/	1647710024	1	True	True	False	XRP	t5_2ruj5	r/XRP	public		0	[]		we understand the seriousness of the utility we have explained it in the discord in more detail it would be amazing if you could come join the conversation in discord with us unfortunately unable to share the discord link due to the auto moderation bot 	0.004730407148599625	0.9872651100158691	0.7451669573783875	0.9226719737052917	0.9806804060935974	0.2781699001789093	0.10574892908334732	8.520089522789931e-07	0.31163161993026733	0.0012323393020778894
285	[]	False		SKYLORD2542			[]				text	t2_2o5vyb0f	False	False	Can someone help me understand about what is it exactly in simpler words?	1bfc1e54e647af2e0dcac38a1b8bf4804dedfa58	True	False					0	1647709728		0	{}	i1auaab	False	t3_thbk6q	False	False	t3_thbk6q	/r/XRP/comments/thbk6q/xrph_airdrop_coming_soon/i1auaab/	1647709741	1	True	True	False	XRP	t5_2ruj5	r/XRP	public		0	[]		can someone help me understand about what is it exactly in simpler words 	0.5274047255516052	0.6235133409500122	0.17853395640850067	0.41969433426856995	0.5140045285224915	0.5130463242530823	0.16977424919605255	0.859385073184967	0.4419015347957611	0.01339049357920885
286	[]	False		[deleted]						dark					[removed]	fe993932d6dced4c0a879e9aa5d7a6e0fbb467f5	True	False					0	1647709295		0	{}	i1at9ru	False	t3_thbk6q	False	True	t1_i1agtuf	/r/XRP/comments/thbk6q/xrph_airdrop_coming_soon/i1at9ru/	1647709308	1	True	True	False	XRP	t5_2ruj5	r/XRP	public		0	[]		 removed 	0.46707504987716675	0.5148742198944092	0.5170193910598755	0.5029740929603577	0.4936113953590393	0.5123135447502136	0.45383262634277344	0.4847692549228668	0.4981911778450012	0.5145108103752136
287	[]	False		rantlers357		Gentleman	[{'e': 'text', 't': 'XRP Hodler'}]	07e1063e-6aba-11e8-8fbb-0efb9a871d68	XRP Hodler	dark	richtext	t2_59x27ghr	False	False	What is the utility of the token?	eea48ce76192eadaa3e58cb69a6c4a890d266f9a	True	False					0	1647708389		0	{}	i1ar5fs	False	t3_thbk6q	False	True	t3_thbk6q	/r/XRP/comments/thbk6q/xrph_airdrop_coming_soon/i1ar5fs/	1647708403	1	True	True	False	XRP	t5_2ruj5	r/XRP	public		0	[]		what is the utility of the token 	0.4132188856601715	0.5975132584571838	0.45807528495788574	0.5254325270652771	0.44399288296699524	0.38511496782302856	0.31117919087409973	0.4316222667694092	0.45844587683677673	0.07778595387935638
288	[]	False		bravetaco2		noflair	[]			dark	text	t2_1gxotucr	False	False	I think you missed a an extra 0 on that “1 trillion”	4c71f8333849fa477a16efa4e59cf0826112ecaa	True	False					0	1647708098		0	{}	i1aqgvw	True	t3_tgh9h7	False	True	t1_i13cen2	/r/XRP/comments/tgh9h7/ripple_commits_1_billion_xrp_to_advance_xrpl/i1aqgvw/	1647708114	1	True	True	False	XRP	t5_2ruj5	r/XRP	public		0	[]		i think you missed a an extra 0 on that 1 trillion 	0.388592004776001	0.5375638604164124	0.3796026408672333	0.1355624943971634	0.32868191599845886	0.33077242970466614	0.32714134454727173	0.00044024185626767576	0.2895454168319702	0.028533820062875748
289	[]	False		lj26ft		Gentleman	[{'e': 'text', 't': 'XRP Hodler'}]	07e1063e-6aba-11e8-8fbb-0efb9a871d68	XRP Hodler	dark	richtext	t2_fn94h	False	False	"https://github.com/ripple/rippled/pull/4123

👀 Holi 💩"	1360c64d22a9dd832a90efd9bdef7bfb90e68427	True	False					0	1647706901		0	{}	i1anlgp	False	t3_thn377	False	True	t3_thn377	/r/XRP/comments/thn377/031922_join_flarexrp_discord/i1anlgp/	1647706918	1	True	True	False	XRP	t5_2ruj5	r/XRP	public		0	[]		https github com ripple rippled pull 4123 holi 	0.5432925820350647	0.6235833168029785	0.5069812536239624	0.36461392045021057	0.4483003616333008	0.6083824038505554	0.36726248264312744	0.2022305727005005	0.4855351448059082	0.0014494935749098659
290	[]	False		Piss_Jug_Ray		Training	[{'e': 'text', 't': 'Redditor for 6 months'}]	f51453f4-6c38-11e9-9031-0ea06aef805a	Redditor for 6 months	dark	richtext	t2_abfo3c74	False	False	Enlighten me, I checked it out and pretty clueless.	3590e94a1436cee2ba99d4055c172b683bec6a03	True	False					0	1647731237		0	{}	i1c7u0i	False	t3_thn377	False	True	t1_i1anlgp	/r/XRP/comments/thn377/031922_join_flarexrp_discord/i1c7u0i/	1647731254	1	True	True	False	XRP	t5_2ruj5	r/XRP	public		0	[]		enlighten me i checked it out and pretty clueless 	0.42800185084342957	0.2493273913860321	0.5699962377548218	0.18618285655975342	0.4596928656101227	0.7365207076072693	0.5419905185699463	0.5705246925354004	0.3793599009513855	0.018715830519795418
291	[]	False		No-Forever3279		Warning-level5	[{'e': 'text', 't': '1 ~ 2 years account age. &lt; 11 comment karma.'}]	f461fce0-6c38-11e9-9031-0ea06aef805a	1 ~ 2 years account age. < 11 comment karma.	dark	richtext	t2_7ugxl6mj	False	False	Just printing money out of thin air	ba5d99d38d7715d0fd63bf3f6cf47bd2013de470	True	False					0	1647729966		0	{}	i1c544e	False	t3_tgh9h7	False	True	t3_tgh9h7	/r/XRP/comments/tgh9h7/ripple_commits_1_billion_xrp_to_advance_xrpl/i1c544e/	1647730003	1	True	True	False	XRP	t5_2ruj5	r/XRP	public		0	[]		just printing money out of thin air	0.47709017992019653	0.5805959105491638	0.4626881182193756	0.5197270512580872	0.3586837947368622	0.24758380651474	0.32167157530784607	0.2997192442417145	0.3927447199821472	0.04441222548484802
292	[]	False		[deleted]						dark					[removed]	fe993932d6dced4c0a879e9aa5d7a6e0fbb467f5	True	False					0	1647704622		0	{}	i1ai3xf	False	t3_thbk6q	False	True	t1_i1agtuf	/r/XRP/comments/thbk6q/xrph_airdrop_coming_soon/i1ai3xf/	1647704637	1	True	True	False	XRP	t5_2ruj5	r/XRP	public		0	[]		 removed 	0.46707504987716675	0.5148742198944092	0.5170193910598755	0.5029740929603577	0.4936113953590393	0.5123135447502136	0.45383262634277344	0.4847692549228668	0.4981911778450012	0.5145108103752136
293	[]	False		[deleted]						dark					[removed]	fe993932d6dced4c0a879e9aa5d7a6e0fbb467f5	True	False					0	1647704446		0	{}	i1ahou8	False	t3_thbk6q	False	True	t1_i1a2com	/r/XRP/comments/thbk6q/xrph_airdrop_coming_soon/i1ahou8/	1647704462	1	True	True	False	XRP	t5_2ruj5	r/XRP	public		0	[]		 removed 	0.46707504987716675	0.5148742198944092	0.5170193910598755	0.5029740929603577	0.4936113953590393	0.5123135447502136	0.45383262634277344	0.4847692549228668	0.4981911778450012	0.5145108103752136
294	[]	False		Kingmaker168		Training	[{'e': 'text', 't': 'Redditor for 10 months'}]	f51453f4-6c38-11e9-9031-0ea06aef805a	Redditor for 10 months	dark	richtext	t2_a251j0r3	False	False	After register, why I couldnt login?	e0c5eb8912beb8fa0b8038f7efee6a63eab79e45	True	False					0	1647704077		0	{}	i1agtuf	False	t3_thbk6q	False	True	t1_i1a2com	/r/XRP/comments/thbk6q/xrph_airdrop_coming_soon/i1agtuf/	1647704093	1	True	True	False	XRP	t5_2ruj5	r/XRP	public		0	[]		after register why i couldnt login 	0.38602104783058167	0.4409983158111572	0.34964558482170105	0.49881964921951294	0.43660804629325867	0.5968712568283081	0.45765551924705505	0.43994447588920593	0.42278197407722473	0.5133634209632874
295	[]	False		Disturbed_Area_			[]				text	t2_8pw7xeiu	False	False	"We are not a wallet. We provide traders tools such as tradingview charts, managing of Multiple XUMM Addresses in one location.  
Portfolio Management. Live prices of the held tokens for all wallets..  Available and reserve xrp per wallet... Open limit orders... XRP and Dollar values of all token held, cumulatively for all wallets... Add &amp; remove Trustlines &amp; a lot more.   


We will be airdropping tokens to all users of the website... there are no tactics here... We will be doing an airdrop as soon as the token is released... Atm we are finalizing tokenomics, utility of the token, and reward structure for holders etc...   


Feel free to join the conversation on Discord as well.."	73d8bd0e3254b8ee19417437947538017e632983	True	False					0	1647697348		0	{}	i1a2com	False	t3_thbk6q	False	True	t1_i18x8mx	/r/XRP/comments/thbk6q/xrph_airdrop_coming_soon/i1a2com/	1647697364	1	True	True	False	XRP	t5_2ruj5	r/XRP	public		0	[]		we are not a wallet we provide traders tools such as tradingview charts managing of multiple xumm addresses in one location portfolio management live prices of the held tokens for all wallets available and reserve xrp per wallet open limit orders xrp and dollar values of all token held cumulatively for all wallets add amp remove trustlines amp a lot more we will be airdropping tokens to all users of the website there are no tactics here we will be doing an airdrop as soon as the token is released atm we are finalizing tokenomics utility of the token and reward structure for holders etc feel free to join the conversation on discord as well 	0.0030921839643269777	0.9874374270439148	0.22451496124267578	0.9210827946662903	0.008861265145242214	0.3995373845100403	0.09910120815038681	8.345397759512707e-07	0.35905715823173523	0.005517478100955486
296	[]	False		Disturbed_Area_			[]				text	t2_8pw7xeiu	False	False	"So basically Xumm is a wallet. We are not a wallet. We provide traders tools such as tradingview charts, managing of Multiple XUMM Addresses in one location.  
Portfolio Management. Live prices of the held tokens for all wallets..  Available and reserve xrp per wallet... Open limit orders... XRP and Dollar values of all token held, cumulatively for all wallets... Add &amp; remove Trustlines &amp; a lot more."	c46a675b412f08c23849cb7061a913b868e33f62	True	False					0	1647697227		0	{}	i1a24i3	False	t3_thbk6q	False	True	t1_i17elme	/r/XRP/comments/thbk6q/xrph_airdrop_coming_soon/i1a24i3/	1647697240	1	True	True	False	XRP	t5_2ruj5	r/XRP	public		0	[]		so basically xumm is a wallet we are not a wallet we provide traders tools such as tradingview charts managing of multiple xumm addresses in one location portfolio management live prices of the held tokens for all wallets available and reserve xrp per wallet open limit orders xrp and dollar values of all token held cumulatively for all wallets add amp remove trustlines amp a lot more 	0.002529360353946686	0.9898249506950378	0.3364982604980469	0.17871998250484467	0.007214656565338373	0.44977086782455444	0.20366458594799042	8.45256010961748e-07	0.4169783890247345	0.004934846889227629
297	[]	False		Disturbed_Area_			[]				text	t2_8pw7xeiu	False	False	The token is not out as yet.. The utility and tokenomics are being finalized before the token launch.. Do visit the discord though to be a part of the conversations..	144886e9c6841823e3c6883527d6bcd66acb65da	True	False					0	1647696461		0	{}	i1a0owh	False	t3_thbk6q	False	True	t1_i19l3de	/r/XRP/comments/thbk6q/xrph_airdrop_coming_soon/i1a0owh/	1647696472	1	True	True	False	XRP	t5_2ruj5	r/XRP	public		0	[]		the token is not out as yet the utility and tokenomics are being finalized before the token launch do visit the discord though to be a part of the conversations 	0.05314711108803749	0.9383584260940552	0.6328043937683105	0.06405139714479446	0.06914138793945312	0.314365953207016	0.08963270485401154	8.462303071610222e-07	0.3904064893722534	0.00512217590585351
298	[]	False		[deleted]						dark					[removed]	fe993932d6dced4c0a879e9aa5d7a6e0fbb467f5	True	False					0	1647694960		0	{}	i19xym7	False	t3_sju049	False	True	t3_sju049	/r/XRP/comments/sju049/xrp_will_never_reach_100/i19xym7/	1647694974	1	True	True	False	XRP	t5_2ruj5	r/XRP	public		0	[]		 removed 	0.46707504987716675	0.5148742198944092	0.5170193910598755	0.5029740929603577	0.4936113953590393	0.5123135447502136	0.45383262634277344	0.4847692549228668	0.4981911778450012	0.5145108103752136
299	[]	False		[deleted]						dark					[removed]	fe993932d6dced4c0a879e9aa5d7a6e0fbb467f5	True	False					0	1647691559		0	{}	i19skdd	False	t3_th79aj	False	True	t3_th79aj	/r/XRP/comments/th79aj/benefits_of_xrp_ledger/i19skdd/	1647691572	1	True	True	False	XRP	t5_2ruj5	r/XRP	public		0	[]		 removed 	0.46707504987716675	0.5148742198944092	0.5170193910598755	0.5029740929603577	0.4936113953590393	0.5123135447502136	0.45383262634277344	0.4847692549228668	0.4981911778450012	0.5145108103752136
300	[]	False		psyentist15			[]				text	t2_mlsvd2e	False	True	"I'd be a little skeptical here. It provides very little information on what this ""hub"" is--is it a wallet? If so, what is it airdropping? Is it a token providing wallet-like services? If so, how does that work?

The only thing clear is that the author(s) want to draw attention with ""Airdrop Coming Soon""."	20e1ad582b310f4c1c33dc2609c873ef161161d2	True	False					0	1647665723		0	{}	i18x8mx	False	t3_thbk6q	False	True	t3_thbk6q	/r/XRP/comments/thbk6q/xrph_airdrop_coming_soon/i18x8mx/	1647665738	1	True	True	False	XRP	t5_2ruj5	r/XRP	public		0	[]		i d be a little skeptical here it provides very little information on what this hub is is it a wallet if so what is it airdropping is it a token providing wallet like services if so how does that work the only thing clear is that the author s want to draw attention with airdrop coming soon 	0.032754868268966675	0.98816978931427	0.06140192970633507	0.018455715849995613	0.009043466299772263	0.4914843738079071	0.08611929416656494	8.341220336660626e-07	0.3013089597225189	0.008633303456008434
301	[]	False		Dragonfly_179			[]				text	t2_fbj2x52y	False	False	"If you check the Neon discord ,the general channel is locked.

The NFT mint instructions were posted in the announcements channel by a compromised admin account.

It had a link to a mint fake mint website, it looks like the mint drains wallets Solana balance. Message if you want the link, I don't want to post it publicly."	45570afff522fbc0b96ae455256427636660d637	True	False					0	1647676777		0	{}	i19b5qq	True	t3_thpspz	False	True	t1_i19aun1	/r/solana/comments/thpspz/neon_labs_discord_hacked_fake_nft_mint_scam/i19b5qq/	1647676789	1	False	True	False	solana	t5_hcs2n	r/solana	public		0	[]		if you check the neon discord the general channel is locked the nft mint instructions were posted in the announcements channel by a compromised admin account it had a link to a mint fake mint website it looks like the mint drains wallets solana balance message if you want the link i don t want to post it publicly 	0.0026791044510900974	0.9877890944480896	0.5114618539810181	0.9455594420433044	0.00831290427595377	0.4045299291610718	0.08145685493946075	8.539482792002673e-07	0.3033398985862732	0.005945424549281597
302	[]	False		BitVibes			[]				text	t2_iper7vnx	False	False	Get off	33fe4544b7e5dc072517ad865c3543aab958479b	True	False					0	1647676761		0	{}	i19b546	False	t3_thpspz	False	True	t1_i19av41	/r/solana/comments/thpspz/neon_labs_discord_hacked_fake_nft_mint_scam/i19b546/	1647676776	1	False	True	False	solana	t5_hcs2n	r/solana	public		0	[]		get off	0.4988514482975006	0.48092910647392273	0.5614844560623169	0.5051321387290955	0.4834091067314148	0.6657842397689819	0.43167415261268616	0.4730056822299957	0.4365807771682739	0.446387380361557
303	[]	False		haikusbot			[]				text	t2_7q331wlw	False	True	"*Can you provide more*

*Context than a link to an*

*Alleged scam address?*

\- laine\_sa

---

^(I detect haikus. And sometimes, successfully.) ^[Learn&amp;#32;more&amp;#32;about&amp;#32;me.](https://www.reddit.com/r/haikusbot/)

^(Opt out of replies: ""haikusbot opt out"" | Delete my comment: ""haikusbot delete"")"	8a1e63c4dc3ef16710456ced27d0301ac45b6c48	True	False					0	1647676507		0	{}	i19av41	False	t3_thpspz	False	True	t1_i19aun1	/r/solana/comments/thpspz/neon_labs_discord_hacked_fake_nft_mint_scam/i19av41/	1647676520	1	False	True	False	solana	t5_hcs2n	r/solana	public		0	[]		 can you provide more context than a link to an alleged scam address laine sa i detect haikus and sometimes successfully learn amp 32 more amp 32 about amp 32 me https www reddit com r haikusbot opt out of replies haikusbot opt out delete my comment haikusbot delete 	0.002229816047474742	0.9894701242446899	0.5820899605751038	0.0701126679778099	0.006928187794983387	0.24192862212657928	0.19110673666000366	8.49198102059745e-07	0.3559069335460663	0.003948603291064501
304	[]	False		laine_sa			[{'e': 'text', 't': 'Moderator'}]		Moderator	dark	richtext	t2_e8cjuh9o	False	False	Can you provide more context than a link to an alleged scam address?	0f598c257c19aecb1650cd97d75026d933b560ee	True	False					0	1647676495		0	{}	i19aun1	False	t3_thpspz	False	True	t3_thpspz	/r/solana/comments/thpspz/neon_labs_discord_hacked_fake_nft_mint_scam/i19aun1/	1647676507	1	False	True	False	solana	t5_hcs2n	r/solana	public		0	[]		can you provide more context than a link to an alleged scam address 	0.2261991947889328	0.8395724892616272	0.4625247120857239	0.6883233785629272	0.26583611965179443	0.2906360626220703	0.19643692672252655	0.5428839325904846	0.410424143075943	0.006298130378127098
305	[]	False		laine_sa			[{'e': 'text', 't': 'Moderator'}]		Moderator	dark	richtext	t2_e8cjuh9o	False	False	The Solana Foundation is based in Geneva, Switzerland, I'm not sure of the dynamics but perhaps they were the ones who did the initial sales. Also most initial token distributions on Solana were through private sales/investment rounds not ICO	2512f5321f2ca4921fe8965caa94f3945a8d6882	True	False					0	1647676441		0	{}	i19asku	False	t3_thm52p	False	False	t3_thm52p	/r/solana/comments/thm52p/how_did_solana_and_now_zebec_legally_have_token/i19asku/	1647676455	1	False	True	False	solana	t5_hcs2n	r/solana	public		0	[]		the solana foundation is based in geneva switzerland i m not sure of the dynamics but perhaps they were the ones who did the initial sales also most initial token distributions on solana were through private sales investment rounds not ico	0.00782791618257761	0.9871571660041809	0.267477810382843	0.09709428250789642	0.9361547231674194	0.3648736774921417	0.11664432287216187	8.725157272237993e-07	0.488174170255661	0.0024832449853420258
306	[]	False		RdudeDdude			[]				text	t2_96vdgaoa	False	True	That was my fear as well, others must have come around and started performing better than Ray...	2755231467a500de9f8c163b6a2b61c80aa03dd0	True	False					0	1647676213		0	{}	i19ajfu	True	t3_th5o6v	False	False	t1_i18ysv0	/r/solana/comments/th5o6v/future_of_raydium_question/i19ajfu/	1647676226	1	False	True	False	solana	t5_hcs2n	r/solana	public		0	[]		that was my fear as well others must have come around and started performing better than ray 	0.4077782928943634	0.5957298874855042	0.24107587337493896	0.03713810443878174	0.6725083589553833	0.6187856793403625	0.23469774425029755	3.2987377380777616e-06	0.39509931206703186	0.015668127685785294
307	[]	False		RdudeDdude			[]				text	t2_96vdgaoa	False	True	That is insane indeed. I thought 17% was a good deal already.	bb773d32fe02cb5b25b1abf890c050d273c164d5	True	False					0	1647676164		0	{}	i19ahg9	True	t3_th5o6v	False	True	t1_i18qxs6	/r/solana/comments/th5o6v/future_of_raydium_question/i19ahg9/	1647676175	1	False	True	False	solana	t5_hcs2n	r/solana	public		0	[]		that is insane indeed i thought 17 was a good deal already 	0.2964637875556946	0.38062429428100586	0.47177767753601074	0.0624159500002861	0.5367274284362793	0.5547183156013489	0.3730660080909729	0.41836783289909363	0.3665523827075958	0.023186447098851204
