Unnamed: 0	all_awardings	archived	associated_award	author	author_flair_background_color	author_flair_css_class	author_flair_richtext	author_flair_template_id	author_flair_text	author_flair_text_color	author_flair_type	author_fullname	author_patreon_flair	author_premium	body	body_sha1	can_gild	collapsed	collapsed_because_crowd_control	collapsed_reason	collapsed_reason_code	comment_type	controversiality	created_utc	distinguished	gilded	gildings	id	is_submitter	link_id	locked	no_follow	parent_id	permalink	retrieved_utc	score	score_hidden	send_replies	stickied	subreddit	subreddit_id	subreddit_name_prefixed	subreddit_type	top_awarded_type	total_awards_received	treatment_tags	unrepliable_reason	corpus	support	knowledge	conflict	power	similarity	fun	status	trust	identity	romance
0	[]	False		Howudoin20			[]				text	t2_7as71bwl	False	False	Both of them would have documents certifying that they have attended high school, courses they attended, and so on. The authenticity of these is no longer proved through a piece of paper, but through an official statement made by the licensing bodies submitted to the blockchain.	684ec33eba86155e4b86c1ac2045bdc28b407cbc	True	False					0	1647676550		0	{}	i19awsd	False	t3_thikba	False	True	t3_thikba	/r/ethereum/comments/thikba/joe_and_jane_and_ethereum/i19awsd/	1647676565	1	False	True	False	ethereum	t5_2zf9m	r/ethereum	public		0	[]		both of them would have documents certifying that they have attended high school courses they attended and so on the authenticity of these is no longer proved through a piece of paper but through an official statement made by the licensing bodies submitted to the blockchain 	0.001177099533379078	0.9954298734664917	0.5851170420646667	0.9592167735099792	0.005344168283045292	0.0705188736319542	0.11112531274557114	8.382592682210088e-07	0.4387223720550537	7.483252556994557e-05
1	[]	False		B0tRank			[]				text	t2_1z1g03sv	False	False	"Thank you, Potential_Departure6, for voting on ectbot.

This bot wants to find the best and worst bots on Reddit. [You can view results here](https://botrank.pastimes.eu/).

***

^(Even if I don't reply to your comment, I'm still listening for votes. Check the webpage to see if your vote registered!)"	68ab195a3b6b88292e4c3f223421508b2efe1200	True	False					0	1647676288		0	{}	i19amgf	False	t3_tgyzav	False	True	t1_i19alwz	/r/ethereum/comments/tgyzav/vitalik_on_the_cover_of_the_newest_time_magazine/i19amgf/	1647676303	1	False	False	False	ethereum	t5_2zf9m	r/ethereum	public		0	[]		thank you potential departure6 for voting on ectbot this bot wants to find the best and worst bots on reddit you can view results here https botrank pastimes eu even if i don t reply to your comment i m still listening for votes check the webpage to see if your vote registered 	0.030049851164221764	0.988063633441925	0.04616980999708176	0.050882238894701004	0.008105644024908543	0.41664955019950867	0.12518878281116486	8.360190690837044e-07	0.20868292450904846	0.005231201183050871
2	[]	False		Potential_Departure6			[]				text	t2_5g6hvk5i	False	False	Good bot	48ab7f4f198b6e525e2906baf9d4ec71de74c0d2	True	False					0	1647676275		0	{}	i19alwz	False	t3_tgyzav	False	True	t1_i194vhv	/r/ethereum/comments/tgyzav/vitalik_on_the_cover_of_the_newest_time_magazine/i19alwz/	1647676291	1	False	True	False	ethereum	t5_2zf9m	r/ethereum	public		0	[]		good bot	0.5119291543960571	0.469869464635849	0.45250391960144043	0.4583524167537689	0.5173079371452332	0.6910462379455566	0.5098810195922852	0.5280970931053162	0.4696330428123474	0.32473132014274597
3	[]	False		[deleted]						dark					[removed]	fe993932d6dced4c0a879e9aa5d7a6e0fbb467f5	True	False					0	1647676221		0	{}	i19ajt5	False	t3_tgzrdq	False	True	t3_tgzrdq	/r/ethereum/comments/tgzrdq/time_interview_ethereums_vitalik_crypto_is/i19ajt5/	1647676233	1	False	True	False	ethereum	t5_2zf9m	r/ethereum	public		0	[]		 removed 	0.46707504987716675	0.5148742198944092	0.5170193910598755	0.5029740929603577	0.4936113953590393	0.5123135447502136	0.45383262634277344	0.4847692549228668	0.4981911778450012	0.5145108103752136
4	[]	False		cjeans23			[]				text	t2_rojvg	False	False	This is great news. So mining and maybe staking shouldn't add to taxes. Great for people who mine. I intend to be a miner in the coming months too.	466d2cf14848725da88ed67265fff80bd63e7f03	True	False					0	1647675903		0	{}	i19a6qn	False	t3_tessd3	False	True	t1_i0vw854	/r/ethereum/comments/tessd3/what_percent_of_crypto_investors_report_crypto_on/i19a6qn/	1647675916	1	False	True	False	ethereum	t5_2zf9m	r/ethereum	public		0	[]		this is great news so mining and maybe staking shouldn t add to taxes great for people who mine i intend to be a miner in the coming months too 	0.2908928692340851	0.8613404035568237	0.035473596304655075	0.03525306656956673	0.5078069567680359	0.44004613161087036	0.18269935250282288	8.610094823779946e-07	0.24277763068675995	0.09773547947406769
5	[]	False		Exhonor			[]				text	t2_ezihpoky	False	False	"And yet crypto makes it absurdly easy to pull off and nearly impossible to rectify.

Good luck undoing an illegitimate transactions or opening a dispute. Crypto demolishes user protections and safeguards."	b1bbeb42862dfb5d9ca4998b147598bf5e886dd9	True	False					0	1647675593		0	{}	i199u9d	False	t3_tgzrdq	False	True	t1_i17zu76	/r/ethereum/comments/tgzrdq/time_interview_ethereums_vitalik_crypto_is/i199u9d/	1647675607	1	False	True	False	ethereum	t5_2zf9m	r/ethereum	public		0	[]		and yet crypto makes it absurdly easy to pull off and nearly impossible to rectify good luck undoing an illegitimate transactions or opening a dispute crypto demolishes user protections and safeguards 	0.0073684933595359325	0.977990984916687	0.7369287014007568	0.019167523831129074	0.009790873154997826	0.09595967084169388	0.1515529751777649	8.71472877861379e-07	0.48269206285476685	0.0006103900959715247
6	[]	False		RedditTooAddictive			[]				text	t2_a80hl	False	False	Exactly, they'll never make it possible, it's their main cash cow lol.	ae1a0fba856a2db163522365f498b8fded52586f	True	False					0	1647675441		0	{}	i199o4b	False	t3_th0rr2	False	True	t1_i193u1f	/r/ethereum/comments/th0rr2/gamestop_announces_launch_of_nft_marketplace_for/i199o4b/	1647675457	1	False	True	False	ethereum	t5_2zf9m	r/ethereum	public		0	[]		exactly they ll never make it possible it s their main cash cow lol 	0.3653738498687744	0.6189554333686829	0.2795204520225525	0.2774578928947449	0.4487801790237427	0.7220867872238159	0.15729786455631256	0.012858680449426174	0.3824600577354431	0.010506571270525455
7	[]	False		armaver			[]				text	t2_61ie03xu	False	False	"I'd say that really owning your money, that you worked for, and having it in a safe place against inflation, is the other half of owning the means of production. You can own the factory all you want, if they can still cheat you on the money part.

And with a DAO you can actually own the means of production outside of a governments control. You and your peers can own the money and make the decision in a venture and no government or bank can interfere."	36eb9ae18cd734e6ad1b105addd8a63683dca178	True	False					0	1647674983		0	{}	i1995k4	False	t3_tgzrdq	False	True	t1_i197xgq	/r/ethereum/comments/tgzrdq/time_interview_ethereums_vitalik_crypto_is/i1995k4/	1647674996	1	False	True	False	ethereum	t5_2zf9m	r/ethereum	public		0	[]		i d say that really owning your money that you worked for and having it in a safe place against inflation is the other half of owning the means of production you can own the factory all you want if they can still cheat you on the money part and with a dao you can actually own the means of production outside of a governments control you and your peers can own the money and make the decision in a venture and no government or bank can interfere 	0.0029481046367436647	0.9878299832344055	0.8819079399108887	0.7033544778823853	0.008994328789412975	0.18384557962417603	0.06195523589849472	8.364058317056333e-07	0.30528950691223145	0.01918923109769821
8	[]	False		[deleted]						dark					[removed]	fe993932d6dced4c0a879e9aa5d7a6e0fbb467f5	True	False					0	1647674979		0	{}	i1995ej	False	t3_thddgd	False	True	t3_thddgd	/r/ethereum/comments/thddgd/what_are_the_main_drivers_of_ethereums_market/i1995ej/	1647674989	1	False	True	False	ethereum	t5_2zf9m	r/ethereum	public		0	[]		 removed 	0.46707504987716675	0.5148742198944092	0.5170193910598755	0.5029740929603577	0.4936113953590393	0.5123135447502136	0.45383262634277344	0.4847692549228668	0.4981911778450012	0.5145108103752136
9	[]	False		ShyRomanticEager			[]				text	t2_wsu9w	False	False	"How much electricity do ERC20 tokens use? I know about the staggering environmental impact of ETH, and how every transaction uses power to be validated on the blockchain, but how much ERC20 work into that?
Is every transaction of a ERC20 token equal to an actual ETH transaction?"	2ad71eee59e0ea6915c47ee4ee0d12668bd8514f	True	False					0	1647674704		0	{}	i198uad	False	t3_tdreoa	False	True	t3_tdreoa	/r/ethereum/comments/tdreoa/frequently_asked_questions_weekly_discussion/i198uad/	1647674717	1	False	True	False	ethereum	t5_2zf9m	r/ethereum	public		0	[]		how much electricity do erc20 tokens use i know about the staggering environmental impact of eth and how every transaction uses power to be validated on the blockchain but how much erc20 work into that is every transaction of a erc20 token equal to an actual eth transaction 	0.007784973364323378	0.9874284863471985	0.21399901807308197	0.15004146099090576	0.008314079605042934	0.17353178560733795	0.11131323128938675	8.390038033212477e-07	0.4187594950199127	0.023452220484614372
10	[]	False		seeker_of_knowledge			[]				text	t2_7lpqo	False	False	Truly shocking, that the people with the most money would take over a new kind of money completely when given the chance...	22e30e6ac1eb08d06dbeb9f901f7ea7eb97f50fb	True	False					0	1647674563		0	{}	i198og9	False	t3_tgzrdq	False	True	t1_i15b85c	/r/ethereum/comments/tgzrdq/time_interview_ethereums_vitalik_crypto_is/i198og9/	1647674580	1	False	True	False	ethereum	t5_2zf9m	r/ethereum	public		0	[]		truly shocking that the people with the most money would take over a new kind of money completely when given the chance 	0.17757274210453033	0.8890343308448792	0.5994452238082886	0.08993086218833923	0.4542287290096283	0.42905566096305847	0.09449255466461182	0.7493165135383606	0.28980553150177	0.02022661082446575
11	[]	False		Useful_Ad_7865			[]				text	t2_a5nb71dz	False	False	This is such a powerful sentiment. A group will accept slavery if they are a class A slave with total domination over class B slaves	e91aec18ac5bcb2e69b2c265aa17d7428beae95e	True	False					0	1647674451		0	{}	i198jyw	False	t3_tgzrdq	False	True	t1_i16079e	/r/ethereum/comments/tgzrdq/time_interview_ethereums_vitalik_crypto_is/i198jyw/	1647674465	1	False	True	False	ethereum	t5_2zf9m	r/ethereum	public		0	[]		this is such a powerful sentiment a group will accept slavery if they are a class a slave with total domination over class b slaves	0.12054994702339172	0.9007238745689392	0.7877225875854492	0.13783636689186096	0.211817666888237	0.27330511808395386	0.12869849801063538	0.7130901217460632	0.5133214592933655	0.015416285023093224
12	[]	False		Dankmanchilliwilli			[]				text	t2_j3t2xvff	False	False	Ethereum is software, it will develop over time similar to Microsoft, Google, Tesla, Apple, Paypal, etc. Its coin is a piece of the network, it will gain and hold value over time.	408be240cef687a82e07c09347efbaf2b9d6f698	True	False					0	1647674447		0	{}	i198jt7	False	t3_thikba	False	True	t3_thikba	/r/ethereum/comments/thikba/joe_and_jane_and_ethereum/i198jt7/	1647674458	1	False	True	False	ethereum	t5_2zf9m	r/ethereum	public		0	[]		ethereum is software it will develop over time similar to microsoft google tesla apple paypal etc its coin is a piece of the network it will gain and hold value over time 	0.005588528234511614	0.9882878661155701	0.09252039343118668	0.04688470438122749	0.05801892280578613	0.39563798904418945	0.07641635090112686	8.829935609355744e-07	0.3311760425567627	0.01894560270011425
13	[]	False		seeker_of_knowledge			[]				text	t2_7lpqo	False	False	"*Capitalism* itself leads to the rich getting richer.

You don't have a conception of what life would be outside of capitalism, so its natural endpoint seems like the entirety of life's possibility to you."	0b6497e70850f5729beaf0934af61b25fd1a1e64	True	False					0	1647674065		0	{}	i19843b	False	t3_tgzrdq	False	True	t1_i16jv2f	/r/ethereum/comments/tgzrdq/time_interview_ethereums_vitalik_crypto_is/i19843b/	1647674077	1	False	True	False	ethereum	t5_2zf9m	r/ethereum	public		0	[]		 capitalism itself leads to the rich getting richer you don t have a conception of what life would be outside of capitalism so its natural endpoint seems like the entirety of life s possibility to you 	0.003288912819698453	0.9882750511169434	0.607090175151825	0.012390481308102608	0.010165775194764137	0.43763241171836853	0.08523420244455338	8.342684054696292e-07	0.47752276062965393	0.0035643919836729765
14	[]	False		sonan11			[]				text	t2_yr8uz	False	False	This is not europe. This is America, we have different standards than they do. We don’t have to be like them.	646e0b7b2145c37caed49cc2b51cfd878c1d0034	True	False					0	1647673976		0	{}	i1980g2	False	t3_tgzrdq	False	True	t1_i18unje	/r/ethereum/comments/tgzrdq/time_interview_ethereums_vitalik_crypto_is/i1980g2/	1647673991	1	False	True	False	ethereum	t5_2zf9m	r/ethereum	public		0	[]		this is not europe this is america we have different standards than they do we don t have to be like them 	0.028996815904974937	0.7880653142929077	0.23180575668811798	0.01641412265598774	0.4630880653858185	0.5676531791687012	0.13164904713630676	8.470265129290055e-07	0.5378184914588928	0.014904928393661976
15	[]	False		seeker_of_knowledge			[]				text	t2_7lpqo	False	False	"First off, what are you producing with your Crypto wallet.

Do you understand what Capital and the means of production are?"	cf002b5723fc31fb53d479fcc1c296e96b068b64	True	False					0	1647673906		0	{}	i197xgq	False	t3_tgzrdq	False	True	t1_i17526f	/r/ethereum/comments/tgzrdq/time_interview_ethereums_vitalik_crypto_is/i197xgq/	1647673917	1	False	True	False	ethereum	t5_2zf9m	r/ethereum	public		0	[]		first off what are you producing with your crypto wallet do you understand what capital and the means of production are 	0.030706150457262993	0.8981114625930786	0.6774867177009583	0.6252632737159729	0.0842607244849205	0.3691827654838562	0.10736223310232162	8.862051572577911e-07	0.45871347188949585	0.01261680293828249
16	[]	False		[deleted]						dark					[removed]	fe993932d6dced4c0a879e9aa5d7a6e0fbb467f5	True	False					0	1647673885		0	{}	i197wkn	False	t3_thlfqp	False	True	t3_thlfqp	/r/ethereum/comments/thlfqp/scam_coin/i197wkn/	1647673901	1	False	True	False	ethereum	t5_2zf9m	r/ethereum	public		0	[]		 removed 	0.46707504987716675	0.5148742198944092	0.5170193910598755	0.5029740929603577	0.4936113953590393	0.5123135447502136	0.45383262634277344	0.4847692549228668	0.4981911778450012	0.5145108103752136
17	[]	False		mooseman99			[]				text	t2_3z4kr	False	False	"Not technically twice, when you earn income via staking you owe taxes on the USD equivalent. When you sell, you only owe taxes on gains above the cost basis (receipt price).

If you earn $1,000 worth of staking rewards, that’s equivalent to $1,000 income and you owe taxes on $1,000 income.

But when you sell it, $1,000 is your cost basis. So if you sell to USD right after receipt you pay no additional taxes because your cost basis is the same as your sale price.

If you hold and your rewards moon and your rewards are worth $10,000 and then you sell, you owe capital gains taxes on the $9,000 profit.  

If your rewards crash to $100 and then you sell, you can claim $900 loss as a capital loss and deduct it from your taxes.  

Where it can screw you is if you earn $10,000 one year, and the next year it crashes. Because you can’t carry loss to a previous year and you can only deduct $3,000 capital loss per year if you have no other capital gains. You would eventually get to deduct all the taxes but it will take 4 years."	53000f9c8d61b1de8011d93d5a3fd2944bbc0eed	True	False					0	1647673424		0	{}	i197dei	False	t3_th3zb5	False	True	t1_i181otz	/r/ethereum/comments/th3zb5/how_do_crypto_taxes_work_heres_what_you_need_to/i197dei/	1647673439	1	False	True	False	ethereum	t5_2zf9m	r/ethereum	public		0	[]		not technically twice when you earn income via staking you owe taxes on the usd equivalent when you sell you only owe taxes on gains above the cost basis receipt price if you earn 1 000 worth of staking rewards that s equivalent to 1 000 income and you owe taxes on 1 000 income but when you sell it 1 000 is your cost basis so if you sell to usd right after receipt you pay no additional taxes because your cost basis is the same as your sale price if you hold and your rewards moon and your rewards are worth 10 000 and then you sell you owe capital gains taxes on the 9 000 profit if your rewards crash to 100 and then you sell you can claim 900 loss as a capital loss and deduct it from your taxes where it can screw you is if you earn 10 000 one year and the next year it crashes because you can t carry loss to a previous year and you can only deduct 3 000 capital loss per year if you have no other capital gains you would eventually get to deduct all the taxes but it will take 4 years 	0.002943772589787841	0.9880809783935547	0.35545220971107483	0.9647846817970276	0.008936277590692043	0.4448274075984955	0.061843860894441605	8.50884305236832e-07	0.1599387377500534	0.052438460290431976
18	[]	False		MojoRyzn			[]				text	t2_13na91	False	False	Thanks Fren. 🤙🏽	214b3dcfc091bd28b3e55ee2dcdceaf1070ec4bb	True	False					0	1647673313		0	{}	i1978p3	False	t3_r6hx9v	False	True	t1_i190z7b	/r/ethereum/comments/r6hx9v/ftx_us_opens_trading_for_cryptopunks_bored_apes/i1978p3/	1647673324	1	False	True	False	ethereum	t5_2zf9m	r/ethereum	public		0	[]		thanks fren 	0.5288228988647461	0.42962726950645447	0.3306363523006439	0.4617427587509155	0.4839341938495636	0.6117937564849854	0.6629962921142578	0.5112652778625488	0.44795066118240356	0.5155664682388306
19	[]	False		daxtaslapp			[]				text	t2_3k1uq5vy	False	False	lol wow now the YouTube style bot chain comments are making their way to reddit too. I see it in here	3c63b9502b09e29693247ecf4c7cc114588c5fd9	True	False					0	1647673187		0	{}	i1973dr	False	t3_th0rr2	False	True	t3_th0rr2	/r/ethereum/comments/th0rr2/gamestop_announces_launch_of_nft_marketplace_for/i1973dr/	1647673199	1	False	True	False	ethereum	t5_2zf9m	r/ethereum	public		0	[]		lol wow now the youtube style bot chain comments are making their way to reddit too i see it in here	0.025540219619870186	0.46365317702293396	0.6310864686965942	0.01652592234313488	0.5636940002441406	0.9684242606163025	0.10962919145822525	8.539905707038997e-07	0.39661210775375366	0.01866563782095909
20	[]	False		cantreadcantspell			[]				text	t2_ncbwb	False	False	"Where in that thread does he take a shot at Vitalik specifically?

And what are you even on about re. Vitalik not being able to code?"	52f091e275598c754827c22dd8384e6b85460d44	True	False					0	1647673029		0	{}	i196wvu	False	t3_thnfty	False	False	t3_thnfty	/r/ethereum/comments/thnfty/ethereum_foundation_lead_developer_says_ethereum/i196wvu/	1647673048	1	False	True	False	ethereum	t5_2zf9m	r/ethereum	public		0	[]		where in that thread does he take a shot at vitalik specifically and what are you even on about re vitalik not being able to code 	0.06169484928250313	0.923176109790802	0.6996076703071594	0.04860258474946022	0.71307373046875	0.27481770515441895	0.09095138311386108	8.644759077469644e-07	0.40614053606987	0.012671546079218388
21	[]	False		armaver			[]				text	t2_61ie03xu	False	False	Decentralization has nothing to do with KYC, you're confusing that with anonymity. No government or central bank can decide to devalue your crypto coins. Nor prevent you from sending coins from your wallet to another. That is decentralization.	2f8b8c09b7bef3b9b3482671c166932abe3c74b9	True	False					0	1647672867		0	{}	i196q0j	False	t3_tgzrdq	False	True	t1_i18ybwa	/r/ethereum/comments/tgzrdq/time_interview_ethereums_vitalik_crypto_is/i196q0j/	1647672882	1	False	True	False	ethereum	t5_2zf9m	r/ethereum	public		0	[]		decentralization has nothing to do with kyc you re confusing that with anonymity no government or central bank can decide to devalue your crypto coins nor prevent you from sending coins from your wallet to another that is decentralization 	0.003972281236201525	0.9874273538589478	0.8180046081542969	0.06562211364507675	0.009347069077193737	0.2651647627353668	0.0742517039179802	8.437290262008901e-07	0.3938494920730591	0.013600151054561138
22	[]	False		cantreadcantspell			[]				text	t2_ncbwb	False	False	Maybe they are subsidizing L1 settlement cost?	1c0778314a29ee4738a303c1541a5f736816f88e	True	False					0	1647672719		0	{}	i196jte	False	t3_th1c2r	False	True	t3_th1c2r	/r/ethereum/comments/th1c2r/how_is_boba_network_achieving_the_lowest_of_all/i196jte/	1647672734	1	False	True	False	ethereum	t5_2zf9m	r/ethereum	public		0	[]		maybe they are subsidizing l1 settlement cost 	0.37829867005348206	0.5344460606575012	0.6248798370361328	0.5101615190505981	0.47254684567451477	0.29122692346572876	0.31038591265678406	0.3317700922489166	0.5151352882385254	0.009230190888047218
23	[]	False		armaver			[]				text	t2_61ie03xu	False	False	That's entirely up to you. The decentralized technology has proven itself for more than 10 years now. Information is free and transparent and so is your money, you can have complete control over it. Use it for those things, instead of get rich quick.	f3ca6d39bcf5d892562ec64868bc07b85ae06db6	True	False					0	1647672641		0	{}	i196gfv	False	t3_tgzrdq	False	True	t1_i18swjx	/r/ethereum/comments/tgzrdq/time_interview_ethereums_vitalik_crypto_is/i196gfv/	1647672655	1	False	True	False	ethereum	t5_2zf9m	r/ethereum	public		0	[]		that s entirely up to you the decentralized technology has proven itself for more than 10 years now information is free and transparent and so is your money you can have complete control over it use it for those things instead of get rich quick 	0.004103143233805895	0.9889782071113586	0.3781236410140991	0.9370332956314087	0.17226575314998627	0.48620328307151794	0.06262862682342529	8.269697104879015e-07	0.1936141550540924	0.00922742672264576
24	[]	False		iamiamwhoami			[]				text	t2_6cssq	False	True	"No it's not. The Democratic party is about as left leaning as most European center left parties.

https://www.nytimes.com/interactive/2019/06/26/opinion/sunday/republican-platform-far-right.html"	97a72dce0a0b6edc1deffacb4e470a767c66138d	True	False					0	1647672423		0	{}	i196715	False	t3_tgzrdq	False	True	t1_i158ib5	/r/ethereum/comments/tgzrdq/time_interview_ethereums_vitalik_crypto_is/i196715/	1647672436	1	False	False	False	ethereum	t5_2zf9m	r/ethereum	public		0	[]		no it s not the democratic party is about as left leaning as most european center left parties https www nytimes com interactive 2019 06 26 opinion sunday republican platform far right html	0.004522676579654217	0.9689220190048218	0.6590752005577087	0.17433494329452515	0.04632672294974327	0.2950584590435028	0.12370073795318604	8.41215864966216e-07	0.49766018986701965	0.0031103608198463917
25	[]	False		armaver			[]				text	t2_61ie03xu	False	False	"Maybe part is a difference in culture. I vote for the party or people that represent my values. I don't care if they are a minority that don't have any real say at the moment. If enough people do that, then a small splinter party can get bigger.

The US has more than two parties too, right? Or independent presidential candidates. But not enough people vote for them."	84e9abb3ac5cf611251ee17d1fce9526d1523a62	True	False					0	1647672366		0	{}	i1964ja	False	t3_tgzrdq	False	True	t1_i18chgy	/r/ethereum/comments/tgzrdq/time_interview_ethereums_vitalik_crypto_is/i1964ja/	1647672388	1	False	True	False	ethereum	t5_2zf9m	r/ethereum	public		0	[]		maybe part is a difference in culture i vote for the party or people that represent my values i don t care if they are a minority that don t have any real say at the moment if enough people do that then a small splinter party can get bigger the us has more than two parties too right or independent presidential candidates but not enough people vote for them 	0.0025012861005961895	0.9890353083610535	0.8222980499267578	0.01593717932701111	0.008643769659101963	0.4248766303062439	0.06262776255607605	8.362423500329896e-07	0.42114412784576416	0.002791209379211068
26	[]	False		Life_Newspaper_6184			[]				text	t2_d7e9h15w	False	False	Staking is not on fire, the APY eroded after these news.	54621ae241f6b79b8f42b64267f464d9d5039d2f	True	False					0	1647672289		0	{}	i19619d	False	t3_th7jp2	False	True	t3_th7jp2	/r/ethereum/comments/th7jp2/with_a_record_200k_eth_staked_in_1_day_staking_is/i19619d/	1647672314	1	False	True	False	ethereum	t5_2zf9m	r/ethereum	public		0	[]		staking is not on fire the apy eroded after these news 	0.19174940884113312	0.6253390312194824	0.6405971646308899	0.6567692756652832	0.4340859353542328	0.45786264538764954	0.2263239324092865	0.052021574229002	0.48929542303085327	0.007275261450558901
27	[]	False		Waterproofsoap			[]				text	t2_ajvar9xc	False	False	"His appearance doesn't instill confidence. 





....at all"	041b0cf4cfd15e727ff82b8c88cfeb0805709ca6	True	False					0	1647672047		0	{}	i195qrz	False	t3_tgyzav	False	True	t3_tgyzav	/r/ethereum/comments/tgyzav/vitalik_on_the_cover_of_the_newest_time_magazine/i195qrz/	1647672059	1	False	True	False	ethereum	t5_2zf9m	r/ethereum	public		0	[]		his appearance doesn t instill confidence at all	0.3993510603904724	0.5193798542022705	0.4405130445957184	0.4207765758037567	0.4385710060596466	0.6787106990814209	0.4446489214897156	0.39678382873535156	0.4374271631240845	0.04360124468803406
