Unnamed: 0	all_awardings	archived	associated_award	author	author_flair_background_color	author_flair_css_class	author_flair_richtext	author_flair_template_id	author_flair_text	author_flair_text_color	author_flair_type	author_fullname	author_patreon_flair	author_premium	body	body_sha1	can_gild	collapsed	collapsed_because_crowd_control	collapsed_reason	collapsed_reason_code	comment_type	controversiality	created_utc	distinguished	gilded	gildings	id	is_submitter	link_id	locked	no_follow	parent_id	permalink	retrieved_utc	score	score_hidden	send_replies	stickied	subreddit	subreddit_id	subreddit_name_prefixed	subreddit_type	top_awarded_type	total_awards_received	treatment_tags	unrepliable_reason	author_cakeday	corpus	support	knowledge	conflict	power	similarity	fun	status	trust	identity	romance
396	[]	False		NotFunnyhah			[]				text	t2_372rrs05	False	False	Gas fees	47d803cbdcf0ee8a71a4a45e616e1aa930868de6	True	False					0	1657886042		0	{}	ig94609	False	t3_vzij1e	False	False	t3_vzij1e	/r/ethereum/comments/vzij1e/why_would_i_ever_use_an_alternate_l1_once_the/ig94609/	1657886055	1	False	True	False	ethereum	t5_2zf9m	r/ethereum	public		0	[]			gas fees	0.4522533118724823	0.5695474147796631	0.48559921979904175	0.5443264842033386	0.46774566173553467	0.4423867464065552	0.43690311908721924	0.45753416419029236	0.4710039794445038	0.22992712259292603
397	[]	False		laiod			[]				text	t2_e6278	False	False	How is it better under the hood?	568a7d3d270d74505bab5bcb41f42cda6b403879	True	False					0	1657886041		0	{}	ig945x5	False	t3_vwsiuq	False	True	t1_ig89mbz	/r/ethereum/comments/vwsiuq/gamestop_has_officially_launched_its_nft/ig945x5/	1657886055	1	False	True	False	ethereum	t5_2zf9m	r/ethereum	public		0	[]			how is it better under the hood 	0.4948035180568695	0.601151704788208	0.41070666909217834	0.4792102575302124	0.4978942573070526	0.41666698455810547	0.28110286593437195	0.605881929397583	0.4721168577671051	0.1720334142446518
398	[]	False		SuperCryptoBr0			[]				text	t2_h21yu4z6	False	False	Bigly	ccf90f725b94de50b6ee99f59805aebc2c107e0d	True	False					0	1657885787		0	{}	ig93qbe	False	t3_vzlbb5	False	True	t3_vzlbb5	/r/ethereum/comments/vzlbb5/im_incredibly_excited_about_polygon_being_a_part/ig93qbe/	1657885799	1	False	True	False	ethereum	t5_2zf9m	r/ethereum	public		0	[]			bigly	0.4630463123321533	0.5352395176887512	0.5240671038627625	0.4709847569465637	0.4710223376750946	0.1883898675441742	0.5116345286369324	0.4854360520839691	0.5077736377716064	0.4087046682834625
399	[]	False		[deleted]						dark					[removed]	fe993932d6dced4c0a879e9aa5d7a6e0fbb467f5	True	False					0	1657885780		0	{}	ig93pvp	False	t3_vl9x4m	False	True	t3_vl9x4m	/r/ethereum/comments/vl9x4m/yes_it_is_a_bear_market_i_think_even_the_most/ig93pvp/	1657885791	1	False	True	False	ethereum	t5_2zf9m	r/ethereum	public		0	[]			 removed 	0.46707504987716675	0.5148742198944092	0.5170193910598755	0.5029740929603577	0.4936113953590393	0.5123135447502136	0.45383262634277344	0.4847692549228668	0.4981911778450012	0.5145108103752136
400	[]	False		JoelFrench93			[]				text	t2_huucl5v	False	False	Further proof that we are so so early	1a85f45699af25453c3ee58b1f2f85cd41384c2b	True	False					0	1657875110		0	{}	ig8p656	False	t3_vyvu0a	False	True	t1_ig7v0o8	/r/XRP/comments/vyvu0a/xspectar_aims_to_bring_the_metaverse_to_the_xrpl/ig8p656/	1657875121	1	True	True	False	XRP	t5_2ruj5	r/XRP	public		0	[]			further proof that we are so so early	0.44192859530448914	0.5094752907752991	0.3529278039932251	0.6743602156639099	0.4791664481163025	0.5098384618759155	0.5169680118560791	0.5987409353256226	0.5212498307228088	0.11669835448265076
401	[]	False		coachhunter		Gentleman	[{'e': 'text', 't': 'XRP Hodler'}]	07e1063e-6aba-11e8-8fbb-0efb9a871d68	XRP Hodler	dark	richtext	t2_1hjxby03	False	False	Why do you get XRP for holding Reaper?	7b604ebe7b9d3039c4fd7240bc261bd1700acb0d	True	False					0	1657898382		0	{}	ig9v39w	False	t3_vyvu0a	False	False	t1_ig7g4lm	/r/XRP/comments/vyvu0a/xspectar_aims_to_bring_the_metaverse_to_the_xrpl/ig9v39w/	1657898396	1	True	True	False	XRP	t5_2ruj5	r/XRP	public		0	[]			why do you get xrp for holding reaper 	0.4908416271209717	0.4236301779747009	0.4526901841163635	0.5162578821182251	0.36208271980285645	0.4541706442832947	0.37818917632102966	0.2947181165218353	0.385405570268631	0.0821189358830452
402	[]	False		TheBotOverlord			[]				text	t2_bvxykdup	False	False	"*It's My Money and I Want It Now*

*Call Mr. Wenworth at 1-877-CASH-NOW*"	7bb0c3feb09b8c007c201f98026e867656efbc94	True	False					0	1657894752		0	{}	ig9m8gw	False	t3_rfw3b8	False	True	t1_hoi1iw2	/r/XRP/comments/rfw3b8/please_enlighten_me/ig9m8gw/	1657894771	1	True	True	False	XRP	t5_2ruj5	r/XRP	public		0	[]			 it s my money and i want it now call mr wenworth at 1 877 cash now 	0.3843850791454315	0.5309630632400513	0.48092955350875854	0.10735742002725601	0.22175930440425873	0.3871762454509735	0.19406954944133759	0.000255307590123266	0.31355541944503784	0.009183323010802269
403	[]	False		huntxfish			[]				text	t2_kszysxsx	False	False	I agree. That’s why I’m heavy on Alts with utility. It’s the cbDC (blockchain) part that could be concerning for me. Has potential to grow where may not need the later 1’s to build on eventually. Just a long term concern. Remember this is still all speculation until we have regulation clarity and full adoption.	2a8f77531c4fc28cb4a8354a00a8595ec95896ee	True	False					0	1657894671		0	{}	ig9m1kz	False	t3_vyenth	False	True	t1_ig86ajp	/r/XRP/comments/vyenth/former_crypto_adviser_michael_barr_confirmed_as/ig9m1kz/	1657894688	1	True	True	False	XRP	t5_2ruj5	r/XRP	public		0	[]			i agree that s why i m heavy on alts with utility it s the cbdc blockchain part that could be concerning for me has potential to grow where may not need the later 1 s to build on eventually just a long term concern remember this is still all speculation until we have regulation clarity and full adoption 	0.0033016956876963377	0.9880579710006714	0.40922605991363525	0.027744987979531288	0.993887722492218	0.30827414989471436	0.11166588962078094	8.394887913709681e-07	0.2697722017765045	0.008184409700334072
404	[]	False		TheBotOverlord			[]				text	t2_bvxykdup	False	False	"*It's My Money and I Want It Now*

*Call Mr. Wenworth at 1-877-CASH-NOW*"	7bb0c3feb09b8c007c201f98026e867656efbc94	True	False					0	1657894161		0	{}	ig9kuie	False	t3_sju049	False	True	t1_iembx5e	/r/XRP/comments/sju049/xrp_will_never_reach_100/ig9kuie/	1657894172	1	True	True	False	XRP	t5_2ruj5	r/XRP	public		0	[]			 it s my money and i want it now call mr wenworth at 1 877 cash now 	0.3843850791454315	0.5309630632400513	0.48092955350875854	0.10735742002725601	0.22175930440425873	0.3871762454509735	0.19406954944133759	0.000255307590123266	0.31355541944503784	0.009183323010802269
405	[]	False		UnitedStatesAirFurs			[]				text	t2_1mbs40pg	False	False	Waiting for profits that XRP may bring.	76f90baa28452763eb7a461dcb8caf49f28d238f	True	False					0	1657889429		0	{}	ig9ahsz	False	t3_vzf3p1	False	True	t1_ig8hill	/r/XRP/comments/vzf3p1/071522_join_flarexrp_discord/ig9ahsz/	1657889441	1	True	True	False	XRP	t5_2ruj5	r/XRP	public		0	[]			waiting for profits that xrp may bring 	0.5462367534637451	0.5908409357070923	0.3663877546787262	0.5409040451049805	0.3897143602371216	0.4296158254146576	0.48368528485298157	0.5388078689575195	0.39716583490371704	0.020163431763648987
406	[]	False		WellPayed		Gentleman	[{'e': 'text', 't': 'XRP Hodler'}]	07e1063e-6aba-11e8-8fbb-0efb9a871d68	XRP Hodler	dark	richtext	t2_249vfxt8	False	False	xx,xxx - xxx,xxx	775ef7a2817ff5e66e0466d711cb13fef35e32df	True	False					0	1657927113		0	{}	igbt5o1	False	t3_vzf3p1	False	True	t1_igb1eew	/r/XRP/comments/vzf3p1/071522_join_flarexrp_discord/igbt5o1/	1657927124	1	True	True	False	XRP	t5_2ruj5	r/XRP	public		0	[]			xx xxx xxx xxx	0.44781339168548584	0.38591891527175903	0.3698250353336334	0.5187168121337891	0.47123584151268005	0.36990591883659363	0.502747654914856	0.5590583086013794	0.4797457754611969	0.910886287689209
407	[]	False		coachhunter		Gentleman	[{'e': 'text', 't': 'XRP Hodler'}]	07e1063e-6aba-11e8-8fbb-0efb9a871d68	XRP Hodler	dark	richtext	t2_1hjxby03	False	False	Afraid not. But after the initial 15% drop there will be a vote to be able to change the target address for the future airdrops.	613be513e7769a3dc8c3ba1a731b558a5f2e0fbd	True	False					0	1657918952		0	{}	igbal4r	False	t3_vzf3p1	False	True	t1_igaispy	/r/XRP/comments/vzf3p1/071522_join_flarexrp_discord/igbal4r/	1657918965	1	True	True	False	XRP	t5_2ruj5	r/XRP	public		0	[]			afraid not but after the initial 15 drop there will be a vote to be able to change the target address for the future airdrops 	0.22625310719013214	0.8780876994132996	0.5494649410247803	0.8718498349189758	0.0443769134581089	0.13355350494384766	0.10048391669988632	8.683378496243677e-07	0.24727363884449005	0.02638498693704605
408	[]	False		[deleted]						dark					[removed]	fe993932d6dced4c0a879e9aa5d7a6e0fbb467f5	True	False					0	1657917885		0	{}	igb7zrh	False	t3_vz53z9	False	True	t3_vz53z9	/r/XRP/comments/vz53z9/where_to_buy_xrp_in_ny_right_now/igb7zrh/	1657917897	1	True	True	False	XRP	t5_2ruj5	r/XRP	public		0	[]			 removed 	0.46707504987716675	0.5148742198944092	0.5170193910598755	0.5029740929603577	0.4936113953590393	0.5123135447502136	0.45383262634277344	0.4847692549228668	0.4981911778450012	0.5145108103752136
409	[]	False		LF777		Warning-level5	[{'e': 'text', 't': 'WARNING: 4 ~ 5 years account age. 0 - 40 comment karma.'}]	f461fce0-6c38-11e9-9031-0ea06aef805a	WARNING: 4 ~ 5 years account age. 0 - 40 comment karma.	dark	richtext	t2_1092ml	False	False	At this point in the game, what's a solid bag to hold?	5db7fb2aaf96cbc83a09f79cf275bfcee7e02e93	True	False					0	1657915213		0	{}	igb1eew	False	t3_vzf3p1	False	True	t3_vzf3p1	/r/XRP/comments/vzf3p1/071522_join_flarexrp_discord/igb1eew/	1657915227	1	True	True	False	XRP	t5_2ruj5	r/XRP	public		0	[]			at this point in the game what s a solid bag to hold 	0.12770330905914307	0.7473141551017761	0.45253339409828186	0.5185691714286804	0.4935133159160614	0.47954726219177246	0.16555164754390717	1.0565230695647188e-05	0.3440511226654053	0.0029430422000586987
410	[]	False		scoobysi		noflair	[]			dark	text	t2_uv26lwz	False	False	I am like a coiled spring	465ba4997c9b80cba4d0df86f8343392b9121bfb	True	False					0	1657868944		0	{}	ig8hill	False	t3_vzf3p1	False	True	t3_vzf3p1	/r/XRP/comments/vzf3p1/071522_join_flarexrp_discord/ig8hill/	1657868955	1	True	True	False	XRP	t5_2ruj5	r/XRP	public		0	[]			i am like a coiled spring	0.4450075626373291	0.40498536825180054	0.3391581177711487	0.2619791626930237	0.5311521291732788	0.5127582550048828	0.507334291934967	0.4419264495372772	0.4802106022834778	0.6358943581581116
411	[]	False		scoobysi		noflair	[]			dark	text	t2_uv26lwz	False	False	Maybe not in the bitcoin maxi world but in this real world domestic currencies aren’t going anywhere any time soon	a09fe00390cdc32fe53079c552a18281701643c0	True	False					0	1657861247		0	{}	ig86ajp	False	t3_vyenth	False	True	t1_ig8035y	/r/XRP/comments/vyenth/former_crypto_adviser_michael_barr_confirmed_as/ig86ajp/	1657861260	1	True	True	False	XRP	t5_2ruj5	r/XRP	public		0	[]			maybe not in the bitcoin maxi world but in this real world domestic currencies aren t going anywhere any time soon	0.0657847598195076	0.9108862280845642	0.38604819774627686	0.03166304901242256	0.4491502344608307	0.4515690207481384	0.13307248055934906	1.638457661101711e-06	0.4457182288169861	0.005412564612925053
412	[]	False		huntxfish			[]				text	t2_kszysxsx	False	False	Right. They don’t need their own cbdc though.	33e4b6ee1fe54eb2c40e597d958fcffd718c4549	True	False					0	1657857666		0	{}	ig8035y	False	t3_vyenth	False	True	t1_ig7yvta	/r/XRP/comments/vyenth/former_crypto_adviser_michael_barr_confirmed_as/ig8035y/	1657857682	1	True	True	False	XRP	t5_2ruj5	r/XRP	public		0	[]			right they don t need their own cbdc though 	0.4141051769256592	0.47815272212028503	0.49679747223854065	0.5976442098617554	0.29279693961143494	0.43169546127319336	0.33585891127586365	0.39726898074150085	0.4725792706012726	0.010705679655075073
413	[]	False		scoobysi		noflair	[]			dark	text	t2_uv26lwz	False	False	Dude central banks aren’t going anywhere	ffe357954e9c20c6f9a09b51771b95784607d082	True	False					0	1657857014		0	{}	ig7yvta	False	t3_vyenth	False	True	t1_ig4xu02	/r/XRP/comments/vyenth/former_crypto_adviser_michael_barr_confirmed_as/ig7yvta/	1657857030	1	True	True	False	XRP	t5_2ruj5	r/XRP	public		0	[]			dude central banks aren t going anywhere	0.33818334341049194	0.4382340610027313	0.5232779383659363	0.47248125076293945	0.49045729637145996	0.5690589547157288	0.3569011390209198	0.3910853862762451	0.4515882730484009	0.008124059066176414
414	[]	False		scoobysi		noflair	[]			dark	text	t2_uv26lwz	False	False	We found gary gensler guys ;)	2d0cc3574909bfbe9f28efa2cb72060da7aac363	True	False					0	1657856947		0	{}	ig7yr2y	False	t3_vyenth	False	True	t1_ig5179k	/r/XRP/comments/vyenth/former_crypto_adviser_michael_barr_confirmed_as/ig7yr2y/	1657856963	1	True	True	False	XRP	t5_2ruj5	r/XRP	public		0	[]			we found gary gensler guys 	0.4065023958683014	0.36849740147590637	0.341718852519989	0.38261160254478455	0.5226380228996277	0.6915522813796997	0.6213076114654541	0.47834864258766174	0.4249560236930847	0.6300709247589111
415	[]	False		CURLY-BILL			[]				text	t2_9vda6voy	False	False	"Lol... You are so right... Even when it's put into bullet points... It makes others scratch their heads...
Lol...
The person who can bring all this stuff together and make it basic BASIC... Will be a billionaire..
I wish I was talented enough in this field to do so...

Are you on Twitter ?"	6862cedb9c4e72a4a8841ae881ca84041ee79af0	True	False					0	1657855019		0	{}	ig7v0o8	False	t3_vyvu0a	False	True	t1_ig7uhby	/r/XRP/comments/vyvu0a/xspectar_aims_to_bring_the_metaverse_to_the_xrpl/ig7v0o8/	1657855034	1	True	True	False	XRP	t5_2ruj5	r/XRP	public		0	[]			lol you are so right even when it s put into bullet points it makes others scratch their heads lol the person who can bring all this stuff together and make it basic basic will be a billionaire i wish i was talented enough in this field to do so are you on twitter 	0.0031002098694443703	0.9872037768363953	0.07878055423498154	0.015661869198083878	0.02825462631881237	0.59511399269104	0.07487691193819046	8.550630923309654e-07	0.16226576268672943	0.018725262954831123
416	[]	False		RickMuffy			[]				text	t2_gxw75	False	False	I always laugh when I read how we buy stuff like this, because a casual persons head might explode trying to understand.	ca129dc1223dcf3458e736ded58bd3880be05d90	True	False					0	1657854750		0	{}	ig7uhby	False	t3_vyvu0a	False	True	t1_ig7g4lm	/r/XRP/comments/vyvu0a/xspectar_aims_to_bring_the_metaverse_to_the_xrpl/ig7uhby/	1657854762	1	True	True	False	XRP	t5_2ruj5	r/XRP	public		0	[]			i always laugh when i read how we buy stuff like this because a casual persons head might explode trying to understand 	0.05371592566370964	0.5033789873123169	0.576983630657196	0.010114290751516819	0.5748569369316101	0.9965169429779053	0.1762818694114685	1.1348307680236758e-06	0.32643604278564453	0.002954147756099701
417	[]	False		Ewoktoremember			[]				text	t2_dbz7d	False	False	Once I can pull it out and 4% of the bag = half of my yearly salary.	2ec186465eeb7d6d1ba8a58b389fc8b5b7b6b474	True	False					0	1657849548		0	{}	ig7jje6	False	t3_vymjks	False	True	t1_ig5o7os	/r/XRP/comments/vymjks/071422_join_flarexrp_discord/ig7jje6/	1657849563	1	True	True	False	XRP	t5_2ruj5	r/XRP	public		0	[]			once i can pull it out and 4 of the bag half of my yearly salary 	0.29538846015930176	0.6947311758995056	0.2594616115093231	0.2571633458137512	0.17484168708324432	0.48249951004981995	0.14752104878425598	0.06195724010467529	0.24258239567279816	0.004473575856536627
418	[]	False		CURLY-BILL			[]				text	t2_9vda6voy	False	False	"I have invested in XSPECTAR. I bought using my Xumm wallet. I used the ego platform on the XRPL. It's called XRPLCoins.
I connected my Xumm Wallet to the SOLOGENIC DEX
Pressed the Fiat button bought Droit went straight into my Xumm Wallet after 10 minutes.
Next I connected my Xumm Wallet to the XRPLcoins DEX I swapped some of my XRP for xSPECTAR and The Reaper coins. Both went straight into my Xumm Wallet with in 5 seconds.
Now I own xspectar and Reaper. Both are awesome coins. I stayked my Xspectar on Staykx do I earn passive income. And just owning Reaper gets me XRP for free every two weeks... More passive income.
@TheReaperCoin @Xspectar check out the community on Twitter."	c3426240d54ab54922b3bf81a1c82ec28467f638	True	False					0	1657847969		0	{}	ig7g4lm	False	t3_vyvu0a	False	True	t3_vyvu0a	/r/XRP/comments/vyvu0a/xspectar_aims_to_bring_the_metaverse_to_the_xrpl/ig7g4lm/	1657847983	1	True	True	False	XRP	t5_2ruj5	r/XRP	public		0	[]			i have invested in xspectar i bought using my xumm wallet i used the ego platform on the xrpl it s called xrplcoins i connected my xumm wallet to the sologenic dex pressed the fiat button bought droit went straight into my xumm wallet after 10 minutes next i connected my xumm wallet to the xrplcoins dex i swapped some of my xrp for xspectar and the reaper coins both went straight into my xumm wallet with in 5 seconds now i own xspectar and reaper both are awesome coins i stayked my xspectar on staykx do i earn passive income and just owning reaper gets me xrp for free every two weeks more passive income thereapercoin xspectar check out the community on twitter 	0.002708739833906293	0.988365888595581	0.3375084698200226	0.06612512469291687	0.9944227337837219	0.38450920581817627	0.14337220788002014	8.635809649604198e-07	0.2841157615184784	0.004028970841318369
419	[]	False		Bronyaur_5tomp			[]				text	t2_c01jd	False	False	A month until the next big event probably	3a2ec5b563771ae1c06b1ebe47ea32c754a5b9ed	True	False					0	1657912589		0	{}	igauxj7	False	t3_vzf3p1	False	True	t1_ig9ahsz	/r/XRP/comments/vzf3p1/071522_join_flarexrp_discord/igauxj7/	1657912603	1	True	True	False	XRP	t5_2ruj5	r/XRP	public		0	[]			a month until the next big event probably	0.46447983384132385	0.5951442122459412	0.266440749168396	0.5945836901664734	0.4534255862236023	0.57452791929245	0.23143981397151947	0.43690311908721924	0.34944087266921997	0.14211760461330414
420	[]	False		Alarming_Ad526			[]				text	t2_degfhjdu	False	False	When the snapshot for flare happened I had my xrp in my probit global wallet. They said they will support the airdrop but they said the same with songbird and I didn't receive it. Is there a way to change the address to my xumm wallet (where I moved it last year) so I can receive it? Can anybody help? Thank you.	99461bfd0cc130bb7ad732d8add194946ea4c679	True	False					0	1657907717		0	{}	igaispy	False	t3_vzf3p1	False	True	t3_vzf3p1	/r/XRP/comments/vzf3p1/071522_join_flarexrp_discord/igaispy/	1657907731	1	True	True	False	XRP	t5_2ruj5	r/XRP	public		0	[]			when the snapshot for flare happened i had my xrp in my probit global wallet they said they will support the airdrop but they said the same with songbird and i didn t receive it is there a way to change the address to my xumm wallet where i moved it last year so i can receive it can anybody help thank you 	0.0035665344912558794	0.9887230396270752	0.026635780930519104	0.01695469208061695	0.993641197681427	0.37602686882019043	0.09266931563615799	8.331091976288008e-07	0.14962062239646912	0.023770736530423164
421	[]	False		scoobysi		noflair	[]			dark	text	t2_uv26lwz	False	False	Lol. That is all our portfolios for now…..	03fe234c40805db1f177e77e4f0a433fe5a3224f	True	False					0	1657906277		0	{}	igaf5w6	False	t3_vzf3p1	False	True	t1_igaam7v	/r/XRP/comments/vzf3p1/071522_join_flarexrp_discord/igaf5w6/	1657906293	1	True	True	False	XRP	t5_2ruj5	r/XRP	public		0	[]			lol that is all our portfolios for now 	0.4262085556983948	0.44034290313720703	0.35074377059936523	0.3650887608528137	0.4771038591861725	0.5267846584320068	0.5072808861732483	0.5926061868667603	0.44246619939804077	0.021048953756690025
422	[]	False		coachhunter		Gentleman	[{'e': 'text', 't': 'XRP Hodler'}]	07e1063e-6aba-11e8-8fbb-0efb9a871d68	XRP Hodler	dark	richtext	t2_1hjxby03	False	False	Think I’m more like a slinky.	ffea1576ae8a1c8d3f9816ab52afa18ea6b6b2bf	True	False					0	1657904489		0	{}	igaam7v	False	t3_vzf3p1	False	True	t1_ig8hill	/r/XRP/comments/vzf3p1/071522_join_flarexrp_discord/igaam7v/	1657904501	1	True	True	False	XRP	t5_2ruj5	r/XRP	public		0	[]			think i m more like a slinky 	0.46340134739875793	0.41810864210128784	0.3166595995426178	0.21342799067497253	0.5394095778465271	0.4704146981239319	0.4607585668563843	0.6792920827865601	0.4455031752586365	0.1749643236398697
423	[]	False		Yarrr_piratejackoff			[]				text	t2_97nj9	False	False	Whatever happens to the flare drop for holding xrp	a14118e67ccb9568c82ebd1e4f0664909cd4f910	True	False					0	1657902856		0	{}	iga6g7u	False	t3_vzf3p1	False	True	t3_vzf3p1	/r/XRP/comments/vzf3p1/071522_join_flarexrp_discord/iga6g7u/	1657902870	1	True	True	False	XRP	t5_2ruj5	r/XRP	public		0	[]			whatever happens to the flare drop for holding xrp	0.30785223841667175	0.6661593914031982	0.44260913133621216	0.417537122964859	0.4004650115966797	0.27734851837158203	0.2794596254825592	0.10884259641170502	0.371537446975708	7.59504473535344e-05
424	[]	False		travisb_1		Warning-level1	[{'e': 'text', 't': '2 ~ 3 years account age. 150 - 250 comment karma.'}]	f4245c6e-6c38-11e9-9031-0ea06aef805a	2 ~ 3 years account age. 150 - 250 comment karma.	dark	richtext	t2_f1209v4	False	False	Eating my words right now 🤣 boy am I glad tho!!	e2ce92c04c299913ba0771776108eb3fec59d766	True	False					0	1657901623		0	{}	iga3b8a	False	t3_hfmi81	False	True	t1_fw4ha6u	/r/XRP/comments/hfmi81/digital_dollar_hearing_round_2_us_senate_to/iga3b8a/	1657901638	1	True	True	False	XRP	t5_2ruj5	r/XRP	public		0	[]			eating my words right now boy am i glad tho 	0.44633522629737854	0.13176420331001282	0.4608898460865021	0.1149158924818039	0.5378245115280151	0.61272794008255	0.6645868420600891	0.08349498361349106	0.3425613343715668	0.06255317479372025
425	[]	False		No-Loss4301			[]				text	t2_4hn6y5sd	False	False	I don't mean by the repo contributors, It's that in the website there's no formal information about the Leadership team behind Solana. If you go for instance to the Algorand website you can see the details about who's in charge of what spec of the Foundation and project, Founder, CEO, etc and their credentials. https://www.algorand.com/about/our-team	6f347b07401e19e15fae68408ff0815bf7ce5857	True	False					0	1657857387		0	{}	ig7zkue	True	t3_vzczkm	False	True	t1_ig7tm9g	/r/solana/comments/vzczkm/solana_team/ig7zkue/	1657857398	1	False	True	False	solana	t5_hcs2n	r/solana	public		0	[]			i don t mean by the repo contributors it s that in the website there s no formal information about the leadership team behind solana if you go for instance to the algorand website you can see the details about who s in charge of what spec of the foundation and project founder ceo etc and their credentials https www algorand com about our team	0.0025582376401871443	0.9891561269760132	0.08759898692369461	0.32648447155952454	0.007597879972308874	0.5088829398155212	0.13261409103870392	8.608108714724949e-07	0.41506683826446533	0.010162421502172947
426	[]	False		pleasure_euphoria			[]				text	t2_b7wlxq9q	False	False	Good for ftx us?	f2ab6a6c51fc9c05d61e043e602e5199988a2d09	True	False					0	1657857096		0	{}	ig7z1gq	False	t3_vz174r	False	True	t1_ig7eg3k	/r/solana/comments/vz174r/staking_options/ig7z1gq/	1657857111	1	False	True	False	solana	t5_hcs2n	r/solana	public		0	[]			good for ftx us 	0.6246005296707153	0.42904433608055115	0.4134303629398346	0.37997937202453613	0.4901367425918579	0.5926908850669861	0.580531895160675	0.6052091717720032	0.43417930603027344	0.23731444776058197
427	[]	False		JGreddit88			[]				text	t2_3n0am1mh	False	False	what do you think of Figment in Ledger ?	dc9e7e51da8ed5589d9e09229181d2c075e0a12c	True	False					0	1657855679		0	{}	ig7wb0h	False	t3_vz174r	False	True	t1_ig5purw	/r/solana/comments/vz174r/staking_options/ig7wb0h/	1657855695	1	False	True	False	solana	t5_hcs2n	r/solana	public		0	[]			what do you think of figment in ledger 	0.4344790279865265	0.3834616243839264	0.6278754472732544	0.4449343979358673	0.41892877221107483	0.4442645311355591	0.35803303122520447	0.25822997093200684	0.46425217390060425	0.024964530020952225
428	[]	False		JGreddit88			[]				text	t2_3n0am1mh	False	False	what do you think of Figment in Ledger ?	dc9e7e51da8ed5589d9e09229181d2c075e0a12c	True	False					0	1657855655		0	{}	ig7w9bo	False	t3_vz174r	False	True	t3_vz174r	/r/solana/comments/vz174r/staking_options/ig7w9bo/	1657855665	1	False	True	False	solana	t5_hcs2n	r/solana	public		0	[]			what do you think of figment in ledger 	0.4344790279865265	0.3834616243839264	0.6278754472732544	0.4449343979358673	0.41892877221107483	0.4442645311355591	0.35803303122520447	0.25822997093200684	0.46425217390060425	0.024964530020952225
429	[]	False		DPSK7878			[]				text	t2_880amgba	False	False	OK whatever. The coin will just appreciate under the same conditions.	4631f1d97019b4d316985b6184ae22add74e235c	True	False					0	1657854964		0	{}	ig7uwps	False	t3_vz2a46	False	True	t1_ig7cfp4	/r/solana/comments/vz2a46/this_is_why_solana_will_moon/ig7uwps/	1657854975	1	False	True	False	solana	t5_hcs2n	r/solana	public		0	[]			ok whatever the coin will just appreciate under the same conditions 	0.5592820048332214	0.4446740448474884	0.2052362859249115	0.31111153960227966	0.5141412019729614	0.4595426321029663	0.4023650586605072	0.685726523399353	0.44627922773361206	0.003911165986210108
