Unnamed: 0	all_awardings	archived	associated_award	author	author_flair_background_color	author_flair_css_class	author_flair_richtext	author_flair_template_id	author_flair_text	author_flair_text_color	author_flair_type	author_fullname	author_patreon_flair	author_premium	body	body_sha1	can_gild	collapsed	collapsed_because_crowd_control	collapsed_reason	collapsed_reason_code	comment_type	controversiality	created_utc	distinguished	gilded	gildings	id	is_submitter	link_id	locked	no_follow	parent_id	permalink	retrieved_utc	score	score_hidden	send_replies	stickied	subreddit	subreddit_id	subreddit_name_prefixed	subreddit_type	top_awarded_type	total_awards_received	treatment_tags	unrepliable_reason	author_cakeday	corpus	support	knowledge	conflict	power	similarity	fun	status	trust	identity	romance
185	[]	False		blakewoolbright			[]				text	t2_htljmoo	False	False	Sorry my friend.  On the bright side, there is a tax write off potentially.  Depending on your basis and your nationality, you might recover a chunk from the govt.	a63f38ea1e312517b06eff8f0bed07e6d9f1278a	True	False					0	1657852921		0	{}	ig7qqcg	False	t3_vz1ief	False	True	t1_ig78kwv	/r/Bitcoin/comments/vz1ief/celsius_files_for_bankruptcy_as_users_worry_their/ig7qqcg/	1657852935	1	True	True	False	Bitcoin	t5_2s3qj	r/Bitcoin	public		0	[]			sorry my friend on the bright side there is a tax write off potentially depending on your basis and your nationality you might recover a chunk from the govt 	0.14834581315517426	0.8700257539749146	0.5832834243774414	0.026626814156770706	0.17586009204387665	0.24977326393127441	0.10004761815071106	8.718520234651805e-07	0.33661746978759766	0.023008884862065315
186	[]	False		mintspit			[]				text	t2_34w1ax53	False	False	Jeff musk 😮	f4f8bcbb4f0e633d6dd5778fcc65327a06f29e33	True	False					0	1657852905		0	{}	ig7qp2o	False	t3_vyt9vl	False	False	t3_vyt9vl	/r/Bitcoin/comments/vyt9vl/i_asked_an_ai_to_draw_the_founder_of_bitcoin/ig7qp2o/	1657852916	1	True	True	False	Bitcoin	t5_2s3qj	r/Bitcoin	public		0	[]			jeff musk 	0.42541980743408203	0.430841863155365	0.47719764709472656	0.4445708692073822	0.48401299118995667	0.6145548820495605	0.48640209436416626	0.4566495716571808	0.47095462679862976	0.7179080843925476
187	[]	False		OGDogePool			[]				text	t2_4y6cs3a7	False	False	Would have been better if it drew Jim Cramer	24a3113cad291d41450ee7aaacd55b1e40a5ec44	True	False					0	1657852874		0	{}	ig7qmv0	False	t3_vyt9vl	False	True	t3_vyt9vl	/r/Bitcoin/comments/vyt9vl/i_asked_an_ai_to_draw_the_founder_of_bitcoin/ig7qmv0/	1657852887	1	True	True	False	Bitcoin	t5_2s3qj	r/Bitcoin	public		0	[]			would have been better if it drew jim cramer	0.4416482150554657	0.4688461124897003	0.37297552824020386	0.48290348052978516	0.41082993149757385	0.6412725448608398	0.4969518482685089	0.5701807141304016	0.38469576835632324	0.07450885325670242
188	[]	False		ToastedShortbread			[]			dark	text	t2_f21ao4fz	False	False	Why do people wear expensive watches or jewelry, honestly asking to get robbed. At least my wallet password is in my head and not physically on my person	ea197547826091ed3aecb0eb5d1afe2afa3ad391	True	False					0	1657852837		0	{}	ig7qjxj	False	t3_vz9zpn	False	True	t3_vz9zpn	/r/Bitcoin/comments/vz9zpn/why_would_people_wear_bitcoin_merch_in_public/ig7qjxj/	1657852850	1	True	True	False	Bitcoin	t5_2s3qj	r/Bitcoin	public		0	[]			why do people wear expensive watches or jewelry honestly asking to get robbed at least my wallet password is in my head and not physically on my person	0.008761913515627384	0.9571714997291565	0.7655321359634399	0.015098736621439457	0.013726986013352871	0.44887182116508484	0.08212731033563614	8.576028562856663e-07	0.3510225713253021	0.11314022541046143
189	[]	False		Commercial-Ninja1			[]				text	t2_e4b21ozq	False	False	this is the most important, thanks for this	602f958c4b7f0443b613b4eee8310dc0537b0988	True	False					0	1657852815		0	{}	ig7qi5p	False	t3_vypq2s	False	True	t1_ig47pxd	/r/Bitcoin/comments/vypq2s/just_wondering_what_happens_if_a_ledger_is_lost/ig7qi5p/	1657852827	1	True	True	False	Bitcoin	t5_2s3qj	r/Bitcoin	public		0	[]			this is the most important thanks for this	0.5358757972717285	0.5809584856033325	0.052707020193338394	0.4068670868873596	0.4917604923248291	0.5080183744430542	0.7234559655189514	0.6198620200157166	0.41158896684646606	0.19711698591709137
190	[]	False		TrymWS			[]				text	t2_kruww	False	False	"I think it’s depositors first, then creditors and lastly shareholders.

And depositors are insured by the government up to around $250k in most functional countries."	3e0310ce42f68c850546da2e4a55f5ef9e31cba6	True	False					0	1657852813		0	{}	ig7qi0y	False	t3_vz1ief	False	True	t1_ig7iikz	/r/Bitcoin/comments/vz1ief/celsius_files_for_bankruptcy_as_users_worry_their/ig7qi0y/	1657852827	1	True	True	False	Bitcoin	t5_2s3qj	r/Bitcoin	public		0	[]			i think it s depositors first then creditors and lastly shareholders and depositors are insured by the government up to around 250k in most functional countries 	0.15270917117595673	0.8203067779541016	0.5634090900421143	0.7646002173423767	0.39400798082351685	0.3198976516723633	0.13496249914169312	8.842069405545772e-07	0.5507199168205261	0.004897493403404951
191	[]	False		-fumble-			[]				text	t2_a42o0	False	False	"Not all of it. They'll probably get back a few cents on the dollar in the bankruptcy in 4 or 5 years (when the BTC will have been worth 5-10x). 

Not your keys, not your coins. There is a reason people who have been doing this for a long time keep repeating themselves."	ecb4192eca1b7946e9354ea9380a7491c3dec91d	True	False					0	1657852731		0	{}	ig7qby6	False	t3_vz1ief	False	True	t1_ig5kwth	/r/Bitcoin/comments/vz1ief/celsius_files_for_bankruptcy_as_users_worry_their/ig7qby6/	1657852745	1	True	True	False	Bitcoin	t5_2s3qj	r/Bitcoin	public		0	[]			not all of it they ll probably get back a few cents on the dollar in the bankruptcy in 4 or 5 years when the btc will have been worth 5 10x not your keys not your coins there is a reason people who have been doing this for a long time keep repeating themselves 	0.007190536241978407	0.9885121583938599	0.7637796998023987	0.02254268154501915	0.011257238686084747	0.49072107672691345	0.07317977398633957	8.416660648435936e-07	0.2008746713399887	0.00645214831456542
192	[]	False		tjackson_12			[]				text	t2_ypbhq5c	False	False	For me personally I bought some BTC stickers, like to put them on random shit in random places where it makes sense. It’s my way of advertising without wearing it	bb0b4f0d23d8798b7a685d7ef3774b834d5f624d	True	False					0	1657852731		0	{}	ig7qbwh	False	t3_vz9zpn	False	True	t3_vz9zpn	/r/Bitcoin/comments/vz9zpn/why_would_people_wear_bitcoin_merch_in_public/ig7qbwh/	1657852745	1	True	True	False	Bitcoin	t5_2s3qj	r/Bitcoin	public		0	[]			for me personally i bought some btc stickers like to put them on random shit in random places where it makes sense it s my way of advertising without wearing it	0.008342131040990353	0.7289799451828003	0.5579138994216919	0.010056398808956146	0.8133001327514648	0.4818284213542938	0.08339857310056686	8.34373452107684e-07	0.35573065280914307	0.01089851837605238
193	[]	False		c0ng0pr0			[]				text	t2_8lf70cnv	False	False	Maybe they’re begging for charity	4652c75877a7af89ab008194bdf3f4f2743a0550	True	False					0	1657852688		0	{}	ig7q8nh	False	t3_vz9zpn	False	True	t3_vz9zpn	/r/Bitcoin/comments/vz9zpn/why_would_people_wear_bitcoin_merch_in_public/ig7q8nh/	1657852702	1	True	True	False	Bitcoin	t5_2s3qj	r/Bitcoin	public		0	[]			maybe they re begging for charity	0.5556326508522034	0.3571338951587677	0.5200311541557312	0.46390220522880554	0.4066373109817505	0.5229002833366394	0.4744969606399536	0.34638169407844543	0.3851766884326935	0.4156492054462433
194	[]	False		Accomplished-Play-84			[]				text	t2_7bo8yw2b	False	False	Those who don't have, wear.	d6d861080ff56bbfaef57169e251eb5b820be500	True	False					0	1657852552		0	{}	ig7pydt	False	t3_vz9zpn	False	True	t3_vz9zpn	/r/Bitcoin/comments/vz9zpn/why_would_people_wear_bitcoin_merch_in_public/ig7pydt/	1657852567	1	True	True	False	Bitcoin	t5_2s3qj	r/Bitcoin	public		0	[]			those who don t have wear 	0.39842167496681213	0.44129303097724915	0.39168471097946167	0.5007531642913818	0.4134199023246765	0.6491294503211975	0.4978342056274414	0.3317830562591553	0.47895196080207825	0.16455799341201782
195	[]	False		AinNoWayBoi61			[]				text	t2_gyu56tfh	False	False	You really can't use a wallet that is abandoned but I hope he returns to it	342b0db0138eaaf60ecec761a0d0d15876e2dc89	True	False					0	1657852546		0	{}	ig7pxw5	False	t3_vz3avx	False	True	t1_ig72dk5	/r/Bitcoin/comments/vz3avx/pine_a_bitcoin_wallet_w_a_messengerlike_ui/ig7pxw5/	1657852560	1	True	True	False	Bitcoin	t5_2s3qj	r/Bitcoin	public		0	[]			you really can t use a wallet that is abandoned but i hope he returns to it	0.34172922372817993	0.623165488243103	0.10586444288492203	0.06720927357673645	0.21568195521831512	0.45490172505378723	0.13835486769676208	1.9985964172519743e-05	0.3212272822856903	0.004896201658993959
196	[]	False		dani_trombly			[]				text	t2_dtj67myw	False	False	I hope everything will be fine.	b67cc334c3fef247a60d748210cf29bfd0d73f3c	True	False					0	1657852543		0	{}	ig7pxog	False	t3_vypq2s	False	True	t1_ig3lqjj	/r/Bitcoin/comments/vypq2s/just_wondering_what_happens_if_a_ledger_is_lost/ig7pxog/	1657852560	1	True	True	False	Bitcoin	t5_2s3qj	r/Bitcoin	public		0	[]			i hope everything will be fine 	0.6874962449073792	0.37662237882614136	0.2541683316230774	0.4155379831790924	0.48800212144851685	0.4698539078235626	0.6208263635635376	0.7451988458633423	0.42502686381340027	0.1823175698518753
197	[]	False		topps_chrome			[]				text	t2_57fkk	False	False	"I think anyone that’s selling their Bitcoin right now is short sighted, it’ll go back up. But I also don’t think Bitcoin has won either. GGood enough only suffices for evolution, mankind tightens down thei processes and procedures.

The question to me is how prevalent will NFTs be? Because the gas fees are significantly less and more consistent on layer 2. 

I don’t know what Bitcoin can do to cement itself as the de facto currency for the future decades but I know that assuming you’ve won because you were first and most successful has been the downfall of quite a few businesses."	7a73000d9876e5e2422717013a602d80ebc6f676	True	False					0	1657852518		0	{}	ig7pvs3	False	t3_vyuu4n	False	True	t1_ig5aujy	/r/Bitcoin/comments/vyuu4n/michael_saylor_calls_out_the_crypto_industry_for/ig7pvs3/	1657852530	1	True	True	False	Bitcoin	t5_2s3qj	r/Bitcoin	public		0	[]			i think anyone that s selling their bitcoin right now is short sighted it ll go back up but i also don t think bitcoin has won either ggood enough only suffices for evolution mankind tightens down thei processes and procedures the question to me is how prevalent will nfts be because the gas fees are significantly less and more consistent on layer 2 i don t know what bitcoin can do to cement itself as the de facto currency for the future decades but i know that assuming you ve won because you were first and most successful has been the downfall of quite a few businesses 	0.0025398351717740297	0.9884762763977051	0.3108833432197571	0.015122240409255028	0.994545578956604	0.5599931478500366	0.09603428840637207	8.357543492820696e-07	0.40365689992904663	0.007092995569109917
198	[]	False		Infamous-Guava3112			[]				text	t2_bq7ohu2v	False	False	Well said	04adeb5e67f29f356b431ff69d85c06449f48f62	True	False					0	1657871990		0	{}	ig8le0t	False	t3_vwt431	False	False	t1_ift54ca	/r/Bitcoin/comments/vwt431/will_i_be_the_old_guy_talking_about_how_cheap_btc/ig8le0t/	1657872000	1	True	True	False	Bitcoin	t5_2s3qj	r/Bitcoin	public		0	[]			well said	0.537165105342865	0.5132164359092712	0.4505508542060852	0.5099619030952454	0.5096572041511536	0.5504289865493774	0.5319519639015198	0.5094119310379028	0.5016539096832275	0.31928595900535583
199	[]	False		Xinqiu-			[]				text	t2_8f3fhs37	False	False	"&gt;Sell at 22k rebuy at 19k, rinse and repeat…

I also want to do that, but I am new...."	0c3df524083a33eb29c025117e44cbcd36622196	True	False					0	1657871978		0	{}	ig8ldhz	True	t3_vz21zz	False	True	t1_ig8jctm	/r/Bitcoin/comments/vz21zz/question_what_investment_strategy_will_you_use_to/ig8ldhz/	1657871991	1	True	True	False	Bitcoin	t5_2s3qj	r/Bitcoin	public		0	[]			 gt sell at 22k rebuy at 19k rinse and repeat i also want to do that but i am new 	0.26052799820899963	0.8430588841438293	0.21418704092502594	0.18282927572727203	0.10922461003065109	0.35267460346221924	0.13449811935424805	0.0032598734833300114	0.3966214954853058	0.1108609288930893
200	[]	False		Remarkable-Hall-9478			[]				text	t2_9mb5pn64	False	False	Lmao 500,000%	a84e38cf0ddb7926b046644e67abe64de6ffced9	True	False					0	1657928734		0	{}	igbwm4d	False	t3_w01q1s	False	False	t3_w01q1s	/r/ethereum/comments/w01q1s/monverse_come_with_a_simple_mission_lead_the_way/igbwm4d/	1657928746	1	False	True	False	ethereum	t5_2zf9m	r/ethereum	public		0	[]			lmao 500 000 	0.3686314821243286	0.4490595757961273	0.5494821071624756	0.2556784749031067	0.3964071571826935	0.3946320414543152	0.4244222044944763	0.42871779203414917	0.47003018856048584	0.060298822820186615
201	[]	False		[deleted]						dark					[removed]	fe993932d6dced4c0a879e9aa5d7a6e0fbb467f5	True	False					0	1657928447		0	{}	igbw097	False	t3_vzij1e	False	True	t1_igaiazk	/r/ethereum/comments/vzij1e/why_would_i_ever_use_an_alternate_l1_once_the/igbw097/	1657928462	1	False	True	False	ethereum	t5_2zf9m	r/ethereum	public		0	[]			 removed 	0.46707504987716675	0.5148742198944092	0.5170193910598755	0.5029740929603577	0.4936113953590393	0.5123135447502136	0.45383262634277344	0.4847692549228668	0.4981911778450012	0.5145108103752136
202	[]	False		ausgear1			[]				text	t2_pldes	False	False	You have been nominated for a low effort post - please stand by to receive your invitation to the Low Effort Post Awards	7218f1109b8f75ac6f394c094cef694170b1bacf	True	False					0	1657928384		0	{}	igbvv7u	False	t3_w02572	False	True	t3_w02572	/r/ethereum/comments/w02572/will_ethereum_founders_devs_allow_me_to_build/igbvv7u/	1657928397	1	False	True	False	ethereum	t5_2zf9m	r/ethereum	public		0	[]			you have been nominated for a low effort post please stand by to receive your invitation to the low effort post awards	0.6290521621704102	0.6583796143531799	0.30613917112350464	0.7049558162689209	0.02305762656033039	0.2750769555568695	0.8344584703445435	0.2889024615287781	0.2226594090461731	0.0028392530512064695
203	[]	False		[deleted]						dark					[removed]	fe993932d6dced4c0a879e9aa5d7a6e0fbb467f5	True	False					0	1657928322		0	{}	igbvqco	False	t3_vzij1e	False	True	t3_vzij1e	/r/ethereum/comments/vzij1e/why_would_i_ever_use_an_alternate_l1_once_the/igbvqco/	1657928335	1	False	True	False	ethereum	t5_2zf9m	r/ethereum	public		0	[]			 removed 	0.46707504987716675	0.5148742198944092	0.5170193910598755	0.5029740929603577	0.4936113953590393	0.5123135447502136	0.45383262634277344	0.4847692549228668	0.4981911778450012	0.5145108103752136
204	[]	False		mybed54			[]				text	t2_1f8ctslj	False	False	You mean that pump and dump shitcoin down 98% where 50% of the supply was given to the company?	7ea6890faeb5e78ed3975611bd7141263af591be	True	False					0	1657928150		0	{}	igbvd8u	True	t3_vzij1e	False	True	t1_igbuq1z	/r/ethereum/comments/vzij1e/why_would_i_ever_use_an_alternate_l1_once_the/igbvd8u/	1657928167	1	False	True	False	ethereum	t5_2zf9m	r/ethereum	public		0	[]			you mean that pump and dump shitcoin down 98 where 50 of the supply was given to the company 	0.13217414915561676	0.8180159330368042	0.3410153090953827	0.3063836097717285	0.18736307322978973	0.31827086210250854	0.14308972656726837	8.686061505613907e-07	0.337578147649765	0.05631227046251297
205	[]	False		[deleted]						dark					[removed]	fe993932d6dced4c0a879e9aa5d7a6e0fbb467f5	True	False					0	1657928084		0	{}	igbv88x	False	t3_vzij1e	False	True	t1_ig8v0li	/r/ethereum/comments/vzij1e/why_would_i_ever_use_an_alternate_l1_once_the/igbv88x/	1657928098	1	False	True	False	ethereum	t5_2zf9m	r/ethereum	public		0	[]			 removed 	0.46707504987716675	0.5148742198944092	0.5170193910598755	0.5029740929603577	0.4936113953590393	0.5123135447502136	0.45383262634277344	0.4847692549228668	0.4981911778450012	0.5145108103752136
206	[]	False		7LayerMagikCookieBar			[]				text	t2_5ui6v	False	False	Just curious... why do people always think randos should get a large portion of the pie? Why not actual contributors?	a40b59ca37116bc0ce97f0e60c4fa5c2180131c0	True	False					0	1657927948		0	{}	igbuxuf	False	t3_vyyd6r	False	True	t3_vyyd6r	/r/ethereum/comments/vyyd6r/stay_away_from_starkware_closedsource_and_most_of/igbuxuf/	1657927964	1	False	True	False	ethereum	t5_2zf9m	r/ethereum	public		0	[]			just curious why do people always think randos should get a large portion of the pie why not actual contributors 	0.34435781836509705	0.7075608968734741	0.7155100703239441	0.04979580268263817	0.18367762863636017	0.36157044768333435	0.1434968113899231	8.6516621422561e-07	0.4653782248497009	0.003809078363701701
207	[]	False		Vonsoo			[]				text	t2_a6xz8ofm	False	False	"Isn't Chia several times more decentralized than Bitcoin or Ethereum? It's also most geographically diverse blockchain. Transactions are dirt cheap and yet, network handles dust attacks well (some nodes are on very slow hardware and their struggle, but any 4 core PC is more than enough, even machines from 10 years ago).

It's still a kind of PoW chain (Proof of Space over Time), but hard drives take only a tiny fraction of energy when compared with BTC. Plotting process takes some CPU power, but network is already created, if we have completely stopped creating new plots, it would still remain most decentralized blockchain."	a9d5ae9cbc258491ea3267c493913830fd3e80ee	True	False					0	1657927847		0	{}	igbuq1z	False	t3_vzij1e	False	True	t3_vzij1e	/r/ethereum/comments/vzij1e/why_would_i_ever_use_an_alternate_l1_once_the/igbuq1z/	1657927860	1	False	True	False	ethereum	t5_2zf9m	r/ethereum	public		0	[]			isn t chia several times more decentralized than bitcoin or ethereum it s also most geographically diverse blockchain transactions are dirt cheap and yet network handles dust attacks well some nodes are on very slow hardware and their struggle but any 4 core pc is more than enough even machines from 10 years ago it s still a kind of pow chain proof of space over time but hard drives take only a tiny fraction of energy when compared with btc plotting process takes some cpu power but network is already created if we have completely stopped creating new plots it would still remain most decentralized blockchain 	0.0007699508569203317	0.9953224062919617	0.4682440459728241	0.005477307830005884	0.004401122219860554	0.013287840411067009	0.10321847349405289	8.360198080481496e-07	0.4715527296066284	3.404451854294166e-05
208	[]	False		Stillbleedblue			[]				text	t2_210130t9	False	False	"Buddy.  You live in a land where Facebook is law. The best thing you can do in this world is make it a better place by trying to lift those dummies up that don't understand. I get it,  it can be frustrating... but it's pur community and you can be the difference! 

(I smoked a little is all.  )"	533b0faf0cebbc45f0678a5b03e61b2e72ab784d	True	False					0	1657927737		0	{}	igbuhov	False	t3_vzxh1m	False	True	t1_igbmljw	/r/ethereum/comments/vzxh1m/how_do_i_explain_blockhain_and_ethereum_to_a/igbuhov/	1657927753	1	False	True	False	ethereum	t5_2zf9m	r/ethereum	public		0	[]			buddy you live in a land where facebook is law the best thing you can do in this world is make it a better place by trying to lift those dummies up that don t understand i get it it can be frustrating but it s pur community and you can be the difference i smoked a little is all 	0.0033435854129493237	0.9891149997711182	0.21166779100894928	0.010246130637824535	0.9895519614219666	0.6120602488517761	0.06600910425186157	8.437773431069218e-07	0.25146275758743286	0.024494284763932228
209	[]	False		[deleted]						dark					[removed]	fe993932d6dced4c0a879e9aa5d7a6e0fbb467f5	True	False					0	1657927696		0	{}	igbuene	False	t3_vzla99	False	True	t3_vzla99	/r/ethereum/comments/vzla99/eth_decentralization/igbuene/	1657927709	1	False	True	False	ethereum	t5_2zf9m	r/ethereum	public		0	[]			 removed 	0.46707504987716675	0.5148742198944092	0.5170193910598755	0.5029740929603577	0.4936113953590393	0.5123135447502136	0.45383262634277344	0.4847692549228668	0.4981911778450012	0.5145108103752136
210	[]	False		[deleted]						dark					[removed]	fe993932d6dced4c0a879e9aa5d7a6e0fbb467f5	True	False					0	1657927676		0	{}	igbud2c	False	t3_vz2494	False	True	t1_ig7zorn	/r/ethereum/comments/vz2494/serious_question_if_eth_wouldnt_be_a_thing_in_the/igbud2c/	1657927687	1	False	True	False	ethereum	t5_2zf9m	r/ethereum	public		0	[]			 removed 	0.46707504987716675	0.5148742198944092	0.5170193910598755	0.5029740929603577	0.4936113953590393	0.5123135447502136	0.45383262634277344	0.4847692549228668	0.4981911778450012	0.5145108103752136
211	[]	False		[deleted]						dark					[removed]	fe993932d6dced4c0a879e9aa5d7a6e0fbb467f5	True	False					0	1657927662		0	{}	igbuc2y	False	t3_vz2494	False	True	t1_ig7ayqi	/r/ethereum/comments/vz2494/serious_question_if_eth_wouldnt_be_a_thing_in_the/igbuc2y/	1657927680	1	False	True	False	ethereum	t5_2zf9m	r/ethereum	public		0	[]			 removed 	0.46707504987716675	0.5148742198944092	0.5170193910598755	0.5029740929603577	0.4936113953590393	0.5123135447502136	0.45383262634277344	0.4847692549228668	0.4981911778450012	0.5145108103752136
212	[]	False		[deleted]						dark					[removed]	fe993932d6dced4c0a879e9aa5d7a6e0fbb467f5	True	False					0	1657927647		0	{}	igbuawm	False	t3_vz2494	False	True	t1_ig5tz8e	/r/ethereum/comments/vz2494/serious_question_if_eth_wouldnt_be_a_thing_in_the/igbuawm/	1657927657	1	False	True	False	ethereum	t5_2zf9m	r/ethereum	public		0	[]			 removed 	0.46707504987716675	0.5148742198944092	0.5170193910598755	0.5029740929603577	0.4936113953590393	0.5123135447502136	0.45383262634277344	0.4847692549228668	0.4981911778450012	0.5145108103752136
213	[]	False		daknuts_			[]				text	t2_77ovj7hx	False	False	Yes... android.	dd4026bf35938d93e809b61d5fe4522bd41dd571	True	False					0	1657927610		0	{}	igbu85h	False	t3_vu335z	False	True	t3_vu335z	/r/ethereum/comments/vu335z/found_this_cute_comic_on_frax_finance/igbu85h/	1657927622	1	False	True	False	ethereum	t5_2zf9m	r/ethereum	public		0	[]			yes android 	0.44195443391799927	0.43537288904190063	0.4689779281616211	0.4669210910797119	0.4908684492111206	0.49867725372314453	0.4938400387763977	0.4927906095981598	0.46772539615631104	0.6511595845222473
214	[]	False		[deleted]						dark					[removed]	fe993932d6dced4c0a879e9aa5d7a6e0fbb467f5	True	False					0	1657927594		0	{}	igbu6yo	False	t3_vz2494	False	True	t3_vz2494	/r/ethereum/comments/vz2494/serious_question_if_eth_wouldnt_be_a_thing_in_the/igbu6yo/	1657927608	1	False	True	False	ethereum	t5_2zf9m	r/ethereum	public		0	[]			 removed 	0.46707504987716675	0.5148742198944092	0.5170193910598755	0.5029740929603577	0.4936113953590393	0.5123135447502136	0.45383262634277344	0.4847692549228668	0.4981911778450012	0.5145108103752136
215	[]	False		[deleted]						dark					[removed]	fe993932d6dced4c0a879e9aa5d7a6e0fbb467f5	True	False					0	1657927414		0	{}	igbtt8h	False	t3_vzpy6y	False	True	t1_igadh6v	/r/ethereum/comments/vzpy6y/implications_of_proposing_2_blocks_in_a_row_on/igbtt8h/	1657927429	1	False	True	False	ethereum	t5_2zf9m	r/ethereum	public		0	[]			 removed 	0.46707504987716675	0.5148742198944092	0.5170193910598755	0.5029740929603577	0.4936113953590393	0.5123135447502136	0.45383262634277344	0.4847692549228668	0.4981911778450012	0.5145108103752136
216	[]	False		[deleted]						dark					[removed]	fe993932d6dced4c0a879e9aa5d7a6e0fbb467f5	True	False					0	1657927400		0	{}	igbts7x	False	t3_vzpy6y	False	True	t3_vzpy6y	/r/ethereum/comments/vzpy6y/implications_of_proposing_2_blocks_in_a_row_on/igbts7x/	1657927413	1	False	True	False	ethereum	t5_2zf9m	r/ethereum	public		0	[]			 removed 	0.46707504987716675	0.5148742198944092	0.5170193910598755	0.5029740929603577	0.4936113953590393	0.5123135447502136	0.45383262634277344	0.4847692549228668	0.4981911778450012	0.5145108103752136
217	[]	False		[deleted]						dark					[removed]	fe993932d6dced4c0a879e9aa5d7a6e0fbb467f5	True	False					0	1657927387		0	{}	igbtr8g	False	t3_vzq7ek	False	True	t3_vzq7ek	/r/ethereum/comments/vzq7ek/simple_escrow_contracts_with_usdt_usdc_dai_on/igbtr8g/	1657927398	1	False	True	False	ethereum	t5_2zf9m	r/ethereum	public		0	[]			 removed 	0.46707504987716675	0.5148742198944092	0.5170193910598755	0.5029740929603577	0.4936113953590393	0.5123135447502136	0.45383262634277344	0.4847692549228668	0.4981911778450012	0.5145108103752136
218	[]	False		[deleted]						dark					[removed]	fe993932d6dced4c0a879e9aa5d7a6e0fbb467f5	True	False					0	1657927371		0	{}	igbtpza	False	t3_vzqb9h	False	True	t3_vzqb9h	/r/ethereum/comments/vzqb9h/study_on_how_scammers_try_to_trick_us/igbtpza/	1657927383	1	False	True	False	ethereum	t5_2zf9m	r/ethereum	public		0	[]			 removed 	0.46707504987716675	0.5148742198944092	0.5170193910598755	0.5029740929603577	0.4936113953590393	0.5123135447502136	0.45383262634277344	0.4847692549228668	0.4981911778450012	0.5145108103752136
219	[]	False		[deleted]						dark					[removed]	fe993932d6dced4c0a879e9aa5d7a6e0fbb467f5	True	False					0	1657927353		0	{}	igbtoko	False	t3_vztmjb	False	True	t3_vztmjb	/r/ethereum/comments/vztmjb/block_space_contracts/igbtoko/	1657927368	1	False	True	False	ethereum	t5_2zf9m	r/ethereum	public		0	[]			 removed 	0.46707504987716675	0.5148742198944092	0.5170193910598755	0.5029740929603577	0.4936113953590393	0.5123135447502136	0.45383262634277344	0.4847692549228668	0.4981911778450012	0.5145108103752136
