Unnamed: 0	all_awardings	archived	associated_award	author	author_flair_background_color	author_flair_css_class	author_flair_template_id	author_flair_text	author_flair_text_color	body	body_sha1	can_gild	collapsed	collapsed_because_crowd_control	collapsed_reason	collapsed_reason_code	comment_type	controversiality	created_utc	distinguished	gilded	gildings	id	is_submitter	link_id	locked	no_follow	parent_id	permalink	retrieved_utc	score	score_hidden	send_replies	stickied	subreddit	subreddit_id	subreddit_name_prefixed	subreddit_type	top_awarded_type	total_awards_received	treatment_tags	unrepliable_reason	author_flair_richtext	author_flair_type	author_fullname	author_patreon_flair	author_premium	author_cakeday	corpus	support	knowledge	conflict	power	similarity	fun	status	trust	identity	romance
214	[]	False		examine8		Training	f51453f4-6c38-11e9-9031-0ea06aef805a	Redditor for 9 months	dark	Isnt that like any business? If they had millions in gold and sold it for cash that would be similar. It doesn't make it a security of ripple. For eg. If you sell it to person A, do they now own part of ripple? Do they have voting rights?	aa3fa67539cb630bca0a5f24a3f31581d25990dd	True	False					0	1660811574		0	{}	ikrrk9i	False	t3_woszyf	False	True	t1_ikellyd	/r/XRP/comments/woszyf/what_is_the_best_sign_of_a_win_for_xrp_holders_in/ikrrk9i/	1660811587	1	True	True	False	XRP	t5_2ruj5	r/XRP	public		0	[]		[{'e': 'text', 't': 'Redditor for 9 months'}]	richtext	t2_a4zjoc7o	False	False		isnt that like any business if they had millions in gold and sold it for cash that would be similar it doesn t make it a security of ripple for eg if you sell it to person a do they now own part of ripple do they have voting rights 	0.008463431149721146	0.987235963344574	0.827454149723053	0.04800216481089592	0.9868959784507751	0.2136743664741516	0.06949302554130554	8.432672871094837e-07	0.38030290603637695	0.009001348167657852
215	[]	False		[deleted]					dark	[removed]	fe993932d6dced4c0a879e9aa5d7a6e0fbb467f5	True	False					0	1660809650		0	{}	ikrp7au	False	t3_wrc5ly	False	True	t3_wrc5ly	/r/XRP/comments/wrc5ly/usa_only_instantly_get_a_free_10_in_btc_for/ikrp7au/	1660809660	1	True	True	False	XRP	t5_2ruj5	r/XRP	public		0	[]								 removed 	0.46707504987716675	0.5148742198944092	0.5170193910598755	0.5029740929603577	0.4936113953590393	0.5123135447502136	0.45383262634277344	0.4847692549228668	0.4981911778450012	0.5145108103752136
216	[]	False		im_vitas						a ton of my friends irl know many other digital assets other than btc. many of them own other assets too. perhaps i'm a bad example as i work in finance and live in miami	f315d06803a82a09c840e684ca1267c983d6d10b	True	False					0	1660842861		0	{}	ikti3pm	False	t3_woc9f1	False	True	t1_ikq2ggb	/r/XRP/comments/woc9f1/buy_xrp/ikti3pm/	1660842875	1	True	True	False	XRP	t5_2ruj5	r/XRP	public		0	[]		[]	text	t2_12yknq	False	False		a ton of my friends irl know many other digital assets other than btc many of them own other assets too perhaps i m a bad example as i work in finance and live in miami	0.018225902691483498	0.9481452703475952	0.18529970943927765	0.017490273341536522	0.9756776094436646	0.3392222821712494	0.12333490699529648	0.10553990304470062	0.5018961429595947	0.024098346009850502
217	[]	False		EverythingKindaSuckz						Getting quiet in here.	a32f67c6fa962aed6312ea9d18e5fa994d73491f	True	False					0	1660841470		0	{}	iktej8j	False	t3_wr9e1h	False	True	t3_wr9e1h	/r/XRP/comments/wr9e1h/081822_join_flarexrp_discord/iktej8j/	1660841488	1	True	True	False	XRP	t5_2ruj5	r/XRP	public		0	[]		[]	text	t2_of0c1owg	False	False		getting quiet in here 	0.5605985522270203	0.4197530150413513	0.3859783411026001	0.46846699714660645	0.5081655383110046	0.6915451288223267	0.5328361988067627	0.5481923818588257	0.4498385787010193	0.4592418074607849
218	[]	False		Sparky8974						Tell that to Coinbase. It absolutely failed to send without a destination tag.	cdc964c7db3c49159923d3cc5da12934c54a7005	True	False					0	1660838352		0	{}	ikt6jlb	False	t3_wp2cjs	False	True	t1_ikpi0i9	/r/XRP/comments/wp2cjs/coinbase_wallet_not_allowing_withdraw/ikt6jlb/	1660838364	1	True	True	False	XRP	t5_2ruj5	r/XRP	public		0	[]		[]	text	t2_4irx2wvv	False	False		tell that to coinbase it absolutely failed to send without a destination tag 	0.4491748511791229	0.6463379263877869	0.4767448604106903	0.5137366056442261	0.13631080090999603	0.3596670925617218	0.24085721373558044	0.2975315749645233	0.36110034584999084	0.061115801334381104
219	[]	False		Calomathor						"Squidgrow is bringing the trust back to bsc, i have not been more impressed with a token then squidgrow on the bsc chain! If you want a trustworthy team that engages with community 24/7 and a developer that funds all marketing out of hos own pocket then Squidgrow is the place to be 

Welcome to Squid Grow!

EN TG: @squidgrowportalentry

Tiktok:  www.tiktok.com/@squidgrow

Youtube:   https://www.youtube.com/channel/UCh-gkjDnFRjX1wMFUpzKdUw

Twitter: https://twitter.com/Squid_Grow"	e2e84734507b52b9fec0fe10486c22d3c351c387	True	False					0	1660828261		0	{}	ikshvfo	False	t3_wrgtff	False	True	t3_wrgtff	/r/XRP/comments/wrgtff/vitalik_buterin_takes_aim_at_ripple_xrp_they/ikshvfo/	1660828278	1	True	True	False	XRP	t5_2ruj5	r/XRP	public		0	[]		[]	text	t2_78ho17c5	False	False		squidgrow is bringing the trust back to bsc i have not been more impressed with a token then squidgrow on the bsc chain if you want a trustworthy team that engages with community 24 7 and a developer that funds all marketing out of hos own pocket then squidgrow is the place to be welcome to squid grow en tg squidgrowportalentry tiktok www tiktok com squidgrow youtube https www youtube com channel uch gkjdnfrjx1wmfupzkduw twitter https twitter com squid grow	0.005004404578357935	0.9876130819320679	0.08488805592060089	0.914250910282135	0.008741834200918674	0.7130637764930725	0.23361249268054962	8.243695788223704e-07	0.4158945381641388	0.027409443631768227
220	[]	False		Calomathor						"Squidgrow is bringing the trust back to bsc, i have not been more impressed with a token then squidgrow on the bsc chain! If you want a trustworthy team that engages with community 24/7 and a developer that funds all marketing out of hos own pocket then Squidgrow is the place to be 

Welcome to Squid Grow!

EN TG: @squidgrowportalentry

Tiktok:  www.tiktok.com/@squidgrow

Youtube:   https://www.youtube.com/channel/UCh-gkjDnFRjX1wMFUpzKdUw

Twitter: https://twitter.com/Squid_Grow"	e2e84734507b52b9fec0fe10486c22d3c351c387	True	False					0	1660827281		0	{}	iksfrcu	False	t3_wrgtff	False	True	t3_wrgtff	/r/XRP/comments/wrgtff/vitalik_buterin_takes_aim_at_ripple_xrp_they/iksfrcu/	1660827293	1	True	True	False	XRP	t5_2ruj5	r/XRP	public		0	[]		[]	text	t2_78ho17c5	False	False		squidgrow is bringing the trust back to bsc i have not been more impressed with a token then squidgrow on the bsc chain if you want a trustworthy team that engages with community 24 7 and a developer that funds all marketing out of hos own pocket then squidgrow is the place to be welcome to squid grow en tg squidgrowportalentry tiktok www tiktok com squidgrow youtube https www youtube com channel uch gkjdnfrjx1wmfupzkduw twitter https twitter com squid grow	0.005004404578357935	0.9876130819320679	0.08488805592060089	0.914250910282135	0.008741834200918674	0.7130637764930725	0.23361249268054962	8.243695788223704e-07	0.4158945381641388	0.027409443631768227
221	[]	False		UnitedStatesAirFurs						"Does this sound bullish to anybody else? Ripple is one step closer to getting the fated emails they've been fighting for since the beginning of this dang lawsuit, and now you have ETH's figurehead coming out swinging?

Sounds like a cornered animal showing their fangs to me.

People tend to only get publicly defensive about suggestions that have some modicum of truth to them."	083a4de3d514742f3ac26f922b3d4564cb4d9569	True	False					0	1660827058		0	{}	iksfai8	False	t3_wrgtff	False	True	t3_wrgtff	/r/XRP/comments/wrgtff/vitalik_buterin_takes_aim_at_ripple_xrp_they/iksfai8/	1660827073	1	True	True	False	XRP	t5_2ruj5	r/XRP	public		0	[]		[]	text	t2_1mbs40pg	False	False		does this sound bullish to anybody else ripple is one step closer to getting the fated emails they ve been fighting for since the beginning of this dang lawsuit and now you have eth s figurehead coming out swinging sounds like a cornered animal showing their fangs to me people tend to only get publicly defensive about suggestions that have some modicum of truth to them 	0.0019810721278190613	0.9775384068489075	0.9530236124992371	0.01697859913110733	0.9944695234298706	0.4049031138420105	0.07591094821691513	8.405342555306561e-07	0.25626498460769653	0.003563893726095557
222	[]	False		coachhunter		Gentleman	07e1063e-6aba-11e8-8fbb-0efb9a871d68	XRP Hodler	dark	Fair point, but Ripple and XRP are different things.	70ba0a5171f9861eb8a348bf77bd77f645ec36a1	True	False					0	1660826724		0	{}	ikselrg	False	t3_wrgtff	False	True	t1_iksa0ow	/r/XRP/comments/wrgtff/vitalik_buterin_takes_aim_at_ripple_xrp_they/ikselrg/	1660826738	1	True	True	False	XRP	t5_2ruj5	r/XRP	public		0	[]		[{'e': 'text', 't': 'XRP Hodler'}]	richtext	t2_1hjxby03	False	False		fair point but ripple and xrp are different things 	0.5359885096549988	0.5122677087783813	0.5246762037277222	0.3150940537452698	0.4937632977962494	0.5048677325248718	0.45829659700393677	0.5476940274238586	0.5600970387458801	0.026186103001236916
223	[]	False		StrikeholdA3504						"Buy Bitcoin or other coin on Binance etc. send to a ledger or any cold hard wallet. Then trade for xrp. Avoid getting hammered by Baanx that rips value from your buy in with debit cards. I fell for debit card purchase on kucoin and quickly $1000 buy was delivered at $924. 🤯

7.5% cost of buying xrp. Market was just under .380000 and my cost basis was over .400000"	b0b6e5bbac61978e592d59722caeb1fe6a20a25f	True	False					0	1660826505		0	{}	ikse5kl	False	t3_wok16j	False	True	t1_ikqg6y9	/r/XRP/comments/wok16j/xrp_holders_in_the_usa/ikse5kl/	1660826518	1	True	True	False	XRP	t5_2ruj5	r/XRP	public		0	[]		[]	text	t2_bw42jltu	False	False		buy bitcoin or other coin on binance etc send to a ledger or any cold hard wallet then trade for xrp avoid getting hammered by baanx that rips value from your buy in with debit cards i fell for debit card purchase on kucoin and quickly 1000 buy was delivered at 924 7 5 cost of buying xrp market was just under 380000 and my cost basis was over 400000	0.0008344519301317632	0.9952507019042969	0.34893104434013367	0.08191274106502533	0.004134767223149538	0.12696179747581482	0.09825945645570755	8.555679187338683e-07	0.28367507457733154	0.0020548503380268812
224	[]	False		StrikeholdA3504						On a ledger nano x 😂	e33e1abb547d2c0e6d91b9a9208e60f628914890	True	False					0	1660825388		0	{}	iksbxqr	False	t3_wok16j	False	True	t1_ikdx7v5	/r/XRP/comments/wok16j/xrp_holders_in_the_usa/iksbxqr/	1660825400	1	True	True	False	XRP	t5_2ruj5	r/XRP	public		0	[]		[]	text	t2_bw42jltu	False	False		on a ledger nano x 	0.4051087498664856	0.5864114761352539	0.2688656151294708	0.4806349277496338	0.4670197665691376	0.32022857666015625	0.4113674759864807	0.34293505549430847	0.4554872214794159	0.16553464531898499
225	[]	False		StrikeholdA3504						Thanks it did not require me to enter anything and arrived just fine thanks.	92d2f23152b275a7846c26980b06316d11d3a513	True	False					0	1660824761		0	{}	iksaqhj	False	t3_wndy20	False	True	t1_ik6ub27	/r/XRP/comments/wndy20/crystal_ball_needed/iksaqhj/	1660824776	1	True	True	False	XRP	t5_2ruj5	r/XRP	public		0	[]		[]	text	t2_bw42jltu	False	False		thanks it did not require me to enter anything and arrived just fine thanks 	0.5524349212646484	0.4001609981060028	0.08246523141860962	0.22525514662265778	0.24033883213996887	0.5774589776992798	0.785473108291626	0.00016844992933329195	0.28367942571640015	0.024448303505778313
226	[]	False		ggffyy123						The XRP Team, their counsel represents Ripple; if their legal reps said it, then that’s what Ripple believe. Ripple instructs the legal team. The legal team only advise and then act upon.	07f4f8d23b08e3c72f89ed1bc04c94117d304bfe	True	False					0	1660824377		0	{}	iksa0ow	False	t3_wrgtff	False	True	t1_iks7hj8	/r/XRP/comments/wrgtff/vitalik_buterin_takes_aim_at_ripple_xrp_they/iksa0ow/	1660824388	1	True	True	False	XRP	t5_2ruj5	r/XRP	public		0	[]		[]	text	t2_dhfvreyu	False	False		the xrp team their counsel represents ripple if their legal reps said it then that s what ripple believe ripple instructs the legal team the legal team only advise and then act upon 	0.30988237261772156	0.9795553088188171	0.3091055154800415	0.9358342885971069	0.7469427585601807	0.2633017599582672	0.11948587000370026	8.441475642939622e-07	0.3757134974002838	0.02356092818081379
227	[]	False		blurryblob						And it’s not like XRP hasn’t been constantly Fudded by both the BTC and ETH communities since forever.  It’s all childish.	45359ff3b7eea27d6e62e3ca3fa605dd3c7d7485	True	False					0	1660824221		0	{}	iks9q1o	False	t3_wrgtff	False	True	t1_iks7hj8	/r/XRP/comments/wrgtff/vitalik_buterin_takes_aim_at_ripple_xrp_they/iks9q1o/	1660824232	1	True	True	False	XRP	t5_2ruj5	r/XRP	public		0	[]		[]	text	t2_gi7i2tya	False	False		and it s not like xrp hasn t been constantly fudded by both the btc and eth communities since forever it s all childish 	0.26422369480133057	0.6344649195671082	0.7168312072753906	0.038366422057151794	0.6451602578163147	0.6370788216590881	0.2673177421092987	8.497110002281261e-07	0.49154847860336304	0.021713213995099068
228	[]	False		Bitesizecrypto35						Everyone knows probably btc but that’s it man.	94bc156b6d02d415cbadcbaeae308e255d7b6711	True	False					0	1660858086		0	{}	ikulyox	False	t3_woc9f1	False	True	t1_ikti3pm	/r/XRP/comments/woc9f1/buy_xrp/ikulyox/	1660858097	1	True	True	False	XRP	t5_2ruj5	r/XRP	public		0	[]		[]	text	t2_fwwdf00x	False	False		everyone knows probably btc but that s it man 	0.534038245677948	0.43115803599357605	0.3609117865562439	0.20686225593090057	0.5539647340774536	0.5545985102653503	0.31359222531318665	0.6791881322860718	0.48363107442855835	0.03714969381690025
229	[]	False		W3F_Bill	#000000		e2b0218a-a42a-11eb-92b9-0e8ba50f1705	✓ Web3 Foundation Team	light	Generally, validators with 100% commission are operating for teams which do not need external nominations (e.g. exchanges which are nominating on behalf of their depositors, and have enough of their own nominating DOT to remain in the active set). They may have numerous separate nominating accounts for flexibility about nominating different validators (if one goes down, or to tweak which validators they are nominating if the amount necessary to get in the active set goes down, etc.).	b1c2bf983be8e86562bec1ec5576e385e539ec74	True	False					0	1660809323		0	{}	ikrosxp	False	t3_wrb1z1	False	True	t3_wrb1z1	/r/Polkadot/comments/wrb1z1/why_do_so_many_validators_have_100_commission/ikrosxp/	1660809337	1	False	True	False	Polkadot	t5_2ublt	r/Polkadot	public		0	[]		[]	text	t2_5turjfiq	False	False		generally validators with 100 commission are operating for teams which do not need external nominations e g exchanges which are nominating on behalf of their depositors and have enough of their own nominating dot to remain in the active set they may have numerous separate nominating accounts for flexibility about nominating different validators if one goes down or to tweak which validators they are nominating if the amount necessary to get in the active set goes down etc 	0.0028722218703478575	0.9882693290710449	0.6955441832542419	0.9524763822555542	0.008755124174058437	0.5479451417922974	0.05706920474767685	8.309881422974286e-07	0.31593072414398193	0.015183244831860065
230	[]	False		timee_bot						"View in your timezone:  
[tomorrow at 13.00 UTC][0]  

[0]: https://timee.io/20220819T1300?tl=Polkadot%20Digest%2018%20Aug%202022"	3162a4ea061825ab62b7332835a348c620c8b9de	True	False					0	1660807906		0	{}	ikrn16g	False	t3_wrd3ry	False	True	t3_wrd3ry	/r/Polkadot/comments/wrd3ry/polkadot_digest_18_aug_2022/ikrn16g/	1660807918	1	False	True	False	Polkadot	t5_2ublt	r/Polkadot	public		0	[]		[]	text	t2_8j8fti5	False	False		view in your timezone tomorrow at 13 00 utc 0 0 https timee io 20220819t1300 tl polkadot 20digest 2018 20aug 202022	0.04884318634867668	0.9631566405296326	0.4816366732120514	0.1970519721508026	0.009849345311522484	0.023726504296064377	0.4107379615306854	8.602536354374024e-07	0.4637812376022339	1.8292041204404086e-05
231	[]	False		timee_bot						"View in your timezone:  
[19 Aug 13.00 - 14.00 UTC][0]  

[0]: https://timee.io/20220819T1300?tl=Bill%20Laboon%20AMA%20-%2019%20Aug%2013.00%20-%2014.00%20UTC&amp;d=60"	34a23d92386eeae973e10aba1314175d7db24bdb	True	False					0	1660807358		0	{}	ikrmc5f	False	t3_wrcy7q	False	True	t3_wrcy7q	/r/Polkadot/comments/wrcy7q/bill_laboon_ama_19_aug_1300_1400_utc/ikrmc5f/	1660807369	1	False	True	False	Polkadot	t5_2ublt	r/Polkadot	public		0	[]		[]	text	t2_8j8fti5	False	False		view in your timezone 19 aug 13 00 14 00 utc 0 0 https timee io 20220819t1300 tl bill 20laboon 20ama 20 2019 20aug 2013 00 20 2014 00 20utc amp d 60	0.009443428367376328	0.9885242581367493	0.2227534055709839	0.2066267877817154	0.0035928275901824236	0.025859327986836433	0.3078453838825226	8.656886052449408e-07	0.4423634111881256	0.00010915411985479295
232	[]	False		timee_bot						"View in your timezone:  
[19 Aug 13.00 - 14.00 UTC][0]  

[0]: https://timee.io/20220819T1300?tl=Bill%20Laboon%20AMA%20-%2019%20Aug%2013.00%20-%2014.00%20UTC&amp;d=60"	34a23d92386eeae973e10aba1314175d7db24bdb	True	False					0	1660807113		0	{}	ikrm0nc	False	t3_wrcw1s	False	True	t3_wrcw1s	/r/Polkadot/comments/wrcw1s/bill_laboon_ama_19_aug_1300_1400_utc/ikrm0nc/	1660807123	1	False	True	False	Polkadot	t5_2ublt	r/Polkadot	public		0	[]		[]	text	t2_8j8fti5	False	False		view in your timezone 19 aug 13 00 14 00 utc 0 0 https timee io 20220819t1300 tl bill 20laboon 20ama 20 2019 20aug 2013 00 20 2014 00 20utc amp d 60	0.009443428367376328	0.9885242581367493	0.2227534055709839	0.2066267877817154	0.0035928275901824236	0.025859327986836433	0.3078453838825226	8.656886052449408e-07	0.4423634111881256	0.00010915411985479295
233	[]	False		chigxii						🫱🏽‍🫲🏼	ec7837271d4763a8aa1f436dad1f729b1abbd7eb	True	False					0	1660805907		0	{}	ikrkh2x	False	t3_wqjdoz	False	True	t3_wqjdoz	/r/Polkadot/comments/wqjdoz/the_first_comprehensive_polkadot_quarterly_report/ikrkh2x/	1660805922	1	False	True	False	Polkadot	t5_2ublt	r/Polkadot	public		0	[]		[]	text	t2_g4dtwoti	False	False		 	0.4871354103088379	0.5098868012428284	0.5124213099479675	0.5155720114707947	0.4910793602466583	0.4970635175704956	0.49484649300575256	0.48481839895248413	0.4902850091457367	0.5123646259307861
234	[]	False		Bulky_Experience1045						Is kraken staking or lending like fx Nexo?	0a085332ed66c4225a1524a6cf89f1ed71a0056d	True	False					0	1660803480		0	{}	ikrharq	False	t3_wqad04	False	True	t1_ikmv34u	/r/Polkadot/comments/wqad04/validator_commissions/ikrharq/	1660803494	1	False	True	False	Polkadot	t5_2ublt	r/Polkadot	public		0	[]		[]	text	t2_el84ohkk	False	False		is kraken staking or lending like fx nexo 	0.14491793513298035	0.6778703927993774	0.5610383152961731	0.3474237620830536	0.45743298530578613	0.0449284091591835	0.2793281674385071	0.23416627943515778	0.4888869524002075	0.0002172119711758569
235	[]	False		dwulf69						"After the regulatory sanction on the Tornado Cash protocol, it got me to think about DAO (aka decentralized autonomous organization) and using a Substrate mechanism (pallet or smart contract) to interoperate exclusively on layer 1 and layer 2 para-chains, and perform automatic mixing functions on all exchanges on a para-chain platform.  
  
*Could a para-chain graft an automatic mixing function on its platform with a Substrate pallet or an Ink Smart Contract?  If so, is there a method to scramble any fingerprint, from internal para-chain mixers, so as to not get blacklisted from other centralized exchanges?*"	2574b8d2d894b702c855120c7fc5e676c2a5eb39	True	False					0	1660838409		0	{}	ikt6owo	False	t3_wrcy7q	False	True	t3_wrcy7q	/r/Polkadot/comments/wrcy7q/bill_laboon_ama_19_aug_1300_1400_utc/ikt6owo/	1660838421	1	False	True	False	Polkadot	t5_2ublt	r/Polkadot	public		0	[]		[]	text	t2_ehgrs	False	False		after the regulatory sanction on the tornado cash protocol it got me to think about dao aka decentralized autonomous organization and using a substrate mechanism pallet or smart contract to interoperate exclusively on layer 1 and layer 2 para chains and perform automatic mixing functions on all exchanges on a para chain platform could a para chain graft an automatic mixing function on its platform with a substrate pallet or an ink smart contract if so is there a method to scramble any fingerprint from internal para chain mixers so as to not get blacklisted from other centralized exchanges 	0.00240953522734344	0.9887036681175232	0.4615389108657837	0.9399498701095581	0.008538923226296902	0.20627620816230774	0.08237773180007935	8.533685331713059e-07	0.4538828730583191	0.003429747186601162
236	[]	False		JustCommunication640						I think the argument is that it’s early and eventually the staking rewards will slow down as the project grows.	19d611f22cb83cbd5e8858a27d473e416ed5d7aa	True	False					0	1660837548		0	{}	ikt4imj	False	t3_wrea3k	False	True	t1_ikstllb	/r/Polkadot/comments/wrea3k/how_many_polkadot_do_i_need_to_get_1_dot_per_day/ikt4imj/	1660837562	1	False	True	False	Polkadot	t5_2ublt	r/Polkadot	public		0	[]		[]	text	t2_b7viyfta	False	False		i think the argument is that it s early and eventually the staking rewards will slow down as the project grows 	0.18219497799873352	0.8500357270240784	0.4089200794696808	0.2099887728691101	0.6256696581840515	0.3098337948322296	0.11078324168920517	9.188616445499065e-07	0.37712201476097107	0.016235854476690292
237	[]	False		DoctorTrainer						Taxes...	28e02e0ce38f24872bb511a37adb3c8e489746bc	True	False					0	1660836997		0	{}	ikt35bb	False	t3_wrea3k	False	True	t1_ikstx9q	/r/Polkadot/comments/wrea3k/how_many_polkadot_do_i_need_to_get_1_dot_per_day/ikt35bb/	1660837008	1	False	True	False	Polkadot	t5_2ublt	r/Polkadot	public		0	[]		[]	text	t2_hvtb606i	False	False		taxes 	0.47478899359703064	0.5246885418891907	0.5848515629768372	0.5310516953468323	0.4836456775665283	0.48948192596435547	0.4546453654766083	0.4878593683242798	0.4963371455669403	0.34202876687049866
238	[]	False		TipTechnicali						Even if the options aren't sold out, Binance usually limits the amount of DOT you can invest	3e7c1b5bff9bb12c1f6f064e34f0f5bdd13e2ac2	True	False					0	1660836340		0	{}	ikt1iw7	False	t3_wrea3k	False	True	t1_iks16z8	/r/Polkadot/comments/wrea3k/how_many_polkadot_do_i_need_to_get_1_dot_per_day/ikt1iw7/	1660836359	1	False	True	False	Polkadot	t5_2ublt	r/Polkadot	public		0	[]		[]	text	t2_dvcj94t9	False	False		even if the options aren t sold out binance usually limits the amount of dot you can invest	0.15287113189697266	0.8901727795600891	0.33466440439224243	0.6615113615989685	0.2913065552711487	0.3837595283985138	0.1335793286561966	8.508266660101071e-07	0.39466479420661926	0.005812746472656727
239	[]	False		TasteConscious1859						Wow I have never been thought like that😯	339011c7feb304cf19c220a57dc2c2cb06bf9c44	True	False					0	1660835886		0	{}	ikt0dur	False	t3_wrea3k	False	True	t3_wrea3k	/r/Polkadot/comments/wrea3k/how_many_polkadot_do_i_need_to_get_1_dot_per_day/ikt0dur/	1660835897	1	False	True	False	Polkadot	t5_2ublt	r/Polkadot	public		0	[]		[]	text	t2_iud0vixb	False	False		wow i have never been thought like that 	0.3945735991001129	0.3319177031517029	0.459153413772583	0.13388626277446747	0.5319737792015076	0.7562223076820374	0.6134755611419678	0.6498046517372131	0.4511951804161072	0.1984589695930481
240	[]	False		Mediocre-Set9307						https://docs.google.com/forms/d/e/1FAIpQLScIqHOA0p62ysyuuKPdILEnO0k28FcIDC-GZCYu1WMZOBv8Mw/viewform	94cb7ddbe7f52a218ff5992fca289696957adaa0	True	False					0	1660835838		0	{}	ikt09kr	False	t3_wrcy7q	False	True	t3_wrcy7q	/r/Polkadot/comments/wrcy7q/bill_laboon_ama_19_aug_1300_1400_utc/ikt09kr/	1660835852	1	False	True	False	Polkadot	t5_2ublt	r/Polkadot	public		0	[]		[]	text	t2_awukknwv	False	False		https docs google com forms d e 1faipqlsciqhoa0p62ysyuukpdileno0k28fcidc gzcyu1wmzobv8mw viewform	0.047868549823760986	0.9071326851844788	0.32140448689460754	0.2091892957687378	0.10975866764783859	0.057808831334114075	0.40117934346199036	0.0009545711800456047	0.47096288204193115	6.333995315799257e-06
241	[]	False		heplg						Thank you	6b50e31a7e1337db9ecb0e2fcb6e65ca27f57df5	True	False					0	1660834859		0	{}	iksxu8m	True	t3_wrea3k	False	True	t1_iksb4cm	/r/Polkadot/comments/wrea3k/how_many_polkadot_do_i_need_to_get_1_dot_per_day/iksxu8m/	1660834870	1	False	True	False	Polkadot	t5_2ublt	r/Polkadot	public		0	[]		[]	text	t2_i21rncp0	False	False		thank you	0.6628825664520264	0.2859748601913452	0.3557310104370117	0.4497220516204834	0.45809370279312134	0.5068443417549133	0.7013788223266602	0.5230814218521118	0.4162631332874298	0.4774157404899597
242	[]	False		rkalla						"But how else is he going to flex on gross poor people?!

I'm about to post: ""Is it bad to have $10m of DOT or should I diversify?"" to this sub."	d279e88d8c6bf6eed77189a9caad89f7a5f05bcb	True	False					0	1660833752		0	{}	iksv0vb	False	t3_wrea3k	False	False	t1_ikrtdi8	/r/Polkadot/comments/wrea3k/how_many_polkadot_do_i_need_to_get_1_dot_per_day/iksv0vb/	1660833765	1	False	True	False	Polkadot	t5_2ublt	r/Polkadot	public		0	[]		[]	text	t2_2its9	False	True		but how else is he going to flex on gross poor people i m about to post is it bad to have 10m of dot or should i diversify to this sub 	0.026414787396788597	0.9203515648841858	0.7308138012886047	0.03091595694422722	0.03234412521123886	0.3389573395252228	0.08188257366418839	9.014674446916615e-07	0.24560070037841797	0.011424234136939049
