Unnamed: 0	all_awardings	archived	associated_award	author	author_flair_background_color	author_flair_css_class	author_flair_richtext	author_flair_template_id	author_flair_text	author_flair_text_color	author_flair_type	author_fullname	author_patreon_flair	author_premium	body	body_sha1	can_gild	collapsed	collapsed_because_crowd_control	collapsed_reason	collapsed_reason_code	comment_type	controversiality	created_utc	distinguished	gilded	gildings	id	is_submitter	link_id	locked	no_follow	parent_id	permalink	retrieved_utc	score	score_hidden	send_replies	stickied	subreddit	subreddit_id	subreddit_name_prefixed	subreddit_type	top_awarded_type	total_awards_received	treatment_tags	unrepliable_reason	author_cakeday	corpus	support	knowledge	conflict	power	similarity	fun	status	trust	identity	romance
0	[]	False		kuzkokronk			[]			dark	text	t2_7m3xw0ua	False	False	Stacking sats in dat ass!	f3c4232501e60dd0bd5fa15c813560916ca3e0a7	True	False					0	1657857646		0	{}	ig801yv	False	t3_vyz7i3	False	True	t1_ig6mfww	/r/Bitcoin/comments/vyz7i3/sell_some_btc_to_start_my_porn_career/ig801yv/	1657857660	1	True	True	False	Bitcoin	t5_2s3qj	r/Bitcoin	public		0	[]			stacking sats in dat ass 	0.35720863938331604	0.4235253930091858	0.7650600075721741	0.3745933771133423	0.4597909450531006	0.6889158487319946	0.36149778962135315	0.47168785333633423	0.4590444564819336	0.08834052830934525
1	[]	False		dpatou23			[]				text	t2_2wfkq0r4	False	False	Bitcoin as an investment dumbass	3ca081b55474736de75028c7d33e3c4e740d89f6	True	False					0	1657857645		0	{}	ig801vh	False	t3_vy68s3	False	False	t1_ig7zuid	/r/Bitcoin/comments/vy68s3/worry_more_about_cbdcs_than_btc_price/ig801vh/	1657857660	1	True	True	False	Bitcoin	t5_2s3qj	r/Bitcoin	public		0	[]			bitcoin as an investment dumbass	0.4228229522705078	0.5234605669975281	0.705823540687561	0.4860711395740509	0.4399420917034149	0.2931351065635681	0.3465859293937683	0.5013812184333801	0.45806968212127686	0.11460914462804794
2	[]	False		TriSamples			[]				text	t2_wdymt	False	False	"Because RTFM is a thing. 

Reaching out on Reddit for basic in the manual/Google searches is LAZY and not a good use of everyone’s time."	f14d1ef4a766e5814c9ca9853394e3b17a10bccb	True	False					0	1657857621		0	{}	ig800a1	False	t3_vypq2s	False	True	t1_ig3yshh	/r/Bitcoin/comments/vypq2s/just_wondering_what_happens_if_a_ledger_is_lost/ig800a1/	1657857637	1	True	True	False	Bitcoin	t5_2s3qj	r/Bitcoin	public		0	[]			because rtfm is a thing reaching out on reddit for basic in the manual google searches is lazy and not a good use of everyone s time 	0.029147962108254433	0.9772665500640869	0.1881221979856491	0.028893589973449707	0.269137978553772	0.4956531226634979	0.0901978462934494	8.700902185410087e-07	0.3352814018726349	0.009028961881995201
3	[]	False		solomonsatoshi			[]			dark	text	t2_afjkwiri	False	False	"Im not a highly socialperson either but of the few I do know several have sats for sale. One of them I would never have expected to be hodling but he was less a stack by a friend who died and so is selling them over time. If you can find someone who wants to cash out over time - perfect.

 If direct networking is not an option try [bisq.network](https://bisq.network)"	8687df1e5e0b475188dad8832cfcd4dd2cf40f7f	True	False					0	1657857555		0	{}	ig7zvw6	False	t3_vz8eqf	False	True	t1_ig7xnji	/r/Bitcoin/comments/vz8eqf/are_there_any_downsides_to_buying_through_an/ig7zvw6/	1657857565	1	True	True	False	Bitcoin	t5_2s3qj	r/Bitcoin	public		0	[]			im not a highly socialperson either but of the few i do know several have sats for sale one of them i would never have expected to be hodling but he was less a stack by a friend who died and so is selling them over time if you can find someone who wants to cash out over time perfect if direct networking is not an option try bisq network https bisq network 	0.002297184895724058	0.9897035956382751	0.3221581280231476	0.023634502664208412	0.007332534994930029	0.11151383817195892	0.10527579486370087	8.487147624691715e-07	0.2835952043533325	0.0008135657990351319
4	[]	False		lazzo300			[]				text	t2_djdnieh1	False	False	That's the best answer we can get these days my man.	cec674848583576870895445d25930a803ef600f	True	False					0	1657857551		0	{}	ig7zvmq	False	t3_vypq2s	False	True	t1_ig4j4tm	/r/Bitcoin/comments/vypq2s/just_wondering_what_happens_if_a_ledger_is_lost/ig7zvmq/	1657857564	1	True	True	False	Bitcoin	t5_2s3qj	r/Bitcoin	public		0	[]			that s the best answer we can get these days my man 	0.4815572500228882	0.46844229102134705	0.08573886007070541	0.45822271704673767	0.49414584040641785	0.5694909691810608	0.32337844371795654	0.6506578326225281	0.30675944685935974	0.043698739260435104
5	[]	False		mkv314			[]				text	t2_ijjz43jg	False	False	Did no doubt about the fact that most of them are going to on this.	469462ee7bd944e8dff43a1eb5820bd6de1330c4	True	False					0	1657857535		0	{}	ig7zumq	False	t3_vy35pj	False	True	t1_ifzrr64	/r/Bitcoin/comments/vy35pj/can_someone_explain_how_after_record_inflation_is/ig7zumq/	1657857550	1	True	True	False	Bitcoin	t5_2s3qj	r/Bitcoin	public		0	[]			did no doubt about the fact that most of them are going to on this 	0.17966721951961517	0.5919850468635559	0.6926423907279968	0.6365144848823547	0.3558114767074585	0.40546324849128723	0.11690111458301544	1.3929815395385958e-05	0.4141019880771637	0.007345374673604965
6	[]	False		kuzkokronk			[]			dark	text	t2_7m3xw0ua	False	False	"If the bank had the bitcoin equivalent of FDIC Insurance to give you back your coins in the event of bankruptcy or theft, then yes.

Otherwise, no."	5cf90ecb234c60f8a110d2c6ba8a12d76f8601b1	True	False					0	1657857534		0	{}	ig7zujm	False	t3_vyvrq1	False	True	t3_vyvrq1	/r/Bitcoin/comments/vyvrq1/would_you_hold_your_btc_in_a_bank/ig7zujm/	1657857550	1	True	True	False	Bitcoin	t5_2s3qj	r/Bitcoin	public		0	[]			if the bank had the bitcoin equivalent of fdic insurance to give you back your coins in the event of bankruptcy or theft then yes otherwise no 	0.029163246974349022	0.9712769389152527	0.724233090877533	0.8228879570960999	0.01212363038212061	0.33817258477211	0.06796405464410782	8.30532599138678e-07	0.3643638789653778	0.03158314898610115
7	[]	False		TopTierTuna			[]				text	t2_ls8zv	False	False	Hey?  Who's paying you?	b1562ab67fb570d058953328711d1a4747bf89bd	True	False					0	1657857534		0	{}	ig7zuid	False	t3_vy68s3	False	True	t1_ig7zqwv	/r/Bitcoin/comments/vy68s3/worry_more_about_cbdcs_than_btc_price/ig7zuid/	1657857550	1	True	True	False	Bitcoin	t5_2s3qj	r/Bitcoin	public		0	[]			hey who s paying you 	0.5006415843963623	0.3477230370044708	0.4782356917858124	0.4579005539417267	0.4940079152584076	0.6226223707199097	0.509552538394928	0.4673154652118683	0.398474782705307	0.07497169822454453
8	[]	False		Romando1			[]				text	t2_rdrf9	False	False	I lost my node in a boating accident.	7e2862e8d682eeb790af33752b65171173763c7f	True	False					0	1657857507		0	{}	ig7zsry	False	t3_vz7iym	False	True	t3_vz7iym	/r/Bitcoin/comments/vz7iym/just_curious_do_you_run_a_bitcoin_node/ig7zsry/	1657857521	1	True	True	False	Bitcoin	t5_2s3qj	r/Bitcoin	public		0	[]			i lost my node in a boating accident 	0.4311898946762085	0.4539133906364441	0.3665889501571655	0.25360408425331116	0.5040745735168457	0.5362555384635925	0.45414870977401733	0.4643900990486145	0.4389731287956238	0.08036573231220245
9	[]	False		dpatou23			[]				text	t2_2wfkq0r4	False	False	Bitcoin	42bd6b9eeb1da01504fefe014e16415246c0f66f	True	False					0	1657857478		0	{}	ig7zqwv	False	t3_vy68s3	False	True	t1_ig7dpsp	/r/Bitcoin/comments/vy68s3/worry_more_about_cbdcs_than_btc_price/ig7zqwv/	1657857492	1	True	True	False	Bitcoin	t5_2s3qj	r/Bitcoin	public		0	[]			bitcoin	0.4630463123321533	0.5352395176887512	0.5230008959770203	0.4709847569465637	0.4710223376750946	0.1883898675441742	0.49838268756866455	0.495523601770401	0.4924294054508209	0.4087046682834625
10	[]	False		cubeeless			[]				text	t2_isd51	False	False	Thanks!	1da20795f84bb9c5e16697aea34f14720e38fc37	True	False					0	1657857472		0	{}	ig7zqij	False	t3_vynpqj	False	True	t1_ig7gpjd	/r/Bitcoin/comments/vynpqj/daily_discussion_july_14_2022/ig7zqij/	1657857485	1	True	True	False	Bitcoin	t5_2s3qj	r/Bitcoin	public		0	[]			thanks 	0.5244714617729187	0.4777355492115021	0.39631444215774536	0.4971177875995636	0.48835933208465576	0.5608528256416321	0.6202717423439026	0.5057796835899353	0.4546191990375519	0.521756112575531
11	[]	False		rufus2785			[]				text	t2_7yhtu	False	False	You should post this to r/DiWHY.	9a805387d6b7867025314f1a7aa876437e78b181	True	False					0	1657857399		0	{}	ig7zlmn	False	t3_vyy2j1	False	True	t3_vyy2j1	/r/Bitcoin/comments/vyy2j1/how_to_make_a_bitcoin_cold_storage_wallet_out_of/ig7zlmn/	1657857413	1	True	True	False	Bitcoin	t5_2s3qj	r/Bitcoin	public		0	[]			you should post this to r diwhy 	0.4417569637298584	0.5164479613304138	0.4486328065395355	0.5451787710189819	0.31490546464920044	0.21242794394493103	0.5547446608543396	0.34590017795562744	0.3970467448234558	0.007822591811418533
12	[]	False		antennawire			[]				text	t2_6otfuap7	False	False	Also some prints are more like a statement. I will not accept trusted third parties and a debasing unit of account. Admittedly also a kind of flex.	1dc1055cc27d3df788292bbb8d425d19749b4261	True	False					0	1657857377		0	{}	ig7zk5d	False	t3_vz9zpn	False	True	t1_ig7xqu7	/r/Bitcoin/comments/vz9zpn/why_would_people_wear_bitcoin_merch_in_public/ig7zk5d/	1657857390	1	True	True	False	Bitcoin	t5_2s3qj	r/Bitcoin	public		0	[]			also some prints are more like a statement i will not accept trusted third parties and a debasing unit of account admittedly also a kind of flex 	0.03225819766521454	0.8889838457107544	0.46812713146209717	0.05863390117883682	0.13175997138023376	0.3264559805393219	0.21702110767364502	7.516906407545321e-06	0.4841684103012085	0.003273001406341791
13	[]	False		yojimann			[]				text	t2_adftyg3j	False	False	I will not be able to do anything like that since this is the first time.	238d81e7d4c6a96e11374e467af63a50029a2488	True	False					0	1657857353		0	{}	ig7zikk	False	t3_vy35pj	False	True	t1_ig2zdoj	/r/Bitcoin/comments/vy35pj/can_someone_explain_how_after_record_inflation_is/ig7zikk/	1657857368	1	True	True	False	Bitcoin	t5_2s3qj	r/Bitcoin	public		0	[]			i will not be able to do anything like that since this is the first time 	0.43032726645469666	0.6343184113502502	0.31703200936317444	0.11460240185260773	0.3598349690437317	0.568625807762146	0.11717488616704941	0.5635162591934204	0.41297006607055664	0.03870470076799393
14	[]	False		nine8whatwhat			[]				text	t2_1188dv	False	False	Damn just 1 btc? I can buy Judge pretty soon!	54d7c96c667584354c30d90292c4d7d81935ea00	True	False					0	1657857340		0	{}	ig7zhpq	False	t3_vzdyk4	False	True	t1_ig7v3vf	/r/Bitcoin/comments/vzdyk4/new_york_yankees_employees_may_now_be_paid_in/ig7zhpq/	1657857353	1	True	True	False	Bitcoin	t5_2s3qj	r/Bitcoin	public		0	[]			damn just 1 btc i can buy judge pretty soon 	0.421318918466568	0.4112006425857544	0.5044624209403992	0.34916722774505615	0.3860495686531067	0.5812568664550781	0.3071199953556061	0.13454662263393402	0.3842439651489258	0.017957663163542747
15	[]	False		Charming-Meringue-68			[]				text	t2_92t044i4	False	False	Fair launch, fixed supply, decentralized, secured through proof of work, no leaders, scales in layers, just to get started…	476aac71ea8d736fa01afbf116e394384e29850b	True	False					0	1657857339		0	{}	ig7zhof	False	t3_vyocs3	False	True	t3_vyocs3	/r/Bitcoin/comments/vyocs3/why_bitcoin/ig7zhof/	1657857353	1	True	True	False	Bitcoin	t5_2s3qj	r/Bitcoin	public		0	[]			fair launch fixed supply decentralized secured through proof of work no leaders scales in layers just to get started 	0.0909082219004631	0.9648732542991638	0.40030941367149353	0.7545593976974487	0.41936346888542175	0.5741023421287537	0.14225757122039795	0.7008840441703796	0.35793814063072205	0.006005502305924892
16	[]	False		AloneDay8829			[]				text	t2_3yi035uo	False	False	That's trivial...	a67db1cb423fb35ebab2d18dd97e8267e904d166	True	False					0	1657857337		0	{}	ig7zhjo	False	t3_vyuu4n	False	True	t1_ig7r5sg	/r/Bitcoin/comments/vyuu4n/michael_saylor_calls_out_the_crypto_industry_for/ig7zhjo/	1657857348	1	True	True	False	Bitcoin	t5_2s3qj	r/Bitcoin	public		0	[]			that s trivial 	0.46637701988220215	0.5080971121788025	0.556044340133667	0.49162226915359497	0.5147601366043091	0.5707423090934753	0.45898550748825073	0.4745391607284546	0.5070309042930603	0.2655677795410156
17	[]	False		TheCrazedBackstabber			[]				text	t2_l9ggn	False	False	I thought it was for the nice man on the phone to verify my wallet?	9711c0ad81846986c0fe3f0c4362ae5d405b93e4	True	False					0	1657857290		0	{}	ig7zeer	False	t3_vypq2s	False	True	t1_ig3wg9f	/r/Bitcoin/comments/vypq2s/just_wondering_what_happens_if_a_ledger_is_lost/ig7zeer/	1657857303	1	True	True	False	Bitcoin	t5_2s3qj	r/Bitcoin	public		0	[]			i thought it was for the nice man on the phone to verify my wallet 	0.1695248782634735	0.3956172466278076	0.06668667495250702	0.041293736547231674	0.47902628779411316	0.6981503367424011	0.3775772452354431	0.33622491359710693	0.2693376839160919	0.01333810668438673
18	[]	False		jbcraigs			[]				text	t2_4av2k	False	True	😂 No one is coming after your broke ass for 100 Satoshis !	1653120e3f2a92add3e1fff1d5f0d5af46daf17f	True	False					0	1657857256		0	{}	ig7zc3s	False	t3_vz9zpn	False	True	t3_vz9zpn	/r/Bitcoin/comments/vz9zpn/why_would_people_wear_bitcoin_merch_in_public/ig7zc3s/	1657857267	1	True	True	False	Bitcoin	t5_2s3qj	r/Bitcoin	public		0	[]			 no one is coming after your broke ass for 100 satoshis 	0.12648724019527435	0.3589208722114563	0.8239390850067139	0.13245171308517456	0.32087087631225586	0.17229796946048737	0.2003035694360733	0.11538957804441452	0.32217180728912354	2.0561190467560664e-05
19	[]	False		Heph333			[]				text	t2_w5r0j	False	False	Your bitcoin is on the blockchain, not on the Ledger. Just get a new Ledger &amp; recover the keys.	3ddbc07d3b17fae0205bb7fdaddbc1f18a8a22f1	True	False					0	1657857202		0	{}	ig7z8im	False	t3_vypq2s	False	True	t3_vypq2s	/r/Bitcoin/comments/vypq2s/just_wondering_what_happens_if_a_ledger_is_lost/ig7z8im/	1657857214	1	True	True	False	Bitcoin	t5_2s3qj	r/Bitcoin	public		0	[]			your bitcoin is on the blockchain not on the ledger just get a new ledger amp recover the keys 	0.22653384506702423	0.8018796443939209	0.31621095538139343	0.5879653692245483	0.20130418241024017	0.37274444103240967	0.1410403549671173	0.7291856408119202	0.3343680799007416	0.008458602242171764
20	[]	False		1111joey1111			[]				text	t2_2wp1heos	False	False	Those poor kids. Maybe they'll grow up to be Gordon  Gekko.	93bfd9bb5740bfd2de862b501d248594d39d45f1	True	False					0	1657857192		0	{}	ig7z7vb	False	t3_vz9d4a	False	True	t3_vz9d4a	/r/Bitcoin/comments/vz9d4a/i_just_started_paying_my_kids_allowance_in_sats/ig7z7vb/	1657857207	1	True	True	False	Bitcoin	t5_2s3qj	r/Bitcoin	public		0	[]			those poor kids maybe they ll grow up to be gordon gekko 	0.6001861691474915	0.25861746072769165	0.5971448421478271	0.09173991531133652	0.4558182954788208	0.3418314456939697	0.2826145589351654	9.526131179882213e-06	0.3359757661819458	0.00010380797903053463
21	[]	False		ReNewableLifestyle			[]				text	t2_36jlb8m6	False	False	🙌🙌🙌🙌🙌🙌🙌🙌🙌	e59e4b1d9d20b86682f33d2f61efaddf90fa5ef0	True	False					0	1657857156		0	{}	ig7z5gc	False	t3_vz5635	False	True	t3_vz5635	/r/Bitcoin/comments/vz5635/take_custody_of_your_bitcoin/ig7z5gc/	1657857171	1	True	True	False	Bitcoin	t5_2s3qj	r/Bitcoin	public		0	[]			 	0.4871354103088379	0.5098868012428284	0.5124213099479675	0.5155720114707947	0.4910793602466583	0.4970635175704956	0.49484649300575256	0.48481839895248413	0.4902850091457367	0.5123646259307861
22	[]	False		PeacePipePanda			[]			dark	text	t2_7ohpuk82	False	False	Awareness buddy	3f855a6e409efca33708d30695ddccd3761ae264	True	False					0	1657857084		0	{}	ig7z0ox	False	t3_vz9zpn	False	True	t3_vz9zpn	/r/Bitcoin/comments/vz9zpn/why_would_people_wear_bitcoin_merch_in_public/ig7z0ox/	1657857097	1	True	True	False	Bitcoin	t5_2s3qj	r/Bitcoin	public		0	[]			awareness buddy	0.5153798460960388	0.4622311592102051	0.40266066789627075	0.5017295479774475	0.5022316575050354	0.6511206030845642	0.5583528876304626	0.4972881078720093	0.46455132961273193	0.38205453753471375
23	[]	False		HarmonyFlame			[]				text	t2_9gfcs	False	False	Yeah worth half a coin today....but crashing in price against all bitcoin wallets until the end of time... like all those possessions. To me its obvious people are scared because there are no intermediaries that can reverse your bitcoin back from theives. We are the bank remember? Definitely dont take security lightly about it. Celsius creditors had the same basic attitude,	fd6ac35e61adbd9a59199194d41aa37f820f0092	True	False					0	1657857056		0	{}	ig7yyqt	False	t3_vz9zpn	False	True	t1_ig7ckgg	/r/Bitcoin/comments/vz9zpn/why_would_people_wear_bitcoin_merch_in_public/ig7yyqt/	1657857067	1	True	True	False	Bitcoin	t5_2s3qj	r/Bitcoin	public		0	[]			yeah worth half a coin today but crashing in price against all bitcoin wallets until the end of time like all those possessions to me its obvious people are scared because there are no intermediaries that can reverse your bitcoin back from theives we are the bank remember definitely dont take security lightly about it celsius creditors had the same basic attitude 	0.0025106919929385185	0.9881945848464966	0.8990257382392883	0.014270499348640442	0.9935303330421448	0.48136216402053833	0.0897216722369194	8.385422347600979e-07	0.40558627247810364	0.008093703538179398
24	[]	False		TheShinyGoodra			[]				text	t2_a2m6cdos	False	False	To look cool	17295438ebd4b19780620f2879bf2e773ef99a49	True	False					0	1657857014		0	{}	ig7yvs5	False	t3_vz9zpn	False	True	t3_vz9zpn	/r/Bitcoin/comments/vz9zpn/why_would_people_wear_bitcoin_merch_in_public/ig7yvs5/	1657857024	1	True	True	False	Bitcoin	t5_2s3qj	r/Bitcoin	public		0	[]			to look cool	0.5046189427375793	0.47441157698631287	0.40535885095596313	0.463147908449173	0.4717342257499695	0.6188617944717407	0.4744117856025696	0.4790319502353668	0.4565769135951996	0.5220585465431213
25	[]	False		Romando1			[]				text	t2_rdrf9	False	False	FUD?  It’s good news!  Stack!!!	6bb3636e23d8062242386049b410dd43d9dfcff6	True	False					0	1657857012		0	{}	ig7yvox	False	t3_vzcrbs	False	True	t1_ig7ttlt	/r/Bitcoin/comments/vzcrbs/bitcoin_is_more_likely_to_hit_10000_than_30000/ig7yvox/	1657857024	1	True	True	False	Bitcoin	t5_2s3qj	r/Bitcoin	public		0	[]			fud it s good news stack 	0.4990997910499573	0.42242667078971863	0.4880445897579193	0.4016250669956207	0.5155062079429626	0.7162747383117676	0.3913062512874603	0.4789714217185974	0.42310068011283875	0.015153767541050911
26	[]	False		typicalsnowman			[]				text	t2_5kurht9h	False	False	DM me the recovery phrase with the address so I can validate it for ya.	974dded2af12291bfec41628a859b80333281add	True	False					0	1657856968		0	{}	ig7ysmh	False	t3_vypq2s	False	False	t1_ig7yh0j	/r/Bitcoin/comments/vypq2s/just_wondering_what_happens_if_a_ledger_is_lost/ig7ysmh/	1657856979	1	True	True	False	Bitcoin	t5_2s3qj	r/Bitcoin	public		0	[]			dm me the recovery phrase with the address so i can validate it for ya 	0.27961692214012146	0.6980749368667603	0.19522292912006378	0.2699001729488373	0.4243857264518738	0.5596833825111389	0.19580572843551636	0.5023162961006165	0.33268165588378906	0.004084570799022913
27	[]	False		pbenz1			[]				text	t2_ahq3z7nw	False	False	That would indeed sound like a begger option though just would be great to see that	e852e378d372670eccc35ca8bf23760155118dcb	True	False					0	1657856967		0	{}	ig7yska	False	t3_vynpqj	False	True	t1_ig682fu	/r/Bitcoin/comments/vynpqj/daily_discussion_july_14_2022/ig7yska/	1657856979	1	True	True	False	Bitcoin	t5_2s3qj	r/Bitcoin	public		0	[]			that would indeed sound like a begger option though just would be great to see that	0.5418305993080139	0.5198416113853455	0.14181868731975555	0.03498709946870804	0.5808688402175903	0.5126484632492065	0.18981929123401642	1.0956456208077725e-05	0.4282894730567932	0.03982160612940788
28	[]	False		-emochicka-19		noob	[{'e': 'text', 't': 'redditor for a day'}]	2ec8e69e-6c36-11e9-a04b-0afb553d4ea6	redditor for a day	dark	richtext	t2_pzlp3gpa	False	False	titcoin was legit for a min	c0178c83afae5b49ad8de28750cb7f0b0735d5c4	True	False					0	1657856911		0	{}	ig7yok2	False	t3_vz9zpn	False	True	t1_ig7wubo	/r/Bitcoin/comments/vz9zpn/why_would_people_wear_bitcoin_merch_in_public/ig7yok2/	1657856927	1	True	True	False	Bitcoin	t5_2s3qj	r/Bitcoin	public		0	[]			titcoin was legit for a min	0.3793187439441681	0.5076285600662231	0.40812215209007263	0.4182310104370117	0.4292113482952118	0.5584479570388794	0.44975581765174866	0.41097912192344666	0.4076363444328308	0.15797248482704163
29	[]	False		HarmonyFlame			[]				text	t2_9gfcs	False	False	"All those items are crashing in price over time against all bitcoin wallets until the end of time. bitcoin is frankly the ultimate ""possession"" so i get the paranoia."	d2e6584aae901d23341b821bc68dea4c0c56cd10	True	False					0	1657856829		0	{}	ig7yizp	False	t3_vz9zpn	False	True	t1_ig7j5rh	/r/Bitcoin/comments/vz9zpn/why_would_people_wear_bitcoin_merch_in_public/ig7yizp/	1657856846	1	True	True	False	Bitcoin	t5_2s3qj	r/Bitcoin	public		0	[]			all those items are crashing in price over time against all bitcoin wallets until the end of time bitcoin is frankly the ultimate possession so i get the paranoia 	0.008776345290243626	0.9284185767173767	0.9154447913169861	0.03842481970787048	0.6140804290771484	0.4868810474872589	0.0840049535036087	8.587207958044019e-07	0.3164381682872772	0.009598747827112675
30	[]	False		BadgerInfamous9954			[]				text	t2_byemz46h	False	False	so i bought a used laptop and found a recovery phase so i put it in wtf 100k in it... what do do now ..	a7784c52eb13606499b1b6940041441829da79ce	True	False					0	1657856801		0	{}	ig7yh0j	False	t3_vypq2s	False	True	t3_vypq2s	/r/Bitcoin/comments/vypq2s/just_wondering_what_happens_if_a_ledger_is_lost/ig7yh0j/	1657856816	1	True	True	False	Bitcoin	t5_2s3qj	r/Bitcoin	public		0	[]			so i bought a used laptop and found a recovery phase so i put it in wtf 100k in it what do do now 	0.06175718456506729	0.9015989899635315	0.5965687036514282	0.018465030938386917	0.38723835349082947	0.4612140953540802	0.0660117119550705	0.25470682978630066	0.4104093611240387	0.007958726026117802
31	[]	False		braunrick7			[]				text	t2_9q4taesq	False	False	No, it does show a difference in general trajectory	2691f90bdbef342fec1ed2674928fe4c4d497a83	True	False					0	1657856789		0	{}	ig7yg5s	False	t3_vyphuj	False	True	t1_ig7tyf9	/r/Bitcoin/comments/vyphuj/im_in_developed_country_i_dont_need_bitcoin/ig7yg5s/	1657856801	1	True	True	False	Bitcoin	t5_2s3qj	r/Bitcoin	public		0	[]			no it does show a difference in general trajectory	0.35527172684669495	0.6154963970184326	0.5771269202232361	0.5155972838401794	0.46920666098594666	0.3765183985233307	0.22916363179683685	0.10701360553503036	0.5037778615951538	0.023424629122018814
32	[]	False		tennisss819			[]				text	t2_1znv4xmj	False	False	I’d say as a conversation starter. People like to show off their interests which is why so many wearing shirts or hats of their favorite team or band	f3aa80794207f03cc390911b7f33358dbd061d70	True	False					0	1657856777		0	{}	ig7yfc0	False	t3_vz9zpn	False	True	t3_vz9zpn	/r/Bitcoin/comments/vz9zpn/why_would_people_wear_bitcoin_merch_in_public/ig7yfc0/	1657856794	1	True	True	False	Bitcoin	t5_2s3qj	r/Bitcoin	public		0	[]			i d say as a conversation starter people like to show off their interests which is why so many wearing shirts or hats of their favorite team or band	0.0217136200517416	0.6981056928634644	0.5898119807243347	0.01905171573162079	0.35943347215652466	0.568276584148407	0.10098165273666382	8.678337053424912e-07	0.45954209566116333	0.010053863748908043
33	[]	False		kittywrastler			[]			dark	text	t2_k2kz8iqm	False	False	Well if we were monetarists that makes sense.	dc4b352182f10df0e375402ba023743cc47a9f92	True	False					0	1657856772		0	{}	ig7yexr	False	t3_vz1ief	False	True	t1_ig7t7on	/r/Bitcoin/comments/vz1ief/celsius_files_for_bankruptcy_as_users_worry_their/ig7yexr/	1657856787	1	True	True	False	Bitcoin	t5_2s3qj	r/Bitcoin	public		0	[]			well if we were monetarists that makes sense 	0.4263763129711151	0.4886910021305084	0.4293234646320343	0.4333409070968628	0.559255838394165	0.5885601043701172	0.46455350518226624	0.4845990836620331	0.5081658959388733	0.015654506161808968
34	[]	False		TheHipHouse			[]				text	t2_h1ogv1u	False	False	Yes I do a little of both and some mining	26c8d2f9ffabc0e9aee10ed07c26fd9711bb5a0d	True	False					0	1657856769		0	{}	ig7yep1	False	t3_vz21zz	False	True	t1_ig7tk33	/r/Bitcoin/comments/vz21zz/question_what_investment_strategy_will_you_use_to/ig7yep1/	1657856780	1	True	True	False	Bitcoin	t5_2s3qj	r/Bitcoin	public		0	[]			yes i do a little of both and some mining	0.5059640407562256	0.4209303557872772	0.2594035863876343	0.16029630601406097	0.36582210659980774	0.3665604293346405	0.48846325278282166	0.25150492787361145	0.41990914940834045	0.01441457960754633
35	[]	False		garrettjeanes			[]				text	t2_ggcnm85s	False	False	This is life tho, we gotta learn to enjoy our failures too. We gotta do it.	f39052ed2f87d0476ba805e86e93242fa9021033	True	False					0	1657856753		0	{}	ig7ydng	False	t3_vynpqj	False	True	t1_ig7fhqh	/r/Bitcoin/comments/vynpqj/daily_discussion_july_14_2022/ig7ydng/	1657856765	1	True	True	False	Bitcoin	t5_2s3qj	r/Bitcoin	public		0	[]			this is life tho we gotta learn to enjoy our failures too we gotta do it 	0.6371949911117554	0.16972783207893372	0.056607045233249664	0.025652389973402023	0.37478309869766235	0.7274319529533386	0.729188859462738	0.8056027293205261	0.3041299283504486	0.003999765031039715
