Unnamed: 0	all_awardings	archived	associated_award	author	author_flair_background_color	author_flair_css_class	author_flair_richtext	author_flair_template_id	author_flair_text	author_flair_text_color	author_flair_type	author_fullname	author_patreon_flair	author_premium	body	body_sha1	can_gild	collapsed	collapsed_because_crowd_control	collapsed_reason	collapsed_reason_code	comment_type	controversiality	created_utc	distinguished	gilded	gildings	id	is_submitter	link_id	locked	no_follow	parent_id	permalink	retrieved_utc	score	score_hidden	send_replies	stickied	subreddit	subreddit_id	subreddit_name_prefixed	subreddit_type	top_awarded_type	total_awards_received	treatment_tags	unrepliable_reason	corpus	support	knowledge	conflict	power	similarity	fun	status	trust	identity	romance
357	[]	False		AutoModerator			[]				text	t2_6l4z3	False	True	"WARNING: 
1) Do not trust DMs from anyone offering to help/support you with your funds (Scammers)! 
2) Never give out your Seed Phrase and DO NOT ENTER it on ANY websites sent to you.
3) MODS or Community Managers will NEVER DM you first regarding your funds/wallet.


*I am a bot, and this action was performed automatically. Please [contact the moderators of this subreddit](/message/compose/?to=/r/solana) if you have any questions or concerns.*"	14dd8b569135602c5532d6566410f9a64883f0a5	True	False					0	1647734236	moderator	0	{}	i1ce5aw	False	t3_ti8csi	True	True	t3_ti8csi	/r/solana/comments/ti8csi/coinbase_sued_for_selling_79_crypto_including/i1ce5aw/	1647734248	1	True	False	True	solana	t5_hcs2n	r/solana	public		0	[]		warning 1 do not trust dms from anyone offering to help support you with your funds scammers 2 never give out your seed phrase and do not enter it on any websites sent to you 3 mods or community managers will never dm you first regarding your funds wallet i am a bot and this action was performed automatically please contact the moderators of this subreddit message compose to r solana if you have any questions or concerns 	0.011870771646499634	0.988234281539917	0.4694240689277649	0.9483896493911743	0.008167698048055172	0.244121253490448	0.10070517659187317	8.339779924426693e-07	0.30487555265426636	0.01920556277036667
358	[]	False		CryptoLoser-XXL			[]				text	t2_b5rn2v4l	False	False	If Solana doubled tomorrow, then probably tomorrow I have twice as much Solana as I have today, but probably the total value will be about the same, because the value per Solana will be probably be half of today's price. So basically nothing changed.	6f337abd43eeed467c30c0a34d11bfe90de72604	True	False					0	1647734010		0	{}	i1cdobt	False	t3_ti6aip	False	True	t3_ti6aip	/r/solana/comments/ti6aip/if_solana_doubled_tomorrow/i1cdobt/	1647734027	1	False	True	False	solana	t5_hcs2n	r/solana	public		0	[]		if solana doubled tomorrow then probably tomorrow i have twice as much solana as i have today but probably the total value will be about the same because the value per solana will be probably be half of today s price so basically nothing changed 	0.022750334814190865	0.9864882826805115	0.5094760656356812	0.02127324417233467	0.3622015416622162	0.4581215977668762	0.07395956665277481	8.503286608174676e-07	0.38239338994026184	0.00960756465792656
359	[]	False		JRPower1			[]				text	t2_4mzdnx9w	False	True	More please kind sir.	cbbd450c0ff53eb57a77e6eb487360f42e58b309	True	False					0	1647733568		0	{}	i1ccr6d	False	t3_ti6aip	False	True	t1_i1c9ccs	/r/solana/comments/ti6aip/if_solana_doubled_tomorrow/i1ccr6d/	1647733581	1	False	True	False	solana	t5_hcs2n	r/solana	public		0	[]		more please kind sir 	0.4967464506626129	0.3571235239505768	0.3804141581058502	0.5080981254577637	0.4064229130744934	0.4539405107498169	0.645318329334259	0.5258477926254272	0.4453924000263214	0.25955089926719666
360	[]	False		crypt0kiddie			[]				text	t2_b531pgij	False	False	😂	df57595309d14b5eb3cca13e4ea172932c1a87dc	True	False					0	1647732656		0	{}	i1cav1x	False	t3_ti6aip	False	True	t1_i1c2pfu	/r/solana/comments/ti6aip/if_solana_doubled_tomorrow/i1cav1x/	1647732667	1	False	True	False	solana	t5_hcs2n	r/solana	public		0	[]		 	0.4871354103088379	0.5098868012428284	0.5124213099479675	0.5155720114707947	0.4910793602466583	0.4970635175704956	0.49484649300575256	0.48481839895248413	0.4902850091457367	0.5123646259307861
361	[]	False		ov3rwatch_			[]				text	t2_54ckxrro	False	False	🤣 nice one	536f8be5f7ac21e6cf549bd458e9ca7b5c34aed8	True	False					0	1647732371		0	{}	i1ca9os	False	t3_thk6jp	False	True	t1_i18r6sf	/r/solana/comments/thk6jp/hey_solana_family_how_would_you_change_an/i1ca9os/	1647732385	1	False	True	False	solana	t5_hcs2n	r/solana	public		0	[]		 nice one	0.5297489166259766	0.4276778995990753	0.384385347366333	0.43157270550727844	0.516728937625885	0.7926215529441833	0.5534669756889343	0.517716109752655	0.48478201031684875	0.5530326962471008
362	[]	False		JustinMurray007			[]				text	t2_g6hdl	False	False	Yes! We'll be releasing on github next week on beta launch, and it will all be open source! Keep tuned to our twitter for github link.	2c6d7f1b009e91aa8112b33d4defb142950daf4c	True	False					0	1647732027		0	{}	i1c9jge	True	t3_ti1me9	False	True	t1_i1c8drq	/r/solana/comments/ti1me9/hi_friends_enjoy_a_demo_video_of_our_solana_pay/i1c9jge/	1647732044	1	False	True	False	solana	t5_hcs2n	r/solana	public		0	[]		yes we ll be releasing on github next week on beta launch and it will all be open source keep tuned to our twitter for github link 	0.13175977766513824	0.932866632938385	0.06106625497341156	0.21646146476268768	0.17906203866004944	0.4451184570789337	0.1699633002281189	8.574098728786339e-07	0.20967164635658264	0.0019502391805872321
363	[]	False		jdrobby			[]				text	t2_cp9rxz99	False	False	If solana doubled tomorrow, it would be twice the price it is today. This is TA, if you would like more. Just ask, you’re welcome.	5ec2728ec484d3eb4b214d2bde0840cee551a6e0	True	False					0	1647731939		0	{}	i1c9ccs	False	t3_ti6aip	False	True	t3_ti6aip	/r/solana/comments/ti6aip/if_solana_doubled_tomorrow/i1c9ccs/	1647731957	1	False	True	False	solana	t5_hcs2n	r/solana	public		0	[]		if solana doubled tomorrow it would be twice the price it is today this is ta if you would like more just ask you re welcome 	0.23705579340457916	0.9627349376678467	0.2609653174877167	0.8783437609672546	0.1975983828306198	0.6169984340667725	0.09362257272005081	8.4294413227326e-07	0.23787908256053925	0.015153767541050911
364	[]	False		m0er0n			[]				text	t2_300yejmw	False	False	Yup. I got drained, after checking this thread out. Oh well. Such is life in the crypto world. I'm starting to hate crypto more and more due to the onslaught of arseholes. Broke again.	add75e52d502e01c66ea33efb359cfa3edf5d4fb	True	False					0	1647731755		0	{}	i1c8xwe	False	t3_snkfy8	False	True	t3_snkfy8	/r/solana/comments/snkfy8/i_see_tons_of_people_on_reddit_and_discord/i1c8xwe/	1647731771	1	False	True	False	solana	t5_hcs2n	r/solana	public		0	[]		yup i got drained after checking this thread out oh well such is life in the crypto world i m starting to hate crypto more and more due to the onslaught of arseholes broke again 	0.007528591901063919	0.9112112522125244	0.8966799974441528	0.02016344666481018	0.8122603893280029	0.5363476872444153	0.09135140478610992	8.378387974516954e-07	0.3080021142959595	0.009058293886482716
365	[]	False		Username_taken_FML			[]				text	t2_1419xg	False	False	I'd have double I have now...	6483b95685e4feae68bed5ad9ba542334022591c	True	False					0	1647731680		0	{}	i1c8s0m	False	t3_ti6aip	False	True	t3_ti6aip	/r/solana/comments/ti6aip/if_solana_doubled_tomorrow/i1c8s0m/	1647731694	1	False	True	False	solana	t5_hcs2n	r/solana	public		0	[]		i d have double i have now 	0.36420300602912903	0.4077320396900177	0.23523063957691193	0.4150206446647644	0.4915533661842346	0.5080769062042236	0.6464625000953674	0.2950947880744934	0.4139823913574219	0.13327056169509888
366	[]	False		siddhant1999			[]				text	t2_13mrmv	False	False	Is any of code open source?	e18aec1a76a34425162703ed133383c7ab83d851	True	False					0	1647731493		0	{}	i1c8drq	False	t3_ti1me9	False	True	t3_ti1me9	/r/solana/comments/ti1me9/hi_friends_enjoy_a_demo_video_of_our_solana_pay/i1c8drq/	1647731507	1	False	True	False	solana	t5_hcs2n	r/solana	public		0	[]		is any of code open source 	0.4041306674480438	0.6110316514968872	0.5513416528701782	0.546612560749054	0.41982293128967285	0.33352386951446533	0.30270707607269287	0.45677608251571655	0.531810998916626	0.15894806385040283
367	[]	False		Feeling_Character151			[]				text	t2_a0zowqut	False	False	Open your wallet in 2025 . It will be 3* than the current ath	1980edea68f56cd486581c334d4612cbbb8e0102	True	False					0	1647730861		0	{}	i1c718q	False	t3_ti6aip	False	True	t3_ti6aip	/r/solana/comments/ti6aip/if_solana_doubled_tomorrow/i1c718q/	1647730878	1	False	True	False	solana	t5_hcs2n	r/solana	public		0	[]		open your wallet in 2025 it will be 3 than the current ath	0.3520411550998688	0.7184513211250305	0.4548535645008087	0.7028984427452087	0.31510284543037415	0.34097176790237427	0.15872208774089813	0.7382729053497314	0.43105947971343994	0.010473067872226238
368	[]	False		daemontool23			[]				text	t2_a3arxkcl	False	False	If you plan it carefully and manage it with discipline, you could use some margin, with your current SOL as collateral, something like x1.5 o x2 max, no more than that. With SOL it make sense because the staking or lending rewards are not that high.	73e515641142743dfa57d9b2f7ce16a21452e0fd	True	False					0	1647730541		0	{}	i1c6cl0	False	t3_ti6aip	False	True	t1_i1c2pnh	/r/solana/comments/ti6aip/if_solana_doubled_tomorrow/i1c6cl0/	1647730556	1	False	True	False	solana	t5_hcs2n	r/solana	public		0	[]		if you plan it carefully and manage it with discipline you could use some margin with your current sol as collateral something like x1 5 o x2 max no more than that with sol it make sense because the staking or lending rewards are not that high 	0.026067929342389107	0.9883999824523926	0.5059789419174194	0.938642144203186	0.00962341669946909	0.2959447205066681	0.07190940529108047	8.534092330592102e-07	0.5545995831489563	0.0022390938829630613
369	[]	False		Creme-Exciting			[]				text	t2_d33ygad7	False	False	No. Microsoft puts the Nigerian prince in the spam box automatically. That's the difference.	f521a68debda14637c9fa3c98b07585b7d7e7881	True	False					0	1647729710		0	{}	i1c4jh4	False	t3_tdn14n	False	True	t1_i1aahwx	/r/solana/comments/tdn14n/any_way_to_get_these_scam_nfts_out_of_my_pantom/i1c4jh4/	1647729720	1	False	True	False	solana	t5_hcs2n	r/solana	public		0	[]		no microsoft puts the nigerian prince in the spam box automatically that s the difference 	0.02063908614218235	0.8994529843330383	0.7324556708335876	0.18673942983150482	0.3916618824005127	0.5195595622062683	0.12116222828626633	0.005977065302431583	0.43151745200157166	0.0016248496249318123
370	[]	False		Haunting-Constant801			[]				text	t2_d95mc3ue	False	False	"

unfortunately this market is full of scams, whether we talking nfts or cryptocurrency projects. we do need some sort of protection for investors to avoid these these honestly. i think launchpads like solanaprime which offers insurance fund, might be bringing some kind of protection for investors."	e4f7029560a2c7eebebd8a4495d088dbb625a4e5	True	False					0	1647729507		0	{}	i1c42wc	False	t3_thpspz	False	True	t3_thpspz	/r/solana/comments/thpspz/neon_labs_discord_hacked_fake_nft_mint_scam/i1c42wc/	1647729523	1	False	True	False	solana	t5_hcs2n	r/solana	public		0	[]		 unfortunately this market is full of scams whether we talking nfts or cryptocurrency projects we do need some sort of protection for investors to avoid these these honestly i think launchpads like solanaprime which offers insurance fund might be bringing some kind of protection for investors 	0.01121071819216013	0.9882912039756775	0.1904672533273697	0.014542541466653347	0.008680736646056175	0.2854295074939728	0.12355440855026245	8.349481959157856e-07	0.3775404095649719	0.008118896745145321
371	[]	False		g223955			[]				text	t2_i7s29456	False	False	just got this too, a xmas looking nft directing to a separate website - can you get rid of it safely? :/ do you have to move your sol and nfts to a different wallet or is that also risky?	25fdc3df286ec3ad4a024383a5d2932956efe719	True	False					0	1647729249		0	{}	i1c3hox	False	t3_rn4zhk	False	True	t3_rn4zhk	/r/solana/comments/rn4zhk/a_gift_appeared_in_my_phantom_wallet_is_it_a_scam/i1c3hox/	1647729264	1	False	True	False	solana	t5_hcs2n	r/solana	public		0	[]		just got this too a xmas looking nft directing to a separate website can you get rid of it safely do you have to move your sol and nfts to a different wallet or is that also risky 	0.03320138901472092	0.9639167785644531	0.14333675801753998	0.16170701384544373	0.008800300769507885	0.32788464426994324	0.0654212161898613	8.419703476647555e-07	0.32489052414894104	0.05862066149711609
372	[]	False		PeterNjos			[]				text	t2_vydb10o	False	False	For sure, I'm out of YOLO money for now though unfortunately. Just waiting for my buying at the ATH (smh) to rebound and go from there.	33cc647e9f7c546d54cfc770b5ce025ddb4f308b	True	False					0	1647728901		0	{}	i1c2pnh	True	t3_ti6aip	False	True	t1_i1c1dcm	/r/solana/comments/ti6aip/if_solana_doubled_tomorrow/i1c2pnh/	1647728917	1	False	True	False	solana	t5_hcs2n	r/solana	public		0	[]		for sure i m out of yolo money for now though unfortunately just waiting for my buying at the ath smh to rebound and go from there 	0.477642297744751	0.7051177620887756	0.5383257269859314	0.01720188371837139	0.3913591504096985	0.49606454372406006	0.11883106082677841	1.3673012517756433e-06	0.16491270065307617	0.010618367232382298
373	[]	False		Soft_Banana3886			[]				text	t2_h8kx3p6p	False	False	I'd break even.	fd321f7f328fabfeb6f709334d974e61c4934805	True	False					0	1647728898		0	{}	i1c2pfu	False	t3_ti6aip	False	False	t3_ti6aip	/r/solana/comments/ti6aip/if_solana_doubled_tomorrow/i1c2pfu/	1647728909	1	False	True	False	solana	t5_hcs2n	r/solana	public		0	[]		i d break even 	0.44070184230804443	0.42219093441963196	0.43511322140693665	0.44065916538238525	0.48080992698669434	0.6682957410812378	0.4789106249809265	0.3980191648006439	0.43514126539230347	0.3722171485424042
374	[]	False		BlazeDemBeatz			[]				text	t2_ncewq	False	False	Yup. There was a ton of opportunity to DCA down.	245e54a28e07077717662078a7102c6cf610ed7b	True	False					0	1647728296		0	{}	i1c1dcm	False	t3_ti6aip	False	True	t1_i1c0zmf	/r/solana/comments/ti6aip/if_solana_doubled_tomorrow/i1c1dcm/	1647728309	1	False	True	False	solana	t5_hcs2n	r/solana	public		0	[]		yup there was a ton of opportunity to dca down 	0.2701030969619751	0.566918134689331	0.2605529725551605	0.18757574260234833	0.39656949043273926	0.5096410512924194	0.4844391345977783	0.12868259847164154	0.32272011041641235	0.013829763978719711
375	[]	False		daemontool23			[]				text	t2_a3arxkcl	False	False	then buy now some…	affa49dcbf35272613b0e927dda5d7f95f7df10f	True	False					0	1647728125		0	{}	i1c0zmf	False	t3_ti6aip	False	True	t3_ti6aip	/r/solana/comments/ti6aip/if_solana_doubled_tomorrow/i1c0zmf/	1647728135	1	False	True	False	solana	t5_hcs2n	r/solana	public		0	[]		then buy now some 	0.45357105135917664	0.5237115621566772	0.4318499267101288	0.5993420481681824	0.49573010206222534	0.5982635021209717	0.33821427822113037	0.5154916644096375	0.44731050729751587	0.4379429519176483
376	[]	False		AutoModerator			[]				text	t2_6l4z3	False	True	"WARNING: 
1) Do not trust DMs from anyone offering to help/support you with your funds (Scammers)! 
2) Never give out your Seed Phrase and DO NOT ENTER it on ANY websites sent to you.
3) MODS or Community Managers will NEVER DM you first regarding your funds/wallet.


*I am a bot, and this action was performed automatically. Please [contact the moderators of this subreddit](/message/compose/?to=/r/solana) if you have any questions or concerns.*"	14dd8b569135602c5532d6566410f9a64883f0a5	True	False					0	1647728004	moderator	0	{}	i1c0pz8	False	t3_ti6aip	True	True	t3_ti6aip	/r/solana/comments/ti6aip/if_solana_doubled_tomorrow/i1c0pz8/	1647728014	1	True	False	True	solana	t5_hcs2n	r/solana	public		0	[]		warning 1 do not trust dms from anyone offering to help support you with your funds scammers 2 never give out your seed phrase and do not enter it on any websites sent to you 3 mods or community managers will never dm you first regarding your funds wallet i am a bot and this action was performed automatically please contact the moderators of this subreddit message compose to r solana if you have any questions or concerns 	0.011870771646499634	0.988234281539917	0.4694240689277649	0.9483896493911743	0.008167698048055172	0.244121253490448	0.10070517659187317	8.339779924426693e-07	0.30487555265426636	0.01920556277036667
377	[]	False		Jesus__Skywalker			[]				text	t2_2wn2vfi8	False	False	 It allows employers to pay their employees using the solana network. You can do payroll to the second with all the tax withholdings done automatically. They are also like the 3rd or 4th crypto project to be given a visa debit card.	44d9492098cf4975c7d20bac5a0e22a8bc925599	True	False					0	1647727436		0	{}	i1bzfev	False	t3_tgcryw	False	True	t1_i186oqg	/r/solana/comments/tgcryw/is_there_a_working_multisig_solution_for_solana/i1bzfev/	1647727449	1	False	True	False	solana	t5_hcs2n	r/solana	public		0	[]		 it allows employers to pay their employees using the solana network you can do payroll to the second with all the tax withholdings done automatically they are also like the 3rd or 4th crypto project to be given a visa debit card 	0.009874553419649601	0.9883080124855042	0.1606699824333191	0.9550747871398926	0.00806517619639635	0.15442392230033875	0.0942627489566803	8.489714105053281e-07	0.4082570970058441	0.016145600005984306
378	[]	False		Mike941			[]				text	t2_5jdxy	False	False	If a validator is profitable and you have the capital to setup another one why wouldn't you? Especially if you have goodwill built up from the stakers.	ec963eedc6f1496d9e1cface20e4bc1fcab08158	True	False					0	1647725610		0	{}	i1bv9bl	False	t3_tgm9qr	False	True	t1_i19npou	/r/solana/comments/tgm9qr/1601_validators/i1bv9bl/	1647725624	1	False	True	False	solana	t5_hcs2n	r/solana	public		0	[]		if a validator is profitable and you have the capital to setup another one why wouldn t you especially if you have goodwill built up from the stakers 	0.05822164565324783	0.9649604558944702	0.23970551788806915	0.9023092985153198	0.02966023050248623	0.5741842985153198	0.103126659989357	8.568409270992561e-07	0.26972776651382446	0.01099336426705122
379	[]	False		Appropriate-Ad-5427			[]				text	t2_8vsns5pd	False	False	Where can I find out how to do that and how many coins do you need to do that?	52bc6fb5bb666f40e136e4f070268d62fdc5f381	True	False					0	1647725539		0	{}	i1bv395	False	t3_tceo5j	False	True	t1_i0lsibc	/r/solana/comments/tceo5j/why_would_i_stake_sol_on_solana_when_i_can_do/i1bv395/	1647725557	1	False	True	False	solana	t5_hcs2n	r/solana	public		0	[]		where can i find out how to do that and how many coins do you need to do that 	0.5945426821708679	0.8599556088447571	0.06170058250427246	0.07732056081295013	0.22078123688697815	0.3511188328266144	0.07668228447437286	0.4019952714443207	0.34880995750427246	0.010804291814565659
380	[]	False		Junnowhoitis			[]				text	t2_7ws9gj96	False	False	Your money your choice. Don't be disappointed if they never amount to anything.	d6d26f74af2e99a135a24c225814fd331ce698b3	True	False					0	1647724781		0	{}	i1btcsv	False	t3_thclq4	False	True	t1_i1brec3	/r/solana/comments/thclq4/star_atlas_polis_pump/i1btcsv/	1647724799	1	False	True	False	solana	t5_hcs2n	r/solana	public		0	[]		your money your choice don t be disappointed if they never amount to anything 	0.5255231857299805	0.405884325504303	0.5885967016220093	0.5212898850440979	0.10373850166797638	0.366952121257782	0.2425214946269989	0.5504648685455322	0.36927512288093567	0.0036769676953554153
381	[]	False		Electronic-Cabinet13			[]				text	t2_c951dk7i	False	False	love jupitor	0a170118f82750ab11eae38922a43a61df31c150	True	False					0	1647724461		0	{}	i1bsmev	False	t3_thrfub	False	True	t3_thrfub	/r/solana/comments/thrfub/on_solana_i_think_the_best_retail_focused_dapp_is/i1bsmev/	1647724476	1	False	True	False	solana	t5_hcs2n	r/solana	public		0	[]		love jupitor	0.5009646415710449	0.40481433272361755	0.43359166383743286	0.39168381690979004	0.47344857454299927	0.4037918746471405	0.5858882665634155	0.507598340511322	0.4697044789791107	0.984684407711029
382	[]	False		TheMoonMan_			[]				text	t2_jeer9qkf	False	False	"Hey well if you ever do feel free to tell me more of your thoughts. 

Me personally I’m going to rock n roll with what they’ve got going on."	e88c4925775f9f9edeea906fd665f94ac74355b3	True	False					0	1647723921		0	{}	i1brec3	False	t3_thclq4	False	True	t1_i1bnr1v	/r/solana/comments/thclq4/star_atlas_polis_pump/i1brec3/	1647723938	1	False	True	False	solana	t5_hcs2n	r/solana	public		0	[]		hey well if you ever do feel free to tell me more of your thoughts me personally i m going to rock n roll with what they ve got going on 	0.6766058206558228	0.19116035103797913	0.13291914761066437	0.021327190101146698	0.01049217488616705	0.6723572015762329	0.19597989320755005	8.812731380203331e-07	0.19983310997486115	0.028050150722265244
383	[]	False		TheMoonMan_			[]				text	t2_jeer9qkf	False	False	LoL	def2dc957e70ef8fbd19e10848fb49063559aadf	True	False					0	1647723832		0	{}	i1br6yu	False	t3_thclq4	False	True	t1_i1bmu88	/r/solana/comments/thclq4/star_atlas_polis_pump/i1br6yu/	1647723849	1	False	True	False	solana	t5_hcs2n	r/solana	public		0	[]		lol	0.47317075729370117	0.43597516417503357	0.5476417541503906	0.4700857996940613	0.4872163236141205	0.6691137552261353	0.49147942662239075	0.4918611943721771	0.46693652868270874	0.5699469447135925
384	[]	False		WallTVLamp			[]				text	t2_4dh5j00y	False	False	Im really sorry man but there isn't	0d8d68e6cb476271af10e7c02c71ced76639f25b	True	False					0	1647723588		0	{}	i1bqm8v	False	t3_rn4zhk	False	True	t1_hqzi4sv	/r/solana/comments/rn4zhk/a_gift_appeared_in_my_phantom_wallet_is_it_a_scam/i1bqm8v/	1647723601	1	False	True	False	solana	t5_hcs2n	r/solana	public		0	[]		im really sorry man but there isn t	0.5908107161521912	0.1388508677482605	0.5787440538406372	0.11149541288614273	0.504680335521698	0.7609908580780029	0.47609466314315796	0.17849744856357574	0.4461701810359955	0.02406860701739788
385	[]	False		Junnowhoitis			[]				text	t2_7ws9gj96	False	False	I'm not doing another deep dive. Especially after that video lmao. Just not worth the time for that hot garbage. I doubt they have hired more than 20 people since then and have not made any real progress in turning into a game development company. If they ever start releasing worthwhile content let me know but right now I'm completely convinced they have no intention or are too naive to create the game they have promised.	1766a2ba24a26ebeb26eab439f804b9ecde83327	True	False					0	1647722360		0	{}	i1bnr1v	False	t3_thclq4	False	True	t1_i1bmi71	/r/solana/comments/thclq4/star_atlas_polis_pump/i1bnr1v/	1647722372	1	False	True	False	solana	t5_hcs2n	r/solana	public		0	[]		i m not doing another deep dive especially after that video lmao just not worth the time for that hot garbage i doubt they have hired more than 20 people since then and have not made any real progress in turning into a game development company if they ever start releasing worthwhile content let me know but right now i m completely convinced they have no intention or are too naive to create the game they have promised 	0.0028308855835348368	0.9879986047744751	0.88941890001297	0.013747872784733772	0.008675312623381615	0.5318136215209961	0.07332048565149307	8.400790534324187e-07	0.25103995203971863	0.012352436780929565
386	[]	False		LearnDifferenceBot			[]				text	t2_i4spg4l9	False	False	"&gt; rather then the

*than

 *Learn the difference [here](https://www.merriam-webster.com/words-at-play/when-to-use-then-and-than#:~:text=Than%20is%20used%20in%20comparisons,the%20then%2Dgovernor%22).*
*** 
 ^(Greetings, I am a language corrector bot. To make me ignore further mistakes from you in the future, reply `!optout` to this comment.)"	a785657756748a7e87d26c6d2191d32925595789	True	False					0	1647721966		0	{}	i1bmu88	False	t3_thclq4	False	True	t1_i1bmi71	/r/solana/comments/thclq4/star_atlas_polis_pump/i1bmu88/	1647721983	1	False	True	False	solana	t5_hcs2n	r/solana	public		0	[]		 gt rather then the than learn the difference here https www merriam webster com words at play when to use then and than text than 20is 20used 20in 20comparisons the 20then 2dgovernor 22 greetings i am a language corrector bot to make me ignore further mistakes from you in the future reply optout to this comment 	0.003085721516981721	0.9880700707435608	0.5437952876091003	0.06336212158203125	0.008280814625322819	0.4004359841346741	0.12419171631336212	8.39690585507924e-07	0.2444542497396469	0.027272505685687065
387	[]	False		TheMoonMan_			[]				text	t2_jeer9qkf	False	False	I would be interested in hearing your thoughts after doing a deep dive today rather then the thoughts from 4-5months ago.	8d235082f62e3dbffa80772fc5a9de6f9d638740	True	False					0	1647721818		0	{}	i1bmi71	False	t3_thclq4	False	True	t1_i1blnhr	/r/solana/comments/thclq4/star_atlas_polis_pump/i1bmi71/	1647721832	1	False	True	False	solana	t5_hcs2n	r/solana	public		0	[]		i would be interested in hearing your thoughts after doing a deep dive today rather then the thoughts from 4 5months ago 	0.5859222412109375	0.4660632014274597	0.12744030356407166	0.060684096068143845	0.32479140162467957	0.4559418559074402	0.2199733555316925	0.11204521358013153	0.2626470923423767	0.00863973330706358
