all_awardings,archived,associated_award,author,author_flair_background_color,author_flair_css_class,author_flair_richtext,author_flair_template_id,author_flair_text,author_flair_text_color,author_flair_type,author_fullname,author_patreon_flair,author_premium,body,body_sha1,can_gild,collapsed,collapsed_because_crowd_control,collapsed_reason,collapsed_reason_code,comment_type,controversiality,created_utc,distinguished,gilded,gildings,id,is_submitter,link_id,locked,no_follow,parent_id,permalink,retrieved_utc,score,score_hidden,send_replies,stickied,subreddit,subreddit_id,subreddit_name_prefixed,subreddit_type,top_awarded_type,total_awards_received,treatment_tags,unrepliable_reason
[],False,,CartographerWorth649,,,[],,,,text,t2_cumkycm9,False,False,Is there any way to recover this recordings? Always looking to get more of Aleksandar Mitrovic's insights on Unique Network and his views on the broad NFT space,8ddd0bfb358fd40dd09e8285b0f6b23d5446c8de,True,False,,,,,0,1656878947,,0,{},ieqj1wn,False,t3_u4eba4,False,True,t3_u4eba4,/r/Polkadot/comments/u4eba4/april_28th_tune_in_to_polkadot_web3_talks_to_dive/ieqj1wn/,1656878959,1,False,True,False,Polkadot,t5_2ublt,r/Polkadot,public,,0,[],
[],False,,creasecarter,,,[],,,,text,t2_2k81sndg,False,False,I think those validators put 100% to keep outsiders out. They have their own liquidity pools I assume.,f0357914aca336bd0bafbb5357c25657d9a8679d,True,False,,,,,0,1656870714,,0,{},ieq0e7g,True,t3_vngjkq,False,True,t1_iepahce,/r/Polkadot/comments/vngjkq/staking_dot_via_ledger/ieq0e7g/,1656870726,1,False,True,False,Polkadot,t5_2ublt,r/Polkadot,public,,0,[],
[],False,,antiwrappingpaper,,,[],,,,text,t2_1hvjboiz,False,False,hmm... wondering why this is not visible on the main page,de405cd075d1ac68872dab5ef7373d70f6a3f193,True,False,,,,,0,1656884501,,0,{},ieqvjpb,False,t3_vqe6e5,False,True,t3_vqe6e5,/r/Polkadot/comments/vqe6e5/concerns_about_parachain_slot_auction_number_21/ieqvjpb/,1656884518,1,False,True,False,Polkadot,t5_2ublt,r/Polkadot,public,,0,[],
[],False,,blksith0,,,[],,,,text,t2_7uqo1,False,False,"Yeah I'm confused. I still don't ""have"" any of my: 

\- DOT,  nor any of the 

\- PAL (Phalus network), nor any of the 

\- CFG (Centrifuge) rewards.

&amp;#x200B;

If I dig through the endless maze of their website, I find just a static list telling me that I staked DOT in exchange for token xyz in the crowdloan, but I can't actually transact the stake-reward tokens. It's very odd.",0b3b6bc01be3fac111dfd727b6a3e7f8dc13f5c8,True,False,,,,,0,1656881071,,0,{},ieqnvsw,True,t3_u970r7,False,True,t3_u970r7,/r/Polkadot/comments/u970r7/kucoin_dot_crowdloans_rewards/ieqnvsw/,1656881086,1,False,True,False,Polkadot,t5_2ublt,r/Polkadot,public,,0,[],
[],False,,electrodude19,,,[],,,,text,t2_lbp754kf,False,False,"I posted this question also on r/dot and someone commented that a minimum amount of DOT has to be met to get a parachain, can someone provide a link where this is defined",1528a59e43e8f70384e12353d635a43cacaf21d2,True,False,,,,,0,1656873494,,0,{},ieq6rhb,True,t3_vqe6e5,False,True,t3_vqe6e5,/r/Polkadot/comments/vqe6e5/concerns_about_parachain_slot_auction_number_21/ieq6rhb/,1656873508,1,False,True,False,Polkadot,t5_2ublt,r/Polkadot,public,,0,[],
[],False,,Repulsive-Ad3460,,,[],,,,text,t2_9zpfrea9,False,False,We need eyes on this,6215380aa2d745f54b19f5b861a92c656a0608e5,True,False,,,,,0,1656873323,,0,{},ieq6dlg,False,t3_vqe6e5,False,True,t3_vqe6e5,/r/Polkadot/comments/vqe6e5/concerns_about_parachain_slot_auction_number_21/ieq6dlg/,1656873337,1,False,True,False,Polkadot,t5_2ublt,r/Polkadot,public,,0,[],
[],False,,Chawkdee,,,[],,,,text,t2_15xtw4s,False,False,"I have exactly that but don't know which ones to choose.

Why are some validators shown as 100% commission?",59b4cfe4e7316880929de9f47334549826e561a1,True,False,,,,,0,1656859708,,0,{},iepahce,False,t3_vngjkq,False,True,t1_iejgv3h,/r/Polkadot/comments/vngjkq/staking_dot_via_ledger/iepahce/,1656859727,1,False,True,False,Polkadot,t5_2ublt,r/Polkadot,public,,0,[],
[],False,,Chawkdee,,,[],,,,text,t2_15xtw4s,False,False,"what is the main net?

&amp;#x200B;

Why are some validators shown as 100% commission?",21550147a08711702e6007897bf7c7906d257151,True,False,,,,,0,1656859656,,0,{},iepad04,False,t3_vngjkq,False,False,t1_iea0gol,/r/Polkadot/comments/vngjkq/staking_dot_via_ledger/iepad04/,1656859672,1,False,True,False,Polkadot,t5_2ublt,r/Polkadot,public,,0,[],
[],False,,binalotwg,,,[],,,,text,t2_d0533etm,False,False,The Polkadot Ecosystem has shown strength through this period. I see some projects like Subsquid building strong and scaling web3 there in the ecosystem. I believe the new version of the Giv2 governance system is a new height.,58c0d8424137be7214177961433139ad42918130,True,False,,,,,0,1656851527,,0,{},ieous0e,False,t3_vnzg9i,False,True,t3_vnzg9i,/r/Polkadot/comments/vnzg9i/time_for_polkadot_i_think_it_will_be_a_bomb_this/ieous0e/,1656851545,1,False,True,False,Polkadot,t5_2ublt,r/Polkadot,public,,0,[],
[],False,,binalotwg,,,[],,,,text,t2_d0533etm,False,False,I followed up on the Subsqiud presentation and what the CEO represents. A show like that was worth the time.,6c5debf428d75bf3b6b833693110b14d9b9b20b2,True,False,,,,,0,1656851093,,0,{},ieou3gr,False,t3_vomy6n,False,True,t1_iejjqzo,/r/Polkadot/comments/vomy6n/does_any_one_know_if_the_polkadot_decoded_talks/ieou3gr/,1656851107,1,False,True,False,Polkadot,t5_2ublt,r/Polkadot,public,,0,[],
[],False,,AutoModerator,,,[],,,,text,t2_6l4z3,False,True,"It seems you are posting content related to price discussion. Please note that this a technology focused sub and all discussions on price, market cap as well as trading should be moved to r/dot, an independent community not moderated by Polkadot developers. This post will be automatically removed, if you believe this to be in error please consider contacting the moderators.

*I am a bot, and this action was performed automatically. Please [contact the moderators of this subreddit](/message/compose/?to=/r/Polkadot) if you have any questions or concerns.*",fc6b03194056e1e28e6f184b09caa925f87973d3,True,False,,,,,0,1656842311,moderator,0,{},ieoiqfy,False,t3_vqe75l,False,True,t3_vqe75l,/r/Polkadot/comments/vqe75l/polkadot_is_in_a_tight_range_as_it_risks_decline/ieoiqfy/,1656842323,1,False,False,False,Polkadot,t5_2ublt,r/Polkadot,public,,0,[],
[],False,,AndyBonaseraSux,,,[],,,,text,t2_a15x5czq,False,False,Oh good to know thank you.,7b8f392619b746e8e4cd0acb57d58f85721be66a,True,False,,,,,0,1656823273,,0,{},ienux3e,True,t3_voq70u,False,False,t1_iehflm7,/r/Polkadot/comments/voq70u/anyone_here_run_a_validate_node/ienux3e/,1656823287,1,False,True,False,Polkadot,t5_2ublt,r/Polkadot,public,,0,[],
[],False,,nestobal,,,[],,,,text,t2_6ckto0dc,False,False,"Ah, this morning I checked and it's working now. I think the waiting period was 2 eras instead of one?",983e2980043228abcef8eef8d4e49f38b6137de4,True,False,,,,,0,1656834054,,0,{},ieo9blo,False,t3_r7u3fj,False,True,t1_iekb3iq,/r/Polkadot/comments/r7u3fj/ledger_staking_there_are_no_active_nominations/ieo9blo/,1656834067,1,False,True,False,Polkadot,t5_2ublt,r/Polkadot,public,,0,[],
