Unnamed: 0	all_awardings	archived	associated_award	author	author_flair_background_color	author_flair_css_class	author_flair_richtext	author_flair_template_id	author_flair_text	author_flair_text_color	author_flair_type	author_fullname	author_patreon_flair	author_premium	body	body_sha1	can_gild	collapsed	collapsed_because_crowd_control	collapsed_reason	collapsed_reason_code	comment_type	controversiality	created_utc	distinguished	gilded	gildings	id	is_submitter	link_id	locked	no_follow	parent_id	permalink	retrieved_utc	score	score_hidden	send_replies	stickied	subreddit	subreddit_id	subreddit_name_prefixed	subreddit_type	top_awarded_type	total_awards_received	treatment_tags	unrepliable_reason	author_cakeday	corpus	support	knowledge	conflict	power	similarity	fun	status	trust	identity	romance
0	[]	False		Crypto_Cadet			[]				text	t2_2r8dgsb8	False	False	My observation is the more elaborate (to a point) the storage system is, the less BTC one actually has. Keep it simple. Complication leads to lost BTC. Lost BTC means  number go up for the rest of…wait never mind, go ahead with this option!	1340fd667ec9d2c13eee2acb4ef46893fbcb044b	True	False					0	1661054420		0	{}	il5it8p	False	t3_wt1155	False	False	t3_wt1155	/r/Bitcoin/comments/wt1155/keeping_cold_storage_keys_safe_my_idea_is_there_a/il5it8p/	1661054433	1	True	True	False	Bitcoin	t5_2s3qj	r/Bitcoin	public		0	[]													
1	[]	False		itsashortcut			[]				text	t2_5zp60pbj	False	False	Hard to imagine too many of them will race to sell when bitcoin is down \~$30k from one year ago.	406a0e9a4ae1d5e9ade1ac3b609f8a962f8f22f5	True	False					0	1661054310		0	{}	il5im22	False	t3_wtkxgi	False	True	t3_wtkxgi	/r/Bitcoin/comments/wtkxgi/any_thoughts_on_the_mtgox_situation_do_u_guys/il5im22/	1661054324	1	True	True	False	Bitcoin	t5_2s3qj	r/Bitcoin	public		0	[]													
2	[]	False		Apprehensive-Sun1215			[]				text	t2_k8cvir8l	False	True	BTC is trading about 4 billion dollars per day on average, and 130,000 coins are worth 2.7b, so I don't think it will have much effect. Also, they aren't going to just dump it since they will want to get the most money they can, so this will be spread over time I am sure... I don't think it will have any impact.	c7f490b23e343b32288933f1481b35e6922d7881	True	False					0	1661054304		0	{}	il5ilmh	False	t3_wtkxgi	False	True	t3_wtkxgi	/r/Bitcoin/comments/wtkxgi/any_thoughts_on_the_mtgox_situation_do_u_guys/il5ilmh/	1661054317	1	True	True	False	Bitcoin	t5_2s3qj	r/Bitcoin	public		0	[]													
3	[]	False		GeminiJ13			[]				text	t2_iiuvq	False	False	Yeah, it is the worst, isn't it.	3cd024d63d697fcb4ad605b609094a5f80ff8282	True	False					0	1661054160		0	{}	il5ic4w	True	t3_wtpbrc	False	True	t1_il5i6h3	/r/Bitcoin/comments/wtpbrc/this_coinbase_pro_fricking_advertisement/il5ic4w/	1661054170	1	True	True	False	Bitcoin	t5_2s3qj	r/Bitcoin	public		0	[]													
4	[]	False		amadeaqueen			[]				text	t2_5f05u81k	False	False	*4 months later* u were saying no housing market crash? LMAO. That's just the beginning.	c3651b6ddc428b84f0145490f66bffbc2af46c98	True	False					0	1661054114		0	{}	il5i93l	True	t3_u3pokg	False	True	t1_i4re6qc	/r/Bitcoin/comments/u3pokg/someone_told_me_today_the_dollar_is_stable_so_i/il5i93l/	1661054125	1	True	True	False	Bitcoin	t5_2s3qj	r/Bitcoin	public		0	[]													
5	[]	False		tmmroy			[]				text	t2_clpoo	False	False	"If BTC hits 1,000,000 and the US has multiple years in a row of 10%+ inflation, I guarantee you they peg a fiat exchange rate to BTC, at something like 50% the market rate and seize BTC while paying at the fiat rate. They'll seize anything they can get their hands on. They'll surveil the blockchain, they'll seize the records of the exchanges, they'll set a 3 year or so prison term for anyone that doesn't turn over their keys, and they'll make you choose between sitting in prison or holding the full value of your coin. And you won't have any way to convert the coin without leaving the country, which they'll probably also ban for anyone convicted of the earlier ""crime.""

There is zero chance the US doesn't elect a populist if we're losing reserve currency status to BTC, and there's zero chance a populist, whether of the left or the right, doesn't pass a law like that. Things start to look like that's happening, don't be like someone in Ukraine missing the signs that Russia would invade, leave while you still can."	e41d03b16a49d412c8d07173169445fbd99d6bf5	True	False					0	1661054114		0	{}	il5i937	False	t3_wtdemh	False	True	t1_il3teje	/r/Bitcoin/comments/wtdemh/governments_trying_to_confiscate_bitcoin_would/il5i937/	1661054125	1	True	True	False	Bitcoin	t5_2s3qj	r/Bitcoin	public		0	[]													
6	[]	False		AndthenIwould			[]				text	t2_16sihf	False	False	I bit the bullet and took the deal.  Got my $20 in BTC and will be removing it shortly.  I'm not a big fan of the Advanced Trade UI.  It's not the default face of CB and I kind of resent having to do the couple extra clicks to get there.  Looking again for other CEX options but being in the US is a hindering factor.  [FTX.US](https://FTX.US) is missing a couple of important tokens for me, Kraken doesn't have an ACH fiat onramp and I don't trust [Binance.US](https://Binance.US).  That leaves Gemini, [Crypto.com](https://Crypto.com) and KuCoin.  The latter two have really bad network fees for transfers.  So I guess I'm going to try out Gemini and see how it goes.  But until we get better options, CB is going to be my primary CEX, for better or worse.	cfd8709e75a52213126a9566fd640b529007ac36	True	False					0	1661054073		0	{}	il5i6h3	False	t3_wtpbrc	False	True	t1_il5exec	/r/Bitcoin/comments/wtpbrc/this_coinbase_pro_fricking_advertisement/il5i6h3/	1661054085	1	True	True	False	Bitcoin	t5_2s3qj	r/Bitcoin	public		0	[]													
7	[]	False		slowd			[]				text	t2_38y4x	False	False	I think Coinbase has OTC services if you’re worried about moving the market with a very large order. Kraken does as well. If you’re buying for example a few hundred thousand USD at a time that’s no big deal, you can set a limit order in Coinbase Pro.	0644e62ffa0a91cd45b76fd5fec468d646417995	True	False					0	1661054022		0	{}	il5i337	False	t3_wtny8s	False	True	t3_wtny8s	/r/Bitcoin/comments/wtny8s/large_purchase/il5i337/	1661054032	1	True	True	False	Bitcoin	t5_2s3qj	r/Bitcoin	public		0	[]													
8	[]	False		furtadocody			[]				text	t2_lx0jcui8	False	False	We won't get it because government is here to fuck us.	614269beb4c04ffd3e4120e29cc922af1805a108	True	False					0	1661054002		0	{}	il5i1ps	False	t3_wsrdp8	False	True	t1_il2wy23	/r/Bitcoin/comments/wsrdp8/we_need_merchant_adoption_so_we_dont_have_to_sell/il5i1ps/	1661054014	1	True	True	False	Bitcoin	t5_2s3qj	r/Bitcoin	public		0	[]													
9	[]	False		Queasy-Lime-2495		noob	[{'e': 'text', 't': 'redditor for 6 days'}]	2ec8e69e-6c36-11e9-a04b-0afb553d4ea6	redditor for 6 days	dark	richtext	t2_rfvtepvy	False	False	Binance Referrals CPA_007XNE1SQD	307b9cef4268aa1799673f058d882829b860f288	True	False					0	1661053972		0	{}	il5hzmf	False	t3_wsrdp8	False	True	t3_wsrdp8	/r/Bitcoin/comments/wsrdp8/we_need_merchant_adoption_so_we_dont_have_to_sell/il5hzmf/	1661053983	1	True	True	False	Bitcoin	t5_2s3qj	r/Bitcoin	public		0	[]													
10	[]	False		Queasy-Lime-2495		noob	[{'e': 'text', 't': 'redditor for 6 days'}]	2ec8e69e-6c36-11e9-a04b-0afb553d4ea6	redditor for 6 days	dark	richtext	t2_rfvtepvy	False	False	Binance Referrals CPA_007XNE1SQD	307b9cef4268aa1799673f058d882829b860f288	True	False					0	1661053945		0	{}	il5hxo3	False	t3_wtdemh	False	True	t3_wtdemh	/r/Bitcoin/comments/wtdemh/governments_trying_to_confiscate_bitcoin_would/il5hxo3/	1661053957	1	True	True	False	Bitcoin	t5_2s3qj	r/Bitcoin	public		0	[]													
11	[]	False		Queasy-Lime-2495		noob	[{'e': 'text', 't': 'redditor for 6 days'}]	2ec8e69e-6c36-11e9-a04b-0afb553d4ea6	redditor for 6 days	dark	richtext	t2_rfvtepvy	False	False	Binance Referrals CPA_007XNE1SQD	307b9cef4268aa1799673f058d882829b860f288	True	False					0	1661053935		0	{}	il5hwye	False	t3_wth6dl	False	True	t3_wth6dl	/r/Bitcoin/comments/wth6dl/buy_the_dip/il5hwye/	1661053950	1	True	True	False	Bitcoin	t5_2s3qj	r/Bitcoin	public		0	[]													
12	[]	False		Queasy-Lime-2495		noob	[{'e': 'text', 't': 'redditor for 6 days'}]	2ec8e69e-6c36-11e9-a04b-0afb553d4ea6	redditor for 6 days	dark	richtext	t2_rfvtepvy	False	False	Binance Referrals CPA_007XNE1SQD	307b9cef4268aa1799673f058d882829b860f288	True	False					0	1661053916		0	{}	il5hvoy	False	t3_wt8cx2	False	True	t3_wt8cx2	/r/Bitcoin/comments/wt8cx2/while_all_the_fud_is_going_on_i_have_decided_to/il5hvoy/	1661053927	1	True	True	False	Bitcoin	t5_2s3qj	r/Bitcoin	public		0	[]													
13	[]	False		Queasy-Lime-2495		noob	[{'e': 'text', 't': 'redditor for 6 days'}]	2ec8e69e-6c36-11e9-a04b-0afb553d4ea6	redditor for 6 days	dark	richtext	t2_rfvtepvy	False	False	Binance Referrals CPA_007XNE1SQD	307b9cef4268aa1799673f058d882829b860f288	True	False					0	1661053906		0	{}	il5hv27	False	t3_wt7uru	False	True	t3_wt7uru	/r/Bitcoin/comments/wt7uru/this_answer_from_greg_maxwell_deserves_its_own/il5hv27/	1661053919	1	True	True	False	Bitcoin	t5_2s3qj	r/Bitcoin	public		0	[]													
14	[]	False		[deleted]						dark					[removed]	fe993932d6dced4c0a879e9aa5d7a6e0fbb467f5	True	False					0	1661053887		0	{}	il5htpr	False	t3_wsyq8o	False	True	t3_wsyq8o	/r/Bitcoin/comments/wsyq8o/daily_discussion_august_20_2022/il5htpr/	1661053897	1	True	True	False	Bitcoin	t5_2s3qj	r/Bitcoin	public		0	[]													
15	[]	False		drgrxdsdaa			[]				text	t2_a6gllr4c	False	False	Amazing work man amazing, this is really cool of you actually.	7073818d34cfd560a8a3dc8980509f6dc7363477	True	False					0	1661053819		0	{}	il5hp8w	False	t3_wt8cx2	False	True	t3_wt8cx2	/r/Bitcoin/comments/wt8cx2/while_all_the_fud_is_going_on_i_have_decided_to/il5hp8w/	1661053831	1	True	True	False	Bitcoin	t5_2s3qj	r/Bitcoin	public		0	[]													
16	[]	False		parfhk			[]				text	t2_als60dqz	False	False	Yep, sounds like a plan to me. I think people should try it.	4de7571667a742f1bc083b27cb72e0d234608d34	True	False					0	1661053622		0	{}	il5hc4o	False	t3_wt8cx2	False	True	t1_il3hqg1	/r/Bitcoin/comments/wt8cx2/while_all_the_fud_is_going_on_i_have_decided_to/il5hc4o/	1661053633	1	True	True	False	Bitcoin	t5_2s3qj	r/Bitcoin	public		0	[]													
17	[]	False		levigoldson			[]				text	t2_32ad1v5b	False	False	Government:  that can be arranged	3bb9ee71c80300a2d7d04b31956389652bdfa2c2	True	False					0	1661053401		0	{}	il5gxgq	False	t3_wssuhl	False	False	t1_il3g6ln	/r/Bitcoin/comments/wssuhl/i_wonder_what_these_are_for/il5gxgq/	1661053416	1	True	True	False	Bitcoin	t5_2s3qj	r/Bitcoin	public		0	[]													
18	[]	False		comfyggs			[]			dark	text	t2_d77f4vjx	False	False	Cheap Sats maybe	57d69f5859302ff2adc0eee169cbd6a17e45b357	True	False					0	1661053387		0	{}	il5gwg7	False	t3_wtkxgi	False	True	t3_wtkxgi	/r/Bitcoin/comments/wtkxgi/any_thoughts_on_the_mtgox_situation_do_u_guys/il5gwg7/	1661053401	1	True	True	False	Bitcoin	t5_2s3qj	r/Bitcoin	public		0	[]													
19	[]	False		Salti21			[]			dark	text	t2_bsqiwcmh	False	False	🤷‍♂️	a6e679cd8e29800d7c4e9ad06bc52cdc3f9b09e9	True	False					0	1661053286		0	{}	il5gppi	False	t3_wth6dl	False	True	t1_il5find	/r/Bitcoin/comments/wth6dl/buy_the_dip/il5gppi/	1661053301	1	True	True	False	Bitcoin	t5_2s3qj	r/Bitcoin	public		0	[]													
20	[]	False		VitisV			[]				text	t2_hnyst	False	False	A cool 10 million 😎	aff7dc74ffda7ed74c7b60ba87ba3e5be73f48cc	True	False					0	1661053276		0	{}	il5gp0e	False	t3_wth6dl	False	True	t1_il50xac	/r/Bitcoin/comments/wth6dl/buy_the_dip/il5gp0e/	1661053294	1	True	True	False	Bitcoin	t5_2s3qj	r/Bitcoin	public		0	[]													
21	[]	False		tmmroy			[]				text	t2_clpoo	False	False	"Any first world and many developing nations have enough surveillance of their markets to effectively kill BTC in their country, at least if they choose to do so. Anyone that is concerned about an order 6102 in the imminent future and who is able to do so, should leave their country.

That being said, BTC is unique in how portable it is. Cubans that fled their homeland when their wealth was seized were not able to take anything with them. That is much less of an issue with BTC if it's held in your own wallet."	96b7828ee603c17c6f6ec640f4a2573d2ee0451c	True	False					0	1661053274		0	{}	il5govs	False	t3_wtdemh	False	True	t3_wtdemh	/r/Bitcoin/comments/wtdemh/governments_trying_to_confiscate_bitcoin_would/il5govs/	1661053286	1	True	True	False	Bitcoin	t5_2s3qj	r/Bitcoin	public		0	[]													
22	[]	False		sgtslaughterTV			[]				text	t2_1lpw021l	False	False	Nick isn't Satoshi and he'll refuse interviews with anyone who believes he is. However, he did work on something prior to bitcoin that was cited by Satoshi, along with six or seven other works that were cited in the bitcoin white paper. It doesn't matter who Satoshi is.	d09cb2984fef401f51f24f2485c85ef3d06f80d5	True	False					0	1661053242		0	{}	il5gmr4	False	t3_wtjygw	False	True	t1_il4ww10	/r/Bitcoin/comments/wtjygw/what_happened_to_nick_szabo/il5gmr4/	1661053255	1	True	True	False	Bitcoin	t5_2s3qj	r/Bitcoin	public		0	[]													
23	[]	False		AlexWD			[]				text	t2_6iwm0	False	False	People with money use Reddit too, lol	d5f15b99767fe1588139a448e6d29860a174715c	True	False					0	1661053201		0	{}	il5gjx3	False	t3_wtny8s	False	True	t1_il5ayms	/r/Bitcoin/comments/wtny8s/large_purchase/il5gjx3/	1661053217	1	True	True	False	Bitcoin	t5_2s3qj	r/Bitcoin	public		0	[]													
24	[]	False		Eddybitcoin			[]				text	t2_48x0k8vr	False	False	I wait for under 20k then go psycho mode on the buy button.	c38d3a4c73477a42a7e13221caf0cd98f3826c1c	True	False					0	1661053175		0	{}	il5gi71	False	t3_wth6dl	False	True	t3_wth6dl	/r/Bitcoin/comments/wth6dl/buy_the_dip/il5gi71/	1661053194	1	True	True	False	Bitcoin	t5_2s3qj	r/Bitcoin	public		0	[]													
25	[]	False		yogaruncrypto		noob	[{'e': 'text', 't': 'redditor for 3 months'}]	2ec8e69e-6c36-11e9-a04b-0afb553d4ea6	redditor for 3 months	dark	richtext	t2_ms8cc2nr	False	False	And pray for more dip! 🙏📉	645303c1da97c39ae301405fecfade543d05c700	True	False					0	1661052986		0	{}	il5g574	False	t3_wth6dl	False	True	t3_wth6dl	/r/Bitcoin/comments/wth6dl/buy_the_dip/il5g574/	1661053003	1	True	True	False	Bitcoin	t5_2s3qj	r/Bitcoin	public		0	[]													
26	[]	False		Grouchy_Artichoke_90			[]			dark	text	t2_kykwqive	False	False	Just think, we all had a chance to buy thousands of btc years ago. Now, most people are lucky to be able to afford one. Any chance of the price crashing is a blessing in disguise.	8eb6467373058b8503e7a115f51c0c6ccf84736d	True	False					0	1661052980		0	{}	il5g4ox	False	t3_wtkxgi	False	True	t3_wtkxgi	/r/Bitcoin/comments/wtkxgi/any_thoughts_on_the_mtgox_situation_do_u_guys/il5g4ox/	1661052995	1	True	True	False	Bitcoin	t5_2s3qj	r/Bitcoin	public		0	[]													
27	[]	False		lib3rty47			[]			dark	text	t2_47b9rhrz	False	False	Trust me bro dot com	1265383a60669322ba864d35781e57b110e6dcff	True	False					0	1661052933		0	{}	il5g1fh	False	t3_wtkxgi	False	True	t1_il53i5f	/r/Bitcoin/comments/wtkxgi/any_thoughts_on_the_mtgox_situation_do_u_guys/il5g1fh/	1661052949	1	True	True	False	Bitcoin	t5_2s3qj	r/Bitcoin	public		0	[]													
28	[]	False		rocket_beer			[]				text	t2_n9afsfz	False	False	Are these taxable events?	d4e9ff6eaf57a14e2cbf36c9b668d116f32402a8	True	False					0	1661052916		0	{}	il5g081	False	t3_wtevnz	False	True	t3_wtevnz	/r/Bitcoin/comments/wtevnz/announcing_sat_battle_a_platform_100_powered_by/il5g081/	1661052927	1	True	True	False	Bitcoin	t5_2s3qj	r/Bitcoin	public		0	[]													
29	[]	False		simplelifestyle			[]				text	t2_15cgu0wo	False	True	"&gt; How do we donate?
&gt; 
&gt; Edit:
&gt; 
&gt; https://www.defendingbtc.com/
&gt; 
&gt; Please go and donate! And email the whales like the Winklevoss to go and do it. So far it seems that only one whale has donated (Mr. Saylor with 47 BTC)."	fc8bebb3bfd21a2176a600ffb2115fb04e670538	True	False					0	1661052890		0	{}	il5fygg	False	t3_wt7uru	False	True	t1_il50w0y	/r/Bitcoin/comments/wt7uru/this_answer_from_greg_maxwell_deserves_its_own/il5fygg/	1661052905	1	True	True	False	Bitcoin	t5_2s3qj	r/Bitcoin	public		0	[]													
30	[]	False		ClementineMoney		noob	[{'e': 'text', 't': 'redditor for 4 weeks'}]	2ec8e69e-6c36-11e9-a04b-0afb553d4ea6	redditor for 4 weeks	dark	richtext	t2_qcigoye5	False	False	Can you add chess? Quick games like bullet chess (1 minute clocks) would be perfect for this setup!	fd2e339f5fd98c56dc8ba62c429e332642e6a273	True	False					0	1661052838		0	{}	il5fuw9	False	t3_wtevnz	False	False	t3_wtevnz	/r/Bitcoin/comments/wtevnz/announcing_sat_battle_a_platform_100_powered_by/il5fuw9/	1661052850	1	True	True	False	Bitcoin	t5_2s3qj	r/Bitcoin	public		0	[]													
31	[]	False		[deleted]						dark					[removed]	fe993932d6dced4c0a879e9aa5d7a6e0fbb467f5	True	False					0	1661052798		0	{}	il5fs54	False	t3_ws8wfd	False	True	t1_il5d1pi	/r/Bitcoin/comments/ws8wfd/starting_september_12th_in_oslo_norway_hodlonaut/il5fs54/	1661052812	1	True	True	False	Bitcoin	t5_2s3qj	r/Bitcoin	public		0	[]													
32	[]	False		ButterChickenBurrahh		noob	[{'e': 'text', 't': 'redditor for 1 week'}]	2ec8e69e-6c36-11e9-a04b-0afb553d4ea6	redditor for 1 week	dark	richtext	t2_r69vkie2	False	False	Me too 6500	94475ce474869318136a271f3faf93b9b902844b	True	False					0	1661052782		0	{}	il5fr0z	False	t3_wt3hg7	False	True	t1_il1u142	/r/Bitcoin/comments/wt3hg7/someone_just_dropped_47_btc_to_hodlonauts_defense/il5fr0z/	1661052792	1	True	True	False	Bitcoin	t5_2s3qj	r/Bitcoin	public		0	[]													
33	[]	False		predawnretrospective		noob	[{'e': 'text', 't': 'redditor for 3 weeks'}]	2ec8e69e-6c36-11e9-a04b-0afb553d4ea6	redditor for 3 weeks	dark	richtext	t2_endce11z	False	False	if youre buying less than 4.5bn go for coinbase pro	4ed4575754ec1700bcb55f599007ba065aa2df6f	True	False					0	1661052776		0	{}	il5fqn5	False	t3_wtny8s	False	True	t3_wtny8s	/r/Bitcoin/comments/wtny8s/large_purchase/il5fqn5/	1661052789	1	True	True	False	Bitcoin	t5_2s3qj	r/Bitcoin	public		0	[]													
34	[]	False		ButterChickenBurrahh		noob	[{'e': 'text', 't': 'redditor for 1 week'}]	2ec8e69e-6c36-11e9-a04b-0afb553d4ea6	redditor for 1 week	dark	richtext	t2_r69vkie2	False	False	Wow they must have like 1000s of btc, sweet	ca9886b5d9ae262e4993db1aeb85e07b93e95181	True	False					0	1661052758		0	{}	il5fpfh	False	t3_wt3hg7	False	True	t3_wt3hg7	/r/Bitcoin/comments/wt3hg7/someone_just_dropped_47_btc_to_hodlonauts_defense/il5fpfh/	1661052770	1	True	True	False	Bitcoin	t5_2s3qj	r/Bitcoin	public		0	[]													
35	[]	False		simplelifestyle			[]				text	t2_15cgu0wo	False	True	"How do we donate?

Edit:

https://www.defendingbtc.com/

Please go and donate! And email the whales like the Winklevoss to go and do it. So far it seems that only one whale has donated (Mr. Saylor with 47 BTC)."	05184ab55550b098c7a4957c699098b0e79fea73	True	False					0	1661052717		0	{}	il5fmmb	False	t3_wt7uru	False	True	t1_il2uwnm	/r/Bitcoin/comments/wt7uru/this_answer_from_greg_maxwell_deserves_its_own/il5fmmb/	1661052729	1	True	True	False	Bitcoin	t5_2s3qj	r/Bitcoin	public		0	[]													
36	[]	False		NeDoMainer			[]				text	t2_e87nbk8g	False	False	"As the people are still getting paid with fiat, so its better to turn those fiat in Bitcoin and hodl them for future.

So that by any chance, the whole world changes its currency to Bitcoin, you don't have to suffer regarding anything"	9de8c4cc1a70ae5583d4237c7b8af41b801d3d51	True	False					0	1661052693		0	{}	il5fkz7	False	t3_wsrdp8	False	False	t1_il2pltc	/r/Bitcoin/comments/wsrdp8/we_need_merchant_adoption_so_we_dont_have_to_sell/il5fkz7/	1661052705	1	True	True	False	Bitcoin	t5_2s3qj	r/Bitcoin	public		0	[]													
37	[]	False		yogaruncrypto		noob	[{'e': 'text', 't': 'redditor for 3 months'}]	2ec8e69e-6c36-11e9-a04b-0afb553d4ea6	redditor for 3 months	dark	richtext	t2_ms8cc2nr	False	False	How zero fees? I set a limit order today and it estimated $18 fees.	3302a817dd3423621d256f3817ad67b6eae3ede6	True	False					0	1661052659		0	{}	il5find	False	t3_wth6dl	False	True	t1_il5ewk8	/r/Bitcoin/comments/wth6dl/buy_the_dip/il5find/	1661052676	1	True	True	False	Bitcoin	t5_2s3qj	r/Bitcoin	public		0	[]													
38	[]	False		nullc			[]				text	t2_1y2aw	False	True	Ironically, when Hodlnaut shows up on the scene hodlonaut complained about the name hijack and that they looked kinda scammy and they tore into him for being toxic. ...	eedcd8cb7ff610a4784535df2da5780e66e23a33	True	False					0	1661052657		0	{}	il5fifp	False	t3_ws8wfd	False	True	t1_il042yz	/r/Bitcoin/comments/ws8wfd/starting_september_12th_in_oslo_norway_hodlonaut/il5fifp/	1661052668	1	True	True	False	Bitcoin	t5_2s3qj	r/Bitcoin	public		0	[]													
39	[]	False		Cute-Transition-7419			[]				text	t2_35vt9236	False	False	I see. Well given yourself hosting your probably going to hit your limit no? Isn't a users request still being tallied as bandwidth coming from you?	c3e2770e3a6106d1189510045518653b12c55752	True	False					0	1661052475		0	{}	il5f5gz	False	t3_wsmtnl	False	True	t1_il32g45	/r/Bitcoin/comments/wsmtnl/i_tired_of_slow_cryptotrackers_and_made_my_it_is/il5f5gz/	1661052486	1	True	True	False	Bitcoin	t5_2s3qj	r/Bitcoin	public		0	[]		True											
40	[]	False		varikonniemi			[]				text	t2_5pv5t	False	False	well, the good thing in that case is that the legal fees are not in tens of millions, but tens of thousands in this legal system. You could even represent yourself in a clearcut case like this.	4f34ec11e146af31240a403902bd3719eb20b75d	True	False					0	1661052397		0	{}	il5ezxc	False	t3_ws8wfd	False	True	t1_il5e8o3	/r/Bitcoin/comments/ws8wfd/starting_september_12th_in_oslo_norway_hodlonaut/il5ezxc/	1661052410	1	True	True	False	Bitcoin	t5_2s3qj	r/Bitcoin	public		0	[]													
41	[]	False		GeminiJ13			[]				text	t2_iiuvq	False	False	I HATE this thing.  It appears EVERY TIME I refresh the page and I don't see any way of disabling it permanently.  I don't pay Coinbase to serve me ads.	cdd833f5fcad059015523fd120bb4d2f228caa4b	True	False					0	1661052363		0	{}	il5exec	True	t3_wtpbrc	False	True	t3_wtpbrc	/r/Bitcoin/comments/wtpbrc/this_coinbase_pro_fricking_advertisement/il5exec/	1661052373	1	True	True	False	Bitcoin	t5_2s3qj	r/Bitcoin	public		0	[]													
42	[]	False		Salti21			[]			dark	text	t2_bsqiwcmh	False	False	Strike let’s me deposit $25 a week.  I contacted them and they said give it some time.  Fuck that.  I’m sticking with coinbase to buy the dip with zero fees right now.  Zero fees.	04dfe652ddec59f597d0f0a4ca8c36e031af040f	True	False					0	1661052351		0	{}	il5ewk8	False	t3_wth6dl	False	True	t1_il5d9cy	/r/Bitcoin/comments/wth6dl/buy_the_dip/il5ewk8/	1661052365	1	True	True	False	Bitcoin	t5_2s3qj	r/Bitcoin	public		0	[]													
43	[]	False		-send_me_bitcoin-			[]			dark	text	t2_ey6e65vq	False	False	All the downsides of a bank without the upsides of bitcoin.	b703e032909e2562b2b7911d50d2b171ff5761d0	True	False					0	1661052351		0	{}	il5ewjy	False	t3_wtpbrc	False	True	t3_wtpbrc	/r/Bitcoin/comments/wtpbrc/this_coinbase_pro_fricking_advertisement/il5ewjy/	1661052365	1	True	True	False	Bitcoin	t5_2s3qj	r/Bitcoin	public		0	[]													
44	[]	False		JooseBTC		noob	[{'e': 'text', 't': 'redditor for 2 weeks'}]	2ec8e69e-6c36-11e9-a04b-0afb553d4ea6	redditor for 2 weeks	dark	richtext	t2_r050m322	False	False	I find it hard to believe “most of them” will sell. They’re coins on a TRADING exchange. I’d bet a good amount of these people are traders. What trader would sell at $20k in a bear market when they KNOW ath is $69k?? That’s be a horrible move.. most traders kno the cycles so I feel like they’d wait for the next bull at least right?	aee6f6013b9887b6d05a5c902a65685e85063b82	True	False					0	1661052344		0	{}	il5ew02	False	t3_wtkxgi	False	True	t1_il4zwah	/r/Bitcoin/comments/wtkxgi/any_thoughts_on_the_mtgox_situation_do_u_guys/il5ew02/	1661052357	1	True	True	False	Bitcoin	t5_2s3qj	r/Bitcoin	public		0	[]													
45	[]	False		OdoIcontradictmyself			[]				text	t2_c7t906d0	False	False	I’m not aloud in public	9dda5e9694fecdf0c5529ac6bdeb32ab38ae2c77	True	False					0	1661052296		0	{}	il5esjx	False	t3_wtkxgi	False	False	t1_il5ef6j	/r/Bitcoin/comments/wtkxgi/any_thoughts_on_the_mtgox_situation_do_u_guys/il5esjx/	1661052310	1	True	True	False	Bitcoin	t5_2s3qj	r/Bitcoin	public		0	[]													
46	[]	False		CaptainPugwash75			[]				text	t2_letr2	False	False	Public my ass	4d513a353b601756a64fa227aba29d3422168e38	True	False					0	1661052098		0	{}	il5ef6j	False	t3_wtkxgi	False	True	t1_il4xpaf	/r/Bitcoin/comments/wtkxgi/any_thoughts_on_the_mtgox_situation_do_u_guys/il5ef6j/	1661052112	1	True	True	False	Bitcoin	t5_2s3qj	r/Bitcoin	public		0	[]													
47	[]	False		varikonniemi			[]				text	t2_5pv5t	False	False	You can have a bank account, but not touch bitcoin with it. How many of your daily purchases could you not make with amazon, and use bitcoin with discount to pay for it?	c19a99176065449471f52574388298e48684082a	True	False					0	1661052090		0	{}	il5eepu	False	t3_wrqfas	False	False	t1_iku8eqa	/r/Bitcoin/comments/wrqfas/this_is_how_kraken_thanks_their_customers/il5eepu/	1661052104	1	True	True	False	Bitcoin	t5_2s3qj	r/Bitcoin	public		0	[]													
48	[]	False		ButterChickenBurrahh		noob	[{'e': 'text', 't': 'redditor for 1 week'}]	2ec8e69e-6c36-11e9-a04b-0afb553d4ea6	redditor for 1 week	dark	richtext	t2_r69vkie2	False	False	I sent 6500 sats to the fund	20a9d90e38c7dea14bb3880901cf0e9a9d154d19	True	False					0	1661052085		0	{}	il5eecr	False	t3_wt7uru	False	True	t3_wt7uru	/r/Bitcoin/comments/wt7uru/this_answer_from_greg_maxwell_deserves_its_own/il5eecr/	1661052096	1	True	True	False	Bitcoin	t5_2s3qj	r/Bitcoin	public		0	[]													
