Unnamed: 0	all_awardings	allow_live_comments	author	author_flair_css_class	author_flair_richtext	author_flair_text	author_flair_type	author_fullname	author_is_blocked	author_patreon_flair	author_premium	awarders	can_mod_post	contest_mode	created_utc	domain	full_link	gildings	id	is_created_from_ads_ui	is_crosspostable	is_meta	is_original_content	is_reddit_media_domain	is_robot_indexable	is_self	is_video	link_flair_background_color	link_flair_richtext	link_flair_text_color	link_flair_type	locked	media_only	no_follow	num_comments	num_crossposts	over_18	parent_whitelist_status	permalink	pinned	pwls	removed_by_category	retrieved_on	score	selftext	send_replies	spoiler	stickied	subreddit	subreddit_id	subreddit_subscribers	subreddit_type	thumbnail	title	total_awards_received	treatment_tags	upvote_ratio	url	whitelist_status	wls	post_hint	preview	thumbnail_height	thumbnail_width	url_overridden_by_dest	author_flair_background_color	author_flair_text_color	author_flair_template_id	distinguished	suggested_sort	media	media_embed	secure_media	secure_media_embed	link_flair_text	is_gallery	media_metadata	gallery_data	link_flair_template_id	concated	corpus	support	knowledge	conflict	power	similarity	fun	status	trust	identity	romance
0	[]	False	northernedge24		[]		text	t2_10p32xkp	False	False	False	[]	False	False	1659252582	self.Bitcoin	https://www.reddit.com/r/Bitcoin/comments/wcj1xn/an_interesting_bitcoin_read_from_2011_this_guy/	{}	wcj1xn	False	False	False	False	False	False	True	False		[]	dark	text	False	False	True	0	0	False	all_ads	/r/Bitcoin/comments/wcj1xn/an_interesting_bitcoin_read_from_2011_this_guy/	False	6	moderator	1659252592	1	[removed]	True	False	False	Bitcoin	t5_2s3qj	4443095	public	self	An interesting Bitcoin read from 2011. This guy must be a time traveler!	0	[]	1.0	https://www.reddit.com/r/Bitcoin/comments/wcj1xn/an_interesting_bitcoin_read_from_2011_this_guy/	all_ads	6																				"An interesting Bitcoin read from 2011. This guy must be a time traveler!
[removed]"											
1	[]	False	Cryptology3366		[]		text	t2_7ohu8p0z	False	False	False	[]	False	False	1659250601	i.redd.it	https://www.reddit.com/r/Bitcoin/comments/wcijo9/lmao/	{}	wcijo9	False	True	False	False	True	True	False	False		[]	dark	text	False	False	True	0	0	False	all_ads	/r/Bitcoin/comments/wcijo9/lmao/	False	6		1659250612	1		True	False	False	Bitcoin	t5_2s3qj	4443047	public	https://a.thumbs.redditmedia.com/8e7saaK17hvW1asYg0LZ9JIgRvAUKKw2bZ_2k056p70.jpg	Lmao !!	0	[]	1.0	https://i.redd.it/8xcrjwgeque91.jpg	all_ads	6	image	{'enabled': True, 'images': [{'id': 'QmpabFA-hgAniNk8YFlPrmPdAxOcfnHXn1gp2FcLjPY', 'resolutions': [{'height': 109, 'url': 'https://preview.redd.it/8xcrjwgeque91.jpg?width=108&amp;crop=smart&amp;auto=webp&amp;s=1ddd005dfcab556c9242568eaca2aa9d74683d5c', 'width': 108}, {'height': 218, 'url': 'https://preview.redd.it/8xcrjwgeque91.jpg?width=216&amp;crop=smart&amp;auto=webp&amp;s=410bebe3e013a25aa5ee19aec04c195c292219ed', 'width': 216}, {'height': 323, 'url': 'https://preview.redd.it/8xcrjwgeque91.jpg?width=320&amp;crop=smart&amp;auto=webp&amp;s=c54015414be9e47d6f589b014e74e26dd28783dc', 'width': 320}, {'height': 647, 'url': 'https://preview.redd.it/8xcrjwgeque91.jpg?width=640&amp;crop=smart&amp;auto=webp&amp;s=90b32e723836197ced29cd29c93602ddbe4f1ab5', 'width': 640}, {'height': 971, 'url': 'https://preview.redd.it/8xcrjwgeque91.jpg?width=960&amp;crop=smart&amp;auto=webp&amp;s=9f98521b0bc1d12bc058f7f791cca328a5b7b697', 'width': 960}, {'height': 1092, 'url': 'https://preview.redd.it/8xcrjwgeque91.jpg?width=1080&amp;crop=smart&amp;auto=webp&amp;s=a3c71539b426c9688c2a4a875188c892b81d1ad7', 'width': 1080}], 'source': {'height': 1184, 'url': 'https://preview.redd.it/8xcrjwgeque91.jpg?auto=webp&amp;s=242af35258007248ab2ce949a7a6592efb8d236f', 'width': 1170}, 'variants': {}}]}	140.0	140.0	https://i.redd.it/8xcrjwgeque91.jpg															"Lmao !!
"											
2	[]	False	SoooBueno		[]		text	t2_2l2a1898	False	False	False	[]	False	False	1659250281	self.Bitcoin	https://www.reddit.com/r/Bitcoin/comments/wcigs5/bull24coin_com_legit/	{}	wcigs5	False	True	False	False	False	True	True	False		[]	dark	text	False	False	True	0	0	False	all_ads	/r/Bitcoin/comments/wcigs5/bull24coin_com_legit/	False	6		1659250292	1	Has anyone heard of or used this platform?	True	False	False	Bitcoin	t5_2s3qj	4443031	public	self	Bull24coin .com legit?	0	[]	1.0	https://www.reddit.com/r/Bitcoin/comments/wcigs5/bull24coin_com_legit/	all_ads	6																				"Bull24coin .com legit?
Has anyone heard of or used this platform?"											
3	[]	False	AdviceImpressive219		[]		text	t2_amifyktt	False	False	False	[]	False	False	1659249274	i.redd.it	https://www.reddit.com/r/Bitcoin/comments/wci7e9/bitcoin_accepted_here_in_a_cocktail_bar_south/	{}	wci7e9	False	True	False	False	True	True	False	False		[]	dark	text	False	False	True	0	0	False	all_ads	/r/Bitcoin/comments/wci7e9/bitcoin_accepted_here_in_a_cocktail_bar_south/	False	6		1659249284	1		True	False	False	Bitcoin	t5_2s3qj	4443003	public	https://b.thumbs.redditmedia.com/5kIMIUMcRz1sAI1mNIw9UMMHrrnnu5SnI05NHTlZeho.jpg	Bitcoin accepted here in a cocktail bar South Australia	0	[]	1.0	https://i.redd.it/o8s5p89gmue91.jpg	all_ads	6	image	{'enabled': True, 'images': [{'id': 'IE3eCZw2MW9sQrJIVZv4gJHCOs2unNva8yHCnZWgAh4', 'resolutions': [{'height': 216, 'url': 'https://preview.redd.it/o8s5p89gmue91.jpg?width=108&amp;crop=smart&amp;auto=webp&amp;s=073d6acc7e4f0bb367f0e49a70751c1f93208a03', 'width': 108}, {'height': 432, 'url': 'https://preview.redd.it/o8s5p89gmue91.jpg?width=216&amp;crop=smart&amp;auto=webp&amp;s=ebfd8c04e9faef4132d9e1190e04f8d27fd33b43', 'width': 216}, {'height': 640, 'url': 'https://preview.redd.it/o8s5p89gmue91.jpg?width=320&amp;crop=smart&amp;auto=webp&amp;s=40e234052e7b359e1d2314cf9ee76b5aab16861a', 'width': 320}, {'height': 1280, 'url': 'https://preview.redd.it/o8s5p89gmue91.jpg?width=640&amp;crop=smart&amp;auto=webp&amp;s=f76d70e30d9fb002ed0b369f968e4691762c06b9', 'width': 640}, {'height': 1920, 'url': 'https://preview.redd.it/o8s5p89gmue91.jpg?width=960&amp;crop=smart&amp;auto=webp&amp;s=3424e9d75a410a910d6f84ea577a7e5da68a2de0', 'width': 960}, {'height': 2160, 'url': 'https://preview.redd.it/o8s5p89gmue91.jpg?width=1080&amp;crop=smart&amp;auto=webp&amp;s=b66620c6b01bc3ae729185eab9516c219e870c54', 'width': 1080}], 'source': {'height': 2532, 'url': 'https://preview.redd.it/o8s5p89gmue91.jpg?auto=webp&amp;s=4b5055c21ff8bc30dbe39f75e72ae4a060a88202', 'width': 1170}, 'variants': {}}]}	140.0	140.0	https://i.redd.it/o8s5p89gmue91.jpg															"Bitcoin accepted here in a cocktail bar South Australia
"											
4	[]	False	IBmyownboss		[]		text	t2_5r7m421j	False	False	False	[]	False	False	1659247354	self.Bitcoin	https://www.reddit.com/r/Bitcoin/comments/wchpsa/question_about_sparrow_wallet_coinjoin/	{}	wchpsa	False	True	False	False	False	True	True	False		[]	dark	text	False	False	True	0	0	False	all_ads	/r/Bitcoin/comments/wchpsa/question_about_sparrow_wallet_coinjoin/	False	6		1659247365	1	How many coinjoin mixes is sufficient? Is 3 or 4 the sweet spot or would more mixes be required?	True	False	False	Bitcoin	t5_2s3qj	4442947	public	self	Question about Sparrow wallet coinjoin.	0	[]	1.0	https://www.reddit.com/r/Bitcoin/comments/wchpsa/question_about_sparrow_wallet_coinjoin/	all_ads	6							dark													"Question about Sparrow wallet coinjoin.
How many coinjoin mixes is sufficient? Is 3 or 4 the sweet spot or would more mixes be required?"											
5	[]	False	Jayden__________	noob	[{'e': 'text', 't': 'redditor for 4 weeks'}]	redditor for 4 weeks	richtext	t2_phdgdqav	False	False	False	[]	False	False	1659247125	self.Bitcoin	https://www.reddit.com/r/Bitcoin/comments/wchnfb/finally_got_an_online_job_after_waiting_for_months/	{}	wchnfb	False	True	False	False	False	True	True	False		[]	dark	text	False	False	True	0	0	False	all_ads	/r/Bitcoin/comments/wchnfb/finally_got_an_online_job_after_waiting_for_months/	False	6		1659247136	1	"I was depressed from 5 months as i applied for many jobs but rejected from all ... Then I tried to apply for an online job and eventually a website hired me . Fast forward to now, I am employed from a month and got a payout of $3700 this month....
Don't worry you will also get a good job soon ..
For your curiosity, i found the job [here](https://linktr.ee/free_jobs_) ."	True	False	False	Bitcoin	t5_2s3qj	4442938	public	self	Finally got an Online job after waiting for months ....	0	[]	1.0	https://www.reddit.com/r/Bitcoin/comments/wchnfb/finally_got_an_online_job_after_waiting_for_months/	all_ads	6	self	{'enabled': False, 'images': [{'id': 'atBqsT_5wQyLU7yYEjnVhLE04YU2_SBcOsAaFWjujoE', 'resolutions': [{'height': 108, 'url': 'https://external-preview.redd.it/Wf2Lge0RSbYbkbhn9C5hzDxpmH0ht7TfGNj5jUowRFE.jpg?width=108&amp;crop=smart&amp;auto=webp&amp;s=af593813f9a4dee8328d34e33e9f5c56e48f30b3', 'width': 108}], 'source': {'height': 162, 'url': 'https://external-preview.redd.it/Wf2Lge0RSbYbkbhn9C5hzDxpmH0ht7TfGNj5jUowRFE.jpg?auto=webp&amp;s=71628e701e722dc04878068743622e3a79c55b82', 'width': 162}, 'variants': {}}]}					dark	2ec8e69e-6c36-11e9-a04b-0afb553d4ea6												"Finally got an Online job after waiting for months ....
I was depressed from 5 months as i applied for many jobs but rejected from all ... Then I tried to apply for an online job and eventually a website hired me . Fast forward to now, I am employed from a month and got a payout of $3700 this month....
Don't worry you will also get a good job soon ..
For your curiosity, i found the job [here](https://linktr.ee/free_jobs_) ."											
6	[]	False	1entreprenewer		[]		text	t2_eutew	False	False	False	[]	False	False	1659247032	i.redd.it	https://www.reddit.com/r/Bitcoin/comments/wchmke/slowly_then_all_at_once_major_israeli_credit_card/	{}	wchmke	False	True	False	False	True	True	False	False		[]	dark	text	False	False	True	0	0	False	all_ads	/r/Bitcoin/comments/wchmke/slowly_then_all_at_once_major_israeli_credit_card/	False	6		1659247043	1		True	False	False	Bitcoin	t5_2s3qj	4442936	public	https://b.thumbs.redditmedia.com/_KV12nZ0fj3PQBFHNITYnhiqG1crW0rhyLtLj3EuC2w.jpg	Slowly, then all at once: Major Israeli credit card provider launches Bitcoin rewards card (spare me the anti-Israel BS)	0	[]	1.0	https://i.redd.it/8kn8logsfue91.jpg	all_ads	6	image	{'enabled': True, 'images': [{'id': '3jVICJzQcImAjyrHhRu29l08dfE9Ycoj3TWSKjCpxQY', 'resolutions': [{'height': 163, 'url': 'https://preview.redd.it/8kn8logsfue91.jpg?width=108&amp;crop=smart&amp;auto=webp&amp;s=68af363ca109cf2b2f149226b5f8af5c62f7c2f5', 'width': 108}, {'height': 327, 'url': 'https://preview.redd.it/8kn8logsfue91.jpg?width=216&amp;crop=smart&amp;auto=webp&amp;s=9e8210331b2f2ad361b15fa7e7ff6779bb1b96e8', 'width': 216}, {'height': 484, 'url': 'https://preview.redd.it/8kn8logsfue91.jpg?width=320&amp;crop=smart&amp;auto=webp&amp;s=29f974a2a3d9695f976e381b2d73e6c33ee29ad6', 'width': 320}, {'height': 969, 'url': 'https://preview.redd.it/8kn8logsfue91.jpg?width=640&amp;crop=smart&amp;auto=webp&amp;s=7038826493baf91fed85f831d6525ad7989f5d00', 'width': 640}, {'height': 1453, 'url': 'https://preview.redd.it/8kn8logsfue91.jpg?width=960&amp;crop=smart&amp;auto=webp&amp;s=bc7fb39fa64da23cbfd1967e80c7319b6686d433', 'width': 960}, {'height': 1635, 'url': 'https://preview.redd.it/8kn8logsfue91.jpg?width=1080&amp;crop=smart&amp;auto=webp&amp;s=44848e9cbb2b5ae03a55e3b6d442c752aa6ad4e2', 'width': 1080}], 'source': {'height': 1772, 'url': 'https://preview.redd.it/8kn8logsfue91.jpg?auto=webp&amp;s=c8a71b9c1d37a26a84f2904b3d724f00413bb8a7', 'width': 1170}, 'variants': {}}]}	140.0	140.0	https://i.redd.it/8kn8logsfue91.jpg															"Slowly, then all at once: Major Israeli credit card provider launches Bitcoin rewards card (spare me the anti-Israel BS)
"											
7	[]	False	mebf109		[]		text	t2_12i2fkn	False	False	False	[]	False	False	1659245088	self.Bitcoin	https://www.reddit.com/r/Bitcoin/comments/wch3ra/starting_next_week_israel_will_prohibit_cash/	{}	wch3ra	False	True	False	False	False	True	True	False		[]	dark	text	False	False	True	0	0	False	all_ads	/r/Bitcoin/comments/wch3ra/starting_next_week_israel_will_prohibit_cash/	False	6		1659245099	1	Good thing that it could never happen here in the U.S., right?	True	False	False	Bitcoin	t5_2s3qj	4442892	public	self	Starting next week, Israel will prohibit cash transactions above $4,400 and business transactions above $1,760.	0	[]	1.0	https://www.reddit.com/r/Bitcoin/comments/wch3ra/starting_next_week_israel_will_prohibit_cash/	all_ads	6																				"Starting next week, Israel will prohibit cash transactions above $4,400 and business transactions above $1,760.
Good thing that it could never happen here in the U.S., right?"											
8	[]	False	KiltedCrypto		[]		text	t2_frj2ya1g	False	False	False	[]	False	False	1659245085	i.redd.it	https://www.reddit.com/r/Bitcoin/comments/wch3px/who_else_has_played_the_chipotle_buy_the_dip_game/	{}	wch3px	False	True	False	False	True	True	False	False		[]	dark	text	False	False	False	0	0	False	all_ads	/r/Bitcoin/comments/wch3px/who_else_has_played_the_chipotle_buy_the_dip_game/	False	6		1659245095	1		True	False	False	Bitcoin	t5_2s3qj	4442892	public	https://b.thumbs.redditmedia.com/camt9l5vQCeaVG7CNOQOTcT4dz3o5Hd_hdgbfkVJe_A.jpg	"Who else has played the Chipotle ""Buy the dip"" game hoping to win BTC only to get gauc for a penny?"	0	[]	1.0	https://i.redd.it/5mo74600aue91.jpg	all_ads	6	image	{'enabled': True, 'images': [{'id': 'IG7gZ7g1mpsiwf5wGiWhnbOjhsd8YQpFS3fAAqzJJko', 'resolutions': [{'height': 203, 'url': 'https://preview.redd.it/5mo74600aue91.jpg?width=108&amp;crop=smart&amp;auto=webp&amp;s=1f2519189ab8701ffacd698228ddac0281dd7beb', 'width': 108}, {'height': 407, 'url': 'https://preview.redd.it/5mo74600aue91.jpg?width=216&amp;crop=smart&amp;auto=webp&amp;s=af62a179f92c3f8b62e72beeea15f279623abb02', 'width': 216}, {'height': 603, 'url': 'https://preview.redd.it/5mo74600aue91.jpg?width=320&amp;crop=smart&amp;auto=webp&amp;s=5db1895d607b44c8d9b6d7186462f170d798cdb3', 'width': 320}, {'height': 1207, 'url': 'https://preview.redd.it/5mo74600aue91.jpg?width=640&amp;crop=smart&amp;auto=webp&amp;s=4e88b4684ec5e601710d7ab5727d0b2b18c831eb', 'width': 640}, {'height': 1811, 'url': 'https://preview.redd.it/5mo74600aue91.jpg?width=960&amp;crop=smart&amp;auto=webp&amp;s=ff7791685274843eda592b806410a368a9fd9c71', 'width': 960}], 'source': {'height': 2017, 'url': 'https://preview.redd.it/5mo74600aue91.jpg?auto=webp&amp;s=1c7d5c5f836d94739ba363af92a5d23c446231bc', 'width': 1069}, 'variants': {}}]}	140.0	140.0	https://i.redd.it/5mo74600aue91.jpg															"Who else has played the Chipotle ""Buy the dip"" game hoping to win BTC only to get gauc for a penny?
"											
9	[]	False	rBitcoinMod		[]		text	t2_tcsf5	False	False	True	[]	False	False	1659244114	self.Bitcoin	https://www.reddit.com/r/Bitcoin/comments/wcgtxw/daily_discussion_july_31_2022/	{}	wcgtxw	False	True	False	False	False	True	True	False		[]	dark	text	False	False	True	0	0	False	all_ads	/r/Bitcoin/comments/wcgtxw/daily_discussion_july_31_2022/	False	6		1659244125	1	"Please utilize this sticky thread for all general **Bitcoin** discussions! If you see posts on the front page or /r/Bitcoin/new which are better suited for this daily discussion thread, please help out by directing the OP to this thread instead. Thank you!

If you don't get an answer to your question, you can try phrasing it differently or commenting again tomorrow.

[Join us in the r/Bitcoin Chatroom!](https://discord.gg/K5H25KZHke)

Please check the [previous discussion thread](https://www.reddit.com/r/Bitcoin/comments/wbpfij/daily_discussion_july_30_2022/) for unanswered questions."	False	False	True	Bitcoin	t5_2s3qj	4442863	public	self	Daily Discussion, July 31, 2022	0	[]	1.0	https://www.reddit.com/r/Bitcoin/comments/wcgtxw/daily_discussion_july_31_2022/	all_ads	6	self	{'enabled': False, 'images': [{'id': 'lYwglxd3tdv2fJaqc5dzb65ea-rCrm9tNLdtD4kabXU', 'resolutions': [{'height': 108, 'url': 'https://external-preview.redd.it/QFU0SFOOGP_UgAQk5QbD-eXX3gdcpQ7zMb3VJyMD68o.jpg?width=108&amp;crop=smart&amp;auto=webp&amp;s=4298907b0a9979110fbca6d4d2d491531f32cd54', 'width': 108}, {'height': 216, 'url': 'https://external-preview.redd.it/QFU0SFOOGP_UgAQk5QbD-eXX3gdcpQ7zMb3VJyMD68o.jpg?width=216&amp;crop=smart&amp;auto=webp&amp;s=9324a6830563e93eb4e2cfdb415d7fdcd7707c8e', 'width': 216}], 'source': {'height': 253, 'url': 'https://external-preview.redd.it/QFU0SFOOGP_UgAQk5QbD-eXX3gdcpQ7zMb3VJyMD68o.jpg?auto=webp&amp;s=e2d1ed9cb6ef84017e1440a923ded9c803a79c63', 'width': 253}, 'variants': {}}]}							moderator	new										"Daily Discussion, July 31, 2022
Please utilize this sticky thread for all general **Bitcoin** discussions! If you see posts on the front page or /r/Bitcoin/new which are better suited for this daily discussion thread, please help out by directing the OP to this thread instead. Thank you!

If you don't get an answer to your question, you can try phrasing it differently or commenting again tomorrow.

[Join us in the r/Bitcoin Chatroom!](https://discord.gg/K5H25KZHke)

Please check the [previous discussion thread](https://www.reddit.com/r/Bitcoin/comments/wbpfij/daily_discussion_july_30_2022/) for unanswered questions."											
10	[]	False	HardBlock_Justin		[]		text	t2_g41q5epb	False	False	False	[]	False	False	1659242561	self.Bitcoin	https://www.reddit.com/r/Bitcoin/comments/wcgdqb/bitcoin_public_key_to_receiving_address_calculator/	{}	wcgdqb	False	True	False	False	False	True	True	False		[]	dark	text	False	False	True	0	0	False	all_ads	/r/Bitcoin/comments/wcgdqb/bitcoin_public_key_to_receiving_address_calculator/	False	6		1659242572	1	"I recently developed a website for calculating standard bitcoin receiving addresses from a child public key: [https://mission-bitcoin.github.io/bitcoin-public-key-to-receiving-address-calculator/](https://mission-bitcoin.github.io/bitcoin-public-key-to-receiving-address-calculator/)

I thought I'd share it in case anyone finds it useful, especially as I haven't come across another website or tool which lets you do this easily (eg, most wallet/address calculators start by having you generate or input your seed words or a private key (or an extended public key), rather than starting from the child public key).

The main use for this tool would be to demonstrate 'likely' ownership during an audit in which you'd rather not provide your private key, extended public key, nor a message signed by the private key. That might sound odd, but I was in such a scenario recently (for a self-managed superannuation fund audit).

You can check the website and the Github page to see a more comprehensive description of the tool, as well as some other resources that might help to understand and use it.

Feedback or suggestions welcome! It's open source too, so feel free to modify it however you want."	True	False	False	Bitcoin	t5_2s3qj	4442815	public	self	Bitcoin Public Key to Receiving Address 'Calculator'	0	[]	1.0	https://www.reddit.com/r/Bitcoin/comments/wcgdqb/bitcoin_public_key_to_receiving_address_calculator/	all_ads	6																				"Bitcoin Public Key to Receiving Address 'Calculator'
I recently developed a website for calculating standard bitcoin receiving addresses from a child public key: [https://mission-bitcoin.github.io/bitcoin-public-key-to-receiving-address-calculator/](https://mission-bitcoin.github.io/bitcoin-public-key-to-receiving-address-calculator/)

I thought I'd share it in case anyone finds it useful, especially as I haven't come across another website or tool which lets you do this easily (eg, most wallet/address calculators start by having you generate or input your seed words or a private key (or an extended public key), rather than starting from the child public key).

The main use for this tool would be to demonstrate 'likely' ownership during an audit in which you'd rather not provide your private key, extended public key, nor a message signed by the private key. That might sound odd, but I was in such a scenario recently (for a self-managed superannuation fund audit).

You can check the website and the Github page to see a more comprehensive description of the tool, as well as some other resources that might help to understand and use it.

Feedback or suggestions welcome! It's open source too, so feel free to modify it however you want."											
11	[]	False	caglebagle		[]		text	t2_7jbab	False	False	False	[]	False	False	1659242537	self.Bitcoin	https://www.reddit.com/r/Bitcoin/comments/wcgdho/from_purchase_with_a_us_bank_account_to/	{}	wcgdho	False	True	False	False	False	True	True	False		[]	dark	text	False	False	False	0	0	False	all_ads	/r/Bitcoin/comments/wcgdho/from_purchase_with_a_us_bank_account_to/	False	6		1659242548	1		True	False	False	Bitcoin	t5_2s3qj	4442815	public	self	From purchase with a US bank account to withdrawal to a BTC wallet, which exchange is the fastest? Must be under 1% fee.	0	[]	1.0	https://www.reddit.com/r/Bitcoin/comments/wcgdho/from_purchase_with_a_us_bank_account_to/	all_ads	6																				"From purchase with a US bank account to withdrawal to a BTC wallet, which exchange is the fastest? Must be under 1% fee.
"											
12	[]	False	mindgame		[]		text	t2_3889u	False	False	False	[]	False	False	1659242384	youtube.com	https://www.reddit.com/r/Bitcoin/comments/wcgbwf/richard_hammond_meets_the_man_that_threw_away_250/	{}	wcgbwf	False	True	False	False	False	True	False	False		[]	dark	text	False	False	True	0	0	False	all_ads	/r/Bitcoin/comments/wcgbwf/richard_hammond_meets_the_man_that_threw_away_250/	False	6		1659242395	1		True	False	False	Bitcoin	t5_2s3qj	4442810	public	https://b.thumbs.redditmedia.com/txTgS_AjjDXBYRLtt-ehDdkRuFGQ2NwNNYpZ7HKGF9E.jpg	Richard Hammond meets the man that threw away $250 MILLION into a landfill	0	[]	1.0	https://www.youtube.com/watch?v=cZr97E5PgzQ	all_ads	6	rich:video	{'enabled': False, 'images': [{'id': '9Q_cvCrx1Pf5JzMGV-WeGAvZNLz_18M3SEvTpY0FCvE', 'resolutions': [{'height': 81, 'url': 'https://external-preview.redd.it/4qoO2wDBv6IFudbtPac8YwFhKuxOGoFHfSdQcPeTCdo.jpg?width=108&amp;crop=smart&amp;auto=webp&amp;s=3a7912e83d0caaddd5cc65f5411f27aab8ce92b5', 'width': 108}, {'height': 162, 'url': 'https://external-preview.redd.it/4qoO2wDBv6IFudbtPac8YwFhKuxOGoFHfSdQcPeTCdo.jpg?width=216&amp;crop=smart&amp;auto=webp&amp;s=972f44d3edc2ecbefede553ef88e291d2eb10d54', 'width': 216}, {'height': 240, 'url': 'https://external-preview.redd.it/4qoO2wDBv6IFudbtPac8YwFhKuxOGoFHfSdQcPeTCdo.jpg?width=320&amp;crop=smart&amp;auto=webp&amp;s=342f39d3167e90b276d11c4a4362ee34ba5df3d7', 'width': 320}], 'source': {'height': 360, 'url': 'https://external-preview.redd.it/4qoO2wDBv6IFudbtPac8YwFhKuxOGoFHfSdQcPeTCdo.jpg?auto=webp&amp;s=146c347167082d0132841057fa9cd1e11f59ae0f', 'width': 480}, 'variants': {}}]}	105.0	140.0	https://www.youtube.com/watch?v=cZr97E5PgzQ						"{'oembed': {'author_name': 'What Next? ', 'author_url': 'https://www.youtube.com/c/WhatNextVids', 'height': 200, 'html': '&lt;iframe width=""356"" height=""200"" src=""https://www.youtube.com/embed/cZr97E5PgzQ?feature=oembed&amp;enablejsapi=1"" frameborder=""0"" allow=""accelerometer; autoplay; clipboard-write; encrypted-media; gyroscope; picture-in-picture"" allowfullscreen title=""Richard Hammond meets the man that threw away $250 MILLION into a landfill!""&gt;&lt;/iframe&gt;', 'provider_name': 'YouTube', 'provider_url': 'https://www.youtube.com/', 'thumbnail_height': 360, 'thumbnail_url': 'https://i.ytimg.com/vi/cZr97E5PgzQ/hqdefault.jpg', 'thumbnail_width': 480, 'title': 'Richard Hammond meets the man that threw away $250 MILLION into a landfill!', 'type': 'video', 'version': '1.0', 'width': 356}, 'type': 'youtube.com'}"	"{'content': '&lt;iframe width=""356"" height=""200"" src=""https://www.youtube.com/embed/cZr97E5PgzQ?feature=oembed&amp;enablejsapi=1"" frameborder=""0"" allow=""accelerometer; autoplay; clipboard-write; encrypted-media; gyroscope; picture-in-picture"" allowfullscreen title=""Richard Hammond meets the man that threw away $250 MILLION into a landfill!""&gt;&lt;/iframe&gt;', 'height': 200, 'scrolling': False, 'width': 356}"	"{'oembed': {'author_name': 'What Next? ', 'author_url': 'https://www.youtube.com/c/WhatNextVids', 'height': 200, 'html': '&lt;iframe width=""356"" height=""200"" src=""https://www.youtube.com/embed/cZr97E5PgzQ?feature=oembed&amp;enablejsapi=1"" frameborder=""0"" allow=""accelerometer; autoplay; clipboard-write; encrypted-media; gyroscope; picture-in-picture"" allowfullscreen title=""Richard Hammond meets the man that threw away $250 MILLION into a landfill!""&gt;&lt;/iframe&gt;', 'provider_name': 'YouTube', 'provider_url': 'https://www.youtube.com/', 'thumbnail_height': 360, 'thumbnail_url': 'https://i.ytimg.com/vi/cZr97E5PgzQ/hqdefault.jpg', 'thumbnail_width': 480, 'title': 'Richard Hammond meets the man that threw away $250 MILLION into a landfill!', 'type': 'video', 'version': '1.0', 'width': 356}, 'type': 'youtube.com'}"	"{'content': '&lt;iframe width=""356"" height=""200"" src=""https://www.youtube.com/embed/cZr97E5PgzQ?feature=oembed&amp;enablejsapi=1"" frameborder=""0"" allow=""accelerometer; autoplay; clipboard-write; encrypted-media; gyroscope; picture-in-picture"" allowfullscreen title=""Richard Hammond meets the man that threw away $250 MILLION into a landfill!""&gt;&lt;/iframe&gt;', 'height': 200, 'media_domain_url': 'https://www.redditmedia.com/mediaembed/wcgbwf', 'scrolling': False, 'width': 356}"						"Richard Hammond meets the man that threw away $250 MILLION into a landfill
"											
