Unnamed: 0	all_awardings	archived	associated_award	author	author_flair_background_color	author_flair_css_class	author_flair_richtext	author_flair_template_id	author_flair_text	author_flair_text_color	author_flair_type	author_fullname	author_patreon_flair	author_premium	body	body_sha1	can_gild	collapsed	collapsed_because_crowd_control	collapsed_reason	collapsed_reason_code	comment_type	controversiality	created_utc	distinguished	gilded	gildings	id	is_submitter	link_id	locked	no_follow	parent_id	permalink	retrieved_utc	score	score_hidden	send_replies	stickied	subreddit	subreddit_id	subreddit_name_prefixed	subreddit_type	top_awarded_type	total_awards_received	treatment_tags	unrepliable_reason	author_cakeday	corpus	support	knowledge	conflict	power	similarity	fun	status	trust	identity	romance
49	[]	False		predawnretrospective		noob	[{'e': 'text', 't': 'redditor for 3 weeks'}]	2ec8e69e-6c36-11e9-a04b-0afb553d4ea6	redditor for 3 weeks	dark	richtext	t2_endce11z	False	False	⚽️ 🏀 🏈	ed712e3ba32924b379c9431cacf989a2bfab25c7	True	False					0	1661052084		0	{}	il5ee9d	True	t3_wsz7jj	False	True	t1_il590yg	/r/Bitcoin/comments/wsz7jj/has_anybody_seen_the_youtube_channel_called/il5ee9d/	1661052096	1	True	True	False	Bitcoin	t5_2s3qj	r/Bitcoin	public		0	[]													
50	[]	False		hermannklaus			[]				text	t2_eifra5iu	False	False	Time to move to Nigeria, I want a Bitcoin payment culture	0c03926c6f80e1b157f7a02ab9e5033c19e0e935	True	False					0	1661052058		0	{}	il5ecet	False	t3_wsrdp8	False	True	t1_il1gziv	/r/Bitcoin/comments/wsrdp8/we_need_merchant_adoption_so_we_dont_have_to_sell/il5ecet/	1661052069	1	True	True	False	Bitcoin	t5_2s3qj	r/Bitcoin	public		0	[]													
51	[]	False		[deleted]						dark					[removed]	fe993932d6dced4c0a879e9aa5d7a6e0fbb467f5	True	False					0	1661052039		0	{}	il5eb3g	False	t3_wssuhl	False	True	t1_il14vlw	/r/Bitcoin/comments/wssuhl/i_wonder_what_these_are_for/il5eb3g/	1661052051	1	True	True	False	Bitcoin	t5_2s3qj	r/Bitcoin	public		0	[]													
52	[]	False		SleepCom			[]				text	t2_2h98l6um	False	False	But only if the loser can pay.	9d2e2825d9418aad73d90b2f5f961cf33f1a6769	True	False					0	1661052006		0	{}	il5e8o3	False	t3_ws8wfd	False	True	t1_il528sj	/r/Bitcoin/comments/ws8wfd/starting_september_12th_in_oslo_norway_hodlonaut/il5e8o3/	1661052020	1	True	True	False	Bitcoin	t5_2s3qj	r/Bitcoin	public		0	[]													
53	[]	False		dindbrbfb			[]				text	t2_8738126f	False	False	"I appreciate the quick response. When my time comes, I mage DM you for any sort of questions if I run into problems (: 

That Beelink Mini S with a TB SSD sounds like a nice and easy way to get a node running. Using a Trezor to verifying transactions would be very helpful too"	a45d41f6c22ef2720f9024a93cc8f1848fa997f3	True	False					0	1661051933		0	{}	il5e3hg	False	t3_wt8cx2	False	True	t1_il59ups	/r/Bitcoin/comments/wt8cx2/while_all_the_fud_is_going_on_i_have_decided_to/il5e3hg/	1661051944	1	True	True	False	Bitcoin	t5_2s3qj	r/Bitcoin	public		0	[]													
54	[]	False		redditisgarbage911			[]			dark	text	t2_g3ohq6dy	False	False	Fair	64b985898db9aeee04705b1010ea6d50df966aea	True	False					0	1661051914		0	{}	il5e28x	False	t3_wt3dg5	False	True	t1_il2z3mz	/r/Bitcoin/comments/wt3dg5/teaching_in_the_school/il5e28x/	1661051925	1	True	True	False	Bitcoin	t5_2s3qj	r/Bitcoin	public		0	[]													
55	[]	False		joaonaves			[]				text	t2_id4v6mvy	False	False	I hate cash, i always turn them into cryptocurrency by buying Bitcoin	c7c719a849e6e1713b6b489894c705d7a4c0f1b9	True	False					0	1661051903		0	{}	il5e1hm	False	t3_wsrdp8	False	True	t1_il207k3	/r/Bitcoin/comments/wsrdp8/we_need_merchant_adoption_so_we_dont_have_to_sell/il5e1hm/	1661051915	1	True	True	False	Bitcoin	t5_2s3qj	r/Bitcoin	public		0	[]													
56	[]	False		HarmonyFlame			[]				text	t2_9gfcs	False	False	No. Bitcoin does 6-7x tht in transactions PER DAY.	4aa3ee54c8a4c95c8d8b6bf142b5386a63e5610d	True	False					0	1661051852		0	{}	il5dy0o	False	t3_wtkxgi	False	True	t3_wtkxgi	/r/Bitcoin/comments/wtkxgi/any_thoughts_on_the_mtgox_situation_do_u_guys/il5dy0o/	1661051863	1	True	True	False	Bitcoin	t5_2s3qj	r/Bitcoin	public		0	[]													
57	[]	False		arbalest_22			[]				text	t2_42pt37zs	False	False	Aww yes, the Chinese spyware Trojan horse social media platform.	9a928835aa335e3838e54ab64a37ee2fdcb4fda9	True	False					0	1661051850		0	{}	il5dxwb	False	t3_wtkxgi	False	True	t1_il55cpn	/r/Bitcoin/comments/wtkxgi/any_thoughts_on_the_mtgox_situation_do_u_guys/il5dxwb/	1661051863	1	True	True	False	Bitcoin	t5_2s3qj	r/Bitcoin	public		0	[]													
58	[]	False		[deleted]						dark					[removed]	fe993932d6dced4c0a879e9aa5d7a6e0fbb467f5	True	False					0	1661051850		0	{}	il5dxv9	False	t3_wtkxgi	False	True	t3_wtkxgi	/r/Bitcoin/comments/wtkxgi/any_thoughts_on_the_mtgox_situation_do_u_guys/il5dxv9/	1661051863	1	True	True	False	Bitcoin	t5_2s3qj	r/Bitcoin	public		0	[]													
59	[]	False		stonksfernothin			[]			dark	text	t2_a1rzkxwb	False	False	Adopting and being forced into something are two different things	fb6abf09eb629547d3285d6a96031dab46026dde	True	False					0	1661051786		0	{}	il5dti3	False	t3_wt2l6a	False	True	t1_il1tc8l	/r/Bitcoin/comments/wt2l6a/war_on_bitcoin_china_hates_bitcoin_not_surprising/il5dti3/	1661051797	1	True	True	False	Bitcoin	t5_2s3qj	r/Bitcoin	public		0	[]													
60	[]	False		arbalest_22			[]				text	t2_42pt37zs	False	False	And now he’s publicly quit.	9313be0d8064c8c6591e705b066ca3083c7ff5de	True	False					0	1661051773		0	{}	il5dsni	False	t3_wtkxgi	False	True	t1_il53i5f	/r/Bitcoin/comments/wtkxgi/any_thoughts_on_the_mtgox_situation_do_u_guys/il5dsni/	1661051787	1	True	True	False	Bitcoin	t5_2s3qj	r/Bitcoin	public		0	[]													
61	[]	False		Jambi1488			[]				text	t2_5ulilkgy	False	False	"I hate coinbase. I think their products/services and company in general are just straight trash.

Kraken on the other hand, I love kraken as much as I hate coinbase."	eafb96bae51c6bed7a1af9484863355a577c78ec	True	False					0	1661051662		0	{}	il5dl96	False	t3_wtny8s	False	True	t3_wtny8s	/r/Bitcoin/comments/wtny8s/large_purchase/il5dl96/	1661051673	1	True	True	False	Bitcoin	t5_2s3qj	r/Bitcoin	public		0	[]													
62	[]	False		rBitcoinMod			[]				text	t2_tcsf5	False	False	"Your submission has been flagged for removal because it is considered off topic for the Bitcoin subreddit.

^^I ^^am ^^a ^^bot ^^and ^^cannot ^^respond. ^^Please ^^contact ^^r/Bitcoin ^^moderators [^^directly ^^via ^^mod ^^mail](https://www.reddit.com/message/compose?to=%2Fr%2FBitcoin) ^^if ^^you ^^have ^^questions."	3ba714eb30fd78d354769e5288e68861c7ff12f7	True	False					0	1661051542	moderator	0	{}	il5dd1g	False	t3_wtnpz8	False	True	t3_wtnpz8	/r/Bitcoin/comments/wtnpz8/blockchain_understanding_iso_20022/il5dd1g/	1661051552	1	True	True	True	Bitcoin	t5_2s3qj	r/Bitcoin	public		0	[]													
63	[]	False		3justincredible			[]				text	t2_13wys4	False	False	Use strike. Btc only company. Zero fees. Instant withdrawal.	63a5086e8a29c06ec7a16b5140ee7e36f4aca272	True	False					0	1661051488		0	{}	il5d9cy	False	t3_wth6dl	False	True	t1_il55gs5	/r/Bitcoin/comments/wth6dl/buy_the_dip/il5d9cy/	1661051500	1	True	True	False	Bitcoin	t5_2s3qj	r/Bitcoin	public		0	[]													
64	[]	False		Nada_Lives			[]				text	t2_4yjkrfk	False	False	"
Blockchain. Crypto. Two words that clue you in that redditor for 4 days is not posting about Bitcoin.

And I have some bad news for all the ISO 20022 fiat fans out there. Less than five years from now, Bitcoin will be the world's settlement base, not SWIFT."	7ae22934fb578e0183e1e9aad17586e467396bc2	True	False					0	1661051462		0	{}	il5d7kf	False	t3_wtnpz8	False	True	t3_wtnpz8	/r/Bitcoin/comments/wtnpz8/blockchain_understanding_iso_20022/il5d7kf/	1661051473	1	True	True	False	Bitcoin	t5_2s3qj	r/Bitcoin	public		0	[]													
65	[]	False		mrxu54321			[]				text	t2_hmzofdnw	False	False	No problems dude, I'm sure people will help it out in this cause.	ccf171e0368436d0d40b8157ca4b815854bdab77	True	False					0	1661051455		0	{}	il5d74w	False	t3_wt7uru	False	True	t1_il3zg1i	/r/Bitcoin/comments/wt7uru/this_answer_from_greg_maxwell_deserves_its_own/il5d74w/	1661051469	1	True	True	False	Bitcoin	t5_2s3qj	r/Bitcoin	public		0	[]													
66	[]	False		RealSHELS			[]				text	t2_iihatlhp	False	False	"I never sold any BTC till now, and I dont feel to sell my BTC, they look really good in my wallet !

Selling BTC would surely gonna make me so depressed, and thus, never think of selling this great coin"	04172e721b636ca87fe43a7fe15f985b35098e40	True	False					0	1661051424		0	{}	il5d507	False	t3_wsrdp8	False	True	t3_wsrdp8	/r/Bitcoin/comments/wsrdp8/we_need_merchant_adoption_so_we_dont_have_to_sell/il5d507/	1661051435	1	True	True	False	Bitcoin	t5_2s3qj	r/Bitcoin	public		0	[]													
67	[]	False		SpC0d3r			[]				text	t2_1rwpwi6x	False	False	ive been hearing end of the month for quite few years now	60059fe7dabbd5445c2d884d68bc51696f751a4b	True	False					0	1661051391		0	{}	il5d2rb	False	t3_wtkxgi	False	True	t1_il4xe22	/r/Bitcoin/comments/wtkxgi/any_thoughts_on_the_mtgox_situation_do_u_guys/il5d2rb/	1661051405	1	True	True	False	Bitcoin	t5_2s3qj	r/Bitcoin	public		0	[]													
68	[]	False		Moji_Motomoe76		noob	[{'e': 'text', 't': 'redditor for 1 week'}]	2ec8e69e-6c36-11e9-a04b-0afb553d4ea6	redditor for 1 week	dark	richtext	t2_r2ft7p76	False	False	How can ?	0681cf9a75fab30126400b137d2907f925046f6e	True	False					0	1661051390		0	{}	il5d2oy	False	t3_wt8cx2	False	True	t3_wt8cx2	/r/Bitcoin/comments/wt8cx2/while_all_the_fud_is_going_on_i_have_decided_to/il5d2oy/	1661051405	1	True	True	False	Bitcoin	t5_2s3qj	r/Bitcoin	public		0	[]													
69	[]	False		nullc			[]				text	t2_1y2aw	False	True	"&gt; At this point, you are simply stupid if u think Satoshi is anyone other than Craig. These ungrateful children hijacked a great invention for profit then turn around attacking the father. History will not be kind to you lying pieces of shit

Lets see-- last time your account was active on Reddit it was May 2018 and you were promoting ""Elastos"" which was trading at $47 dollars. Today it trades at $1.87.  I hope you can forgive people here for not blindly trusting your judgement, especially since you've spared us any rational and slathered on the obscenities. 

How could you possibly believe that Mr. Wright had anything to do with the creation of Bitcoin?  At every turn he demonstrates total incompetency about the technology, he continually lies and fabricates over matters that no one can deny, particularly now that it's been noted by multiple courts across multiple continents.

Please help me understand how you could believe such an absurd thing."	a68d8f369995f4f25873ff5998836769fe9993b8	True	False					0	1661051376		0	{}	il5d1pi	False	t3_ws8wfd	False	True	t1_il5bic5	/r/Bitcoin/comments/ws8wfd/starting_september_12th_in_oslo_norway_hodlonaut/il5d1pi/	1661051388	1	True	True	False	Bitcoin	t5_2s3qj	r/Bitcoin	public		0	[]													
70	[]	False		ShittingOutPosts			[]				text	t2_10v91w	False	False	What private keys?	05cb85ff068e3a5397e11657fc9d58fd25c9bd08	True	False					0	1661051366		0	{}	il5d119	False	t3_wtdemh	False	True	t1_il4q1ok	/r/Bitcoin/comments/wtdemh/governments_trying_to_confiscate_bitcoin_would/il5d119/	1661051377	1	True	True	False	Bitcoin	t5_2s3qj	r/Bitcoin	public		0	[]													
71	[]	False		snowracer919			[]				text	t2_litrs2ln	False	False	Yep, only the riches can Hire the good lawyes so yeah.	2bd3ade8df897573f07bc875fa3be18b16e33879	True	False					0	1661051146		0	{}	il5clwa	False	t3_wt7uru	False	True	t1_il3rujl	/r/Bitcoin/comments/wt7uru/this_answer_from_greg_maxwell_deserves_its_own/il5clwa/	1661051159	1	True	True	False	Bitcoin	t5_2s3qj	r/Bitcoin	public		0	[]													
72	[]	False		midmagic			[]				text	t2_epwe3	False	False	You suck, Craig.	376a0b7f4ddf962c4457952ead3032acb34da17a	True	False					0	1661051056		0	{}	il5cfip	False	t3_ws8wfd	False	True	t1_il5bic5	/r/Bitcoin/comments/ws8wfd/starting_september_12th_in_oslo_norway_hodlonaut/il5cfip/	1661051072	1	True	True	False	Bitcoin	t5_2s3qj	r/Bitcoin	public		0	[]													
73	[]	False		savinelli_smoker			[]				text	t2_rcdiw	False	False	Many would say this is not cold storage. The key generation was done on a computer that had connected to the net, and will have to connect to the net again when signing a transaction.	14c7a378c80d8e58bba04e960103c9f81d30c32e	True	False					0	1661050923		0	{}	il5c6c6	False	t3_wtoazv	False	True	t3_wtoazv	/r/Bitcoin/comments/wtoazv/bitcoin_core_cold_storage/il5c6c6/	1661050937	1	True	True	False	Bitcoin	t5_2s3qj	r/Bitcoin	public		0	[]													
74	[]	False		ThothsGhost45			[]				text	t2_a332jsav	False	False	It’s buy the trip	d2ecbc2ea52eb0c56006d52919277da85a3b1cf6	True	False					0	1661050888		0	{}	il5c3wj	False	t3_wth6dl	False	True	t3_wth6dl	/r/Bitcoin/comments/wth6dl/buy_the_dip/il5c3wj/	1661050899	1	True	True	False	Bitcoin	t5_2s3qj	r/Bitcoin	public		0	[]													
75	[]	False		coinfeeds-bot			[]				text	t2_8ihxazi7	False	False	"tldr; The world of international payments is about to receive a major overhaul. By 2025, all financial institutions will have to process ISO 20022 compliant payments. The new standard, currently in an opt-in phase, will allow for open and transparent messaging between financial institutions around the globe.

*This summary is auto generated by a bot and not meant to replace reading the original article. As always, DYOR.*"	2aeec6465197743d752d496d06d61a05f2ebd42a	True	False					0	1661050826		0	{}	il5bzjr	False	t3_wtnpz8	False	True	t3_wtnpz8	/r/Bitcoin/comments/wtnpz8/blockchain_understanding_iso_20022/il5bzjr/	1661050837	1	True	True	False	Bitcoin	t5_2s3qj	r/Bitcoin	public		0	[]													
76	[]	False		life762			[]			dark	text	t2_ia8yuscn	False	False	"I guess ""cold storage"" can mean different things to different people. To me, it means the private key was never generated on nor typed into a general purpose computed, _any_ general purpose computer but especially computers that are or were or ever will be again connected to a network, esp. the internet.

So I wouldn't consider using Bitcoin core as ""cold storage"" unless used with a hardware wallet. Also, what you described seems like a hassle versus the easier and more secure best practice of using a hardware wallet.

By the way, the reason my definition of ""cold storage"" is so strict is because I know general purpose computers, even ""air-gapped"" computers, can be infected with rootkits. Remember Stuxnet that infected sensitive Iranian air-gapped networks about a decade ago? It was spread using USB devices."	3add374b7791319bb09568df586816e99a7d1085	True	False					0	1661050716		0	{}	il5brzp	False	t3_wtoazv	False	True	t3_wtoazv	/r/Bitcoin/comments/wtoazv/bitcoin_core_cold_storage/il5brzp/	1661050727	1	True	True	False	Bitcoin	t5_2s3qj	r/Bitcoin	public		0	[]													
77	[]	False		[deleted]						dark					[removed]	fe993932d6dced4c0a879e9aa5d7a6e0fbb467f5	True	False					0	1661050695		0	{}	il5bqkn	False	t3_wsrdp8	False	True	t1_il1thoi	/r/Bitcoin/comments/wsrdp8/we_need_merchant_adoption_so_we_dont_have_to_sell/il5bqkn/	1661050706	1	True	True	False	Bitcoin	t5_2s3qj	r/Bitcoin	public		0	[]													
78	[]	False		TheGreatMuffin			[]				text	t2_j5h9i	False	False	I don't mean automatically, I mean manually switching.	2b2137c2b38c7e37e58ddce7f805b469501e8714	True	False					0	1661050644		0	{}	il5bn5y	False	t3_wseezl	False	True	t1_il1zp39	/r/Bitcoin/comments/wseezl/understanding_censorship_resistance_in_pow/il5bn5y/	1661050654	1	True	True	False	Bitcoin	t5_2s3qj	r/Bitcoin	public		0	[]													
79	[]	False		tman6495			[]				text	t2_o1n9b	False	False	At this point, you are simply stupid if u think Satoshi is anyone other than Craig. These ungrateful children hijacked a great invention for profit then turn around attacking the father. History will not be kind to you lying pieces of shit	c09dcd6ed47dc49b20296ebc203627b54d883165	True	False					0	1661050576		0	{}	il5bic5	False	t3_ws8wfd	False	True	t1_ikxqxoo	/r/Bitcoin/comments/ws8wfd/starting_september_12th_in_oslo_norway_hodlonaut/il5bic5/	1661050590	1	True	True	False	Bitcoin	t5_2s3qj	r/Bitcoin	public		0	[]													
80	[]	False		tua79344			[]				text	t2_e3btey58	False	False	Fuck that dude, from where he gets his confidence anyways.	9f4845d32817653e87d6335f89de23d5bb810657	True	False					0	1661050548		0	{}	il5bge7	False	t3_wt7uru	False	True	t1_il2uwnm	/r/Bitcoin/comments/wt7uru/this_answer_from_greg_maxwell_deserves_its_own/il5bge7/	1661050559	1	True	True	False	Bitcoin	t5_2s3qj	r/Bitcoin	public		0	[]													
81	[]	False		austrolibertarian			[]				text	t2_nhhg6qc	False	False	Same place it gave the government power to confiscate gold. If you haven't noticed yet, the government is not restrained by the constitution in any meaningful way.	5aaa6c69b71d247da5fddfcc660ccfe7012721d3	True	False					0	1661050434		0	{}	il5b8g3	False	t3_wtdemh	False	True	t1_il4yror	/r/Bitcoin/comments/wtdemh/governments_trying_to_confiscate_bitcoin_would/il5b8g3/	1661050446	1	True	True	False	Bitcoin	t5_2s3qj	r/Bitcoin	public		0	[]													
82	[]	False		Grouchy_Artichoke_90			[]			dark	text	t2_kykwqive	False	False	"Chances are a lot of people haven't even heard of the pinephone. A lot of people are still very unaware of what tech can be used and what to do/how to do this stuff.

My advice would be to do a post about the pine, help people learn more."	d41dba886b965a8d48adba7e83c03f95238c56c5	True	False					0	1661050380		0	{}	il5b4oi	False	t3_wszvmn	False	True	t1_il5av1z	/r/Bitcoin/comments/wszvmn/what_a_cute_digital_picture_frame_where_did_you/il5b4oi/	1661050392	1	True	True	False	Bitcoin	t5_2s3qj	r/Bitcoin	public		0	[]													
83	[]	False		Rtbrosk			[]				text	t2_7i9xvv9q	False	False	Im sure he has no clue what large really is......because he is on reddit asking.....lol	07e1f5aac86e016ef6c98c08d13899c81dda594f	True	False					0	1661050294		0	{}	il5ayms	False	t3_wtny8s	False	True	t3_wtny8s	/r/Bitcoin/comments/wtny8s/large_purchase/il5ayms/	1661050306	1	True	True	False	Bitcoin	t5_2s3qj	r/Bitcoin	public		0	[]													
84	[]	False		gamercer			[]				text	t2_fnzdg	False	False	Yes. That is one of the original ways	6b9150c601a2bfd3bede2ad543eb5a7b29313680	True	False					0	1661050289		0	{}	il5ay82	False	t3_wtoazv	False	False	t3_wtoazv	/r/Bitcoin/comments/wtoazv/bitcoin_core_cold_storage/il5ay82/	1661050306	1	True	True	False	Bitcoin	t5_2s3qj	r/Bitcoin	public		0	[]													
85	[]	False		vaspopov			[]				text	t2_c26t8ioz	False	False	That would be one of the good things if this became the fucking reality in the future brother, we really want this to be true and I know this can be true in the future.	c6f27086b227e86563d46fdb22d36833dc02bd3b	True	False					0	1661050269		0	{}	il5awv4	False	t3_wsrdp8	False	True	t3_wsrdp8	/r/Bitcoin/comments/wsrdp8/we_need_merchant_adoption_so_we_dont_have_to_sell/il5awv4/	1661050283	1	True	True	False	Bitcoin	t5_2s3qj	r/Bitcoin	public		0	[]													
86	[]	False		alievr			[]				text	t2_j4t9zyfp	False	False	In South Africa, people are actually accepting btc in place of fiat, this change is needed	a68e4282745b0fbade7cc4c134a1c6be2496aedc	True	False					0	1661050256		0	{}	il5avwc	False	t3_wsrdp8	False	True	t1_il2kfg8	/r/Bitcoin/comments/wsrdp8/we_need_merchant_adoption_so_we_dont_have_to_sell/il5avwc/	1661050268	1	True	True	False	Bitcoin	t5_2s3qj	r/Bitcoin	public		0	[]													
87	[]	False		varikonniemi			[]				text	t2_5pv5t	False	False	my whole comment thread was something in comparison to what is pictured by OP. I'm just amazed people keep going for these raspberry pi:s and add external hard drives and mini LCD screens and sometimes even external battery UPS. When all that and more can be had for cheaper by using a pinephone.	e0f197329fd64b69924e6de649af186b435dc246	True	False					0	1661050245		0	{}	il5av1z	False	t3_wszvmn	False	True	t1_il5a01g	/r/Bitcoin/comments/wszvmn/what_a_cute_digital_picture_frame_where_did_you/il5av1z/	1661050260	1	True	True	False	Bitcoin	t5_2s3qj	r/Bitcoin	public		0	[]													
88	[]	False		vaxiann			[]				text	t2_15szqg	False	False	The only thing you should replace is the HDD with a 1 or 2TB SSD and you should be good to go.	57e8593c5b480c4820bf73eaf7674e5bf2d887b1	True	False					0	1661050179		0	{}	il5aq5v	False	t3_wtlhdi	False	True	t3_wtlhdi	/r/Bitcoin/comments/wtlhdi/bitcoin_full_node/il5aq5v/	1661050189	1	True	True	False	Bitcoin	t5_2s3qj	r/Bitcoin	public		0	[]													
89	[]	False		ThothsGhost45			[]				text	t2_a332jsav	False	False	It’s actually buy the trip	2eafcb1115fc0e064e2fb951304b62fc69afc755	True	False					0	1661050175		0	{}	il5aput	False	t3_wtkjg4	False	True	t3_wtkjg4	/r/Bitcoin/comments/wtkjg4/everyone_keeps_saying_buy_the_dip/il5aput/	1661050189	1	True	True	False	Bitcoin	t5_2s3qj	r/Bitcoin	public		0	[]													
90	[]	False		rtheiss			[]				text	t2_4m0x1x	False	False	I use coinbase and kraken, both solid.	4933ffdc56f8adda3611d06dc9a6b1c8570d25d3	True	False					0	1661050150		0	{}	il5ao0m	False	t3_wtny8s	False	True	t3_wtny8s	/r/Bitcoin/comments/wtny8s/large_purchase/il5ao0m/	1661050166	1	True	True	False	Bitcoin	t5_2s3qj	r/Bitcoin	public		0	[]													
91	[]	False		Grouchy_Artichoke_90			[]			dark	text	t2_kykwqive	False	False	Should probably advertise when the site actually loads	50085aff42504393e56d4f18a99a7d5f2fd1c9ff	True	False					0	1661050117		0	{}	il5alnj	False	t3_wtevnz	False	True	t3_wtevnz	/r/Bitcoin/comments/wtevnz/announcing_sat_battle_a_platform_100_powered_by/il5alnj/	1661050128	1	True	True	False	Bitcoin	t5_2s3qj	r/Bitcoin	public		0	[]													
92	[]	False		Nada_Lives			[]				text	t2_4yjkrfk	False	False	"I'm waiting for delivery of a similar machine. Planning to run myNode on VBox with plenty of power left for other VMs.

I like the paid version of myNode with Tor, so I can connect from anywhere."	2e9affc42b0143a7715a4dff82007ffd8a64bf71	True	False					0	1661050070		0	{}	il5ai9y	False	t3_wtnsc1	False	True	t3_wtnsc1	/r/Bitcoin/comments/wtnsc1/can_you_set_up_a_node_on_a_mini_pc_beelink_using/il5ai9y/	1661050083	1	True	True	False	Bitcoin	t5_2s3qj	r/Bitcoin	public		0	[]													
93	[]	False		TheGreatMuffin			[]				text	t2_j5h9i	False	False	"&gt; I think the point of using the old laptop is that in order to run the node you want it up 24/7. 

You don't have to run it 24/7. You can just start it whenever you need it, although then it'll need some time to sync back up, which can take quite a while depending on how long it was off and on your hardware."	8b666db25e41ab711d5b94bd9fb17f95e3853f36	True	False					0	1661050058		0	{}	il5ahen	False	t3_wt8cx2	False	True	t1_il4g07s	/r/Bitcoin/comments/wt8cx2/while_all_the_fud_is_going_on_i_have_decided_to/il5ahen/	1661050076	1	True	True	False	Bitcoin	t5_2s3qj	r/Bitcoin	public		0	[]													
94	[]	False		vaxiann			[]				text	t2_15szqg	False	False	"Well yeah, but the thing is you are looking at the whole thing in hindsight, not everyone who got into bitcoin back in the early days knew what or if anything would come of it. Just imagine if you mined 50K bitcoins back in 2010, which was basically as easy as just let your PC mine in the background. Suddenly bitcoin is worth $1 and you've made $50K out of nothing almost. It would be very tempting to sell because you didn't know if it would continue to grow or go back to $0. All the FUD there is today it's nothing compared to how it was back in the day. 

Heck I remember back in like 2012-2013, I bought like 10.20 bitcoins at around $13 and sold 10 at around $200 thinking I just hit the jackpot. I just left the 0.20 bitcoins there and eventually forgot about them. I only remembered about them when bitcoin hit like $40K but was not able to recover them. The irony was that at that point the 0.20 btc ""change"" was worth much more than the profit I got from selling the 10 btc...truth is, shit happens, no point beating yourself over it, but at least learn a lesson. Today I wouldn't sell more than 5% of my bitcoins even if it hit $1M."	9f043e3b700c7f2ba5d3e1959d54dbdbae3cc1e2	True	False					0	1661050049		0	{}	il5agrf	False	t3_wt39sv	False	True	t1_il24q9r	/r/Bitcoin/comments/wt39sv/i_wish_i_had_kept_my_1700_btc_006_instead_of/il5agrf/	1661050061	1	True	True	False	Bitcoin	t5_2s3qj	r/Bitcoin	public		0	[]													
95	[]	False		Userisnowhere			[]				text	t2_5d7f3dij	False	False	Consider using Coinbase advanced trading (desktop version).  Same fees as Coinbase pro with instant withdrawals!	4ba0f1e2ff4b307663624c2c729f7f9779420c42	True	False					0	1661050001		0	{}	il5ade0	False	t3_wtny8s	False	True	t3_wtny8s	/r/Bitcoin/comments/wtny8s/large_purchase/il5ade0/	1661050016	1	True	True	False	Bitcoin	t5_2s3qj	r/Bitcoin	public		0	[]													
96	[]	False		Federal-Smell-4050			[]				text	t2_7thng212	False	False	Maybe not today, maybe not tomorrow	5d3600855a15223df0a965c83c5250ea20cc81a0	True	False					0	1661050001		0	{}	il5addw	False	t3_wtkxgi	False	True	t1_il4xe22	/r/Bitcoin/comments/wtkxgi/any_thoughts_on_the_mtgox_situation_do_u_guys/il5addw/	1661050016	1	True	True	False	Bitcoin	t5_2s3qj	r/Bitcoin	public		0	[]													
97	[]	False		Yavuz_Selim			[]				text	t2_qhzkq	False	False	"You need 1 of these:

- Private key. These are random characters, 51 or 52 characters long, starts with 5, L or K.

- Wallet file, almost always `wallet.dat`.

- Recovery phrase. 12, 18 or 24 English words.

&amp;nbsp;

If you have any of these, you should be able to access the coins."	8a93fe5e02f1347f547c1f69a73b007529e231e7	True	False					0	1661049951		0	{}	il5a9tc	False	t3_wsyw0n	False	True	t3_wsyw0n	/r/Bitcoin/comments/wsyw0n/hello_i_found_my_bitcoin_miner_wallet_from_2016/il5a9tc/	1661049969	1	True	True	False	Bitcoin	t5_2s3qj	r/Bitcoin	public		0	[]													
