Unnamed: 0	all_awardings	associated_award	author	author_flair_background_color	author_flair_css_class	author_flair_richtext	author_flair_template_id	author_flair_text	author_flair_text_color	author_flair_type	author_fullname	author_patreon_flair	author_premium	awarders	body	collapsed_because_crowd_control	collapsed_reason_code	comment_type	created_utc	gildings	id	is_submitter	link_id	locked	no_follow	parent_id	permalink	retrieved_on	score	send_replies	stickied	subreddit	subreddit_id	top_awarded_type	total_awards_received	treatment_tags	unrepliable_reason	archived	body_sha1	can_gild	collapsed	collapsed_reason	controversiality	distinguished	gilded	retrieved_utc	score_hidden	subreddit_name_prefixed	subreddit_type	author_cakeday	corpus	support	knowledge	conflict	power	similarity	fun	status	trust	identity	romance
0	[]		LuKeNuKuM			[]				text	t2_3f9oh	False	False	[]	Definitely can't with Paypal. A lot of folks will do this as it's such an easy way in... But then you're stuck. Starting with coinbase and setting up your own wallet teaches you a lot. From there you can progress to coinbase pro and some cold storage. But I agree, it's a bit of a faff of you're not relatively technical.				1645257618	{}	hxjzu00	False	t3_sw21sn	False	False	t1_hxjxe6h	/r/Bitcoin/comments/sw21sn/daily_discussion_february_19_2022/hxjzu00/	1650120396.0	3	True	False	Bitcoin	t5_2s3qj		0	[]																									
1	[]		BashCo			[]				text	t2_d7sse	False	True	[]	... because Marty is in a drug induced trance?				1645257594	{}	hxjzsuw	False	t3_svyln5	False	False	t1_hxjqpze	/r/Bitcoin/comments/svyln5/marty_bent_on_tucker_carlson_tonight_gives_a/hxjzsuw/	1650120277.0	3	True	False	Bitcoin	t5_2s3qj		0	[]																									
2	[]		ElephantsAreHeavy			[]				text	t2_13e7j7	False	False	[]	You typically buy from exchanges and transfer it to your hardware wallet.				1645257528	{}	hxjzpua	False	t3_svhxo9	False	True	t1_hxibole	/r/Bitcoin/comments/svhxo9/ceo_of_kraken_if_you_store_your_bitcoin_in_an/hxjzpua/	1650119982.0	2	True	False	Bitcoin	t5_2s3qj		0	[]																									
3	[]		blumma1312			[]				text	t2_9ufbi	False	False	[]	"Show here some nice graphs of BTC over the last few years and gold as well

If she keep on going with complaining then tell her she should spend her part for DCA‘ing in gold and you will spend in BTC

Both worlds are covered 
No stress 

In worst case spend half of your existing BTC amount in gold as well"				1645257528	{}	hxjzptm	False	t3_svrdlr	False	True	t3_svrdlr	/r/Bitcoin/comments/svrdlr/wife_wants_me_to_stop_dcaing_and_sell_all_my/hxjzptm/	1650119980.0	1	True	False	Bitcoin	t5_2s3qj		0	[]																									
4	[]		Smok_eater			[]				text	t2_570qqhrx	False	False	[]	He explained that like hot garbage				1645257527	{}	hxjzprq	False	t3_svyln5	False	True	t3_svyln5	/r/Bitcoin/comments/svyln5/marty_bent_on_tucker_carlson_tonight_gives_a/hxjzprq/	1650119975.0	-1	True	False	Bitcoin	t5_2s3qj		0	[]																									
5	[]		Ahoomanbeanzz			[]			dark	text	t2_c5p2ftym	False	False		How do TIPS work?				1645257496	{}	hxjzobd	True	t3_sw1zj1	False	True	t1_hxjze4m	/r/Bitcoin/comments/sw1zj1/should_i_invest_everything_into_bitcoin_and/hxjzobd/		1	True	False	Bitcoin	t5_2s3qj		0	[]		False	a39c48bfd21dcbd73e190a07adc82615e9508465	True	False		0.0		0.0	1645257509.0	True	r/Bitcoin	public												
6	[]		ElephantsAreHeavy			[]				text	t2_13e7j7	False	False	[]	I personally prefer the ledger, but I use all three.				1645257475	{}	hxjzna2	False	t3_svhxo9	False	True	t1_hxiapnm	/r/Bitcoin/comments/svhxo9/ceo_of_kraken_if_you_store_your_bitcoin_in_an/hxjzna2/	1650119724.0	1	True	False	Bitcoin	t5_2s3qj		0	[]																									
7	[]		BashCo			[]				text	t2_d7sse	False	True	[]	Bitcoin doesn't care about left vs right. However it does impact the authoritarian vs libertarian landscape.				1645257469	{}	hxjzn0c	False	t3_svyln5	False	False	t1_hxj71zz	/r/Bitcoin/comments/svyln5/marty_bent_on_tucker_carlson_tonight_gives_a/hxjzn0c/	1650119697.0	8	True	False	Bitcoin	t5_2s3qj		0	[]																									
8	[]		timbulance			[]				text	t2_5pikd7nh	False	False	[]	I’ll be satisfied if they buy 900 a day at current price.				1645257456	{}	hxjzmdx	False	t3_sw21sn	False	False	t1_hxjz6ir	/r/Bitcoin/comments/sw21sn/daily_discussion_february_19_2022/hxjzmdx/	1650119635.0	3	True	False	Bitcoin	t5_2s3qj		0	[]																									
9	[]		ILikePracticalGifts			[]				text	t2_dk6f6zaa	False	False	[]	🤦‍♂️				1645257437	{}	hxjzlg9	False	t3_suy6ir	False	False	t1_hxdah9b	/r/Bitcoin/comments/suy6ir/charlie_munger_is_dried_up_he_is_clueless_and/hxjzlg9/	1650119545.0	1	True	False	Bitcoin	t5_2s3qj		0	[]																									
10	[]		ElephantsAreHeavy			[]				text	t2_13e7j7	False	False	[]	No, a password allows you access to the private key stored in the hardware wallet. The key never leave the wallet. Transactions are signed on the wallet before being sent out.				1645257428	{}	hxjzkzu	False	t3_svhxo9	False	True	t1_hxi6b8k	/r/Bitcoin/comments/svhxo9/ceo_of_kraken_if_you_store_your_bitcoin_in_an/hxjzkzu/	1650119500.0	1	True	False	Bitcoin	t5_2s3qj		0	[]																									
11	"[{'award_sub_type': 'GLOBAL', 'award_type': 'global', 'awardings_required_to_grant_benefits': None, 'coin_price': 100, 'coin_reward': 0, 'count': 1, 'days_of_drip_extension': None, 'days_of_premium': None, 'description': ""Shows the Silver Award... and that's it."", 'end_date': None, 'giver_coin_reward': None, 'icon_format': None, 'icon_height': 512, 'icon_url': 'https://www.redditstatic.com/gold/awards/icon/silver_512.png', 'icon_width': 512, 'id': 'gid_1', 'is_enabled': True, 'is_new': False, 'name': 'Silver', 'penny_donate': None, 'penny_price': None, 'resized_icons': [{'height': 16, 'url': 'https://www.redditstatic.com/gold/awards/icon/silver_16.png', 'width': 16}, {'height': 32, 'url': 'https://www.redditstatic.com/gold/awards/icon/silver_32.png', 'width': 32}, {'height': 48, 'url': 'https://www.redditstatic.com/gold/awards/icon/silver_48.png', 'width': 48}, {'height': 64, 'url': 'https://www.redditstatic.com/gold/awards/icon/silver_64.png', 'width': 64}, {'height': 128, 'url': 'https://www.redditstatic.com/gold/awards/icon/silver_128.png', 'width': 128}], 'resized_static_icons': [{'height': 16, 'url': 'https://www.redditstatic.com/gold/awards/icon/silver_16.png', 'width': 16}, {'height': 32, 'url': 'https://www.redditstatic.com/gold/awards/icon/silver_32.png', 'width': 32}, {'height': 48, 'url': 'https://www.redditstatic.com/gold/awards/icon/silver_48.png', 'width': 48}, {'height': 64, 'url': 'https://www.redditstatic.com/gold/awards/icon/silver_64.png', 'width': 64}, {'height': 128, 'url': 'https://www.redditstatic.com/gold/awards/icon/silver_128.png', 'width': 128}], 'start_date': None, 'static_icon_height': 512, 'static_icon_url': 'https://www.redditstatic.com/gold/awards/icon/silver_512.png', 'static_icon_width': 512, 'subreddit_coin_reward': 0, 'subreddit_id': None, 'tiers_by_required_awardings': None}]"		MaximumStudent1839		noob	[{'e': 'text', 't': 'redditor for 3 months'}]	2ec8e69e-6c36-11e9-a04b-0afb553d4ea6	redditor for 3 months	dark	richtext	t2_dx63zp2s	False	False	[]	You are missing the big picture. This level of wealth concentration within one generation is unprecedented. And a large part of that wealth has been financed all thanks to govt debt accumulation under the boomer's era. It is the greatest generational theft in American history. All younger Americans will be paying a hefty price for boomers' luxurious retirement.				1645257425	{'gid_1': 1}	hxjzkvs	False	t3_sw1rtg	False	False	t1_hxjklfq	/r/Bitcoin/comments/sw1rtg/76_percent_of_all_wealth_in_america_is_held_by/hxjzkvs/	1650119488.0	27	True	False	Bitcoin	t5_2s3qj		1	[]																									
12	[]		Ok_Hall_1589			[]				text	t2_a6axzbep	False	False	[]	Yuss!				1645257385	{}	hxjziyz	False	t3_sw21sn	False	True	t1_hxjvjly	/r/Bitcoin/comments/sw21sn/daily_discussion_february_19_2022/hxjziyz/	1650119302.0	1	True	False	Bitcoin	t5_2s3qj		0	[]																									
13	[]		BashCo			[]				text	t2_d7sse	False	True	[]	"&gt;Why? There's just no good reason, its as safe as paper or a key.

Sorry, but I'm removing this comment because it's misinformation. If you're going to do something, do it right."				1645257358	{}	hxjzhs2	False	t3_svyln5	False	False	t1_hxje1t8	/r/Bitcoin/comments/svyln5/marty_bent_on_tucker_carlson_tonight_gives_a/hxjzhs2/	1650119189.0	3	True	False	Bitcoin	t5_2s3qj		0	[]								moderator																	
14	[]		NJ0000			[]				text	t2_7m7mhtb	False	False	[]	This. But if we keep going down on the lower timeframes there will be a point the larger trend gets broken.				1645257347	{}	hxjzh9z	False	t3_sw3dw0	False	True	t1_hxjscn6	/r/Bitcoin/comments/sw3dw0/are_we_still_in_the_uptrend/hxjzh9z/	1650119141.0	1	True	False	Bitcoin	t5_2s3qj		0	[]																									
15	[]		kingofthejaffacakes			[]				text	t2_82mje	False	False		"It's not quite as quick as you imply.  And even if it were minutes is far too long for day traders.

Also, the revision for a sudden trade is reduced because there's no quick access to the trade mechanism. In truth is more like 30 minutes to an hour to get enough confirmations to trade.  And that's in quiet times, if you've ever tried to move China from a wallet to an exchange when the market is moving quickly, it can be literally hours.

It's not that the coins don't exist, it's that they are the equivalent of under the bed, so the live, traded supply is lower (not by 100% of the moved coins, for exactly the reasons you say, but not 0% either)."				1645257330	{}	hxjzggm	False	t3_svhxo9	False	True	t1_hxjb5kf	/r/Bitcoin/comments/svhxo9/ceo_of_kraken_if_you_store_your_bitcoin_in_an/hxjzggm/		1	True	False	Bitcoin	t5_2s3qj		0	[]		False	846c0cd6935f108875353ed069ff6e6464edd181	True	False		0.0		0.0	1645257342.0	True	r/Bitcoin	public												
16	[]		Ger_mack			[]				text	t2_9oc7qvc4	False	False	[]	This is incredible for the unbanked defi defy				1645257306	{}	hxjzfcr	False	t3_sw3hd2	False	False	t3_sw3hd2	/r/Bitcoin/comments/sw3hd2/so_your_bank_account_is_frozen_starter_pack/hxjzfcr/	1650118949.0	6	True	False	Bitcoin	t5_2s3qj		0	[]																									
17	[]		BashCo			[]				text	t2_d7sse	False	True	[]	"Please don't do a paper wallet. Honestly there's just too many ways that you can fuck it up and I don't want to read yet another sob story about how some poor schmuck lost his kids' college funds because he swept an old paper wallet into some shitty malware that stole his coins, or whatever else happens.

At the very least, generate a BIP39 deterministic seed **offline** using Electrum on TAILS OS or another airgapped solution. If you don't know what I'm talking about, please do a lot more research and several small tests. Don't fuck it up.

And if you ""gift"" wallets, be sure to keep a backup of the private key because your recipients won't care about it and will 100% lose it and come asking you for it in 5 years."				1645257302	{}	hxjzf5o	False	t3_svyln5	False	False	t1_hxj803a	/r/Bitcoin/comments/svyln5/marty_bent_on_tucker_carlson_tonight_gives_a/hxjzf5o/	1650118929.0	17	True	False	Bitcoin	t5_2s3qj		0	[]																									
18	[]		smilingbuddhauk			[]				text	t2_5oeqoq	False	False	[]	Yes				1645257282	{}	hxjze9l	False	t3_sw1zj1	False	True	t3_sw1zj1	/r/Bitcoin/comments/sw1zj1/should_i_invest_everything_into_bitcoin_and/hxjze9l/	1650118842.0	1	True	False	Bitcoin	t5_2s3qj		0	[]																									
19	[]		Phynaes			[]				text	t2_n7l4e	False	False	[]	The efficient frontier for stocks is 30%, and you can make a portion of that SCV to improve its returns. Put the rest in TIPS, real estate, gold and crypto, plus some cash. Stay diversified. If Bitcoin does what you think it will, you won't need it to be 100% of your portfolio to win big, and if it doesn't do what you think it will, you'll be glad it wasn't 100% of your portfolio. Return of money is just as important as return on money. Never lose capital permanently, never go 100% in on anything.				1645257279	{}	hxjze4m	False	t3_sw1zj1	False	False	t3_sw1zj1	/r/Bitcoin/comments/sw1zj1/should_i_invest_everything_into_bitcoin_and/hxjze4m/	1650118828.0	9	True	False	Bitcoin	t5_2s3qj		0	[]																									
20	[]		Freefall101			[]				text	t2_5haij54l	False	False	[]	I see, thank you!				1645257275	{}	hxjzdyd	False	t3_svtg6y	False	False	t1_hxjn9jx	/r/Bitcoin/comments/svtg6y/joinmarket_v095_fully_functional_rpcapi_send_to/hxjzdyd/	1650118813.0	2	True	False	Bitcoin	t5_2s3qj		0	[]																									
21	[]		kanye_is_a_douche			[]				text	t2_lecsl	False	False	[]	Ask gold people on the gold sub after getting responses here, then draw a Venn diagram.				1645257236	{}	hxjzc67	False	t3_svrdlr	False	True	t3_svrdlr	/r/Bitcoin/comments/svrdlr/wife_wants_me_to_stop_dcaing_and_sell_all_my/hxjzc67/	1650118644.0	1	True	False	Bitcoin	t5_2s3qj		0	[]																									
22	[]		BurloTheMeh			[]				text	t2_12cjtbum	False	False	[]	Yes				1645257198	{}	hxjzacy	False	t3_sw4fhs	False	True	t3_sw4fhs	/r/Bitcoin/comments/sw4fhs/governments_realizing_theyre_too_late_to_exert/hxjzacy/	1650118468.0	3	True	False	Bitcoin	t5_2s3qj		0	[]																									
23	[]		wtfsperday			[]				text	t2_3hq9vhfl	False	False	[]	"Well, it’s better they come to us.

R/cryptocurrency 
R/buttcoin

(Not linked on purpose)"				1645257185	{}	hxjz9sd	False	t3_sw21sn	False	True	t1_hxjy9p8	/r/Bitcoin/comments/sw21sn/daily_discussion_february_19_2022/hxjz9sd/	1650118413.0	2	True	False	Bitcoin	t5_2s3qj		0	[]																									
24	[]		couchguitar			[]			dark	text	t2_di6lgwei	False	False	[]	I firmly believe most exchanges where you can buy crypto but no send it to a cold wallet, are full of shit. I'm looking at you Robinhood! If you dont have the keys, its not your coin				1645257166	{}	hxjz8ww	False	t3_sw23cw	False	True	t3_sw23cw	/r/Bitcoin/comments/sw23cw/is_btc_fractionalized_on_crypto_exchanges/hxjz8ww/	1650118327.0	2	True	False	Bitcoin	t5_2s3qj		0	[]																									
25	[]		ElephantsAreHeavy			[]				text	t2_13e7j7	False	False	[]	It is simply sending the coins back to an exchange to sell.				1645257153	{}	hxjz8b3	False	t3_svhxo9	False	True	t1_hxhoju9	/r/Bitcoin/comments/svhxo9/ceo_of_kraken_if_you_store_your_bitcoin_in_an/hxjz8b3/	1650118269.0	2	True	False	Bitcoin	t5_2s3qj		0	[]																									
26	[]		nebbie13			[]				text	t2_7ygry	False	False	[]	Crypto is more of a libertarian thing than a conservative or liberal thing.				1645257150	{}	hxjz85c	False	t3_svyln5	False	False	t1_hxjsxh0	/r/Bitcoin/comments/svyln5/marty_bent_on_tucker_carlson_tonight_gives_a/hxjz85c/	1650118252.0	11	True	False	Bitcoin	t5_2s3qj		0	[]																									
27	[]		smilingbuddhauk			[]				text	t2_5oeqoq	False	False	[]	You will your own way out for sure.				1645257137	{}	hxjz7m8	False	t3_svr670	False	True	t1_hxibpa9	/r/Bitcoin/comments/svr670/who_else/hxjz7m8/	1650118200.0	1	True	False	Bitcoin	t5_2s3qj		0	[]																									
28	[]		ILikePracticalGifts			[]				text	t2_dk6f6zaa	False	False	[]	"Stop thinking that BTC will engulf every single piece of value on the planet.

Please. Just stop.

It’s embarrassing."				1645257131	{}	hxjz7br	False	t3_svndey	False	True	t3_svndey	/r/Bitcoin/comments/svndey/doesnt_holding_bitcoin_today_mean_holding_all/hxjz7br/	1650118173.0	0	True	False	Bitcoin	t5_2s3qj		0	[]																									
29	[]		MVisintin98			[]				text	t2_a0v5iw0s	False	False	[]	Someones gotta take one for the team here and buy 10,000 bitcoins for 100k each				1645257114	{}	hxjz6ir	False	t3_sw21sn	False	False	t3_sw21sn	/r/Bitcoin/comments/sw21sn/daily_discussion_february_19_2022/hxjz6ir/	1650118096.0	10	True	False	Bitcoin	t5_2s3qj		0	[]																									
30	[]		BashCo			[]				text	t2_d7sse	False	True	[]	Whether you're right or wrong about the percentage of people who are capable of self custody, bitcoin doesn't die out if some people lose their coins. Bitcoin is the most divisible money ever known to man, so lost coin just makes the remaining coin more scarce.				1645257099	{}	hxjz5t3	False	t3_svyln5	False	False	t1_hxjcegy	/r/Bitcoin/comments/svyln5/marty_bent_on_tucker_carlson_tonight_gives_a/hxjz5t3/	1650118027.0	5	True	False	Bitcoin	t5_2s3qj		0	[]																									
31	[]		[deleted]						dark					[]	[removed]				1645257030	{}	hxjz2nv	False	t3_svklg4	False	True	t1_hxgonih	/r/Bitcoin/comments/svklg4/big_boy_table/hxjz2nv/	1650117720.0	1	True	False	Bitcoin	t5_2s3qj		0	[]																									
32	[]		Financial_Chemist286			[]				text	t2_8gwuzj2x	False	False	[]	She’s doesn’t understand the concept of mining				1645257026	{}	hxjz2gk	False	t3_svrdlr	False	True	t3_svrdlr	/r/Bitcoin/comments/svrdlr/wife_wants_me_to_stop_dcaing_and_sell_all_my/hxjz2gk/	1650117701.0	1	True	False	Bitcoin	t5_2s3qj		0	[]																									
33	[]		[deleted]						dark					[]	[removed]				1645257001	{}	hxjz1cn	False	t3_svklg4	False	True	t3_svklg4	/r/Bitcoin/comments/svklg4/big_boy_table/hxjz1cn/	1650117594.0	1	True	False	Bitcoin	t5_2s3qj		0	[]																									
34	[]		smilingbuddhauk			[]				text	t2_5oeqoq	False	False	[]	Was that a badumtiss?				1645256982	{}	hxjz0fx	False	t3_svr670	False	True	t1_hxjtoaj	/r/Bitcoin/comments/svr670/who_else/hxjz0fx/	1650117507.0	1	True	False	Bitcoin	t5_2s3qj		0	[]																									
35	[]		[deleted]						dark						[removed]				1645256954	{}	hxjyz53	False	t3_sw1zj1	False	True	t3_sw1zj1	/r/Bitcoin/comments/sw1zj1/should_i_invest_everything_into_bitcoin_and/hxjyz53/		1	True	False	Bitcoin	t5_2s3qj		0	[]		False	fe993932d6dced4c0a879e9aa5d7a6e0fbb467f5	True	False		0.0		0.0	1645256964.0	True	r/Bitcoin	public												
36	[]		Berserkism			[]				text	t2_odgwz	False	False	[]	Fear is not the way to invest. Tell her no and mean it.				1645256946	{}	hxjyysm	False	t3_svrdlr	False	False	t3_svrdlr	/r/Bitcoin/comments/svrdlr/wife_wants_me_to_stop_dcaing_and_sell_all_my/hxjyysm/	1650117348.0	2	True	False	Bitcoin	t5_2s3qj		0	[]																									
37	[]		Crypto_CPA20			[]				text	t2_c65k4epb	False	False	[]	Thou hast be the way				1645256944	{}	hxjyypd	False	t3_svrdlr	False	True	t1_hxjiktz	/r/Bitcoin/comments/svrdlr/wife_wants_me_to_stop_dcaing_and_sell_all_my/hxjyypd/	1650117339.0	3	True	False	Bitcoin	t5_2s3qj		0	[]																									
38	[]		MaximumStudent1839		noob	[{'e': 'text', 't': 'redditor for 3 months'}]	2ec8e69e-6c36-11e9-a04b-0afb553d4ea6	redditor for 3 months	dark	richtext	t2_dx63zp2s	False	False	[]	More people and equipment mining BTC means more future sell pressure on BTC to ROI on equipment and pay bills. Given we are now in a bear market, I am looking forward to great sales when all these noob miners capitulate.				1645256935	{}	hxjyy92	False	t3_sw26xj	False	False	t3_sw26xj	/r/Bitcoin/comments/sw26xj/bitcoin_hashrate_reaches_new_ath/hxjyy92/	1650117295.0	6	True	False	Bitcoin	t5_2s3qj		0	[]																									
39	[]		_mrost_		noob	[{'e': 'text', 't': 'redditor for 3 days'}]	2ec8e69e-6c36-11e9-a04b-0afb553d4ea6	redditor for 3 days	dark	richtext	t2_jqbv15xz	False	False	[]	Stonks👆				1645256925	{}	hxjyxsa	False	t3_svr670	False	True	t3_svr670	/r/Bitcoin/comments/svr670/who_else/hxjyxsa/	1650117253.0	1	True	False	Bitcoin	t5_2s3qj		0	[]																									
40	[]		[deleted]						dark					[]	[deleted]				1645256923	{}	hxjyxp6	False	t3_svrdlr	False	True	t1_hxhr3r8	/r/Bitcoin/comments/svrdlr/wife_wants_me_to_stop_dcaing_and_sell_all_my/hxjyxp6/	1650117245.0	1	True	False	Bitcoin	t5_2s3qj		0	[]																									
41	[]		Itchy_Project5926			[]				text	t2_a0dlwaki	False	False	[]	Peter?				1645256886	{}	hxjyvww	False	t3_svrdlr	False	True	t1_hxjwi55	/r/Bitcoin/comments/svrdlr/wife_wants_me_to_stop_dcaing_and_sell_all_my/hxjyvww/	1650117057.0	1	True	False	Bitcoin	t5_2s3qj		0	[]																									
42	[]		bmanbran19			[]				text	t2_8kgt097n	False	False	[]	My apologies,  haven't searched for it just asked				1645256854	{}	hxjyufx	True	t3_sw3opx	False	True	t1_hxjy5fr	/r/Bitcoin/comments/sw3opx/best_btc_wallet/hxjyufx/	1650116917.0	-1	True	False	Bitcoin	t5_2s3qj		0	[]																									
43	[]		mmockingbird12			[]				text	t2_3a7hhfdc	False	False	[]	Unstoppable wallet				1645256805	{}	hxjys6f	False	t3_sw2nu5	False	True	t3_sw2nu5	/r/Bitcoin/comments/sw2nu5/best_mobile_wallet_for_ios/hxjys6f/	1650116702.0	1	True	False	Bitcoin	t5_2s3qj		0	[]																									
44	[]		AbbreviationsDue1489			[]				text	t2_5e1hjz9n	False	False	[]	"Movie too short. Drama can make longer and soapy haha ""Game of BTC"" or ""Undersiege: Central Bank"" 🤣"				1645256788	{}	hxjyrfg	False	t3_sw4fhs	False	False	t1_hxjy8f9	/r/Bitcoin/comments/sw4fhs/governments_realizing_theyre_too_late_to_exert/hxjyrfg/	1650116628.0	14	True	False	Bitcoin	t5_2s3qj		0	[]																									
45	[]		wayanonforthis			[]				text	t2_5uom8	False	False		Agree on an amount that is yours to spend as you see fit.				1645256770	{}	hxjyqi4	False	t3_svrdlr	False	True	t3_svrdlr	/r/Bitcoin/comments/svrdlr/wife_wants_me_to_stop_dcaing_and_sell_all_my/hxjyqi4/		1	True	False	Bitcoin	t5_2s3qj		0	[]		False	88249c5248da912fdfc7e50282d13bd03e528cef	True	False		0.0		0.0	1645256783.0	True	r/Bitcoin	public												
46	[]		billythebob122		noob	[{'e': 'text', 't': 'redditor for 2 weeks'}]	2ec8e69e-6c36-11e9-a04b-0afb553d4ea6	redditor for 2 weeks	dark	richtext	t2_jj17939g	False	False	[]	I looked at trezors twitter going back to 1/27 and couldnt find anything. What are you referring to? did they delete the tweet?				1645256768	{}	hxjyqey	False	t3_svyln5	False	True	t1_hxjd5m5	/r/Bitcoin/comments/svyln5/marty_bent_on_tucker_carlson_tonight_gives_a/hxjyqey/	1650116530.0	3	True	False	Bitcoin	t5_2s3qj		0	[]																									
47	[]		Catlsnotsobad		noob	[{'e': 'text', 't': 'redditor for 3 months'}]	2ec8e69e-6c36-11e9-a04b-0afb553d4ea6	redditor for 3 months	dark	richtext	t2_gzi0l1sn	False	False	[]	"Someone help me understand this. The wallets that were on exchanges were frozen so any cold wallet is still able to transfer BTC right? But you can’t spend the BTC and any exchange has blocked you from exchanging BTC for fiat to be able to spend the money. 

Also it’s on the block chain and public so any wallet you send it to will just be blocked too. So it’s basically the same effect as having your bank account frozen. Is there a way to get around this l, I thought this was a big selling point was the decentralization that one person can’t just shut it down."				1645256728	{}	hxjyoj0	False	t3_svzxq6	False	False	t3_svzxq6	/r/Bitcoin/comments/svzxq6/the_trudeau_regime_is_trying_to_make_parts_of_the/hxjyoj0/	1650116352.0	4	True	False	Bitcoin	t5_2s3qj		0	[]																									
48	[]		[deleted]						dark					[]	I put a lot of money into outlet finance, they are paying 9% apy and they’re just a usd front end to the Celsius network and they do all the crypto stuff behind the scenes through APIs. It’s seems it’s a good way to earn good interest on your usd without losing money.				1645256690	{}	hxjymq0	False	t3_sw1zj1	False	True	t1_hxjyfkc	/r/Bitcoin/comments/sw1zj1/should_i_invest_everything_into_bitcoin_and/hxjymq0/	1650116177.0	2	True	False	Bitcoin	t5_2s3qj		0	[]																									
49	[]		ttwait_ok			[]				text	t2_d9mssizr	False	False	[]	Lol, nothing wrong in using a word. It's all language dude.				1645256689	{}	hxjymn2	False	t3_sv9hwb	False	False	t1_hxi6tpz	/r/Bitcoin/comments/sv9hwb/daily_discussion_february_18_2022/hxjymn2/	1650116170.0	4	True	False	Bitcoin	t5_2s3qj		0	[]																									
50	[]		Palm-o-Granite_Jam			[]				text	t2_3i6yaf65	False	False	[]	"You gotta find a happy medium with her. You are together in this. Negotiate.

Your wife isn't telling you to throw that money away... Gold stocks are probably going to do well. I'm with you, in thinking that btc is going to do better, however. So, any money put into gold stocks should,  from that perspective, just be looked at as losing out on the performance difference, which if we're being honest, is guesswork anyways.

Perhaps the happy medium would be to negotiate an agreement to retain your current crypto holdings instead of selling now, cessate the DCA into BTC and divert that investment capital into Gold Stocks.

The levers of negotiation are thus: 

A. Any quantity of current BTC holdings to be liquidated and reinvested in Gold Stocks,
B. The proportion of new investment capital into Gold vs. BTC
C. Exit points and take-profits
And D. What to do with profits taken

You want the parameters [0% liquidation, 100% DCA into BTC], she wants [100% liquidation, 100% DCA into Gold Stocks]. A middling compromise would naturally be [50% liquidation, 50% DCA into BTC &amp; 50% into Gold Stocks]. Perhaps she would accept something like [0% liquidation, 100% into Gold stocks] or [20% Liquidation, 75% into Gold Stocks]. Maybe she would even accept [0% liq, 50% DCA]. You just have to open the issue up to negotiation.

But bear in mind, your wife is along for the ride and she isn't comfortable with the current structure of [your investment portfolio + your investment strategy]. Let her know that you want her to be comfortable with it, but that you feel very strongly about the strategy you are currently employing, and find metrics that will put her at ease while not causing you to feel deprived of the opportunity that you are interested in putting your shared financial futures towards.

The ideas of when profits should be taken, how they should be allocated, and all of that can be worked out if you guys want to dive into the details on that end, but her feeling of security needs to be considered. If she wants to hedge the crypto bet with gold, it isn't like that money is just going to be thrown away. 

Work with her."				1645256679	{}	hxjym5h	False	t3_svrdlr	False	True	t3_svrdlr	/r/Bitcoin/comments/svrdlr/wife_wants_me_to_stop_dcaing_and_sell_all_my/hxjym5h/	1650116124.0	1	True	False	Bitcoin	t5_2s3qj		0	[]																									
