Unnamed: 0	all_awardings	archived	associated_award	author	author_flair_background_color	author_flair_css_class	author_flair_richtext	author_flair_template_id	author_flair_text	author_flair_text_color	author_flair_type	author_fullname	author_patreon_flair	author_premium	body	body_sha1	can_gild	collapsed	collapsed_because_crowd_control	collapsed_reason	collapsed_reason_code	comment_type	controversiality	created_utc	distinguished	gilded	gildings	id	is_submitter	link_id	locked	no_follow	parent_id	permalink	retrieved_utc	score	score_hidden	send_replies	stickied	subreddit	subreddit_id	subreddit_name_prefixed	subreddit_type	top_awarded_type	total_awards_received	treatment_tags	unrepliable_reason	author_cakeday	corpus	support	knowledge	conflict	power	similarity	fun	status	trust	identity	romance
316	[]	False		No_Industry9653			[]				text	t2_oniup7jq	False	False	"&gt;Display the assets and interactions that you want

Really cool idea. I always thought there was a problem with interfaces that proactively crawl and display tokens as being 'in your wallet', a lot of people get confused and bothered by this."	3c358a2ad0aae79014eaffd896395a49795f4cd1	True	False					0	1656960711		0	{}	ieumgln	False	t3_vr7hbx	False	True	t3_vr7hbx	/r/ethereum/comments/vr7hbx/ive_spent_the_last_8_months_working_on/ieumgln/	1656960724	1	False	True	False	ethereum	t5_2zf9m	r/ethereum	public		0	[]													
317	[]	False		Sufficient-Feed-3482			[]				text	t2_o0prgato	False	False	Daily reminder that NFTs are literally just text hyperlinks on the blockchain	c29f405de120af0415779e9639399b360ec79ac0	True	False					0	1656960699		0	{}	ieumfmn	False	t3_vr5wy2	False	True	t3_vr5wy2	/r/ethereum/comments/vr5wy2/the_biggest_headline_is_that_nft_sales_fell_by_72/ieumfmn/	1656960716	1	False	True	False	ethereum	t5_2zf9m	r/ethereum	public		0	[]													
318	[]	False		cryptolipto			[]				text	t2_6k6f2ry5	False	False	Honestly I’m surprised NFTs are still holding up relatively well. I expected them to go -99% and they’ve only done -85% to -90%	9c8b0cd2367b51cdcc684d039b643edbf82904d6	True	False					0	1656960605		0	{}	ieum7ob	False	t3_vr5wy2	False	True	t3_vr5wy2	/r/ethereum/comments/vr5wy2/the_biggest_headline_is_that_nft_sales_fell_by_72/ieum7ob/	1656960622	1	False	True	False	ethereum	t5_2zf9m	r/ethereum	public		0	[]													
319	[]	False		AutoModerator			[]				text	t2_6l4z3	False	True	"Your submission was removed from /r/ethereum due to being too short. All text submissions must be at least 60 characters long.

*I am a bot, and this action was performed automatically. Please [contact the moderators of this subreddit](/message/compose/?to=/r/ethereum) if you have any questions or concerns.*"	f5350acfa4ebeaa5482eb2be2e6daa9c2d3776c0	True	False					0	1656960008	moderator	0	{}	ieukt0a	False	t3_vre6ub	False	True	t3_vre6ub	/r/ethereum/comments/vre6ub/facebook_made_some_announcement_regarding_eth_and/ieukt0a/	1656960022	1	False	False	False	ethereum	t5_2zf9m	r/ethereum	public		0	[]													
320	[]	False		Financetrader			[]				text	t2_v7nq6	False	False	This is pretty neat. I can see this working well with ENS integration. Perhaps a social media profile for ENS users	d04cca17bf583b18b008098f324e6126330068df	True	False					0	1656959904		0	{}	ieukk8t	False	t3_vr7hbx	False	True	t3_vr7hbx	/r/ethereum/comments/vr7hbx/ive_spent_the_last_8_months_working_on/ieukk8t/	1656959920	1	False	True	False	ethereum	t5_2zf9m	r/ethereum	public		0	[]													
321	[]	False		ismirschlecht			[]				text	t2_cmz0cj8u	False	False	"&gt;a) order-book exchanges aren't even possible on most blockchains

How's that, I can't think of a reason \^\^"	8a1a34407581203e27a38a1adaefaf1e3a7fee86	True	False					0	1656959805		0	{}	ieukbuu	False	t3_vrd88w	False	True	t1_ieufaib	/r/ethereum/comments/vrd88w/since_the_uniswap_algorithm_is_so_efficient_at/ieukbuu/	1656959820	1	False	True	False	ethereum	t5_2zf9m	r/ethereum	public		0	[]													
322	[]	False		[deleted]						dark					[removed]	fe993932d6dced4c0a879e9aa5d7a6e0fbb467f5	True	False					0	1656959682		0	{}	ieuk1ho	False	t3_vr7hbx	False	True	t3_vr7hbx	/r/ethereum/comments/vr7hbx/ive_spent_the_last_8_months_working_on/ieuk1ho/	1656959699	1	False	True	False	ethereum	t5_2zf9m	r/ethereum	public		0	[]													
323	[]	False		Layer_4_Solutions			[]				text	t2_ng7wff1k	False	False	"I would consider ""status symbols"" with no significant utility as scams."	0b5a54c243f4e91a5c5368bc121b081e3dcfb55d	True	False					0	1656959541		0	{}	ieujpox	False	t3_vr5wy2	False	True	t1_iety2f9	/r/ethereum/comments/vr5wy2/the_biggest_headline_is_that_nft_sales_fell_by_72/ieujpox/	1656959552	1	False	True	False	ethereum	t5_2zf9m	r/ethereum	public		0	[]													
324	[]	False		drewshaver			[]				text	t2_3gr81	False	False	"&gt; the inefficient way of bidding and waiting for takers

You can be the taker and execute against resting on the order books if you want"	679a23487b0577997a215520e592c657d17ef2b2	True	False					0	1656958741		0	{}	ieuhu4d	False	t3_vrd88w	False	False	t3_vrd88w	/r/ethereum/comments/vrd88w/since_the_uniswap_algorithm_is_so_efficient_at/ieuhu4d/	1656958752	1	False	True	False	ethereum	t5_2zf9m	r/ethereum	public		0	[]													
325	[]	False		patniemeyer			[]				text	t2_4bwhg	False	False	Can someone point to an example of a current Defi project that isn’t purely driven by leveraged speculation or unsustainable free-money giveaways?  Given that we don’t have under-collateralized loans yet what else can you do with it?  (Honestly asking, inform me)	1b1674795da7dcba16b3f758a798db37cc2dfedd	True	False					0	1656958267		0	{}	ieugqfy	False	t3_vrawh8	False	True	t3_vrawh8	/r/ethereum/comments/vrawh8/speculation_nation_the_daily_gwei_511/ieugqfy/	1656958284	1	False	True	False	ethereum	t5_2zf9m	r/ethereum	public		0	[]													
326	[]	False		Lowekey333			[]				text	t2_57yzegdv	False	False	What?	be65b9e347375f6ab4dbf58f66fa0a0b73735783	True	False					0	1656958154		0	{}	ieugh5d	True	t3_vqzn67	False	True	t1_ieugan2	/r/ethereum/comments/vqzn67/when_i_was_18_i_forgot_about_this_wallet_claimed/ieugh5d/	1656958174	1	False	True	False	ethereum	t5_2zf9m	r/ethereum	public		0	[]													
327	[]	False		coolman_yes			[]				text	t2_c4wz84pv	False	False	op is a dumbass	ddcc75c820b6a6d674686d746a6af0268b414106	True	False					0	1656958075		0	{}	ieugan2	False	t3_vqzn67	False	True	t3_vqzn67	/r/ethereum/comments/vqzn67/when_i_was_18_i_forgot_about_this_wallet_claimed/ieugan2/	1656958086	1	False	True	False	ethereum	t5_2zf9m	r/ethereum	public		0	[]													
328	[]	False		give2love			[]				text	t2_826mwfyo	False	False	"wow I am literally working on something similar to this called walletsearch.xyz
haven't released beta yet tho. great work!

On-chain identity is the most import problem. It's the google of web3/crypto imho"	04da74c6b14c21558550a9324c448855510cc786	True	False					0	1656957765		0	{}	ieufk50	False	t3_vr7hbx	False	True	t3_vr7hbx	/r/ethereum/comments/vr7hbx/ive_spent_the_last_8_months_working_on/ieufk50/	1656957777	1	False	True	False	ethereum	t5_2zf9m	r/ethereum	public		0	[]													
329	[]	False		dmihal			[]		David Mihal	dark	text	t2_iu4uy	False	False	"Uniswap is actually incredibly *inefficient*, especially Uniswap V2 &amp; forks.

Despite this, Uniswap has been successful because a) order-book exchanges aren't even possible on most blockchains, and b) they allow users to passively provide liquidity.

I can't go out and become a market-maker on Binance, because it's too complicated. But depositing into Uniswap is easy, I can sit there and earn fees passively."	a41757b546367b97ea8fe13c83da7b838db1a257	True	False					0	1656957652		0	{}	ieufaib	False	t3_vrd88w	False	True	t3_vrd88w	/r/ethereum/comments/vrd88w/since_the_uniswap_algorithm_is_so_efficient_at/ieufaib/	1656957670	1	False	True	False	ethereum	t5_2zf9m	r/ethereum	public		0	[]													
330	[]	False		dmihal			[]		David Mihal	dark	text	t2_iu4uy	False	False	This post is not about Ethereum or its ecosystem. Please post it elsewhere.	7539b3bc124e93a4f401f094d3f7e11040227f15	True	False					0	1656957497	moderator	0	{}	ieuex6v	False	t3_vrba1i	False	True	t3_vrba1i	/r/ethereum/comments/vrba1i/the_dude_on_this_windows_tutorial_sounds_like/ieuex6v/	1656957514	1	True	True	True	ethereum	t5_2zf9m	r/ethereum	public		0	[]													
331	[]	False		AutoModerator			[]				text	t2_6l4z3	False	True	"Your submission was removed from /r/ethereum due to being too short. All text submissions must be at least 60 characters long.

*I am a bot, and this action was performed automatically. Please [contact the moderators of this subreddit](/message/compose/?to=/r/ethereum) if you have any questions or concerns.*"	f5350acfa4ebeaa5482eb2be2e6daa9c2d3776c0	True	False					0	1656957230	moderator	0	{}	ieueayl	False	t3_vrd5yu	False	True	t3_vrd5yu	/r/ethereum/comments/vrd5yu/since_the_uniswap_algorithm_is_so_efficient_at/ieueayl/	1656957244	1	False	False	False	ethereum	t5_2zf9m	r/ethereum	public		0	[]													
332	[]	False		TrymWS			[]				text	t2_kruww	False	False	"&gt; It’s nobody’s job to provide you with any source you pathetic clown

If you make a claim, it's your job to provide the source.

But I understand that's too hard to understand for someone as stupid as you, hahahaha. 🥳

You also don't even understand what the source says, which is adorable. 😂"	9c99a2cd8d59a5e0b37d6e7ea3051cb871cec7be	True	False					0	1656957190		0	{}	ieue7ke	False	t3_vq5vev	False	True	t1_ieuamzl	/r/ethereum/comments/vq5vev/best_way_to_dca_into_eth/ieue7ke/	1656957205	1	False	True	False	ethereum	t5_2zf9m	r/ethereum	public		0	[]													
333	[]	False		cryptolulz			[]				text	t2_sh9mwxl	False	False	Yeah, tho I'm sure Coinbase itself is fine for the most part. They're trying to be regulator friendly and don't seem to be into secretly leveraging customer funds, at least not that I know.	ab1dc1628773582a7125651c6d6f5179deaf1691	True	False					0	1656957182		0	{}	ieue6vz	False	t3_vrb5zm	False	True	t1_ieu6het	/r/ethereum/comments/vrb5zm/staked_eth_safe_from_cex_default/ieue6vz/	1656957197	1	False	True	False	ethereum	t5_2zf9m	r/ethereum	public		0	[]													
334	[]	False		TrymWS			[]				text	t2_kruww	False	False	"&gt; Do you always cry when you lose?

Hahahahaha, you're the only one talking about winning or losing here. 🥳

&gt; I never whined about “the source” you deranged troll.

You did. You whined about having to provide a source.

&gt; I pointed you directly to the source

That's not directly. But I guess it's too hard for someone as stupid as you to understand the meaning of words.

&gt; and you were too stupid to figure it out.

No, you're just too stupid to understand what providing a source means.

You're also too stupid to understand what the source says. 🥳"	529439da4935806e7112e902d714a40ebb44e272	True	False					0	1656957113		0	{}	ieue10g	False	t3_vq5vev	False	True	t1_ieua9kf	/r/ethereum/comments/vq5vev/best_way_to_dca_into_eth/ieue10g/	1656957126	1	False	True	False	ethereum	t5_2zf9m	r/ethereum	public		0	[]													
335	[]	False		PhysicalJoe3011			[]				text	t2_b3zfwn9k	False	False	"If possible, a subscribe feature would be nice.
Thus I can see, when a fried buys an NFT."	743d508b9d6c9d88fa9e9e534b474d83588b4845	True	False					0	1656956948		0	{}	ieudmw5	False	t3_vr7hbx	False	True	t3_vr7hbx	/r/ethereum/comments/vr7hbx/ive_spent_the_last_8_months_working_on/ieudmw5/	1656956961	1	False	True	False	ethereum	t5_2zf9m	r/ethereum	public		0	[]													
336	[]	False		sendr0ck			[]				text	t2_df2ojd	False	True	lol	403926033d001b5279df37cbbe5287b7c7c267fa	True	False					0	1656956114		0	{}	ieubpht	False	t3_vr5wy2	False	False	t3_vr5wy2	/r/ethereum/comments/vr5wy2/the_biggest_headline_is_that_nft_sales_fell_by_72/ieubpht/	1656956126	1	False	True	False	ethereum	t5_2zf9m	r/ethereum	public		0	[]													
337	[]	False		stryker7314			[]				text	t2_g05sg	False	False	Be first (Celsius), be smarter, or cheat.	144a9f63494f24054a8625c2aa6e4faa81b779ae	True	False					0	1656955996		0	{}	ieubf9e	False	t3_vr8zyr	False	True	t3_vr8zyr	/r/ethereum/comments/vr8zyr/crypto_lender_vauld_suspends_withdrawals_company/ieubf9e/	1656956009	1	False	True	False	ethereum	t5_2zf9m	r/ethereum	public		0	[]													
338	[]	False		Impossible-Example91			[]				text	t2_9usq5ygq	False	False	It’s nobody’s job to provide you with any source you pathetic clown	c2ead0417814e2e3777eecae3cfc10e1a2b96d15	True	False					0	1656955673		0	{}	ieuamzl	False	t3_vq5vev	False	True	t1_ieu2vt5	/r/ethereum/comments/vq5vev/best_way_to_dca_into_eth/ieuamzl/	1656955689	1	False	True	False	ethereum	t5_2zf9m	r/ethereum	public		0	[]													
339	[]	False		[deleted]						dark					[removed]	fe993932d6dced4c0a879e9aa5d7a6e0fbb467f5	True	False					0	1656955578		0	{}	ieuaep6	False	t3_vr7hbx	False	True	t3_vr7hbx	/r/ethereum/comments/vr7hbx/ive_spent_the_last_8_months_working_on/ieuaep6/	1656955594	1	False	True	False	ethereum	t5_2zf9m	r/ethereum	public		0	[]													
340	[]	False		BillMcN3al			[]				text	t2_vfgfd5f	False	False	Aaaaand it's gone	90234756224ac1f7e620e5e19b3bb26e4698c577	True	False					0	1656955537		0	{}	ieuab2f	False	t3_vr8zyr	False	True	t3_vr8zyr	/r/ethereum/comments/vr8zyr/crypto_lender_vauld_suspends_withdrawals_company/ieuab2f/	1656955556	1	False	True	False	ethereum	t5_2zf9m	r/ethereum	public		0	[]													
341	[]	False		Impossible-Example91			[]				text	t2_9usq5ygq	False	False	Do you always cry when you lose?	c3b601e7519ca941711413f93736da617898488a	True	False					0	1656955520		0	{}	ieua9kf	False	t3_vq5vev	False	True	t1_ieu2lez	/r/ethereum/comments/vq5vev/best_way_to_dca_into_eth/ieua9kf/	1656955532	1	False	True	False	ethereum	t5_2zf9m	r/ethereum	public		0	[]													
342	[]	False		br094			[]				text	t2_120wprko	False	False	Good. NFTs are scams by natural con artists to get money out of morons who think they’re going to be rich.	f1fb02f144159aa82759993763db941e2867511b	True	False					0	1656954838		0	{}	ieu8ma4	False	t3_vr5wy2	False	True	t3_vr5wy2	/r/ethereum/comments/vr5wy2/the_biggest_headline_is_that_nft_sales_fell_by_72/ieu8ma4/	1656954850	1	False	True	False	ethereum	t5_2zf9m	r/ethereum	public		0	[]													
343	[]	False		[deleted]						dark					[removed]	fe993932d6dced4c0a879e9aa5d7a6e0fbb467f5	True	False					0	1656954435		0	{}	ieu7nd1	False	t3_vr0kk0	False	True	t3_vr0kk0	/r/ethereum/comments/vr0kk0/frequently_asked_questions_weekly_discussion/ieu7nd1/	1656954449	1	False	True	False	ethereum	t5_2zf9m	r/ethereum	public		0	[]													
344	[]	False		Surfsd20			[]				text	t2_860rqu2i	False	False	"BAYC is not and will never be a “status symbol” in the way that Ferraris or watches are. If you’ve never heard of a Patek Philippe or a Mazzanti, when you see someone wearing or driving one you immediately know they are high status. 

If you’ve never heard of BAYC and someone shows it off you would just think they are an idiot with a weird obsession for poorly drawn monkeys.

The idea that a monkey pic conveys the same value and status as luxury cars, watches, etc is the dumbest concept I’ve ever heard of."	7a0eb20f3202a7b3dd193606a00b742446284815	True	False					0	1656954327		0	{}	ieu7dz5	False	t3_vr5wy2	False	True	t1_iety2f9	/r/ethereum/comments/vr5wy2/the_biggest_headline_is_that_nft_sales_fell_by_72/ieu7dz5/	1656954341	1	False	True	False	ethereum	t5_2zf9m	r/ethereum	public		0	[]													
345	[]	False		saddit42			[]				text	t2_kibwt	False	False	not really	b433a0bf1d47e68637f5222066110b0d4c8511f1	True	False					0	1656954197		0	{}	ieu72o9	False	t3_vrba1i	False	True	t3_vrba1i	/r/ethereum/comments/vrba1i/the_dude_on_this_windows_tutorial_sounds_like/ieu72o9/	1656954210	1	False	True	False	ethereum	t5_2zf9m	r/ethereum	public		0	[]													
346	[]	False		Novel_Development898			[]				text	t2_a0ae9vna	False	False	Thanks for the explanation. Hopefully it never comes to that but in the event of a prolonged winter, my guess is all bets are off and (like you said), it’s not hard to guess where the CEX’s interests will be first and foremost.	8e0f07ab9e2492a9b0617404e6e1d55917cf5c5a	True	False					0	1656953953		0	{}	ieu6het	True	t3_vrb5zm	False	True	t1_ieu5m02	/r/ethereum/comments/vrb5zm/staked_eth_safe_from_cex_default/ieu6het/	1656953967	1	False	True	False	ethereum	t5_2zf9m	r/ethereum	public		0	[]													
347	[]	False		cryptolulz			[]				text	t2_sh9mwxl	False	False	So yeah, the coins are 'safe' in a sense that they're on the Blockchain and Coinbase probably doesn't stake using their own nodes... But also they control the keys to move the coins so if things get desperate it's hard to guess what could happen.	4cefdd156f00496a0d1a60dd084df9d64b2989bc	True	False					0	1656953592		0	{}	ieu5m02	False	t3_vrb5zm	False	True	t1_ieu1xzc	/r/ethereum/comments/vrb5zm/staked_eth_safe_from_cex_default/ieu5m02/	1656953608	1	False	True	False	ethereum	t5_2zf9m	r/ethereum	public		0	[]													
348	[]	False		khansian			[]				text	t2_16urpd	False	False	"Why shouldn’t I just buy a REIT or some other investment property, and rent the home I want to live in for myself?

There seems to be no benefit in this scheme to actually occupying the properties yourselves. Why not just pool your money and invest in properties and rent them out to the highest bidder? That would maximize profits."	bab9c7ab6ecb46f527e4d55e08725a0fe766cff8	True	False					0	1656952596		0	{}	ieu379b	False	t3_vq90dm	False	True	t3_vq90dm	/r/ethereum/comments/vq90dm/decentralized_housing_a_dao_for_public_good/ieu379b/	1656952613	1	False	True	False	ethereum	t5_2zf9m	r/ethereum	public		0	[]													
349	[]	False		TrymWS			[]				text	t2_kruww	False	False	"It’s quite ironic that you’re here, responding to yourself, and pretending you made any useful difference other than proving your stupidity.

Have fun with your own little made up scenarios in your non-functional head, mate. 🥳"	d436586b287ba9f9d167ce47ef020c284f26f23c	True	False					0	1656952465		0	{}	ieu2vt5	False	t3_vq5vev	False	True	t1_ietxy20	/r/ethereum/comments/vq5vev/best_way_to_dca_into_eth/ieu2vt5/	1656952481	1	False	True	False	ethereum	t5_2zf9m	r/ethereum	public		0	[]													
350	[]	False		[deleted]						dark					[removed]	fe993932d6dced4c0a879e9aa5d7a6e0fbb467f5	True	False					0	1656952464		0	{}	ieu2vqt	False	t3_vrb5zm	False	True	t1_ieu1zks	/r/ethereum/comments/vrb5zm/staked_eth_safe_from_cex_default/ieu2vqt/	1656952481	1	False	True	False	ethereum	t5_2zf9m	r/ethereum	public		0	[]													
351	[]	False		TrymWS			[]				text	t2_kruww	False	False	"No, you’re the clown.

Imagine being stupid enough to whine about being asked for the source.

And by bitching like this you were piggybacking on the argument.

You also said:

&gt; Coinbase Pro is going away whether you like it or not.

Which is the same argument."	f9f456c222bbd1e2caab0f08c0d15f19850c82a5	True	False					0	1656952346		0	{}	ieu2lez	False	t3_vq5vev	False	True	t1_ietxijg	/r/ethereum/comments/vq5vev/best_way_to_dca_into_eth/ieu2lez/	1656952365	1	False	True	False	ethereum	t5_2zf9m	r/ethereum	public		0	[]													
352	[]	False		Novel_Development898			[]				text	t2_a0ae9vna	False	False	I like that news!	d536a257fa3998692728fe5408b52a9d38f51bec	True	False					0	1656952094		0	{}	ieu1zks	True	t3_vrb5zm	False	True	t1_ieu1q6d	/r/ethereum/comments/vrb5zm/staked_eth_safe_from_cex_default/ieu1zks/	1656952106	1	False	True	False	ethereum	t5_2zf9m	r/ethereum	public		0	[]													
353	[]	False		Novel_Development898			[]				text	t2_a0ae9vna	False	False	"Agreed.
I have cold storage but obviously I can’t get my staked ETH off CB. Just wondering if CB actually holds those coins or if they are “safe” from CB, on the ETH blockchain…?"	afe82fa917ab36abe3e0d7748fc7369cb90534c7	True	False					0	1656952076		0	{}	ieu1xzc	True	t3_vrb5zm	False	True	t1_ieu1o0i	/r/ethereum/comments/vrb5zm/staked_eth_safe_from_cex_default/ieu1xzc/	1656952091	1	False	True	False	ethereum	t5_2zf9m	r/ethereum	public		0	[]													
354	[]	False		OldManFleming			[]				text	t2_qwb8s	False	False	This makes me incredibly happy to hear!! Thanks so much for the nice feedback! You can absolutely show your DAI balance on both Arbitrum and Optimism. If you have your wallet connected, you can press the pencil icon in the top right corner of your profile and add a new token badge with Arbitrubm/Optimism as the blockchain and the DAI contract address. You can then drag and drop the badge into the correct order and grouping you want. Let me know if thats not clear or difficult to figure out. UX is always a challenge	f084da7754817d1cb18874d7233b53134a278793	True	False					0	1656952071		0	{}	ieu1xhl	True	t3_vr7hbx	False	True	t1_ieu0d50	/r/ethereum/comments/vr7hbx/ive_spent_the_last_8_months_working_on/ieu1xhl/	1656952083	1	False	True	False	ethereum	t5_2zf9m	r/ethereum	public		0	[]													
355	[]	False		allbriskets			[]				text	t2_3ozv16m8	False	False	Unlikely they are safe in the event of default. However, coinbase has plenty of cash for operations for 8 quarters last I checked.	abf2bd830e58512ef850d5030f0869dfa3c0b1b0	True	False					0	1656951988		0	{}	ieu1q6d	False	t3_vrb5zm	False	True	t3_vrb5zm	/r/ethereum/comments/vrb5zm/staked_eth_safe_from_cex_default/ieu1q6d/	1656952006	1	False	True	False	ethereum	t5_2zf9m	r/ethereum	public		0	[]													
356	[]	False		cryptolulz			[]				text	t2_sh9mwxl	False	False	The coin itself probably is, but you know the whole thing where people say not your keys not your coins? If Coinbase goes insolvent, do you think they will make it easy to get anything out?	65515805ec619b7b5a249f83a5a31e7ac7b2798f	True	False					0	1656951963		0	{}	ieu1o0i	False	t3_vrb5zm	False	True	t3_vrb5zm	/r/ethereum/comments/vrb5zm/staked_eth_safe_from_cex_default/ieu1o0i/	1656951975	1	False	True	False	ethereum	t5_2zf9m	r/ethereum	public		0	[]													
357	[]	False		[deleted]						dark					[removed]	fe993932d6dced4c0a879e9aa5d7a6e0fbb467f5	True	False					0	1656951476		0	{}	ieu0hat	False	t3_vr7hbx	False	True	t3_vr7hbx	/r/ethereum/comments/vr7hbx/ive_spent_the_last_8_months_working_on/ieu0hat/	1656951492	1	False	True	False	ethereum	t5_2zf9m	r/ethereum	public		0	[]													
358	[]	False		Juankestein			[]				text	t2_bnfh0	False	False	"I know you want to hear this feedback: I just bookmarked my wallet page to my browser!

I'm by no means a crazy power user but I recently purchased rETH token, and your page displays my earned rewards. Literally just yesterday I was wondering how in the hell was I supposed to calculate how much my rETH staking has generated and you page makes a cool summary of that.

Also I wanted to point out that I have DAI in both Arbitrum and Optimism but they don't show on the summary, would that be normal?"	44062413c2bb128b1e80164334862c4bf8840264	True	False					0	1656951428		0	{}	ieu0d50	False	t3_vr7hbx	False	True	t3_vr7hbx	/r/ethereum/comments/vr7hbx/ive_spent_the_last_8_months_working_on/ieu0d50/	1656951446	1	False	True	False	ethereum	t5_2zf9m	r/ethereum	public		0	[]													
359	[]	False		marcuspohl			[]				text	t2_12t57o	False	False	Certainly need more use cases that are speculative, it’s driving crypto way too much. Seems like every single article is “oh the price is going to go up/down due to this triangle circle jerk pattern on this here chart”.	b83266fb5ae87f0c19a12559256e41fd7ff459fa	True	False					0	1656951365		0	{}	ieu07l8	False	t3_vrawh8	False	True	t3_vrawh8	/r/ethereum/comments/vrawh8/speculation_nation_the_daily_gwei_511/ieu07l8/	1656951384	1	False	True	False	ethereum	t5_2zf9m	r/ethereum	public		0	[]													
360	[]	False		coinfeeds-bot			[]				text	t2_8ihxazi7	False	False	"tldr; The crypto industry is currently too concentrated on speculative activity and apps, which is the main reason why crypto cycles are so violent. If we want the crypto ecosystem to be more sustainable and also start to get rid of these violent market cycles, we need to build more non-speculative apps. Gitcoin, POAP and ENS are among the most popular Ethereum apps right now.

*This summary is auto generated by a bot and not meant to replace reading the original article. As always, DYOR.*"	2d8d7cc8304fc279fd13750fc62bc3a3cdb9c009	True	False					0	1656951317		0	{}	ieu03h8	False	t3_vrawh8	False	True	t3_vrawh8	/r/ethereum/comments/vrawh8/speculation_nation_the_daily_gwei_511/ieu03h8/	1656951329	1	False	True	False	ethereum	t5_2zf9m	r/ethereum	public		0	[]													
361	[]	False		[deleted]						dark					[removed]	fe993932d6dced4c0a879e9aa5d7a6e0fbb467f5	True	False					0	1656951057		0	{}	ietzgtr	False	t3_vloh74	False	True	t3_vloh74	/r/ethereum/comments/vloh74/frequently_asked_questions_weekly_discussion/ietzgtr/	1656951074	1	False	True	False	ethereum	t5_2zf9m	r/ethereum	public		0	[]													
362	[]	False		gbersac			[]				text	t2_ifbxi	False	False	BAYC is status symbol. It's not a scam, it has that utility for some.	a89fab005deddc84a4aac5e39b491498eee7787f	True	False					0	1656950474		0	{}	iety2f9	False	t3_vr5wy2	False	True	t1_iet5jtl	/r/ethereum/comments/vr5wy2/the_biggest_headline_is_that_nft_sales_fell_by_72/iety2f9/	1656950487	1	False	True	False	ethereum	t5_2zf9m	r/ethereum	public		0	[]													
363	[]	False		Impossible-Example91			[]				text	t2_9usq5ygq	False	False	It’s wild how dumb some people are. The clown asked for the source, he was told, then claimed there was some argument being made, and proceeded to claim themselves the winner of an argument they were only having with themselves.	2434b6602cea2165298160600e9e0cd5135af355	True	False					0	1656950424		0	{}	ietxy20	False	t3_vq5vev	False	True	t1_ietxijg	/r/ethereum/comments/vq5vev/best_way_to_dca_into_eth/ietxy20/	1656950438	1	False	True	False	ethereum	t5_2zf9m	r/ethereum	public		0	[]													
