Unnamed: 0	all_awardings	archived	associated_award	author	author_flair_background_color	author_flair_css_class	author_flair_richtext	author_flair_template_id	author_flair_text	author_flair_text_color	author_flair_type	author_fullname	author_patreon_flair	author_premium	body	body_sha1	can_gild	collapsed	collapsed_because_crowd_control	collapsed_reason	collapsed_reason_code	comment_type	controversiality	created_utc	distinguished	gilded	gildings	id	is_submitter	link_id	locked	no_follow	parent_id	permalink	retrieved_utc	score	score_hidden	send_replies	stickied	subreddit	subreddit_id	subreddit_name_prefixed	subreddit_type	top_awarded_type	total_awards_received	treatment_tags	unrepliable_reason	author_cakeday	corpus	support	knowledge	conflict	power	similarity	fun	status	trust	identity	romance
95	[]	False		Squarebobspungelegs		noob	[{'e': 'text', 't': 'redditor for 3 months'}]	2ec8e69e-6c36-11e9-a04b-0afb553d4ea6	redditor for 3 months	dark	richtext	t2_jrzqajbe	False	False	Get a raspberry pi and install bitcoin wallet	9a5fc3541735b5f68d9e3aac52cd4f320d56af86	True	False					0	1652758507		0	{}	i8wm0y8	False	t3_urb3j4	False	True	t3_urb3j4	/r/Bitcoin/comments/urb3j4/which_wallet_would_best_be_for_bitcoinbeginner/i8wm0y8/	1652758522	1	True	True	False	Bitcoin	t5_2s3qj	r/Bitcoin	public		0	[]													
96	[]	False		vattenj			[]				text	t2_de72m	False	False	"Show blockchain traces, otherwise it did not happen 

So far I have not seen any blockchain traces published by them"	2f688eeda5a78e6edb03a4ecf225d51122bd6375	True	False					0	1652758506		0	{}	i8wm0vv	False	t3_uqwgjs	False	True	t1_i8tqljd	/r/Bitcoin/comments/uqwgjs/3_billion_in_bitcoin_was_sold_in_a_lastditch/i8wm0vv/	1652758522	1	True	True	False	Bitcoin	t5_2s3qj	r/Bitcoin	public		0	[]													
97	[]	False		intec82			[]				text	t2_enxx13a6	False	False	Why would you say all these stuff? I don't agree with you here.	439744e90bbdc91471bfff6611606d000ad34721	True	False					0	1652758502		0	{}	i8wm0lo	False	t3_upp3q2	False	False	t1_i8m3iyb	/r/Bitcoin/comments/upp3q2/been_buying_bitcoin_every_month_since_october/i8wm0lo/	1652758515	1	True	True	False	Bitcoin	t5_2s3qj	r/Bitcoin	public		0	[]													
98	[]	False		I_bench_10kgs			[]			dark	text	t2_9sgw9dpi	False	False	About as good a TA on this sub as I've ever seen	6a8411dfdece01148940818caecc8219dbbc2842	True	False					0	1652758498		0	{}	i8wm0fb	False	t3_urdfrk	False	True	t3_urdfrk	/r/Bitcoin/comments/urdfrk/usa_left_the_gold_standard_1970s_fiat_currency_is/i8wm0fb/	1652758515	1	True	True	False	Bitcoin	t5_2s3qj	r/Bitcoin	public		0	[]													
99	[]	False		According_Ad5882			[]				text	t2_7wed0quq	False	False	"""working in cryptocurrencies on wall street for 13 years""
C'mon man. Wtf is this"	7503e9ccc3285d514454e007ad05af7b00c63178	True	False					0	1652758492		0	{}	i8wm019	False	t3_uraxs9	False	True	t1_i8wesw5	/r/Bitcoin/comments/uraxs9/knowledge_about_bitcoin/i8wm019/	1652758508	1	True	True	False	Bitcoin	t5_2s3qj	r/Bitcoin	public		0	[]													
100	[]	False		HODLMEPLS			[]				text	t2_dnblf7	False	False	Agree but 2 gold eagles a month is $4000 not 40k	aa8574dfa3a772e978e6d3f2445e7ce21e4543ca	True	False					0	1652758482		0	{}	i8wlzex	False	t3_ur64qy	False	True	t1_i8vqd5g	/r/Bitcoin/comments/ur64qy/how_is_it_that_antiwork_crowd_can_see_the/i8wlzex/	1652758493	1	True	True	False	Bitcoin	t5_2s3qj	r/Bitcoin	public		0	[]													
101	[]	False		hcflight			[]				text	t2_d85wrk6t	False	False	That's right my man, we need to be that focused in our life.	9724a33cfeda2a1bb28c3d6080903d5348550a03	True	False					0	1652758481		0	{}	i8wlze0	False	t3_upp3q2	False	True	t1_i8ncgmv	/r/Bitcoin/comments/upp3q2/been_buying_bitcoin_every_month_since_october/i8wlze0/	1652758493	1	True	True	False	Bitcoin	t5_2s3qj	r/Bitcoin	public		0	[]													
102	[]	False		Vinnypaperhands			[]			dark	text	t2_ba95agep	False	False	Sounds like it works until it doesn't	c1df2edd7dac5f54273516501fe555481be27dd9	True	False					0	1652758441		0	{}	i8wlwwa	False	t3_urb0wj	False	True	t3_urb0wj	/r/Bitcoin/comments/urb0wj/buying_and_selling_to_make_a_few_grand/i8wlwwa/	1652758458	1	True	True	False	Bitcoin	t5_2s3qj	r/Bitcoin	public		0	[]													
103	[]	False		baltimore0256			[]				text	t2_e5o1h9vk	False	False	Gonna buy more and more, I was born ready for this.	ee2fdf14fab8689b2d74e47194274ee9c2713270	True	False					0	1652758433		0	{}	i8wlwer	False	t3_upvfim	False	True	t3_upvfim	/r/Bitcoin/comments/upvfim/the_next_612_months_will_be_the_best_opportunity/i8wlwer/	1652758451	1	True	True	False	Bitcoin	t5_2s3qj	r/Bitcoin	public		0	[]													
104	[]	False		[deleted]						dark					[removed]	fe993932d6dced4c0a879e9aa5d7a6e0fbb467f5	True	False					0	1652758431		0	{}	i8wlwbb	False	t3_ur31jq	False	True	t1_i8wkx8g	/r/Bitcoin/comments/ur31jq/bitcoin_addresses_with_a_balance_over_001_btc_hit/i8wlwbb/	1652758443	1	True	True	False	Bitcoin	t5_2s3qj	r/Bitcoin	public		0	[]													
105	[]	False		wizz135			[]				text	t2_cvcvi5ns	False	False	That is what I advice and tell everyone. You got patience you win and gain profits!	129ee8476bfd5d88234265bdc519059b4bad6ff9	True	False					0	1652758428		0	{}	i8wlw2v	False	t3_upp3q2	False	True	t1_i8n383m	/r/Bitcoin/comments/upp3q2/been_buying_bitcoin_every_month_since_october/i8wlw2v/	1652758443	1	True	True	False	Bitcoin	t5_2s3qj	r/Bitcoin	public		0	[]													
106	[]	False		dankie44			[]				text	t2_d9v8kneq	False	False	The best thing we human developed in bitcoin in this centre.	d22ef38e0ec92cdc3b870dc3fb6fe981b08c6210	True	False					0	1652758426		0	{}	i8wlvxt	False	t3_upp3q2	False	True	t1_i8nbz3f	/r/Bitcoin/comments/upp3q2/been_buying_bitcoin_every_month_since_october/i8wlvxt/	1652758444	1	True	True	False	Bitcoin	t5_2s3qj	r/Bitcoin	public		0	[]													
107	[]	False		trancamnam156		noob	[{'e': 'text', 't': 'redditor for 3 months'}]	2ec8e69e-6c36-11e9-a04b-0afb553d4ea6	redditor for 3 months	dark	richtext	t2_k779jm09	False	False	What does that mean? Is that some kind of a taunt or something?	e2b5f6b6a382df37f9c573b76fd27bc5176d589c	True	False					0	1652758417		0	{}	i8wlvds	False	t3_upp3q2	False	True	t1_i8mb5h7	/r/Bitcoin/comments/upp3q2/been_buying_bitcoin_every_month_since_october/i8wlvds/	1652758429	1	True	True	False	Bitcoin	t5_2s3qj	r/Bitcoin	public		0	[]													
108	[]	False		afBeaver			[]				text	t2_4isrj	False	False	Yeah, that sucks. This should be a lesson to everybody. Bitcoin is volatile like crazy and don’t buy with any money you can’t afford to lose. If you freak out about a massive dip you may have bought too much.	a5767bbe8014cec886f3f5e268541352917c55bc	True	False					0	1652758415		0	{}	i8wlv9p	False	t3_uqo8ox	False	True	t1_i8w9ttp	/r/Bitcoin/comments/uqo8ox/daily_discussion_may_16_2022/i8wlv9p/	1652758429	1	True	True	False	Bitcoin	t5_2s3qj	r/Bitcoin	public		0	[]													
109	[]	False		BuyRackTurk		noob	[{'e': 'text', 't': 'redditor for 3 months'}]	2ec8e69e-6c36-11e9-a04b-0afb553d4ea6	redditor for 3 months	dark	richtext	t2_kpdqrcx9	False	False	"&gt; Labor is only 20% of total product price. 

Thats not the reason. Its the extra money those workers would have to spend from their higher salaries that concerns the fed.

In short, they need someone to pay the tab for their reckless spending, and would prefer is the W2 wage slaves to take one for the team.

Bitcoin is the way to opt out."	c2e739162c69c1a2cb2fe9de4385bc81469fb34c	True	False					0	1652758405		0	{}	i8wluld	False	t3_ur64qy	False	True	t1_i8wlb0y	/r/Bitcoin/comments/ur64qy/how_is_it_that_antiwork_crowd_can_see_the/i8wluld/	1652758422	1	True	True	False	Bitcoin	t5_2s3qj	r/Bitcoin	public		0	[]													
110	[]	False		RueUbu			[]				text	t2_1rn2bz28	False	False	Since last night!	aeafe016e9e6ae292ced37389a9bbaf85f20f3fb	True	False					0	1652758402		0	{}	i8wluf0	False	t3_ur31jq	False	True	t1_i8vf8y5	/r/Bitcoin/comments/ur31jq/bitcoin_addresses_with_a_balance_over_001_btc_hit/i8wluf0/	1652758414	1	True	True	False	Bitcoin	t5_2s3qj	r/Bitcoin	public		0	[]													
111	[]	False		Independent-Snow-129		noob	[{'e': 'text', 't': 'redditor for 3 weeks'}]	2ec8e69e-6c36-11e9-a04b-0afb553d4ea6	redditor for 3 weeks	dark	richtext	t2_m3nv0rje	False	False	Mastering bitcoin by Andreas Antonopoulos !	9bf04f91f0aebe3bac0ed2a7828ddbff9e78ab3e	True	False					0	1652758387		0	{}	i8wlthr	False	t3_ur9ds7	False	True	t3_ur9ds7	/r/Bitcoin/comments/ur9ds7/research/i8wlthr/	1652758399	1	True	True	False	Bitcoin	t5_2s3qj	r/Bitcoin	public		0	[]													
112	[]	False		regard23			[]				text	t2_efr0fzl8	False	False	That's right and we must follow the man right now lol.	57b78fadba342fbdd1ad52a10356f1c10a7a607b	True	False					0	1652758386		0	{}	i8wltfw	False	t3_upvfim	False	True	t1_i8noi54	/r/Bitcoin/comments/upvfim/the_next_612_months_will_be_the_best_opportunity/i8wltfw/	1652758399	1	True	True	False	Bitcoin	t5_2s3qj	r/Bitcoin	public		0	[]													
113	[]	False		nino262596			[]				text	t2_d045ffl4	False	False	"This is the way kids. Buy, keep buying, never sell.

 Focus on your health and skills in real life. May Satoshis be with you ."	0f4d7532804d8216908203c99919189303b11e7b	True	False					0	1652758375		0	{}	i8wlsps	False	t3_upp3q2	False	True	t1_i8n2ay0	/r/Bitcoin/comments/upp3q2/been_buying_bitcoin_every_month_since_october/i8wlsps/	1652758385	1	True	True	False	Bitcoin	t5_2s3qj	r/Bitcoin	public		0	[]													
114	[]	False		harvester88			[]				text	t2_e24yrk2j	False	False	Good to know that, it's important for all of us to invest like that in coming days, we gotta invest more to secure our future, keep it up and invest more, good luck.	ab72eb71bd8fcab52d6a3687657537f1588d6f09	True	False					0	1652758360		0	{}	i8wlrr4	False	t3_upp3q2	False	True	t1_i8nfc4m	/r/Bitcoin/comments/upp3q2/been_buying_bitcoin_every_month_since_october/i8wlrr4/	1652758371	1	True	True	False	Bitcoin	t5_2s3qj	r/Bitcoin	public		0	[]													
115	[]	False		ffeng271			[]				text	t2_dh1sj536	False	False	I don't think he got some real traffic on the blogs but maybe he will get this in coming time if he keep investing and keep sharing his experience in the future.	1387898ff7f4606316112c96776bbecd9e060422	True	False					0	1652758357		0	{}	i8wlrkv	False	t3_upp3q2	False	True	t1_i8nhfqf	/r/Bitcoin/comments/upp3q2/been_buying_bitcoin_every_month_since_october/i8wlrkv/	1652758371	1	True	True	False	Bitcoin	t5_2s3qj	r/Bitcoin	public		0	[]													
116	[]	False		medemskiy			[]				text	t2_ctc5owsh	False	False	"He got a really good profit going at this point and a fantastic market position with a multiple gain on top of it. 

His sitting really good, good work."	aec07ce7daf82122f34b195a91bced71d7f7997d	True	False					0	1652758342		0	{}	i8wlqnu	False	t3_upp3q2	False	True	t1_i8mn2o4	/r/Bitcoin/comments/upp3q2/been_buying_bitcoin_every_month_since_october/i8wlqnu/	1652758357	1	True	True	False	Bitcoin	t5_2s3qj	r/Bitcoin	public		0	[]													
117	[]	False		[deleted]						dark					[removed]	fe993932d6dced4c0a879e9aa5d7a6e0fbb467f5	True	False					0	1652758334		0	{}	i8wlq7b	False	t3_ur1qu2	False	True	t3_ur1qu2	/r/Bitcoin/comments/ur1qu2/grandtheft_inflation/i8wlq7b/	1652758349	1	True	True	False	Bitcoin	t5_2s3qj	r/Bitcoin	public		0	[]													
118	[]	False		na3than			[]				text	t2_qio81jk	False	False	"&gt;My uncle has been working in cryptocurrencies on Wall Street for 13 years.

Tell us more. I'm dying to hear the tales of this 13 year veteran Wall Street crypto trader."	468d7e0b1ef80e001f56a04b3ba4ba8341196b05	True	False					0	1652758318		0	{}	i8wlp7y	False	t3_uraxs9	False	True	t1_i8wesw5	/r/Bitcoin/comments/uraxs9/knowledge_about_bitcoin/i8wlp7y/	1652758335	1	True	True	False	Bitcoin	t5_2s3qj	r/Bitcoin	public		0	[]													
119	[]	False		According_Ad5882			[]				text	t2_7wed0quq	False	False	You're never gonna be ready for the 20% pump or dump.	e90604d0add5711df43c8421d6caa1fd33445376	True	False					0	1652758304		0	{}	i8wlod0	False	t3_urb0wj	False	True	t3_urb0wj	/r/Bitcoin/comments/urb0wj/buying_and_selling_to_make_a_few_grand/i8wlod0/	1652758321	1	True	True	False	Bitcoin	t5_2s3qj	r/Bitcoin	public		0	[]													
120	[]	False		ccrooster2			[]				text	t2_4d6l6nj9	False	False	It take 2 people to work and that still middle class.	eda2eac946cb3131c2e54d794f985d98b80adece	True	False					0	1652758297		0	{}	i8wlnvz	False	t3_urdfrk	False	True	t3_urdfrk	/r/Bitcoin/comments/urdfrk/usa_left_the_gold_standard_1970s_fiat_currency_is/i8wlnvz/	1652758313	1	True	True	False	Bitcoin	t5_2s3qj	r/Bitcoin	public		0	[]													
121	[]	False		[deleted]						dark					[removed]	fe993932d6dced4c0a879e9aa5d7a6e0fbb467f5	True	False					0	1652758266		0	{}	i8wllxh	False	t3_tk73um	False	True	t3_tk73um	/r/Bitcoin/comments/tk73um/run_bitcoin_run/i8wllxh/	1652758284	1	True	True	False	Bitcoin	t5_2s3qj	r/Bitcoin	public		0	[]													
122	[]	False		BuyRackTurk		noob	[{'e': 'text', 't': 'redditor for 3 months'}]	2ec8e69e-6c36-11e9-a04b-0afb553d4ea6	redditor for 3 months	dark	richtext	t2_kpdqrcx9	False	False	"&gt; If a person has a problem with the r/antiwork crowd, it's got nothing to do with Bitcoin and everything to do with the biases they've been programmed with. 

Lol, it has more to do with the outrageously idiotic proposals they make, and their insane ideas as to how economics or the world works. 

If you think that the antiwork crowd are anything but a bunch of useful idiots and bots, you are just not being logical.

&gt; No amount of Austrian economic buzzwords will change that.

Buzzwords? The actual concepts of austrian economics and bitcoin are exactly pointing out the gap that separates antiwork zombies from escaping their self-imposed drudgery."	c00d0c67148067eb1a707caf5ec54e378319f1e4	True	False					0	1652758250		0	{}	i8wlkw6	False	t3_ur64qy	False	True	t1_i8vtlli	/r/Bitcoin/comments/ur64qy/how_is_it_that_antiwork_crowd_can_see_the/i8wlkw6/	1652758262	1	True	True	False	Bitcoin	t5_2s3qj	r/Bitcoin	public		0	[]													
123	[]	False		canadas			[]				text	t2_5jum8	False	False	So I will what, no buy food everyday? not replace my TV when it breaks?  Somehow live without a car it it dies?	280bc04128b01e49a341d8327cf61e31e1d746c7	True	False					0	1652758221		0	{}	i8wlj3x	False	t3_ur64qy	False	True	t1_i8vjjvv	/r/Bitcoin/comments/ur64qy/how_is_it_that_antiwork_crowd_can_see_the/i8wlj3x/	1652758233	1	True	True	False	Bitcoin	t5_2s3qj	r/Bitcoin	public		0	[]													
124	[]	False		According_Ad5882			[]				text	t2_7wed0quq	False	False	A little now, a little later, a little after that	3296305da40b571e89c66c32a173e0970e5362a3	True	False					0	1652758203		0	{}	i8wlhyo	False	t3_urc69c	False	True	t3_urc69c	/r/Bitcoin/comments/urc69c/btc_question/i8wlhyo/	1652758218	1	True	True	False	Bitcoin	t5_2s3qj	r/Bitcoin	public		0	[]													
125	[]	False		Cyeda			[]				text	t2_e2v1zl3n	False	False	Keep investing you all, no need to think about anything else.	5a322bb26d4045346dae8f981c23c97bed01e48f	True	False					0	1652758188		0	{}	i8wlh1r	False	t3_upvfim	False	True	t3_upvfim	/r/Bitcoin/comments/upvfim/the_next_612_months_will_be_the_best_opportunity/i8wlh1r/	1652758205	1	True	True	False	Bitcoin	t5_2s3qj	r/Bitcoin	public		0	[]													
126	[]	False		nxdesign			[]				text	t2_dn9o14ti	False	False	Stacking is the only thing we all have to focus on now.	133b3909456f95687e798249193d28a2fd885c5e	True	False					0	1652758186		0	{}	i8wlgxw	False	t3_upp3q2	False	False	t1_i8m47wa	/r/Bitcoin/comments/upp3q2/been_buying_bitcoin_every_month_since_october/i8wlgxw/	1652758205	1	True	True	False	Bitcoin	t5_2s3qj	r/Bitcoin	public		0	[]													
127	[]	False		Marcion_Sinope			[]				text	t2_gv0j0hg	False	False	LN is inevitable.	5deb0a169c99266ebadb2e8cca6d87b701f6f343	True	False					0	1652758179		0	{}	i8wlgha	False	t3_urafk1	False	True	t3_urafk1	/r/Bitcoin/comments/urafk1/meta_adopts_bitcoin_after_its_own_stablecoin/i8wlgha/	1652758197	1	True	True	False	Bitcoin	t5_2s3qj	r/Bitcoin	public		0	[]													
128	[]	False		clapperhead			[]				text	t2_e5mn5z36	False	False	Very cool story here, good luck to you and cheers to an ATH in September .	ef95528aee7b209481568c3681fa307ebf6dd503	True	False					0	1652758178		0	{}	i8wlgft	False	t3_upp3q2	False	True	t1_i8m8mdl	/r/Bitcoin/comments/upp3q2/been_buying_bitcoin_every_month_since_october/i8wlgft/	1652758189	1	True	True	False	Bitcoin	t5_2s3qj	r/Bitcoin	public		0	[]													
129	[]	False		ghbdtns			[]				text	t2_gx86kte0	False	False	Indeed loved that the sub has always been a source to encourage me.	5b6083f845f2b72d6a99fd2dfd25b0b1dfe2b728	True	False					0	1652758171		0	{}	i8wlg0y	False	t3_upp3q2	False	True	t1_i8m3qk4	/r/Bitcoin/comments/upp3q2/been_buying_bitcoin_every_month_since_october/i8wlg0y/	1652758190	1	True	True	False	Bitcoin	t5_2s3qj	r/Bitcoin	public		0	[]													
130	[]	False		developeron29			[]				text	t2_i2kb7	False	False	DMs incoming. Don't trust her. speaking from experience	5011a4cc749b4edb3198919cf47092ec1c3fca71	True	False					0	1652758142		0	{}	i8wle7k	False	t3_ur31jq	False	True	t1_i8urxau	/r/Bitcoin/comments/ur31jq/bitcoin_addresses_with_a_balance_over_001_btc_hit/i8wle7k/	1652758153	1	True	True	False	Bitcoin	t5_2s3qj	r/Bitcoin	public		0	[]													
131	[]	False		Shepherd818			[]				text	t2_eo3zsb38	False	False	Still that would be enough if you keep investing those 50 dollars every month at least for 10 years, it will give a lot of returns after some time my man, good luck.	4f2ce3a0b6cba79e12b6e3d34c168515b79c3900	True	False					0	1652758119		0	{}	i8wlctf	False	t3_upp3q2	False	True	t1_i8ng2nn	/r/Bitcoin/comments/upp3q2/been_buying_bitcoin_every_month_since_october/i8wlctf/	1652758131	1	True	True	False	Bitcoin	t5_2s3qj	r/Bitcoin	public		0	[]													
132	[]	False		Plenty_System45			[]				text	t2_3f9ie2wd	False	False	The time to accumulate 1 whole BTC is now!	b01816ec64936ab7fab160c63bb4eafe4dc739d4	True	False					0	1652758115		0	{}	i8wlck4	False	t3_ur2ph0	False	True	t3_ur2ph0	/r/Bitcoin/comments/ur2ph0/bitcoin_addresses_holding_1_or_more_btc_hits_a/i8wlck4/	1652758132	1	True	True	False	Bitcoin	t5_2s3qj	r/Bitcoin	public		0	[]													
133	[]	False		baconcheeseburgarian			[]				text	t2_49jcesdf	False	False	"&gt; So they think raising wages cause inflation.

Fuel costs, supply line problems and trillions in borrowed debt getting an interest rate increase are what is primarily driving inflation, not wages.  Labor is only 20% of total product price.  The largest costs are materials and shipping.  One member of the Fed suggested a temporary corporate hiring freeze as a tool to fight inflation.  Clearly there are many other factors driving this surge."	093dd209857fa6a98125f2558ed209506aec724a	True	False					0	1652758090		0	{}	i8wlb0y	False	t3_ur64qy	False	True	t1_i8wk2ur	/r/Bitcoin/comments/ur64qy/how_is_it_that_antiwork_crowd_can_see_the/i8wlb0y/	1652758103	1	True	True	False	Bitcoin	t5_2s3qj	r/Bitcoin	public		0	[]													
134	[]	False		mrjoke2011			[]				text	t2_d4xzt5w5	False	False	Always buy the sat and keep holding no matter what the situation arises!	47cee0cc1aa1295ea8a12d248107349dcbc9197a	True	False					0	1652758088		0	{}	i8wlawh	False	t3_upp3q2	False	True	t1_i8m7gyb	/r/Bitcoin/comments/upp3q2/been_buying_bitcoin_every_month_since_october/i8wlawh/	1652758103	1	True	True	False	Bitcoin	t5_2s3qj	r/Bitcoin	public		0	[]													
135	[]	False		jburianek			[]				text	t2_dft77oo4	False	False	True that, stacking is the best thing we got and we need to follow it.	da6bc0185aacb7db4bd65541ef62ad45e9076243	True	False					0	1652758088		0	{}	i8wlavu	False	t3_upp3q2	False	True	t1_i8nhg6y	/r/Bitcoin/comments/upp3q2/been_buying_bitcoin_every_month_since_october/i8wlavu/	1652758103	1	True	True	False	Bitcoin	t5_2s3qj	r/Bitcoin	public		0	[]													
136	[]	False		Eternal12equiem			[]				text	t2_a28e5bjx	False	False	U going to say zoom out when it’s 2030 and it’s still at its current price. Zoom out assume it’s constantly going up. Nothing goes only up long term.	b2bcc76a180917daeabd018e6849cbdc2e25c859	True	False					0	1652758077		0	{}	i8wla6z	False	t3_uqsovd	False	True	t1_i8tp808	/r/Bitcoin/comments/uqsovd/even_with_bitcoin_at_30k_microstrategy_and_tesla/i8wla6z/	1652758088	1	True	True	False	Bitcoin	t5_2s3qj	r/Bitcoin	public		0	[]													
137	[]	False		Mangalz			[]				text	t2_69sac	False	False	Kraken ceo is also based AF.	b676f44bf591f5e3050bfb27e37405baab6bff7b	True	False					0	1652758077		0	{}	i8wla5j	False	t3_uqzm2h	False	True	t3_uqzm2h	/r/Bitcoin/comments/uqzm2h/wyoming_1st_place_in_world_to_recognize_digital/i8wla5j/	1652758088	1	True	True	False	Bitcoin	t5_2s3qj	r/Bitcoin	public		0	[]													
138	[]	False		mgd09292007			[]				text	t2_1leklrj	False	False	This guy maths	0eb6f04d1f454337f0127d1014292dc08d20dbe3	True	False					0	1652758075		0	{}	i8wla2i	False	t3_ur31jq	False	True	t1_i8w366q	/r/Bitcoin/comments/ur31jq/bitcoin_addresses_with_a_balance_over_001_btc_hit/i8wla2i/	1652758089	1	True	True	False	Bitcoin	t5_2s3qj	r/Bitcoin	public		0	[]													
139	[]	False		btcgreys			[]				text	t2_dieczcl3	False	False	Yeah we can see that shit right now, it looks like that.	56cb6fed9d3b4f0e6e5fc94f63bff155c777c074	True	False					0	1652758070		0	{}	i8wl9qm	False	t3_upp3q2	False	True	t1_i8mc8et	/r/Bitcoin/comments/upp3q2/been_buying_bitcoin_every_month_since_october/i8wl9qm/	1652758082	1	True	True	False	Bitcoin	t5_2s3qj	r/Bitcoin	public		0	[]													
140	[]	False		schmidtaltenburg			[]				text	t2_ij78appw	False	False	Well these people are from some other crytpo market lol.	bbc97ec94dfc513679d54b619efa90cc7d4a0b23	True	False					0	1652758068		0	{}	i8wl9lg	False	t3_upp3q2	False	True	t1_i8m3nxi	/r/Bitcoin/comments/upp3q2/been_buying_bitcoin_every_month_since_october/i8wl9lg/	1652758082	1	True	True	False	Bitcoin	t5_2s3qj	r/Bitcoin	public		0	[]													
141	[]	False		Jmp-U235			[]				text	t2_92bv46dt	False	False	Tell me if you're rich	a192a628faf72a3d76d34c624ca7d0585bdfa12a	True	False					0	1652758045		0	{}	i8wl84u	False	t3_uqtg9t	False	True	t3_uqtg9t	/r/Bitcoin/comments/uqtg9t/found_this_old_bitcoin_hard_drive_how_do_i_check/i8wl84u/	1652758060	1	True	True	False	Bitcoin	t5_2s3qj	r/Bitcoin	public		0	[]													
142	[]	False		qiwibiz		noob	[{'e': 'text', 't': 'redditor for 3 months'}]	2ec8e69e-6c36-11e9-a04b-0afb553d4ea6	redditor for 3 months	dark	richtext	t2_k6pdlbbj	False	False	Further we go with Bitcoin though, just go with the flow and yo won't be disappointed!	57828602d362772194d032c237fda01815529863	True	False					0	1652758040		0	{}	i8wl7tg	False	t3_upp3q2	False	True	t1_i8mhcin	/r/Bitcoin/comments/upp3q2/been_buying_bitcoin_every_month_since_october/i8wl7tg/	1652758053	1	True	True	False	Bitcoin	t5_2s3qj	r/Bitcoin	public		0	[]													
143	[]	False		Vendura663			[]				text	t2_gcq7cwv	False	False	"Did you just discovered trading?

I hope you know you're going to get taxed on every sale"	c07a9e6847fa12c7939a4ad3aa07b5bf39d8ab73	True	False					0	1652758034		0	{}	i8wl7f7	False	t3_urb0wj	False	True	t3_urb0wj	/r/Bitcoin/comments/urb0wj/buying_and_selling_to_make_a_few_grand/i8wl7f7/	1652758045	1	True	True	False	Bitcoin	t5_2s3qj	r/Bitcoin	public		0	[]													
144	[]	False		thfrey63			[]				text	t2_gwr5u514	False	False	Let's hope for the best and believe in the great future of cryptocurrency.	9a4ded54bb3267fca43e716b760fb0ad0e5b34bf	True	False					0	1652758023		0	{}	i8wl6ra	False	t3_upp3q2	False	True	t1_i8mce8n	/r/Bitcoin/comments/upp3q2/been_buying_bitcoin_every_month_since_october/i8wl6ra/	1652758038	1	True	True	False	Bitcoin	t5_2s3qj	r/Bitcoin	public		0	[]													
145	[]	False		javico88			[]				text	t2_eeqolj3e	False	False	That seems like a great idea after all though like this would help people store and use Bitcoin.	7aeba0af2e2af7db44e7e53197168e2469e6ab0a	True	False					0	1652758014		0	{}	i8wl67d	False	t3_upp3q2	False	True	t1_i8mjygu	/r/Bitcoin/comments/upp3q2/been_buying_bitcoin_every_month_since_october/i8wl67d/	1652758032	1	True	True	False	Bitcoin	t5_2s3qj	r/Bitcoin	public		0	[]													
146	[]	False		Corbimos			[]				text	t2_4lr1o	False	False	Read The Mandibles. This sounds exactly like one of the characters as he's being shit on by the system. Complete denial.	f2bdd233cf7dc3fd2095d29af24490db14a2ef11	True	False					0	1652758008		0	{}	i8wl5up	False	t3_uqo8ox	False	True	t1_i8u1496	/r/Bitcoin/comments/uqo8ox/daily_discussion_may_16_2022/i8wl5up/	1652758024	1	True	True	False	Bitcoin	t5_2s3qj	r/Bitcoin	public		0	[]													
147	[]	False		omgitzdpwner		noob	[{'e': 'text', 't': 'redditor for 3 months'}]	2ec8e69e-6c36-11e9-a04b-0afb553d4ea6	redditor for 3 months	dark	richtext	t2_jxreg52o	False	False	That's what I am agreeing to, it's really important infront of jackasses.	2ed8ab2eb5ae392b4473d3790250c49e7c59df8c	True	False					0	1652758007		0	{}	i8wl5s3	False	t3_upp3q2	False	True	t1_i8m5vsy	/r/Bitcoin/comments/upp3q2/been_buying_bitcoin_every_month_since_october/i8wl5s3/	1652758024	1	True	True	False	Bitcoin	t5_2s3qj	r/Bitcoin	public		0	[]													
148	[]	False		nationshelf			[]				text	t2_20se6avt	False	False	Yes. Even if it’s just $20.	e8702da579d654a27e85b39585e83a26ffca1797	True	False					0	1652758002		0	{}	i8wl5fz	False	t3_uqo8ox	False	True	t1_i8vbett	/r/Bitcoin/comments/uqo8ox/daily_discussion_may_16_2022/i8wl5fz/	1652758017	1	True	True	False	Bitcoin	t5_2s3qj	r/Bitcoin	public		0	[]													
149	[]	False		joebode27		noob	[{'e': 'text', 't': 'redditor for 3 months'}]	2ec8e69e-6c36-11e9-a04b-0afb553d4ea6	redditor for 3 months	dark	richtext	t2_khnn2630	False	False	He is holding for sure, I can sense that shit right now.	659cd4a0160ab405741f6efab96033d7e117c3eb	True	False					0	1652757988		0	{}	i8wl4jc	False	t3_upp3q2	False	True	t1_i8nk4u2	/r/Bitcoin/comments/upp3q2/been_buying_bitcoin_every_month_since_october/i8wl4jc/	1652758003	1	True	True	False	Bitcoin	t5_2s3qj	r/Bitcoin	public		0	[]													
