Unnamed: 0	all_awardings	archived	associated_award	author	author_flair_background_color	author_flair_css_class	author_flair_richtext	author_flair_template_id	author_flair_text	author_flair_text_color	author_flair_type	author_fullname	author_patreon_flair	author_premium	body	body_sha1	can_gild	collapsed	collapsed_because_crowd_control	collapsed_reason	collapsed_reason_code	comment_type	controversiality	created_utc	distinguished	gilded	gildings	id	is_submitter	link_id	locked	no_follow	parent_id	permalink	retrieved_utc	score	score_hidden	send_replies	stickied	subreddit	subreddit_id	subreddit_name_prefixed	subreddit_type	top_awarded_type	total_awards_received	treatment_tags	unrepliable_reason	author_cakeday	corpus	support	knowledge	conflict	power	similarity	fun	status	trust	identity	romance
146	[]	False		throwawayagin			[]				text	t2_49j26	False	False	"&gt;I have been toying with the idea of setting up multipath TCP now as linux supports it well with later versions, but it's still a bit esoteric for me. 

Yea pretty much what I was curious about too. Thanks for the info."	1758399c8bdbe658ca024b407182639f6e8861cb	True	False					0	1661048192		0	{}	il56pmx	False	t3_wt8cx2	False	True	t1_il55qjt	/r/Bitcoin/comments/wt8cx2/while_all_the_fud_is_going_on_i_have_decided_to/il56pmx/	1661048207	1	True	True	False	Bitcoin	t5_2s3qj	r/Bitcoin	public		0	[]													
147	[]	False		EvaUnit_03			[]				text	t2_4u6zh2fl	False	False	It already did that today and yesterday. You're 2 days late and and updoot short, friend!	94a579d6b289b1deec789385e318ec3bc6955804	True	False					0	1661048081		0	{}	il56hm1	False	t3_wtny4b	False	True	t3_wtny4b	/r/Bitcoin/comments/wtny4b/bitcoin_is_going_below_21000_tomorrow/il56hm1/	1661048092	1	True	True	False	Bitcoin	t5_2s3qj	r/Bitcoin	public		0	[]													
148	[]	False		textreply			[]			dark	text	t2_63xi9w29	False	False	There used to be one a few years ago. Where you could win actual bitcoin, I mean. I wonder what happened to it.	24231143435f78d928d038bd9a08a83c3000b27a	True	False					0	1661048022		0	{}	il56ddc	False	t3_wtevnz	False	True	t1_il4osgr	/r/Bitcoin/comments/wtevnz/announcing_sat_battle_a_platform_100_powered_by/il56ddc/	1661048033	1	True	True	False	Bitcoin	t5_2s3qj	r/Bitcoin	public		0	[]													
149	[]	False		varikonniemi			[]				text	t2_5pv5t	False	False	in what sense? A phone looks very minimal compared to that monstrosity.	75d205e144d35b6b92db21593a2f9af142f37bb3	True	False					0	1661047967		0	{}	il569b0	False	t3_wszvmn	False	True	t1_il560a8	/r/Bitcoin/comments/wszvmn/what_a_cute_digital_picture_frame_where_did_you/il569b0/	1661047981	1	True	True	False	Bitcoin	t5_2s3qj	r/Bitcoin	public		0	[]													
150	[]	False		senmi777			[]				text	t2_di0nyw2h	False	False	"It is actually eye catching and I personally loved it in either of the ways !

keep up with these great ideas, its something that actually lovely to be as a wallpapet, love Bitcoin, love crypto"	72ef1657b0487d8e23a7ceab6d51267fd6bc8b1d	True	False					0	1661047879		0	{}	il562yw	False	t3_wszvmn	False	True	t1_il1dhqo	/r/Bitcoin/comments/wszvmn/what_a_cute_digital_picture_frame_where_did_you/il562yw/	1661047893	1	True	True	False	Bitcoin	t5_2s3qj	r/Bitcoin	public		0	[]													
151	[]	False		throwawayagin			[]				text	t2_49j26	False	False	Or run it pruned.	b74bedddfed4354013dd29cd36ef20a7e0e8d6eb	True	False					0	1661047845		0	{}	il560kr	False	t3_wt8cx2	False	True	t1_il2rt0y	/r/Bitcoin/comments/wt8cx2/while_all_the_fud_is_going_on_i_have_decided_to/il560kr/	1661047858	1	True	True	False	Bitcoin	t5_2s3qj	r/Bitcoin	public		0	[]													
152	[]	False		Grouchy_Artichoke_90			[]			dark	text	t2_kykwqive	False	False	I think the point is minimalism	d11f4da09c190a2b96bc576e9dd2f6e20d934f0e	True	False					0	1661047841		0	{}	il560a8	False	t3_wszvmn	False	True	t1_il54usq	/r/Bitcoin/comments/wszvmn/what_a_cute_digital_picture_frame_where_did_you/il560a8/	1661047854	1	True	True	False	Bitcoin	t5_2s3qj	r/Bitcoin	public		0	[]													
153	[]	False		textreply			[]			dark	text	t2_63xi9w29	False	False	"&gt; I wonder if any visitors to my place will catch on to what it is

Van Gogh - The Starry Night"	18c5bcae4e4f7f8a989825f6e19471a29ea22dce	True	False					0	1661047799		0	{}	il55x7n	False	t3_wszvmn	False	True	t1_il1dhqo	/r/Bitcoin/comments/wszvmn/what_a_cute_digital_picture_frame_where_did_you/il55x7n/	1661047811	1	True	True	False	Bitcoin	t5_2s3qj	r/Bitcoin	public		0	[]													
154	[]	False		varikonniemi			[]				text	t2_5pv5t	False	False	it makes the connection drop and retry with new connection	62922a50cf15e72ea8a7e3ea00fce86f1873cd40	True	False					0	1661047706		0	{}	il55qjt	False	t3_wt8cx2	False	True	t1_il55jge	/r/Bitcoin/comments/wt8cx2/while_all_the_fud_is_going_on_i_have_decided_to/il55qjt/	1661047720	1	True	True	False	Bitcoin	t5_2s3qj	r/Bitcoin	public		0	[]													
155	[]	False		throwawayagin			[]				text	t2_49j26	False	False	"I'd reccomend you check out the RaspiBlitz project too.

/r/Raspiblitz"	9b8f80d6e7eb81519f49f9ce7c5ad8320efda9ba	True	False					0	1661047702		0	{}	il55q9e	False	t3_wt8cx2	False	True	t1_il3sqso	/r/Bitcoin/comments/wt8cx2/while_all_the_fud_is_going_on_i_have_decided_to/il55q9e/	1661047716	1	True	True	False	Bitcoin	t5_2s3qj	r/Bitcoin	public		0	[]													
156	[]	False		throwawayagin			[]				text	t2_49j26	False	False	Have you tested the failover to cell well on that?	eecd775a30d2e724548a326cf34d9d18bbba4d26	True	False					0	1661047611		0	{}	il55jge	False	t3_wt8cx2	False	True	t1_il508zk	/r/Bitcoin/comments/wt8cx2/while_all_the_fud_is_going_on_i_have_decided_to/il55jge/	1661047622	1	True	True	False	Bitcoin	t5_2s3qj	r/Bitcoin	public		0	[]													
157	[]	False		Salti21			[]			dark	text	t2_bsqiwcmh	False	False	I have zero issues with coinbase besides them holding half my coins for 6 days.  After 6 days always released then I send to cold storage.	bb7eadaf9b8089919122d4e4834824c44cb72dc4	True	False					0	1661047575		0	{}	il55gs5	False	t3_wth6dl	False	True	t1_il458u9	/r/Bitcoin/comments/wth6dl/buy_the_dip/il55gs5/	1661047592	1	True	True	False	Bitcoin	t5_2s3qj	r/Bitcoin	public		0	[]													
158	[]	False		escape1979uk			[]				text	t2_2pt360cx	False	False	"&gt;This guy was (still is?) very important figure to the BTC community

Sounds like someone hitching their wagon IMO. 

I might be wrong. I often am.."	b4201271a597598dd582650ae3c70d94edd08317	True	False					0	1661047563		0	{}	il55fvr	False	t3_wtjygw	False	True	t1_il549do	/r/Bitcoin/comments/wtjygw/what_happened_to_nick_szabo/il55fvr/	1661047576	1	True	True	False	Bitcoin	t5_2s3qj	r/Bitcoin	public		0	[]													
159	[]	False		86F63243ffD4			[]				text	t2_lik0l43m	False	False	But we all know that Bitcoin gonna change the fiat system and it is going to be accepted everywhere	7f0a68489184baece54c8c7020fb00ec22d8e6b6	True	False					0	1661047552		0	{}	il55f2w	False	t3_wsrdp8	False	True	t1_il1ipm5	/r/Bitcoin/comments/wsrdp8/we_need_merchant_adoption_so_we_dont_have_to_sell/il55f2w/	1661047569	1	True	True	False	Bitcoin	t5_2s3qj	r/Bitcoin	public		0	[]													
160	[]	False		cyberlacs			[]				text	t2_exuympsl	False	False	This is a great work done by the team, kudos to them, lovely appreciated work	e12b828a9e2c43676b7736245b74788319e08451	True	False					0	1661047544		0	{}	il55egv	False	t3_wt5n33	False	True	t3_wt5n33	/r/Bitcoin/comments/wt5n33/bitcoin_donors_fund_and_construct_clean_water/il55egv/	1661047561	1	True	True	False	Bitcoin	t5_2s3qj	r/Bitcoin	public		0	[]													
161	[]	False		PastaOleary			[]				text	t2_d4t3f	False	False	Just sent this to a friend in New Hampshire who will now be voting for Bruce Fenton.	962fbaae07c0843993a01f73570dafdf73b79d85	True	False					0	1661047528		0	{}	il55dab	False	t3_wte9wq	False	True	t3_wte9wq	/r/Bitcoin/comments/wte9wq/nh_united_states_senate_debate_question_on_bitcoin/il55dab/	1661047546	1	True	True	False	Bitcoin	t5_2s3qj	r/Bitcoin	public		0	[]													
162	[]	False		ptmplop			[]			dark	text	t2_55lu3jt8	False	False	TikTok has all the answers, nobody knows anything here	d7b9aa539d09c4d392cae687e36d684ed4b9695b	True	False					0	1661047520		0	{}	il55cpn	False	t3_wtkxgi	False	True	t3_wtkxgi	/r/Bitcoin/comments/wtkxgi/any_thoughts_on_the_mtgox_situation_do_u_guys/il55cpn/	1661047531	1	True	True	False	Bitcoin	t5_2s3qj	r/Bitcoin	public		0	[]													
163	[]	False		Major_Bandicoot_3239			[]				text	t2_9wasajqw	False	False	0.6% of all Bitcoin. Doesn’t seem like it will matter much. Even if it was all sold at once (which won’t happen)	d491f5b6a7db96a8ff4dd39d82b1a9a6799171f2	True	False					0	1661047520		0	{}	il55cph	False	t3_wtkxgi	False	True	t3_wtkxgi	/r/Bitcoin/comments/wtkxgi/any_thoughts_on_the_mtgox_situation_do_u_guys/il55cph/	1661047531	1	True	True	False	Bitcoin	t5_2s3qj	r/Bitcoin	public		0	[]													
164	[]	False		bstardif			[]				text	t2_h6oaw	False	False	It was. I noticed it was unpinned around the same time the hodlnaught vs Craig post was pinned so possibly just to get some attention on that so people don't miss what's going on? To be honest today's daily has been pretty full of either bots or buttcoiners so no major loss.	c56305209c2feed35f5e90ea081420ef191a9712	True	False					0	1661047361		0	{}	il550mi	False	t3_wsyq8o	False	True	t1_il4zqlh	/r/Bitcoin/comments/wsyq8o/daily_discussion_august_20_2022/il550mi/	1661047377	1	True	True	False	Bitcoin	t5_2s3qj	r/Bitcoin	public		0	[]													
165	[]	False		varikonniemi			[]				text	t2_5pv5t	False	False	have you considered using a mobile phone for that? Cheaper, more features.	b8421e6390a37b4a3b073815a6c95e7b301489b7	True	False					0	1661047281		0	{}	il54usq	False	t3_wszvmn	False	True	t1_il1pd0z	/r/Bitcoin/comments/wszvmn/what_a_cute_digital_picture_frame_where_did_you/il54usq/	1661047293	1	True	True	False	Bitcoin	t5_2s3qj	r/Bitcoin	public		0	[]													
166	[]	False		Rtbrosk			[]				text	t2_7i9xvv9q	False	False	So me the data that they will sell......its just an opinion.....or FUD	b92cf7939e0c8c0e48d6b61ef8dde1b9bc2593ff	True	False					0	1661047244		0	{}	il54s2t	False	t3_wtkxgi	False	True	t1_il4zwah	/r/Bitcoin/comments/wtkxgi/any_thoughts_on_the_mtgox_situation_do_u_guys/il54s2t/	1661047261	1	True	True	False	Bitcoin	t5_2s3qj	r/Bitcoin	public		0	[]													
167	[]	False		rBitcoinMod			[]				text	t2_tcsf5	False	False	"Your submission has been flagged for removal because it doesn't meet the quality standards for /r/Bitcoin at this time. Please help keep the subreddit clean from low quality posts.

^^I ^^am ^^a ^^bot ^^and ^^cannot ^^respond. ^^Please ^^contact ^^r/Bitcoin ^^moderators [^^directly ^^via ^^mod ^^mail](https://www.reddit.com/message/compose?to=%2Fr%2FBitcoin) ^^if ^^you ^^have ^^questions."	7f47cb61e3880cbcec652e5c0ab78630b03152cc	True	False					0	1661047231	moderator	0	{}	il54r5y	False	t3_wtl2gg	False	True	t3_wtl2gg	/r/Bitcoin/comments/wtl2gg/bitcoin_lucifer_shiva/il54r5y/	1661047245	1	True	True	True	Bitcoin	t5_2s3qj	r/Bitcoin	public		0	[]													
168	[]	False		rBitcoinMod			[]				text	t2_tcsf5	False	False	"Your submission has been flagged for removal because it is considered off topic for the Bitcoin subreddit.

^^I ^^am ^^a ^^bot ^^and ^^cannot ^^respond. ^^Please ^^contact ^^r/Bitcoin ^^moderators [^^directly ^^via ^^mod ^^mail](https://www.reddit.com/message/compose?to=%2Fr%2FBitcoin) ^^if ^^you ^^have ^^questions."	3ba714eb30fd78d354769e5288e68861c7ff12f7	True	False					0	1661047219	moderator	0	{}	il54q7y	False	t3_wtk5sz	False	True	t3_wtk5sz	/r/Bitcoin/comments/wtk5sz/the_lawsuit_are_pilingup_its_a_bad_time_to_be_a/il54q7y/	1661047232	1	True	True	True	Bitcoin	t5_2s3qj	r/Bitcoin	public		0	[]													
169	[]	False		TheGreatMuffin			[]				text	t2_j5h9i	False	False	No, Hodlonaut is a bitcoiner/Twitter user, not related to Hodlnaut the company	e843abe5edbfd9380f49d1cc791c60dba1e22e27	True	False					0	1661047113		0	{}	il54ifz	True	t3_wt3hg7	False	True	t1_il4yovn	/r/Bitcoin/comments/wt3hg7/someone_just_dropped_47_btc_to_hodlonauts_defense/il54ifz/	1661047125	1	True	True	False	Bitcoin	t5_2s3qj	r/Bitcoin	public		0	[]													
170	[]	False		blanchwood			[]				text	t2_39hbk3rw	False	False	whitch	5d1fa8215f72bdbfadab8e0f74cf217ae8aad942	True	False					0	1661047074		0	{}	il54fj8	False	t3_wt8cx2	False	True	t1_il54egj	/r/Bitcoin/comments/wt8cx2/while_all_the_fud_is_going_on_i_have_decided_to/il54fj8/	1661047086	1	True	True	False	Bitcoin	t5_2s3qj	r/Bitcoin	public		0	[]													
171	[]	False		blanchwood			[]				text	t2_39hbk3rw	False	False	about educate, what books about crypto are you reading?	d478855cf85bef88f7f96d29807da0f478f1e9d3	True	False					0	1661047059		0	{}	il54egj	False	t3_wt8cx2	False	False	t3_wt8cx2	/r/Bitcoin/comments/wt8cx2/while_all_the_fud_is_going_on_i_have_decided_to/il54egj/	1661047071	1	True	True	False	Bitcoin	t5_2s3qj	r/Bitcoin	public		0	[]													
172	[]	False		varikonniemi			[]				text	t2_5pv5t	False	False	"check this out, also a bitcoin (and lightning) node, with UPS and dual internet, probably cheaper than yours. 

https://imgur.com/bM0Lhb5"	b5b4b306c2ea9c102eb6661c7975b7c57629fde7	True	False					0	1661047052		0	{}	il54dxw	False	t3_wszvmn	False	False	t1_il1dhqo	/r/Bitcoin/comments/wszvmn/what_a_cute_digital_picture_frame_where_did_you/il54dxw/	1661047064	1	True	True	False	Bitcoin	t5_2s3qj	r/Bitcoin	public		0	[]													
173	[]	False		Cats_n_Porn			[]				text	t2_bv8o0	False	False	Maybe right now, but that influence is very expensive to maintain and is definitely not permanent. I would argue it is heavily tied to the dollar hegemony, which is not as strong as it once was.	14117f431caeabdd31709c59aadbbefe8d7bace0	True	False					0	1661047052		0	{}	il54dxb	True	t3_wtdemh	False	True	t1_il50r06	/r/Bitcoin/comments/wtdemh/governments_trying_to_confiscate_bitcoin_would/il54dxb/	1661047064	1	True	True	False	Bitcoin	t5_2s3qj	r/Bitcoin	public		0	[]													
174	[]	False		jdwwq5			[]				text	t2_ene0zy3z	False	False	I have used btc as the payment options in many stores, happy to see the people accepting btc	eb59fb572a758439478b5be7c3e324cc86abeea2	True	False					0	1661047046		0	{}	il54dhw	False	t3_wsrdp8	False	True	t1_il1n2ot	/r/Bitcoin/comments/wsrdp8/we_need_merchant_adoption_so_we_dont_have_to_sell/il54dhw/	1661047057	1	True	True	False	Bitcoin	t5_2s3qj	r/Bitcoin	public		0	[]													
175	[]	False		rBitcoinMod			[]				text	t2_tcsf5	False	False	"Your submission has been flagged for removal because it pertains to general trading or market discussion, whereas r/Bitcoin tries to be less price oriented. Please visit r/BitcoinMarkets. Thank you.

^^I ^^am ^^a ^^bot ^^and ^^cannot ^^respond. ^^Please ^^contact ^^r/Bitcoin ^^moderators [^^directly ^^via ^^mod ^^mail](https://www.reddit.com/message/compose?to=%2Fr%2FBitcoin) ^^if ^^you ^^have ^^questions."	3983f6ad1df20b0c1e876c5bfb07c5fdc0c81ac7	True	False					0	1661046997	moderator	0	{}	il549sp	False	t3_wtlpj2	False	True	t3_wtlpj2	/r/Bitcoin/comments/wtlpj2/bitcoin_observing_the_double_bottom_action/il549sp/	1661047011	1	True	True	True	Bitcoin	t5_2s3qj	r/Bitcoin	public		0	[]													
176	[]	False		BrotherAmazing			[]				text	t2_9zpa4hew	False	False	Who said anything about “idol worship”?  If someone is smart and has a lot of life and technical experience, they may be able to pass valuable information to others and may be worth listening to.  One need not “worship” people who are simply worth listening to speak on certain issues.	4465e4dab7ad7fa18f19ce890630908ad579b059	True	False					0	1661046992		0	{}	il549do	False	t3_wtjygw	False	True	t1_il4z3s3	/r/Bitcoin/comments/wtjygw/what_happened_to_nick_szabo/il549do/	1661047003	1	True	True	False	Bitcoin	t5_2s3qj	r/Bitcoin	public		0	[]													
177	[]	False		rBitcoinMod			[]				text	t2_tcsf5	False	False	"Your submission has been flagged for removal because it doesn't meet the quality standards for /r/Bitcoin at this time. Please help keep the subreddit clean from low quality posts.

^^I ^^am ^^a ^^bot ^^and ^^cannot ^^respond. ^^Please ^^contact ^^r/Bitcoin ^^moderators [^^directly ^^via ^^mod ^^mail](https://www.reddit.com/message/compose?to=%2Fr%2FBitcoin) ^^if ^^you ^^have ^^questions."	7f47cb61e3880cbcec652e5c0ab78630b03152cc	True	False					0	1661046986	moderator	0	{}	il548xe	False	t3_wtlfa3	False	True	t3_wtlfa3	/r/Bitcoin/comments/wtlfa3/michael_saylor/il548xe/	1661047001	1	True	True	True	Bitcoin	t5_2s3qj	r/Bitcoin	public		0	[]													
178	[]	False		janjabanja			[]				text	t2_gtaqkerw	False	False	Yep, law comes at a cost lol. As better call saul has taught us.	5725c4d36dc8aa03408531759304f71ba5275880	True	False					0	1661046979		0	{}	il548f9	False	t3_wt7uru	False	True	t1_il3b2u1	/r/Bitcoin/comments/wt7uru/this_answer_from_greg_maxwell_deserves_its_own/il548f9/	1661046992	1	True	True	False	Bitcoin	t5_2s3qj	r/Bitcoin	public		0	[]													
179	[]	False		SamwiseGamgee87			[]				text	t2_75oo42rf	False	False	So for someone who don't know U.S, wanna do it and it's fan of grunge. You would recommend to travel to Seattle?	3a5ded5f2a58c8b3fb21d6fd319280a905889df4	True	False					0	1661046964		0	{}	il547bh	False	t3_wsbcie	False	True	t1_il4s35q	/r/Bitcoin/comments/wsbcie/jpmorgan_el_salvador_reduces_fiscal_deficit/il547bh/	1661046977	1	True	True	False	Bitcoin	t5_2s3qj	r/Bitcoin	public		0	[]													
180	[]	False		Senior-Dig2133		noob	[{'e': 'text', 't': 'redditor for 1 week'}]	2ec8e69e-6c36-11e9-a04b-0afb553d4ea6	redditor for 1 week	dark	richtext	t2_or3oyzpz	False	False	Keep it strong	6780cfa349072ac2e3b406e2a937ecd973cbc007	True	False					0	1661046896		0	{}	il542cb	False	t3_wt8cx2	False	True	t3_wt8cx2	/r/Bitcoin/comments/wt8cx2/while_all_the_fud_is_going_on_i_have_decided_to/il542cb/	1661046908	1	True	True	False	Bitcoin	t5_2s3qj	r/Bitcoin	public		0	[]													
181	[]	False		CrypoFiend			[]			dark	text	t2_e7z7annz	False	False	"I am not saying investing is bad. I am saying it is not adequate to fund a retirement and the majority of Americans do not have enough extra revenue to invest the necessary amount to retire. With inflation at it's current pace your savings is being eaten away.

 Realistically you have been investing for 17k years and are nowhere close to having enough for retirement."	e2bffe5a3a243ad105bf3ef76403948311941e23	True	False					0	1661046842		0	{}	il53y9l	False	t3_wsc4dl	False	True	t1_il512s0	/r/Bitcoin/comments/wsc4dl/inflation/il53y9l/	1661046855	1	True	True	False	Bitcoin	t5_2s3qj	r/Bitcoin	public		0	[]													
182	[]	False		Cats_n_Porn			[]				text	t2_bv8o0	False	False	"I did not say ""soon"" or give a timeline. The way I see things going could happen in 2 years or 20+, and we will not get there in a straight line. It is going to be a very rocky road to get there. There will probably be wars, famines, depressions, revolutions, etc. along the way. However I think the trend is towards Bitcoin taking a much larger role in the global economy. 

There are a lot of other factors I am considering that I have not outlined in my posts that would back up my arguments. It's just difficult to cover all the different moving parts that paint the picture as I see it in a reddit post and comments. Unfortunately I do not have the time to explain and back up every single thing I say, at least not in a reddit comments format. No offense to you, but if I am going to put the amount of effort and thought into some of these posts that I have been I might as well write an article and back it up with sources and charts and get it published. Otherwise it will only be read by one person and dismissed as wishful thinking. I really only made the OP to discuss the view I had on confiscation, not my grand vision for the future of Bitcoin for decades to come."	37bf364c224d94a04cb445305c58abce0bab774c	True	False					0	1661046838		0	{}	il53y14	True	t3_wtdemh	False	True	t1_il4uzlb	/r/Bitcoin/comments/wtdemh/governments_trying_to_confiscate_bitcoin_would/il53y14/	1661046851	1	True	True	False	Bitcoin	t5_2s3qj	r/Bitcoin	public		0	[]													
183	[]	False		life762			[]			dark	text	t2_ia8yuscn	False	False	"You're going to have to be specific to get any sort of meaningful technical help. ""Can't do some import thing"" and ""some connection error"" aren't very much to go off of.

Did you connect to the internet? The internet connection is not automatically established. There is a Tor connection dialog that opens right after boot. You have to follow the instructions in that dialog to connect to the internet, at which point you can download Sparrow."	211f83a9cf0c811ed27911828410f0798116c63c	True	False					0	1661046692		0	{}	il53ne0	False	t3_wtlphs	False	True	t3_wtlphs	/r/Bitcoin/comments/wtlphs/sparrow_on_tailsos/il53ne0/	1661046704	1	True	True	False	Bitcoin	t5_2s3qj	r/Bitcoin	public		0	[]													
184	[]	False		BrotherAmazing			[]				text	t2_9zpa4hew	False	False	"If it’s public information, post a public link/reference please.  

A quick Google search turns up nothing.  That doesn’t mean you’re a liar, but it often proves someone is telling the truth and, this time, it did not help us have any additional faith in the veracity of your claim."	d933ef05b84180c42a191b6fe2325459210a75c3	True	False					0	1661046622		0	{}	il53i5f	False	t3_wtkxgi	False	True	t1_il4vpnu	/r/Bitcoin/comments/wtkxgi/any_thoughts_on_the_mtgox_situation_do_u_guys/il53i5f/	1661046635	1	True	True	False	Bitcoin	t5_2s3qj	r/Bitcoin	public		0	[]													
185	[]	False		Fancy-You3022			[]				text	t2_cx18gqqn	False	False	"I was just joking. We went to the Smokey Mountains. Pidgin Forge to be exact. Was a fun time. Met a lot of really nice people. First time the kids got to go to a drive in movie theater.

Would recommend."	04b037f9ace75541b7b6bf67f77ad8b9ceda2e3a	True	False					0	1661046496		0	{}	il538ql	False	t3_wsbcie	False	True	t1_il3zw3k	/r/Bitcoin/comments/wsbcie/jpmorgan_el_salvador_reduces_fiscal_deficit/il538ql/	1661046508	1	True	True	False	Bitcoin	t5_2s3qj	r/Bitcoin	public		0	[]													
186	[]	False		NitronBot106			[]			dark	text	t2_9wnpih59	False	False	"Sure mempool.space has a ton of information on what mining pools mined which block.

https://mempool.space/graphs/mining/pools#24h

And yes this is provided voluntarily but the pools could easy stop including their pool name in the coinbase transaction. Then it would be very difficult to determine who mined which block. I could see a situation in the future where this happens because governments are threating legal action or violence against miners and mining pools."	e7b3dc38765ec95824bacbed4d750490c76defd5	True	False					0	1661046455		0	{}	il535t4	False	t3_wtb5iu	False	True	t3_wtb5iu	/r/Bitcoin/comments/wtb5iu/miners_tagging_mined_blocks/il535t4/	1661046469	1	True	True	False	Bitcoin	t5_2s3qj	r/Bitcoin	public		0	[]													
187	[]	False		pdath			[]				text	t2_3almi4j5	False	False	Doh!  I just spotted you have a second 1TB SSD.  This machine will be great as a BTC node.	3c6622758aadc00f6fe2de2e5f1a7eea3d564158	True	False					0	1661046417		0	{}	il53305	False	t3_wtlhdi	False	False	t3_wtlhdi	/r/Bitcoin/comments/wtlhdi/bitcoin_full_node/il53305/	1661046428	1	True	True	False	Bitcoin	t5_2s3qj	r/Bitcoin	public		0	[]													
188	[]	False		pdath			[]				text	t2_3almi4j5	False	False	"You need a minimum of 512GB of storage to run a full node,  otherwise you have to run it in pruned mode.  The current block chain database uses 451GB.  Personally I would go for a 1TB SSD.

I did a video about this.   The first bit covers the requirements. 
https://youtu.be/vst25Q9i9mc"	0fd33acb333b14d6b1b0866e4f01795560830cc7	True	False					0	1661046360		0	{}	il52ysd	False	t3_wtlhdi	False	True	t3_wtlhdi	/r/Bitcoin/comments/wtlhdi/bitcoin_full_node/il52ysd/	1661046375	1	True	True	False	Bitcoin	t5_2s3qj	r/Bitcoin	public		0	[]													
189	[]	False		AinNoWayBoi61			[]				text	t2_gyu56tfh	False	False	People who evaded the order, and the rest of the world	8c170f6f11307c9b53ef4023e4761e78b1860ad3	True	False					0	1661046228		0	{}	il52p0x	False	t3_wtdemh	False	False	t1_il4zgrt	/r/Bitcoin/comments/wtdemh/governments_trying_to_confiscate_bitcoin_would/il52p0x/	1661046238	1	True	True	False	Bitcoin	t5_2s3qj	r/Bitcoin	public		0	[]													
190	[]	False		Mr_P_Nissaurus		noob	[{'e': 'text', 't': 'redditor for 3 months'}]	2ec8e69e-6c36-11e9-a04b-0afb553d4ea6	redditor for 3 months	dark	richtext	t2_oqxa5s90	False	False	"Hype?  

No. 

Saylor tells the truth."	efac130c6ef899063cbccceb74a35be367bff4d5	True	False					0	1661046176		0	{}	il52la0	False	t3_wtlfa3	False	True	t1_il50pzu	/r/Bitcoin/comments/wtlfa3/michael_saylor/il52la0/	1661046191	1	True	True	False	Bitcoin	t5_2s3qj	r/Bitcoin	public		0	[]													
191	[]	False		varikonniemi			[]				text	t2_5pv5t	False	False	what a shitty legal system. Over here the winner gets legal expenses paid in full, plus compensation for wasted time in court.	7f58c2811745adb25dbfcce1d831cbb58e3afcdb	True	False					0	1661046005		0	{}	il528sj	False	t3_ws8wfd	False	True	t1_il2g9ie	/r/Bitcoin/comments/ws8wfd/starting_september_12th_in_oslo_norway_hodlonaut/il528sj/	1661046017	1	True	True	False	Bitcoin	t5_2s3qj	r/Bitcoin	public		0	[]													
192	[]	False		bitjava			[]			dark	text	t2_awppihq5	False	False	User name definitely checks out.	3a3769ef6dfaa891c3cbd88e11400a26af669aa6	True	False					0	1661045961		0	{}	il525lb	False	t3_wt7uru	False	True	t1_il3drmr	/r/Bitcoin/comments/wt7uru/this_answer_from_greg_maxwell_deserves_its_own/il525lb/	1661045979	1	True	True	False	Bitcoin	t5_2s3qj	r/Bitcoin	public		0	[]													
