Unnamed: 0	all_awardings	archived	associated_award	author	author_flair_background_color	author_flair_css_class	author_flair_richtext	author_flair_template_id	author_flair_text	author_flair_text_color	author_flair_type	author_fullname	author_patreon_flair	author_premium	body	body_sha1	can_gild	collapsed	collapsed_because_crowd_control	collapsed_reason	collapsed_reason_code	comment_type	controversiality	created_utc	distinguished	gilded	gildings	id	is_submitter	link_id	locked	no_follow	parent_id	permalink	retrieved_utc	score	score_hidden	send_replies	stickied	subreddit	subreddit_id	subreddit_name_prefixed	subreddit_type	top_awarded_type	total_awards_received	treatment_tags	unrepliable_reason	corpus	support	knowledge	conflict	power	similarity	fun	status	trust	identity	romance
117	[]	False		Undso3			[]				text	t2_9b5ek49a	False	False	I can't wait to confirm the new ETH fees.	5f04b798a498e8d5276a8ba764136c608ee6883c	True	False					0	1656072062		0	{}	idjr9tu	False	t3_v8k2f2	False	True	t1_ibs4pzw	/r/ethereum/comments/v8k2f2/ethereum_fees_fall_to_1/idjr9tu/	1656072075	1	False	True	False	ethereum	t5_2zf9m	r/ethereum	public		0	[]		i can t wait to confirm the new eth fees 	0.3894261419773102	0.56165611743927	0.1734105795621872	0.426624059677124	0.31769996881484985	0.29976364970207214	0.33670032024383545	0.42448389530181885	0.34636354446411133	0.008864468894898891
118	[]	False		[deleted]						dark					[removed]	fe993932d6dced4c0a879e9aa5d7a6e0fbb467f5	True	False					0	1656072057		0	{}	idjr9j9	False	t3_vi61c1	False	True	t3_vi61c1	/r/ethereum/comments/vi61c1/dydx_is_planning_to_stop_functioning_as_an_l2_and/idjr9j9/	1656072068	1	False	True	False	ethereum	t5_2zf9m	r/ethereum	public		0	[]		 removed 	0.46707504987716675	0.5148742198944092	0.5170193910598755	0.5029740929603577	0.4936113953590393	0.5123135447502136	0.45383262634277344	0.4847692549228668	0.4981911778450012	0.5145108103752136
119	[]	False		phazei			[]				text	t2_4aen8	False	False	I could be wrong about this, but I believe zkSync's solution while it is zkEVM, isn't 1:1 with EVM.  The zkEVM loopring is working on is supposed to b e 1:1 with EVM so you can take a dApp and just move it over to their zkEVM with almost no modification.	88eda449331828709ee08a66c11a9e97016e806b	True	False					0	1656114499		0	{}	idmk2wr	False	t3_visxue	False	False	t1_idfcnvw	/r/ethereum/comments/visxue/zeroknowledge_tech_is_way_more_private_than/idmk2wr/	1656114517	1	False	True	False	ethereum	t5_2zf9m	r/ethereum	public		0	[]		i could be wrong about this but i believe zksync s solution while it is zkevm isn t 1 1 with evm the zkevm loopring is working on is supposed to b e 1 1 with evm so you can take a dapp and just move it over to their zkevm with almost no modification 	0.0044097802601754665	0.9877955913543701	0.4662952721118927	0.233710378408432	0.9408687353134155	0.284524142742157	0.07060792297124863	8.486031788379478e-07	0.30399906635284424	0.09216924011707306
120	[]	False		tonwaton			[]				text	t2_kse8waxc	False	False	"A chair's utility isn't 50 dollars because i can buy it and sell it for 50 dollars. 

¿What can you actually do with 1 Ether?"	e3074699eb064c7a71410625a0c95f1a63de68b0	True	False					0	1656114477		0	{}	idmk19t	True	t3_viml4j	False	True	t1_iddwt29	/r/ethereum/comments/viml4j/what_could_i_do_with_1_ether/idmk19t/	1656114493	1	False	True	False	ethereum	t5_2zf9m	r/ethereum	public		0	[]		a chair s utility isn t 50 dollars because i can buy it and sell it for 50 dollars what can you actually do with 1 ether 	0.12115740031003952	0.9708013534545898	0.23261168599128723	0.021782243624329567	0.02439795434474945	0.3531370162963867	0.06352146714925766	8.626985845694435e-07	0.2928921580314636	0.030116086825728416
121	[]	False		AESTHTK			[]				text	t2_10fwavem	False	False	"This seems accurate:

https://notes.ethereum.org/PhbNw_cGSQ-VKqzGl4bPcg?view"	205e91123cb091922a8d437210362852e56a7be5	True	False					0	1656114310		0	{}	idmjoj6	False	t3_vjkd2r	False	True	t1_idll8dw	/r/ethereum/comments/vjkd2r/hwo_did_the_recent_shadow_fork_go/idmjoj6/	1656114322	1	False	True	False	ethereum	t5_2zf9m	r/ethereum	public		0	[]		this seems accurate https notes ethereum org phbnw cgsq vkqzgl4bpcg view	0.16480432450771332	0.8200869560241699	0.47419607639312744	0.26004835963249207	0.11974633485078812	0.22469140589237213	0.4376765191555023	0.7205713987350464	0.505540668964386	0.0012566850055009127
122	[]	False		AESTHTK			[]				text	t2_10fwavem	False	False	"You can track it here:

https://notes.ethereum.org/PhbNw_cGSQ-VKqzGl4bPcg?view"	e0d85948121c1323121473b68fccebfcb9c67875	True	False					0	1656114292		0	{}	idmjn79	False	t3_vjkd2r	False	True	t1_idjv5jq	/r/ethereum/comments/vjkd2r/hwo_did_the_recent_shadow_fork_go/idmjn79/	1656114306	1	False	True	False	ethereum	t5_2zf9m	r/ethereum	public		0	[]		you can track it here https notes ethereum org phbnw cgsq vkqzgl4bpcg view	0.358771413564682	0.8102917671203613	0.41386106610298157	0.5904549956321716	0.08221786469221115	0.2265528291463852	0.36870792508125305	0.7060514092445374	0.48970216512680054	0.0011211662786081433
123	[]	False		AESTHTK			[]				text	t2_10fwavem	False	False	"Here you go:

https://notes.ethereum.org/PhbNw_cGSQ-VKqzGl4bPcg?view"	858183c141faf5b657817c397e67545db708080f	True	False					0	1656114269		0	{}	idmjlh1	False	t3_vjkd2r	False	True	t3_vjkd2r	/r/ethereum/comments/vjkd2r/hwo_did_the_recent_shadow_fork_go/idmjlh1/	1656114283	1	False	True	False	ethereum	t5_2zf9m	r/ethereum	public		0	[]		here you go https notes ethereum org phbnw cgsq vkqzgl4bpcg view	0.4384124279022217	0.6746324300765991	0.5026993155479431	0.6589935421943665	0.10931722074747086	0.2302941530942917	0.42051616311073303	0.4582001864910126	0.4863314628601074	0.0013668629107996821
124	[]	False		Marcellusk			[]				text	t2_5k2xm	False	False	Just getting started.  Things will take off once the utility capabilities of them are put to use.	17101f9bc17fc6bb3afe2f8f440daabd09b255b2	True	False					0	1656113986		0	{}	idmizy7	False	t3_vjol42	False	True	t1_idm55uv	/r/ethereum/comments/vjol42/eminem_and_snoop_dogg_drop_baycthemed_track_from/idmizy7/	1656114000	1	False	True	False	ethereum	t5_2zf9m	r/ethereum	public		0	[]		just getting started things will take off once the utility capabilities of them are put to use 	0.36520326137542725	0.7725578546524048	0.3461497128009796	0.6416850686073303	0.3527485728263855	0.27978116273880005	0.09456540644168854	9.007421795104165e-06	0.2712780237197876	0.0013986435951665044
125	[]	False		abcoathup			[]				text	t2_6t9z4g3	False	False	Please keep price discussion, market talk, memes, and exchanges to subreddits such as r/ethfinance or  r/ethtrader	dec5e4ab1294f88e7ae40e2121741e45371c7c24	True	False					0	1656113611	moderator	0	{}	idmi7f1	False	t3_vk1fkl	False	True	t3_vk1fkl	/r/ethereum/comments/vk1fkl/cant_wait_to_buy_bitcoin_at_12500_ethereum_at_825/idmi7f1/	1656113626	1	True	True	True	ethereum	t5_2zf9m	r/ethereum	public		0	[]		please keep price discussion market talk memes and exchanges to subreddits such as r ethfinance or r ethtrader	0.02559542842209339	0.8214024901390076	0.633165180683136	0.6197721362113953	0.020574690774083138	0.09487023949623108	0.3243497908115387	0.6616637110710144	0.4739669859409332	4.443669968168251e-05
126	[]	False		shutupandlistenordie			[]				text	t2_3nj2t2xh	False	False	Came here to get an in depth view. Point being nullfied	039253064bd6b6d2b3ce923076c1dd47ac62d26c	True	False					0	1656110583		0	{}	idmbm24	False	t3_uyxvdx	False	True	t3_uyxvdx	/r/ethereum/comments/uyxvdx/all_you_need_to_know_about_soulbound_token_an_nft/idmbm24/	1656110594	1	False	True	False	ethereum	t5_2zf9m	r/ethereum	public		0	[]		came here to get an in depth view point being nullfied	0.2586915194988251	0.7514722347259521	0.4014497995376587	0.4371235966682434	0.49873387813568115	0.07671619951725006	0.30488279461860657	0.0782645046710968	0.42902466654777527	0.0028671312611550093
127	[]	False		AutoModerator			[]				text	t2_6l4z3	False	True	"Your submission was removed from /r/ethereum due to being too short. All text submissions must be at least 60 characters long.

*I am a bot, and this action was performed automatically. Please [contact the moderators of this subreddit](/message/compose/?to=/r/ethereum) if you have any questions or concerns.*"	f5350acfa4ebeaa5482eb2be2e6daa9c2d3776c0	True	False					0	1656109809	moderator	0	{}	idm9v9h	False	t3_vk082h	False	True	t3_vk082h	/r/ethereum/comments/vk082h/apex_ai_buy_eth_30min_8_small_time_frame_movements/idm9v9h/	1656109820	1	False	False	False	ethereum	t5_2zf9m	r/ethereum	public		0	[]		your submission was removed from r ethereum due to being too short all text submissions must be at least 60 characters long i am a bot and this action was performed automatically please contact the moderators of this subreddit message compose to r ethereum if you have any questions or concerns 	0.003361653070896864	0.9877400994300842	0.3758471608161926	0.14455313980579376	0.008221076801419258	0.24413546919822693	0.11215468496084213	8.340520025740261e-07	0.331838995218277	0.019277073442935944
128	[]	False		GoCryptoYourself			[]				text	t2_ko0ni56v	False	False	My gut in this case is no news is bad news.	b4ddaba91e4eae3f603eb2b03b532c088186332d	True	False					0	1656109138		0	{}	idm8c6k	False	t3_vjkd2r	False	True	t3_vjkd2r	/r/ethereum/comments/vjkd2r/hwo_did_the_recent_shadow_fork_go/idm8c6k/	1656109157	1	False	True	False	ethereum	t5_2zf9m	r/ethereum	public		0	[]		my gut in this case is no news is bad news 	0.29357367753982544	0.47542452812194824	0.5260192155838013	0.3115314543247223	0.5788300633430481	0.6255075931549072	0.21828821301460266	0.2729179561138153	0.47460708022117615	0.001937176799401641
129	[]	False		[deleted]						dark					[removed]	fe993932d6dced4c0a879e9aa5d7a6e0fbb467f5	True	False					0	1656109046		0	{}	idm84nf	False	t3_vhscdb	False	True	t1_idjaxer	/r/ethereum/comments/vhscdb/i_feel_like_no_one_outside_of_our_industry/idm84nf/	1656109064	1	False	True	False	ethereum	t5_2zf9m	r/ethereum	public		0	[]		 removed 	0.46707504987716675	0.5148742198944092	0.5170193910598755	0.5029740929603577	0.4936113953590393	0.5123135447502136	0.45383262634277344	0.4847692549228668	0.4981911778450012	0.5145108103752136
130	[]	False		ForbiddenFruit91			[]				text	t2_4gm0gkaz	False	False	No	816c52fd2bdd94a63cd0944823a6c0aa9384c103	True	False					0	1656108718		0	{}	idm7drm	False	t3_vjol42	False	True	t1_idm6nld	/r/ethereum/comments/vjol42/eminem_and_snoop_dogg_drop_baycthemed_track_from/idm7drm/	1656108735	1	False	True	False	ethereum	t5_2zf9m	r/ethereum	public		0	[]		no	0.48560506105422974	0.5060324668884277	0.552438497543335	0.5165206789970398	0.49183720350265503	0.4923526644706726	0.4438704252243042	0.4987156093120575	0.4971311092376709	0.4656928777694702
131	[]	False		Alarmming			[]				text	t2_e5r3k0ej	False	False	You're gay bro?	00e4a6ff4848f098baac1446eebf2198762f426c	True	False					0	1656108396		0	{}	idm6nld	False	t3_vjol42	False	True	t1_idlbyg5	/r/ethereum/comments/vjol42/eminem_and_snoop_dogg_drop_baycthemed_track_from/idm6nld/	1656108411	1	False	True	False	ethereum	t5_2zf9m	r/ethereum	public		0	[]		you re gay bro 	0.4918684661388397	0.321408748626709	0.6143412590026855	0.5230751633644104	0.4281653165817261	0.5512951612472534	0.5445290803909302	0.42148557305336	0.4652281701564789	0.6630125045776367
132	[]	False		[deleted]						dark					[removed]	fe993932d6dced4c0a879e9aa5d7a6e0fbb467f5	True	False					0	1656108161		0	{}	idm63u5	False	t3_sfbn34	False	True	t3_sfbn34	/r/ethereum/comments/sfbn34/bored_ape_yacht_club_is_racist_and_started_by_neo/idm63u5/	1656108175	1	False	True	False	ethereum	t5_2zf9m	r/ethereum	public		0	[]		 removed 	0.46707504987716675	0.5148742198944092	0.5170193910598755	0.5029740929603577	0.4936113953590393	0.5123135447502136	0.45383262634277344	0.4847692549228668	0.4981911778450012	0.5145108103752136
133	[]	False		Nonocoiner			[]				text	t2_lzfny8h5	False	False	"&gt;but will probably use BSC

So you are complaining about L2's being PoS copies of Ethereum (which they aren't), and your solution is to use BSC, which literally is a centralized copy of Ethereum?

You can't be serious, lol!"	3be690ea33c8db4ae906c38401bfb50ed4ba43fd	True	False					0	1656108122		0	{}	idm60i3	False	t3_vjul0u	False	True	t1_idliyai	/r/ethereum/comments/vjul0u/when_will_eth_gas_fees_be_cheaper/idm60i3/	1656108137	1	False	True	False	ethereum	t5_2zf9m	r/ethereum	public		0	[]		 gt but will probably use bsc so you are complaining about l2 s being pos copies of ethereum which they aren t and your solution is to use bsc which literally is a centralized copy of ethereum you can t be serious lol 	0.0034399081487208605	0.9878590703010559	0.4413089454174042	0.050400469452142715	0.007945477962493896	0.5652605891227722	0.07699348032474518	8.308684869007266e-07	0.3727821409702301	0.03821190819144249
134	[]	False		Opposite_Contact_265			[]				text	t2_8e1ldhzg	False	False	I think it’s safe to say NFTs are officially dead.	c54d0324b834bf4ba32b10290f6fb6e18781128e	True	False					0	1656107756		0	{}	idm55uv	False	t3_vjol42	False	True	t3_vjol42	/r/ethereum/comments/vjol42/eminem_and_snoop_dogg_drop_baycthemed_track_from/idm55uv/	1656107769	1	False	True	False	ethereum	t5_2zf9m	r/ethereum	public		0	[]		i think it s safe to say nfts are officially dead 	0.5490844249725342	0.4426563084125519	0.437431663274765	0.30826953053474426	0.45711272954940796	0.37240687012672424	0.27996382117271423	0.5642627477645874	0.47417181730270386	0.005528630223125219
135	[]	False		LiveDirtyEatClean			[]				text	t2_64fa4213	False	False	Xinqui, the authentic f2pool enthusiast	dc777e319a5d83cc99f8858cef1e55a8c77a72d3	True	False					0	1656106945		0	{}	idm39yr	False	t3_vjcyod	False	True	t1_idjcotp	/r/ethereum/comments/vjcyod/buying_eth_and_btc_better_using_binance_degiro_or/idm39yr/	1656106962	1	False	True	False	ethereum	t5_2zf9m	r/ethereum	public		0	[]		xinqui the authentic f2pool enthusiast	0.41249561309814453	0.542938768863678	0.4555297791957855	0.41427916288375854	0.4228441119194031	0.48923590779304504	0.5147806406021118	0.47012606263160706	0.46529147028923035	0.3310413062572479
136	[]	False		[deleted]						dark					[removed]	fe993932d6dced4c0a879e9aa5d7a6e0fbb467f5	True	False					0	1656106644		0	{}	idm2ko0	False	t3_vjj4hm	False	True	t1_idjcfsu	/r/ethereum/comments/vjj4hm/i_have_been_working_on_a_cap_table_solution_on/idm2ko0/	1656106663	1	False	True	False	ethereum	t5_2zf9m	r/ethereum	public		0	[]		 removed 	0.46707504987716675	0.5148742198944092	0.5170193910598755	0.5029740929603577	0.4936113953590393	0.5123135447502136	0.45383262634277344	0.4847692549228668	0.4981911778450012	0.5145108103752136
137	[]	False		YOLObetsWIN			[]				text	t2_7wzrj37p	False	True	yup	4defd3fdb651017e1536e81b441ccd5d20b898c8	True	False					0	1656106217		0	{}	idm1knm	False	t3_vjt18q	False	True	t1_idlr5tk	/r/ethereum/comments/vjt18q/one_in_four_americans_think_were_in_a_recession/idm1knm/	1656106228	1	False	True	False	ethereum	t5_2zf9m	r/ethereum	public		0	[]		yup	0.47044867277145386	0.4813596308231354	0.5059669613838196	0.4850977957248688	0.49574440717697144	0.5773223638534546	0.5015926957130432	0.4900018274784088	0.4812517464160919	0.5068324208259583
138	[]	False		Perleflamme			[]				text	t2_13pqgo	False	False	It's just logic computers, here, you just need tools to better browse them all. Just like we have tools to manage many different physical computers in a cloud. We'll end up with clouds of world computers.	3669e401edbbd4efb61d0e8aec0e0c85841dbedd	True	False					0	1656106203		0	{}	idm1jfw	False	t3_vjgbvx	False	True	t1_idkb66m	/r/ethereum/comments/vjgbvx/is_pure_decentralization_a_myth/idm1jfw/	1656106221	1	False	True	False	ethereum	t5_2zf9m	r/ethereum	public		0	[]		it s just logic computers here you just need tools to better browse them all just like we have tools to manage many different physical computers in a cloud we ll end up with clouds of world computers 	0.21495890617370605	0.9886893630027771	0.05443260073661804	0.018661387264728546	0.32102662324905396	0.3922235071659088	0.09087683260440826	8.496282930536836e-07	0.29559701681137085	0.012013115920126438
139	[]	False		vickvinegar_			[]				text	t2_11tdmm	False	False	You’re trash and corny af	b93bea1b0f555cb2539ae2d988c0b8c1065fedcd	True	False					0	1656106142		0	{}	idm1e6m	False	t3_vjol42	False	True	t1_idldm8r	/r/ethereum/comments/vjol42/eminem_and_snoop_dogg_drop_baycthemed_track_from/idm1e6m/	1656106160	1	False	True	False	ethereum	t5_2zf9m	r/ethereum	public		0	[]		you re trash and corny af	0.3724827468395233	0.32937076687812805	0.7231512665748596	0.33694395422935486	0.37017595767974854	0.7976344227790833	0.45403847098350525	0.2579066753387451	0.4177463948726654	0.18153616786003113
140	[]	False		[deleted]						dark					[removed]	fe993932d6dced4c0a879e9aa5d7a6e0fbb467f5	True	False					0	1656105848		0	{}	idm0p99	False	t3_vjol42	False	True	t3_vjol42	/r/ethereum/comments/vjol42/eminem_and_snoop_dogg_drop_baycthemed_track_from/idm0p99/	1656105867	1	False	True	False	ethereum	t5_2zf9m	r/ethereum	public		0	[]		 removed 	0.46707504987716675	0.5148742198944092	0.5170193910598755	0.5029740929603577	0.4936113953590393	0.5123135447502136	0.45383262634277344	0.4847692549228668	0.4981911778450012	0.5145108103752136
141	[]	False		marcuspohl			[]				text	t2_12t57o	False	False	"Why do people keep complaining about ETH gas fees? Right now it’s $0.13 for a transfer. https://ethgasstation.info

Meanwhile credit card processing fees are 1.5% to 3.5%. Even at the lowest rate of 1.5%, it starts costing more to process a transaction on your credit card (right now at the time of this post) once you go higher than an $8.75 transaction. https://www.nerdwallet.com/article/small-business/credit-card-processing-fees"	952cb3baa993e7b7965baf2640e93ad99c29ffe5	True	False					0	1656105497		0	{}	idlzv66	False	t3_vjul0u	False	True	t3_vjul0u	/r/ethereum/comments/vjul0u/when_will_eth_gas_fees_be_cheaper/idlzv66/	1656105516	1	False	True	False	ethereum	t5_2zf9m	r/ethereum	public		0	[]		why do people keep complaining about eth gas fees right now it s 0 13 for a transfer https ethgasstation info meanwhile credit card processing fees are 1 5 to 3 5 even at the lowest rate of 1 5 it starts costing more to process a transaction on your credit card right now at the time of this post once you go higher than an 8 75 transaction https www nerdwallet com article small business credit card processing fees	0.0026402713265269995	0.9884081482887268	0.08262880891561508	0.9532891511917114	0.008631259202957153	0.14539611339569092	0.12080568820238113	8.446113497484475e-07	0.28359735012054443	0.0024711135774850845
142	[]	False		Chudley5000			[]				text	t2_1xf5hugc	False	False	Damn what’s it like to be so blessed ;)	ee199d2793256d86bf5e7072c11ec1dd0cc82579	True	False					0	1656105491		0	{}	idlzumm	False	t3_vjt18q	False	True	t1_idliymx	/r/ethereum/comments/vjt18q/one_in_four_americans_think_were_in_a_recession/idlzumm/	1656105508	1	False	True	False	ethereum	t5_2zf9m	r/ethereum	public		0	[]		damn what s it like to be so blessed 	0.4842544496059418	0.3299805521965027	0.4877331852912903	0.20559443533420563	0.5551924109458923	0.5454462170600891	0.3235951364040375	0.22975856065750122	0.46409860253334045	0.06587953865528107
143	[]	False		Perleflamme			[]				text	t2_13pqgo	False	False	Ah, yes, the difference between economical community, Schengen and EU. You're right.	46082605bb05be11943a4d23c743f073fc14b16b	True	False					0	1656104719		0	{}	idly0ww	False	t3_vjj4hm	False	True	t1_idkcbc8	/r/ethereum/comments/vjj4hm/i_have_been_working_on_a_cap_table_solution_on/idly0ww/	1656104735	1	False	True	False	ethereum	t5_2zf9m	r/ethereum	public		0	[]		ah yes the difference between economical community schengen and eu you re right 	0.5182029008865356	0.5109326243400574	0.271223247051239	0.16540144383907318	0.4808691143989563	0.4624550938606262	0.47036099433898926	0.0019168193684890866	0.46268028020858765	0.004141992889344692
144	[]	False		[deleted]						dark					[removed]	fe993932d6dced4c0a879e9aa5d7a6e0fbb467f5	True	False					0	1656104158		0	{}	idlwnmb	False	t3_vjul0u	False	True	t1_idluhh5	/r/ethereum/comments/vjul0u/when_will_eth_gas_fees_be_cheaper/idlwnmb/	1656104172	1	False	True	False	ethereum	t5_2zf9m	r/ethereum	public		0	[]		 removed 	0.46707504987716675	0.5148742198944092	0.5170193910598755	0.5029740929603577	0.4936113953590393	0.5123135447502136	0.45383262634277344	0.4847692549228668	0.4981911778450012	0.5145108103752136
145	[]	False		vislumin			[]				text	t2_j8sm9xdd	False	False	Lol, what morons, and the upvotes. They are essentially PoS. I built an L2 and you guys are smug for sure. Pathetic.	d5ff14a4bb45aac8af1da0e927aa25d22558d84b	True	False					0	1656103817		0	{}	idlvtlw	True	t3_vjul0u	False	True	t1_idlt2db	/r/ethereum/comments/vjul0u/when_will_eth_gas_fees_be_cheaper/idlvtlw/	1656103835	1	False	True	False	ethereum	t5_2zf9m	r/ethereum	public		0	[]		lol what morons and the upvotes they are essentially pos i built an l2 and you guys are smug for sure pathetic 	0.01950395479798317	0.2920762002468109	0.9635255932807922	0.01771758310496807	0.21369636058807373	0.718798041343689	0.1638038009405136	8.657133321321453e-07	0.3839714229106903	0.007578481920063496
146	[]	False		dr_michaeil			[]				text	t2_6jwzn68l	False	False	Thanks , wish u best	d4e9888733f82fceb49be6976b1baf651554f933	True	False					0	1656103337		0	{}	idlun5q	False	t3_vjcyod	False	True	t1_idlrjp6	/r/ethereum/comments/vjcyod/buying_eth_and_btc_better_using_binance_degiro_or/idlun5q/	1656103353	1	False	True	False	ethereum	t5_2zf9m	r/ethereum	public		0	[]		thanks wish u best	0.6733892560005188	0.27872371673583984	0.1795819252729416	0.3972257673740387	0.46417737007141113	0.6247533559799194	0.7779668569564819	0.5782392621040344	0.40458425879478455	0.5969172120094299
147	[]	False		domotheus			[]				text	t2_i5ghusfv	False	True	"&gt; The L2's are mostly just PoS copies of ETH

Are you thinking of sidechains like Polygon's PoS chain?

&gt;but will probably use BSC

L2s are too centralized for you so you use BSC? lol"	8e5437639cc38ade5c62c37fddcee6a66f020f69	True	False					0	1656103273		0	{}	idluhh5	False	t3_vjul0u	False	False	t1_idliyai	/r/ethereum/comments/vjul0u/when_will_eth_gas_fees_be_cheaper/idluhh5/	1656103291	1	False	True	False	ethereum	t5_2zf9m	r/ethereum	public		0	[]		 gt the l2 s are mostly just pos copies of eth are you thinking of sidechains like polygon s pos chain gt but will probably use bsc l2s are too centralized for you so you use bsc lol	0.0040933010168373585	0.9850194454193115	0.15175263583660126	0.01564822532236576	0.024228287860751152	0.459097683429718	0.09178555756807327	8.316723096868373e-07	0.37390029430389404	0.015450092032551765
148	[]	False		c-strong			[]				text	t2_1fqk5btp	False	False	Came here after reading your twitter thread. This sounds really cool. Is there any more info in English, particularly about how the solution will be used? I'm a lawyer working for a (crypto) startup, so more interested in the corporate side than the technical side (though both are interesting).	863aeb410cb5588d86689aed85b12bb15e258428	True	False					0	1656103095		0	{}	idlu1ww	False	t3_vjj4hm	False	True	t3_vjj4hm	/r/ethereum/comments/vjj4hm/i_have_been_working_on_a_cap_table_solution_on/idlu1ww/	1656103110	1	False	True	False	ethereum	t5_2zf9m	r/ethereum	public		0	[]		came here after reading your twitter thread this sounds really cool is there any more info in english particularly about how the solution will be used i m a lawyer working for a crypto startup so more interested in the corporate side than the technical side though both are interesting 	0.005347854923456907	0.9878899455070496	0.10579892247915268	0.024510463699698448	0.5917125344276428	0.9962000250816345	0.09086664021015167	8.600378578194068e-07	0.41841423511505127	0.009742851369082928
149	[]	False		Fouace			[]				text	t2_hfyyl	False	False	Gratulerer!	ba17c56cdc67fa2587cca096070b698c3c763d21	True	False					0	1656103059		0	{}	idltyqw	False	t3_vjj4hm	False	True	t3_vjj4hm	/r/ethereum/comments/vjj4hm/i_have_been_working_on_a_cap_table_solution_on/idltyqw/	1656103072	1	False	True	False	ethereum	t5_2zf9m	r/ethereum	public		0	[]		gratulerer 	0.4630463123321533	0.5352395176887512	0.47441837191581726	0.4709847569465637	0.4710223376750946	0.1883898675441742	0.5407869815826416	0.4854360520839691	0.46541523933410645	0.4087046682834625
150	[]	False		frank__costello			[]				text	t2_50ob6pn5	False	False	"&gt; L2's are mostly just PoS copies of ETH

Lol what?

Not a single L2 is using PoS right now"	f907b5c28aee1612b5ae1ee7cb9228c33f941d93	True	False					0	1656102694		0	{}	idlt2db	False	t3_vjul0u	False	True	t1_idliyai	/r/ethereum/comments/vjul0u/when_will_eth_gas_fees_be_cheaper/idlt2db/	1656102709	1	False	True	False	ethereum	t5_2zf9m	r/ethereum	public		0	[]		 gt l2 s are mostly just pos copies of eth lol what not a single l2 is using pos right now	0.016892891377210617	0.7826381325721741	0.786660373210907	0.06529764831066132	0.26234322786331177	0.3806212544441223	0.10255605727434158	8.813117347017396e-07	0.48035529255867004	0.008042053319513798
151	[]	False		frank__costello			[]				text	t2_50ob6pn5	False	False	"&gt; not if the nodes have good hardware/interent

The hardware &amp; infrastructure requirements to run a node is the primary measure of how decentralized a blockchain is"	2bcd7c586c80794d44cb55395a07ee9dd802a966	True	False					0	1656102662		0	{}	idlszhc	False	t3_vjul0u	False	False	t1_idlhmvg	/r/ethereum/comments/vjul0u/when_will_eth_gas_fees_be_cheaper/idlszhc/	1656102677	1	False	True	False	ethereum	t5_2zf9m	r/ethereum	public		0	[]		 gt not if the nodes have good hardware interent the hardware amp infrastructure requirements to run a node is the primary measure of how decentralized a blockchain is	0.03244812786579132	0.9859963059425354	0.48701465129852295	0.5900901556015015	0.025381801649928093	0.21218860149383545	0.10185267776250839	8.499954446961056e-07	0.5306731462478638	0.0027276857290416956
