Unnamed: 0	all_awardings	archived	associated_award	author	author_flair_background_color	author_flair_css_class	author_flair_richtext	author_flair_template_id	author_flair_text	author_flair_text_color	author_flair_type	author_fullname	author_patreon_flair	author_premium	body	body_sha1	can_gild	collapsed	collapsed_because_crowd_control	collapsed_reason	collapsed_reason_code	comment_type	controversiality	created_utc	distinguished	gilded	gildings	id	is_submitter	link_id	locked	no_follow	parent_id	permalink	retrieved_utc	score	score_hidden	send_replies	stickied	subreddit	subreddit_id	subreddit_name_prefixed	subreddit_type	top_awarded_type	total_awards_received	treatment_tags	unrepliable_reason	corpus	support	knowledge	conflict	power	similarity	fun	status	trust	identity	romance
0	[]	False		trujillobitcoin		noob	[{'e': 'text', 't': 'redditor for a day'}]	2ec8e69e-6c36-11e9-a04b-0afb553d4ea6	redditor for a day	dark	richtext	t2_jqt5ync4	False	False	"Would only buy gold because it is actually really nice. So as a collector.  
And perhaps as a charitable event to bail out goldbugs. Because they are brothers in arms to bring down the fed. I respect the work of goldbugs in regards to education and promoting sound economics."	5ab2846b89709131254e9596d35986fcdbb24671	True	False					0	1653206412		0	{}	i9ji15n	False	t3_uuxhmm	False	True	t1_i9ib3j7	/r/Bitcoin/comments/uuxhmm/why_all_investors_need_to_own_gold_and_bitcoin/i9ji15n/	1653206423	1	True	True	False	Bitcoin	t5_2s3qj	r/Bitcoin	public		0	[]												
1	[]	False		TopTierTuna			[]				text	t2_ls8zv	False	False	"Banking supported astroturfing.

Changed in the last month as far as I can tell.  Support for Bitcoin and likely other crytpos is being attacked via upvotes, posts, and comments."	c431e759bacc4daad07e517b0eeeca9f335464df	True	False					0	1653206359		0	{}	i9jhz4s	False	t3_uurzww	False	True	t1_i9hq7df	/r/Bitcoin/comments/uurzww/bitcoin_is_now_legal_tender_in_five_governments/i9jhz4s/	1653206370	1	True	True	False	Bitcoin	t5_2s3qj	r/Bitcoin	public		0	[]												
2	[]	False		Quiet-Curve9919			[]			dark	text	t2_9nyy3l8z	False	False	"Many were shock that is only warranty of a small sum of their deposit if a bank fail.
Is not about the likely hood of that happening but the appreance of a set up."	823cae79e3246dd0a069a36b999001869f1743f9	True	False					0	1653206288		0	{}	i9jhwfa	False	t3_utrheo	False	True	t1_i9bo3i1	/r/Bitcoin/comments/utrheo/central_bankers_from_44_countries_using_bitcoin/i9jhwfa/	1653206304	1	True	True	False	Bitcoin	t5_2s3qj	r/Bitcoin	public		0	[]												
3	[]	False		justyoungpapi			[]				text	t2_flhzoidt	False	False	I hope he won't get robbed because I want him to invest.	637d18ab38ba0f913b49022e3a5f5d7a5c2373f3	True	False					0	1653206275		0	{}	i9jhvy1	False	t3_uu772m	False	True	t1_i9do9ss	/r/Bitcoin/comments/uu772m/im_not_afraid_to_tell_the_world_i_love_bitcoin/i9jhvy1/	1653206290	1	True	True	False	Bitcoin	t5_2s3qj	r/Bitcoin	public		0	[]												
4	[]	False		kurav1_mod		noob	[{'e': 'text', 't': 'redditor for 4 days'}]	2ec8e69e-6c36-11e9-a04b-0afb553d4ea6	redditor for 4 days	dark	richtext	t2_n9rjr7j0	False	False	Right	954daa8b00335c66e262106e01f7dc22b19a4372	True	False					0	1653206264		0	{}	i9jhvk5	False	t3_uv42l5	False	True	t1_i9jek5k	/r/Bitcoin/comments/uv42l5/really_we_are_in_bear_market/i9jhvk5/	1653206277	1	True	True	False	Bitcoin	t5_2s3qj	r/Bitcoin	public		0	[]												
5	[]	False		SlowestCamper			[]			dark	text	t2_h6vp7jqu	False	False	Next 12 will be interesting	2c3eb51b85351f33513a52171d3a962c2d8f2355	True	False					0	1653206241		0	{}	i9jhunu	False	t3_uv626n	False	True	t3_uv626n	/r/Bitcoin/comments/uv626n/12_years_ago_laszlo_hanyecz_the_guy_who_also/i9jhunu/	1653206257	1	True	True	False	Bitcoin	t5_2s3qj	r/Bitcoin	public		0	[]												
6	[]	False		COVID19MurderHornet			[]				text	t2_6dgfpa4u	False	True	He's probably just sick of people getting burnt from shitcoins	55d0caddbcb7d06902caad3132d8c9ada005e175	True	False					0	1653206230		0	{}	i9jhu76	False	t3_uul8o3	False	True	t1_i9hc29m	/r/Bitcoin/comments/uul8o3/regulation_two_birds_one_stone_my_dark_maximalism/i9jhu76/	1653206244	1	True	True	False	Bitcoin	t5_2s3qj	r/Bitcoin	public		0	[]												
7	[]	False		[deleted]						dark					[removed]	fe993932d6dced4c0a879e9aa5d7a6e0fbb467f5	True	False					0	1653206211		0	{}	i9jhtgk	False	t3_uusaey	False	True	t1_i9jhetd	/r/Bitcoin/comments/uusaey/how_can_btc_be_going_down_if_the_market_is_also/i9jhtgk/	1653206224	1	True	True	False	Bitcoin	t5_2s3qj	r/Bitcoin	public		0	[]												
8	[]	False		Mallardshead			[]			dark	text	t2_g40kqtvx	False	True	"That's part of the key to breaking the USD peg. Exchanges are not going anywhere (CEX/DEX) until there's a sufficient circular economy. That economy will rapidly reprice the asset's unit-of-account into what we call SATS. I've been two places (El Salvador, Turkey) where small circular economies exist. Interestingly in the local language they call sats bitcoin. 1000 sats is 1000 bitcoin to them. The range of prices in sats of similar things should very widely. They don't. The locale's free market arbitrages everything. That'll expand geographically until ∞/21M. Right now we still have a dollar peg and rely on exchange API and exchange arbitrageurs.

Ultimately the scarcity of the money will absorb more and more around it, like hard drives and servers absorb information."	8df30b87072e21a84ab22a3d99c1f2312f5be404	True	False					0	1653206173		0	{}	i9jhrwv	True	t3_uul8o3	False	False	t1_i9jbmlo	/r/Bitcoin/comments/uul8o3/regulation_two_birds_one_stone_my_dark_maximalism/i9jhrwv/	1653206184	1	True	True	False	Bitcoin	t5_2s3qj	r/Bitcoin	public		0	[]												
9	[]	False		eY9b4sG9tM8Wa4			[]				text	t2_hatgov6d	False	False	I can see the sadness in his eyes.	b91a5ad3a5cdc0a4a409674a342f4606994e65a1	True	False					0	1653206163		0	{}	i9jhrke	False	t3_uv626n	False	True	t3_uv626n	/r/Bitcoin/comments/uv626n/12_years_ago_laszlo_hanyecz_the_guy_who_also/i9jhrke/	1653206178	1	True	True	False	Bitcoin	t5_2s3qj	r/Bitcoin	public		0	[]												
10	[]	False		Downtown-Ad-4117		noob	[{'e': 'text', 't': 'redditor for 3 months'}]	2ec8e69e-6c36-11e9-a04b-0afb553d4ea6	redditor for 3 months	dark	richtext	t2_fps997m0	False	False	I remember new years eve 2000, me and some drunk friends switching on the Pentium 133, running Windows 95, to check some websites. After concluding nothing had happened we resumed partying activities. The world had been saved.	debe36d6700a10cc6772c92b3c1ea9fd61256be3	True	False					0	1653206120		0	{}	i9jhpux	False	t3_uupn9r	False	True	t1_i9i4jr0	/r/Bitcoin/comments/uupn9r/bitcoin_will_share_the_same_fate_as_the_internet/i9jhpux/	1653206132	1	True	True	False	Bitcoin	t5_2s3qj	r/Bitcoin	public		0	[]												
11	[]	False		ControversialTomato			[]				text	t2_3g1o9gbc	False	False	That’s because it is. The comment is a reference  to WEF’s plan for the future	76484a82cc396b63cc34505b5904b504a49c20df	True	False					0	1653206112		0	{}	i9jhpix	False	t3_uv4890	False	True	t1_i9jarmh	/r/Bitcoin/comments/uv4890/the_dangers_of_inflation/i9jhpix/	1653206125	1	True	True	False	Bitcoin	t5_2s3qj	r/Bitcoin	public		0	[]												
12	[]	False		StonedHusk			[]				text	t2_bpy4rykk	False	False	Biden printing more money than ever didn’t help	f48e0ed543ef9553f362c86e47d72b96b696f6d8	True	False					0	1653206073		0	{}	i9jho0x	False	t3_uuy972	False	True	t1_i9itf6f	/r/Bitcoin/comments/uuy972/as_we_currently_enter_a_recession_worse_than_2008/i9jho0x/	1653206091	1	True	True	False	Bitcoin	t5_2s3qj	r/Bitcoin	public		0	[]												
13	[]	False		[deleted]						dark					[removed]	fe993932d6dced4c0a879e9aa5d7a6e0fbb467f5	True	False					0	1653206033		0	{}	i9jhmf1	False	t3_uul8o3	False	True	t3_uul8o3	/r/Bitcoin/comments/uul8o3/regulation_two_birds_one_stone_my_dark_maximalism/i9jhmf1/	1653206043	1	True	True	False	Bitcoin	t5_2s3qj	r/Bitcoin	public		0	[]												
14	[]	False		ForcedLoginIsFacism			[]			dark	text	t2_79ca6bgp	False	False	Fuck this shit	fbca80a9b8804f8213eaf4406e5696ca6d2bc064	True	False					0	1653206031		0	{}	i9jhmcp	False	t3_uuy9rq	False	True	t1_i9idl5r	/r/Bitcoin/comments/uuy9rq/i_dont_know_who_needs_to_hear_this_but_the_first/i9jhmcp/	1653206044	1	True	True	False	Bitcoin	t5_2s3qj	r/Bitcoin	public		0	[]												
15	[]	False		ForcedLoginIsFacism			[]			dark	text	t2_79ca6bgp	False	False	High blood pressure before my first coffee. I feel you, lad.	9ca637e6cd89bb353a90b6608dacf30548d2f803	True	False					0	1653205993		0	{}	i9jhku8	False	t3_uuy9rq	False	True	t1_i9i9n0j	/r/Bitcoin/comments/uuy9rq/i_dont_know_who_needs_to_hear_this_but_the_first/i9jhku8/	1653206022	1	True	True	False	Bitcoin	t5_2s3qj	r/Bitcoin	public		0	[]												
16	[]	False		StonedHusk			[]				text	t2_bpy4rykk	False	False	I love bongs!	d3d11eba51f84a05b3a1b73d45ff987b74f58293	True	False					0	1653205987		0	{}	i9jhklj	False	t3_uuy972	False	True	t1_i9iuik1	/r/Bitcoin/comments/uuy972/as_we_currently_enter_a_recession_worse_than_2008/i9jhklj/	1653205998	1	True	True	False	Bitcoin	t5_2s3qj	r/Bitcoin	public		0	[]												
17	[]	False		Cheyemos			[]				text	t2_6zmpn148	False	False	What makes you think Bitcoin will rally and reach that level of valuation?? I see the argument for gold, but Bitcoin is a big head scratching…	c8be2207ad83df80656b36481575bdd203a24d3b	True	False					0	1653205976		0	{}	i9jhk6v	False	t3_uuy972	False	True	t3_uuy972	/r/Bitcoin/comments/uuy972/as_we_currently_enter_a_recession_worse_than_2008/i9jhk6v/	1653205992	1	True	True	False	Bitcoin	t5_2s3qj	r/Bitcoin	public		0	[]												
18	[]	False		Sealobo			[]				text	t2_u3amqeg	False	False	2% p.a. is really not that much. It’s not perfect but it’s a viable alternative.	33a41fc3804b775c5e1fcde5cfc5071d92e969f1	True	False					0	1653205960		0	{}	i9jhjj7	False	t3_uuxj3p	False	True	t3_uuxj3p	/r/Bitcoin/comments/uuxj3p/what_am_i_missing_here_isnt_this_just_getting/i9jhjj7/	1653205977	1	True	True	False	Bitcoin	t5_2s3qj	r/Bitcoin	public		0	[]												
19	[]	False		ForcedLoginIsFacism			[]			dark	text	t2_79ca6bgp	False	False	I guess this is a severe fallacy. The price of no privacy is the true one,  one pays.	f3fda5f5f2659805906d9c57f6f054468aaf5d6b	True	False					0	1653205958		0	{}	i9jhjgi	False	t3_uuy9rq	False	True	t1_i9j0elr	/r/Bitcoin/comments/uuy9rq/i_dont_know_who_needs_to_hear_this_but_the_first/i9jhjgi/	1653205970	1	True	True	False	Bitcoin	t5_2s3qj	r/Bitcoin	public		0	[]												
20	[]	False		ForcedLoginIsFacism			[]			dark	text	t2_79ca6bgp	False	False	Burn it down or pull out the reader. Fuck dystopian shit in this free community	85a80b2be0bed420cad31dc274b5c064555927fc	True	False					0	1653205883		0	{}	i9jhghy	False	t3_uuy9rq	False	True	t3_uuy9rq	/r/Bitcoin/comments/uuy9rq/i_dont_know_who_needs_to_hear_this_but_the_first/i9jhghy/	1653205896	1	True	True	False	Bitcoin	t5_2s3qj	r/Bitcoin	public		0	[]												
21	[]	False		d_101			[]				text	t2_f81wy	False	False	Thanks, great answer. I got it.	90cc888e245cda65aeb401206b280786f34597aa	True	False					0	1653205878		0	{}	i9jhgal	True	t3_uv4z8u	False	True	t1_i9jh3u4	/r/Bitcoin/comments/uv4z8u/how_does_bitcoin_network_exactly_work/i9jhgal/	1653205889	1	True	True	False	Bitcoin	t5_2s3qj	r/Bitcoin	public		0	[]												
22	[]	False		xexcutionerx			[]				text	t2_4np5k5v	False	False	"So i make a shitcoin with 100 trillion supply. 
And buy it myself at 10 usd per coin 

Then i have beaten bitcoin my coin is the new bitcoin. Then roger will want a peice of that too what will i do ? 
Also i am afrid satoshi will kidnap me 
So i will sell it at a loss to myself and keep it under top 100 coins. 
That way ppl will think it has potential but its still shitty enough but not so much."	e5f706b8dea4e921ac727f4ecb55edb30de08809	True	False					0	1653205842		0	{}	i9jhetd	False	t3_uusaey	False	True	t1_i9ha3km	/r/Bitcoin/comments/uusaey/how_can_btc_be_going_down_if_the_market_is_also/i9jhetd/	1653205856	1	True	True	False	Bitcoin	t5_2s3qj	r/Bitcoin	public		0	[]												
23	[]	False		hateschoolfml			[]				text	t2_4krs339o	False	False	Yup, welcome to fractional reserve banking	64213b0076ef2cf1c7b2a01a82a32b6627bb1bc0	True	False					0	1653205831		0	{}	i9jhec2	False	t3_uuy972	False	True	t1_i9isl04	/r/Bitcoin/comments/uuy972/as_we_currently_enter_a_recession_worse_than_2008/i9jhec2/	1653205843	1	True	True	False	Bitcoin	t5_2s3qj	r/Bitcoin	public		0	[]												
24	[]	False		Quiet-Curve9919			[]			dark	text	t2_9nyy3l8z	False	False	Yes!!!!!	f9f629a55bb8685f5dad97c5035c8532593c3879	True	False					0	1653205809		0	{}	i9jhdh2	False	t3_uuxgtz	False	True	t1_i9ibhou	/r/Bitcoin/comments/uuxgtz/goldman_sachs_seeks_partnership_with_crypto/i9jhdh2/	1653205823	1	True	True	False	Bitcoin	t5_2s3qj	r/Bitcoin	public		0	[]												
25	[]	False		trujillobitcoin		noob	[{'e': 'text', 't': 'redditor for a day'}]	2ec8e69e-6c36-11e9-a04b-0afb553d4ea6	redditor for a day	dark	richtext	t2_jqt5ync4	False	False	Well that would be a nice citadel , surrounded by water!	19fd7313639b850d584603d1694fb2e4bb1903d0	True	False					0	1653205800		0	{}	i9jhd2e	False	t3_uum3dt	False	True	t3_uum3dt	/r/Bitcoin/comments/uum3dt/autonomous_region_madeira_to_adopt_bitcoin/i9jhd2e/	1653205816	1	True	True	False	Bitcoin	t5_2s3qj	r/Bitcoin	public		0	[]												
26	[]	False		hateschoolfml			[]				text	t2_4krs339o	False	False	Will fall as speculators leave, will rally as those who understand keep buying	b193a2082d920dc9633d324dee0b5a052ce4cd25	True	False					0	1653205789		0	{}	i9jhclr	False	t3_uuy972	False	True	t1_i9j4jfn	/r/Bitcoin/comments/uuy972/as_we_currently_enter_a_recession_worse_than_2008/i9jhclr/	1653205802	1	True	True	False	Bitcoin	t5_2s3qj	r/Bitcoin	public		0	[]												
27	[]	False		[deleted]						dark					[removed]	fe993932d6dced4c0a879e9aa5d7a6e0fbb467f5	True	False					0	1653205767		0	{}	i9jhboq	False	t3_uv626n	False	True	t3_uv626n	/r/Bitcoin/comments/uv626n/12_years_ago_laszlo_hanyecz_the_guy_who_also/i9jhboq/	1653205782	1	True	True	False	Bitcoin	t5_2s3qj	r/Bitcoin	public		0	[]												
28	[]	False		fazz100			[]				text	t2_xv88g	False	False	i'd love to buy this prophecy. hopium-ing for this.	d73ae6953d5aa990c9a3a0c698b556ea00c22b1b	True	False					0	1653205749		0	{}	i9jhayb	False	t3_uuy972	False	False	t3_uuy972	/r/Bitcoin/comments/uuy972/as_we_currently_enter_a_recession_worse_than_2008/i9jhayb/	1653205761	1	True	True	False	Bitcoin	t5_2s3qj	r/Bitcoin	public		0	[]												
29	[]	False		hateschoolfml			[]				text	t2_4krs339o	False	False	One more quarter of negative gdp and it’s a recession, don’t need to look hard	15264c9236af8f0788ac81b26b3a45600251f58f	True	False					0	1653205715		0	{}	i9jh9l2	False	t3_uuy972	False	True	t1_i9iyl6h	/r/Bitcoin/comments/uuy972/as_we_currently_enter_a_recession_worse_than_2008/i9jh9l2/	1653205727	1	True	True	False	Bitcoin	t5_2s3qj	r/Bitcoin	public		0	[]												
30	[]	False		Rannasha			[]				text	t2_a4fbm	False	False	"&gt; Im still confused about whom am i sending the transaction? When i connect to google, i know their IP because of DNS. When i connect to P2P network who am i sending packets to?

Assuming you run a full node (if you don't, more on that later), you're connected to a number of other nodes. When you send a transaction, you send it to all connected nodes. When a node receives a transaction, it will verify that it is correct and if it is, it will forward it to the nodes that it is connected to. This way, the transaction is propagated through the network. But it can take a fair number of hops before all nodes are reached.

So how do you find the nodes to connect to? This is called the bootstrapping process. The software comes with a number of hardcoded addresses for nodes that are supposed to be online all the time. A user can also provide the software with one or more addresses of nodes to connect to. Once connected to one or more nodes, the software will exchange lists of active nodes that it is aware of. This way, your own node can build a list of nodes it could connect to. The next time it starts up, it'll sort that list on the last time a node was seen online and add some randomization. From that, it'll pick the nodes to connect to that time. Note that once a node has its own list of nodes, it will no longer use the hardcoded node addresses. Those are only there as a last resort if no reachable nodes are known.

If you don't run a full node, but use a ""light wallet"", you're not actually a participant in the Bitcoin network in the same way. Light wallets typically connect to a central server operated by the developer of the wallet. Any transactions and balance queries are routed to this server. This server runs a Bitcoin node and handles interaction with the Bitcoin network."	5f8fd4ca2c9a2db30788822ba26ae6fa7a3c5e40	True	False					0	1653205570		0	{}	i9jh3u4	False	t3_uv4z8u	False	True	t1_i9jey1h	/r/Bitcoin/comments/uv4z8u/how_does_bitcoin_network_exactly_work/i9jh3u4/	1653205586	1	True	True	False	Bitcoin	t5_2s3qj	r/Bitcoin	public		0	[]												
31	[]	False		happy-fella			[]				text	t2_15a9yi88	False	False	"You pay taxes based on tax residency. If you have French tax residency and sell in Belgium France still wants their cut.   
  
Changing tax residency entails moving and / or not living in some country for more than half the time of the year. Pretty much you should look up the details."	5623c354303f8d881e3d87c8d2de96ffdfae7d64	True	False					0	1653205565		0	{}	i9jh3mc	False	t3_uupewp	False	True	t1_i9j3dx3	/r/Bitcoin/comments/uupewp/ecbeu_plans_next_attack_on_bitcoin_suggests_a/i9jh3mc/	1653205579	1	True	True	False	Bitcoin	t5_2s3qj	r/Bitcoin	public		0	[]												
32	[]	False		Biglingfruitpie			[]				text	t2_a1ze537k	False	False	What if it never goes back up?	05d1eb5e2ecfee98e51227f43fc90d7d1c260de6	True	False					0	1653205563		0	{}	i9jh3jk	False	t3_uuy972	False	True	t1_i9iui6i	/r/Bitcoin/comments/uuy972/as_we_currently_enter_a_recession_worse_than_2008/i9jh3jk/	1653205573	1	True	True	False	Bitcoin	t5_2s3qj	r/Bitcoin	public		0	[]												
33	[]	False		vpadwal			[]				text	t2_ff7i72i9	False	False	"Will you can see a lot of major problems which are going to happen because of this same stuff only and this is why it needs to be changed

This is the only reason why people are trying their best to make the changes out of it so that they can go out."	cfde3ecc6758acd5cd77a2529346f704e8cd4ba2	True	False					0	1653205548		0	{}	i9jh2zr	False	t3_uulwtu	False	True	t1_i9j5z4p	/r/Bitcoin/comments/uulwtu/wage_slave_by_design_post_deleted_in_rantiwork/i9jh2zr/	1653205560	1	True	True	False	Bitcoin	t5_2s3qj	r/Bitcoin	public		0	[]												
34	[]	False		Longjumping-Basket62			[]				text	t2_9ped7c1r	False	False	Yes. Nobody knows fuck about shit.	deb335288eb0ab19023a6c8554148c6d0e3a7f32	True	False					0	1653205547		0	{}	i9jh2y9	False	t3_uunz93	False	True	t3_uunz93	/r/Bitcoin/comments/uunz93/jokes_apart_has_anybody_a_valid_analysis_of_the/i9jh2y9/	1653205560	1	True	True	False	Bitcoin	t5_2s3qj	r/Bitcoin	public		0	[]												
35	[]	False		Nuclearstarfishicide		noob	[{'e': 'text', 't': 'redditor for 4 weeks'}]	2ec8e69e-6c36-11e9-a04b-0afb553d4ea6	redditor for 4 weeks	dark	richtext	t2_m5zlddh0	False	False	There are some default nodes that the software connects to, who is known to be up. These nodes also share information on how to reach other nodes, who also share information of their nodes.	31a739b64e7719493320a362823940f8000c5566	True	False					0	1653205532		0	{}	i9jh2dc	False	t3_uv4z8u	False	True	t1_i9jey1h	/r/Bitcoin/comments/uv4z8u/how_does_bitcoin_network_exactly_work/i9jh2dc/	1653205547	1	True	True	False	Bitcoin	t5_2s3qj	r/Bitcoin	public		0	[]												
36	[]	False		Doge-SAE		noob	[{'e': 'text', 't': 'redditor for 6 weeks'}]	2ec8e69e-6c36-11e9-a04b-0afb553d4ea6	redditor for 6 weeks	dark	richtext	t2_lm68nzkt	False	False	Why not just get a Robinhood debit card and buy it?  Oh… you’re doing something illegal.  I get it now.  Sorry.	15297a59ed8f2309fc10d6d1d86db637129b4654	True	False					0	1653205478		0	{}	i9jh07k	False	t3_uutv1u	False	True	t3_uutv1u	/r/Bitcoin/comments/uutv1u/where_can_i_obtain_bitcoin_with_credit_card_or/i9jh07k/	1653205495	1	True	True	False	Bitcoin	t5_2s3qj	r/Bitcoin	public		0	[]												
37	[]	False		volocom7			[]				text	t2_4at7i	False	False	This.	ccdc8713566c46c96d98f3e5bb65e561e79a0320	True	False					0	1653205298		0	{}	i9jgt2g	False	t3_uuy972	False	True	t3_uuy972	/r/Bitcoin/comments/uuy972/as_we_currently_enter_a_recession_worse_than_2008/i9jgt2g/	1653205312	1	True	True	False	Bitcoin	t5_2s3qj	r/Bitcoin	public		0	[]												
38	[]	False		ItalianStallion9069			[]			dark	text	t2_cm1rgyu6	False	False	Why not $15k? $10k? $0?	74b5647015324cfd62983478720927d7af660a88	True	False					0	1653205257		0	{}	i9jgrcd	False	t3_uuy972	False	True	t1_i9jamg1	/r/Bitcoin/comments/uuy972/as_we_currently_enter_a_recession_worse_than_2008/i9jgrcd/	1653205272	1	True	True	False	Bitcoin	t5_2s3qj	r/Bitcoin	public		0	[]												
39	[]	False		Mallardshead			[]			dark	text	t2_g40kqtvx	False	True	Yes.	c53c562dab4b33b3e42f3bc4d8e5719439a9c155	True	False					0	1653205240		0	{}	i9jgqmj	True	t3_uul8o3	False	True	t1_i9ifiaz	/r/Bitcoin/comments/uul8o3/regulation_two_birds_one_stone_my_dark_maximalism/i9jgqmj/	1653205252	1	True	True	False	Bitcoin	t5_2s3qj	r/Bitcoin	public		0	[]												
40	[]	False		SaneLad			[]				text	t2_1tu55rlf	False	True	Taxes and bans are the only things these EU muppets can come up with. This continent is going to shit.	85ac673f7ffd6c5e01fd5b6c6abb83d968889a6d	True	False					0	1653205235		0	{}	i9jgqds	False	t3_uupewp	False	True	t3_uupewp	/r/Bitcoin/comments/uupewp/ecbeu_plans_next_attack_on_bitcoin_suggests_a/i9jgqds/	1653205252	1	True	True	False	Bitcoin	t5_2s3qj	r/Bitcoin	public		0	[]												
41	[]	False		Mallardshead			[]			dark	text	t2_g40kqtvx	False	True	With zero liquidity yes.	61a93f4e455be82f07b31182d0c2099399195051	True	False					0	1653205207		0	{}	i9jgp5r	True	t3_uul8o3	False	True	t1_i9ijp7p	/r/Bitcoin/comments/uul8o3/regulation_two_birds_one_stone_my_dark_maximalism/i9jgp5r/	1653205217	1	True	True	False	Bitcoin	t5_2s3qj	r/Bitcoin	public		0	[]												
42	[]	False		[deleted]						dark					[removed]	fe993932d6dced4c0a879e9aa5d7a6e0fbb467f5	True	False					0	1653205100		0	{}	i9jgkug	False	t3_uuy9rq	False	True	t3_uuy9rq	/r/Bitcoin/comments/uuy9rq/i_dont_know_who_needs_to_hear_this_but_the_first/i9jgkug/	1653205111	1	True	True	False	Bitcoin	t5_2s3qj	r/Bitcoin	public		0	[]												
43	[]	False		Fmanow			[]				text	t2_xmdtl	False	False	Shit like this is why people get ass fucked. You have no basis to what you’re taking about, specially Bitcoin decoupling from stocks. This is everyone’s wet dream in crypto land, but it just ain’t happening, not for a long time. Btc didn’t go to $69k because of retail crypto bros dca  $50 every paycheck. It went to ath because of institutional investors buying btc because there was no more alpha left in stocks, now they’re both retreating in lock step. Luckily for all crypto investors, we have a crystal ball, it’s called the stock market. Btc mimics the markets, specifically nasdaq 100. The great decoupling will be THE event in crypto when it happens, but not just yet.	1c740c75f230937b7ca8f43d8445b411a0b390c9	True	False					0	1653205087		0	{}	i9jgkbi	False	t3_uuy972	False	True	t3_uuy972	/r/Bitcoin/comments/uuy972/as_we_currently_enter_a_recession_worse_than_2008/i9jgkbi/	1653205097	1	True	True	False	Bitcoin	t5_2s3qj	r/Bitcoin	public		0	[]												
44	[]	False		Wombat1886			[]				text	t2_j5jy4	False	False	we will see. Of course never marry an alt coin and only put a 1-3% in one	55f0ab375337d17f6d339f333b6a1191911b17bd	True	False					0	1653205065		0	{}	i9jgjhg	False	t3_uul8o3	False	True	t1_i9ifg2s	/r/Bitcoin/comments/uul8o3/regulation_two_birds_one_stone_my_dark_maximalism/i9jgjhg/	1653205078	1	True	True	False	Bitcoin	t5_2s3qj	r/Bitcoin	public		0	[]												
45	[]	False		osogordo			[]				text	t2_l78ym	False	False	Curious, what do you get when you use this? A seed phrase?	238571fb2edb40b274b2ab980eacb86c36c0e8f3	True	False					0	1653205022		0	{}	i9jght5	False	t3_uuy9rq	False	True	t3_uuy9rq	/r/Bitcoin/comments/uuy9rq/i_dont_know_who_needs_to_hear_this_but_the_first/i9jght5/	1653205037	1	True	True	False	Bitcoin	t5_2s3qj	r/Bitcoin	public		0	[]												
46	[]	False		[deleted]						dark					[removed]	fe993932d6dced4c0a879e9aa5d7a6e0fbb467f5	True	False					0	1653204996		0	{}	i9jggs5	False	t3_uuweeg	False	True	t3_uuweeg	/r/Bitcoin/comments/uuweeg/sponsor_a_professional_golfer_with_bitcoin/i9jggs5/	1653205010	1	True	True	False	Bitcoin	t5_2s3qj	r/Bitcoin	public		0	[]												
47	[]	False		elftantra69			[]				text	t2_j589a106	False	False	Can you share the link please? If you have or can get.	ff9d86a29c59882ecb325e7162b73b948b6297c6	True	False					0	1653204977		0	{}	i9jgg0j	False	t3_uu772m	False	True	t1_i9e2uhv	/r/Bitcoin/comments/uu772m/im_not_afraid_to_tell_the_world_i_love_bitcoin/i9jgg0j/	1653205004	1	True	True	False	Bitcoin	t5_2s3qj	r/Bitcoin	public		0	[]												
48	[]	False		Mentalni_sklop			[]			dark	text	t2_ehlq7zcs	False	False	Strongly disagree. As long as the dollar is going strong and until inflation is under control the fed will keep rising rates and this will hold btc down. Also btc is behaving like a tech stock, its a fact not my opinion, meaning risk off asset in time if recession. Btc is not gold or a store of value, at least not yet. Again we are still early, it will be one day, but at the moment no.	0c150d0694da8e1ff6a4e933504202ad6fb17f34	True	False					0	1653204918		0	{}	i9jgdl0	False	t3_uuy972	False	True	t3_uuy972	/r/Bitcoin/comments/uuy972/as_we_currently_enter_a_recession_worse_than_2008/i9jgdl0/	1653204935	1	True	True	False	Bitcoin	t5_2s3qj	r/Bitcoin	public		0	[]												
