59	[]	False	NoShower2841		[]		text	t2_a0t41rlm	False	False	False	[]	False	False	1651620273	self.Bitcoin	https://www.reddit.com/r/Bitcoin/comments/uhsyrb/i_knew_of_bitcoin_since_2009_i_but_i_only_now/	{}	uhsyrb	False	True	False	False	False	True	True	False		[]	dark	text	False	False	True	0	0	False	all_ads	/r/Bitcoin/comments/uhsyrb/i_knew_of_bitcoin_since_2009_i_but_i_only_now/	False	6		1651620284	1	"When I was a kid I begged my parents to loan me a 100$ to accumulate what would now be considered a whale 🐳 amount. Yet I only recently started a job and started accumulating every month started Oct 2021. And so far I’m in the red 😑 is this normal or am I doing something wrong? Or has this period just sucked in general.


I have DCA every month since DEC 2021 and today i accumulated negative 46.52% on my invested hard work.


Total of 20k is now roughly 10k it hurts. I don’t want to keep working all my life. Bitcoin for me is financial freedom money “savings technology” yet this dumping action is very demotivating.

Please share your experiences, everyone is welcome 🙏🏻 

I am a believer in BTC I just am here to vent 😂"	True	False	False	Bitcoin	t5_2s3qj	4159535	public	self	I knew of Bitcoin since 2009 I but I only now started accumulating and I’m in the RED!	0	[]	1.0	https://www.reddit.com/r/Bitcoin/comments/uhsyrb/i_knew_of_bitcoin_since_2009_i_but_i_only_now/		all_ads	6																					"I knew of Bitcoin since 2009 I but I only now started accumulating and I’m in the RED!
When I was a kid I begged my parents to loan me a 100$ to accumulate what would now be considered a whale 🐳 amount. Yet I only recently started a job and started accumulating every month started Oct 2021. And so far I’m in the red 😑 is this normal or am I doing something wrong? Or has this period just sucked in general.


I have DCA every month since DEC 2021 and today i accumulated negative 46.52% on my invested hard work.


Total of 20k is now roughly 10k it hurts. I don’t want to keep working all my life. Bitcoin for me is financial freedom money “savings technology” yet this dumping action is very demotivating.

Please share your experiences, everyone is welcome 🙏🏻 

I am a believer in BTC I just am here to vent 😂"	i knew of bitcoin since 2009 i but i only now started accumulating and i m in the red when i was a kid i begged my parents to loan me a 100 to accumulate what would now be considered a whale amount yet i only recently started a job and started accumulating every month started oct 2021 and so far i m in the red is this normal or am i doing something wrong or has this period just sucked in general i have dca every month since dec 2021 and today i accumulated negative 46 52 on my invested hard work total of 20k is now roughly 10k it hurts i don t want to keep working all my life bitcoin for me is financial freedom money savings technology yet this dumping action is very demotivating please share your experiences everyone is welcome i am a believer in btc i just am here to vent 	0.002000196371227503	0.9895492792129517	0.1407783329486847	0.010381952859461308	0.9955497980117798	0.42281749844551086	0.1714046448469162	8.574515959480777e-07	0.2481498420238495	0.004954279400408268
60	[]	False	All_these_marbles		[]		text	t2_g348kfd3	False	False	False	[]	False	False	1651618663	self.Bitcoin	https://www.reddit.com/r/Bitcoin/comments/uhsf2d/since_when_is_bitcoin_pro_racism_why_the_f_are/	{}	uhsf2d	False	False	False	False	False	False	True	False		[]	dark	text	False	False	True	0	0	False	all_ads	/r/Bitcoin/comments/uhsf2d/since_when_is_bitcoin_pro_racism_why_the_f_are/	False	6	moderator	1651618673	1	[removed]	True	False	False	Bitcoin	t5_2s3qj	4159490	public	self	Since when is bitcoin pro racism? why the f*** are you promoting joe god**** rogan?	0	[]	1.0	https://www.reddit.com/r/Bitcoin/comments/uhsf2d/since_when_is_bitcoin_pro_racism_why_the_f_are/		all_ads	6		dark																			"Since when is bitcoin pro racism? why the f*** are you promoting joe god**** rogan?
[removed]"	since when is bitcoin pro racism why the f are you promoting joe god rogan removed 	0.036216311156749725	0.45230334997177124	0.8722790479660034	0.15714791417121887	0.30229583382606506	0.2688148021697998	0.20124773681163788	2.2044462184567237e-06	0.4455627501010895	0.0021929950453341007
61	[]	False	All_these_marbles		[]		text	t2_g348kfd3	False	False	False	[]	False	False	1651618602	self.Bitcoin	https://www.reddit.com/r/Bitcoin/comments/uhseas/since_when_is_bitcoin_pro_racism_why_the_fuck_are/	{}	uhseas	False	False	False	False	False	False	True	False		[]	dark	text	False	False	True	0	0	False	all_ads	/r/Bitcoin/comments/uhseas/since_when_is_bitcoin_pro_racism_why_the_fuck_are/	False	6	moderator	1651618613	1	[removed]	True	False	False	Bitcoin	t5_2s3qj	4159491	public	self	Since when is bitcoin pro racism? why the fuck are you promoting joe goddamn rogan?	0	[]	1.0	https://www.reddit.com/r/Bitcoin/comments/uhseas/since_when_is_bitcoin_pro_racism_why_the_fuck_are/		all_ads	6		dark																			"Since when is bitcoin pro racism? why the fuck are you promoting joe goddamn rogan?
[removed]"	since when is bitcoin pro racism why the fuck are you promoting joe goddamn rogan removed 	0.025196662172675133	0.27691203355789185	0.941909909248352	0.1385975480079651	0.24291086196899414	0.4526364505290985	0.15474346280097961	8.819568392937072e-06	0.41858959197998047	0.001331943436525762
62	[]	False	JTennant83		[]		text	t2_a3qvs6w6	False	False	False	[]	False	False	1651618286	self.Bitcoin	https://www.reddit.com/r/Bitcoin/comments/uhsabg/fuck_the_media/	{}	uhsabg	False	True	False	False	False	True	True	False		[]	dark	text	False	False	False	0	0	False	all_ads	/r/Bitcoin/comments/uhsabg/fuck_the_media/	False	6		1651618297	1	I know BTC is supposed to be apolitical, but the media around us is most certainly not. Their liberally slanted, misguided, “reporting” and FUD on bitcoin only hinders hyperbitcoinization and adoption at a quicker pace. There are a lot of dumbfucks out there who believe anything they read. It is, IMO, a duty of all bitcoiners to do their part and steer people in the right direction regarding accurate info to allow them to choose for themselves. It will only help the everyday man and get them away from the inflated fiat world of corruption.	True	False	False	Bitcoin	t5_2s3qj	4159484	public	self	Fuck the media	0	[]	1.0	https://www.reddit.com/r/Bitcoin/comments/uhsabg/fuck_the_media/		all_ads	6																					"Fuck the media
I know BTC is supposed to be apolitical, but the media around us is most certainly not. Their liberally slanted, misguided, “reporting” and FUD on bitcoin only hinders hyperbitcoinization and adoption at a quicker pace. There are a lot of dumbfucks out there who believe anything they read. It is, IMO, a duty of all bitcoiners to do their part and steer people in the right direction regarding accurate info to allow them to choose for themselves. It will only help the everyday man and get them away from the inflated fiat world of corruption."	fuck the media i know btc is supposed to be apolitical but the media around us is most certainly not their liberally slanted misguided reporting and fud on bitcoin only hinders hyperbitcoinization and adoption at a quicker pace there are a lot of dumbfucks out there who believe anything they read it is imo a duty of all bitcoiners to do their part and steer people in the right direction regarding accurate info to allow them to choose for themselves it will only help the everyday man and get them away from the inflated fiat world of corruption 	0.0019886826630681753	0.9888835549354553	0.9264516234397888	0.02699880115687847	0.007788156624883413	0.13968177139759064	0.07864964008331299	8.460213507532899e-07	0.23137089610099792	0.0015571995172649622
63	[]	False	meefozio		[]		text	t2_4lziz	False	False	False	[]	False	False	1651618161	self.Bitcoin	https://www.reddit.com/r/Bitcoin/comments/uhs8pw/whats_your_guess_for_the_lowest_price_well_see/	{}	uhs8pw	False	False	False	False	False	False	True	False		[{'e': 'text', 't': 'comment as submission'}]	dark	richtext	False	False	True	0	0	False	all_ads	/r/Bitcoin/comments/uhs8pw/whats_your_guess_for_the_lowest_price_well_see/	False	6	moderator	1651618172	1	[removed]	True	False	False	Bitcoin	t5_2s3qj	4159479	public	self	What's your guess for the lowest price we'll see going forward?	0	[]	1.0	https://www.reddit.com/r/Bitcoin/comments/uhs8pw/whats_your_guess_for_the_lowest_price_well_see/		all_ads	6															comment as submission						"What's your guess for the lowest price we'll see going forward?
[removed]"	what s your guess for the lowest price we ll see going forward removed 	0.311703085899353	0.586698055267334	0.16436049342155457	0.3846733570098877	0.47527965903282166	0.5293817520141602	0.3427942395210266	0.018489444628357887	0.3202119469642639	0.0050495401956140995
64	[]	False	hyperinflationUSA		[]		text	t2_bf6vmd19	False	False	False	[]	False	False	1651617602	thehalvening.com	https://www.reddit.com/r/Bitcoin/comments/uhs1pa/bitcoin_solstice_is_tomorrow_221_blocks_36_hours/	{}	uhs1pa	False	False	False	False	False	False	False	False		[]	dark	text	False	False	True	0	0	False	all_ads	/r/Bitcoin/comments/uhs1pa/bitcoin_solstice_is_tomorrow_221_blocks_36_hours/	False	6	moderator	1651617612	1		True	False	False	Bitcoin	t5_2s3qj	4159466	public	default	Bitcoin Solstice is tomorrow. 221 Blocks = 36 hours away	0	[]	1.0	https://www.thehalvening.com/	https://www.thehalvening.com/	all_ads	6		dark																			"Bitcoin Solstice is tomorrow. 221 Blocks = 36 hours away
"	bitcoin solstice is tomorrow 221 blocks 36 hours away nan	0.43697312474250793	0.6387537717819214	0.18306338787078857	0.22867022454738617	0.28397905826568604	0.42150571942329407	0.31546100974082947	0.5177613496780396	0.3690699338912964	0.04180069640278816
65	[]	False	DanK91		[]		text	t2_mtset	False	False	False	[]	False	False	1651617266	self.Bitcoin	https://www.reddit.com/r/Bitcoin/comments/uhrx9f/nodes/	{}	uhrx9f	False	True	False	False	False	True	True	False		[]	dark	text	False	False	True	0	0	False	all_ads	/r/Bitcoin/comments/uhrx9f/nodes/	False	6		1651617277	1	"What are some cheap but still good options? Sub $500 ideally. Or is $500 about what I should expect to spend?

Thanks in advance"	True	False	False	Bitcoin	t5_2s3qj	4159459	public	self	Nodes	0	[]	1.0	https://www.reddit.com/r/Bitcoin/comments/uhrx9f/nodes/		all_ads	6																					"Nodes
What are some cheap but still good options? Sub $500 ideally. Or is $500 about what I should expect to spend?

Thanks in advance"	nodes what are some cheap but still good options sub 500 ideally or is 500 about what i should expect to spend thanks in advance	0.5325688719749451	0.9438348412513733	0.028099358081817627	0.02646446041762829	0.4436546862125397	0.3854084014892578	0.13673065602779388	9.42704787121329e-07	0.37268105149269104	0.04064282774925232
66	[]	False	BL4CKN166464N6		[]		text	t2_7i35u9yr	False	False	False	[]	False	False	1651617226	i.redd.it	https://www.reddit.com/r/Bitcoin/comments/uhrwo9/noticed_this_relationship_between_bitcoins_peaks/	{}	uhrwo9	False	True	False	False	True	True	False	False		[]	dark	text	False	False	True	0	0	False	all_ads	/r/Bitcoin/comments/uhrwo9/noticed_this_relationship_between_bitcoins_peaks/	False	6		1651617236	1		True	False	False	Bitcoin	t5_2s3qj	4159458	public	https://b.thumbs.redditmedia.com/6SkdH9_Edcw0v9zw1PAWgZaxWETCDdi5gPssHtGtJ3A.jpg	Noticed this relationship between Bitcoin's peaks and troughs, pointing to decreasing volatility	0	[]	1.0	https://i.redd.it/5lr4l9ud8cx81.png	https://i.redd.it/5lr4l9ud8cx81.png	all_ads	6		dark	image	{'enabled': True, 'images': [{'id': 'MZK2XTAZkfUzBX3PtNfvXs8HV4zGqIibtPKIGvveUN4', 'resolutions': [{'height': 60, 'url': 'https://preview.redd.it/5lr4l9ud8cx81.png?width=108&amp;crop=smart&amp;auto=webp&amp;s=a9ed0c6635d366a7fede43d615f59340215ea382', 'width': 108}, {'height': 121, 'url': 'https://preview.redd.it/5lr4l9ud8cx81.png?width=216&amp;crop=smart&amp;auto=webp&amp;s=13ee6f973ebd9d8fcd38a0cb4259bb1a6ac1989b', 'width': 216}, {'height': 180, 'url': 'https://preview.redd.it/5lr4l9ud8cx81.png?width=320&amp;crop=smart&amp;auto=webp&amp;s=caef15acaf96cc699569416b42a9478f660d0cfa', 'width': 320}, {'height': 360, 'url': 'https://preview.redd.it/5lr4l9ud8cx81.png?width=640&amp;crop=smart&amp;auto=webp&amp;s=0f3531bc587c2e81a155e4722f0a2126977a9fd3', 'width': 640}, {'height': 540, 'url': 'https://preview.redd.it/5lr4l9ud8cx81.png?width=960&amp;crop=smart&amp;auto=webp&amp;s=9944baf7a1d6be46eb26294d2ed0a834d7058c9e', 'width': 960}, {'height': 607, 'url': 'https://preview.redd.it/5lr4l9ud8cx81.png?width=1080&amp;crop=smart&amp;auto=webp&amp;s=7d3ecc71db6007d0f174ef24f277320dc85ca74b', 'width': 1080}], 'source': {'height': 720, 'url': 'https://preview.redd.it/5lr4l9ud8cx81.png?auto=webp&amp;s=cbea29f9542e7186b89e08ff72e95913d6129246', 'width': 1280}, 'variants': {}}]}	78.0	140.0															"Noticed this relationship between Bitcoin's peaks and troughs, pointing to decreasing volatility
"	noticed this relationship between bitcoin s peaks and troughs pointing to decreasing volatility nan	0.15352006256580353	0.7752810716629028	0.3878287076950073	0.28015196323394775	0.7404384613037109	0.2782743573188782	0.3735819458961487	0.7107871770858765	0.46815624833106995	0.7207194566726685
67	[]	False	ComprehensiveSet2461		[]		text	t2_csun9eww	False	False	False	[]	False	False	1651617036	self.Bitcoin	https://www.reddit.com/r/Bitcoin/comments/uhrubh/do_you_know_other_sites_good_like_coinriderscom/	{}	uhrubh	False	True	False	False	False	True	True	False		[]	dark	text	False	False	True	0	0	False	all_ads	/r/Bitcoin/comments/uhrubh/do_you_know_other_sites_good_like_coinriderscom/	False	6		1651617047	1	"Do you know other sites good like coinriders.com?

for check crypto and view predictions"	True	False	False	Bitcoin	t5_2s3qj	4159455	public	self	Do you know other sites good like coinriders.com?	0	[]	1.0	https://www.reddit.com/r/Bitcoin/comments/uhrubh/do_you_know_other_sites_good_like_coinriderscom/		all_ads	6																					"Do you know other sites good like coinriders.com?
Do you know other sites good like coinriders.com?

for check crypto and view predictions"	do you know other sites good like coinriders com do you know other sites good like coinriders com for check crypto and view predictions	0.44552791118621826	0.7359123826026917	0.017371073365211487	0.014678164385259151	0.8192390203475952	0.33072513341903687	0.1888706237077713	0.8831537961959839	0.4607912003993988	0.005853444803506136
68	[]	False	TrudleR		[]		text	t2_h0h5v	False	False	False	[]	False	False	1651616445	i.redd.it	https://www.reddit.com/r/Bitcoin/comments/uhrmom/when_they_ask_you_if_you_sold_your_bitcoin/	{}	uhrmom	False	True	False	False	True	True	False	False		[]	dark	text	False	False	True	0	0	False	all_ads	/r/Bitcoin/comments/uhrmom/when_they_ask_you_if_you_sold_your_bitcoin/	False	6		1651616456	1		True	False	False	Bitcoin	t5_2s3qj	4159440	public	https://b.thumbs.redditmedia.com/JG91d8MvE4_UgQ_o-NVIBu_I76g02W4EC5hZkeXnW2M.jpg	When they ask you if you sold your bitcoin...	0	[]	1.0	https://i.redd.it/wi0uhn156cx81.jpg	https://i.redd.it/wi0uhn156cx81.jpg	all_ads	6			image	{'enabled': True, 'images': [{'id': '05qV-BJMRCqqhsjRpb7g82RaSEZW6Sr76-CVTc9DkxI', 'resolutions': [{'height': 108, 'url': 'https://preview.redd.it/wi0uhn156cx81.jpg?width=108&amp;crop=smart&amp;auto=webp&amp;s=a390fd14d901b6517789b6049a5088a7232f1713', 'width': 108}, {'height': 216, 'url': 'https://preview.redd.it/wi0uhn156cx81.jpg?width=216&amp;crop=smart&amp;auto=webp&amp;s=7a4d2215c6c3b47201ef325aa15a1e3ad6004638', 'width': 216}, {'height': 320, 'url': 'https://preview.redd.it/wi0uhn156cx81.jpg?width=320&amp;crop=smart&amp;auto=webp&amp;s=7b278c5a92297b25153cbbfe4639b742a40e5e66', 'width': 320}], 'source': {'height': 628, 'url': 'https://preview.redd.it/wi0uhn156cx81.jpg?auto=webp&amp;s=e6cc940b37fc508bcf8e79afdef1f6490c855443', 'width': 628}, 'variants': {}}]}	140.0	140.0															"When they ask you if you sold your bitcoin...
"	when they ask you if you sold your bitcoin nan	0.4175196588039398	0.33827337622642517	0.4456591308116913	0.656471312046051	0.30030012130737305	0.5347475409507751	0.32860803604125977	0.36826291680336	0.367827832698822	0.13147114217281342
69	[]	False	MichaelYeadon		[]		text	t2_mez4q5i1	False	False	False	[]	False	False	1651616195	rebrand.ly	https://www.reddit.com/r/Bitcoin/comments/uhrjar/a_cryptocurrency_video_course_for_beginners_from/	{}	uhrjar	False	False	False	False	False	False	False	False		[]	dark	text	False	False	True	0	0	False	all_ads	/r/Bitcoin/comments/uhrjar/a_cryptocurrency_video_course_for_beginners_from/	False	6	moderator	1651616205	1		False	False	False	Bitcoin	t5_2s3qj	4159429	public	default	A cryptocurrency video course for beginners from an ex-Agora guru now publishing independently. High quality content, great conversions and happy customers.	0	[]	1.0	http://rebrand.ly/fca64bb	http://rebrand.ly/fca64bb	all_ads	6																					"A cryptocurrency video course for beginners from an ex-Agora guru now publishing independently. High quality content, great conversions and happy customers.
"	a cryptocurrency video course for beginners from an ex agora guru now publishing independently high quality content great conversions and happy customers nan	0.08666928112506866	0.9637177586555481	0.009598162956535816	0.06471972912549973	0.32281720638275146	0.5384840965270996	0.5197628736495972	8.783280804891547e-07	0.4027922749519348	0.013103043660521507
70	[]	False	Mountain_Finding_603	noob	[{'e': 'text', 't': 'redditor for 4 weeks'}]	redditor for 4 weeks	richtext	t2_jgvng374	False	False	False	[]	False	False	1651614549	self.Bitcoin	https://www.reddit.com/r/Bitcoin/comments/uhqxro/does_adding_one_crypto_transaction_to_a_block/	{}	uhqxro	False	True	False	False	False	True	True	False		[]	dark	text	False	False	True	0	0	False	all_ads	/r/Bitcoin/comments/uhqxro/does_adding_one_crypto_transaction_to_a_block/	False	6		1651614560	1	"Say a PoW blockchain (maybe BTC) happens to have 10,000 miners with identical hardware  and 100,000 transactions to be posted in the next block. This process  requires 1 amount of energy in an unspecified joule-like unit. Say you  add one transaction to this queue. Does this 100,001st transaction:

A: take zero energy to process, or,

B: consume 1/100,001 of an unspecified joule-like unit of energy, or similar, or,

C. A lengthy well-written response about a classically large misunderstanding I've made about PoW crytocurrencies

Thank you in advance for your time. I tried asking in r/CryptoCurrency but their bot has it out for me."	True	False	False	Bitcoin	t5_2s3qj	4159377	public	self	does adding one crypto transaction to a block actually use any energy	0	[]	1.0	https://www.reddit.com/r/Bitcoin/comments/uhqxro/does_adding_one_crypto_transaction_to_a_block/		all_ads	6	2ec8e69e-6c36-11e9-a04b-0afb553d4ea6	dark																			"does adding one crypto transaction to a block actually use any energy
Say a PoW blockchain (maybe BTC) happens to have 10,000 miners with identical hardware  and 100,000 transactions to be posted in the next block. This process  requires 1 amount of energy in an unspecified joule-like unit. Say you  add one transaction to this queue. Does this 100,001st transaction:

A: take zero energy to process, or,

B: consume 1/100,001 of an unspecified joule-like unit of energy, or similar, or,

C. A lengthy well-written response about a classically large misunderstanding I've made about PoW crytocurrencies

Thank you in advance for your time. I tried asking in r/CryptoCurrency but their bot has it out for me."	does adding one crypto transaction to a block actually use any energy say a pow blockchain maybe btc happens to have 10 000 miners with identical hardware and 100 000 transactions to be posted in the next block this process requires 1 amount of energy in an unspecified joule like unit say you add one transaction to this queue does this 100 001st transaction a take zero energy to process or b consume 1 100 001 of an unspecified joule like unit of energy or similar or c a lengthy well written response about a classically large misunderstanding i ve made about pow crytocurrencies thank you in advance for your time i tried asking in r cryptocurrency but their bot has it out for me 	0.0026291431859135628	0.9890740513801575	0.023823237046599388	0.021208956837654114	0.008257445879280567	0.6398340463638306	0.08681126683950424	8.09020320957643e-07	0.2293478101491928	0.024123236536979675
71	[]	False	Reahvenz		[]		text	t2_34jvnp5q	False	False	False	[]	False	False	1651614168	/r/Bitcoin/comments/uhqsvt/if_you_look_at_the_smartest_and_brightest_minds/	https://www.reddit.com/r/Bitcoin/comments/uhqsvt/if_you_look_at_the_smartest_and_brightest_minds/	{}	uhqsvt	False	True	False	False	False	True	False	True		[]	dark	text	False	False	True	0	0	False	all_ads	/r/Bitcoin/comments/uhqsvt/if_you_look_at_the_smartest_and_brightest_minds/	False	6		1651614179	1		False	False	False	Bitcoin	t5_2s3qj	4159363	public	https://b.thumbs.redditmedia.com/htCnCKsAeJaTXAAstifk1vtLkJDHuAIEpDM_5NB8aQM.jpg	"""If you look at the smartest and brightest minds that are coming out of colleges today, so many of them are going into crypto"", says Paul Tudor Jones."	0	[]	1.0	https://v.redd.it/8hmgswcbzbx81	https://v.redd.it/8hmgswcbzbx81	all_ads	6			hosted:video	{'enabled': False, 'images': [{'id': 'OlX8PyHBdZe-Esvre_PBOXnk-5pCiR8bNhGvLMlDN3E', 'resolutions': [{'height': 60, 'url': 'https://external-preview.redd.it/A592HXZlPz1xuVyFDhaU6Hb-0HKxuYUDvVD793YBCys.png?width=108&amp;crop=smart&amp;format=pjpg&amp;auto=webp&amp;s=ff9d986403b74dbd3aead9f391164ad5024c78c0', 'width': 108}, {'height': 121, 'url': 'https://external-preview.redd.it/A592HXZlPz1xuVyFDhaU6Hb-0HKxuYUDvVD793YBCys.png?width=216&amp;crop=smart&amp;format=pjpg&amp;auto=webp&amp;s=0d24453a2a1640c604946a48381c7195b5be0a70', 'width': 216}, {'height': 180, 'url': 'https://external-preview.redd.it/A592HXZlPz1xuVyFDhaU6Hb-0HKxuYUDvVD793YBCys.png?width=320&amp;crop=smart&amp;format=pjpg&amp;auto=webp&amp;s=a1cf5eeede6b645174b15c5174b1a5704cccd9bc', 'width': 320}, {'height': 360, 'url': 'https://external-preview.redd.it/A592HXZlPz1xuVyFDhaU6Hb-0HKxuYUDvVD793YBCys.png?width=640&amp;crop=smart&amp;format=pjpg&amp;auto=webp&amp;s=5ce50e6f58e56679786e9a64184d66688ea71743', 'width': 640}, {'height': 540, 'url': 'https://external-preview.redd.it/A592HXZlPz1xuVyFDhaU6Hb-0HKxuYUDvVD793YBCys.png?width=960&amp;crop=smart&amp;format=pjpg&amp;auto=webp&amp;s=f400ce5985a533039c4654f45f8d634e35ec47eb', 'width': 960}, {'height': 607, 'url': 'https://external-preview.redd.it/A592HXZlPz1xuVyFDhaU6Hb-0HKxuYUDvVD793YBCys.png?width=1080&amp;crop=smart&amp;format=pjpg&amp;auto=webp&amp;s=1f12369515ddef465b795a031b51c7f4ed7b83e6', 'width': 1080}], 'source': {'height': 720, 'url': 'https://external-preview.redd.it/A592HXZlPz1xuVyFDhaU6Hb-0HKxuYUDvVD793YBCys.png?format=pjpg&amp;auto=webp&amp;s=5e3a36ae963d778c1b896d4a059b83c6ec58f31f', 'width': 1280}, 'variants': {}}]}	78.0	140.0															"""If you look at the smartest and brightest minds that are coming out of colleges today, so many of them are going into crypto"", says Paul Tudor Jones.
"	 if you look at the smartest and brightest minds that are coming out of colleges today so many of them are going into crypto says paul tudor jones nan	0.3797735273838043	0.6937322020530701	0.5300115942955017	0.12068045884370804	0.09101548045873642	0.6487202644348145	0.14811334013938904	8.639953534839151e-07	0.40072742104530334	0.051353927701711655
