Unnamed: 0	all_awardings	archived	associated_award	author	author_flair_background_color	author_flair_css_class	author_flair_richtext	author_flair_template_id	author_flair_text	author_flair_text_color	author_flair_type	author_fullname	author_patreon_flair	author_premium	body	body_sha1	can_gild	collapsed	collapsed_because_crowd_control	collapsed_reason	collapsed_reason_code	comment_type	controversiality	created_utc	distinguished	gilded	gildings	id	is_submitter	link_id	locked	no_follow	parent_id	permalink	retrieved_utc	score	score_hidden	send_replies	stickied	subreddit	subreddit_id	subreddit_name_prefixed	subreddit_type	top_awarded_type	total_awards_received	treatment_tags	unrepliable_reason	author_cakeday	corpus	support	knowledge	conflict	power	similarity	fun	status	trust	identity	romance
0	[]	False		SnowmanRandom			[]				text	t2_3nnq8z3h	False	False	Because mining tends to be more centralized with the advantages of scaling. Mining BTC is mainly done by a few actors worldwide.	73847fce82b0e8eeb069adee298981c4d0d1d204	True	False					0	1653552034		0	{}	ia1hdwv	False	t3_uxtgim	False	False	t1_ia054iu	/r/Bitcoin/comments/uxtgim/this_is_the_reason_why_pow_is_better_than_pos/ia1hdwv/	1653552045	1	True	True	False	Bitcoin	t5_2s3qj	r/Bitcoin	public		0	[]													
1	[]	False		spin_kick			[]				text	t2_58k0z	False	False	"So is it okay to trust them now that they talk favorably about the currency ?

We are in the ""then they join you"" phase"	924f829af020135a50d0c05f6bea6a6945e71331	True	False					0	1653552004		0	{}	ia1hckm	False	t3_uxvmny	False	True	t3_uxvmny	/r/Bitcoin/comments/uxvmny/jpmorgan_terms_bitcoin_as_favorite_alternative/ia1hckm/	1653552019	1	True	True	False	Bitcoin	t5_2s3qj	r/Bitcoin	public		0	[]													
2	[]	False		[deleted]						dark					[removed]	fe993932d6dced4c0a879e9aa5d7a6e0fbb467f5	True	False					0	1653551974		0	{}	ia1hbet	False	t3_uy03pk	False	True	t3_uy03pk	/r/Bitcoin/comments/uy03pk/daily_discussion_may_26_2022/ia1hbet/	1653551985	1	True	True	False	Bitcoin	t5_2s3qj	r/Bitcoin	public		0	[]													
3	[]	False		Knurlinger			[]				text	t2_gvhxc	False	False	What the heck? Is this supposed to be a real story?	1b8944b3da9c15b471091e1636f8caf494a017ce	True	False					0	1653551908		0	{}	ia1h8rn	False	t3_uy255r	False	True	t3_uy255r	/r/Bitcoin/comments/uy255r/how_to_lose_money_by_investing_through/ia1h8rn/	1653551918	1	True	True	False	Bitcoin	t5_2s3qj	r/Bitcoin	public		0	[]													
4	[]	False		baconbitz0			[]				text	t2_9xaoe	False	False	"Mix in the fact she just dropped the anecdote of her son purchasing crypto and it shows her vain indifference to the plight of the likes of even her son. 

Not a care but for her selfish whims."	9b630d9ec6d0d8b88bccd971ac2e6b6e29e5385e	True	False					0	1653551903		0	{}	ia1h8kb	False	t3_uxn9q4	False	True	t1_ia1a0p0	/r/Bitcoin/comments/uxn9q4/watch_christine_lagarde_of_ecb_being_questioned/ia1h8kb/	1653551919	1	True	True	False	Bitcoin	t5_2s3qj	r/Bitcoin	public		0	[]													
5	[]	False		magneticman245			[]				text	t2_nykc7	False	False	"There's no point reading a PoS whitepaper when the entire concept of PoS is flawed to begin with:

https://medium.com/stakin/centralization-of-stake-in-pos-f7ccb8f8254

https://medium.com/@BobMcElrath/whats-wrong-with-proof-of-stake-77d4f370be15

https://github.com/libbitcoin/libbitcoin-system/wiki/Proof-of-Stake-Fallacy"	f1444d2cb663722b0bb6f3ce6a3f7c0d23c0e0ca	True	False					0	1653551888		0	{}	ia1h7yi	False	t3_uxtgim	False	True	t1_ia1fzum	/r/Bitcoin/comments/uxtgim/this_is_the_reason_why_pow_is_better_than_pos/ia1h7yi/	1653551899	1	True	True	False	Bitcoin	t5_2s3qj	r/Bitcoin	public		0	[]													
6	[]	False		Tall_Mechanic8403			[]				text	t2_6atz8dn4	False	False	“We”	7b2cb1935deded7ad33585e3d3dbdae420e6ca3e	True	False					0	1653551868		0	{}	ia1h75x	False	t3_uxwqp2	False	True	t1_ia0omgt	/r/Bitcoin/comments/uxwqp2/how_come_crypto_wasnt_invented_in_the_1980s/ia1h75x/	1653551879	1	True	True	False	Bitcoin	t5_2s3qj	r/Bitcoin	public		0	[]													
7	[]	False		Scam_by_UnionBazaar		noob	[{'e': 'text', 't': 'redditor for a day'}]	2ec8e69e-6c36-11e9-a04b-0afb553d4ea6	redditor for a day	dark	richtext	t2_nnof6ltc	False	False	yep. like many other advise you get from the verified accounts....	42617fa03518f2ed1eb07325de6e06d6b3289d1f	True	False					0	1653551851		0	{}	ia1h6ig	True	t3_uy255r	False	True	t1_ia1guvh	/r/Bitcoin/comments/uy255r/how_to_lose_money_by_investing_through/ia1h6ig/	1653551866	1	True	True	False	Bitcoin	t5_2s3qj	r/Bitcoin	public		0	[]													
8	[]	False		my4coins			[]			dark	text	t2_8o862zj1	False	False	Okay Bitcoin, now you have rested 2 weeks near this $30K camping ground. Now it's time to start climbing. No stress, baby steps are fine.	f5b2257ac5ee55c9514e325f08292ef5258d7303	True	False					0	1653551845		0	{}	ia1h6b7	False	t3_uy03pk	False	True	t3_uy03pk	/r/Bitcoin/comments/uy03pk/daily_discussion_may_26_2022/ia1h6b7/	1653551859	1	True	True	False	Bitcoin	t5_2s3qj	r/Bitcoin	public		0	[]													
9	[]	False		mpem___			[]				text	t2_71xpr16u	False	False	that page look like scam from first sight. how could dumb people like you have $20k just laying around?	f592bc1f89266e5f62d1c34e3c112620531ea08d	True	False					0	1653551835		0	{}	ia1h5yz	False	t3_uy255r	False	True	t3_uy255r	/r/Bitcoin/comments/uy255r/how_to_lose_money_by_investing_through/ia1h5yz/	1653551846	1	True	True	False	Bitcoin	t5_2s3qj	r/Bitcoin	public		0	[]													
10	[]	False		Godfreee			[]				text	t2_a7jvo	False	False	"""Investing"" in ""Cryptos"" is a pure BS. Accumulating Bitcoin is not the same thing."	27f7685febe5d6c5e2dd9b64b07613a1c65966f3	True	False					0	1653551817		0	{}	ia1h5a0	False	t3_uxn9q4	False	True	t3_uxn9q4	/r/Bitcoin/comments/uxn9q4/watch_christine_lagarde_of_ecb_being_questioned/ia1h5a0/	1653551833	1	True	True	False	Bitcoin	t5_2s3qj	r/Bitcoin	public		0	[]													
11	[]	False		GorillaSpinner69			[]				text	t2_fyzqy0ig	False	False	I just came back from Holiday in Portugal would love to go back via Visa property 🔥	c8da482f05f6cd5a4357c67c76dc91617e95efbd	True	False					0	1653551817		0	{}	ia1h59t	False	t3_uy0s0z	False	True	t3_uy0s0z	/r/Bitcoin/comments/uy0s0z/portugal_has_rejected_proposal_to_tax_bitcoin/ia1h59t/	1653551833	1	True	True	False	Bitcoin	t5_2s3qj	r/Bitcoin	public		0	[]													
12	[]	False		CoinCorner_Sam			[]			dark	text	t2_fospv9k6	False	True	Similar question is asked here quite often. If too frequent, some of the posts gets removed by (possibly) auto-moderator. The bot will leave a similar (not sarcastic) message. Can't find any RN, perhaps my app is hiding removed posts.	f1f64caf5826e63651d2050be2e737559683a843	True	False					0	1653551804		0	{}	ia1h4qu	False	t3_uxolc4	False	True	t1_i9z1bjy	/r/Bitcoin/comments/uxolc4/i_have_20000_i_dont_really_need_i_have_401k_cash/ia1h4qu/	1653551820	1	True	True	False	Bitcoin	t5_2s3qj	r/Bitcoin	public		0	[]													
13	[]	False		vpadwal			[]				text	t2_ff7i72i9	False	False	That's right, we have to hold as much as possible before that day.	7fd1c59aad8d9082ba56cb295f182b731f7bbc80	True	False					0	1653551738		0	{}	ia1h22d	False	t3_ux8xfw	False	True	t1_i9x85zk	/r/Bitcoin/comments/ux8xfw/if_demand_for_bitcoin_goes_up/ia1h22d/	1653551754	1	True	True	False	Bitcoin	t5_2s3qj	r/Bitcoin	public		0	[]													
14	[]	False		Knurlinger			[]				text	t2_gvhxc	False	False	That’d be the point where you should definitely invest then.	6f8dc72cc589d2de2cc1440a56c9a8fdc694ab39	True	False					0	1653551714		0	{}	ia1h11u	False	t3_uxolc4	False	True	t1_ia1fb6i	/r/Bitcoin/comments/uxolc4/i_have_20000_i_dont_really_need_i_have_401k_cash/ia1h11u/	1653551726	1	True	True	False	Bitcoin	t5_2s3qj	r/Bitcoin	public		0	[]													
15	[]	False		DagiUr			[]			dark	text	t2_esxic95f	False	False	yes, join the revolution pls.	b3a1e5eacb8b0ecee5d15452740dba83891a670f	True	False					0	1653551681		0	{}	ia1gzqo	False	t3_uxolc4	False	True	t3_uxolc4	/r/Bitcoin/comments/uxolc4/i_have_20000_i_dont_really_need_i_have_401k_cash/ia1gzqo/	1653551693	1	True	True	False	Bitcoin	t5_2s3qj	r/Bitcoin	public		0	[]													
16	[]	False		jdmsantos			[]				text	t2_c57lyznd	False	False	Bitcoin is the one that is still carrying the market of the crypto.	5de6bf8fb85858c4ebc7c9b08f30017aa5c497ea	True	False					0	1653551572		0	{}	ia1gv9t	False	t3_uxkvkb	False	False	t1_i9zdt6a	/r/Bitcoin/comments/uxkvkb/i_bless_you_altcoins/ia1gv9t/	1653551613	1	True	True	False	Bitcoin	t5_2s3qj	r/Bitcoin	public		0	[]													
17	[]	False		dlq84			[]				text	t2_5db0x	False	False	Imagine getting investment advice on instagram...	bd3013ed082f3db6ec6ddb233a895522c373603c	True	False					0	1653551562		0	{}	ia1guvh	False	t3_uy255r	False	True	t3_uy255r	/r/Bitcoin/comments/uy255r/how_to_lose_money_by_investing_through/ia1guvh/	1653551573	1	True	True	False	Bitcoin	t5_2s3qj	r/Bitcoin	public		0	[]													
18	[]	False		mpem___			[]				text	t2_71xpr16u	False	False	1Mb block size is still too big to propagate quickly over 90s internet	53608410e452c118f8e66b5812f36dc28ea16d25	True	False					0	1653551505		0	{}	ia1gsmm	False	t3_uxwqp2	False	True	t1_ia0qmtu	/r/Bitcoin/comments/uxwqp2/how_come_crypto_wasnt_invented_in_the_1980s/ia1gsmm/	1653551519	1	True	True	False	Bitcoin	t5_2s3qj	r/Bitcoin	public		0	[]													
19	[]	False		Starkgaryen69			[]				text	t2_8x14n4a	False	False	Bitcoin was the first to solve the “double spend” problem while being decentralized.	688eeb74867cc19f4ffd61773a888f379607626e	True	False					0	1653551505		0	{}	ia1gsm3	False	t3_uxwqp2	False	True	t3_uxwqp2	/r/Bitcoin/comments/uxwqp2/how_come_crypto_wasnt_invented_in_the_1980s/ia1gsm3/	1653551519	1	True	True	False	Bitcoin	t5_2s3qj	r/Bitcoin	public		0	[]													
20	[]	False		sylsau			[]				text	t2_brc3w	False	False	"If Satoshi Nakamoto wished to remain a mysterious unknown, there is at least one good reason for this: it protected Bitcoin and made it completely unassailable.

The fact that there is no leader to chase, no one who is more important than the other in the Bitcoin world, protects the network as a whole.

There's no need to look into who Satoshi Nakamoto is. This had a remarkable marketing effect in the early days of Bitcoin, I must say."	7df72a8f25d98be8232ea30d745e493127fb7d99	True	False					0	1653551499		0	{}	ia1gsea	False	t3_uy0uco	False	True	t3_uy0uco	/r/Bitcoin/comments/uy0uco/who_is_satoshi_nakamoto_the_mysterious_creator_of/ia1gsea/	1653551513	1	True	True	False	Bitcoin	t5_2s3qj	r/Bitcoin	public		0	[]													
21	[]	False		wytslyts		noob	[{'e': 'text', 't': 'redditor for 3 months'}]	2ec8e69e-6c36-11e9-a04b-0afb553d4ea6	redditor for 3 months	dark	richtext	t2_khl49hxc	False	False	We told or new we have already had sent it has been working for a lot of people.	c1480f113f7441ca8ed7a79fdb9f4284f38fa2d0	True	False					0	1653551496		0	{}	ia1gs9q	False	t3_uxm0v0	False	True	t1_ia094lf	/r/Bitcoin/comments/uxm0v0/there_are_58_million_millionaires_why_havent_they/ia1gs9q/	1653551513	1	True	True	False	Bitcoin	t5_2s3qj	r/Bitcoin	public		0	[]													
22	[]	False		blondaczek			[]				text	t2_dmmyizmx	False	False	"No doubt about the fact that they are going to die soon and there really don't understanding the reality of it now

Totally understand how people are not really working according to their effects and according to what they want to do."	bfaf2c3ea99d197a95996ee59523fe015986c450	True	False					0	1653551369		0	{}	ia1gmzs	False	t3_uxgs7k	False	True	t1_i9y1bda	/r/Bitcoin/comments/uxgs7k/bank_of_america_doing_survey_asking_about_crypto/ia1gmzs/	1653551384	1	True	True	False	Bitcoin	t5_2s3qj	r/Bitcoin	public		0	[]													
23	[]	False		mpem___			[]				text	t2_71xpr16u	False	False	egold was another one.	ca3046a5250fc52c7f284b7ca1427dbc0eec04c9	True	False					0	1653551364		0	{}	ia1gmsc	False	t3_uxwqp2	False	True	t1_ia0vw5q	/r/Bitcoin/comments/uxwqp2/how_come_crypto_wasnt_invented_in_the_1980s/ia1gmsc/	1653551377	1	True	True	False	Bitcoin	t5_2s3qj	r/Bitcoin	public		0	[]													
24	[]	False		nickname432			[]			dark	text	t2_9tcrxsc9	False	False	"All this talk about ""we had no other choice - without expanding the balance sheet, the economy would have collapsed"" is hypocritical to me. How much worse could a restructuring after the dot com bubble or the great financial crisis have been compared to what we're in now? Isn't that what capitalism is about? Letting the economy go bust would have at least solved something. For the most part, rich people's portfolios were saved. The middle class was thrown under the bus.

And she has the audacity to be all vague about it."	fa54780113d98f8c50c4b0c5f63cc677b4ce3279	True	False					0	1653551341		0	{}	ia1glsg	False	t3_uxn9q4	False	True	t3_uxn9q4	/r/Bitcoin/comments/uxn9q4/watch_christine_lagarde_of_ecb_being_questioned/ia1glsg/	1653551357	1	True	True	False	Bitcoin	t5_2s3qj	r/Bitcoin	public		0	[]													
25	[]	False		Misterman098			[]				text	t2_6j92qtu8	False	False	Because they obviously have ways to make real money.  Why risk it on speculation?	2df4d8bfbb29d71a2f0f58be0b6ebd0b2bceceaa	True	False					0	1653551338		0	{}	ia1glo5	False	t3_uxm0v0	False	True	t3_uxm0v0	/r/Bitcoin/comments/uxm0v0/there_are_58_million_millionaires_why_havent_they/ia1glo5/	1653551349	1	True	True	False	Bitcoin	t5_2s3qj	r/Bitcoin	public		0	[]													
26	[]	False		betty6991			[]				text	t2_d9rnwexy	False	False	This would be something bad in the market, I don't want that.	e86bdfd640c08dbf08aa27d46d12ce1503f4d259	True	False					0	1653551302		0	{}	ia1gk6q	False	t3_ux8xfw	False	True	t1_i9y8bw6	/r/Bitcoin/comments/ux8xfw/if_demand_for_bitcoin_goes_up/ia1gk6q/	1653551316	1	True	True	False	Bitcoin	t5_2s3qj	r/Bitcoin	public		0	[]													
27	[]	False		ProfessorTe			[]				text	t2_es7si2yc	False	False	I think we need to study about something in which we are investing.	de9f50f862cfe5ebbc46e44770875f193765b2cc	True	False					0	1653551201		0	{}	ia1gg5k	False	t3_uxio1g	False	True	t1_ia0iiqg	/r/Bitcoin/comments/uxio1g/portfolio_diversity_whats_the_point/ia1gg5k/	1653551215	1	True	True	False	Bitcoin	t5_2s3qj	r/Bitcoin	public		0	[]													
28	[]	False		GaliboControl2310			[]				text	t2_chprzhpe	False	False	Contact support. They will be able to help you better	3fd61c53da6487728b79e5368c924df5742a1744	True	False					0	1653551159		0	{}	ia1gej5	True	t3_uxgwq5	False	True	t1_ia1gaa1	/r/Bitcoin/comments/uxgwq5/now_its_time_for_go_to_the_sky/ia1gej5/	1653551176	1	True	True	False	Bitcoin	t5_2s3qj	r/Bitcoin	public		0	[]													
29	[]	False		CoinCorner_Sam			[]			dark	text	t2_fospv9k6	False	True	"You just had to ruin it!


/s"	5f25978fe548b50927c38c1cb7f06137df209ab1	True	False					0	1653551125		0	{}	ia1gd53	False	t3_uxn7y8	False	True	t1_ia1e7j6	/r/Bitcoin/comments/uxn7y8/when_people_ask_about_our_portfolio_diversity/ia1gd53/	1653551135	1	True	True	False	Bitcoin	t5_2s3qj	r/Bitcoin	public		0	[]													
30	[]	False		fokrivers			[]				text	t2_ekxflpfp	False	False	It's fungible man, but some people have narrative to say that it's not.	2931e2546de7d2f6e04287c35eb602cc62a77a34	True	False					0	1653551120		0	{}	ia1gcxr	False	t3_ux9w3g	False	True	t1_i9yhlgn	/r/Bitcoin/comments/ux9w3g/daily_discussion_may_25_2022/ia1gcxr/	1653551135	1	True	True	False	Bitcoin	t5_2s3qj	r/Bitcoin	public		0	[]													
31	[]	False		[deleted]						dark					[removed]	fe993932d6dced4c0a879e9aa5d7a6e0fbb467f5	True	False					0	1653551107		0	{}	ia1gcev	False	t3_uxtgim	False	True	t3_uxtgim	/r/Bitcoin/comments/uxtgim/this_is_the_reason_why_pow_is_better_than_pos/ia1gcev/	1653551121	1	True	True	False	Bitcoin	t5_2s3qj	r/Bitcoin	public		0	[]													
32	[]	False		Valeryannatalks		noob	[{'e': 'text', 't': 'redditor for a day'}]	2ec8e69e-6c36-11e9-a04b-0afb553d4ea6	redditor for a day	dark	richtext	t2_nmn35lhg	False	False	I keep getting pop message that something went wrong.	d8dc017adb61029a87aefcb32ddfd390fd064af9	True	False					0	1653551055		0	{}	ia1gaa1	False	t3_uxgwq5	False	True	t1_ia1g023	/r/Bitcoin/comments/uxgwq5/now_its_time_for_go_to_the_sky/ia1gaa1/	1653551067	1	True	True	False	Bitcoin	t5_2s3qj	r/Bitcoin	public		0	[]													
33	[]	False		Phil_Drill			[]				text	t2_ure03	False	False	Rebound to… less than $40k? Woweeeee	1b5991a115667f1f11bd48177726b1cf3d9f9fe5	True	False					0	1653551050		0	{}	ia1ga3h	False	t3_uxm9s2	False	True	t1_i9ypj58	/r/Bitcoin/comments/uxm9s2/jpmorgan_backs_bitcoin_to_rise_28_and_says/ia1ga3h/	1653551067	1	True	True	False	Bitcoin	t5_2s3qj	r/Bitcoin	public		0	[]													
34	[]	False		ControversialTomato			[]				text	t2_3g1o9gbc	False	False	"Libertarian socialist, sounds like an oxymoron. UBI, along with other socialist ideas you advocate for inevitably lead to more centralization and a more powerful state. 

Under a truly free market it’s quite likely that billionaires like bezos wouldn’t exist in the first place. The problem with modern ’capitalism’ is that strict regulation and increasing bureaucracy  make it difficult for small companies and start ups to compete with these mega corporations, leading to large monopolies. FIAT is ofc a huge problem in itself, but I suppose that’s the one thing we agree on.

Anyway, I appreciate the time you put into your answers, but we will just have to agree to disagree. Keep stacking and have a good one."	80cac9a661174278f0ec903cc599ee63888f8aa1	True	False					0	1653551044		0	{}	ia1g9v9	False	t3_ux7zyn	False	True	t1_i9zrl2h	/r/Bitcoin/comments/ux7zyn/billionaires_want_you_to_believe_that_bitcoin/ia1g9v9/	1653551060	1	True	True	False	Bitcoin	t5_2s3qj	r/Bitcoin	public		0	[]													
35	[]	False		mikebutrimov			[]				text	t2_j8aaa8xw	False	False	"I think we are moving in the future of the electric car and tesla is surely the trend setter.

Still their are many companies who is trying to figure about the electric car, so i would say best bet."	368877db2f4c1f351ba960ebdba1158041a14cb9	True	False					0	1653550979		0	{}	ia1g759	False	t3_uxio1g	False	True	t1_i9yzhk1	/r/Bitcoin/comments/uxio1g/portfolio_diversity_whats_the_point/ia1g759/	1653550991	1	True	True	False	Bitcoin	t5_2s3qj	r/Bitcoin	public		0	[]													
36	[]	False		Troy_Ounces			[]			dark	text	t2_6bzumcgs	False	False	They tried but couldn’t succeed. There were a select few working p2p tokens in the 90’s if I remember correctly.	3225fcd2ba613e1e5f49fd3416be7d6e6be32989	True	False					0	1653550949		0	{}	ia1g5ym	False	t3_uxwqp2	False	True	t3_uxwqp2	/r/Bitcoin/comments/uxwqp2/how_come_crypto_wasnt_invented_in_the_1980s/ia1g5ym/	1653550964	1	True	True	False	Bitcoin	t5_2s3qj	r/Bitcoin	public		0	[]													
37	[]	False		coupleofquid		noob	[{'e': 'text', 't': 'redditor for 2 weeks'}]	2ec8e69e-6c36-11e9-a04b-0afb553d4ea6	redditor for 2 weeks	dark	richtext	t2_mgxzgf3c	False	False	They’re probably happy with the system that’s made them millionaires	3a9ba3b51adc455afc8e077f0095a467e96b72b4	True	False					0	1653550897		0	{}	ia1g3xb	False	t3_uxm0v0	False	True	t3_uxm0v0	/r/Bitcoin/comments/uxm0v0/there_are_58_million_millionaires_why_havent_they/ia1g3xb/	1653550910	1	True	True	False	Bitcoin	t5_2s3qj	r/Bitcoin	public		0	[]													
38	[]	False		ThePronto8			[]				text	t2_6kt3pwbg	False	False	Why havent they all bought Apple shares? Why havent they all bought Gold? Some people just don’t worry about these sort of investments.	24f53cfdbee2cd67ac423b6edf431fb8892bd4cc	True	False					0	1653550897		0	{}	ia1g3wp	False	t3_uxm0v0	False	True	t3_uxm0v0	/r/Bitcoin/comments/uxm0v0/there_are_58_million_millionaires_why_havent_they/ia1g3wp/	1653550910	1	True	True	False	Bitcoin	t5_2s3qj	r/Bitcoin	public		0	[]		True											
39	[]	False		bobbytabl3s			[]				text	t2_uuri997	False	False	They are a collective delusion.	82c967c8bd3d4304901a206f9d60441853f944d4	True	False					0	1653550892		0	{}	ia1g3on	False	t3_ux9w3g	False	True	t1_ia0imvf	/r/Bitcoin/comments/ux9w3g/daily_discussion_may_25_2022/ia1g3on/	1653550904	1	True	True	False	Bitcoin	t5_2s3qj	r/Bitcoin	public		0	[]													
40	[]	False		rBitcoinMod			[]				text	t2_tcsf5	False	False	"Your submission has been flagged for removal because it pertains primarily to altcoin discussion and/or promotion. Altcoins are off topic for the Bitcoin subreddit. Please post in the subreddit appropriate to that altcoin instead. Thank you.

^^I ^^am ^^a ^^bot ^^and ^^cannot ^^respond. ^^Please ^^contact ^^r/Bitcoin ^^moderators [^^directly ^^via ^^mod ^^mail](https://www.reddit.com/message/compose?to=%2Fr%2FBitcoin) ^^if ^^you ^^have ^^questions."	7ddf2e08136dc7c45de1e2a20fa597d69268c1c3	True	False					0	1653550889	moderator	0	{}	ia1g3li	False	t3_uy24zu	False	True	t3_uy24zu	/r/Bitcoin/comments/uy24zu/bitcoiner_what_your_strategy_to_protect_your/ia1g3li/	1653550904	1	True	True	True	Bitcoin	t5_2s3qj	r/Bitcoin	public		0	[]													
41	[]	False		hea8y		noob	[{'e': 'text', 't': 'redditor for 3 months'}]	2ec8e69e-6c36-11e9-a04b-0afb553d4ea6	redditor for 3 months	dark	richtext	t2_jpuuran1	False	False	Proportion is what we had seen that it had constantly been increased.	644c57a4b33f4e1e6e628465f90583945e62050d	True	False					0	1653550834		0	{}	ia1g1a7	False	t3_uxm0v0	False	True	t1_ia0u9n4	/r/Bitcoin/comments/uxm0v0/there_are_58_million_millionaires_why_havent_they/ia1g1a7/	1653550850	1	True	True	False	Bitcoin	t5_2s3qj	r/Bitcoin	public		0	[]													
42	[]	False		GaliboControl2310			[]				text	t2_chprzhpe	False	False	I guess they have to accept the conversation to be able to talk to them	6355203a33e98b361b93ff1b29179fca63651ac3	True	False					0	1653550804		0	{}	ia1g023	True	t3_uxgwq5	False	True	t1_ia1flsn	/r/Bitcoin/comments/uxgwq5/now_its_time_for_go_to_the_sky/ia1g023/	1653550815	1	True	True	False	Bitcoin	t5_2s3qj	r/Bitcoin	public		0	[]													
43	[]	False		michelbarnich			[]				text	t2_33owbdag	False	False	You cant in PoS either. Nodes get penalties for bad behaviou, meaning your node is less likely to be chosen as a forger. At some point your node is basically banned as a forger, which means your conteol is gone too. Maybe read whitepapers before arguing.	e7b55f359e6a1c8c7c9512ce9c3d3b6576291896	True	False					0	1653550799		0	{}	ia1fzum	False	t3_uxtgim	False	True	t1_ia1ftzg	/r/Bitcoin/comments/uxtgim/this_is_the_reason_why_pow_is_better_than_pos/ia1fzum/	1653550815	1	True	True	False	Bitcoin	t5_2s3qj	r/Bitcoin	public		0	[]													
44	[]	False		Agile_Ad2902			[]				text	t2_ipq803ar	False	False	Feed the poor. Or better, Use that money to teach a young man to fish.	73852c046fa894c8444b0639583f802b92cd5067	True	False					0	1653550799		0	{}	ia1fzti	False	t3_uxolc4	False	True	t3_uxolc4	/r/Bitcoin/comments/uxolc4/i_have_20000_i_dont_really_need_i_have_401k_cash/ia1fzti/	1653550815	1	True	True	False	Bitcoin	t5_2s3qj	r/Bitcoin	public		0	[]													
45	[]	False		racebum			[]				text	t2_15fr9s	False	False	Fun thing about portugal, it's one of the countries that has a pretty low cost golden Visa. If any of you guys get lucky enough and make a few million in Bitcoin. You can get a Visa via property investment, cruise on over there with your seed then cash out the rest as necessary	4f171a04e222ae210021a2518f6b5877784bdde1	True	False					0	1653550769		0	{}	ia1fynz	False	t3_uy0s0z	False	True	t3_uy0s0z	/r/Bitcoin/comments/uy0s0z/portugal_has_rejected_proposal_to_tax_bitcoin/ia1fynz/	1653550781	1	True	True	False	Bitcoin	t5_2s3qj	r/Bitcoin	public		0	[]													
46	[]	False		-Avacyn			[]				text	t2_cl0gt	False	False	I disagree. This kind of journalism doesn't need this kind of grilling. The carefully placed silences by the interviewer are powerful. The Dutch people are not stupid, we don't need it spelled out by a journalist yelling at us. This show in particular is aimed at university educated people. Incompetence shows through clearly and we can make up our own conclusions.	343c43260eb6634578cb4b8ae3edf9de0268dbb9	True	False					0	1653550710		0	{}	ia1fw9u	False	t3_uxn9q4	False	True	t1_i9zfpv4	/r/Bitcoin/comments/uxn9q4/watch_christine_lagarde_of_ecb_being_questioned/ia1fw9u/	1653550723	1	True	True	False	Bitcoin	t5_2s3qj	r/Bitcoin	public		0	[]													
47	[]	False		qqnodes612			[]				text	t2_ile4jxot	False	False	I don't understand why some people wish whole world to end.	7bc51a64c1da447bf8ca2b359915719233ba584d	True	False					0	1653550671		0	{}	ia1fune	False	t3_ux9w3g	False	True	t1_i9xy4lc	/r/Bitcoin/comments/ux9w3g/daily_discussion_may_25_2022/ia1fune/	1653550682	1	True	True	False	Bitcoin	t5_2s3qj	r/Bitcoin	public		0	[]													
48	[]	False		Mari0305			[]				text	t2_ah3a6kgw	False	False	True, people thinks its just ca car or batteries company whenever they heard the Tesla.	1e77fdffa4c8b392e5cc11db6277c70c5e972179	True	False					0	1653550664		0	{}	ia1fud0	False	t3_uxio1g	False	True	t1_i9z2t5b	/r/Bitcoin/comments/uxio1g/portfolio_diversity_whats_the_point/ia1fud0/	1653550676	1	True	True	False	Bitcoin	t5_2s3qj	r/Bitcoin	public		0	[]													
49	[]	False		boiledpangolin			[]			dark	text	t2_5rsrtlgr	False	False	I'm surprised she even showed up to such a interview, prepared questions non withstanding.	2f426bc9d67a510c2621244c91232e49aa6c0674	True	False					0	1653550657		0	{}	ia1fu2h	False	t3_uxn9q4	False	True	t3_uxn9q4	/r/Bitcoin/comments/uxn9q4/watch_christine_lagarde_of_ecb_being_questioned/ia1fu2h/	1653550669	1	True	True	False	Bitcoin	t5_2s3qj	r/Bitcoin	public		0	[]													
