Unnamed: 0	all_awardings	associated_award	author	author_flair_background_color	author_flair_css_class	author_flair_richtext	author_flair_template_id	author_flair_text	author_flair_text_color	author_flair_type	author_fullname	author_patreon_flair	author_premium	awarders	body	collapsed_because_crowd_control	collapsed_reason_code	comment_type	created_utc	gildings	id	is_submitter	link_id	locked	no_follow	parent_id	permalink	retrieved_on	score	send_replies	stickied	subreddit	subreddit_id	top_awarded_type	total_awards_received	treatment_tags	unrepliable_reason	archived	body_sha1	can_gild	collapsed	collapsed_reason	controversiality	distinguished	gilded	retrieved_utc	score_hidden	subreddit_name_prefixed	subreddit_type	author_cakeday	corpus	support	knowledge	conflict	power	similarity	fun	status	trust	identity	romance
114	[]		Zudafrica			[]				text	t2_31n092e9	False	False	[]	A full node needs a Terabyte, any bandwith is good---there is no cost of running a node---it runs like a screensaver.				1645255401	{}	hxjwyqt	False	t3_svzbxs	False	True	t3_svzbxs	/r/Bitcoin/comments/svzbxs/running_a_full_node_in_canada/hxjwyqt/	1650110191.0	1	True	False	Bitcoin	t5_2s3qj		0	[]																									
115	[]		Bitcoin-shroom			[]			dark	text	t2_clhqaftj	False	False	[]	"you gotta visit /r/canada to see the extent of the ""bootlicking"". It's sad that a northern country could turn to such a mess in less than 15 years."				1645255392	{}	hxjwyca	False	t3_svzxq6	False	False	t1_hxjlfv2	/r/Bitcoin/comments/svzxq6/the_trudeau_regime_is_trying_to_make_parts_of_the/hxjwyca/	1650110151.0	10	True	False	Bitcoin	t5_2s3qj		0	[]																									
116	[]		CaptainPugwash75			[]				text	t2_letr2	False	False	[]	Indeed it did.				1645255372	{}	hxjwxf4	False	t3_sw1zj1	False	True	t1_hxjv7p4	/r/Bitcoin/comments/sw1zj1/should_i_invest_everything_into_bitcoin_and/hxjwxf4/	1650110073.0	1	True	False	Bitcoin	t5_2s3qj		0	[]																									
117	[]		Logitition			[]				text	t2_3ksyg4n9	False	False	[]	What this person said \^\^				1645255363	{}	hxjwwzd	False	t3_svrdlr	False	True	t1_hxhrjyg	/r/Bitcoin/comments/svrdlr/wife_wants_me_to_stop_dcaing_and_sell_all_my/hxjwwzd/	1650110034.0	3	True	False	Bitcoin	t5_2s3qj		0	[]																									
118	[]		thetagodfather			[]			dark	text	t2_9gur7xf3	False	False		трахать тебя				1645255266	{}	hxjwsg4	False	t3_svys9b	False	True	t1_hxjwerg	/r/Bitcoin/comments/svys9b/trucker_gets_8k_in_bitcoin_during_live_stream/hxjwsg4/		1	True	False	Bitcoin	t5_2s3qj		0	[]		False	9f0d8bb9686c0d696bd83531ea8788f666900058	True	False		0.0		0.0	1645255277.0	True	r/Bitcoin	public												
119	[]		[deleted]						dark					[]	[removed]				1645255261	{}	hxjws5q	False	t3_svmmyp	False	True	t1_hxhfilx	/r/Bitcoin/comments/svmmyp/i_finally_have_002/hxjws5q/	1650109604.0	1	True	False	Bitcoin	t5_2s3qj		0	[]																									
120	[]		12coinfx13sigAB			[]				text	t2_7y2j0ygw	False	False	[]	Same to you man, we'll hodl out all the chaos and misery.				1645255245	{}	hxjwrgd	False	t3_sv9hwb	False	False	t1_hxi772u	/r/Bitcoin/comments/sv9hwb/daily_discussion_february_18_2022/hxjwrgd/	1650109542.0	6	True	False	Bitcoin	t5_2s3qj		0	[]																									
121	[]		Ahoomanbeanzz			[]			dark	text	t2_c5p2ftym	False	False		"Nobody cares more about your money than you do, especially not a management firm who gets to play the stock market with other people's funds.

And I keep as little cash as possible in banks. As we can clearly see historically -- and with what's happening today -- when your money is in a bank it is NOT your money anymore.

Every dollar you have in a bank is the bank's. They may or may not decide to give it back to you when you ask for it. But they have no obligation to."				1645255230	{}	hxjwqq2	True	t3_sw1zj1	False	True	t1_hxjw9ko	/r/Bitcoin/comments/sw1zj1/should_i_invest_everything_into_bitcoin_and/hxjwqq2/		1	True	False	Bitcoin	t5_2s3qj		0	[]		False	fc54404ee4557f210eca04ba656969195ce7c78f	True	False		0.0		0.0	1645255244.0	True	r/Bitcoin	public												
122	[]		100hedgiescalps			[]			dark	text	t2_e2uc2te8	False	False	[]	Congrats, fellow stacker.				1645255219	{}	hxjwq7t	False	t3_svmmyp	False	True	t3_svmmyp	/r/Bitcoin/comments/svmmyp/i_finally_have_002/hxjwq7t/	1650109432.0	1	True	False	Bitcoin	t5_2s3qj		0	[]																									
123	[]		mriggs82			[]				text	t2_16bv8rcm	False	False	[]	Show her a gold inflation-adjusted chart 10 years, 20 years, 40 years doesn't matter. Then show her all time chart of BTC lol				1645255209	{}	hxjwppz	False	t3_svrdlr	False	True	t3_svrdlr	/r/Bitcoin/comments/svrdlr/wife_wants_me_to_stop_dcaing_and_sell_all_my/hxjwppz/	1650109390.0	2	True	False	Bitcoin	t5_2s3qj		0	[]																									
124	[]		YoupMediaSupport			[]				text	t2_a264xx4s	False	False	[]	Did you make the money you put in btc? If so don't sell. If not and it's for example both of your savings consider selling her cut and put it in the giant gold bubble.				1645255180	{}	hxjwobl	False	t3_svrdlr	False	True	t3_svrdlr	/r/Bitcoin/comments/svrdlr/wife_wants_me_to_stop_dcaing_and_sell_all_my/hxjwobl/	1650109272.0	1	True	False	Bitcoin	t5_2s3qj		0	[]																									
125	[]		Ahoomanbeanzz			[]			dark	text	t2_c5p2ftym	False	False		"Depends on where you buy it. Buying a house in the US is just giving my money to a landlord too (the State). 

I'd like to buy a house in a country with no property taxes eventually -- but I don't want to deal with the hassle right now especially since I probably won't live there and will need to find a property manager and all that annoying stuff. 

I rent because of the convenience. I don't have roots."				1645255141	{}	hxjwmfr	True	t3_sw1zj1	False	True	t1_hxjw2go	/r/Bitcoin/comments/sw1zj1/should_i_invest_everything_into_bitcoin_and/hxjwmfr/		1	True	False	Bitcoin	t5_2s3qj		0	[]		False	f5dfb790c80619566c170373ef8d00fe63e10869	True	False		0.0		0.0	1645255154.0	True	r/Bitcoin	public												
126	[]		heyhihowyahdurn			[]				text	t2_659c5iw3	False	False	[]	True but people are living much longer and older people are improving how to continue to grow there wealth faster than young people can keep up. Housing is outpacing pretty much all wage growth for example.				1645255116	{}	hxjwla6	False	t3_sw1rtg	False	True	t1_hxjklfq	/r/Bitcoin/comments/sw1rtg/76_percent_of_all_wealth_in_america_is_held_by/hxjwla6/	1650109010.0	3	True	False	Bitcoin	t5_2s3qj		0	[]																									
127	[]		Zudafrica			[]				text	t2_31n092e9	False	False	[]	Off line storage with your keys is your best bet----no wallets or exchanges. Use Ledger $75----send and receive directly into your offline hardware storage.				1645255103	{}	hxjwkmh	False	t3_sw1dw5	False	True	t3_sw1dw5	/r/Bitcoin/comments/sw1dw5/cold_storage_versus_no_storage/hxjwkmh/	1650108952.0	1	True	False	Bitcoin	t5_2s3qj		0	[]																									
128	[]		RAabd177			[]				text	t2_7tiha3fv	False	False	[]	Lol yeah let them dream whatever they want in the nights.				1645255066	{}	hxjwis3	False	t3_sveiq0	False	True	t1_hxh1i65	/r/Bitcoin/comments/sveiq0/the_joke_is_on_you_keep_buying_bitcoin/hxjwis3/	1650108784.0	0	True	False	Bitcoin	t5_2s3qj		0	[]																									
129	[]		Ahoomanbeanzz			[]			dark	text	t2_c5p2ftym	False	False		"&gt;Yes, even though bonds pay less than inflation sometimes, sometimes they don't, they also always pay and never crash unless the country itself fails as a state.

The United States Government cannot let bond yields rise or they will literally become insolvent (debt to GDP is in excess of 130% it was 30% when Volcker did what he did -- that cannot be done again). 

In fact the US Government has a vested interest in not only keeping bond yields as low as humanly possible, but to default on their debts through inflation.

Also I don't trust the US Government to pay back bonds -- plenty of Governments have defaulted on bond obligations.

&gt;I am attracted to the Volcano Bond in El Salvador. Whats it pay? 6, 6.5%? And a BTC bonus after 5yr?  


Yeah I think it's 6.5% -- I can see how that's good a good idea. I'd like to invest in them myself.

But, I'm less interested in the yield as I am just supporting the overall project. I want to lend money to El Salvador because I like what they're doing. 

I definitely don't like what the US does with my money..."				1645255056	{}	hxjwias	True	t3_sw1zj1	False	True	t1_hxjw0or	/r/Bitcoin/comments/sw1zj1/should_i_invest_everything_into_bitcoin_and/hxjwias/		1	True	False	Bitcoin	t5_2s3qj		0	[]		False	559b2d18ae74108935ce0d1524437598c05e5e3a	True	False		0.0		0.0	1645255073.0	True	r/Bitcoin	public												
130	[]		You_Bish			[]				text	t2_3liq6g7r	False	False	[]	Btc is just an online token and nothing more than that, while gold is tangable and has real world uses and has been desired from the dawn of man. Recent times showed how gold is truly a safe haven and an inflation hedge while as bitcoin completely choked, so just don't fall for the hype and listen to your smart wife and buy gold				1645255053	{}	hxjwi55	False	t3_svrdlr	False	True	t3_svrdlr	/r/Bitcoin/comments/svrdlr/wife_wants_me_to_stop_dcaing_and_sell_all_my/hxjwi55/	1650108728.0	0	True	False	Bitcoin	t5_2s3qj		0	[]																									
131	[]		[deleted]						dark					[]	[removed]				1645255017	{}	hxjwgh6	False	t3_sw42z8	False	True	t1_hxjw767	/r/Bitcoin/comments/sw42z8/found_an_old_walletdat_file_on_one_of_my_old/hxjwgh6/	1650108576.0	1	True	False	Bitcoin	t5_2s3qj		0	[]																									
132	[]		woyaozhangpan			[]				text	t2_80mwcilw	False	False	[]	That's the real way he should follow these words for sure.				1645255006	{}	hxjwfxq	False	t3_svrdlr	False	False	t1_hxi08kn	/r/Bitcoin/comments/svrdlr/wife_wants_me_to_stop_dcaing_and_sell_all_my/hxjwfxq/	1650108529.0	5	True	False	Bitcoin	t5_2s3qj		0	[]																									
133	[]		Vladimus44			[]				text	t2_66wg2	False	False	[]	"&gt;The goal is end all mandates and if that doesn’t succeed then to overthrow the government.

What the actual fuck are you talking about? The overwhelming majority of protestors are completely peaceful and have no intention of ""overthrowing the government"".

&gt;If you deny this then you aren’t paying attention because it was literally in their original statement/manifesto.

Who the fuck is ""they"".

You people are fucking insane conspiracy nut jobs. That makes you a deeply immoral and dangerous person."				1645254981	{}	hxjwerg	False	t3_svys9b	False	True	t1_hxjqcsq	/r/Bitcoin/comments/svys9b/trucker_gets_8k_in_bitcoin_during_live_stream/hxjwerg/	1650108420.0	0	True	False	Bitcoin	t5_2s3qj		0	[]																									
134	[]		ModerateBrainUsage			[]				text	t2_171bmn	False	False	[]	According to inflation calculator, $447 in 1982 was worth $1302. So it only increased 43% in 40 years. That’s really bad performance, pretty much any index has done better in last 10years.				1645254956	{}	hxjwdk4	False	t3_svrdlr	False	True	t1_hxinybx	/r/Bitcoin/comments/svrdlr/wife_wants_me_to_stop_dcaing_and_sell_all_my/hxjwdk4/	1650108312.0	3	True	False	Bitcoin	t5_2s3qj		0	[]																									
135	[]		benzamjr1			[]				text	t2_eqawia5v	False	False	[]	Finally someone spoke the truth, it's not that hard lol.				1645254949	{}	hxjwd7o	False	t3_sv9hwb	False	True	t1_hxi1jhw	/r/Bitcoin/comments/sv9hwb/daily_discussion_february_18_2022/hxjwd7o/	1650108283.0	1	True	False	Bitcoin	t5_2s3qj		0	[]																									
136	[]		try2264		noob	[{'e': 'text', 't': 'redditor for 3 months'}]	2ec8e69e-6c36-11e9-a04b-0afb553d4ea6	redditor for 3 months	dark	richtext	t2_bw248rzl	False	False	[]	I once waited a few days for a transaction to go through.  I could see it as “pending” on the block explorer.  Maybe the sender gave a too small “tip” for the miner.  Sooner or later a miner will pick up your transaction, don’t worry too much				1645254943	{}	hxjwcxp	False	t3_sw2veg	False	True	t3_sw2veg	/r/Bitcoin/comments/sw2veg/transaction_still_pending_after_45_mins/hxjwcxp/	1650108258.0	3	True	False	Bitcoin	t5_2s3qj		0	[]																									
137	[]		Future-PeterSchiff		noob	[{'e': 'text', 't': 'redditor for 3 months'}]	2ec8e69e-6c36-11e9-a04b-0afb553d4ea6	redditor for 3 months	dark	richtext	t2_j52fqdim	False	False	[]	Reads like someone who is upset a love partner won’t conform to every wish of their other partner				1645254937	{}	hxjwcnm	False	t3_svrdlr	False	True	t1_hxj7on2	/r/Bitcoin/comments/svrdlr/wife_wants_me_to_stop_dcaing_and_sell_all_my/hxjwcnm/	1650108233.0	1	True	False	Bitcoin	t5_2s3qj		0	[]																									
138	[]		sargentpilcher			[]				text	t2_4ctkj	False	False	[]	"Ask her if she can tell you what a market cap is and what it means.

When she can’t say “I rest my case”"				1645254914	{}	hxjwbgv	False	t3_svrdlr	False	False	t3_svrdlr	/r/Bitcoin/comments/svrdlr/wife_wants_me_to_stop_dcaing_and_sell_all_my/hxjwbgv/	1650108127.0	1	True	False	Bitcoin	t5_2s3qj		0	[]																									
139	[]		LordDosangg			[]				text	t2_ahbz5j69	False	False	[]	Earning this much recurring earnings while needing this few, just put your money under mgmt in a respected private bank such as Pictet or Lombard Audier, and never again worry about it.				1645254874	{}	hxjw9ko	False	t3_sw1zj1	False	True	t3_sw1zj1	/r/Bitcoin/comments/sw1zj1/should_i_invest_everything_into_bitcoin_and/hxjw9ko/	1650107958.0	0	True	False	Bitcoin	t5_2s3qj		0	[]																									
140	[]		Vladimus44			[]				text	t2_66wg2	False	False	[]	"Imagine gaslighting yourself into believing that peaceful protestors, filled with elderly men, women, and veterans are ""far right militias"" trying to over throw the government."				1645254831	{}	hxjw7hm	False	t3_svys9b	False	False	t1_hxjcq1c	/r/Bitcoin/comments/svys9b/trucker_gets_8k_in_bitcoin_during_live_stream/hxjw7hm/	1650107770.0	7	True	False	Bitcoin	t5_2s3qj		0	[]																									
141	[]		[deleted]						dark					[]	Divorce her your welcome				1645254830	{}	hxjw7gt	False	t3_svrdlr	False	True	t3_svrdlr	/r/Bitcoin/comments/svrdlr/wife_wants_me_to_stop_dcaing_and_sell_all_my/hxjw7gt/	1650107768.0	1	True	False	Bitcoin	t5_2s3qj		0	[]																									
142	[]		[deleted]						dark					[]	[removed]				1645254824	{}	hxjw767	False	t3_sw42z8	False	True	t3_sw42z8	/r/Bitcoin/comments/sw42z8/found_an_old_walletdat_file_on_one_of_my_old/hxjw767/	1650107741.0	1	True	False	Bitcoin	t5_2s3qj		0	[]																									
143	[]		Gismo981			[]				text	t2_38acl10i	False	False	[]	Time is money				1645254763	{}	hxjw46x	False	t3_svrdlr	False	True	t1_hxin5x7	/r/Bitcoin/comments/svrdlr/wife_wants_me_to_stop_dcaing_and_sell_all_my/hxjw46x/	1650107474.0	3	True	False	Bitcoin	t5_2s3qj		0	[]																									
144	[]		cuttyranking			[]				text	t2_163vfr	False	False	[]	Noobs are not going to find this easy to do. Especially in the uk. I for example can find no information about how to get my coin off eToro. What am I supposed to do? I desperately want to get this done but I just don’t know how to.				1645254760	{}	hxjw42j	False	t3_sw21sn	False	True	t1_hxjruki	/r/Bitcoin/comments/sw21sn/daily_discussion_february_19_2022/hxjw42j/	1650107463.0	2	True	False	Bitcoin	t5_2s3qj		0	[]																									
145	[]		oldmole84			[]				text	t2_9ab8oe2s	False	False	[]	biggest hole in your logic is asking a bunch of people that hold an asset if you should buy said asset. buy a house stop renting its just giving your money to landlord.				1645254727	{}	hxjw2go	False	t3_sw1zj1	False	True	t3_sw1zj1	/r/Bitcoin/comments/sw1zj1/should_i_invest_everything_into_bitcoin_and/hxjw2go/	1650107324.0	1	True	False	Bitcoin	t5_2s3qj		0	[]																									
146	[]		AutonomousAutomaton_			[]				text	t2_aciz68km	False	True	[]	It’s correlated until the day it’s not. If you’re in for the long haul Don’t sweat it				1645254719	{}	hxjw226	False	t3_sw2t5o	False	True	t3_sw2t5o	/r/Bitcoin/comments/sw2t5o/bitcoin_should_be_zigging_when_the_market_zags/hxjw226/	1650107292.0	1	True	False	Bitcoin	t5_2s3qj		0	[]																									
147	[]		[deleted]						dark					[]	"Yes, even though bonds pay less than inflation sometimes, sometimes they don't, they also always pay and never crash unless the country itself fails as a state. 

I am attracted to the Volcano Bond in El Salvador. Whats it pay? 6, 6.5%? And a BTC bonus after 5yr?"				1645254690	{}	hxjw0or	False	t3_sw1zj1	False	False	t1_hxjrwj7	/r/Bitcoin/comments/sw1zj1/should_i_invest_everything_into_bitcoin_and/hxjw0or/	1650107171.0	4	True	False	Bitcoin	t5_2s3qj		0	[]																									
148	[]		Ahoomanbeanzz			[]			dark	text	t2_c5p2ftym	False	False		"Right...but a bond is a *guaranteed loss* of your capital. Not only that, you're trusting the Government that they will pay you back (which historically is a bad idea). 

I just don't understand the logic. ""I'm going to let someone borrow my money under the binding agreement that they pay me back significantly less money later.""

How does that make sense?"				1645254669	{}	hxjvzpx	True	t3_sw1zj1	False	True	t1_hxjvljn	/r/Bitcoin/comments/sw1zj1/should_i_invest_everything_into_bitcoin_and/hxjvzpx/		1	True	False	Bitcoin	t5_2s3qj		0	[]		False	52b833f7c3c00c042a58aba1a1bd723f3054307c	True	False		0.0		0.0	1645254684.0	True	r/Bitcoin	public												
149	[]		Zudafrica			[]				text	t2_31n092e9	False	False	[]	It depends on your risk tolerance-----if you are 22 and want a plan for the next 4-5 years, bitcoin is your best bet. check out the annual returns for the last 5 years 400%, loss 10%, 200% 300% 68%. Average about 200%------nothing beats BTC.				1645254664	{}	hxjvzif	False	t3_sw1zj1	False	True	t3_sw1zj1	/r/Bitcoin/comments/sw1zj1/should_i_invest_everything_into_bitcoin_and/hxjvzif/	1650107063.0	1	True	False	Bitcoin	t5_2s3qj		0	[]																									
150	[]		effexzi			[]				text	t2_vs391rv	False	False	[]	For someone who once called bitcoin rat poison squared, this is to me a move towards bitcoin: https://fortune.com/2022/02/16/warren-buffett-invested-1-billion-crypto-bank/				1645254626	{}	hxjvxok	True	t3_svwnep	False	True	t1_hxjpl2u	/r/Bitcoin/comments/svwnep/munger_says_fiats_going_to_zero_right_after_his/hxjvxok/	1650106904.0	1	True	False	Bitcoin	t5_2s3qj		0	[]																									
151	[]		halfapestyle			[]				text	t2_3syxkt4p	False	False	[]	Yep, just checked and it was at about 12k 18 months ago. If this guy is being honest about his timeframe he would be up over 3x on his investment right now.				1645254616	{}	hxjvx7x	False	t3_sw2t5o	False	True	t1_hxjq6g7	/r/Bitcoin/comments/sw2t5o/bitcoin_should_be_zigging_when_the_market_zags/hxjvx7x/	1650106862.0	3	True	False	Bitcoin	t5_2s3qj		0	[]																									
152	[]		Vast-Employ-4920			[]				text	t2_4slqn22q	False	False	[]	What are their names mate?				1645254614	{}	hxjvx5c	False	t3_s3md8z	False	True	t1_hwhl1pu	/r/Bitcoin/comments/s3md8z/vestvai_anyone_heard_of_em/hxjvx5c/	1650106857.0	1	True	False	Bitcoin	t5_2s3qj		0	[]																									
153	[]		dlm83			[]				text	t2_53rk3w0t	False	False	[]	"High &amp; low data labels and/or prices on the y axis would be helpful quick glance info.

I have used RH in a very limited capacity (I can't remember my initial reason), and it felt kind of like it was designed as a sparkly learning tool for kids."				1645254612	{}	hxjvx1r	False	t3_sw042q	False	True	t3_sw042q	/r/Bitcoin/comments/sw042q/bitcoin_price_palindrome/hxjvx1r/	1650106849.0	1	True	False	Bitcoin	t5_2s3qj		0	[]																									
154	[]		Soulprano			[]				text	t2_4t77do4t	False	False	[]	You have the right to say no. Even people like warren buffet miss out on Amazon and Google. Show her some other big Investors who believe in bitcoin.				1645254607	{}	hxjvwsf	False	t3_svrdlr	False	True	t3_svrdlr	/r/Bitcoin/comments/svrdlr/wife_wants_me_to_stop_dcaing_and_sell_all_my/hxjvwsf/	1650106825.0	1	True	False	Bitcoin	t5_2s3qj		0	[]																									
155	[]		gtowndave77			[]				text	t2_efqpfvu3	False	False	[]	This sounds like a motivation to me, I want to share this to my family.				1645254583	{}	hxjvvme	False	t3_sveiq0	False	True	t1_hxg0dl6	/r/Bitcoin/comments/sveiq0/the_joke_is_on_you_keep_buying_bitcoin/hxjvvme/	1650106724.0	1	True	False	Bitcoin	t5_2s3qj		0	[]																									
156	[]		Vast-Employ-4920			[]				text	t2_4slqn22q	False	False	[]	Denis Bandle?				1645254547	{}	hxjvtvu	False	t3_s3md8z	False	True	t1_hxdli1o	/r/Bitcoin/comments/s3md8z/vestvai_anyone_heard_of_em/hxjvtvu/	1650106572.0	1	True	False	Bitcoin	t5_2s3qj		0	[]																									
157	[]		Lost-Adhesiveness-72			[]				text	t2_c9o8oil7	False	False	[]	Serve her with papers...				1645254503	{}	hxjvrsj	False	t3_svrdlr	False	True	t3_svrdlr	/r/Bitcoin/comments/svrdlr/wife_wants_me_to_stop_dcaing_and_sell_all_my/hxjvrsj/	1650106390.0	1	True	False	Bitcoin	t5_2s3qj		0	[]																									
158	[]		ruimikemau			[]				text	t2_2tiicwum	False	False	[]	It just depends on your butt and the size of the metals				1645254493	{}	hxjvrb2	False	t3_svrdlr	False	False	t1_hxigrma	/r/Bitcoin/comments/svrdlr/wife_wants_me_to_stop_dcaing_and_sell_all_my/hxjvrb2/	1650106347.0	5	True	False	Bitcoin	t5_2s3qj		0	[]																									
159	[]		Vast-Employ-4920			[]				text	t2_4slqn22q	False	False	[]	Can I ask you who recommended Vestvai?				1645254490	{}	hxjvr79	False	t3_s3md8z	False	True	t1_hxekr94	/r/Bitcoin/comments/s3md8z/vestvai_anyone_heard_of_em/hxjvr79/	1650106338.0	1	True	False	Bitcoin	t5_2s3qj		0	[]																									
160	[]		ausrhino			[]				text	t2_cfwb9	False	False	[]	Tracking exactly to my weight log.				1645254486	{}	hxjvqyo	False	t3_sw26xj	False	False	t3_sw26xj	/r/Bitcoin/comments/sw26xj/bitcoin_hashrate_reaches_new_ath/hxjvqyo/	1650106320.0	1	True	False	Bitcoin	t5_2s3qj		0	[]																									
161	[]		The_Realist01			[]				text	t2_7aajcvdc	False	False	[]	Yes - it is.				1645254474	{}	hxjvqdj	False	t3_sw1rtg	False	False	t1_hxjs4tp	/r/Bitcoin/comments/sw1rtg/76_percent_of_all_wealth_in_america_is_held_by/hxjvqdj/	1650106270.0	5	True	False	Bitcoin	t5_2s3qj		0	[]																									
162	[]		Vast-Employ-4920			[]				text	t2_4slqn22q	False	False	[]	I was locked out after a few days of waiting for my withdrawal.				1645254463	{}	hxjvpu3	False	t3_s3md8z	False	True	t1_hxfybnl	/r/Bitcoin/comments/s3md8z/vestvai_anyone_heard_of_em/hxjvpu3/	1650106225.0	1	True	False	Bitcoin	t5_2s3qj		0	[]																									
163	[]		StackinAndRackin			[]				text	t2_2kdzo1c3	False	False	[]	Never this long. I’m sending to a whitelisted address that I’ve sent to dozens of times. Looks like it hasn’t even been sent to the mempool. Only thing I can figure is CBP set the network fee way too low. My past transactions all had higher fees. From Googling this issue, it seems most transactions eventually go through after several hours. I just hope I wake up tomorrow to a sent and received transaction…				1645254450	{}	hxjvp6u	False	t3_sw2veg	False	True	t1_hxjtoc8	/r/Bitcoin/comments/sw2veg/transaction_still_pending_after_45_mins/hxjvp6u/	1650106170.0	2	True	False	Bitcoin	t5_2s3qj		0	[]																									
164	[]		PassionbyMichelle		noob	[{'e': 'text', 't': 'redditor for 4 days'}]	2ec8e69e-6c36-11e9-a04b-0afb553d4ea6	redditor for 4 days	dark	richtext	t2_jp4dstim	False	False	[]	lol i can very much relate to this !				1645254442	{}	hxjvosi	False	t3_svr670	False	False	t3_svr670	/r/Bitcoin/comments/svr670/who_else/hxjvosi/	1650106137.0	2	True	False	Bitcoin	t5_2s3qj		0	[]																									
165	[]		Elliotneversleeps			[]				text	t2_8w2pmlfb	False	False	[]	Canada subreddit still in denial				1645254420	{}	hxjvnra	False	t3_svzxq6	False	False	t3_svzxq6	/r/Bitcoin/comments/svzxq6/the_trudeau_regime_is_trying_to_make_parts_of_the/hxjvnra/	1650106045.0	20	True	False	Bitcoin	t5_2s3qj		0	[]																									
166	[]		ILikePracticalGifts			[]				text	t2_dk6f6zaa	False	False	[]	Because sometimes markets crash.				1645254373	{}	hxjvljn	False	t3_sw1zj1	False	True	t1_hxjrwj7	/r/Bitcoin/comments/sw1zj1/should_i_invest_everything_into_bitcoin_and/hxjvljn/	1650105854.0	1	True	False	Bitcoin	t5_2s3qj		0	[]																									
167	[]		Goodfella_17			[]				text	t2_7rpwsr04	False	False	[]	It's amazing how idiot some people are it's just amazing.				1645254360	{}	hxjvkvz	False	t3_sv9hwb	False	False	t1_hxikd7c	/r/Bitcoin/comments/sv9hwb/daily_discussion_february_18_2022/hxjvkvz/	1650105799.0	5	True	False	Bitcoin	t5_2s3qj		0	[]																									
168	[]		Whatever3999086543			[]			dark	text	t2_bg17yavv	False	False	[]	Yes. You own your own keys on Exodus. It's not an exchange.				1645254333	{}	hxjvjly	False	t3_sw21sn	False	False	t1_hxjunxu	/r/Bitcoin/comments/sw21sn/daily_discussion_february_19_2022/hxjvjly/	1650105690.0	4	True	False	Bitcoin	t5_2s3qj		0	[]																									
169	[]		rtheiss			[]				text	t2_4m0x1x	False	False	[]	"Emergency powers to supercede rights is the dumbest thing I've ever heard. When else would you ever need emergency powers? When your power is being threatened duh. When else is the rights of citizens the most important? When government power is threatened duh. 

Just stfu you stupid cunt."				1645254286	{}	hxjvhdy	False	t3_svzxq6	False	False	t3_svzxq6	/r/Bitcoin/comments/svzxq6/the_trudeau_regime_is_trying_to_make_parts_of_the/hxjvhdy/	1650105495.0	4	True	False	Bitcoin	t5_2s3qj		0	[]																									
170	[]		Good_Web_8629			[]				text	t2_a2vd7z7y	False	False	[]	"Educate her and include her more. 
Let her form her own opinion based on knowledge instead of short term fear"				1645254277	{}	hxjvgy3	False	t3_svrdlr	False	False	t3_svrdlr	/r/Bitcoin/comments/svrdlr/wife_wants_me_to_stop_dcaing_and_sell_all_my/hxjvgy3/	1650105457.0	1	True	False	Bitcoin	t5_2s3qj		0	[]																									
