Unnamed: 0	all_awardings	archived	associated_award	author	author_flair_background_color	author_flair_css_class	author_flair_richtext	author_flair_template_id	author_flair_text	author_flair_text_color	author_flair_type	author_fullname	author_patreon_flair	author_premium	body	body_sha1	can_gild	collapsed	collapsed_because_crowd_control	collapsed_reason	collapsed_reason_code	comment_type	controversiality	created_utc	distinguished	gilded	gildings	id	is_submitter	link_id	locked	no_follow	parent_id	permalink	retrieved_utc	score	score_hidden	send_replies	stickied	subreddit	subreddit_id	subreddit_name_prefixed	subreddit_type	top_awarded_type	total_awards_received	treatment_tags	unrepliable_reason	corpus	support	knowledge	conflict	power	similarity	fun	status	trust	identity	romance
0	[]	False		Funkyding			[]				text	t2_lkgiqrq	False	False	Dogecoin lol	c6497b592a6909b92747727c22bc8e9479b0a8ed	True	False					0	1656057638		0	{}	idj9e4q	False	t3_vjcyod	False	True	t3_vjcyod	/r/ethereum/comments/vjcyod/buying_eth_and_btc_better_using_binance_degiro_or/idj9e4q/	1656057649	1	False	True	False	ethereum	t5_2zf9m	r/ethereum	public		0	[]		dogecoin lol	0.4643867611885071	0.453379362821579	0.5520794987678528	0.4233325123786926	0.4599742889404297	0.6108909249305725	0.4897325336933136	0.48447293043136597	0.46434563398361206	0.4915803372859955
1	[]	False		taobaolover			[]				text	t2_26l4141l	False	False	When that hashrate difficulty increases, those machines lose value real quick and those mining companies keep pumping out new miners.  I love pow but pos really starting to make sense financially. Bitmain themselves will hurt the value of your miner.	5537634e1aa51fc47b69ee17771139de008483ff	True	False					0	1656057570		0	{}	idj9b8x	False	t3_viv8ef	False	True	t1_idhfx2u	/r/ethereum/comments/viv8ef/eth_hashrate_drops_10_as_falling_price_and_rising/idj9b8x/	1656057586	1	False	True	False	ethereum	t5_2zf9m	r/ethereum	public		0	[]		when that hashrate difficulty increases those machines lose value real quick and those mining companies keep pumping out new miners i love pow but pos really starting to make sense financially bitmain themselves will hurt the value of your miner 	0.09692415595054626	0.9874102473258972	0.2933501899242401	0.026141071692109108	0.21877075731754303	0.3994116485118866	0.12269465625286102	8.643703495181398e-07	0.25840771198272705	0.024550912901759148
2	[]	False		twitterStatus_Bot			[]				text	t2_d38zaa6k	False	False	"Major announcement: European nation embracing public Ethereum.

The Norwegian Government just announced that they are releasing a solution on public Ethereum: A cap tables platform for unlisted companies.

🧵

@EF_ESP  @arbitrum @ConsenSysCodefi @ceramicnetwork  @ChrJentzsch

---

posted by [@JonRamvi](https://twitter.com/JonRamvi/)

---

[Thanks to inteoryx, videos are supported even without Twitter API V2 support! Middle finger to you, twitter](https://github.com/inteoryx/twitter-video-dl)"	44c239c9da2fbeaa8c8e677c10cbca5a522a7f68	True	False					0	1656057426		0	{}	idj95i7	False	t3_vjj4hm	False	True	t3_vjj4hm	/r/ethereum/comments/vjj4hm/i_have_been_working_on_a_cap_table_solution_on/idj95i7/	1656057438	1	False	True	False	ethereum	t5_2zf9m	r/ethereum	public		0	[]		major announcement european nation embracing public ethereum the norwegian government just announced that they are releasing a solution on public ethereum a cap tables platform for unlisted companies ef esp arbitrum consensyscodefi ceramicnetwork chrjentzsch posted by jonramvi https twitter com jonramvi thanks to inteoryx videos are supported even without twitter api v2 support middle finger to you twitter https github com inteoryx twitter video dl 	0.0025645713321864605	0.9878646731376648	0.12729386985301971	0.022317200899124146	0.007954643107950687	0.707747220993042	0.1642475575208664	8.610201689407404e-07	0.38188013434410095	0.0037031390238553286
3	[]	False		majorpickle01			[]				text	t2_dlbyq	False	False	"Etoro charge insane spreads - I've seen 7% on crypto before.  


Lowest cost platforms are coinbasepro, kraken, kucoin, binance"	03c3afdda8c024ae122bfae571674bba25a9cc32	True	False					0	1656057239		0	{}	idj8xyp	False	t3_vjcyod	False	True	t3_vjcyod	/r/ethereum/comments/vjcyod/buying_eth_and_btc_better_using_binance_degiro_or/idj8xyp/	1656057257	1	False	True	False	ethereum	t5_2zf9m	r/ethereum	public		0	[]		etoro charge insane spreads i ve seen 7 on crypto before lowest cost platforms are coinbasepro kraken kucoin binance	0.003501381492242217	0.9465315937995911	0.5963462591171265	0.008604008704423904	0.28450217843055725	0.06364189833402634	0.26278695464134216	9.160531249108317e-07	0.44059523940086365	6.020993623678805e-06
4	[]	False		[deleted]						dark					[removed]	fe993932d6dced4c0a879e9aa5d7a6e0fbb467f5	True	False					0	1656057161		0	{}	idj8uue	False	t3_vjcyod	False	True	t1_idj7roo	/r/ethereum/comments/vjcyod/buying_eth_and_btc_better_using_binance_degiro_or/idj8uue/	1656057173	1	False	True	False	ethereum	t5_2zf9m	r/ethereum	public		0	[]		 removed 	0.46707504987716675	0.5148742198944092	0.5170193910598755	0.5029740929603577	0.4936113953590393	0.5123135447502136	0.45383262634277344	0.4847692549228668	0.4981911778450012	0.5145108103752136
5	[]	False		Financial_Green9120			[]				text	t2_a0s8ac75	False	False	Because you’re not real owner of assets, they are just giving you IOU - Fugazzi	8c942f77dacc3fff744cf463fc570b5564c56461	True	False					0	1656057040		0	{}	idj8q18	False	t3_vjcyod	False	True	t1_idj8kz1	/r/ethereum/comments/vjcyod/buying_eth_and_btc_better_using_binance_degiro_or/idj8q18/	1656057054	1	False	True	False	ethereum	t5_2zf9m	r/ethereum	public		0	[]		because you re not real owner of assets they are just giving you iou fugazzi	0.23809443414211273	0.6003006100654602	0.7354069352149963	0.6788396835327148	0.3088380694389343	0.07879045605659485	0.24100278317928314	1.0749671446319553e-06	0.4350567162036896	6.93577530910261e-05
6	[]	False		dr_michaeil			[]				text	t2_6jwzn68l	False	False	Why ?	ba09fa6b55a3bdb0facb3573158b662f2856f540	True	False					0	1656056920		0	{}	idj8kz1	False	t3_vjcyod	False	False	t1_idj4qxe	/r/ethereum/comments/vjcyod/buying_eth_and_btc_better_using_binance_degiro_or/idj8kz1/	1656056931	1	False	True	False	ethereum	t5_2zf9m	r/ethereum	public		0	[]		why 	0.4870544970035553	0.49271899461746216	0.5627589225769043	0.5104725360870361	0.4892781376838684	0.5422865748405457	0.467404305934906	0.4831920266151428	0.4931294322013855	0.500263512134552
7	[]	False		dalovar			[]				text	t2_a8fxr	False	False	"Even though many people have downvoted you, I see that what you say has some truth. Your mistake is that this address in particular wasn't generated by anyone, the ERC20 contract of the tokens it transacts allows for 3rd parties to control the ERC20 balance of any address, similar to how USDT or USDC have a way for a controller to spend anyone's USDC/USDT balance in the case of a hack when recouping stolen funds for example.

The part that you get right however, is that there are addresses that were actually generated to have 0 bytes on purpose to save gas fees, not just for ""vanity"" as explained here: https://medium.com/coinmonks/on-efficient-ethereum-addresses-3fef0596e263"	017160a34de4ae7f5059257de6c9b87f2ed05d0c	True	False					0	1656056752		0	{}	idj8dzo	True	t3_vhhs0c	False	True	t1_id7kouq	/r/ethereum/comments/vhhs0c/eth_address_with_35_leading_zeros_transacting/idj8dzo/	1656056765	1	False	True	False	ethereum	t5_2zf9m	r/ethereum	public		0	[]		even though many people have downvoted you i see that what you say has some truth your mistake is that this address in particular wasn t generated by anyone the erc20 contract of the tokens it transacts allows for 3rd parties to control the erc20 balance of any address similar to how usdt or usdc have a way for a controller to spend anyone s usdc usdt balance in the case of a hack when recouping stolen funds for example the part that you get right however is that there are addresses that were actually generated to have 0 bytes on purpose to save gas fees not just for vanity as explained here https medium com coinmonks on efficient ethereum addresses 3fef0596e263	0.0007291387300938368	0.9956650137901306	0.40448087453842163	0.008043346926569939	0.9972032308578491	0.03616298735141754	0.17338475584983826	8.472073886878206e-07	0.3736187815666199	2.871305878215935e-05
8	[]	False		uiuyiuyo			[]				text	t2_2c925jgv	False	False	"I feel like you don't really know the target audience for these services. They are largely enterprise. These companies want support, account managers, reliability, uptime, documentation. They want global distribution and availability.

So what you see as needless cost is actually what most customers want, not to mention 1000s of engineers and constantly upgraded tech and infrastructure.

When was the last time AWS, gcp, azure, Nvidia, etc even ran out of resources? No one who would tax these companies' resources could ever be served by Golem in the first place.

What exactly is Golem making more accessible and how are these small time entrepreneurs befitting from buying a GPU to contribute to Golem rather than just buying stock in a cloud provider?"	7d477479ed7335548fa0be1443f9e95f9ca81a8f	True	False					0	1656056393		0	{}	idj7z01	False	t3_vhscdb	False	True	t1_idh8yzv	/r/ethereum/comments/vhscdb/i_feel_like_no_one_outside_of_our_industry/idj7z01/	1656056403	1	False	True	False	ethereum	t5_2zf9m	r/ethereum	public		0	[]		i feel like you don t really know the target audience for these services they are largely enterprise these companies want support account managers reliability uptime documentation they want global distribution and availability so what you see as needless cost is actually what most customers want not to mention 1000s of engineers and constantly upgraded tech and infrastructure when was the last time aws gcp azure nvidia etc even ran out of resources no one who would tax these companies resources could ever be served by golem in the first place what exactly is golem making more accessible and how are these small time entrepreneurs befitting from buying a gpu to contribute to golem rather than just buying stock in a cloud provider 	0.002239399589598179	0.9887186288833618	0.11991411447525024	0.03211543709039688	0.00794434268027544	0.1905142217874527	0.08797002583742142	8.365334451809758e-07	0.3947761058807373	0.01574893854558468
9	[]	False		No-Contribution942			[]				text	t2_8pj8rjwh	False	False	I‘m using Bitpanda (Austria), but they are going on my nervs since I transfered 80K to my wallet to buy ETH, they want stupid documents to prove that it‘s really my money and not any illegal money lmao	c34fa000e0b5b11d48fbdad5ad67b78808f56876	True	False					0	1656056216		0	{}	idj7roo	False	t3_vjcyod	False	True	t3_vjcyod	/r/ethereum/comments/vjcyod/buying_eth_and_btc_better_using_binance_degiro_or/idj7roo/	1656056234	1	False	True	False	ethereum	t5_2zf9m	r/ethereum	public		0	[]		i m using bitpanda austria but they are going on my nervs since i transfered 80k to my wallet to buy eth they want stupid documents to prove that it s really my money and not any illegal money lmao	0.0038715621922165155	0.8587692379951477	0.9333106279373169	0.024992704391479492	0.9668583273887634	0.36485880613327026	0.05704423040151596	8.479138955408416e-07	0.30174916982650757	0.005420312285423279
10	[]	False		twistdafterdark			[]				text	t2_klz4r	False	False	"Binance has done a lot of shady stuff over the years, their entangled in so much legal stuff especially in EU.

I've never been screwed over by Binance, but I don't use them unless I don't have another option for what I want to do."	10b6eb6b90631e4544e39dad462ba6cecd6db38a	True	False					0	1656055793		0	{}	idj79th	False	t3_vjcyod	False	True	t1_idj5frp	/r/ethereum/comments/vjcyod/buying_eth_and_btc_better_using_binance_degiro_or/idj79th/	1656055806	1	False	True	False	ethereum	t5_2zf9m	r/ethereum	public		0	[]		binance has done a lot of shady stuff over the years their entangled in so much legal stuff especially in eu i ve never been screwed over by binance but i don t use them unless i don t have another option for what i want to do 	0.0033704384695738554	0.9883991479873657	0.1241971030831337	0.008101715706288815	0.7157090306282043	0.4148479104042053	0.06651340425014496	8.45106114866212e-07	0.28305497765541077	0.0033228828106075525
11	[]	False		chanchanchanchaaan			[]				text	t2_67hmx3px	False	False	If ramp doesn’t ban you.	ec11189ce629373e577bfa5256d05cdc9a910512	True	False					0	1656055690		0	{}	idj75f8	False	t3_vjcyod	False	True	t1_idj0rzp	/r/ethereum/comments/vjcyod/buying_eth_and_btc_better_using_binance_degiro_or/idj75f8/	1656055705	1	False	True	False	ethereum	t5_2zf9m	r/ethereum	public		0	[]		if ramp doesn t ban you 	0.4400990307331085	0.5107653141021729	0.5476154088973999	0.5843921899795532	0.4343748986721039	0.6656081676483154	0.33260172605514526	0.12286723405122757	0.4418841302394867	0.06827204674482346
12	[]	False		[deleted]						dark					[removed]	fe993932d6dced4c0a879e9aa5d7a6e0fbb467f5	True	False					0	1656055584		0	{}	idj70xn	False	t3_pktkwk	False	True	t3_pktkwk	/r/ethereum/comments/pktkwk/pending_transactions_not_showing_on_etherscan/idj70xn/	1656055600	1	False	True	False	ethereum	t5_2zf9m	r/ethereum	public		0	[]		 removed 	0.46707504987716675	0.5148742198944092	0.5170193910598755	0.5029740929603577	0.4936113953590393	0.5123135447502136	0.45383262634277344	0.4847692549228668	0.4981911778450012	0.5145108103752136
13	[]	False		Xinqiu-			[]				text	t2_8f3fhs37	False	False	"Binance is one of the top 3 exchanges. 
By the way, why not use your investment funds to buy some mining rigs? Haha bear market is a better time to increase your store of crypto currencies.
Haha, if you want to join mining, I advise you to mine with f2pool 🐟, that pool since 2013."	2cf7d7247206e4aedce61b7fa20a06f6ed01bc66	True	False					0	1656055281		0	{}	idj6o01	False	t3_vjcyod	False	True	t3_vjcyod	/r/ethereum/comments/vjcyod/buying_eth_and_btc_better_using_binance_degiro_or/idj6o01/	1656055298	1	False	True	False	ethereum	t5_2zf9m	r/ethereum	public		0	[]		binance is one of the top 3 exchanges by the way why not use your investment funds to buy some mining rigs haha bear market is a better time to increase your store of crypto currencies haha if you want to join mining i advise you to mine with f2pool that pool since 2013 	0.0009220291394740343	0.9953320622444153	0.013415941968560219	0.97044837474823	0.0040996139869093895	0.24347274005413055	0.11061252653598785	8.546896310690499e-07	0.2874790132045746	0.005579279735684395
14	[]	False		HEX_helper			[]				text	t2_4rc0665j	False	True	You tell me	f9f7e43239be179a3f6fb6a4427c70d248853746	True	False					0	1656054585		0	{}	idj5tnp	False	t3_vfl20r	False	True	t1_idhi1w8	/r/ethereum/comments/vfl20r/what_will_be_a_use_of_eth_that_makes_it_a_500/idj5tnp/	1656054597	1	False	True	False	ethereum	t5_2zf9m	r/ethereum	public		0	[]		you tell me	0.5283522605895996	0.33749112486839294	0.5097976326942444	0.4785577356815338	0.4836123287677765	0.6528696417808533	0.5289784073829651	0.4910387694835663	0.4240182340145111	0.44859078526496887
15	[]	False		Large_Value_4552			[]				text	t2_dydql5o6	False	False	ZK proofs can be used for a variety of other purposes. For instance, when you deposit tokens on Polygon Nightfall, you must show a proof of ownership for the tokens, even though the L1 contract really holds them in its own.	1c219c440c7337b8c422d518cf09b22627a4ef6a	True	False					0	1656054351		0	{}	idj5jcf	False	t3_visxue	False	True	t3_visxue	/r/ethereum/comments/visxue/zeroknowledge_tech_is_way_more_private_than/idj5jcf/	1656054362	1	False	True	False	ethereum	t5_2zf9m	r/ethereum	public		0	[]		zk proofs can be used for a variety of other purposes for instance when you deposit tokens on polygon nightfall you must show a proof of ownership for the tokens even though the l1 contract really holds them in its own 	0.004223199095577002	0.9881547689437866	0.18667170405387878	0.031243735924363136	0.00926622748374939	0.4776468575000763	0.08425235748291016	8.5474351863013e-07	0.37121835350990295	0.01748444139957428
16	[]	False		KingKongOfSilver			[]				text	t2_c2r189rc	False	False	I have only used Kraken in the past. But I'm considering giving Binance a chance, since it has lower fees. Or why should I stay on Kraken?	4b772c3e6a969d55c4515f216e1281990ce1211b	True	False					0	1656054272		0	{}	idj5frp	False	t3_vjcyod	False	True	t1_idivbm1	/r/ethereum/comments/vjcyod/buying_eth_and_btc_better_using_binance_degiro_or/idj5frp/	1656054285	1	False	True	False	ethereum	t5_2zf9m	r/ethereum	public		0	[]		i have only used kraken in the past but i m considering giving binance a chance since it has lower fees or why should i stay on kraken 	0.03914628177881241	0.9461758732795715	0.3235875070095062	0.02381976693868637	0.5191104412078857	0.46063846349716187	0.10405681282281876	8.726055966690183e-07	0.3254363536834717	0.017811328172683716
17	[]	False		Prestigious_Ape8888			[]				text	t2_b3ukhc89	False	True	Stay away from etoro	4a4432afbfdcfbb5a1483e163c765e6e9f67168e	True	False					0	1656053723		0	{}	idj4qxe	False	t3_vjcyod	False	True	t3_vjcyod	/r/ethereum/comments/vjcyod/buying_eth_and_btc_better_using_binance_degiro_or/idj4qxe/	1656053734	1	False	True	False	ethereum	t5_2zf9m	r/ethereum	public		0	[]		stay away from etoro	0.5921001434326172	0.5414008498191833	0.4745355546474457	0.5366607904434204	0.4743885099887848	0.2295333594083786	0.4357236623764038	0.487205445766449	0.39299657940864563	0.42054086923599243
18	[]	False		AutoModerator			[]				text	t2_6l4z3	False	True	"Your submission was removed from /r/ethereum due to being too short. All text submissions must be at least 60 characters long.

*I am a bot, and this action was performed automatically. Please [contact the moderators of this subreddit](/message/compose/?to=/r/ethereum) if you have any questions or concerns.*"	f5350acfa4ebeaa5482eb2be2e6daa9c2d3776c0	True	False					0	1656053110	moderator	0	{}	idj3z5a	False	t3_vji3bi	False	True	t3_vji3bi	/r/ethereum/comments/vji3bi/followthistrend1_sell_jst/idj3z5a/	1656053122	1	False	False	False	ethereum	t5_2zf9m	r/ethereum	public		0	[]		your submission was removed from r ethereum due to being too short all text submissions must be at least 60 characters long i am a bot and this action was performed automatically please contact the moderators of this subreddit message compose to r ethereum if you have any questions or concerns 	0.003361653070896864	0.9877400994300842	0.3758471608161926	0.14455313980579376	0.008221076801419258	0.24413546919822693	0.11215468496084213	8.340520025740261e-07	0.331838995218277	0.019277073442935944
19	[]	False		mpjme			[]				text	t2_i0q8e	False	False	Kind of you to go beyond the like, gave me a smile this morning coffee!	692e9b49292e28300cb521c2de772f12b635517f	True	False					0	1656052983		0	{}	idj3tgk	False	t3_vg3rty	False	False	t1_idgurcw	/r/ethereum/comments/vg3rty/whoever_has_doubts_about_ethereums_future_calm/idj3tgk/	1656052994	1	False	True	False	ethereum	t5_2zf9m	r/ethereum	public		0	[]		kind of you to go beyond the like gave me a smile this morning coffee 	0.5826691389083862	0.28989797830581665	0.25244587659835815	0.07728750258684158	0.40149229764938354	0.917586088180542	0.2646888494491577	0.5250911712646484	0.21517576277256012	0.18152093887329102
20	[]	False		StewieKCC			[]				text	t2_q60ri	False	False	Thank you!	184eb63a906e3136190bfe5ddab6df3340bd9b91	True	False					0	1656052586		0	{}	idj3beh	True	t3_vj773r	False	True	t1_idiwvol	/r/ethereum/comments/vj773r/how_do_i_use_an_adress/idj3beh/	1656052600	1	False	True	False	ethereum	t5_2zf9m	r/ethereum	public		0	[]		thank you 	0.6628825664520264	0.2859748601913452	0.3557310104370117	0.4497220516204834	0.45809370279312134	0.5068443417549133	0.7013788223266602	0.5230814218521118	0.4162631332874298	0.4774157404899597
21	[]	False		Perleflamme			[]				text	t2_13pqgo	False	False	"This doesn't prevent anyone from forking and has nothing to do with how hard or easy a fork is. 

It only prevents you from attracting current users to the fork by using communication platforms generally used by the chain you want to fork from.

But if you provide a management that suits better the needs of users, your fork will attract more people nonetheless, because no chain can censor people beyond their own platforms (be it on subreddits or anything else)."	204bbc66e2276d7f8c0eef4ad4e76a69550329b5	True	False					0	1656052360		0	{}	idj30w9	False	t3_vjgbvx	False	True	t1_idj2oq2	/r/ethereum/comments/vjgbvx/is_pure_decentralization_a_myth/idj30w9/	1656052376	1	False	True	False	ethereum	t5_2zf9m	r/ethereum	public		0	[]		this doesn t prevent anyone from forking and has nothing to do with how hard or easy a fork is it only prevents you from attracting current users to the fork by using communication platforms generally used by the chain you want to fork from but if you provide a management that suits better the needs of users your fork will attract more people nonetheless because no chain can censor people beyond their own platforms be it on subreddits or anything else 	0.002418151590973139	0.9889786839485168	0.5609259605407715	0.01398133672773838	0.008124270476400852	0.392117977142334	0.05771033465862274	8.429866511505679e-07	0.41082605719566345	0.009544223546981812
22	[]	False		MiataBoy95			[]				text	t2_a49jh5ry	False	False	Use your  btc on chain wallet and buy from someone that own btc directly	2fca451c06ac7733d1da5474ee208e9d40bd50fe	True	False					0	1656052177		0	{}	idj2skv	False	t3_vjcyod	False	True	t3_vjcyod	/r/ethereum/comments/vjcyod/buying_eth_and_btc_better_using_binance_degiro_or/idj2skv/	1656052192	1	False	True	False	ethereum	t5_2zf9m	r/ethereum	public		0	[]		use your btc on chain wallet and buy from someone that own btc directly	0.22684653103351593	0.8426916599273682	0.4012991487979889	0.6940154433250427	0.21356357634067535	0.20433904230594635	0.16133487224578857	0.8531773686408997	0.404899924993515	0.0039204880595207214
23	[]	False		_yarayara_			[]				text	t2_j3od2	False	False	Kraken	3515dc3dfe461ab124f0795172e3d7a59a678c6b	True	False					0	1656052114		0	{}	idj2pow	False	t3_vjcyod	False	True	t1_idj1i4y	/r/ethereum/comments/vjcyod/buying_eth_and_btc_better_using_binance_degiro_or/idj2pow/	1656052128	1	False	True	False	ethereum	t5_2zf9m	r/ethereum	public		0	[]		kraken	0.4376221299171448	0.5062661170959473	0.5286489129066467	0.5049575567245483	0.49291470646858215	0.4905965328216553	0.4782927334308624	0.4803524315357208	0.48030245304107666	0.4772033095359802
24	[]	False		GranPino			[]				text	t2_37f11mf	False	False	Forks aren’t so easy. When the most important forums and websites around a project like bitcoin is controlled by very few agents, they control the narrative and therefore can manipulate the community. Like with the block size wars. The bitcoin sub is heavily censored for a good reason	39c8f448bc25ed1bba90d5fdbd5dfe67b116efdc	True	False					0	1656052093		0	{}	idj2oq2	False	t3_vjgbvx	False	True	t1_idj0yol	/r/ethereum/comments/vjgbvx/is_pure_decentralization_a_myth/idj2oq2/	1656052107	1	False	True	False	ethereum	t5_2zf9m	r/ethereum	public		0	[]		forks aren t so easy when the most important forums and websites around a project like bitcoin is controlled by very few agents they control the narrative and therefore can manipulate the community like with the block size wars the bitcoin sub is heavily censored for a good reason	0.0026959930546581745	0.9893116354942322	0.5754542350769043	0.01577594131231308	0.10718658566474915	0.4797991216182709	0.08364975452423096	8.337975714312051e-07	0.472514271736145	0.00301669561304152
25	[]	False		masixx			[]				text	t2_fep5k	False	False	It won't be because it's not their goal. They stated over and over again that L2 is already here and should be used for scaling. The question is what L2 since they differ quite a lot when it comes to security. ZK is surely the future for everything of value. But full fledged ZK-rollup implementations are still being worked on and are not yet available afaik.	3f64e07d8aa69a4eb4bf04b1d6589cbf207ceb7c	True	False					0	1656051767		0	{}	idj29wt	False	t3_visxue	False	True	t1_idhw99a	/r/ethereum/comments/visxue/zeroknowledge_tech_is_way_more_private_than/idj29wt/	1656051779	1	False	True	False	ethereum	t5_2zf9m	r/ethereum	public		0	[]		it won t be because it s not their goal they stated over and over again that l2 is already here and should be used for scaling the question is what l2 since they differ quite a lot when it comes to security zk is surely the future for everything of value but full fledged zk rollup implementations are still being worked on and are not yet available afaik 	0.0030211578123271465	0.9875969290733337	0.6553838849067688	0.04775795340538025	0.9913510084152222	0.3912953734397888	0.08079086989164352	8.311244528158568e-07	0.5129106640815735	0.008172470144927502
26	[]	False		-flatline			[]				text	t2_gpiz4	False	False	FTX.com	242a40d1b4e3a7145c143399b999afc81882a750	True	False					0	1656051423		0	{}	idj1tq3	False	t3_vjcyod	False	True	t3_vjcyod	/r/ethereum/comments/vjcyod/buying_eth_and_btc_better_using_binance_degiro_or/idj1tq3/	1656051438	1	False	True	False	ethereum	t5_2zf9m	r/ethereum	public		0	[]		ftx com	0.4618980884552002	0.5120829939842224	0.5434521436691284	0.4713643193244934	0.4694969058036804	0.5396414995193481	0.4371834695339203	0.47497105598449707	0.49434375762939453	0.46980875730514526
