118	[]	False	cryptopassiveready	noob	[{'e': 'text', 't': 'redditor for 4 weeks'}]	redditor for 4 weeks	richtext	t2_jvgl7aee	False	False	False	[]	False	False	1651594092	self.Bitcoin	https://www.reddit.com/r/Bitcoin/comments/uhjhpp/may_3rd_2022_live_webinar_on_cryptotrading_bots/	{}	uhjhpp	False	True	False	False	False	True	True	False		[]	dark	text	False	False	True	0	0	False	all_ads	/r/Bitcoin/comments/uhjhpp/may_3rd_2022_live_webinar_on_cryptotrading_bots/	False	6		1651594103	1	"hey guys.  


Not sure if you guys have heard about Dan Holling's  webinar on crypto bots.  
It has some pretty neat stuff he is sharing.  


Would apply to most people because it does need some capital to start one of these bots but like the average person savings account is like 0.5% per year. these bots can generate like 20 - 50% per year (depends on many things including how much you invest though)  


But you can always take a look, its without cost. In fact, he is giving away like $2500 at this live webinar today.  


[www.cryptopassiveready.com/info](https://www.cryptopassiveready.com/info)

I also did share my point of view through my youtube channel @ cryptopassiveready.  


https://preview.redd.it/5p9gd6xnbax81.png?width=600&amp;format=png&amp;auto=webp&amp;s=0b2564c055284efe97935c211adc405a13ef882e"	True	False	False	Bitcoin	t5_2s3qj	4158642	public	https://b.thumbs.redditmedia.com/TWnQUojq3VCmNpmt68n8z7WT-WhBxUVRp-qAqWGnHUc.jpg	May 3rd, 2022 Live webinar on cryptotrading bots	0	[]	1.0	https://www.reddit.com/r/Bitcoin/comments/uhjhpp/may_3rd_2022_live_webinar_on_cryptotrading_bots/		all_ads	6	2ec8e69e-6c36-11e9-a04b-0afb553d4ea6	dark			140.0	140.0								{'5p9gd6xnbax81': {'e': 'Image', 'id': '5p9gd6xnbax81', 'm': 'image/png', 'p': [{'u': 'https://preview.redd.it/5p9gd6xnbax81.png?width=108&amp;crop=smart&amp;auto=webp&amp;s=c4472b395821a9d0ba4b8c682883b00a29e7380b', 'x': 108, 'y': 108}, {'u': 'https://preview.redd.it/5p9gd6xnbax81.png?width=216&amp;crop=smart&amp;auto=webp&amp;s=900722725113423a2ede46eafb6e75720e4a77a6', 'x': 216, 'y': 216}, {'u': 'https://preview.redd.it/5p9gd6xnbax81.png?width=320&amp;crop=smart&amp;auto=webp&amp;s=6d2086f815959882ec1070d28215b122f89097f8', 'x': 320, 'y': 320}], 's': {'u': 'https://preview.redd.it/5p9gd6xnbax81.png?width=600&amp;format=png&amp;auto=webp&amp;s=0b2564c055284efe97935c211adc405a13ef882e', 'x': 600, 'y': 600}, 'status': 'valid'}}							"May 3rd, 2022 Live webinar on cryptotrading bots
hey guys.  


Not sure if you guys have heard about Dan Holling's  webinar on crypto bots.  
It has some pretty neat stuff he is sharing.  


Would apply to most people because it does need some capital to start one of these bots but like the average person savings account is like 0.5% per year. these bots can generate like 20 - 50% per year (depends on many things including how much you invest though)  


But you can always take a look, its without cost. In fact, he is giving away like $2500 at this live webinar today.  


[www.cryptopassiveready.com/info](https://www.cryptopassiveready.com/info)

I also did share my point of view through my youtube channel @ cryptopassiveready.  


https://preview.redd.it/5p9gd6xnbax81.png?width=600&amp;format=png&amp;auto=webp&amp;s=0b2564c055284efe97935c211adc405a13ef882e"	may 3rd 2022 live webinar on cryptotrading bots hey guys not sure if you guys have heard about dan holling s webinar on crypto bots it has some pretty neat stuff he is sharing would apply to most people because it does need some capital to start one of these bots but like the average person savings account is like 0 5 per year these bots can generate like 20 50 per year depends on many things including how much you invest though but you can always take a look its without cost in fact he is giving away like 2500 at this live webinar today www cryptopassiveready com info https www cryptopassiveready com info i also did share my point of view through my youtube channel cryptopassiveready https preview redd it 5p9gd6xnbax81 png width 600 amp format png amp auto webp amp s 0b2564c055284efe97935c211adc405a13ef882e	0.0008004740229807794	0.9954144954681396	0.006127466447651386	0.028197895735502243	0.003994918428361416	0.9991123080253601	0.21399059891700745	8.464838288091414e-07	0.4936252236366272	0.00015009165508672595
119	[]	False	Mr_perfect32	noob	[{'e': 'text', 't': 'redditor for 4 days'}]	redditor for 4 days	richtext	t2_mirhxhut	False	False	False	[]	False	False	1651593681	wanchortoken.com	https://www.reddit.com/r/Bitcoin/comments/uhjc9b/wanchor_token/	{}	uhjc9b	False	True	False	False	False	True	False	False		[]	dark	text	False	False	True	0	0	True	all_ads	/r/Bitcoin/comments/uhjc9b/wanchor_token/	False	6		1651593693	1		True	False	False	Bitcoin	t5_2s3qj	4158627	public	nsfw	⚓️ Wanchor Token ⚓️	0	[]	1.0	https://wanchortoken.com/	https://wanchortoken.com/	promo_adult_nsfw	3	2ec8e69e-6c36-11e9-a04b-0afb553d4ea6	dark																			"⚓️ Wanchor Token ⚓️
"	 wanchor token nan	0.5159607529640198	0.4480224847793579	0.4764683246612549	0.4262010157108307	0.45725229382514954	0.4533197581768036	0.5319311022758484	0.4819771647453308	0.4881044626235962	0.5061310529708862
120	[]	False	simplewojak	noob	[{'e': 'text', 't': 'redditor for 3 weeks'}]	redditor for 3 weeks	richtext	t2_ln9wi67d	False	False	False	[]	False	False	1651578978	i.redd.it	https://www.reddit.com/r/Bitcoin/comments/uheeh8/realistically_how_would_the_market_react_if_both/	{}	uheeh8	False	True	False	False	True	True	False	False		[]	dark	text	False	False	True	0	0	False	all_ads	/r/Bitcoin/comments/uheeh8/realistically_how_would_the_market_react_if_both/	False	6		1651578989	1		True	False	False	Bitcoin	t5_2s3qj	4158079	public	https://b.thumbs.redditmedia.com/av5f9aeTxMjS2RVKGN5KmbPpLQMukxkcAJtyTynWksY.jpg	Realistically, how would the market react if both MicroStrategy and Tesla were in a loss? Would that freak out retail and lead to even more sharp drops?	0	[]	1.0	https://i.redd.it/sb4obd4q29x81.jpg	https://i.redd.it/sb4obd4q29x81.jpg	all_ads	6	2ec8e69e-6c36-11e9-a04b-0afb553d4ea6	dark	image	{'enabled': True, 'images': [{'id': 'gjPqlsQsO6eCf7GULdvxN69AWj1UqsO3GRVBPHnQvJI', 'resolutions': [{'height': 215, 'url': 'https://preview.redd.it/sb4obd4q29x81.jpg?width=108&amp;crop=smart&amp;auto=webp&amp;s=793dc8585e3a7340c284961694bf13f7a85c4c70', 'width': 108}, {'height': 431, 'url': 'https://preview.redd.it/sb4obd4q29x81.jpg?width=216&amp;crop=smart&amp;auto=webp&amp;s=42a9be8f4b824d1c4358194300e8d5d8c14edf2a', 'width': 216}, {'height': 639, 'url': 'https://preview.redd.it/sb4obd4q29x81.jpg?width=320&amp;crop=smart&amp;auto=webp&amp;s=0b1726cdfe7091529988c8a7c972f37ec184a520', 'width': 320}, {'height': 1278, 'url': 'https://preview.redd.it/sb4obd4q29x81.jpg?width=640&amp;crop=smart&amp;auto=webp&amp;s=2846fd531af94e3fdb3d07063b32b1d1b1175235', 'width': 640}, {'height': 1918, 'url': 'https://preview.redd.it/sb4obd4q29x81.jpg?width=960&amp;crop=smart&amp;auto=webp&amp;s=4730dff81acecdbd85e0421e2ef2f2d7f9019928', 'width': 960}, {'height': 2158, 'url': 'https://preview.redd.it/sb4obd4q29x81.jpg?width=1080&amp;crop=smart&amp;auto=webp&amp;s=795faa2a0f1c348a859a52075202a147f982e722', 'width': 1080}], 'source': {'height': 2158, 'url': 'https://preview.redd.it/sb4obd4q29x81.jpg?auto=webp&amp;s=40e6cbef66d63616494d51c43aac495e1c948154', 'width': 1080}, 'variants': {}}]}	140.0	140.0															"Realistically, how would the market react if both MicroStrategy and Tesla were in a loss? Would that freak out retail and lead to even more sharp drops?
"	realistically how would the market react if both microstrategy and tesla were in a loss would that freak out retail and lead to even more sharp drops nan	0.04288799315690994	0.9620475172996521	0.49748900532722473	0.8063805103302002	0.38988563418388367	0.5396620035171509	0.1010638177394867	8.723934001864109e-07	0.3306497037410736	0.033108074218034744
121	[]	False	Single-Comedian-2176		[]		text	t2_7dypujq4	False	False	False	[]	False	False	1651578603	self.Bitcoin	https://www.reddit.com/r/Bitcoin/comments/uheaqu/join_my_cause_in_vaporizing_the_central_bank/	{}	uheaqu	False	True	False	False	False	True	True	False		[]	dark	text	False	False	True	0	0	False	all_ads	/r/Bitcoin/comments/uheaqu/join_my_cause_in_vaporizing_the_central_bank/	False	6		1651578614	1	In less thana decade, the central bank will control our every move, taking away our freedom. Join my cause in destroying it in every way. Apply a job in a central bank, do some arsony, if you're a hacker, hack the system, etc... R/AgainstCentralBank	True	False	False	Bitcoin	t5_2s3qj	4158066	public	self	JOIN MY CAUSE IN VAPORIZING THE CENTRAL BANK	0	[]	1.0	https://www.reddit.com/r/Bitcoin/comments/uheaqu/join_my_cause_in_vaporizing_the_central_bank/		all_ads	6																					"JOIN MY CAUSE IN VAPORIZING THE CENTRAL BANK
In less thana decade, the central bank will control our every move, taking away our freedom. Join my cause in destroying it in every way. Apply a job in a central bank, do some arsony, if you're a hacker, hack the system, etc... R/AgainstCentralBank"	join my cause in vaporizing the central bank in less thana decade the central bank will control our every move taking away our freedom join my cause in destroying it in every way apply a job in a central bank do some arsony if you re a hacker hack the system etc r againstcentralbank	0.0008601418230682611	0.9951416254043579	0.6208862066268921	0.020013287663459778	0.995970606803894	0.14587385952472687	0.09482627362012863	8.705982281753677e-07	0.3362274169921875	0.00020030220912303776
122	[]	False	algomoneyfest		[]		text	t2_a2bll0zr	False	False	False	[]	False	False	1651578365	twitter.com	https://www.reddit.com/r/Bitcoin/comments/uhe8fh/2_argentina_banks_launched_bitcoin_world_top_read/	{}	uhe8fh	False	True	False	False	False	True	False	False		[]	dark	text	False	False	False	0	0	False	all_ads	/r/Bitcoin/comments/uhe8fh/2_argentina_banks_launched_bitcoin_world_top_read/	False	6		1651578375	1		True	False	False	Bitcoin	t5_2s3qj	4158054	public	https://a.thumbs.redditmedia.com/gKEUpCXk8Hbsj5DynK1AGFWmtNVCPbVoYFEDAMly548.jpg	2 ARGENTINA BANKS LAUNCHED BITCOIN. World top read article by Bloomberg . 60% of customers want BITCOIN	0	[]	1.0	https://twitter.com/AMoneyfest/status/1521453554963263488	https://twitter.com/AMoneyfest/status/1521453554963263488	all_ads	6			link	{'enabled': False, 'images': [{'id': '4nEQOLwMh2zZSIK-T1t8jcezR150Z9xs9F6e48PzwY8', 'resolutions': [{'height': 56, 'url': 'https://external-preview.redd.it/N77Vsn4sn_9rGvA1nluUK-_gZI3aJCz3BeLcVWXMRls.jpg?width=108&amp;crop=smart&amp;auto=webp&amp;s=4f8d37cd7c261cc79ead220570dadced9da50093', 'width': 108}], 'source': {'height': 73, 'url': 'https://external-preview.redd.it/N77Vsn4sn_9rGvA1nluUK-_gZI3aJCz3BeLcVWXMRls.jpg?auto=webp&amp;s=71fb23aca2c976733ee6d449251c9b0574761061', 'width': 140}, 'variants': {}}]}	73.0	140.0		"{'oembed': {'author_name': 'AlgoMoneyfest', 'author_url': 'https://twitter.com/AMoneyfest', 'cache_age': 3153600000, 'height': None, 'html': '&lt;blockquote class=""twitter-video""&gt;&lt;p lang=""en"" dir=""ltr""&gt;yes  I will made a vid about this if you want&lt;a href=""https://twitter.com/hashtag/Bitcoin?src=hash&amp;amp;ref_src=twsrc%5Etfw""&gt;#Bitcoin&lt;/a&gt; what are the risks of innovation for banks? big!&lt;br&gt;they are scared of moving to crypto. but now the are all forced to do it. 60% WANT CRYPTO! the PEOPLE HAS SPOKEN!&lt;a href=""https://t.co/cG9IOzCJq5""&gt;https://t.co/cG9IOzCJq5&lt;/a&gt;&lt;/p&gt;&amp;mdash; AlgoMoneyfest (@AMoneyfest) &lt;a href=""https://twitter.com/AMoneyfest/status/1521453554963263488?ref_src=twsrc%5Etfw""&gt;May 3, 2022&lt;/a&gt;&lt;/blockquote&gt;\n&lt;script async src=""https://platform.twitter.com/widgets.js"" charset=""utf-8""&gt;&lt;/script&gt;\n', 'provider_name': 'Twitter', 'provider_url': 'https://twitter.com', 'type': 'rich', 'url': 'https://twitter.com/AMoneyfest/status/1521453554963263488', 'version': '1.0', 'width': 350}, 'type': 'twitter.com'}"	"{'content': '&lt;blockquote class=""twitter-video""&gt;&lt;p lang=""en"" dir=""ltr""&gt;yes  I will made a vid about this if you want&lt;a href=""https://twitter.com/hashtag/Bitcoin?src=hash&amp;amp;ref_src=twsrc%5Etfw""&gt;#Bitcoin&lt;/a&gt; what are the risks of innovation for banks? big!&lt;br&gt;they are scared of moving to crypto. but now the are all forced to do it. 60% WANT CRYPTO! the PEOPLE HAS SPOKEN!&lt;a href=""https://t.co/cG9IOzCJq5""&gt;https://t.co/cG9IOzCJq5&lt;/a&gt;&lt;/p&gt;&amp;mdash; AlgoMoneyfest (@AMoneyfest) &lt;a href=""https://twitter.com/AMoneyfest/status/1521453554963263488?ref_src=twsrc%5Etfw""&gt;May 3, 2022&lt;/a&gt;&lt;/blockquote&gt;\n&lt;script async src=""https://platform.twitter.com/widgets.js"" charset=""utf-8""&gt;&lt;/script&gt;\n', 'height': 200, 'scrolling': False, 'width': 350}"	"{'oembed': {'author_name': 'AlgoMoneyfest', 'author_url': 'https://twitter.com/AMoneyfest', 'cache_age': 3153600000, 'height': None, 'html': '&lt;blockquote class=""twitter-video""&gt;&lt;p lang=""en"" dir=""ltr""&gt;yes  I will made a vid about this if you want&lt;a href=""https://twitter.com/hashtag/Bitcoin?src=hash&amp;amp;ref_src=twsrc%5Etfw""&gt;#Bitcoin&lt;/a&gt; what are the risks of innovation for banks? big!&lt;br&gt;they are scared of moving to crypto. but now the are all forced to do it. 60% WANT CRYPTO! the PEOPLE HAS SPOKEN!&lt;a href=""https://t.co/cG9IOzCJq5""&gt;https://t.co/cG9IOzCJq5&lt;/a&gt;&lt;/p&gt;&amp;mdash; AlgoMoneyfest (@AMoneyfest) &lt;a href=""https://twitter.com/AMoneyfest/status/1521453554963263488?ref_src=twsrc%5Etfw""&gt;May 3, 2022&lt;/a&gt;&lt;/blockquote&gt;\n&lt;script async src=""https://platform.twitter.com/widgets.js"" charset=""utf-8""&gt;&lt;/script&gt;\n', 'provider_name': 'Twitter', 'provider_url': 'https://twitter.com', 'type': 'rich', 'url': 'https://twitter.com/AMoneyfest/status/1521453554963263488', 'version': '1.0', 'width': 350}, 'type': 'twitter.com'}"	"{'content': '&lt;blockquote class=""twitter-video""&gt;&lt;p lang=""en"" dir=""ltr""&gt;yes  I will made a vid about this if you want&lt;a href=""https://twitter.com/hashtag/Bitcoin?src=hash&amp;amp;ref_src=twsrc%5Etfw""&gt;#Bitcoin&lt;/a&gt; what are the risks of innovation for banks? big!&lt;br&gt;they are scared of moving to crypto. but now the are all forced to do it. 60% WANT CRYPTO! the PEOPLE HAS SPOKEN!&lt;a href=""https://t.co/cG9IOzCJq5""&gt;https://t.co/cG9IOzCJq5&lt;/a&gt;&lt;/p&gt;&amp;mdash; AlgoMoneyfest (@AMoneyfest) &lt;a href=""https://twitter.com/AMoneyfest/status/1521453554963263488?ref_src=twsrc%5Etfw""&gt;May 3, 2022&lt;/a&gt;&lt;/blockquote&gt;\n&lt;script async src=""https://platform.twitter.com/widgets.js"" charset=""utf-8""&gt;&lt;/script&gt;\n', 'height': 200, 'media_domain_url': 'https://www.redditmedia.com/mediaembed/uhe8fh', 'scrolling': False, 'width': 350}"										"2 ARGENTINA BANKS LAUNCHED BITCOIN. World top read article by Bloomberg . 60% of customers want BITCOIN
"	2 argentina banks launched bitcoin world top read article by bloomberg 60 of customers want bitcoin nan	0.05382378771901131	0.8040180206298828	0.23476257920265198	0.43627429008483887	0.15371030569076538	0.2745901644229889	0.32273194193840027	0.007272455375641584	0.40642550587654114	0.0021586562506854534
123	[]	False	Ok-View1990		[]		text	t2_mnt4ba6b	False	False	False	[]	False	False	1651578344	self.Bitcoin	https://www.reddit.com/r/Bitcoin/comments/uhe87w/stole_my_money/	{}	uhe87w	False	False	False	False	False	False	True	False		[]	dark	text	False	False	True	0	0	False	all_ads	/r/Bitcoin/comments/uhe87w/stole_my_money/	False	6	moderator	1651578355	1	[removed]	True	False	False	Bitcoin	t5_2s3qj	4158055	public	self	Stole my money	0	[]	1.0	https://www.reddit.com/r/Bitcoin/comments/uhe87w/stole_my_money/		all_ads	6																					"Stole my money
[removed]"	stole my money removed 	0.4217236042022705	0.39801761507987976	0.5714618563652039	0.37819933891296387	0.4804929792881012	0.5991089344024658	0.40163010358810425	0.5086596608161926	0.41938987374305725	0.3605656623840332
124	[]	False	Elrondarius		[]		text	t2_c5bat1cu	False	False	False	[]	False	False	1651577805	self.Bitcoin	https://www.reddit.com/r/Bitcoin/comments/uhe2tz/over_the_last_year_i_have_learned_that_a/	{}	uhe2tz	False	False	False	False	False	False	True	False		[]	dark	text	False	False	True	0	0	False	all_ads	/r/Bitcoin/comments/uhe2tz/over_the_last_year_i_have_learned_that_a/	False	6	moderator	1651577816	1	[removed]	True	False	False	Bitcoin	t5_2s3qj	4158043	public	self	Over the last year, I have learned that a portfolio without BTC is a bizarre.	0	[]	1.0	https://www.reddit.com/r/Bitcoin/comments/uhe2tz/over_the_last_year_i_have_learned_that_a/		all_ads	6																					"Over the last year, I have learned that a portfolio without BTC is a bizarre.
[removed]"	over the last year i have learned that a portfolio without btc is a bizarre removed 	0.11467252671718597	0.814858078956604	0.610582709312439	0.2705865800380707	0.5563892126083374	0.546402633190155	0.1793803721666336	0.6703587770462036	0.4303705394268036	0.006541873794049025
125	[]	False	fastbitcoinsHenry		[]		text	t2_e6a1ctcl	False	False	False	[]	False	False	1651576090	i.redd.it	https://www.reddit.com/r/Bitcoin/comments/uhdmyf/bitcoiner_friends_normal_friends/	{}	uhdmyf	False	True	False	False	True	True	False	False		[]	dark	text	False	False	False	0	0	False	all_ads	/r/Bitcoin/comments/uhdmyf/bitcoiner_friends_normal_friends/	False	6		1651576100	1		True	False	False	Bitcoin	t5_2s3qj	4157985	public	https://b.thumbs.redditmedia.com/m_BjNc6sdx6hOBXpewZJtVcwSH3Ypts0ZahdgAIYYhE.jpg	Bitcoiner friends &gt; normal friends	0	[]	1.0	https://i.redd.it/e0mlf0utt8x81.jpg	https://i.redd.it/e0mlf0utt8x81.jpg	all_ads	6			image	{'enabled': True, 'images': [{'id': 'PudXqEIKjdO4ow9aNmvop03bOpwaymqbXlRsPFhCuPI', 'resolutions': [{'height': 108, 'url': 'https://preview.redd.it/e0mlf0utt8x81.jpg?width=108&amp;crop=smart&amp;auto=webp&amp;s=13068560956bc47c3aaa3cad0b6cbbc835083a02', 'width': 108}, {'height': 216, 'url': 'https://preview.redd.it/e0mlf0utt8x81.jpg?width=216&amp;crop=smart&amp;auto=webp&amp;s=ef3b83a6433eb209e2a8349586d0214a69054550', 'width': 216}, {'height': 320, 'url': 'https://preview.redd.it/e0mlf0utt8x81.jpg?width=320&amp;crop=smart&amp;auto=webp&amp;s=4440d8ac0ceba32fb259795071e4cbc7caf8d836', 'width': 320}, {'height': 640, 'url': 'https://preview.redd.it/e0mlf0utt8x81.jpg?width=640&amp;crop=smart&amp;auto=webp&amp;s=2276c229729abceb1f7b83c895e9efcf0e477b1c', 'width': 640}, {'height': 960, 'url': 'https://preview.redd.it/e0mlf0utt8x81.jpg?width=960&amp;crop=smart&amp;auto=webp&amp;s=31aec0f5899702e48c03c313d0d82f4d27cd772f', 'width': 960}, {'height': 1080, 'url': 'https://preview.redd.it/e0mlf0utt8x81.jpg?width=1080&amp;crop=smart&amp;auto=webp&amp;s=6a1bb613eb4ebc3404717e0581da7273dbf8919a', 'width': 1080}], 'source': {'height': 1271, 'url': 'https://preview.redd.it/e0mlf0utt8x81.jpg?auto=webp&amp;s=deb128c873bd47a965c36508c2f5f65c4f407e69', 'width': 1271}, 'variants': {}}]}	140.0	140.0															"Bitcoiner friends &gt; normal friends
"	bitcoiner friends gt normal friends nan	0.5806810259819031	0.31050142645835876	0.21867889165878296	0.33836695551872253	0.541122555732727	0.7250508069992065	0.5864012837409973	0.5874446034431458	0.44636186957359314	0.6039309501647949
126	[]	False	yeho_meta		[]		text	t2_4mc6ixul	False	False	False	[]	False	False	1651575678	youtube.com	https://www.reddit.com/r/Bitcoin/comments/uhdj4i/sure_warren/	{}	uhdj4i	False	True	False	False	False	True	False	False		[]	dark	text	False	False	True	0	0	False	all_ads	/r/Bitcoin/comments/uhdj4i/sure_warren/	False	6		1651575689	1		True	False	False	Bitcoin	t5_2s3qj	4157976	public	https://b.thumbs.redditmedia.com/zzhqnCFhsUmxRUI2xeZn0iEUurCQb4aiinD52tgmwxg.jpg	Sure Warren	0	[]	1.0	https://youtube.com/watch?v=E5Selp9qoYQ&amp;feature=share	https://youtube.com/watch?v=E5Selp9qoYQ&amp;feature=share	all_ads	6			rich:video	{'enabled': False, 'images': [{'id': 'R-8GHN1WkdNs7xKHa89Aea08EJoxQOU44Zah4UuFdFA', 'resolutions': [{'height': 81, 'url': 'https://external-preview.redd.it/XrhVsEKNFaaaMmCtJq3a0Eb-mV6L_ltj8ibMF3TLFRQ.jpg?width=108&amp;crop=smart&amp;auto=webp&amp;s=fd306abca4728e5795135c960e4f17c780e9a7b5', 'width': 108}, {'height': 162, 'url': 'https://external-preview.redd.it/XrhVsEKNFaaaMmCtJq3a0Eb-mV6L_ltj8ibMF3TLFRQ.jpg?width=216&amp;crop=smart&amp;auto=webp&amp;s=fb2c42d4bebfc10ca72568d467a73c5fe3d33063', 'width': 216}, {'height': 240, 'url': 'https://external-preview.redd.it/XrhVsEKNFaaaMmCtJq3a0Eb-mV6L_ltj8ibMF3TLFRQ.jpg?width=320&amp;crop=smart&amp;auto=webp&amp;s=e4ba4213a11cbe8048d2c92cc7045ebdf7fd6a34', 'width': 320}], 'source': {'height': 360, 'url': 'https://external-preview.redd.it/XrhVsEKNFaaaMmCtJq3a0Eb-mV6L_ltj8ibMF3TLFRQ.jpg?auto=webp&amp;s=9a18b95aeab18329afdcd1ea5b6da6463f27268c', 'width': 480}, 'variants': {}}]}	105.0	140.0		"{'oembed': {'author_name': 'Crypto meditation', 'author_url': 'https://www.youtube.com/c/Cryptomemeinspiration', 'height': 200, 'html': '&lt;iframe width=""356"" height=""200"" src=""https://www.youtube.com/embed/E5Selp9qoYQ?feature=oembed&amp;enablejsapi=1"" frameborder=""0"" allow=""accelerometer; autoplay; clipboard-write; encrypted-media; gyroscope; picture-in-picture"" allowfullscreen&gt;&lt;/iframe&gt;', 'provider_name': 'YouTube', 'provider_url': 'https://www.youtube.com/', 'thumbnail_height': 360, 'thumbnail_url': 'https://i.ytimg.com/vi/E5Selp9qoYQ/hqdefault.jpg', 'thumbnail_width': 480, 'title': 'Bitcoin to the moon 🌙 Boomer regret meme compilation 2021', 'type': 'video', 'version': '1.0', 'width': 356}, 'type': 'youtube.com'}"	"{'content': '&lt;iframe width=""356"" height=""200"" src=""https://www.youtube.com/embed/E5Selp9qoYQ?feature=oembed&amp;enablejsapi=1"" frameborder=""0"" allow=""accelerometer; autoplay; clipboard-write; encrypted-media; gyroscope; picture-in-picture"" allowfullscreen&gt;&lt;/iframe&gt;', 'height': 200, 'scrolling': False, 'width': 356}"	"{'oembed': {'author_name': 'Crypto meditation', 'author_url': 'https://www.youtube.com/c/Cryptomemeinspiration', 'height': 200, 'html': '&lt;iframe width=""356"" height=""200"" src=""https://www.youtube.com/embed/E5Selp9qoYQ?feature=oembed&amp;enablejsapi=1"" frameborder=""0"" allow=""accelerometer; autoplay; clipboard-write; encrypted-media; gyroscope; picture-in-picture"" allowfullscreen&gt;&lt;/iframe&gt;', 'provider_name': 'YouTube', 'provider_url': 'https://www.youtube.com/', 'thumbnail_height': 360, 'thumbnail_url': 'https://i.ytimg.com/vi/E5Selp9qoYQ/hqdefault.jpg', 'thumbnail_width': 480, 'title': 'Bitcoin to the moon 🌙 Boomer regret meme compilation 2021', 'type': 'video', 'version': '1.0', 'width': 356}, 'type': 'youtube.com'}"	"{'content': '&lt;iframe width=""356"" height=""200"" src=""https://www.youtube.com/embed/E5Selp9qoYQ?feature=oembed&amp;enablejsapi=1"" frameborder=""0"" allow=""accelerometer; autoplay; clipboard-write; encrypted-media; gyroscope; picture-in-picture"" allowfullscreen&gt;&lt;/iframe&gt;', 'height': 200, 'media_domain_url': 'https://www.redditmedia.com/mediaembed/uhdj4i', 'scrolling': False, 'width': 356}"										"Sure Warren
"	sure warren nan	0.5106704235076904	0.42469483613967896	0.42258405685424805	0.48196807503700256	0.467481404542923	0.623450756072998	0.5316972732543945	0.5074386596679688	0.4646076261997223	0.39792171120643616
