Unnamed: 0	all_awardings	archived	associated_award	author	author_flair_background_color	author_flair_css_class	author_flair_richtext	author_flair_template_id	author_flair_text	author_flair_text_color	author_flair_type	author_fullname	author_patreon_flair	author_premium	body	body_sha1	can_gild	collapsed	collapsed_because_crowd_control	collapsed_reason	collapsed_reason_code	comment_type	controversiality	created_utc	distinguished	gilded	gildings	id	is_submitter	link_id	locked	no_follow	parent_id	permalink	retrieved_utc	score	score_hidden	send_replies	stickied	subreddit	subreddit_id	subreddit_name_prefixed	subreddit_type	top_awarded_type	total_awards_received	treatment_tags	unrepliable_reason	author_cakeday	corpus	support	knowledge	conflict	power	similarity	fun	status	trust	identity	romance
0	[]	False		BoulderMaker			[]				text	t2_x4udd	False	False	"Actually, he did say that. Specifically, he said, ""What motivates most gold purchasers is their belief that the ranks of the fearful will grow ... As 'bandwagon' investors join any party, they create their own truth - for a while... True, gold has some industrial and decorative utility, but the demand for these purposes is both limited and incapable of soaking up new production. Meanwhile, if you own one ounce of gold for an eternity, you will still own one ounce at its end. It has no productive value."""	4792c018e981d460e2eeb3599f0e464b63c57af2	True	False					0	1663560026		0	{}	ip0u9w8	False	t3_xhxi23	False	True	t1_ip0sphz	/r/Bitcoin/comments/xhxi23/every_cfp_that_parrots_this_gets_a_cracker/ip0u9w8/	1663560042	1	True	True	False	Bitcoin	t5_2s3qj	r/Bitcoin	public		0	[]													
1	[]	False		Thom5001			[]				text	t2_819bdqbi	False	False	I wouldn’t be sitting on the toilet reading this…	711641fa657a96d4a735cfbe7deb530fbdba7654	True	False					0	1663559994		0	{}	ip0u7pb	False	t3_xhxb33	False	True	t3_xhxb33	/r/Bitcoin/comments/xhxb33/what_would_you_do_if_you_earned_1_bitcoin_now/ip0u7pb/	1663560012	1	True	True	False	Bitcoin	t5_2s3qj	r/Bitcoin	public		0	[]													
2	[]	False		PatrickHenryTax			[]			dark	text	t2_cnbynl20	False	False	Sounds like you’re fun at parties considering you spend your time looking for typos on Reddit…	2ff0f7f59e0258ba76c38b22d0b0ec0bc34cc6ca	True	False					0	1663559833		0	{}	ip0tx2b	True	t3_xhxi23	False	True	t1_ip0rdjc	/r/Bitcoin/comments/xhxi23/every_cfp_that_parrots_this_gets_a_cracker/ip0tx2b/	1663559850	1	True	True	False	Bitcoin	t5_2s3qj	r/Bitcoin	public		0	[]													
3	[]	False		ItsAllJustASickGame			[]				text	t2_4rb89hry	False	True	Oh wow interesting. Grass roots OP. Good luck!	22d940785b6727581b49d421071311626e595fbf	True	False					0	1663559824		0	{}	ip0twfd	False	t3_xhgcy8	False	True	t1_ip0r7y2	/r/Bitcoin/comments/xhgcy8/boracay_philippines_aka_bitcoin_island/ip0twfd/	1663559835	1	True	True	False	Bitcoin	t5_2s3qj	r/Bitcoin	public		0	[]													
4	[]	False		staycurrent11			[]				text	t2_hr2l3wm6	False	False	Btc is the shit, I'm telling you. People don't realise it yet.	4139d120158dfe863c9e50e2a8f5a867f2b84b37	True	False					0	1663559745		0	{}	ip0tr37	False	t3_xh7lah	False	True	t1_ip01ns4	/r/Bitcoin/comments/xh7lah/daily_discussion_september_18_2022/ip0tr37/	1663559756	1	True	True	False	Bitcoin	t5_2s3qj	r/Bitcoin	public		0	[]													
5	[]	False		Z3LS3			[]				text	t2_7gc6zt4f	False	False	I celebrate the entire catalog	d105171c4818fe073e457bafd2a24dfad8b73648	True	False					0	1663559693		0	{}	ip0tnj3	False	t3_xhxb33	False	True	t1_ip0pap1	/r/Bitcoin/comments/xhxb33/what_would_you_do_if_you_earned_1_bitcoin_now/ip0tnj3/	1663559711	1	True	True	False	Bitcoin	t5_2s3qj	r/Bitcoin	public		0	[]													
6	[]	False		Awtz09			[]				text	t2_6zhdlr0z	False	False	Accumulate more of course	21ce405fdbd102c01d07ab0e2ef497837e1b20ed	True	False					0	1663559662		0	{}	ip0tlfz	False	t3_xhxb33	False	True	t3_xhxb33	/r/Bitcoin/comments/xhxb33/what_would_you_do_if_you_earned_1_bitcoin_now/ip0tlfz/	1663559674	1	True	True	False	Bitcoin	t5_2s3qj	r/Bitcoin	public		0	[]													
7	[]	False		[deleted]						dark					[removed]	fe993932d6dced4c0a879e9aa5d7a6e0fbb467f5	True	False					0	1663559563		0	{}	ip0tf3d	False	t3_xh7lah	False	True	t1_ip0mdrr	/r/Bitcoin/comments/xh7lah/daily_discussion_september_18_2022/ip0tf3d/	1663559575	1	True	True	False	Bitcoin	t5_2s3qj	r/Bitcoin	public		0	[]													
8	[]	False		Jiujitsu_Dude			[]				text	t2_128x9twa	False	False	This	7971e6a051104074fdae0f02322417b6eb5695a2	True	False					0	1663559560		0	{}	ip0teye	False	t3_xhxb33	False	True	t1_ip0dy2y	/r/Bitcoin/comments/xhxb33/what_would_you_do_if_you_earned_1_bitcoin_now/ip0teye/	1663559575	1	True	True	False	Bitcoin	t5_2s3qj	r/Bitcoin	public		0	[]													
9	[]	False		LTZ3			[]				text	t2_kmcaw	False	False	Bitcoin going tits up	fcd9680eb35e0d35d9b0ab754a79c99f55692f6d	True	False					0	1663559503		0	{}	ip0tb7e	False	t3_xh7lah	False	True	t1_ip0qry4	/r/Bitcoin/comments/xh7lah/daily_discussion_september_18_2022/ip0tb7e/	1663559514	1	True	True	False	Bitcoin	t5_2s3qj	r/Bitcoin	public		0	[]													
10	[]	False		savinelli_smoker			[]				text	t2_rcdiw	False	False	Funny the way this picture is put together coz almost these “celebs” had almost nothing to do with bitcoin, what’s all these gold bitcoin graphics doing here?	0af2095397780e456c33ff082afe9f460dd4b3e2	True	False					0	1663559500		0	{}	ip0tay3	False	t3_xhoal4	False	True	t3_xhoal4	/r/Bitcoin/comments/xhoal4/celebrities_who_promoted_cryptocurrencies_remain/ip0tay3/	1663559514	1	True	True	False	Bitcoin	t5_2s3qj	r/Bitcoin	public		0	[]													
11	[]	False		[deleted]						dark					[removed]	fe993932d6dced4c0a879e9aa5d7a6e0fbb467f5	True	False					0	1663559449		0	{}	ip0t7mv	False	t3_xhm4tu	False	True	t1_ioz3zyx	/r/Bitcoin/comments/xhm4tu/jordan_peterson_fascinated_by_bitcoin_mining/ip0t7mv/	1663559461	1	True	True	False	Bitcoin	t5_2s3qj	r/Bitcoin	public		0	[]													
12	[]	False		theekman			[]				text	t2_f2u8s	False	False	Oh hell you dont need a whole bitcoin to to nothing man, take a look at my cousin hes broke n don’t do shit.	8f5398ae8c01052db0e7ec71d4378b403231ce02	True	False					0	1663559448		0	{}	ip0t7l7	False	t3_xhxb33	False	True	t1_ip0fn3i	/r/Bitcoin/comments/xhxb33/what_would_you_do_if_you_earned_1_bitcoin_now/ip0t7l7/	1663559461	1	True	True	False	Bitcoin	t5_2s3qj	r/Bitcoin	public		0	[]													
13	[]	False		nklstar			[]				text	t2_js5ek158	False	False	Is he still around I mean? Haven't seen him in a while tho.	c77cf5ccddaf45ca628abcf3dcb692ca4befb59b	True	False					0	1663559440		0	{}	ip0t713	False	t3_xh7lah	False	False	t1_iowbn0l	/r/Bitcoin/comments/xh7lah/daily_discussion_september_18_2022/ip0t713/	1663559453	1	True	True	False	Bitcoin	t5_2s3qj	r/Bitcoin	public		0	[]													
14	[]	False		merklegroot			[]				text	t2_1sids6vx	False	False	Earn a second one.	670bb075657ceb4daba1e4c093397c9fe82fe542	True	False					0	1663559395		0	{}	ip0t41z	False	t3_xhxb33	False	True	t1_ip0pap1	/r/Bitcoin/comments/xhxb33/what_would_you_do_if_you_earned_1_bitcoin_now/ip0t41z/	1663559407	1	True	True	False	Bitcoin	t5_2s3qj	r/Bitcoin	public		0	[]													
15	[]	False		Ok_Aerie3546			[]				text	t2_809nb64s	False	False	No one said they were.	98990de68ca1ffd706b26aa4495a3d928f8d5b21	True	False					0	1663559377		0	{}	ip0t2vc	False	t3_xhz8ej	False	True	t1_ip0ssk8	/r/Bitcoin/comments/xhz8ej/wishing_bitcoin_was_the_norm_buying_sarees_in/ip0t2vc/	1663559392	1	True	True	False	Bitcoin	t5_2s3qj	r/Bitcoin	public		0	[]													
16	[]	False		Vimvimboy		noob	[{'e': 'text', 't': 'redditor for 5 weeks'}]	2ec8e69e-6c36-11e9-a04b-0afb553d4ea6	redditor for 5 weeks	dark	richtext	t2_rbfkqnrp	False	False	I see BTC and Philippines in one sentence. I upvote	4b4b1b2a3b05ed6f3db76075498dc183cb79c6e5	True	False					0	1663559282		0	{}	ip0swpq	False	t3_xhgcy8	False	False	t3_xhgcy8	/r/Bitcoin/comments/xhgcy8/boracay_philippines_aka_bitcoin_island/ip0swpq/	1663559299	1	True	True	False	Bitcoin	t5_2s3qj	r/Bitcoin	public		0	[]													
17	[]	False		p-iliev			[]				text	t2_a2tqoncd	False	False	Short with it🤣	89b9a6c376aba020c41a5754616af81b681eb723	True	False					0	1663559259		0	{}	ip0sv7t	False	t3_xhxb33	False	True	t3_xhxb33	/r/Bitcoin/comments/xhxb33/what_would_you_do_if_you_earned_1_bitcoin_now/ip0sv7t/	1663559277	1	True	True	False	Bitcoin	t5_2s3qj	r/Bitcoin	public		0	[]													
18	[]	False		omarmbtc			[]				text	t2_f2ddtyl9	False	False	It has made me understand that, I don't know about you guys.	f76979c01739af04eeb4f9fb290697ace9bb8d1e	True	False					0	1663559227		0	{}	ip0st0b	False	t3_xh7lah	False	True	t1_iozx5qg	/r/Bitcoin/comments/xh7lah/daily_discussion_september_18_2022/ip0st0b/	1663559238	1	True	True	False	Bitcoin	t5_2s3qj	r/Bitcoin	public		0	[]													
19	[]	False		Nada_Lives			[]				text	t2_4yjkrfk	False	False	Banks are NOT a part of Bitcoin.	9c3e49113380952de2f0a6da861288ca7b827b71	True	False					0	1663559220		0	{}	ip0ssk8	False	t3_xhz8ej	False	True	t1_ip0iait	/r/Bitcoin/comments/xhz8ej/wishing_bitcoin_was_the_norm_buying_sarees_in/ip0ssk8/	1663559231	1	True	True	False	Bitcoin	t5_2s3qj	r/Bitcoin	public		0	[]													
20	[]	False		BigTimeButNotReally			[]				text	t2_7usdk2ws	False	True	Lol.  I like that response.	4748f108e2aef128a4b0f13590a20e261ae3753c	True	False					0	1663559208		0	{}	ip0srtv	False	t3_xhvw16	False	True	t1_ip0sj7h	/r/Bitcoin/comments/xhvw16/another_simple_angle_on_thispow_uses_the_minimum/ip0srtv/	1663559223	1	True	True	False	Bitcoin	t5_2s3qj	r/Bitcoin	public		0	[]													
21	[]	False		ValuableShoulder5059			[]				text	t2_ag81vqpx	False	False	Not to mention in order to pull off a 51% attack on POW you need 51% of the hash rate. Impossible to do. For POS you only need to borrow 51% of the stake to take over the network. Borrowing 51% of the stake for a couple days is within reach of many...	f85d401c59d9b0b68849acd98dffbcd3562e4039	True	False					0	1663559194		0	{}	ip0sqxg	False	t3_xhevrk	False	True	t1_ioxqr9r	/r/Bitcoin/comments/xhevrk/how_proofofwork_incentives_are_more_fair/ip0sqxg/	1663559208	1	True	True	False	Bitcoin	t5_2s3qj	r/Bitcoin	public		0	[]													
22	[]	False		Ok_Aerie3546			[]				text	t2_809nb64s	False	False	"So when asked about gold, he never says ""gold has no intrinsic value"". He just says that he doesnt like unproductive assets. 

Atleast keep your valuations ""reasonable"" across all unproductive assets."	146d144159d01a3d1b98057d5f55db26644db927	True	False					0	1663559172		0	{}	ip0sphz	False	t3_xhxi23	False	True	t1_ip0rmf4	/r/Bitcoin/comments/xhxi23/every_cfp_that_parrots_this_gets_a_cracker/ip0sphz/	1663559187	1	True	True	False	Bitcoin	t5_2s3qj	r/Bitcoin	public		0	[]													
23	[]	False		[deleted]						dark					[removed]	fe993932d6dced4c0a879e9aa5d7a6e0fbb467f5	True	False					0	1663559150		0	{}	ip0so32	False	t3_xhxb33	False	True	t3_xhxb33	/r/Bitcoin/comments/xhxb33/what_would_you_do_if_you_earned_1_bitcoin_now/ip0so32/	1663559164	1	True	True	False	Bitcoin	t5_2s3qj	r/Bitcoin	public		0	[]													
24	[]	False		[deleted]						dark					[removed]	fe993932d6dced4c0a879e9aa5d7a6e0fbb467f5	True	False					0	1663559110		0	{}	ip0slco	False	t3_xhoal4	False	True	t1_ioys91w	/r/Bitcoin/comments/xhoal4/celebrities_who_promoted_cryptocurrencies_remain/ip0slco/	1663559127	1	True	True	False	Bitcoin	t5_2s3qj	r/Bitcoin	public		0	[]													
25	[]	False		midizzz			[]				text	t2_146bom	False	False	All I can do is try ;)	1c91eff5cc5f4643d70c9dbf63799e84d7acb1cd	True	False					0	1663559078		0	{}	ip0sj7h	True	t3_xhvw16	False	True	t1_ip0g4z2	/r/Bitcoin/comments/xhvw16/another_simple_angle_on_thispow_uses_the_minimum/ip0sj7h/	1663559096	1	True	True	False	Bitcoin	t5_2s3qj	r/Bitcoin	public		0	[]													
26	[]	False		Tyler_Zoro			[]				text	t2_n1pw9	False	False	"&gt;Crypto exists because of irresponsible government spending.

Crypto exists because using secure, distributed systems for currency was always going to happen. Pretending that it's some sort of indictment against government spending is a backward-looking justification.

&gt; We don’t need the Fed

Saying that doesn't make it true. I'm not convinced that there *isn't* a practically possible world where the US doesn't have a central bank, but I'd need a whole lot of convincing that getting there wouldn't go through ***many*** iterations of horrific pain and opportunistic land-grabs.

Say what you want about the Fed, but the balancing act that it represents between public (Governors) and semi-public (Reserve Banks) and private (banks)  institutions makes it extremely stable in the face of any one of those groups seeking to destabilize it. Let it go into the wilds of the ""free market"" and it won't be reddit ""Stonks!"" memers that set the course. It will be the large first that descend on it like buzzards on the carcase of a cow in the desert. Then you'll discover what ""irresponsible"" really looks like."	6e248d414730b8818f48535b9d73dff401ac44b2	True	False					0	1663559058		0	{}	ip0shwv	False	t3_xfqh4q	False	True	t1_ip0qqhl	/r/Bitcoin/comments/xfqh4q/as_a_bitcoiner_sometimes_it_is_difficult_to_focus/ip0shwv/	1663559072	1	True	True	False	Bitcoin	t5_2s3qj	r/Bitcoin	public		0	[]													
27	[]	False		[deleted]						dark					[removed]	fe993932d6dced4c0a879e9aa5d7a6e0fbb467f5	True	False					0	1663559034		0	{}	ip0sg61	False	t3_xh7lah	False	True	t3_xh7lah	/r/Bitcoin/comments/xh7lah/daily_discussion_september_18_2022/ip0sg61/	1663559049	1	True	True	False	Bitcoin	t5_2s3qj	r/Bitcoin	public		0	[]													
28	[]	False		thekarmabum			[]				text	t2_ap4zn	False	False	I love Peter Tosh, I wish he would have stayed with Bob Marley though, I really liked their songs together.	46bd6a1535b5cf09d38a92fd69e1f6fef1a8bbb8	True	False					0	1663559019		0	{}	ip0sf4j	False	t3_xhlenf	False	True	t3_xhlenf	/r/Bitcoin/comments/xhlenf/peter_tosh_the_day_the_dollar_die_live_1979/ip0sf4j/	1663559034	1	True	True	False	Bitcoin	t5_2s3qj	r/Bitcoin	public		0	[]													
29	[]	False		ValuableShoulder5059			[]				text	t2_ag81vqpx	False	False	Because people are selling it for cash because they need the cash as that is the only way to afford anything. Long term, the value will go up. Just like people will take in gold jewelry when times get tough. Price of gold falls in the short term, but skyrockets in the long with inflation.	9ced9efc6109127c2fdf8e3fdadf81aec8403f2e	True	False					0	1663559001		0	{}	ip0sdxz	False	t3_xhtt55	False	False	t1_ip0cjm0	/r/Bitcoin/comments/xhtt55/bitcoin_is_a_parallel_society/ip0sdxz/	1663559013	1	True	True	False	Bitcoin	t5_2s3qj	r/Bitcoin	public		0	[]													
30	[]	False		forzagesu			[]				text	t2_13dlti	False	False	Sell it until Powell decides he doesn't want Bitcoin to go lower	609ba9386d4342a7ebed7bcf61c3287c81e73464	True	False					0	1663558902		0	{}	ip0s743	False	t3_xhxb33	False	True	t3_xhxb33	/r/Bitcoin/comments/xhxb33/what_would_you_do_if_you_earned_1_bitcoin_now/ip0s743/	1663558913	1	True	True	False	Bitcoin	t5_2s3qj	r/Bitcoin	public		0	[]													
31	[]	False		VELOCIRAPTOR_ANUS			[]				text	t2_fs4t3	False	False	"Too bad we weren't arguing what the hardest money is.

And tell me again how you're not a purist?"	540b7d89060e317859983bd24c08173c26ffdd0f	True	False					0	1663558775		0	{}	ip0ry67	False	t3_xgw29z	False	True	t1_ip0pwru	/r/Bitcoin/comments/xgw29z/crypto_slowing_bitcoins_adoption/ip0ry67/	1663558787	1	True	True	False	Bitcoin	t5_2s3qj	r/Bitcoin	public		0	[]													
32	[]	False		geogiam2			[]			dark	text	t2_9yhsgu7g	False	False	you are downvoted but are the only one who knows better my country. quite evidently the truths hurts here. btc and what is happening in el salvador have nothing to do with one another. btc is not winning. fake news. yes. we are broken and us dollar becoming more expensive will send many endebted countries into default.	3deec5f55a0d73907d6862efeea5afb769f9b873	True	False					0	1663558644		0	{}	ip0rp3a	False	t3_xhq5ro	False	True	t1_iozflta	/r/Bitcoin/comments/xhq5ro/el_salvador_is_attacked_because_theyre_winning/ip0rp3a/	1663558656	1	True	True	False	Bitcoin	t5_2s3qj	r/Bitcoin	public		0	[]													
33	[]	False		TexasRanger6455			[]				text	t2_ac7yt84u	False	False	Major bear flag alert. We blew right through the $19,600 support today. If $18,700ish support doesn't hold, we're heading to $17,500. If $17,500 doesn't hold, there are no further support levels until $13k-$14k.	593e210148402866dc6c3e4663674d22bf5a4a47	True	False					0	1663558616		0	{}	ip0rn3u	False	t3_xh7lah	False	True	t3_xh7lah	/r/Bitcoin/comments/xh7lah/daily_discussion_september_18_2022/ip0rn3u/	1663558634	1	True	True	False	Bitcoin	t5_2s3qj	r/Bitcoin	public		0	[]													
34	[]	False		BoulderMaker			[]				text	t2_x4udd	False	False	By intrinsic value, he means a productive asset that creates a cash flow with some predictability and therefore could reasonably receive some valuation.	5afe6fa539075b9ed67fc76e1c6806b8e9cbe0a4	True	False					0	1663558606		0	{}	ip0rmf4	False	t3_xhxi23	False	False	t1_ip0awxg	/r/Bitcoin/comments/xhxi23/every_cfp_that_parrots_this_gets_a_cracker/ip0rmf4/	1663558617	1	True	True	False	Bitcoin	t5_2s3qj	r/Bitcoin	public		0	[]													
35	[]	False		BoulderMaker			[]				text	t2_x4udd	False	False	Sounds like you know what you're talking about considering you don't know how to spell his name...	fc609a5e1bce172e5d93198f95e9dbf0e5afdd36	True	False					0	1663558478		0	{}	ip0rdjc	False	t3_xhxi23	False	True	t1_ip0ksco	/r/Bitcoin/comments/xhxi23/every_cfp_that_parrots_this_gets_a_cracker/ip0rdjc/	1663558492	1	True	True	False	Bitcoin	t5_2s3qj	r/Bitcoin	public		0	[]													
36	[]	False		tesseramous			[]				text	t2_dtkwz	False	False	Why arent there 25,000 coin buy orders and 200,000 coin books anymore? Does bitcoin even have any kind of support?	9a8a086aa5bdb30b0e5fcc574da2de8ace5918e9	True	False					0	1663558450		0	{}	ip0rbm3	False	t3_xh7lah	False	False	t3_xh7lah	/r/Bitcoin/comments/xh7lah/daily_discussion_september_18_2022/ip0rbm3/	1663558470	1	True	True	False	Bitcoin	t5_2s3qj	r/Bitcoin	public		0	[]													
37	[]	False		Ghost156915			[]				text	t2_655wyrxq	False	False	I keep an eye on DXY chart on trading view, it’s got a spot for people to comment and show their charts and what they think… anyways I’m seeing quite a few more “suggestions” for people to short so who knows maybe it’ll drop soon	9f07f47d76a42d76b466abbed74d40812e2c8871	True	False					0	1663558446		0	{}	ip0rb9u	False	t3_xh7lah	False	True	t1_ip0paza	/r/Bitcoin/comments/xh7lah/daily_discussion_september_18_2022/ip0rb9u/	1663558462	1	True	True	False	Bitcoin	t5_2s3qj	r/Bitcoin	public		0	[]													
38	[]	False		[deleted]						dark					[removed]	fe993932d6dced4c0a879e9aa5d7a6e0fbb467f5	True	False					0	1663558444		0	{}	ip0rb49	False	t3_xhq5ro	False	True	t3_xhq5ro	/r/Bitcoin/comments/xhq5ro/el_salvador_is_attacked_because_theyre_winning/ip0rb49/	1663558462	1	True	True	False	Bitcoin	t5_2s3qj	r/Bitcoin	public		0	[]													
39	[]	False		ThePleasureOfPurity			[]				text	t2_5k6eb3as	False	False	Back to 18k it's sooo fucking over	794e8790aa9807b724539613b18f4609a2a9ea1e	True	False					0	1663558442		0	{}	ip0rb0x	False	t3_xh7lah	False	True	t3_xh7lah	/r/Bitcoin/comments/xh7lah/daily_discussion_september_18_2022/ip0rb0x/	1663558462	1	True	True	False	Bitcoin	t5_2s3qj	r/Bitcoin	public		0	[]													
40	[]	False		BitcoinIslandPH			[]			dark	text	t2_mvhengox	False	False	[http://pouch.ph/bitcoinIsland](http://pouch.ph/bitcoinIsland) is not a government operation.  Bunch of bitcoiners that are cleverly disguised as responsible adults running a company.  We got all our government permits to prove it though!	4900968007f605d74e0b7ccb932d29940b768e44	True	False					0	1663558397		0	{}	ip0r7y2	False	t3_xhgcy8	False	False	t1_ip0jgyg	/r/Bitcoin/comments/xhgcy8/boracay_philippines_aka_bitcoin_island/ip0r7y2/	1663558415	1	True	True	False	Bitcoin	t5_2s3qj	r/Bitcoin	public		0	[]													
41	[]	False		MerCyMining		noob	[{'e': 'text', 't': 'redditor for 3 months'}]	2ec8e69e-6c36-11e9-a04b-0afb553d4ea6	redditor for 3 months	dark	richtext	t2_otr7vu3x	False	False	Guns, Ammo, food, water filters, candles, batteries, solar panel setup.	32d174c0ebb0b6d9093bb1120893e918792be9bc	True	False					0	1663558357		0	{}	ip0r572	False	t3_xhxb33	False	False	t3_xhxb33	/r/Bitcoin/comments/xhxb33/what_would_you_do_if_you_earned_1_bitcoin_now/ip0r572/	1663558368	1	True	True	False	Bitcoin	t5_2s3qj	r/Bitcoin	public		0	[]													
42	[]	False		[deleted]						dark					[removed]	fe993932d6dced4c0a879e9aa5d7a6e0fbb467f5	True	False					0	1663558230		0	{}	ip0qwcv	False	t3_xhq5ro	False	True	t3_xhq5ro	/r/Bitcoin/comments/xhq5ro/el_salvador_is_attacked_because_theyre_winning/ip0qwcv/	1663558244	1	True	True	False	Bitcoin	t5_2s3qj	r/Bitcoin	public		0	[]													
43	[]	False		Vimvimboy		noob	[{'e': 'text', 't': 'redditor for 5 weeks'}]	2ec8e69e-6c36-11e9-a04b-0afb553d4ea6	redditor for 5 weeks	dark	richtext	t2_rbfkqnrp	False	False	You nailed it	e786baba5c9891aaa00c27b8da5c23787b5f8131	True	False					0	1663558194		0	{}	ip0qtw4	False	t3_xhxi23	False	True	t1_ip0jiec	/r/Bitcoin/comments/xhxi23/every_cfp_that_parrots_this_gets_a_cracker/ip0qtw4/	1663558212	1	True	True	False	Bitcoin	t5_2s3qj	r/Bitcoin	public		0	[]													
44	[]	False		titsup24-7			[]				text	t2_iuiogos3	False	False	"Are you an edgy short term sadist, but long term masochist in the btc community?  I don't quite know why I'm responding lol

Good luck guy/girl"	5c04eb31156cd79ab482ff632f22328494c53d19	True	False					0	1663558166		0	{}	ip0qry4	False	t3_xh7lah	False	True	t1_ip0p6eb	/r/Bitcoin/comments/xh7lah/daily_discussion_september_18_2022/ip0qry4/	1663558181	1	True	True	False	Bitcoin	t5_2s3qj	r/Bitcoin	public		0	[]													
45	[]	False		Keth43			[]				text	t2_s96lw	False	False	Only answer	6c02459ac9a380d08dbee0e8d85af37fed96357f	True	False					0	1663558163		0	{}	ip0qrqj	False	t3_xhxb33	False	True	t1_ip086ml	/r/Bitcoin/comments/xhxb33/what_would_you_do_if_you_earned_1_bitcoin_now/ip0qrqj/	1663558173	1	True	True	False	Bitcoin	t5_2s3qj	r/Bitcoin	public		0	[]													
46	[]	False		Fuzzymango_9			[]			dark	text	t2_n3dybgbl	False	False	Probably forget my keys.	504d0cda74f5ddbecc48a6931612c6fd11a8a8ea	True	False					0	1663558153		0	{}	ip0qr2x	False	t3_xhxb33	False	True	t3_xhxb33	/r/Bitcoin/comments/xhxb33/what_would_you_do_if_you_earned_1_bitcoin_now/ip0qr2x/	1663558165	1	True	True	False	Bitcoin	t5_2s3qj	r/Bitcoin	public		0	[]													
47	[]	False		GoBigorGoHome687			[]				text	t2_9ye13sri	False	False	Nothing short of abolishing the Federal reserve. They want to attack crypto! Crypto exists because of irresponsible government spending. Irresponsible government spending and their attempts of a wealth transfer is instability. Look at all asset classes.	5556c2a76315fd812726dae6b9d9184d30c41867	True	False					0	1663558144		0	{}	ip0qqhl	False	t3_xfqh4q	False	True	t1_ioz82eh	/r/Bitcoin/comments/xfqh4q/as_a_bitcoiner_sometimes_it_is_difficult_to_focus/ip0qqhl/	1663558157	1	True	True	False	Bitcoin	t5_2s3qj	r/Bitcoin	public		0	[]													
48	[]	False		Apart-Mango-4441			[]				text	t2_fbpl94ub	False	False	If it wasn’t Saylor it’d be someone else. Sooner or later prominent figures will pop up it’s just things that happen when you’re revolutionizing the global financial system. I view it as a marker that we’re on the right track. And, after listening to quite a few Saylor interviews I’m pretty glad it’s him, dude is wicked smart.	8d6eab1320985c3a420a007739a9a7018254501c	True	False					0	1663558139		0	{}	ip0qq48	False	t3_xflu2y	False	True	t1_iosm1la	/r/Bitcoin/comments/xflu2y/michael_saylor_publishes_open_letter_discussing/ip0qq48/	1663558150	1	True	True	False	Bitcoin	t5_2s3qj	r/Bitcoin	public		0	[]													
49	[]	False		NeutronSniper			[]				text	t2_8nz49753	False	False	The IRS's only concern is that the government gets it cut. How you got it is another agency's concern, such the DEA or FBI.	c1a7f61fa037c649b57499bf86885ae835c87760	True	False					0	1663558119		0	{}	ip0qops	False	t3_xh3sne	False	True	t1_ioxi8ye	/r/Bitcoin/comments/xh3sne/question_about_btc_and_money_laundering_via/ip0qops/	1663558135	1	True	True	False	Bitcoin	t5_2s3qj	r/Bitcoin	public		0	[]													
50	[]	False		poochylaa			[]				text	t2_56ui91lm	False	False	Hes technically part of the greatest generation, which i have mad respect for, but him and munger dont believe in anything with intrinsic value (i.e. gold, diamonds, silver etc.). They exclusively put faith in  people and businesses. Im not saying their right, im just saying that their stance has made them very wealthy.	f5010868b18aa436eb0043b256a4b154a424e622	True	False					0	1663558082		0	{}	ip0qm23	False	t3_xhxi23	False	True	t3_xhxi23	/r/Bitcoin/comments/xhxi23/every_cfp_that_parrots_this_gets_a_cracker/ip0qm23/	1663558096	1	True	True	False	Bitcoin	t5_2s3qj	r/Bitcoin	public		0	[]													
51	[]	False		rkomzzzz			[]				text	t2_elivzg5r	False	False	came here to say this as well. dude’s full of shit	68cc722b3ebd359a5ff1b0a9f8223a758313cfc3	True	False					0	1663558065		0	{}	ip0qkuq	False	t3_xh7lah	False	True	t1_ip0oh3a	/r/Bitcoin/comments/xh7lah/daily_discussion_september_18_2022/ip0qkuq/	1663558079	1	True	True	False	Bitcoin	t5_2s3qj	r/Bitcoin	public		0	[]													
52	[]	False		tigersharkwushen_			[]				text	t2_gf251	False	False	Ah, I see.  By that accounting the bitcoin would have negative intrinsic value since you need to burn energy to create it.	3ee4ad94eee569576c841b50d3b09bc1e36d08ed	True	False					0	1663558047		0	{}	ip0qjkl	False	t3_xhxi23	False	True	t1_ip0pxhm	/r/Bitcoin/comments/xhxi23/every_cfp_that_parrots_this_gets_a_cracker/ip0qjkl/	1663558065	1	True	True	False	Bitcoin	t5_2s3qj	r/Bitcoin	public		0	[]													
