Unnamed: 0	all_awardings	archived	associated_award	author	author_flair_background_color	author_flair_css_class	author_flair_richtext	author_flair_template_id	author_flair_text	author_flair_text_color	author_flair_type	author_fullname	author_patreon_flair	author_premium	body	body_sha1	can_gild	collapsed	collapsed_because_crowd_control	collapsed_reason	collapsed_reason_code	comment_type	controversiality	created_utc	distinguished	gilded	gildings	id	is_submitter	link_id	locked	no_follow	parent_id	permalink	retrieved_utc	score	score_hidden	send_replies	stickied	subreddit	subreddit_id	subreddit_name_prefixed	subreddit_type	top_awarded_type	total_awards_received	treatment_tags	unrepliable_reason	corpus	support	knowledge	conflict	power	similarity	fun	status	trust	identity	romance
250	[]	False		BlazingHotFireFox			[]				text	t2_gcys21hq	False	False	It leads to their accounts on OpenSea.	e39b295004aae57367126983f374336b82809575	True	False					0	1653180057		0	{}	i9iecvj	True	t3_uuz029	False	True	t1_i9idqxe	/r/ethereum/comments/uuz029/view_nft_wallets_of_famous_people_and_brands/i9iecvj/	1653180076	1	False	True	False	ethereum	t5_2zf9m	r/ethereum	public		0	[]												
251	[]	False		KlopKlop10293			[]				text	t2_6htonncs	False	False	There are actually some good points, computers at that time weren’t that useful for the average John writer that just wanted to write, it was indeed probably just easier to use paper and pen	b97551b88790b9329eb960f76c76a97828b29070	True	False					0	1653179732		0	{}	i9idr9q	False	t3_uutkb6	False	True	t3_uutkb6	/r/ethereum/comments/uutkb6/why_i_am_not_going_to_buy_a_computer_wendell/i9idr9q/	1653179746	1	False	True	False	ethereum	t5_2zf9m	r/ethereum	public		0	[]												
252	[]	False		Cryptomaniacuk			[]				text	t2_r31pph7	False	False	Either snoop dog is selling apes for $20 or this leads to scam wallets	b9d316f2133937b7743089d0c057911cafe47d9e	True	False					0	1653179726		0	{}	i9idqxe	False	t3_uuz029	False	True	t3_uuz029	/r/ethereum/comments/uuz029/view_nft_wallets_of_famous_people_and_brands/i9idqxe/	1653179738	1	False	True	False	ethereum	t5_2zf9m	r/ethereum	public		0	[]												
253	[]	False		Fantastic-Ad548			[]				text	t2_b0fx13pj	False	False	Cool, thanks for the info	5d606767e90e6ee80e60a711a1a0b9034bc2fcd9	True	False					0	1653179281		0	{}	i9icxnu	False	t3_uuxv0b	False	True	t1_i9icucl	/r/ethereum/comments/uuxv0b/nice_fees/i9icxnu/	1653179299	1	False	True	False	ethereum	t5_2zf9m	r/ethereum	public		0	[]												
254	[]	False		abu_alkindi			[]				text	t2_ft2tjtp1	False	False	This should be the top comment.	19907e999352cf7466622ae95474cb3516be97aa	True	False					0	1653179240		0	{}	i9icv01	False	t3_uuyv1i	False	True	t1_i9i9ssv	/r/ethereum/comments/uuyv1i/really_excited_about_the_merge_but_im_even_more/i9icv01/	1653179254	1	False	True	False	ethereum	t5_2zf9m	r/ethereum	public		0	[]												
255	[]	False		AESTHTK			[]				text	t2_10fwavem	False	False	"Metis is a fork of Optimism.

I believe they’re using an off-chain data model at the moment - so it’s a validium rather than a roll-up, but this makes it cheap."	0a8407be8e6f42d97bafb74cff79a118981e9f54	True	False					0	1653179230		0	{}	i9icucl	False	t3_uuxv0b	False	True	t1_i9ibzge	/r/ethereum/comments/uuxv0b/nice_fees/i9icucl/	1653179247	1	False	True	False	ethereum	t5_2zf9m	r/ethereum	public		0	[]												
256	[]	False		AESTHTK			[]				text	t2_10fwavem	False	False	"Just for clarity:

The “ETH 2.0” roadmap and computational sharding were dropped a few years ago in favour of a roll-up centric approach to scaling.

Sharding here refers to data availability sharding also know as danksharding.

Shanghai is the next release after Bellatrix and is hoping to include the first step here known as “proto danksharding” (EIP-4844) named after its investors.

Bankless did a great interview with Dankrad, Vitalik and Protolambda last week where they covered it in detail. Hopefully they release it soon."	62a3aa8321be96ea5af82863c738b77a3a7a9692	True	False					0	1653178912		0	{}	i9ic9hk	False	t3_uuyv1i	False	True	t3_uuyv1i	/r/ethereum/comments/uuyv1i/really_excited_about_the_merge_but_im_even_more/i9ic9hk/	1653178929	1	False	True	False	ethereum	t5_2zf9m	r/ethereum	public		0	[]												
257	[]	False		Fantastic-Ad548			[]				text	t2_b0fx13pj	False	False	Is Metis a new L2 ?	b323a7df891179da513b6e407aa464cebc123c46	True	False					0	1653178765		0	{}	i9ibzge	False	t3_uuxv0b	False	True	t3_uuxv0b	/r/ethereum/comments/uuxv0b/nice_fees/i9ibzge/	1653178777	1	False	True	False	ethereum	t5_2zf9m	r/ethereum	public		0	[]												
258	[]	False		Own-Tumbleweed6337			[]				text	t2_9jrg60si	False	False	Am I the only one guessing this won't happen for some time lol	ae0d219b6f67a3fc88c24db7463b889c43d1dd2c	True	False					0	1653178562		0	{}	i9ibm9p	False	t3_uuc59y	False	True	t3_uuc59y	/r/ethereum/comments/uuc59y/ethereum_20_the_official_merge_of_blockchains/i9ibm9p/	1653178572	1	False	True	False	ethereum	t5_2zf9m	r/ethereum	public		0	[]												
259	[]	False		[deleted]						dark					[removed]	fe993932d6dced4c0a879e9aa5d7a6e0fbb467f5	True	False					0	1653178328		0	{}	i9ib743	False	t3_uuyv1i	False	True	t3_uuyv1i	/r/ethereum/comments/uuyv1i/really_excited_about_the_merge_but_im_even_more/i9ib743/	1653178345	1	False	True	False	ethereum	t5_2zf9m	r/ethereum	public		0	[]												
260	[]	False		AESTHTK			[]				text	t2_10fwavem	False	False	Actually it’s not, we’re still looking at EIP4844 to be included in Shanghai - the next release after Bellatrix (The Merge).	bee58e66a050848b409ca5b36a97d352c1072c3b	True	False					0	1653178304		0	{}	i9ib5hl	False	t3_uts8xx	False	True	t1_i9gl7ge	/r/ethereum/comments/uts8xx/ethereum_devs_tip_the_merge_will_occur_in_august/i9ib5hl/	1653178316	1	False	True	False	ethereum	t5_2zf9m	r/ethereum	public		0	[]												
261	[]	False		interweaver			[]				text	t2_28j2kkcx	False	True	Basically everything takes place in the daily discussion thread. If you read every post there for a while, guaranteed you will come away knowing more about Ethereum and DeFi.	4a1b1aa27fdfb7cb83cc287376be229c98a68824	True	False					0	1653178274		0	{}	i9ib3gx	False	t3_uts8xx	False	True	t1_i9goikd	/r/ethereum/comments/uts8xx/ethereum_devs_tip_the_merge_will_occur_in_august/i9ib3gx/	1653178287	1	False	True	False	ethereum	t5_2zf9m	r/ethereum	public		0	[]												
262	[]	False		BlazingHotFireFox			[]				text	t2_gcys21hq	False	False	"The reason people buy them is because of the utility not the artwork. 

Of course there is also a lot of people who buy it to flip it for a profit."	a80a597c26b3163aef1679271e29f87cd32cc60a	True	False					0	1653178205		0	{}	i9iayz2	True	t3_uurd4l	False	True	t1_i9hjc18	/r/ethereum/comments/uurd4l/gary_vee_kicks_off_veecon_summer_camp_to_show/i9iayz2/	1653178223	1	False	True	False	ethereum	t5_2zf9m	r/ethereum	public		0	[]												
263	[]	False		marcuspohl			[]				text	t2_12t57o	False	False	It’s true, sharding will be a great benefit, but L2 scaling helps until then. POS gives another really good differentiator against Bitcoin though with environmental impact.	ad437dae918c3eb477e724eea58516c725bdb684	True	False					0	1653178084		0	{}	i9iar42	False	t3_uuyv1i	False	True	t3_uuyv1i	/r/ethereum/comments/uuyv1i/really_excited_about_the_merge_but_im_even_more/i9iar42/	1653178100	1	False	True	False	ethereum	t5_2zf9m	r/ethereum	public		0	[]												
264	[]	False		ELCNYTROID			[]				text	t2_8lm9kgil	False	False	Ways to diversify your expenses	5a8f332931e12324d16512c64606833326871f08	True	False					0	1653177829		0	{}	i9iaaac	False	t3_uutkb6	False	True	t1_i9hihom	/r/ethereum/comments/uutkb6/why_i_am_not_going_to_buy_a_computer_wendell/i9iaaac/	1653177841	1	False	True	False	ethereum	t5_2zf9m	r/ethereum	public		0	[]												
265	[]	False		echofish			[]				text	t2_494fu	False	False	Most of these are taking the low cost on their own bill, or rather VCs bill.	b8fbdd49660a1d5d705a226da048c5240fa4840f	True	False					0	1653206423		0	{}	i9ji1m7	False	t3_uuxv0b	False	True	t3_uuxv0b	/r/ethereum/comments/uuxv0b/nice_fees/i9ji1m7/	1653206436	1	False	True	False	ethereum	t5_2zf9m	r/ethereum	public		0	[]												
266	[]	False		coinfeeds-bot			[]				text	t2_8ihxazi7	False	False	"tldr; The decentralized finance (DeFi) ecosystem has grown at an explosive rate, reaching a high of almost $200 billion in November 2021, rivaling the GDP of many nation-states and top corporations. Most of the growth of DeFi is due to the rise of decentralized oracles, which allow blockchains to access external data on their own. However, using centralized oracles could negate the advantages of having a smart contract, which raises significant privacy issues.

*This summary is auto generated by a bot and not meant to replace reading the original article. As always, DYOR.*"	275e0b76321d46fc72a8581f9a40d944c6b3a599	True	False					0	1653206413		0	{}	i9ji177	False	t3_uv60u6	False	True	t3_uv60u6	/r/ethereum/comments/uv60u6/the_rise_in_security_pitfalls_on_decentralized/i9ji177/	1653206424	1	False	True	False	ethereum	t5_2zf9m	r/ethereum	public		0	[]												
267	[]	False		saddit42			[]				text	t2_kibwt	False	False	it's not even a validium. Validium is on chain zk validity proof without onchain data.	3ccda6a7da6793998af29afc8582a6259be3919b	True	False					0	1653206184		0	{}	i9jhsdb	False	t3_uuxv0b	False	True	t1_i9icucl	/r/ethereum/comments/uuxv0b/nice_fees/i9jhsdb/	1653206197	1	False	True	False	ethereum	t5_2zf9m	r/ethereum	public		0	[]												
268	[]	False		AESTHTK			[]				text	t2_10fwavem	False	False	"Correct.

Listen from 24:00 onwards: https://youtu.be/b1m_PTVxD-s"	0863e0546c57ca15c090908a24c8469adf2f9801	True	False					0	1653206031		0	{}	i9jhmcs	False	t3_uuyv1i	False	True	t1_i9j6gyp	/r/ethereum/comments/uuyv1i/really_excited_about_the_merge_but_im_even_more/i9jhmcs/	1653206044	1	False	True	False	ethereum	t5_2zf9m	r/ethereum	public		0	[]												
269	[]	False		davidw_-			[]				text	t2_6vu6vx	False	False	"Can someone summarize the convo for those without headphones?

My guess is that he’s saying metamask is insecure because it blindy trusts responses from a server, and asking several nodes might be good enough"	47f42346dfe16d6244365e99d01f6decc64994e5	True	False					0	1653205999		0	{}	i9jhl30	False	t3_uum7kc	False	True	t3_uum7kc	/r/ethereum/comments/uum7kc/vitalik_encourages_ethereum_devs_to_build/i9jhl30/	1653206030	1	False	True	False	ethereum	t5_2zf9m	r/ethereum	public		0	[]												
270	[]	False		AESTHTK			[]				text	t2_10fwavem	False	False	"No, Layer 2s will handle execution and Layer 1 will become a security/settlement chain with enshrined Data Availability.

Sharding in this context refers to sync committees and data availability sampling.

Listen from about 24:00 onwards. https://youtu.be/b1m_PTVxD-s

What you’re referring to was actually adopted by NEAR - that’s probably the most true to intent realisation of the original “Ethereum 2.0” architecture."	41b41e57f69b471ad46826978164c8f98a9b0d71	True	False					0	1653205962		0	{}	i9jhjmj	False	t3_uuyv1i	False	True	t1_i9jf4sd	/r/ethereum/comments/uuyv1i/really_excited_about_the_merge_but_im_even_more/i9jhjmj/	1653205977	1	False	True	False	ethereum	t5_2zf9m	r/ethereum	public		0	[]												
271	[]	False		ThunderTM			[]				text	t2_npywfz	False	False	"So how do I do those cheap swaps?  
Don't I need to bridge them over in first place?"	f4ea8d36fadc4233d301feb65b97c59621a5bd46	True	False					0	1653205882		0	{}	i9jhgfo	False	t3_uuxv0b	False	True	t3_uuxv0b	/r/ethereum/comments/uuxv0b/nice_fees/i9jhgfo/	1653205897	1	False	True	False	ethereum	t5_2zf9m	r/ethereum	public		0	[]												
272	[]	False		likesexonlycheaper			[]				text	t2_396fzhwx	False	False	They had to have know when they came up with the name right? They knew, they for sure knew	5041e2fcc87990ca8f10cb810698c8fae05c142e	True	False					0	1653205824		0	{}	i9jhe24	False	t3_uuyv1i	False	True	t3_uuyv1i	/r/ethereum/comments/uuyv1i/really_excited_about_the_merge_but_im_even_more/i9jhe24/	1653205835	1	False	True	False	ethereum	t5_2zf9m	r/ethereum	public		0	[]												
273	[]	False		makito_burgerito			[]				text	t2_cihlv30p	False	False	NFT's without utility behind is not a thing anymore	5d45b8129e091cf1dc9a9e42d820580443ebe062	True	False					0	1653205619		0	{}	i9jh5sc	False	t3_uv5i42	False	True	t3_uv5i42	/r/ethereum/comments/uv5i42/027_eth_11_nft_3d_model_glb_all_details_are/i9jh5sc/	1653205633	1	False	True	False	ethereum	t5_2zf9m	r/ethereum	public		0	[]												
274	[]	False		[deleted]						dark					[removed]	fe993932d6dced4c0a879e9aa5d7a6e0fbb467f5	True	False					0	1653205080		0	{}	i9jgk1l	False	t3_uv3xj7	False	True	t1_i9j6h0r	/r/ethereum/comments/uv3xj7/floyd_mayweather_nft_tickets/i9jgk1l/	1653205098	1	False	True	False	ethereum	t5_2zf9m	r/ethereum	public		0	[]												
275	[]	False		_ArtosisCurse_			[]				text	t2_jnr65	False	False	like 50% of the time i see some one explaining interessting stuff on eth its you. you really know your stuff, thank you man	db7a1d36fd4796564c1d3e4a4ca5881c199ad046	True	False					0	1653205004		0	{}	i9jgh38	False	t3_uuxv0b	False	False	t1_i9icucl	/r/ethereum/comments/uuxv0b/nice_fees/i9jgh38/	1653205017	1	False	True	False	ethereum	t5_2zf9m	r/ethereum	public		0	[]												
276	[]	False		xPurrpX			[]				text	t2_717e30wp	False	False	So basically the chain will function the same as today but with 99% less power consumption?	23e70fc61449d92570e3ef054b21786be3941884	True	False					0	1653204691		0	{}	i9jg479	False	t3_uuxv0b	False	True	t1_i9j7mpe	/r/ethereum/comments/uuxv0b/nice_fees/i9jg479/	1653204705	1	False	True	False	ethereum	t5_2zf9m	r/ethereum	public		0	[]												
277	[]	False		-spooky_ghost			[]				text	t2_j52uzagh	False	False	Ahhh ok fair enough tried running a Windows VM and doing it through that?	ab3ca543f7562f2e09d15cafc9a16291281fd1c8	True	False					0	1653204536		0	{}	i9jfxr1	False	t3_uui29q	False	True	t1_i9jbyva	/r/ethereum/comments/uui29q/arent_cold_wallets_pointless/i9jfxr1/	1653204550	1	False	True	False	ethereum	t5_2zf9m	r/ethereum	public		0	[]												
278	[]	False		xPurrpX			[]				text	t2_717e30wp	False	False	"I guess the first step is to figure out what to do, then find a way to do it, do the paperwork, maybe hire people if I need bigger scales, and god knows what next.

This all sounds complicated, where can I learn about all of this?"	bd0d0d960a8cd075cb1829522cddaaa48eaea8fa	True	False					0	1653204468		0	{}	i9jfuxm	False	t3_uuq0ev	False	True	t1_i9hk19z	/r/ethereum/comments/uuq0ev/my_small_business_now_accepts_ethereum_other/i9jfuxm/	1653204482	1	False	True	False	ethereum	t5_2zf9m	r/ethereum	public		0	[]												
279	[]	False		[deleted]						dark					[removed]	fe993932d6dced4c0a879e9aa5d7a6e0fbb467f5	True	False					0	1653204349		0	{}	i9jfq22	False	t3_uuxv0b	False	True	t3_uuxv0b	/r/ethereum/comments/uuxv0b/nice_fees/i9jfq22/	1653204363	1	False	True	False	ethereum	t5_2zf9m	r/ethereum	public		0	[]												
280	[]	False		xPurrpX			[]				text	t2_717e30wp	False	False	"Finally!

I was making myself sad yesterday by browsing some nft's on OpenSea, and seeing all of these being generated automatically with different clothes and stuff. I already knew this, but psychologically I only came to understand the scale when I saw them lined up together, collection after collection, sold as ""unique"" items.

One cool use I see would be custom festival tickets for example, as it doesn't really cost that much more to the organizers of events to make these instead of paper ones, and it adds some uniqueness to them.

The problem I see in this system is that the bandwidth is shared between all actions on the blockchain, be it an important eth transaction or a monkey jpeg. Imo there should be different ""lanes"" for applications of different domains, like one lane for finance, one for nfts, and so on.

That being said, I am also surprised by how low the fees are."	600547ad5d8c5ef40ef38868bbaec0c8ae74ae9a	True	False					0	1653204314		0	{}	i9jfomo	False	t3_uuxv0b	False	True	t1_i9j3992	/r/ethereum/comments/uuxv0b/nice_fees/i9jfomo/	1653204328	1	False	True	False	ethereum	t5_2zf9m	r/ethereum	public		0	[]												
281	[]	False		NimChimspky			[]				text	t2_la9uz	False	False	"The only way to trace is matching time of transactions and amounts. Personally I think that is ridiculous, and makes it untraceable people saying otherwise I just don't understand.   

If I wanted privacy I would have no issue using it."	691df502a7a87c794766926c73ceb5ebdbbd51de	True	False					0	1653204129		0	{}	i9jfh6f	False	t3_uury49	False	True	t3_uury49	/r/ethereum/comments/uury49/viability_of_tornado_cash/i9jfh6f/	1653204145	1	False	True	False	ethereum	t5_2zf9m	r/ethereum	public		0	[]												
282	[]	False		Reddit5678912			[]				text	t2_xi4b1	False	False	Except computers weren’t pyramid schemes. Computers offered services and had use cases to the commoners. You didn’t buy computers just to eventually sell it for a profit to the next gullible schmuck.	de141385a693c79be74b59b2d05e22b01ff9408c	True	False					0	1653204098		0	{}	i9jffwh	False	t3_uutkb6	False	True	t3_uutkb6	/r/ethereum/comments/uutkb6/why_i_am_not_going_to_buy_a_computer_wendell/i9jffwh/	1653204111	1	False	True	False	ethereum	t5_2zf9m	r/ethereum	public		0	[]												
283	[]	False		Any-Masterpiece6708			[]				text	t2_b0fort9f	False	False	Ok. What	f66575f3b7909cac38a9ca707fd06b0407ab4341	True	False					0	1653204069		0	{}	i9jfepc	False	t3_uv5i42	False	True	t3_uv5i42	/r/ethereum/comments/uv5i42/027_eth_11_nft_3d_model_glb_all_details_are/i9jfepc/	1653204083	1	False	True	False	ethereum	t5_2zf9m	r/ethereum	public		0	[]												
284	[]	False		FucksWithCats2105			[]				text	t2_c21fsrkg	False	False	How did people watch porn on a typewriter? They sound useless to me.	8ce011334fdf3c0dd02c25f1f7dfca4f9c018b70	True	False					0	1653204041		0	{}	i9jfdfr	False	t3_uutkb6	False	True	t1_i9i0m26	/r/ethereum/comments/uutkb6/why_i_am_not_going_to_buy_a_computer_wendell/i9jfdfr/	1653204055	1	False	True	False	ethereum	t5_2zf9m	r/ethereum	public		0	[]												
285	[]	False		toec			[]				text	t2_85dmo	False	False	Swapping tokens uses liquidity pools and liquidity providers need to get paid.	cb6931c9c8289baa7f323d14a6a1777f378df08b	True	False					0	1653204041		0	{}	i9jfdfl	False	t3_uuxv0b	False	True	t1_i9ipvmu	/r/ethereum/comments/uuxv0b/nice_fees/i9jfdfl/	1653204055	1	False	True	False	ethereum	t5_2zf9m	r/ethereum	public		0	[]												
286	[]	False		jarfil			[]				text	t2_5mzr6	False	False	I'd rather write on a computer from 1987 than on a typewriter, for a simple reason: you can't edit text on a typewriter.	2481829d15a15ddca23d132c1a8a141f71ea4e66	True	False					0	1653203915		0	{}	i9jf7vn	False	t3_uutkb6	False	True	t1_i9i314p	/r/ethereum/comments/uutkb6/why_i_am_not_going_to_buy_a_computer_wendell/i9jf7vn/	1653203925	1	False	True	False	ethereum	t5_2zf9m	r/ethereum	public		0	[]												
287	[]	False		Simple_Yam			[]				text	t2_62brrad7	False	False	What do you mean, execution sharding is not on the roadmap anymore? I thought it will be still done but data sharding has a higher priority.	6346534a398509ae69e627d3a601b7e9e6c3b6c9	True	False					0	1653203839		0	{}	i9jf4sd	False	t3_uuyv1i	False	True	t1_i9ic9hk	/r/ethereum/comments/uuyv1i/really_excited_about_the_merge_but_im_even_more/i9jf4sd/	1653203851	1	False	True	False	ethereum	t5_2zf9m	r/ethereum	public		0	[]												
288	[]	False		nabetse7deuce			[]				text	t2_8b7iopgk	False	False	You are a troll, but if you really think so go live in Haiti	5ba676646bf7edcef76c9e85783045c0ba349f57	True	False					0	1653203738		0	{}	i9jf0n2	False	t3_uutkb6	False	True	t1_i9igf9v	/r/ethereum/comments/uutkb6/why_i_am_not_going_to_buy_a_computer_wendell/i9jf0n2/	1653203750	1	False	True	False	ethereum	t5_2zf9m	r/ethereum	public		0	[]												
289	[]	False		Longjumping-Quiet-77			[]				text	t2_79si9pld	False	False	Less traffic	ecba85bef4037d18da7c7e7a3debb0eb47ae57a4	True	False					0	1653203700		0	{}	i9jez22	False	t3_uuxv0b	False	True	t1_i9jdlmt	/r/ethereum/comments/uuxv0b/nice_fees/i9jez22/	1653203715	1	False	True	False	ethereum	t5_2zf9m	r/ethereum	public		0	[]												
290	[]	False		jarfil			[]				text	t2_5mzr6	False	False	Well, people still use sticks and stones... but computers seem likely to become photonic-based instead of electricity-based. That light might still come from an electric source, but also might not, like maybe a bioluminescent source.	aed0c15c303da6110f3ee2e27d616d28f32dd750	True	False					0	1653203548		0	{}	i9jessj	False	t3_uutkb6	False	False	t1_i9j01kb	/r/ethereum/comments/uutkb6/why_i_am_not_going_to_buy_a_computer_wendell/i9jessj/	1653203564	1	False	True	False	ethereum	t5_2zf9m	r/ethereum	public		0	[]												
291	[]	False		bestfriendfraser			[]				text	t2_cke5yg8c	False	False	Looks bad	6cee20bf03034d5d94c5993e56ac38f43be3b317	True	False					0	1653203328		0	{}	i9jejpe	False	t3_uv5i42	False	True	t3_uv5i42	/r/ethereum/comments/uv5i42/027_eth_11_nft_3d_model_glb_all_details_are/i9jejpe/	1653203340	1	False	True	False	ethereum	t5_2zf9m	r/ethereum	public		0	[]												
292	[]	False		jarfil			[]				text	t2_5mzr6	False	False	It is already. Some years ago I tried to remember what did I use to do all day without Internet, Google, or Wikipedia... and I can't really remember.	3913ee315d947658624f8c3de9fd054b57529b86	True	False					0	1653203129		0	{}	i9jebn0	False	t3_uutkb6	False	True	t1_i9j8um6	/r/ethereum/comments/uutkb6/why_i_am_not_going_to_buy_a_computer_wendell/i9jebn0/	1653203147	1	False	True	False	ethereum	t5_2zf9m	r/ethereum	public		0	[]												
293	[]	False		Skretch12			[]				text	t2_dfnwp	False	False	ZKsync all the way!! MIT license, high focus on decentralization and security, their upgrade methodology :O, their delayed upgrades with test nets with real assets that you are allowed to steal if you can exploit the protocol to get to them. The industry should really look at Matter Labs and learn from them.	827344a856124b80621af323c5f68826f49818a6	True	False					0	1653202974		0	{}	i9je531	False	t3_uuxv0b	False	True	t1_i9iouh4	/r/ethereum/comments/uuxv0b/nice_fees/i9je531/	1653202991	1	False	True	False	ethereum	t5_2zf9m	r/ethereum	public		0	[]												
294	[]	False		feketegy			[]				text	t2_1cp15	False	False	You gotta draw that hypocrisy line somewhere. He did it at paper and pen.	55a52475c6dd9c4f17d42d40e2c407bce5cf5024	True	False					0	1653202713		0	{}	i9jdu3d	False	t3_uutkb6	False	True	t1_i9hp9rg	/r/ethereum/comments/uutkb6/why_i_am_not_going_to_buy_a_computer_wendell/i9jdu3d/	1653202727	1	False	True	False	ethereum	t5_2zf9m	r/ethereum	public		0	[]												
295	[]	False		Longjumping-Basket62			[]				text	t2_9ped7c1r	False	False	I don't know what 'network effects' he's referring to, but regarding algorithmic complexity (in theta and big-O notation), logarithmic complexity is an ideal goal for any algorithm (they take less time) whereas quadratic complexity can render many types of algorithms unusable because the time they take to run makes them impractical.	0e799421b6434abe8f4c71cb9639940e1b1fd080	True	False					0	1653202696		0	{}	i9jdth3	False	t3_uupkkd	False	False	t3_uupkkd	/r/ethereum/comments/uupkkd/in_defense_of_maximalism/i9jdth3/	1653202707	1	False	True	False	ethereum	t5_2zf9m	r/ethereum	public		0	[]												
296	[]	False		ShowerWide7800			[]				text	t2_9zwij971	False	False	If all of these other networks had anywhere near the volume of eth, the fees would not be like that. High gas fees is a feature of a secure and high network traffic, not a bug.	d15b8158fbe40ce396b9e8213096597a4c550b3a	True	False					0	1653202674		0	{}	i9jdsjs	False	t3_uuxv0b	False	True	t3_uuxv0b	/r/ethereum/comments/uuxv0b/nice_fees/i9jdsjs/	1653202687	1	False	True	False	ethereum	t5_2zf9m	r/ethereum	public		0	[]												
297	[]	False		Valandomar			[]				text	t2_9s2s5w35	False	False	Sorry I’m kinda new but how did that happen? I thought fees are more than that?	0120663318b918a4aea33a477006f959190050a2	True	False					0	1653202506		0	{}	i9jdlmt	False	t3_uuxv0b	False	False	t3_uuxv0b	/r/ethereum/comments/uuxv0b/nice_fees/i9jdlmt/	1653202519	1	False	True	False	ethereum	t5_2zf9m	r/ethereum	public		0	[]												
298	[]	False		PNW-Mastermind			[]				text	t2_855tagls	False	False	It’s the calm before the Volatility storm 😬	3145a2678055b5d6b61f893c8d454f31ec6b0d3b	True	False					0	1653202360		0	{}	i9jdfrc	False	t3_uuxv0b	False	True	t1_i9iu4hg	/r/ethereum/comments/uuxv0b/nice_fees/i9jdfrc/	1653202377	1	False	True	False	ethereum	t5_2zf9m	r/ethereum	public		0	[]												
299	[]	False		ThaCowboy			[]				text	t2_162xkd	False	False	I’ve refreshed data numerous of times. There’s no option to enter the name manually. Just wanna add my own image to it , if possible	8ff16d2fa3e76e203b181bd5a78b3a8ae4652893	True	False					0	1653201597		0	{}	i9jcjxl	True	t3_uv57ua	False	True	t3_uv57ua	/r/ethereum/comments/uv57ua/how_to_change_content_not_available_yet_image/i9jcjxl/	1653201608	1	False	True	False	ethereum	t5_2zf9m	r/ethereum	public		0	[]												
