Unnamed: 0	all_awardings	archived	associated_award	author	author_flair_background_color	author_flair_css_class	author_flair_richtext	author_flair_template_id	author_flair_text	author_flair_text_color	author_flair_type	author_fullname	author_patreon_flair	author_premium	body	body_sha1	can_gild	collapsed	collapsed_because_crowd_control	collapsed_reason	collapsed_reason_code	comment_type	controversiality	created_utc	distinguished	gilded	gildings	id	is_submitter	link_id	locked	no_follow	parent_id	permalink	retrieved_utc	score	score_hidden	send_replies	stickied	subreddit	subreddit_id	subreddit_name_prefixed	subreddit_type	top_awarded_type	total_awards_received	treatment_tags	unrepliable_reason	author_cakeday	corpus	support	knowledge	conflict	power	similarity	fun	status	trust	identity	romance
114	[]	False		Ghost156915			[]				text	t2_655wyrxq	False	False	Lol and with all the YouTubers calling for a drop because of mt. Gox I was really expecting to see it pump for the next few days instead lol	ff69860919d3717e4b5c349db4bd918ad33ab171	True	False					0	1663556252		0	{}	ip0ms0f	False	t3_xh7lah	False	True	t1_ip0mj4b	/r/Bitcoin/comments/xh7lah/daily_discussion_september_18_2022/ip0ms0f/	1663556264	1	True	True	False	Bitcoin	t5_2s3qj	r/Bitcoin	public		0	[]													
115	[]	False		[deleted]						dark					[removed]	fe993932d6dced4c0a879e9aa5d7a6e0fbb467f5	True	False					0	1663556249		0	{}	ip0mrqd	False	t3_xhok5k	False	True	t1_ip0fer0	/r/Bitcoin/comments/xhok5k/for_those_who_blame_btc_for_energy_consumption/ip0mrqd/	1663556264	1	True	True	False	Bitcoin	t5_2s3qj	r/Bitcoin	public		0	[]													
116	[]	False		Remarkable-Host405			[]				text	t2_7yaa4ft0	False	False	It's a British thermal unit, or the energy needed to raise 1 pound of water by one degree Fahrenheit. That's the intrinsic value of a dollar.	b4ba28fbf3843ac1cb7053376e358100ef089689	True	False					0	1663556180		0	{}	ip0mmie	False	t3_xhxi23	False	True	t1_ip0md7s	/r/Bitcoin/comments/xhxi23/every_cfp_that_parrots_this_gets_a_cracker/ip0mmie/	1663556192	1	True	True	False	Bitcoin	t5_2s3qj	r/Bitcoin	public		0	[]													
117	[]	False		Dont_Waver			[]			dark	text	t2_59d337sz	False	False	Oh. That's kind of ... sad. Do you need someone to talk to? How's everything going in your life?	d6011319b874cd57c8644cdca55f5b3f3e733edf	True	False					0	1663556158		0	{}	ip0mksl	False	t3_x1a9mk	False	True	t1_ip09aan	/r/Bitcoin/comments/x1a9mk/daily_discussion_august_30_2022/ip0mksl/	1663556177	1	True	True	False	Bitcoin	t5_2s3qj	r/Bitcoin	public		0	[]													
118	[]	False		HurricaneHarvey7			[]				text	t2_brc73fg	False	False	The buttcoiners have crawled out of their caves	cae16c512dcc22ac9aa43c542b73b6764d4ca7af	True	False					0	1663556137		0	{}	ip0mj4b	False	t3_xh7lah	False	True	t3_xh7lah	/r/Bitcoin/comments/xh7lah/daily_discussion_september_18_2022/ip0mj4b/	1663556154	1	True	True	False	Bitcoin	t5_2s3qj	r/Bitcoin	public		0	[]													
119	[]	False		aScarfAtTutties		noob	[{'e': 'text', 't': 'redditor for 3 months'}]	2ec8e69e-6c36-11e9-a04b-0afb553d4ea6	redditor for 3 months	dark	richtext	t2_ouegutp3	False	False	The Bogdanoffs have risen from the grave, and are voting republican.	36a5624ae81b46f499dee5e5e8250e951f66386a	True	False					0	1663556113		0	{}	ip0mh9n	False	t3_xh7lah	False	True	t1_ip0jdxe	/r/Bitcoin/comments/xh7lah/daily_discussion_september_18_2022/ip0mh9n/	1663556130	1	True	True	False	Bitcoin	t5_2s3qj	r/Bitcoin	public		0	[]													
120	[]	False		Policy_Purple			[]			dark	text	t2_8fgbz4x3	False	False	the threat of martial law is much more powerful than martial law itself. Once martial law is implemented they have already lost the future.	60538bc7d940a32cf48a7aa39078fb3f9efe308b	True	False					0	1663556105		0	{}	ip0mgkz	False	t3_xgng8w	False	True	t1_iowy3dp	/r/Bitcoin/comments/xgng8w/are_europeans_just_going_to_roll_over_and_let/ip0mgkz/	1663556122	1	True	True	False	Bitcoin	t5_2s3qj	r/Bitcoin	public		0	[]													
121	[]	False		roliasedor			[]				text	t2_88qx8mbh	False	False	This aged well lol	65eebec1ae1f2c62b4450d427e449dc73521a96c	True	False					0	1663556086		0	{}	ip0mf4p	True	t3_xgtxk9	False	True	t1_ioyxz2a	/r/Bitcoin/comments/xgtxk9/a_woman_held_a_bank_in_lebanon_hostage_to_take/ip0mf4p/	1663556097	1	True	True	False	Bitcoin	t5_2s3qj	r/Bitcoin	public		0	[]													
122	[]	False		LTZ3			[]				text	t2_kmcaw	False	False	Bye bye bitcoin	1b0530eb871fd537d7a4d4ad386ff9a1ebc4ea90	True	False					0	1663556070		0	{}	ip0mdrr	False	t3_xh7lah	False	True	t3_xh7lah	/r/Bitcoin/comments/xh7lah/daily_discussion_september_18_2022/ip0mdrr/	1663556081	1	True	True	False	Bitcoin	t5_2s3qj	r/Bitcoin	public		0	[]													
123	[]	False		tigersharkwushen_			[]				text	t2_gf251	False	False	Do you know what a btu is?	9aae134b4a2072a09048ca4a225af14b094df7db	True	False					0	1663556063		0	{}	ip0md7s	False	t3_xhxi23	False	True	t1_ip0l5i6	/r/Bitcoin/comments/xhxi23/every_cfp_that_parrots_this_gets_a_cracker/ip0md7s/	1663556082	1	True	True	False	Bitcoin	t5_2s3qj	r/Bitcoin	public		0	[]													
124	[]	False		LTZ3			[]				text	t2_kmcaw	False	False	😂 delusional	e9e58645beefeabe57c41f60ff31f933006dbb96	True	False					0	1663556055		0	{}	ip0mcka	False	t3_xh7lah	False	True	t1_ip0jci3	/r/Bitcoin/comments/xh7lah/daily_discussion_september_18_2022/ip0mcka/	1663556065	1	True	True	False	Bitcoin	t5_2s3qj	r/Bitcoin	public		0	[]													
125	[]	False		smellyboi6969			[]				text	t2_54ftgfzr	False	False	"That is literally the meaning of intrinsic. The intrinsic value of a company is it's positive cash flow.

""The intrinsic value of a business (or any investment security) is the present value of all expected future cash flows, discounted at the appropriate discount rate. Unlike relative forms of valuation that look at comparable companies, intrinsic valuation looks only at the inherent value of a business on its own."""	6dcffbf263ec8da9f8234f5242889305586dd5af	True	False					0	1663556041		0	{}	ip0mbgh	False	t3_xhxi23	False	True	t1_ip0hgtf	/r/Bitcoin/comments/xhxi23/every_cfp_that_parrots_this_gets_a_cracker/ip0mbgh/	1663556058	1	True	True	False	Bitcoin	t5_2s3qj	r/Bitcoin	public		0	[]													
126	[]	False		LTZ3			[]				text	t2_kmcaw	False	False	lol bye bye fake internet money	d1e33f3207e24f18a7222afe30dbd6dbac7c8af0	True	False					0	1663556027		0	{}	ip0mac6	False	t3_xh7lah	False	True	t3_xh7lah	/r/Bitcoin/comments/xh7lah/daily_discussion_september_18_2022/ip0mac6/	1663556043	1	True	True	False	Bitcoin	t5_2s3qj	r/Bitcoin	public		0	[]													
127	[]	False		Policy_Purple			[]			dark	text	t2_8fgbz4x3	False	False	97% of the world is NPC so they do whatever they are told	618a38b6c1bcbea24722f36902d4fd52c532f12f	True	False					0	1663555998		0	{}	ip0m7xx	False	t3_xgng8w	False	True	t3_xgng8w	/r/Bitcoin/comments/xgng8w/are_europeans_just_going_to_roll_over_and_let/ip0m7xx/	1663556009	1	True	True	False	Bitcoin	t5_2s3qj	r/Bitcoin	public		0	[]													
128	[]	False		massa_chan			[]				text	t2_1wkjtir1	False	False	save to pay my house loan	d4625e3ef18d4cebc9c8e809f32e837184cffcb5	True	False					0	1663555970		0	{}	ip0m5od	False	t3_xhxb33	False	True	t3_xhxb33	/r/Bitcoin/comments/xhxb33/what_would_you_do_if_you_earned_1_bitcoin_now/ip0m5od/	1663555985	1	True	True	False	Bitcoin	t5_2s3qj	r/Bitcoin	public		0	[]													
129	[]	False		tigersharkwushen_			[]				text	t2_gf251	False	False	"&gt; ""The Venezuelan Bolívar's intrinsic value is literally its face value.""

&gt; ""The Zimbabwean dollar's intrinsic value is literally it's face value.""

They are.  The thing you don't seem to be getting is that the number on the Zimbabwean dollar does not represent the same number in the USD."	35bcac1889c7b83ccac6c2f8f2cee25a6552b47e	True	False					0	1663555938		0	{}	ip0m31z	False	t3_xhxi23	False	True	t1_ip0kt64	/r/Bitcoin/comments/xhxi23/every_cfp_that_parrots_this_gets_a_cracker/ip0m31z/	1663555953	1	True	True	False	Bitcoin	t5_2s3qj	r/Bitcoin	public		0	[]													
130	[]	False		satayasat			[]				text	t2_53dlg	False	False	I'll take some of that, thanks	4ce09e6c367e6247ca92debbc60c9adf4c2b1513	True	False					0	1663555933		0	{}	ip0m2oy	False	t3_xh7lah	False	True	t3_xh7lah	/r/Bitcoin/comments/xh7lah/daily_discussion_september_18_2022/ip0m2oy/	1663555945	1	True	True	False	Bitcoin	t5_2s3qj	r/Bitcoin	public		0	[]													
131	[]	False		smellyboi6969			[]				text	t2_54ftgfzr	False	False	Gold has a lot more intrinsic value than other metals. Proof is in the fact that literally every civilization, even those that had no contact to the modern world, value and desire gold. There's an instinct embedded in humans that gold is beautiful and valuable. If you showed gold and copper to a child most children would be more interested in the gold.	0cee5bdcdb79e91a5200cd69219c6c41d3db4cb5	True	False					0	1663555851		0	{}	ip0lvw2	False	t3_xhxi23	False	False	t1_ip099qt	/r/Bitcoin/comments/xhxi23/every_cfp_that_parrots_this_gets_a_cracker/ip0lvw2/	1663555867	1	True	True	False	Bitcoin	t5_2s3qj	r/Bitcoin	public		0	[]													
132	[]	False		WorkingLime			[]				text	t2_363xpnn	False	True	I wish i could as i know the volume traded there is much bigger. But Binance doesn't make public the stats	9b4776655f4871ea9e042ef9ff0aaa7477fe12ff	True	False					0	1663555836		0	{}	ip0luoh	True	t3_xhmkox	False	True	t1_ip0lpry	/r/Bitcoin/comments/xhmkox/32_btc_were_traded_last_week_in_venezuela/ip0luoh/	1663555851	1	True	True	False	Bitcoin	t5_2s3qj	r/Bitcoin	public		0	[]													
133	[]	False		excessCeramic			[]				text	t2_rgw0x	False	False	"Sure, but debt doesn’t really mean much, especially when the debtors are entirely dependent on its success.

No country can afford to drop the USD, period. That would destroy their economy. Not that they would want to, they make good money on that debt.

“Too big to fail” really is a thing. The USG will not let the banks fail. When the USG can no longer prevent that from happening, it means either (1) the global economy has collapsed or (2) the USG has collapsed (and either scenario probably means some sort of apocalyptic scenario)."	3a93381bc87c7d53066d18605f3f18b88ef8684e	True	False					0	1663555798		0	{}	ip0lrmf	False	t3_xgjz1d	False	True	t1_iozk9pi	/r/Bitcoin/comments/xgjz1d/does_anyone_still_believe_to_own_the_money_in/ip0lrmf/	1663555811	1	True	True	False	Bitcoin	t5_2s3qj	r/Bitcoin	public		0	[]													
134	[]	False		Magnus826			[]				text	t2_418e0blm	False	False	Ooh thank you! I hadn't heard of this. I still prefer Bitcoin but this is good backup. Appreciate it!	52dd893f7ebf338307d5d907fe3bf6291416afd9	True	False					0	1663555791		0	{}	ip0lr1n	True	t3_xhz8ej	False	True	t1_ip0ktv7	/r/Bitcoin/comments/xhz8ej/wishing_bitcoin_was_the_norm_buying_sarees_in/ip0lr1n/	1663555803	1	True	True	False	Bitcoin	t5_2s3qj	r/Bitcoin	public		0	[]													
135	[]	False		Rix0n3		noob	[{'e': 'text', 't': 'redditor for 3 months'}]	2ec8e69e-6c36-11e9-a04b-0afb553d4ea6	redditor for 3 months	dark	richtext	t2_ob9vj7i3	False	False	Where are you getting your predictions?	498e432e683995410a9033cfd35b7dc5a4f2e85c	True	False					0	1663555790		0	{}	ip0lqxx	False	t3_xhxb33	False	True	t1_ip0i1cm	/r/Bitcoin/comments/xhxb33/what_would_you_do_if_you_earned_1_bitcoin_now/ip0lqxx/	1663555803	1	True	True	False	Bitcoin	t5_2s3qj	r/Bitcoin	public		0	[]													
136	[]	False		[deleted]						dark					[removed]	fe993932d6dced4c0a879e9aa5d7a6e0fbb467f5	True	False					0	1663555787		0	{}	ip0lqre	False	t3_xh7lah	False	True	t3_xh7lah	/r/Bitcoin/comments/xh7lah/daily_discussion_september_18_2022/ip0lqre/	1663555803	1	True	True	False	Bitcoin	t5_2s3qj	r/Bitcoin	public		0	[]													
137	[]	False		Scholes_SC2			[]				text	t2_9vb9h	False	False	Can you do the same but with the binance p2p market?	c56ae3104523244c7190aeb31d6fd76610bde86e	True	False					0	1663555775		0	{}	ip0lpry	False	t3_xhmkox	False	True	t3_xhmkox	/r/Bitcoin/comments/xhmkox/32_btc_were_traded_last_week_in_venezuela/ip0lpry/	1663555788	1	True	True	False	Bitcoin	t5_2s3qj	r/Bitcoin	public		0	[]													
138	[]	False		Exit-Velocity			[]				text	t2_684m80bo	False	False	Right, a single basket. No bueno amigo.	40abc6df48d5667b577f4ccba8e816251a023da1	True	False					0	1663555770		0	{}	ip0lpg9	False	t3_xgmhm3	False	True	t1_ip0h3bx	/r/Bitcoin/comments/xgmhm3/stacking_sats_every_month_since_oct_2017_60_months/ip0lpg9/	1663555788	1	True	True	False	Bitcoin	t5_2s3qj	r/Bitcoin	public		0	[]													
139	[]	False		[deleted]						dark					[removed]	fe993932d6dced4c0a879e9aa5d7a6e0fbb467f5	True	False					0	1663555760		0	{}	ip0lomg	False	t3_xhm4tu	False	True	t3_xhm4tu	/r/Bitcoin/comments/xhm4tu/jordan_peterson_fascinated_by_bitcoin_mining/ip0lomg/	1663555772	1	True	True	False	Bitcoin	t5_2s3qj	r/Bitcoin	public		0	[]													
140	[]	False		xxadmxx			[]				text	t2_9gs8qssb	False	False	This man knows what it’s like	e3303c073ac71e7f692f718b281b3876b6eff843	True	False					0	1663555753		0	{}	ip0lo20	False	t3_xhxb33	False	True	t1_ip0fn3i	/r/Bitcoin/comments/xhxb33/what_would_you_do_if_you_earned_1_bitcoin_now/ip0lo20/	1663555765	1	True	True	False	Bitcoin	t5_2s3qj	r/Bitcoin	public		0	[]													
141	[]	False		xxadmxx			[]				text	t2_9gs8qssb	False	False	Confirmed	8cc7acb8f360901e81cab8460b63a515a6e9ce99	True	False					0	1663555686		0	{}	ip0lir2	False	t3_xhxb33	False	True	t1_ip0c63w	/r/Bitcoin/comments/xhxb33/what_would_you_do_if_you_earned_1_bitcoin_now/ip0lir2/	1663555702	1	True	True	False	Bitcoin	t5_2s3qj	r/Bitcoin	public		0	[]													
142	[]	False		CANUHODL			[]			dark	text	t2_cpiczth4	False	False	Imagine caring so much about people’s investments you don’t like you follow it so closely you post within min of a drop.	0e4a4618cce6edb1e7571548d8fa6434ad9f611b	True	False					0	1663555652		0	{}	ip0lg04	False	t3_xh7lah	False	True	t1_ip0koiw	/r/Bitcoin/comments/xh7lah/daily_discussion_september_18_2022/ip0lg04/	1663555670	1	True	True	False	Bitcoin	t5_2s3qj	r/Bitcoin	public		0	[]													
143	[]	False		[deleted]						dark					[removed]	fe993932d6dced4c0a879e9aa5d7a6e0fbb467f5	True	False					0	1663555589		0	{}	ip0lavg	False	t3_xhevrk	False	True	t1_ioyew71	/r/Bitcoin/comments/xhevrk/how_proofofwork_incentives_are_more_fair/ip0lavg/	1663555607	1	True	True	False	Bitcoin	t5_2s3qj	r/Bitcoin	public		0	[]													
144	[]	False		rkomzzzz			[]				text	t2_elivzg5r	False	False	those who are long term looking to make some serious fucking bank	f9ea5f894df648140d3d6129027b6c19f517c7e6	True	False					0	1663555558		0	{}	ip0l8de	False	t3_xh7lah	False	True	t1_ip0koiw	/r/Bitcoin/comments/xh7lah/daily_discussion_september_18_2022/ip0l8de/	1663555575	1	True	True	False	Bitcoin	t5_2s3qj	r/Bitcoin	public		0	[]													
145	[]	False		Remarkable-Host405			[]				text	t2_7yaa4ft0	False	False	Which is a few btus of heat	a0fff439885be22f0121d2b9e53165c7d605c946	True	False					0	1663555522		0	{}	ip0l5i6	False	t3_xhxi23	False	True	t1_ip0ihbl	/r/Bitcoin/comments/xhxi23/every_cfp_that_parrots_this_gets_a_cracker/ip0l5i6/	1663555535	1	True	True	False	Bitcoin	t5_2s3qj	r/Bitcoin	public		0	[]													
146	[]	False		BigBadAl			[]				text	t2_ftcu	False	True	"I fully understand how PoW and the Blockchain works, thanks. I've been involved with Bitcoin since 2010.

[Here's how Bitcoin has ruined the first country to adopt it as its currency.](https://www.bloomberg.com/news/articles/2022-06-15/el-salvador-s-big-bitcoin-gamble-backfires-to-deepen-debt-woes)

[Because nobody apart from Bitcoin tourists want to use it as a currency.](https://www.cnbc.com/2022/06/25/el-salvador-bitcoin-experiment-not-saving-countrys-finances.html)

Maybe you ought to read a bit more."	ab8ed2139d04d6f158c3396e696fb580c9a5aeea	True	False					0	1663555494		0	{}	ip0l36l	False	t3_xgkp0z	False	True	t1_ip0i2q8	/r/Bitcoin/comments/xgkp0z/til_that_a_division_of_greenpeace_took_a_5m_bribe/ip0l36l/	1663555513	1	True	True	False	Bitcoin	t5_2s3qj	r/Bitcoin	public		0	[]													
147	[]	False		Whatever3999086543			[]			dark	text	t2_bg17yavv	False	False	People who are smart and getting ready for the upcoming bull run.	7236f988e6cd39694e924d6781596019d34c6972	True	False					0	1663555492		0	{}	ip0l30u	False	t3_xh7lah	False	True	t1_ip0koiw	/r/Bitcoin/comments/xh7lah/daily_discussion_september_18_2022/ip0l30u/	1663555504	1	True	True	False	Bitcoin	t5_2s3qj	r/Bitcoin	public		0	[]													
148	[]	False		mikec20			[]				text	t2_4b6vt	False	False	What about those that promoted Netflix down 60% ytd	d86972a7d0bec328433c10b552236b0979f779fc	True	False					0	1663555475		0	{}	ip0l1qe	False	t3_xhoal4	False	True	t3_xhoal4	/r/Bitcoin/comments/xhoal4/celebrities_who_promoted_cryptocurrencies_remain/ip0l1qe/	1663555487	1	True	True	False	Bitcoin	t5_2s3qj	r/Bitcoin	public		0	[]													
149	[]	False		[deleted]						dark					[removed]	fe993932d6dced4c0a879e9aa5d7a6e0fbb467f5	True	False					0	1663555472		0	{}	ip0l1hw	False	t3_xhm4tu	False	True	t3_xhm4tu	/r/Bitcoin/comments/xhm4tu/jordan_peterson_fascinated_by_bitcoin_mining/ip0l1hw/	1663555488	1	True	True	False	Bitcoin	t5_2s3qj	r/Bitcoin	public		0	[]													
150	[]	False		YEEBUS_DELLEBUS			[]				text	t2_5dwb95op	False	False	Dear God I understand what he meant now good riddance society hello leaders of nwo I am here I am aware	7f12725a954b477a9585dcace31699def290dad7	True	False					0	1663555434		0	{}	ip0kybl	False	t3_xhtt55	False	True	t3_xhtt55	/r/Bitcoin/comments/xhtt55/bitcoin_is_a_parallel_society/ip0kybl/	1663555448	1	True	True	False	Bitcoin	t5_2s3qj	r/Bitcoin	public		0	[]													
151	[]	False		BrdEvans			[]				text	t2_a5p6grso	False	False	Have you looked into WorldRemit?	9b6cdcfd839ed393e49c1211ef94a51b8708f4ea	True	False					0	1663555380		0	{}	ip0ktv7	False	t3_xhz8ej	False	True	t3_xhz8ej	/r/Bitcoin/comments/xhz8ej/wishing_bitcoin_was_the_norm_buying_sarees_in/ip0ktv7/	1663555395	1	True	True	False	Bitcoin	t5_2s3qj	r/Bitcoin	public		0	[]													
152	[]	False		[deleted]						dark					[removed]	fe993932d6dced4c0a879e9aa5d7a6e0fbb467f5	True	False					0	1663555373		0	{}	ip0ktbl	False	t3_xhevrk	False	True	t1_ioxqr9r	/r/Bitcoin/comments/xhevrk/how_proofofwork_incentives_are_more_fair/ip0ktbl/	1663555388	1	True	True	False	Bitcoin	t5_2s3qj	r/Bitcoin	public		0	[]													
153	[]	False		TyrannicalTy2			[]				text	t2_7fe5cret	False	False	"""The Venezuelan Bolívar's intrinsic value is literally its face value.""

""The Zimbabwean dollar's intrinsic value is literally it's face value.""

If fiat currency has intrinsic value based on whatever number you print on it,  then we can create value by simply printing more! Poverty solved, everyone!"	9d30837a5526ffa3780024c298a66fa7312cfe26	True	False					0	1663555371		0	{}	ip0kt64	False	t3_xhxi23	False	True	t1_ip0ihbl	/r/Bitcoin/comments/xhxi23/every_cfp_that_parrots_this_gets_a_cracker/ip0kt64/	1663555388	1	True	True	False	Bitcoin	t5_2s3qj	r/Bitcoin	public		0	[]													
154	[]	False		Remarkable-Host405			[]				text	t2_7yaa4ft0	False	False	"Except all that equipment to print it.. each and every dollar...

Oh yeah, and the whole military, all of the resources and intelligence and citizens of the US"	becf2e2ab6f419dca1ecf73b1d120f6c5f71a406	True	False					0	1663555367		0	{}	ip0kstc	False	t3_xhxi23	False	True	t1_ip0h9ho	/r/Bitcoin/comments/xhxi23/every_cfp_that_parrots_this_gets_a_cracker/ip0kstc/	1663555380	1	True	True	False	Bitcoin	t5_2s3qj	r/Bitcoin	public		0	[]													
155	[]	False		PatrickHenryTax			[]			dark	text	t2_cnbynl20	False	False	I separately asked 2 roughly 60-70 year old financial planners what they thought of bitcoin. Both said it had no intrinsic value, referenced Warren Buffet, and said it was like tulip mania.	4f9ca25b69031afb06263396531dd57fe2b251c5	True	False					0	1663555361		0	{}	ip0ksco	True	t3_xhxi23	False	True	t3_xhxi23	/r/Bitcoin/comments/xhxi23/every_cfp_that_parrots_this_gets_a_cracker/ip0ksco/	1663555380	1	True	True	False	Bitcoin	t5_2s3qj	r/Bitcoin	public		0	[]													
156	[]	False		PatrickHenryTax			[]			dark	text	t2_cnbynl20	False	False	I separately asked 2 roughly 60-70 years old financial planners what they thought of bitcoin. Both said it had no intrinsic value, referenced Warren Buffet, and said it was like tulip mania.	86837ed769edc2ef35c2f9c1899b034a5f24cf48	True	False					0	1663555322		0	{}	ip0kpdh	True	t3_xhxi23	False	True	t3_xhxi23	/r/Bitcoin/comments/xhxi23/every_cfp_that_parrots_this_gets_a_cracker/ip0kpdh/	1663555334	1	True	True	False	Bitcoin	t5_2s3qj	r/Bitcoin	public		0	[]													
157	[]	False		Analyst_Simple			[]				text	t2_39eq70tm	False	False	Who in there right mind would buy an asset, trending down, that dumps 6-10% of it's value. Because it is Sunday?	34ed09cc75c1ba16d6e16515d7d82b42915e300a	True	False					0	1663555311		0	{}	ip0koiw	False	t3_xh7lah	False	True	t3_xh7lah	/r/Bitcoin/comments/xh7lah/daily_discussion_september_18_2022/ip0koiw/	1663555326	1	True	True	False	Bitcoin	t5_2s3qj	r/Bitcoin	public		0	[]													
158	[]	False		[deleted]						dark					[removed]	fe993932d6dced4c0a879e9aa5d7a6e0fbb467f5	True	False					0	1663555261		0	{}	ip0kkit	False	t3_xh7lah	False	True	t1_ioz6kk1	/r/Bitcoin/comments/xh7lah/daily_discussion_september_18_2022/ip0kkit/	1663555272	1	True	True	False	Bitcoin	t5_2s3qj	r/Bitcoin	public		0	[]													
159	[]	False		HurricaneHarvey7			[]				text	t2_brc73fg	False	False	Feels like 2015 and 2018 again. Just keep buying	c36ca3cf04130983c9eab09a906df84c2cab2c9b	True	False					0	1663555244		0	{}	ip0kj3s	False	t3_xh7lah	False	True	t3_xh7lah	/r/Bitcoin/comments/xh7lah/daily_discussion_september_18_2022/ip0kj3s/	1663555256	1	True	True	False	Bitcoin	t5_2s3qj	r/Bitcoin	public		0	[]													
160	[]	False		Jakeepood			[]				text	t2_adnqk25m	False	False	Not so easy, but it's easy for people to down vote your comment.	36708f87dc15ae1ec98d3177a67c1ad46edd42b0	True	False					0	1663555163		0	{}	ip0kcno	False	t3_xh7lah	False	True	t1_iow9by2	/r/Bitcoin/comments/xh7lah/daily_discussion_september_18_2022/ip0kcno/	1663555179	1	True	True	False	Bitcoin	t5_2s3qj	r/Bitcoin	public		0	[]													
161	[]	False		[deleted]						dark					[removed]	fe993932d6dced4c0a879e9aa5d7a6e0fbb467f5	True	False					0	1663555158		0	{}	ip0kc7r	False	t3_xh7lah	False	True	t1_ip0jdxe	/r/Bitcoin/comments/xh7lah/daily_discussion_september_18_2022/ip0kc7r/	1663555171	1	True	True	False	Bitcoin	t5_2s3qj	r/Bitcoin	public		0	[]													
162	[]	False		frumpydrangus			[]				text	t2_13kxvvwm	False	False	It appears that the price has lowered	282a6b5b457e0de6b00b6b3b468eddd8bcfe8f11	True	False					0	1663555083		0	{}	ip0k6am	False	t3_xh7lah	False	True	t1_ip0jpdw	/r/Bitcoin/comments/xh7lah/daily_discussion_september_18_2022/ip0k6am/	1663555098	1	True	True	False	Bitcoin	t5_2s3qj	r/Bitcoin	public		0	[]													
163	[]	False		skyvina			[]				text	t2_kcxh8hak	False	False	WHO DID THIS?	188802a66346b08bffabae61547f0e64f28d9718	True	False					0	1663555068		0	{}	ip0k53a	False	t3_xh7lah	False	True	t3_xh7lah	/r/Bitcoin/comments/xh7lah/daily_discussion_september_18_2022/ip0k53a/	1663555082	1	True	True	False	Bitcoin	t5_2s3qj	r/Bitcoin	public		0	[]													
164	[]	False		Pengu105			[]				text	t2_66tvtklz	False	False	Hold until 2024 at least which is the next BTC halving and then wait for a raging pump and then sell and buy real estate	a367cffa1ba3b682831c590051187bd10bd4abcc	True	False					0	1663555046		0	{}	ip0k3av	False	t3_xhxb33	False	True	t3_xhxb33	/r/Bitcoin/comments/xhxb33/what_would_you_do_if_you_earned_1_bitcoin_now/ip0k3av/	1663555059	1	True	True	False	Bitcoin	t5_2s3qj	r/Bitcoin	public		0	[]													
165	[]	False		III1IIIIIII1IIIIII1I			[]				text	t2_1280av	False	False	She’s got those headphones around her neck in nearly every photo. Are they for listening to music ever, or just a fashion accessory?	23dfd5b0e1acd415d1ca2d55c41c7171ae6a84d1	True	False					0	1663554968		0	{}	ip0jx81	False	t3_xhfej0	False	True	t3_xhfej0	/r/Bitcoin/comments/xhfej0/lina_seiche_creator_of_the_little_hodler/ip0jx81/	1663554981	1	True	True	False	Bitcoin	t5_2s3qj	r/Bitcoin	public		0	[]													
166	[]	False		OMG-WOW-GG			[]				text	t2_32zdaxoa	False	False	2 chicks at the same time.	2c1a55626b78478bc2e5ebd64af7588b463b99b8	True	False					0	1663554934		0	{}	ip0jufg	False	t3_xhxb33	False	True	t3_xhxb33	/r/Bitcoin/comments/xhxb33/what_would_you_do_if_you_earned_1_bitcoin_now/ip0jufg/	1663554949	1	True	True	False	Bitcoin	t5_2s3qj	r/Bitcoin	public		0	[]													
167	[]	False		Pleasant_Plantain			[]				text	t2_2jpvzn2g	False	False	oh fuck.... well since crypto sometimes precedes the st0nk market.... its gonna be an interesting week.....	60eef0ce292a7a26bbdf6bd01ab7f6ffe3fb5ce9	True	False					0	1663554930		0	{}	ip0ju1r	False	t3_xh7lah	False	True	t1_iozc07f	/r/Bitcoin/comments/xh7lah/daily_discussion_september_18_2022/ip0ju1r/	1663554940	1	True	True	False	Bitcoin	t5_2s3qj	r/Bitcoin	public		0	[]													
168	[]	False		Ghost156915			[]				text	t2_655wyrxq	False	False	I do miss the days that when you had little “dip” like this for no apparent reason it was quickly gobbled up by and brought back to the previous price. I just like to see some resistance, keep stacking sats!	9492826e3b014aa9ce3d49f296afdefefe615f31	True	False					0	1663554894		0	{}	ip0jr83	False	t3_xh7lah	False	True	t3_xh7lah	/r/Bitcoin/comments/xh7lah/daily_discussion_september_18_2022/ip0jr83/	1663554910	1	True	True	False	Bitcoin	t5_2s3qj	r/Bitcoin	public		0	[]													
169	[]	False		Film2021			[]			dark	text	t2_am8y6jd9	False	False	Whhhhaaatttt just happened?	0529704491c9b50778e91de593b42bf875640aa5	True	False					0	1663554870		0	{}	ip0jpdw	False	t3_xh7lah	False	True	t3_xh7lah	/r/Bitcoin/comments/xh7lah/daily_discussion_september_18_2022/ip0jpdw/	1663554887	1	True	True	False	Bitcoin	t5_2s3qj	r/Bitcoin	public		0	[]													
