Unnamed: 0	all_awardings	archived	associated_award	author	author_flair_background_color	author_flair_css_class	author_flair_template_id	author_flair_text	author_flair_text_color	body	body_sha1	can_gild	collapsed	collapsed_because_crowd_control	collapsed_reason	collapsed_reason_code	comment_type	controversiality	created_utc	distinguished	gilded	gildings	id	is_submitter	link_id	locked	no_follow	parent_id	permalink	retrieved_utc	score	score_hidden	send_replies	stickied	subreddit	subreddit_id	subreddit_name_prefixed	subreddit_type	top_awarded_type	total_awards_received	treatment_tags	unrepliable_reason	author_flair_richtext	author_flair_type	author_fullname	author_patreon_flair	author_premium	corpus	support	knowledge	conflict	power	similarity	fun	status	trust	identity	romance
0	[]	False		[deleted]					dark	[removed]	fe993932d6dced4c0a879e9aa5d7a6e0fbb467f5	True	False					0	1641023790		0.0	{}	hqsa4rq	False	t3_rewp12	False	True	t1_hobmh08	/r/ethereum/comments/rewp12/is_blockchaincom_a_scam/hqsa4rq/	1641023801.0	1.0	False	True	False	ethereum	t5_2zf9m	r/ethereum	public		0.0	[]							 removed 	0.46707504987716675	0.5148742198944092	0.5170193910598755	0.5029740929603577	0.4936113953590393	0.5123135447502136	0.45383262634277344	0.4847692549228668	0.4981911778450012	0.5145108103752136
1	[]	False		[deleted]					dark	[removed]	fe993932d6dced4c0a879e9aa5d7a6e0fbb467f5	True	False					0	1641023626		0.0	{}	hqs9xj9	False	t3_rmv7ac	False	True	t3_rmv7ac	/r/ethereum/comments/rmv7ac/web3d_decentralized_vs_web3c_centralized/hqs9xj9/	1641023643.0	1.0	False	True	False	ethereum	t5_2zf9m	r/ethereum	public		0.0	[]							 removed 	0.46707504987716675	0.5148742198944092	0.5170193910598755	0.5029740929603577	0.4936113953590393	0.5123135447502136	0.45383262634277344	0.4847692549228668	0.4981911778450012	0.5145108103752136
2	[]	False		ElectricalAd5612						"If you have the NFT you are the owner of that file.
If you won't to much it with an item in reality you nead an organization or a company that it will guarantee that
The one who buys the NFT will also  be the original photos Owner."	c731c06ed9af569d209549a73b868ff9d7dfd00f	True	False					0	1641023517		0.0	{}	hqs9sm3	False	t3_rswv5t	False	True	t3_rswv5t	/r/ethereum/comments/rswv5t/using_an_nft_for_vintage_photo_provenance/hqs9sm3/	1641023530.0	1.0	False	True	False	ethereum	t5_2zf9m	r/ethereum	public		0.0	[]		[]	text	t2_9aq88cpt	False	False	if you have the nft you are the owner of that file if you won t to much it with an item in reality you nead an organization or a company that it will guarantee that the one who buys the nft will also be the original photos owner 	0.004713434260338545	0.9868135452270508	0.20527517795562744	0.9308229684829712	0.01005915179848671	0.6577232480049133	0.09255968034267426	8.374522053600231e-07	0.37013009190559387	0.003720490960404277
3	[]	False		SirRuaro						"Amazing - thank you! I thought it might be the address from the Opensea profile 😂

Happy New Year!"	c16e3defc00f023624cb3d9571a0aa2a0404a761	True	False					0	1641023176		0.0	{}	hqs9cxl	False	t3_rphdgx	False	True	t1_hqs7xs5	/r/ethereum/comments/rphdgx/frequently_asked_questions_weekly_discussion/hqs9cxl/	1641023188.0	1.0	False	True	False	ethereum	t5_2zf9m	r/ethereum	public		0.0	[]		[]	text	t2_8ft5d	False	False	amazing thank you i thought it might be the address from the opensea profile happy new year 	0.7957464456558228	0.3255997896194458	0.015382224693894386	0.025852013379335403	0.4249148964881897	0.5030734539031982	0.9176680445671082	0.6384672522544861	0.3111845552921295	0.008415885269641876
4	[]	False		Fearless-Mushroom						"St. Brown is a premium desperation start.

Ie. players on COVID or IR or deep league"	c8e8503e20cf4f2b290046d872b46a3854a9d3db	True	False					0	1641023059		0.0	{}	hqs97k1	False	t3_rta3mg	False	True	t3_rta3mg	/r/ethereum/comments/rta3mg/eminem_buys_bored_ape_yacht_club_nft_for_450k_on/hqs97k1/	1641023072.0	1.0	False	True	False	ethereum	t5_2zf9m	r/ethereum	public		0.0	[]		[]	text	t2_3ywvbt3u	False	False	st brown is a premium desperation start ie players on covid or ir or deep league	0.04240981116890907	0.7147852182388306	0.51600182056427	0.27740466594696045	0.24811087548732758	0.30207473039627075	0.1422860026359558	8.738056180845888e-07	0.4206702709197998	0.006647678092122078
5	[]	False		ABONESR						 Eminem never flexes his wealth. Not in his rap, not in his personality, he doesn't and never even had a chuffier.  He also hardly knows how to use social media he's not tech savy at all.  It's sponsored, it was given to him for free and he was paid to make it his social media picture.  I can't believe people believe he paid anything for this lol	cdb82e53532c05cbe193e18f569c39279c191640	True	False					0	1641022843		0.0	{}	hqs8xne	False	t3_rta3mg	False	True	t1_hqrrbd6	/r/ethereum/comments/rta3mg/eminem_buys_bored_ape_yacht_club_nft_for_450k_on/hqs8xne/	1641022856.0	1.0	False	True	False	ethereum	t5_2zf9m	r/ethereum	public		0.0	[]		[]	text	t2_4xuue	False	False	 eminem never flexes his wealth not in his rap not in his personality he doesn t and never even had a chuffier he also hardly knows how to use social media he s not tech savy at all it s sponsored it was given to him for free and he was paid to make it his social media picture i can t believe people believe he paid anything for this lol	0.0023454464972019196	0.9886025786399841	0.697627604007721	0.014164467342197895	0.008236214518547058	0.5911954641342163	0.060684677213430405	8.315708441841707e-07	0.14426979422569275	0.010762167163193226
6	[]	False		iAmBurdman						450k* more like given to him gtfoh	72197444584b74df375761419023d44cf1688806	True	False					0	1641022754		0.0	{}	hqs8tjs	False	t3_rta3mg	False	True	t3_rta3mg	/r/ethereum/comments/rta3mg/eminem_buys_bored_ape_yacht_club_nft_for_450k_on/hqs8tjs/	1641022767.0	1.0	False	True	False	ethereum	t5_2zf9m	r/ethereum	public		0.0	[]		[]	text	t2_ds6gtyl1	False	False	450k more like given to him gtfoh	0.4866776168346405	0.5113331079483032	0.5337985754013062	0.27011820673942566	0.38568341732025146	0.10472530126571655	0.41856810450553894	0.43817636370658875	0.41727957129478455	0.104317806661129
7	[]	False		PoweredbyBurgerz						This ape hype is literally like buying clout for the sake of seeming relevant to the near future	318ac22180a4d3cb9c9b6b09150dd3fecf6e51fc	True	False					0	1641022583		0.0	{}	hqs8ll6	False	t3_rta3mg	False	True	t3_rta3mg	/r/ethereum/comments/rta3mg/eminem_buys_bored_ape_yacht_club_nft_for_450k_on/hqs8ll6/	1641022594.0	1.0	False	True	False	ethereum	t5_2zf9m	r/ethereum	public		0.0	[]		[]	text	t2_5m2pjuk2	False	False	this ape hype is literally like buying clout for the sake of seeming relevant to the near future	0.03198448568582535	0.8371413946151733	0.7026833295822144	0.06632330268621445	0.3806644380092621	0.3150354325771332	0.14897873997688293	8.594204814471595e-07	0.3920448422431946	0.008955830708146095
8	[]	False		Ok_Gold_9536						what a fucking..........	5e9fc3d84534e66c8f2f9650fc807462cb094ec9	True	False					0	1641022567		0.0	{}	hqs8kuu	False	t3_rta3mg	False	True	t3_rta3mg	/r/ethereum/comments/rta3mg/eminem_buys_bored_ape_yacht_club_nft_for_450k_on/hqs8kuu/	1641022581.0	1.0	False	True	False	ethereum	t5_2zf9m	r/ethereum	public		0.0	[]		[]	text	t2_amxhojic	False	False	what a fucking 	0.43685880303382874	0.4453839361667633	0.6942229270935059	0.4334810972213745	0.46372756361961365	0.47947877645492554	0.435535192489624	0.40080878138542175	0.46129438281059265	0.27788814902305603
9	[]	False		0xJADD						There's only 2000 Pepsi nfts, guess he should've purchased one of those instead. They're 5 times more rare than a Bored Ape!	5925214a7de3f628c80478bd7ab683c3c6d77069	True	False					0	1641022537		0.0	{}	hqs8jg6	False	t3_rta3mg	False	True	t1_hqrsacm	/r/ethereum/comments/rta3mg/eminem_buys_bored_ape_yacht_club_nft_for_450k_on/hqs8jg6/	1641022548.0	1.0	False	True	False	ethereum	t5_2zf9m	r/ethereum	public		0.0	[]		[]	text	t2_ccugn	False	False	there s only 2000 pepsi nfts guess he should ve purchased one of those instead they re 5 times more rare than a bored ape 	0.02087591029703617	0.8601171374320984	0.29212015867233276	0.01657288894057274	0.3074663579463959	0.7269116044044495	0.11342529207468033	8.818170158519933e-07	0.3893800973892212	0.09942744672298431
10	[]	False		tabac-en-paris						You can’t tell the difference between a fungible currency and an ape picture NFT (where there are tens of thousands of the, and no upper limit at that)….?	e6feca6ef3036537f372461e52fc7f23ee58fe1b	True	False					0	1641022396		0.0	{}	hqs8cqb	False	t3_rta3mg	False	True	t1_hqrsacm	/r/ethereum/comments/rta3mg/eminem_buys_bored_ape_yacht_club_nft_for_450k_on/hqs8cqb/	1641022408.0	1.0	False	True	False	ethereum	t5_2zf9m	r/ethereum	public		0.0	[]		[]	text	t2_5wjx2mi9	False	False	you can t tell the difference between a fungible currency and an ape picture nft where there are tens of thousands of the and no upper limit at that 	0.00705894036218524	0.9737843871116638	0.6373924016952515	0.08725368976593018	0.21040165424346924	0.3453936278820038	0.07972920686006546	8.43810312289861e-07	0.4486643970012665	0.009204559028148651
11	[]	False		BlazeDemBeatz						"On top of being frugal, he’s not very internet savvy. He doesn’t even write those messages on his Twitter, all that’s managed by an agency as well. 

Eminem isn’t scrouring the internet looking for NFTs."	ac50cf749cf5f664f48ff27fcf03dd515c955af6	True	False					0	1641022362		0.0	{}	hqs8b11	False	t3_rta3mg	False	True	t1_hqrw9rq	/r/ethereum/comments/rta3mg/eminem_buys_bored_ape_yacht_club_nft_for_450k_on/hqs8b11/	1641022376.0	1.0	False	True	False	ethereum	t5_2zf9m	r/ethereum	public		0.0	[]		[]	text	t2_ncewq	False	False	on top of being frugal he s not very internet savvy he doesn t even write those messages on his twitter all that s managed by an agency as well eminem isn t scrouring the internet looking for nfts 	0.0027021553833037615	0.9886152744293213	0.31278061866760254	0.005386145785450935	0.15120550990104675	0.20022141933441162	0.12715981900691986	8.527267141289485e-07	0.3519362807273865	4.536709820968099e-05
12	[]	False		martymartinator						"You'll need to have coinbase wallet installed (separate from the coinbase exchange). From there you just click on ""receive"" in your ethereum wallet and copy the address. Good luck!"	74fab7690affc7662054bafc40ee8d2572f31238	True	False					0	1641022077		0.0	{}	hqs7xs5	False	t3_rphdgx	False	True	t1_hqq4u7u	/r/ethereum/comments/rphdgx/frequently_asked_questions_weekly_discussion/hqs7xs5/	1641022091.0	1.0	False	True	False	ethereum	t5_2zf9m	r/ethereum	public		0.0	[]		[]	text	t2_29kyicsw	False	False	you ll need to have coinbase wallet installed separate from the coinbase exchange from there you just click on receive in your ethereum wallet and copy the address good luck 	0.13530127704143524	0.9769799709320068	0.0949983149766922	0.8068196773529053	0.012034919112920761	0.39170020818710327	0.1676967591047287	8.244639957410982e-07	0.2562411427497864	0.02117255888879299
13	[]	False		richardd08						No, you can't have it both ways. Decide on whether or not distributing someone else's art is considered theft. It shouldn't be theft in one case and not the other.	c71f25ac3ad3a390757fd5fef138f9753ce94986	True	False					0	1641021978		0.0	{}	hqs7t3n	False	t3_rta3mg	False	True	t1_hqrvaku	/r/ethereum/comments/rta3mg/eminem_buys_bored_ape_yacht_club_nft_for_450k_on/hqs7t3n/	1641021991.0	1.0	False	True	False	ethereum	t5_2zf9m	r/ethereum	public		0.0	[]		[]	text	t2_scds3qw	False	False	no you can t have it both ways decide on whether or not distributing someone else s art is considered theft it shouldn t be theft in one case and not the other 	0.009033502079546452	0.9820156097412109	0.8616165518760681	0.26395830512046814	0.03222010284662247	0.3884527087211609	0.0658707544207573	8.555712156521622e-07	0.532254695892334	0.0047562336549162865
14	[]	False		TXTCLA55						Make the NFT then.	981da263868798122d53510590a00d0dbb11def6	True	False					0	1641021818		0.0	{}	hqs7lgd	False	t3_rta3mg	False	True	t1_hqrwmn2	/r/ethereum/comments/rta3mg/eminem_buys_bored_ape_yacht_club_nft_for_450k_on/hqs7lgd/	1641021831.0	1.0	False	True	False	ethereum	t5_2zf9m	r/ethereum	public		0.0	[]		[]	text	t2_ch047	False	False	make the nft then 	0.4816550314426422	0.5126683115959167	0.49979957938194275	0.5201961994171143	0.4780087471008301	0.5799327492713928	0.377693772315979	0.47095757722854614	0.45730364322662354	0.40211135149002075
15	[]	False		DarkChocolatRaisinet						Lol	a79fd0872d2d79c1e87cdb6157f4ee6abf479479	True	False					0	1641021365		0.0	{}	hqs6ze1	False	t3_rta3mg	False	True	t1_hqs3bk1	/r/ethereum/comments/rta3mg/eminem_buys_bored_ape_yacht_club_nft_for_450k_on/hqs6ze1/	1641021381.0	1.0	False	True	False	ethereum	t5_2zf9m	r/ethereum	public		0.0	[]		[]	text	t2_64vs6lx5	False	False	lol	0.47317075729370117	0.43597516417503357	0.5476417541503906	0.4700857996940613	0.4872163236141205	0.6691137552261353	0.49147942662239075	0.4918611943721771	0.46693652868270874	0.5699469447135925
16	[]	False		DarkChocolatRaisinet						"Tax avoidance isn't illegal... The claims I've seen have been about money laundering. There's nothing legal about that.

What are you referring to that is specifically avoidance and not evasion here?"	7cb8528763e71f446ce58cab75589e3b24c9f8ad	True	False					0	1641021287		0.0	{}	hqs6vmv	False	t3_rta3mg	False	True	t1_hqrvyam	/r/ethereum/comments/rta3mg/eminem_buys_bored_ape_yacht_club_nft_for_450k_on/hqs6vmv/	1641021301.0	1.0	False	True	False	ethereum	t5_2zf9m	r/ethereum	public		0.0	[]		[]	text	t2_64vs6lx5	False	False	tax avoidance isn t illegal the claims i ve seen have been about money laundering there s nothing legal about that what are you referring to that is specifically avoidance and not evasion here 	0.0033389676827937365	0.9823447465896606	0.9284304976463318	0.013821825385093689	0.4812277853488922	0.4516479969024658	0.07172967493534088	8.36263836845319e-07	0.4942176938056946	0.005947154946625233
17	[]	False		MarcusOctavius						https://youtu.be/bm3mLBJWBhc	cd61155bcd3ecc18fd7b17da4ad52319e09b183a	True	False					0	1641021204		0.0	{}	hqs6rpq	False	t3_rs7t5i	False	True	t1_hqs3geo	/r/ethereum/comments/rs7t5i/10k_polygon_stolen_looking_for_blockchain/hqs6rpq/	1641021215.0	1.0	False	True	False	ethereum	t5_2zf9m	r/ethereum	public		0.0	[]		[]	text	t2_a094882a	False	False	https youtu be bm3mlbjwbhc	0.4823460876941681	0.5621112585067749	0.5295092463493347	0.5801894664764404	0.4203113317489624	0.05224071070551872	0.4323502480983734	0.47088727355003357	0.5089743733406067	0.05039598047733307
18	[]	False		DarkChocolatRaisinet						I'm curious how you think something can be worth $400k without anyone caring about it... These things are only worth what someone is willing to pay for them. If nobody cared, they wouldn't be worth anything.	4a5cb8b3f639f1b9d371b70f80f7e4a7f25f72a1	True	False					0	1641021145		0.0	{}	hqs6owz	False	t3_rta3mg	False	True	t1_hqrtvec	/r/ethereum/comments/rta3mg/eminem_buys_bored_ape_yacht_club_nft_for_450k_on/hqs6owz/	1641021156.0	1.0	False	True	False	ethereum	t5_2zf9m	r/ethereum	public		0.0	[]		[]	text	t2_64vs6lx5	False	False	i m curious how you think something can be worth 400k without anyone caring about it these things are only worth what someone is willing to pay for them if nobody cared they wouldn t be worth anything 	0.6318793892860413	0.6553907990455627	0.5120238065719604	0.009594021365046501	0.02161969058215618	0.6226274967193604	0.07679853588342667	8.387885941374407e-07	0.2589464783668518	0.016158724203705788
19	[]	False		trailerparkbhoys						It’s called eth paid them. To do it 😂 it’s called marketing	fab63198516f96ad70cf5c686b49bf6279bc927f	True	False					0	1641020872		0.0	{}	hqs6bir	False	t3_rssmwb	False	True	t3_rssmwb	/r/ethereum/comments/rssmwb/paris_hilton_sets_her_twitter_name_to/hqs6bir/	1641020884.0	1.0	False	True	False	ethereum	t5_2zf9m	r/ethereum	public		0.0	[]		[]	text	t2_5tcn0kud	False	False	it s called eth paid them to do it it s called marketing	0.26030653715133667	0.6087462306022644	0.43943867087364197	0.46704164147377014	0.443427175283432	0.5041746497154236	0.13777148723602295	5.2488943765638396e-05	0.39494216442108154	0.004480087198317051
20	[]	False		Sniter						"The article even mentions the company who helped facilitate the ""purchase"". They seem to be involved directly in celebrity/crypto promotion projects. 

Not to mention, Eminem is a notoriously frugal spender, this would be completely out of his character.

And he didn't even tweet about it, just put up the new image... I just don't buy that this was an organic purchase, not in a million years."	b55c6655c5aa4022aa2527cd3e5621a484d2135e	True	False					0	1641020394		0.0	{}	hqs5o74	False	t3_rta3mg	False	True	t1_hqrnvyb	/r/ethereum/comments/rta3mg/eminem_buys_bored_ape_yacht_club_nft_for_450k_on/hqs5o74/	1641020407.0	1.0	False	True	False	ethereum	t5_2zf9m	r/ethereum	public		0.0	[]		[]	text	t2_6tgs8	False	False	the article even mentions the company who helped facilitate the purchase they seem to be involved directly in celebrity crypto promotion projects not to mention eminem is a notoriously frugal spender this would be completely out of his character and he didn t even tweet about it just put up the new image i just don t buy that this was an organic purchase not in a million years 	0.0023981460835784674	0.988724410533905	0.5669494867324829	0.015884365886449814	0.008596003986895084	0.35191667079925537	0.06582752615213394	8.556454531571944e-07	0.266603946685791	0.004531401209533215
21	[]	False		Sniter						"He didn't it was a sponsor ship, the article even mentions the company who helped facilitate the ""purchase"". They seem to be involved directly in celebrity/crypto promotion projects. 

Not to mention, Eminem is a notoriously frugal spender, this would be completely out of his character.

And he didn't even tweet about it, just put up the new image... I just don't buy that this was an organic purchase, not in a million years."	a4458df1303d24e1a1265cbfe9838b99b7eebe06	True	False					0	1641020367		0.0	{}	hqs5mxz	False	t3_rta3mg	False	True	t1_hqrtw3q	/r/ethereum/comments/rta3mg/eminem_buys_bored_ape_yacht_club_nft_for_450k_on/hqs5mxz/	1641020379.0	1.0	False	True	False	ethereum	t5_2zf9m	r/ethereum	public		0.0	[]		[]	text	t2_6tgs8	False	False	he didn t it was a sponsor ship the article even mentions the company who helped facilitate the purchase they seem to be involved directly in celebrity crypto promotion projects not to mention eminem is a notoriously frugal spender this would be completely out of his character and he didn t even tweet about it just put up the new image i just don t buy that this was an organic purchase not in a million years 	0.0023777491878718138	0.9887253642082214	0.5695782899856567	0.01709112338721752	0.008386656641960144	0.35191670060157776	0.06578703224658966	8.556316402064112e-07	0.26179757714271545	0.004529405385255814
22	[]	False		Sniter						exactly	fa361dc6994cb4f44130d42a561627e721bc4af8	True	False					0	1641020336		0.0	{}	hqs5lf8	False	t3_rta3mg	False	True	t1_hqs52zg	/r/ethereum/comments/rta3mg/eminem_buys_bored_ape_yacht_club_nft_for_450k_on/hqs5lf8/	1641020352.0	1.0	False	True	False	ethereum	t5_2zf9m	r/ethereum	public		0.0	[]		[]	text	t2_6tgs8	False	False	exactly	0.494263231754303	0.5073648691177368	0.4842499792575836	0.5269474387168884	0.5025415420532227	0.5476186275482178	0.4835456609725952	0.48244616389274597	0.493169367313385	0.5194799304008484
23	[]	False		rynchpln						It's the ability to prove you own an original. Which is slightly flawed, but still could be beneficial. IMO the jury is still out.	cb5856539cf63e35e1b9912001657427bd0c9f4a	True	False					0	1641020324		0.0	{}	hqs5kt5	False	t3_rta3mg	False	True	t1_hqs52zg	/r/ethereum/comments/rta3mg/eminem_buys_bored_ape_yacht_club_nft_for_450k_on/hqs5kt5/	1641020339.0	1.0	False	True	False	ethereum	t5_2zf9m	r/ethereum	public		0.0	[]		[]	text	t2_9xgnj	False	False	it s the ability to prove you own an original which is slightly flawed but still could be beneficial imo the jury is still out 	0.04340830072760582	0.9601787328720093	0.6658578515052795	0.06360187381505966	0.4197847545146942	0.4876801073551178	0.07954873144626617	8.544109277863754e-07	0.4798324704170227	0.007665766403079033
24	[]	False		NonConShaggy						"$452,000 or 123.45 ETH. 
Good summary bot🤖;just a detail that I thought was fun."	e4aa74374a4c34e1f08de4f2171b27852bc24037	True	False					0	1641020306		0.0	{}	hqs5jwr	False	t3_rta3mg	False	True	t1_hqrj826	/r/ethereum/comments/rta3mg/eminem_buys_bored_ape_yacht_club_nft_for_450k_on/hqs5jwr/	1641020320.0	1.0	False	True	False	ethereum	t5_2zf9m	r/ethereum	public		0.0	[]		[]	text	t2_9ups1wmr	False	False	 452 000 or 123 45 eth good summary bot just a detail that i thought was fun 	0.25703662633895874	0.6998540759086609	0.11660740524530411	0.03624313324689865	0.2178020179271698	0.9247098565101624	0.24058623611927032	8.680364089741488e-07	0.35683873295783997	0.019176244735717773
25	[]	False		NotNotAnonAnon						The world do often work this way	e26554f48f87bd551cb667c554bfa27585609cad	True	False					0	1641020245		0.0	{}	hqs5gtj	False	t3_rta3mg	False	True	t1_hqrs0lz	/r/ethereum/comments/rta3mg/eminem_buys_bored_ape_yacht_club_nft_for_450k_on/hqs5gtj/	1641020259.0	1.0	False	True	False	ethereum	t5_2zf9m	r/ethereum	public		0.0	[]		[]	text	t2_ex2kx4i0	False	False	the world do often work this way	0.48859718441963196	0.5952886939048767	0.3600218892097473	0.518786609172821	0.46169689297676086	0.416252464056015	0.34903278946876526	0.40400829911231995	0.47568801045417786	0.04693247750401497
26	[]	False		Sniter						Username checks out	49ab9e7913e907455ed420977f23c853eae715da	True	False					0	1641020239		0.0	{}	hqs5gjh	False	t3_rta3mg	False	True	t1_hqs3bk1	/r/ethereum/comments/rta3mg/eminem_buys_bored_ape_yacht_club_nft_for_450k_on/hqs5gjh/	1641020252.0	1.0	False	True	False	ethereum	t5_2zf9m	r/ethereum	public		0.0	[]		[]	text	t2_6tgs8	False	False	username checks out	0.5032686591148376	0.46885064244270325	0.4277273118495941	0.5712695121765137	0.46335113048553467	0.5292308330535889	0.4852798581123352	0.47210466861724854	0.45130008459091187	0.058045823127031326
27	[]	False		2applepie7						Yes but most actual paintings are nothing but money laundering as well so it's hardly any different.	29bb9c72141d04ad279be4359dfb02dcf63f1ad7	True	False					0	1641020210		0.0	{}	hqs5f3t	False	t3_rta3mg	False	True	t1_hqrvyam	/r/ethereum/comments/rta3mg/eminem_buys_bored_ape_yacht_club_nft_for_450k_on/hqs5f3t/	1641020225.0	1.0	False	True	False	ethereum	t5_2zf9m	r/ethereum	public		0.0	[]		[]	text	t2_fkvd2bqg	False	False	yes but most actual paintings are nothing but money laundering as well so it s hardly any different 	0.1564892679452896	0.825753390789032	0.40766042470932007	0.017916740849614143	0.49460694193840027	0.5104359984397888	0.14779570698738098	1.1520621683303034e-06	0.5833701491355896	0.0028347850311547518
28	[]	False		ohsnapt						why are people paying so much money for this shit?	eb0cdadcf004af4f7a2039858212d3b5c71682db	True	False					0	1641020190		0.0	{}	hqs5e4e	False	t3_rta3mg	False	True	t3_rta3mg	/r/ethereum/comments/rta3mg/eminem_buys_bored_ape_yacht_club_nft_for_450k_on/hqs5e4e/	1641020205.0	1.0	False	True	False	ethereum	t5_2zf9m	r/ethereum	public		0.0	[]		[]	text	t2_bc43y	False	False	why are people paying so much money for this shit 	0.47314968705177307	0.46457234025001526	0.7435704469680786	0.5336474180221558	0.4447660446166992	0.5001673698425293	0.3770517408847809	0.5050180554389954	0.3663251996040344	0.002183591015636921
29	[]	False		KTownDaren						You can buy UST on many platforms. I prefer on [Terra Network](https://www.terra.money/)	87abb8efc2b2af6c2f7846f2d7cdac7a7b1d82e6	True	False					0	1641019970		0.0	{}	hqs5337	False	t3_rr9c1d	False	True	t1_hqrmoip	/r/ethereum/comments/rr9c1d/where_is_the_best_place_to_stake_15_eth/hqs5337/	1641019986.0	1.0	False	True	False	ethereum	t5_2zf9m	r/ethereum	public		0.0	[]		[]	text	t2_5xsrw	False	False	you can buy ust on many platforms i prefer on terra network https www terra money 	0.12099577486515045	0.8325053453445435	0.07210325449705124	0.27077361941337585	0.2602693736553192	0.2545998990535736	0.19950713217258453	0.8844165802001953	0.4368473291397095	0.0008099195547401905
30	[]	False		geeseareweapons						I just don't get NFTs, tried explaining to my girlfriend last night over dinner about what I am doing in crypto and we both agreed that NFTs seem stupid unless your really into modern art forms. Seems super specialised after the hype dies down on it	d15913886c1c51c07ec5f3bcbe3ca9563e0def31	True	False					0	1641019968		0.0	{}	hqs52zg	False	t3_rta3mg	False	True	t3_rta3mg	/r/ethereum/comments/rta3mg/eminem_buys_bored_ape_yacht_club_nft_for_450k_on/hqs52zg/	1641019979.0	1.0	False	True	False	ethereum	t5_2zf9m	r/ethereum	public		0.0	[]		[]	text	t2_gc1z5v7n	False	False	i just don t get nfts tried explaining to my girlfriend last night over dinner about what i am doing in crypto and we both agreed that nfts seem stupid unless your really into modern art forms seems super specialised after the hype dies down on it	0.002858339576050639	0.9115214347839355	0.6841100454330444	0.013989156112074852	0.008781752549111843	0.5445882081985474	0.07309776544570923	8.041833439165202e-07	0.3050069212913513	0.009144525043666363
31	[]	False		WhichEstablishment96						Are you retarded or you just never worked in crypto?	cef9b854cefc9550ce15f82044e341929ff010fc	True	False					0	1641019868		0.0	{}	hqs4xwu	False	t3_rta3mg	False	True	t1_hqs3bk1	/r/ethereum/comments/rta3mg/eminem_buys_bored_ape_yacht_club_nft_for_450k_on/hqs4xwu/	1641019882.0	1.0	False	True	False	ethereum	t5_2zf9m	r/ethereum	public		0.0	[]		[]	text	t2_byrxsxim	False	False	are you retarded or you just never worked in crypto 	0.30850735306739807	0.4318232834339142	0.8292083144187927	0.27914443612098694	0.44215336441993713	0.3662196397781372	0.21325410902500153	0.0030475743114948273	0.4605298936367035	0.01577179506421089
