Unnamed: 0	all_awardings	archived	associated_award	author	author_flair_background_color	author_flair_css_class	author_flair_richtext	author_flair_template_id	author_flair_text	author_flair_text_color	author_flair_type	author_fullname	author_patreon_flair	author_premium	body	body_sha1	can_gild	collapsed	collapsed_because_crowd_control	collapsed_reason	collapsed_reason_code	comment_type	controversiality	created_utc	distinguished	gilded	gildings	id	is_submitter	link_id	locked	no_follow	parent_id	permalink	retrieved_utc	score	score_hidden	send_replies	stickied	subreddit	subreddit_id	subreddit_name_prefixed	subreddit_type	top_awarded_type	total_awards_received	treatment_tags	unrepliable_reason	corpus	support	knowledge	conflict	power	similarity	fun	status	trust	identity	romance
198	[]	False		[deleted]						dark					[removed]	fe993932d6dced4c0a879e9aa5d7a6e0fbb467f5	True	False					0	1653200639		0	{}	i9jbev9	False	t3_uuuso7	False	True	t1_i9j74ix	/r/Bitcoin/comments/uuuso7/my_gift_for_my_son_on_his_wedding_day/i9jbev9/	1653200653	1	True	True	False	Bitcoin	t5_2s3qj	r/Bitcoin	public		0	[]												
199	[]	False		Dazzling_Marzipan474			[]				text	t2_80wmsoe7	False	False	Every year I believe is the 2% fee	2f02018947e9a11307e22392747eca0bcb8d01d1	True	False					0	1653200605		0	{}	i9jbdf3	False	t3_uuxj3p	False	True	t1_i9i0ye0	/r/Bitcoin/comments/uuxj3p/what_am_i_missing_here_isnt_this_just_getting/i9jbdf3/	1653200618	1	True	True	False	Bitcoin	t5_2s3qj	r/Bitcoin	public		0	[]												
200	[]	False		Deus_Desuper			[]				text	t2_749dylfj	False	False	"Everything I can find says PoS wont change gas fees.


Seriously feel like eth network will get outdone due to their ridiculous gas."	e253112358a65d9efac984f551da7ee0ec344c42	True	False					0	1653191651		0	{}	i9iz6kc	False	t3_rw8w2a	False	True	t1_hrab7lx	/r/ethereum/comments/rw8w2a/why_are_the_fees_or_gas_fees_so_high/i9iz6kc/	1653191663	1	False	True	False	ethereum	t5_2zf9m	r/ethereum	public		0	[]												
201	[]	False		FaceDeer			[]				text	t2_4ljvm	False	False	Okay, still rather complex. I think I understood *some* of that. :)	bb912bd16e1ff1966b00f0b8869e898751fea88e	True	False					0	1653191192		0	{}	i9iygkq	False	t3_uts8xx	False	True	t1_i9iuig3	/r/ethereum/comments/uts8xx/ethereum_devs_tip_the_merge_will_occur_in_august/i9iygkq/	1653191206	1	False	True	False	ethereum	t5_2zf9m	r/ethereum	public		0	[]												
202	[]	False		fnetma			[]				text	t2_1392vp	False	False	"Polygons website is all you need to know about what their vision is for Ethereum [https://polygon.technology/](https://polygon.technology/)

This is a good thing because I don't have faith Ethereum will solve its scaling problems."	c6a6d265a3278897ed8f053df2c1ee838bc2d214	True	False					0	1653191035		0	{}	i9iy7u7	False	t3_smwke9	False	True	t1_hvzn9cc	/r/ethereum/comments/smwke9/sequoia_just_invested_450_million_dollars_into/i9iy7u7/	1653191048	1	False	True	False	ethereum	t5_2zf9m	r/ethereum	public		0	[]												
203	[]	False		AutoModerator			[]				text	t2_6l4z3	False	True	"Your submission was removed from /r/ethereum due to being too short. All text submissions must be at least 120 characters long.

*I am a bot, and this action was performed automatically. Please [contact the moderators of this subreddit](/message/compose/?to=/r/ethereum) if you have any questions or concerns.*"	1a4cd7c8e58d8206d6fdd96ae5fec9e799971e55	True	False					0	1653190958	moderator	0	{}	i9iy3fr	False	t3_uv2t4l	False	True	t3_uv2t4l	/r/ethereum/comments/uv2t4l/once_a_smart_contract_has_been_how_can_it_be/i9iy3fr/	1653190969	1	False	False	False	ethereum	t5_2zf9m	r/ethereum	public		0	[]												
204	[]	False		Trakeen			[]				text	t2_2tzpveqz	False	False	Metal used to make the type writer. Which is about the same as mining coal	364320456eaf182375836796d05e60bda92d2ce7	True	False					0	1653190100		0	{}	i9iwoou	False	t3_uutkb6	False	True	t1_i9i36on	/r/ethereum/comments/uutkb6/why_i_am_not_going_to_buy_a_computer_wendell/i9iwoou/	1653190113	1	False	True	False	ethereum	t5_2zf9m	r/ethereum	public		0	[]												
205	[]	False		oakislandorchard			[]				text	t2_4aq4us3t	False	False	i sharded in my panties today	25980a28a8efcc62a68c30b5a132af83313daef0	True	False					0	1653189871		0	{}	i9iwb36	False	t3_uuyv1i	False	True	t3_uuyv1i	/r/ethereum/comments/uuyv1i/really_excited_about_the_merge_but_im_even_more/i9iwb36/	1653189884	1	False	True	False	ethereum	t5_2zf9m	r/ethereum	public		0	[]												
206	[]	False		Trixteri			[]				text	t2_4efhm5an	False	False	why would the tx demand go up by 64x?	42cd19cf0fc86055ad4c98212f0d87493cc84b06	True	False					0	1653189788		0	{}	i9iw63c	False	t3_uuyv1i	False	True	t1_i9inre9	/r/ethereum/comments/uuyv1i/really_excited_about_the_merge_but_im_even_more/i9iw63c/	1653189806	1	False	True	False	ethereum	t5_2zf9m	r/ethereum	public		0	[]												
207	[]	False		Perleflamme			[]				text	t2_13pqgo	False	False	"&gt;A) I haven’t seen any court case or public document citing it as having been tracable, but if you’re going to do illicit activities I would heavily suggest using a stronger protocol such as /r/Monero

Even if not for illicit activities and only for your financial privacy, actually. 

Though Monero isn't the only network. On Ethereum, you also have the L2 Aztek protocol. There also are other tools you can use. Compare them and choose the one fitting your purposes the best."	e2d85a088aac0624305305315436186d09b1e27e	True	False					0	1653189202		0	{}	i9iv51w	False	t3_uury49	False	False	t1_i9hozj8	/r/ethereum/comments/uury49/viability_of_tornado_cash/i9iv51w/	1653189216	1	False	True	False	ethereum	t5_2zf9m	r/ethereum	public		0	[]												
208	[]	False		Perleflamme			[]				text	t2_13pqgo	False	False	"Why would you be asking for a friend instead of asking for yourself? 

Data privacy, even more so financial data, is a need in nowadays world. Otherwise, it's pretty easy for any hacker to commit identity theft and ruin your life."	2ccce578ac12ab9ccd688b67bafdb20833d0b430	True	False					0	1653188900		0	{}	i9iulog	False	t3_uury49	False	True	t1_i9hj14q	/r/ethereum/comments/uury49/viability_of_tornado_cash/i9iulog/	1653188914	1	False	True	False	ethereum	t5_2zf9m	r/ethereum	public		0	[]												
209	[]	False		AESTHTK			[]				text	t2_10fwavem	False	False	"Just discovered this:

www.eip4844.com"	c06add6aabece2a4bad4e45e545d4bdc0366411f	True	False					0	1653188851		0	{}	i9iuig3	False	t3_uts8xx	False	True	t1_i9ihj35	/r/ethereum/comments/uts8xx/ethereum_devs_tip_the_merge_will_occur_in_august/i9iuig3/	1653188864	1	False	True	False	ethereum	t5_2zf9m	r/ethereum	public		0	[]												
210	[]	False		n8dahwgg			[]				text	t2_2l8t8fai	False	False	Sharting is pretty cool	4577a6cf3e0a2cfeb24a716e2344f64be85fd5d5	True	False					0	1653188763		0	{}	i9iucmo	False	t3_uuyv1i	False	True	t3_uuyv1i	/r/ethereum/comments/uuyv1i/really_excited_about_the_merge_but_im_even_more/i9iucmo/	1653188776	1	False	True	False	ethereum	t5_2zf9m	r/ethereum	public		0	[]												
211	[]	False		AESTHTK			[]				text	t2_10fwavem	False	False	Oh awesome.	11480a5af6f8034ac9d044477949e8e980b12a12	True	False					0	1653188709		0	{}	i9iu910	False	t3_uuyv1i	False	True	t1_i9igv3c	/r/ethereum/comments/uuyv1i/really_excited_about_the_merge_but_im_even_more/i9iu910/	1653188724	1	False	True	False	ethereum	t5_2zf9m	r/ethereum	public		0	[]												
212	[]	False		bandoonparade			[]				text	t2_er2a5f93	False	False	Ok point taken, but seriously y'all, these gas fees on Ethereum are surprisingly low rn.	9591275f6d4e2a4dabd82f4419546d53a5f75b6e	True	False					0	1653188643		0	{}	i9iu4hg	False	t3_uuxv0b	False	True	t3_uuxv0b	/r/ethereum/comments/uuxv0b/nice_fees/i9iu4hg/	1653188659	1	False	True	False	ethereum	t5_2zf9m	r/ethereum	public		0	[]												
213	[]	False		Zuccccccccccccccccck			[]				text	t2_7qv0rbxk	False	False	I shid and shard and pissd	961a3ac95f8e524df82b5b8a085f70955fd295d0	True	False					0	1653188583		0	{}	i9iu0lp	False	t3_uuyv1i	False	True	t3_uuyv1i	/r/ethereum/comments/uuyv1i/really_excited_about_the_merge_but_im_even_more/i9iu0lp/	1653188595	1	False	True	False	ethereum	t5_2zf9m	r/ethereum	public		0	[]												
214	[]	False		bandoonparade			[]				text	t2_er2a5f93	False	False	Underrated comment.	d6412ed69aec30b9384cf6ead0343fec20f74bcb	True	False					0	1653188482		0	{}	i9itua9	False	t3_uuyv1i	False	False	t1_i9isua1	/r/ethereum/comments/uuyv1i/really_excited_about_the_merge_but_im_even_more/i9itua9/	1653188495	1	False	True	False	ethereum	t5_2zf9m	r/ethereum	public		0	[]												
215	[]	False		braclayrab			[]				text	t2_jjlo	False	False	I challenge this subreddit to explain how the switch to proof of stake makes this possible...	7370cafd5b9198ac10ebc5ff96d69b98c0008697	True	False					0	1653188067		0	{}	i9it2si	False	t3_uum7kc	False	True	t3_uum7kc	/r/ethereum/comments/uum7kc/vitalik_encourages_ethereum_devs_to_build/i9it2si/	1653188078	1	False	True	False	ethereum	t5_2zf9m	r/ethereum	public		0	[]												
216	[]	False		Significant-Neck9605			[]				text	t2_6ipzdslk	False	False	I shart all the time!	d1e2c490a19d34a63f886569513416a8b4321777	True	False					0	1653187937		0	{}	i9isua1	False	t3_uuyv1i	False	True	t3_uuyv1i	/r/ethereum/comments/uuyv1i/really_excited_about_the_merge_but_im_even_more/i9isua1/	1653187949	1	False	True	False	ethereum	t5_2zf9m	r/ethereum	public		0	[]												
217	[]	False		EmilyLovs			[]				text	t2_3vpeovno	False	False	"You seem to imply that privacy is ""sketchy""...Oh your master would be so proud of you, good little slave."	f7341d47abdb1257cf7dbde6827f79bd064a5b16	True	False					0	1653187881		0	{}	i9isqol	True	t3_uury49	False	True	t1_i9hj14q	/r/ethereum/comments/uury49/viability_of_tornado_cash/i9isqol/	1653187892	1	False	True	False	ethereum	t5_2zf9m	r/ethereum	public		0	[]												
218	[]	False		espresso_chain			[]				text	t2_ei57ep10	False	False	"could be their zk proof tech. zkSync is built by a bunch of programming triathletes so they have really solid zk proof system. 

just a guess."	06218ccde0226d9d4eb313c6cb4aaf5588d0ee1e	True	False					0	1653187486		0	{}	i9is0wf	False	t3_uuxv0b	False	True	t1_i9ipvmu	/r/ethereum/comments/uuxv0b/nice_fees/i9is0wf/	1653187503	1	False	True	False	ethereum	t5_2zf9m	r/ethereum	public		0	[]												
219	[]	False		TheModernSkater			[]				text	t2_21o12pg9	False	False	Well technically it's worth 20 loops (demand) cause I want it... well if you decide to sell it to me (supply) if not then the price shall go up. That's how supply and demand work. Man in 2 months the value went up. Imagine what someone might wanna pay in 10 years? One of the first minted pieces from an APE fam.... on the real though you wanna sell me this for 20 loops?	2904acb27620ee21b037328ca16f21acc049755b	True	False					0	1653187370		0	{}	i9irt5j	False	t3_t8x0ms	False	True	t1_hzqqfs4	/r/ethereum/comments/t8x0ms/cost_of_1st_ever_nft_mint_on_loopring_layer2_0686/i9irt5j/	1653187386	1	False	True	False	ethereum	t5_2zf9m	r/ethereum	public		0	[]												
220	[]	False		[deleted]						dark					[removed]	fe993932d6dced4c0a879e9aa5d7a6e0fbb467f5	True	False					0	1653186936		0	{}	i9ir0t1	False	t3_uszlba	False	True	t1_i97c1un	/r/ethereum/comments/uszlba/eth_wallet/i9ir0t1/	1653186953	1	False	True	False	ethereum	t5_2zf9m	r/ethereum	public		0	[]												
221	[]	False		BTCwatcher92			[]				text	t2_9zbkmg48	False	False	"Quick question You seem like you’d be able to answer, so I have a ledger that has not been updated in over a year, making some assets inaccessible from my app. Basically they’re stuck until I update, which I can’t, I don’t have a compatible computer…
So If I understand what you wrote, correctly, if I put the ledger seed phrase into MetaMask, I could get around the inability to update? I understand the security of the accounts would be less safe, By that point it would already be on its way out if so."	cc31cac83d882d0d72c032ddc23066b4eed2041f	True	False					0	1653186855		0	{}	i9iqvk2	False	t3_uui29q	False	True	t1_i9gglcg	/r/ethereum/comments/uui29q/arent_cold_wallets_pointless/i9iqvk2/	1653186872	1	False	True	False	ethereum	t5_2zf9m	r/ethereum	public		0	[]												
222	[]	False		user260421			[]				text	t2_e1vmlpfw	False	False	Imagine how people are going to read reddit threads 100 years from now and wonder wtf was in our heads	fe4079e3ece9fc213c123f5bf8d24fb75be4137d	True	False					0	1653186431		0	{}	i9iq4k9	False	t3_uutkb6	False	True	t1_i9hjwb3	/r/ethereum/comments/uutkb6/why_i_am_not_going_to_buy_a_computer_wendell/i9iq4k9/	1653186446	1	False	True	False	ethereum	t5_2zf9m	r/ethereum	public		0	[]												
223	[]	False		user260421			[]				text	t2_e1vmlpfw	False	False	"Sure thing


You never know what was happening in the back of the barn"	f68dbeb8c24ae7d8df4d4cb0c471fd0c3101d93f	True	False					0	1653186351		0	{}	i9ipzj5	False	t3_uutkb6	False	True	t1_i9htni9	/r/ethereum/comments/uutkb6/why_i_am_not_going_to_buy_a_computer_wendell/i9ipzj5/	1653186367	1	False	True	False	ethereum	t5_2zf9m	r/ethereum	public		0	[]												
224	[]	False		jakob_x			[]				text	t2_14bjj8	False	False	why does it cost so much to swap tokens with loopring, in comparison to the others?	8f370bc432cb168d0eeb3641eef5a05ec9e2ab9b	True	False					0	1653186291		0	{}	i9ipvmu	False	t3_uuxv0b	False	False	t3_uuxv0b	/r/ethereum/comments/uuxv0b/nice_fees/i9ipvmu/	1653186308	1	False	True	False	ethereum	t5_2zf9m	r/ethereum	public		0	[]												
225	[]	False		dompomcash			[]				text	t2_ndl39	False	False	If you thought that ETH would act as a Stablecoin rather than a holding that could increase in value, would you own it? I’d be willing to be that 90% of this sub would not. The point in asking the question is to demonstrate that the utility portion comes second for most holders. It’s the speculative nature and the potential for huge earnings that cause most to even use that damn blockchain. At the same time, the speculative/volatile nature will also dissuade mass adoption. It’s a double edge sword and I don’t think it’s irrational to bet against mass adoption. I certainly am not convinced	b5c9a686508ccd9aa1b623f52f65206ef537b9b5	True	False					0	1653186033		0	{}	i9ipfbt	False	t3_uutkb6	False	True	t3_uutkb6	/r/ethereum/comments/uutkb6/why_i_am_not_going_to_buy_a_computer_wendell/i9ipfbt/	1653186049	1	False	True	False	ethereum	t5_2zf9m	r/ethereum	public		0	[]												
226	[]	False		Educational-Spread41			[]				text	t2_dj0mn1es	False	False	Loop and ZKSync here!!!	fc769d45959eb60ba58d6a38962167a5a0d1084b	True	False					0	1653185713		0	{}	i9iouh4	False	t3_uuxv0b	False	True	t1_i9ij60o	/r/ethereum/comments/uuxv0b/nice_fees/i9iouh4/	1653185726	1	False	True	False	ethereum	t5_2zf9m	r/ethereum	public		0	[]												
227	[]	False		csmrh			[]				text	t2_kaijx	False	False	Meta has 30x the market cap of coinbase, so by your logic they’re probably a better company to start a web3 marketplace	651806690ab66e6a5192c492fef51e037bb16f9c	True	False					0	1653185657		0	{}	i9ioql5	False	t3_utc4ww	False	True	t1_i9djmzl	/r/ethereum/comments/utc4ww/coinbase_unveils_new_dapp_wallet_and_browser_for/i9ioql5/	1653185675	1	False	True	False	ethereum	t5_2zf9m	r/ethereum	public		0	[]												
228	[]	False		immolated_			[]				text	t2_menks	False	False	So explain to me...if sharding increases TX bandwith by 64x, it will momentarily get cheaper, but then TX demand will go up 64x until gas fees stabilize again. How does that fix it long term?	95a4e77d5ae775e1e96b15c1f27ad2e5f7734ee7	True	False					0	1653185125		0	{}	i9inre9	False	t3_uuyv1i	False	True	t3_uuyv1i	/r/ethereum/comments/uuyv1i/really_excited_about_the_merge_but_im_even_more/i9inre9/	1653185144	1	False	True	False	ethereum	t5_2zf9m	r/ethereum	public		0	[]												
229	[]	False		Perleflamme			[]				text	t2_13pqgo	False	False	"Look very closely at the definition of maximalism that is used. It's miles away from the critiques of maximalism. 

And that is the actual joke.

But the seriousness behind it is relevant. 

For instance, is he defending the zero-sum game mindset of maximalists? No. 

Is he defending the concept of spreading misinformation about other tokens? No. 

Is he defending the concept of supporting bans of others tokens? No. 

What he is seriously defending isn't the concept of maximalism that is denounced here and there. That's why it's an April's fool to begin with, because you should replace the word maximalism with the actual concept he's talking about. Call it maximalism if you want, but then don't confuse it with what's being receiving critiques and being mocked about some crypto fools."	fce59ae18ddf9b4411ed4e584b07bfeefec8578e	True	False					0	1653184788		0	{}	i9in4k3	False	t3_uupkkd	False	True	t1_i9h67q6	/r/ethereum/comments/uupkkd/in_defense_of_maximalism/i9in4k3/	1653184801	1	False	True	False	ethereum	t5_2zf9m	r/ethereum	public		0	[]												
230	[]	False		safetaco			[]				text	t2_23cxk6j8	False	True	I am excited to withdraw my staked ETH from Coinbase: what a big mistake that was.	c0498c4a51ad5e7a381036ace01994912942a13d	True	False					0	1653184387		0	{}	i9imdtt	False	t3_uuyv1i	False	True	t3_uuyv1i	/r/ethereum/comments/uuyv1i/really_excited_about_the_merge_but_im_even_more/i9imdtt/	1653184400	1	False	True	False	ethereum	t5_2zf9m	r/ethereum	public		0	[]												
231	[]	False		cam_breakfastdonut			[]				text	t2_x74rg	False	False	As a general rule, Wendell Berry is right and other people are wrong	0de073d84c4fdc9dbf4331105a58cb5c5b454287	True	False					0	1653184314		0	{}	i9im90l	False	t3_uutkb6	False	False	t3_uutkb6	/r/ethereum/comments/uutkb6/why_i_am_not_going_to_buy_a_computer_wendell/i9im90l/	1653184327	1	False	True	False	ethereum	t5_2zf9m	r/ethereum	public		0	[]												
232	[]	False		Perleflamme			[]				text	t2_13pqgo	False	False	No, it doesn't. You need 32 ETH if you want to run an entire validator on your own. But you can stake with way less, because there are decentralized pools.	fd451cc63261f28d1f2d7c178e45ac04e833640b	True	False					0	1653184311		0	{}	i9im8sz	False	t3_uuo3n2	False	True	t1_i9gzegy	/r/ethereum/comments/uuo3n2/is_eth_20_going_to_be_centralized/i9im8sz/	1653184328	1	False	True	False	ethereum	t5_2zf9m	r/ethereum	public		0	[]												
233	[]	False		Perleflamme			[]				text	t2_13pqgo	False	False	"It's because the actual people behind BTC were actually behind crypto in general. These people have simply moved on. 

The people you see nowadays on BTC are the ones who weren't for crypto in general but rather for their own gains, bag holders having zero-sum game mindset. I think Vitalik recently called them ""trolls"", notably regarding his talk about contradictions."	b46fd3e0978caf266dcda62c2beaed7b43278dd9	True	False					0	1653184087		0	{}	i9ilu4f	False	t3_uulcg3	False	True	t1_i9hhm7g	/r/ethereum/comments/uulcg3/what_a_security_designation_for_eth_looks_like/i9ilu4f/	1653184104	1	False	True	False	ethereum	t5_2zf9m	r/ethereum	public		0	[]												
234	[]	False		Swole_Bodry			[]				text	t2_90r9txms	False	False	Fax	b67fad2e2edf27045555eadaf1e4a848ab242206	True	False					0	1653182993		0	{}	i9ijtai	False	t3_uuyv1i	False	True	t3_uuyv1i	/r/ethereum/comments/uuyv1i/really_excited_about_the_merge_but_im_even_more/i9ijtai/	1653183003	1	False	True	False	ethereum	t5_2zf9m	r/ethereum	public		0	[]												
235	[]	False		orion2145			[]				text	t2_p9mp6	False	False	"The dripping sarcasm in the response is amazing:

Wendell Berry provides writers enslaved by the computer with a handy alternative: Wife - a low-tech energy-saving device. Drop a pile of handwritten notes on Wife and you get back a finished manuscript, edited while it was typed. What computer can do that? Wife meets all of Berry's uncompromising standards for techno- logical innovation: she's cheap, repairable near home, and good for the family structure. Best of all, Wife is politically correct because she breaks a writer's ""direct dependence on strip-mined coal.""
History teaches us that Wife can also be used to beat rugs and wash clothes by hand, thus eliminating the need for the vacuum cleaner and washing machine, two more nasty machines that threaten the act of writing."	18deac12d8210871412aa1fe329445a63ec31dc6	True	False					0	1653182992		0	{}	i9ijt8j	False	t3_uutkb6	False	True	t3_uutkb6	/r/ethereum/comments/uutkb6/why_i_am_not_going_to_buy_a_computer_wendell/i9ijt8j/	1653183004	1	False	True	False	ethereum	t5_2zf9m	r/ethereum	public		0	[]												
236	[]	False		SMAMtastic			[]				text	t2_12qu5g	False	False	What do you think the horses were for?	57e5011dca0ab965d12da3176ce1390cbefdb96f	True	False					0	1653182930		0	{}	i9ijp5y	False	t3_uutkb6	False	True	t1_i9hp9rg	/r/ethereum/comments/uutkb6/why_i_am_not_going_to_buy_a_computer_wendell/i9ijp5y/	1653182947	1	False	True	False	ethereum	t5_2zf9m	r/ethereum	public		0	[]												
237	[]	False		Hot_Ask_3360			[]				text	t2_ci2hz5kf	False	False	Loopring!!!	aa0bf592ee3bdee6ebc8958fac76127f08e84d68	True	False					0	1653182643		0	{}	i9ij60o	False	t3_uuxv0b	False	True	t3_uuxv0b	/r/ethereum/comments/uuxv0b/nice_fees/i9ij60o/	1653182654	1	False	True	False	ethereum	t5_2zf9m	r/ethereum	public		0	[]												
238	[]	False		Dismal_Ad_7318			[]				text	t2_5pk59l3t	False	False	he explains why he is happy with his typewriter.	1dc64ddc86c236b7a925a4b402e4312e97889981	True	False					0	1653182167		0	{}	i9ii9ob	False	t3_uutkb6	False	True	t3_uutkb6	/r/ethereum/comments/uutkb6/why_i_am_not_going_to_buy_a_computer_wendell/i9ii9ob/	1653182184	1	False	True	False	ethereum	t5_2zf9m	r/ethereum	public		0	[]												
239	[]	False		FaceDeer			[]				text	t2_4ljvm	False	False	"Oh, neat. I'd heard that it had been greatly simplified, but I still assumed that ""greatly simplified"" must still be ""rather complex"" given how big a challenge this sort of thing is."	61c4bea1308f5546985175917be39f280ab5542e	True	False					0	1653181778		0	{}	i9ihj35	False	t3_uts8xx	False	True	t1_i9ib5hl	/r/ethereum/comments/uts8xx/ethereum_devs_tip_the_merge_will_occur_in_august/i9ihj35/	1653181792	1	False	True	False	ethereum	t5_2zf9m	r/ethereum	public		0	[]												
240	[]	False		EAscripting			[]				text	t2_lins2a10	False	False	Why my dude?	e7516ad6b0323adec74c5b779f2886cee4482b10	True	False					0	1653181640		0	{}	i9ih9wt	True	t3_uuzqi6	False	True	t1_i9ih59g	/r/ethereum/comments/uuzqi6/ethereum_crash_course_for_begginers/i9ih9wt/	1653181654	1	False	True	False	ethereum	t5_2zf9m	r/ethereum	public		0	[]												
241	[]	False		InfamousAd2528			[]				text	t2_7tgoj6c9	False	False	ban this bird	65406b3bea5d932ac99771a3a5bfba4d6e981a8a	True	False					0	1653181567		0	{}	i9ih59g	False	t3_uuzqi6	False	True	t3_uuzqi6	/r/ethereum/comments/uuzqi6/ethereum_crash_course_for_begginers/i9ih59g/	1653181581	1	False	True	False	ethereum	t5_2zf9m	r/ethereum	public		0	[]												
242	[]	False		lavastorm			[]				text	t2_53mf2	False	False	They have a website for that https://www.eip4844.com	4b2f350fd45a502c7cf137f8baefd72e8542dc84	True	False					0	1653181416		0	{}	i9igv3c	False	t3_uuyv1i	False	True	t1_i9ic9hk	/r/ethereum/comments/uuyv1i/really_excited_about_the_merge_but_im_even_more/i9igv3c/	1653181429	1	False	True	False	ethereum	t5_2zf9m	r/ethereum	public		0	[]												
243	[]	False		Cryptomaniacuk			[]				text	t2_r31pph7	False	False	Their all fresh accounts and all got all their stuff for sale for peanuts, sorry but even the contract addresses of the assets don't match up	8697cdeace76e750b007a05128a5fef3b0e32995	True	False					0	1653181278		0	{}	i9iglzq	False	t3_uuz029	False	True	t1_i9iecvj	/r/ethereum/comments/uuz029/view_nft_wallets_of_famous_people_and_brands/i9iglzq/	1653181292	1	False	True	False	ethereum	t5_2zf9m	r/ethereum	public		0	[]												
244	[]	False		L0ckeandDemosthenes			[]				text	t2_aoabfhk	False	True	Well to be honest electricity is pretty dumb and caused most of our problems. Computers are stoopid boxes and just replaced the dumb TV box with a dumber chat box. Without electricity the world could truly chill. Man, electricity is dumb the Amish got it figured out.	a2a39ca0c399236f805a3b2215b6c22f9390230a	True	False					0	1653181182		0	{}	i9igf9v	False	t3_uutkb6	False	True	t1_i9hjwb3	/r/ethereum/comments/uutkb6/why_i_am_not_going_to_buy_a_computer_wendell/i9igf9v/	1653181200	1	False	True	False	ethereum	t5_2zf9m	r/ethereum	public		0	[]												
245	[]	False		[deleted]						dark					[removed]	fe993932d6dced4c0a879e9aa5d7a6e0fbb467f5	True	False					0	1653181033		0	{}	i9ig5ax	False	t3_uum7kc	False	True	t1_i9h048v	/r/ethereum/comments/uum7kc/vitalik_encourages_ethereum_devs_to_build/i9ig5ax/	1653181048	1	False	True	False	ethereum	t5_2zf9m	r/ethereum	public		0	[]												
246	[]	False		[deleted]						dark					[removed]	fe993932d6dced4c0a879e9aa5d7a6e0fbb467f5	True	False					0	1653181027		0	{}	i9ig4z3	False	t3_uutkb6	False	True	t1_i9iej9n	/r/ethereum/comments/uutkb6/why_i_am_not_going_to_buy_a_computer_wendell/i9ig4z3/	1653181041	1	False	True	False	ethereum	t5_2zf9m	r/ethereum	public		0	[]												
247	[]	False		[deleted]						dark					[removed]	fe993932d6dced4c0a879e9aa5d7a6e0fbb467f5	True	False					0	1653180910		0	{}	i9ifx3c	False	t3_uum7kc	False	True	t3_uum7kc	/r/ethereum/comments/uum7kc/vitalik_encourages_ethereum_devs_to_build/i9ifx3c/	1653180927	1	False	True	False	ethereum	t5_2zf9m	r/ethereum	public		0	[]												
248	[]	False		Ilaypipe0012			[]				text	t2_chh283t2	False	False	Who dat	0d3f266681bd5b088c341810837dc8f9162838c4	True	False					0	1653180586		0	{}	i9ifbp3	False	t3_uuzx2p	False	True	t3_uuzx2p	/r/ethereum/comments/uuzx2p/seth_curry_nft_wallet_famous_wallets/i9ifbp3/	1653180599	1	False	True	False	ethereum	t5_2zf9m	r/ethereum	public		0	[]												
249	[]	False		cubsfan2154			[]				text	t2_vh6f2	False	False	Yeah... on this very sub when it comes to NFTs	de8eb2b21469004b66858b38d3f1150c851e97c6	True	False					0	1653180154		0	{}	i9iej9n	False	t3_uutkb6	False	True	t3_uutkb6	/r/ethereum/comments/uutkb6/why_i_am_not_going_to_buy_a_computer_wendell/i9iej9n/	1653180171	1	False	True	False	ethereum	t5_2zf9m	r/ethereum	public		0	[]												
