Unnamed: 0	all_awardings	archived	associated_award	author	author_flair_background_color	author_flair_css_class	author_flair_richtext	author_flair_template_id	author_flair_text	author_flair_text_color	author_flair_type	author_fullname	author_patreon_flair	author_premium	body	body_sha1	can_gild	collapsed	collapsed_because_crowd_control	collapsed_reason	collapsed_reason_code	comment_type	controversiality	created_utc	distinguished	gilded	gildings	id	is_submitter	link_id	locked	no_follow	parent_id	permalink	retrieved_utc	score	score_hidden	send_replies	stickied	subreddit	subreddit_id	subreddit_name_prefixed	subreddit_type	top_awarded_type	total_awards_received	treatment_tags	unrepliable_reason	corpus	support	knowledge	conflict	power	similarity	fun	status	trust	identity	romance
100	[]	False		Yoghurt114			[]				text	t2_fl71w	False	False	Lmao	f01af540b3ca4638a70d274cbf46764e6adb2afb	True	False					0	1653203453		0	{}	i9jeowf	False	t3_uv0oap	False	True	t3_uv0oap	/r/Bitcoin/comments/uv0oap/forgive_my_ignorance_but_if_there_are_only_15000/i9jeowf/	1653203469	1	True	True	False	Bitcoin	t5_2s3qj	r/Bitcoin	public		0	[]												
101	[]	False		YoMammaSoThin			[]				text	t2_6kiyr	False	False	This entire thing is about the death of an obsolete technology: central banking.	4eed2a081536e71dede52b943deed7c3ff46766e	True	False					0	1653203381		0	{}	i9jelz4	False	t3_uujr7e	False	True	t3_uujr7e	/r/Bitcoin/comments/uujr7e/the_fiat_system_is_doing_just_fine_what_you_are/i9jelz4/	1653203395	1	True	True	False	Bitcoin	t5_2s3qj	r/Bitcoin	public		0	[]												
102	[]	False		[deleted]						dark					[removed]	fe993932d6dced4c0a879e9aa5d7a6e0fbb467f5	True	False					0	1653203378		0	{}	i9jelun	False	t3_uv5oxu	False	True	t3_uv5oxu	/r/Bitcoin/comments/uv5oxu/install_cryptotab_browser_and_get_real_bitcoins/i9jelun/	1653203394	1	True	True	False	Bitcoin	t5_2s3qj	r/Bitcoin	public		0	[]												
103	[]	False		ndgoLiberty			[]				text	t2_k11mk82	False	False	Absolutely bear. Really it’s been bear since we went under 52k we were all just too busy shooting up hopium	b157ce6cc8078b24b5ad90a3af2f4e098ccbd998	True	False					0	1653203338		0	{}	i9jek5k	False	t3_uv42l5	False	True	t3_uv42l5	/r/Bitcoin/comments/uv42l5/really_we_are_in_bear_market/i9jek5k/	1653203354	1	True	True	False	Bitcoin	t5_2s3qj	r/Bitcoin	public		0	[]												
104	[]	False		ThotDoge69			[]				text	t2_8b6racru	False	False	"I bought in 2017 when Btc was 3k, than it ran up to 20k and didn't sold. Then it came all the way back down to like 4k. I DCA during those years from 2017 to late 2020. I did not see big profit until almost 2021, but those years after the drop from 20k to 3k sure were painful.  
  
This time around I took my profit and am happy I did. The bigger the portfolio, the hardest it is to see it fall."	9aa52e54fd669149ff285e210182a92a50caab4c	True	False					0	1653203289		0	{}	i9jei5h	False	t3_uv42l5	False	False	t1_i9jdtk4	/r/Bitcoin/comments/uv42l5/really_we_are_in_bear_market/i9jei5h/	1653203300	1	True	True	False	Bitcoin	t5_2s3qj	r/Bitcoin	public		0	[]												
105	[]	False		Mikey_Dread			[]				text	t2_tgasi	False	False	Great work dude, thanks for sharing.	cc0adecb073524f99a3a6ebe6c2c7ea9d2bb13e3	True	False					0	1653203234		0	{}	i9jefyt	False	t3_uv01e2	False	True	t3_uv01e2	/r/Bitcoin/comments/uv01e2/btc_rainbow_signals_in_google_spreadsheets/i9jefyt/	1653203251	1	True	True	False	Bitcoin	t5_2s3qj	r/Bitcoin	public		0	[]												
106	[]	False		SegheCoiPiedi1777			[]				text	t2_a0rnd2rx	False	False	The IMF is supposed to NOT lend money to a country when it knows that said money will be misused and it’s citizens will be left with the bill to pay. The IMF is a clueless, corrupted institution that promotes austerity measures that have been proven not to work over and over again, only fucking up common citizens and spiraling countries into debt forever.	0ea1b6e58c16281131302aaad3db0b7e822b6d91	True	False					0	1653203213		0	{}	i9jef2l	False	t3_uupewp	False	True	t1_i9jdl0m	/r/Bitcoin/comments/uupewp/ecbeu_plans_next_attack_on_bitcoin_suggests_a/i9jef2l/	1653203230	1	True	True	False	Bitcoin	t5_2s3qj	r/Bitcoin	public		0	[]												
107	[]	False		TastyLaksa			[]				text	t2_8lj73	False	False	Why is $BTC still under $30k?	0949f3d0f38d0ce9b43c305fd9a6b1f320143bba	True	False					0	1653203181		0	{}	i9jedrk	False	t3_uv3yts	False	True	t3_uv3yts	/r/Bitcoin/comments/uv3yts/daily_discussion_may_22_2022/i9jedrk/	1653203196	1	True	True	False	Bitcoin	t5_2s3qj	r/Bitcoin	public		0	[]												
108	[]	False		graffstadt			[]				text	t2_a5u26d8f	False	False	So, uhm, Argentina  AMA	fb18b83cf087cb7d6bb7c949b7179abebf27cfe4	True	False					0	1653203160		0	{}	i9jecwl	False	t3_uujr7e	False	True	t3_uujr7e	/r/Bitcoin/comments/uujr7e/the_fiat_system_is_doing_just_fine_what_you_are/i9jecwl/	1653203175	1	True	True	False	Bitcoin	t5_2s3qj	r/Bitcoin	public		0	[]												
109	[]	False		ThotDoge69			[]				text	t2_8b6racru	False	False	"I bought in 2017 when Btc was 3k, than it ran up to 20k and didn't sold. Then it came all the way back down to like 4k. I DCA during those years from 2017 to late 2020. I did not see big profit until almost 2021, but those years after the drop from 20k to 3k sure were painful. 

This time around I took my profit and am happy I did. The bigger the portfolio, the hardest it is to see it fall."	2c6019e4735a33e68dd47de4560567c2f75568ef	True	False					0	1653203075		0	{}	i9je9bk	False	t3_uv42l5	False	True	t3_uv42l5	/r/Bitcoin/comments/uv42l5/really_we_are_in_bear_market/i9je9bk/	1653203092	1	True	True	False	Bitcoin	t5_2s3qj	r/Bitcoin	public		0	[]												
110	[]	False		Beautiful-Relief-268			[]				text	t2_b4pjyj60	False	False	true	5ffe533b830f08a0326348a9160afafc8ada44db	True	False					0	1653203050		0	{}	i9je89d	False	t3_uusaey	False	True	t1_i9jdh0o	/r/Bitcoin/comments/uusaey/how_can_btc_be_going_down_if_the_market_is_also/i9je89d/	1653203065	1	True	True	False	Bitcoin	t5_2s3qj	r/Bitcoin	public		0	[]												
111	[]	False		arbalest_22			[]				text	t2_42pt37zs	False	False	Unfortunately, I don’t have a lightning wallet set up either.	daff027a366315c4eb367667d7d1188f8dbe80ac	True	False					0	1653203024		0	{}	i9je75k	False	t3_uv5dc1	False	True	t1_i9jdzmz	/r/Bitcoin/comments/uv5dc1/hey_guys_play_me_in_poker_if_you_are_in_lightning/i9je75k/	1653203038	1	True	True	False	Bitcoin	t5_2s3qj	r/Bitcoin	public		0	[]												
112	[]	False		BedroomWonderful			[]				text	t2_9sof4v4u	False	False	"“what did the pizza place do with that BTC”
Thank you for this colossal facepalm moment. Holy shit."	ae263a7a50cfbb64f652db206e5dda7ee958d9d7	True	False					0	1653202991		0	{}	i9je5sg	False	t3_uv1785	False	False	t3_uv1785	/r/Bitcoin/comments/uv1785/so_bitcoin_pizza_day/i9je5sg/	1653203004	1	True	True	False	Bitcoin	t5_2s3qj	r/Bitcoin	public		0	[]												
113	[]	False		Hipcatjack			[]				text	t2_4769e	False	True	"Actually i thought of a better analogy…
You have a google docs sheet shared with ten other people… each person can read the sheet, BUT only one person at a time can edit the sheet. This is decided by who gets the highest score in under a minuet from that hidden dinosaur jump game Chrome has when no internet. The person with the highest score after a minuet gets to make ONE efit. Thrn the newly edited sheet is perma saved by everyone who can read it. And then the next edit happens and everyone starts the dinosaur jump game all over again. And so on and so on… all the while every single edit is logged by everyone ."	a20dedf87bdf6dbad3fdd6033e7bb35be88a4e04	True	False					0	1653202978		0	{}	i9je59c	False	t3_uv4z8u	False	True	t3_uv4z8u	/r/Bitcoin/comments/uv4z8u/how_does_bitcoin_network_exactly_work/i9je59c/	1653202991	1	True	True	False	Bitcoin	t5_2s3qj	r/Bitcoin	public		0	[]												
114	[]	False		Caponcapoffstillon			[]				text	t2_30is8zqb	False	False	If you actually looked up an into video to bitcoin you’d have your answer	f1f8b729ebb166e9693e01a68ca2ca79c8652c4b	True	False					0	1653202913		0	{}	i9je2hc	False	t3_uv5i21	False	True	t3_uv5i21	/r/Bitcoin/comments/uv5i21/rebroadcasting_a_signed_transaction/i9je2hc/	1653202930	1	True	True	False	Bitcoin	t5_2s3qj	r/Bitcoin	public		0	[]												
115	[]	False		AdviceImpressive219			[]				text	t2_amifyktt	False	False	Come on it’s only a 200 sat game, I am friendly!! We can have a chat too!! Will be fin	6bf6a6a676966f667427c0119fd43e640f9d3099	True	False					0	1653202846		0	{}	i9jdzmz	True	t3_uv5dc1	False	False	t1_i9jdxff	/r/Bitcoin/comments/uv5dc1/hey_guys_play_me_in_poker_if_you_are_in_lightning/i9jdzmz/	1653202862	1	True	True	False	Bitcoin	t5_2s3qj	r/Bitcoin	public		0	[]												
116	[]	False		nic1058			[]				text	t2_f2du7kfg	False	False	I hope he will understand that thing but still it's good thing.	619eb01a1d4c1726a9de6c86b40fce755b81c68a	True	False					0	1653202823		0	{}	i9jdylo	False	t3_uu772m	False	True	t1_i9fmjun	/r/Bitcoin/comments/uu772m/im_not_afraid_to_tell_the_world_i_love_bitcoin/i9jdylo/	1653202835	1	True	True	False	Bitcoin	t5_2s3qj	r/Bitcoin	public		0	[]												
117	[]	False		Ghost_Lawless		noob	[{'e': 'text', 't': 'redditor for 3 months'}]	2ec8e69e-6c36-11e9-a04b-0afb553d4ea6	redditor for 3 months	dark	richtext	t2_jc2yqhqi	False	False	There is no escape of these feelings, it's just something normal I guess and we should not take these things that seriously, it's okay to have some type of pressure while transacting.	35a9885ee0c3be2280830e985f4641caf851cd19	True	False					0	1653202821		0	{}	i9jdygx	False	t3_uuazk2	False	False	t3_uuazk2	/r/Bitcoin/comments/uuazk2/is_it_ok_to_feel_like_this/i9jdygx/	1653202835	1	True	True	False	Bitcoin	t5_2s3qj	r/Bitcoin	public		0	[]												
118	[]	False		arbalest_22			[]				text	t2_42pt37zs	False	False	If I wasn’t drunk I’d do it. Maybe another time. lol	ecdcc94f72bb637ff980fa6ca75714556a288952	True	False					0	1653202799		0	{}	i9jdxff	False	t3_uv5dc1	False	True	t3_uv5dc1	/r/Bitcoin/comments/uv5dc1/hey_guys_play_me_in_poker_if_you_are_in_lightning/i9jdxff/	1653202814	1	True	True	False	Bitcoin	t5_2s3qj	r/Bitcoin	public		0	[]												
119	[]	False		Middle-Pattern3712			[]				text	t2_9xd80i5f	False	False	What years were you DCA that you haven't seen returns? Even 2017 if you were DCA for years your value would've gone up an absurd amount.	471cc8df8f9f27c2de423ceb97bd0b4ba116ab5f	True	False					0	1653202698		0	{}	i9jdtk4	False	t3_uv42l5	False	True	t1_i9j8m99	/r/Bitcoin/comments/uv42l5/really_we_are_in_bear_market/i9jdtk4/	1653202714	1	True	True	False	Bitcoin	t5_2s3qj	r/Bitcoin	public		0	[]												
120	[]	False		Stenny007			[]				text	t2_rz147	False	False	"Love how so much of this sub has skipped economics 101.

Deflation is a rather bad thing if your economy relies on a huge export sector."	5b2c92a5a1fe60365e54d8d2c64c869f167b996d	True	False					0	1653202673		0	{}	i9jdsj2	False	t3_uujr7e	False	True	t1_i9hvpb3	/r/Bitcoin/comments/uujr7e/the_fiat_system_is_doing_just_fine_what_you_are/i9jdsj2/	1653202687	1	True	True	False	Bitcoin	t5_2s3qj	r/Bitcoin	public		0	[]												
121	[]	False		Game_13			[]			dark	text	t2_a1xvru06	False	False	haha. You forget the most important. Market is rigged and follows no logic. It just follows the orders from its owners.	da0efdf73b276d5ca7b87c79c16de5f3e3704fb1	True	False					0	1653202633		0	{}	i9jdqvs	False	t3_uuy972	False	True	t3_uuy972	/r/Bitcoin/comments/uuy972/as_we_currently_enter_a_recession_worse_than_2008/i9jdqvs/	1653202646	1	True	True	False	Bitcoin	t5_2s3qj	r/Bitcoin	public		0	[]												
122	[]	False		TheChildOfChange			[]				text	t2_a01k148y	False	False	100$ for two pizzas is scary enough	a11505c0a869b49c94183afeee0ce88fa4c4c617	True	False					0	1653202576		0	{}	i9jdoir	False	t3_uv4890	False	True	t3_uv4890	/r/Bitcoin/comments/uv4890/the_dangers_of_inflation/i9jdoir/	1653202587	1	True	True	False	Bitcoin	t5_2s3qj	r/Bitcoin	public		0	[]												
123	[]	False		Milk77cookies			[]				text	t2_alxxsivx	False	False	Btc	a35240845770ea48a0c11aee9aa99a8e2c30c5bc	True	False					0	1653202566		0	{}	i9jdo4p	False	t3_uuy9rq	False	True	t3_uuy9rq	/r/Bitcoin/comments/uuy9rq/i_dont_know_who_needs_to_hear_this_but_the_first/i9jdo4p/	1653202580	1	True	True	False	Bitcoin	t5_2s3qj	r/Bitcoin	public		0	[]												
124	[]	False		TheNintendoWii			[]			dark	text	t2_ea2umd1z	False	False	[Read my comment on the subject](https://www.reddit.com/r/Bitcoin/comments/uurzww/bitcoin_is_now_legal_tender_in_five_governments/i9jddo2)	37cba6cd133de2bf323d06dc91f2fa53f6b4b07f	True	False					0	1653202517		0	{}	i9jdm3t	False	t3_uurzww	False	True	t1_i9j1u3x	/r/Bitcoin/comments/uurzww/bitcoin_is_now_legal_tender_in_five_governments/i9jdm3t/	1653202533	1	True	True	False	Bitcoin	t5_2s3qj	r/Bitcoin	public		0	[]												
125	[]	False		raphas			[]				text	t2_3sbb6d	False	False	I suppose the IMF is just supposed to pay a country debt and not ask anything in return. Of course there has to be consequences for asking help with this last resort measure, they have tried everything before, now someone actually competent can come in and put back the country on the right course, see Greece for an example	0875e5bd8be977eb040a6effa6247038f7e5ea83	True	False					0	1653202505		0	{}	i9jdllh	False	t3_uupewp	False	True	t1_i9hfd3x	/r/Bitcoin/comments/uupewp/ecbeu_plans_next_attack_on_bitcoin_suggests_a/i9jdllh/	1653202519	1	True	True	False	Bitcoin	t5_2s3qj	r/Bitcoin	public		0	[]												
126	[]	False		raphas			[]				text	t2_3sbb6d	False	False	I suppose the IMF is just supposed to pay a country debt and not ask anything in return. Of course there has to be consequences for asking help with this last resort measure, they have tried everything before, now someone actually competent can come in and put back the country on the right course, see Greece for an example	0875e5bd8be977eb040a6effa6247038f7e5ea83	True	False					0	1653202491		0	{}	i9jdl0m	False	t3_uupewp	False	True	t1_i9hfd3x	/r/Bitcoin/comments/uupewp/ecbeu_plans_next_attack_on_bitcoin_suggests_a/i9jdl0m/	1653202507	1	True	True	False	Bitcoin	t5_2s3qj	r/Bitcoin	public		0	[]												
127	[]	False		ariN_CS			[]				text	t2_3fe9vbdg	False	False	Correct! The less you know the higher is your fear	fc5655f477cd160baf72b3f7cd64748cea4d7473	True	False					0	1653202471		0	{}	i9jdk85	False	t3_uuouba	False	True	t1_i9i46pv	/r/Bitcoin/comments/uuouba/me_researching_btc_last_year_before_going_all_in/i9jdk85/	1653202486	1	True	True	False	Bitcoin	t5_2s3qj	r/Bitcoin	public		0	[]												
128	[]	False		TheNintendoWii			[]			dark	text	t2_ea2umd1z	False	False	Eh, Swede here. Correct term is social democrats - we’re not full on Soviet socialist ;)	8c436b92765257afe0d241b279b9ba994a63c7bb	True	False					0	1653202441		0	{}	i9jdizx	False	t3_uurzww	False	True	t1_i9j9nvw	/r/Bitcoin/comments/uurzww/bitcoin_is_now_legal_tender_in_five_governments/i9jdizx/	1653202452	1	True	True	False	Bitcoin	t5_2s3qj	r/Bitcoin	public		0	[]												
129	[]	False		Knurlinger			[]				text	t2_gvhxc	False	False	Curious too, was looking at .btc domains recently which are offered by stacks too (but not supported by wallets afaik)	7bf30d22657a0309c60b4ccc6cc4d4a0309dc423	True	False					0	1653202404		0	{}	i9jdhio	False	t3_uv3fx4	False	False	t3_uv3fx4	/r/Bitcoin/comments/uv3fx4/what_is_everyones_thoughts_on_stacks/i9jdhio/	1653202418	1	True	True	False	Bitcoin	t5_2s3qj	r/Bitcoin	public		0	[]												
130	[]	False		dextersh			[]				text	t2_43suc	False	False	OK, but prepare for 4-digit bitcoin just in case	a07be3e968b054cbc65057eecb8e4c1d67a831d2	True	False					0	1653202401		0	{}	i9jdhec	False	t3_uuy972	False	True	t3_uuy972	/r/Bitcoin/comments/uuy972/as_we_currently_enter_a_recession_worse_than_2008/i9jdhec/	1653202418	1	True	True	False	Bitcoin	t5_2s3qj	r/Bitcoin	public		0	[]												
131	[]	False		saltyfinish			[]				text	t2_7b9ler8	False	False	And my axe….	6e7fbc06f436029b8ef205d132756512760be72c	True	False					0	1653202391		0	{}	i9jdh0o	False	t3_uusaey	False	True	t1_i9hr6k3	/r/Bitcoin/comments/uusaey/how_can_btc_be_going_down_if_the_market_is_also/i9jdh0o/	1653202404	1	True	True	False	Bitcoin	t5_2s3qj	r/Bitcoin	public		0	[]												
132	[]	False		never_safe_for_life			[]				text	t2_d45if	False	False	Jesus man, read this thread instead of posting on it.	37da80f602945dfe4964cd615d5f66c969aea3e0	True	False					0	1653202359		0	{}	i9jdfpp	False	t3_uv0oap	False	True	t1_i9imssv	/r/Bitcoin/comments/uv0oap/forgive_my_ignorance_but_if_there_are_only_15000/i9jdfpp/	1653202377	1	True	True	False	Bitcoin	t5_2s3qj	r/Bitcoin	public		0	[]												
133	[]	False		mrv1ckt3r			[]			dark	text	t2_fl1bj3qt	False	False	I’ve used https://ln.cash to gift some Bitcoin.	1b0e209a078989077bfc4de4e7759cd1b7635900	True	False					0	1653202344		0	{}	i9jdf47	False	t3_uuy9cs	False	True	t3_uuy9cs	/r/Bitcoin/comments/uuy9cs/is_egifter_legit/i9jdf47/	1653202355	1	True	True	False	Bitcoin	t5_2s3qj	r/Bitcoin	public		0	[]												
134	[]	False		Hipcatjack			[]				text	t2_4769e	False	True	"No, quite literally by design, there is not centralised server. 
Basically think of the BtC network as a smaller internet inside the normal internet. In order for one “coin” to be “moved” to another, your computer(dex or cex) places the value of your wallet to zero and adds to the value of the wallet you are sending the coin to. Like on a ledger. Then literally every single “miner” in the world checks to see if this was correct. The first one to  prove that this transaction took place (by doing some math problems) gets to write(update) that transaction to the BIG ledger every computer on the mini internet has an exact copy of, and as a reward for being the first in the world on this mini internet to verify that transaction, THAT computer gets a few Bitcoins as a reward. This incentivising the whole mini-internet system to keep doing those math problems."	ceb4152d92da374bbafb253fad6a3cbc43d839b0	True	False					0	1653202320		0	{}	i9jde31	False	t3_uv4z8u	False	True	t3_uv4z8u	/r/Bitcoin/comments/uv4z8u/how_does_bitcoin_network_exactly_work/i9jde31/	1653202336	1	True	True	False	Bitcoin	t5_2s3qj	r/Bitcoin	public		0	[]												
135	[]	False		d3vrandom			[]				text	t2_bmi9k	False	False	"Restore from seed using electrum by following this guide:
https://bitcoinelectrum.com/restoring-your-multibithd-wallet-in-electrum/"	c823268f7f07ba8362d0978e6ca9fa04b224e503	True	False					0	1653202315		0	{}	i9jddwc	False	t3_uv3oe7	False	True	t3_uv3oe7	/r/Bitcoin/comments/uv3oe7/bluewallet_claims_that_i_sold_more_btc_than_i/i9jddwc/	1653202329	1	True	True	False	Bitcoin	t5_2s3qj	r/Bitcoin	public		0	[]												
136	[]	False		gkush3			[]				text	t2_13uzbhzs	False	False	Joining...	757a266e7519d915cc6b6a7a009cba136fe4d0ec	True	False					0	1653202312		0	{}	i9jddrn	False	t3_uv5dc1	False	True	t1_i9jd9kj	/r/Bitcoin/comments/uv5dc1/hey_guys_play_me_in_poker_if_you_are_in_lightning/i9jddrn/	1653202329	1	True	True	False	Bitcoin	t5_2s3qj	r/Bitcoin	public		0	[]												
137	[]	False		jh830186			[]				text	t2_9nla93vb	False	False	Madeira is not a country, you tool. It’s an island in Portugal.	ddbf603919b91e34a03d938b58b56090e03f40c9	True	False					0	1653202311		0	{}	i9jddq8	False	t3_uurzww	False	True	t3_uurzww	/r/Bitcoin/comments/uurzww/bitcoin_is_now_legal_tender_in_five_governments/i9jddq8/	1653202322	1	True	True	False	Bitcoin	t5_2s3qj	r/Bitcoin	public		0	[]												
138	[]	False		TheNintendoWii			[]			dark	text	t2_ea2umd1z	False	False	"This is misleading. When people hear governments, they think countries. Let’s count them out, guys…  
Próspera - A special economic zone on a Honduran island  
Lugano - A city in Switzerland.  
Madeira - An autonomous archipelago in Portugal.

Adding to this, two of these are marked by OP as having *de facto* legal tender as bitcoin. De facto is latin and means in reality or in fact. The opposite is de jure which can be translated as in write or in law. By this logic, de facto and legal cannot be used in the same sentence.   Therefore:  
Madeira - Has no intention of making Bitcoin *legal* legal tender (you hear how that sounds?) (source https://www.theblockcrypto.com/amp/post/142173/no-madeira-is-not-making-bitcoin-legal-tender)  
Lugano - Swiss franc is still the legal tender in Lugano. Bitcoin and USDT happen to be acceptable and the government encourages it - but it is not legal tender. (Source https://www.coindesk.com/business/2022/03/03/swiss-city-of-lugano-to-make-bitcoin-and-tether-de-facto-legal-tender/)"	a9a1bf4cc1b29352fec0c89a0d6ca34751c31702	True	False					0	1653202310		0	{}	i9jddo2	False	t3_uurzww	False	True	t3_uurzww	/r/Bitcoin/comments/uurzww/bitcoin_is_now_legal_tender_in_five_governments/i9jddo2/	1653202322	1	True	True	False	Bitcoin	t5_2s3qj	r/Bitcoin	public		0	[]												
139	[]	False		bobbyv137			[]				text	t2_9r7xzckj	False	True	"I appreciate many people discredit technical analysis but having studied it over recent months and identified a handful of quality analysts on YouTube\*, I believe it absolutely works. 

You say it's a ""low probability"" - the TA indicates there's a high probability sub $20k is hit. 

$10k does seem like a ""stupid"" number, however do remember a typical 80% drawdown from the all time high as per historical cycles puts BTC at circa $14k, which isn't far off.

Ultimately we're all speculating and BTC has a tendency to make fools out of the best of us. The best strategy is to actually have a strategy and pivot accordingly."	b2376cdba5df301cacc9e36d72182db148e581c5	True	False					0	1653202290		0	{}	i9jdcv3	False	t3_uuhxpp	False	False	t1_i9hk5ie	/r/Bitcoin/comments/uuhxpp/im_resisting_the_temptation/i9jdcv3/	1653202302	1	True	True	False	Bitcoin	t5_2s3qj	r/Bitcoin	public		0	[]												
140	[]	False		[deleted]						dark					[removed]	fe993932d6dced4c0a879e9aa5d7a6e0fbb467f5	True	False					0	1653202274		0	{}	i9jdc6h	False	t3_uv0oap	False	True	t1_i9j7fr9	/r/Bitcoin/comments/uv0oap/forgive_my_ignorance_but_if_there_are_only_15000/i9jdc6h/	1653202289	1	True	True	False	Bitcoin	t5_2s3qj	r/Bitcoin	public		0	[]												
141	[]	False		Space-Dementia			[]				text	t2_4tjza	False	False	Yea that was a nice 86% retrace on the markets, could be best buying opportunity of a lifetime.	f3d8483a902b47f2f244742f8b6b488cd0f445fe	True	False					0	1653202235		0	{}	i9jdal4	False	t3_uuy972	False	True	t1_i9ikifi	/r/Bitcoin/comments/uuy972/as_we_currently_enter_a_recession_worse_than_2008/i9jdal4/	1653202248	1	True	True	False	Bitcoin	t5_2s3qj	r/Bitcoin	public		0	[]												
142	[]	False		AdviceImpressive219			[]				text	t2_amifyktt	False	False	Play me I’m waiting on the table	a0d9ca3130b09bd45c76af77e169a37f32196c8a	True	False					0	1653202211		0	{}	i9jd9kj	True	t3_uv5dc1	False	True	t1_i9jd8lp	/r/Bitcoin/comments/uv5dc1/hey_guys_play_me_in_poker_if_you_are_in_lightning/i9jd9kj/	1653202221	1	True	True	False	Bitcoin	t5_2s3qj	r/Bitcoin	public		0	[]												
143	[]	False		gkush3			[]				text	t2_13uzbhzs	False	False	Hey, this looks good. I like it.	f66f14e961bb270007c67b17621deb988df9380d	True	False					0	1653202187		0	{}	i9jd8lp	False	t3_uv5dc1	False	True	t3_uv5dc1	/r/Bitcoin/comments/uv5dc1/hey_guys_play_me_in_poker_if_you_are_in_lightning/i9jd8lp/	1653202200	1	True	True	False	Bitcoin	t5_2s3qj	r/Bitcoin	public		0	[]												
144	[]	False		[deleted]						dark					[removed]	fe993932d6dced4c0a879e9aa5d7a6e0fbb467f5	True	False					0	1653202160		0	{}	i9jd7gz	False	t3_uuuso7	False	True	t1_i9i3szt	/r/Bitcoin/comments/uuuso7/my_gift_for_my_son_on_his_wedding_day/i9jd7gz/	1653202173	1	True	True	False	Bitcoin	t5_2s3qj	r/Bitcoin	public		0	[]												
145	[]	False		berylaite			[]				text	t2_5pzka	False	False	"Thanks

Do you have a link with the full interview? I love his confidence🙂"	b21ba5dfcce187c161a18bed84d8968d8f0f85ab	True	False					0	1653202073		0	{}	i9jd3to	False	t3_uv0oap	False	True	t1_i9ilxzy	/r/Bitcoin/comments/uv0oap/forgive_my_ignorance_but_if_there_are_only_15000/i9jd3to/	1653202083	1	True	True	False	Bitcoin	t5_2s3qj	r/Bitcoin	public		0	[]												
146	[]	False		Thirdlegproduction			[]				text	t2_kkdt9	False	False	"I REALLY can not comprehend people like this who want to argue against the fact that the coming recession/depression will be way worse than 2008, like under what rock have you been living to be in so much denial?

We didn't have 10% to 20% inflation, we didn't have record high gas/energy prices or incredibly high debts or a worldwide pandemic. A war with Russia or an upcoming food shortage and student debt being so high people are unable to pay them back.

2008 was a US housing bubble, 2022 is a global everything bubble that is being propped up with a money printing machine printing unlimited amounts of dollars but you're saying there's a low chance things get as bad as 2008?"	a90cb334e2306b5fc5ab6cb7ded4583a4cae006b	True	False					0	1653202067		0	{}	i9jd3lb	False	t3_uuy972	False	False	t1_i9ijsdi	/r/Bitcoin/comments/uuy972/as_we_currently_enter_a_recession_worse_than_2008/i9jd3lb/	1653202084	1	True	True	False	Bitcoin	t5_2s3qj	r/Bitcoin	public		0	[]												
147	[]	False		goshgod			[]				text	t2_55o6jtl4	False	False	Dam people are so freaked about a recession. It’s like STFU things are sort of bearish but it does NOT feel like 08. It may be bearish for a bit but for me, doesn’t feel like it’s going to be “despair”	00bcc416dd7fb9f59ece47154f43b4e1ac2a8154	True	False					0	1653202039		0	{}	i9jd2fw	False	t3_uuy972	False	True	t3_uuy972	/r/Bitcoin/comments/uuy972/as_we_currently_enter_a_recession_worse_than_2008/i9jd2fw/	1653202051	1	True	True	False	Bitcoin	t5_2s3qj	r/Bitcoin	public		0	[]												
