Unnamed: 0	all_awardings	archived	associated_award	author	author_flair_background_color	author_flair_css_class	author_flair_richtext	author_flair_template_id	author_flair_text	author_flair_text_color	author_flair_type	author_fullname	author_patreon_flair	author_premium	body	body_sha1	can_gild	collapsed	collapsed_because_crowd_control	collapsed_reason	collapsed_reason_code	comment_type	controversiality	created_utc	distinguished	gilded	gildings	id	is_submitter	link_id	locked	no_follow	parent_id	permalink	retrieved_utc	score	score_hidden	send_replies	stickied	subreddit	subreddit_id	subreddit_name_prefixed	subreddit_type	top_awarded_type	total_awards_received	treatment_tags	unrepliable_reason	author_cakeday	corpus	support	knowledge	conflict	power	similarity	fun	status	trust	identity	romance
299	[]	False		tobuno			[]				text	t2_fagnv	False	False	"""by the end of the year"" claimed by who? It's decentralized development, there is no one to give a target date, only for community consensus to agree it's time"	4fe48c85c004c61c0655464b781b9fce27d9efa4	True	False					0	1650209962		0	{}	i53cdf6	False	t3_u531qn	False	True	t1_i52ln05	/r/ethereum/comments/u531qn/id_like_to_hear_some_replies_particularly_about/i53cdf6/	1650209978	1	False	True	False	ethereum	t5_2zf9m	r/ethereum	public		0	[]													
300	[]	False		swap_catz			[]				text	t2_cxi1es8v	False	False	With nfts I believe we can digitize the best of both worlds. I don't think you're including the possibility of having KYC nfts like that created by pfpid.xyz, and using something like status to enforce troll and bot reduction simply by only allowing Soulbound NFTs. In some sense I agree with what you're saying, but I think you believe we shouldn't try to make an interoperable program where communities can enforce their own rules. There will always be trolls and hate groups. The point is to create gated communities where the trolls can be over there, and high quality communities can emerge using the interoperability of web3 technology.	2dcddf1009f2f6f296f17c1ee716244c3eeb8705	True	False					0	1650209879		0	{}	i53c6ks	True	t3_u5mjf6	False	True	t1_i53altt	/r/ethereum/comments/u5mjf6/status_messenger_shares_desktop_vision_tokennft/i53c6ks/	1650209895	1	False	True	False	ethereum	t5_2zf9m	r/ethereum	public		0	[]													
301	[]	False		Puzzleheaded-Top-263			[]				text	t2_a44y88kf	False	False	Mmm I see	7e604b2f5da6c4b026c60833df183e494b6ffb44	True	False					0	1650209600		0	{}	i53bjgx	True	t3_u5pbwi	False	True	t1_i53avil	/r/ethereum/comments/u5pbwi/whats_going_on/i53bjgx/	1650209613	1	False	True	False	ethereum	t5_2zf9m	r/ethereum	public		0	[]													
302	[]	False		throwaway_boulder			[]				text	t2_8d33d	False	False	"We’re still in the early nineties era of creativity when it comes to web3. People keep trying to retro-ft old paradigms into new technology instead of new paradigms. 

It reminds me of Compuserve. Their usernames were just strings of numbers — e.g. 87659,987 — because they thought online comms was like telephones. They thought you would memorize a few important numbers and use a directory like with the legacy phone system. They also charges by the minute like long distance calls. 

Web3 will remain a niche until novel use cases that enable entirely new behavior."	fe31b3480d0a747c5696960c0113a26b741545d2	True	False					0	1650209561		0	{}	i53bg7m	False	t3_u5mjf6	False	True	t3_u5mjf6	/r/ethereum/comments/u5mjf6/status_messenger_shares_desktop_vision_tokennft/i53bg7m/	1650209577	1	False	True	False	ethereum	t5_2zf9m	r/ethereum	public		0	[]													
303	[]	False		DragonXDT			[]				text	t2_tuio4	False	False	You find anything good OP?	322d00ee81e44d14ba83403d3b97d28d61fed6dc	True	False					0	1650209484		0	{}	i53b9sn	False	t3_kou0km	False	True	t3_kou0km	/r/ethereum/comments/kou0km/crypto_wallet_tracker/i53b9sn/	1650209495	1	False	True	False	ethereum	t5_2zf9m	r/ethereum	public		0	[]													
304	[]	False		Rumblestillskin			[]				text	t2_z8x6jzf	False	False	That is untrue. Even after my other response you still try to spread untruths.	6e874ed455f0f168457385bd0b10a012b87b83e4	True	False					0	1650209458		0	{}	i53b7n2	False	t3_u5mjf6	False	True	t1_i538a74	/r/ethereum/comments/u5mjf6/status_messenger_shares_desktop_vision_tokennft/i53b7n2/	1650209472	1	False	True	False	ethereum	t5_2zf9m	r/ethereum	public		0	[]													
305	[]	False		Olaf4586			[]				text	t2_2e02foli	False	False	"&gt;Based on her post history, she's at least 60 and is a drug addict. So, I wouldn't take life advice from her.

Man, fuck you."	90def90dffd2e6e4fa916970d5bff678c4289b2e	True	False					0	1650209419		0	{}	i53b4f1	False	t3_u54o7k	False	True	t1_i5319en	/r/ethereum/comments/u54o7k/how_often_do_you_use_your_crypto_as_a_currency_to/i53b4f1/	1650209435	1	False	True	False	ethereum	t5_2zf9m	r/ethereum	public		0	[]													
306	[]	False		[deleted]						dark					[removed]	fe993932d6dced4c0a879e9aa5d7a6e0fbb467f5	True	False					0	1650209304		0	{}	i53auoc	False	t3_u5pcfj	False	True	t3_u5pcfj	/r/ethereum/comments/u5pcfj/just_a_little_help_to_get_me_started/i53auoc/	1650209317	1	False	True	False	ethereum	t5_2zf9m	r/ethereum	public		0	[]													
307	[]	False		danhakimi			[]				text	t2_4d0ul	False	False	"1. He talks about why the only reason these things have value is that people organize around them. That's a very good point, except it calls to question why the fuck he works on a product like Status which nobody uses.

2. He almost skips over why we might want to host a social network on Ethereum entirely. He does not mention the fediverse, because crypto people don't think about the fediverse, not because of point one, but primarily because they can't figure out how to profit from it.

3. He then presents one issue with status: that the wallet focuses on price and not social features. I'd take a step back. Status is a wallet with a bunch of terrible social features shoehorned in. Nobody wants a messaging network where you have to pay to rent a username. Nobody wants a payment app combined with their messaging app. Nobody wants a dapp browser stapled to their messaging app. So if they want the wallet to focus on the social features, they should do away with the wallet and with Status as it is and make a social network instead of Status. They won't do that, of course.

4. He talks about a social network that's based on what you have in your wallet. *Nobody wants that*. Social networks are for friends, not money. It appears to be kind of a discord-type community thing, which... is like a tertiary kind of social network that people kind of want... but you have to own a certain amount of money or an NFT to join a community, and rent your username, and pay exorbitant fees for each of those privileges. So nobody's going to use it. I'm part of one paid discord community that works via patreon, and the amount I pay is fucking *annoying*, not because it's too much, but because human nature is to *hate* paying *anything* as a cost of talking to your friends. Yes, NFTs offer a similar, much more expensive, much more elaborate, much more complicated means by which to do this. (And much more secure in theory, but orders of magnitude less secure in practice, at least until we have a Free social recovery wallet app, which we currently do not, and a native social recovery wallet, which it seems we have no plans of ever doing?).

5. The wallet setup is still dramatically antisocial and antihuman. It's still the same non-custodial software wallet used everywhere else. Try showing that to a normie, see what happens. Try showing it to your mom, if your mom can actually figure it out and keep a secure wallet, I'll eat my hat. I also love that they tell people to keep their private keys on paper -- like, shit, when we were talking about passwords, that was terrible advice, and you can change your password if it gets lost or compromised, but now, with private keys... really? paper? that's a good idea now? Again, with all this talk of social crypto, you think social recovery would come into play, but no.

6. They brag that they can't shut a community down. They acknowledge that chats are a mess now, and their solution to that is... let the same assholes start communities and whatever happens happens. I understand the value of censorship resistance. But look at Telegram. Telegram is loaded with crypto spam, scams, misinformation, etc. That's what an uncensored social network looks like. Look at... Gab, and all the other right-wing troll networks. That's what uncensored social networks look like. You *will* get calls to violence, and death threats, and scams, and bigotry, and misinformation, and spam, in large amounts. Now, is it worth it, socially? Maybe. But meh."	48a84089191a509f964cd3b76c9d52aa74d01d86	True	False					0	1650209199		0	{}	i53altt	False	t3_u5mjf6	False	True	t3_u5mjf6	/r/ethereum/comments/u5mjf6/status_messenger_shares_desktop_vision_tokennft/i53altt/	1650209212	1	False	True	False	ethereum	t5_2zf9m	r/ethereum	public		0	[]													
308	[]	False		Schapsouille			[]				text	t2_1cnsev3u	False	False	No way what? At that time it was the price of Eth. Lum tech c7.	7c4430e8c38ff1b5148766accf165eef46834d3f	True	False					0	1650209077		0	{}	i53abrc	False	t3_u54o7k	False	True	t1_i537dq1	/r/ethereum/comments/u54o7k/how_often_do_you_use_your_crypto_as_a_currency_to/i53abrc/	1650209094	1	False	True	False	ethereum	t5_2zf9m	r/ethereum	public		0	[]													
309	[]	False		zippy9002			[]				text	t2_edps3	False	False	I used to do it all the time but changes in tax rules have made it way too cumbersome so now I don’t do it often anymore.	d2afc91d02d11503924aa549d08f80143d88e6ee	True	False					0	1650209001		0	{}	i53a5il	False	t3_u54o7k	False	True	t3_u54o7k	/r/ethereum/comments/u54o7k/how_often_do_you_use_your_crypto_as_a_currency_to/i53a5il/	1650209012	1	False	True	False	ethereum	t5_2zf9m	r/ethereum	public		0	[]													
310	[]	False		Rumblestillskin			[]				text	t2_z8x6jzf	False	False	"A smart contract can generate the tokens. Call the tokens whatever you want KishComFriends (KCF). Send em to your friends. Make your chat only available to people with your token. No cost involved. 

I feel if you don't understand this concept you are not in this subreddit out of interest but more out of looking to win an argument."	94d5dd5913607669dbcd79d385fb92c20abc2890	True	False					0	1650208890		0	{}	i539w0z	False	t3_u5mjf6	False	True	t1_i5390e6	/r/ethereum/comments/u5mjf6/status_messenger_shares_desktop_vision_tokennft/i539w0z/	1650208902	1	False	True	False	ethereum	t5_2zf9m	r/ethereum	public		0	[]													
311	[]	False		[deleted]						dark					[removed]	fe993932d6dced4c0a879e9aa5d7a6e0fbb467f5	True	False					0	1650208732		0	{}	i539iou	False	t3_u56oar	False	True	t3_u56oar	/r/ethereum/comments/u56oar/can_avalanche_really_kill_ethereum/i539iou/	1650208746	1	False	True	False	ethereum	t5_2zf9m	r/ethereum	public		0	[]													
312	[]	False		[deleted]						dark					[removed]	fe993932d6dced4c0a879e9aa5d7a6e0fbb467f5	True	False					0	1650208692		0	{}	i539fb7	False	t3_u531qn	False	True	t1_i536cts	/r/ethereum/comments/u531qn/id_like_to_hear_some_replies_particularly_about/i539fb7/	1650208708	1	False	True	False	ethereum	t5_2zf9m	r/ethereum	public		0	[]													
313	[]	False		Maswasnos			[]				text	t2_nr2mp	False	True	Yeah, this is another bot post guys. Very weird account activity.	096db0011ebe39972ee426af59e5de09820bb5b6	True	False					0	1650208680		0	{}	i539eb3	False	t3_u5h38t	False	True	t3_u5h38t	/r/ethereum/comments/u5h38t/with_the_ethereum_merger_no_longer_expected_in/i539eb3/	1650208693	1	False	True	False	ethereum	t5_2zf9m	r/ethereum	public		0	[]													
314	[]	False		BabydollPenny			[]				text	t2_5qxpemxm	False	False	It's been fun. Have a great Easter Sunday!!	b2e9b13d27e8910ad797694d3aec4c80e9d5e4fc	True	False					0	1650208558		0	{}	i53945z	False	t3_u54o7k	False	True	t1_i536xcg	/r/ethereum/comments/u54o7k/how_often_do_you_use_your_crypto_as_a_currency_to/i53945z/	1650208576	1	False	True	False	ethereum	t5_2zf9m	r/ethereum	public		0	[]													
315	[]	False		KishCom			[]				text	t2_1va3	False	False	"How does my friend acquire tokens? What if I have no friends with tokens?

I am asking rhetorical questions here. My point is that the starting point for this tech is _always_ a broker taking your fiat. (Yes: mining exists, but mining will be going away for ETH real soon, and is far beyond the technical abilities of most).

&gt; other cool programmatic things with it

Like what? Be specific. As a developer I am always looking for APIs that are better than what I'm using. The Web3 tech stack is left wanting in many areas."	293ef8bddb16a7bbc96f2c0b7e2de5c70ad8290e	True	False					0	1650208514		0	{}	i5390e6	False	t3_u5mjf6	False	True	t1_i5380l3	/r/ethereum/comments/u5mjf6/status_messenger_shares_desktop_vision_tokennft/i5390e6/	1650208532	1	False	True	False	ethereum	t5_2zf9m	r/ethereum	public		0	[]													
316	[]	False		RobertAlbers			[]				text	t2_8hpxwl34	False	False	You are suprised because you still don't understand all the implications, I know very well Ethereum and Bitcoin and you can bet Saylor has better advisor than you or me	bcb81ec3e3e8fb381b9db9fd9dde21fa235ee5ba	True	False					0	1650208374		0	{}	i538ojt	False	t3_u58il1	False	True	t1_i530d0h	/r/ethereum/comments/u58il1/lex_fridman_vs_michael_saylor/i538ojt/	1650208392	1	False	True	False	ethereum	t5_2zf9m	r/ethereum	public		0	[]													
317	[]	False		fplfreakaaro			[]				text	t2_a27hlhky	False	False	Only 0.5% of population in the world has ever used  Bitcoin and most only use it as store of value for now. Imagine when 50% of world population starts using Bitcoin as a medium of exchange?	be49496e5773258f8652fee590043cb088ecd0be	True	False					0	1650208333		0	{}	i538l2x	False	t3_u531qn	False	True	t1_i52ldcv	/r/ethereum/comments/u531qn/id_like_to_hear_some_replies_particularly_about/i538l2x/	1650208346	1	False	True	False	ethereum	t5_2zf9m	r/ethereum	public		0	[]													
318	[]	False		fplfreakaaro			[]				text	t2_a27hlhky	False	False	Only 0.5% of population in the world has ever used  Bitcoin and most only use it as store of value for now. Imagine when 50% of world population starts using Bitcoin as a medium of exchange?	be49496e5773258f8652fee590043cb088ecd0be	True	False					0	1650208307		0	{}	i538isl	False	t3_u531qn	False	True	t1_i51teb8	/r/ethereum/comments/u531qn/id_like_to_hear_some_replies_particularly_about/i538isl/	1650208324	1	False	True	False	ethereum	t5_2zf9m	r/ethereum	public		0	[]													
319	[]	False		GildedSilverBitcoins			[]				text	t2_g9029x9r	False	False	"""I cannot teach him. The boy has no patience..."" - Yoda"	a260da590deba4350f386a55e4ccd6df4fec8b4e	True	False					0	1650208266		0	{}	i538fdv	False	t3_u5h38t	False	True	t3_u5h38t	/r/ethereum/comments/u5h38t/with_the_ethereum_merger_no_longer_expected_in/i538fdv/	1650208279	1	False	True	False	ethereum	t5_2zf9m	r/ethereum	public		0	[]													
320	[]	False		KishCom			[]				text	t2_1va3	False	False	"It's much slower, there's way more infrastructure involved, and you have to pay brokers to get into the ecosystem (and again if you screw up). It's better because many more people make money! (/s)

[The federation API is tight](https://spec.matrix.org/latest/), with no sketchy tokenomics required."	90231ba82a274266d9fd01e707904641652b916f	True	False					0	1650208203		0	{}	i538a74	False	t3_u5mjf6	False	False	t1_i5369ve	/r/ethereum/comments/u5mjf6/status_messenger_shares_desktop_vision_tokennft/i538a74/	1650208218	1	False	True	False	ethereum	t5_2zf9m	r/ethereum	public		0	[]													
321	[]	False		Rumblestillskin			[]				text	t2_z8x6jzf	False	False	As an invite token from a friend to join a chat. It is essentially a token in a distributed DB. It could have value or not. You can also do many other cool programmatic things with it.	1e78c0dce3f994b69a736ebb1d36e795d2f6e79c	True	False					0	1650208087		0	{}	i5380l3	False	t3_u5mjf6	False	False	t1_i537qq7	/r/ethereum/comments/u5mjf6/status_messenger_shares_desktop_vision_tokennft/i5380l3/	1650208100	1	False	True	False	ethereum	t5_2zf9m	r/ethereum	public		0	[]													
322	[]	False		_____fool____			[]				text	t2_48j1zwmc	False	False	The most used platform for vr is oculus.  They do have presence. However it’s probably more a minute to Atari and video games.  Anyone played one of those recently?	2fb17d6334704afd1c45de9345f6eabcb4e5f208	True	False					0	1650208031		0	{}	i537w0f	False	t3_u4ya0u	False	True	t1_i4zcomk	/r/ethereum/comments/u4ya0u/cnbc_meta_plans_to_take_a_nearly_50_cut_on/i537w0f/	1650208049	1	False	True	False	ethereum	t5_2zf9m	r/ethereum	public		0	[]													
323	[]	False		Rumblestillskin			[]				text	t2_z8x6jzf	False	False	It is what they showed but not necessary.	d42aa0eb9c327ed8a2fb944356aaf55e4d8b09d0	True	False					0	1650207981		0	{}	i537rxe	False	t3_u5mjf6	False	True	t1_i537n3j	/r/ethereum/comments/u5mjf6/status_messenger_shares_desktop_vision_tokennft/i537rxe/	1650207997	1	False	True	False	ethereum	t5_2zf9m	r/ethereum	public		0	[]													
324	[]	False		KishCom			[]				text	t2_1va3	False	False	Of course, but how do I acquire the initial tokens for sending?	06eadb583c1aadfd345143bd81f2c46b06dee32a	True	False					0	1650207967		0	{}	i537qq7	False	t3_u5mjf6	False	True	t1_i536ske	/r/ethereum/comments/u5mjf6/status_messenger_shares_desktop_vision_tokennft/i537qq7/	1650207982	1	False	True	False	ethereum	t5_2zf9m	r/ethereum	public		0	[]													
325	[]	False		jrkirby			[]				text	t2_6izwp	False	False	The examples in the talk? That's literally what they showed.	8410ed9ff4d9580033c9be2c9829cb4f9ac373dc	True	False					0	1650207923		0	{}	i537n3j	False	t3_u5mjf6	False	True	t1_i536wjr	/r/ethereum/comments/u5mjf6/status_messenger_shares_desktop_vision_tokennft/i537n3j/	1650207937	1	False	True	False	ethereum	t5_2zf9m	r/ethereum	public		0	[]													
326	[]	False		klasp100			[]				text	t2_7b66p5	False	False	"We shouldn't abandon everything we are doing right now that isn't sustainable, however we should NOT invest in NEW things that are not sustainable. Eventually we can replace the old non-sustainable with the new sustainable.

If we are going to invest massive human capital into developing a new currency, let's not be stupid and make it non-sustainable."	ac2089f5fe7a270988365ba70900b4aa6ad44822	True	False					0	1650207919		0	{}	i537mso	False	t3_u531qn	False	True	t1_i5357m1	/r/ethereum/comments/u531qn/id_like_to_hear_some_replies_particularly_about/i537mso/	1650207937	1	False	True	False	ethereum	t5_2zf9m	r/ethereum	public		0	[]													
327	[]	False		[deleted]						dark					[removed]	fe993932d6dced4c0a879e9aa5d7a6e0fbb467f5	True	False					0	1650207835		0	{}	i537fpm	False	t3_u54o7k	False	True	t3_u54o7k	/r/ethereum/comments/u54o7k/how_often_do_you_use_your_crypto_as_a_currency_to/i537fpm/	1650207849	1	False	True	False	ethereum	t5_2zf9m	r/ethereum	public		0	[]													
328	[]	False		cryptokingmylo			[]				text	t2_lpik9l1	False	False	"no way I paid 0.5 eth for a 500$ watch as well.
what watch did you get?"	9809f0527c606aebfdb6ac2814b1295aa2c444b8	True	False					0	1650207812		0	{}	i537dq1	False	t3_u54o7k	False	True	t1_i4zz9ld	/r/ethereum/comments/u54o7k/how_often_do_you_use_your_crypto_as_a_currency_to/i537dq1/	1650207826	1	False	True	False	ethereum	t5_2zf9m	r/ethereum	public		0	[]													
329	[]	False		cryptening			[]				text	t2_42atz9fo	False	False	"&gt; I think that POS could only work long term with a constant coin inflation (a constant release of new coins that are released fairly).

The biggest stakers will get the biggest reward. In POS there is no way to impeach the top stakers."	585bf51ded483c527079e3a91eab289d298de449	True	False					0	1650207618		0	{}	i536xle	False	t3_u531qn	False	True	t1_i4zsbrm	/r/ethereum/comments/u531qn/id_like_to_hear_some_replies_particularly_about/i536xle/	1650207633	1	False	True	False	ethereum	t5_2zf9m	r/ethereum	public		0	[]													
330	[]	False		jeesh			[]				text	t2_4kmq3	False	False	All good!  Haven’t grown mushies in a few years, seeing your posts makes me want to get back into it!	b8407faec3833e708ad35e2e2b651856a097a89f	True	False					0	1650207615		0	{}	i536xcg	False	t3_u54o7k	False	True	t1_i53698a	/r/ethereum/comments/u54o7k/how_often_do_you_use_your_crypto_as_a_currency_to/i536xcg/	1650207633	1	False	True	False	ethereum	t5_2zf9m	r/ethereum	public		0	[]													
331	[]	False		Rumblestillskin			[]				text	t2_z8x6jzf	False	False	Who said you had to pay for the NFT to access? You seem to just want to push a narrative.	6e158db356e339f7348970c7b58c6183d26ffc83	True	False					0	1650207605		0	{}	i536wjr	False	t3_u5mjf6	False	True	t1_i535kne	/r/ethereum/comments/u5mjf6/status_messenger_shares_desktop_vision_tokennft/i536wjr/	1650207618	1	False	True	False	ethereum	t5_2zf9m	r/ethereum	public		0	[]													
332	[]	False		Rumblestillskin			[]				text	t2_z8x6jzf	False	False	NFT tokens can be sent for no charge. It is just a record.	4f81dfac11cc26c3c6f1b32713556c97d9cd32f5	True	False					0	1650207558		0	{}	i536ske	False	t3_u5mjf6	False	True	t1_i534sgq	/r/ethereum/comments/u5mjf6/status_messenger_shares_desktop_vision_tokennft/i536ske/	1650207574	1	False	True	False	ethereum	t5_2zf9m	r/ethereum	public		0	[]													
333	[]	False		jlevy1126			[]				text	t2_ay306	False	False	"Yea he's definitely passionate... But not much beyond that and talks like he's so leveraged. 

Also his ""rant"" about what inflation was contradicts economists. He's using an older definition at best"	71e75f137dd54d1c9eb66edf4692241fff8fcc21	True	False					0	1650207477		0	{}	i536lux	False	t3_u58il1	False	True	t1_i5228vs	/r/ethereum/comments/u58il1/lex_fridman_vs_michael_saylor/i536lux/	1650207493	1	False	True	False	ethereum	t5_2zf9m	r/ethereum	public		0	[]													
334	[]	False		tatooine			[]				text	t2_2sjdn	False	False	You’ve literally just described web3.	9d7905632bd60a1c6b9b03dc7d99238b36a910d3	True	False					0	1650207468		0	{}	i536l5c	False	t3_u5mjf6	False	True	t1_i534sgq	/r/ethereum/comments/u5mjf6/status_messenger_shares_desktop_vision_tokennft/i536l5c/	1650207485	1	False	True	False	ethereum	t5_2zf9m	r/ethereum	public		0	[]													
335	[]	False		FaceDeer			[]				text	t2_4ljvm	False	False	Good news, then - Ethereum is international.	a7fb4f4a95c1f55e01007c1cdf1f0b5f2f18f80f	True	False					0	1650207368		0	{}	i536cts	False	t3_u531qn	False	True	t1_i5343ok	/r/ethereum/comments/u531qn/id_like_to_hear_some_replies_particularly_about/i536cts/	1650207387	1	False	True	False	ethereum	t5_2zf9m	r/ethereum	public		0	[]													
336	[]	False		Stiltzkinn			[]				text	t2_5gxlc	False	True	Why is this better than a decentralized alternative as Matrix?.	a72c1f25d364170884c02f87ac00ccace1fd384f	True	False					0	1650207332		0	{}	i5369ve	False	t3_u5mjf6	False	True	t3_u5mjf6	/r/ethereum/comments/u5mjf6/status_messenger_shares_desktop_vision_tokennft/i5369ve/	1650207350	1	False	True	False	ethereum	t5_2zf9m	r/ethereum	public		0	[]													
337	[]	False		BabydollPenny			[]				text	t2_5qxpemxm	False	False	Thanks for the faith. I harm none. There's always got to be some troll that's gotta kill my happy vibe. They're probably just miserable human being. Have a great day!!	d453153eb0f89bab00ee545765646f4672c7673a	True	False					0	1650207325		0	{}	i53698a	False	t3_u54o7k	False	True	t1_i534xx3	/r/ethereum/comments/u54o7k/how_often_do_you_use_your_crypto_as_a_currency_to/i53698a/	1650207343	1	False	True	False	ethereum	t5_2zf9m	r/ethereum	public		0	[]													
338	[]	False		LandinHardcastle			[]				text	t2_ap5k6	False	False	Saylor brings some new ways of thinking, which are hard to disagree with.  His view on that ETH is a crypto system and BTC is crypto property makes sense.  He highlights the value of BTCs simplicity, and has a long view that is not interested in dabbling in less established crypto tech.	bb8d88ea8b4a3240b7a4c034f367dcdbf9a96531	True	False					0	1650207275		0	{}	i53652m	False	t3_u58il1	False	False	t3_u58il1	/r/ethereum/comments/u58il1/lex_fridman_vs_michael_saylor/i53652m/	1650207291	1	False	True	False	ethereum	t5_2zf9m	r/ethereum	public		0	[]													
339	[]	False		BabydollPenny			[]				text	t2_5qxpemxm	False	False	Wow..thanks for the faith..I have kids that also will inherit this BTC &amp; my other coin investments. ...and if you don't understand lousy price action your a complete moron ...68k down to 40k ....yah real smart dipshit. Why don't you just go be miserable elsewhere.	0b0cadd22483a421526606be1a08f2f9e2d54d7f	True	False					0	1650207254		0	{}	i5363do	False	t3_u54o7k	False	True	t1_i5319en	/r/ethereum/comments/u54o7k/how_often_do_you_use_your_crypto_as_a_currency_to/i5363do/	1650207269	1	False	True	False	ethereum	t5_2zf9m	r/ethereum	public		0	[]													
340	[]	False		[deleted]						dark					[removed]	fe993932d6dced4c0a879e9aa5d7a6e0fbb467f5	True	False					0	1650207154		0	{}	i535v42	False	t3_u0e6lq	False	True	t3_u0e6lq	/r/ethereum/comments/u0e6lq/a_deep_dive_into_the_ethereum_virtual_machine/i535v42/	1650207167	1	False	True	False	ethereum	t5_2zf9m	r/ethereum	public		0	[]													
341	[]	False		domotheus			[]				text	t2_i5ghusfv	False	True	if you think of it in terms of the % of supply that you own, that number should always go up if you stake It since not all of the supply is staked	117078841d60f69bfd95999a539ad32f48bd3979	True	False					0	1650207102		0	{}	i535qyt	True	t3_tijcq1	False	True	t1_i52nyqn	/r/ethereum/comments/tijcq1/stuff_rethereum_should_know_proof_of_stake_edition/i535qyt/	1650207116	1	False	True	False	ethereum	t5_2zf9m	r/ethereum	public		0	[]													
