Unnamed: 0	all_awardings	archived	associated_award	author	author_flair_background_color	author_flair_css_class	author_flair_richtext	author_flair_template_id	author_flair_text	author_flair_text_color	author_flair_type	author_fullname	author_patreon_flair	author_premium	body	body_sha1	can_gild	collapsed	collapsed_because_crowd_control	collapsed_reason	collapsed_reason_code	comment_type	controversiality	created_utc	distinguished	gilded	gildings	id	is_submitter	link_id	locked	no_follow	parent_id	permalink	retrieved_utc	score	score_hidden	send_replies	stickied	subreddit	subreddit_id	subreddit_name_prefixed	subreddit_type	top_awarded_type	total_awards_received	treatment_tags	unrepliable_reason	author_cakeday	corpus	support	knowledge	conflict	power	similarity	fun	status	trust	identity	romance
0	[]	False		haha_supadupa			[]				text	t2_114wia	False	False	GOOD	7763d377b925fc016d9fde44fe2afa2332a30fd2	True	False					0	1650182416		0	{}	i524gjh	False	t3_u58o1u	False	True	t3_u58o1u	/r/Bitcoin/comments/u58o1u/1200000000_in_bitcoin_moved_out_of_coinbase_in/i524gjh/	1650182433	1	True	True	False	Bitcoin	t5_2s3qj	r/Bitcoin	public		0	[]													
1	[]	False		Tron_Passant			[]			dark	text	t2_65aqswhp	False	False	When will bitcoin hit 100K and why?	24478afcb63ae1d0830da16a064b856eb795d426	True	False					0	1650182198		0	{}	i52475e	False	t3_u5fv5k	False	True	t3_u5fv5k	/r/Bitcoin/comments/u5fv5k/daily_discussion_april_17_2022/i52475e/	1650182214	1	True	True	False	Bitcoin	t5_2s3qj	r/Bitcoin	public		0	[]													
2	[]	False		LeGama			[]				text	t2_c26cx	False	False	Wow, I haven't seen that before but that's actually kinda impressive. I mean it did work, and it fit the category.	614cace3eae6a440a35da51edd7191ea1a568782	True	False					0	1650182169		0	{}	i5245x8	False	t3_u55lt6	False	True	t1_i51u0vy	/r/Bitcoin/comments/u55lt6/why_yes_yes_it_is/i5245x8/	1650182180	1	True	True	False	Bitcoin	t5_2s3qj	r/Bitcoin	public		0	[]													
3	[]	False		New_Orange96		noob	[{'e': 'text', 't': 'redditor for 3 months'}]	2ec8e69e-6c36-11e9-a04b-0afb553d4ea6	redditor for 3 months	dark	richtext	t2_j5bnj0li	False	False	Nothing new. But I do buy Bitcoin with USDT to stay safe.	d39327764dae822c7d882d265231d89e5fd73e31	True	False					0	1650182124		0	{}	i52442j	False	t3_u5ae4e	False	True	t3_u5ae4e	/r/Bitcoin/comments/u5ae4e/rich_dad_poor_dad_author_robert_kiyosaki_says/i52442j/	1650182141	1	True	True	False	Bitcoin	t5_2s3qj	r/Bitcoin	public		0	[]													
4	[]	False		ScamJustice			[]				text	t2_63flt8uy	False	False	I love when he talks about buying a square block in Manhattan 100 years ago and how Bitcoin is like thhat in cyber space and how Bitcoin is a energy lossless battery that will preserve monetary energy through space and time	fe74a8c35e41fad48eb2ace9c29104ec24ae9e70	True	False					0	1650181941		0	{}	i523wg6	False	t3_u5diqt	False	True	t3_u5diqt	/r/Bitcoin/comments/u5diqt/every_michael_saylor_interview_ever/i523wg6/	1650181956	1	True	True	False	Bitcoin	t5_2s3qj	r/Bitcoin	public		0	[]													
5	[]	False		i_kant_spal			[]			dark	text	t2_er11xuds	False	False	The node doesn't broadcast that node in such case. When a node sees a valid block, it then broadcasts it for other nodes to join.	b8bd6d72f4a9df159cf86f7c7176891ad02ad6c2	True	False					0	1650181875		0	{}	i523tkc	False	t3_u4sk0r	False	True	t1_i50km1z	/r/Bitcoin/comments/u4sk0r/does_the_price_of_bitcoin_need_to_go_up_to_secure/i523tkc/	1650181890	1	True	True	False	Bitcoin	t5_2s3qj	r/Bitcoin	public		0	[]													
6	[]	False		gotamm			[]			dark	text	t2_4t5ey4m1	False	True	It’s not a matter of words, it’s a matter of value. If you cannot spot the difference between bitcoin and other cryptos, well…you should study the technology behind them.	e6144eec75a33918ece0c4dadf7976a3d4de6393	True	False					0	1650181838		0	{}	i523s0j	False	t3_u5h84f	False	True	t3_u5h84f	/r/Bitcoin/comments/u5h84f/bitcoin_is_crypto/i523s0j/	1650181850	1	True	True	False	Bitcoin	t5_2s3qj	r/Bitcoin	public		0	[]													
7	[]	False		Get_the_nak			[]			dark	text	t2_28td4nyq	False	False	gmtu2	fd6f298916baf524d1a9f8de45cecbf8368a6ec6	True	False					0	1650181788		0	{}	i523psy	False	t3_u5fv5k	False	False	t1_i51qred	/r/Bitcoin/comments/u5fv5k/daily_discussion_april_17_2022/i523psy/	1650181804	1	True	True	False	Bitcoin	t5_2s3qj	r/Bitcoin	public		0	[]													
8	[]	False		DrOhmu			[]				text	t2_4thaxfah	False	False	"Its not detached because there is an upper bound.

Its a simplification for conveinience. Can you simply the complicated metric better?

I always like days destroyed."	ba26b4198fc3425263d6cfc2e705495540f119c2	True	False					0	1650181786		0	{}	i523pop	False	t3_u58o1u	False	True	t1_i51zzp4	/r/Bitcoin/comments/u58o1u/1200000000_in_bitcoin_moved_out_of_coinbase_in/i523pop/	1650181797	1	True	True	False	Bitcoin	t5_2s3qj	r/Bitcoin	public		0	[]													
9	[]	False		macinrapi			[]				text	t2_autklkad	False	False	Thanks for this, I think this will do it for me. I'm gonna be okay.	5eef0783cd04d7451852121b5e1a63724c2ce559	True	False					0	1650181770		0	{}	i523ozi	False	t3_u4qkcu	False	True	t1_i4zz8z2	/r/Bitcoin/comments/u4qkcu/daily_discussion_april_16_2022/i523ozi/	1650181784	1	True	True	False	Bitcoin	t5_2s3qj	r/Bitcoin	public		0	[]													
10	[]	False		tokyo_aces			[]				text	t2_xn4d6j1	False	False	"Hm, I took a different interpretation after hearing him on Lex Fridman recently.  Full disclosure, I loathe his constant ""MS bought the dip"" tweets and also thought he was half-shill prior to the interview.

He was very clear on the distinction between L1/L2/L3 - L3 being where ""paper bitcoin"" would come into play, and not about banks (as we know them today) at all.  He champions NYKNYC.  As a maxi, and one who thinks we're going to have gold+ market cap soon, I think L2 is where most people are going to be situated as they are priced out of L1 and - as you and I agree ;) - L3 has its own risks.  **For him**, yeah, he's doing a lot with paper BTC because he's collateralizing and loaning it, but that's not something we all can do.  Or should.

As for proof of reserves, he specifically mentioned that as an issue with Tether, so I got the impression he is for showing PoR in general.  Perhaps you have seen him speak against it w.r.t. another coin, or BTC and custodians?

Again, I'm not a Saylor apologist, but I have to give the devil his due in some respects."	10a1dca32c759786e5a560fd86593304fb180fa1	True	False					0	1650181683		0	{}	i523l6r	False	t3_u5diqt	False	True	t1_i51iexi	/r/Bitcoin/comments/u5diqt/every_michael_saylor_interview_ever/i523l6r/	1650181694	1	True	True	False	Bitcoin	t5_2s3qj	r/Bitcoin	public		0	[]													
11	[]	False		OmsFar			[]				text	t2_5c2z78ly	False	False	I’ve been hearing this exact same thing for the past two years. It doesn’t mean anything.	ea139a25e62aae9e29d14479b7253c96fa1589ce	True	False					0	1650181676		0	{}	i523kut	False	t3_u58o1u	False	True	t3_u58o1u	/r/Bitcoin/comments/u58o1u/1200000000_in_bitcoin_moved_out_of_coinbase_in/i523kut/	1650181686	1	True	True	False	Bitcoin	t5_2s3qj	r/Bitcoin	public		0	[]													
12	[]	False		0bran			[]				text	t2_afuj9	False	False	You cant google this. Go search my history even more, or fuck off	3369e8697c7e7a3de1c13099d815442a3667c2ce	True	False					0	1650181608		0	{}	i523hz6	True	t3_u5i1zb	False	True	t1_i523fcu	/r/Bitcoin/comments/u5i1zb/what_would_happen_to_bitcoin_if_sun_flares_hit/i523hz6/	1650181619	1	True	True	False	Bitcoin	t5_2s3qj	r/Bitcoin	public		0	[]													
13	[]	False		DEEErab			[]				text	t2_gc713uq	False	False	I’m pretty sure nearly everything would be completely done	e69be904b5f42df45b5725a1940e5262205c9e00	True	False					0	1650181602		0	{}	i523hoh	False	t3_u5i1zb	False	True	t1_i523ews	/r/Bitcoin/comments/u5i1zb/what_would_happen_to_bitcoin_if_sun_flares_hit/i523hoh/	1650181613	1	True	True	False	Bitcoin	t5_2s3qj	r/Bitcoin	public		0	[]													
14	[]	False		LIAM_WATSON2003			[]				text	t2_d1d807cl	False	False	"Wtf lmao, go home and read some. You don't know shit lol.

Hash rate has got nothing to with it, and how can base layer can be faster all of a sudden lol?"	0fcf35444c24025b535f5f7e9ac06e5c888535a0	True	False					0	1650181600		0	{}	i523hmi	False	t3_u4wtpn	False	True	t1_i4yci4v	/r/Bitcoin/comments/u4wtpn/what_changed_in_bitcoin_how_transactions_are_so/i523hmi/	1650181613	1	True	True	False	Bitcoin	t5_2s3qj	r/Bitcoin	public		0	[]													
15	[]	False		Asum_chum			[]				text	t2_qfciqve	False	False	"“Lazy fucker thinks its easier to make a reddit post instead of google.”

This was you 11 hours ago."	0d3312ea29006b2cd95b36f3bee586c2ce314672	True	False					0	1650181548		0	{}	i523fcu	False	t3_u5i1zb	False	True	t1_i5234my	/r/Bitcoin/comments/u5i1zb/what_would_happen_to_bitcoin_if_sun_flares_hit/i523fcu/	1650181559	1	True	True	False	Bitcoin	t5_2s3qj	r/Bitcoin	public		0	[]													
16	[]	False		igadjeed			[]				text	t2_vy03v	False	True	You're praying to the wrong person	18c030a91206fdf38b89879acba636f68375c72a	True	False					0	1650181543		0	{}	i523f4u	False	t3_u42jae	False	True	t1_i4uevyq	/r/Bitcoin/comments/u42jae/man_lost_18m_after_got_scammed_on_dating_app_that/i523f4u/	1650181560	1	True	True	False	Bitcoin	t5_2s3qj	r/Bitcoin	public		0	[]													
17	[]	False		0bran			[]				text	t2_afuj9	False	False	Is it possible to save bitcoin network somehow in this scenario, or btc would be completely dead	b81fa1e20e2a13a6b6a1aefe554228127ebb314d	True	False					0	1650181538		0	{}	i523ews	True	t3_u5i1zb	False	True	t1_i523a88	/r/Bitcoin/comments/u5i1zb/what_would_happen_to_bitcoin_if_sun_flares_hit/i523ews/	1650181553	1	True	True	False	Bitcoin	t5_2s3qj	r/Bitcoin	public		0	[]													
18	[]	False		DrOhmu			[]				text	t2_4thaxfah	False	False	"To where?

We cant know these transfers are ""out of coinbase""

What we can be sure of is this username brand new and only hyping crypto."	8e82539c3e3f66db0c8899843a3d9d530d65b838	True	False					0	1650181517		0	{}	i523e1n	False	t3_u58o1u	False	True	t3_u58o1u	/r/Bitcoin/comments/u58o1u/1200000000_in_bitcoin_moved_out_of_coinbase_in/i523e1n/	1650181534	1	True	True	False	Bitcoin	t5_2s3qj	r/Bitcoin	public		0	[]													
19	[]	False		GoldStandardVisuals			[]				text	t2_33ohjswr	False	False	If electricity is eliminated we've got worse problems than what happened to my bitcoin.	d4008a6cdc8f5d3fc260f750a1d3933b836a583c	True	False					0	1650181429		0	{}	i523a88	False	t3_u5i1zb	False	False	t3_u5i1zb	/r/Bitcoin/comments/u5i1zb/what_would_happen_to_bitcoin_if_sun_flares_hit/i523a88/	1650181440	1	True	True	False	Bitcoin	t5_2s3qj	r/Bitcoin	public		0	[]													
20	[]	False		Asum_chum			[]				text	t2_qfciqve	False	False	"“Wrapped Bitcoin (WBTC) is an ERC-20 token that represents Bitcoin (BTC) on the Ethereum blockchain.”

As I say, shitcoin."	33b11c93c527dd56d5d9f1bfb4a638f72fbfb233	True	False					0	1650181410		0	{}	i5239fh	False	t3_u4phb4	False	True	t1_i4zzaa9	/r/Bitcoin/comments/u4phb4/can_i_sell_my_btc_to_claim_a_loss_then_buy_it/i5239fh/	1650181420	1	True	True	False	Bitcoin	t5_2s3qj	r/Bitcoin	public		0	[]													
21	[]	False		summonsterism			[]			dark	text	t2_67lup7xg	False	False	We'd be able to spend it less freely; what with all your fingers and toes being fused together...	7a76c4eab4b6d89a21b4c0036199c0d318e4665d	True	False					0	1650181357		0	{}	i523715	False	t3_u5i1zb	False	True	t3_u5i1zb	/r/Bitcoin/comments/u5i1zb/what_would_happen_to_bitcoin_if_sun_flares_hit/i523715/	1650181368	1	True	True	False	Bitcoin	t5_2s3qj	r/Bitcoin	public		0	[]													
22	[]	False		Amber_Sam			[]			dark	text	t2_8y14mj5n	False	False	How? Are you able to load your Luno keys into Electrum or BlueWallet and use your Bitcoin? How it works?	a87aef9230139cfa924a74ac89cafae870efced7	True	False					0	1650181331		0	{}	i5235x2	False	t3_u5fk3x	False	True	t1_i5211r6	/r/Bitcoin/comments/u5fk3x/what_is_the_best_cryptocurrency_wallet/i5235x2/	1650181341	1	True	True	False	Bitcoin	t5_2s3qj	r/Bitcoin	public		0	[]													
23	[]	False		0bran			[]				text	t2_afuj9	False	False	You have an answer or just here to look like a smartass	94549f40cf7e16c93bd3357c18e84e1d52a98177	True	False					0	1650181302		0	{}	i5234my	True	t3_u5i1zb	False	True	t1_i522z9e	/r/Bitcoin/comments/u5i1zb/what_would_happen_to_bitcoin_if_sun_flares_hit/i5234my/	1650181315	1	True	True	False	Bitcoin	t5_2s3qj	r/Bitcoin	public		0	[]													
24	[]	False		Marcion_Sinope			[]				text	t2_gv0j0hg	False	False	"Bcash is crypto.

Bitcoin is not crypto.

No need to thank me."	d5be5293d6a5134fe6000983f17388257fbbdec6	True	False					0	1650181211		0	{}	i5230gd	False	t3_u5h84f	False	True	t3_u5h84f	/r/Bitcoin/comments/u5h84f/bitcoin_is_crypto/i5230gd/	1650181228	1	True	True	False	Bitcoin	t5_2s3qj	r/Bitcoin	public		0	[]													
25	[]	False		couchguitar			[]			dark	text	t2_di6lgwei	False	False	Just because its a medium of exchange and a store of value, doesn't automatically qualify it as Capitalistic. Communists use money and Fascists own gold. Capitalism is an economic system.	dfce6b5e22f9d9bafc8ea46a382ff729a85f3998	True	False					0	1650181194		0	{}	i522zpl	False	t3_u5a0qs	False	True	t1_i51vpdf	/r/Bitcoin/comments/u5a0qs/bitcoin_the_greatest_socialist_push_of_all_time/i522zpl/	1650181207	1	True	True	False	Bitcoin	t5_2s3qj	r/Bitcoin	public		0	[]													
26	[]	False		Asum_chum			[]				text	t2_qfciqve	False	False	"What an original question. 

I’ve also got one about quantum computing…."	b49d702bbb31cf5009984d2999e48a1c646e1a63	True	False					0	1650181184		0	{}	i522z9e	False	t3_u5i1zb	False	True	t3_u5i1zb	/r/Bitcoin/comments/u5i1zb/what_would_happen_to_bitcoin_if_sun_flares_hit/i522z9e/	1650181194	1	True	True	False	Bitcoin	t5_2s3qj	r/Bitcoin	public		0	[]													
27	[]	False		rBitcoinMod			[]				text	t2_tcsf5	False	False	"Your submission has been flagged for removal because it doesn't meet the quality standards for /r/Bitcoin at this time. Please help keep the subreddit clean from low quality posts.

^^I ^^am ^^a ^^bot ^^and ^^cannot ^^respond. ^^Please ^^contact ^^r/Bitcoin ^^moderators [^^directly ^^via ^^mod ^^mail](https://www.reddit.com/message/compose?to=%2Fr%2FBitcoin) ^^if ^^you ^^have ^^questions."	7f47cb61e3880cbcec652e5c0ab78630b03152cc	True	False					0	1650181158	moderator	0	{}	i522y3p	False	t3_u5hx9v	False	True	t3_u5hx9v	/r/Bitcoin/comments/u5hx9v/what_you_know_about_scenes_from_bitcoin_miami/i522y3p/	1650181168	1	True	True	True	Bitcoin	t5_2s3qj	r/Bitcoin	public		0	[]													
28	[]	False		Bryan_RedLightRising			[]				text	t2_77fkuv2a	False	False	"If anyone shits on BTC around me, I calmly ask ' Do you understand money or BTC?' 

99% of the time, they don't. 

If people truly understand money, inflation and how BTC works, isn't it virtually impossible to shit on it?

My opinion is yes."	b3a42a71ab626494f4ad81a73568ca6423fbe152	True	False					0	1650181127		0	{}	i522wsg	False	t3_u4u6vc	False	True	t3_u4u6vc	/r/Bitcoin/comments/u4u6vc/friends_and_bitcoin/i522wsg/	1650181143	1	True	True	False	Bitcoin	t5_2s3qj	r/Bitcoin	public		0	[]													
29	[]	False		ScamJustice			[]				text	t2_63flt8uy	False	False	"Hardware wallets: trezor, ledger, coldcard

Software wallets: wasabi wallet, blue wallet, mycelium, Samourai wallet, trust wallet"	276cb8316aa0b66a7b6f73ee285ac22217d75b8e	True	False					0	1650181013		0	{}	i522rth	False	t3_u5fk3x	False	True	t3_u5fk3x	/r/Bitcoin/comments/u5fk3x/what_is_the_best_cryptocurrency_wallet/i522rth/	1650181027	1	True	True	False	Bitcoin	t5_2s3qj	r/Bitcoin	public		0	[]													
30	[]	False		ishizawa			[]				text	t2_edczuso4	False	False	"Those things don't have any actual value, it's all just hype.

And by value I mean they don't have any utility. They're kinda bad I guess man."	140508d99217c43f09bf45aff59d08dfbb97592a	True	False					0	1650180905		0	{}	i522n6t	False	t3_u4wtpn	False	True	t1_i4zzeav	/r/Bitcoin/comments/u4wtpn/what_changed_in_bitcoin_how_transactions_are_so/i522n6t/	1650180921	1	True	True	False	Bitcoin	t5_2s3qj	r/Bitcoin	public		0	[]													
31	[]	False		tokyo_aces			[]				text	t2_xn4d6j1	False	False	"Yes, this is possible.

It does not, however, prevent you from using *any other* LN node.

Your question, ""What would it take to defeat censorship ***there***"" has a subtle problem.  It treats censorship like #1 below, rather than #2

1. If *just 1* node is censored, the whole damn thing is censored (all must be uncensored)
2. If *just 1 node allows free access*, censorship is kept at bay (just 1 must be uncensored)

\#2 is the correct way of viewing things for Bitcoin and LN both.  By contrast, in the context of centralized systems, e.g. social media ""censorship"", you can see how #2 would fall - Twitter, Facebook, etc control the entirety of the nodes, so there is no qualitative difference between #1 and #2."	151ab301ae8c31c5c837e94a9b725879997a6337	True	False					0	1650180883		0	{}	i522m8x	False	t3_u5ditq	False	True	t3_u5ditq	/r/Bitcoin/comments/u5ditq/lightening_network_censorship_is_it_possible/i522m8x/	1650180895	1	True	True	False	Bitcoin	t5_2s3qj	r/Bitcoin	public		0	[]													
32	[]	False		[deleted]						dark					[removed]	fe993932d6dced4c0a879e9aa5d7a6e0fbb467f5	True	False					0	1650180851		0	{}	i522kvn	False	t3_u58o1u	False	True	t3_u58o1u	/r/Bitcoin/comments/u58o1u/1200000000_in_bitcoin_moved_out_of_coinbase_in/i522kvn/	1650180863	1	True	True	False	Bitcoin	t5_2s3qj	r/Bitcoin	public		0	[]													
33	[]	False		Temporary-Welder7588		noob	[{'e': 'text', 't': 'redditor for 3 months'}]	2ec8e69e-6c36-11e9-a04b-0afb553d4ea6	redditor for 3 months	dark	richtext	t2_hnxea15d	False	False	I agree.	698a021858324f32dce089b699e27013cc94d0e1	True	False					0	1650180785		0	{}	i522hv8	False	t3_u4z0te	False	True	t1_i4zadin	/r/Bitcoin/comments/u4z0te/i_just_had_this_amazing_idea_on_decentralizing/i522hv8/	1650180803	1	True	True	False	Bitcoin	t5_2s3qj	r/Bitcoin	public		0	[]													
34	[]	False		rBitcoinMod			[]				text	t2_tcsf5	False	False	"Your submission has been flagged and removed because it relates primarily to bitcoin mining. If you would like to learn more about mining bitcoin, please visit /r/BitcoinMining. Be aware that bitcoin cannot be mined using graphic cards. Specialized ASIC hardware is required. Cloud mining is often a scam.

^^I ^^am ^^a ^^bot ^^and ^^cannot ^^respond. ^^Please ^^contact ^^r/Bitcoin ^^moderators [^^directly ^^via ^^mod ^^mail](https://www.reddit.com/message/compose?to=%2Fr%2FBitcoin) ^^if ^^you ^^have ^^questions."	2d9674e0a3db29875cba137b67bd32edfc531b23	True	False					0	1650180729	moderator	0	{}	i522fbi	False	t3_u5hwai	False	True	t3_u5hwai	/r/Bitcoin/comments/u5hwai/bitmain_s19_95tthe_most_popular_s19_95t_on_the/i522fbi/	1650180741	1	True	True	True	Bitcoin	t5_2s3qj	r/Bitcoin	public		0	[]													
35	[]	False		chiseled_sloth			[]				text	t2_c2kce	False	False	People getting wooshed so hard right now.	94d1308f4b285e0b37138e97a33abc1b3c71351c	True	False					0	1650180722		0	{}	i522f1d	False	t3_u55lt6	False	True	t1_i51v3p0	/r/Bitcoin/comments/u55lt6/why_yes_yes_it_is/i522f1d/	1650180734	1	True	True	False	Bitcoin	t5_2s3qj	r/Bitcoin	public		0	[]													
36	[]	False		zuoke8888			[]				text	t2_d3eoey8i	False	False	It's safe until it's not, learn to take the self custody man.	02189dd1b2f8055f6913bf7baccfe45a4654c39d	True	False					0	1650180693		0	{}	i522drf	False	t3_u4qkcu	False	True	t1_i50y1w8	/r/Bitcoin/comments/u4qkcu/daily_discussion_april_16_2022/i522drf/	1650180707	1	True	True	False	Bitcoin	t5_2s3qj	r/Bitcoin	public		0	[]													
37	[]	False		ApprehensiveSorbet76			[]			dark	text	t2_fs7xj2pi	False	False	The only way nodes can stop miners from participating is to create a whitelist.  You say nodes have shut down bad actor miners before, but I don’t understand how.  Can’t these miners hide their identities by spoofing in addresses and providing unique coinbase reward addresses each time?  How can nodes know who is submitting blocks to them?	876daedfe613688ebcdf3acecdff878ffea7f67a	True	False					0	1650180639		0	{}	i522bgl	False	t3_u4vkqx	False	True	t1_i5203t8	/r/Bitcoin/comments/u4vkqx/criminally_underrated_panel_on_bitcoin_consensus/i522bgl/	1650180653	1	True	True	False	Bitcoin	t5_2s3qj	r/Bitcoin	public		0	[]													
38	[]	False		Nervous-Papaya-5675			[]				text	t2_8zabwctr	False	False	Wrong	346a2f5c8fd56d91bc30b757b68d2971ed7e9398	True	False					0	1650180588		0	{}	i522980	False	t3_u5bzs2	False	True	t1_i510y8m	/r/Bitcoin/comments/u5bzs2/how_are_credit_card_awards_in_bitcoin_taxed/i522980/	1650180602	1	True	True	False	Bitcoin	t5_2s3qj	r/Bitcoin	public		0	[]													
39	[]	False		ZICRON_ULTRA			[]			dark	text	t2_a2aihq8m	False	False	I use samourai on an old phone because Andreas told me to	662839faa5f1668d5139e49776635eb08ab0224f	True	False					0	1650180577		0	{}	i5228ps	False	t3_u5fk3x	False	True	t3_u5fk3x	/r/Bitcoin/comments/u5fk3x/what_is_the_best_cryptocurrency_wallet/i5228ps/	1650180588	1	True	True	False	Bitcoin	t5_2s3qj	r/Bitcoin	public		0	[]													
40	[]	False		AlwaysMooning			[]			dark	text	t2_20s78d7n	False	False	The word crypto has been corrupted by scum and scam. Bitcoin is pure and good. So yes, Bitcoin is a cryptocurrency, but calling it crypto is like calling a square a rectangle.	77b7550db7723aedf7a359d86eef8e43fbeeb4ff	True	False					0	1650180527		0	{}	i5226n3	False	t3_u5h84f	False	True	t3_u5h84f	/r/Bitcoin/comments/u5h84f/bitcoin_is_crypto/i5226n3/	1650180544	1	True	True	False	Bitcoin	t5_2s3qj	r/Bitcoin	public		0	[]													
41	[]	False		GSadman			[]				text	t2_487j9nzu	False	False	Could he just let Sailor speak	077cce7e7fc9a4cd4c755373e334977d978a2f4f	True	False					0	1650180466		0	{}	i5223x3	False	t3_u5hsi9	False	True	t3_u5hsi9	/r/Bitcoin/comments/u5hsi9/the_role_of_bitcoin_in_war/i5223x3/	1650180477	1	True	True	False	Bitcoin	t5_2s3qj	r/Bitcoin	public		0	[]													
42	[]	False		nicoznico			[]				text	t2_o8fw2k2	False	False	Number 9 scares tf out of me tho. Every time I hear it, over and over again.	8721a3662e99f0286300382dc6e322790b82ced2	True	False					0	1650180426		0	{}	i52227w	False	t3_u5diqt	False	True	t1_i51e4s4	/r/Bitcoin/comments/u5diqt/every_michael_saylor_interview_ever/i52227w/	1650180439	1	True	True	False	Bitcoin	t5_2s3qj	r/Bitcoin	public		0	[]													
43	[]	False		nicoznico			[]				text	t2_o8fw2k2	False	False	Number 9 scares tf out of me tho. Every time I hear it, over and over again.	8721a3662e99f0286300382dc6e322790b82ced2	True	False					0	1650180408		0	{}	i5221eo	False	t3_u5diqt	False	True	t3_u5diqt	/r/Bitcoin/comments/u5diqt/every_michael_saylor_interview_ever/i5221eo/	1650180419	1	True	True	False	Bitcoin	t5_2s3qj	r/Bitcoin	public		0	[]													
44	[]	False		ApprehensiveSorbet76			[]			dark	text	t2_fs7xj2pi	False	False	"Hmm this is a complicated topic.  It seems nodes can decide their consensus by rejecting blocks, but they cannot create blocks without mining.  Blocks that do not pass the hash validation cannot be faked.  The hash check is a validation step nodes cannot override easily.  So the best a group of rogue nodes can do is try to create their own truth by forming a coalition of aligned consensus on which blocks to reject.  But when they mine their own blocks, their hash power will set the difficulty low.  Miners who do not like this group can perform 51% and empty block attacks to shut down any attempt at an alternate reality.  
But the more I think about this the more I’m leaning towards you being right."	f402db2154e9c593dcad6575294e04e28accee1d	True	False					0	1650180366		0	{}	i521zkz	False	t3_u4vkqx	False	True	t1_i5203t8	/r/Bitcoin/comments/u4vkqx/criminally_underrated_panel_on_bitcoin_consensus/i521zkz/	1650180379	1	True	True	False	Bitcoin	t5_2s3qj	r/Bitcoin	public		0	[]													
45	[]	False		Nervous-Papaya-5675			[]				text	t2_8zabwctr	False	False	"What book did you read to have those thoughts? Get your money back. 

Try this one. It’s free https://github.com/lnbook/lnbook"	39b97d66713a7d19c8451670a3a57e812cac163d	True	False					0	1650180302		0	{}	i521wte	False	t3_u5gonk	False	True	t3_u5gonk	/r/Bitcoin/comments/u5gonk/clarification_on_the_lightning_network/i521wte/	1650180319	1	True	True	False	Bitcoin	t5_2s3qj	r/Bitcoin	public		0	[]													
46	[]	False		ma0za			[]				text	t2_9e95vbg	False	True	No	816c52fd2bdd94a63cd0944823a6c0aa9384c103	True	False					0	1650180159		0	{}	i521qjg	False	t3_u4wich	False	True	t1_i4zh0gf	/r/Bitcoin/comments/u4wich/coincub_report_shows_that_germany_has_become_the/i521qjg/	1650180172	1	True	True	False	Bitcoin	t5_2s3qj	r/Bitcoin	public		0	[]													
47	[]	False		saamalam			[]				text	t2_eizx9en5	False	False	That's why we should be taking the custody of the coins.	6edcb5f6b5d30d3eb6c2db583758bae6ee680d96	True	False					0	1650180153		0	{}	i521q9x	False	t3_u58o1u	False	False	t1_i50n4iw	/r/Bitcoin/comments/u58o1u/1200000000_in_bitcoin_moved_out_of_coinbase_in/i521q9x/	1650180165	1	True	True	False	Bitcoin	t5_2s3qj	r/Bitcoin	public		0	[]													
48	[]	False		ma0za			[]				text	t2_9e95vbg	False	True	$30	1c114f28cee8b62b2eca49a887a648f8489b63dc	True	False					0	1650180128		0	{}	i521p5z	False	t3_u4wich	False	True	t1_i51m3jh	/r/Bitcoin/comments/u4wich/coincub_report_shows_that_germany_has_become_the/i521p5z/	1650180139	1	True	True	False	Bitcoin	t5_2s3qj	r/Bitcoin	public		0	[]													
49	[]	False		ma0za			[]				text	t2_9e95vbg	False	True	"Complete nonsense 

Source: am German"	52ea6a14b4be11a2c76af1c3472054aeaba05ffa	True	False					0	1650180100		0	{}	i521nxp	False	t3_u4wich	False	True	t3_u4wich	/r/Bitcoin/comments/u4wich/coincub_report_shows_that_germany_has_become_the/i521nxp/	1650180113	1	True	True	False	Bitcoin	t5_2s3qj	r/Bitcoin	public		0	[]													
