Unnamed: 0	all_awardings	associated_award	author	author_flair_background_color	author_flair_css_class	author_flair_richtext	author_flair_template_id	author_flair_text	author_flair_text_color	author_flair_type	author_fullname	author_patreon_flair	author_premium	awarders	body	collapsed_because_crowd_control	collapsed_reason_code	comment_type	created_utc	gildings	id	is_submitter	link_id	locked	no_follow	parent_id	permalink	retrieved_on	score	send_replies	stickied	subreddit	subreddit_id	top_awarded_type	total_awards_received	treatment_tags	unrepliable_reason	archived	body_sha1	can_gild	collapsed	collapsed_reason	controversiality	distinguished	gilded	retrieved_utc	score_hidden	subreddit_name_prefixed	subreddit_type	author_cakeday	corpus	support	knowledge	conflict	power	similarity	fun	status	trust	identity	romance
288	[]		Ideafecater			[]				text	t2_i2bqdmcb	False	False	[]	If I’m pooping on the sidewalk I definitely don’t want anyone near me.				1645235868	{}	hxiz99c	False	t3_svu1fv	False	True	t1_hxiyftl	/r/ethereum/comments/svu1fv/banks_are_freezing_accounts_in_canada/hxiz99c/	1649997287.0	1	True	False	ethereum	t5_2zf9m		0	[]																									
289	[]		FaceDeer			[]				text	t2_4ljvm	False	False	[]	"And we also have commenters describing Black Lives Matter supporters as ""[ghetto apes](https://www.reddit.com/r/ethereum/comments/svu1fv/banks_are_freezing_accounts_in_canada/hxifhhu/)"" and ""[Hitlerjugend](https://www.reddit.com/r/ethereum/comments/svu1fv/banks_are_freezing_accounts_in_canada/hxi9kbr/)."" So yeah, this thread's a bit of a train wreck."				1645235811	{}	hxiz50u	False	t3_svu1fv	False	True	t1_hxin47j	/r/ethereum/comments/svu1fv/banks_are_freezing_accounts_in_canada/hxiz50u/	1649996900.0	-1	True	False	ethereum	t5_2zf9m		0	[]																									
290	[]		Ande64			[]				text	t2_czqo507	False	False	[]	Sign me up for the toilet on the shoe NFT!				1645235715	{}	hxiyxw2	False	t3_svtuwk	False	True	t3_svtuwk	/r/ethereum/comments/svtuwk/trump_will_sell_nfts_of_key_moments_of_his_time/hxiyxw2/	1649996233.0	1	True	False	ethereum	t5_2zf9m		0	[]																									
291	[]		Dantelion_Shinoni			[]				text	t2_r04b5	False	False	[]	At least they didn't burn a building.		LOW_SCORE		1645235704	{}	hxiyx4l	False	t3_svtuwk	False	True	t1_hxigxps	/r/ethereum/comments/svtuwk/trump_will_sell_nfts_of_key_moments_of_his_time/hxiyx4l/	1649996162.0	-9	True	False	ethereum	t5_2zf9m		0	[]																									
292	[]		dewster17			[]				text	t2_14dxin	False	False	[]	Well since you are bashing Trump for no good reason. What about the grift of a $32 million nft this week?  Just saying Biden doesn't even know how to open a fridge door.				1645235601	{}	hxiypgf	False	t3_svtuwk	False	True	t1_hxiriu5	/r/ethereum/comments/svtuwk/trump_will_sell_nfts_of_key_moments_of_his_time/hxiypgf/	1649995466.0	1	True	False	ethereum	t5_2zf9m		0	[]																									
293	[]		HeyCharrrrlie			[]				text	t2_25tbn774	False	True	[]	Fucking grifter. Traitor. He belongs in a federal prison.				1645235489	{}	hxiyhcu	False	t3_svtuwk	False	True	t3_svtuwk	/r/ethereum/comments/svtuwk/trump_will_sell_nfts_of_key_moments_of_his_time/hxiyhcu/	1649994732.0	1	True	False	ethereum	t5_2zf9m		0	[]																									
294	[]		FaceDeer			[]				text	t2_4ljvm	False	False	[]	"Geese honk incessantly, harass anyone that comes near them, and poop on the sidewalk.

Which side of this issue does that better describe, I wonder."				1645235468	{}	hxiyftl	False	t3_svu1fv	False	True	t1_hxitqc6	/r/ethereum/comments/svu1fv/banks_are_freezing_accounts_in_canada/hxiyftl/	1649994340.0	2	True	False	ethereum	t5_2zf9m		0	[]																									
295	[]		CletusTSJY			[]				text	t2_32bqj	False	False	[]	I’d buy some of those tweets tbh. Remember rocket man? Like him or hate him guy had some bangers.				1645235459	{}	hxiyf3a	False	t3_svtuwk	False	True	t3_svtuwk	/r/ethereum/comments/svtuwk/trump_will_sell_nfts_of_key_moments_of_his_time/hxiyf3a/	1649994275.0	2	True	False	ethereum	t5_2zf9m		0	[]																									
296	[]		drhodl			[]				text	t2_afueacp	False	False	[]	"""Here's one of me selling out our long time allies, the Kurds.  

Oh, and here's the one where I sabotaged Biden's chance of a orderly withdrawal from Afghanistan.

Oh, and here's the one of the time Trump Org had a private server connected directly to Russia's Alpha Bank.  Nothing to see here lol.  That one was hilarious..."""				1645235311	{}	hxiy458	False	t3_svtuwk	False	True	t1_hxi8w6g	/r/ethereum/comments/svtuwk/trump_will_sell_nfts_of_key_moments_of_his_time/hxiy458/	1649993277.0	7	True	False	ethereum	t5_2zf9m		0	[]																									
297	[]		cantevenskatewell			[]				text	t2_ibt2s	False	False	[]	Nah gfy instead				1645235301	{}	hxiy3eh	False	t3_svu1fv	False	True	t1_hxithxs	/r/ethereum/comments/svu1fv/banks_are_freezing_accounts_in_canada/hxiy3eh/	1649993205.0	-1	True	False	ethereum	t5_2zf9m		0	[]																									
298	[]		Yoloballsdeep			[]				text	t2_a0zp2j85	False	False	[]	I thought he hated crypto and worships the trash fiat coupons and below zero interest rates				1645235218	{}	hxixx6z	False	t3_svtuwk	False	True	t3_svtuwk	/r/ethereum/comments/svtuwk/trump_will_sell_nfts_of_key_moments_of_his_time/hxixx6z/	1649992632.0	1	True	False	ethereum	t5_2zf9m		0	[]																									
299	[]		FaceDeer			[]				text	t2_4ljvm	False	False	[]	So, what, you're saying flipping back and forth is bad?				1645235133	{}	hxixqvv	False	t3_svu1fv	False	True	t1_hxitdvo	/r/ethereum/comments/svu1fv/banks_are_freezing_accounts_in_canada/hxixqvv/	1649992045.0	-1	True	False	ethereum	t5_2zf9m		0	[]																									
300	[]		admin_accnt			[]				text	t2_49920ssc	False	True	[]	To himself				1645235051	{}	hxixl0c	False	t3_svtuwk	False	True	t3_svtuwk	/r/ethereum/comments/svtuwk/trump_will_sell_nfts_of_key_moments_of_his_time/hxixl0c/	1649991505.0	1	True	False	ethereum	t5_2zf9m		0	[]																									
301	[]		-xstatic-			[]				text	t2_4c5h39np	False	False	[]	The grift that keeps on grifting				1645235013	{}	hxixi7e	False	t3_svtuwk	False	True	t3_svtuwk	/r/ethereum/comments/svtuwk/trump_will_sell_nfts_of_key_moments_of_his_time/hxixi7e/	1649991241.0	1	True	False	ethereum	t5_2zf9m		0	[]																									
302	[]		EmbraceHegemony			[]				text	t2_34g1qc3l	False	False	[]	This move is 100% Melania trying to cash in before divorcing Trump and violating whatever pre-nup they have.				1645235011	{}	hxixi3v	False	t3_svtuwk	False	True	t3_svtuwk	/r/ethereum/comments/svtuwk/trump_will_sell_nfts_of_key_moments_of_his_time/hxixi3v/	1649991232.0	1	True	False	ethereum	t5_2zf9m		0	[]														True											
303	[]		drhodl			[]				text	t2_afueacp	False	False	[]	I suspect there's a third yet to come...				1645234988	{}	hxixgcm	False	t3_svtuwk	False	True	t1_hxiem9z	/r/ethereum/comments/svtuwk/trump_will_sell_nfts_of_key_moments_of_his_time/hxixgcm/	1649991064.0	5	True	False	ethereum	t5_2zf9m		0	[]																									
304	[]		SolarPanelDude			[]				text	t2_8o5lwepk	False	False	[]	Puts on NFTs.  Everything he touches he ruins				1645234988	{}	hxixgca	False	t3_svtuwk	False	True	t3_svtuwk	/r/ethereum/comments/svtuwk/trump_will_sell_nfts_of_key_moments_of_his_time/hxixgca/	1649991063.0	1	True	False	ethereum	t5_2zf9m		0	[]																									
305	[]		Criss_Crossx			[]				text	t2_a8e0o	False	False	[]	Sharpie-gate all the way				1645234969	{}	hxixex5	False	t3_svtuwk	False	True	t1_hxi8w6g	/r/ethereum/comments/svtuwk/trump_will_sell_nfts_of_key_moments_of_his_time/hxixex5/	1649990933.0	3	True	False	ethereum	t5_2zf9m		0	[]																									
306	[]		[deleted]						dark					[]	[deleted]				1645234764	{}	hxiwzwa	False	t3_svu1fv	False	True	t1_hxillfc	/r/ethereum/comments/svu1fv/banks_are_freezing_accounts_in_canada/hxiwzwa/	1649989536.0	0	True	False	ethereum	t5_2zf9m		0	[]																									
307	[]		BabySealOfDoom			[]				text	t2_28g1tclh	False	False		Classified documents are maybe nft? I wonder for my Russia friend. He loves white paper has words.				1645234723	{}	hxiwwu3	False	t3_svtuwk	False	True	t3_svtuwk	/r/ethereum/comments/svtuwk/trump_will_sell_nfts_of_key_moments_of_his_time/hxiwwu3/		1	True	False	ethereum	t5_2zf9m		0	[]		False	0d73c5c0027a8abc851ad5ca110dcea43addc126	True	False		0.0		0.0	1645234737.0	False	r/ethereum	public												
308	[]		quaglandx3			[]				text	t2_hs0aj	False	False	[]	Ah, so NFTs are a scam after all…				1645234716	{}	hxiwwbn	False	t3_svtuwk	False	True	t3_svtuwk	/r/ethereum/comments/svtuwk/trump_will_sell_nfts_of_key_moments_of_his_time/hxiwwbn/	1649989200.0	1	True	False	ethereum	t5_2zf9m		0	[]																									
309	[]		cletus_foo			[]				text	t2_12rpjq	False	False	[]	I'll take the one where he climbed in the semi and pretend to drive it.  Gold.				1645234622	{}	hxiwpk4	False	t3_svtuwk	False	True	t3_svtuwk	/r/ethereum/comments/svtuwk/trump_will_sell_nfts_of_key_moments_of_his_time/hxiwpk4/	1649988569.0	1	True	False	ethereum	t5_2zf9m		0	[]																									
310	[]		Ken808			[]				text	t2_9gn4w	False	True	[]	"Just because you didn't personally experience it doesn't mean it isn't there.  You're supporting a movement led by white supremacists flying swastikas and other hateful symbols.

Three percenters flag, a designated terrorist organization in Canada  
  
https://mobile.twitter.com/MarcCossette/status/1488168403575742470?s=20&amp;t=eWgi3uu2cpmjXjcMF20L3Q  
  
Canadian white nationalist party flag  
  
https://mobile.twitter.com/Justin\_Ling/status/1487889846735675397  
  
Nazi and confederate flags  
  
https://mobile.twitter.com/WillieHandler/status/1487838826915860481  
  
Confederate flag  
  
https://mobile.twitter.com/ArielTroster/status/1487081459546529798?s=20&amp;t=ZyG4NPV94q9MzplD9J02jw"				1645234617	{}	hxiwp6n	False	t3_svu1fv	False	True	t1_hxirtw9	/r/ethereum/comments/svu1fv/banks_are_freezing_accounts_in_canada/hxiwp6n/	1649988533.0	0	True	False	ethereum	t5_2zf9m		0	[]																									
311	[]		Throwawayiea			[]				text	t2_10k0h3	False	False	[]	Because foreign and bad influences were coming into play. Bad influences like what happen in Coutts, AB when they found firearms and arrested 12 people. The Freedom Convoy saw this as a bad sign blurring the message and disbanded. They have my utmost respect for doing so I respected the protest but it just turned dark real fast and they outstayed their welcome. I HATE the mandates. I don't like Trudeau. However, I believe the actions were necessary and about freezing accounts, etc the judicial system started doing that WITHOUT the Emergency Measures at. They are an independent governing body.				1645234487	{}	hxiwfj7	False	t3_svu1fv	False	True	t1_hxivo42	/r/ethereum/comments/svu1fv/banks_are_freezing_accounts_in_canada/hxiwfj7/	1649987641.0	0	True	False	ethereum	t5_2zf9m		0	[]																									
312	[]		[deleted]						dark					[]	[deleted]				1645234373	{}	hxiw77h	False	t3_svtuwk	False	True	t1_hxilr68	/r/ethereum/comments/svtuwk/trump_will_sell_nfts_of_key_moments_of_his_time/hxiw77h/	1649986868.0	0	True	False	ethereum	t5_2zf9m		0	[]																									
313	[]		septicdank			[]				text	t2_jh6qd	False	False	[]	Now him and Melania can buy each other's NFT's!				1645234323	{}	hxiw3l4	False	t3_svtuwk	False	True	t3_svtuwk	/r/ethereum/comments/svtuwk/trump_will_sell_nfts_of_key_moments_of_his_time/hxiw3l4/	1649986524.0	1	True	False	ethereum	t5_2zf9m		0	[]																									
314	[]		Throwawayiea			[]				text	t2_10k0h3	False	False	[]	then tell me what you like about the conservatives. Actually, you tell me that your a liberal warms my heart :) Also, and I will repeat, I don't like Trudeau.				1645234284	{}	hxiw0n2	False	t3_svu1fv	False	True	t1_hxivwv9	/r/ethereum/comments/svu1fv/banks_are_freezing_accounts_in_canada/hxiw0n2/	1649986245.0	3	True	False	ethereum	t5_2zf9m		0	[]																									
315	[]		EmanEwl			[]				text	t2_738vd4vr	False	False	[]	Funny how you see nothing about this in the US media. At least I dont see any major coverage				1645234276	{}	hxiw00u	False	t3_svu1fv	False	True	t3_svu1fv	/r/ethereum/comments/svu1fv/banks_are_freezing_accounts_in_canada/hxiw00u/	1649986182.0	5	True	False	ethereum	t5_2zf9m		0	[]																									
316	[]		[deleted]						dark					[]	[deleted]				1645234276	{}	hxiw00n	False	t3_svu1fv	False	True	t3_svu1fv	/r/ethereum/comments/svu1fv/banks_are_freezing_accounts_in_canada/hxiw00n/	1649986181.0	1	True	False	ethereum	t5_2zf9m		0	[]																									
317	[]		DEADPAN_GLAM			[]				text	t2_53tewm86	False	False	[]	To himself				1645234242	{}	hxivxh9	False	t3_svtuwk	False	True	t3_svtuwk	/r/ethereum/comments/svtuwk/trump_will_sell_nfts_of_key_moments_of_his_time/hxivxh9/	1649985944.0	1	True	False	ethereum	t5_2zf9m		0	[]																									
318	[]		StanDarsh88			[]				text	t2_eprnw9qm	False	False	[]	I'm a lifelong liberal and I support those truckers, and I support anyone fighting against the government.   Fuck is wrong with YOU?				1645234234	{}	hxivwv9	False	t3_svu1fv	False	True	t1_hxig9jb	/r/ethereum/comments/svu1fv/banks_are_freezing_accounts_in_canada/hxivwv9/	1649985884.0	3	True	False	ethereum	t5_2zf9m		0	[]																									
319	[]		ouyin2000			[]				text	t2_8x7yh	False	False	[]	Probably where he got the idea.				1645234132	{}	hxivp4h	False	t3_svtuwk	False	True	t1_hxivfzt	/r/ethereum/comments/svtuwk/trump_will_sell_nfts_of_key_moments_of_his_time/hxivp4h/	1649985134.0	2	True	False	ethereum	t5_2zf9m		0	[]																									
320	[]		illini35			[]				text	t2_t7rsl	False	False	[]	Biden should do this as well				1645234129	{}	hxivowr	False	t3_svtuwk	False	True	t3_svtuwk	/r/ethereum/comments/svtuwk/trump_will_sell_nfts_of_key_moments_of_his_time/hxivowr/	1649985114.0	1	True	False	ethereum	t5_2zf9m		0	[]																									
321	[]		[deleted]						dark					[]	[deleted]				1645234125	{}	hxivoln	False	t3_svu1fv	False	True	t1_hxigbpk	/r/ethereum/comments/svu1fv/banks_are_freezing_accounts_in_canada/hxivoln/	1649985086.0	-1	True	False	ethereum	t5_2zf9m		0	[]																									
322	[]		urnapple			[]				text	t2_1ovhefjj	False	False	[]	No but the point is our CANADIAN Prime Minister SUPPORTED the destruction				1645234118	{}	hxivo42	False	t3_svu1fv	False	True	t1_hxigfqz	/r/ethereum/comments/svu1fv/banks_are_freezing_accounts_in_canada/hxivo42/	1649985039.0	1	True	False	ethereum	t5_2zf9m		0	[]																									
323	[]		Swoopscooter			[]				text	t2_35u1aqvg	False	False	[]	🤣 good one				1645234064	{}	hxivk1t	False	t3_svu1fv	False	True	t1_hxikxr2	/r/ethereum/comments/svu1fv/banks_are_freezing_accounts_in_canada/hxivk1t/	1649984664.0	-1	True	False	ethereum	t5_2zf9m		0	[]																									
324	[]		tiffanylan			[]				text	t2_qp4gl	False	False	[]	Melania already has done that with her ugly hat NFT.  Sold it to herself after the value was a fraction of the asking price.  Another grift!				1645234007	{}	hxivfzt	False	t3_svtuwk	False	True	t1_hxio2a8	/r/ethereum/comments/svtuwk/trump_will_sell_nfts_of_key_moments_of_his_time/hxivfzt/	1649984267.0	5	True	False	ethereum	t5_2zf9m		0	[]																									
325	[]		donkboy			[]				text	t2_41yw2	False	False	[]	Selling them for fiat? Because crypto is bad right?				1645233968	{}	hxivd6f	False	t3_svtuwk	False	True	t3_svtuwk	/r/ethereum/comments/svtuwk/trump_will_sell_nfts_of_key_moments_of_his_time/hxivd6f/	1649983989.0	1	True	False	ethereum	t5_2zf9m		0	[]																									
326	[]		yvv1			[]				text	t2_ot8s6qa	False	False	[]	This proves that banking system is an instrument of economical oppression. Those who think this is alright will look funny when they will get oppressed the same way some day.				1645233954	{}	hxivc4i	False	t3_svu1fv	False	True	t3_svu1fv	/r/ethereum/comments/svu1fv/banks_are_freezing_accounts_in_canada/hxivc4i/	1649983887.0	1	True	False	ethereum	t5_2zf9m		0	[]																									
327	[]		WildRacoons			[]				text	t2_33j7br	False	False	[]	"TBF the tokenomics were designed specifically to incentivise active actors without extracting value from the system (charging protocol fee to user, let NOs enjoy rent-free commissions).

It’s a little weird because such systems are novel (nearly no cost to the protocol after devs deploy smart contracts). In the mid-long term, the price action will likely be decent due to growing NOs. 

In the ultra long term (after massive amounts of ETH staked) - RPL will likely act as a slowly depreciating deposit that NOs pay to enjoy the benefits of the protocol."				1645233915	{}	hxiv98v	False	t3_svw5iw	False	True	t1_hxisxys	/r/ethereum/comments/svw5iw/how_to_stake_less_than_32_eth_off_cex/hxiv98v/	1649983619.0	1	True	False	ethereum	t5_2zf9m		0	[]																									
328	[]		Klutzy-Chocolate710			[]				text	t2_4v2eopu6	False	False	[]	yet another grift I'm sure.				1645233831	{}	hxiv2zj	False	t3_svtuwk	False	True	t3_svtuwk	/r/ethereum/comments/svtuwk/trump_will_sell_nfts_of_key_moments_of_his_time/hxiv2zj/	1649983028.0	1	True	False	ethereum	t5_2zf9m		0	[]																									
329	[]		Hancock02			[]				text	t2_9ancr	False	False	[]	EX US president Donald fuckall Trump				1645233827	{}	hxiv2op	False	t3_svtuwk	False	True	t1_hxic419	/r/ethereum/comments/svtuwk/trump_will_sell_nfts_of_key_moments_of_his_time/hxiv2op/	1649983000.0	5	True	False	ethereum	t5_2zf9m		0	[]																									
330	[]		Hancock02			[]				text	t2_9ancr	False	False		best one is signing his name on a black paper during his covid hospitalization				1645233762	{}	hxiuy1d	False	t3_svtuwk	False	True	t1_hxi8w6g	/r/ethereum/comments/svtuwk/trump_will_sell_nfts_of_key_moments_of_his_time/hxiuy1d/		1	True	False	ethereum	t5_2zf9m		0	[]		False	43ddb65fa5709b400c2d4e21a0d59d5ada2d9bb8	True	False		0.0		0.0	1645233780.0	False	r/ethereum	public												
331	[]		jimmychung88			[]				text	t2_mmhgp23	False	False	[]	I'm getting the Four Seasons Total Landscaping NFT				1645233733	{}	hxiuvul	False	t3_svtuwk	False	True	t3_svtuwk	/r/ethereum/comments/svtuwk/trump_will_sell_nfts_of_key_moments_of_his_time/hxiuvul/	1649982355.0	1	True	False	ethereum	t5_2zf9m		0	[]																									
332	[]		Cecilia_Wren			[]				text	t2_blnndxk6	False	False	[]	tfw being cool is more important than stopping a global pandemic 😎				1645233667	{}	hxiur0v	False	t3_svu1fv	False	True	t1_hxitp76	/r/ethereum/comments/svu1fv/banks_are_freezing_accounts_in_canada/hxiur0v/	1649981890.0	-1	True	False	ethereum	t5_2zf9m		0	[]																									
333	[]		uGotMeWrong			[]				text	t2_u0dz0am	False	False	[]	Here’s me boarding Air Force One with toilet paper stuck to my shoe.				1645233655	{}	hxiuq3g	False	t3_svtuwk	False	True	t1_hxi8w6g	/r/ethereum/comments/svtuwk/trump_will_sell_nfts_of_key_moments_of_his_time/hxiuq3g/	1649981804.0	7	True	False	ethereum	t5_2zf9m		0	[]																									
334	[]		captainhaddock			[]				text	t2_1wk8q	False	False	[]	How about an NFT of him publicly mocking a disabled journalist? And maybe another where he suggests inserting bleach and UV light into people to kill the coronavirus. And maybe one for that big empty binder that supposedly contained his health care plan.				1645233572	{}	hxiuk2r	False	t3_svtuwk	False	True	t1_hxi8w6g	/r/ethereum/comments/svtuwk/trump_will_sell_nfts_of_key_moments_of_his_time/hxiuk2r/	1649981233.0	11	False	False	ethereum	t5_2zf9m		0	[]																									
335	[]		okwhoqueefed			[]				text	t2_7twc0ivk	False	False	[]	Ooooh burn. My feelings are hurt now. I think I’m gonna go protest because you’re against my freedumbs to double mask.				1645233448	{}	hxiuawe	False	t3_svu1fv	False	True	t1_hxitpyz	/r/ethereum/comments/svu1fv/banks_are_freezing_accounts_in_canada/hxiuawe/	1649980348.0	-1	True	False	ethereum	t5_2zf9m		0	[]																									
336	[]		saddit42			[]				text	t2_kibwt	False	False	[]	There's pros and cons in the crypto community growing. One bad aspect is that you don't find the original crypto spirit as much anymore on reddit. But that's ok.. there will be decentralized reputaiton based alternatives soon				1645233424	{}	hxiu980	False	t3_svu1fv	False	True	t1_hxin47j	/r/ethereum/comments/svu1fv/banks_are_freezing_accounts_in_canada/hxiu980/	1649980186.0	2	True	False	ethereum	t5_2zf9m		0	[]																									
337	[]		StanDarsh88			[]				text	t2_eprnw9qm	False	False	[]	That's fucking right.  I'm a college educated lifelong liberal, crypto enthusiast, and what's happening right now is WRONG.  Stop painting us Trump supporters.  I fucking hate that dude.				1645233424	{}	hxiu97r	False	t3_svu1fv	False	True	t1_hxi9vuq	/r/ethereum/comments/svu1fv/banks_are_freezing_accounts_in_canada/hxiu97r/	1649980185.0	4	True	False	ethereum	t5_2zf9m		0	[]																									
338	[]		Dry-Significance-948			[]				text	t2_7jiap222	False	False	[]	Yes, miners and some gets burned as well				1645233379	{}	hxiu5x8	False	t3_svqih9	False	True	t3_svqih9	/r/ethereum/comments/svqih9/how_does_eth_inflation_actually_work/hxiu5x8/	1649979865.0	1	True	False	ethereum	t5_2zf9m		0	[]																									
339	[]		BilloTBaggins			[]				text	t2_amx0dvdg	False	False	[]	Thanks!!  I’m gonna look into this				1645233267	{}	hxitxks	True	t3_svw5iw	False	False	t1_hxisn5j	/r/ethereum/comments/svw5iw/how_to_stake_less_than_32_eth_off_cex/hxitxks/	1649979074.0	3	True	False	ethereum	t5_2zf9m		0	[]																									
340	[]		ouyin2000			[]				text	t2_8x7yh	False	False	[]	Their MOU literally called for the Governor General to dissolve the duly elected government and hand over the reins to the leaders of the Konvoy.				1645233208	{}	hxitt7e	False	t3_svu1fv	False	True	t1_hxisue0	/r/ethereum/comments/svu1fv/banks_are_freezing_accounts_in_canada/hxitt7e/	1649978646.0	0	True	False	ethereum	t5_2zf9m		0	[]																									
341	[]		StanDarsh88			[]				text	t2_eprnw9qm	False	False	[]	Shut up boomer				1645233204	{}	hxitswo	False	t3_svu1fv	False	True	t1_hximb6c	/r/ethereum/comments/svu1fv/banks_are_freezing_accounts_in_canada/hxitswo/	1649978617.0	1	True	False	ethereum	t5_2zf9m		0	[]																									
342	[]		StanDarsh88			[]				text	t2_eprnw9qm	False	False	[]	Fucking right				1645233192	{}	hxits2t	False	t3_svu1fv	False	True	t1_hxihyw9	/r/ethereum/comments/svu1fv/banks_are_freezing_accounts_in_canada/hxits2t/	1649978533.0	3	True	False	ethereum	t5_2zf9m		0	[]																									
343	[]		lostharbor			[]				text	t2_lzh5u	False	False	[]	He found a sucker to pay those, the RNC				1645233192	{}	hxits28	False	t3_svtuwk	False	True	t1_hxi6bfe	/r/ethereum/comments/svtuwk/trump_will_sell_nfts_of_key_moments_of_his_time/hxits28/	1649978531.0	4	True	False	ethereum	t5_2zf9m		0	[]																									
344	[]		Ideafecater			[]				text	t2_i2bqdmcb	False	False	[]	You silly goose				1645233169	{}	hxitqc6	False	t3_svu1fv	False	True	t1_hxiciej	/r/ethereum/comments/svu1fv/banks_are_freezing_accounts_in_canada/hxitqc6/	1649978365.0	0	True	False	ethereum	t5_2zf9m		0	[]																									
345	[]		Busy-Bonus3010			[]				text	t2_dxsnn4tv	False	False	[]	Guarantee you’re one of those ones that wore double mask you fuckin clown				1645233164	{}	hxitpyz	False	t3_svu1fv	False	True	t1_hxiteo9	/r/ethereum/comments/svu1fv/banks_are_freezing_accounts_in_canada/hxitpyz/	1649978329.0	1	True	False	ethereum	t5_2zf9m		0	[]																									
346	[]		StanDarsh88			[]				text	t2_eprnw9qm	False	False	[]	"Hate to tell you, but as of a month ago on the internet this was considered the defacto boomer stance, and basically the epitome of uncool.

Glad to see which side you picked."				1645233154	{}	hxitp76	False	t3_svu1fv	False	True	t1_hximgaq	/r/ethereum/comments/svu1fv/banks_are_freezing_accounts_in_canada/hxitp76/	1649978254.0	1	True	False	ethereum	t5_2zf9m		0	[]																									
347	[]		[deleted]						dark					[]	[deleted]				1645233139	{}	hxito3y	False	t3_svu1fv	False	True	t1_hxiteo9	/r/ethereum/comments/svu1fv/banks_are_freezing_accounts_in_canada/hxito3y/	1649978149.0	1	True	False	ethereum	t5_2zf9m		0	[]																									
348	[]		StanDarsh88			[]				text	t2_eprnw9qm	False	False	[]	Wrong answer.  Try again				1645233055	{}	hxithxs	False	t3_svu1fv	False	True	t1_hxinckg	/r/ethereum/comments/svu1fv/banks_are_freezing_accounts_in_canada/hxithxs/	1649977561.0	0	True	False	ethereum	t5_2zf9m		0	[]																									
349	[]		okwhoqueefed			[]				text	t2_7twc0ivk	False	False	[]	You don’t even know what communism is if you think thats what’s happening. If you have a problem with me, then you have a problem with the majority of Canadians who are also in agreement with these emergency measures. But whatever, you go support funding these reprobates and keep doubling down on stupid, loser.				1645233012	{}	hxiteo9	False	t3_svu1fv	False	True	t1_hxir3rf	/r/ethereum/comments/svu1fv/banks_are_freezing_accounts_in_canada/hxiteo9/	1649977245.0	4	True	False	ethereum	t5_2zf9m		0	[]																									
350	[]		StanDarsh88			[]				text	t2_eprnw9qm	False	False	[]	Yeah, sort of like how the government has been flipping back and forth between putting a mask on, or not.  And making us comply with these back and forth(s) while every week we watch ten of thousands of people watching sporting events with no masks on, just fine.				1645233001	{}	hxitdvo	False	t3_svu1fv	False	True	t1_hxibxfi	/r/ethereum/comments/svu1fv/banks_are_freezing_accounts_in_canada/hxitdvo/	1649977167.0	1	True	False	ethereum	t5_2zf9m		0	[]																									
351	[]		VLADIMIROVIC_L			[]				text	t2_nfndk	False	False	[]	which other methods sir?				1645232990	{}	hxitd0d	True	t3_rs9x1a	False	True	t1_hxgbiok	/r/ethereum/comments/rs9x1a/im_looking_for_an_nft_contract_that_uses_a_merkle/hxitd0d/	1649977080.0	1	True	False	ethereum	t5_2zf9m		0	[]																									
