Unnamed: 0	all_awardings	allow_live_comments	author	author_flair_css_class	author_flair_richtext	author_flair_text	author_flair_type	author_fullname	author_is_blocked	author_patreon_flair	author_premium	awarders	can_mod_post	contest_mode	created_utc	domain	full_link	gildings	id	is_created_from_ads_ui	is_crosspostable	is_meta	is_original_content	is_reddit_media_domain	is_robot_indexable	is_self	is_video	link_flair_background_color	link_flair_richtext	link_flair_text_color	link_flair_type	locked	media_only	no_follow	num_comments	num_crossposts	over_18	parent_whitelist_status	permalink	pinned	pwls	removed_by_category	retrieved_on	score	selftext	send_replies	spoiler	stickied	subreddit	subreddit_id	subreddit_subscribers	subreddit_type	thumbnail	title	total_awards_received	treatment_tags	upvote_ratio	url	url_overridden_by_dest	whitelist_status	wls	author_flair_template_id	author_flair_text_color	post_hint	preview	thumbnail_height	thumbnail_width	author_flair_background_color	media	media_embed	secure_media	secure_media_embed	gallery_data	is_gallery	media_metadata	link_flair_text	suggested_sort	author_cakeday	crosspost_parent	crosspost_parent_list	link_flair_template_id	concated	corpus	support	knowledge	conflict	power	similarity	fun	status	trust	identity	romance
0	[]	False	Ambitious-Film2095		[]		text	t2_mnmzl0p4	False	False	False	[]	False	False	1651564344	gohere.pl	https://www.reddit.com/r/Bitcoin/comments/uhazxv/click_on_the_link_to_create_a_free_account_and/	{}	uhazxv	False	False	False	False	False	False	False	False		[]	dark	text	False	False	True	0	0	False	all_ads	/r/Bitcoin/comments/uhazxv/click_on_the_link_to_create_a_free_account_and/	False	6	reddit	1651564354	1		True	False	False	Bitcoin	t5_2s3qj	4157600	public	default	click on the link to create a free account and startsaving	0	[]	1.0	https://gohere.pl/p/T4wV/cg2O/OcFg	https://gohere.pl/p/T4wV/cg2O/OcFg	all_ads	6																					"click on the link to create a free account and startsaving
"	click on the link to create a free account and startsaving nan	0.19561536610126495	0.8359719514846802	0.19068048894405365	0.6348786950111389	0.3578684329986572	0.2645972669124603	0.22582797706127167	0.00047259125858545303	0.38144370913505554	0.019112970679998398
1	[]	False	Bitter-Form-4364		[]		text	t2_fzynfrjh	False	False	False	[]	False	False	1651563654	self.Bitcoin	https://www.reddit.com/r/Bitcoin/comments/uhauq5/please_help_me_im_begin_you/	{}	uhauq5	False	True	False	False	False	True	True	False		[]	dark	text	False	False	False	0	0	False	all_ads	/r/Bitcoin/comments/uhauq5/please_help_me_im_begin_you/	False	6		1651563664	1	Please help me I need some donations I'm in a very bad situation I'm really desperate I don't know what to do please send me some btc to pay my bills please help me bc1q5g70a2wea3u3csn6kywwgz3z80xl8apdvxsyl8	True	False	False	Bitcoin	t5_2s3qj	4157585	public	self	Please help me im begin you	0	[]	1.0	https://www.reddit.com/r/Bitcoin/comments/uhauq5/please_help_me_im_begin_you/		all_ads	6																					"Please help me im begin you
Please help me I need some donations I'm in a very bad situation I'm really desperate I don't know what to do please send me some btc to pay my bills please help me bc1q5g70a2wea3u3csn6kywwgz3z80xl8apdvxsyl8"	please help me im begin you please help me i need some donations i m in a very bad situation i m really desperate i don t know what to do please send me some btc to pay my bills please help me bc1q5g70a2wea3u3csn6kywwgz3z80xl8apdvxsyl8	0.9826518297195435	0.04668314754962921	0.008748645894229412	0.008553460240364075	0.003948010504245758	0.07370220869779587	0.9434375762939453	9.79814785750932e-07	0.13032343983650208	0.0006973950657993555
2	[]	False	ajaykumar02	noob	[{'e': 'text', 't': 'redditor for 5 weeks'}]	redditor for 5 weeks	richtext	t2_l01rxc0k	False	False	False	[]	False	False	1651563130	mainstreetpt.com	https://www.reddit.com/r/Bitcoin/comments/uhaqlk/best_dpt_therapist_clinic_oceanside_nassau_new/	{}	uhaqlk	False	True	False	False	False	True	False	False		[]	dark	text	False	False	True	0	0	False	all_ads	/r/Bitcoin/comments/uhaqlk/best_dpt_therapist_clinic_oceanside_nassau_new/	False	6		1651563140	1		True	False	False	Bitcoin	t5_2s3qj	4157574	public	default	Best DPT Therapist clinic Oceanside Nassau New York.	0	[]	1.0	https://mainstreetpt.com/gallery	https://mainstreetpt.com/gallery	all_ads	6	2ec8e69e-6c36-11e9-a04b-0afb553d4ea6	dark																			"Best DPT Therapist clinic Oceanside Nassau New York.
"	best dpt therapist clinic oceanside nassau new york nan	0.5321637392044067	0.5640167593955994	0.10755511373281479	0.3850958049297333	0.4795413911342621	0.5488842725753784	0.450467050075531	0.6209743618965149	0.45976734161376953	0.1208166554570198
3	[]	False	BlockHeight0	noob	[{'e': 'text', 't': 'redditor for a day'}]	redditor for a day	richtext	t2_mmdagcod	False	False	False	[]	False	False	1651563072	self.Bitcoin	https://www.reddit.com/r/Bitcoin/comments/uhaq4g/just_withdrew_off_my_exchange/	{}	uhaq4g	False	True	False	False	False	True	True	False		[]	dark	text	False	False	True	0	0	False	all_ads	/r/Bitcoin/comments/uhaq4g/just_withdrew_off_my_exchange/	False	6		1651563083	1	"It’s been a journey. Heard about BTC back when I was 16, made an exchange account at 17, bought my first amount at 19. Went through the whole fiasco and ended up being orange pilled within a year. I’m now 20 and withdrew to my ledger yesterday. 

It’s a whole different feeling I tell you. I have complete peace of mind. Anxiety free as of today. If you’ve been thinking about it recently, organise yourself a trusty seed backup and a hardware wallet."	True	False	False	Bitcoin	t5_2s3qj	4157575	public	self	Just withdrew off my exchange!	0	[]	1.0	https://www.reddit.com/r/Bitcoin/comments/uhaq4g/just_withdrew_off_my_exchange/		all_ads	6	2ec8e69e-6c36-11e9-a04b-0afb553d4ea6	dark																			"Just withdrew off my exchange!
It’s been a journey. Heard about BTC back when I was 16, made an exchange account at 17, bought my first amount at 19. Went through the whole fiasco and ended up being orange pilled within a year. I’m now 20 and withdrew to my ledger yesterday. 

It’s a whole different feeling I tell you. I have complete peace of mind. Anxiety free as of today. If you’ve been thinking about it recently, organise yourself a trusty seed backup and a hardware wallet."	just withdrew off my exchange it s been a journey heard about btc back when i was 16 made an exchange account at 17 bought my first amount at 19 went through the whole fiasco and ended up being orange pilled within a year i m now 20 and withdrew to my ledger yesterday it s a whole different feeling i tell you i have complete peace of mind anxiety free as of today if you ve been thinking about it recently organise yourself a trusty seed backup and a hardware wallet 	0.0024380984250456095	0.9898850917816162	0.0734274759888649	0.053453486412763596	0.9947147965431213	0.3956791162490845	0.10139261931180954	8.38913422285259e-07	0.24521534144878387	0.036091383546590805
4	[]	False	AndyCanestra	noob	[{'e': 'text', 't': 'redditor for 2 days'}]	redditor for 2 days	richtext	t2_mk8hun34	False	False	False	[]	False	False	1651561768	self.Bitcoin	https://www.reddit.com/r/Bitcoin/comments/uhag2u/earn_bitcoin_quick_and_easy_without_spending_a/	{}	uhag2u	False	False	False	False	False	False	True	False		[]	dark	text	False	False	True	0	0	False	all_ads	/r/Bitcoin/comments/uhag2u/earn_bitcoin_quick_and_easy_without_spending_a/	False	6	reddit	1651561778	1	[removed]	True	False	False	Bitcoin	t5_2s3qj	4157538	public	self	Earn Bitcoin quick and easy without spending a cent!	0	[]	1.0	https://www.reddit.com/r/Bitcoin/comments/uhag2u/earn_bitcoin_quick_and_easy_without_spending_a/		all_ads	6	2ec8e69e-6c36-11e9-a04b-0afb553d4ea6	dark	self	{'enabled': False, 'images': [{'id': 'CKBpRplKfsEdmN3jcil5G7VJJtlGC3FA0dBuTdF2L-U', 'resolutions': [{'height': 62, 'url': 'https://external-preview.redd.it/j0xS_pUqJDsoFpWIblfhC74ps5VSU2cScfnwKM735iY.jpg?width=108&amp;crop=smart&amp;auto=webp&amp;s=abf204e07e7ce1d53a27eb1759ceef36a5d07885', 'width': 108}, {'height': 124, 'url': 'https://external-preview.redd.it/j0xS_pUqJDsoFpWIblfhC74ps5VSU2cScfnwKM735iY.jpg?width=216&amp;crop=smart&amp;auto=webp&amp;s=b4acca2f0e171bae3ebb5185b62b24ff01f46df9', 'width': 216}, {'height': 184, 'url': 'https://external-preview.redd.it/j0xS_pUqJDsoFpWIblfhC74ps5VSU2cScfnwKM735iY.jpg?width=320&amp;crop=smart&amp;auto=webp&amp;s=99329e7f85d1529af4576b93bfbbe328ef9d4624', 'width': 320}, {'height': 369, 'url': 'https://external-preview.redd.it/j0xS_pUqJDsoFpWIblfhC74ps5VSU2cScfnwKM735iY.jpg?width=640&amp;crop=smart&amp;auto=webp&amp;s=5bd520795f9dcf341561428b091e5af321122634', 'width': 640}], 'source': {'height': 369, 'url': 'https://external-preview.redd.it/j0xS_pUqJDsoFpWIblfhC74ps5VSU2cScfnwKM735iY.jpg?auto=webp&amp;s=d8d15357b8316db839c7cda7d9a158dccf1ae05f', 'width': 640}, 'variants': {}}]}																	"Earn Bitcoin quick and easy without spending a cent!
[removed]"	earn bitcoin quick and easy without spending a cent removed 	0.5795056223869324	0.6668749451637268	0.3398115932941437	0.35742178559303284	0.19985762238502502	0.2369745820760727	0.3254694640636444	0.7833073735237122	0.38328397274017334	0.1135425865650177
5	[]	False	jaun_speaks		[]		text	t2_d121ov07	False	False	False	[]	False	False	1651561168	self.Bitcoin	https://www.reddit.com/r/Bitcoin/comments/uhab3a/how_fast_should_miners_computer_generate_work_for/	{}	uhab3a	False	True	False	False	False	True	True	False		[]	dark	text	False	False	True	0	0	False	all_ads	/r/Bitcoin/comments/uhab3a/how_fast_should_miners_computer_generate_work_for/	False	6		1651561179	1	"how fast does the beaglebone block generate work? modern asic miners exhaust the nonce range in around 2-3 milliseconds. 

say if it does exhaust in 2 milliseconds, and we need to keep the asics busy for 1 second, does it mean it needs to send 500 work items to the ASICS every second? 
what if it exhausts the range in 1 ms? 

is the microcomputer capable of generating and sending that much data that fast? 
one work = 512 bits 
1000 work items = 512000 bits 

on uart the baud rate is 115200 bits/second

the work items data is approx 5 times more for every second. how is the data transfer handled?"	True	False	False	Bitcoin	t5_2s3qj	4157520	public	self	How fast should miners computer generate work for ASICS?	0	[]	1.0	https://www.reddit.com/r/Bitcoin/comments/uhab3a/how_fast_should_miners_computer_generate_work_for/		all_ads	6																					"How fast should miners computer generate work for ASICS?
how fast does the beaglebone block generate work? modern asic miners exhaust the nonce range in around 2-3 milliseconds. 

say if it does exhaust in 2 milliseconds, and we need to keep the asics busy for 1 second, does it mean it needs to send 500 work items to the ASICS every second? 
what if it exhausts the range in 1 ms? 

is the microcomputer capable of generating and sending that much data that fast? 
one work = 512 bits 
1000 work items = 512000 bits 

on uart the baud rate is 115200 bits/second

the work items data is approx 5 times more for every second. how is the data transfer handled?"	how fast should miners computer generate work for asics how fast does the beaglebone block generate work modern asic miners exhaust the nonce range in around 2 3 milliseconds say if it does exhaust in 2 milliseconds and we need to keep the asics busy for 1 second does it mean it needs to send 500 work items to the asics every second what if it exhausts the range in 1 ms is the microcomputer capable of generating and sending that much data that fast one work 512 bits 1000 work items 512000 bits on uart the baud rate is 115200 bits second the work items data is approx 5 times more for every second how is the data transfer handled 	0.00251115788705647	0.9886751174926758	0.025209588930010796	0.9465539455413818	0.008859623223543167	0.2726445496082306	0.0827709287405014	8.386813874494692e-07	0.2992875576019287	0.0016143419779837132
6	[]	False	artifex28		[]		text	t2_7c3ke	False	False	False	[]	False	False	1651559972	blockchain.com	https://www.reddit.com/r/Bitcoin/comments/uha1xw/does_blockchaincom_api_support_receiving_bep20/	{}	uha1xw	False	True	False	False	False	True	False	False		[]	dark	text	False	False	True	0	0	False	all_ads	/r/Bitcoin/comments/uha1xw/does_blockchaincom_api_support_receiving_bep20/	False	6		1651559983	1		True	False	False	Bitcoin	t5_2s3qj	4157484	public	https://b.thumbs.redditmedia.com/IgGX8Ka4vnI9qiAGia4Sw6BwDjnkfwwfNBEuHe1KdVk.jpg	Does Blockchain.com API support receiving BEP20 / BEP2-network based Bitcoin transactions or BTC only?	0	[]	1.0	https://www.blockchain.com/api/api_receive	https://www.blockchain.com/api/api_receive	all_ads	6			link	{'enabled': False, 'images': [{'id': 'XFlerzvs5kFGXARq-1TqbiS0gL88z1a9BGeyD7jTbyo', 'resolutions': [{'height': 56, 'url': 'https://external-preview.redd.it/xf5WRDvubf0PhY4le0v4W4wr81N87tj2wQnRGoW9Td8.jpg?width=108&amp;crop=smart&amp;auto=webp&amp;s=d8af5dbd817197d438fe5779d7ed3fb3fef97062', 'width': 108}, {'height': 113, 'url': 'https://external-preview.redd.it/xf5WRDvubf0PhY4le0v4W4wr81N87tj2wQnRGoW9Td8.jpg?width=216&amp;crop=smart&amp;auto=webp&amp;s=f2f581aff666da605e242bae0d30e36b5e03fc73', 'width': 216}, {'height': 168, 'url': 'https://external-preview.redd.it/xf5WRDvubf0PhY4le0v4W4wr81N87tj2wQnRGoW9Td8.jpg?width=320&amp;crop=smart&amp;auto=webp&amp;s=06f7f5451936bc461c285fe1d29a2dc49ca32b4b', 'width': 320}], 'source': {'height': 202, 'url': 'https://external-preview.redd.it/xf5WRDvubf0PhY4le0v4W4wr81N87tj2wQnRGoW9Td8.jpg?auto=webp&amp;s=c1ced0f4a1ab60898fb9919fdad1364127afca34', 'width': 384}, 'variants': {}}]}	73.0	140.0															"Does Blockchain.com API support receiving BEP20 / BEP2-network based Bitcoin transactions or BTC only?
"	does blockchain com api support receiving bep20 bep2 network based bitcoin transactions or btc only nan	0.28057584166526794	0.8751864433288574	0.3646389842033386	0.21157705783843994	0.05404295399785042	0.35758069157600403	0.2628253996372223	0.22960777580738068	0.4673957824707031	0.020308056846261024
7	[]	False	No-You122		[]		text	t2_g7x4oirp	False	False	False	[]	False	False	1651558966	self.Bitcoin	https://www.reddit.com/r/Bitcoin/comments/uh9ty4/can_someone_send_me_some_bitcoin_i_would_be/	{}	uh9ty4	False	True	False	False	False	True	True	False		[]	dark	text	False	False	True	0	0	False	all_ads	/r/Bitcoin/comments/uh9ty4/can_someone_send_me_some_bitcoin_i_would_be/	False	6		1651558976	0	bc1qef6v0h6der3wjt98y9ggn2gfcdzs05ww2hjlmw	True	False	False	Bitcoin	t5_2s3qj	4157457	public	self	Can someone send me some bitcoin? I would be forever in debt to u!	0	[]	0.5	https://www.reddit.com/r/Bitcoin/comments/uh9ty4/can_someone_send_me_some_bitcoin_i_would_be/		all_ads	6																					"Can someone send me some bitcoin? I would be forever in debt to u!
bc1qef6v0h6der3wjt98y9ggn2gfcdzs05ww2hjlmw"	can someone send me some bitcoin i would be forever in debt to u bc1qef6v0h6der3wjt98y9ggn2gfcdzs05ww2hjlmw	0.6716368198394775	0.33587613701820374	0.5686054825782776	0.027028393000364304	0.18116281926631927	0.08044548332691193	0.2530228793621063	0.8790821433067322	0.3219717741012573	0.0002785507240332663
8	[]	False	Reahvenz		[]		text	t2_34jvnp5q	False	False	False	[]	False	False	1651558750	i.redd.it	https://www.reddit.com/r/Bitcoin/comments/uh9s4m/psychology_is_a_funny_thing/	{}	uh9s4m	False	True	False	False	True	True	False	False		[]	dark	text	False	False	False	0	0	False	all_ads	/r/Bitcoin/comments/uh9s4m/psychology_is_a_funny_thing/	False	6		1651558760	1		True	False	False	Bitcoin	t5_2s3qj	4157456	public	https://b.thumbs.redditmedia.com/Oav0YMx_BLXp5nE2x2jcZNdHYtcFarnyyXcSo5qPSvo.jpg	Psychology is a funny thing	0	[]	1.0	https://i.redd.it/sxxbwyrke7x81.jpg	https://i.redd.it/sxxbwyrke7x81.jpg	all_ads	6			image	{'enabled': True, 'images': [{'id': '0L32RmG5e5K5Bci9cO44B6Dy5q90hpudpNjFudoWaq4', 'resolutions': [{'height': 75, 'url': 'https://preview.redd.it/sxxbwyrke7x81.jpg?width=108&amp;crop=smart&amp;auto=webp&amp;s=cbc8551767ce1d3688dc5dea82300f13a63231af', 'width': 108}, {'height': 151, 'url': 'https://preview.redd.it/sxxbwyrke7x81.jpg?width=216&amp;crop=smart&amp;auto=webp&amp;s=625544080f9540f2dac2805931212e5b0d023426', 'width': 216}, {'height': 224, 'url': 'https://preview.redd.it/sxxbwyrke7x81.jpg?width=320&amp;crop=smart&amp;auto=webp&amp;s=c84cddc99b6f2698db19597b2aaf8ce8f7905a8d', 'width': 320}, {'height': 449, 'url': 'https://preview.redd.it/sxxbwyrke7x81.jpg?width=640&amp;crop=smart&amp;auto=webp&amp;s=1d8766ada16e17a032aea8c155b9e13050b634e7', 'width': 640}, {'height': 674, 'url': 'https://preview.redd.it/sxxbwyrke7x81.jpg?width=960&amp;crop=smart&amp;auto=webp&amp;s=95b7522f2b0ba9734e7a51c5294a107ef8b569d2', 'width': 960}, {'height': 758, 'url': 'https://preview.redd.it/sxxbwyrke7x81.jpg?width=1080&amp;crop=smart&amp;auto=webp&amp;s=a022500e046573225e07dd2ace384c7f83febb55', 'width': 1080}], 'source': {'height': 759, 'url': 'https://preview.redd.it/sxxbwyrke7x81.jpg?auto=webp&amp;s=26352236c9048df519cc275f066ee4df9692fa6b', 'width': 1080}, 'variants': {}}]}	98.0	140.0															"Psychology is a funny thing
"	psychology is a funny thing nan	0.38362738490104675	0.4611254632472992	0.4686501920223236	0.23549360036849976	0.5158537030220032	0.9865134358406067	0.41528287529945374	0.3468015193939209	0.4696851074695587	0.12068378180265427
9	[]	False	fredfwedthefirst		[]		text	t2_71xg2x3b	False	False	False	[]	False	False	1651558399	self.Bitcoin	https://www.reddit.com/r/Bitcoin/comments/uh9p83/a_family_member_bought_166_bitcoins_in_2009_is/	{}	uh9p83	False	True	False	False	False	True	True	False		[]	dark	text	False	False	True	0	0	False	all_ads	/r/Bitcoin/comments/uh9p83/a_family_member_bought_166_bitcoins_in_2009_is/	False	6		1651558410	1	"A family member bought 166 Bitcoins in 2009, is there any possible way to get them back?

      Call me crazy all you want, but I'm telling you, this actually happened. Believe it or not, I am telling the truth.

     So there's a bit of a story as to how I got these bitcoins in the first place.
     Back in 2009, 12 years ago (I think), a sibling (Let's call her A) wanted some coins for a stupid game she played. A was pretty young at the time. So another family member (B) looks for a way to buy coins. (I don't really remember why they didn't buy them from the store or something). B finds a very shady guy, selling these coins, in exchange for one thing. Bitcoin.
     Bitcoin was 3 cents at the time. Although very suspicious, B buys $15 worth of it. Gives $10 to the guy, and A gets her coins. We had $5 leftover. I did the math, we would have 166 Bitcoins. Flash forward 12 years later, that would be worth about 10 million dollars if Bitcoin is high.
     There's a bit of a problem though. The laptop that it was stored on, was thrown away. I have no idea where it is. It could either be in a landfill right now or completely gone. I have looked all over my house, and several other family members' house. It was nowhere to be seen.
     So, I was wondering, is there any possible way to get these coins back? B recalls seeing something like a balance, such as ""166 Bitcoins"" or ""$5.00"", if that helps. 
     Please help me. If this isn't possible, oh well. I just want to know if there's a way to get this back."	True	False	False	Bitcoin	t5_2s3qj	4157443	public	self	A family member bought 166 Bitcoins in 2009, is there any possible way to get them back?	0	[]	1.0	https://www.reddit.com/r/Bitcoin/comments/uh9p83/a_family_member_bought_166_bitcoins_in_2009_is/		all_ads	6																					"A family member bought 166 Bitcoins in 2009, is there any possible way to get them back?
A family member bought 166 Bitcoins in 2009, is there any possible way to get them back?

      Call me crazy all you want, but I'm telling you, this actually happened. Believe it or not, I am telling the truth.

     So there's a bit of a story as to how I got these bitcoins in the first place.
     Back in 2009, 12 years ago (I think), a sibling (Let's call her A) wanted some coins for a stupid game she played. A was pretty young at the time. So another family member (B) looks for a way to buy coins. (I don't really remember why they didn't buy them from the store or something). B finds a very shady guy, selling these coins, in exchange for one thing. Bitcoin.
     Bitcoin was 3 cents at the time. Although very suspicious, B buys $15 worth of it. Gives $10 to the guy, and A gets her coins. We had $5 leftover. I did the math, we would have 166 Bitcoins. Flash forward 12 years later, that would be worth about 10 million dollars if Bitcoin is high.
     There's a bit of a problem though. The laptop that it was stored on, was thrown away. I have no idea where it is. It could either be in a landfill right now or completely gone. I have looked all over my house, and several other family members' house. It was nowhere to be seen.
     So, I was wondering, is there any possible way to get these coins back? B recalls seeing something like a balance, such as ""166 Bitcoins"" or ""$5.00"", if that helps. 
     Please help me. If this isn't possible, oh well. I just want to know if there's a way to get this back."	a family member bought 166 bitcoins in 2009 is there any possible way to get them back a family member bought 166 bitcoins in 2009 is there any possible way to get them back call me crazy all you want but i m telling you this actually happened believe it or not i am telling the truth so there s a bit of a story as to how i got these bitcoins in the first place back in 2009 12 years ago i think a sibling let s call her a wanted some coins for a stupid game she played a was pretty young at the time so another family member b looks for a way to buy coins i don t really remember why they didn t buy them from the store or something b finds a very shady guy selling these coins in exchange for one thing bitcoin bitcoin was 3 cents at the time although very suspicious b buys 15 worth of it gives 10 to the guy and a gets her coins we had 5 leftover i did the math we would have 166 bitcoins flash forward 12 years later that would be worth about 10 million dollars if bitcoin is high there s a bit of a problem though the laptop that it was stored on was thrown away i have no idea where it is it could either be in a landfill right now or completely gone i have looked all over my house and several other family members house it was nowhere to be seen so i was wondering is there any possible way to get these coins back b recalls seeing something like a balance such as 166 bitcoins or 5 00 if that helps please help me if this isn t possible oh well i just want to know if there s a way to get this back 	0.0026522937696427107	0.9890228509902954	0.05735863745212555	0.013799276202917099	0.9947110414505005	0.555817723274231	0.053511034697294235	8.391165806642675e-07	0.13011814653873444	0.023587558418512344
10	[]	False	ILost10Million		[]		text	t2_mnkwyoan	False	False	False	[]	False	False	1651557937	self.Bitcoin	https://www.reddit.com/r/Bitcoin/comments/uh9ljx/a_family_member_bought_166_bitcoins_in_2009_is/	{}	uh9ljx	False	False	False	False	False	False	True	False		[]	dark	text	False	False	True	0	0	False	all_ads	/r/Bitcoin/comments/uh9ljx/a_family_member_bought_166_bitcoins_in_2009_is/	False	6	moderator	1651557947	1	[removed]	True	False	False	Bitcoin	t5_2s3qj	4157438	public	self	A family member bought 166 Bitcoins in 2009, is there any possible way to get them back?	0	[]	1.0	https://www.reddit.com/r/Bitcoin/comments/uh9ljx/a_family_member_bought_166_bitcoins_in_2009_is/		all_ads	6																					"A family member bought 166 Bitcoins in 2009, is there any possible way to get them back?
[removed]"	a family member bought 166 bitcoins in 2009 is there any possible way to get them back removed 	0.5161616206169128	0.7507398128509521	0.29872724413871765	0.07532087713479996	0.523421585559845	0.5299980044364929	0.13698244094848633	0.8994235992431641	0.40344834327697754	0.0595136359333992
11	[]	False	auntieruckus		[]		text	t2_do5xt4e8	False	False	False	[]	False	False	1651557724	self.Bitcoin	https://www.reddit.com/r/Bitcoin/comments/uh9js7/up_to_how_many_btc_can_i_earn_the_65_yield_using/	{}	uh9js7	False	True	False	False	False	True	True	False		[]	dark	text	False	False	True	0	0	False	all_ads	/r/Bitcoin/comments/uh9js7/up_to_how_many_btc_can_i_earn_the_65_yield_using/	False	6		1651557734	1	I am an average user.	True	False	False	Bitcoin	t5_2s3qj	4157426	public	self	Up to how many BTC can I earn the 6.5% yield using Celsius?	0	[]	1.0	https://www.reddit.com/r/Bitcoin/comments/uh9js7/up_to_how_many_btc_can_i_earn_the_65_yield_using/		all_ads	6		dark																			"Up to how many BTC can I earn the 6.5% yield using Celsius?
I am an average user."	up to how many btc can i earn the 6 5 yield using celsius i am an average user 	0.20734909176826477	0.8777099251747131	0.2148008644580841	0.16125904023647308	0.39573413133621216	0.5351637005805969	0.17856954038143158	0.7310391664505005	0.32719114422798157	0.0033042121212929487
