Unnamed: 0	all_awardings	archived	associated_award	author	author_flair_background_color	author_flair_css_class	author_flair_richtext	author_flair_template_id	author_flair_text	author_flair_text_color	author_flair_type	author_fullname	author_patreon_flair	author_premium	body	body_sha1	can_gild	collapsed	collapsed_because_crowd_control	collapsed_reason	collapsed_reason_code	comment_type	controversiality	created_utc	distinguished	gilded	gildings	id	is_submitter	link_id	locked	no_follow	parent_id	permalink	retrieved_utc	score	score_hidden	send_replies	stickied	subreddit	subreddit_id	subreddit_name_prefixed	subreddit_type	top_awarded_type	total_awards_received	treatment_tags	unrepliable_reason	corpus	support	knowledge	conflict	power	similarity	fun	status	trust	identity	romance
219	[]	False		BurningVeal			[]				text	t2_8s5uj	False	False	"12% increase is a good thing to wake up. Let’s see if she holds this over the weekend. Baby steps. 
Wonder if the judge will rule on the emails by end of play today."	81ba11c945abb528a2f22ce01df04969ac7bbcb7	True	False					0	1656054115		0	{}	idj58ll	False	t3_vjfbxz	False	True	t3_vjfbxz	/r/XRP/comments/vjfbxz/062422_join_flarexrp_discord/idj58ll/	1656054132	1	True	True	False	XRP	t5_2ruj5	r/XRP	public		0	[]		12 increase is a good thing to wake up let s see if she holds this over the weekend baby steps wonder if the judge will rule on the emails by end of play today 	0.1193951815366745	0.9706692099571228	0.4065060317516327	0.03775840997695923	0.2948096990585327	0.6013464331626892	0.07707783579826355	9.071923159353901e-07	0.16368620097637177	0.011668364517390728
220	[]	False		its_Lucifer	#dadada		[{'a': ':cake:', 'e': 'emoji', 'u': 'https://emoji.redditmedia.com/46kel8lf1guz_t5_3nqvj/cake'}, {'e': 'text', 't': ' Mod'}]	ce3c4128-7b35-11e8-9585-0e763f31a276	:cake: Mod	dark	richtext	t2_ot6ytxv	False	False	"There is no need to create another cryptocurrency. XRP is the native currency on the XRPL (XRP Ledger). If you read the article it answers your question. 

&gt;	But the DEX also has a superpower: its ability to automatically find a currency or token pair—either directly or by using the XRP Ledger’s native XRP as a bridge currency—at the lowest possible price"	61cc82b337c07136fb6169680de947fdfc960445	True	False					0	1656048309		0	{}	idixlmb	True	t3_vjaa3j	False	True	t1_idig25q	/r/XRP/comments/vjaa3j/behind_the_scenes_of_the_xrpl_dex/idixlmb/	1656048320	1	True	True	False	XRP	t5_2ruj5	r/XRP	public		0	[]		there is no need to create another cryptocurrency xrp is the native currency on the xrpl xrp ledger if you read the article it answers your question gt but the dex also has a superpower its ability to automatically find a currency or token pair either directly or by using the xrp ledger s native xrp as a bridge currency at the lowest possible price	0.002900219289585948	0.9879377484321594	0.11177778244018555	0.8506607413291931	0.00920101534575224	0.40365973114967346	0.11166031658649445	8.44368173602561e-07	0.4368981122970581	0.04578382149338722
221	[]	False		Learnformyfam		noflair	[]			dark	text	t2_2yx8prp9	False	False	"You're not buying XRP directly. You're buying XRP IOUs then transfer to the XRP ledger. Then you can exchange the Bitstamp IOUs on the XRP ledger for XRP. But first you set up a trust line for bitstamp in your xuum wallet.

https://www.bitstamp.net/faq/iou-btc-usd-deposit/"	74c1e5a743b148822091980653a3a660d50eb34d	True	False					0	1656044714		0	{}	idis4fy	True	t3_n6l4xt	False	False	t1_idintkq	/r/XRP/comments/n6l4xt/a_better_way_to_buy_xrp_if_youre_in_the_us_to/idis4fy/	1656044726	1	True	True	False	XRP	t5_2ruj5	r/XRP	public		0	[]		you re not buying xrp directly you re buying xrp ious then transfer to the xrp ledger then you can exchange the bitstamp ious on the xrp ledger for xrp but first you set up a trust line for bitstamp in your xuum wallet https www bitstamp net faq iou btc usd deposit 	0.0033433977514505386	0.9871789216995239	0.20165342092514038	0.9565520882606506	0.008287807926535606	0.26588577032089233	0.16992458701133728	8.498097940901062e-07	0.4435782730579376	0.014697453007102013
222	[]	False		comprapescado			[]				text	t2_ahw6cp	False	False	"[https://www.brianfriel.xyz/how-to-create-a-token-on-solana/](https://www.brianfriel.xyz/how-to-create-a-token-on-solana/)

&amp;#x200B;

[https://www.youtube.com/watch?v=befUVytFC80](https://www.youtube.com/watch?v=befUVytFC80)"	b8bcfe1b249e7a94ed584091eb8db6ee54af5752	True	False					0	1656042281		0	{}	idinzyx	False	t3_vipxtg	False	True	t3_vipxtg	/r/solana/comments/vipxtg/help_issuing_tokens_questions/idinzyx/	1656042296	1	False	True	False	solana	t5_hcs2n	r/solana	public		0	[]		 https www brianfriel xyz how to create a token on solana https www brianfriel xyz how to create a token on solana amp x200b https www youtube com watch v befuvytfc80 https www youtube com watch v befuvytfc80 	0.005143188871443272	0.9953299760818481	0.11931157857179642	0.9443089365959167	0.003788305213674903	0.9189960360527039	0.17665719985961914	8.40641689592303e-07	0.4474376142024994	3.4958618925884366e-05
223	[]	False		Prudent_Nebula2558			[]				text	t2_8k0l60uw	False	False	Weird flex but ok	8cb8e99525c4e1ce4b5e52a1de931b57df31df0b	True	False					0	1656042109		0	{}	idinp20	False	t3_vj2vgj	False	True	t1_idgjeq6	/r/solana/comments/vj2vgj/solanas_developers_unveil_web3focused_mobile_phone/idinp20/	1656042120	1	False	True	False	solana	t5_hcs2n	r/solana	public		0	[]		weird flex but ok	0.4115855395793915	0.40980154275894165	0.4778338372707367	0.3373944163322449	0.5084068775177002	0.7910664081573486	0.41749823093414307	0.48463743925094604	0.49540436267852783	0.3520316183567047
224	[]	False		AutoModerator			[]				text	t2_6l4z3	False	True	"WARNING: 
1) Do not trust DMs from anyone offering to help/support you with your funds (Scammers)! 
2) Never give out your Seed Phrase and DO NOT ENTER it on ANY websites sent to you.
3) MODS or Community Managers will NEVER DM you first regarding your funds/wallet.


*I am a bot, and this action was performed automatically. Please [contact the moderators of this subreddit](/message/compose/?to=/r/solana) if you have any questions or concerns.*"	14dd8b569135602c5532d6566410f9a64883f0a5	True	False					0	1656042003	moderator	0	{}	idiniai	False	t3_vjezgr	True	True	t3_vjezgr	/r/solana/comments/vjezgr/magic_eden_mint_vs_listing_question/idiniai/	1656042014	1	True	False	True	solana	t5_hcs2n	r/solana	public		0	[]		warning 1 do not trust dms from anyone offering to help support you with your funds scammers 2 never give out your seed phrase and do not enter it on any websites sent to you 3 mods or community managers will never dm you first regarding your funds wallet i am a bot and this action was performed automatically please contact the moderators of this subreddit message compose to r solana if you have any questions or concerns 	0.011870771646499634	0.988234281539917	0.4694240689277649	0.9483896493911743	0.008167698048055172	0.244121253490448	0.10070517659187317	8.339779924426693e-07	0.30487555265426636	0.01920556277036667
225	[]	False		DeLuca9			[]				text	t2_10fy7x	False	True	I’m ready for this	649536ac9b9e4dc049cfc1bef3aa83b69190714a	True	False					0	1656041500		0	{}	idimlty	False	t3_vjcmhy	False	True	t3_vjcmhy	/r/solana/comments/vjcmhy/its_a_sol_summer_and_the_girls_are_taking_over/idimlty/	1656041516	1	False	True	False	solana	t5_hcs2n	r/solana	public		0	[]		i m ready for this	0.5651293396949768	0.4330202341079712	0.2090417891740799	0.46198737621307373	0.4789629578590393	0.621924638748169	0.6027849316596985	0.6835299730300903	0.3783648610115051	0.4083150327205658
226	[]	False		thermocoffee			[]				text	t2_5ois0	False	False	100%%%%%%%%%	36c9bc65d84e9db0311604327d46fdb59d655778	True	False					0	1656041331		0	{}	idiman3	False	t3_vj2vgj	False	True	t1_idhkarg	/r/solana/comments/vj2vgj/solanas_developers_unveil_web3focused_mobile_phone/idiman3/	1656041346	1	False	True	False	solana	t5_hcs2n	r/solana	public		0	[]		100 	0.4630463123321533	0.5352395176887512	0.48968106508255005	0.4709847569465637	0.4710223376750946	0.1883898675441742	0.4673807621002197	0.4825744926929474	0.5033395886421204	0.4087046682834625
227	[]	False		dingus-pendamus			[]				text	t2_895yfklj	False	False	"I think you just subscribe to json rpc of the candy machine program id and wait for certain instructions to be called.

Once you see new accounts created from candy machine programs, you can start calling programs yourself. For example, you call the mint_nft instruction."	7789fadb18cacd3626c87fa8b57df1e01eef9433	True	False					0	1656038984		0	{}	idihsaw	False	t3_vj9i9v	False	True	t3_vj9i9v	/r/solana/comments/vj9i9v/how_do_onchain_nft_snipers_work/idihsaw/	1656039001	1	False	True	False	solana	t5_hcs2n	r/solana	public		0	[]		i think you just subscribe to json rpc of the candy machine program id and wait for certain instructions to be called once you see new accounts created from candy machine programs you can start calling programs yourself for example you call the mint nft instruction 	0.003523478750139475	0.9885721206665039	0.06729082018136978	0.023099010810256004	0.008213693276047707	0.433817982673645	0.10812891274690628	8.509354643138067e-07	0.23055525124073029	0.007823257707059383
228	[]	False		maryupallnight			[]				text	t2_afuqrz2l	False	False	Only an idiot could see it.	c9ad574cb6f60cb74c3d696c7f1840518dab2135	True	False					0	1656038350		0	{}	idigiip	False	t3_vjcmhy	False	True	t1_idig2wc	/r/solana/comments/vjcmhy/its_a_sol_summer_and_the_girls_are_taking_over/idigiip/	1656038367	1	False	True	False	solana	t5_hcs2n	r/solana	public		0	[]		only an idiot could see it 	0.3579641580581665	0.45032504200935364	0.7534133195877075	0.4127686321735382	0.4271407127380371	0.6181964874267578	0.25866737961769104	0.2735845148563385	0.4521245062351227	0.1230178102850914
229	[]	False		maryupallnight			[]				text	t2_afuqrz2l	False	False	"Right the opposite idea.

I support women ... so I must be a sexist.

Yes, make a lot of sense."	199864cb1d89c2f45048783fc32b0c744033484e	True	False					0	1656038314		0	{}	idigg0b	False	t3_vjcmhy	False	True	t1_idify7f	/r/solana/comments/vjcmhy/its_a_sol_summer_and_the_girls_are_taking_over/idigg0b/	1656038329	1	False	True	False	solana	t5_hcs2n	r/solana	public		0	[]		right the opposite idea i support women so i must be a sexist yes make a lot of sense 	0.20019638538360596	0.27558690309524536	0.8082377314567566	0.02151046320796013	0.6056819558143616	0.43191125988960266	0.19609977304935455	0.42267459630966187	0.4464406967163086	0.0017120764823630452
230	[]	False		maryupallnight			[]				text	t2_afuqrz2l	False	False	"Seriously!

Get a life."	743135679eac0e5de2f84f05a6d13cd5b15ed8a7	True	False					0	1656038247		0	{}	idigb7b	False	t3_vjcmhy	False	True	t1_idifxnp	/r/solana/comments/vjcmhy/its_a_sol_summer_and_the_girls_are_taking_over/idigb7b/	1656038262	1	False	True	False	solana	t5_hcs2n	r/solana	public		0	[]		seriously get a life 	0.5316793918609619	0.46728599071502686	0.5671044588088989	0.44269508123397827	0.44335347414016724	0.47376638650894165	0.46716463565826416	0.4075547456741333	0.4515247941017151	0.4866173565387726
231	[]	False		maryupallnight			[]				text	t2_afuqrz2l	False	False	I did.	69c3697221c1d642b2a74662e8360450daf0b455	True	False					0	1656038221		0	{}	idig9ci	False	t3_vjcmhy	False	True	t1_idifwc4	/r/solana/comments/vjcmhy/its_a_sol_summer_and_the_girls_are_taking_over/idig9ci/	1656038239	1	False	True	False	solana	t5_hcs2n	r/solana	public		0	[]		i did 	0.4914208948612213	0.4391535818576813	0.4540574550628662	0.46611538529396057	0.5017295479774475	0.5769742131233215	0.5190523862838745	0.4794430434703827	0.47098127007484436	0.5158721208572388
232	[]	False		maryupallnight			[]				text	t2_afuqrz2l	False	False	I live.	50c52b79f0b6dc54fe40119eccf8267749d77989	True	False					0	1656038196		0	{}	idig7ii	False	t3_vjcmhy	False	True	t1_idiffa6	/r/solana/comments/vjcmhy/its_a_sol_summer_and_the_girls_are_taking_over/idig7ii/	1656038208	1	False	True	False	solana	t5_hcs2n	r/solana	public		0	[]		i live 	0.4876841902732849	0.4482346773147583	0.4516748785972595	0.4712756276130676	0.511729896068573	0.5632216334342957	0.5377940535545349	0.4851602017879486	0.5025476217269897	0.6216581463813782
233	[]	False		Forsaken_Detail_8676			[]				text	t2_6k74tw2a	False	False	your idiot is showing again. 🤍	6612ab8bc1e4a6fc20973ccb54745842e5c1cc27	True	False					0	1656038132		0	{}	idig2wc	True	t3_vjcmhy	False	True	t1_idig0xj	/r/solana/comments/vjcmhy/its_a_sol_summer_and_the_girls_are_taking_over/idig2wc/	1656038148	1	False	True	False	solana	t5_hcs2n	r/solana	public		0	[]		your idiot is showing again 	0.39679017663002014	0.3449134826660156	0.8159444332122803	0.4625994861125946	0.4021751880645752	0.5888366103172302	0.40681391954421997	0.4171876907348633	0.45339885354042053	0.18012292683124542
234	[]	False		maryupallnight			[]				text	t2_afuqrz2l	False	False	"Get some sleep.

I never said it was OK.

Sad face."	c7d7299bb4b74d3e49003613732f061b65e2a7de	True	False					0	1656038107		0	{}	idig0xj	False	t3_vjcmhy	False	True	t1_idifcu4	/r/solana/comments/vjcmhy/its_a_sol_summer_and_the_girls_are_taking_over/idig0xj/	1656038126	1	False	True	False	solana	t5_hcs2n	r/solana	public		0	[]		get some sleep i never said it was ok sad face 	0.5449448823928833	0.2687767446041107	0.4915604591369629	0.07802381366491318	0.5497944951057434	0.8900671601295471	0.3256499171257019	0.5727187991142273	0.3348969519138336	0.05895629897713661
235	[]	False		Cultural-Suspect917			[]				text	t2_9pubwtpn	False	False	Right back at you. Being a woman does not mean you support women's rights and I'm starting to believe you're sexist as it is sexist to think all women should think all women think the same and have the same interests...	7239cabf7ad44f232a01fe74525a3abb2a81fc60	True	False					0	1656038071		0	{}	idify7f	False	t3_vjcmhy	False	True	t1_idifhpl	/r/solana/comments/vjcmhy/its_a_sol_summer_and_the_girls_are_taking_over/idify7f/	1656038087	1	False	True	False	solana	t5_hcs2n	r/solana	public		0	[]		right back at you being a woman does not mean you support women s rights and i m starting to believe you re sexist as it is sexist to think all women should think all women think the same and have the same interests 	0.017078576609492302	0.7032730579376221	0.9475383162498474	0.017360487952828407	0.012003679759800434	0.36529403924942017	0.07364644855260849	8.32072203138523e-07	0.6185906529426575	0.015985623002052307
236	[]	False		Forsaken_Detail_8676			[]				text	t2_6k74tw2a	False	False	then check them on linked in 😂😂😂	976730d8da587da3eeded9b16503808619332e8f	True	False					0	1656038064		0	{}	idifxnp	True	t3_vjcmhy	False	True	t1_idifv3d	/r/solana/comments/vjcmhy/its_a_sol_summer_and_the_girls_are_taking_over/idifxnp/	1656038079	1	False	True	False	solana	t5_hcs2n	r/solana	public		0	[]		then check them on linked in 	0.4112190008163452	0.5376722812652588	0.40695589780807495	0.5966030359268188	0.5185104012489319	0.5338912606239319	0.33048614859580994	0.4730008840560913	0.4853774309158325	0.19039736688137054
237	[]	False		Forsaken_Detail_8676			[]				text	t2_6k74tw2a	False	False	lol what. can’t expose a doxxed creator. you have an issue with the collection? address it with the female artist. ✌️	f3b027634030dffc3d3d723e42fb50049fac99e7	True	False					0	1656038046		0	{}	idifwc4	True	t3_vjcmhy	False	True	t1_idifryp	/r/solana/comments/vjcmhy/its_a_sol_summer_and_the_girls_are_taking_over/idifwc4/	1656038064	1	False	True	False	solana	t5_hcs2n	r/solana	public		0	[]		lol what can t expose a doxxed creator you have an issue with the collection address it with the female artist 	0.02903370000422001	0.8590718507766724	0.42326804995536804	0.06453387439250946	0.07798749953508377	0.2416955530643463	0.13122963905334473	8.728061970941781e-07	0.4661726951599121	0.03253589943051338
238	[]	False		maryupallnight			[]				text	t2_afuqrz2l	False	False	Yes, we should all live and die by twitter.	5e14c6f5ba7250d50754fb546ccc7af7352abcd5	True	False					0	1656038029		0	{}	idifv3d	False	t3_vjcmhy	False	True	t1_idif6hq	/r/solana/comments/vjcmhy/its_a_sol_summer_and_the_girls_are_taking_over/idifv3d/	1656038042	1	False	True	False	solana	t5_hcs2n	r/solana	public		0	[]		yes we should all live and die by twitter 	0.4909709095954895	0.29049426317214966	0.30321335792541504	0.43478167057037354	0.4437682628631592	0.4164099395275116	0.6302709579467773	0.37004461884498596	0.44273173809051514	0.016597146168351173
239	[]	False		maryupallnight			[]				text	t2_afuqrz2l	False	False	"&gt; you a nut you REACHING

Only to those who fear being exposed."	6c5da2dcbbd1291b836e12b3474fc496f2bebdc7	True	False					0	1656037988		0	{}	idifryp	False	t3_vjcmhy	False	True	t1_idif8mf	/r/solana/comments/vjcmhy/its_a_sol_summer_and_the_girls_are_taking_over/idifryp/	1656038005	1	False	True	False	solana	t5_hcs2n	r/solana	public		0	[]		 gt you a nut you reaching only to those who fear being exposed 	0.19620312750339508	0.48370736837387085	0.8020872473716736	0.2521722912788391	0.33902961015701294	0.24035823345184326	0.1985548883676529	0.07789301872253418	0.4084680676460266	0.018072567880153656
240	[]	False		maryupallnight			[]				text	t2_afuqrz2l	False	False	"Of course you are.

We can all see that.

And being a woman does not mean you support women rights.

It is sexist to think all women think alight and have the same interests."	a17093e2af18551e22c8e9709b66036378ac92a8	True	False					0	1656037844		0	{}	idifhpl	False	t3_vjcmhy	False	True	t1_idif15d	/r/solana/comments/vjcmhy/its_a_sol_summer_and_the_girls_are_taking_over/idifhpl/	1656037862	1	False	True	False	solana	t5_hcs2n	r/solana	public		0	[]		of course you are we can all see that and being a woman does not mean you support women rights it is sexist to think all women think alight and have the same interests 	0.09441742300987244	0.7252476811408997	0.9017347097396851	0.02455945685505867	0.03883855417370796	0.3789061903953552	0.08744325488805771	8.449175084024318e-07	0.6174988746643066	0.01956343837082386
241	[]	False		Forsaken_Detail_8676			[]				text	t2_6k74tw2a	False	False	your argument is dying by the second 😂😂😂	5ebaf27d069dd2a10be94f425de9f37f66bd8b23	True	False					0	1656037811		0	{}	idiffa6	True	t3_vjcmhy	False	True	t1_idifbgx	/r/solana/comments/vjcmhy/its_a_sol_summer_and_the_girls_are_taking_over/idiffa6/	1656037823	1	False	True	False	solana	t5_hcs2n	r/solana	public		0	[]		your argument is dying by the second 	0.356729656457901	0.4953225255012512	0.6764295101165771	0.570392370223999	0.4340612292289734	0.46654102206230164	0.35245487093925476	0.3093322813510895	0.46511346101760864	0.16467849910259247
242	[]	False		Forsaken_Detail_8676			[]				text	t2_6k74tw2a	False	False	i love how your first comment was DONT SUPPORT THIS ITS SEXIST. then you learn it’s created by a female and now it’s ok? you wobble more than a pogo stick	40e740947ae526b23aa7e8ff5a0d7bd91dec8f8e	True	False					0	1656037777		0	{}	idifcu4	True	t3_vjcmhy	False	True	t1_idif3vu	/r/solana/comments/vjcmhy/its_a_sol_summer_and_the_girls_are_taking_over/idifcu4/	1656037793	1	False	True	False	solana	t5_hcs2n	r/solana	public		0	[]		i love how your first comment was dont support this its sexist then you learn it s created by a female and now it s ok you wobble more than a pogo stick	0.018888460472226143	0.7248398065567017	0.5789292454719543	0.02010796219110489	0.011097369715571404	0.6034553647041321	0.28121376037597656	8.372972502002085e-07	0.3797391653060913	0.022816941142082214
243	[]	False		maryupallnight			[]				text	t2_afuqrz2l	False	False	"Sure - it is not in your interest to understand.

How much are you getting paid?"	b5c3d5c0bf08d2697e03ec3c1cae50523f67a974	True	False					0	1656037757		0	{}	idifbgx	False	t3_vjcmhy	False	True	t1_idif15r	/r/solana/comments/vjcmhy/its_a_sol_summer_and_the_girls_are_taking_over/idifbgx/	1656037770	1	False	True	False	solana	t5_hcs2n	r/solana	public		0	[]		sure it is not in your interest to understand how much are you getting paid 	0.5996581315994263	0.6810188293457031	0.37167057394981384	0.5523643493652344	0.3513842821121216	0.4564824402332306	0.1591886579990387	0.6158818006515503	0.41809457540512085	0.005338361952453852
244	[]	False		Forsaken_Detail_8676			[]				text	t2_6k74tw2a	False	False	also girl, you a nut you REACHING. now get some sleep.	a23559fd629ca62ef1b4d5ec5584937c5467529b	True	False					0	1656037717		0	{}	idif8mf	True	t3_vjcmhy	False	True	t1_idif3vu	/r/solana/comments/vjcmhy/its_a_sol_summer_and_the_girls_are_taking_over/idif8mf/	1656037733	1	False	True	False	solana	t5_hcs2n	r/solana	public		0	[]		also girl you a nut you reaching now get some sleep 	0.43014734983444214	0.3832855820655823	0.4563216269016266	0.26411205530166626	0.43116259574890137	0.6170312762260437	0.2555541396141052	0.03525319695472717	0.31609979271888733	0.4381178915500641
245	[]	False		Forsaken_Detail_8676			[]				text	t2_6k74tw2a	False	False	ask them on twitter before you comment a hot mess of a thread girlfren	2ab23c0918da1fc2e30a52b1b6e89b5136b3bea6	True	False					0	1656037687		0	{}	idif6hq	True	t3_vjcmhy	False	True	t1_idif3vu	/r/solana/comments/vjcmhy/its_a_sol_summer_and_the_girls_are_taking_over/idif6hq/	1656037702	1	False	True	False	solana	t5_hcs2n	r/solana	public		0	[]		ask them on twitter before you comment a hot mess of a thread girlfren	0.1977766901254654	0.19398705661296844	0.8292048573493958	0.5959437489509583	0.04923643171787262	0.12988172471523285	0.23872968554496765	0.5356883406639099	0.2849796414375305	1.6954400052782148e-05
246	[]	False		nvdr_			[]				text	t2_nafnfus5	False	False	No problem. Appreciate the chat	69cbbc295e5aa5a87340e09f42afe6f00baf08e9	True	False					0	1656037651		0	{}	idif3y4	False	t3_vj2vgj	False	False	t1_idibz48	/r/solana/comments/vj2vgj/solanas_developers_unveil_web3focused_mobile_phone/idif3y4/	1656037665	1	False	True	False	solana	t5_hcs2n	r/solana	public		0	[]		no problem appreciate the chat	0.5192102789878845	0.3594709038734436	0.4460524618625641	0.44057533144950867	0.4766961336135864	0.6426184177398682	0.6032343506813049	0.47615233063697815	0.45206770300865173	0.23864132165908813
247	[]	False		maryupallnight			[]				text	t2_afuqrz2l	False	False	"&gt; my perversions? a woman created this collection. what are you even talking about 

How do we prove it is a woman?

Women are exploited in many ways. 

Would you say a woman who is sex trafficed is doing it willingly?"	ac2c1dac01c88f4ca79d8787dc3aed59cc3d2b32	True	False					0	1656037651		0	{}	idif3vu	False	t3_vjcmhy	False	False	t1_idiek6q	/r/solana/comments/vjcmhy/its_a_sol_summer_and_the_girls_are_taking_over/idif3vu/	1656037665	1	False	True	False	solana	t5_hcs2n	r/solana	public		0	[]		 gt my perversions a woman created this collection what are you even talking about how do we prove it is a woman women are exploited in many ways would you say a woman who is sex trafficed is doing it willingly 	0.003094850108027458	0.9769019484519958	0.6793444752693176	0.014924867078661919	0.03234533220529556	0.44730421900749207	0.07572649419307709	8.44313433390198e-07	0.5629099011421204	0.21063365042209625
248	[]	False		Forsaken_Detail_8676			[]				text	t2_6k74tw2a	False	False	mary, get some sleep. you’re making no sense. being up all night isn’t good for the mind. stop hating a female creator and move on. also—plz send your bathing suit sweater recommendations my way. tysm	1ed5654c8782e985de8fecee6c4da13587ccfea4	True	False					0	1656037613		0	{}	idif15r	True	t3_vjcmhy	False	True	t1_idiewen	/r/solana/comments/vjcmhy/its_a_sol_summer_and_the_girls_are_taking_over/idif15r/	1656037627	1	False	True	False	solana	t5_hcs2n	r/solana	public		0	[]		mary get some sleep you re making no sense being up all night isn t good for the mind stop hating a female creator and move on also plz send your bathing suit sweater recommendations my way tysm	0.07202610373497009	0.40108585357666016	0.2837317883968353	0.008669537492096424	0.019636426120996475	0.20919717848300934	0.18483631312847137	8.488459002364834e-07	0.26036587357521057	0.00025417699362151325
249	[]	False		Cultural-Suspect917			[]				text	t2_9pubwtpn	False	False	I'm a women... but, thanks...	fdc63704dac893708eceb52e249f3100fdd18d51	True	False					0	1656037613		0	{}	idif15d	False	t3_vjcmhy	False	True	t1_idiewen	/r/solana/comments/vjcmhy/its_a_sol_summer_and_the_girls_are_taking_over/idif15d/	1656037627	1	False	True	False	solana	t5_hcs2n	r/solana	public		0	[]		i m a women but thanks 	0.5339573621749878	0.44769617915153503	0.19833901524543762	0.33948835730552673	0.49269261956214905	0.45858103036880493	0.626449465751648	0.6449760794639587	0.47261419892311096	0.3536912798881531
250	[]	False		maryupallnight			[]				text	t2_afuqrz2l	False	False	"&gt; your last comment is basically saying you'd rather a ""woman"" creator create nothing vs creating the art

Mansplaining ..."	b095cd368218172e74e329bee79d993cd432936a	True	False					0	1656037547		0	{}	idiewen	False	t3_vjcmhy	False	True	t1_idie7ud	/r/solana/comments/vjcmhy/its_a_sol_summer_and_the_girls_are_taking_over/idiewen/	1656037562	1	False	True	False	solana	t5_hcs2n	r/solana	public		0	[]		 gt your last comment is basically saying you d rather a woman creator create nothing vs creating the art mansplaining 	0.011874389834702015	0.67438143491745	0.729736328125	0.23233728110790253	0.20556290447711945	0.1240570992231369	0.17920555174350739	1.4019863101566443e-06	0.44190871715545654	3.0104014513199218e-05
