Unnamed: 0	all_awardings	archived	associated_award	author	author_flair_background_color	author_flair_css_class	author_flair_richtext	author_flair_template_id	author_flair_text	author_flair_text_color	author_flair_type	author_fullname	author_patreon_flair	author_premium	body	body_sha1	can_gild	collapsed	collapsed_because_crowd_control	collapsed_reason	collapsed_reason_code	comment_type	controversiality	created_utc	distinguished	gilded	gildings	id	is_submitter	link_id	locked	no_follow	parent_id	permalink	retrieved_utc	score	score_hidden	send_replies	stickied	subreddit	subreddit_id	subreddit_name_prefixed	subreddit_type	top_awarded_type	total_awards_received	treatment_tags	unrepliable_reason	author_cakeday	corpus	support	knowledge	conflict	power	similarity	fun	status	trust	identity	romance
150	[]	False		Tuki2ki2			[]				text	t2_rimhw	False	False	Quite similar to mine tbh. My portfolio is : I have 50% bitcoin ; 50% global equities by market cap. That’s it.	4c8b02931cc010a8736a9901a04a4487e7888ac3	True	False					0	1656917110		0	{}	iesh15m	False	t3_vqrkip	False	True	t3_vqrkip	/r/Bitcoin/comments/vqrkip/if_i_post_this_here_youll_say_im_underexposed_if/iesh15m/	1656917126	1	True	True	False	Bitcoin	t5_2s3qj	r/Bitcoin	public		0	[]													
151	[]	False		PresentationUpset719		noob	[{'e': 'text', 't': 'redditor for 3 months'}]	2ec8e69e-6c36-11e9-a04b-0afb553d4ea6	redditor for 3 months	dark	richtext	t2_k2y4ukzy	False	False	Depends on your age and income, if you are comfortable losing 50-80 percent of the investment, then you are okay, I personally will not allocate more than 5 percent of my NW in Crypto	c764ddcad569df995e5c91687e5fd1e12001ba96	True	False					0	1656917108		0	{}	iesh127	False	t3_vqrkip	False	False	t3_vqrkip	/r/Bitcoin/comments/vqrkip/if_i_post_this_here_youll_say_im_underexposed_if/iesh127/	1656917119	1	True	True	False	Bitcoin	t5_2s3qj	r/Bitcoin	public		0	[]													
152	[]	False		sedulouspellucidsoft			[]				text	t2_17fc96	False	False	Huh?	73fef01e230300ae6fc10ffd739157b067709157	True	False					0	1656917101		0	{}	iesh0pa	False	t3_vqdpsm	False	True	t1_ieq3yma	/r/Bitcoin/comments/vqdpsm/not_your_keys_not_your_coins_6_billion_in/iesh0pa/	1656917119	1	True	True	False	Bitcoin	t5_2s3qj	r/Bitcoin	public		0	[]													
153	[]	False		Bitbuyer313			[]			dark	text	t2_4cd7lcfh	False	False	100% agreed	4288019d582df2b516118c3b966d9d29d76a2086	True	False					0	1656917068		0	{}	iesgz4v	True	t3_vr0li5	False	True	t1_iesgovk	/r/Bitcoin/comments/vr0li5/if_youre_not_completely_in_self_custody_cold/iesgz4v/	1656917083	1	True	True	False	Bitcoin	t5_2s3qj	r/Bitcoin	public		0	[]													
154	[]	False		iamkuljuarenot			[]				text	t2_p46prkf	False	False	I understand what he is saying, but I would bet that 95% of the people with his mindset are the ones that capitulate and end up dumping the price during times of duress. Diamond hands turn into paper hands very fast.	ef46a3bb423fdafa1909d4d2e5b353bfe2cbf715	True	False					0	1656917043		0	{}	iesgxy0	False	t3_vqdd4a	False	True	t1_ieq6cxc	/r/Bitcoin/comments/vqdd4a/low_prices_make_me_happy/iesgxy0/	1656917054	1	True	True	False	Bitcoin	t5_2s3qj	r/Bitcoin	public		0	[]													
155	[]	False		NearbyTurnover			[]				text	t2_13cu546	False	False	Just print more, who cares.	f910b44305fce887e29aa748885fa7478ab85391	True	False					0	1656917043		0	{}	iesgxxd	False	t3_vqdpsm	False	True	t3_vqdpsm	/r/Bitcoin/comments/vqdpsm/not_your_keys_not_your_coins_6_billion_in/iesgxxd/	1656917054	1	True	True	False	Bitcoin	t5_2s3qj	r/Bitcoin	public		0	[]													
156	[]	False		jhuhfft			[]				text	t2_9gxapu6v	False	False	You are at the start of your investment journey. Take as much time to learn as much as you can and invest slowly. Reddit is a good place to start but don’t stop here. The fact that you’re asking the question you’re asking is a red flag that you need to learn a lot more about what’s going on in the space.	0ba0b23fec8569e9699c9b1732b5468bbd1cd379	True	False					0	1656917008		0	{}	iesgwbp	False	t3_vqozwb	False	True	t3_vqozwb	/r/Bitcoin/comments/vqozwb/why_is_bitcoin_crashing/iesgwbp/	1656917020	1	True	True	False	Bitcoin	t5_2s3qj	r/Bitcoin	public		0	[]													
157	[]	False		BrendaWardy			[]				text	t2_fsez6xfs	False	False	 To determine how much they can get away with before people rebel, they test the limits.	f4e5f3a701871331d9ada95e9820c484d3f6a0a8	True	False					0	1656917004		0	{}	iesgw4j	False	t3_vqdpsm	False	True	t3_vqdpsm	/r/Bitcoin/comments/vqdpsm/not_your_keys_not_your_coins_6_billion_in/iesgw4j/	1656917020	1	True	True	False	Bitcoin	t5_2s3qj	r/Bitcoin	public		0	[]													
158	[]	False		Tuki2ki2			[]				text	t2_rimhw	False	False	Woo woo!	f297a8c422f78564175a785e55d99f509b567877	True	False					0	1656917002		0	{}	iesgw05	False	t3_vqzc5o	False	True	t3_vqzc5o	/r/Bitcoin/comments/vqzc5o/i_am_officially_a_wholecoiner/iesgw05/	1656917012	1	True	True	False	Bitcoin	t5_2s3qj	r/Bitcoin	public		0	[]													
159	[]	False		ContWord2346			[]				text	t2_8k6yzqgi	False	False	Soon.	5e0f2a4ad4d247657e642dd9f2de7e3c96b8f60a	True	False					0	1656916993		0	{}	iesgvmn	False	t3_vqidil	False	True	t3_vqidil	/r/Bitcoin/comments/vqidil/tf_is_july_not_crypto_month_in_the_us_federal/iesgvmn/	1656917004	1	True	True	False	Bitcoin	t5_2s3qj	r/Bitcoin	public		0	[]													
160	[]	False		goeswith			[]				text	t2_jnrkz	False	False	What even is the point of hardware wallets when we have cold storage and new multisig solutions like Muun's?	f9d2e8795af24804dd199b2caa59cae63a6fac78	True	False					0	1656916968		0	{}	iesgubi	False	t3_vqq3hd	False	True	t3_vqq3hd	/r/Bitcoin/comments/vqq3hd/why_do_people_even_recommend_ledger/iesgubi/	1656916983	1	True	True	False	Bitcoin	t5_2s3qj	r/Bitcoin	public		0	[]													
161	[]	False		digiorgioyates			[]				text	t2_j4c4i9w5	False	False	That's the reason why I never had any money on these fucking banks, they are just fucked up and they all are just so bad, I hope everyone will get a cold wallet.	7d03bdc38b0bb35b949bd6fdc768599945d00391	True	False					0	1656916968		0	{}	iesguav	False	t3_vqdpsm	False	True	t3_vqdpsm	/r/Bitcoin/comments/vqdpsm/not_your_keys_not_your_coins_6_billion_in/iesguav/	1656916983	1	True	True	False	Bitcoin	t5_2s3qj	r/Bitcoin	public		0	[]													
162	[]	False		sedulouspellucidsoft			[]				text	t2_17fc96	False	False	If they had bought 10 years ago?	7db5b9062782fbc43f4fb761ffe92cab0a80d2c9	True	False					0	1656916966		0	{}	iesgu8o	False	t3_vqdpsm	False	True	t1_ieqpq4b	/r/Bitcoin/comments/vqdpsm/not_your_keys_not_your_coins_6_billion_in/iesgu8o/	1656916983	1	True	True	False	Bitcoin	t5_2s3qj	r/Bitcoin	public		0	[]													
163	[]	False		[deleted]						dark					[removed]	fe993932d6dced4c0a879e9aa5d7a6e0fbb467f5	True	False					0	1656916927		0	{}	iesgsfw	False	t3_vqmacf	False	True	t3_vqmacf	/r/Bitcoin/comments/vqmacf/bitcoin_runs_in_cycles_so_after_a_bear_always/iesgsfw/	1656916942	1	True	True	False	Bitcoin	t5_2s3qj	r/Bitcoin	public		0	[]													
164	[]	False		NearbyTurnover			[]				text	t2_13cu546	False	False	Looks like something happened around 1971..	9608ccbe8b921d68ba3026c7f1814f21bcaad721	True	False					0	1656916925		0	{}	iesgsc2	False	t3_vqiodm	False	False	t3_vqiodm	/r/Bitcoin/comments/vqiodm/the_us_debt_is_exponentially_growing_and_its/iesgsc2/	1656916942	1	True	True	False	Bitcoin	t5_2s3qj	r/Bitcoin	public		0	[]													
165	[]	False		Caraquena			[]				text	t2_zzro1	False	False	There are dozens (hundreds?) of tax evasion and money laundering investigations still ongoing by different authorities (Australia, US, ....) but he hasn't been charged with anything (yet).	8c98e72107213ed0ec7bd398cf68d630f9e6702a	True	False					0	1656916914		0	{}	iesgrta	False	t3_vquakg	False	True	t1_ies6b38	/r/Bitcoin/comments/vquakg/bitcoin_fixes_this/iesgrta/	1656916927	1	True	True	False	Bitcoin	t5_2s3qj	r/Bitcoin	public		0	[]													
166	[]	False		sedulouspellucidsoft			[]				text	t2_17fc96	False	False	How did you do that	f38ff402ec06ade3c826095555ac53b0e8c978a1	True	False					0	1656916913		0	{}	iesgrrs	False	t3_vqdpsm	False	True	t1_ier2vzr	/r/Bitcoin/comments/vqdpsm/not_your_keys_not_your_coins_6_billion_in/iesgrrs/	1656916927	1	True	True	False	Bitcoin	t5_2s3qj	r/Bitcoin	public		0	[]													
167	[]	False		AV3NG3R00			[]				text	t2_8t7zr	False	False	"Graph needs a log scale.

You could have said the same about 1 trillion, 500 billion, 100 billion, 50 billion, 10 billion etc.

Give me a graph of the YoY percentage increase."	636f3b8a6cfcf6991f7adb6e58f10795a029255a	True	False					0	1656916893		0	{}	iesgqtq	False	t3_vqiodm	False	True	t3_vqiodm	/r/Bitcoin/comments/vqiodm/the_us_debt_is_exponentially_growing_and_its/iesgqtq/	1656916905	1	True	True	False	Bitcoin	t5_2s3qj	r/Bitcoin	public		0	[]													
168	[]	False		[deleted]						dark					[removed]	fe993932d6dced4c0a879e9aa5d7a6e0fbb467f5	True	False					0	1656916871		0	{}	iesgpsp	False	t3_vqzc5o	False	True	t1_iesfg3c	/r/Bitcoin/comments/vqzc5o/i_am_officially_a_wholecoiner/iesgpsp/	1656916883	1	True	True	False	Bitcoin	t5_2s3qj	r/Bitcoin	public		0	[]													
169	[]	False		savinelli_smoker			[]				text	t2_rcdiw	False	False	I mean, even a hot wallet on your phone is way better - while you wait for your hardware - do it now.	e88b4e2340f2713640fcbed76b71391de51e7fff	True	False					0	1656916851		0	{}	iesgovk	False	t3_vr0li5	False	True	t3_vr0li5	/r/Bitcoin/comments/vr0li5/if_youre_not_completely_in_self_custody_cold/iesgovk/	1656916862	1	True	True	False	Bitcoin	t5_2s3qj	r/Bitcoin	public		0	[]													
170	[]	False		sedulouspellucidsoft			[]				text	t2_17fc96	False	False	In the video it says the police are beating up protestors	bbedfa7ea9d3c1f7afe3b042ba62db7fb908166e	True	False					0	1656916818		0	{}	iesgndi	False	t3_vqdpsm	False	True	t1_iepjvfa	/r/Bitcoin/comments/vqdpsm/not_your_keys_not_your_coins_6_billion_in/iesgndi/	1656916835	1	True	True	False	Bitcoin	t5_2s3qj	r/Bitcoin	public		0	[]													
171	[]	False		bittabet			[]				text	t2_22hjfdx	False	False	I mean, miners are nodes themselves so they’re validating and including them in the blocks. Pretty sure other nodes only validate the transactions after they’ve been placed in a block so the first nodes to validate the transactions themselves are the mining nodes.	3a14a22ae66df2998cdd43622ff8f58a9083ee08	True	False					0	1656916784		0	{}	iesglr8	False	t3_vqg908	False	True	t1_iepnn6b	/r/Bitcoin/comments/vqg908/el_salvador_and_bitcoin/iesglr8/	1656916800	1	True	True	False	Bitcoin	t5_2s3qj	r/Bitcoin	public		0	[]													
172	[]	False		sedulouspellucidsoft			[]				text	t2_17fc96	False	False	Good look going against tanks	888e239ef703c4bea599f990972ce04f84ecafb9	True	False					0	1656916744		0	{}	iesgjwn	False	t3_vqdpsm	False	True	t1_iepi7sq	/r/Bitcoin/comments/vqdpsm/not_your_keys_not_your_coins_6_billion_in/iesgjwn/	1656916755	1	True	True	False	Bitcoin	t5_2s3qj	r/Bitcoin	public		0	[]													
173	[]	False		TomEltonArt			[]				text	t2_aoci841j	False	False	Thank you for the kind comment, Penny Admixture. It is representational. Thank you very much for the kind words.	3a23d54a0f3ae5d731c0055001273a8dee83b050	True	False					0	1656916584		0	{}	iesgcfx	True	t3_vq4cda	False	True	t1_ien4p95	/r/Bitcoin/comments/vq4cda/starting_version_2_of_a_visual_expression_of/iesgcfx/	1656916595	1	True	True	False	Bitcoin	t5_2s3qj	r/Bitcoin	public		0	[]													
174	[]	False		rfkzen			[]				text	t2_ui9wj	False	True	🙏🏼	68f5773a840f3de5c236e02349992a788e1dd655	True	False					0	1656916544		0	{}	iesgafr	False	t3_vqzqpv	False	True	t1_iesg8fb	/r/Bitcoin/comments/vqzqpv/daily_discussion_july_04_2022/iesgafr/	1656916559	1	True	True	False	Bitcoin	t5_2s3qj	r/Bitcoin	public		0	[]													
175	[]	False		medialAxis			[]				text	t2_xr245	False	False	How exactly does that work? I mean bitcoin on memory sticks - eh?	95b6732aba7686d18378b78c6caa460b3e15921f	True	False					0	1656916539		0	{}	iesga8b	False	t3_vqn9ob	False	True	t1_ieqxlzl	/r/Bitcoin/comments/vqn9ob/missing_cryptoqueen_is_dr_ruja_ignatova_the/iesga8b/	1656916552	1	True	True	False	Bitcoin	t5_2s3qj	r/Bitcoin	public		0	[]													
176	[]	False		AvisPhlox			[]				text	t2_eo0q0pk3	False	False	You too.	51418253aafa99296444015e51e413ba4aa4a83e	True	False					0	1656916534		0	{}	iesg9z3	False	t3_vqufqb	False	True	t1_iesfwyr	/r/Bitcoin/comments/vqufqb/why_is_everyone_making_fun_of_el_slavador_beucase/iesg9z3/	1656916545	1	True	True	False	Bitcoin	t5_2s3qj	r/Bitcoin	public		0	[]													
177	[]	False		Bitbuyer313			[]			dark	text	t2_4cd7lcfh	False	False	I think it's a combination of both	ae68d68587dbc0569c30b0d66ace5ef275ab8d5a	True	False					0	1656916523		0	{}	iesg9h2	False	t3_vr0pxl	False	True	t1_iesfld4	/r/Bitcoin/comments/vr0pxl/accelerated_trend_in_addresses_holding_greater/iesg9h2/	1656916539	1	True	True	False	Bitcoin	t5_2s3qj	r/Bitcoin	public		0	[]													
178	[]	False		Jin-Sakti			[]				text	t2_d3bn253q	False	False	"Btc got into this mess because the exchanges and scammy hedge funds use btc that people own or stake on exchanges as collateral for scam defi and defi protocols with insane yield .

Hope all bitcoiners buy btc pull off exchange immediately, supply shock and squeeze all liquidity out of system and kill all the shit coins and fake defi protocols once and for all."	04683101aa75d00012c9a5f58ea9a4be800cb297	True	False					0	1656916502		0	{}	iesg8fb	False	t3_vqzqpv	False	True	t1_iese8tw	/r/Bitcoin/comments/vqzqpv/daily_discussion_july_04_2022/iesg8fb/	1656916517	1	True	True	False	Bitcoin	t5_2s3qj	r/Bitcoin	public		0	[]		True											
179	[]	False		[deleted]						dark					[removed]	fe993932d6dced4c0a879e9aa5d7a6e0fbb467f5	True	False					0	1656916492		0	{}	iesg7ym	False	t3_vqdpsm	False	True	t3_vqdpsm	/r/Bitcoin/comments/vqdpsm/not_your_keys_not_your_coins_6_billion_in/iesg7ym/	1656916503	1	True	True	False	Bitcoin	t5_2s3qj	r/Bitcoin	public		0	[]													
180	[]	False		Quantumboredom			[]				text	t2_aqoh1	False	True	"Because trezor has known and unfixable hardware vulnerabilities that are not very hard to exploit?

I mean with a trezor you need such a strong passphrase to maintain security that you might as well not have a seed in the first place, since you must assume that the seed is easily available to anyone that gains physical access to you trezor."	651c49dc503d045db2d00f5e145077b179636ceb	True	False					0	1656916480		0	{}	iesg7f6	False	t3_vqq3hd	False	True	t1_ier6ymu	/r/Bitcoin/comments/vqq3hd/why_do_people_even_recommend_ledger/iesg7f6/	1656916496	1	True	True	False	Bitcoin	t5_2s3qj	r/Bitcoin	public		0	[]													
181	[]	False		Seeders			[]				text	t2_2ce0k	False	False	Which is irrelevant.	485e8e1b7cc50fb79e189fa9d12d8a584dbbb612	True	False					0	1656916476		0	{}	iesg76s	False	t3_vq9vyg	False	True	t1_iesfehs	/r/Bitcoin/comments/vq9vyg/daily_discussion_july_03_2022/iesg76s/	1656916489	1	True	True	False	Bitcoin	t5_2s3qj	r/Bitcoin	public		0	[]													
182	[]	False		Whoz_Yerdaddi			[]				text	t2_10drbl	False	False	"That’s what I think will happen as well. China’s already doing it with the digital Yuan. Countries won’t give up control of their own currencies without a fight. Unfortunately this brings up serious privacy issues. 

Bitcoin is an excellent step towards a true Internet currency but it doesn’t scale and also has privacy issues. Eventually a coin will be created that is private, scalable to levels like Visa, of finite quantity, doesn’t consume massive amounts of energy, and is resistant to Quantum computer attacks. That’s what it’ll take to replace national digital currencies."	4b7e3f3369e0cf4aec2cbcb290105a96c006bad2	True	False					0	1656916475		0	{}	iesg75r	False	t3_vqiodm	False	True	t1_ieppz1z	/r/Bitcoin/comments/vqiodm/the_us_debt_is_exponentially_growing_and_its/iesg75r/	1656916489	1	True	True	False	Bitcoin	t5_2s3qj	r/Bitcoin	public		0	[]													
183	[]	False		ElephantsAreHeavy			[]				text	t2_13e7j7	False	False	With bitcoin, you don't need banks.	ad95f68afce34c57f8ef27c676ab245a7ef9ed75	True	False					0	1656916443		0	{}	iesg5l9	False	t3_vqxyep	False	True	t3_vqxyep	/r/Bitcoin/comments/vqxyep/banking_for_crypto_msb/iesg5l9/	1656916461	1	True	True	False	Bitcoin	t5_2s3qj	r/Bitcoin	public		0	[]													
184	[]	False		sedulouspellucidsoft			[]				text	t2_17fc96	False	False	RIP	23ecfd73cf6c3d5cd8a357226bc95a16e7290dbc	True	False					0	1656916422		0	{}	iesg4m3	False	t3_vqdpsm	False	True	t1_ieozgzz	/r/Bitcoin/comments/vqdpsm/not_your_keys_not_your_coins_6_billion_in/iesg4m3/	1656916438	1	True	True	False	Bitcoin	t5_2s3qj	r/Bitcoin	public		0	[]													
185	[]	False		TomEltonArt			[]				text	t2_aoci841j	False	False	https://postimg.cc/bSJcdhsm	7bae8c873a815115f6bd659bbea5dc1a8878637a	True	False					0	1656916411		0	{}	iesg43j	True	t3_vq4cda	False	True	t1_ieo1oof	/r/Bitcoin/comments/vq4cda/starting_version_2_of_a_visual_expression_of/iesg43j/	1656916424	1	True	True	False	Bitcoin	t5_2s3qj	r/Bitcoin	public		0	[]													
186	[]	False		BUYEROFSTONKS			[]				text	t2_4p14q24w	False	False	Good on ya, Chad.	afeb68bfa58f60df846939e86a2ab7cb2a84c425	True	False					0	1656916399		0	{}	iesg3kf	False	t3_vqv8ea	False	True	t3_vqv8ea	/r/Bitcoin/comments/vqv8ea/day_4_im_buying_more_eow_40m_sats_please_keep/iesg3kf/	1656916410	1	True	True	False	Bitcoin	t5_2s3qj	r/Bitcoin	public		0	[]													
187	[]	False		TomEltonArt			[]				text	t2_aoci841j	False	False	https://postimg.cc/bSJcdhsm	7bae8c873a815115f6bd659bbea5dc1a8878637a	True	False					0	1656916396		0	{}	iesg3fk	True	t3_vq4cda	False	True	t1_ieolbyq	/r/Bitcoin/comments/vq4cda/starting_version_2_of_a_visual_expression_of/iesg3fk/	1656916410	1	True	True	False	Bitcoin	t5_2s3qj	r/Bitcoin	public		0	[]													
188	[]	False		RobustFallacy			[]				text	t2_gz0v9qut	False	False	Coolsauce	609fae45ffbe9da7e5e6b56ac0756d7fc3859d63	True	False					0	1656916374		0	{}	iesg2df	False	t3_vqzc5o	False	False	t3_vqzc5o	/r/Bitcoin/comments/vqzc5o/i_am_officially_a_wholecoiner/iesg2df/	1656916388	1	True	True	False	Bitcoin	t5_2s3qj	r/Bitcoin	public		0	[]													
189	[]	False		sedulouspellucidsoft			[]				text	t2_17fc96	False	False	You’re full of bologna.	62af0ae85e930d2d38f0db7dac9f8c5ec5277278	True	False					0	1656916362		0	{}	iesg1s7	False	t3_vqdpsm	False	True	t1_iesd5ma	/r/Bitcoin/comments/vqdpsm/not_your_keys_not_your_coins_6_billion_in/iesg1s7/	1656916379	1	True	True	False	Bitcoin	t5_2s3qj	r/Bitcoin	public		0	[]													
190	[]	False		ElephantsAreHeavy			[]				text	t2_13e7j7	False	False	Oh, they are. Not a single person lost any bitcoin. People that settled for paper IOU's just do not understand the purpose or value proposition of bitcoin to begin with. Not a single institutional investor that invested in bitcoin directly lost anything. Even if big parts of the 'ecosystem' collapse, bitcoin stays alive and resilient. In my opinion, nothing out of the ordinary happened. You give people access to your money, they will run away with it at some point...	4cfdeb8c12cd3a61e4a84167af473a0fcc55cf1b	True	False					0	1656916298		0	{}	iesfyrj	False	t3_vqq2mt	False	True	t1_iercp4b	/r/Bitcoin/comments/vqq2mt/survival_of_the_fittest/iesfyrj/	1656916315	1	True	True	False	Bitcoin	t5_2s3qj	r/Bitcoin	public		0	[]													
191	[]	False		DadaDoDat			[]				text	t2_n45h5hj	False	False	"6:08 Biden starting his policy with ""Respect the Fed. Respect the Fed's independence. Which I have done and will continue to do."" sounds bonkers."	7e0988181c9ff159e123559c384eaa91aaf05905	True	False					0	1656916297		0	{}	iesfyoc	False	t3_vqg7p7	False	True	t3_vqg7p7	/r/Bitcoin/comments/vqg7p7/us_presidents_and_the_federal_reserve/iesfyoc/	1656916308	1	True	True	False	Bitcoin	t5_2s3qj	r/Bitcoin	public		0	[]													
192	[]	False		BitcoinUser263895			[]				text	t2_23xzh5p7	False	True	Good luck to your people. They're going to need it.	55e3bf78fafb60e07a59ee73d8e97cecb154e32c	True	False					0	1656916262		0	{}	iesfwyr	False	t3_vqufqb	False	True	t1_ies015h	/r/Bitcoin/comments/vqufqb/why_is_everyone_making_fun_of_el_slavador_beucase/iesfwyr/	1656916273	1	True	True	False	Bitcoin	t5_2s3qj	r/Bitcoin	public		0	[]													
193	[]	False		Bitcoin__Hodler			[]			dark	text	t2_jtjwgqh6	False	False	sending money in the mail is a bad idea. better meet someone at a public space and do that exchange.	66c03033e56526d00a4af53d58d00b5d5bff202b	True	False					0	1656916241		0	{}	iesfvzu	False	t3_vqr0cm	False	False	t3_vqr0cm	/r/Bitcoin/comments/vqr0cm/how_safe_is_bisq/iesfvzu/	1656916251	1	True	True	False	Bitcoin	t5_2s3qj	r/Bitcoin	public		0	[]													
194	[]	False		Dee_Jiensai			[]				text	t2_hqyjl	False	False	lol :-D	e8cc6e10b1c347af3a69cb463099ac184e3808fa	True	False					0	1656916227		0	{}	iesfvdc	False	t3_vqozwb	False	True	t1_iesf3xi	/r/Bitcoin/comments/vqozwb/why_is_bitcoin_crashing/iesfvdc/	1656916245	1	True	True	False	Bitcoin	t5_2s3qj	r/Bitcoin	public		0	[]													
195	[]	False		bittabet			[]				text	t2_22hjfdx	False	False	I think for daily use it might be the easiest to use, might be good to put like your monthly spending on it or something of that sort.	3e09730f23d081ca96f6049d6d10dbbe57eeb9b9	True	False					0	1656916207		0	{}	iesfuch	False	t3_vqt274	False	True	t1_ierwk7t	/r/Bitcoin/comments/vqt274/blocks_hardware_wallet/iesfuch/	1656916223	1	True	True	False	Bitcoin	t5_2s3qj	r/Bitcoin	public		0	[]													
196	[]	False		BitcoinUser263895			[]				text	t2_23xzh5p7	False	True	"&gt; Pathetic short sighted snark

Do I keep reading? I vote; No."	1e37de5a90e74c1ca81f3de03039b265af39d653	True	False					0	1656916204		0	{}	iesfu6u	False	t3_vqufqb	False	True	t1_ies0gra	/r/Bitcoin/comments/vqufqb/why_is_everyone_making_fun_of_el_slavador_beucase/iesfu6u/	1656916216	1	True	True	False	Bitcoin	t5_2s3qj	r/Bitcoin	public		0	[]													
197	[]	False		BitcoinUser263895			[]				text	t2_23xzh5p7	False	True	lol right? ;)	8e3688a443d362a78fdf27d963adadc9a257b71d	True	False					0	1656916173		0	{}	iesfsqh	False	t3_vqr0cm	False	True	t1_ies0kl4	/r/Bitcoin/comments/vqr0cm/how_safe_is_bisq/iesfsqh/	1656916188	1	True	True	False	Bitcoin	t5_2s3qj	r/Bitcoin	public		0	[]													
198	[]	False		Bitcoin__Hodler			[]			dark	text	t2_jtjwgqh6	False	False	= Buy a Trezor	b2eb6e8c4c4aab66b37975283a90913c36ac6ce1	True	False					0	1656916163		0	{}	iesfs8w	False	t3_vqrmuj	False	True	t1_ieqwgy8	/r/Bitcoin/comments/vqrmuj/im_tossing_up_between_getting_a_trezor_vs_cheap/iesfs8w/	1656916181	1	True	True	False	Bitcoin	t5_2s3qj	r/Bitcoin	public		0	[]													
199	[]	False		thestrongestversion			[]				text	t2_o8up9	False	False	" After that, the goal will be to say ""I have a non-prime number of coins."""	454c9afd9c2ea8c242e4309981c074303b58ca1b	True	False					0	1656916146		0	{}	iesfrdr	False	t3_vqv8ea	False	True	t1_ies13gu	/r/Bitcoin/comments/vqv8ea/day_4_im_buying_more_eow_40m_sats_please_keep/iesfrdr/	1656916158	1	True	True	False	Bitcoin	t5_2s3qj	r/Bitcoin	public		0	[]													
200	[]	False		KyleWatermellon			[]				text	t2_cboxnadb	False	False	"I'm trying to figure out the best way to get hired as a blockchain developer. My thought is doing the [front end developer](https://www.codecademy.com/learn/paths/front-end-engineer-career-path) career path on code academy. Then doing a [blockchain developer](https://www.udemy.com/course/ethereum-and-solidity-the-complete-developers-guide/) course on Udemy. And by the time that is complete I should have a portfolio and a chance at an entry level job. 

On code academy there is also a full stack developer career path, but I thought that wasn't necessary because if probably involves connecting to a web2 type database. And blockchain is the new way of doing back end engineering. Is that correct?

I appreciate any feedback. I want to get a big picture understanding before going all in with self learning"	6faad0887aafa94c2351bb298204bf64ed1df8ce	True	False					0	1656906154		0	{}	ies0tcy	False	t3_vloh74	False	True	t3_vloh74	/r/ethereum/comments/vloh74/frequently_asked_questions_weekly_discussion/ies0tcy/	1656906170	1	False	True	False	ethereum	t5_2zf9m	r/ethereum	public		0	[]													
201	[]	False		TrymWS			[]				text	t2_kruww	False	False	"That’s still not providing a source.

Anyways, what they’re doing is just merging Coinbase and Coinbase Pro, so the argument is just stupid."	8e8a21e1b3b88bf690317527efdd653145a974ad	True	False					0	1656905689		0	{}	ies01at	False	t3_vq5vev	False	True	t1_ieryi8b	/r/ethereum/comments/vq5vev/best_way_to_dca_into_eth/ies01at/	1656905707	1	False	True	False	ethereum	t5_2zf9m	r/ethereum	public		0	[]													
202	[]	False		Impossible-Example91			[]				text	t2_9usq5ygq	False	False	The tweet was on June 23rd. You can find it with 2 minutes of effort.	df2ea233ed9a6354db083645bd98a4ae2d043ddf	True	False					0	1656904787		0	{}	ieryi8b	False	t3_vq5vev	False	True	t1_ieq0h26	/r/ethereum/comments/vq5vev/best_way_to_dca_into_eth/ieryi8b/	1656904799	1	False	True	False	ethereum	t5_2zf9m	r/ethereum	public		0	[]													
203	[]	False		elemeno89			[]				text	t2_af4po	False	False	Will there be online streams of the event like polkadot decode?	2df9c0ddf61b4c42e4aad7682162d273d37a4dbd	True	False					0	1656903071		0	{}	iervirr	False	t3_vqlto9	False	True	t3_vqlto9	/r/ethereum/comments/vqlto9/argentina_to_host_3_days_of_free_ethereum/iervirr/	1656903082	1	False	True	False	ethereum	t5_2zf9m	r/ethereum	public		0	[]													
204	[]	False		Isabela_Grace			[]				text	t2_5140d1px	False	False	Paper is the most secure it gets… I have no idea why you’d remove it. Makes no sense. Duplicate it and put it in another secure safe or something maybe but I wouldn’t import it into anything especially a ledger that could be compromised somehow when you know that paper is untouchable	dbfb6c5a768141c72dfd16689a036d35575659bd	True	False					0	1656902518		0	{}	ierujgu	False	t3_vqpot1	False	True	t3_vqpot1	/r/ethereum/comments/vqpot1/how_to_move_ether_from_paper_wallet_to_hardware/ierujgu/	1656902530	1	False	True	False	ethereum	t5_2zf9m	r/ethereum	public		0	[]													
