Unnamed: 0	all_awardings	archived	associated_award	author	author_flair_background_color	author_flair_css_class	author_flair_richtext	author_flair_template_id	author_flair_text	author_flair_text_color	author_flair_type	author_fullname	author_patreon_flair	author_premium	body	body_sha1	can_gild	collapsed	collapsed_because_crowd_control	collapsed_reason	collapsed_reason_code	comment_type	controversiality	created_utc	distinguished	gilded	gildings	id	is_submitter	link_id	locked	no_follow	parent_id	permalink	retrieved_utc	score	score_hidden	send_replies	stickied	subreddit	subreddit_id	subreddit_name_prefixed	subreddit_type	top_awarded_type	total_awards_received	treatment_tags	unrepliable_reason	author_cakeday	corpus	support	knowledge	conflict	power	similarity	fun	status	trust	identity	romance
0	[]	False		WorriedExpat123			[]				text	t2_cduir1cp	False	False	Perfect comment.	d8bf6953256a9ae9f7fbe62810d8546dd377436a	True	False					0	1652760046		0	{}	i8woluj	False	t3_ur64qy	False	True	t1_i8vqd5g	/r/Bitcoin/comments/ur64qy/how_is_it_that_antiwork_crowd_can_see_the/i8woluj/	1652760059	1	True	True	False	Bitcoin	t5_2s3qj	r/Bitcoin	public		0	[]													
1	[]	False		AussieCryptoCurrency			[]				text	t2_fgixs	False	False	Did it cost you $30 In Tx fees to withdraw?	00af0051400afce02578d15dd9974786344b72ed	True	False					0	1652760022		0	{}	i8wokck	False	t3_u17suo	False	True	t1_i4n6s1r	/r/Bitcoin/comments/u17suo/cryptocom_doesnt_work_again/i8wokck/	1652760038	1	True	True	False	Bitcoin	t5_2s3qj	r/Bitcoin	public		0	[]													
2	[]	False		penty			[]				text	t2_3l16	False	False	Genius!	b1bb28eec7aa7aa6e402caf91e79c3a6056b854b	True	False					0	1652759986		0	{}	i8woi7l	False	t3_ur31jq	False	True	t1_i8wg6s4	/r/Bitcoin/comments/ur31jq/bitcoin_addresses_with_a_balance_over_001_btc_hit/i8woi7l/	1652760003	1	True	True	False	Bitcoin	t5_2s3qj	r/Bitcoin	public		0	[]													
3	[]	False		ReedoIncognito		noob	[{'e': 'text', 't': 'redditor for 3 months'}]	2ec8e69e-6c36-11e9-a04b-0afb553d4ea6	redditor for 3 months	dark	richtext	t2_i8l6l63s	False	False	It is known	45b9fdf0949c1507ab925bb1da4c5d3e8c576df1	True	False					0	1652759982		0	{}	i8wohzq	False	t3_ur2ph0	False	True	t1_i8w3t9m	/r/Bitcoin/comments/ur2ph0/bitcoin_addresses_holding_1_or_more_btc_hits_a/i8wohzq/	1652759996	1	True	True	False	Bitcoin	t5_2s3qj	r/Bitcoin	public		0	[]													
4	[]	False		LilFettucineAlfredo			[]				text	t2_58rb6kqi	False	False	damn didn't know it took being clever to take 3 seconds to consider what you're doing when you aren't in a 0 risk enviroment. if you find $400 in your car are you going to ask the nearest stranger what you should do with it?	7726b50b0a94d9f20f91bef4785b0904265f3bc3	True	False					0	1652759948		0	{}	i8wofzy	False	t3_uqtg9t	False	True	t1_i8vdkss	/r/Bitcoin/comments/uqtg9t/found_this_old_bitcoin_hard_drive_how_do_i_check/i8wofzy/	1652759961	1	True	True	False	Bitcoin	t5_2s3qj	r/Bitcoin	public		0	[]													
5	[]	False		bandoonparade			[]				text	t2_er2a5f93	False	False	Well, the math seems to check out.	f568165fa0bb905a20d423a2cae00d48d9adc709	True	False					0	1652759943		0	{}	i8wofpe	False	t3_urdfrk	False	True	t3_urdfrk	/r/Bitcoin/comments/urdfrk/usa_left_the_gold_standard_1970s_fiat_currency_is/i8wofpe/	1652759954	1	True	True	False	Bitcoin	t5_2s3qj	r/Bitcoin	public		0	[]													
6	[]	False		[deleted]						dark					[removed]	fe993932d6dced4c0a879e9aa5d7a6e0fbb467f5	True	False					0	1652759938		0	{}	i8wofg3	False	t3_ur31jq	False	True	t3_ur31jq	/r/Bitcoin/comments/ur31jq/bitcoin_addresses_with_a_balance_over_001_btc_hit/i8wofg3/	1652759955	1	True	True	False	Bitcoin	t5_2s3qj	r/Bitcoin	public		0	[]													
7	[]	False		DarkSyde3000			[]				text	t2_11mos5	False	False	Ooh I'm in the official numbers 👍	a1691dade119b42d7000a8a97e04eb15b7b1b2de	True	False					0	1652759927		0	{}	i8woepl	False	t3_ur31jq	False	True	t3_ur31jq	/r/Bitcoin/comments/ur31jq/bitcoin_addresses_with_a_balance_over_001_btc_hit/i8woepl/	1652759941	1	True	True	False	Bitcoin	t5_2s3qj	r/Bitcoin	public		0	[]													
8	[]	False		ReedoIncognito		noob	[{'e': 'text', 't': 'redditor for 3 months'}]	2ec8e69e-6c36-11e9-a04b-0afb553d4ea6	redditor for 3 months	dark	richtext	t2_i8l6l63s	False	False	PLEBS, ARISE!	7939d7133777ad8527cf759420371d81dc519349	True	False					0	1652759915		0	{}	i8woe14	False	t3_ur2ph0	False	True	t3_ur2ph0	/r/Bitcoin/comments/ur2ph0/bitcoin_addresses_holding_1_or_more_btc_hits_a/i8woe14/	1652759927	1	True	True	False	Bitcoin	t5_2s3qj	r/Bitcoin	public		0	[]													
9	[]	False		GazeTheSun			[]				text	t2_8khdeqr	False	False	"lol they don't ""have"" 15 dollars an hour, the federal minimum wage is still 7.25"	8c3441f93125362406089965e5924d419be9d3b6	True	False					0	1652759910		0	{}	i8wodqt	False	t3_ur64qy	False	True	t3_ur64qy	/r/Bitcoin/comments/ur64qy/how_is_it_that_antiwork_crowd_can_see_the/i8wodqt/	1652759927	1	True	True	False	Bitcoin	t5_2s3qj	r/Bitcoin	public		0	[]													
10	[]	False		theplushpairing			[]				text	t2_63gwbu69	False	False	If you’re not making that much you sorta have to be	41f550c60b71e6a832dbf5be1b9195722ba662f3	True	False					0	1652759900		0	{}	i8wod5x	False	t3_ur64qy	False	True	t1_i8wgclc	/r/Bitcoin/comments/ur64qy/how_is_it_that_antiwork_crowd_can_see_the/i8wod5x/	1652759913	1	True	True	False	Bitcoin	t5_2s3qj	r/Bitcoin	public		0	[]													
11	[]	False		hyperinflationUSA			[]			dark	text	t2_bf6vmd19	False	False	Shhhhh I'm spreading FUD about fiat.	8474513d16be4ba26225897b50edef3ee57d2f38	True	False					0	1652759895		0	{}	i8wocv3	True	t3_urdfrk	False	True	t1_i8wn5e3	/r/Bitcoin/comments/urdfrk/usa_left_the_gold_standard_1970s_fiat_currency_is/i8wocv3/	1652759905	1	True	True	False	Bitcoin	t5_2s3qj	r/Bitcoin	public		0	[]													
12	[]	False		penty			[]				text	t2_3l16	False	False	"1) I said ""could""

2) His people have literally said this.

So yeah."	34a6a54c84d200187ef68b51a61e45f0eb168f27	True	False					0	1652759881		0	{}	i8woc0y	False	t3_upa21w	False	True	t1_i8wnrjx	/r/Bitcoin/comments/upa21w/daily_discussion_may_14_2022/i8woc0y/	1652759898	1	True	True	False	Bitcoin	t5_2s3qj	r/Bitcoin	public		0	[]													
13	[]	False		coredweller1785			[]				text	t2_l05i7	False	False	"Milton Friedman is a joke. I would read How China Escaped Shock Therapy and just read how the Chinese laugh at the elementary level of understanding Friedman has of economics. The Chinese had so many scholars who did in depth reports and commissioned research of every kind. Milton Friedman brought in by the world Bank just lies about the ""Erhard miracle"" and spews the most basic bs about suppressed inflation the Chinese nearly laugh him out.

Monopolies cause inflation, market concentration causes inflation.  Great podcast on it 

https://listen.stitcher.com/yvap/?af_dp=stitcher://episode/203155240&amp;af_web_dp=https://www.stitcher.com/episode/203155240&amp;deep_link_value=stitcher://episode/203155240


And one final point is you clearly did not read thr article above as it is very clear in its calculations."	0ce01a8cf430af059f37a925ff93df091062681e	True	False					0	1652759870		0	{}	i8wobfa	False	t3_ur64qy	False	True	t1_i8wjn2i	/r/Bitcoin/comments/ur64qy/how_is_it_that_antiwork_crowd_can_see_the/i8wobfa/	1652759883	1	True	True	False	Bitcoin	t5_2s3qj	r/Bitcoin	public		0	[]													
14	[]	False		lizeqiand55d			[]				text	t2_e5h48oyc	False	False	Yeah but, that's not something that you can time the market for.	1a49591eeb7bb9e4cf7fe175c455d80b0d49c3fc	True	False					0	1652759838		0	{}	i8wo9k1	False	t3_upa21w	False	True	t1_i8mno2r	/r/Bitcoin/comments/upa21w/daily_discussion_may_14_2022/i8wo9k1/	1652759848	1	True	True	False	Bitcoin	t5_2s3qj	r/Bitcoin	public		0	[]													
15	[]	False		icute78			[]				text	t2_gf59kyn3	False	False	Dang man you're absolutely wildin right now, you mad bro.	ecfe1a2a72fda568dd159405c86f6f7c5138f7ca	True	False					0	1652759802		0	{}	i8wo7jf	False	t3_upa21w	False	True	t1_i8lmr9s	/r/Bitcoin/comments/upa21w/daily_discussion_may_14_2022/i8wo7jf/	1652759813	1	True	True	False	Bitcoin	t5_2s3qj	r/Bitcoin	public		0	[]													
16	[]	False		torinakomara			[]				text	t2_88kbyvt2	False	False	Bitcoin does have a bit of inflation, not all 21 mil been created yet	cf9a980b6d2c14e774e9160eb0ec97b6651da070	True	False					0	1652759798		0	{}	i8wo7ar	False	t3_ur64qy	False	True	t3_ur64qy	/r/Bitcoin/comments/ur64qy/how_is_it_that_antiwork_crowd_can_see_the/i8wo7ar/	1652759813	1	True	True	False	Bitcoin	t5_2s3qj	r/Bitcoin	public		0	[]													
17	[]	False		grgveilleux		noob	[{'e': 'text', 't': 'redditor for 6 weeks'}]	2ec8e69e-6c36-11e9-a04b-0afb553d4ea6	redditor for 6 weeks	dark	richtext	t2_lfvyuk5n	False	False	"First of all that's  not a margin call dude, You're wrong.

And he's not going to get liquidated on the 21k, you don't have to worry about that my guy."	bfe179f62316ccb9b4ab6fa0a69fb4843fd742e1	True	False					0	1652759777		0	{}	i8wo62e	False	t3_upa21w	False	True	t1_i8lnoix	/r/Bitcoin/comments/upa21w/daily_discussion_may_14_2022/i8wo62e/	1652759792	1	True	True	False	Bitcoin	t5_2s3qj	r/Bitcoin	public		0	[]													
18	[]	False		alradko			[]				text	t2_d83sfmya	False	False	I don't even wanna hear that name, don't take that name here.	27700dc518c7aedc834326bcbf15507921141292	True	False					0	1652759748		0	{}	i8wo4dj	False	t3_upa21w	False	True	t1_i8lubdm	/r/Bitcoin/comments/upa21w/daily_discussion_may_14_2022/i8wo4dj/	1652759764	1	True	True	False	Bitcoin	t5_2s3qj	r/Bitcoin	public		0	[]													
19	[]	False		vattenj			[]				text	t2_de72m	False	False	"I think gold actually act as some kind of credit rating between monarchs, so that they could use certain amount of gold to exchange resources. Without the support of those overlords, gold would worth much less

So bitcoin is also gaining its support among IT entrepreneurs , when their power grows enough big, that also works as an universal credit in this new class"	437fd11e44b5a3de87fc3e7d7f74ec1e0831ad33	True	False					0	1652759747		0	{}	i8wo4d1	False	t3_uqyp56	False	True	t1_i8ud7qn	/r/Bitcoin/comments/uqyp56/bitcoin_wont_become_an_alternative_form_of_money/i8wo4d1/	1652759764	1	True	True	False	Bitcoin	t5_2s3qj	r/Bitcoin	public		0	[]													
20	[]	False		jiexa1706			[]				text	t2_dnivpgef	False	False	Yep, He's so deep into this btc. He must know everything.	3993ae6eff2da5eefc2ad8b50f370a932a528e23	True	False					0	1652759740		0	{}	i8wo3yv	False	t3_upa21w	False	True	t1_i8mq425	/r/Bitcoin/comments/upa21w/daily_discussion_may_14_2022/i8wo3yv/	1652759757	1	True	True	False	Bitcoin	t5_2s3qj	r/Bitcoin	public		0	[]													
21	[]	False		Final_Historian7309			[]				text	t2_ejxdi5bv	False	False	I signed up for Bitcoinn here	b61c2bf26abfedfce4f78132abd17c7e4369616d	True	False					0	1652759702		0	{}	i8wo1q7	False	t3_uqo8ox	False	True	t1_i8wnof3	/r/Bitcoin/comments/uqo8ox/daily_discussion_may_16_2022/i8wo1q7/	1652759714	1	True	True	False	Bitcoin	t5_2s3qj	r/Bitcoin	public		0	[]													
22	[]	False		FutureNotBleak			[]			dark	text	t2_cqm638wy	False	False	Majority of the youth have been educated into ignorance. It’s not 100% their own fault.	da98081c046fe71ba526ce99e067c75387bf1a45	True	False					0	1652759687		0	{}	i8wo0uw	False	t3_ur64qy	False	True	t3_ur64qy	/r/Bitcoin/comments/ur64qy/how_is_it_that_antiwork_crowd_can_see_the/i8wo0uw/	1652759699	1	True	True	False	Bitcoin	t5_2s3qj	r/Bitcoin	public		0	[]													
23	[]	False		Olskoolah			[]				text	t2_ch2p2ycv	False	False	Cool it nooowww	e40f72ba56205fe27eb2dd5a4e9c93c478319b37	True	False					0	1652759653		0	{}	i8wnys3	False	t3_uqtg9t	False	True	t1_i8vvoac	/r/Bitcoin/comments/uqtg9t/found_this_old_bitcoin_hard_drive_how_do_i_check/i8wnys3/	1652759671	1	True	True	False	Bitcoin	t5_2s3qj	r/Bitcoin	public		0	[]													
24	[]	False		cryptofarmer08			[]				text	t2_9zjkhn4w	False	False	That trend started in the 60’s. Your graph shows it! Cmon that’s like jumpin in btc at $50k when tsla announced holdings.	e88fe067d55f0f5a23e9703eab95e0eb398ed6cf	True	False					0	1652759643		0	{}	i8wny7g	False	t3_urdfrk	False	True	t3_urdfrk	/r/Bitcoin/comments/urdfrk/usa_left_the_gold_standard_1970s_fiat_currency_is/i8wny7g/	1652759656	1	True	True	False	Bitcoin	t5_2s3qj	r/Bitcoin	public		0	[]													
25	[]	False		Since_1979			[]			dark	text	t2_dboip08e	False	False	That dude is a moonboi	384681d16ff53a81061524ce629e4bcfc0fc9e80	True	False					0	1652759642		0	{}	i8wny70	False	t3_ur7bbk	False	True	t1_i8wbxci	/r/Bitcoin/comments/ur7bbk/millionaire_investor_sells_all_his_assets_to_buy/i8wny70/	1652759656	1	True	True	False	Bitcoin	t5_2s3qj	r/Bitcoin	public		0	[]													
26	[]	False		Ok_Economics1981		noob	[{'e': 'text', 't': 'redditor for 5 weeks'}]	2ec8e69e-6c36-11e9-a04b-0afb553d4ea6	redditor for 5 weeks	dark	richtext	t2_kqcv1y9e	False	False	was going to be president of russia	25fe246437f4861c62f13b9d6d555f9561dc295b	True	False					0	1652759634		0	{}	i8wnxp2	False	t3_ura6i5	False	True	t1_i8w8kpk	/r/Bitcoin/comments/ura6i5/hopium_from_the_grandmaster_kasparov/i8wnxp2/	1652759648	1	True	True	False	Bitcoin	t5_2s3qj	r/Bitcoin	public		0	[]													
27	[]	False		bobbyv137			[]				text	t2_9r7xzckj	False	False	"Sounds great in theory but even experienced traders lose money. 

Tread with caution."	a6ed419b878c8736382f051554b9a2854c74c05e	True	False					0	1652759631		0	{}	i8wnxix	False	t3_urb0wj	False	True	t3_urb0wj	/r/Bitcoin/comments/urb0wj/buying_and_selling_to_make_a_few_grand/i8wnxix/	1652759649	1	True	True	False	Bitcoin	t5_2s3qj	r/Bitcoin	public		0	[]													
28	[]	False		Cyeda			[]				text	t2_e2v1zl3n	False	False	That sounds safe enough to me actually. Not a problem at all.	d06004f07d3652b6c8398f43ba793d8370de8c03	True	False					0	1652759621		0	{}	i8wnx0g	False	t3_upa21w	False	True	t1_i8lsp54	/r/Bitcoin/comments/upa21w/daily_discussion_may_14_2022/i8wnx0g/	1652759634	1	True	True	False	Bitcoin	t5_2s3qj	r/Bitcoin	public		0	[]													
29	[]	False		vashhenko88			[]				text	t2_e7wmm6or	False	False	No one had guessed bitcoin will go so much high in some period of time.	6a3d9c99c9de75220161c6a2bafb17e9c75501ad	True	False					0	1652759600		0	{}	i8wnvq2	False	t3_upp3q2	False	True	t3_upp3q2	/r/Bitcoin/comments/upp3q2/been_buying_bitcoin_every_month_since_october/i8wnvq2/	1652759613	1	True	True	False	Bitcoin	t5_2s3qj	r/Bitcoin	public		0	[]													
30	[]	False		dadlif3			[]				text	t2_3eeyf5wy	False	False	I'm already regretting it lol. In true reddit fashion, you get downvoted for stating facts.	0c1ad133eb8a2a439dce9042b8cbe7873aafecde	True	False					0	1652759554		0	{}	i8wnt50	False	t3_ur64qy	False	True	t1_i8vzzkb	/r/Bitcoin/comments/ur64qy/how_is_it_that_antiwork_crowd_can_see_the/i8wnt50/	1652759570	1	True	True	False	Bitcoin	t5_2s3qj	r/Bitcoin	public		0	[]													
31	[]	False		[deleted]						dark					[removed]	fe993932d6dced4c0a879e9aa5d7a6e0fbb467f5	True	False					0	1652759537		0	{}	i8wns38	False	t3_ur7bbk	False	True	t1_i8w9t65	/r/Bitcoin/comments/ur7bbk/millionaire_investor_sells_all_his_assets_to_buy/i8wns38/	1652759548	1	True	True	False	Bitcoin	t5_2s3qj	r/Bitcoin	public		0	[]													
32	[]	False		jcag3			[]				text	t2_ek0zyoyn	False	False	You seem really confident about what's he going to do.	2bfce0d1e95645858df422738db8970cc7555651	True	False					0	1652759527		0	{}	i8wnrjx	False	t3_upa21w	False	True	t1_i8lqxfv	/r/Bitcoin/comments/upa21w/daily_discussion_may_14_2022/i8wnrjx/	1652759541	1	True	True	False	Bitcoin	t5_2s3qj	r/Bitcoin	public		0	[]													
33	[]	False		pcvcolin			[]				text	t2_6esft	False	True	"&gt;Whoever is in possession of an accounts private key is able to do whatever they like to the Bitcoin in that account.

That is the point that is being made by the article cited and by the discussion here.  The finer details are covered because they are important and can't be dismissed. If you ignore them you end up getting Coinbased.  (This is getting f\*cked, in crypto world)

It's fairly obvious there is no ""central authority"" over Bitcoin itself, but the law that is applicable when an exchange chooses to operate in certain areas and chooses its licensing, is in fact that law that applies and has relation in terms of how the assets are treated.

Cheers"	d7bd47fcf9be4e5eb7b7f4a3f37e0ef0975793f8	True	False					0	1652759501		0	{}	i8wnq02	True	t3_uqzm2h	False	True	t1_i8wbk60	/r/Bitcoin/comments/uqzm2h/wyoming_1st_place_in_world_to_recognize_digital/i8wnq02/	1652759519	1	True	True	False	Bitcoin	t5_2s3qj	r/Bitcoin	public		0	[]													
34	[]	False		Whatever3999086543			[]			dark	text	t2_bg17yavv	False	False	I'm guessing NASDAQ futures are in the green?	4b6c43306548e15271ceb43b4463b316d2d8fcd7	True	False					0	1652759476		0	{}	i8wnof3	False	t3_uqo8ox	False	True	t3_uqo8ox	/r/Bitcoin/comments/uqo8ox/daily_discussion_may_16_2022/i8wnof3/	1652759489	1	True	True	False	Bitcoin	t5_2s3qj	r/Bitcoin	public		0	[]													
35	[]	False		ndgoLiberty			[]				text	t2_k11mk82	False	False	You’re gonna want to write down your seed words cause usb drivers are absolutely horrible at long term storage. They begin to lose data within minutes of being unplugged.	108f29c3b9864bbdc2d528a3758d4dcf56b8b13f	True	False					0	1652759388		0	{}	i8wnj3y	False	t3_urdojq	False	False	t3_urdojq	/r/Bitcoin/comments/urdojq/how_to_set_up_wallet_on_usb_drive/i8wnj3y/	1652759403	1	True	True	False	Bitcoin	t5_2s3qj	r/Bitcoin	public		0	[]													
36	[]	False		NigelBeans			[]				text	t2_egc50dtt	False	False	"I'm ready for that, how are we going to do man? Tell us that.

Because I wanna know that how We're going to hit those levels, because I want it to lol."	3c6343d15dbc8b6ccfd925f700766e3f5682fdbb	True	False					0	1652759364		0	{}	i8wnhn8	False	t3_upa21w	False	True	t1_i8llqe3	/r/Bitcoin/comments/upa21w/daily_discussion_may_14_2022/i8wnhn8/	1652759382	1	True	True	False	Bitcoin	t5_2s3qj	r/Bitcoin	public		0	[]													
37	[]	False		Smp208f			[]				text	t2_airfs	False	False	"I’ll happily hear out the criticism of well-informed people and consider their take, but as anyone says stuff like this it’s clear they haven’t actually looked into things. They’re either listening to what other people tell them or dismissed it without giving it any thought.

Gold isn’t used for crowns or filling cavities anymore. Why? It’s too expensive because people speculate on it and it’s seen as a store of value. It does have uses, but they are few and employed sparingly, because of the cost.

There are plenty of recent examples out there showing why using BTC or most cryptocurrencies for ransomware is a bad idea. Governments can and do trace movements of the ransom and seize it."	a4452be363725f1751b74c81800c9199d68dd19c	True	False					0	1652759314		0	{}	i8wnemc	False	t3_uqyp56	False	True	t1_i8u38e6	/r/Bitcoin/comments/uqyp56/bitcoin_wont_become_an_alternative_form_of_money/i8wnemc/	1652759330	1	True	True	False	Bitcoin	t5_2s3qj	r/Bitcoin	public		0	[]													
38	[]	False		pcvcolin			[]				text	t2_6esft	False	True	"&gt;This only matters if you’re foolish enough to leave your crypto on an exchange

\- on an exchange named Coinbase, or any exchange that does not utilize Wyoming or Wyoming-similar law and licensing.  That's the caveat.  

You have two solutions.

1.  Remove your digital assets from the exchange, place them on your hardware wallet (**and, I would argue - stop supporting and close your accounts at any exchange that operates in a manner where its jurisdictional and licensing pathway it has chosen does not honor your desire to legally own your digital assets at all moments regardless of form of custody**).  This is a fancy way of saying ""don't just move away from traditional banks, stop supporting exchanges that don't recognize your ownership of digital assets at all moments in time - stop supporting exchanges that try to claim that your bitcoin is theirs.""
2. **Find another exchange to do business at that does recognize that your assets are yours.**  Again, right now, that would be one that is operating under Wyoming or Wyoming-similar law, which right now means that Kraken is the only crypto exchange operating that is doing that (and if I understand correctly the scope of these laws extend to U.S. persons, which means that people in other countries that don't have laws that recognize or protect ownership, that they have a lot to work on).  That doesn't mean you have to leave your bitcoin on the exchange, it just means that in the timeframe you need it to be there (whether it's for a few hours, or days or whatever your strategy requires) that it will in fact be understood to be yours.  Finally as to the question of decentralized exchanges (and why not just use those), I think there is only truly one that actually meets the definition of a truly decentralized exchange, and it is [bisq](https://bisq.network/), though like all exchanges, you'll still hit roadbumps periodically when using [the payment methods](https://bisq.wiki/Payment_methods) and limitations on what you can do with how much you can order / trade there. 

In countries outside of the U.S., for example in the E.U., where there were controversial discussions and votes in March of 2022 regarding (amongst other things) requirements to disclose transfers to unhosted wallets, I'm not sure what to say except it's pretty obvious that E.U. doesn't seem to have any desire to protect ownership of assets.  In that case those in the E.U. may need to migrate fully to multisignature and smart contract solutions and begin a process of moving to redundant space (low earth orbit) backups (some of these services already exist to protect client assets).  As countries get more hostile and desperate such space-oriented redundant services will become necessary as a legal aspect of protection of one's lifetime savings."	f043e5b7ea762933f5e921b6625c018731a89426	True	False					0	1652759295		0	{}	i8wndg7	True	t3_uqzm2h	False	True	t1_i8w09tn	/r/Bitcoin/comments/uqzm2h/wyoming_1st_place_in_world_to_recognize_digital/i8wndg7/	1652759310	1	True	True	False	Bitcoin	t5_2s3qj	r/Bitcoin	public		0	[]													
39	[]	False		BitcoinUser263895			[]				text	t2_23xzh5p7	False	True	"A hardware ""wallet"" is a key secure storage device. It holds keys and signs transactions.

The mnemonic seed phrase generates ""Hierarchical Deterministic"" keys. Sets of public(addresses)/private keys all linked to that single phrase.

Your Bitcoin is on the blockchain. Private keys give you access to move it.

The hardware wallet simply facilitates making transactions in a safe manner with relative ease of single-button-push to confirm."	14cf028f73b13a66cdf74e5508a47910aea47972	True	False					0	1652759270		0	{}	i8wnbvu	False	t3_upp3q2	False	True	t1_i8wi4lf	/r/Bitcoin/comments/upp3q2/been_buying_bitcoin_every_month_since_october/i8wnbvu/	1652759280	1	True	True	False	Bitcoin	t5_2s3qj	r/Bitcoin	public		0	[]													
40	[]	False		litetrading			[]				text	t2_j1mchz1t	False	False	Hardware wallets are the best for storing BTC like that.	5c451ed9ef528d7a9d0bffed79f01e070e83a389	True	False					0	1652759266		0	{}	i8wnbp7	False	t3_upp3q2	False	True	t1_i8m7rjo	/r/Bitcoin/comments/upp3q2/been_buying_bitcoin_every_month_since_october/i8wnbp7/	1652759280	1	True	True	False	Bitcoin	t5_2s3qj	r/Bitcoin	public		0	[]													
41	[]	False		BankMack			[]				text	t2_djbbx58y	False	False	"I STILL have friends telling me they regret not listening when I told them to buy Bitcoin at $100. 

And they STILL haven’t bought any. You just can’t help some people."	60f243419ebf168a1bd02825df44818d37cd51ed	True	False					0	1652759259		0	{}	i8wnb9r	False	t3_upp3q2	False	True	t3_upp3q2	/r/Bitcoin/comments/upp3q2/been_buying_bitcoin_every_month_since_october/i8wnb9r/	1652759273	1	True	True	False	Bitcoin	t5_2s3qj	r/Bitcoin	public		0	[]													
42	[]	False		ndgoLiberty			[]				text	t2_k11mk82	False	False	=(1/how good women are at cooking)	59eb142ddd7a6a5f831602b08810ef24b1811473	True	False					0	1652759229		0	{}	i8wn9h1	False	t3_urdfrk	False	True	t3_urdfrk	/r/Bitcoin/comments/urdfrk/usa_left_the_gold_standard_1970s_fiat_currency_is/i8wn9h1/	1652759245	1	True	True	False	Bitcoin	t5_2s3qj	r/Bitcoin	public		0	[]													
43	[]	False		artnaqent			[]				text	t2_iofu0br0	False	False	True that, we won't gonna get something better than that.	0abe178bfb1140c18c291f55678e6b21ede7f4d0	True	False					0	1652759225		0	{}	i8wn99o	False	t3_upp3q2	False	True	t1_i8matgv	/r/Bitcoin/comments/upp3q2/been_buying_bitcoin_every_month_since_october/i8wn99o/	1652759237	1	True	True	False	Bitcoin	t5_2s3qj	r/Bitcoin	public		0	[]													
44	[]	False		coelacan			[]				text	t2_9bqkf	False	False	Okay — go change your poopy pants	ac7c61b83ec6e40a27ade64edfa13d682cc5e9ef	True	False					0	1652759215		0	{}	i8wn8ne	False	t3_ur31jq	False	True	t1_i8vfhec	/r/Bitcoin/comments/ur31jq/bitcoin_addresses_with_a_balance_over_001_btc_hit/i8wn8ne/	1652759230	1	True	True	False	Bitcoin	t5_2s3qj	r/Bitcoin	public		0	[]													
45	[]	False		cryptkings			[]				text	t2_ed7y4lby	False	False	Dude this is good, people should remember all the points.	55f928d302a81504fce186579f2f66fca0cb4bf5	True	False					0	1652759189		0	{}	i8wn74n	False	t3_upa21w	False	True	t1_i8lgsk8	/r/Bitcoin/comments/upa21w/daily_discussion_may_14_2022/i8wn74n/	1652759203	1	True	True	False	Bitcoin	t5_2s3qj	r/Bitcoin	public		0	[]													
