42	[]	False	radarsfather1		[]		text	t2_ff4wuy19	False	False	False	[]	False	False	1659271773	self.Bitcoin	https://www.reddit.com/r/Bitcoin/comments/wcnyz2/mt_gox_deal_is_set_to_happen_at_the_end_of_august/	{}	wcnyz2	False	True	False	False	False	True	True	False		[]	dark	text	False	False	True	0	0	False	all_ads	/r/Bitcoin/comments/wcnyz2/mt_gox_deal_is_set_to_happen_at_the_end_of_august/	False	6		1659271835	1	"If you don’t know about the MT Gox deal let me give you a very very quick rundown. 
In 2011 someone named MT Gox bought 850k Bitcoin…. Which today is roughly worth 7.2 billion USD.. that was hacked 7 years later and has been locked up until a little bit ago. 
In recent statements multiple times and with posting emails, MT Gox plans to liquidate all of it at the end of August which pretty much everyone who knows about the transaction thinks it will cause the market to go spiraling downward hard. 
AGAIN, he’s releasing 850k Bitcoin back into the market.
My question to you guys is, how far down? How long will the market be down?
Context, this is a totally real thing that is happening, go read all about it. This is not a bear market, bull market thing.. just totally curious what you guys think will happen.."	True	False	False	Bitcoin	t5_2s3qj	4443733	public	self	Mt Gox deal is set to happen at the end of August	0	[]	1.0	https://www.reddit.com/r/Bitcoin/comments/wcnyz2/mt_gox_deal_is_set_to_happen_at_the_end_of_august/	all_ads	6																				"Mt Gox deal is set to happen at the end of August
If you don’t know about the MT Gox deal let me give you a very very quick rundown. 
In 2011 someone named MT Gox bought 850k Bitcoin…. Which today is roughly worth 7.2 billion USD.. that was hacked 7 years later and has been locked up until a little bit ago. 
In recent statements multiple times and with posting emails, MT Gox plans to liquidate all of it at the end of August which pretty much everyone who knows about the transaction thinks it will cause the market to go spiraling downward hard. 
AGAIN, he’s releasing 850k Bitcoin back into the market.
My question to you guys is, how far down? How long will the market be down?
Context, this is a totally real thing that is happening, go read all about it. This is not a bear market, bull market thing.. just totally curious what you guys think will happen.."											
43	[]	False	mccormack555		[]		text	t2_5q7oe	False	False	False	[]	False	False	1659271335	whatbitcoindid.com	https://www.reddit.com/r/Bitcoin/comments/wcnu41/how_bitcoin_reprograms_the_mind_with_dan/	{}	wcnu41	False	True	False	False	False	True	False	False		[]	dark	text	False	False	True	0	0	False	all_ads	/r/Bitcoin/comments/wcnu41/how_bitcoin_reprograms_the_mind_with_dan/	False	6		1659271346	1		True	False	False	Bitcoin	t5_2s3qj	4443706	public	https://b.thumbs.redditmedia.com/qBjISg9y1M76zaBM7fyY-ayNzqwHteIa3ArZdgt6fWc.jpg	How Bitcoin Reprograms the Mind with Dan Weintraub — What Bitcoin Did	0	[]	1.0	https://www.whatbitcoindid.com/podcast/how-bitcoin-reprograms-the-mind	all_ads	6	link	{'enabled': False, 'images': [{'id': 'jxcQVdoE8RgciFK6UsK4bhufelj-KXJgc1G_dtCRmT4', 'resolutions': [{'height': 60, 'url': 'https://external-preview.redd.it/Y4sRtdtyWLuRsiKTBY1_rIwF318FDxRnFVx-RVKXaLs.jpg?width=108&amp;crop=smart&amp;auto=webp&amp;s=8b527dfb473c44645c54521bc8dbeea592d803db', 'width': 108}, {'height': 121, 'url': 'https://external-preview.redd.it/Y4sRtdtyWLuRsiKTBY1_rIwF318FDxRnFVx-RVKXaLs.jpg?width=216&amp;crop=smart&amp;auto=webp&amp;s=a14ad3784b61b56557eb6b8a58b9234457d1b907', 'width': 216}, {'height': 180, 'url': 'https://external-preview.redd.it/Y4sRtdtyWLuRsiKTBY1_rIwF318FDxRnFVx-RVKXaLs.jpg?width=320&amp;crop=smart&amp;auto=webp&amp;s=105d02d7f021621c12e31f85d5d5d370673a8ad6', 'width': 320}, {'height': 360, 'url': 'https://external-preview.redd.it/Y4sRtdtyWLuRsiKTBY1_rIwF318FDxRnFVx-RVKXaLs.jpg?width=640&amp;crop=smart&amp;auto=webp&amp;s=67118e00676e8e268059ca8733fd742e692f1d19', 'width': 640}, {'height': 540, 'url': 'https://external-preview.redd.it/Y4sRtdtyWLuRsiKTBY1_rIwF318FDxRnFVx-RVKXaLs.jpg?width=960&amp;crop=smart&amp;auto=webp&amp;s=919df202776a5ac310c4f18215d8395113656733', 'width': 960}], 'source': {'height': 552, 'url': 'https://external-preview.redd.it/Y4sRtdtyWLuRsiKTBY1_rIwF318FDxRnFVx-RVKXaLs.jpg?auto=webp&amp;s=8e9104dc914bd5024b51eeacaabecfa54b913707', 'width': 980}, 'variants': {}}]}	78.0	140.0	https://www.whatbitcoindid.com/podcast/how-bitcoin-reprograms-the-mind															"How Bitcoin Reprograms the Mind with Dan Weintraub — What Bitcoin Did
"											
44	[]	False	EnceladusJones239		[]		text	t2_gzc5zzh4	False	False	False	[]	False	False	1659270805	self.Bitcoin	https://www.reddit.com/r/Bitcoin/comments/wcnofv/fediments_really_gives_me_a_unique_sense_of_hope/	{}	wcnofv	False	True	False	False	False	True	True	False		[]	dark	text	False	False	False	0	0	False	all_ads	/r/Bitcoin/comments/wcnofv/fediments_really_gives_me_a_unique_sense_of_hope/	False	6		1659270815	1	What do you guys think about it? I think this could be a game changer in a way. Massively helps with onboarding as well.	True	False	False	Bitcoin	t5_2s3qj	4443694	public	self	Fediments really gives me a unique sense of hope for localism and economic activity amongst close family and family - communities for the win.	0	[]	1.0	https://www.reddit.com/r/Bitcoin/comments/wcnofv/fediments_really_gives_me_a_unique_sense_of_hope/	all_ads	6							dark													"Fediments really gives me a unique sense of hope for localism and economic activity amongst close family and family - communities for the win.
What do you guys think about it? I think this could be a game changer in a way. Massively helps with onboarding as well."											
45	[]	False	EverydayCryptoNet		[]		text	t2_dmdh01us	False	False	False	[]	False	False	1659269318	self.Bitcoin	https://www.reddit.com/r/Bitcoin/comments/wcn8pk/best_free_cryptocurrency_telegram_bots/	{}	wcn8pk	False	True	False	False	False	True	True	False		[]	dark	text	False	False	True	0	0	False	all_ads	/r/Bitcoin/comments/wcn8pk/best_free_cryptocurrency_telegram_bots/	False	6		1659269328	1	"[http://everydaycrypto.net/2022/01/08/best-free-cryptocurrency-bots-en-iyi-ucretsiz-kripto-botlari/](http://everydaycrypto.net/2022/01/08/best-free-cryptocurrency-bots-en-iyi-ucretsiz-kripto-botlari/)

I suggest **3, 4, 31, 36, 41**"	True	False	False	Bitcoin	t5_2s3qj	4443636	public	self	Best Free Cryptocurrency Telegram Bots	0	[]	1.0	https://www.reddit.com/r/Bitcoin/comments/wcn8pk/best_free_cryptocurrency_telegram_bots/	all_ads	6							dark													"Best Free Cryptocurrency Telegram Bots
[http://everydaycrypto.net/2022/01/08/best-free-cryptocurrency-bots-en-iyi-ucretsiz-kripto-botlari/](http://everydaycrypto.net/2022/01/08/best-free-cryptocurrency-bots-en-iyi-ucretsiz-kripto-botlari/)

I suggest **3, 4, 31, 36, 41**"											
46	[]	False	Investon001		[]		text	t2_qeg57bpn	False	False	False	[]	False	False	1659269307	self.Bitcoin	https://www.reddit.com/r/Bitcoin/comments/wcn8l8/recover_all_your_lost_crypto_how/	{}	wcn8l8	False	False	False	False	False	False	True	False		[]	dark	text	False	False	True	0	0	False	all_ads	/r/Bitcoin/comments/wcn8l8/recover_all_your_lost_crypto_how/	False	6	reddit	1659269317	1	[removed]	True	False	False	Bitcoin	t5_2s3qj	4443634	public	self	Recover all your lost crypto! How?	0	[]	1.0	https://www.reddit.com/r/Bitcoin/comments/wcn8l8/recover_all_your_lost_crypto_how/	all_ads	6																				"Recover all your lost crypto! How?
[removed]"											
47	[]	False	redlunaarmy		[]		text	t2_qdz9i08n	False	False	False	[]	False	False	1659311016	i.redd.it	https://www.reddit.com/r/Bitcoin/comments/wd2gfa/redluna_is_the_next_1000x_bsc_project_of_the_year/	{}	wd2gfa	False	False	False	False	True	False	False	False		[]	dark	text	False	False	True	0	0	False	all_ads	/r/Bitcoin/comments/wd2gfa/redluna_is_the_next_1000x_bsc_project_of_the_year/	False	6	reddit	1659311027	1		True	False	False	Bitcoin	t5_2s3qj	4445035	public	https://a.thumbs.redditmedia.com/oQBXStV2KZmDuTnhwiQpZVyth00OI29xWJwDq2bT0r0.jpg	Redluna is the next 1000x BSC project of the year ❤️❤️❤️ Redluna is listed on #coinmarketcap and #coingecko	0	[]	1.0	https://i.redd.it/5ulna6s1qze91.jpg	all_ads	6	image	{'enabled': True, 'images': [{'id': 'JD0Ba-f08UBCijmZY13qRmClyh8Tq_h7pC3IlegDo3Q', 'resolutions': [{'height': 60, 'url': 'https://preview.redd.it/5ulna6s1qze91.jpg?width=108&amp;crop=smart&amp;auto=webp&amp;s=2705267fc1237ddc1e08e7543f7a17bdf5f4317b', 'width': 108}, {'height': 120, 'url': 'https://preview.redd.it/5ulna6s1qze91.jpg?width=216&amp;crop=smart&amp;auto=webp&amp;s=bb0bb867e6e20f7a7d3a1a4c147e184ed877feef', 'width': 216}, {'height': 178, 'url': 'https://preview.redd.it/5ulna6s1qze91.jpg?width=320&amp;crop=smart&amp;auto=webp&amp;s=a598c57d9447c77a7c1b0a4eed6ae5466813c2b8', 'width': 320}, {'height': 357, 'url': 'https://preview.redd.it/5ulna6s1qze91.jpg?width=640&amp;crop=smart&amp;auto=webp&amp;s=63e5cdeddcf4ef75742eb5f02087c80469a65691', 'width': 640}, {'height': 536, 'url': 'https://preview.redd.it/5ulna6s1qze91.jpg?width=960&amp;crop=smart&amp;auto=webp&amp;s=787b2a099448975acfd92466cbeff23b6d9a9fcb', 'width': 960}, {'height': 603, 'url': 'https://preview.redd.it/5ulna6s1qze91.jpg?width=1080&amp;crop=smart&amp;auto=webp&amp;s=c072ba1db1038edfd2be0ce6e32c5308e4971267', 'width': 1080}], 'source': {'height': 715, 'url': 'https://preview.redd.it/5ulna6s1qze91.jpg?auto=webp&amp;s=b62f6dd9e41433fe681e2f4c1e0859143b934e31', 'width': 1280}, 'variants': {}}]}	78.0	140.0	https://i.redd.it/5ulna6s1qze91.jpg															"Redluna is the next 1000x BSC project of the year ❤️❤️❤️ Redluna is listed on #coinmarketcap and #coingecko
"											
48	[]	False	Darken-kun		[]		text	t2_ca04x21f	False	False	True	[]	False	False	1659310679	self.Bitcoin	https://www.reddit.com/r/Bitcoin/comments/wd2c5i/my_personal_experience_with_bitcoin_versus_a/	{}	wd2c5i	False	True	False	False	False	True	True	False		[]	dark	text	False	False	True	0	0	False	all_ads	/r/Bitcoin/comments/wd2c5i/my_personal_experience_with_bitcoin_versus_a/	False	6		1659310689	1	"A little fun fact about the experience I had with Bitcoin and that unfamous hardfork.

A few weeks ago, some user donated me a small amount of the copycat coin to try and convince me that it's faster and more scalable. It took 15 minutes to receive it.

In the other hand, today I made a peer-2-peer BTC purchase opting for the slowest transaction fee possible (1 sat/vByte). I received it in 4 minutes."	True	False	False	Bitcoin	t5_2s3qj	4445027	public	self	My personal experience with Bitcoin versus a copycat.	0	[]	1.0	https://www.reddit.com/r/Bitcoin/comments/wd2c5i/my_personal_experience_with_bitcoin_versus_a/	all_ads	6																				"My personal experience with Bitcoin versus a copycat.
A little fun fact about the experience I had with Bitcoin and that unfamous hardfork.

A few weeks ago, some user donated me a small amount of the copycat coin to try and convince me that it's faster and more scalable. It took 15 minutes to receive it.

In the other hand, today I made a peer-2-peer BTC purchase opting for the slowest transaction fee possible (1 sat/vByte). I received it in 4 minutes."											
49	[]	False	jeremyvr46		[]		text	t2_77ylegs7	False	False	False	[]	False	False	1659310426	self.Bitcoin	https://www.reddit.com/r/Bitcoin/comments/wd2914/dca_taxes_nightmare/	{}	wd2914	False	True	False	False	False	True	True	False		[]	dark	text	False	False	False	0	0	False	all_ads	/r/Bitcoin/comments/wd2914/dca_taxes_nightmare/	False	6		1659310436	1	"Hi guys, 
After finally getting into BTC today and setting up a daily DCA on Strike, a couple people commented in my other post about the massive headache it would generate should I ever sell with a gain. (We’re talking MAYBE and YEARS from now if all goes according to plan). 
I tried to read as much as possible on this topic today (my wife is wondering why I’m so much on my phone today haha!) and am thinking that if I keep a spreadsheet with every transactions details on it, as provided by Strike in each transaction emails, it should make filing taxes rather smooth. 
What is your take on it? Any DCA suggestion? I really like the daily buy but if it turns out being a nightmare someday, then I’d rather change it to weekly. 
Cheers fellow BitCoiners! *insert non existing BitCoin emoji*"	True	False	False	Bitcoin	t5_2s3qj	4445016	public	self	DCA + Taxes = Nightmare?	0	[]	1.0	https://www.reddit.com/r/Bitcoin/comments/wd2914/dca_taxes_nightmare/	all_ads	6																				"DCA + Taxes = Nightmare?
Hi guys, 
After finally getting into BTC today and setting up a daily DCA on Strike, a couple people commented in my other post about the massive headache it would generate should I ever sell with a gain. (We’re talking MAYBE and YEARS from now if all goes according to plan). 
I tried to read as much as possible on this topic today (my wife is wondering why I’m so much on my phone today haha!) and am thinking that if I keep a spreadsheet with every transactions details on it, as provided by Strike in each transaction emails, it should make filing taxes rather smooth. 
What is your take on it? Any DCA suggestion? I really like the daily buy but if it turns out being a nightmare someday, then I’d rather change it to weekly. 
Cheers fellow BitCoiners! *insert non existing BitCoin emoji*"											
50	[]	False	prison-break-rick		[]		text	t2_15afzgy5	False	False	False	[]	False	False	1659309791	reddit.com	https://www.reddit.com/r/Bitcoin/comments/wd2107/is_this_a_scam/	{}	wd2107	False	False	False	False	False	False	False	False		[]	dark	text	False	False	True	1	0	False	all_ads	/r/Bitcoin/comments/wd2107/is_this_a_scam/	False	6	moderator	1659309802	1		True	False	False	Bitcoin	t5_2s3qj	4444993	public	https://b.thumbs.redditmedia.com/PE6JPNFTht6G212wF6y_d3z6Zz04oqdrl8Se6sRkMmg.jpg	is this a scam?	0	[]	1.0	https://www.reddit.com/gallery/wd2107	all_ads	6			138.0	140.0	https://www.reddit.com/gallery/wd2107											True				"is this a scam?
"											
51	[]	False	Clay_PalmData		[]		text	t2_of9yhi1d	False	False	False	[]	False	False	1659309424	self.Bitcoin	https://www.reddit.com/r/Bitcoin/comments/wd1wa9/asic_mining_hardware_for_sale_731/	{}	wd1wa9	False	False	False	False	False	False	True	False		[]	dark	text	False	False	True	0	0	False	all_ads	/r/Bitcoin/comments/wd1wa9/asic_mining_hardware_for_sale_731/	False	6	moderator	1659309434	1	[removed]	True	False	False	Bitcoin	t5_2s3qj	4444994	public	https://b.thumbs.redditmedia.com/l_eVjy5xCfrsscGGpYNYHFxUegMb2w8DoN4eIt0MhVw.jpg	Asic Mining Hardware For Sale 7/31	0	[]	1.0	https://www.reddit.com/r/Bitcoin/comments/wd1wa9/asic_mining_hardware_for_sale_731/	all_ads	6			140.0	140.0																"Asic Mining Hardware For Sale 7/31
[removed]"											
52	[]	False	mundo-inaudito24	noob	[{'e': 'text', 't': 'redditor for 4 weeks'}]	redditor for 4 weeks	richtext	t2_pi416vr8	False	False	False	[]	False	False	1659309028	binance.com	https://www.reddit.com/r/Bitcoin/comments/wd1r8c/hola_si_te_unes_a_binance_usando_mi_enlace_de/	{}	wd1r8c	False	True	False	False	False	True	False	False		[]	dark	text	False	False	True	0	0	False	all_ads	/r/Bitcoin/comments/wd1r8c/hola_si_te_unes_a_binance_usando_mi_enlace_de/	False	6		1659309039	1		False	False	False	Bitcoin	t5_2s3qj	4444977	public	https://a.thumbs.redditmedia.com/tMJfGsxu2-73iguYwfJrBYSrZIDA_WWmXzhQD-I2lm4.jpg	¡Hola! Si te unes a Binance usando mi enlace de recomendación, puedes desbloquear cajas misteriosas por un valor de hasta 500 $ cada una.	0	[]	1.0	https://www.binance.com/es/activity/referral-entry/JLMBX?fromActivityPage=true&amp;ref=LIMIT_JLM58ZIY&amp;utm_campaign=web_share_link&amp;utm_source=reddit	all_ads	6	link	{'enabled': False, 'images': [{'id': 'UT5WNvYa1EgwShuuoNuQNCScMpz0K800Ri8Yez_etQY', 'resolutions': [{'height': 60, 'url': 'https://external-preview.redd.it/OTmJ0ZZqEEEOonEzrmN0fkX-K2VLOU4CHdjilYd8TTg.jpg?width=108&amp;crop=smart&amp;auto=webp&amp;s=14de091d1bf6171e4c442da94fd53fee2d689f83', 'width': 108}, {'height': 121, 'url': 'https://external-preview.redd.it/OTmJ0ZZqEEEOonEzrmN0fkX-K2VLOU4CHdjilYd8TTg.jpg?width=216&amp;crop=smart&amp;auto=webp&amp;s=e222b1d6ea87264f692f509ec64942c2d0ee5bcf', 'width': 216}, {'height': 180, 'url': 'https://external-preview.redd.it/OTmJ0ZZqEEEOonEzrmN0fkX-K2VLOU4CHdjilYd8TTg.jpg?width=320&amp;crop=smart&amp;auto=webp&amp;s=1d213a58dcca5e8406683bfd936418a3ed64dc1b', 'width': 320}, {'height': 360, 'url': 'https://external-preview.redd.it/OTmJ0ZZqEEEOonEzrmN0fkX-K2VLOU4CHdjilYd8TTg.jpg?width=640&amp;crop=smart&amp;auto=webp&amp;s=e6ab0ff3ac2a49eebbac3ec2faad4b2b592aa0ba', 'width': 640}, {'height': 540, 'url': 'https://external-preview.redd.it/OTmJ0ZZqEEEOonEzrmN0fkX-K2VLOU4CHdjilYd8TTg.jpg?width=960&amp;crop=smart&amp;auto=webp&amp;s=68ace4e1896f809ad74f54ceffafa2e46a3c1ed5', 'width': 960}, {'height': 607, 'url': 'https://external-preview.redd.it/OTmJ0ZZqEEEOonEzrmN0fkX-K2VLOU4CHdjilYd8TTg.jpg?width=1080&amp;crop=smart&amp;auto=webp&amp;s=085e0bfa9af1796a20c91957409c7884139441c1', 'width': 1080}], 'source': {'height': 900, 'url': 'https://external-preview.redd.it/OTmJ0ZZqEEEOonEzrmN0fkX-K2VLOU4CHdjilYd8TTg.jpg?auto=webp&amp;s=4da5b9e0f534724fceb1115a9746c4b242c5aeb0', 'width': 1600}, 'variants': {}}]}	78.0	140.0	https://www.binance.com/es/activity/referral-entry/JLMBX?fromActivityPage=true&amp;ref=LIMIT_JLM58ZIY&amp;utm_campaign=web_share_link&amp;utm_source=reddit		dark	2ec8e69e-6c36-11e9-a04b-0afb553d4ea6												"¡Hola! Si te unes a Binance usando mi enlace de recomendación, puedes desbloquear cajas misteriosas por un valor de hasta 500 $ cada una.
"											
53	[]	False	Kennedy2345		[]		text	t2_lqiuxpid	False	False	False	[]	False	False	1659308993	self.Bitcoin	https://www.reddit.com/r/Bitcoin/comments/wd1qqo/bingx_crypto_social_trading_network/	{}	wd1qqo	False	False	False	False	False	False	True	False		[]	dark	text	False	False	True	0	0	False	all_ads	/r/Bitcoin/comments/wd1qqo/bingx_crypto_social_trading_network/	False	6	reddit	1659309003	1	[removed]	True	False	False	Bitcoin	t5_2s3qj	4444974	public	self	BingX Crypto Social Trading Network	0	[]	1.0	https://www.reddit.com/r/Bitcoin/comments/wd1qqo/bingx_crypto_social_trading_network/	all_ads	6																				"BingX Crypto Social Trading Network
[removed]"											
54	[]	False	Spacialjumper	noob	[{'e': 'text', 't': 'redditor for 1 week'}]	redditor for 1 week	richtext	t2_kppixus9	False	False	False	[]	False	False	1659308983	self.Bitcoin	https://www.reddit.com/r/Bitcoin/comments/wd1qmj/strike_withdraw/	{}	wd1qmj	False	True	False	False	False	True	True	False		[]	dark	text	False	False	True	0	0	False	all_ads	/r/Bitcoin/comments/wd1qmj/strike_withdraw/	False	6		1659308994	1	Deposited 50 USD through bank transfer on strike a few days ago but still don’t see the withdraw even pending on my account. How long does this usually take?	True	False	False	Bitcoin	t5_2s3qj	4444974	public	self	Strike withdraw	0	[]	1.0	https://www.reddit.com/r/Bitcoin/comments/wd1qmj/strike_withdraw/	all_ads	6							dark	2ec8e69e-6c36-11e9-a04b-0afb553d4ea6												"Strike withdraw
Deposited 50 USD through bank transfer on strike a few days ago but still don’t see the withdraw even pending on my account. How long does this usually take?"											
55	[]	False	solaropposites93		[]		text	t2_6a3b5t7t	False	False	False	[]	False	False	1659308678	self.Bitcoin	https://www.reddit.com/r/Bitcoin/comments/wd1mkn/bitcoin_wallet/	{}	wd1mkn	False	True	False	False	False	True	True	False		[]	dark	text	False	False	True	0	0	False	all_ads	/r/Bitcoin/comments/wd1mkn/bitcoin_wallet/	False	6		1659308689	1	How secure is Coinomi as a bitcoin wallet on the Apple AppStore?	True	False	False	Bitcoin	t5_2s3qj	4444965	public	self	Bitcoin wallet	0	[]	1.0	https://www.reddit.com/r/Bitcoin/comments/wd1mkn/bitcoin_wallet/	all_ads	6																				"Bitcoin wallet
How secure is Coinomi as a bitcoin wallet on the Apple AppStore?"											
56	[]	False	btc-congratulatr-guy	noob	[{'e': 'text', 't': 'redditor for 1 week'}]	redditor for 1 week	richtext	t2_qdfev6hi	False	False	False	[]	False	False	1659308439	self.Bitcoin	https://www.reddit.com/r/Bitcoin/comments/wd1jcd/hey_new_full_coiners_congratulations/	{}	wd1jcd	False	True	False	False	False	True	True	False		[]	dark	text	False	False	True	0	0	False	all_ads	/r/Bitcoin/comments/wd1jcd/hey_new_full_coiners_congratulations/	False	6		1659308449	1	Tall you new owners of a full Bitcoin, I just want to acknowledge you and offer my sincere congrats.  You know who you are. You know that ID'ing yourself as a whole coiner is bad opsec. Yet, its human nature to crave some kind of pat on the back for being so damn clever.  So here it is.  CONGRATS!  YOU DID IT!!	True	False	False	Bitcoin	t5_2s3qj	4444960	public	self	Hey, new Full Coiners: Congratulations!	0	[]	1.0	https://www.reddit.com/r/Bitcoin/comments/wd1jcd/hey_new_full_coiners_congratulations/	all_ads	6							dark	2ec8e69e-6c36-11e9-a04b-0afb553d4ea6												"Hey, new Full Coiners: Congratulations!
Tall you new owners of a full Bitcoin, I just want to acknowledge you and offer my sincere congrats.  You know who you are. You know that ID'ing yourself as a whole coiner is bad opsec. Yet, its human nature to crave some kind of pat on the back for being so damn clever.  So here it is.  CONGRATS!  YOU DID IT!!"											
57	[]	False	_BitBull_	noob	[{'e': 'text', 't': 'redditor for 3 months'}]	redditor for 3 months	richtext	t2_mrmgqpp0	False	False	False	[]	False	False	1659308213	twitter.com	https://www.reddit.com/r/Bitcoin/comments/wd1g8a/bitull_on_twitter/	{}	wd1g8a	False	True	False	False	False	True	False	False		[]	dark	text	False	False	True	0	0	False	all_ads	/r/Bitcoin/comments/wd1g8a/bitull_on_twitter/	False	6		1659308224	1		False	False	False	Bitcoin	t5_2s3qj	4444955	public	https://b.thumbs.redditmedia.com/eICaPVlgWBhMJVYekR5ge8IMpo0DWzwH7Q5SEmxrF_M.jpg	Bit₿ull📈 on Twitter	0	[]	1.0	https://twitter.com/fp0618/status/1553860925966503937?s=21&amp;t=cmf3wSLhhCNtQEnKEbefBA	all_ads	6	link	{'enabled': False, 'images': [{'id': 'dOHuNrY-GlLYjFtRop_n_uZHcmwsot3vO2grHjjP724', 'resolutions': [{'height': 65, 'url': 'https://external-preview.redd.it/wg7RlHl5X2W00soCWaeKu1G4wFmiTL7wRak9Mxi2dB8.jpg?width=108&amp;crop=smart&amp;auto=webp&amp;s=ec059195b024b2db204cfa87a36f8ec02c2820f3', 'width': 108}], 'source': {'height': 85, 'url': 'https://external-preview.redd.it/wg7RlHl5X2W00soCWaeKu1G4wFmiTL7wRak9Mxi2dB8.jpg?auto=webp&amp;s=6a9caa571a39e70c188df1eafb53a8409f826448', 'width': 140}, 'variants': {}}]}	85.0	140.0	https://twitter.com/fp0618/status/1553860925966503937?s=21&amp;t=cmf3wSLhhCNtQEnKEbefBA		dark	2ec8e69e-6c36-11e9-a04b-0afb553d4ea6			"{'oembed': {'author_name': 'Bit₿ull📈', 'author_url': 'https://twitter.com/FP0618', 'cache_age': 3153600000, 'height': None, 'html': '&lt;blockquote class=""twitter-video""&gt;&lt;p lang=""und"" dir=""ltr""&gt;618 run &lt;a href=""https://twitter.com/hashtag/BITCOIN?src=hash&amp;amp;ref_src=twsrc%5Etfw""&gt;#BITCOIN&lt;/a&gt; &lt;a href=""https://t.co/2DX3UKL6wV""&gt;pic.twitter.com/2DX3UKL6wV&lt;/a&gt;&lt;/p&gt;&amp;mdash; Bit₿ull📈 (@FP0618) &lt;a href=""https://twitter.com/FP0618/status/1553860925966503937?ref_src=twsrc%5Etfw""&gt;July 31, 2022&lt;/a&gt;&lt;/blockquote&gt;\n&lt;script async src=""https://platform.twitter.com/widgets.js"" charset=""utf-8""&gt;&lt;/script&gt;\n', 'provider_name': 'Twitter', 'provider_url': 'https://twitter.com', 'type': 'rich', 'url': 'https://twitter.com/FP0618/status/1553860925966503937', 'version': '1.0', 'width': 350}, 'type': 'twitter.com'}"	"{'content': '&lt;blockquote class=""twitter-video""&gt;&lt;p lang=""und"" dir=""ltr""&gt;618 run &lt;a href=""https://twitter.com/hashtag/BITCOIN?src=hash&amp;amp;ref_src=twsrc%5Etfw""&gt;#BITCOIN&lt;/a&gt; &lt;a href=""https://t.co/2DX3UKL6wV""&gt;pic.twitter.com/2DX3UKL6wV&lt;/a&gt;&lt;/p&gt;&amp;mdash; Bit₿ull📈 (@FP0618) &lt;a href=""https://twitter.com/FP0618/status/1553860925966503937?ref_src=twsrc%5Etfw""&gt;July 31, 2022&lt;/a&gt;&lt;/blockquote&gt;\n&lt;script async src=""https://platform.twitter.com/widgets.js"" charset=""utf-8""&gt;&lt;/script&gt;\n', 'height': 200, 'scrolling': False, 'width': 350}"	"{'oembed': {'author_name': 'Bit₿ull📈', 'author_url': 'https://twitter.com/FP0618', 'cache_age': 3153600000, 'height': None, 'html': '&lt;blockquote class=""twitter-video""&gt;&lt;p lang=""und"" dir=""ltr""&gt;618 run &lt;a href=""https://twitter.com/hashtag/BITCOIN?src=hash&amp;amp;ref_src=twsrc%5Etfw""&gt;#BITCOIN&lt;/a&gt; &lt;a href=""https://t.co/2DX3UKL6wV""&gt;pic.twitter.com/2DX3UKL6wV&lt;/a&gt;&lt;/p&gt;&amp;mdash; Bit₿ull📈 (@FP0618) &lt;a href=""https://twitter.com/FP0618/status/1553860925966503937?ref_src=twsrc%5Etfw""&gt;July 31, 2022&lt;/a&gt;&lt;/blockquote&gt;\n&lt;script async src=""https://platform.twitter.com/widgets.js"" charset=""utf-8""&gt;&lt;/script&gt;\n', 'provider_name': 'Twitter', 'provider_url': 'https://twitter.com', 'type': 'rich', 'url': 'https://twitter.com/FP0618/status/1553860925966503937', 'version': '1.0', 'width': 350}, 'type': 'twitter.com'}"	"{'content': '&lt;blockquote class=""twitter-video""&gt;&lt;p lang=""und"" dir=""ltr""&gt;618 run &lt;a href=""https://twitter.com/hashtag/BITCOIN?src=hash&amp;amp;ref_src=twsrc%5Etfw""&gt;#BITCOIN&lt;/a&gt; &lt;a href=""https://t.co/2DX3UKL6wV""&gt;pic.twitter.com/2DX3UKL6wV&lt;/a&gt;&lt;/p&gt;&amp;mdash; Bit₿ull📈 (@FP0618) &lt;a href=""https://twitter.com/FP0618/status/1553860925966503937?ref_src=twsrc%5Etfw""&gt;July 31, 2022&lt;/a&gt;&lt;/blockquote&gt;\n&lt;script async src=""https://platform.twitter.com/widgets.js"" charset=""utf-8""&gt;&lt;/script&gt;\n', 'height': 200, 'media_domain_url': 'https://www.redditmedia.com/mediaembed/wd1g8a', 'scrolling': False, 'width': 350}"						"Bit₿ull📈 on Twitter
"											
