Unnamed: 0	all_awardings	archived	associated_award	author	author_flair_background_color	author_flair_css_class	author_flair_richtext	author_flair_template_id	author_flair_text	author_flair_text_color	author_flair_type	author_fullname	author_patreon_flair	author_premium	body	body_sha1	can_gild	collapsed	collapsed_because_crowd_control	collapsed_reason	collapsed_reason_code	comment_type	controversiality	created_utc	distinguished	gilded	gildings	id	is_submitter	link_id	locked	no_follow	parent_id	permalink	retrieved_utc	score	score_hidden	send_replies	stickied	subreddit	subreddit_id	subreddit_name_prefixed	subreddit_type	top_awarded_type	total_awards_received	treatment_tags	unrepliable_reason	author_cakeday	corpus	support	knowledge	conflict	power	similarity	fun	status	trust	identity	romance
0	[]	False		mpem___			[]				text	t2_71xpr16u	False	False	"I have big ""borrow"" button on main screen"	b4f4428ee74d939a0bce9be67ac6be43dc5f30e1	True	False					0	1656921588		0	{}	iesmjzu	False	t3_vr1n4v	False	True	t1_iesmbcn	/r/Bitcoin/comments/vr1n4v/crypto_lending/iesmjzu/	1656921605	1	True	True	False	Bitcoin	t5_2s3qj	r/Bitcoin	public		0	[]													
1	[]	False		danieleinad86			[]				text	t2_51x67	False	False	Thats Bitcoin!	b77d109e10f6ce4f7f22fb944b694171b0115743	True	False					0	1656921579		0	{}	iesmjld	False	t3_vqg7p7	False	True	t1_iep3vwu	/r/Bitcoin/comments/vqg7p7/us_presidents_and_the_federal_reserve/iesmjld/	1656921591	1	True	True	False	Bitcoin	t5_2s3qj	r/Bitcoin	public		0	[]													
2	[]	False		SourerDiesel			[]				text	t2_axkiq	False	False	"&gt; that time range is meaningless toward proving the point you are trying to make.

I'm not making a point.  I'm stating a fact (there's an accelerating trend of wallets holding &gt;= 1 BTC) and making an inference (people see the the crash as an opportunity to join 21M club).  The inference may or may not be correct, but the fact is a fact.

&gt; you would have to look back far to conclude such a thing.

Incidentally, [that same graph on a longer time scale](https://i.imgur.com/wua9hAn.png) appears as an even more extreme trend extending back to February, not less.

Some of you people got to learn the difference between cherry picking data and not cherry picking.  Not everything is cherry picked.  My inference is very much up for debate.  The trend is not."	7702733c30e6be729bdd51728a13f184f8e7c76b	True	False					0	1656921548		0	{}	iesmibh	True	t3_vr0pxl	False	True	t1_iesicad	/r/Bitcoin/comments/vr0pxl/accelerated_trend_in_addresses_holding_greater/iesmibh/	1656921564	1	True	True	False	Bitcoin	t5_2s3qj	r/Bitcoin	public		0	[]													
3	[]	False		Bitbuyer313			[]			dark	text	t2_4cd7lcfh	False	False	Hindsight is 20/20 but I tell people to never invest more into btc than you're willing to sit on for several years, and it's only a loss if you sell at a loss. BTC is a long term investment, if you can manage to sit out this bear market you'll get back into the green eventually. This is my 3rd bear market I've been through, the price drops don't phase me anymore and I'm still buying BTC on a weekly basis while it's cheap. Wish I could tell you how long this bear market will last but it's anybody's guess	fb516bd4f3bb3a23a8b87edfe642ca84ab381b80	True	False					0	1656921506		0	{}	iesmgi1	False	t3_vr20r1	False	True	t1_iesm2po	/r/Bitcoin/comments/vr20r1/stay_safe_guys/iesmgi1/	1656921523	1	True	True	False	Bitcoin	t5_2s3qj	r/Bitcoin	public		0	[]													
4	[]	False		Argyrus777			[]				text	t2_5dkaa6j4	False	False	☕️	ab23801d4ce770f75618e4dddc73161a6a310d7f	True	False					0	1656921418		0	{}	iesmct0	False	t3_vqzqpv	False	True	t3_vqzqpv	/r/Bitcoin/comments/vqzqpv/daily_discussion_july_04_2022/iesmct0/	1656921434	1	True	True	False	Bitcoin	t5_2s3qj	r/Bitcoin	public		0	[]													
5	[]	False		Friendly-Mountain535			[]				text	t2_8zg127af	False	False	Im looking into them right now.. can’t find yet how to borrow on their app. I hope they buy Celsius. I have 0.76 BTC stuck on that platform	e69cc8f4d698f3c96c727cad3069ae32f5601ba4	True	False					0	1656921383		0	{}	iesmbcn	True	t3_vr1n4v	False	True	t1_iesm6fm	/r/Bitcoin/comments/vr1n4v/crypto_lending/iesmbcn/	1656921400	1	True	True	False	Bitcoin	t5_2s3qj	r/Bitcoin	public		0	[]													
6	[]	False		GoElastic			[]				text	t2_7j15vjgp	False	False	Ok, I will add some prayers to the hopium mix.	d07065ada02d664ceb15a1fa65143039be4e7531	True	False					0	1656921355		0	{}	iesma4k	False	t3_vqzqpv	False	True	t1_iesls40	/r/Bitcoin/comments/vqzqpv/daily_discussion_july_04_2022/iesma4k/	1656921372	1	True	True	False	Bitcoin	t5_2s3qj	r/Bitcoin	public		0	[]													
7	[]	False		Ima_Wreckyou			[]				text	t2_11epd9	False	False	"""The money in your account, it didn't do too well. It's gone. Next please!"""	b86f05ed8498bd676a19aa49d42b0dd30926197e	True	False					0	1656921309		0	{}	iesm87n	False	t3_vqdpsm	False	True	t3_vqdpsm	/r/Bitcoin/comments/vqdpsm/not_your_keys_not_your_coins_6_billion_in/iesm87n/	1656921323	1	True	True	False	Bitcoin	t5_2s3qj	r/Bitcoin	public		0	[]													
8	[]	False		dima054			[]				text	t2_4r3ss	False	False	lol wtf is VaULd	8a57e7f1db84c8b685a8e4fc08e2a74d648cbc49	True	False					0	1656921291		0	{}	iesm7gq	False	t3_vqzo51	False	True	t3_vqzo51	/r/Bitcoin/comments/vqzo51/vauld_suspends_withdrawal/iesm7gq/	1656921302	1	True	True	False	Bitcoin	t5_2s3qj	r/Bitcoin	public		0	[]													
9	[]	False		[deleted]						dark					[removed]	fe993932d6dced4c0a879e9aa5d7a6e0fbb467f5	True	False					0	1656921275		0	{}	iesm6rt	False	t3_vquakg	False	True	t1_ierllnu	/r/Bitcoin/comments/vquakg/bitcoin_fixes_this/iesm6rt/	1656921289	1	True	True	False	Bitcoin	t5_2s3qj	r/Bitcoin	public		0	[]													
10	[]	False		mpem___			[]				text	t2_71xpr16u	False	False	No they are still ok, but I will not shill them. They came from credissimo - bulgarian company offering hight interest short term loans. basically loan sharks. But with hight collateral their interests are low. They were also saying they will buy all celsius assests I think they know how to manage this.	4b6adaa0ec70f75924183df754e7066aaaf175a0	True	False					0	1656921267		0	{}	iesm6fm	False	t3_vr1n4v	False	True	t1_ieskxre	/r/Bitcoin/comments/vr1n4v/crypto_lending/iesm6fm/	1656921282	1	True	True	False	Bitcoin	t5_2s3qj	r/Bitcoin	public		0	[]													
11	[]	False		diogorilho			[]				text	t2_zhx20	False	False	Btc all 100%	7e5d4938a49761a9039189b1881fbf64f2a2779b	True	False					0	1656921179		0	{}	iesm2po	True	t3_vr20r1	False	True	t1_iesld79	/r/Bitcoin/comments/vr20r1/stay_safe_guys/iesm2po/	1656921192	1	True	True	False	Bitcoin	t5_2s3qj	r/Bitcoin	public		0	[]													
12	[]	False		The_Judicaetor			[]				text	t2_l54frqo	False	False	4th*	bd4423c4c43fc1177b0aab90c9a4e78e5a3557cd	True	False					0	1656921154		0	{}	iesm1n0	False	t3_vqma4t	False	True	t1_ieslvpu	/r/Bitcoin/comments/vqma4t/if_you_bought_most_of_your_bitcoin_in_2021_this/iesm1n0/	1656921170	1	True	True	False	Bitcoin	t5_2s3qj	r/Bitcoin	public		0	[]													
13	[]	False		pxww		noob	[{'e': 'text', 't': 'redditor for 6 weeks'}]	2ec8e69e-6c36-11e9-a04b-0afb553d4ea6	redditor for 6 weeks	dark	richtext	t2_nhlrazya	False	False	Ledger is not really that bad the support is horrible though and sometimes it's laggy which is disappointing	73a375ed6a5e78cdbb03475e40c8234e698e4af4	True	False					0	1656921132		0	{}	iesm0s5	False	t3_vqq3hd	False	True	t3_vqq3hd	/r/Bitcoin/comments/vqq3hd/why_do_people_even_recommend_ledger/iesm0s5/	1656921150	1	True	True	False	Bitcoin	t5_2s3qj	r/Bitcoin	public		0	[]													
14	[]	False		CoinCorner_Sam			[]			dark	text	t2_fospv9k6	False	True	The merchant is accepting Bitcoin over r/thelightningnetwork POS terminal. No fiat involved, pure Bitcoin card.	2c6f3fa2730003134e1a040c7e844d8617e7c6b4	True	False					0	1656921126		0	{}	iesm0j1	True	t3_vpms0d	False	True	t1_iempy42	/r/Bitcoin/comments/vpms0d/bitcoin_is_childs_play/iesm0j1/	1656921142	1	True	True	False	Bitcoin	t5_2s3qj	r/Bitcoin	public		0	[]													
15	[]	False		Unusual_Layer_5751			[]				text	t2_88td7fi2	False	False	If you keep doubling your money at the roulette table on an even chance bet then you are GUARANTEED to make a profit.   GUARANTEED.	2126070ad23381d439058f3101fc4de1120d3302	True	False					0	1656921106		0	{}	ieslzq5	False	t3_vqma4t	False	True	t3_vqma4t	/r/Bitcoin/comments/vqma4t/if_you_bought_most_of_your_bitcoin_in_2021_this/ieslzq5/	1656921120	1	True	True	False	Bitcoin	t5_2s3qj	r/Bitcoin	public		0	[]													
16	[]	False		thefullmcnulty			[]				text	t2_m1hb2	False	False	Memory is fallible. My key storage isn’t. But I will work on memorizing as an ode to cypher-punk ideals.	7820eed3c9c5162a6062732210e7178c9cf339e2	True	False					0	1656921074		0	{}	ieslydj	False	t3_vqqg3m	False	True	t1_iesb8mt	/r/Bitcoin/comments/vqqg3m/finally_did_it/ieslydj/	1656921085	1	True	True	False	Bitcoin	t5_2s3qj	r/Bitcoin	public		0	[]													
17	[]	False		tesseramous			[]				text	t2_dtkwz	False	False	Wasn't it actually better when the coins were more spread out?	5801518f5370b710157e664fcdb2b2e943770118	True	False					0	1656921018		0	{}	ieslvwy	False	t3_vr0pxl	False	True	t3_vr0pxl	/r/Bitcoin/comments/vr0pxl/accelerated_trend_in_addresses_holding_greater/ieslvwy/	1656921029	1	True	True	False	Bitcoin	t5_2s3qj	r/Bitcoin	public		0	[]													
18	[]	False		WaitingToBeTriggered			[]				text	t2_3qhv112i	False	False	THE END OF THE THIRD REICH DRAWS NEAR	58375c0316b14c6fb730d26b04c4dbedcb1db403	True	False					0	1656921014		0	{}	ieslvpu	False	t3_vqma4t	False	True	t1_iesluqs	/r/Bitcoin/comments/vqma4t/if_you_bought_most_of_your_bitcoin_in_2021_this/ieslvpu/	1656921029	1	True	True	False	Bitcoin	t5_2s3qj	r/Bitcoin	public		0	[]													
19	[]	False		redshiftquasars			[]				text	t2_hjizw	False	False	"late to the show.. but want to say that if you have hairs standing on end at the ends of your arms then maybe this isn't your first whole coin and you are well on you way to the second coin.  

remember to always consider your tax obligations as well.  Play by the rules until you don't need to.  

take the leaps you can while you are able,  be crazy and wreckless without hurting others around you, stay sober and your aim will amaze you."	c25752fea1224ce05f5cba54e000f4abac98a0f9	True	False					0	1656921012		0	{}	ieslvmw	False	t3_vqzc5o	False	True	t3_vqzc5o	/r/Bitcoin/comments/vqzc5o/i_am_officially_a_wholecoiner/ieslvmw/	1656921029	1	True	True	False	Bitcoin	t5_2s3qj	r/Bitcoin	public		0	[]													
20	[]	False		The_Judicaetor			[]				text	t2_l54frqo	False	False	There is no turning back now	b8aa1059ac8640aebece4f80995b5af0de69cca3	True	False					0	1656920991		0	{}	iesluqs	False	t3_vqma4t	False	True	t1_iepyoeb	/r/Bitcoin/comments/vqma4t/if_you_bought_most_of_your_bitcoin_in_2021_this/iesluqs/	1656921008	1	True	True	False	Bitcoin	t5_2s3qj	r/Bitcoin	public		0	[]													
21	[]	False		The_Judicaetor			[]				text	t2_l54frqo	False	False	Amen	1f90d223e201f975f575e4afde2f1d5e5d242d6d	True	False					0	1656920936		0	{}	ieslsda	False	t3_vqma4t	False	True	t1_ieqdbgq	/r/Bitcoin/comments/vqma4t/if_you_bought_most_of_your_bitcoin_in_2021_this/ieslsda/	1656920952	1	True	True	False	Bitcoin	t5_2s3qj	r/Bitcoin	public		0	[]													
22	[]	False		tesseramous			[]				text	t2_dtkwz	False	False	The halving involves so little coins it doesn't mean anything anymore.  You need to hope for more than a halving	4146800310b657194d24f44182b7d7de0ef97b36	True	False					0	1656920931		0	{}	iesls40	False	t3_vqzqpv	False	True	t1_iese3ye	/r/Bitcoin/comments/vqzqpv/daily_discussion_july_04_2022/iesls40/	1656920945	1	True	True	False	Bitcoin	t5_2s3qj	r/Bitcoin	public		0	[]													
23	[]	False		PlanetEarthFirst			[]				text	t2_1we1d69y	False	False	"I certainly don't believe it is fully backed. Looking at the development of money supply (e.g. M0 or M1), I don't see how one could even think that it is seriously backed. They scale up the supply as they wish. ""Printing"" trillions of dollars out of thin air without GDP or anything going up as well (except stock market which is not a security for the dollar)."	c4c2371c057301d4d7f0d7408cdbce15fa7c992f	True	False					0	1656920890		0	{}	ieslqby	False	t3_vnmjwe	False	True	t1_iemagcn	/r/Bitcoin/comments/vnmjwe/bitcoin_fixes_government/ieslqby/	1656920903	1	True	True	False	Bitcoin	t5_2s3qj	r/Bitcoin	public		0	[]													
24	[]	False		Romsel87			[]				text	t2_2sl2ji2l	False	False	Hindsight is 20/20. I've seen BTC gone from 30K to 69K two times and did not take any profit. Now im down 25%. No worries though, this is a great time to accumulate and wait for better times. Only invest with money you're comfortable losing.	c08377c0e2ea2c33ff153b87ccf91391a0eb309f	True	False					0	1656920884		0	{}	ieslq1y	False	t3_vqrho9	False	True	t3_vqrho9	/r/Bitcoin/comments/vqrho9/i_regret_not_buying_bitcoin_back_in_20152016/ieslq1y/	1656920903	1	True	True	False	Bitcoin	t5_2s3qj	r/Bitcoin	public		0	[]													
25	[]	False		8ballandaDUI			[]				text	t2_x06ti	False	False	Stop asking intelligent questions.	c525ab8e3c09144abf8421ec9df7729f98737116	True	False					0	1656920838		0	{}	ieslo32	False	t3_vqzqpv	False	True	t1_ieshv3j	/r/Bitcoin/comments/vqzqpv/daily_discussion_july_04_2022/ieslo32/	1656920853	1	True	True	False	Bitcoin	t5_2s3qj	r/Bitcoin	public		0	[]													
26	[]	False		CoinCorner_Sam			[]			dark	text	t2_fospv9k6	False	True	IKR, that's why I'm asking OP for their opinion.	cac601f88b46cef44b7debdbe55a560b6221d34d	True	False					0	1656920760		0	{}	ieslksv	False	t3_vqntn4	False	True	t1_ieq89iw	/r/Bitcoin/comments/vqntn4/bitcoin_value/ieslksv/	1656920777	1	True	True	False	Bitcoin	t5_2s3qj	r/Bitcoin	public		0	[]													
27	[]	False		[deleted]						dark					[removed]	fe993932d6dced4c0a879e9aa5d7a6e0fbb467f5	True	False					0	1656920760		0	{}	ieslksp	False	t3_vqrkip	False	True	t3_vqrkip	/r/Bitcoin/comments/vqrkip/if_i_post_this_here_youll_say_im_underexposed_if/ieslksp/	1656920777	1	True	True	False	Bitcoin	t5_2s3qj	r/Bitcoin	public		0	[]													
28	[]	False		JHGrove3			[]				text	t2_611o9	False	False	The bank manager has a different key. You need both keys to open the box.	30e6d2d73445542364e8aa9a6bce87809760ed9d	True	False					0	1656920747		0	{}	ieslk7i	False	t3_vquakg	False	False	t1_ierliv7	/r/Bitcoin/comments/vquakg/bitcoin_fixes_this/ieslk7i/	1656920763	1	True	True	False	Bitcoin	t5_2s3qj	r/Bitcoin	public		0	[]													
29	[]	False		dfunkmedia			[]				text	t2_6wzpf	False	True	Yeah that's a butt load of tech. Remember there's other industries, some are less prone to the boom and bust cycles.	005518bdbc34751bf9cca9a4cef327a40f15e698	True	False					0	1656920724		0	{}	ieslj77	False	t3_vqrkip	False	True	t3_vqrkip	/r/Bitcoin/comments/vqrkip/if_i_post_this_here_youll_say_im_underexposed_if/ieslj77/	1656920735	1	True	True	False	Bitcoin	t5_2s3qj	r/Bitcoin	public		0	[]													
30	[]	False		Jaseur			[]				text	t2_chf55	False	False	What's the value of a fridge without food to put in it?	ede7f6cb672de40a9437fb622d5787b039e6c731	True	False					0	1656920707		0	{}	iesligk	False	t3_vquakg	False	True	t1_iesj0k0	/r/Bitcoin/comments/vquakg/bitcoin_fixes_this/iesligk/	1656920722	1	True	True	False	Bitcoin	t5_2s3qj	r/Bitcoin	public		0	[]													
31	[]	False		Alekspish			[]				text	t2_j3pn3	False	False	I know USA closed the gold window. This doesn't change how they got the dollar into reserve status.	6112599087eba2667bcb5b47f9328e289ee8657b	True	False					0	1656920611		0	{}	iesle9q	False	t3_vqiodm	False	True	t1_ier6h4s	/r/Bitcoin/comments/vqiodm/the_us_debt_is_exponentially_growing_and_its/iesle9q/	1656920628	1	True	True	False	Bitcoin	t5_2s3qj	r/Bitcoin	public		0	[]													
32	[]	False		Bitbuyer313			[]			dark	text	t2_4cd7lcfh	False	False	Did you get locked out of a lending platform account? Or did you just put all your money into BTC not expecting the price to drop?	ae52cb15b10204e75fd1d7da4ca7b33412ef9c66	True	False					0	1656920587		0	{}	iesld79	False	t3_vr20r1	False	True	t3_vr20r1	/r/Bitcoin/comments/vr20r1/stay_safe_guys/iesld79/	1656920600	1	True	True	False	Bitcoin	t5_2s3qj	r/Bitcoin	public		0	[]													
33	[]	False		Sufficient-Jury6684		noob	[{'e': 'text', 't': 'redditor for 2 weeks'}]	2ec8e69e-6c36-11e9-a04b-0afb553d4ea6	redditor for 2 weeks	dark	richtext	t2_olucg605	False	False	"Get some real estate shares like SPG.

Not financial advice."	f42db571716453b142db0057a0818c6dd146e272	True	False					0	1656920579		0	{}	ieslcvy	False	t3_vqrkip	False	True	t3_vqrkip	/r/Bitcoin/comments/vqrkip/if_i_post_this_here_youll_say_im_underexposed_if/ieslcvy/	1656920592	1	True	True	False	Bitcoin	t5_2s3qj	r/Bitcoin	public		0	[]													
34	[]	False		LadyAnarki			[]				text	t2_fp2dind	False	False	"Strong passphrases being long have nothing to do with trezor and everything to do with entropy. Anything less than 5 words can be brute forced by the NSA b/c their computer power is insane. Snowden spoke about this. 

Also, can you please share a source for this unfixable hardware vulnerability? Because I'm pretty sure it was fixed."	2b2c46cab547e7012cc4c1b1f60b576ccf8a93be	True	False					0	1656920574		0	{}	ieslcm9	False	t3_vqq3hd	False	True	t1_iesg7f6	/r/Bitcoin/comments/vqq3hd/why_do_people_even_recommend_ledger/ieslcm9/	1656920585	1	True	True	False	Bitcoin	t5_2s3qj	r/Bitcoin	public		0	[]													
35	[]	False		blacksoilbrownlog			[]				text	t2_o1ngn0x	False	False	Scary	17d7549c672a9f119ced7294bf8211d91e583e87	True	False					0	1656920554		0	{}	ieslbrm	False	t3_vqdpsm	False	True	t3_vqdpsm	/r/Bitcoin/comments/vqdpsm/not_your_keys_not_your_coins_6_billion_in/ieslbrm/	1656920571	1	True	True	False	Bitcoin	t5_2s3qj	r/Bitcoin	public		0	[]													
36	[]	False		Boe_Ning			[]				text	t2_6mkjb3n4	False	False	These can be multiple UTXOs owned by the same person, right? The trend is still meaningful, but not necessarily a 1:1 BTC-to-individual metric	de10037a2c91c0a5aeff93c5f2d7f44d050f966c	True	False					0	1656920554		0	{}	ieslbqi	False	t3_vr0pxl	False	True	t3_vr0pxl	/r/Bitcoin/comments/vr0pxl/accelerated_trend_in_addresses_holding_greater/ieslbqi/	1656920571	1	True	True	False	Bitcoin	t5_2s3qj	r/Bitcoin	public		0	[]													
37	[]	False		Alekspish			[]				text	t2_j3pn3	False	False	Yeah, but when the USA defaulted by closing the dollar gold exchange all the countries didn't just suddenly dump all the dollars as the USA still had the strongest economy. There was nothing to take it's place so everyone just carried on with the existing arrangement and all currencies traded freely against each other.	33df66259cbfe781f1bc5adbfc1c59ec99654ec0	True	False					0	1656920490		0	{}	iesl8yt	False	t3_vqiodm	False	True	t1_ier0oyp	/r/Bitcoin/comments/vqiodm/the_us_debt_is_exponentially_growing_and_its/iesl8yt/	1656920507	1	True	True	False	Bitcoin	t5_2s3qj	r/Bitcoin	public		0	[]													
38	[]	False		Bitbuyer313			[]			dark	text	t2_4cd7lcfh	False	False	Give it time, this is still the wild west and will remain so until regulators finally step in. On the bright side these current events will force regulators to finally ramp up efforts to layout regulatory guidelines that we've all been waiting for	1b1153d91cf08ce73f6d47bcd44103b8d9e66cbc	True	False					0	1656920406		0	{}	iesl56s	False	t3_vr1n4v	False	False	t1_ieskw1a	/r/Bitcoin/comments/vr1n4v/crypto_lending/iesl56s/	1656920422	1	True	True	False	Bitcoin	t5_2s3qj	r/Bitcoin	public		0	[]													
39	[]	False		Boe_Ning			[]				text	t2_6mkjb3n4	False	False	Transferred to Trezor.  Probably didn't want to send it all at once	38cf39b004823a6acd0bbeac44e0675abb7838ca	True	False					0	1656920399		0	{}	iesl4vu	False	t3_vqzc5o	False	True	t1_iesdxpg	/r/Bitcoin/comments/vqzc5o/i_am_officially_a_wholecoiner/iesl4vu/	1656920415	1	True	True	False	Bitcoin	t5_2s3qj	r/Bitcoin	public		0	[]													
40	[]	False		johnross59		noob	[{'e': 'text', 't': 'redditor for 4 weeks'}]	2ec8e69e-6c36-11e9-a04b-0afb553d4ea6	redditor for 4 weeks	dark	richtext	t2_lde3f8cq	False	False	Trezor, Bitbox and Coldcard are open source. Or you can simply install a wallet like Electrum on an offline machine to generate your seed phrase, and use it as a cold wallet.	1b1832d80365801be4993f767148a20633318447	True	False					0	1656920377		0	{}	iesl3yc	False	t3_vqq3hd	False	True	t1_iern4uj	/r/Bitcoin/comments/vqq3hd/why_do_people_even_recommend_ledger/iesl3yc/	1656920394	1	True	True	False	Bitcoin	t5_2s3qj	r/Bitcoin	public		0	[]													
41	[]	False		Scary_Ordinary_4448			[]			dark	text	t2_jvpp9skq	False	False	We all regret it man I heard about it before it even came out and I just let it leave my mind because I was a kid into other internet trends my whole life. Have very faint memory of looking at the price when you could buy thousands for a dollar. It is what it is..	4950e318fa7cac3a94faa19e53e94eb151de202f	True	False					0	1656920353		0	{}	iesl2xf	False	t3_vqrho9	False	True	t3_vqrho9	/r/Bitcoin/comments/vqrho9/i_regret_not_buying_bitcoin_back_in_20152016/iesl2xf/	1656920365	1	True	True	False	Bitcoin	t5_2s3qj	r/Bitcoin	public		0	[]													
42	[]	False		[deleted]						dark					[removed]	fe993932d6dced4c0a879e9aa5d7a6e0fbb467f5	True	False					0	1656920321		0	{}	iesl1lh	False	t3_vqzqpv	False	True	t3_vqzqpv	/r/Bitcoin/comments/vqzqpv/daily_discussion_july_04_2022/iesl1lh/	1656920337	1	True	True	False	Bitcoin	t5_2s3qj	r/Bitcoin	public		0	[]													
43	[]	False		No-Research8107			[]			dark	text	t2_52jiolhb	False	False	Yeah, that was the scam giveaway.. here is the real one [https://www.youtube.com/watch?v=dQw4w9WgXcQ](https://www.youtube.com/watch?v=dQw4w9WgXcQ)	9f1b6d97222279aa572a7d283f07a535d61b1d03	True	False					0	1656920301		0	{}	iesl0nf	False	t3_vqot7m	False	True	t1_iesag0l	/r/Bitcoin/comments/vqot7m/twitter_accepting_btc_tips_now/iesl0nf/	1656920316	1	True	True	False	Bitcoin	t5_2s3qj	r/Bitcoin	public		0	[]													
44	[]	False		zorro3987			[]				text	t2_6piw9	False	False	He dont pay taxes in pr.	b18ef466536c93e34fe5aa74871968c7460f9deb	True	False					0	1656920299		0	{}	iesl0kb	False	t3_vquakg	False	True	t1_ierc78n	/r/Bitcoin/comments/vquakg/bitcoin_fixes_this/iesl0kb/	1656920309	1	True	True	False	Bitcoin	t5_2s3qj	r/Bitcoin	public		0	[]													
45	[]	False		Jacked_1			[]				text	t2_j40oqs	False	False	"Most importantly, why do you assume I have something to hide it, rather than have nothing to declare?

I have no taxable events, nor do I plan on.

I have never sold, nor will I. 

If I use bitcoin, I'll use it as it was designed according to the whitepaper. 

I pay my taxes like everyone else in the fiat world (solely), until it inevitably collapses by its own mismanagement. 

You said it yourself in another comment, you don't understand the anti-government sentiment being a European citizen - I am a European citizen also, but clearly we have very different outlooks on society, especially when that same society has the audacity to try and ban self-custody."	778ce1968db5e83a4ddc220fcc95ec9fdd438782	True	False					0	1656920252		0	{}	ieskymh	False	t3_vqaszu	False	False	t1_ieqaftf	/r/Bitcoin/comments/vqaszu/why_do_people_think_that_a_government_cant_seize/ieskymh/	1656920268	1	True	True	False	Bitcoin	t5_2s3qj	r/Bitcoin	public		0	[]													
46	[]	False		[deleted]						dark					[removed]	fe993932d6dced4c0a879e9aa5d7a6e0fbb467f5	True	False					0	1656920239		0	{}	iesky1b	False	t3_vqzqpv	False	True	t3_vqzqpv	/r/Bitcoin/comments/vqzqpv/daily_discussion_july_04_2022/iesky1b/	1656920254	1	True	True	False	Bitcoin	t5_2s3qj	r/Bitcoin	public		0	[]													
47	[]	False		Friendly-Mountain535			[]				text	t2_8zg127af	False	False	Aren’t they also in trouble? I just wanna borrow $1500, but hell can’t trust any of them anymore rn	302e875dd3359cd35db460dc3681f7d441b5f0df	True	False					0	1656920233		0	{}	ieskxre	True	t3_vr1n4v	False	True	t1_iesk7vl	/r/Bitcoin/comments/vr1n4v/crypto_lending/ieskxre/	1656920247	1	True	True	False	Bitcoin	t5_2s3qj	r/Bitcoin	public		0	[]													
48	[]	False		CoinCorner_Sam			[]			dark	text	t2_fospv9k6	False	True	"All of the lenders were trusted at some point. The ""Not your keys, not your Bitcoin"" applies to ANY custodian at all times."	6a070629f7dbefe9a53a6b4701a066bef9f580ff	True	False					0	1656920206		0	{}	ieskwmr	False	t3_vr1n4v	False	True	t3_vr1n4v	/r/Bitcoin/comments/vr1n4v/crypto_lending/ieskwmr/	1656920218	1	True	True	False	Bitcoin	t5_2s3qj	r/Bitcoin	public		0	[]													
49	[]	False		Friendly-Mountain535			[]				text	t2_8zg127af	False	False	No I understand, I don’t actually want to trust them, but the concept is still very nice. Borrowing money while your assets grow over time. I mean this really enabled me to grow assets while still being able to spend and live a good life. Now it’s all fucked	999591617a9f4f947513242fae9ecd628908fdc5	True	False					0	1656920192		0	{}	ieskw1a	True	t3_vr1n4v	False	True	t1_ieskgm6	/r/Bitcoin/comments/vr1n4v/crypto_lending/ieskw1a/	1656920204	1	True	True	False	Bitcoin	t5_2s3qj	r/Bitcoin	public		0	[]													
50	[]	False		hans7070			[]			dark	text	t2_74h195zg	False	False	"When you create a 1 Mio channel you have 1 Mio sats of actual money, right? When you send 600k to your muun wallet or a merchant or wherever you are left with 400k sats of actual money. That's all pretty much. You are short 600k sats. Coincidently this 600k gap or ""inbound capacity"" can now be used by anybody to send you up to 600k. My english sucks right now, but maybe the abacus explanation is overkill is what I'm trying to say."	9e552ef5d679f005fd3d507e5a96967ae1a2e97e	True	False					0	1656920175		0	{}	ieskva8	False	t3_vqngmf	False	True	t3_vqngmf	/r/Bitcoin/comments/vqngmf/lightning_question_can_someone_explain_inbound/ieskva8/	1656920191	1	True	True	False	Bitcoin	t5_2s3qj	r/Bitcoin	public		0	[]													
