Unnamed: 0	all_awardings	archived	associated_award	author	author_flair_background_color	author_flair_css_class	author_flair_richtext	author_flair_template_id	author_flair_text	author_flair_text_color	author_flair_type	author_fullname	author_patreon_flair	author_premium	body	body_sha1	can_gild	collapsed	collapsed_because_crowd_control	collapsed_reason	collapsed_reason_code	comment_type	controversiality	created_utc	distinguished	gilded	gildings	id	is_submitter	link_id	locked	no_follow	parent_id	permalink	retrieved_utc	score	score_hidden	send_replies	stickied	subreddit	subreddit_id	subreddit_name_prefixed	subreddit_type	top_awarded_type	total_awards_received	treatment_tags	unrepliable_reason	author_cakeday	corpus	support	knowledge	conflict	power	similarity	fun	status	trust	identity	romance
98	[]	False		trunksta			[]				text	t2_ecfvb	False	False	I just hope he shows up unlike the previous guy who let Craig win by default	c40025d33792b9d0508e2ac2394e8b4ad5cbd8c3	True	False					0	1661049951		0	{}	il5a9t4	False	t3_wt7uru	False	True	t3_wt7uru	/r/Bitcoin/comments/wt7uru/this_answer_from_greg_maxwell_deserves_its_own/il5a9t4/	1661049962	1	True	True	False	Bitcoin	t5_2s3qj	r/Bitcoin	public		0	[]													
99	[]	False		Mr_P_Nissaurus		noob	[{'e': 'text', 't': 'redditor for 3 months'}]	2ec8e69e-6c36-11e9-a04b-0afb553d4ea6	redditor for 3 months	dark	richtext	t2_oqxa5s90	False	False	When you re-connect, you'll have to wait for Core to sync with the blockchain.  That can take a long time, depending on how long it was disconnected.  Until it syncs, all you can do is wait.	38b8281dd7c6e73164fe6775cbff5694c41e5afb	True	False					0	1661049928		0	{}	il5a879	False	t3_wtoazv	False	True	t3_wtoazv	/r/Bitcoin/comments/wtoazv/bitcoin_core_cold_storage/il5a879/	1661049940	1	True	True	False	Bitcoin	t5_2s3qj	r/Bitcoin	public		0	[]													
100	[]	False		Flguy76			[]				text	t2_6y61rkr8	False	False	Hell i have an old dell optiplex dual core  with 8gb with 1tb ssd only took like 28 hours to sync on a 1GB down 1GB up fiber internet.	25dcb9402da7b00dbf9a69d2010af8313562cf62	True	False					0	1661049846		0	{}	il5a2be	False	t3_wt8cx2	False	True	t3_wt8cx2	/r/Bitcoin/comments/wt8cx2/while_all_the_fud_is_going_on_i_have_decided_to/il5a2be/	1661049861	1	True	True	False	Bitcoin	t5_2s3qj	r/Bitcoin	public		0	[]													
101	[]	False		Grouchy_Artichoke_90			[]			dark	text	t2_kykwqive	False	False	Not really aiming for one. More an off handed remark that if you had a picture frame hanging up and a node was on the back then that would be minimalistic and quite nice.	60d1475e2cd920de923fad162c8db7633ca25321	True	False					0	1661049813		0	{}	il5a01g	False	t3_wszvmn	False	True	t1_il59uw1	/r/Bitcoin/comments/wszvmn/what_a_cute_digital_picture_frame_where_did_you/il5a01g/	1661049825	1	True	True	False	Bitcoin	t5_2s3qj	r/Bitcoin	public		0	[]													
102	[]	False		cheerful_afternoon			[]			dark	text	t2_ji4d5nwa	False	False	"I recall the dev having a reddit account.

I remember contacting him about some of these token lists or something, and he replied and gave me some insight.

Might want to try him. I don't remember his username, but shouldn't be hard to find"	de9a71f98bcab3ba9c59b5fd05a369a17929fee1	True	False					0	1661049745		0	{}	il59v3h	False	t3_wt64po	False	True	t3_wt64po	/r/Bitcoin/comments/wt64po/tokenlists_for_btcrecover_trying_to_reclaim_old/il59v3h/	1661049758	1	True	True	False	Bitcoin	t5_2s3qj	r/Bitcoin	public		0	[]													
103	[]	False		varikonniemi			[]				text	t2_5pv5t	False	False	i'm simply trying to understand your point	26ad64305b47ec81da88fac454ab5da916338874	True	False					0	1661049742		0	{}	il59uw1	False	t3_wszvmn	False	True	t1_il59mqa	/r/Bitcoin/comments/wszvmn/what_a_cute_digital_picture_frame_where_did_you/il59uw1/	1661049753	1	True	True	False	Bitcoin	t5_2s3qj	r/Bitcoin	public		0	[]													
104	[]	False		TheGreatMuffin			[]				text	t2_j5h9i	False	False	"&gt; So after you install and run the node, where do you validate the transactions? Within the software? If so, what’s the best way to find your transaction?

Your node verifies all transactions/block it receives automatically. You don't need to manually look up transactions (although you can, if you want to).  

To gain the actual benefits of having your own node, you need to connect your actual wallet to it. The wallet then uses your node to look up and verify your incoming transactions and broadcast your outgoing transactions through your node.  

How to do that specifically depends on your wallet (mobile? hardware?) and your node setup (laptop? specialized hardware like raspberry pi?). There are a variety of ways and guides.  

Easiest way I know is to install Bitcoin Core on your machine and point your hardware wallet software to it. I think Ledger Live allows for that. Another way is to use another wallet software instead of Ledger Live (Specter, f.ex), which also can connect your hardware wallet to your local node."	b04958767b9e89e6644c31727cdf919a48f7ed01	True	False					0	1661049739		0	{}	il59ups	False	t3_wt8cx2	False	True	t1_il593uv	/r/Bitcoin/comments/wt8cx2/while_all_the_fud_is_going_on_i_have_decided_to/il59ups/	1661049751	1	True	True	False	Bitcoin	t5_2s3qj	r/Bitcoin	public		0	[]													
105	[]	False		franzsylvestter		noob	[{'e': 'text', 't': 'redditor for 7 weeks'}]	2ec8e69e-6c36-11e9-a04b-0afb553d4ea6	redditor for 7 weeks	dark	richtext	t2_pdznrt17	False	False	This is excellent.	043b0f2dcdc0e85e384e519d4eb70fcfd79c0f29	True	False					0	1661049680		0	{}	il59qjl	False	t3_wplf3w	False	True	t3_wplf3w	/r/Bitcoin/comments/wplf3w/africans_are_sending_bitcoin_peer_to_peer_without/il59qjl/	1661049693	1	True	True	False	Bitcoin	t5_2s3qj	r/Bitcoin	public		0	[]													
106	[]	False		gsinitsyn		noob	[{'e': 'text', 't': 'redditor for 3 months'}]	2ec8e69e-6c36-11e9-a04b-0afb553d4ea6	redditor for 3 months	dark	richtext	t2_mxm9apiq	False	False	The best way to use Bitcoin is to find stores who accepts Bitcoin	7d5d124fc5967747b0d14394a3f3f1b1715eeb07	True	False					0	1661049673		0	{}	il59q00	False	t3_wsrdp8	False	True	t1_il2s7ty	/r/Bitcoin/comments/wsrdp8/we_need_merchant_adoption_so_we_dont_have_to_sell/il59q00/	1661049684	1	True	True	False	Bitcoin	t5_2s3qj	r/Bitcoin	public		0	[]													
107	[]	False		Grouchy_Artichoke_90			[]			dark	text	t2_kykwqive	False	False	I feel you're arguing purely because you can at this point.	f892c2ffb1ebffa55450410bc7072e4c1181caa1	True	False					0	1661049627		0	{}	il59mqa	False	t3_wszvmn	False	True	t1_il59hlq	/r/Bitcoin/comments/wszvmn/what_a_cute_digital_picture_frame_where_did_you/il59mqa/	1661049638	1	True	True	False	Bitcoin	t5_2s3qj	r/Bitcoin	public		0	[]													
108	[]	False		kittywrastler			[]			dark	text	t2_k2kz8iqm	False	False	So if I was rich could I effectively provide my inheritors with monthly stipends?	9022600ac040f753894de8da8e4b2d68fe2bd03f	True	False					0	1661049571		0	{}	il59io0	False	t3_ws9djv	False	True	t3_ws9djv	/r/Bitcoin/comments/ws9djv/recurring_bitcoin_lightning_payments_are_coming/il59io0/	1661049582	1	True	True	False	Bitcoin	t5_2s3qj	r/Bitcoin	public		0	[]													
109	[]	False		varikonniemi			[]				text	t2_5pv5t	False	False	"so what exactly makes the pictured one have more ""picture frame"" ? The fact it has two bezels instead of one? To me that looks like jerry rigging"	9faddb872a256cf8a827d229acbb3d1f24313665	True	False					0	1661049557		0	{}	il59hlq	False	t3_wszvmn	False	True	t1_il59bps	/r/Bitcoin/comments/wszvmn/what_a_cute_digital_picture_frame_where_did_you/il59hlq/	1661049575	1	True	True	False	Bitcoin	t5_2s3qj	r/Bitcoin	public		0	[]													
110	[]	False		boogwin			[]				text	t2_h4c5t	False	False	Gotta keep buying man. In all markets.	fd6de1243420da7efa1c5b0e1d059b31bde40f21	True	False					0	1661049515		0	{}	il59eka	False	t3_wsc4dl	False	True	t1_il4xm3h	/r/Bitcoin/comments/wsc4dl/inflation/il59eka/	1661049530	1	True	True	False	Bitcoin	t5_2s3qj	r/Bitcoin	public		0	[]													
111	[]	False		Grouchy_Artichoke_90			[]			dark	text	t2_kykwqive	False	False	A picture frame would be nice	b42875643b8c6b201998c5b45a3e61d74326a4e1	True	False					0	1661049476		0	{}	il59bps	False	t3_wszvmn	False	True	t1_il569b0	/r/Bitcoin/comments/wszvmn/what_a_cute_digital_picture_frame_where_did_you/il59bps/	1661049492	1	True	True	False	Bitcoin	t5_2s3qj	r/Bitcoin	public		0	[]													
112	[]	False		ip_address_freely			[]				text	t2_qgdbx	False	False	As you should	f328c4daf25bdcd0f0895eb4d1ea8b3d9ee1a7d3	True	False					0	1661049461		0	{}	il59akn	True	t3_wth6dl	False	True	t1_il57mgk	/r/Bitcoin/comments/wth6dl/buy_the_dip/il59akn/	1661049474	1	True	True	False	Bitcoin	t5_2s3qj	r/Bitcoin	public		0	[]													
113	[]	False		liv2cod		noob	[{'e': 'text', 't': 'redditor for 7 weeks'}]	2ec8e69e-6c36-11e9-a04b-0afb553d4ea6	redditor for 7 weeks	dark	richtext	t2_p9uvmxbh	False	False	I would love to disagree but history indicates that Republicans often talk a good story but fail badly at follow-through.  But you hafta vote for somebody, so you may as well pick the one who says the right things.  Maybe there'll be a pot of gold at the end of the electoral rainbow this time.	05b2eaa95a949206bd367135752726112b4d93fc	True	False					0	1661049446		0	{}	il599iy	False	t3_wte9wq	False	True	t1_il4nw7p	/r/Bitcoin/comments/wte9wq/nh_united_states_senate_debate_question_on_bitcoin/il599iy/	1661049458	1	True	True	False	Bitcoin	t5_2s3qj	r/Bitcoin	public		0	[]													
114	[]	False		longonbtc			[]				text	t2_ju09ke4l	False	False	Only two threads can be pinned at a time. This thread was pinned but it was automatically unpinned when someone pinned the hodlnaught vs Craig thread. I just unpinned the newcomers thread and pinned this thread back up.	6f2fdb34e8ef5f5afa22d5ff46963166eb61f2db	True	False					0	1661049424		0	{}	il597uq	False	t3_wsyq8o	False	True	t1_il4zqlh	/r/Bitcoin/comments/wsyq8o/daily_discussion_august_20_2022/il597uq/	1661049435	1	True	True	False	Bitcoin	t5_2s3qj	r/Bitcoin	public		0	[]													
115	[]	False		[deleted]						dark					[removed]	fe993932d6dced4c0a879e9aa5d7a6e0fbb467f5	True	False					0	1661049413		0	{}	il59730	False	t3_wssuhl	False	True	t1_il1fou3	/r/Bitcoin/comments/wssuhl/i_wonder_what_these_are_for/il59730/	1661049427	1	True	True	False	Bitcoin	t5_2s3qj	r/Bitcoin	public		0	[]													
116	[]	False		rBitcoinMod			[]				text	t2_tcsf5	False	False	"Your submission has been flagged for removal because it pertains to general trading or market discussion, whereas r/Bitcoin tries to be less price oriented. Please visit r/BitcoinMarkets. Thank you.

^^I ^^am ^^a ^^bot ^^and ^^cannot ^^respond. ^^Please ^^contact ^^r/Bitcoin ^^moderators [^^directly ^^via ^^mod ^^mail](https://www.reddit.com/message/compose?to=%2Fr%2FBitcoin) ^^if ^^you ^^have ^^questions."	3983f6ad1df20b0c1e876c5bfb07c5fdc0c81ac7	True	False					0	1661049392	moderator	0	{}	il595hy	False	t3_wtny4b	False	True	t3_wtny4b	/r/Bitcoin/comments/wtny4b/bitcoin_is_going_below_21000_tomorrow/il595hy/	1661049404	1	True	True	True	Bitcoin	t5_2s3qj	r/Bitcoin	public		0	[]													
117	[]	False		dindbrbfb			[]				text	t2_8738126f	False	False	"Thanks. 

So after you install and run the node, where do you validate the transactions? Within the software? If so, what’s the best way to find your transaction? 

Is there a tutorial that makes it easy to understand ? As someone that wants to buy and run a node, “verifying transactions” always seems to be talked/boasted about, but never explained or walked through step-by-step"	cee77a55d734a5ff2fbbf984fd0448e80776d14b	True	False					0	1661049369		0	{}	il593uv	False	t3_wt8cx2	False	False	t1_il326y7	/r/Bitcoin/comments/wt8cx2/while_all_the_fud_is_going_on_i_have_decided_to/il593uv/	1661049381	1	True	True	False	Bitcoin	t5_2s3qj	r/Bitcoin	public		0	[]													
118	[]	False		Pasukaru0			[]				text	t2_kwjlu	False	False	I think you need to take some maths lessons.	67ec252dcb16f2b3c42cded98b60570a2e5a8a1b	True	False					0	1661049330		0	{}	il590yg	False	t3_wsz7jj	False	True	t1_il1ciy2	/r/Bitcoin/comments/wsz7jj/has_anybody_seen_the_youtube_channel_called/il590yg/	1661049343	1	True	True	False	Bitcoin	t5_2s3qj	r/Bitcoin	public		0	[]													
119	[]	False		[deleted]						dark					[removed]	fe993932d6dced4c0a879e9aa5d7a6e0fbb467f5	True	False					0	1661049330		0	{}	il590yc	False	t3_wth6dl	False	True	t1_il458u9	/r/Bitcoin/comments/wth6dl/buy_the_dip/il590yc/	1661049343	1	True	True	False	Bitcoin	t5_2s3qj	r/Bitcoin	public		0	[]													
120	[]	False		liv2cod		noob	[{'e': 'text', 't': 'redditor for 7 weeks'}]	2ec8e69e-6c36-11e9-a04b-0afb553d4ea6	redditor for 7 weeks	dark	richtext	t2_p9uvmxbh	False	False	They also get two US senators, just like everyone else.  Their senator would be the US Senator from New Hampshire, but that's probably too long to put on the screen.	2d2f6ef0f9ae78974de197bcf702d1bec558cf07	True	False					0	1661049281		0	{}	il58x9l	False	t3_wte9wq	False	True	t1_il3sobd	/r/Bitcoin/comments/wte9wq/nh_united_states_senate_debate_question_on_bitcoin/il58x9l/	1661049297	1	True	True	False	Bitcoin	t5_2s3qj	r/Bitcoin	public		0	[]													
121	[]	False		itallendsintears		noob	[{'e': 'text', 't': 'redditor for 3 weeks'}]	2ec8e69e-6c36-11e9-a04b-0afb553d4ea6	redditor for 3 weeks	dark	richtext	t2_qj6tfj63	False	False	"Yeah thank you also!  I’m glad we were able to be civil for the most part and let each other be heard.  

I love America and I can tell you do, too.  That’s a powerful thing and it’s the beginning of something.  We are both on a bitcoin sub for example.  We are searching for solutions to problems we both identify.  

I’m glad to have had this discourse with you.  Be well."	8759e962fe89020bbe84b8ad6ea2551b5ad4be87	True	False					0	1661049234		0	{}	il58tsq	False	t3_wrqfas	False	True	t1_il4tvio	/r/Bitcoin/comments/wrqfas/this_is_how_kraken_thanks_their_customers/il58tsq/	1661049245	1	True	True	False	Bitcoin	t5_2s3qj	r/Bitcoin	public		0	[]													
122	[]	False		Far-Department-4196			[]				text	t2_iilcv55w	False	False	Mich-Celsius	2e0cef56580e97c484b044a85d6711c5196ca41a	True	False					0	1661048999		0	{}	il58cxz	False	t3_wtny4b	False	True	t1_il57051	/r/Bitcoin/comments/wtny4b/bitcoin_is_going_below_21000_tomorrow/il58cxz/	1661049012	1	True	True	False	Bitcoin	t5_2s3qj	r/Bitcoin	public		0	[]													
123	[]	False		SATBATTLE		noob	[{'e': 'text', 't': 'redditor for 1 week'}]	2ec8e69e-6c36-11e9-a04b-0afb553d4ea6	redditor for 1 week	dark	richtext	t2_rbfitlbt	False	False	I see, that's exactly how our platform currently works, except we only have 1v1 tournaments at the moment.	4e8517cd04d727da34a61f3636c0435f24f6597f	True	False					0	1661048850		0	{}	il581zd	True	t3_wtevnz	False	True	t1_il57c4s	/r/Bitcoin/comments/wtevnz/announcing_sat_battle_a_platform_100_powered_by/il581zd/	1661048868	1	True	True	False	Bitcoin	t5_2s3qj	r/Bitcoin	public		0	[]													
124	[]	False		throwawayagin			[]				text	t2_49j26	False	False	"Same way Trump got elected unfortunately, lotta folk outsource their thinking to their preferred peer group. 

Critical thinking takes **effort**. Comes with built in opportunity costs too."	5dc8b21de4eac7660756e3e54a8a1a46d04803ba	True	False					0	1661048746		0	{}	il57uae	False	t3_wt7uru	False	True	t1_il36458	/r/Bitcoin/comments/wt7uru/this_answer_from_greg_maxwell_deserves_its_own/il57uae/	1661048759	1	True	True	False	Bitcoin	t5_2s3qj	r/Bitcoin	public		0	[]													
125	[]	False		Ambitious-Painter838		noob	[{'e': 'text', 't': 'redditor for 5 weeks'}]	2ec8e69e-6c36-11e9-a04b-0afb553d4ea6	redditor for 5 weeks	dark	richtext	t2_llfusi7a	False	False	has anybody used exodus ?	7c4ea594e32f52fdf7d3558453b7777aeb39e493	True	False					0	1661048740		0	{}	il57tuv	False	t3_wo7w0x	False	True	t3_wo7w0x	/r/Bitcoin/comments/wo7w0x/non_kyc_crypto_exchanges_to_buy_and_sell_bitcoin/il57tuv/	1661048752	1	True	True	False	Bitcoin	t5_2s3qj	r/Bitcoin	public		0	[]													
126	[]	False		SpaceBumCraig			[]				text	t2_9vv7rfef	False	False	"""Buy the fucking dip"" - Grandma 👵"	f767262fad91cafdb84e55ac4f5c937f3101afde	True	False					0	1661048639		0	{}	il57mm2	False	t3_wth6dl	False	True	t1_il4gj7d	/r/Bitcoin/comments/wth6dl/buy_the_dip/il57mm2/	1661048652	1	True	True	False	Bitcoin	t5_2s3qj	r/Bitcoin	public		0	[]													
127	[]	False		VampireApe			[]				text	t2_atttcghc	False	False	Nice bro! I DCA every day into BTC.	9f75295a8fb55c34d6944bd8ed2e1c1bccd94309	True	False					0	1661048637		0	{}	il57mgk	False	t3_wth6dl	False	True	t3_wth6dl	/r/Bitcoin/comments/wth6dl/buy_the_dip/il57mgk/	1661048649	1	True	True	False	Bitcoin	t5_2s3qj	r/Bitcoin	public		0	[]													
128	[]	False		neutrino_fire			[]				text	t2_5l4scn66	False	False	"Panic and fear FUD. Corporations continue to invest billions in the crypto space. Crypto isn't going anywhere, and no one needs to ""exit cryptos."""	832f6fe8b27b78b2048081caf9223f1d422e86c1	True	False					0	1661048636		0	{}	il57mca	False	t3_wtny4b	False	False	t3_wtny4b	/r/Bitcoin/comments/wtny4b/bitcoin_is_going_below_21000_tomorrow/il57mca/	1661048649	1	True	True	False	Bitcoin	t5_2s3qj	r/Bitcoin	public		0	[]													
129	[]	False		[deleted]						dark					[removed]	fe993932d6dced4c0a879e9aa5d7a6e0fbb467f5	True	False					0	1661048627		0	{}	il57lpw	False	t3_wt7uru	False	True	t3_wt7uru	/r/Bitcoin/comments/wt7uru/this_answer_from_greg_maxwell_deserves_its_own/il57lpw/	1661048641	1	True	True	False	Bitcoin	t5_2s3qj	r/Bitcoin	public		0	[]													
130	[]	False		liv2cod		noob	[{'e': 'text', 't': 'redditor for 7 weeks'}]	2ec8e69e-6c36-11e9-a04b-0afb553d4ea6	redditor for 7 weeks	dark	richtext	t2_p9uvmxbh	False	False	"How large?  I like Kraken OTC.  You talk to them over secure chat and tell them what you want.  They make an offer and you accept or reject.  They have minimal spread and no fee.  They will send the BTC directly to your hardware wallet.  But they have minimum trade limit of $100K.  So... how big?

If that's too large, Kraken Pro has very low fees and good liquidity.  I tried Coinbase Pro and it's safe to say we hate each other.  They still won't release my crypto for at least another month.  Binance doesn't serve Texas, so nothing there for me but it may work for you.   Bitstamp is cute and has a nice interface but relatively high fees for large trades.  

Whatever you do, I strongly recommend offline storage.  DO NOT leave your coin lying on the exchange.  It's easy enough to transfer it back if you want to sell.  Look for the crypto deposit/withdrawal fees so you don't get surprised."	1e426f2f8c6dda588341cabd3e454b724da0a22a	True	False					0	1661048607		0	{}	il57k9g	False	t3_wtny8s	False	True	t3_wtny8s	/r/Bitcoin/comments/wtny8s/large_purchase/il57k9g/	1661048618	1	True	True	False	Bitcoin	t5_2s3qj	r/Bitcoin	public		0	[]													
131	[]	False		0ptioneer			[]				text	t2_6pxjjl2u	False	False	"17k years bro, I’m older than ganfolf. And the returns are pretty shitty if I were investing for that long. Hahah. Jk

I still have another 20 years to go before I retire. By then I will have more than enough to “rest my loins” 

Using the rule of 72 at a rate of 12%, money will double every 6 years (roughly), in 18 years when I’m at “retirement” age I should have roughly 1M or so. Like what you are saying with inflation, how far will that take me, who knows but I hope it will work in my favor. 

45k in todays money will be around 90k by the time I retire, so that should take me 17 years if I just draw cash from that account. That’s where inflation sucks, but not much you can really do about it with current financial markets, can’t freeze the price of corn and oil."	888ba21fdcd4f2ecb8c03ef372ccd75f54251b4c	True	False					0	1661048575		0	{}	il57hxg	False	t3_wsc4dl	False	True	t1_il53y9l	/r/Bitcoin/comments/wsc4dl/inflation/il57hxg/	1661048587	1	True	True	False	Bitcoin	t5_2s3qj	r/Bitcoin	public		0	[]													
132	[]	False		throwawayagin			[]				text	t2_49j26	False	False	Case is in Norway.	82eeaf304b03156b55bfcc2e3e6612ec03ba8b4e	True	False					0	1661048530		0	{}	il57ero	False	t3_wt7uru	False	True	t1_il4y1kt	/r/Bitcoin/comments/wt7uru/this_answer_from_greg_maxwell_deserves_its_own/il57ero/	1661048543	1	True	True	False	Bitcoin	t5_2s3qj	r/Bitcoin	public		0	[]													
133	[]	False		PreferenceUnique3832			[]				text	t2_96h80rtj	False	False	Good good. I might DCA soon after getting some more funds and looking at the recession data	d829ff3d4a18a8ee19e92338697c5cd80f289eaa	True	False					0	1661048520		0	{}	il57dzm	False	t3_wth6dl	False	True	t1_il57857	/r/Bitcoin/comments/wth6dl/buy_the_dip/il57dzm/	1661048533	1	True	True	False	Bitcoin	t5_2s3qj	r/Bitcoin	public		0	[]													
134	[]	False		Pouch-PH			[]			dark	text	t2_fybh608v	False	False	None that I know of on Palawan yet! But I really hope the Boracay team will expand to a new community there soon!!	b1197aed2166b1b3a8272a2579dacc5c670dcd5e	True	False					0	1661048511		0	{}	il57ddd	True	t3_wtdrhw	False	True	t1_il56zo7	/r/Bitcoin/comments/wtdrhw/the_best_place_to_live_off_bitcoin_this_wall_is/il57ddd/	1661048525	1	True	True	False	Bitcoin	t5_2s3qj	r/Bitcoin	public		0	[]													
135	[]	False		textreply			[]			dark	text	t2_63xi9w29	False	False	"No, it was essentially a ""last-man-standing"" scenario. You all put in a small amount of sats, and then get put in an arena together, with ultimate winner taking all."	2da405a6d2a0df21b5fb4b06414886877eebb183	True	False					0	1661048495		0	{}	il57c4s	False	t3_wtevnz	False	True	t1_il56tk4	/r/Bitcoin/comments/wtevnz/announcing_sat_battle_a_platform_100_powered_by/il57c4s/	1661048510	1	True	True	False	Bitcoin	t5_2s3qj	r/Bitcoin	public		0	[]													
136	[]	False		ip_address_freely			[]				text	t2_qgdbx	False	False	I am DCAing	1c35480746d9b2398e76f99bb310831a60b25b1b	True	False					0	1661048442		0	{}	il57857	True	t3_wth6dl	False	True	t1_il573ax	/r/Bitcoin/comments/wth6dl/buy_the_dip/il57857/	1661048455	1	True	True	False	Bitcoin	t5_2s3qj	r/Bitcoin	public		0	[]													
137	[]	False		NoDesk			[]				text	t2_sr83qzu	False	False	Will have virtually no effect on the price.	f677eb4d1825b96e75c71db0a4d8069d5cda4a8c	True	False					0	1661048436		0	{}	il577p5	False	t3_wtkxgi	False	True	t3_wtkxgi	/r/Bitcoin/comments/wtkxgi/any_thoughts_on_the_mtgox_situation_do_u_guys/il577p5/	1661048448	1	True	True	False	Bitcoin	t5_2s3qj	r/Bitcoin	public		0	[]													
138	[]	False		EvaUnit_03			[]				text	t2_4u6zh2fl	False	False	If I did, I wouldn't of held during the previous bull run lmao...	6444bf826af7533b5e9f543ec0583d3763330284	True	False					0	1661048393		0	{}	il574dw	False	t3_wtny4b	False	True	t1_il57051	/r/Bitcoin/comments/wtny4b/bitcoin_is_going_below_21000_tomorrow/il574dw/	1661048407	1	True	True	False	Bitcoin	t5_2s3qj	r/Bitcoin	public		0	[]													
139	[]	False		PreferenceUnique3832			[]				text	t2_96h80rtj	False	False	I would rather DCA into it during the recession rather than unloading all the money	a4b5fb56946d2bac5a9c08de71b8eefd541d1b40	True	False					0	1661048378		0	{}	il573ax	False	t3_wth6dl	False	True	t3_wth6dl	/r/Bitcoin/comments/wth6dl/buy_the_dip/il573ax/	1661048392	1	True	True	False	Bitcoin	t5_2s3qj	r/Bitcoin	public		0	[]													
140	[]	False		Ok-Association-355			[]				text	t2_65547u2n	False	False	back to 18k soon	a081bbccdc354dfcf75bc68fb3a664809e4bc28a	True	False					0	1661048368		0	{}	il572j6	False	t3_wtny4b	False	True	t3_wtny4b	/r/Bitcoin/comments/wtny4b/bitcoin_is_going_below_21000_tomorrow/il572j6/	1661048379	1	True	True	False	Bitcoin	t5_2s3qj	r/Bitcoin	public		0	[]													
141	[]	False		Michellesis			[]				text	t2_64gcllpj	False	False	Do you know how to make a small fortune on the bounce from $ 17,000?	ea1836c487fafb42c7b72270e5bc4de51a239cd9	True	False					0	1661048336		0	{}	il57051	True	t3_wtny4b	False	True	t1_il56hm1	/r/Bitcoin/comments/wtny4b/bitcoin_is_going_below_21000_tomorrow/il57051/	1661048348	1	True	True	False	Bitcoin	t5_2s3qj	r/Bitcoin	public		0	[]													
142	[]	False		comp21			[]				text	t2_ndq8v	False	False	Awesome. We're gonna stop by for sure :) any idea if there's something similar on Palawan?	b7ceb433c6125882c30c033e6b7eb63be9be5ef7	True	False					0	1661048329		0	{}	il56zo7	False	t3_wtdrhw	False	True	t1_il504ix	/r/Bitcoin/comments/wtdrhw/the_best_place_to_live_off_bitcoin_this_wall_is/il56zo7/	1661048341	1	True	True	False	Bitcoin	t5_2s3qj	r/Bitcoin	public		0	[]													
143	[]	False		SATBATTLE		noob	[{'e': 'text', 't': 'redditor for 1 week'}]	2ec8e69e-6c36-11e9-a04b-0afb553d4ea6	redditor for 1 week	dark	richtext	t2_rbfitlbt	False	False	"Ah yes, I heard about that. I think it was called [chopcoin.io](https://chopcoin.io)

I wonder too, it's something I would have loved to try.

I can imagine all the food you eat are sats, that would be awesome."	4aa40efe445048d6ca3c7e4de9107a2aeb4d0f54	True	False					0	1661048247		0	{}	il56tk4	True	t3_wtevnz	False	True	t1_il56ddc	/r/Bitcoin/comments/wtevnz/announcing_sat_battle_a_platform_100_powered_by/il56tk4/	1661048260	1	True	True	False	Bitcoin	t5_2s3qj	r/Bitcoin	public		0	[]													
144	[]	False		KaiSosceles			[]				text	t2_vld7g	False	False	Evading suvh an order with a public bloch ian asset seems like a recipe for an easy arrest. This isnt 2010. No one should be so foolish as to believe BTC is anonymous or untraceable.	aea850ed51a0d8d8ec81a31d193fe802278355f7	True	False					0	1661048233		0	{}	il56sk1	False	t3_wtdemh	False	True	t1_il52p0x	/r/Bitcoin/comments/wtdemh/governments_trying_to_confiscate_bitcoin_would/il56sk1/	1661048245	1	True	True	False	Bitcoin	t5_2s3qj	r/Bitcoin	public		0	[]													
145	[]	False		Apart_Birthday8154			[]				text	t2_cmqf14r7	False	False	Wasn’t he just at the last Bitcoin conference in Miami?	4d7151072e5923305c29c7baf94734abae871184	True	False					0	1661048229		0	{}	il56s9r	False	t3_wtjygw	False	True	t3_wtjygw	/r/Bitcoin/comments/wtjygw/what_happened_to_nick_szabo/il56s9r/	1661048239	1	True	True	False	Bitcoin	t5_2s3qj	r/Bitcoin	public		0	[]													
