Unnamed: 0	all_awardings	archived	associated_award	author	author_flair_background_color	author_flair_css_class	author_flair_richtext	author_flair_template_id	author_flair_text	author_flair_text_color	author_flair_type	author_fullname	author_patreon_flair	author_premium	body	body_sha1	can_gild	collapsed	collapsed_because_crowd_control	collapsed_reason	collapsed_reason_code	comment_type	controversiality	created_utc	distinguished	gilded	gildings	id	is_submitter	link_id	locked	no_follow	parent_id	permalink	retrieved_utc	score	score_hidden	send_replies	stickied	subreddit	subreddit_id	subreddit_name_prefixed	subreddit_type	top_awarded_type	total_awards_received	treatment_tags	unrepliable_reason	corpus	support	knowledge	conflict	power	similarity	fun	status	trust	identity	romance
84	[]	False		FaceDeer			[]				text	t2_4ljvm	False	False	What? This doesn't affect the blockchain's decentralization. Once you've got your funds withdrawn to it you can transact to your heart's content, including laundering the funds through Tornado to hide your identity.	9d83d28631241722d3e021a8f2c6d814484698c1	True	False					0	1648786589		0	{}	i2xyu8x	False	t3_tt56qm	False	True	t1_i2xl8y5	/r/ethereum/comments/tt56qm/eu_parliament_votes_to_impose_kyc_on_private/i2xyu8x/	1648786604	1	False	True	False	ethereum	t5_2zf9m	r/ethereum	public		0	[]		what this doesn t affect the blockchain s decentralization once you ve got your funds withdrawn to it you can transact to your heart s content including laundering the funds through tornado to hide your identity 	0.018630370497703552	0.9850754737854004	0.2888284921646118	0.02480247989296913	0.02140348218381405	0.4043941795825958	0.08759920299053192	8.532879860467801e-07	0.37374448776245117	0.005823387298732996
85	[]	False		FaceDeer			[]				text	t2_4ljvm	False	False	"You don't tornado your every transaction. You withdraw your funds from your exchange to a known address, then you send those funds through to your anonymous address in a single Tornado transaction. Your anonymous address doesn't have KYC records. You then make your transactions from that address.

Your scenario is a strawman, and suggests a misunderstanding of how Tornado works (it can't process arbitrary transactions, a Tornado pool is split into uniform chunks. Otherwise it'd be obvious who's inputs match up with who's outputs)."	8274b57fc94792ceecfd5f4413a80bdaf5ce3d29	True	False					0	1648786486		0	{}	i2xynx8	False	t3_tt56qm	False	True	t1_i2xlzey	/r/ethereum/comments/tt56qm/eu_parliament_votes_to_impose_kyc_on_private/i2xynx8/	1648786497	1	False	True	False	ethereum	t5_2zf9m	r/ethereum	public		0	[]		you don t tornado your every transaction you withdraw your funds from your exchange to a known address then you send those funds through to your anonymous address in a single tornado transaction your anonymous address doesn t have kyc records you then make your transactions from that address your scenario is a strawman and suggests a misunderstanding of how tornado works it can t process arbitrary transactions a tornado pool is split into uniform chunks otherwise it d be obvious who s inputs match up with who s outputs 	0.002509483601897955	0.9887444972991943	0.37567734718322754	0.01385671366006136	0.008737645111978054	0.4607223570346832	0.09588590264320374	8.756316560720734e-07	0.4306148886680603	0.005854304879903793
86	[]	False		2020rattler			[]				text	t2_70nwk87g	False	False	I don't get how this would be a problem. Exchanges would be the ones needing to verify that the crypto is being sent to your wallet - they already have KYC to buy it on the exchange so you're not anonymously holding crypto after you buy it anyway. From your wallet after that you can always send it to another wallet anonymously.	be1c31293b5fc3062b5c2ffd41cdeefcbfec1b7f	True	False					0	1648786405		0	{}	i2xyisl	False	t3_tt56qm	False	True	t3_tt56qm	/r/ethereum/comments/tt56qm/eu_parliament_votes_to_impose_kyc_on_private/i2xyisl/	1648786421	1	False	True	False	ethereum	t5_2zf9m	r/ethereum	public		0	[]		i don t get how this would be a problem exchanges would be the ones needing to verify that the crypto is being sent to your wallet they already have kyc to buy it on the exchange so you re not anonymously holding crypto after you buy it anyway from your wallet after that you can always send it to another wallet anonymously 	0.0023295991122722626	0.9891870617866516	0.6545184850692749	0.012311642989516258	0.007501494139432907	0.4183453917503357	0.06586261093616486	8.411645922024036e-07	0.18004870414733887	0.025782562792301178
87	[]	False		ApplicationOk6762			[]				text	t2_8wribd26	False	False	"Bla bla bla

Just trying to get attention with naming ETH"	ced244116f55fc802c48bd1117861f63145f8e9e	True	False					0	1648786214		0	{}	i2xy6p6	False	t3_ttfob6	False	True	t3_ttfob6	/r/ethereum/comments/ttfob6/introducing_obfc_wire_money_over_ethereum/i2xy6p6/	1648786226	1	False	True	False	ethereum	t5_2zf9m	r/ethereum	public		0	[]		bla bla bla just trying to get attention with naming eth	0.21270215511322021	0.37944456934928894	0.7824721932411194	0.1881796270608902	0.3690721094608307	0.35160353779792786	0.29861176013946533	4.323143457440892e-06	0.3742198646068573	0.01059140544384718
88	[]	False		Perleflamme			[]				text	t2_13pqgo	False	False	"I agree many people were interested in the fact deflation would increase ETH price and that it mechanically has such consequence. 

But it wasn't the goal of devs. They're too focused on vulnerabilities, scalability and PoS consensus work to also add such detail. 

To the people interested in the tech, price is secondary. Price will follow anyway if tech is really, really good. Just as much as cars replaced horses.

But to other people, I can understand they heard deflation and immediately thought the goal was to increase ETH price."	1f4aa2a6e9d97e880166fa37af7ade2a6e642d96	True	False					0	1648786012		0	{}	i2xxtwl	False	t3_ttfyiq	False	True	t1_i2xws4f	/r/ethereum/comments/ttfyiq/review_its_been_a_year_and_eip1559_was_supposed/i2xxtwl/	1648786026	1	False	True	False	ethereum	t5_2zf9m	r/ethereum	public		0	[]		i agree many people were interested in the fact deflation would increase eth price and that it mechanically has such consequence but it wasn t the goal of devs they re too focused on vulnerabilities scalability and pos consensus work to also add such detail to the people interested in the tech price is secondary price will follow anyway if tech is really really good just as much as cars replaced horses but to other people i can understand they heard deflation and immediately thought the goal was to increase eth price 	0.0027702462393790483	0.9875437021255493	0.24288441240787506	0.018370764330029488	0.9939589500427246	0.48003050684928894	0.08719255030155182	8.757853038332541e-07	0.2317996770143509	0.035953305661678314
89	[]	False		iraqmtpizza			[]				text	t2_gspd52qw	False	False	"&gt;begin going each block's proposer - completely liquid

?"	f0235d90cd54d61fe983d472bb1ebbb58271c7b6	True	False					0	1648785905		0	{}	i2xxn5w	False	t3_tt2cqu	False	True	t3_tt2cqu	/r/ethereum/comments/tt2cqu/the_merge_is_coming_a_few_things_to_expect/i2xxn5w/	1648785918	1	False	True	False	ethereum	t5_2zf9m	r/ethereum	public		0	[]		 gt begin going each block s proposer completely liquid 	0.27572381496429443	0.580190122127533	0.4675489366054535	0.5180851817131042	0.5142409801483154	0.43337827920913696	0.26905664801597595	0.5653348565101624	0.4476657509803772	0.11514820903539658
90	[]	False		emelbard			[]				text	t2_z3n53	False	True	There is lost income from missing a proposal but not a slashing. Slashing takes acting malicious like running duplicate nodes as one example.	bcad545b3d0a5429a769ee694fd358a081d8a9fa	True	False					0	1648785778		0	{}	i2xxexo	False	t3_tt2cqu	False	True	t1_i2vvumo	/r/ethereum/comments/tt2cqu/the_merge_is_coming_a_few_things_to_expect/i2xxexo/	1648785794	1	False	True	False	ethereum	t5_2zf9m	r/ethereum	public		0	[]		there is lost income from missing a proposal but not a slashing slashing takes acting malicious like running duplicate nodes as one example 	0.10413533449172974	0.881618857383728	0.8938078880310059	0.09603070467710495	0.4742704927921295	0.35468119382858276	0.08923813700675964	8.520121923538682e-07	0.4658338725566864	0.00845360103994608
91	[]	False		trippy1			[]				text	t2_92rvp	False	False	When is Shanghai?	406e235b749d2a6a4a51fd5ac597888b7564f53f	True	False					0	1648785719		0	{}	i2xxb0i	False	t3_tt2cqu	False	True	t3_tt2cqu	/r/ethereum/comments/tt2cqu/the_merge_is_coming_a_few_things_to_expect/i2xxb0i/	1648785735	1	False	True	False	ethereum	t5_2zf9m	r/ethereum	public		0	[]		when is shanghai 	0.4476796090602875	0.5239613056182861	0.4228358268737793	0.5282993316650391	0.4940258264541626	0.6091411709785461	0.417939156293869	0.4725826680660248	0.5099439024925232	0.5816700458526611
92	[]	False		ItsAConspiracy			[]				text	t2_21i1m	False	False	"ETH is both. It's money, with a solid valuation model behind it. It works just as well for money as anything else, and money is an important application. For example, just as with Bitcoin, a large amount of ETH has been donated to the government of Ukraine, which is using it directly to buy supplies.

Stablecoins are better money in some ways, but don't necessarily accomplish the goals Vitalik talks about in this article. At a minimum they rely on price feeds, which gives a potential point of attack. Those based on off-chain reserves, even less so."	0123219904461ad7bda3c500a5a24a2ce4bf03b8	True	False					0	1648828723		0	{}	i2zx6n1	False	t3_ttnw4t	False	True	t1_i2zsfvy	/r/ethereum/comments/ttnw4t/in_defense_of_bitcoin_maximalism/i2zx6n1/	1648828741	1	False	True	False	ethereum	t5_2zf9m	r/ethereum	public		0	[]		eth is both it s money with a solid valuation model behind it it works just as well for money as anything else and money is an important application for example just as with bitcoin a large amount of eth has been donated to the government of ukraine which is using it directly to buy supplies stablecoins are better money in some ways but don t necessarily accomplish the goals vitalik talks about in this article at a minimum they rely on price feeds which gives a potential point of attack those based on off chain reserves even less so 	0.0025911445263773203	0.9882710576057434	0.5936757326126099	0.06677796691656113	0.993920087814331	0.4849376082420349	0.06676894426345825	8.193322855731822e-07	0.3466992676258087	0.03078380599617958
93	[]	False		random_sociopath			[]				text	t2_5n5u4h1r	False	False	But there is an er and an um!	b2c441f16dac53b33314f977c0b3c93800308f14	True	False					0	1648828677		0	{}	i2zx2kn	False	t3_ttrp0g	False	True	t1_i2zqjs2	/r/ethereum/comments/ttrp0g/what_do_you_think_would_happen_to_ethereums_price/i2zx2kn/	1648828695	1	False	True	False	ethereum	t5_2zf9m	r/ethereum	public		0	[]		but there is an er and an um 	0.32278817892074585	0.49361732602119446	0.45066675543785095	0.3259675204753876	0.42529091238975525	0.6387683153152466	0.20986269414424896	0.42869383096694946	0.4710689187049866	0.15115737915039062
94	[]	False		DavidKens			[]				text	t2_888yz	False	False	"In context, I think OP meant “trusted” as a synonym for “permissioned”, as opposed to “permissionless” blockchains. 

People would trust those from companies like Meta for the same reason they trust Meta today. There are far more users of Meta products today than users of cryptocurrency. 

I’m not saying I like it, just making the point."	d167bc8e05e69dc3e72e4a469420c0a57a8bcfed	True	False					0	1648828636		0	{}	i2zwytu	False	t3_ttqskr	False	True	t1_i2zdnxp	/r/ethereum/comments/ttqskr/really_why_hold/i2zwytu/	1648828657	1	False	True	False	ethereum	t5_2zf9m	r/ethereum	public		0	[]		in context i think op meant trusted as a synonym for permissioned as opposed to permissionless blockchains people would trust those from companies like meta for the same reason they trust meta today there are far more users of meta products today than users of cryptocurrency i m not saying i like it just making the point 	0.002840141300112009	0.9885446429252625	0.503154993057251	0.01474895142018795	0.9932799935340881	0.47113215923309326	0.06608185917139053	8.460948492938769e-07	0.4047781527042389	0.015528827905654907
95	[]	False		Mobyduck321			[]				text	t2_geifxtg	False	False	I can’t tell is this a joke? It honestly doesn’t seem like it, but I have no idea.	7f113725b2ffc27186b71894cd780d5f7aeb2a4c	True	False					0	1648828633		0	{}	i2zwyjj	False	t3_ttnw4t	False	True	t3_ttnw4t	/r/ethereum/comments/ttnw4t/in_defense_of_bitcoin_maximalism/i2zwyjj/	1648828648	1	False	True	False	ethereum	t5_2zf9m	r/ethereum	public		0	[]		i can t tell is this a joke it honestly doesn t seem like it but i have no idea 	0.07777244597673416	0.44091281294822693	0.5595737099647522	0.00886522326618433	0.2883927524089813	0.9878696799278259	0.09357981383800507	9.320028198089858e-07	0.4457899034023285	0.005993860308080912
96	[]	False		dracolnyte			[]				text	t2_14ozws8c	False	False	in a recession, if people don't have enough income or can't keep their jobs, for sure will not be putting more money into ETH if they are struggling to make ends meet.	663f76354d894d4498cc2fe1b745a8a1b9d40736	True	False					0	1648828487		0	{}	i2zwli3	False	t3_ttrp0g	False	True	t3_ttrp0g	/r/ethereum/comments/ttrp0g/what_do_you_think_would_happen_to_ethereums_price/i2zwli3/	1648828505	1	False	True	False	ethereum	t5_2zf9m	r/ethereum	public		0	[]		in a recession if people don t have enough income or can t keep their jobs for sure will not be putting more money into eth if they are struggling to make ends meet 	0.525443434715271	0.9864440560340881	0.6857912540435791	0.9465453624725342	0.010223162360489368	0.3891974687576294	0.07840246707201004	8.441523959845654e-07	0.2657461166381836	0.015866553410887718
97	[]	False		C0NSCI0US			[]				text	t2_cj8m7	False	False	You clearly dont understand the point of it all.	de34ffc53d44ef0a7101422972e22f89736fc302	True	False					0	1648828475		0	{}	i2zwkhf	False	t3_ttqskr	False	True	t3_ttqskr	/r/ethereum/comments/ttqskr/really_why_hold/i2zwkhf/	1648828497	1	False	True	False	ethereum	t5_2zf9m	r/ethereum	public		0	[]		you clearly dont understand the point of it all 	0.37377598881721497	0.42930087447166443	0.7945634722709656	0.4728383421897888	0.41666048765182495	0.49079927802085876	0.35139793157577515	0.38478150963783264	0.46815431118011475	0.020264558494091034
98	[]	False		hblask			[]				text	t2_4a4q2	False	False	You are just making stuff up.  No developer is giving timelines like that.	0362f4610b31c9f7a755437d99fe851e2e49bc29	True	False					0	1648828090		0	{}	i2zvlxt	False	t3_tt2cqu	False	True	t1_i2zv870	/r/ethereum/comments/tt2cqu/the_merge_is_coming_a_few_things_to_expect/i2zvlxt/	1648828110	1	False	True	False	ethereum	t5_2zf9m	r/ethereum	public		0	[]		you are just making stuff up no developer is giving timelines like that 	0.39592161774635315	0.5943068861961365	0.6240209341049194	0.3306136131286621	0.4916713833808899	0.4588072597980499	0.17565613985061646	0.018203066661953926	0.41059163212776184	0.003014192683622241
99	[]	False		serban1313			[]				text	t2_5vqfiwtw	False	True	Can you tell me what subset of the business model interest you the most?	e8da1fab7a1adc4323b43e09b4c5b729fed47bb1	True	False					0	1648828054		0	{}	i2zvil2	True	t3_ttpngi	False	False	t1_i2zty2w	/r/ethereum/comments/ttpngi/what_topic_do_you_consider_the_most_important/i2zvil2/	1648828073	1	False	True	False	ethereum	t5_2zf9m	r/ethereum	public		0	[]		can you tell me what subset of the business model interest you the most 	0.37046289443969727	0.6756117939949036	0.18184609711170197	0.539080798625946	0.4224780797958374	0.3973563313484192	0.22853511571884155	0.8115180134773254	0.4203178584575653	0.0075974236242473125
100	[]	False		montaigne85			[]				text	t2_g6j3f	False	False	I didn't mean months between each public testnet, rather months in total updating and merging the public testnets. Also add one month before this process starts, and then one month after the process ends (preparation time). This means november-december (if all goes well).	aa3dce3088cdfbd39f6692e956857969e64bb4b5	True	False					0	1648827938		0	{}	i2zv870	False	t3_tt2cqu	False	True	t1_i2zse8u	/r/ethereum/comments/tt2cqu/the_merge_is_coming_a_few_things_to_expect/i2zv870/	1648827959	1	False	True	False	ethereum	t5_2zf9m	r/ethereum	public		0	[]		i didn t mean months between each public testnet rather months in total updating and merging the public testnets also add one month before this process starts and then one month after the process ends preparation time this means november december if all goes well 	0.0048387483693659306	0.9878858327865601	0.12672874331474304	0.02087397500872612	0.9793696999549866	0.6781005263328552	0.07442529499530792	8.373020818908117e-07	0.21927428245544434	0.0021586683578789234
101	[]	False		azsxdcfvg			[]				text	t2_e2mfw	False	False	Just go through Monero. Eth &gt; Xmr &gt; Eth.	f3b375f22d2a63233a50b32656c95fb9f933c7b2	True	False					0	1648827899		0	{}	i2zv4ql	False	t3_ttm3hw	False	True	t3_ttm3hw	/r/ethereum/comments/ttm3hw/impact_of_eu_kyc_rules_long_term/i2zv4ql/	1648827917	1	False	True	False	ethereum	t5_2zf9m	r/ethereum	public		0	[]		just go through monero eth gt xmr gt eth 	0.43370383977890015	0.5287548303604126	0.5507842898368835	0.39707323908805847	0.4511219561100006	0.36780524253845215	0.32308921217918396	0.2930190861225128	0.4568190276622772	0.0700521320104599
102	[]	False		twitterStatus_Bot			[]				text	t2_d38zaa6k	False	False	"(1/4) We've decided not to continue to pursue a patent on our steganographic NFTs for three reasons: 
\#blockchain \#nftnews \#nfts \#NFTCommumity \#nftinnovation \#blockchaintech

---

posted by [@Roccafranca1](https://twitter.com/Roccafranca1/)

---

^(If media is missing, please DM me with a link to submission url and tweet. I will do my best to solve the issue)"	903af5c5ceb50da60929a40fbebf0921fa4dfa75	True	False					0	1648827848		0	{}	i2zv066	False	t3_ttttt3	False	True	t3_ttttt3	/r/ethereum/comments/ttttt3/roccafranca_abandons_patenting_its_nft_innovation/i2zv066/	1648827862	1	False	True	False	ethereum	t5_2zf9m	r/ethereum	public		0	[]		 1 4 we ve decided not to continue to pursue a patent on our steganographic nfts for three reasons blockchain nftnews nfts nftcommumity nftinnovation blockchaintech posted by roccafranca1 https twitter com roccafranca1 if media is missing please dm me with a link to submission url and tweet i will do my best to solve the issue 	0.00443282863125205	0.9887235164642334	0.06921305507421494	0.9321057796478271	0.007602134253829718	0.27583757042884827	0.09248713403940201	8.379099085686903e-07	0.2128308266401291	0.04517212510108948
103	[]	False		AffectionatePeak9085			[]				text	t2_2y17cqsx	False	False	All good man. I appreciate everything you do,to educate people about Ethereum.	172d87514c2f9f7c08cf76c43d6dea18590e477c	True	False					0	1648827678		0	{}	i2zuknw	False	t3_tt70ax	False	True	t1_i2yuaks	/r/ethereum/comments/tt70ax/wen_merge/i2zuknw/	1648827695	1	False	True	False	ethereum	t5_2zf9m	r/ethereum	public		0	[]		all good man i appreciate everything you do to educate people about ethereum 	0.8275155425071716	0.12772879004478455	0.05835718289017677	0.040269482880830765	0.43932753801345825	0.05631369724869728	0.8678380846977234	0.8301258683204651	0.35875794291496277	3.0510143915307708e-05
104	[]	False		MinimalGravitas			[]				text	t2_imdxj	False	True	"You seem to know what you're talking about with regard to PoS so I wonder if you could point me towards any more discussion of the cost difference of attacks compared to PoW?

I've only got a fairly surface level understanding and really want to dig into this more. I tried pushing back on a claim that PoS is less secure by doing some back-of-the envelope calculations, but as the conversation was in the bitcoin sub the mods just deleted my comparison before anyone could point out what I'm misunderstanding...

https://www.unddit.com/r/Bitcoin/comments/tt7q5r/_/

I'd love to get any corrections to mistakes or misunderstandings if you've got time to take a look? I'm completely sure that I've made some errors there and would like to be less wrong in the future!"	d04796847287ce7cf082d7cbc92b819b8e56d32a	True	False					0	1648827649		0	{}	i2zui2r	False	t3_ttpznl	False	False	t1_i2zfu9k	/r/ethereum/comments/ttpznl/what_is_ethereum_merge_and_why_is_it_important/i2zui2r/	1648827665	1	False	True	False	ethereum	t5_2zf9m	r/ethereum	public		0	[]		you seem to know what you re talking about with regard to pos so i wonder if you could point me towards any more discussion of the cost difference of attacks compared to pow i ve only got a fairly surface level understanding and really want to dig into this more i tried pushing back on a claim that pos is less secure by doing some back of the envelope calculations but as the conversation was in the bitcoin sub the mods just deleted my comparison before anyone could point out what i m misunderstanding https www unddit com r bitcoin comments tt7q5r i d love to get any corrections to mistakes or misunderstandings if you ve got time to take a look i m completely sure that i ve made some errors there and would like to be less wrong in the future 	0.002926511922851205	0.9880270957946777	0.9154527187347412	0.021214010193943977	0.008606038987636566	0.2505403161048889	0.06317534297704697	8.420394124186714e-07	0.20133577287197113	0.04565855860710144
105	[]	False		[deleted]						dark					[removed]	fe993932d6dced4c0a879e9aa5d7a6e0fbb467f5	True	False					0	1648827558		0	{}	i2zu9xl	False	t3_ttqskr	False	True	t1_i2zn6kg	/r/ethereum/comments/ttqskr/really_why_hold/i2zu9xl/	1648827573	1	False	True	False	ethereum	t5_2zf9m	r/ethereum	public		0	[]		 removed 	0.46707504987716675	0.5148742198944092	0.5170193910598755	0.5029740929603577	0.4936113953590393	0.5123135447502136	0.45383262634277344	0.4847692549228668	0.4981911778450012	0.5145108103752136
106	[]	False		[deleted]						dark					[removed]	fe993932d6dced4c0a879e9aa5d7a6e0fbb467f5	True	False					0	1648827551		0	{}	i2zu9bo	False	t3_ttqskr	False	True	t1_i2ziadt	/r/ethereum/comments/ttqskr/really_why_hold/i2zu9bo/	1648827564	1	False	True	False	ethereum	t5_2zf9m	r/ethereum	public		0	[]		 removed 	0.46707504987716675	0.5148742198944092	0.5170193910598755	0.5029740929603577	0.4936113953590393	0.5123135447502136	0.45383262634277344	0.4847692549228668	0.4981911778450012	0.5145108103752136
107	[]	False		[deleted]						dark					[removed]	fe993932d6dced4c0a879e9aa5d7a6e0fbb467f5	True	False					0	1648827545		0	{}	i2zu8t2	False	t3_ttqskr	False	True	t1_i2zlj5d	/r/ethereum/comments/ttqskr/really_why_hold/i2zu8t2/	1648827560	1	False	True	False	ethereum	t5_2zf9m	r/ethereum	public		0	[]		 removed 	0.46707504987716675	0.5148742198944092	0.5170193910598755	0.5029740929603577	0.4936113953590393	0.5123135447502136	0.45383262634277344	0.4847692549228668	0.4981911778450012	0.5145108103752136
108	[]	False		[deleted]						dark					[removed]	fe993932d6dced4c0a879e9aa5d7a6e0fbb467f5	True	False					0	1648827539		0	{}	i2zu8ad	False	t3_ttqskr	False	True	t1_i2zjj31	/r/ethereum/comments/ttqskr/really_why_hold/i2zu8ad/	1648827561	1	False	True	False	ethereum	t5_2zf9m	r/ethereum	public		0	[]		 removed 	0.46707504987716675	0.5148742198944092	0.5170193910598755	0.5029740929603577	0.4936113953590393	0.5123135447502136	0.45383262634277344	0.4847692549228668	0.4981911778450012	0.5145108103752136
109	[]	False		[deleted]						dark					[removed]	fe993932d6dced4c0a879e9aa5d7a6e0fbb467f5	True	False					0	1648827534		0	{}	i2zu7sr	False	t3_ttqskr	False	True	t1_i2zfycj	/r/ethereum/comments/ttqskr/really_why_hold/i2zu7sr/	1648827552	1	False	True	False	ethereum	t5_2zf9m	r/ethereum	public		0	[]		 removed 	0.46707504987716675	0.5148742198944092	0.5170193910598755	0.5029740929603577	0.4936113953590393	0.5123135447502136	0.45383262634277344	0.4847692549228668	0.4981911778450012	0.5145108103752136
110	[]	False		[deleted]						dark					[removed]	fe993932d6dced4c0a879e9aa5d7a6e0fbb467f5	True	False					0	1648827526		0	{}	i2zu746	False	t3_ttqskr	False	True	t1_i2zhvyl	/r/ethereum/comments/ttqskr/really_why_hold/i2zu746/	1648827543	1	False	True	False	ethereum	t5_2zf9m	r/ethereum	public		0	[]		 removed 	0.46707504987716675	0.5148742198944092	0.5170193910598755	0.5029740929603577	0.4936113953590393	0.5123135447502136	0.45383262634277344	0.4847692549228668	0.4981911778450012	0.5145108103752136
111	[]	False		[deleted]						dark					[removed]	fe993932d6dced4c0a879e9aa5d7a6e0fbb467f5	True	False					0	1648827518		0	{}	i2zu6fk	False	t3_ttqskr	False	True	t1_i2zju0w	/r/ethereum/comments/ttqskr/really_why_hold/i2zu6fk/	1648827535	1	False	True	False	ethereum	t5_2zf9m	r/ethereum	public		0	[]		 removed 	0.46707504987716675	0.5148742198944092	0.5170193910598755	0.5029740929603577	0.4936113953590393	0.5123135447502136	0.45383262634277344	0.4847692549228668	0.4981911778450012	0.5145108103752136
112	[]	False		[deleted]						dark					[removed]	fe993932d6dced4c0a879e9aa5d7a6e0fbb467f5	True	False					0	1648827512		0	{}	i2zu5w2	False	t3_ttqskr	False	True	t1_i2ze88c	/r/ethereum/comments/ttqskr/really_why_hold/i2zu5w2/	1648827527	1	False	True	False	ethereum	t5_2zf9m	r/ethereum	public		0	[]		 removed 	0.46707504987716675	0.5148742198944092	0.5170193910598755	0.5029740929603577	0.4936113953590393	0.5123135447502136	0.45383262634277344	0.4847692549228668	0.4981911778450012	0.5145108103752136
113	[]	False		[deleted]						dark					[removed]	fe993932d6dced4c0a879e9aa5d7a6e0fbb467f5	True	False					0	1648827506		0	{}	i2zu5c6	False	t3_ttqskr	False	True	t1_i2zdnxp	/r/ethereum/comments/ttqskr/really_why_hold/i2zu5c6/	1648827518	1	False	True	False	ethereum	t5_2zf9m	r/ethereum	public		0	[]		 removed 	0.46707504987716675	0.5148742198944092	0.5170193910598755	0.5029740929603577	0.4936113953590393	0.5123135447502136	0.45383262634277344	0.4847692549228668	0.4981911778450012	0.5145108103752136
