Unnamed: 0	all_awardings	archived	associated_award	author	author_flair_background_color	author_flair_css_class	author_flair_richtext	author_flair_template_id	author_flair_text	author_flair_text_color	author_flair_type	author_fullname	author_patreon_flair	author_premium	body	body_sha1	can_gild	collapsed	collapsed_because_crowd_control	collapsed_reason	collapsed_reason_code	comment_type	controversiality	created_utc	distinguished	gilded	gildings	id	is_submitter	link_id	locked	no_follow	parent_id	permalink	retrieved_utc	score	score_hidden	send_replies	stickied	subreddit	subreddit_id	subreddit_name_prefixed	subreddit_type	top_awarded_type	total_awards_received	treatment_tags	unrepliable_reason	author_cakeday	corpus	support	knowledge	conflict	power	similarity	fun	status	trust	identity	romance
84	[]	False		BitListMarketplace		noob	[{'e': 'text', 't': 'redditor for 1 week'}]	2ec8e69e-6c36-11e9-a04b-0afb553d4ea6	redditor for 1 week	dark	richtext	t2_rkslonn5	False	False	Why should it raise a red flag? It’s just money. Just because other people dont carry cash doesn’t mean it’s illegal to do so. They have no right to take his money with no evidence of a crime being committed with said money	df0ced87b848e9ad20838d1e68b2edbd70ce59f2	True	False					0	1663456135		0	{}	iouuuf1	False	t3_xgyql5	False	True	t1_iouu01t	/r/Bitcoin/comments/xgyql5/we_will_all_be_bank_free_soon/iouuuf1/	1663456155	1	True	True	False	Bitcoin	t5_2s3qj	r/Bitcoin	public		0	[]			why should it raise a red flag it s just money just because other people dont carry cash doesn t mean it s illegal to do so they have no right to take his money with no evidence of a crime being committed with said money	0.0042987000197172165	0.9862449765205383	0.9560974836349487	0.8328103423118591	0.009023664519190788	0.3091612160205841	0.07541409879922867	8.347236075678666e-07	0.32707589864730835	0.027545178309082985
85	[]	False		temchic			[]				text	t2_fei9in4d	False	False	It seems to me that I'll have to start reading a little more now.	b8b5880327c389fbf2b2c303e1e0e31c27beaec9	True	False					0	1663456083		0	{}	iouuqhx	False	t3_xf8au9	False	True	t1_iomlrsw	/r/Bitcoin/comments/xf8au9/ath_hashrate_but_where_are_the_miners_everywhere/iouuqhx/	1663456100	1	True	True	False	Bitcoin	t5_2s3qj	r/Bitcoin	public		0	[]			it seems to me that i ll have to start reading a little more now 	0.45639610290527344	0.4758220613002777	0.18319837749004364	0.05994918569922447	0.45200231671333313	0.48362481594085693	0.17963062226772308	0.21818070113658905	0.26913854479789734	0.021963946521282196
86	[]	False		SaltyEchidna4682			[]				text	t2_btv8buqh	False	False	Same thing happened to me. It reset my banking info and made me route through a third party. Then I had to do the verification process twice before it went through. It did finally work tho.	8ab770a66257be1879ca6d4f33c2fb3a95a2944a	True	False					0	1663456072		0	{}	iouupnk	False	t3_xgqx3p	False	True	t1_iothteb	/r/Bitcoin/comments/xgqx3p/six_reasons_to_withdraw_your_bitcoin_from/iouupnk/	1663456084	1	True	True	False	Bitcoin	t5_2s3qj	r/Bitcoin	public		0	[]			same thing happened to me it reset my banking info and made me route through a third party then i had to do the verification process twice before it went through it did finally work tho 	0.011380862444639206	0.9577646851539612	0.1562795639038086	0.021748146042227745	0.9895851016044617	0.5846646428108215	0.06469383090734482	8.437491487711668e-07	0.16154305636882782	0.06237632781267166
87	[]	False		BitListMarketplace		noob	[{'e': 'text', 't': 'redditor for 1 week'}]	2ec8e69e-6c36-11e9-a04b-0afb553d4ea6	redditor for 1 week	dark	richtext	t2_rkslonn5	False	False	Be suspected of a drug crime probably. But that doesn’t mean you are guilty of said crime	b3e548bbcb68f3d6415e741d7d706bb747a2342c	True	False					0	1663456057		0	{}	iouuoi7	False	t3_xgyql5	False	True	t1_ioutj96	/r/Bitcoin/comments/xgyql5/we_will_all_be_bank_free_soon/iouuoi7/	1663456068	1	True	True	False	Bitcoin	t5_2s3qj	r/Bitcoin	public		0	[]			be suspected of a drug crime probably but that doesn t mean you are guilty of said crime	0.16326111555099487	0.6398371458053589	0.917722761631012	0.03829306736588478	0.2714810073375702	0.3904721736907959	0.11603605002164841	2.4002215468499344e-06	0.511292040348053	0.003582061966881156
88	[]	False		200kBR			[]				text	t2_axt28s3z	False	False	Who holds 87k cash in their car?? Dang, that 87k is now worth 76k. USD; the next shitcoin?	e4b59f5e003e606e6534caf8e8960d2ca9282d80	True	False					0	1663456036		0	{}	iouumum	False	t3_xgyql5	False	True	t3_xgyql5	/r/Bitcoin/comments/xgyql5/we_will_all_be_bank_free_soon/iouumum/	1663456054	1	True	True	False	Bitcoin	t5_2s3qj	r/Bitcoin	public		0	[]			who holds 87k cash in their car dang that 87k is now worth 76k usd the next shitcoin 	0.06714186072349548	0.8959830403327942	0.3187367916107178	0.1016625389456749	0.26455461978912354	0.07124791294336319	0.14437298476696014	0.7977500557899475	0.40055567026138306	8.971252100309357e-05
89	[]	False		BitListMarketplace		noob	[{'e': 'text', 't': 'redditor for 1 week'}]	2ec8e69e-6c36-11e9-a04b-0afb553d4ea6	redditor for 1 week	dark	richtext	t2_rkslonn5	False	False	No it’s not. The point is that they took it at all, with zero reason. If he had Bitcoin, they wouldn’t be able to.	bb527902cef30a0b997a4ea53bdbce3f001d9361	True	False					0	1663456013		0	{}	iouul4r	False	t3_xgyql5	False	True	t1_iout2zo	/r/Bitcoin/comments/xgyql5/we_will_all_be_bank_free_soon/iouul4r/	1663456030	1	True	True	False	Bitcoin	t5_2s3qj	r/Bitcoin	public		0	[]			no it s not the point is that they took it at all with zero reason if he had bitcoin they wouldn t be able to 	0.011049340479075909	0.9632319808006287	0.7817796468734741	0.8999124765396118	0.6997472047805786	0.32761943340301514	0.07628832757472992	8.312283057421155e-07	0.3687238395214081	0.00023081968538463116
90	[]	False		pwuille		expert	[{'e': 'text', 't': 'Pieter Wuille - Bitcoin Expert'}]		Pieter Wuille - Bitcoin Expert	dark	richtext	t2_97r5g	False	False	You actually do. Even if you use every address only once, the keys are related through the use of BIP32 derivation in many cases. If someone knew the xpub your addresses were derived from, and you reused nonces to sign with them, that would equally let an attacker compute your private keys.	2b815a8e652c13d51c4068d809ce79103035430b	True	False					0	1663455975		0	{}	iouui6m	False	t3_xfuht5	False	True	t1_iotdmq6	/r/Bitcoin/comments/xfuht5/bitcoin_rng_vulnerabilities/iouui6m/	1663455991	1	True	True	False	Bitcoin	t5_2s3qj	r/Bitcoin	public		0	[]			you actually do even if you use every address only once the keys are related through the use of bip32 derivation in many cases if someone knew the xpub your addresses were derived from and you reused nonces to sign with them that would equally let an attacker compute your private keys 	0.0026041388045996428	0.9897099137306213	0.31671664118766785	0.036055948585271835	0.008274336345493793	0.2895388603210449	0.08965646475553513	8.516368552591302e-07	0.3855844736099243	0.03121480531990528
91	[]	False		Available_Bed_1913			[]				text	t2_7hdb7mcg	False	False	Do they apply the inflaction? /s	494b19b1a493217defacb883f7c9000ffb2c6eb2	True	False					0	1663455908		0	{}	iouucxl	False	t3_xgyql5	False	True	t1_ioulwgj	/r/Bitcoin/comments/xgyql5/we_will_all_be_bank_free_soon/iouucxl/	1663455922	1	True	True	False	Bitcoin	t5_2s3qj	r/Bitcoin	public		0	[]			do they apply the inflaction s	0.4789399802684784	0.5704743266105652	0.4033163785934448	0.6134232878684998	0.45288610458374023	0.41417354345321655	0.3660600185394287	0.33412426710128784	0.4894651174545288	0.07553765922784805
92	[]	False		Keth43			[]				text	t2_s96lw	False	False	Maybe it feel slow because you have unrealistic expectations of what Bitcoin is?	a8262823f5661d46d49e29795e1623df5041b67c	True	False					0	1663455897		0	{}	iouuc0e	False	t3_xgw29z	False	True	t3_xgw29z	/r/Bitcoin/comments/xgw29z/crypto_slowing_bitcoins_adoption/iouuc0e/	1663455914	1	True	True	False	Bitcoin	t5_2s3qj	r/Bitcoin	public		0	[]			maybe it feel slow because you have unrealistic expectations of what bitcoin is 	0.512388288974762	0.4430786669254303	0.7820720672607422	0.0903090387582779	0.3688138425350189	0.3139844238758087	0.2233319729566574	0.24447202682495117	0.49464836716651917	0.003964410163462162
93	[]	False		pwuille		expert	[{'e': 'text', 't': 'Pieter Wuille - Bitcoin Expert'}]		Pieter Wuille - Bitcoin Expert	dark	richtext	t2_97r5g	False	False	"I can't give you a good answer to that. It's just always been part of the ECDSA signing algorithm. It begins with ""generate a random number r in range 1 to the group size - 1"". It doesn't actually need to be random, it merely needs to be entirely unpredictable to attackers, but without that, it's trivial to recover the private key from a signature."	88d4fbd4f6b5aa57756b2e02db2836d3f0be077c	True	False					0	1663455869		0	{}	iouu9uw	False	t3_xfuht5	False	False	t1_iot8cle	/r/Bitcoin/comments/xfuht5/bitcoin_rng_vulnerabilities/iouu9uw/	1663455883	1	True	True	False	Bitcoin	t5_2s3qj	r/Bitcoin	public		0	[]			i can t give you a good answer to that it s just always been part of the ecdsa signing algorithm it begins with generate a random number r in range 1 to the group size 1 it doesn t actually need to be random it merely needs to be entirely unpredictable to attackers but without that it s trivial to recover the private key from a signature 	0.0025625191628932953	0.9893484115600586	0.49400267004966736	0.015803098678588867	0.007776892744004726	0.24988007545471191	0.0800386443734169	8.699325917405076e-07	0.3263959586620331	0.008710597641766071
94	[]	False		pperpich			[]				text	t2_djptrloa	False	False	Thanks dude, no matter how much I see it, I just like to see it more.	c25180428671c4cab7c1c0234edf96eb3f32387a	True	False					0	1663455859		0	{}	iouu92o	False	t3_xf8au9	False	True	t1_iolgoyp	/r/Bitcoin/comments/xf8au9/ath_hashrate_but_where_are_the_miners_everywhere/iouu92o/	1663455875	1	True	True	False	Bitcoin	t5_2s3qj	r/Bitcoin	public		0	[]			thanks dude no matter how much i see it i just like to see it more 	0.4495573937892914	0.2878912091255188	0.18477219343185425	0.016097292304039	0.5595190525054932	0.5937641859054565	0.8459829688072205	0.8502532839775085	0.3323405981063843	0.004636765923351049
95	[]	False		Sweaty_Camel_118			[]			dark	text	t2_dgpuvwvq	False	False	Selling bitcoin for fiat and being taxed is a form of fiat regulation. Your making a gain in fiat. Bitcoing isn't regulated in that regard. Why would you sell your bitcoin for fiat when you could buy things with bitcoin?	252e2643a59a9f8bc404e9957ad540c6ac57c73d	True	False					0	1663455802		0	{}	iouu4q5	False	t3_xgw29z	False	True	t1_iouqecl	/r/Bitcoin/comments/xgw29z/crypto_slowing_bitcoins_adoption/iouu4q5/	1663455813	1	True	True	False	Bitcoin	t5_2s3qj	r/Bitcoin	public		0	[]			selling bitcoin for fiat and being taxed is a form of fiat regulation your making a gain in fiat bitcoing isn t regulated in that regard why would you sell your bitcoin for fiat when you could buy things with bitcoin 	0.0009558197925798595	0.9952848553657532	0.7456405758857727	0.010252680629491806	0.004193718545138836	0.2135476917028427	0.08628666400909424	8.493788072883035e-07	0.3514973223209381	0.0004882134962826967
96	[]	False		pazza83			[]			dark	text	t2_8m3hlmsw	False	False	Check out [Bisq](https://bisq.network/)	cdd60c752de626dd2b8ebc0005440d8192246aff	True	False					0	1663455780		0	{}	iouu32m	False	t3_xfx3pi	False	False	t3_xfx3pi	/r/Bitcoin/comments/xfx3pi/this_has_been_asked_a_billion_times_how_to/iouu32m/	1663455797	1	True	True	False	Bitcoin	t5_2s3qj	r/Bitcoin	public		0	[]			check out bisq https bisq network 	0.4872845411300659	0.5704951286315918	0.47545507550239563	0.6201176643371582	0.38380154967308044	0.16825351119041443	0.3988407254219055	0.35671788454055786	0.4765370786190033	0.008146082982420921
97	[]	False		LCmeplzbro			[]				text	t2_2ulcbrl0	False	False	Why the hell did he have 100k in cash in his car? Ofc it raises suspicion lmao wtf. Glad he got it back if it was clean money	a494bbdbe0e35f0bd5bcc957c60b46d8bce22ba0	True	False					0	1663455742		0	{}	iouu01t	False	t3_xgyql5	False	True	t3_xgyql5	/r/Bitcoin/comments/xgyql5/we_will_all_be_bank_free_soon/iouu01t/	1663455759	1	True	True	False	Bitcoin	t5_2s3qj	r/Bitcoin	public		0	[]			why the hell did he have 100k in cash in his car ofc it raises suspicion lmao wtf glad he got it back if it was clean money	0.011583535000681877	0.47047552466392517	0.8451895117759705	0.011065359227359295	0.22650420665740967	0.9037637114524841	0.07038917392492294	8.369444230993395e-07	0.20695248246192932	0.021883394569158554
98	[]	False		Keth43			[]				text	t2_s96lw	False	False	"There’s a video (with police body cam) in the article that goes over the entire incident in great detail. 

Yes, there is body cam footage of the using a dog to sniff it and that is what they use as an “active alert” to seize the currency. The video also states that studies show that 65-100% of usd will test positive for drug residue."	3846737da70a84ad3e7827c408e233d4332dcadb	True	False					0	1663455726		0	{}	ioutyti	False	t3_xgyql5	False	True	t1_iouos8r	/r/Bitcoin/comments/xgyql5/we_will_all_be_bank_free_soon/ioutyti/	1663455744	1	True	True	False	Bitcoin	t5_2s3qj	r/Bitcoin	public		0	[]			there s a video with police body cam in the article that goes over the entire incident in great detail yes there is body cam footage of the using a dog to sniff it and that is what they use as an active alert to seize the currency the video also states that studies show that 65 100 of usd will test positive for drug residue 	0.002850495046004653	0.9885681867599487	0.12808555364608765	0.17372481524944305	0.9945769309997559	0.20546607673168182	0.10743658244609833	8.570460749979247e-07	0.3997551202774048	0.00899574812501669
99	[]	False		g33kb0y3a			[]				text	t2_6gktf3qm	False	False	https://forum.qnap.com/viewtopic.php?f=45&amp;t=164797	5c42e4df073c8d08bdd5bb9d387462c81a60bdf6	True	False					0	1663455668		0	{}	ioutue1	False	t3_xgumku	False	True	t1_iou35br	/r/Bitcoin/comments/xgumku/op_return_code_help/ioutue1/	1663455682	1	True	True	False	Bitcoin	t5_2s3qj	r/Bitcoin	public		0	[]			https forum qnap com viewtopic php f 45 amp t 164797	0.17054994404315948	0.8016760349273682	0.3621428310871124	0.6464294791221619	0.12026498466730118	0.1863374412059784	0.3791091740131378	0.1403869241476059	0.4215885102748871	2.4937033231253736e-05
100	[]	False		Nada_Lives			[]				text	t2_4yjkrfk	False	False	"Well, someone now downvoted me twice for just discussing this. 

Bitcoin has no control over its ""usage"". It just goes on being what it is."	47a5c1b8acaeb277a6401f7e5bf06308a3b37cc6	True	False					0	1663455646		0	{}	ioutsly	False	t3_xgw29z	False	True	t1_iouqecl	/r/Bitcoin/comments/xgw29z/crypto_slowing_bitcoins_adoption/ioutsly/	1663455659	1	True	True	False	Bitcoin	t5_2s3qj	r/Bitcoin	public		0	[]			well someone now downvoted me twice for just discussing this bitcoin has no control over its usage it just goes on being what it is 	0.10896351933479309	0.9032285809516907	0.781997799873352	0.02555622160434723	0.7359921336174011	0.45066097378730774	0.06924640387296677	0.6944792866706848	0.34542083740234375	0.010779350064694881
101	[]	False		Semmcity			[]				text	t2_rhirl	False	False	I’m hoping not soon cause I want one or two of them plz 🥹	f80b1101ea06a7c85d1ee1027e9d1331d220c3ba	True	False					0	1663455576		0	{}	ioutn8w	False	t3_xgp2ys	False	True	t3_xgp2ys	/r/Bitcoin/comments/xgp2ys/what_will_usher_in_the_new_bull_run/ioutn8w/	1663455589	1	True	True	False	Bitcoin	t5_2s3qj	r/Bitcoin	public		0	[]			i m hoping not soon cause i want one or two of them plz 	0.6723563075065613	0.32275092601776123	0.4691375494003296	0.056586991995573044	0.409097284078598	0.5506671071052551	0.2440599799156189	0.8388567566871643	0.3410891890525818	0.006155537907034159
102	[]	False		pazza83			[]			dark	text	t2_8m3hlmsw	False	False	Check out the getting started guide: https://bisq.network/getting-started/	752bc1f7829b3a8b513ed2a7218169b40bbdf524	True	False					0	1663455555		0	{}	ioutll6	False	t3_xc1lb5	False	True	t3_xc1lb5	/r/Bitcoin/comments/xc1lb5/could_anyone_help_me_understand_how_to_use_bisq/ioutll6/	1663455575	1	True	True	False	Bitcoin	t5_2s3qj	r/Bitcoin	public		0	[]			check out the getting started guide https bisq network getting started 	0.4343682825565338	0.675707995891571	0.36675992608070374	0.7611746788024902	0.44080650806427	0.4184170067310333	0.245014950633049	0.04432401433587074	0.35128873586654663	0.001916887704282999
103	[]	False		deeeznotes			[]			dark	text	t2_a2xzzrmf	False	False	What do you have to do for the DEA to pull you over?	1ebb266b646b416f40176377e6b79aaef89c35d6	True	False					0	1663455525		0	{}	ioutj96	False	t3_xgyql5	False	True	t3_xgyql5	/r/Bitcoin/comments/xgyql5/we_will_all_be_bank_free_soon/ioutj96/	1663455543	1	True	True	False	Bitcoin	t5_2s3qj	r/Bitcoin	public		0	[]			what do you have to do for the dea to pull you over 	0.49102509021759033	0.5442905426025391	0.5355814099311829	0.6424700021743774	0.24785034358501434	0.5073334574699402	0.1711605340242386	0.002437559189274907	0.2846774160861969	0.009633192792534828
104	[]	False		gotosteven			[]				text	t2_f2yf82ob	False	False	It's all good with BTC and we have that believe man.	f35b86e7d664e4cb104e350035e37f4f2e5b9a8d	True	False					0	1663455516		0	{}	ioutihn	False	t3_xftykj	False	True	t1_iop7t8h	/r/Bitcoin/comments/xftykj/bitcoin_island_is_over_100_businesses_now/ioutihn/	1663455526	1	True	True	False	Bitcoin	t5_2s3qj	r/Bitcoin	public		0	[]			it s all good with btc and we have that believe man 	0.6098102331161499	0.4390294551849365	0.28339695930480957	0.2520837187767029	0.6471395492553711	0.30680564045906067	0.5409769415855408	0.7773938179016113	0.4895889461040497	0.020215462893247604
105	[]	False		Unun_Pentium			[]				text	t2_ce0rkejb	False	False	Good point - I don’t see it when I log onto the app. However, when I log in via the website, I see the option for either direct connection via Plaid or manually entering bank info.	d944ea0f4ce64261eb7c6a87b3f36d6f1f2359be	True	False					0	1663455483		0	{}	ioutfxv	True	t3_xgtrvh	False	True	t1_ioury5f	/r/Bitcoin/comments/xgtrvh/kraken_now_accepting_ach_deposits/ioutfxv/	1663455496	1	True	True	False	Bitcoin	t5_2s3qj	r/Bitcoin	public		0	[]			good point i don t see it when i log onto the app however when i log in via the website i see the option for either direct connection via plaid or manually entering bank info 	0.0039135911501944065	0.9862545728683472	0.018059203401207924	0.01462640892714262	0.5250598192214966	0.30683958530426025	0.10061702132225037	8.39407960029348e-07	0.36877351999282837	0.004093052353709936
106	[]	False		MindSecurity			[]				text	t2_8ch24	False	False	You need to post sources when posting this crap. No one gives a shit about Twitter account hearsay bullshit.	66b0aabed7d34f5e5b30bf9c395d336c7b78da73	True	False					0	1663455429		0	{}	ioutbuc	False	t3_xgkp0z	False	True	t1_iou1gun	/r/Bitcoin/comments/xgkp0z/til_that_a_division_of_greenpeace_took_a_5m_bribe/ioutbuc/	1663455441	1	True	True	False	Bitcoin	t5_2s3qj	r/Bitcoin	public		0	[]			you need to post sources when posting this crap no one gives a shit about twitter account hearsay bullshit 	0.04990437254309654	0.6240792870521545	0.9367797374725342	0.28150105476379395	0.08870097994804382	0.37436413764953613	0.1447334587574005	9.273993555325433e-07	0.2737662196159363	0.0005214556003920734
107	[]	False		runnerinthegarde			[]				text	t2_evbu4yef	False	False	Yep it's likely that it's all nodes but it all helps in making btc more decentralised.	72b7b1f501d21d853702544701e02df21634cfeb	True	False					0	1663455377		0	{}	iout7vo	False	t3_xf8au9	False	True	t1_iolxo3u	/r/Bitcoin/comments/xf8au9/ath_hashrate_but_where_are_the_miners_everywhere/iout7vo/	1663455387	1	True	True	False	Bitcoin	t5_2s3qj	r/Bitcoin	public		0	[]			yep it s likely that it s all nodes but it all helps in making btc more decentralised 	0.18148238956928253	0.9334388971328735	0.2180711179971695	0.0183302890509367	0.6524400115013123	0.1034323051571846	0.13841640949249268	1.9351366518094437e-06	0.5018309950828552	5.699480971088633e-05
108	[]	False		Longjumping-Low3164			[]			dark	text	t2_c1db2dm0	False	False	I understood Bitcoin only after 3 years of analysis. I thought altcoins are better. God how wrong I was. I guess it will take time before World will understand. Altcoins will go to the same place where Theranos went.	0c31553cfe871c0b9e9f40fcadf75b0169d75c47	True	False					0	1663455334		0	{}	iout4mb	False	t3_xgw29z	False	True	t3_xgw29z	/r/Bitcoin/comments/xgw29z/crypto_slowing_bitcoins_adoption/iout4mb/	1663455349	1	True	True	False	Bitcoin	t5_2s3qj	r/Bitcoin	public		0	[]			i understood bitcoin only after 3 years of analysis i thought altcoins are better god how wrong i was i guess it will take time before world will understand altcoins will go to the same place where theranos went 	0.017116984352469444	0.9578586220741272	0.24042287468910217	0.014610733836889267	0.9767975211143494	0.34555935859680176	0.08613418787717819	8.672354852024e-07	0.24956266582012177	0.009412545710802078
109	[]	False		ip_address_freely			[]				text	t2_qgdbx	False	False	Joe Biden supported civil forfeiture laws in the late 80s and early 90s, FYI.	1e2612ed17276705c7049bb48c78b9b91ebe5cdc	True	False					0	1663455331		0	{}	iout4d3	False	t3_xgyql5	False	True	t3_xgyql5	/r/Bitcoin/comments/xgyql5/we_will_all_be_bank_free_soon/iout4d3/	1663455341	1	True	True	False	Bitcoin	t5_2s3qj	r/Bitcoin	public		0	[]			joe biden supported civil forfeiture laws in the late 80s and early 90s fyi 	0.11106138676404953	0.7442755699157715	0.3772004544734955	0.6534681916236877	0.3119588792324066	0.3379323482513428	0.31836560368537903	9.86921463663748e-07	0.4667777121067047	0.0011172173544764519
110	[]	False		Short-Shopping3197			[]				text	t2_bm8c1fir	False	False	Well that’s embarrassing for OP	73dfe252e660def62f8b8b3b3f1d49f58a4c9fbe	True	False					0	1663455313		0	{}	iout2zo	False	t3_xgyql5	False	True	t1_ioulwgj	/r/Bitcoin/comments/xgyql5/we_will_all_be_bank_free_soon/iout2zo/	1663455325	1	True	True	False	Bitcoin	t5_2s3qj	r/Bitcoin	public		0	[]			well that s embarrassing for op	0.5133450031280518	0.4949616491794586	0.42313092947006226	0.3800421357154846	0.5147369503974915	0.724438488483429	0.46466949582099915	0.5555707812309265	0.4599948525428772	0.08975939452648163
111	[]	False		ryanq99			[]				text	t2_j96u7	False	False	The difference is it’s probably unlikely satoshi still has the keys. Imagine what would happen if satoshis stash started moving. Could be detrimental.	006b4ac7278a401e05d2b1bbc81fb8e25751b290	True	False					0	1663455252		0	{}	iousyb4	False	t3_xgk0fl	False	True	t1_ioujlzx	/r/Bitcoin/comments/xgk0fl/mathematical_evidence_that_satoshi_mined/iousyb4/	1663455264	1	True	True	False	Bitcoin	t5_2s3qj	r/Bitcoin	public		0	[]			the difference is it s probably unlikely satoshi still has the keys imagine what would happen if satoshis stash started moving could be detrimental 	0.15536651015281677	0.9051330089569092	0.4412843883037567	0.025532657280564308	0.6357197165489197	0.4096527397632599	0.09831329435110092	8.474797255075828e-07	0.41391342878341675	0.023853501304984093
112	[]	False		bcum44			[]				text	t2_dnvaavc3	False	False	Yep, that's how it's looking and it's looking better and better.	878accd800f4265c7b1a1a4e55c3432fe3dad8c5	True	False					0	1663455252		0	{}	iousy9t	False	t3_xf8au9	False	True	t1_ioppmu9	/r/Bitcoin/comments/xf8au9/ath_hashrate_but_where_are_the_miners_everywhere/iousy9t/	1663455264	1	True	True	False	Bitcoin	t5_2s3qj	r/Bitcoin	public		0	[]			yep that s how it s looking and it s looking better and better 	0.495449960231781	0.6501705646514893	0.05294741317629814	0.1243642270565033	0.5310375094413757	0.46558433771133423	0.19975411891937256	0.16862648725509644	0.4045167863368988	0.003748921910300851
113	[]	False		roitakesforever			[]				text	t2_ft5snxg	False	False	nice brain	d43bd29058a187a39cdf4a776929eebe78200256	True	False					0	1663455226		0	{}	iouswcu	False	t3_xgdb6t	False	True	t1_iou81a4	/r/Bitcoin/comments/xgdb6t/daily_discussion_september_17_2022/iouswcu/	1663455241	1	True	True	False	Bitcoin	t5_2s3qj	r/Bitcoin	public		0	[]			nice brain	0.5405702590942383	0.44151702523231506	0.44138315320014954	0.40646544098854065	0.5180210471153259	0.809120774269104	0.519923746585846	0.5178880095481873	0.4682917296886444	0.6164018511772156
114	[]	False		forzagesu			[]				text	t2_13dlti	False	False	The Fed Chair dropping interest rates in 2026	513d347d2fa6cfd91396fe1b7318633eed0119a4	True	False					0	1663455174		0	{}	ioussbh	False	t3_xgp2ys	False	True	t3_xgp2ys	/r/Bitcoin/comments/xgp2ys/what_will_usher_in_the_new_bull_run/ioussbh/	1663455186	1	True	True	False	Bitcoin	t5_2s3qj	r/Bitcoin	public		0	[]			the fed chair dropping interest rates in 2026	0.20046913623809814	0.7044593691825867	0.4709806442260742	0.42896267771720886	0.43970930576324463	0.26641541719436646	0.338801771402359	0.10343539714813232	0.44363871216773987	4.729323700303212e-05
115	[]	False		benegoxel			[]				text	t2_a65qpy5k	False	False	Thanks for this link, every link matters when it comes to decentralisation.	adc2e492b4714905f6cc6ad4a6e7e3b64059cb07	True	False					0	1663455173		0	{}	iouss8w	False	t3_xf8au9	False	True	t1_iolgwja	/r/Bitcoin/comments/xf8au9/ath_hashrate_but_where_are_the_miners_everywhere/iouss8w/	1663455186	1	True	True	False	Bitcoin	t5_2s3qj	r/Bitcoin	public		0	[]			thanks for this link every link matters when it comes to decentralisation 	0.427984356880188	0.7621482014656067	0.05496588349342346	0.20521657168865204	0.5674929618835449	0.10978598147630692	0.8319293856620789	0.6503146290779114	0.3313058912754059	0.00013897032476961613
