Unnamed: 0	all_awardings	archived	associated_award	author	author_flair_background_color	author_flair_css_class	author_flair_richtext	author_flair_template_id	author_flair_text	author_flair_text_color	author_flair_type	author_fullname	author_patreon_flair	author_premium	body	body_sha1	can_gild	collapsed	collapsed_because_crowd_control	collapsed_reason	collapsed_reason_code	comment_type	controversiality	created_utc	distinguished	gilded	gildings	id	is_submitter	link_id	locked	no_follow	parent_id	permalink	retrieved_utc	score	score_hidden	send_replies	stickied	subreddit	subreddit_id	subreddit_name_prefixed	subreddit_type	top_awarded_type	total_awards_received	treatment_tags	unrepliable_reason	author_cakeday	corpus	support	knowledge	conflict	power	similarity	fun	status	trust	identity	romance
254	[]	False		ljump12			[]				text	t2_5x0yc	False	False	"1) There is no slashing right now, so you're safe.


2) A validator verifies the signatures on all the tx's it receives, and then creates a block with those tx's on it. It publishes the block and all the other validators do the same process after its published and verify everythign is correct. The other validators ""vote"" on the correctness of the ""leader"" validators block. In practice, a malicious actor would have to convince 66% of the other validators that the ""false"" transaction was actually correct. An impossible job."	e3b689521a7399a226b3b1d09fabc4885f1cffa9	True	False					0	1643593001		0	{}	huxo53n	False	t3_sgleba	False	True	t3_sgleba	/r/solana/comments/sgleba/general_stakingvalidator_questions/huxo53n/	1643593015	1	False	True	False	solana	t5_hcs2n	r/solana	public		0	[]			1 there is no slashing right now so you re safe 2 a validator verifies the signatures on all the tx s it receives and then creates a block with those tx s on it it publishes the block and all the other validators do the same process after its published and verify everythign is correct the other validators vote on the correctness of the leader validators block in practice a malicious actor would have to convince 66 of the other validators that the false transaction was actually correct an impossible job 	0.002421492012217641	0.9887303709983826	0.8406267166137695	0.9472665786743164	0.008979503065347672	0.46487346291542053	0.0765463188290596	8.394335395678354e-07	0.41041651368141174	0.032656047493219376
255	[]	False		ansi09			[{'e': 'text', 't': 'Moderator'}]		Moderator	dark	richtext	t2_nrj91	False	False	Hello **bunkatze**, yes **Wormholebridge** is a trusted Solana bridge.	f438bfcffa7fe9362b725b4435f9f1ac84e0852c	True	False					0	1643592956		0	{}	huxo12k	False	t3_sgo8ju	False	True	t3_sgo8ju	/r/solana/comments/sgo8ju/is_wormhole_secure/huxo12k/	1643592971	1	False	True	False	solana	t5_hcs2n	r/solana	public		0	[]			hello bunkatze yes wormholebridge is a trusted solana bridge 	0.6647685766220093	0.38457298278808594	0.3066045939922333	0.14202232658863068	0.2239522486925125	0.11910317093133926	0.4797571301460266	0.30793410539627075	0.5057082176208496	0.015341359190642834
256	[]	False		TITANIC_DONG			[]				text	t2_8o17ja4l	False	False	Actually, eth 2.0 (moving to proof of stake) won’t do much of anything to reduce fees. It’s the sharding mechanisms that will reduce fees, and those are much further away from being implemented.	b8b77b01ae66e10a976998f2f2ab6e33749e29b4	True	False					0	1643592929		0	{}	huxnyk7	False	t3_sge0ku	False	True	t1_huxjjsr	/r/solana/comments/sge0ku/what_will_happen_to_solana_when_eth_2_comes_out/huxnyk7/	1643592940	1	False	True	False	solana	t5_hcs2n	r/solana	public		0	[]			actually eth 2 0 moving to proof of stake won t do much of anything to reduce fees it s the sharding mechanisms that will reduce fees and those are much further away from being implemented 	0.022521046921610832	0.9857860207557678	0.6907585263252258	0.6967694759368896	0.012369178235530853	0.23319898545742035	0.0910027027130127	8.463094332000765e-07	0.3651663064956665	0.027491984888911247
257	[]	False		ljump12			[]				text	t2_5x0yc	False	False	"Yea devnet tokens are fake -- used for ""Dev""elopers to test things, and have no value.

If someone is telling you to do something with a devnet wallet, and you're not testing or developing an application, you're probably getting scammed."	a4b1754ab59b12ba65dd79b851fb27f9ce9b319f	True	False					0	1643592768		0	{}	huxnjwk	False	t3_sgkxd8	False	True	t3_sgkxd8	/r/solana/comments/sgkxd8/devnet_funds_real_or_fake/huxnjwk/	1643592780	1	False	True	False	solana	t5_hcs2n	r/solana	public		0	[]			yea devnet tokens are fake used for dev elopers to test things and have no value if someone is telling you to do something with a devnet wallet and you re not testing or developing an application you re probably getting scammed 	0.0068259392865002155	0.987073540687561	0.611342191696167	0.08366561681032181	0.008539116941392422	0.4363858103752136	0.07474508881568909	8.527129011781653e-07	0.25902262330055237	0.03791503980755806
258	[]	False		ansi09			[{'e': 'text', 't': 'Moderator'}]		Moderator	dark	richtext	t2_nrj91	False	False	"**"" Devnet ""** as the nemae says it's only used in the **"" Developer Network ""**, it's only for TESTING purposes, call them FAKE SOL if you like (like in Fake Money).

So to answer your question, no you can't send your Devnet SOLs to your Mainnet Solana wallet."	5439a7532246216371fafad998301c4ef113443e	True	False					0	1643592752		0	{}	huxnihw	False	t3_sgkxd8	False	True	t3_sgkxd8	/r/solana/comments/sgkxd8/devnet_funds_real_or_fake/huxnihw/	1643592764	1	False	True	False	solana	t5_hcs2n	r/solana	public		0	[]			 devnet as the nemae says it s only used in the developer network it s only for testing purposes call them fake sol if you like like in fake money so to answer your question no you can t send your devnet sols to your mainnet solana wallet 	0.002151927910745144	0.9908440709114075	0.6680437326431274	0.01618098095059395	0.011676082387566566	0.25704699754714966	0.11865866929292679	8.469037311442662e-07	0.3129653334617615	0.010341598652303219
259	[]	False		Idgaf115599			[]				text	t2_95ue8eh9	False	False	Eth is like yahoo. It's going to lose its market share to newer and better L1s	9cbcb27c6367e95454f4551b79cede36a942a31a	True	False					0	1643592683		0	{}	huxncl4	False	t3_sglgyq	False	True	t3_sglgyq	/r/solana/comments/sglgyq/if_eth_is_digital_oil_can_solana_be_compared_to/huxncl4/	1643592697	1	False	True	False	solana	t5_hcs2n	r/solana	public		0	[]			eth is like yahoo it s going to lose its market share to newer and better l1s	0.06991750001907349	0.8363826870918274	0.18577754497528076	0.028748830780386925	0.5927588939666748	0.053838323801755905	0.18048474192619324	1.9397502910578623e-06	0.39759156107902527	5.9180940297665074e-05
260	[]	False		ljump12			[]				text	t2_5x0yc	False	False	I believe Jump did a fairly large investment into Solana, and like you said they're spending money to help that investment succeed. They essentially are pyth, and they also are a market maker on serum.	5748f4cbea1ef97d12487aa205ccf4fa13955f43	True	False					0	1643592649		0	{}	huxn9pv	False	t3_sg0r4b	False	True	t3_sg0r4b	/r/solana/comments/sg0r4b/jump_crypto/huxn9pv/	1643592667	1	False	True	False	solana	t5_hcs2n	r/solana	public		0	[]			i believe jump did a fairly large investment into solana and like you said they re spending money to help that investment succeed they essentially are pyth and they also are a market maker on serum 	0.30616241693496704	0.9729182124137878	0.4927437901496887	0.12216632068157196	0.36002182960510254	0.23945803940296173	0.10255040228366852	8.560674586988171e-07	0.415856271982193	0.024584868922829628
261	[]	False		ansi09			[{'e': 'text', 't': 'Moderator'}]		Moderator	dark	richtext	t2_nrj91	False	False	You may always Restore you **Sollet** wallet into **Phantom** / **SolFlare** or any other Solana wallet, using your **Sollet** wallet **Seed Words**.	ba36e1c6d59d7e76cfadfdfe142dbb639fdaaba9	True	False					0	1643592615		0	{}	huxn6rt	False	t3_sgkj4i	False	True	t3_sgkj4i	/r/solana/comments/sgkj4i/help_moving_star_atlas_assets_from_sollet/huxn6rt/	1643592629	1	False	True	False	solana	t5_hcs2n	r/solana	public		0	[]			you may always restore you sollet wallet into phantom solflare or any other solana wallet using your sollet wallet seed words 	0.20416031777858734	0.793189287185669	0.3696557879447937	0.08252965658903122	0.024948332458734512	0.1797410249710083	0.18464414775371552	1.1399745289963903e-06	0.4840884506702423	0.02012590505182743
262	[]	False		ljump12			[]				text	t2_5x0yc	False	False	Yea ftx.us is the easiest way. They'll handle all the backend stuff for you.	2e47f147c376d499f27dd2fd18b07bcb4b97eb19	True	False					0	1643592558		0	{}	huxn1ys	False	t3_sgevhr	False	True	t1_huwl295	/r/solana/comments/sgevhr/i_want_to_send_usdc_from_solana_to_coinbase_pro/huxn1ys/	1643592576	1	False	True	False	solana	t5_hcs2n	r/solana	public		0	[]			yea ftx us is the easiest way they ll handle all the backend stuff for you 	0.5085923075675964	0.46206825971603394	0.28980880975723267	0.05915919318795204	0.47899001836776733	0.6748442053794861	0.18957461416721344	5.5501036513305735e-06	0.3228631913661957	0.0042494828812778
263	[]	False		Visible_Chance5712			[]				text	t2_fr8wvh30	False	False	SOL listed on COINBASE overhyped?	76b4c079e2cbf668719bad6c9b81b825c88cf651	True	False					0	1643592535		0	{}	huxmzwv	False	t3_sg6unr	False	True	t3_sg6unr	/r/solana/comments/sg6unr/is_solana_overhyped/huxmzwv/	1643592545	1	False	True	False	solana	t5_hcs2n	r/solana	public		0	[]			sol listed on coinbase overhyped 	0.3147922456264496	0.5839962959289551	0.5446295142173767	0.47696560621261597	0.4529658555984497	0.4128319323062897	0.4544490575790405	0.39364850521087646	0.47271642088890076	0.3679249882698059
264	[]	False		bondrez			[]				text	t2_z0rcs	False	False	"what? you generalized all things together. That's not even the reason why solana ""will still be faster and will still have lower gas fees."" as suggested by TheBobbyMan9"	366f7203483e2f3901d47abd86c9a5563244f6d7	True	False					0	1643592513		0	{}	huxmy4q	False	t3_sge0ku	False	True	t1_huxkj1k	/r/solana/comments/sge0ku/what_will_happen_to_solana_when_eth_2_comes_out/huxmy4q/	1643592529	1	False	True	False	solana	t5_hcs2n	r/solana	public		0	[]			what you generalized all things together that s not even the reason why solana will still be faster and will still have lower gas fees as suggested by thebobbyman9	0.12564004957675934	0.9493321180343628	0.4999050199985504	0.021532123908400536	0.9317798614501953	0.29677557945251465	0.1294924020767212	7.273233677551616e-07	0.45368459820747375	0.003157902043312788
265	[]	False		ott1030			[]				text	t2_bjplxrdh	False	False	"There's a common misconception going around that ETH2 means faster TPS immediately. ETH2 (the ""merge"") will setup the framework for transaction speed improvements, but those improvements are still a long way from being fully implemented. Having said that, I think the future is multi-chain where each L1 has stregths that differentiate itself from other competitors. So, ETH2 doesn't raise any real concerns for my outlook on Solana."	73cd11c43bfc66e871e64f42a887c6535130eaea	True	False					0	1643592501		0	{}	huxmx41	False	t3_sge0ku	False	True	t3_sge0ku	/r/solana/comments/sge0ku/what_will_happen_to_solana_when_eth_2_comes_out/huxmx41/	1643592513	1	False	True	False	solana	t5_hcs2n	r/solana	public		0	[]			there s a common misconception going around that eth2 means faster tps immediately eth2 the merge will setup the framework for transaction speed improvements but those improvements are still a long way from being fully implemented having said that i think the future is multi chain where each l1 has stregths that differentiate itself from other competitors so eth2 doesn t raise any real concerns for my outlook on solana 	0.0008084779838100076	0.9952110648155212	0.5470996499061584	0.006944801192730665	0.9968691468238831	0.09050768613815308	0.12837836146354675	8.611335147179489e-07	0.43625137209892273	0.00033846244332380593
266	[]	False		ljump12			[]				text	t2_5x0yc	False	False	Yes you can arb, yes its hard, yes serum is a trustworthy platform, and no i wouldn't trust anyone that says they can do it for you.	bb4407a2542c0ad67bda9c15d270e03f193d2323	True	False					0	1643592465		0	{}	huxmu16	False	t3_sggqp0	False	True	t3_sggqp0	/r/solana/comments/sggqp0/amm_arbitrage_trading/huxmu16/	1643592476	1	False	True	False	solana	t5_hcs2n	r/solana	public		0	[]			yes you can arb yes its hard yes serum is a trustworthy platform and no i wouldn t trust anyone that says they can do it for you 	0.1447606235742569	0.7456985116004944	0.13997799158096313	0.014529569074511528	0.012973927892744541	0.5341934561729431	0.0772329568862915	0.8500798940658569	0.346443772315979	0.022849934175610542
267	[]	False		penny__			[]				text	t2_11pmv3fc	False	False	Okay, fair enough, you got me. But you acknowledged the issue existed so I still win. :)	aba67854c1b25e068d2872b946aee2b43b94cf88	True	False					0	1643592424		0	{}	huxmqfl	False	t3_sgmtt1	False	True	t1_huxml8k	/r/solana/comments/sgmtt1/what_happens_to_my_staked_solana_if_a_validator/huxmqfl/	1643592439	1	False	True	False	solana	t5_hcs2n	r/solana	public		0	[]			okay fair enough you got me but you acknowledged the issue existed so i still win 	0.4171670973300934	0.19225893914699554	0.48171719908714294	0.05254058167338371	0.47443389892578125	0.7253255248069763	0.5298071503639221	0.8254671692848206	0.36261990666389465	0.04046541824936867
268	[]	False		xonigx			[]				text	t2_2d2fbw4	False	False	ETH 2 Is never coming out.	dff8bb15ad1c288c7731e15a8823158918bc038b	True	False					0	1643592412		0	{}	huxmpc0	False	t3_sge0ku	False	True	t3_sge0ku	/r/solana/comments/sge0ku/what_will_happen_to_solana_when_eth_2_comes_out/huxmpc0/	1643592425	1	False	True	False	solana	t5_hcs2n	r/solana	public		0	[]			eth 2 is never coming out 	0.43694397807121277	0.5001459717750549	0.6011468172073364	0.4894419312477112	0.49303802847862244	0.5983378291130066	0.3707830607891083	0.39557135105133057	0.4007622003555298	0.2561672627925873
269	[]	False		PolarBearToeNails99			[]				text	t2_767xb111	False	False	That has nothing to do with the topic here and you know it. Nice try though.	f04ec646b79dec6a7627a0e35d72b7bc4288da2e	True	False					0	1643592365		0	{}	huxml8k	False	t3_sgmtt1	False	True	t1_huxlf4d	/r/solana/comments/sgmtt1/what_happens_to_my_staked_solana_if_a_validator/huxml8k/	1643592378	1	False	True	False	solana	t5_hcs2n	r/solana	public		0	[]			that has nothing to do with the topic here and you know it nice try though 	0.4472053349018097	0.507459819316864	0.4346526861190796	0.21155206859111786	0.37241968512535095	0.7865275144577026	0.15585112571716309	0.49949660897254944	0.34067797660827637	0.014118810184299946
270	[]	False		addexecthrowaway			[]				text	t2_er32v8i6	False	False	Vitalik, the creator and current head of ETH, has said multiple times that ETH 2 alone won’t solve the gas issue nor the tps.	5d4182a7ae10ea22196502173062e930af76d003	True	False					0	1643592361		0	{}	huxmkwn	False	t3_sge0ku	False	True	t3_sge0ku	/r/solana/comments/sge0ku/what_will_happen_to_solana_when_eth_2_comes_out/huxmkwn/	1643592379	1	False	True	False	solana	t5_hcs2n	r/solana	public		0	[]			vitalik the creator and current head of eth has said multiple times that eth 2 alone won t solve the gas issue nor the tps 	0.03482750430703163	0.9227392673492432	0.6732858419418335	0.3602604269981384	0.5069138407707214	0.3020101487636566	0.14077302813529968	8.681821555001079e-07	0.403043270111084	0.00475649768486619
271	[]	False		bunkatze			[]				text	t2_hd2nbbt6	False	False	Thanks for the advice, appreciate it	8473a2b69212fb4838eb17bd56ca44a5bca60729	True	False					0	1643592313		0	{}	huxmgp6	True	t3_sgo8ju	False	True	t1_huxmapc	/r/solana/comments/sgo8ju/is_wormhole_secure/huxmgp6/	1643592326	1	False	True	False	solana	t5_hcs2n	r/solana	public		0	[]			thanks for the advice appreciate it	0.7261151075363159	0.40150997042655945	0.04226239025592804	0.47211429476737976	0.4417060911655426	0.46891993284225464	0.8817885518074036	0.6557320356369019	0.32901906967163086	0.152078315615654
272	[]	False		ljump12			[]				text	t2_5x0yc	False	False	Yes, it's legit and fairly 'secure'. It's backed by Jump Crypto, a fairly well known name. Bridges are always a security risk/target, but I would feel comfortable bridging some assets.	4afb6d32a78d80d84ab775125a57a6901c3ce03b	True	False					0	1643592245		0	{}	huxmapc	False	t3_sgo8ju	False	True	t3_sgo8ju	/r/solana/comments/sgo8ju/is_wormhole_secure/huxmapc/	1643592259	1	False	True	False	solana	t5_hcs2n	r/solana	public		0	[]			yes it s legit and fairly secure it s backed by jump crypto a fairly well known name bridges are always a security risk target but i would feel comfortable bridging some assets 	0.057800259441137314	0.9700108170509338	0.24455784261226654	0.014352327212691307	0.8222718238830566	0.2916294038295746	0.10857004672288895	8.335128995895502e-07	0.5347055792808533	0.010466675274074078
273	[]	False		ljump12			[]				text	t2_5x0yc	False	False	This seems like a super tall order. What language are you writing it in? I have some smart contract coding experience, and a lot of solana experience, feel free to DM.	86ee0819357c3fd22f23b5dea0313f4142defb5d	True	False					0	1643592102		0	{}	huxly9p	False	t3_sgdytn	False	True	t3_sgdytn	/r/solana/comments/sgdytn/im_thinking_on_starting_a_solana_crossplatform/huxly9p/	1643592121	1	False	True	False	solana	t5_hcs2n	r/solana	public		0	[]			this seems like a super tall order what language are you writing it in i have some smart contract coding experience and a lot of solana experience feel free to dm 	0.05580979585647583	0.9690495133399963	0.026831261813640594	0.025675155222415924	0.8366594910621643	0.14127127826213837	0.12325892597436905	0.22131268680095673	0.3924234211444855	0.00429044384509325
274	[]	False		MrRandyWatson_100			[]				text	t2_7xvz96z2	False	False	Nothing	4481948392a8846400c954e77f58d76cdaa73963	True	False					0	1643591986		0	{}	huxlo3q	False	t3_sge0ku	False	False	t3_sge0ku	/r/solana/comments/sge0ku/what_will_happen_to_solana_when_eth_2_comes_out/huxlo3q/	1643592000	1	False	True	False	solana	t5_hcs2n	r/solana	public		0	[]			nothing	0.488933801651001	0.48698270320892334	0.5691243410110474	0.5056793689727783	0.49535563588142395	0.525969386100769	0.46508321166038513	0.48798349499702454	0.4883320927619934	0.43242430686950684
275	[]	False		bravetaco2			[]				text	t2_1gxotucr	False	False	ETH 2.0 is actually a centralization effort. What most people don’t realize is the large majority of ETH is still held by original investors that have obfuscated their purchases early on. Over 65% is held by a small group of investors. Once staking becomes the way to control the network, that solidifies centralization forever to the small group forever. Go Google Joe Lubin and you’ll see the early conferences where this has happened. Stay far away from ETH. Solana is really the best bet we have in crypto that we have for smart contracts.	12b81bd5d6dafbca6fff66ebea0aefbbccef72fc	True	False					0	1643591977		0	{}	huxlncw	False	t3_sge0ku	False	True	t3_sge0ku	/r/solana/comments/sge0ku/what_will_happen_to_solana_when_eth_2_comes_out/huxlncw/	1643591993	1	False	True	False	solana	t5_hcs2n	r/solana	public		0	[]			eth 2 0 is actually a centralization effort what most people don t realize is the large majority of eth is still held by original investors that have obfuscated their purchases early on over 65 is held by a small group of investors once staking becomes the way to control the network that solidifies centralization forever to the small group forever go google joe lubin and you ll see the early conferences where this has happened stay far away from eth solana is really the best bet we have in crypto that we have for smart contracts 	0.002638954436406493	0.9887020587921143	0.2094770073890686	0.015420150011777878	0.008916337974369526	0.38570013642311096	0.09716637432575226	8.413506975557539e-07	0.3083658814430237	0.004311567172408104
276	[]	False		penny__			[]				text	t2_11pmv3fc	False	False	The ecosystem chokes up like a little bitch and shuts down, as we’ve seen multiple times before.	1ae563483c25b76e4ef62ef9f1997e12123150e4	True	False					0	1643591885		0	{}	huxlf4d	False	t3_sgmtt1	False	True	t3_sgmtt1	/r/solana/comments/sgmtt1/what_happens_to_my_staked_solana_if_a_validator/huxlf4d/	1643591902	1	False	True	False	solana	t5_hcs2n	r/solana	public		0	[]			the ecosystem chokes up like a little bitch and shuts down as we ve seen multiple times before 	0.24024060368537903	0.5719363689422607	0.8319682478904724	0.017328955233097076	0.6518819332122803	0.5551097989082336	0.10057245939970016	8.721222570784448e-07	0.36119699478149414	0.006919436622411013
277	[]	False		Jack-O-Neill			[]				text	t2_pul7zrd	False	False	https://www.reddit.com/r/solana/comments/sft5ew/i_need_help_urgently/?utm_medium=android_app&amp;utm_source=share	028cf69a63d9ae0ac3ea4c9442e5880baaba0604	True	False					0	1643591868		0	{}	huxldir	False	t3_sgkxd8	False	True	t3_sgkxd8	/r/solana/comments/sgkxd8/devnet_funds_real_or_fake/huxldir/	1643591878	1	False	True	False	solana	t5_hcs2n	r/solana	public		0	[]			https www reddit com r solana comments sft5ew i need help urgently utm medium android app amp utm source share	0.28533557057380676	0.9106565117835999	0.1147516742348671	0.7581241130828857	0.02513744868338108	0.3346428871154785	0.3381621539592743	8.575758556617075e-07	0.449349969625473	0.006089654751121998
278	[]	False		saintluorent			[]				text	t2_40e89ju7	False	True	i recommend you invest your minimum wage into an index fund	a39ca82d1a9ce7828dac94f7d7dbd834bced8e01	True	False					0	1643591865		0	{}	huxldbk	False	t3_sge0ku	False	True	t1_huxl3jj	/r/solana/comments/sge0ku/what_will_happen_to_solana_when_eth_2_comes_out/huxldbk/	1643591878	1	False	True	False	solana	t5_hcs2n	r/solana	public		0	[]			i recommend you invest your minimum wage into an index fund	0.4688013792037964	0.6928712725639343	0.2836991846561432	0.7954835295677185	0.30457258224487305	0.29467397928237915	0.29741936922073364	0.6512258648872375	0.4270942509174347	0.0035298445727676153
279	[]	False		saintluorent			[]				text	t2_40e89ju7	False	True	polygon already hit congestion before lmao stupid false claims	ba26243b1904a4f6be8c7859430ebbddf7775ade	True	False					0	1643591784		0	{}	huxl69j	False	t3_sge0ku	False	True	t1_hux3vl6	/r/solana/comments/sge0ku/what_will_happen_to_solana_when_eth_2_comes_out/huxl69j/	1643591796	1	False	True	False	solana	t5_hcs2n	r/solana	public		0	[]			polygon already hit congestion before lmao stupid false claims	0.14640721678733826	0.43254542350769043	0.9265739917755127	0.16889096796512604	0.3634282052516937	0.6627663373947144	0.2113111913204193	0.026122940704226494	0.36788806319236755	0.0013996742200106382
280	[]	False		DemonCleaner75			[]				text	t2_7o298p2g	False	False	Yeah I really didn’t try to hide the fact now did I captain obvious	abeec467ea6c178e1d4e385c31d4a005c9fb56c5	True	False					0	1643591753		0	{}	huxl3jj	False	t3_sge0ku	False	True	t1_huxkwvt	/r/solana/comments/sge0ku/what_will_happen_to_solana_when_eth_2_comes_out/huxl3jj/	1643591765	1	False	True	False	solana	t5_hcs2n	r/solana	public		0	[]			yeah i really didn t try to hide the fact now did i captain obvious	0.21165324747562408	0.28600284457206726	0.5298547148704529	0.036929089576005936	0.5028466582298279	0.8863682746887207	0.22647112607955933	1.998271045522415e-06	0.29436030983924866	0.01749424822628498
281	[]	False		saintluorent			[]				text	t2_40e89ju7	False	True	lol sore money loser vibes	3d7759614def4d35fca5ee06724741346a22c081	True	False					0	1643591678		0	{}	huxkwvt	False	t3_sge0ku	False	True	t1_huvuizl	/r/solana/comments/sge0ku/what_will_happen_to_solana_when_eth_2_comes_out/huxkwvt/	1643591689	1	False	True	False	solana	t5_hcs2n	r/solana	public		0	[]			lol sore money loser vibes	0.5059317350387573	0.24222731590270996	0.7023593783378601	0.25866273045539856	0.4323853552341461	0.8817555904388428	0.44112417101860046	0.43335434794425964	0.35228201746940613	0.06520381569862366
282	[]	False		Fwiler			[]				text	t2_r1gl3	False	False	"The risk is still there.  To think that people will allow their money to be locked up before services are done, is not going to work for anyone that I know of.  And to think they will be automatically released, is another fantasy.

Especially when you involve different types of money, whether it's a line of credit, business loan, or other means that have stipulations.  Then you can't lock up that money.

Then what if there is a dispute like with any contract?  You did your job, but not to the satisfaction of the employer.  You are still at the, go to court stage."	e5f9ff8bf6f11ecd3d6c7b0adaa8b85f85def05a	True	False					0	1643591619		0	{}	huxkrj3	False	t3_sge0ku	False	True	t1_huwkg10	/r/solana/comments/sge0ku/what_will_happen_to_solana_when_eth_2_comes_out/huxkrj3/	1643591637	1	False	True	False	solana	t5_hcs2n	r/solana	public		0	[]			the risk is still there to think that people will allow their money to be locked up before services are done is not going to work for anyone that i know of and to think they will be automatically released is another fantasy especially when you involve different types of money whether it s a line of credit business loan or other means that have stipulations then you can t lock up that money then what if there is a dispute like with any contract you did your job but not to the satisfaction of the employer you are still at the go to court stage 	0.0025073515716940165	0.9891920685768127	0.9057166576385498	0.9649732708930969	0.007766001857817173	0.46642982959747314	0.06280517578125	8.616657964921615e-07	0.16369321942329407	0.019439425319433212
