Unnamed: 0	all_awardings	archived	associated_award	author	author_flair_background_color	author_flair_css_class	author_flair_richtext	author_flair_template_id	author_flair_text	author_flair_text_color	author_flair_type	author_fullname	author_patreon_flair	author_premium	body	body_sha1	can_gild	collapsed	collapsed_because_crowd_control	collapsed_reason	collapsed_reason_code	comment_type	controversiality	created_utc	distinguished	gilded	gildings	id	is_submitter	link_id	locked	no_follow	parent_id	permalink	retrieved_utc	score	score_hidden	send_replies	stickied	subreddit	subreddit_id	subreddit_name_prefixed	subreddit_type	top_awarded_type	total_awards_received	treatment_tags	unrepliable_reason	author_cakeday	corpus	support	knowledge	conflict	power	similarity	fun	status	trust	identity	romance
0	[]	False		FlowersWillWait			[]				text	t2_898foxe	False	False	"It's an interesting concept...

Not sure why OP just didn't write Pay Bitcoin for sushi lmao"	b163c383cef637cca2c6696d6f22834ee5bf5354	True	False					0	1663459192		0	{}	iov1a8y	False	t3_xgfl6q	False	True	t1_iosb4lr	/r/Bitcoin/comments/xgfl6q/trade_bitcoin_for_sushi_in_nelson_new_zealand/iov1a8y/	1663459205	1	True	True	False	Bitcoin	t5_2s3qj	r/Bitcoin	public		0	[]			it s an interesting concept not sure why op just didn t write pay bitcoin for sushi lmao	0.10898453742265701	0.751582682132721	0.4783991873264313	0.034288469702005386	0.33927953243255615	0.9733498096466064	0.20558080077171326	8.898857686290285e-07	0.3355075418949127	0.003821198595687747
1	[]	False		Enki906			[]				text	t2_3rjdf5l2	False	False	How old are you and when do you plan to retire? When will you sell?	3f7d67afc4398bee63b4cf315e09b1024857d551	True	False					0	1663459036		0	{}	iov0yob	False	t3_xgmhm3	False	True	t3_xgmhm3	/r/Bitcoin/comments/xgmhm3/stacking_sats_every_month_since_oct_2017_60_months/iov0yob/	1663459050	1	True	True	False	Bitcoin	t5_2s3qj	r/Bitcoin	public		0	[]			how old are you and when do you plan to retire when will you sell 	0.5135380029678345	0.5720517635345459	0.32865577936172485	0.7760317921638489	0.3182178735733032	0.4680202603340149	0.13210412859916687	0.4516938030719757	0.2964824140071869	0.12303683161735535
2	[]	False		[deleted]						dark					[removed]	fe993932d6dced4c0a879e9aa5d7a6e0fbb467f5	True	False					0	1663459034		0	{}	iov0yi6	False	t3_xgkgr9	False	True	t3_xgkgr9	/r/Bitcoin/comments/xgkgr9/a_cbdc_would_be_about_the_worst_possible_thing_to/iov0yi6/	1663459050	1	True	True	False	Bitcoin	t5_2s3qj	r/Bitcoin	public		0	[]			 removed 	0.46707504987716675	0.5148742198944092	0.5170193910598755	0.5029740929603577	0.4936113953590393	0.5123135447502136	0.45383262634277344	0.4847692549228668	0.4981911778450012	0.5145108103752136
3	[]	False		m0loch			[]				text	t2_35yj2	False	False	Coldcard	23f747d99c26fa253f7e052e596b8973eba54374	True	False					0	1663458996		0	{}	iov0vos	False	t3_xgqx3p	False	True	t1_iouythh	/r/Bitcoin/comments/xgqx3p/six_reasons_to_withdraw_your_bitcoin_from/iov0vos/	1663459012	1	True	True	False	Bitcoin	t5_2s3qj	r/Bitcoin	public		0	[]			coldcard	0.4630463123321533	0.5352395176887512	0.5127844214439392	0.4709847569465637	0.4710223376750946	0.1883898675441742	0.5000308752059937	0.4854360520839691	0.48816636204719543	0.4087046682834625
4	[]	False		Nada_Lives			[]				text	t2_4yjkrfk	False	False	"They can make proclamations, but they've never affected Bitcoin. Only their own miserable fiat's usefulness.

Bitcoin doesn't care."	c384d60c4dfc791704ada362231ad1e7cb129cb1	True	False					0	1663458984		0	{}	iov0urm	False	t3_xgw29z	False	False	t1_iouz2ct	/r/Bitcoin/comments/xgw29z/crypto_slowing_bitcoins_adoption/iov0urm/	1663458997	1	True	True	False	Bitcoin	t5_2s3qj	r/Bitcoin	public		0	[]			they can make proclamations but they ve never affected bitcoin only their own miserable fiat s usefulness bitcoin doesn t care 	0.3060721755027771	0.6353643536567688	0.7228779792785645	0.0443035364151001	0.2238236516714096	0.5656682848930359	0.22089464962482452	0.7577075362205505	0.452324241399765	0.0030972857493907213
5	[]	False		Future_Hyena4368			[]				text	t2_9ly49fcq	False	False	"A CBDC by default removes the necessity of local banks. America is at it's highest levels of distrust,  so that initial launch should bring a handful over to btc.

Now just a little ways down the road. People are going to be getting taxed by the mile automatically on carbon taxes. It's also going to create an even looser monetary policy and the currency will lose value even faster.

The cbdc will allow for people to get comfortable with mobile wallets and digital interfaces. 

Bullish"	9b59d913427e56ebadb3c5c1e5279dd9fcf90a71	True	False					0	1663458906		0	{}	iov0oua	False	t3_xgkgr9	False	True	t1_iotj4iw	/r/Bitcoin/comments/xgkgr9/a_cbdc_would_be_about_the_worst_possible_thing_to/iov0oua/	1663458921	1	True	True	False	Bitcoin	t5_2s3qj	r/Bitcoin	public		0	[]			a cbdc by default removes the necessity of local banks america is at it s highest levels of distrust so that initial launch should bring a handful over to btc now just a little ways down the road people are going to be getting taxed by the mile automatically on carbon taxes it s also going to create an even looser monetary policy and the currency will lose value even faster the cbdc will allow for people to get comfortable with mobile wallets and digital interfaces bullish	0.002489068079739809	0.9885140061378479	0.23118956387043	0.05630100145936012	0.008056135848164558	0.13610072433948517	0.1307365596294403	8.477796882289113e-07	0.2889479100704193	0.0035403259098529816
6	[]	False		Bright-Elderberry576			[]				text	t2_dhbfm69e	False	False	I personally think Bitcoin is not going to be one of the currencies being used once people start using crypto for transactions, even though it is the most popular cryptocurrency. It’s lack of scalability is slowing its own adoption. Maybe later 2 solutions might help though.	4b2ba021807d9fa1d6cd19b01b0ebd178b214742	True	False					0	1663458905		0	{}	iov0osb	False	t3_xgw29z	False	True	t3_xgw29z	/r/Bitcoin/comments/xgw29z/crypto_slowing_bitcoins_adoption/iov0osb/	1663458921	1	True	True	False	Bitcoin	t5_2s3qj	r/Bitcoin	public		0	[]			i personally think bitcoin is not going to be one of the currencies being used once people start using crypto for transactions even though it is the most popular cryptocurrency it s lack of scalability is slowing its own adoption maybe later 2 solutions might help though 	0.004655808210372925	0.9881173968315125	0.15033705532550812	0.03574041277170181	0.1477796584367752	0.3705439567565918	0.08661510795354843	8.415818228968419e-07	0.3912658393383026	0.007914282381534576
7	[]	False		solomonsatoshi			[]			dark	text	t2_afjkwiri	False	False	"The new mod was literally Easycryptos first employee as a social media manager and since becoming an independent crypto promoter and social media operator still receives sponsorship and funding from Easycrypto including payments for referrals. He had already established r/CryptocurrencyNZ but could not resist taking 'ownership' of NZBitcoin because of its nearly 10000 community offering such a rich opportunity to tout shitcoin for Easycrypto. 

Easycrypto itself is a non custodial broker that hold no cryptocurrency but simply acts as a middleman clipping the ticket of sales and purchases made via Binance and other offshore exchanges. They have a cosy relationship with the banking cartel that refuses to provide reliable banking to NZ exchanges who are forced to use intermediaries. 

The result is NZ is possibly the most obstructed Bitcoin market in the OECD with very high fees charged by Easycrypto who dominate the market and only minor competition from exchanges who operate in constant threat of losing banking access. It looks a lot like market capture and control by the banking cartel. 

Possibly open banking reforms (that the banks have been resisting for over a decade) might be pushed through in the next year and more competition could emerge, but the bankers cartel nominee ex boss of Easycrypto founder/CEO looks like he could win the election next year and if so the bankers cartel obstruction of Bitcoin in NZ is almost certain to continue, IMO."	e124338726a1ca1bf4f615c60650cf19b650993f	True	False					0	1663458902		0	{}	iov0okp	False	t3_xgfl6q	False	True	t1_iouqoec	/r/Bitcoin/comments/xgfl6q/trade_bitcoin_for_sushi_in_nelson_new_zealand/iov0okp/	1663458921	1	True	True	False	Bitcoin	t5_2s3qj	r/Bitcoin	public		0	[]			the new mod was literally easycryptos first employee as a social media manager and since becoming an independent crypto promoter and social media operator still receives sponsorship and funding from easycrypto including payments for referrals he had already established r cryptocurrencynz but could not resist taking ownership of nzbitcoin because of its nearly 10000 community offering such a rich opportunity to tout shitcoin for easycrypto easycrypto itself is a non custodial broker that hold no cryptocurrency but simply acts as a middleman clipping the ticket of sales and purchases made via binance and other offshore exchanges they have a cosy relationship with the banking cartel that refuses to provide reliable banking to nz exchanges who are forced to use intermediaries the result is nz is possibly the most obstructed bitcoin market in the oecd with very high fees charged by easycrypto who dominate the market and only minor competition from exchanges who operate in constant threat of losing banking access it looks a lot like market capture and control by the banking cartel possibly open banking reforms that the banks have been resisting for over a decade might be pushed through in the next year and more competition could emerge but the bankers cartel nominee ex boss of easycrypto founder ceo looks like he could win the election next year and if so the bankers cartel obstruction of bitcoin in nz is almost certain to continue imo 	0.0024217995814979076	0.9890774488449097	0.7527156472206116	0.035904522985219955	0.00783540029078722	0.33935990929603577	0.0779610127210617	8.194151632778812e-07	0.3851590156555176	0.017817769199609756
8	[]	False		Luckynumba2			[]				text	t2_1qz60pmn	False	False	Just wait for this winter, its going to get interesting in France. People might wake up a bit more. We cut off the kings head, we will do it again if push comes to shove. The king being the ECB this time around.	99b838b9d36083c6c5c019f51818b49e450c8c6a	True	False					0	1663458847		0	{}	iov0khz	False	t3_xgng8w	False	True	t1_ioudvkl	/r/Bitcoin/comments/xgng8w/are_europeans_just_going_to_roll_over_and_let/iov0khz/	1663458866	1	True	True	False	Bitcoin	t5_2s3qj	r/Bitcoin	public		0	[]			just wait for this winter its going to get interesting in france people might wake up a bit more we cut off the kings head we will do it again if push comes to shove the king being the ecb this time around 	0.021980540826916695	0.9843971133232117	0.7895027995109558	0.02320745959877968	0.009747774340212345	0.5405394434928894	0.07001715898513794	8.469949079881189e-07	0.1574184149503708	0.02689242549240589
9	[]	False		[deleted]						dark					[removed]	fe993932d6dced4c0a879e9aa5d7a6e0fbb467f5	True	False					0	1663458834		0	{}	iov0jit	False	t3_xgng8w	False	True	t3_xgng8w	/r/Bitcoin/comments/xgng8w/are_europeans_just_going_to_roll_over_and_let/iov0jit/	1663458849	1	True	True	False	Bitcoin	t5_2s3qj	r/Bitcoin	public		0	[]			 removed 	0.46707504987716675	0.5148742198944092	0.5170193910598755	0.5029740929603577	0.4936113953590393	0.5123135447502136	0.45383262634277344	0.4847692549228668	0.4981911778450012	0.5145108103752136
10	[]	False		gvictor808			[]				text	t2_2w0k216g	False	False	Yeah it’s like a placenta, though, longer term.	cdb578b810581087a7391b2cca36ce9622922c78	True	False					0	1663458665		0	{}	iov06ve	False	t3_xgw29z	False	True	t3_xgw29z	/r/Bitcoin/comments/xgw29z/crypto_slowing_bitcoins_adoption/iov06ve/	1663458680	1	True	True	False	Bitcoin	t5_2s3qj	r/Bitcoin	public		0	[]			yeah it s like a placenta though longer term 	0.47258707880973816	0.5185559988021851	0.38547831773757935	0.11423170566558838	0.6001997590065002	0.564556360244751	0.22698375582695007	0.22951635718345642	0.5111692547798157	0.022597482427954674
11	[]	False		eurodiablo			[]				text	t2_a0cwfva4	False	False	This ☝️	97a74e4f5f16fb98ff0aaeaf576c0e9b1acce3ea	True	False					0	1663458635		0	{}	iov04lh	False	t3_xgp2ys	False	True	t1_ioumkfr	/r/Bitcoin/comments/xgp2ys/what_will_usher_in_the_new_bull_run/iov04lh/	1663458649	1	True	True	False	Bitcoin	t5_2s3qj	r/Bitcoin	public		0	[]			this 	0.5047774910926819	0.4987621009349823	0.48036742210388184	0.5125024914741516	0.4887435734272003	0.5407670140266418	0.5104243159294128	0.49320998787879944	0.4738154113292694	0.5025169849395752
12	[]	False		ProtonPacks123			[]				text	t2_x2ykjk8	False	False	The future tends to get pushed back a lot by anti-future idiots.	2d6ec7ad5e40b5bd1bb1d342ac4399f909c542a5	True	False					0	1663458580		0	{}	iov00f3	False	t3_xgoqzc	False	True	t1_iouyl9h	/r/Bitcoin/comments/xgoqzc/bitcoin_nuclear_power_on_the_cover_of_polish/iov00f3/	1663458594	1	True	True	False	Bitcoin	t5_2s3qj	r/Bitcoin	public		0	[]			the future tends to get pushed back a lot by anti future idiots 	0.32141557335853577	0.5790192484855652	0.8026590943336487	0.2785860002040863	0.4067882001399994	0.31970667839050293	0.17858639359474182	0.04013606533408165	0.3461199402809143	0.0027614987920969725
13	[]	False		tuyguy			[]				text	t2_2tu58b0	False	False	"Just follow the log growth curve models for btc, they're pretty accurate within reason.

There's also more QE and the halving to look out for in 2023/2024 respectively."	a48302ccb7cbc032e3a6845857535a5f4bacc7ba	True	False					0	1663458574		0	{}	iouzzyc	False	t3_xgp2ys	False	True	t3_xgp2ys	/r/Bitcoin/comments/xgp2ys/what_will_usher_in_the_new_bull_run/iouzzyc/	1663458586	1	True	True	False	Bitcoin	t5_2s3qj	r/Bitcoin	public		0	[]			just follow the log growth curve models for btc they re pretty accurate within reason there s also more qe and the halving to look out for in 2023 2024 respectively 	0.011871599592268467	0.9882291555404663	0.49243998527526855	0.9291149377822876	0.8431743383407593	0.28339850902557373	0.1112440750002861	8.456124191980052e-07	0.4512220621109009	0.005063655786216259
14	[]	False		[deleted]						dark					[removed]	fe993932d6dced4c0a879e9aa5d7a6e0fbb467f5	True	False					0	1663458549		0	{}	iouzxy7	False	t3_xgaw97	False	True	t3_xgaw97	/r/Bitcoin/comments/xgaw97/my_biggest_concern_about_bitcoin_help_ease_it_for/iouzxy7/	1663458563	1	True	True	False	Bitcoin	t5_2s3qj	r/Bitcoin	public		0	[]			 removed 	0.46707504987716675	0.5148742198944092	0.5170193910598755	0.5029740929603577	0.4936113953590393	0.5123135447502136	0.45383262634277344	0.4847692549228668	0.4981911778450012	0.5145108103752136
15	[]	False		BlackDog990			[]				text	t2_6jfe3vwd	False	False	Not sure but it won't happen until broader market is out of limbo and starts an upward trend. So long as market is suppressed, folks will de-risk and BTC will be stagnant.	1c4ac349d7083f351cf57bc62a8c66ba1d429afa	True	False					0	1663458532		0	{}	iouzwng	False	t3_xgp2ys	False	True	t3_xgp2ys	/r/Bitcoin/comments/xgp2ys/what_will_usher_in_the_new_bull_run/iouzwng/	1663458547	1	True	True	False	Bitcoin	t5_2s3qj	r/Bitcoin	public		0	[]			not sure but it won t happen until broader market is out of limbo and starts an upward trend so long as market is suppressed folks will de risk and btc will be stagnant 	0.03411861136555672	0.9774405360221863	0.6058810353279114	0.056127116084098816	0.07408209890127182	0.31397545337677	0.09886696189641953	8.412720262640505e-07	0.45526108145713806	0.004422023426741362
16	[]	False		tuyguy			[]				text	t2_2tu58b0	False	False	After bond rates increase to the point that major nations can no longer afford the interest on their debt, their CBs will be forced to step in and start buying all the bonds themselves to drive the yields down.	ec9205db5b8d54e2c5a43fc065a521dd99c22613	True	False					0	1663458483		0	{}	iouzt0k	False	t3_xgp2ys	False	True	t1_iot2ero	/r/Bitcoin/comments/xgp2ys/what_will_usher_in_the_new_bull_run/iouzt0k/	1663458502	1	True	True	False	Bitcoin	t5_2s3qj	r/Bitcoin	public		0	[]			after bond rates increase to the point that major nations can no longer afford the interest on their debt their cbs will be forced to step in and start buying all the bonds themselves to drive the yields down 	0.006767654325813055	0.987841784954071	0.6654073596000671	0.938549280166626	0.04660848155617714	0.3297269940376282	0.0741693302989006	8.486143769914634e-07	0.2988296449184418	0.06334513425827026
17	[]	False		gubatron			[]				text	t2_2j56e	False	False	"more like ""how moon"""	38656ec5ce083b8dd2d7cf0853eceb042561e260	True	False					0	1663458405		0	{}	iouzn37	False	t3_xgp2ys	False	True	t1_ioumvxe	/r/Bitcoin/comments/xgp2ys/what_will_usher_in_the_new_bull_run/iouzn37/	1663458416	1	True	True	False	Bitcoin	t5_2s3qj	r/Bitcoin	public		0	[]			more like how moon 	0.4928462505340576	0.5064967274665833	0.3896327018737793	0.4494500756263733	0.509100615978241	0.4956285357475281	0.4423103630542755	0.4885999858379364	0.5029964447021484	0.5645186901092529
18	[]	False		BitListMarketplace		noob	[{'e': 'text', 't': 'redditor for 1 week'}]	2ec8e69e-6c36-11e9-a04b-0afb553d4ea6	redditor for 1 week	dark	richtext	t2_rkslonn5	False	False	Sounds pretty logical to me. Some people don’t like banks (like most of us on this sub)	46a7cb390d68f023aac24c0a7c69712a8aa3ff11	True	False					0	1663458399		0	{}	iouzmne	False	t3_xgyql5	False	True	t1_iouz0bi	/r/Bitcoin/comments/xgyql5/we_will_all_be_bank_free_soon/iouzmne/	1663458416	1	True	True	False	Bitcoin	t5_2s3qj	r/Bitcoin	public		0	[]			sounds pretty logical to me some people don t like banks like most of us on this sub 	0.27390119433403015	0.3969608247280121	0.33313465118408203	0.016302768141031265	0.8429470658302307	0.5092915892601013	0.1775454431772232	9.369363169753342e-07	0.4135631024837494	0.005343357566744089
19	[]	False		gubatron			[]				text	t2_2j56e	False	False	not to mention by then a Fed CBDC dollar will likely be out by then	5853d627232592432b0a057fa4d2a01edb5458f0	True	False					0	1663458365		0	{}	iouzjys	False	t3_xgp2ys	False	True	t1_ioul16d	/r/Bitcoin/comments/xgp2ys/what_will_usher_in_the_new_bull_run/iouzjys/	1663458377	1	True	True	False	Bitcoin	t5_2s3qj	r/Bitcoin	public		0	[]			not to mention by then a fed cbdc dollar will likely be out by then	0.2998693585395813	0.6615334153175354	0.673759400844574	0.5013588666915894	0.28730493783950806	0.3922729194164276	0.1474393755197525	8.893088647710101e-07	0.4035956561565399	0.00875269528478384
20	[]	False		smellyboi6969			[]				text	t2_54ftgfzr	False	False	Lol yeah that's shady as fuck. Also this seems to portray the opposite of what OP was trying to convey. If that money was in a trezor that the DEA seized it would also be civil forfeiture, no?	2e31dbc331cfc67710a64ab67479d1c9bfc79a46	True	False					0	1663458316		0	{}	iouzg5x	False	t3_xgyql5	False	True	t1_iouz0bi	/r/Bitcoin/comments/xgyql5/we_will_all_be_bank_free_soon/iouzg5x/	1663458332	1	True	True	False	Bitcoin	t5_2s3qj	r/Bitcoin	public		0	[]			lol yeah that s shady as fuck also this seems to portray the opposite of what op was trying to convey if that money was in a trezor that the dea seized it would also be civil forfeiture no 	0.004172252956777811	0.919568657875061	0.8035843372344971	0.07146602123975754	0.9882281422615051	0.35541799664497375	0.07345261424779892	8.257513286480389e-07	0.45925387740135193	0.01144674513489008
21	[]	False		silver-blazer29		noob	[{'e': 'text', 't': 'redditor for a day'}]	2ec8e69e-6c36-11e9-a04b-0afb553d4ea6	redditor for a day	dark	richtext	t2_skoifa6q	False	False	"I mean it would be amazing if that wasn’t the case but obviously the government isn’t going to just let gains go because you bought with crypto. 

But that’s just a simple example of what the government can do. They could apply all kinds of regulation to businesses and it would greatly affect how you make purchases with it. Just because it’s decentralized doesn’t mean they can’t regulate Bitcoin by regulating businesses and people."	cd2534722bbeac6cceebd1e9d8940fa24c835a60	True	False					0	1663458305		0	{}	iouzfal	False	t3_xgw29z	False	True	t1_iouygxb	/r/Bitcoin/comments/xgw29z/crypto_slowing_bitcoins_adoption/iouzfal/	1663458325	1	True	True	False	Bitcoin	t5_2s3qj	r/Bitcoin	public		0	[]			i mean it would be amazing if that wasn t the case but obviously the government isn t going to just let gains go because you bought with crypto but that s just a simple example of what the government can do they could apply all kinds of regulation to businesses and it would greatly affect how you make purchases with it just because it s decentralized doesn t mean they can t regulate bitcoin by regulating businesses and people 	0.0022084908559918404	0.9891635179519653	0.5845203995704651	0.014882323332130909	0.994758665561676	0.1915648877620697	0.10470999032258987	8.454092039755778e-07	0.47800320386886597	0.0009663596865721047
22	[]	False		[deleted]						dark					[removed]	fe993932d6dced4c0a879e9aa5d7a6e0fbb467f5	True	False					0	1663458235		0	{}	iouz9xt	False	t3_xgp2ys	False	True	t1_iot8q5z	/r/Bitcoin/comments/xgp2ys/what_will_usher_in_the_new_bull_run/iouz9xt/	1663458253	1	True	True	False	Bitcoin	t5_2s3qj	r/Bitcoin	public		0	[]			 removed 	0.46707504987716675	0.5148742198944092	0.5170193910598755	0.5029740929603577	0.4936113953590393	0.5123135447502136	0.45383262634277344	0.4847692549228668	0.4981911778450012	0.5145108103752136
23	[]	False		DeadlyViperSquad			[]			dark	text	t2_dn8q7sx1	False	False	as long as there is a government, anything can be regulated	2a01e18f3e488a1b555f61640776afe15daadf37	True	False					0	1663458136		0	{}	iouz2ct	False	t3_xgw29z	False	True	t1_iouh7e8	/r/Bitcoin/comments/xgw29z/crypto_slowing_bitcoins_adoption/iouz2ct/	1663458152	1	True	True	False	Bitcoin	t5_2s3qj	r/Bitcoin	public		0	[]			as long as there is a government anything can be regulated	0.45126527547836304	0.7146286368370056	0.584185004234314	0.3379068076610565	0.4429241716861725	0.2482871562242508	0.16370388865470886	0.07698298990726471	0.5796402096748352	0.008193201385438442
24	[]	False		deeeznotes			[]			dark	text	t2_a2xzzrmf	False	False	"Just seems weird. Also that he had nearly 100k on him ""to buy a house"" wat?"	ac100ad48c748bc4d2ac34ce855bf6af00bda4c1	True	False					0	1663458109		0	{}	iouz0bi	False	t3_xgyql5	False	True	t1_iouuoi7	/r/Bitcoin/comments/xgyql5/we_will_all_be_bank_free_soon/iouz0bi/	1663458128	1	True	True	False	Bitcoin	t5_2s3qj	r/Bitcoin	public		0	[]			just seems weird also that he had nearly 100k on him to buy a house wat 	0.07935670763254166	0.6105853319168091	0.364912211894989	0.03485490754246712	0.6725891828536987	0.6466453671455383	0.09648406505584717	0.20237743854522705	0.32515791058540344	0.011985563673079014
25	[]	False		ok46reddit			[]			dark	text	t2_cdvd3qao	False	False	What is negative about anything I have said? I am pointing out what must occur in order that any of this can become sustainable.	0094e68f2d75c81a7f65761c989a82a643272832	True	False					0	1663458088		0	{}	iouyyoh	False	t3_xftykj	False	True	t1_iouy8q2	/r/Bitcoin/comments/xftykj/bitcoin_island_is_over_100_businesses_now/iouyyoh/	1663458104	1	True	True	False	Bitcoin	t5_2s3qj	r/Bitcoin	public		0	[]			what is negative about anything i have said i am pointing out what must occur in order that any of this can become sustainable 	0.04807949438691139	0.8526617288589478	0.6969645619392395	0.0361647829413414	0.5885093212127686	0.2812918424606323	0.11457078158855438	1.26664963318035e-06	0.4810405373573303	0.031001612544059753
26	[]	False		King0liver			[]				text	t2_7kjd0	False	False	Close to the correct conclusion. Off by 1 error	455368399938a043a2df5f6de2821b02bc3838ee	True	False					0	1663458033		0	{}	iouyun6	False	t3_xgw29z	False	True	t3_xgw29z	/r/Bitcoin/comments/xgw29z/crypto_slowing_bitcoins_adoption/iouyun6/	1663458051	1	True	True	False	Bitcoin	t5_2s3qj	r/Bitcoin	public		0	[]			close to the correct conclusion off by 1 error	0.42545121908187866	0.5831968784332275	0.638161838054657	0.6078941226005554	0.5119909048080444	0.34345272183418274	0.30799850821495056	0.09609542042016983	0.38092270493507385	0.15627017617225647
27	[]	False		KingBoo919			[]				text	t2_2of7caf0	False	False	What’s a good hard wallet to use?	3bf419b5c08507d35b78f7a99f35cc9de2baf9c7	True	False					0	1663458018		0	{}	iouythh	False	t3_xgqx3p	False	True	t1_iotsls8	/r/Bitcoin/comments/xgqx3p/six_reasons_to_withdraw_your_bitcoin_from/iouythh/	1663458035	1	True	True	False	Bitcoin	t5_2s3qj	r/Bitcoin	public		0	[]			what s a good hard wallet to use 	0.6262586116790771	0.45957863330841064	0.19520863890647888	0.27396121621131897	0.4352673292160034	0.35540950298309326	0.34693458676338196	0.456939160823822	0.42235198616981506	0.010465697385370731
28	[]	False		BitcoinCentrum			[]			dark	text	t2_n2cv103b	False	False	"You know those people that were saying ""this is the future"" in 1970? One of my biggest fears is that this future never arrives."	06b01d960a92ee3f462a47190eed8a833465cc04	True	False					0	1663457911		0	{}	iouyl9h	False	t3_xgoqzc	False	True	t1_iotifnr	/r/Bitcoin/comments/xgoqzc/bitcoin_nuclear_power_on_the_cover_of_polish/iouyl9h/	1663457927	1	True	True	False	Bitcoin	t5_2s3qj	r/Bitcoin	public		0	[]			you know those people that were saying this is the future in 1970 one of my biggest fears is that this future never arrives 	0.1500331312417984	0.6477473974227905	0.500078022480011	0.4146479666233063	0.778301477432251	0.3556828498840332	0.1351068615913391	0.03570453077554703	0.413074254989624	0.06903456151485443
