Unnamed: 0	all_awardings	archived	associated_award	author	author_flair_background_color	author_flair_css_class	author_flair_richtext	author_flair_template_id	author_flair_text	author_flair_text_color	author_flair_type	author_fullname	author_patreon_flair	author_premium	body	body_sha1	can_gild	collapsed	collapsed_because_crowd_control	collapsed_reason	collapsed_reason_code	comment_type	controversiality	created_utc	distinguished	gilded	gildings	id	is_submitter	link_id	locked	no_follow	parent_id	permalink	retrieved_utc	score	score_hidden	send_replies	stickied	subreddit	subreddit_id	subreddit_name_prefixed	subreddit_type	top_awarded_type	total_awards_received	treatment_tags	unrepliable_reason	author_cakeday	corpus	support	knowledge	conflict	power	similarity	fun	status	trust	identity	romance
139	[]	False		Trooper7281			[]				text	t2_8k1bs2f2	False	False	I mean zkSync had uniswap testnet lest year and since the start of this year the private testnet for v2.0 with evm support. Would not say they are that far away.	a56a43af00dc2b23fcdfda6bc9b1d6a1986a67e3	True	False					0	1643598086		0	{}	huy0vba	False	t3_sgkbqa	False	True	t1_huwutot	/r/ethereum/comments/sgkbqa/picking_the_right_l2_rollup_loopring_vs/huy0vba/	1643598101	1	False	True	False	ethereum	t5_2zf9m	r/ethereum	public		0	[]			i mean zksync had uniswap testnet lest year and since the start of this year the private testnet for v2 0 with evm support would not say they are that far away 	0.1717197299003601	0.9601003527641296	0.7514949440956116	0.05213310196995735	0.011249752715229988	0.37641316652297974	0.1059928610920906	8.397634587709035e-07	0.4244288206100464	0.01987389475107193
140	[]	False		Salt-Repair8034			[]				text	t2_i9eoy4ht	False	False	"Lost it in the ether 

I'm sorry this happened to you."	c1bcd45549efe5fa3ecf821aed6d237a42958fd0	True	False					0	1643598043		0	{}	huy0rpf	False	t3_sfz4kw	False	False	t3_sfz4kw	/r/ethereum/comments/sfz4kw/did_i_just_lose_half_a_million_dollars_by_sending/huy0rpf/	1643598055	1	False	True	False	ethereum	t5_2zf9m	r/ethereum	public		0	[]			lost it in the ether i m sorry this happened to you 	0.4246043860912323	0.3409128487110138	0.358984112739563	0.10038401931524277	0.5470160245895386	0.6102402806282043	0.28368648886680603	0.32228949666023254	0.3438180088996887	0.006404740270227194
141	[]	False		0150r			[]				text	t2_kp6cjag	False	False	People said the same thing five years ago	db93742c2fc7d8eb51a5e1c15823d6eb1556665d	True	False					0	1643598008		0	{}	huy0op0	False	t3_sgm5k4	False	True	t3_sgm5k4	/r/ethereum/comments/sgm5k4/what_do_you_think/huy0op0/	1643598025	1	False	True	False	ethereum	t5_2zf9m	r/ethereum	public		0	[]			people said the same thing five years ago	0.3761068880558014	0.5215144753456116	0.5013720989227295	0.5493221282958984	0.6519893407821655	0.6399143934249878	0.3474516272544861	0.4649156928062439	0.40926721692085266	0.012805833481252193
142	[]	False		Truth__Machine			[]				text	t2_5rnpvgpk	False	False	"&gt;  I'm sure you're right and the entire rest of the world is wrong.

Pretty much. BSV is the true Bitcoin maximalism."	4bb9fbaa4a06edab183a7f0ff17297c713b6d11d	True	False					0	1643597929		0	{}	huy0hr8	False	t3_sgd3zt	False	True	t1_huxu989	/r/ethereum/comments/sgd3zt/a_quick_reminder_of_what_shared_security_means/huy0hr8/	1643597941	1	False	True	False	ethereum	t5_2zf9m	r/ethereum	public		0	[]			 gt i m sure you re right and the entire rest of the world is wrong pretty much bsv is the true bitcoin maximalism 	0.2250858098268509	0.7014215588569641	0.6445300579071045	0.014345827512443066	0.266581267118454	0.27791082859039307	0.1663944572210312	3.3715396057232283e-06	0.42659783363342285	0.004193449392914772
143	[]	False		Amane_VIII			[]				text	t2_71rhb	False	False	No, you'd get your package back with a label saying “return to sender: no such address”.	8dc7a704981d69ce56f6688ab6886d787d063f08	True	False					0	1643597924		0	{}	huy0hfc	False	t3_sfz4kw	False	True	t1_huuq4dj	/r/ethereum/comments/sfz4kw/did_i_just_lose_half_a_million_dollars_by_sending/huy0hfc/	1643597941	1	False	True	False	ethereum	t5_2zf9m	r/ethereum	public		0	[]			no you d get your package back with a label saying return to sender no such address 	0.3066771626472473	0.5551462769508362	0.6784668564796448	0.5315125584602356	0.1609087884426117	0.21965134143829346	0.1726216822862625	8.736523113839212e-07	0.35947930812835693	0.006933527532964945
144	[]	False		FreeFactoid			[]				text	t2_ktjpt3i	False	True	Forks happen all the time on Ethereum. Every EIP needs a fork. You're welcome	a1f1ed25cf2547d33cdd6a55b24ba65e8c8f5aed	True	False					0	1643597873		0	{}	huy0cz2	False	t3_sfz4kw	False	True	t1_huuq7g7	/r/ethereum/comments/sfz4kw/did_i_just_lose_half_a_million_dollars_by_sending/huy0cz2/	1643597887	1	False	True	False	ethereum	t5_2zf9m	r/ethereum	public		0	[]			forks happen all the time on ethereum every eip needs a fork you re welcome	0.46647730469703674	0.6394042372703552	0.27122244238853455	0.14921483397483826	0.33523327112197876	0.39988207817077637	0.3229304850101471	0.591411828994751	0.33869630098342896	0.014805836603045464
145	[]	False		Trooper7281			[]				text	t2_8k1bs2f2	False	False	"Why would you even need to do a testnet. If you want to promote your UI, just use a fully mocked backend. Should be fine 

If you want to promote the backend, just use the low values, should be about the tec in that case."	73002be715fba5de8f41695d2e74d33c15aba132	True	False					0	1643597830		0	{}	huy09c7	False	t3_sglnad	False	True	t1_hux475n	/r/ethereum/comments/sglnad/is_there_way_to_change_a_token_price_on_a/huy09c7/	1643597848	1	False	True	False	ethereum	t5_2zf9m	r/ethereum	public		0	[]			why would you even need to do a testnet if you want to promote your ui just use a fully mocked backend should be fine if you want to promote the backend just use the low values should be about the tec in that case 	0.4729783535003662	0.9872755408287048	0.6297743320465088	0.9407803416252136	0.008975617587566376	0.6261014938354492	0.07187151163816452	8.39449626255373e-07	0.38186123967170715	0.005272496026009321
146	[]	False		pcpLiu			[]				text	t2_2t15nb8	False	False	"One question: didn't all large chains grow from small?

Why we/you are scared of the security of small chains now not before when Ethereum is small?"	2d492f3bb1cae5ff9a8e14c7e2f5cbc371266b95	True	False					0	1643597809		0	{}	huy07ei	False	t3_sgd3zt	False	True	t3_sgd3zt	/r/ethereum/comments/sgd3zt/a_quick_reminder_of_what_shared_security_means/huy07ei/	1643597824	1	False	True	False	ethereum	t5_2zf9m	r/ethereum	public		0	[]			one question didn t all large chains grow from small why we you are scared of the security of small chains now not before when ethereum is small 	0.031203487887978554	0.9155793786048889	0.6513459086418152	0.11046979576349258	0.8079867959022522	0.45324912667274475	0.07498340308666229	8.48693730404193e-07	0.40963825583457947	0.037318725138902664
147	[]	False		Darius510			[]				text	t2_8snn3	False	False	It’s literally what we have right now	874fb307aa00201289b4e6bc8b40656fa8109b91	True	False					0	1643597797		0	{}	huy06g3	False	t3_sgomic	False	True	t1_huxyw5p	/r/ethereum/comments/sgomic/does_ethereum_still_need_to_go_pos/huy06g3/	1643597809	1	False	True	False	ethereum	t5_2zf9m	r/ethereum	public		0	[]			it s literally what we have right now	0.46050941944122314	0.4484288692474365	0.384807288646698	0.5154884457588196	0.5566543936729431	0.5005136728286743	0.31470823287963867	0.37278586626052856	0.466204971075058	0.029619572684168816
148	[]	False		Silverporsche_59			[]				text	t2_7hwlxb5q	False	False	"Let’s hope ETH.2 will come soon hopefully this summer? My ETH is in the vault and will have to stay there until I break even. My avg is 4100. So I am not
Selling now is not wise. So I sit and wait and let the crypto evolve accordingly."	aebd017f692a9cb441200407a7a11ef1e94ad3ea	True	False					0	1643597744		0	{}	huy01v7	False	t3_sggj4e	False	True	t3_sggj4e	/r/ethereum/comments/sggj4e/sold_all_of_my_btc_and_loaded_up_on_eth/huy01v7/	1643597756	1	False	True	False	ethereum	t5_2zf9m	r/ethereum	public		0	[]			let s hope eth 2 will come soon hopefully this summer my eth is in the vault and will have to stay there until i break even my avg is 4100 so i am not selling now is not wise so i sit and wait and let the crypto evolve accordingly 	0.6024560928344727	0.9851742386817932	0.5068635940551758	0.02101660706102848	0.5133419632911682	0.2347297966480255	0.09192905575037003	8.425903956776892e-07	0.23786164820194244	0.0073133911937475204
149	[]	False		Far_Spirit_50			[]				text	t2_ch38iwww	False	False	Cars being mass adopted by every dumb stick out there wasn't a good thing either.	d21d8c013bf473e8db8e3244f0b9f43f0d43f4c6	True	False					0	1643597710		0	{}	huxzyum	False	t3_sfz4kw	False	True	t1_huw6mgc	/r/ethereum/comments/sfz4kw/did_i_just_lose_half_a_million_dollars_by_sending/huxzyum/	1643597725	1	False	True	False	ethereum	t5_2zf9m	r/ethereum	public		0	[]			cars being mass adopted by every dumb stick out there wasn t a good thing either 	0.042905453592538834	0.5425803661346436	0.7798031568527222	0.03358198329806328	0.5550556182861328	0.7797313332557678	0.1477990597486496	8.757928640079626e-07	0.3830568194389343	0.003314584493637085
150	[]	False		VenomousFang666			[]				text	t2_a0sfgcgq	False	False	What that you are the dumb duck that can’t figure bout what address to send shit to?	1023c0318cb340b15f840f726ad7636e77e10023	True	False					0	1643597662		0	{}	huxzung	False	t3_sfz4kw	False	True	t1_huxy5rp	/r/ethereum/comments/sfz4kw/did_i_just_lose_half_a_million_dollars_by_sending/huxzung/	1643597678	1	False	True	False	ethereum	t5_2zf9m	r/ethereum	public		0	[]			what that you are the dumb duck that can t figure bout what address to send shit to 	0.023950573056936264	0.7036964893341064	0.9018416404724121	0.08668822795152664	0.1877262443304062	0.08676212280988693	0.10293318331241608	8.634591495138011e-07	0.304004043340683	2.9066361094010063e-05
151	[]	False		Trooper7281			[]				text	t2_8k1bs2f2	False	False	"It's just the next chain forking the code and set the settings on max. Sure you can go max throttle for a while, but at some point any car will break.
You can have my interest, if a project acctualy tries to improve things."	faa088545b9ff8872c6689e30994a520c8e52cfb	True	False					0	1643597661		0	{}	huxzul1	False	t3_sgomic	False	False	t1_huxx09u	/r/ethereum/comments/sgomic/does_ethereum_still_need_to_go_pos/huxzul1/	1643597678	1	False	True	False	ethereum	t5_2zf9m	r/ethereum	public		0	[]			it s just the next chain forking the code and set the settings on max sure you can go max throttle for a while but at some point any car will break you can have my interest if a project acctualy tries to improve things 	0.00569143844768405	0.9893696308135986	0.2618323564529419	0.9489725232124329	0.008803054690361023	0.32652953267097473	0.07727857679128647	8.395945201300492e-07	0.18206867575645447	0.015531344339251518
152	[]	False		Treyzania			[]				text	t2_8vzbi	False	False	So you're brigading then?  You know that's against reddit ToS, right?	8514a7f2ddb6cff4bddb4b452446024766d29b40	True	False					0	1643597512		0	{}	huxzhiz	False	t3_ry6pl8	False	True	t1_huxz78j	/r/ethereum/comments/ry6pl8/can_anyone_eli5_to_me_what_sharding_is/huxzhiz/	1643597526	1	False	True	False	ethereum	t5_2zf9m	r/ethereum	public		0	[]			so you re brigading then you know that s against reddit tos right 	0.3815046548843384	0.3946240246295929	0.6339066028594971	0.5327706933021545	0.3828526437282562	0.734920859336853	0.2830144166946411	0.002695451956242323	0.44759294390678406	0.0037524320650845766
153	[]	False		AndrewS1793			[]				text	t2_3k0degiq	False	False	I think a simple way to fix this would be to implement some kind of check to see whether or not the address you are sending to can accept the token you are sending. Unsure why this isn’t a feature anywhere, if anyone knows why or other ideas that could solve this problem I would love to hear.	0e86f7c27bef6f0fe88e2a7a3faeb2bb7f6edd5a	True	False					0	1643597426		0	{}	huxz9v1	False	t3_sfz4kw	False	True	t1_hut6tmr	/r/ethereum/comments/sfz4kw/did_i_just_lose_half_a_million_dollars_by_sending/huxz9v1/	1643597441	1	False	True	False	ethereum	t5_2zf9m	r/ethereum	public		0	[]			i think a simple way to fix this would be to implement some kind of check to see whether or not the address you are sending to can accept the token you are sending unsure why this isn t a feature anywhere if anyone knows why or other ideas that could solve this problem i would love to hear 	0.12394527345895767	0.9889664053916931	0.4216344654560089	0.007520849816501141	0.007791388314217329	0.5584319233894348	0.08377721905708313	8.40509358113195e-07	0.21554535627365112	0.154653400182724
154	[]	False		Known_Syllabub_8334			[]				text	t2_f40ki7zx	False	False	The radix shill group is part of the illuminati my friend.	73952fd9b67ec62db8db2cc7828719181780d0f3	True	False					0	1643597397		0	{}	huxz78j	False	t3_ry6pl8	False	True	t1_huxyore	/r/ethereum/comments/ry6pl8/can_anyone_eli5_to_me_what_sharding_is/huxz78j/	1643597410	1	False	True	False	ethereum	t5_2zf9m	r/ethereum	public		0	[]			the radix shill group is part of the illuminati my friend 	0.18705056607723236	0.5049980878829956	0.7358114123344421	0.27252158522605896	0.48142096400260925	0.5410988330841064	0.27039581537246704	0.14742222428321838	0.4659833014011383	0.00602851714938879
155	[]	False		FrickGoogle			[]				text	t2_7aya5e86	False	True	IMO the ideal would be a dual POW of POS system. That way you can get the best of both worlds, but I'm not sure how that would be possible.	4fcb86ae65a5d4e2719efa3db74fda3a42ba53cb	True	False					0	1643597275		0	{}	huxyw5p	False	t3_sgomic	False	True	t3_sgomic	/r/ethereum/comments/sgomic/does_ethereum_still_need_to_go_pos/huxyw5p/	1643597288	1	False	True	False	ethereum	t5_2zf9m	r/ethereum	public		0	[]			imo the ideal would be a dual pow of pos system that way you can get the best of both worlds but i m not sure how that would be possible 	0.2195524275302887	0.9664756059646606	0.06956209987401962	0.01413801684975624	0.38841456174850464	0.3549141585826874	0.06931772083044052	7.751622615614906e-05	0.3795163631439209	0.01865711435675621
156	[]	False		[deleted]						dark					[removed]	fe993932d6dced4c0a879e9aa5d7a6e0fbb467f5	True	False					0	1643597259		0	{}	huxyuqf	False	t3_sgomic	False	True	t1_huxx09u	/r/ethereum/comments/sgomic/does_ethereum_still_need_to_go_pos/huxyuqf/	1643597273	1	False	True	False	ethereum	t5_2zf9m	r/ethereum	public		0	[]			 removed 	0.46707504987716675	0.5148742198944092	0.5170193910598755	0.5029740929603577	0.4936113953590393	0.5123135447502136	0.45383262634277344	0.4847692549228668	0.4981911778450012	0.5145108103752136
157	[]	False		Treyzania			[]				text	t2_8vzbi	False	False	How did *you* find this comment organically?	d21077014af0e9c282396a619b382fa08bd68e15	True	False					0	1643597195		0	{}	huxyore	False	t3_ry6pl8	False	True	t1_huxovgh	/r/ethereum/comments/ry6pl8/can_anyone_eli5_to_me_what_sharding_is/huxyore/	1643597212	1	False	True	False	ethereum	t5_2zf9m	r/ethereum	public		0	[]			how did you find this comment organically 	0.48756876587867737	0.4486744999885559	0.41562536358833313	0.6125350594520569	0.4289073646068573	0.48338884115219116	0.5140048265457153	0.44143566489219666	0.41723525524139404	0.08147062361240387
158	[]	False		ocdexpress5			[]				text	t2_4cllvwuh	False	False	That's horseshit. I like btc and hold it never plan to sell. But to claim it's good for the environment is rediculous. The better argument is the fact that pow provides better securit, and great value as a global store of wealth. If we want to fix the environment maybe the USA and other countries should stop subsidizing oil.	d6c1aee4857e64373eb88ffcee3593b046ed0692	True	False					0	1643597109		0	{}	huxygma	False	t3_sgomic	False	True	t1_huxuh9u	/r/ethereum/comments/sgomic/does_ethereum_still_need_to_go_pos/huxygma/	1643597121	1	False	True	False	ethereum	t5_2zf9m	r/ethereum	public		0	[]			that s horseshit i like btc and hold it never plan to sell but to claim it s good for the environment is rediculous the better argument is the fact that pow provides better securit and great value as a global store of wealth if we want to fix the environment maybe the usa and other countries should stop subsidizing oil 	0.003038632683455944	0.9876852035522461	0.6421631574630737	0.057989101856946945	0.06346196681261063	0.1942000538110733	0.07777807116508484	8.484639124617388e-07	0.41333234310150146	0.0032705552875995636
159	[]	False		Meanmanjr			[]				text	t2_hmb0q	False	False	No.  And if you actually believe this shit you are not well educated.	00b1ea785b5f60e09de6b65b8b7d82b50f7dec87	True	False					0	1643597074		0	{}	huxydf7	False	t3_sgm5k4	False	True	t3_sgm5k4	/r/ethereum/comments/sgm5k4/what_do_you_think/huxydf7/	1643597090	1	False	True	False	ethereum	t5_2zf9m	r/ethereum	public		0	[]			no and if you actually believe this shit you are not well educated 	0.3479040563106537	0.3269152343273163	0.8706504106521606	0.3405012786388397	0.3773548901081085	0.4023936688899994	0.19968080520629883	0.002442736178636551	0.45423516631126404	0.0016276607057079673
160	[]	False		42389423894237894498			[]				text	t2_frmzeibc	False	False	Ok, that is actually better for the overall point I’m making	e2598c53ff0353a59d2c75e626eb22786cc0c638	True	False					0	1643596990		0	{}	huxy5rp	False	t3_sfz4kw	False	True	t1_huw2k5j	/r/ethereum/comments/sfz4kw/did_i_just_lose_half_a_million_dollars_by_sending/huxy5rp/	1643597005	1	False	True	False	ethereum	t5_2zf9m	r/ethereum	public		0	[]			ok that is actually better for the overall point i m making	0.5003069639205933	0.5401207804679871	0.22243168950080872	0.12743479013442993	0.5693329572677612	0.4360886514186859	0.28479135036468506	0.8022971749305725	0.3864595890045166	0.013407601043581963
161	[]	False		sunnya97			[]				text	t2_o4hkq	False	False	"If you would treat:

[--- Asset is issued on ---]	| [--- You are using that asset on ---]	| [--- Security level ---]
:-- | :-- | :--
Avalanche | Avalanche | High

And both chains use an IBC-style full light client verification for the bridge, then shouldn't you also treat at the very least:

[--- Asset is issued on ---]	| [--- You are using that asset on ---]	| [--- Security level ---]
:-- | :-- | :--
Ethereum | Avalanche | Medium-High
Avalanche | Ethereum | Medium-High"	0c41985e147fb039e8b8e23ef6a095075af89564	True	False					0	1643596989		0	{}	huxy5ov	False	t3_sgd3zt	False	True	t3_sgd3zt	/r/ethereum/comments/sgd3zt/a_quick_reminder_of_what_shared_security_means/huxy5ov/	1643597005	1	False	True	False	ethereum	t5_2zf9m	r/ethereum	public		0	[]			if you would treat asset is issued on you are using that asset on security level avalanche avalanche high and both chains use an ibc style full light client verification for the bridge then shouldn t you also treat at the very least asset is issued on you are using that asset on security level ethereum avalanche medium high avalanche ethereum medium high	0.002347558503970504	0.9890056848526001	0.3371683359146118	0.9481756687164307	0.007970602251589298	0.21132026612758636	0.1473182737827301	8.523713859176496e-07	0.3957621157169342	0.004287125077098608
162	[]	False		sebikun			[]				text	t2_19g5mhbp	False	False	Nope not a hardfork but implemented a code that declines transactions like this, absolutely	b331cfae35ec54d2c6ab261e3aabc93ecb4cf8b1	True	False					0	1643596940		0	{}	huxy11x	False	t3_sgfvjv	False	True	t3_sgfvjv	/r/ethereum/comments/sgfvjv/would_you_support_a_hard_fork_to_return_lost_eth/huxy11x/	1643596951	1	False	True	False	ethereum	t5_2zf9m	r/ethereum	public		0	[]			nope not a hardfork but implemented a code that declines transactions like this absolutely	0.2597724199295044	0.6616002321243286	0.45360565185546875	0.33539101481437683	0.34375476837158203	0.3826180100440979	0.2719589173793793	9.551761195325525e-07	0.4693017899990082	0.01827201247215271
163	[]	False		ocdexpress5			[]				text	t2_4cllvwuh	False	False	That's correct if eth does not go pos it will lose a tone of esg opertunaty which is one major advantage it has over btc.	72761021d9f06257feda3ebac97b5d4c629e9a34	True	False					0	1643596872		0	{}	huxxumi	False	t3_sgomic	False	False	t1_huxnoq5	/r/ethereum/comments/sgomic/does_ethereum_still_need_to_go_pos/huxxumi/	1643596886	1	False	True	False	ethereum	t5_2zf9m	r/ethereum	public		0	[]			that s correct if eth does not go pos it will lose a tone of esg opertunaty which is one major advantage it has over btc 	0.07092848420143127	0.9670955538749695	0.6471452713012695	0.45651543140411377	0.09135124832391739	0.11296594887971878	0.09379594773054123	8.436542202616693e-07	0.462080180644989	0.0004796143912244588
164	[]	False		Far-Fig2434			[]				text	t2_ad8ilsfa	False	False	I think a billion +$ of sacrificed currency for pulsex and hundreds of millions sacrificed for pulsechain is too large to ignore and make your comment a bit naive	14a83039c745b82fbd5d07d3c28f0643dbf3d572	True	False					0	1643596558		0	{}	huxx09u	True	t3_sgomic	False	True	t1_huxwoef	/r/ethereum/comments/sgomic/does_ethereum_still_need_to_go_pos/huxx09u/	1643596575	1	False	True	False	ethereum	t5_2zf9m	r/ethereum	public		0	[]			i think a billion of sacrificed currency for pulsex and hundreds of millions sacrificed for pulsechain is too large to ignore and make your comment a bit naive	0.3982682526111603	0.8092965483665466	0.7909305095672607	0.03739318624138832	0.008327914401888847	0.37257394194602966	0.16475622355937958	0.9388945698738098	0.32205185294151306	0.03509482741355896
165	[]	False		squarevenom			[]				text	t2_hye9tpa2	False	False	"That sounds like complete bullshit why tf would they make it work like that. 

Selling I can understand but I mean dude traded it and lost it, technically he lost the money into an abyss"	e54e32078c5785a599bc28975aa6f0e33a57006c	True	False					0	1643596541		0	{}	huxwyka	False	t3_sfz4kw	False	True	t1_huxqpus	/r/ethereum/comments/sfz4kw/did_i_just_lose_half_a_million_dollars_by_sending/huxwyka/	1643596559	1	False	True	False	ethereum	t5_2zf9m	r/ethereum	public		0	[]			that sounds like complete bullshit why tf would they make it work like that selling i can understand but i mean dude traded it and lost it technically he lost the money into an abyss	0.005490290001034737	0.9293351173400879	0.762018620967865	0.011253349483013153	0.785716712474823	0.3141520321369171	0.05764366686344147	8.50403239383013e-07	0.24424579739570618	0.03725600615143776
166	[]	False		Danny-On			[]				text	t2_75bcdupl	False	True	Now my last, screw crypto sticking to etransfer	e4977c02d656499ab6ddaae4d412a4ce35dd3b4a	True	False					0	1643596528		0	{}	huxwxb2	True	t3_sgo1mn	False	True	t1_huxr9ax	/r/ethereum/comments/sgo1mn/failed_transactions_have_a_gas_fee/huxwxb2/	1643596544	1	False	True	False	ethereum	t5_2zf9m	r/ethereum	public		0	[]			now my last screw crypto sticking to etransfer	0.12861624360084534	0.4278966784477234	0.6555135250091553	0.2299882024526596	0.41457319259643555	0.043334148824214935	0.3854581117630005	0.39454782009124756	0.41844069957733154	2.773307824099902e-05
167	[]	False		Zahnymous			[]				text	t2_h4seipas	False	False	You aren’t viewing the market how the people who control the market do. Remember when someone is winning someone is losing, and the sad reality is there’s always a winner or loser. Even when the charts going up, and when the charts going down	2f672fab8e051fe665774575b1c64cf5d66fac38	True	False					0	1643596458		0	{}	huxwr7i	False	t3_sgpp79	False	True	t1_huxvfs8	/r/ethereum/comments/sgpp79/is_crypto_dead_whales_control_pricing_is_there_a/huxwr7i/	1643596470	1	False	True	False	ethereum	t5_2zf9m	r/ethereum	public		0	[]			you aren t viewing the market how the people who control the market do remember when someone is winning someone is losing and the sad reality is there s always a winner or loser even when the charts going up and when the charts going down	0.0028734540101140738	0.9879079461097717	0.6151286363601685	0.0253965575248003	0.6330934166908264	0.5060561895370483	0.0553426630795002	8.454318276562844e-07	0.18117083609104156	0.03611065447330475
168	[]	False		joannew99			[]				text	t2_3spmg8tf	False	True	Nobody gives a damn about pulsechain dude lol scammy shit. Delete this, mods	9da6de65fffc0d656b7b2dde962d4015bd97afd6	True	False					0	1643596427		0	{}	huxwoef	False	t3_sgomic	False	True	t3_sgomic	/r/ethereum/comments/sgomic/does_ethereum_still_need_to_go_pos/huxwoef/	1643596440	1	False	True	False	ethereum	t5_2zf9m	r/ethereum	public		0	[]			nobody gives a damn about pulsechain dude lol scammy shit delete this mods	0.07362622022628784	0.17549365758895874	0.9104799628257751	0.021885940805077553	0.20597301423549652	0.6651344895362854	0.22672423720359802	0.06243610382080078	0.34898221492767334	0.0007133230683393776
169	[]	False		Zahnymous			[]				text	t2_h4seipas	False	False	Because you can always inflate price attracting buyers.	adccc53d16e8bd2299b3a01425617e90207a8e96	True	False					0	1643596385		0	{}	huxwknr	False	t3_sgpp79	False	True	t1_huxvfs8	/r/ethereum/comments/sgpp79/is_crypto_dead_whales_control_pricing_is_there_a/huxwknr/	1643596399	1	False	True	False	ethereum	t5_2zf9m	r/ethereum	public		0	[]			because you can always inflate price attracting buyers 	0.3488370180130005	0.6159408688545227	0.28192684054374695	0.46971970796585083	0.411917507648468	0.44916003942489624	0.40986064076423645	0.49168577790260315	0.42481160163879395	0.031899526715278625
170	[]	False		BlaiseGlory			[]				text	t2_443co6c	False	False	POW propaganda	0d71b9471eecbd0731b15e9705b4d223bb3320e8	True	False					0	1643596372		0	{}	huxwjir	False	t3_sgomic	False	True	t1_huxuh9u	/r/ethereum/comments/sgomic/does_ethereum_still_need_to_go_pos/huxwjir/	1643596384	1	False	True	False	ethereum	t5_2zf9m	r/ethereum	public		0	[]			pow propaganda	0.4067370593547821	0.4625113308429718	0.599563717842102	0.43608957529067993	0.4420187175273895	0.714461624622345	0.46291103959083557	0.46287479996681213	0.4676346480846405	0.3133690655231476
