Unnamed: 0	all_awardings	archived	associated_award	author	author_flair_background_color	author_flair_css_class	author_flair_richtext	author_flair_template_id	author_flair_text	author_flair_text_color	author_flair_type	author_fullname	author_patreon_flair	author_premium	body	body_sha1	can_gild	collapsed	collapsed_because_crowd_control	collapsed_reason	collapsed_reason_code	comment_type	controversiality	created_utc	distinguished	gilded	gildings	id	is_submitter	link_id	locked	no_follow	parent_id	permalink	retrieved_utc	score	score_hidden	send_replies	stickied	subreddit	subreddit_id	subreddit_name_prefixed	subreddit_type	top_awarded_type	total_awards_received	treatment_tags	unrepliable_reason	corpus	support	knowledge	conflict	power	similarity	fun	status	trust	identity	romance
55	[]	False		erics0082			[]				text	t2_7mji5zo4	False	False	wait so if you run your 32 eth node on allnodes. then after the merge it wont work?	971dc37786a5b323da1c45dea8747eea4c19d15f	True	False					0	1648791928		0	{}	i2y7e62	False	t3_tt2cqu	False	False	t3_tt2cqu	/r/ethereum/comments/tt2cqu/the_merge_is_coming_a_few_things_to_expect/i2y7e62/	1648791943	1	False	True	False	ethereum	t5_2zf9m	r/ethereum	public		0	[]		wait so if you run your 32 eth node on allnodes then after the merge it wont work 	0.4340108633041382	0.6625518798828125	0.506056010723114	0.6882981061935425	0.10353046655654907	0.4052608609199524	0.1094772219657898	1.1987939387836377e-06	0.3562629818916321	0.017943037673830986
56	[]	False		anotherfroggyevening			[]				text	t2_dxuii	False	False	And what do you do if you want to send it to an exchange to withdraw to fiat? Doesnt the exchange need a kyc for that ... how would tornado help. The exchange wont allow crypto deposited from an anonymous adress?	60b9c4e026040ce45bc3efbdb463c16bc1b59508	True	False					0	1648791792		0	{}	i2y774s	False	t3_tt56qm	False	True	t1_i2xyu8x	/r/ethereum/comments/tt56qm/eu_parliament_votes_to_impose_kyc_on_private/i2y774s/	1648791807	1	False	True	False	ethereum	t5_2zf9m	r/ethereum	public		0	[]		and what do you do if you want to send it to an exchange to withdraw to fiat doesnt the exchange need a kyc for that how would tornado help the exchange wont allow crypto deposited from an anonymous adress 	0.5855494141578674	0.9766026139259338	0.5458959341049194	0.8909948468208313	0.008368776179850101	0.22496074438095093	0.09412288665771484	8.532464903510117e-07	0.3037668466567993	0.0042909616604447365
57	[]	False		[deleted]						dark					[removed]	fe993932d6dced4c0a879e9aa5d7a6e0fbb467f5	True	False					0	1648791781		0	{}	i2y76hm	False	t3_tt2cqu	False	True	t1_i2wpsf4	/r/ethereum/comments/tt2cqu/the_merge_is_coming_a_few_things_to_expect/i2y76hm/	1648791799	1	False	True	False	ethereum	t5_2zf9m	r/ethereum	public		0	[]		 removed 	0.46707504987716675	0.5148742198944092	0.5170193910598755	0.5029740929603577	0.4936113953590393	0.5123135447502136	0.45383262634277344	0.4847692549228668	0.4981911778450012	0.5145108103752136
58	[]	False		viper2097			[]				text	t2_ejhl9	False	False	"I know right!?! I literally didn't even know he was part of the thread until a friend I shared this link with started laughing at me for arguing with Vitalik. What a trip!!!  


It looks like we both got what we wanted, I made the best investment of my life and Vitalik created a chain with endless services!"	2207153aa024e483b9c4ae790d27230bde79b54c	True	False					0	1648791763		0	{}	i2y75jq	True	t3_ttiuv6	False	True	t1_i2y62p3	/r/ethereum/comments/ttiuv6/a_post_from_8_years_ago_of_me_congratulating/i2y75jq/	1648791780	1	False	True	False	ethereum	t5_2zf9m	r/ethereum	public		0	[]		i know right i literally didn t even know he was part of the thread until a friend i shared this link with started laughing at me for arguing with vitalik what a trip it looks like we both got what we wanted i made the best investment of my life and vitalik created a chain with endless services 	0.0031988429836928844	0.706654965877533	0.23820073902606964	0.045629195868968964	0.9944645762443542	0.9964094758033752	0.11986105144023895	8.480359952045546e-07	0.23528224229812622	0.026380956172943115
59	[]	False		GarugasRevenge			[]				text	t2_ipaay	False	False	"What about

Eth -&gt; BTC(address 1) -&gt; xmr -&gt; BTC(address 2) -&gt; BTC ATM cash out.

Although I'm unsure of how to do eth to BTC, maybe it can be swapped for wrapped BTC on eth blockchain. I've never really done this I'm just trying to understand the concept. Never heard of tornado, thanks for telling me."	7129fec0ce57af6b3a95eeffff7e6ff72d901ba6	True	False					0	1648791755		0	{}	i2y7552	False	t3_tt56qm	False	True	t1_i2xz316	/r/ethereum/comments/tt56qm/eu_parliament_votes_to_impose_kyc_on_private/i2y7552/	1648791772	1	False	True	False	ethereum	t5_2zf9m	r/ethereum	public		0	[]		what about eth gt btc address 1 gt xmr gt btc address 2 gt btc atm cash out although i m unsure of how to do eth to btc maybe it can be swapped for wrapped btc on eth blockchain i ve never really done this i m just trying to understand the concept never heard of tornado thanks for telling me 	0.002842709654942155	0.9882866740226746	0.08196153491735458	0.013917199335992336	0.008002827875316143	0.6427830457687378	0.14175891876220703	8.075710411503678e-07	0.16315065324306488	0.021260198205709457
60	[]	False		[deleted]						dark					[removed]	fe993932d6dced4c0a879e9aa5d7a6e0fbb467f5	True	False					0	1648791538		0	{}	i2y6tm2	False	t3_tgzrdq	False	True	t3_tgzrdq	/r/ethereum/comments/tgzrdq/time_interview_ethereums_vitalik_crypto_is/i2y6tm2/	1648791557	1	False	True	False	ethereum	t5_2zf9m	r/ethereum	public		0	[]		 removed 	0.46707504987716675	0.5148742198944092	0.5170193910598755	0.5029740929603577	0.4936113953590393	0.5123135447502136	0.45383262634277344	0.4847692549228668	0.4981911778450012	0.5145108103752136
61	[]	False		[deleted]						dark					[removed]	fe993932d6dced4c0a879e9aa5d7a6e0fbb467f5	True	False					0	1648791506		0	{}	i2y6ryv	False	t3_tijcq1	False	True	t3_tijcq1	/r/ethereum/comments/tijcq1/stuff_rethereum_should_know_proof_of_stake_edition/i2y6ryv/	1648791522	1	False	True	False	ethereum	t5_2zf9m	r/ethereum	public		0	[]		 removed 	0.46707504987716675	0.5148742198944092	0.5170193910598755	0.5029740929603577	0.4936113953590393	0.5123135447502136	0.45383262634277344	0.4847692549228668	0.4981911778450012	0.5145108103752136
62	[]	False		dennisdennison			[]				text	t2_c45afnvk	False	False	Satoshi very explicitly endorsed hardware scaling. He envisioned bitcoin nodes being run by professionals in data centers.	b6d96ea5b90f18e628a9ba0519f96b6c066e4400	True	False					0	1648791411		0	{}	i2y6ms3	False	t3_ttc0oh	False	True	t1_i2x6o1l	/r/ethereum/comments/ttc0oh/how_proofofstake_is_playing_a_critical_role_in/i2y6ms3/	1648791425	1	False	True	False	ethereum	t5_2zf9m	r/ethereum	public		0	[]		satoshi very explicitly endorsed hardware scaling he envisioned bitcoin nodes being run by professionals in data centers 	0.21831738948822021	0.8902997374534607	0.3631484806537628	0.5576298832893372	0.5333821773529053	0.26484110951423645	0.26708555221557617	0.7345462441444397	0.534015953540802	0.002432705834507942
63	[]	False		nootnewb			[]				text	t2_ghc23	False	False	bwahahahaha	0a7ef7445dce1ab8ac348a5c64d84fc584f0c0fd	True	False					0	1648791141		0	{}	i2y68am	False	t3_2fbxwf	False	True	t3_2fbxwf	/r/ethereum/comments/2fbxwf/this_is_why_you_just_made_an_awesome_investment/i2y68am/	1648791153	1	False	True	False	ethereum	t5_2zf9m	r/ethereum	public		0	[]		bwahahahaha	0.4630463123321533	0.5352395176887512	0.5558963418006897	0.4709847569465637	0.4710223376750946	0.1883898675441742	0.5106321573257446	0.48567378520965576	0.48341959714889526	0.4087046682834625
64	[]	False		nootnewb			[]				text	t2_ghc23	False	False	"lmao at Vitalik's post

""Eh, price will go where it will go. I'm more looking forward to seeing what services we and other people will come up with that the tokens can actually be used for."""	4ef48fae7a8603b41d65d3af8e1791baa640d3c1	True	False					0	1648791037		0	{}	i2y62p3	False	t3_ttiuv6	False	True	t3_ttiuv6	/r/ethereum/comments/ttiuv6/a_post_from_8_years_ago_of_me_congratulating/i2y62p3/	1648791051	1	False	True	False	ethereum	t5_2zf9m	r/ethereum	public		0	[]		lmao at vitalik s post eh price will go where it will go i m more looking forward to seeing what services we and other people will come up with that the tokens can actually be used for 	0.1207108274102211	0.9800983667373657	0.052063848823308945	0.014040670357644558	0.08822676539421082	0.40139222145080566	0.06224332004785538	8.404605296163936e-07	0.17800076305866241	0.010241000913083553
65	[]	False		itsreallyme3			[]				text	t2_7b5a2jc4	False	False	Hey, I’ve got one. If I’m staking on Lido, should I do anything or just leave it and big picture what will happen to my staked ETH after the merge. Thank you kindly.	3435f97790b832af9ea633cbf90c483ec0539fd6	True	False					0	1648790979		0	{}	i2y5zjz	False	t3_tt2cqu	False	True	t1_i2v07qx	/r/ethereum/comments/tt2cqu/the_merge_is_coming_a_few_things_to_expect/i2y5zjz/	1648790996	1	False	True	False	ethereum	t5_2zf9m	r/ethereum	public		0	[]		hey i ve got one if i m staking on lido should i do anything or just leave it and big picture what will happen to my staked eth after the merge thank you kindly 	0.013929704204201698	0.4136095345020294	0.45147356390953064	0.016911417245864868	0.10633151233196259	0.3604251444339752	0.18770726025104523	8.417085837209015e-07	0.21784400939941406	0.09541622549295425
66	[]	False		[deleted]						dark					[removed]	fe993932d6dced4c0a879e9aa5d7a6e0fbb467f5	True	False					0	1648790875		0	{}	i2y5ttj	False	t3_tgzrdq	False	True	t3_tgzrdq	/r/ethereum/comments/tgzrdq/time_interview_ethereums_vitalik_crypto_is/i2y5ttj/	1648790895	1	False	True	False	ethereum	t5_2zf9m	r/ethereum	public		0	[]		 removed 	0.46707504987716675	0.5148742198944092	0.5170193910598755	0.5029740929603577	0.4936113953590393	0.5123135447502136	0.45383262634277344	0.4847692549228668	0.4981911778450012	0.5145108103752136
67	[]	False		BaitForWenches			[]				text	t2_qw6qvid	False	False	congrats, come back in a few years if you are still hodling.	d4f2193dd69bba9e73fdaccd1a5e4ba179f95e3c	True	False					0	1648790763		0	{}	i2y5nqx	False	t3_ttiuv6	False	True	t3_ttiuv6	/r/ethereum/comments/ttiuv6/a_post_from_8_years_ago_of_me_congratulating/i2y5nqx/	1648790781	1	False	True	False	ethereum	t5_2zf9m	r/ethereum	public		0	[]		congrats come back in a few years if you are still hodling 	0.7858553528785706	0.250274658203125	0.17150169610977173	0.10406570136547089	0.4381735920906067	0.1522490680217743	0.5352162718772888	0.6777093410491943	0.3536297380924225	9.247454727301374e-05
68	[]	False		KoreanJesusFTW			[]				text	t2_147rkl	False	False	The real funny part is the bit where they all have that 1 thing in common where they hide their true fraudulent selves as if none of it will reflect to the actual things they do or say and no one will be able to tell. Delusions I tell ya. Gotta say though... BBT even almost got me on the whole 6900XT registering as 2 GPUs with SAM. Not sure if that vid blog is still around but if he's any wiser he'd at least try to remove the tracks. These MF are too sloppy anyway....	1e49d0798705b4cf707e3d47d14b9030698c8cf3	True	False					0	1648790482		0	{}	i2y58kk	False	t3_ttfyiq	False	True	t1_i2y3htd	/r/ethereum/comments/ttfyiq/review_its_been_a_year_and_eip1559_was_supposed/i2y58kk/	1648790497	1	False	True	False	ethereum	t5_2zf9m	r/ethereum	public		0	[]		the real funny part is the bit where they all have that 1 thing in common where they hide their true fraudulent selves as if none of it will reflect to the actual things they do or say and no one will be able to tell delusions i tell ya gotta say though bbt even almost got me on the whole 6900xt registering as 2 gpus with sam not sure if that vid blog is still around but if he s any wiser he d at least try to remove the tracks these mf are too sloppy anyway 	0.002332935342565179	0.9883345365524292	0.9260973930358887	0.013636245392262936	0.9941381216049194	0.9970692992210388	0.06742116808891296	8.26780421903095e-07	0.22628764808177948	0.008874156512320042
69	[]	False		NotNotAnonAnon			[]				text	t2_ex2kx4i0	False	False	this is a great summary, thank you!	74c4fbc35f703f9740ada2df740c4402efe28d56	True	False					0	1648790413		0	{}	i2y54to	False	t3_tt2cqu	False	True	t3_tt2cqu	/r/ethereum/comments/tt2cqu/the_merge_is_coming_a_few_things_to_expect/i2y54to/	1648790426	1	False	True	False	ethereum	t5_2zf9m	r/ethereum	public		0	[]		this is a great summary thank you 	0.712772011756897	0.29472067952156067	0.06832556426525116	0.33983075618743896	0.4816346764564514	0.5087310671806335	0.7732231020927429	0.5343127250671387	0.36836132407188416	0.0749683529138565
70	[]	False		AESTHTK			[]				text	t2_10fwavem	False	False	"London upgrade was last year (EIP-1559).

The answer is no.

However the upcoming Bellatrix release will actually shorten the block-time from an average of 13.4 seconds to a consistent 12 seconds."	1cd7c9aeaf6b182bee2c4aaf348f511ef897fa4a	True	False					0	1648790169		0	{}	i2y4r8u	False	t3_tthe4r	False	True	t3_tthe4r	/r/ethereum/comments/tthe4r/with_london_upgrade_may_the_block_take_longer_to/i2y4r8u/	1648790186	1	False	True	False	ethereum	t5_2zf9m	r/ethereum	public		0	[]		london upgrade was last year eip 1559 the answer is no however the upcoming bellatrix release will actually shorten the block time from an average of 13 4 seconds to a consistent 12 seconds 	0.007550248876214027	0.987454891204834	0.31077390909194946	0.08107500523328781	0.009242583997547626	0.17739160358905792	0.08946460485458374	8.408533744841407e-07	0.2605209946632385	0.0040269698947668076
71	[]	False		Mallardshead			[]				text	t2_g40kqtvx	False	True	The last 4 weeks have been nothing short of disastrous for ETH. From Metamask blocking tx's to Infura blacking-out full geographical areas. The Flexpool and NFT disasters and the Buterin TIME interview. I think we're close to the s-curve adoption shakeout in crypto. Nightmare.	0041b26d91851b9169f4b44783d4071ac63b479a	True	False					0	1648789414		0	{}	i2y3klc	False	t3_ttfyiq	False	True	t3_ttfyiq	/r/ethereum/comments/ttfyiq/review_its_been_a_year_and_eip1559_was_supposed/i2y3klc/	1648789432	1	False	True	False	ethereum	t5_2zf9m	r/ethereum	public		0	[]		the last 4 weeks have been nothing short of disastrous for eth from metamask blocking tx s to infura blacking out full geographical areas the flexpool and nft disasters and the buterin time interview i think we re close to the s curve adoption shakeout in crypto nightmare 	0.00441748509183526	0.9878845810890198	0.2896127998828888	0.06738265603780746	0.012918295338749886	0.23940014839172363	0.14295324683189392	8.519016887476027e-07	0.4037973880767822	0.005332615226507187
72	[]	False		cryptosperm			[]				text	t2_5krfmah7	False	False	"Oh hell ""Mineority"" and ""SQRL""..."	42f456245e522b74b60046c2cf355b7f8e96db0f	True	False					0	1648789366		0	{}	i2y3htd	True	t3_ttfyiq	False	False	t1_i2y31f1	/r/ethereum/comments/ttfyiq/review_its_been_a_year_and_eip1559_was_supposed/i2y3htd/	1648789385	1	False	True	False	ethereum	t5_2zf9m	r/ethereum	public		0	[]		oh hell mineority and sqrl 	0.3528198003768921	0.2890792489051819	0.6465039849281311	0.12418048083782196	0.32938152551651	0.3450036942958832	0.4647163450717926	0.3159120976924896	0.43564021587371826	0.0630684420466423
73	[]	False		FizziBublech			[]				text	t2_4vz9u	False	False	"&gt;It is basically a security feature for us. You can not send crypto to the wrong wallet accidentally.

Never thought of it like this. I guess that is a silver lining."	bfe609a6be023ec4f8d71a824d3e1e566ab5a727	True	False					0	1648789125		0	{}	i2y33zz	False	t3_tt56qm	False	True	t1_i2xf2w7	/r/ethereum/comments/tt56qm/eu_parliament_votes_to_impose_kyc_on_private/i2y33zz/	1648789143	1	False	True	False	ethereum	t5_2zf9m	r/ethereum	public		0	[]		 gt it is basically a security feature for us you can not send crypto to the wrong wallet accidentally never thought of it like this i guess that is a silver lining 	0.0066128019243478775	0.9660020470619202	0.5384736657142639	0.010694640688598156	0.018628640100359917	0.38117659091949463	0.06819724291563034	8.57938289300364e-07	0.35014480352401733	0.029361609369516373
74	[]	False		KoreanJesusFTW			[]				text	t2_147rkl	False	False	"BBT... I get it.  The whole post was a joke just like BBT.

Just like Kristy, Flexpool, and all the fct up characters in the space... they act as if they are trust worthy. Bunch of clowns."	d48ab6f40cf7919113aeda4de2ebe6338c8544de	True	False					0	1648789081		0	{}	i2y31f1	False	t3_ttfyiq	False	True	t3_ttfyiq	/r/ethereum/comments/ttfyiq/review_its_been_a_year_and_eip1559_was_supposed/i2y31f1/	1648789100	1	False	True	False	ethereum	t5_2zf9m	r/ethereum	public		0	[]		bbt i get it the whole post was a joke just like bbt just like kristy flexpool and all the fct up characters in the space they act as if they are trust worthy bunch of clowns 	0.012233039364218712	0.7849867939949036	0.845197319984436	0.01815122552216053	0.9789959192276001	0.9968632459640503	0.09226066619157791	8.634731329948409e-07	0.45135533809661865	0.002484740922227502
75	[]	False		psteff			[]				text	t2_1490np	False	False	i invented on Ethereum really early because of it appilcation. Compared to bitcoin it was exciting, and looked like it could be adopted by people outside of the cryptosphere. Now I traded all my eth to iota for exactly the same reason. That was maybe foolish, but it worked the first time 😀	017b104e7baabe07655efebd0a349385efdb299f	True	False					0	1648789007		0	{}	i2y2x1u	False	t3_tt1zue	False	True	t3_tt1zue	/r/ethereum/comments/tt1zue/a_question_for_the_og_ethereum_people/i2y2x1u/	1648789021	1	False	True	False	ethereum	t5_2zf9m	r/ethereum	public		0	[]		i invented on ethereum really early because of it appilcation compared to bitcoin it was exciting and looked like it could be adopted by people outside of the cryptosphere now i traded all my eth to iota for exactly the same reason that was maybe foolish but it worked the first time 	0.0030191519763320684	0.988298237323761	0.5332629084587097	0.014321195892989635	0.9940387010574341	0.605383038520813	0.06538399308919907	8.445566095360846e-07	0.28960728645324707	0.02519545517861843
76	[]	False		cryptosperm			[]				text	t2_5krfmah7	False	False	Ultrasound Money!	3b176bac40fae38ad26214c7f658f833545b8c56	True	False					0	1648788662		0	{}	i2y2d16	True	t3_ttfyiq	False	True	t1_i2y1w9t	/r/ethereum/comments/ttfyiq/review_its_been_a_year_and_eip1559_was_supposed/i2y2d16/	1648788675	1	False	True	False	ethereum	t5_2zf9m	r/ethereum	public		0	[]		ultrasound money 	0.5187299847602844	0.5443339943885803	0.44907885789871216	0.5074868202209473	0.48104584217071533	0.4643690586090088	0.44539874792099	0.4855538010597229	0.4653804302215576	0.4741915464401245
77	[]	False		ma0za			[]				text	t2_9e95vbg	False	True	Tell me you don’t understand EIP-1559 without saying you don’t understand EIP-1559.	5bb411d83f4cc9f28740cd81eb0558495947afeb	True	False					0	1648788383		0	{}	i2y1w9t	False	t3_ttfyiq	False	True	t3_ttfyiq	/r/ethereum/comments/ttfyiq/review_its_been_a_year_and_eip1559_was_supposed/i2y1w9t/	1648788403	1	False	True	False	ethereum	t5_2zf9m	r/ethereum	public		0	[]		tell me you don t understand eip 1559 without saying you don t understand eip 1559 	0.11373887956142426	0.4031040370464325	0.692093014717102	0.13331682980060577	0.0380469486117363	0.048049136996269226	0.2758784592151642	0.5332850217819214	0.4534599483013153	4.7954341425793245e-05
78	[]	False		FaceDeer			[]				text	t2_4ljvm	False	False	Devs tried really hard to convince everyone that it was *not* a mechanism intended to increase the price of ETH. Because it wasn't. People who thought that sold it to themselves, because that's what they wanted to believe I guess.	60a64242a646af4a999fd5e6fee81fcf859bd910	True	False					0	1648788208		0	{}	i2y1lpe	False	t3_ttfyiq	False	True	t1_i2xws4f	/r/ethereum/comments/ttfyiq/review_its_been_a_year_and_eip1559_was_supposed/i2y1lpe/	1648788225	1	False	True	False	ethereum	t5_2zf9m	r/ethereum	public		0	[]		devs tried really hard to convince everyone that it was not a mechanism intended to increase the price of eth because it wasn t people who thought that sold it to themselves because that s what they wanted to believe i guess 	0.006359218619763851	0.9805511236190796	0.7988251447677612	0.013803989626467228	0.008273088373243809	0.4685697853565216	0.06088714301586151	8.592295444032061e-07	0.3309139311313629	0.04397610202431679
79	[]	False		[deleted]						dark					[deleted]	228f7d207920fb84335fac5b2b06ed7b472ece9e	True	False					0	1648788081		0	{}	i2y1e3d	False	t3_ttfob6	False	True	t1_i2xy6p6	/r/ethereum/comments/ttfob6/introducing_obfc_wire_money_over_ethereum/i2y1e3d/	1648788098	1	False	True	False	ethereum	t5_2zf9m	r/ethereum	public		0	[]		 deleted 	0.4731675684452057	0.5102088451385498	0.5685626268386841	0.506443977355957	0.4862896203994751	0.5029312968254089	0.4756966531276703	0.48399344086647034	0.4851445257663727	0.5096864104270935
80	[]	False		FaceDeer			[]				text	t2_4ljvm	False	False	"Over and over and over again in the lead up to EIP-1559, it was trumpeted from the rooftops and repeated ad infinitum in the comments of discussion threads: EIP-1559 is not intended to boost the value of Ether. It is not going to decrease the cost of doing transactions. That's not what it's for. [One random example thread out of the ones I participated in back then](https://www.reddit.com/r/ethereum/comments/ik3c80/how_serious_is_the_fee_burning_proposal/).

And now it's been a year after the fact and still it gets repeated.

Here's hoping that when the Merge finally happens this tired old misconception will finally fade away under the layers of new tired old misconceptions that PoS will bring."	db138e31547618513d8b3a40a2e99441bc6007e6	True	False					0	1648787946		0	{}	i2y163o	False	t3_ttfyiq	False	True	t3_ttfyiq	/r/ethereum/comments/ttfyiq/review_its_been_a_year_and_eip1559_was_supposed/i2y163o/	1648787965	1	False	True	False	ethereum	t5_2zf9m	r/ethereum	public		0	[]		over and over and over again in the lead up to eip 1559 it was trumpeted from the rooftops and repeated ad infinitum in the comments of discussion threads eip 1559 is not intended to boost the value of ether it is not going to decrease the cost of doing transactions that s not what it s for one random example thread out of the ones i participated in back then https www reddit com r ethereum comments ik3c80 how serious is the fee burning proposal and now it s been a year after the fact and still it gets repeated here s hoping that when the merge finally happens this tired old misconception will finally fade away under the layers of new tired old misconceptions that pos will bring 	0.0025676775258034468	0.9886835217475891	0.8915314078330994	0.9267401099205017	0.9940468072891235	0.4004842936992645	0.08683072030544281	8.356371949957975e-07	0.2094087153673172	0.004437467083334923
81	[]	False		AffectionatePeak9085			[]				text	t2_2y17cqsx	False	False	What’s supermajority? Last I saw is that it’s down to 57% I think?	4a1c83c13c47fb8a3745c5935ce53230b577e98a	True	False					0	1648787432		0	{}	i2y0aka	False	t3_tt70ax	False	True	t1_i2xpcuo	/r/ethereum/comments/tt70ax/wen_merge/i2y0aka/	1648787448	1	False	True	False	ethereum	t5_2zf9m	r/ethereum	public		0	[]		what s supermajority last i saw is that it s down to 57 i think 	0.09114423394203186	0.6777784824371338	0.31397128105163574	0.18499170243740082	0.6694756746292114	0.595222532749176	0.16106624901294708	5.671169219567673e-06	0.39220619201660156	0.0056256698444485664
82	[]	False		muradphy			[]				text	t2_12jsd6	False	False	"It'll definitely be an absolute wild day when it's fully released. However, I hope it's for the best. As stated in the article, It seems like it needs to be done to continue scaling long-term, the repercussions of sticking to PoW seem to be too high to continue using.

Who would have thought Ethereum would have got to this point, It's truly been an amazing journey."	0dcd94ed2939ff02d1e1cbded82df616bf1a6268	True	False					0	1648786751		0	{}	i2xz4i5	True	t3_ttc0oh	False	True	t1_i2wudrq	/r/ethereum/comments/ttc0oh/how_proofofstake_is_playing_a_critical_role_in/i2xz4i5/	1648786767	1	False	True	False	ethereum	t5_2zf9m	r/ethereum	public		0	[]		it ll definitely be an absolute wild day when it s fully released however i hope it s for the best as stated in the article it seems like it needs to be done to continue scaling long term the repercussions of sticking to pow seem to be too high to continue using who would have thought ethereum would have got to this point it s truly been an amazing journey 	0.0030262735672295094	0.9881021976470947	0.17878207564353943	0.028554320335388184	0.9939087629318237	0.6945424675941467	0.09593544155359268	8.544060392523534e-07	0.1929103136062622	0.26174089312553406
83	[]	False		FaceDeer			[]				text	t2_4ljvm	False	False	Since this is Ethereum, a better approach would be to run your funds through Tornado to put them into an address that isn't associated with the one you withdrew to from the exchange. Do with them what you like afterward.	c3cb8a9c3afae52f82eab00aa788a557316e52fc	True	False					0	1648786727		0	{}	i2xz316	False	t3_tt56qm	False	True	t1_i2xruwc	/r/ethereum/comments/tt56qm/eu_parliament_votes_to_impose_kyc_on_private/i2xz316/	1648786747	1	False	True	False	ethereum	t5_2zf9m	r/ethereum	public		0	[]		since this is ethereum a better approach would be to run your funds through tornado to put them into an address that isn t associated with the one you withdrew to from the exchange do with them what you like afterward 	0.17998327314853668	0.9883203506469727	0.5657938718795776	0.02269897423684597	0.0091843381524086	0.5780941843986511	0.05398803949356079	8.364448831343907e-07	0.22862429916858673	0.026222797110676765
