Unnamed: 0	all_awardings	archived	associated_award	author	author_flair_background_color	author_flair_css_class	author_flair_richtext	author_flair_template_id	author_flair_text	author_flair_text_color	author_flair_type	author_fullname	author_patreon_flair	author_premium	body	body_sha1	can_gild	collapsed	collapsed_because_crowd_control	collapsed_reason	collapsed_reason_code	comment_type	controversiality	created_utc	distinguished	gilded	gildings	id	is_submitter	link_id	locked	no_follow	parent_id	permalink	retrieved_utc	score	score_hidden	send_replies	stickied	subreddit	subreddit_id	subreddit_name_prefixed	subreddit_type	top_awarded_type	total_awards_received	treatment_tags	unrepliable_reason	author_cakeday	corpus	support	knowledge	conflict	power	similarity	fun	status	trust	identity	romance
116	[]	False		ILikeThisPomegranate			[]				text	t2_swl25	False	False	"It's propaganda because nuclear power plants are massive government projects that cost 10's of billions of dollars to construct, and require decades to complete.  Government projects of this scale allow for insane levels of grift where politicians and bureaucrats will cooperate only if they feel they're personally siphoning off a fair amount of the money.  For example, politician A will only allow/ lobby for the construction of the plant in his state if his wife's brother's construction firm is guaranteed a $50M contract to install portable toilets at one of the sites.  This leads to endless cycles of budget shortfalls and going back to the taxpayers for more funding.   Nuclear powerplant projects are so complicated that it's extremely hard to be sure of where the money actually goes, and whether or not reported expenditures are reasonable.  This is exactly why the political class wants them so much.

Even if the corruption/ financing issues surrounding nuclear power could somehow magically be straightened out there are also enormous safety concerns.  Where/ how do you store a waste product that will be cancer-causing for longer than the average human language will exist?  Oh yeah; science will fix it in the *future*! ! fuck off.

Another way to tell that nuclear energy is a highly propagandized subject is to watch the swarm of angry responses to anyone questioning it on more mainstream subs."	1169eb4047fee53eaf89b7935abb2c25c261a203	True	False					0	1663455125		0	{}	iousoje	False	t3_xgoqzc	False	True	t1_ioufjda	/r/Bitcoin/comments/xgoqzc/bitcoin_nuclear_power_on_the_cover_of_polish/iousoje/	1663455140	1	True	True	False	Bitcoin	t5_2s3qj	r/Bitcoin	public		0	[]			it s propaganda because nuclear power plants are massive government projects that cost 10 s of billions of dollars to construct and require decades to complete government projects of this scale allow for insane levels of grift where politicians and bureaucrats will cooperate only if they feel they re personally siphoning off a fair amount of the money for example politician a will only allow lobby for the construction of the plant in his state if his wife s brother s construction firm is guaranteed a 50m contract to install portable toilets at one of the sites this leads to endless cycles of budget shortfalls and going back to the taxpayers for more funding nuclear powerplant projects are so complicated that it s extremely hard to be sure of where the money actually goes and whether or not reported expenditures are reasonable this is exactly why the political class wants them so much even if the corruption financing issues surrounding nuclear power could somehow magically be straightened out there are also enormous safety concerns where how do you store a waste product that will be cancer causing for longer than the average human language will exist oh yeah science will fix it in the future fuck off another way to tell that nuclear energy is a highly propagandized subject is to watch the swarm of angry responses to anyone questioning it on more mainstream subs 	0.002365387976169586	0.9880288243293762	0.9468878507614136	0.944193959236145	0.008643193170428276	0.31777122616767883	0.07882624864578247	8.721737572159327e-07	0.3274597227573395	0.014803881756961346
117	[]	False		SupportUnit66			[]				text	t2_a2oo9i13	False	False	"Where we have gas ?
The only aboundant energy resources we have on our continent is coal and renewables (hydro + wind + sun), all the others are mainly imported..."	7778ca7bddca44c76674d6216e474488a01881f3	True	False					0	1663455102		0	{}	iousmsv	False	t3_xgoqzc	False	True	t1_iounaiw	/r/Bitcoin/comments/xgoqzc/bitcoin_nuclear_power_on_the_cover_of_polish/iousmsv/	1663455116	1	True	True	False	Bitcoin	t5_2s3qj	r/Bitcoin	public		0	[]			where we have gas the only aboundant energy resources we have on our continent is coal and renewables hydro wind sun all the others are mainly imported 	0.05851215496659279	0.9678928256034851	0.14403823018074036	0.9176115989685059	0.502772867679596	0.3845003843307495	0.21129447221755981	8.538390829926357e-07	0.5316143035888672	0.0015931377420201898
118	[]	False		RefanRes			[]			dark	text	t2_g9ghhb0u	False	False	"Maybe there could be differentiation by calling Bitcoin ""Crypto"" and the rubbish ones ""Crapto"". Never got how people miss that obvious name when they're calling them ""shitcoins""."	54031331d55e9dbed37fbd894e686bb65f8db752	True	False					0	1663454977		0	{}	iouscw6	False	t3_xgw29z	False	True	t3_xgw29z	/r/Bitcoin/comments/xgw29z/crypto_slowing_bitcoins_adoption/iouscw6/	1663454992	1	True	True	False	Bitcoin	t5_2s3qj	r/Bitcoin	public		0	[]			maybe there could be differentiation by calling bitcoin crypto and the rubbish ones crapto never got how people miss that obvious name when they re calling them shitcoins 	0.002696377458050847	0.9544203877449036	0.8731150031089783	0.005790504161268473	0.02911658026278019	0.18391935527324677	0.10626652091741562	8.564708764424722e-07	0.370589017868042	0.00023666571360081434
119	[]	False		[deleted]						dark					[removed]	fe993932d6dced4c0a879e9aa5d7a6e0fbb467f5	True	False					0	1663454933		0	{}	ious9fp	False	t3_xgp2ys	False	True	t3_xgp2ys	/r/Bitcoin/comments/xgp2ys/what_will_usher_in_the_new_bull_run/ious9fp/	1663454944	1	True	True	False	Bitcoin	t5_2s3qj	r/Bitcoin	public		0	[]			 removed 	0.46707504987716675	0.5148742198944092	0.5170193910598755	0.5029740929603577	0.4936113953590393	0.5123135447502136	0.45383262634277344	0.4847692549228668	0.4981911778450012	0.5145108103752136
120	[]	False		SmoothGoing			[]			dark	text	t2_aihchwkb	False	False	I didn't make the post. My stance here is anti-plaid. Kraken deserves some grumbling too, for their face collection and for using plaid.	783ea40ab08d13ab3bb06d36539b8fd586191a9d	True	False					0	1663454918		0	{}	ious8az	False	t3_xgtrvh	False	True	t1_iourjs6	/r/Bitcoin/comments/xgtrvh/kraken_now_accepting_ach_deposits/ious8az/	1663454928	1	True	True	False	Bitcoin	t5_2s3qj	r/Bitcoin	public		0	[]			i didn t make the post my stance here is anti plaid kraken deserves some grumbling too for their face collection and for using plaid 	0.01618700847029686	0.41586601734161377	0.8205608129501343	0.013153268955647945	0.1516137570142746	0.446165531873703	0.20870476961135864	8.79723813795863e-07	0.3851734697818756	0.0036857351660728455
121	[]	False		Ryan61701			[]				text	t2_dqv8wttj	False	False	Yeah yeah, I wanna meet the people who get mad over these things.	5cae645e2cea3050aa6d32c1d841f188d04d0a87	True	False					0	1663454909		0	{}	ious7md	False	t3_xf8au9	False	True	t1_ion0lp8	/r/Bitcoin/comments/xf8au9/ath_hashrate_but_where_are_the_miners_everywhere/ious7md/	1663454921	1	True	True	False	Bitcoin	t5_2s3qj	r/Bitcoin	public		0	[]			yeah yeah i wanna meet the people who get mad over these things 	0.4616824686527252	0.11017510294914246	0.7118887901306152	0.025187738239765167	0.5482616424560547	0.7241274118423462	0.35286056995391846	0.14370715618133545	0.2788621187210083	0.003625247161835432
122	[]	False		Nichoros_Strategy			[]				text	t2_yt8ki	False	False	What makes you think I believe that, it seems like you are just responding with random nonsense rather than discussing anything with me.	fe7f2112f0ac43b8d3da8ac90d3fcacdf69c97d8	True	False					0	1663454846		0	{}	ious2qp	False	t3_xg4eo1	False	True	t1_iosuj0v	/r/Bitcoin/comments/xg4eo1/argentina_to_hike_interest_rates_to_75_as/ious2qp/	1663454865	1	True	True	False	Bitcoin	t5_2s3qj	r/Bitcoin	public		0	[]			what makes you think i believe that it seems like you are just responding with random nonsense rather than discussing anything with me 	0.0802367553114891	0.38878029584884644	0.885603666305542	0.008364926092326641	0.6441612839698792	0.5078073740005493	0.0922541469335556	0.0034290726762264967	0.4285944402217865	0.007563821040093899
123	[]	False		PedroJTrump			[]				text	t2_3tvmyy8g	False	False	God Bless Mr Lara and his family	d565c24083e5d2e5db2f8fbd7a8eac349dd7bb0a	True	False					0	1663454831		0	{}	ious1i8	False	t3_xgyql5	False	True	t3_xgyql5	/r/Bitcoin/comments/xgyql5/we_will_all_be_bank_free_soon/ious1i8/	1663454849	1	True	True	False	Bitcoin	t5_2s3qj	r/Bitcoin	public		0	[]			god bless mr lara and his family	0.5823051929473877	0.1544458270072937	0.19422821700572968	0.14757540822029114	0.36966225504875183	0.5047572255134583	0.7680276036262512	0.4551910161972046	0.4024895429611206	0.6512749195098877
124	[]	False		lingordrone			[]				text	t2_93h3b22a	False	False	Where do you go to do that in the web app or the mobile app?  I am not seeing it.	5c4cc9e04fca903c323db9938a8133608713a97f	True	False					0	1663454790		0	{}	ioury5f	False	t3_xgtrvh	False	True	t3_xgtrvh	/r/Bitcoin/comments/xgtrvh/kraken_now_accepting_ach_deposits/ioury5f/	1663454803	1	True	True	False	Bitcoin	t5_2s3qj	r/Bitcoin	public		0	[]			where do you go to do that in the web app or the mobile app i am not seeing it 	0.12405962496995926	0.9146395921707153	0.1556105613708496	0.7148796319961548	0.34773534536361694	0.49543294310569763	0.08627837151288986	8.228081469496829e-07	0.36954545974731445	0.010957633145153522
125	[]	False		PedroJTrump			[]				text	t2_3tvmyy8g	False	False	Welcome to Biden’s America	d7da1d2c1c469ab4a13e2280cdb4a772941918f3	True	False					0	1663454770		0	{}	iourwng	False	t3_xgyql5	False	True	t3_xgyql5	/r/Bitcoin/comments/xgyql5/we_will_all_be_bank_free_soon/iourwng/	1663454788	1	True	True	False	Bitcoin	t5_2s3qj	r/Bitcoin	public		0	[]			welcome to biden s america	0.565401017665863	0.38898298144340515	0.4636900722980499	0.4093985855579376	0.4106265604496002	0.5121750235557556	0.5574672222137451	0.4672071039676666	0.48960694670677185	0.1711031198501587
126	[]	False		[deleted]						dark					[removed]	fe993932d6dced4c0a879e9aa5d7a6e0fbb467f5	True	False					0	1663454763		0	{}	iourvwn	False	t3_wmnhua	False	True	t3_wmnhua	/r/Bitcoin/comments/wmnhua/is_it_too_late_to_get_into_cryptocurrency/iourvwn/	1663454780	1	True	True	False	Bitcoin	t5_2s3qj	r/Bitcoin	public		0	[]			 removed 	0.46707504987716675	0.5148742198944092	0.5170193910598755	0.5029740929603577	0.4936113953590393	0.5123135447502136	0.45383262634277344	0.4847692549228668	0.4981911778450012	0.5145108103752136
127	[]	False		Wsemenske			[]				text	t2_11053f	False	False	Bitcoin wasn't killed	b8977be24d018019c31acf3a2fc9c73096ce1d63	True	False					0	1663454740		0	{}	iouru2s	False	t3_xgk0fl	False	True	t1_iouj4n3	/r/Bitcoin/comments/xgk0fl/mathematical_evidence_that_satoshi_mined/iouru2s/	1663454756	1	True	True	False	Bitcoin	t5_2s3qj	r/Bitcoin	public		0	[]			bitcoin wasn t killed	0.44113123416900635	0.4860565960407257	0.5963897109031677	0.45150163769721985	0.45083367824554443	0.7678852677345276	0.4047822654247284	0.42062464356422424	0.47166937589645386	0.2620225250720978
128	[]	False		BennyTroves			[]				text	t2_i7vf6	False	False	It’s already over.  CBDC’s are just another small step from our overlords	7363cd074f1f4753f115ecf3612653fb608fc371	True	False					0	1663454725		0	{}	ioursx6	False	t3_xgkgr9	False	True	t3_xgkgr9	/r/Bitcoin/comments/xgkgr9/a_cbdc_would_be_about_the_worst_possible_thing_to/ioursx6/	1663454740	1	True	True	False	Bitcoin	t5_2s3qj	r/Bitcoin	public		0	[]			it s already over cbdc s are just another small step from our overlords	0.40472832322120667	0.6494068503379822	0.3318696916103363	0.6078071594238281	0.5699355006217957	0.30058082938194275	0.20035119354724884	0.00029781361809000373	0.3923080861568451	0.005628158804029226
129	[]	False		[deleted]						dark					[removed]	fe993932d6dced4c0a879e9aa5d7a6e0fbb467f5	True	False					0	1663454664		0	{}	iournvg	False	t3_xgoqzc	False	True	t3_xgoqzc	/r/Bitcoin/comments/xgoqzc/bitcoin_nuclear_power_on_the_cover_of_polish/iournvg/	1663454679	1	True	True	False	Bitcoin	t5_2s3qj	r/Bitcoin	public		0	[]			 removed 	0.46707504987716675	0.5148742198944092	0.5170193910598755	0.5029740929603577	0.4936113953590393	0.5123135447502136	0.45383262634277344	0.4847692549228668	0.4981911778450012	0.5145108103752136
130	[]	False		[deleted]						dark					[removed]	fe993932d6dced4c0a879e9aa5d7a6e0fbb467f5	True	False					0	1663454658		0	{}	iourndh	False	t3_xgkgr9	False	True	t3_xgkgr9	/r/Bitcoin/comments/xgkgr9/a_cbdc_would_be_about_the_worst_possible_thing_to/iourndh/	1663454671	1	True	True	False	Bitcoin	t5_2s3qj	r/Bitcoin	public		0	[]			 removed 	0.46707504987716675	0.5148742198944092	0.5170193910598755	0.5029740929603577	0.4936113953590393	0.5123135447502136	0.45383262634277344	0.4847692549228668	0.4981911778450012	0.5145108103752136
131	[]	False		[deleted]						dark					[removed]	fe993932d6dced4c0a879e9aa5d7a6e0fbb467f5	True	False					0	1663454652		0	{}	iourmv5	False	t3_xgtxk9	False	True	t3_xgtxk9	/r/Bitcoin/comments/xgtxk9/a_woman_held_a_bank_in_lebanon_hostage_to_take/iourmv5/	1663454662	1	True	True	False	Bitcoin	t5_2s3qj	r/Bitcoin	public		0	[]			 removed 	0.46707504987716675	0.5148742198944092	0.5170193910598755	0.5029740929603577	0.4936113953590393	0.5123135447502136	0.45383262634277344	0.4847692549228668	0.4981911778450012	0.5145108103752136
132	[]	False		[deleted]						dark					[removed]	fe993932d6dced4c0a879e9aa5d7a6e0fbb467f5	True	False					0	1663454646		0	{}	iourmbw	False	t3_xgkp0z	False	True	t3_xgkp0z	/r/Bitcoin/comments/xgkp0z/til_that_a_division_of_greenpeace_took_a_5m_bribe/iourmbw/	1663454663	1	True	True	False	Bitcoin	t5_2s3qj	r/Bitcoin	public		0	[]			 removed 	0.46707504987716675	0.5148742198944092	0.5170193910598755	0.5029740929603577	0.4936113953590393	0.5123135447502136	0.45383262634277344	0.4847692549228668	0.4981911778450012	0.5145108103752136
133	[]	False		ipassedthe65		noob	[{'e': 'text', 't': 'redditor for 3 months'}]	2ec8e69e-6c36-11e9-a04b-0afb553d4ea6	redditor for 3 months	dark	richtext	t2_paj24ho5	False	True	"So basically you're making an anti-kraken post?

It's one of the best exchanges out there ran by an actual enthusiast"	693d00ad61063d71f0838e1afa734763f00a38a3	True	False					0	1663454614		0	{}	iourjs6	False	t3_xgtrvh	False	True	t1_iourbp4	/r/Bitcoin/comments/xgtrvh/kraken_now_accepting_ach_deposits/iourjs6/	1663454634	1	True	True	False	Bitcoin	t5_2s3qj	r/Bitcoin	public		0	[]			so basically you re making an anti kraken post it s one of the best exchanges out there ran by an actual enthusiast	0.017526701092720032	0.8031623363494873	0.6812961101531982	0.05076814442873001	0.40247493982315063	0.6335304975509644	0.1181984469294548	8.507934694534924e-07	0.32970213890075684	0.007337816525250673
134	[]	False		Wreck556			[]				text	t2_a9dd61co	False	False	No	816c52fd2bdd94a63cd0944823a6c0aa9384c103	True	False					0	1663454589		0	{}	iourhqg	False	t3_xgyql5	False	True	t1_iouoa4s	/r/Bitcoin/comments/xgyql5/we_will_all_be_bank_free_soon/iourhqg/	1663454601	1	True	True	False	Bitcoin	t5_2s3qj	r/Bitcoin	public		0	[]			no	0.48560506105422974	0.5060324668884277	0.552438497543335	0.5165206789970398	0.49183720350265503	0.4923526644706726	0.4438704252243042	0.4987156093120575	0.4971311092376709	0.4656928777694702
135	[]	False		ne2pit			[]				text	t2_dk4iekd6	False	False	Good to know that you are a Filipino, that's really nice. Hope people like you will understand the importance of BTC in a mass number, that's all we want to see in the future.	24b22afd8845ac21ae53cd29b315d243cbc2ba56	True	False					0	1663454523		0	{}	iource6	False	t3_xftykj	False	True	t1_ioqjhjb	/r/Bitcoin/comments/xftykj/bitcoin_island_is_over_100_businesses_now/iource6/	1663454538	1	True	True	False	Bitcoin	t5_2s3qj	r/Bitcoin	public		0	[]			good to know that you are a filipino that s really nice hope people like you will understand the importance of btc in a mass number that s all we want to see in the future 	0.9022502899169922	0.7731578350067139	0.039843738079071045	0.04874493554234505	0.9865754246711731	0.3121115267276764	0.09444665908813477	8.698770557202806e-07	0.39382222294807434	0.07513167709112167
136	[]	False		SmoothGoing			[]			dark	text	t2_aihchwkb	False	False	Transfer fiat to another exchange for free. Kraken doesn't want your business.	35be17ae1f74d58b02a77f5d8b206bffb7017c25	True	False					0	1663454514		0	{}	iourbp4	False	t3_xgtrvh	False	True	t1_ioupcbq	/r/Bitcoin/comments/xgtrvh/kraken_now_accepting_ach_deposits/iourbp4/	1663454530	1	True	True	False	Bitcoin	t5_2s3qj	r/Bitcoin	public		0	[]			transfer fiat to another exchange for free kraken doesn t want your business 	0.18196088075637817	0.6513248085975647	0.4023171067237854	0.43838754296302795	0.24285629391670227	0.5276257395744324	0.25068801641464233	0.08672338724136353	0.35353899002075195	0.0013802606845274568
137	[]	False		shleebs			[]				text	t2_xw0fz	False	False	The fidelity story just broke, you're not making any sense	8b1a0830eaece4e819a661004da929b4177089d2	True	False					0	1663454493		0	{}	ioura4e	False	t3_xgpycz	False	True	t1_iounr83	/r/Bitcoin/comments/xgpycz/bitcoin_massive_wall_of_money_coming/ioura4e/	1663454506	1	True	True	False	Bitcoin	t5_2s3qj	r/Bitcoin	public		0	[]			the fidelity story just broke you re not making any sense	0.2618890702724457	0.504105806350708	0.7413961291313171	0.5039058923721313	0.45945706963539124	0.5221261978149414	0.2277044951915741	0.1830057054758072	0.4101531207561493	0.09220387786626816
138	[]	False		Nichoros_Strategy			[]				text	t2_yt8ki	False	False	What difference does it make?? Loans are still not the same as wealth. The US is almost has $30 trillion of its own debt,  most if not all of that has been printed over time.	a349aca83ce60dc94d0ce2889f6f96cc652bd32c	True	False					0	1663454488		0	{}	iour9o1	False	t3_xg4eo1	False	True	t1_iosv5mq	/r/Bitcoin/comments/xg4eo1/argentina_to_hike_interest_rates_to_75_as/iour9o1/	1663454507	1	True	True	False	Bitcoin	t5_2s3qj	r/Bitcoin	public		0	[]			what difference does it make loans are still not the same as wealth the us is almost has 30 trillion of its own debt most if not all of that has been printed over time 	0.02465047501027584	0.9856581091880798	0.7726465463638306	0.03780608996748924	0.7597104907035828	0.3501570224761963	0.07174129784107208	8.461367997369962e-07	0.5373435616493225	0.025161894038319588
139	[]	False		icweenie			[]				text	t2_y3abp	False	False	Lol	a79fd0872d2d79c1e87cdb6157f4ee6abf479479	True	False					0	1663454437		0	{}	iour5mt	False	t3_xgoqzc	False	True	t1_iotb3n6	/r/Bitcoin/comments/xgoqzc/bitcoin_nuclear_power_on_the_cover_of_polish/iour5mt/	1663454452	1	True	True	False	Bitcoin	t5_2s3qj	r/Bitcoin	public		0	[]			lol	0.47317075729370117	0.43597516417503357	0.5476417541503906	0.4700857996940613	0.4872163236141205	0.6691137552261353	0.49147942662239075	0.4918611943721771	0.46693652868270874	0.5699469447135925
140	[]	False		Amoci			[]				text	t2_msl1m	False	False	Could you deposit sats by sending USD from Strike?	940f7c14ab49903e87e5997361f5f167990ca600	True	False					0	1663454374		0	{}	iour0kg	False	t3_xgtrvh	False	True	t1_ioupcbq	/r/Bitcoin/comments/xgtrvh/kraken_now_accepting_ach_deposits/iour0kg/	1663454388	1	True	True	False	Bitcoin	t5_2s3qj	r/Bitcoin	public		0	[]			could you deposit sats by sending usd from strike 	0.3443698287010193	0.6524288654327393	0.3915737569332123	0.6553871035575867	0.38059189915657043	0.3459913432598114	0.37412598729133606	0.14272522926330566	0.37479299306869507	0.28718429803848267
141	[]	False		NoLifeLine			[]				text	t2_26ilcrf6	False	False	Wordpress? Well ok I will.	91ef45e65218072c49ea9443e30d391f826258a1	True	False					0	1663454344		0	{}	iouqy5o	True	t3_xgizqk	False	True	t1_iouqt3c	/r/Bitcoin/comments/xgizqk/it_is_expected_that_quantum_computer_technology/iouqy5o/	1663454357	1	True	True	False	Bitcoin	t5_2s3qj	r/Bitcoin	public		0	[]			wordpress well ok i will 	0.5921882390975952	0.4192521274089813	0.20470096170902252	0.37063661217689514	0.5111157298088074	0.7172555923461914	0.6118517518043518	0.6208429932594299	0.45181524753570557	0.034642454236745834
142	[]	False		Dziabadu			[]				text	t2_w1675	False	False	Point 2. Can you remember? I think it was riot who was kyc'ing blocks. They gave up quicker than introduced it.	3de997f1b7d969546fc9bb3387c3d95f736a7ec8	True	False					0	1663454329		0	{}	iouqwzw	False	t3_xfw0di	False	True	t1_iopxyxy	/r/Bitcoin/comments/xfw0di/can_someone_make_a_steel_man_argument_for_why_not/iouqwzw/	1663454341	1	True	True	False	Bitcoin	t5_2s3qj	r/Bitcoin	public		0	[]			point 2 can you remember i think it was riot who was kyc ing blocks they gave up quicker than introduced it 	0.055208735167980194	0.6146634817123413	0.4553191065788269	0.02720571681857109	0.2686568796634674	0.7704823613166809	0.1268913745880127	8.20964658032608e-07	0.35619115829467773	0.017167406156659126
143	[]	False		a10lber			[]				text	t2_pp0y3	False	False	I tell people only about BTC. It's actually a protocol unlike many of the others.	c2fd4fb693331b2eb4f4f37c894bbfdaa6244953	True	False					0	1663454329		0	{}	iouqwyj	False	t3_xgw29z	False	True	t3_xgw29z	/r/Bitcoin/comments/xgw29z/crypto_slowing_bitcoins_adoption/iouqwyj/	1663454341	1	True	True	False	Bitcoin	t5_2s3qj	r/Bitcoin	public		0	[]			i tell people only about btc it s actually a protocol unlike many of the others 	0.19723843038082123	0.7359021902084351	0.3425517678260803	0.0981145054101944	0.6579707860946655	0.3468538522720337	0.1649138331413269	0.5259110331535339	0.4839341938495636	0.004020083229988813
144	[]	False		ChipsDipChainsWhips			[]				text	t2_6es34	False	False	If only she had bought at 60k	7cfef85c973c21f9b2e77e27e1ae7104fb27e788	True	False					0	1663454292		0	{}	iouqu37	False	t3_xgtxk9	False	True	t3_xgtxk9	/r/Bitcoin/comments/xgtxk9/a_woman_held_a_bank_in_lebanon_hostage_to_take/iouqu37/	1663454310	1	True	True	False	Bitcoin	t5_2s3qj	r/Bitcoin	public		0	[]			if only she had bought at 60k	0.34093335270881653	0.6194092035293579	0.3011663854122162	0.4732150733470917	0.48405784368515015	0.49728164076805115	0.2997918725013733	0.349124550819397	0.4015301465988159	0.2761588990688324
145	[]	False		mostly_harmless79			[]			dark	text	t2_a2vy97s3	False	False	"You might want to take some time and read this paper. Might help out things in perspective regarding QC. 

https://scottlocklin.wordpress.com/2019/01/15/quantum-computing-as-a-field-is-obvious-bullshit/"	b83fed2e4ed80e3671659a073d9d2c5364a41413	True	False					0	1663454281		0	{}	iouqt3c	False	t3_xgizqk	False	True	t3_xgizqk	/r/Bitcoin/comments/xgizqk/it_is_expected_that_quantum_computer_technology/iouqt3c/	1663454294	1	True	True	False	Bitcoin	t5_2s3qj	r/Bitcoin	public		0	[]			you might want to take some time and read this paper might help out things in perspective regarding qc https scottlocklin wordpress com 2019 01 15 quantum computing as a field is obvious bullshit 	0.32787615060806274	0.9811720848083496	0.1986859291791916	0.17269885540008545	0.00789511390030384	0.4677504301071167	0.13314220309257507	1.8584685676614754e-05	0.40092867612838745	0.012411949224770069
146	[]	False		JanPB			[]				text	t2_1avpwenj	False	False	"No, all the Big Money people say the same thing: it's the lack of clear regulation that prevents (prohibits) the Big Money to enter. They don't even know about the ""other crypto"", it doesn't exist for them."	f1643443d42201b4cc2fca47bd75ba9d0bedba35	True	False					0	1663454263		0	{}	iouqrnc	False	t3_xgw29z	False	True	t3_xgw29z	/r/Bitcoin/comments/xgw29z/crypto_slowing_bitcoins_adoption/iouqrnc/	1663454287	1	True	True	False	Bitcoin	t5_2s3qj	r/Bitcoin	public		0	[]			no all the big money people say the same thing it s the lack of clear regulation that prevents prohibits the big money to enter they don t even know about the other crypto it doesn t exist for them 	0.004381165374070406	0.9855981469154358	0.879705548286438	0.014024638570845127	0.9815520644187927	0.5560680031776428	0.0670354813337326	8.387694379052846e-07	0.43456923961639404	0.0034126571845263243
147	[]	False		Motor-boat			[]				text	t2_p87yy	False	False	Uh the halvening, like it always does.	c9156f224d7df3d819bc65f2212841e9edc5fc7b	True	False					0	1663454236		0	{}	iouqpgt	False	t3_xgp2ys	False	True	t3_xgp2ys	/r/Bitcoin/comments/xgp2ys/what_will_usher_in_the_new_bull_run/iouqpgt/	1663454250	1	True	True	False	Bitcoin	t5_2s3qj	r/Bitcoin	public		0	[]			uh the halvening like it always does 	0.5177250504493713	0.38134145736694336	0.4768392741680145	0.29041409492492676	0.517228364944458	0.5964374542236328	0.3426039516925812	0.2143753319978714	0.5004938244819641	0.06514904648065567
148	[]	False		Gcampton13			[]				text	t2_kqc8mrzq	False	False	Don’t threaten me with a good time	0823dc21c3caaeab74be90d1c785144099026f51	True	False					0	1663454231		0	{}	iouqp19	False	t3_xfsetd	False	True	t1_iosq0wf	/r/Bitcoin/comments/xfsetd/satoshi_math_mistake/iouqp19/	1663454251	1	True	True	False	Bitcoin	t5_2s3qj	r/Bitcoin	public		0	[]			don t threaten me with a good time	0.3601224720478058	0.38175341486930847	0.5164763331413269	0.34338074922561646	0.32323965430259705	0.592190146446228	0.4166143238544464	0.08573757112026215	0.4208391308784485	0.05884895473718643
