241	[]	False	Material_Star_6964		[]		text	t2_bks858ky	False	False	False	[]	False	False	1642796070	/r/solana/comments/s9jruq/whats_good_fam_how_are_you_i_hope_all_is_well_i/	https://www.reddit.com/r/solana/comments/s9jruq/whats_good_fam_how_are_you_i_hope_all_is_well_i/	{}	s9jruq	False	True	False	False	False	True	False	True	#c285f4	[{'e': 'text', 't': 'NFT/Gaming'}]	light	richtext	False	False	True	1	0	False	all_ads	/r/solana/comments/s9jruq/whats_good_fam_how_are_you_i_hope_all_is_well_i/	False	6	1642796081	1		True	False	False	solana	t5_hcs2n	121648	public	https://b.thumbs.redditmedia.com/Cw8NvxKt5mU4g-MC7ZE7pZ-2CbYJT7LMIEynOhAHjso.jpg	What's good fam, How are you? I hope all is well🙏🏽🙌🏾. I was going to sell this project as an NFT, but honestly I'm tired of making art for money, And how people treat art these days is absolutely disgusting to me. So I'm giving this project away for FREE!!!	0	[]	1.0	https://v.redd.it/oubcvs7lm3d81	all_ads	6			hosted:video	{'enabled': False, 'images': [{'id': '6l7JzryQIvEyeT09HNj8sX3agaS4sxRiUTPp68MSy8o', 'resolutions': [{'height': 108, 'url': 'https://external-preview.redd.it/eL4XPlOpBVPrrCLyosSd8XrxJrda_EKskfSqI35L5m8.png?width=108&amp;crop=smart&amp;format=pjpg&amp;auto=webp&amp;s=2cc849f0012dafc8992a15fa0b74dd24b664c7cf', 'width': 108}, {'height': 216, 'url': 'https://external-preview.redd.it/eL4XPlOpBVPrrCLyosSd8XrxJrda_EKskfSqI35L5m8.png?width=216&amp;crop=smart&amp;format=pjpg&amp;auto=webp&amp;s=db00c45289113a31a89f6421c3fc459ee7cb6f49', 'width': 216}, {'height': 320, 'url': 'https://external-preview.redd.it/eL4XPlOpBVPrrCLyosSd8XrxJrda_EKskfSqI35L5m8.png?width=320&amp;crop=smart&amp;format=pjpg&amp;auto=webp&amp;s=10e161457372ca5c3e3fe1e30a556631e38e99e2', 'width': 320}, {'height': 640, 'url': 'https://external-preview.redd.it/eL4XPlOpBVPrrCLyosSd8XrxJrda_EKskfSqI35L5m8.png?width=640&amp;crop=smart&amp;format=pjpg&amp;auto=webp&amp;s=27cfcef03d62ec688f16b426ff63a74fc9bdece9', 'width': 640}, {'height': 960, 'url': 'https://external-preview.redd.it/eL4XPlOpBVPrrCLyosSd8XrxJrda_EKskfSqI35L5m8.png?width=960&amp;crop=smart&amp;format=pjpg&amp;auto=webp&amp;s=d2d81bd13c1e546eff6041634cb344f30eef6486', 'width': 960}, {'height': 1080, 'url': 'https://external-preview.redd.it/eL4XPlOpBVPrrCLyosSd8XrxJrda_EKskfSqI35L5m8.png?width=1080&amp;crop=smart&amp;format=pjpg&amp;auto=webp&amp;s=bc0b14e0f97401acf1a8a5660860f12d3018c1d0', 'width': 1080}], 'source': {'height': 1080, 'url': 'https://external-preview.redd.it/eL4XPlOpBVPrrCLyosSd8XrxJrda_EKskfSqI35L5m8.png?format=pjpg&amp;auto=webp&amp;s=0b21ade73300c8cddb626b3ca582120612f8766c', 'width': 1080}, 'variants': {}}]}	140.0	140.0	https://v.redd.it/oubcvs7lm3d81		NFT/Gaming							dfc58e32-1f91-11ec-8773-d2282d993a02						"What's good fam, How are you? I hope all is well🙏🏽🙌🏾. I was going to sell this project as an NFT, but honestly I'm tired of making art for money, And how people treat art these days is absolutely disgusting to me. So I'm giving this project away for FREE!!!
"	what s good fam how are you i hope all is well i was going to sell this project as an nft but honestly i m tired of making art for money and how people treat art these days is absolutely disgusting to me so i m giving this project away for free nan	0.3923129439353943	0.9445170164108276	0.5126810073852539	0.013140753842890263	0.9914857745170593	0.4559653401374817	0.20565100014209747	8.626960834590136e-07	0.16252823173999786	0.019660888239741325
242	[]	False	smackmykitty		[]		text	t2_8dhzr4eu	False	False	False	[]	False	False	1642795312	self.solana	https://www.reddit.com/r/solana/comments/s9jhhm/panic/	{}	s9jhhm	False	True	False	False	False	True	True	False	#63afe9	[{'e': 'text', 't': 'Dev/Tech'}]	light	richtext	False	False	True	1	0	False	all_ads	/r/solana/comments/s9jhhm/panic/	False	6	1642795322	1	"All I see in here today is people panicking, “sol is down” “the markets crashing” “crypto will never be mass adopted”.

If your gonna whine about the price falling everytime it dips investing/crypto probably isn’t for you, if your looking to make fast money go dump your hard earned cash into meme coins. 

This is a project it’s not built over night how is that so hard to understand stop using confirmation bias to justify your panic attack. If the network goes down then it goes down the devs aren’t gonna just shrug it off and say “better luck next time” it will be updated and bettered as problems are discovered. 

If you don’t think solana has a future sell your coins and move on to doge and shib… bag holders."	True	False	False	solana	t5_hcs2n	121641	public	self	Panic	0	[]	1.0	https://www.reddit.com/r/solana/comments/s9jhhm/panic/	all_ads	6									Dev/Tech							61c2a160-53d9-11ec-b0b3-8a60790caa75						"Panic
All I see in here today is people panicking, “sol is down” “the markets crashing” “crypto will never be mass adopted”.

If your gonna whine about the price falling everytime it dips investing/crypto probably isn’t for you, if your looking to make fast money go dump your hard earned cash into meme coins. 

This is a project it’s not built over night how is that so hard to understand stop using confirmation bias to justify your panic attack. If the network goes down then it goes down the devs aren’t gonna just shrug it off and say “better luck next time” it will be updated and bettered as problems are discovered. 

If you don’t think solana has a future sell your coins and move on to doge and shib… bag holders."	panic all i see in here today is people panicking sol is down the markets crashing crypto will never be mass adopted if your gonna whine about the price falling everytime it dips investing crypto probably isn t for you if your looking to make fast money go dump your hard earned cash into meme coins this is a project it s not built over night how is that so hard to understand stop using confirmation bias to justify your panic attack if the network goes down then it goes down the devs aren t gonna just shrug it off and say better luck next time it will be updated and bettered as problems are discovered if you don t think solana has a future sell your coins and move on to doge and shib bag holders 	0.002277493244037032	0.9885685443878174	0.7506563067436218	0.047000009566545486	0.02907465398311615	0.339692085981369	0.12537842988967896	8.713108741176256e-07	0.26566556096076965	0.03307335823774338
243	[]	False	bordoisse		[]		text	t2_46bmkzyo	False	False	False	[]	False	False	1642795268	publish0x.com	https://www.reddit.com/r/solana/comments/s9jgtx/solana_community_and_utility_for_nfts/	{}	s9jgtx	False	True	False	False	False	True	False	False	#c285f4	[{'e': 'text', 't': 'NFT/Gaming'}]	light	richtext	False	False	True	1	0	False	all_ads	/r/solana/comments/s9jgtx/solana_community_and_utility_for_nfts/	False	6	1642795279	1		True	False	False	solana	t5_hcs2n	121641	public	https://b.thumbs.redditmedia.com/UQx51CKxrBijG9mLwRybA6g1F6BJfatodi_KYXoqPMw.jpg	Solana: Community and utility for NFTs	0	[]	1.0	https://www.publish0x.com/smokey-the-pixelinvader/solana-community-and-utility-for-nfts-xznxgzq	all_ads	6			link	{'enabled': False, 'images': [{'id': 'NyruCBm8Kg_YGhKcOQTHV0Tk59O-omnDoQwAk5_lipc', 'resolutions': [{'height': 60, 'url': 'https://external-preview.redd.it/F84-Y42rOkGANLWAGLDddAKKJWB2f-Xy8hnflHTT24E.jpg?width=108&amp;crop=smart&amp;auto=webp&amp;s=ff12f3968645d445313d74c37a4859cb09363136', 'width': 108}, {'height': 121, 'url': 'https://external-preview.redd.it/F84-Y42rOkGANLWAGLDddAKKJWB2f-Xy8hnflHTT24E.jpg?width=216&amp;crop=smart&amp;auto=webp&amp;s=f0919c060105731a35ca5a699fcaf590cdfbba2b', 'width': 216}, {'height': 179, 'url': 'https://external-preview.redd.it/F84-Y42rOkGANLWAGLDddAKKJWB2f-Xy8hnflHTT24E.jpg?width=320&amp;crop=smart&amp;auto=webp&amp;s=fb042ec545a68c44540f206eb7188dfd9c2dd795', 'width': 320}], 'source': {'height': 287, 'url': 'https://external-preview.redd.it/F84-Y42rOkGANLWAGLDddAKKJWB2f-Xy8hnflHTT24E.jpg?auto=webp&amp;s=d96d59d513157da08d5769e9efdd50e17352142e', 'width': 512}, 'variants': {}}]}	78.0	140.0	https://www.publish0x.com/smokey-the-pixelinvader/solana-community-and-utility-for-nfts-xznxgzq		NFT/Gaming							dfc58e32-1f91-11ec-8773-d2282d993a02						"Solana: Community and utility for NFTs
"	solana community and utility for nfts nan	0.6466315388679504	0.5420609712600708	0.31388700008392334	0.4443008601665497	0.3549254536628723	0.29812726378440857	0.5427789092063904	0.5861622095108032	0.46419596672058105	0.027684077620506287
244	[]	False	OwnFuture152		[]		text	t2_c62hjrss	False	False	False	[]	False	False	1642765391	self.solana	https://www.reddit.com/r/solana/comments/s98xaj/i_would_like_to_buy_some_more_solana_do_you_think/	{}	s98xaj	False	False	False	False	False	False	True	False	#0dd3bb	[{'e': 'text', 't': 'DeFi'}]	light	richtext	False	False	True	1	0	False	all_ads	/r/solana/comments/s98xaj/i_would_like_to_buy_some_more_solana_do_you_think/	False	6	1642765401	1	[removed]	True	False	False	solana	t5_hcs2n	121497	public	self	I would like to buy some more solana, do you think the price can go down again?	0	[]	1.0	https://www.reddit.com/r/solana/comments/s98xaj/i_would_like_to_buy_some_more_solana_do_you_think/	all_ads	6									DeFi	reddit						8b35b210-1f92-11ec-9196-c6690f50d128						"I would like to buy some more solana, do you think the price can go down again?
[removed]"	i would like to buy some more solana do you think the price can go down again removed 	0.39493057131767273	0.6443663239479065	0.4121042490005493	0.0574537068605423	0.4052383601665497	0.5748397707939148	0.09284089505672455	0.4997837245464325	0.312590628862381	0.04554294794797897
245	[]	False	Alan-FE804		[]		text	t2_et0yqyhe	False	False	False	[]	False	False	1642765209	self.solana	https://www.reddit.com/r/solana/comments/s98vi0/what_if_i_sent_sol_to_my_staking_address/	{}	s98vi0	False	True	False	False	False	True	True	False	#42c1e0	[{'e': 'text', 't': 'Staking'}]	light	richtext	False	False	True	1	0	False	all_ads	/r/solana/comments/s98vi0/what_if_i_sent_sol_to_my_staking_address/	False	6	1642765219	1	"if I sent SOL to my staking address, would the SOL be recoverable? I think some people make a mistake and send their SOL to their account which is ""Stake Program"" and is not ""System Account."""	True	False	False	solana	t5_hcs2n	121496	public	self	What if I sent SOL to my staking address?	0	[]	1.0	https://www.reddit.com/r/solana/comments/s98vi0/what_if_i_sent_sol_to_my_staking_address/	all_ads	6									Staking							7487bc88-2501-11ec-a031-d6d33f341d1c						"What if I sent SOL to my staking address?
if I sent SOL to my staking address, would the SOL be recoverable? I think some people make a mistake and send their SOL to their account which is ""Stake Program"" and is not ""System Account."""	what if i sent sol to my staking address if i sent sol to my staking address would the sol be recoverable i think some people make a mistake and send their sol to their account which is stake program and is not system account 	0.004182837903499603	0.9805532097816467	0.522132933139801	0.08593863248825073	0.00861743837594986	0.3071676790714264	0.06759709119796753	8.461190077468927e-07	0.4460837244987488	0.008354134857654572
246	[]	False	Glad_Fold_3355		[]		text	t2_715pv7z5	False	False	False	[]	False	False	1642764317	self.solana	https://www.reddit.com/r/solana/comments/s98ne0/how_to_protect_myself/	{}	s98ne0	False	True	False	False	False	True	True	False	#0dd3bb	[{'e': 'text', 't': 'DeFi'}]	light	richtext	False	False	True	1	0	False	all_ads	/r/solana/comments/s98ne0/how_to_protect_myself/	False	6	1642764328	1	I know prices been going down and i want to try and protect myself a little bit, would you think using my HOLD solana and put it on a SOL-USD fam would be a good idea until things go back?	True	False	False	solana	t5_hcs2n	121495	public	self	How to protect myself?	0	[]	1.0	https://www.reddit.com/r/solana/comments/s98ne0/how_to_protect_myself/	all_ads	6									DeFi							8b35b210-1f92-11ec-9196-c6690f50d128						"How to protect myself?
I know prices been going down and i want to try and protect myself a little bit, would you think using my HOLD solana and put it on a SOL-USD fam would be a good idea until things go back?"	how to protect myself i know prices been going down and i want to try and protect myself a little bit would you think using my hold solana and put it on a sol usd fam would be a good idea until things go back 	0.496492475271225	0.6833310723304749	0.22702960669994354	0.044329527765512466	0.008464891463518143	0.6536515951156616	0.06294755637645721	8.434668075096852e-07	0.17930911481380463	0.038443174213171005
247	[]	False	CryptoEbeng		[]		text	t2_c2e8w5ud	False	False	False	[]	False	False	1642764015	self.solana	https://www.reddit.com/r/solana/comments/s98kf1/solana/	{}	s98kf1	False	True	False	False	False	True	True	False	#f874fb	[{'e': 'text', 't': 'Meme'}]	light	richtext	False	False	False	1	0	False	all_ads	/r/solana/comments/s98kf1/solana/	False	6	1642764026	1	"Ladies and gentlemen, please help me out with giving your opinion.

I personally think that Solana will get over this dip within a few weeks. Let say between one and three weeks. I have a bet with my friend about this. He says that it will take months to recover. We have agreed that the person who loses will buy an extra $500 Solana for the winner. The issue is this; when do you think Solana will recover? Within one to three weeks? Or within a few months? // the winner is the person with the most support. 

Let me know!! Only your honest opinion!!"	True	False	False	solana	t5_hcs2n	121495	public	self	Solana	0	[]	1.0	https://www.reddit.com/r/solana/comments/s98kf1/solana/	all_ads	6									Meme							48078cbc-1f91-11ec-b1e7-1275770f1cb4						"Solana
Ladies and gentlemen, please help me out with giving your opinion.

I personally think that Solana will get over this dip within a few weeks. Let say between one and three weeks. I have a bet with my friend about this. He says that it will take months to recover. We have agreed that the person who loses will buy an extra $500 Solana for the winner. The issue is this; when do you think Solana will recover? Within one to three weeks? Or within a few months? // the winner is the person with the most support. 

Let me know!! Only your honest opinion!!"	solana ladies and gentlemen please help me out with giving your opinion i personally think that solana will get over this dip within a few weeks let say between one and three weeks i have a bet with my friend about this he says that it will take months to recover we have agreed that the person who loses will buy an extra 500 solana for the winner the issue is this when do you think solana will recover within one to three weeks or within a few months the winner is the person with the most support let me know only your honest opinion 	0.7907142043113708	0.9888080954551697	0.34134694933891296	0.024881264194846153	0.008040779270231724	0.3769736588001251	0.9655722975730896	8.357392289326526e-07	0.1427242010831833	0.005433902144432068
248	[]	False	StormR1		[]		text	t2_eqxaym29	False	False	False	[]	False	False	1642762281	self.solana	https://www.reddit.com/r/solana/comments/s984i6/officialsolanagiftcom/	{}	s984i6	False	True	False	False	False	True	True	False	#63afe9	[{'e': 'text', 't': 'Dev/Tech'}]	light	richtext	False	False	True	1	0	False	all_ads	/r/solana/comments/s984i6/officialsolanagiftcom/	False	6	1642762291	1	"&amp;#x200B;

""OfficialSolanaGift.com""

Uninvited, this appeared in my wallet with my purchased NFTs in my Phantom wallet. Looks and smells like a Tojan horse. How do I delete/remove it?

If it's genuine how do I confirm it to be so? I went to the official Solana website but could not find it there. Thanks."	True	False	False	solana	t5_hcs2n	121482	public	self	???OfficialSolanaGift.com???	0	[]	1.0	https://www.reddit.com/r/solana/comments/s984i6/officialsolanagiftcom/	all_ads	6									Dev/Tech							61c2a160-53d9-11ec-b0b3-8a60790caa75						"???OfficialSolanaGift.com???
&amp;#x200B;

""OfficialSolanaGift.com""

Uninvited, this appeared in my wallet with my purchased NFTs in my Phantom wallet. Looks and smells like a Tojan horse. How do I delete/remove it?

If it's genuine how do I confirm it to be so? I went to the official Solana website but could not find it there. Thanks."	 officialsolanagift com amp x200b officialsolanagift com uninvited this appeared in my wallet with my purchased nfts in my phantom wallet looks and smells like a tojan horse how do i delete remove it if it s genuine how do i confirm it to be so i went to the official solana website but could not find it there thanks 	0.002729356987401843	0.9886044263839722	0.1938442438840866	0.025703733786940575	0.008516596630215645	0.5854213833808899	0.07137151062488556	8.305167398248159e-07	0.3184248208999634	0.0584602877497673
249	[]	False	acebiz1		[]		text	t2_87o6xw3q	False	False	False	[]	False	False	1642761793	imgur.com	https://www.reddit.com/r/solana/comments/s980cu/solana_coin_club_nft_collection_is_outstanding_a/	{}	s980cu	False	True	False	False	False	True	False	False	#c285f4	[{'e': 'text', 't': 'NFT/Gaming'}]	light	richtext	False	False	True	1	0	False	all_ads	/r/solana/comments/s980cu/solana_coin_club_nft_collection_is_outstanding_a/	False	6	1642761804	1		True	False	False	solana	t5_hcs2n	121480	public	https://a.thumbs.redditmedia.com/Ei-OigcIvoV2rvg5CjT4ouYpwJUEXGUKNzdLU0Jl8V0.jpg	Solana Coin Club NFT Collection is OUTSTANDING! A Community of Fans Supporting the Healthy Growth of the Solana Ecosystem Thought Smart Innovation. Read more about Solana Coin Club in the link in comments	0	[]	1.0	https://imgur.com/a/w5r7MA2	all_ads	6			link	{'enabled': False, 'images': [{'id': '7pFQCs2kTxdAA-D5_WDMnRFG0S4efzc6F87zKkP37Bo', 'resolutions': [{'height': 56, 'url': 'https://external-preview.redd.it/TomjgrrBpM1n0f150sRgy6z35alvGAeZdTryTmsNNRM.jpg?width=108&amp;crop=smart&amp;auto=webp&amp;s=2f850593ee5b23c3749c902e330697b48827d0c6', 'width': 108}, {'height': 113, 'url': 'https://external-preview.redd.it/TomjgrrBpM1n0f150sRgy6z35alvGAeZdTryTmsNNRM.jpg?width=216&amp;crop=smart&amp;auto=webp&amp;s=7e7709fc86e333defa67bb96b6612ed22bd4ad4c', 'width': 216}, {'height': 168, 'url': 'https://external-preview.redd.it/TomjgrrBpM1n0f150sRgy6z35alvGAeZdTryTmsNNRM.jpg?width=320&amp;crop=smart&amp;auto=webp&amp;s=ae4651c4b35d073589e3974e79e0f8a2d1aaa8db', 'width': 320}], 'source': {'height': 315, 'url': 'https://external-preview.redd.it/TomjgrrBpM1n0f150sRgy6z35alvGAeZdTryTmsNNRM.jpg?auto=webp&amp;s=60feef4a200da6b7f3edeebab11852f9d9902148', 'width': 600}, 'variants': {}}]}	73.0	140.0	https://imgur.com/a/w5r7MA2		NFT/Gaming		"{'oembed': {'description': 'Post with 0 views. Solana Coin Club NFT Collection', 'height': 640, 'html': '&lt;iframe class=""embedly-embed"" src=""https://cdn.embedly.com/widgets/media.html?src=https%3A%2F%2Fimgur.com%2Fa%2Fw5r7MA2%2Fembed%3Fpub%3Dtrue%26ref%3Dhttps%253A%252F%252Fembed.ly%26w%3D900&amp;display_name=Imgur&amp;url=https%3A%2F%2Fimgur.com%2Fa%2Fw5r7MA2&amp;image=https%3A%2F%2Fi.imgur.com%2FSmUagDc.jpg%3Ffbplay&amp;key=ed8fa8699ce04833838e66ce79ba05f1&amp;type=text%2Fhtml&amp;schema=imgur"" width=""600"" height=""640"" scrolling=""no"" title=""Imgur embed"" frameborder=""0"" allow=""autoplay; fullscreen"" allowfullscreen=""true""&gt;&lt;/iframe&gt;', 'provider_name': 'Imgur', 'provider_url': 'http://imgur.com', 'thumbnail_height': 315, 'thumbnail_url': 'https://i.imgur.com/SmUagDc.jpg?fbplay', 'thumbnail_width': 600, 'title': 'Solana Coin Club NFT Collection', 'type': 'rich', 'url': 'https://imgur.com/a/w5r7MA2', 'version': '1.0', 'width': 600}, 'type': 'imgur.com'}"	"{'content': '&lt;iframe class=""embedly-embed"" src=""https://cdn.embedly.com/widgets/media.html?src=https%3A%2F%2Fimgur.com%2Fa%2Fw5r7MA2%2Fembed%3Fpub%3Dtrue%26ref%3Dhttps%253A%252F%252Fembed.ly%26w%3D900&amp;display_name=Imgur&amp;url=https%3A%2F%2Fimgur.com%2Fa%2Fw5r7MA2&amp;image=https%3A%2F%2Fi.imgur.com%2FSmUagDc.jpg%3Ffbplay&amp;key=ed8fa8699ce04833838e66ce79ba05f1&amp;type=text%2Fhtml&amp;schema=imgur"" width=""600"" height=""640"" scrolling=""no"" title=""Imgur embed"" frameborder=""0"" allow=""autoplay; fullscreen"" allowfullscreen=""true""&gt;&lt;/iframe&gt;', 'height': 640, 'scrolling': False, 'width': 600}"	"{'oembed': {'description': 'Post with 0 views. Solana Coin Club NFT Collection', 'height': 640, 'html': '&lt;iframe class=""embedly-embed"" src=""https://cdn.embedly.com/widgets/media.html?src=https%3A%2F%2Fimgur.com%2Fa%2Fw5r7MA2%2Fembed%3Fpub%3Dtrue%26ref%3Dhttps%253A%252F%252Fembed.ly%26w%3D900&amp;display_name=Imgur&amp;url=https%3A%2F%2Fimgur.com%2Fa%2Fw5r7MA2&amp;image=https%3A%2F%2Fi.imgur.com%2FSmUagDc.jpg%3Ffbplay&amp;key=ed8fa8699ce04833838e66ce79ba05f1&amp;type=text%2Fhtml&amp;schema=imgur"" width=""600"" height=""640"" scrolling=""no"" title=""Imgur embed"" frameborder=""0"" allow=""autoplay; fullscreen"" allowfullscreen=""true""&gt;&lt;/iframe&gt;', 'provider_name': 'Imgur', 'provider_url': 'http://imgur.com', 'thumbnail_height': 315, 'thumbnail_url': 'https://i.imgur.com/SmUagDc.jpg?fbplay', 'thumbnail_width': 600, 'title': 'Solana Coin Club NFT Collection', 'type': 'rich', 'url': 'https://imgur.com/a/w5r7MA2', 'version': '1.0', 'width': 600}, 'type': 'imgur.com'}"	"{'content': '&lt;iframe class=""embedly-embed"" src=""https://cdn.embedly.com/widgets/media.html?src=https%3A%2F%2Fimgur.com%2Fa%2Fw5r7MA2%2Fembed%3Fpub%3Dtrue%26ref%3Dhttps%253A%252F%252Fembed.ly%26w%3D900&amp;display_name=Imgur&amp;url=https%3A%2F%2Fimgur.com%2Fa%2Fw5r7MA2&amp;image=https%3A%2F%2Fi.imgur.com%2FSmUagDc.jpg%3Ffbplay&amp;key=ed8fa8699ce04833838e66ce79ba05f1&amp;type=text%2Fhtml&amp;schema=imgur"" width=""600"" height=""640"" scrolling=""no"" title=""Imgur embed"" frameborder=""0"" allow=""autoplay; fullscreen"" allowfullscreen=""true""&gt;&lt;/iframe&gt;', 'height': 640, 'media_domain_url': 'https://www.redditmedia.com/mediaembed/s980cu', 'scrolling': False, 'width': 600}"		dfc58e32-1f91-11ec-8773-d2282d993a02						"Solana Coin Club NFT Collection is OUTSTANDING! A Community of Fans Supporting the Healthy Growth of the Solana Ecosystem Thought Smart Innovation. Read more about Solana Coin Club in the link in comments
"	solana coin club nft collection is outstanding a community of fans supporting the healthy growth of the solana ecosystem thought smart innovation read more about solana coin club in the link in comments nan	0.12176984548568726	0.9361788630485535	0.47286510467529297	0.0612860843539238	0.010217470116913319	0.49098435044288635	0.2825736999511719	8.668469035910675e-07	0.4386698305606842	0.02294657565653324
250	[]	False	Dread-Llama		[]		text	t2_10xym2	False	False	False	[]	False	False	1642761724	self.solana	https://www.reddit.com/r/solana/comments/s97zol/understanding_50_apy_using_chestfi/	{}	s97zol	False	True	False	False	False	True	True	False	#0dd3bb	[{'e': 'text', 't': 'DeFi'}]	light	richtext	False	False	True	1	0	False	all_ads	/r/solana/comments/s97zol/understanding_50_apy_using_chestfi/	False	6	1642761734	1	"So I have most of my SOL locked up and staking at 6-7% per year like most people here I'm guessing.

But in my travels around the Solanaverse I stumbled upon [Chest.fi](https://Chest.fi) who advertise 50% APY on locked Solana, they lock your SOL into weekly call options and if the options which is how they can advertise such high APY.

I'm trying to figure out the actual risk here, if the strike point is reached do I literally lose the entirety of my staked SOL or just a small portion? 50% on SOL sounds way too good to be true, but assessing the real risk is tricky."	True	False	False	solana	t5_hcs2n	121480	public	self	Understanding 50% APY using Chest.fi	0	[]	1.0	https://www.reddit.com/r/solana/comments/s97zol/understanding_50_apy_using_chestfi/	all_ads	6									DeFi							8b35b210-1f92-11ec-9196-c6690f50d128						"Understanding 50% APY using Chest.fi
So I have most of my SOL locked up and staking at 6-7% per year like most people here I'm guessing.

But in my travels around the Solanaverse I stumbled upon [Chest.fi](https://Chest.fi) who advertise 50% APY on locked Solana, they lock your SOL into weekly call options and if the options which is how they can advertise such high APY.

I'm trying to figure out the actual risk here, if the strike point is reached do I literally lose the entirety of my staked SOL or just a small portion? 50% on SOL sounds way too good to be true, but assessing the real risk is tricky."	understanding 50 apy using chest fi so i have most of my sol locked up and staking at 6 7 per year like most people here i m guessing but in my travels around the solanaverse i stumbled upon chest fi https chest fi who advertise 50 apy on locked solana they lock your sol into weekly call options and if the options which is how they can advertise such high apy i m trying to figure out the actual risk here if the strike point is reached do i literally lose the entirety of my staked sol or just a small portion 50 on sol sounds way too good to be true but assessing the real risk is tricky 	0.0026548102032393217	0.9888170957565308	0.4695967733860016	0.02182997204363346	0.008655823767185211	0.5024281740188599	0.08403976261615753	8.37576806134166e-07	0.39005598425865173	0.009912710636854172
