Unnamed: 0	all_awardings	archived	associated_award	author	author_flair_background_color	author_flair_css_class	author_flair_richtext	author_flair_template_id	author_flair_text	author_flair_text_color	author_flair_type	author_fullname	author_patreon_flair	author_premium	body	body_sha1	can_gild	collapsed	collapsed_because_crowd_control	collapsed_reason	collapsed_reason_code	comment_type	controversiality	created_utc	distinguished	gilded	gildings	id	is_submitter	link_id	locked	no_follow	parent_id	permalink	retrieved_utc	score	score_hidden	send_replies	stickied	subreddit	subreddit_id	subreddit_name_prefixed	subreddit_type	top_awarded_type	total_awards_received	treatment_tags	unrepliable_reason	author_cakeday	corpus	support	knowledge	conflict	power	similarity	fun	status	trust	identity	romance
0	[]	False		insomnis_animo			[]				text	t2_2zk0zzwh	False	False	Will do! Cheers	09dc9579cf0f83920c048482eb29e9639c99f23b	True	False					0	1643601586		0	{}	huy8m5o	True	t3_sgqmg0	False	True	t1_huy85r9	/r/ethereum/comments/sgqmg0/locking_a_wallet_but_to_unlock_a_price_needs_to/huy8m5o/	1643601603	1	False	True	False	ethereum	t5_2zf9m	r/ethereum	public		0	[]			will do cheers	0.5583274960517883	0.4435039758682251	0.4143604636192322	0.5004909634590149	0.4511995315551758	0.645325779914856	0.5616074800491333	0.5115702748298645	0.427936315536499	0.29436057806015015
1	[]	False		insomnis_animo			[]				text	t2_2zk0zzwh	False	False	"Yeah I totally agree with you, I just don't want to publish my idea so to you it seems like I have paper hands haha but it's actually for something else I just needed to know if if was possible. :)

Thanks for your help appreciate it"	7ee1c7e43b7ece2425c715ac8e1c065598a6154b	True	False					0	1643601440		0	{}	huy8b7c	True	t3_sgqmg0	False	True	t1_huy7d4v	/r/ethereum/comments/sgqmg0/locking_a_wallet_but_to_unlock_a_price_needs_to/huy8b7c/	1643601454	1	False	True	False	ethereum	t5_2zf9m	r/ethereum	public		0	[]			yeah i totally agree with you i just don t want to publish my idea so to you it seems like i have paper hands haha but it s actually for something else i just needed to know if if was possible thanks for your help appreciate it	0.00546787166967988	0.6694751977920532	0.0026700953021645546	0.009849410504102707	0.41756775975227356	0.555103600025177	0.978405237197876	8.039778549573384e-07	0.10360315442085266	0.026134086772799492
2	[]	False		trentrand			[]				text	t2_5zvxtvqk	False	False	"Take a look through the Ethereum Smart Contract docs: [https://ethereum.org/en/developers/docs/smart-contracts/](https://ethereum.org/en/developers/docs/smart-contracts/)

With some patience you can create the contract you're describing. Work with others before you use the contract on mainnet."	e75a36560e2bc86b20ed292cd496f33dae297a9f	True	False					0	1643601368		0	{}	huy85r9	False	t3_sgqmg0	False	True	t1_huy6723	/r/ethereum/comments/sgqmg0/locking_a_wallet_but_to_unlock_a_price_needs_to/huy85r9/	1643601381	1	False	True	False	ethereum	t5_2zf9m	r/ethereum	public		0	[]			take a look through the ethereum smart contract docs https ethereum org en developers docs smart contracts https ethereum org en developers docs smart contracts with some patience you can create the contract you re describing work with others before you use the contract on mainnet 	0.3040364980697632	0.9952327609062195	0.012425136752426624	0.9724112749099731	0.004417478572577238	0.06313163787126541	0.09173403680324554	8.562233801967523e-07	0.25059276819229126	0.00043487586663104594
3	[]	False		crashingdown27			[]				text	t2_2mvxc26z	False	False	Thanks for taking your time to explain, it's appreciated.	8a1e6437a5d4d68edb360671b9d019a5575020f0	True	False					0	1643601352		0	{}	huy84he	False	t3_sfz4kw	False	True	t1_huy6d9a	/r/ethereum/comments/sfz4kw/did_i_just_lose_half_a_million_dollars_by_sending/huy84he/	1643601366	1	False	True	False	ethereum	t5_2zf9m	r/ethereum	public		0	[]			thanks for taking your time to explain it s appreciated 	0.6663164496421814	0.46982333064079285	0.017804263159632683	0.41806042194366455	0.3646620213985443	0.5810713171958923	0.8743261098861694	0.6958479881286621	0.2912085950374603	0.028910914435982704
4	[]	False		[deleted]						dark					[removed]	fe993932d6dced4c0a879e9aa5d7a6e0fbb467f5	True	False					0	1643601224		0	{}	huy7upk	False	t3_sgomic	False	True	t1_huy71e1	/r/ethereum/comments/sgomic/does_ethereum_still_need_to_go_pos/huy7upk/	1643601240	1	False	True	False	ethereum	t5_2zf9m	r/ethereum	public		0	[]			 removed 	0.46707504987716675	0.5148742198944092	0.5170193910598755	0.5029740929603577	0.4936113953590393	0.5123135447502136	0.45383262634277344	0.4847692549228668	0.4981911778450012	0.5145108103752136
5	[]	False		[deleted]						dark					[removed]	fe993932d6dced4c0a879e9aa5d7a6e0fbb467f5	True	False					0	1643601141		0	{}	huy7odc	False	t3_sgd3zt	False	True	t1_huvoelm	/r/ethereum/comments/sgd3zt/a_quick_reminder_of_what_shared_security_means/huy7odc/	1643601159	1	False	True	False	ethereum	t5_2zf9m	r/ethereum	public		0	[]			 removed 	0.46707504987716675	0.5148742198944092	0.5170193910598755	0.5029740929603577	0.4936113953590393	0.5123135447502136	0.45383262634277344	0.4847692549228668	0.4981911778450012	0.5145108103752136
6	[]	False		jcm2606			[]				text	t2_qqvkn	False	False	To play devil's advocate, this contract was intended to be a low level contract that is only interacted with by other contracts (or user interfaces written by developers who know what they're doing), so the developer of this contract probably figured that any protections would have just wasted precious gas, as users shouldn't be interacting with this themselves and so there shouldn't be issues like this.	e7f74cbe5ee4558efc85df7e451c5f0dec6f81dd	True	False					0	1643601073		0	{}	huy7j5d	False	t3_sfz4kw	False	True	t1_hux3ipy	/r/ethereum/comments/sfz4kw/did_i_just_lose_half_a_million_dollars_by_sending/huy7j5d/	1643601089	1	False	True	False	ethereum	t5_2zf9m	r/ethereum	public		0	[]			to play devil s advocate this contract was intended to be a low level contract that is only interacted with by other contracts or user interfaces written by developers who know what they re doing so the developer of this contract probably figured that any protections would have just wasted precious gas as users shouldn t be interacting with this themselves and so there shouldn t be issues like this 	0.002878606552258134	0.9882057905197144	0.7020555734634399	0.011831493116915226	0.11124107986688614	0.46782830357551575	0.08026033639907837	8.367408668163989e-07	0.4992204010486603	0.007527383975684643
7	[]	False		mooremo			[]				text	t2_4ijnk	False	False	You could set a time out on it, but wouldn't it be simpler to just not touch the funds until that price is met?	bcf7ee49b43472fe05ab481b7198ba62e9f911b8	True	False					0	1643600995		0	{}	huy7d4v	False	t3_sgqmg0	False	True	t1_huy6qdg	/r/ethereum/comments/sgqmg0/locking_a_wallet_but_to_unlock_a_price_needs_to/huy7d4v/	1643601008	1	False	True	False	ethereum	t5_2zf9m	r/ethereum	public		0	[]			you could set a time out on it but wouldn t it be simpler to just not touch the funds until that price is met 	0.22389395534992218	0.8509005904197693	0.3804752826690674	0.7740313410758972	0.26995494961738586	0.46655797958374023	0.08143683522939682	8.545478635824111e-07	0.3166520595550537	0.01923462189733982
8	[]	False		jcm2606			[]				text	t2_qqvkn	False	False	Unfortunately, nope. Contracts don't have private keys and they can't submit transactions on their own, so an owner would have to make a call to some administrator function to tell the contract to transfer the funds back to OP, but none exists in this particular contract. OP's wETH is basically lost, with no way to retrieve it.	7cf72e878eeb7fc945f14f001dce29d47dd713ad	True	False					0	1643600943		0	{}	huy794m	False	t3_sfz4kw	False	True	t1_huxcrbs	/r/ethereum/comments/sfz4kw/did_i_just_lose_half_a_million_dollars_by_sending/huy794m/	1643600958	1	False	True	False	ethereum	t5_2zf9m	r/ethereum	public		0	[]			unfortunately nope contracts don t have private keys and they can t submit transactions on their own so an owner would have to make a call to some administrator function to tell the contract to transfer the funds back to op but none exists in this particular contract op s weth is basically lost with no way to retrieve it 	0.0024071387015283108	0.989222526550293	0.29394933581352234	0.016852188855409622	0.007767420262098312	0.47825270891189575	0.06738410890102386	8.033708809307427e-07	0.3422068953514099	0.013253169134259224
9	[]	False		cryptosperm			[]				text	t2_5krfmah7	False	False	ESG sounds so decentralized LOL.  Why in the F would you want big tech to take over ETH for ESG reasons?	5a16b0fc1a34ec57f5ba409ee1827c62f45cf587	True	False					0	1643600843		0	{}	huy71e1	False	t3_sgomic	False	True	t1_huxxumi	/r/ethereum/comments/sgomic/does_ethereum_still_need_to_go_pos/huy71e1/	1643600855	1	False	True	False	ethereum	t5_2zf9m	r/ethereum	public		0	[]			esg sounds so decentralized lol why in the f would you want big tech to take over eth for esg reasons 	0.0891517698764801	0.7941292524337769	0.5790181159973145	0.035416122525930405	0.4377642869949341	0.374725878238678	0.14194859564304352	8.550712209398625e-07	0.3137231171131134	0.008035639300942421
10	[]	False		mooremo			[]				text	t2_4ijnk	False	False	Pulsechain is a scam or at best a very misguided fork.	e9219337df8694ced4d74dd8db55e123823765c9	True	False					0	1643600820		0	{}	huy6zq0	False	t3_sgomic	False	True	t3_sgomic	/r/ethereum/comments/sgomic/does_ethereum_still_need_to_go_pos/huy6zq0/	1643600833	1	False	True	False	ethereum	t5_2zf9m	r/ethereum	public		0	[]			pulsechain is a scam or at best a very misguided fork 	0.36950188875198364	0.632291316986084	0.6886454820632935	0.23866410553455353	0.3508044183254242	0.24052584171295166	0.20550160109996796	0.02350885048508644	0.4490278959274292	0.06839484721422195
11	[]	False		anslew			[]				text	t2_pfu0w9r	False	False	"Well you *can* do it, but it’s essentially lost forever.
These smart contracts are minted on chain, when a user calls a function of them, they do what their programmed to.

That’s what the campaign is about, user wallets should have more warnings in place.

There’s a lot of reasons, but none of them are good"	7758a957af3c1553bca758d9521a0a8915511932	True	False					0	1643600817		0	{}	huy6zht	False	t3_sfz4kw	False	True	t1_huy489e	/r/ethereum/comments/sfz4kw/did_i_just_lose_half_a_million_dollars_by_sending/huy6zht/	1643600833	1	False	True	False	ethereum	t5_2zf9m	r/ethereum	public		0	[]			well you can do it but it s essentially lost forever these smart contracts are minted on chain when a user calls a function of them they do what their programmed to that s what the campaign is about user wallets should have more warnings in place there s a lot of reasons but none of them are good	0.003064329968765378	0.9892164468765259	0.4356735348701477	0.03758133947849274	0.64726722240448	0.4690062403678894	0.07239609211683273	8.230310299950361e-07	0.4376889765262604	0.014064347371459007
12	[]	False		Bitbatgaming			[]				text	t2_160q1g	False	False	I’m so sorry dude…	11523c165b64648137186f120811cb19edcd73eb	True	False					0	1643600785		0	{}	huy6x0x	False	t3_sfz4kw	False	True	t3_sfz4kw	/r/ethereum/comments/sfz4kw/did_i_just_lose_half_a_million_dollars_by_sending/huy6x0x/	1643600795	1	False	True	False	ethereum	t5_2zf9m	r/ethereum	public		0	[]			i m so sorry dude 	0.525700032711029	0.24303728342056274	0.4400048553943634	0.2923240065574646	0.5009215474128723	0.5679135322570801	0.6488096714019775	0.6922292709350586	0.41449353098869324	0.4461992383003235
13	[]	False		jcm2606			[]				text	t2_qqvkn	False	False	Wouldn't matter. Contracts don't have private keys and there's no administration functions here that only the deployer can call, so the developers can't submit a transaction on the contract's behalf to transfer its own wETH back to OP. Additionally, the contract wasn't designed to be upgradeable, so the developers can't just patch it, as they'd need to deploy an entirely new contract.	35e60130884efe6380d2bab87fadfb3e50b9107a	True	False					0	1643600784		0	{}	huy6wzo	False	t3_sfz4kw	False	True	t1_huxhyn8	/r/ethereum/comments/sfz4kw/did_i_just_lose_half_a_million_dollars_by_sending/huy6wzo/	1643600795	1	False	True	False	ethereum	t5_2zf9m	r/ethereum	public		0	[]			wouldn t matter contracts don t have private keys and there s no administration functions here that only the deployer can call so the developers can t submit a transaction on the contract s behalf to transfer its own weth back to op additionally the contract wasn t designed to be upgradeable so the developers can t just patch it as they d need to deploy an entirely new contract 	0.0028726099990308285	0.9883158206939697	0.14065665006637573	0.950463593006134	0.008963621221482754	0.30488672852516174	0.07592906057834625	8.432070330854913e-07	0.3245140314102173	0.0205284021794796
14	[]	False		[deleted]						dark					[removed]	fe993932d6dced4c0a879e9aa5d7a6e0fbb467f5	True	False					0	1643600768		0	{}	huy6vsn	False	t3_sgovgx	False	True	t1_huxpbye	/r/ethereum/comments/sgovgx/all_my_anyeth_is_stuck_and_i_cant_do_anything/huy6vsn/	1643600781	1	False	True	False	ethereum	t5_2zf9m	r/ethereum	public		0	[]			 removed 	0.46707504987716675	0.5148742198944092	0.5170193910598755	0.5029740929603577	0.4936113953590393	0.5123135447502136	0.45383262634277344	0.4847692549228668	0.4981911778450012	0.5145108103752136
15	[]	False		[deleted]						dark					[removed]	fe993932d6dced4c0a879e9aa5d7a6e0fbb467f5	True	False					0	1643600757		0	{}	huy6uv4	False	t3_sgovgx	False	True	t3_sgovgx	/r/ethereum/comments/sgovgx/all_my_anyeth_is_stuck_and_i_cant_do_anything/huy6uv4/	1643600774	1	False	True	False	ethereum	t5_2zf9m	r/ethereum	public		0	[]			 removed 	0.46707504987716675	0.5148742198944092	0.5170193910598755	0.5029740929603577	0.4936113953590393	0.5123135447502136	0.45383262634277344	0.4847692549228668	0.4981911778450012	0.5145108103752136
16	[]	False		[deleted]						dark					[removed]	fe993932d6dced4c0a879e9aa5d7a6e0fbb467f5	True	False					0	1643600746		0	{}	huy6u1a	False	t3_sgc6af	False	True	t1_hux5sce	/r/ethereum/comments/sgc6af/if_i_claimed_amazon_stock_was_worthless_and_only/huy6u1a/	1643600759	1	False	True	False	ethereum	t5_2zf9m	r/ethereum	public		0	[]			 removed 	0.46707504987716675	0.5148742198944092	0.5170193910598755	0.5029740929603577	0.4936113953590393	0.5123135447502136	0.45383262634277344	0.4847692549228668	0.4981911778450012	0.5145108103752136
17	[]	False		[deleted]						dark					[removed]	fe993932d6dced4c0a879e9aa5d7a6e0fbb467f5	True	False					0	1643600736		0	{}	huy6t86	False	t3_sgc6af	False	True	t1_huvbhyy	/r/ethereum/comments/sgc6af/if_i_claimed_amazon_stock_was_worthless_and_only/huy6t86/	1643600752	1	False	True	False	ethereum	t5_2zf9m	r/ethereum	public		0	[]			 removed 	0.46707504987716675	0.5148742198944092	0.5170193910598755	0.5029740929603577	0.4936113953590393	0.5123135447502136	0.45383262634277344	0.4847692549228668	0.4981911778450012	0.5145108103752136
18	[]	False		t0fu_ep3			[]				text	t2_3z1c9ujn	False	False	I've paid twice that just transferring $15USD in ETH to another wallet owned by me ... Did the transaction fees drop recently?	bb1e8270aa415c45303db5fddc42ebab00f9bbed	True	False					0	1643600733		0	{}	huy6t2d	False	t3_sfz4kw	False	False	t1_huy6l7x	/r/ethereum/comments/sfz4kw/did_i_just_lose_half_a_million_dollars_by_sending/huy6t2d/	1643600745	1	False	True	False	ethereum	t5_2zf9m	r/ethereum	public		0	[]			i ve paid twice that just transferring 15usd in eth to another wallet owned by me did the transaction fees drop recently 	0.04204489663243294	0.732575535774231	0.2012387365102768	0.06929979473352432	0.6300124526023865	0.38966813683509827	0.19432510435581207	9.689354101283243e-07	0.34086596965789795	0.0049920943565666676
19	[]	False		[deleted]						dark					[removed]	fe993932d6dced4c0a879e9aa5d7a6e0fbb467f5	True	False					0	1643600723		0	{}	huy6sah	False	t3_sgc6af	False	True	t1_huvy7fo	/r/ethereum/comments/sgc6af/if_i_claimed_amazon_stock_was_worthless_and_only/huy6sah/	1643600738	1	False	True	False	ethereum	t5_2zf9m	r/ethereum	public		0	[]			 removed 	0.46707504987716675	0.5148742198944092	0.5170193910598755	0.5029740929603577	0.4936113953590393	0.5123135447502136	0.45383262634277344	0.4847692549228668	0.4981911778450012	0.5145108103752136
20	[]	False		[deleted]						dark					[removed]	fe993932d6dced4c0a879e9aa5d7a6e0fbb467f5	True	False					0	1643600708		0	{}	huy6r4n	False	t3_sgc6af	False	True	t3_sgc6af	/r/ethereum/comments/sgc6af/if_i_claimed_amazon_stock_was_worthless_and_only/huy6r4n/	1643600724	1	False	True	False	ethereum	t5_2zf9m	r/ethereum	public		0	[]			 removed 	0.46707504987716675	0.5148742198944092	0.5170193910598755	0.5029740929603577	0.4936113953590393	0.5123135447502136	0.45383262634277344	0.4847692549228668	0.4981911778450012	0.5145108103752136
21	[]	False		insomnis_animo			[]				text	t2_2zk0zzwh	False	False	"How come? Because the price may never be met?
Is it possible to have a price lock with an expiry?"	73ae46381a0a9a4fe09a6c338d2496229b4f17e9	True	False					0	1643600699		0	{}	huy6qdg	True	t3_sgqmg0	False	True	t1_huy6c23	/r/ethereum/comments/sgqmg0/locking_a_wallet_but_to_unlock_a_price_needs_to/huy6qdg/	1643600716	1	False	True	False	ethereum	t5_2zf9m	r/ethereum	public		0	[]			how come because the price may never be met is it possible to have a price lock with an expiry 	0.18268176913261414	0.9115519523620605	0.3133902847766876	0.309832900762558	0.3988926112651825	0.31444957852363586	0.10217773169279099	0.7205936312675476	0.37193503975868225	0.007606013678014278
22	[]	False		[deleted]						dark					[removed]	fe993932d6dced4c0a879e9aa5d7a6e0fbb467f5	True	False					0	1643600691		0	{}	huy6psh	False	t3_sglnad	False	True	t1_hux475n	/r/ethereum/comments/sglnad/is_there_way_to_change_a_token_price_on_a/huy6psh/	1643600709	1	False	True	False	ethereum	t5_2zf9m	r/ethereum	public		0	[]			 removed 	0.46707504987716675	0.5148742198944092	0.5170193910598755	0.5029740929603577	0.4936113953590393	0.5123135447502136	0.45383262634277344	0.4847692549228668	0.4981911778450012	0.5145108103752136
23	[]	False		[deleted]						dark					[removed]	fe993932d6dced4c0a879e9aa5d7a6e0fbb467f5	True	False					0	1643600680		0	{}	huy6owv	False	t3_sglnad	False	True	t3_sglnad	/r/ethereum/comments/sglnad/is_there_way_to_change_a_token_price_on_a/huy6owv/	1643600693	1	False	True	False	ethereum	t5_2zf9m	r/ethereum	public		0	[]			 removed 	0.46707504987716675	0.5148742198944092	0.5170193910598755	0.5029740929603577	0.4936113953590393	0.5123135447502136	0.45383262634277344	0.4847692549228668	0.4981911778450012	0.5145108103752136
24	[]	False		[deleted]						dark					[removed]	fe993932d6dced4c0a879e9aa5d7a6e0fbb467f5	True	False					0	1643600670		0	{}	huy6o8a	False	t3_sfn1pg	False	True	t3_sfn1pg	/r/ethereum/comments/sfn1pg/why_the_hell_are_you_still_on_layer_one/huy6o8a/	1643600686	1	False	True	False	ethereum	t5_2zf9m	r/ethereum	public		0	[]			 removed 	0.46707504987716675	0.5148742198944092	0.5170193910598755	0.5029740929603577	0.4936113953590393	0.5123135447502136	0.45383262634277344	0.4847692549228668	0.4981911778450012	0.5145108103752136
25	[]	False		CupformyCosta			[]				text	t2_inaul	False	False	Yeah this guy reaallly has no idea what he’s talking about but postures like he does. Been watching a bit too much Bitboy if I had to guess.	fe11caefc18a6c54b6adde4ae4b8271c2b34e1e2	True	False					0	1643600668		0	{}	huy6o0q	False	t3_sggj4e	False	True	t1_huwuu9p	/r/ethereum/comments/sggj4e/sold_all_of_my_btc_and_loaded_up_on_eth/huy6o0q/	1643600679	1	False	True	False	ethereum	t5_2zf9m	r/ethereum	public		0	[]			yeah this guy reaallly has no idea what he s talking about but postures like he does been watching a bit too much bitboy if i had to guess 	0.02654418535530567	0.5804833769798279	0.5410321354866028	0.007134691346436739	0.9219961762428284	0.4627479612827301	0.07719004899263382	8.563328037780593e-07	0.36167576909065247	0.010600368492305279
26	[]	False		[deleted]						dark					[removed]	fe993932d6dced4c0a879e9aa5d7a6e0fbb467f5	True	False					0	1643600660		0	{}	huy6nf8	False	t3_sgqmg0	False	True	t1_huy6c23	/r/ethereum/comments/sgqmg0/locking_a_wallet_but_to_unlock_a_price_needs_to/huy6nf8/	1643600672	1	False	True	False	ethereum	t5_2zf9m	r/ethereum	public		0	[]			 removed 	0.46707504987716675	0.5148742198944092	0.5170193910598755	0.5029740929603577	0.4936113953590393	0.5123135447502136	0.45383262634277344	0.4847692549228668	0.4981911778450012	0.5145108103752136
27	[]	False		FrickGoogle			[]				text	t2_7aya5e86	False	True	You mine ETH?	2c4c31f4b22335c27c63ac719ec5264c9c47b919	True	False					0	1643600647		0	{}	huy6md2	False	t3_sgomic	False	True	t1_huy6hqm	/r/ethereum/comments/sgomic/does_ethereum_still_need_to_go_pos/huy6md2/	1643600664	1	False	True	False	ethereum	t5_2zf9m	r/ethereum	public		0	[]			you mine eth 	0.5080855488777161	0.4205625057220459	0.49365824460983276	0.5154706239700317	0.48505741357803345	0.5314225554466248	0.5132311582565308	0.499350905418396	0.4570501446723938	0.4190714955329895
28	[]	False		[deleted]						dark					[removed]	fe993932d6dced4c0a879e9aa5d7a6e0fbb467f5	True	False					0	1643600646		0	{}	huy6m90	False	t3_sgqmg0	False	True	t1_huy3cv2	/r/ethereum/comments/sgqmg0/locking_a_wallet_but_to_unlock_a_price_needs_to/huy6m90/	1643600657	1	False	True	False	ethereum	t5_2zf9m	r/ethereum	public		0	[]			 removed 	0.46707504987716675	0.5148742198944092	0.5170193910598755	0.5029740929603577	0.4936113953590393	0.5123135447502136	0.45383262634277344	0.4847692549228668	0.4981911778450012	0.5145108103752136
29	[]	False		ocdexpress5			[]				text	t2_4cllvwuh	False	False	"If we had miners at every hydro electric plant when there was over production that's one thing, but this is not what the issue is. I am a big proponent of btc and I think the security that pow provides is justified.

I would just rather hit the issue head on with reality not bullshit. 

Dod and DARPA project climate change to cost trillions. I am sick of bullshit. Greg Abbott is so full of shit. All these guys with one foot in the grave that are hip deap in big oil will shill anything"	2903de3b84f71f5d99b0ae2123368f31ba709391	True	False					0	1643600645		0	{}	huy6m6g	False	t3_sgomic	False	True	t1_huy58k8	/r/ethereum/comments/sgomic/does_ethereum_still_need_to_go_pos/huy6m6g/	1643600657	1	False	True	False	ethereum	t5_2zf9m	r/ethereum	public		0	[]			if we had miners at every hydro electric plant when there was over production that s one thing but this is not what the issue is i am a big proponent of btc and i think the security that pow provides is justified i would just rather hit the issue head on with reality not bullshit dod and darpa project climate change to cost trillions i am sick of bullshit greg abbott is so full of shit all these guys with one foot in the grave that are hip deap in big oil will shill anything	0.002655161079019308	0.9875866174697876	0.9566976428031921	0.9266427755355835	0.9938613176345825	0.3026859164237976	0.07372584939002991	8.364991117559839e-07	0.32387182116508484	0.006134762428700924
30	[]	False		jcm2606			[]				text	t2_qqvkn	False	False	It's a very simple contract.	8572808686c6fd8602da7553175ac3f20ab015cb	True	False					0	1643600632		0	{}	huy6l7x	False	t3_sfz4kw	False	True	t1_huxsn8w	/r/ethereum/comments/sfz4kw/did_i_just_lose_half_a_million_dollars_by_sending/huy6l7x/	1643600649	1	False	True	False	ethereum	t5_2zf9m	r/ethereum	public		0	[]			it s a very simple contract 	0.5145905017852783	0.523611307144165	0.17913442850112915	0.4723060131072998	0.5173578858375549	0.5855123400688171	0.4395717680454254	0.43480798602104187	0.48601943254470825	0.15390188992023468
31	[]	False		[deleted]						dark					[removed]	fe993932d6dced4c0a879e9aa5d7a6e0fbb467f5	True	False					0	1643600631		0	{}	huy6l4y	False	t3_sgqmg0	False	True	t1_huy2bl2	/r/ethereum/comments/sgqmg0/locking_a_wallet_but_to_unlock_a_price_needs_to/huy6l4y/	1643600649	1	False	True	False	ethereum	t5_2zf9m	r/ethereum	public		0	[]			 removed 	0.46707504987716675	0.5148742198944092	0.5170193910598755	0.5029740929603577	0.4936113953590393	0.5123135447502136	0.45383262634277344	0.4847692549228668	0.4981911778450012	0.5145108103752136
32	[]	False		[deleted]						dark					[removed]	fe993932d6dced4c0a879e9aa5d7a6e0fbb467f5	True	False					0	1643600618		0	{}	huy6k62	False	t3_sgqmg0	False	True	t3_sgqmg0	/r/ethereum/comments/sgqmg0/locking_a_wallet_but_to_unlock_a_price_needs_to/huy6k62/	1643600634	1	False	True	False	ethereum	t5_2zf9m	r/ethereum	public		0	[]			 removed 	0.46707504987716675	0.5148742198944092	0.5170193910598755	0.5029740929603577	0.4936113953590393	0.5123135447502136	0.45383262634277344	0.4847692549228668	0.4981911778450012	0.5145108103752136
33	[]	False		[deleted]						dark					[removed]	fe993932d6dced4c0a879e9aa5d7a6e0fbb467f5	True	False					0	1643600607		0	{}	huy6jby	False	t3_sgo1mn	False	True	t1_huxk1im	/r/ethereum/comments/sgo1mn/failed_transactions_have_a_gas_fee/huy6jby/	1643600620	1	False	True	False	ethereum	t5_2zf9m	r/ethereum	public		0	[]			 removed 	0.46707504987716675	0.5148742198944092	0.5170193910598755	0.5029740929603577	0.4936113953590393	0.5123135447502136	0.45383262634277344	0.4847692549228668	0.4981911778450012	0.5145108103752136
34	[]	False		[deleted]						dark					[removed]	fe993932d6dced4c0a879e9aa5d7a6e0fbb467f5	True	False					0	1643600597		0	{}	huy6iki	False	t3_sgo1mn	False	True	t1_huxw9jr	/r/ethereum/comments/sgo1mn/failed_transactions_have_a_gas_fee/huy6iki/	1643600612	1	False	True	False	ethereum	t5_2zf9m	r/ethereum	public		0	[]			 removed 	0.46707504987716675	0.5148742198944092	0.5170193910598755	0.5029740929603577	0.4936113953590393	0.5123135447502136	0.45383262634277344	0.4847692549228668	0.4981911778450012	0.5145108103752136
