Unnamed: 0	all_awardings	archived	associated_award	author	author_flair_background_color	author_flair_css_class	author_flair_richtext	author_flair_template_id	author_flair_text	author_flair_text_color	author_flair_type	author_fullname	author_patreon_flair	author_premium	body	body_sha1	can_gild	collapsed	collapsed_because_crowd_control	collapsed_reason	collapsed_reason_code	comment_type	controversiality	created_utc	distinguished	gilded	gildings	id	is_submitter	link_id	locked	no_follow	parent_id	permalink	retrieved_utc	score	score_hidden	send_replies	stickied	subreddit	subreddit_id	subreddit_name_prefixed	subreddit_type	top_awarded_type	total_awards_received	treatment_tags	unrepliable_reason	corpus	support	knowledge	conflict	power	similarity	fun	status	trust	identity	romance
108	[]	False		CallingVoid			[]				text	t2_6wp5f	False	False	"A wallet doesn't contain bitcoin, it contains your private keys. These allow you to access your bitcoin. If a wallet is airgapped then the private key is produced on a device that has never and (if never plugged in) will never touch the internet. This greatly decreases the attack surface. 

The coldcard uses an SD card to sign transactions generated on an internet enabled computer, which are then ready to be broadcast on that same computer."	df4752c826e44de4a0771b8ce781a31d4689ec4a	True	False					0	1651301338		0	{}	i6ripkx	False	t3_uey0gz	False	True	t1_i6rfdu4	/r/Bitcoin/comments/uey0gz/trezor_or_nano_or_something_else/i6ripkx/	1651301351	1	True	True	False	Bitcoin	t5_2s3qj	r/Bitcoin	public		0	[]		a wallet doesn t contain bitcoin it contains your private keys these allow you to access your bitcoin if a wallet is airgapped then the private key is produced on a device that has never and if never plugged in will never touch the internet this greatly decreases the attack surface the coldcard uses an sd card to sign transactions generated on an internet enabled computer which are then ready to be broadcast on that same computer 	0.0024871283676475286	0.9881607294082642	0.19588550925254822	0.027393875643610954	0.00894550234079361	0.4159758985042572	0.06877582520246506	8.503894832756487e-07	0.2903728187084198	0.012712703086435795
109	[]	False		eitoajtio		noob	[{'e': 'text', 't': 'redditor for 3 months'}]	2ec8e69e-6c36-11e9-a04b-0afb553d4ea6	redditor for 3 months	dark	richtext	t2_jeih8tnm	False	False	"&gt; Most people donâ€™t even have a phone or power in their house.

Looks like most people won't even notice this."	87fa1127c9cf1b18e0b6c86422ddd48873cb732e	True	False					0	1651301321		0	{}	i6riov6	False	t3_ue4cfi	False	True	t1_i6mupat	/r/Bitcoin/comments/ue4cfi/central_african_republic_in_a_couple_decades/i6riov6/	1651301332	1	True	True	False	Bitcoin	t5_2s3qj	r/Bitcoin	public		0	[]		 gt most people don t even have a phone or power in their house looks like most people won t even notice this 	0.019597500562667847	0.8688599467277527	0.3443586826324463	0.05628664046525955	0.2057340443134308	0.6361178159713745	0.10082381963729858	0.00031634760671295226	0.4396030902862549	0.005586082581430674
110	[]	False		smirnov_000			[]			dark	text	t2_c1d9nln1	False	False	Pretty much I just remember the jest of it somewhat can you remind me?	219cc91ead08e53eb4b5dbec460371fdee04c8a4	True	False					0	1651301282		0	{}	i6rin5q	False	t3_ueeeu9	False	True	t1_i6njpoe	/r/Bitcoin/comments/ueeeu9/daily_discussion_april_29_2022/i6rin5q/	1651301299	1	True	True	False	Bitcoin	t5_2s3qj	r/Bitcoin	public		0	[]		pretty much i just remember the jest of it somewhat can you remind me 	0.4079535901546478	0.207217276096344	0.2531169056892395	0.020573556423187256	0.5045142769813538	0.8837723135948181	0.3650636672973633	0.23635873198509216	0.371252179145813	0.014391843229532242
111	[]	False		ThePalych			[]				text	t2_ai5exlr9	False	False	Inflation is already a reality, because governments are printing way too much money.	dbad5b736de5381e740057355ef45cfaf13764e0	True	False					0	1651301271		0	{}	i6rimno	False	t3_uez0e5	False	True	t1_i6qyg4n	/r/Bitcoin/comments/uez0e5/repost_from_wsb/i6rimno/	1651301285	1	True	True	False	Bitcoin	t5_2s3qj	r/Bitcoin	public		0	[]		inflation is already a reality because governments are printing way too much money 	0.20243003964424133	0.7494122982025146	0.6605480313301086	0.7065473794937134	0.37354615330696106	0.32274332642555237	0.1766916811466217	0.0010172592010349035	0.5202361345291138	0.0038117950316518545
112	[]	False		BusinessBreakfast3			[]				text	t2_62s8vrzu	False	False	"I can generate a private key without a software. 

Regarding your second question, how does a Bitcoin node sync with the blockchain? You also need to access the information somehow."	c5fed34c6792741c79e11c4e37143c208d725070	True	False					0	1651301265		0	{}	i6rimf2	False	t3_uenyr3	False	True	t1_i6raaku	/r/Bitcoin/comments/uenyr3/4_million_members_in_this_group_and_just_under/i6rimf2/	1651301279	1	True	True	False	Bitcoin	t5_2s3qj	r/Bitcoin	public		0	[]		i can generate a private key without a software regarding your second question how does a bitcoin node sync with the blockchain you also need to access the information somehow 	0.043919820338487625	0.9860570430755615	0.18109160661697388	0.19268837571144104	0.00903323758393526	0.22017686069011688	0.0829368606209755	0.01461432408541441	0.3888266384601593	0.028265515342354774
113	[]	False		timevalueofmoonbits			[]			dark	text	t2_5rijhw2z	False	False	Why diamond ðŸ’Ž âœ‹ï¸ when you can ðŸ’Ž ðŸ§ 	b4fd32c2342b366e885f3422b4635e5e6995a63f	True	False					0	1651301198		0	{}	i6rijln	False	t3_uf44oo	False	True	t1_i6rf7n2	/r/Bitcoin/comments/uf44oo/daily_discussion_april_30_2022/i6rijln/	1651301213	1	True	True	False	Bitcoin	t5_2s3qj	r/Bitcoin	public		0	[]		why diamond when you can 	0.48976895213127136	0.4857337474822998	0.5204502940177917	0.5427246689796448	0.4778243601322174	0.5513694882392883	0.3998798429965973	0.45488232374191284	0.44580763578414917	0.684866726398468
114	[]	False		trferris			[]				text	t2_b4xcwijq	False	False	I want to know the same thing, can't find out that yet.	417ccc56e0270e6b48cf812b251ef393fa52e450	True	False					0	1651301150		0	{}	i6rihld	False	t3_ueiuk5	False	True	t1_i6oh9i5	/r/Bitcoin/comments/ueiuk5/to_accelerate_financial_inclusion_kraken_has/i6rihld/	1651301167	1	True	True	False	Bitcoin	t5_2s3qj	r/Bitcoin	public		0	[]		i want to know the same thing can t find out that yet 	0.4417722821235657	0.48098471760749817	0.26764461398124695	0.20569074153900146	0.49785393476486206	0.5421162843704224	0.16892613470554352	0.7103372812271118	0.3997606635093689	0.008682546205818653
115	[]	False		ymo			[]				text	t2_3dlpz	False	False	That's forbidden on Reddit.  Gotta upvote or downvote only on the topicality of the individual comment in the thread.  I think even downvoting in disagreement is frowned upon.	d73aff93c7565610186cfaa9a428628959a86bc2	True	False					0	1651301086		0	{}	i6rieu8	False	t3_ueqluz	False	True	t1_i6podpq	/r/Bitcoin/comments/ueqluz/for_anyone_wondering_what_its_like_to_be_a/i6rieu8/	1651301100	1	True	True	False	Bitcoin	t5_2s3qj	r/Bitcoin	public		0	[]		that s forbidden on reddit gotta upvote or downvote only on the topicality of the individual comment in the thread i think even downvoting in disagreement is frowned upon 	0.006458586547523737	0.8321012258529663	0.9244624972343445	0.030342208221554756	0.10132447630167007	0.40923160314559937	0.11890606582164764	8.455978672827769e-07	0.5087550282478333	0.015794431790709496
116	[]	False		BusinessBreakfast3			[]				text	t2_62s8vrzu	False	False	"This is the right answer. 

Thank you."	5d0240167c93d40c5c236a866431fcc5da8fe2ec	True	False					0	1651301053		0	{}	i6ridgh	False	t3_uenyr3	False	True	t1_i6qa40u	/r/Bitcoin/comments/uenyr3/4_million_members_in_this_group_and_just_under/i6ridgh/	1651301067	1	True	True	False	Bitcoin	t5_2s3qj	r/Bitcoin	public		0	[]		this is the right answer thank you 	0.6055912971496582	0.2752774655818939	0.34911346435546875	0.4848653972148895	0.4283572733402252	0.46391692757606506	0.6589804887771606	0.559147834777832	0.3554427921772003	0.18229177594184875
117	[]	False		fplfreakaaro			[]			dark	text	t2_a27hlhky	False	False	"-Bitcoin mining represents around 0.1% of global energy consumption.

-Much of it makes use of stranded and oversupplied energy sources. Electricity isn't fungible.

-BTC's productivity far outweighs its energy usage. Permissionless payments, inflation resistance, etc."	ead5365144b2baa257607ee7ccbbbcedb59bacbb	True	False					0	1651301048		0	{}	i6rid9u	False	t3_uf2mcd	False	True	t3_uf2mcd	/r/Bitcoin/comments/uf2mcd/to_the_nonbitcoin_people_out_there_who_think/i6rid9u/	1651301059	1	True	True	False	Bitcoin	t5_2s3qj	r/Bitcoin	public		0	[]		 bitcoin mining represents around 0 1 of global energy consumption much of it makes use of stranded and oversupplied energy sources electricity isn t fungible btc s productivity far outweighs its energy usage permissionless payments inflation resistance etc 	0.006561476271599531	0.9878457188606262	0.490911602973938	0.9042753577232361	0.010589136742055416	0.2908729910850525	0.17322148382663727	8.292077495752892e-07	0.4901745617389679	0.002397239441052079
118	[]	False		Trifusi0n			[]				text	t2_s9ut9	False	False	Logarithmic scale and linear scale on the same plot, my brain hurts.	874702dccc186313e2baeddfa8e675e45dd00045	True	False					0	1651301047		0	{}	i6rid71	False	t3_uf3n4w	False	True	t3_uf3n4w	/r/Bitcoin/comments/uf3n4w/btc_price_usd_vs_circulating_supply/i6rid71/	1651301060	1	True	True	False	Bitcoin	t5_2s3qj	r/Bitcoin	public		0	[]		logarithmic scale and linear scale on the same plot my brain hurts 	0.04883002117276192	0.8350205421447754	0.3966436982154846	0.3081626892089844	0.649626612663269	0.6902307868003845	0.22212550044059753	0.37477099895477295	0.4214765131473541	0.011628570035099983
119	[]	False		Nibbler_Jack			[]				text	t2_4tn32	False	False	Good thing Bitcoin is not a product and doesn't have a CEO.	11e0ee22e80efc981360538d76cbc13afed49e4f	True	False					0	1651301039		0	{}	i6ricu2	False	t3_uezk7t	False	True	t1_i6qwzov	/r/Bitcoin/comments/uezk7t/bitcoin_gives_you_the_ability_to_levitate_above/i6ricu2/	1651301052	1	True	True	False	Bitcoin	t5_2s3qj	r/Bitcoin	public		0	[]		good thing bitcoin is not a product and doesn t have a ceo 	0.46602144837379456	0.6595898270606995	0.47231388092041016	0.08237071335315704	0.35783034563064575	0.3203655183315277	0.25970008969306946	0.8466408252716064	0.4689061939716339	0.001976986415684223
120	[]	False		oltreil			[]				text	t2_8f6na6fj	False	False	It should be a weekly reminder from this sub	72ee0752172fced78f4bd945ae404f3df4f40409	True	False					0	1651301027		0	{}	i6ricaf	False	t3_uenyr3	False	True	t3_uenyr3	/r/Bitcoin/comments/uenyr3/4_million_members_in_this_group_and_just_under/i6ricaf/	1651301039	1	True	True	False	Bitcoin	t5_2s3qj	r/Bitcoin	public		0	[]		it should be a weekly reminder from this sub	0.5240957140922546	0.6128137111663818	0.23916170001029968	0.5162724256515503	0.3743515908718109	0.42281290888786316	0.4154372215270996	0.3723643124103546	0.36709120869636536	0.03409019485116005
121	[]	False		revol0ution			[]				text	t2_a31ahfv3	False	False	That's how real investors are because they always buy irrespective of dip	e973a095582cd865b01f77b96b6006f864e2099a	True	False					0	1651301000		0	{}	i6rib31	False	t3_uekjrq	False	True	t1_i6nz9fz	/r/Bitcoin/comments/uekjrq/how_much_bitcoin_is_enough/i6rib31/	1651301011	1	True	True	False	Bitcoin	t5_2s3qj	r/Bitcoin	public		0	[]		that s how real investors are because they always buy irrespective of dip	0.29092636704444885	0.7270660996437073	0.3663392663002014	0.5101131200790405	0.5442802906036377	0.4127076268196106	0.21572311222553253	0.4079170525074005	0.5247502326965332	0.0014552334323525429
122	[]	False		BusinessBreakfast3			[]				text	t2_62s8vrzu	False	False	"And then a transction happens. 

How do you sync your node with the blockchain?"	53669a7a0bb3ec778e3ada73f18b34680221ea40	True	False					0	1651300977		0	{}	i6ria39	False	t3_uenyr3	False	True	t1_i6q4heu	/r/Bitcoin/comments/uenyr3/4_million_members_in_this_group_and_just_under/i6ria39/	1651300991	1	True	True	False	Bitcoin	t5_2s3qj	r/Bitcoin	public		0	[]		and then a transction happens how do you sync your node with the blockchain 	0.415267676115036	0.7433366775512695	0.34088900685310364	0.3285844922065735	0.19093553721904755	0.05048472061753273	0.17321188747882843	0.3263673782348633	0.45445117354393005	0.0002228984667453915
123	[]	False		kraken-sera			[]			dark	text	t2_hnj7agmj	False	False	"Hi u/uncontrollableop ðŸ‘‹

Many thanks for your interest in Kraken as an exchange! Here's an overview on our [funding, trading, Instant Buy fees and fees we don't charge our clients](https://support.kraken.com/hc/en-us/articles/360030303832-Overview-of-fees-on-Kraken).

If you have any other questions, shoot us back a reply or [open a call/email/Live Chat](https://support.kraken.com/hc/en-us/articles/215601908) with us. 

Cheers,   
Kraken ðŸ™"	8f7d513e51820d2cc5530e787940e491c9caf598	True	False					0	1651300849		0	{}	i6ri4l4	False	t3_ueiuk5	False	True	t1_i6rf8ix	/r/Bitcoin/comments/ueiuk5/to_accelerate_financial_inclusion_kraken_has/i6ri4l4/	1651300865	1	True	True	False	Bitcoin	t5_2s3qj	r/Bitcoin	public		0	[]		hi u uncontrollableop many thanks for your interest in kraken as an exchange here s an overview on our funding trading instant buy fees and fees we don t charge our clients https support kraken com hc en us articles 360030303832 overview of fees on kraken if you have any other questions shoot us back a reply or open a call email live chat https support kraken com hc en us articles 215601908 with us cheers kraken 	0.0026841021608561277	0.9878259301185608	0.0055216713808476925	0.03868136927485466	0.007706819102168083	0.7439555525779724	0.3676516115665436	8.679321581439581e-07	0.3348769247531891	0.0040827286429703236
124	[]	False		retropieproblems			[]				text	t2_p1o2o2z	False	False	You recruit blockchains? Or what?	761f05c444a8086763c982d3cab40830c456f622	True	False					0	1651300736		0	{}	i6rhzqa	False	t3_ueqluz	False	True	t1_i6qaa5m	/r/Bitcoin/comments/ueqluz/for_anyone_wondering_what_its_like_to_be_a/i6rhzqa/	1651300751	1	True	True	False	Bitcoin	t5_2s3qj	r/Bitcoin	public		0	[]		you recruit blockchains or what 	0.48243850469589233	0.4886864721775055	0.520649254322052	0.5233116745948792	0.40872132778167725	0.4298649728298187	0.35731542110443115	0.4549829065799713	0.47656452655792236	0.22704598307609558
125	[]	False		retropieproblems			[]				text	t2_p1o2o2z	False	False	The fuck is a Bitcoin engineer?	2a5627c319a1281ea9afb13a06c576ea2046217c	True	False					0	1651300573		0	{}	i6rhspq	False	t3_ueqluz	False	True	t3_ueqluz	/r/Bitcoin/comments/ueqluz/for_anyone_wondering_what_its_like_to_be_a/i6rhspq/	1651300585	1	True	True	False	Bitcoin	t5_2s3qj	r/Bitcoin	public		0	[]		the fuck is a bitcoin engineer 	0.27027055621147156	0.461943119764328	0.6734917163848877	0.45080429315567017	0.3635207414627075	0.4604303538799286	0.33714112639427185	0.18103308975696564	0.4524507522583008	0.04235099256038666
126	[]	False		bitcoin_islander		noob	[{'e': 'text', 't': 'redditor for 5 weeks'}]	2ec8e69e-6c36-11e9-a04b-0afb553d4ea6	redditor for 5 weeks	dark	richtext	t2_kx3qokux	False	False	What is the point of running ubreachable nodes? Dont they have to be connected to others in order to sync all transactions?	e661ab90a95f271ffb538a667b61ff1690e38e43	True	False					0	1651300435		0	{}	i6rhmpg	False	t3_uenyr3	False	True	t1_i6opdtu	/r/Bitcoin/comments/uenyr3/4_million_members_in_this_group_and_just_under/i6rhmpg/	1651300446	1	True	True	False	Bitcoin	t5_2s3qj	r/Bitcoin	public		0	[]		what is the point of running ubreachable nodes dont they have to be connected to others in order to sync all transactions 	0.14610528945922852	0.8928436636924744	0.5740161538124084	0.40189221501350403	0.3284335136413574	0.24560274183750153	0.11213861405849457	8.601650165473984e-07	0.4764697253704071	0.02194761484861374
127	[]	False		bobbyv137			[]				text	t2_9r7xzckj	False	True	"Yes. The historical chart indicates purchasing BTC at circa 50% down from it's most recent all time high is a fine investment, in the long term. Can it go down further? Of course. So that's when you buy even more, if possible. 

When BTC is $250k around 2023 - just 36 months from now - you will not care whether you paid $38k or $33k."	06b731cced9212681f58500471f78c3c9f41bd49	True	False					0	1651300395		0	{}	i6rhkxw	False	t3_uex7yy	False	True	t3_uex7yy	/r/Bitcoin/comments/uex7yy/should_i_buy_a_whole_bitcoin/i6rhkxw/	1651300406	1	True	True	False	Bitcoin	t5_2s3qj	r/Bitcoin	public		0	[]		yes the historical chart indicates purchasing btc at circa 50 down from it s most recent all time high is a fine investment in the long term can it go down further of course so that s when you buy even more if possible when btc is 250k around 2023 just 36 months from now you will not care whether you paid 38k or 33k 	0.0008228535298258066	0.9956796765327454	0.6138042211532593	0.983853816986084	0.9971321821212769	0.06435626745223999	0.06567991524934769	8.437065162070212e-07	0.2856253981590271	0.0004544900730252266
128	[]	False		ForcedLoginIsFacism			[]			dark	text	t2_79ca6bgp	False	False	Soo every other follows closely	eb957fe22f00201960007d3b2eadb240d47b88a8	True	False					0	1651300361		0	{}	i6rhjfu	False	t3_uez0e5	False	True	t1_i6quiat	/r/Bitcoin/comments/uez0e5/repost_from_wsb/i6rhjfu/	1651300373	1	True	True	False	Bitcoin	t5_2s3qj	r/Bitcoin	public		0	[]		soo every other follows closely	0.5103769898414612	0.4751684069633484	0.323533833026886	0.37378305196762085	0.5540660619735718	0.4082889258861542	0.5000098943710327	0.5597245693206787	0.5403119921684265	0.2029421329498291
129	[]	False		Cats_n_Porn			[]				text	t2_bv8o0	False	False	If the oceans are boiling we can use the steam to power turbines for more Bitcoin mining.	30ef49731ef1cea5d24b3892a681f1c1c1e70e4f	True	False					0	1651300351		0	{}	i6rhj08	False	t3_uf2mcd	False	True	t1_i6r7alh	/r/Bitcoin/comments/uf2mcd/to_the_nonbitcoin_people_out_there_who_think/i6rhj08/	1651300367	1	True	True	False	Bitcoin	t5_2s3qj	r/Bitcoin	public		0	[]		if the oceans are boiling we can use the steam to power turbines for more bitcoin mining 	0.09356262534856796	0.9229534864425659	0.2796740233898163	0.8657165169715881	0.20185722410678864	0.2920744717121124	0.19585168361663818	9.017168167702039e-07	0.38969987630844116	0.0016738525591790676
130	[]	False		ForcedLoginIsFacism			[]			dark	text	t2_79ca6bgp	False	False	Thatâ€™s not a bug, itâ€™s a feature	f17d41c178fcff7125081cb179c70e649e78bb1c	True	False					0	1651300334		0	{}	i6rhicj	False	t3_uez0e5	False	True	t1_i6r7zpy	/r/Bitcoin/comments/uez0e5/repost_from_wsb/i6rhicj/	1651300347	1	True	True	False	Bitcoin	t5_2s3qj	r/Bitcoin	public		0	[]		that s not a bug it s a feature	0.33623600006103516	0.63010573387146	0.49499401450157166	0.3458879888057709	0.42289450764656067	0.7048081159591675	0.24079468846321106	0.010891015641391277	0.4876672923564911	0.006454594433307648
131	[]	False		coldearsforever		noob	[{'e': 'text', 't': 'redditor for 5 weeks'}]	2ec8e69e-6c36-11e9-a04b-0afb553d4ea6	redditor for 5 weeks	dark	richtext	t2_igsq9udr	False	False	Wen?	057b732589fd111f2288a80b18decb7fc4adb262	True	False					0	1651300300		0	{}	i6rhgt4	False	t3_uf297b	False	False	t3_uf297b	/r/Bitcoin/comments/uf297b/if_support_reaches_out_to_you_on_reddit_chat/i6rhgt4/	1651300314	1	True	True	False	Bitcoin	t5_2s3qj	r/Bitcoin	public		0	[]		wen 	0.4846218228340149	0.4789467751979828	0.5237472057342529	0.4908091723918915	0.47573819756507874	0.5246041417121887	0.49248966574668884	0.49370908737182617	0.485808789730072	0.5066181421279907
132	[]	False		119b63			[]				text	t2_16bu5u	False	False	I love jelly!	14c041e17ed05d4253a847b27478394a70f1bc5c	True	False					0	1651300289		0	{}	i6rhgc3	False	t3_ueqluz	False	True	t1_i6ppbmx	/r/Bitcoin/comments/ueqluz/for_anyone_wondering_what_its_like_to_be_a/i6rhgc3/	1651300300	1	True	True	False	Bitcoin	t5_2s3qj	r/Bitcoin	public		0	[]		i love jelly 	0.4802860617637634	0.35362672805786133	0.32216203212738037	0.377051442861557	0.5044432282447815	0.7454414963722229	0.6052783131599426	0.5191715359687805	0.4472673833370209	0.9442724585533142
133	[]	False		F3TGM5bpGG0S			[]			dark	text	t2_a5k773wi	False	False	He sold!	f83a215342ca4bc31fa12ff478141a1551ff765c	True	False					0	1651300278		0	{}	i6rhfu6	False	t3_uf44oo	False	True	t1_i6reywu	/r/Bitcoin/comments/uf44oo/daily_discussion_april_30_2022/i6rhfu6/	1651300294	1	True	True	False	Bitcoin	t5_2s3qj	r/Bitcoin	public		0	[]		he sold 	0.4398266673088074	0.5078878998756409	0.49737998843193054	0.5227620601654053	0.5058955550193787	0.5897312760353088	0.4445495009422302	0.5103999376296997	0.46673107147216797	0.4542877674102783
134	[]	False		Lord_Delioncurt			[]				text	t2_g4ue17iq	False	False	Kraken definitely gonna change the entire game in coming time.	38f14d291038367f9251759cd2790f696f8efd6f	True	False					0	1651300228		0	{}	i6rhdo6	False	t3_ueiuk5	False	True	t1_i6nimzn	/r/Bitcoin/comments/ueiuk5/to_accelerate_financial_inclusion_kraken_has/i6rhdo6/	1651300246	1	True	True	False	Bitcoin	t5_2s3qj	r/Bitcoin	public		0	[]		kraken definitely gonna change the entire game in coming time 	0.27223116159439087	0.4155943691730499	0.62760990858078	0.1703142672777176	0.49113717675209045	0.6796311140060425	0.2447851300239563	0.07815216481685638	0.3671722412109375	0.006707979366183281
135	[]	False		cgstmx			[]				text	t2_qhskmtc	False	False	"For people more familiar with metric:  
Total: 63,824,447.6 kmÂ²  
3.039 kmÂ² per Bitcoin"	5524cbdb1e7f708b2590eccdde9d5fda4deaced7	True	False					0	1651300221		0	{}	i6rhdcw	False	t3_uevi0m	False	True	t3_uevi0m	/r/Bitcoin/comments/uevi0m/bitcoin_compared_to_habitable_land_mass_on_earth/i6rhdcw/	1651300239	1	True	True	False	Bitcoin	t5_2s3qj	r/Bitcoin	public		0	[]		for people more familiar with metric total 63 824 447 6 km 3 039 km per bitcoin	0.04927438125014305	0.9621794819831848	0.32604849338531494	0.5964521765708923	0.523567259311676	0.12679822742938995	0.3366996645927429	0.6494903564453125	0.4415239095687866	0.00012277990754228085
136	[]	False		KairuXXXRival			[]				text	t2_4fwt67x4	False	False	"â€œInflation is goodâ€

Who tf thinks this shit ??"	957cb07caf1a881c63ffd82dc487043333a5044d	True	False					0	1651300202		0	{}	i6rhcgw	False	t3_uez0e5	False	True	t3_uez0e5	/r/Bitcoin/comments/uez0e5/repost_from_wsb/i6rhcgw/	1651300212	1	True	True	False	Bitcoin	t5_2s3qj	r/Bitcoin	public		0	[]		 inflation is good who tf thinks this shit 	0.30706098675727844	0.42865943908691406	0.5626388788223267	0.38435986638069153	0.44932931661605835	0.7607594728469849	0.3776586055755615	0.6111260056495667	0.41220566630363464	0.0031103966757655144
137	[]	False		Weir3			[]				text	t2_fyhz09p2	False	False	"Such a great move by kraken, they are just being the best in the whole motherfucking game,

we all love kraken so much and it deserve that love.

such a good place to buy BTC."	e449a4cebb31abb2e4f985bad798cb69fb09771f	True	False					0	1651300200		0	{}	i6rhcfg	False	t3_ueiuk5	False	True	t3_ueiuk5	/r/Bitcoin/comments/ueiuk5/to_accelerate_financial_inclusion_kraken_has/i6rhcfg/	1651300212	1	True	True	False	Bitcoin	t5_2s3qj	r/Bitcoin	public		0	[]		such a great move by kraken they are just being the best in the whole motherfucking game we all love kraken so much and it deserve that love such a good place to buy btc 	0.012837719172239304	0.20960460603237152	0.20787622034549713	0.0038095777854323387	0.9863811135292053	0.1040041446685791	0.14105676114559174	8.429408353549661e-07	0.35898831486701965	0.00011038190132239833
138	[]	False		119b63			[]				text	t2_16bu5u	False	False	"Link to any meaningful contribution to anything related (not just tangentially) to Bitcoin or GTFO. Bitcoin core was obviously just an example and the fact that you didn't understand that makes me doubt even more you're a ""top tier"" anything. Respectfully."	c17ce7deaac0cce6988dce86d545b085207cef08	True	False					0	1651300200		0	{}	i6rhcer	False	t3_ueqluz	False	True	t1_i6q7sjh	/r/Bitcoin/comments/ueqluz/for_anyone_wondering_what_its_like_to_be_a/i6rhcer/	1651300212	1	True	True	False	Bitcoin	t5_2s3qj	r/Bitcoin	public		0	[]		link to any meaningful contribution to anything related not just tangentially to bitcoin or gtfo bitcoin core was obviously just an example and the fact that you didn t understand that makes me doubt even more you re a top tier anything respectfully 	0.00905967690050602	0.985461950302124	0.9361780881881714	0.018438026309013367	0.008290622383356094	0.2437937706708908	0.07814221829175949	8.424538577855856e-07	0.31418415904045105	0.024153074249625206
139	[]	False		ForcedLoginIsFacism			[]			dark	text	t2_79ca6bgp	False	False	Then itâ€™s fine	15a237273d38c80f7cfdb5de2045a03c77542de3	True	False					0	1651300178		0	{}	i6rhbie	False	t3_uez0e5	False	True	t1_i6rbsxl	/r/Bitcoin/comments/uez0e5/repost_from_wsb/i6rhbie/	1651300194	1	True	True	False	Bitcoin	t5_2s3qj	r/Bitcoin	public		0	[]		then it s fine	0.47040894627571106	0.4870452284812927	0.4167642891407013	0.5563348531723022	0.5027835965156555	0.6655720472335815	0.3826068639755249	0.5142245888710022	0.4917958974838257	0.3228928744792938
