Unnamed: 0	all_awardings	archived	associated_award	author	author_flair_background_color	author_flair_css_class	author_flair_richtext	author_flair_template_id	author_flair_text	author_flair_text_color	author_flair_type	author_fullname	author_patreon_flair	author_premium	body	body_sha1	can_gild	collapsed	collapsed_because_crowd_control	collapsed_reason	collapsed_reason_code	comment_type	controversiality	created_utc	distinguished	gilded	gildings	id	is_submitter	link_id	locked	no_follow	parent_id	permalink	retrieved_utc	score	score_hidden	send_replies	stickied	subreddit	subreddit_id	subreddit_name_prefixed	subreddit_type	top_awarded_type	total_awards_received	treatment_tags	unrepliable_reason	corpus	support	knowledge	conflict	power	similarity	fun	status	trust	identity	romance
59	[]	False		MapleMemories			[]				text	t2_12fm8l	False	False	"Would love to see two things: 1) more decimal points on the number, more of an accuracy thing than anything else. If not by default then perhaps by a setting?

2) Might be more complicated but a graph showing balance over time would be awesome

Great start! Love the visuals!"	4b7f758540093deee436009bd288a2bbd853c87e	True	False					0	1662524463		0	{}	inerg6d	False	t3_x7hq33	False	True	t3_x7hq33	/r/ethereum/comments/x7hq33/i_made_a_eth_balance_lookup_tool/inerg6d/	1662524478	1	False	True	False	ethereum	t5_2zf9m	r/ethereum	public		0	[]		would love to see two things 1 more decimal points on the number more of an accuracy thing than anything else if not by default then perhaps by a setting 2 might be more complicated but a graph showing balance over time would be awesome great start love the visuals 	0.003903362201526761	0.9888321161270142	0.0698215588927269	0.013117857277393341	0.008703798986971378	0.8775284886360168	0.10140789300203323	8.620011726634402e-07	0.26265037059783936	0.5500949621200562
60	[]	False		ChunderHog			[]				text	t2_14vgnc	False	False	Because if you get hacked once all your assets are gone.	2535e8e6506a430ceb85c8e2d48b1e0602fd7761	True	False					0	1662524114		0	{}	ineqtgl	False	t3_x7u8ya	False	True	t3_x7u8ya	/r/ethereum/comments/x7u8ya/why_dont_we_see_more_online_wallets_based_on/ineqtgl/	1662524129	1	False	True	False	ethereum	t5_2zf9m	r/ethereum	public		0	[]		because if you get hacked once all your assets are gone 	0.34878411889076233	0.5721541047096252	0.6537094712257385	0.4409484565258026	0.41325366497039795	0.43823105096817017	0.1920251101255417	0.009213791228830814	0.39721494913101196	0.013419551774859428
61	[]	False		JohnMcafee4coffee			[]				text	t2_c5knzd27	False	False	They solved this problem with seed phrases.	9b46f6beb12c4aeda6e314211d1ba236a811bebd	True	False					0	1662524037		0	{}	ineqomg	False	t3_x7u8ya	False	False	t3_x7u8ya	/r/ethereum/comments/x7u8ya/why_dont_we_see_more_online_wallets_based_on/ineqomg/	1662524048	1	False	True	False	ethereum	t5_2zf9m	r/ethereum	public		0	[]		they solved this problem with seed phrases 	0.46009165048599243	0.47420528531074524	0.4630866050720215	0.47383055090904236	0.47743871808052063	0.3747945725917816	0.47675400972366333	0.49533095955848694	0.4689735174179077	0.13970790803432465
62	[]	False		sos755			[]				text	t2_kvyi2	False	False	I believe that most wallets already require a password to use them.	a487b3f907dab4ae3ed3af64db96198f8eb31fe2	True	False					0	1662523969		0	{}	ineqkdo	False	t3_x7u8ya	False	True	t3_x7u8ya	/r/ethereum/comments/x7u8ya/why_dont_we_see_more_online_wallets_based_on/ineqkdo/	1662523982	1	False	True	False	ethereum	t5_2zf9m	r/ethereum	public		0	[]		i believe that most wallets already require a password to use them 	0.3430764675140381	0.6626754403114319	0.15480126440525055	0.3741181194782257	0.232456773519516	0.31708648800849915	0.2641960680484772	0.5633525848388672	0.4364902675151825	0.0022976233158260584
63	[]	False		JohnMcafee4coffee			[]				text	t2_c5knzd27	False	False	Typically you will see it be sold cheaper	5f2f68d7cac7f845e3d503063a6f2b85ba7f30bf	True	False					0	1662523937		0	{}	ineqics	False	t3_x7ujty	False	True	t3_x7ujty	/r/ethereum/comments/x7ujty/what_happens_to_the_eth_in_various_wallets_post/ineqics/	1662523953	1	False	True	False	ethereum	t5_2zf9m	r/ethereum	public		0	[]		typically you will see it be sold cheaper	0.382931113243103	0.6531171798706055	0.3259028494358063	0.5739432573318481	0.46782857179641724	0.5515289306640625	0.2546052634716034	0.5751587748527527	0.4671427309513092	0.1423782855272293
64	[]	False		Furlz			[]				text	t2_11w8ke	False	False	Cool, nice job	d2dd871997b782142934ca1c97931ac1f6cf0c3c	True	False					0	1662523924		0	{}	ineqhki	False	t3_x7hq33	False	True	t3_x7hq33	/r/ethereum/comments/x7hq33/i_made_a_eth_balance_lookup_tool/ineqhki/	1662523939	1	False	True	False	ethereum	t5_2zf9m	r/ethereum	public		0	[]		cool nice job	0.5599920153617859	0.3938882052898407	0.3035278916358948	0.4166722893714905	0.5101175904273987	0.8965449333190918	0.5815495252609253	0.5665073990821838	0.4379066526889801	0.37208980321884155
65	[]	False		Perleflamme			[]				text	t2_13pqgo	False	False	"If you want it to work, you need to provide that token as a way to model an actually scarce resource.

And here, the scarce resource you could model is about post position in a post ordering list. As such, when you post, you can either do it freely and be last in that list or spend tokens to come higher. Then, you can be given tokens by people depending on the relevance of your post. As such, you can pay for the advertisement of being first in the list, to ensure more people view your post, because you believe lots of people will find it useful enough to notify it as relevant and give tokens to you. 

But by posting anywhere except at the last position, you push some people away from where they were. So, you could handle that by actually staking tokens rather than spending them. And then, staked tokens are regularly spent depending on how high the post is in the list. 

That's the spending part of the tokenomics, revolving around a scarce resource. 

Then, you can model the issuance part. Well, the issuance could be done by another token or the same token being staked to generate more tokens or anything to provide more tokens over time to people providing a service. Now as to what service to provide, that is a good question. Ideally, nothing tied to Karma, due to its very easy manipulation. Just being a Reddit viewer, as some sort of consumer? More than that? It's the half I'm struggling with.

Interestingly enough, this at least means it can be either handled by Reddit or any front end parsing Reddit posts and showing them in any order. So, technically, being a viewer looking at advertisements (if there's nothing else that can be done to monetize it) is a service provided to the front end and that could ensure there's a service and there are tokens users could earn, at the very least."	62bb03c7dc52c670015148a46f16a022aaf2656d	True	False					0	1662523700		0	{}	ineq3bn	False	t3_x7tx4l	False	True	t3_x7tx4l	/r/ethereum/comments/x7tx4l/paid_to_post_the_monetization_of_reddit_karma_and/ineq3bn/	1662523716	1	False	True	False	ethereum	t5_2zf9m	r/ethereum	public		0	[]		if you want it to work you need to provide that token as a way to model an actually scarce resource and here the scarce resource you could model is about post position in a post ordering list as such when you post you can either do it freely and be last in that list or spend tokens to come higher then you can be given tokens by people depending on the relevance of your post as such you can pay for the advertisement of being first in the list to ensure more people view your post because you believe lots of people will find it useful enough to notify it as relevant and give tokens to you but by posting anywhere except at the last position you push some people away from where they were so you could handle that by actually staking tokens rather than spending them and then staked tokens are regularly spent depending on how high the post is in the list that s the spending part of the tokenomics revolving around a scarce resource then you can model the issuance part well the issuance could be done by another token or the same token being staked to generate more tokens or anything to provide more tokens over time to people providing a service now as to what service to provide that is a good question ideally nothing tied to karma due to its very easy manipulation just being a reddit viewer as some sort of consumer more than that it s the half i m struggling with interestingly enough this at least means it can be either handled by reddit or any front end parsing reddit posts and showing them in any order so technically being a viewer looking at advertisements if there s nothing else that can be done to monetize it is a service provided to the front end and that could ensure there s a service and there are tokens users could earn at the very least 	0.002699886914342642	0.9890323281288147	0.17514584958553314	0.9525535106658936	0.008257071487605572	0.5252593159675598	0.0795007273554802	8.323611382365925e-07	0.281935453414917	0.03818840533494949
66	[]	False		[deleted]						dark					[removed]	fe993932d6dced4c0a879e9aa5d7a6e0fbb467f5	True	False					0	1662523544		0	{}	ineptch	False	t3_x7ujty	False	True	t3_x7ujty	/r/ethereum/comments/x7ujty/what_happens_to_the_eth_in_various_wallets_post/ineptch/	1662523558	1	False	True	False	ethereum	t5_2zf9m	r/ethereum	public		0	[]		 removed 	0.46707504987716675	0.5148742198944092	0.5170193910598755	0.5029740929603577	0.4936113953590393	0.5123135447502136	0.45383262634277344	0.4847692549228668	0.4981911778450012	0.5145108103752136
67	[]	False		ethtips			[]				text	t2_ptk2g	False	False	It's on autopilot now. Roughly 10 days to go.	6c2045bfdd8eba53bdc7167fbef7aa99d8727735	True	False					0	1662523512		0	{}	inepr7l	False	t3_x78ng5	False	True	t1_inei9jr	/r/ethereum/comments/x78ng5/the_final_countdown_to_the_ethereum_merge_has/inepr7l/	1662523528	1	False	True	False	ethereum	t5_2zf9m	r/ethereum	public		0	[]		it s on autopilot now roughly 10 days to go 	0.2958472669124603	0.7184711694717407	0.34632590413093567	0.6885330080986023	0.5285542011260986	0.4208315908908844	0.18140742182731628	0.25637340545654297	0.34519270062446594	0.0030569476075470448
68	[]	False		ethtips			[]				text	t2_ptk2g	False	False	"Db+ B Db+ F#     D+ Db+ D+ Db+ B  
D+ Db+ D+ F#     B A B A Ab B A  
Db+ B Db+ F#     D+ Db+ D+ Db+ B  
D+ Db+ D+ F#     B A B A Ab B A  
Db+ B Db+ F#     D+ Db+ D+ Db+ B  
D+ Db+ D+ F#     B A B A Ab B A  
Db+ B Db+ F#     D+ Db+ D+ Db+ B  
D+ Db+ D+ F#     B A B A Ab B A  
Ab A B   A B Db+ B A Ab F#  
D+ Db+  Db+ D+ Db+ B Db+  
Or just: [https://www.youtube.com/watch?v=9jK-NcRmVcw](https://www.youtube.com/watch?v=9jK-NcRmVcw) (song: ""The Final Countdown"")"	3d926a831a22d0be598033be752ddb261f123877	True	False					0	1662523467		0	{}	inepo6w	False	t3_x78ng5	False	True	t1_indscu3	/r/ethereum/comments/x78ng5/the_final_countdown_to_the_ethereum_merge_has/inepo6w/	1662523482	1	False	True	False	ethereum	t5_2zf9m	r/ethereum	public		0	[]		db b db f d db d db b d db d f b a b a ab b a db b db f d db d db b d db d f b a b a ab b a db b db f d db d db b d db d f b a b a ab b a db b db f d db d db b d db d f b a b a ab b a ab a b a b db b a ab f d db db d db b db or just https www youtube com watch v 9jk ncrmvcw https www youtube com watch v 9jk ncrmvcw song the final countdown 	0.002258324297145009	0.9889511466026306	0.10249059647321701	0.9421555399894714	0.007460745982825756	0.9192509651184082	0.1857917159795761	8.577492280892329e-07	0.40892478823661804	0.00851795356720686
69	[]	False		ethtips			[]				text	t2_ptk2g	False	False	"This was played excessively during the launch of Ethereum itself. :-) (song: ""The Final Countdown"")

https://www.youtube.com/watch?v=9jK-NcRmVcw"	11ba5017439b72c8635e9efe8f53f3a70ab5da84	True	False					0	1662523356		0	{}	inepgtt	False	t3_x78ng5	False	True	t1_ind84gb	/r/ethereum/comments/x78ng5/the_final_countdown_to_the_ethereum_merge_has/inepgtt/	1662523370	1	False	True	False	ethereum	t5_2zf9m	r/ethereum	public		0	[]		this was played excessively during the launch of ethereum itself song the final countdown https www youtube com watch v 9jk ncrmvcw	0.003911643289029598	0.941720187664032	0.2589694857597351	0.011460193432867527	0.2917618453502655	0.9297139048576355	0.19702443480491638	8.514541605109116e-07	0.43259522318840027	7.094862212397857e-06
70	[]	False		ethtips			[]				text	t2_ptk2g	False	False	"...but Bitcoin runs on dirty coal? ""Coal generates nearly 40% of the world's electricity"" ☁️☁️☁️☁️☁️🤕"	2d3992ea57bed68baef6bc8ce867723785340ee9	True	False					0	1662523254		0	{}	inepa2z	False	t3_x78ng5	False	True	t1_ineoieo	/r/ethereum/comments/x78ng5/the_final_countdown_to_the_ethereum_merge_has/inepa2z/	1662523265	1	False	True	False	ethereum	t5_2zf9m	r/ethereum	public		0	[]		 but bitcoin runs on dirty coal coal generates nearly 40 of the world s electricity 	0.08945181965827942	0.870711088180542	0.4982542097568512	0.5293408632278442	0.2843932509422302	0.3686635196208954	0.16601546108722687	9.950564708560705e-05	0.38979706168174744	0.005482170265167952
71	[]	False		BlankEris			[]				text	t2_j0a5jyh	False	False	They already have	39778d41cc20a73f3af5747af95c38b5fd6b57ea	True	False					0	1662566333		0	{}	ingrabm	False	t3_x85mcf	False	True	t3_x85mcf	/r/ethereum/comments/x85mcf/why_people_wont_sell_the_news_on_the_merge/ingrabm/	1662566345	1	False	True	False	ethereum	t5_2zf9m	r/ethereum	public		0	[]		they already have	0.5094513297080994	0.49233826994895935	0.4849451184272766	0.5679409503936768	0.4850253164768219	0.5006281733512878	0.47211897373199463	0.480518639087677	0.4929245710372925	0.31046929955482483
72	[]	False		Zarxrax			[]				text	t2_4lllr	False	False	"There is no ""news"". It has been public knowledge that this has been coming forever. There might be price action around the merge, but its got nothing to do with ""buy the rumor, sell the news""."	f9f58453faa9a27475e6260950f9fd71ead2d399	True	False					0	1662565827		0	{}	ingpywr	False	t3_x85mcf	False	True	t3_x85mcf	/r/ethereum/comments/x85mcf/why_people_wont_sell_the_news_on_the_merge/ingpywr/	1662565841	1	False	True	False	ethereum	t5_2zf9m	r/ethereum	public		0	[]		there is no news it has been public knowledge that this has been coming forever there might be price action around the merge but its got nothing to do with buy the rumor sell the news 	0.0077780005522072315	0.9840835928916931	0.5961195826530457	0.03666931390762329	0.7049590945243835	0.6960186958312988	0.0713401809334755	8.725473321646859e-07	0.30763670802116394	0.008527547121047974
73	[]	False		erikmalkavian			[]				text	t2_4s5jfd6p	False	False	good bot	cd0cfae43110cc7530d73483783846216584a8f7	True	False					0	1662565799		0	{}	ingpwcy	False	t3_x78ng5	False	True	t1_inb10xv	/r/ethereum/comments/x78ng5/the_final_countdown_to_the_ethereum_merge_has/ingpwcy/	1662565810	1	False	True	False	ethereum	t5_2zf9m	r/ethereum	public		0	[]		good bot	0.5119291543960571	0.469869464635849	0.45250391960144043	0.4583524167537689	0.5173079371452332	0.6910462379455566	0.5098810195922852	0.5280970931053162	0.4696330428123474	0.32473132014274597
74	[]	False		_Zazu95_			[]				text	t2_cqgtmoxx	False	False	I don’t think it will make a difference	9fa32ee9b8ad83dc5019cd55cb0f9868e4138f44	True	False					0	1662565787		0	{}	ingpv7u	False	t3_x83r4o	False	True	t3_x83r4o	/r/ethereum/comments/x83r4o/premerge_and_postmerge_transactions_can_a/ingpv7u/	1662565801	1	False	True	False	ethereum	t5_2zf9m	r/ethereum	public		0	[]		i don t think it will make a difference	0.42666196823120117	0.4617532193660736	0.3276497423648834	0.19829589128494263	0.3291268050670624	0.5416854023933411	0.36538174748420715	0.3162217438220978	0.43483126163482666	0.021582866087555885
75	[]	False		28tolove			[]				text	t2_n0zd1aon	False	False	"That's a pretty big ""update"" we are talking about here... I mean the entire consensus mechanism of eth is being changed from POW to POS .. this is not like the previous updates... This is huge for ethereum..."	1202e4ec03f11c359024a349554e4229037215bc	True	False					0	1662565780		0	{}	ingpukr	False	t3_x85mcf	False	True	t1_inghn75	/r/ethereum/comments/x85mcf/why_people_wont_sell_the_news_on_the_merge/ingpukr/	1662565793	1	False	True	False	ethereum	t5_2zf9m	r/ethereum	public		0	[]		that s a pretty big update we are talking about here i mean the entire consensus mechanism of eth is being changed from pow to pos this is not like the previous updates this is huge for ethereum 	0.005703989416360855	0.9798094034194946	0.6737982630729675	0.0058166636154055595	0.9942408800125122	0.24895957112312317	0.09228277951478958	8.427688271694933e-07	0.334423691034317	0.00010151776950806379
76	[]	False		L0ckeandDemosthenes			[]				text	t2_aoabfhk	False	True	"Obv etc, raven... 

Anyone still holding their etc just incase or have you sold em to buy more eth. Trying to figure out what I should do. Any chance the chain will be viable and compliment eth... if not that's the only chance I can see of it having a use case. Thoughts?"	1d1729f3e160bd6a4c8ef0c1da3baf6a34e2db92	True	False					0	1662565692		0	{}	ingpm93	False	t3_x82szv	False	True	t3_x82szv	/r/ethereum/comments/x82szv/ethereum_proof_of_stake_date_ethereum_proof_of/ingpm93/	1662565704	1	False	True	False	ethereum	t5_2zf9m	r/ethereum	public		0	[]		obv etc raven anyone still holding their etc just incase or have you sold em to buy more eth trying to figure out what i should do any chance the chain will be viable and compliment eth if not that s the only chance i can see of it having a use case thoughts 	0.00277772662229836	0.9882461428642273	0.5264761447906494	0.019083818420767784	0.0076108770444989204	0.35763877630233765	0.06560254096984863	8.414694434577541e-07	0.2123878002166748	0.015645822510123253
77	[]	False		voltsmeter			[]				text	t2_mdq7l47o	False	False	What do ya’ll think will be mined? Make me feel better about selling 200 etc about 2 months ago	e6ddd312918218d4083d272a4d5a0a7f0a117fb9	True	False					0	1662565581		0	{}	ingpc0f	False	t3_x85mcf	False	True	t3_x85mcf	/r/ethereum/comments/x85mcf/why_people_wont_sell_the_news_on_the_merge/ingpc0f/	1662565599	1	False	True	False	ethereum	t5_2zf9m	r/ethereum	public		0	[]		what do ya ll think will be mined make me feel better about selling 200 etc about 2 months ago	0.3263590335845947	0.6092303395271301	0.33254629373550415	0.043142758309841156	0.28170838952064514	0.4724375009536743	0.12988774478435516	0.8809030652046204	0.31625238060951233	0.016135627403855324
78	[]	False		hanniabu			[]				text	t2_fzasvrv	False	True	Staked ETH will still be locked until the following update, but at that point only 900 validators can exit per day which means the sell pressure will be limited	0d7fd67007a6be58da0ee214c9e1aa3c44a8b7cc	True	False					0	1662565543		0	{}	ingp8fv	False	t3_x85mcf	False	True	t1_ingoof5	/r/ethereum/comments/x85mcf/why_people_wont_sell_the_news_on_the_merge/ingp8fv/	1662565559	1	False	True	False	ethereum	t5_2zf9m	r/ethereum	public		0	[]		staked eth will still be locked until the following update but at that point only 900 validators can exit per day which means the sell pressure will be limited	0.04710770770907402	0.978004515171051	0.2585388720035553	0.9033921957015991	0.312885582447052	0.3592522442340851	0.09089039266109467	8.579333439229231e-07	0.34957048296928406	0.0066469162702560425
79	[]	False		28tolove			[]				text	t2_n0zd1aon	False	False	I agree with you but the crypto market is currently going through a downtrend so I doubt we see any kind of large price increase right away, However I do believe in the next 4-5 months we would see considerable price increase for eth...	54dc234f37b7e659c84a76bd8193a3a44b73bcda	True	False					0	1662565535		0	{}	ingp7r1	False	t3_x85mcf	False	True	t1_ingepxd	/r/ethereum/comments/x85mcf/why_people_wont_sell_the_news_on_the_merge/ingp7r1/	1662565551	1	False	True	False	ethereum	t5_2zf9m	r/ethereum	public		0	[]		i agree with you but the crypto market is currently going through a downtrend so i doubt we see any kind of large price increase right away however i do believe in the next 4 5 months we would see considerable price increase for eth 	0.003906960599124432	0.986000120639801	0.38496822118759155	0.025767752900719643	0.9796468019485474	0.3581010103225708	0.10061606764793396	8.77351908457058e-07	0.23594066500663757	0.004174287896603346
80	[]	False		gvictor808			[]				text	t2_2w0k216g	False	False	I never staked ETH because I didn’t want to wait for the merge for my ETH to be unlocked.  Is that still a thing?  If so, then for sure the event might well be a “sell the unlock” which happens to coincide with the news.  Or did that locking thing get changed?	a58baa9c29ce91152077f0a3402fe040d50dac03	True	False					0	1662565328		0	{}	ingoof5	False	t3_x85mcf	False	True	t3_x85mcf	/r/ethereum/comments/x85mcf/why_people_wont_sell_the_news_on_the_merge/ingoof5/	1662565342	1	False	True	False	ethereum	t5_2zf9m	r/ethereum	public		0	[]		i never staked eth because i didn t want to wait for the merge for my eth to be unlocked is that still a thing if so then for sure the event might well be a sell the unlock which happens to coincide with the news or did that locking thing get changed 	0.00343873118981719	0.98575758934021	0.4798479676246643	0.01717357710003853	0.009966683574020863	0.5546870231628418	0.060635048896074295	8.487617719765694e-07	0.2261471450328827	0.011927131563425064
81	[]	False		adosti			[]				text	t2_h5wbptn	False	False	Yes and you should move them ASAP	9f034f24a1af14cca0db0485dd0056bea6cfaff2	True	False					0	1662565280		0	{}	ingojz5	False	t3_x7zoto	False	True	t3_x7zoto	/r/ethereum/comments/x7zoto/i_have_eth_sitting_in_a_few_different_exchanges/ingojz5/	1662565293	1	False	True	False	ethereum	t5_2zf9m	r/ethereum	public		0	[]		yes and you should move them asap	0.5578979253768921	0.3235161304473877	0.24915288388729095	0.5241327285766602	0.3632848858833313	0.5017286539077759	0.4989296495914459	0.4958842992782593	0.3694356679916382	0.08401971310377121
82	[]	False		[deleted]						dark					[removed]	fe993932d6dced4c0a879e9aa5d7a6e0fbb467f5	True	False					0	1662565154		0	{}	ingo88r	False	t3_x85mcf	False	True	t3_x85mcf	/r/ethereum/comments/x85mcf/why_people_wont_sell_the_news_on_the_merge/ingo88r/	1662565172	1	False	True	False	ethereum	t5_2zf9m	r/ethereum	public		0	[]		 removed 	0.46707504987716675	0.5148742198944092	0.5170193910598755	0.5029740929603577	0.4936113953590393	0.5123135447502136	0.45383262634277344	0.4847692549228668	0.4981911778450012	0.5145108103752136
83	[]	False		[deleted]						dark					[removed]	fe993932d6dced4c0a879e9aa5d7a6e0fbb467f5	True	False					0	1662565142		0	{}	ingo76m	False	t3_x85mcf	False	True	t1_inghcv7	/r/ethereum/comments/x85mcf/why_people_wont_sell_the_news_on_the_merge/ingo76m/	1662565155	1	False	True	False	ethereum	t5_2zf9m	r/ethereum	public		0	[]		 removed 	0.46707504987716675	0.5148742198944092	0.5170193910598755	0.5029740929603577	0.4936113953590393	0.5123135447502136	0.45383262634277344	0.4847692549228668	0.4981911778450012	0.5145108103752136
84	[]	False		[deleted]						dark					[removed]	fe993932d6dced4c0a879e9aa5d7a6e0fbb467f5	True	False					0	1662565058		0	{}	ingnzbk	False	t3_x85mcf	False	True	t3_x85mcf	/r/ethereum/comments/x85mcf/why_people_wont_sell_the_news_on_the_merge/ingnzbk/	1662565075	1	False	True	False	ethereum	t5_2zf9m	r/ethereum	public		0	[]		 removed 	0.46707504987716675	0.5148742198944092	0.5170193910598755	0.5029740929603577	0.4936113953590393	0.5123135447502136	0.45383262634277344	0.4847692549228668	0.4981911778450012	0.5145108103752136
85	[]	False		NckyDC			[]				text	t2_hvfyxiw	False	False	One thing comes to mind…. Security?	db33aa7ddab3e5e06352115a5eb7532ba334770e	True	False					0	1662564771		0	{}	ingn9g3	False	t3_x7u8ya	False	True	t3_x7u8ya	/r/ethereum/comments/x7u8ya/why_dont_we_see_more_online_wallets_based_on/ingn9g3/	1662564785	1	False	True	False	ethereum	t5_2zf9m	r/ethereum	public		0	[]		one thing comes to mind security 	0.4476677477359772	0.4835027754306793	0.4556105136871338	0.33893275260925293	0.5099593997001648	0.5309200286865234	0.3598141074180603	0.4769325256347656	0.45085465908050537	0.10151198506355286
86	[]	False		syscollapse			[]				text	t2_hnzrt9m3	False	True	lol	403926033d001b5279df37cbbe5287b7c7c267fa	True	False					0	1662564735		0	{}	ingn60y	False	t3_x85gar	False	True	t3_x85gar	/r/ethereum/comments/x85gar/ipfs_alternatives/ingn60y/	1662564753	1	False	True	False	ethereum	t5_2zf9m	r/ethereum	public		0	[]		lol	0.47317075729370117	0.43597516417503357	0.5476417541503906	0.4700857996940613	0.4872163236141205	0.6691137552261353	0.49147942662239075	0.4918611943721771	0.46693652868270874	0.5699469447135925
87	[]	False		abzzdev			[]				text	t2_30khgtkt	False	False	Not long now ;)	521f04ee3af950309c1c7af8e4bd1d0e8b63f0c6	True	False					0	1662564712		0	{}	ingn3yj	False	t3_nsc8n1	False	True	t1_h0mtylc	/r/ethereum/comments/nsc8n1/everyone_is_talking_about_ethereum_at_bitcoin_2021/ingn3yj/	1662564729	1	False	True	False	ethereum	t5_2zf9m	r/ethereum	public		0	[]		not long now 	0.5201006531715393	0.5003911256790161	0.5042099356651306	0.5360659956932068	0.4728463292121887	0.468591570854187	0.43875059485435486	0.4872420132160187	0.5116100311279297	0.44338259100914
88	[]	False		Responsible-Store-62			[]				text	t2_a1athvo8	False	True	"the eip-1559 fee burn mechanism (2021)
-90% issuance reduction post-merge
staking locking supply"	adafff5b388471f77ba26f3119eb23b102e47244	True	False					0	1662564502		0	{}	ingmkp1	False	t3_x85mcf	False	True	t1_inglkdb	/r/ethereum/comments/x85mcf/why_people_wont_sell_the_news_on_the_merge/ingmkp1/	1662564520	1	False	True	False	ethereum	t5_2zf9m	r/ethereum	public		0	[]		the eip 1559 fee burn mechanism 2021 90 issuance reduction post merge staking locking supply	0.11617826670408249	0.8587154150009155	0.5712491273880005	0.6234030723571777	0.17043252289295197	0.12131363898515701	0.24261686205863953	1.1934439498872962e-06	0.4662299156188965	0.01186539139598608
