Unnamed: 0	all_awardings	archived	associated_award	author	author_flair_background_color	author_flair_css_class	author_flair_richtext	author_flair_template_id	author_flair_text	author_flair_text_color	author_flair_type	author_fullname	author_patreon_flair	author_premium	body	body_sha1	can_gild	collapsed	collapsed_because_crowd_control	collapsed_reason	collapsed_reason_code	comment_type	controversiality	created_utc	distinguished	gilded	gildings	id	is_submitter	link_id	locked	no_follow	parent_id	permalink	retrieved_utc	score	score_hidden	send_replies	stickied	subreddit	subreddit_id	subreddit_name_prefixed	subreddit_type	top_awarded_type	total_awards_received	treatment_tags	unrepliable_reason	corpus	support	knowledge	conflict	power	similarity	fun	status	trust	identity	romance
0	[]	False		sylverreine			[]				text	t2_c33y2mc1	False	False	Sorry. When is the expected eth2.0 release?	82be301adf63e962a458fd22883d850623d78be4	True	False					0	1648799474		0	{}	i2yhbql	False	t3_tt2cqu	False	True	t3_tt2cqu	/r/ethereum/comments/tt2cqu/the_merge_is_coming_a_few_things_to_expect/i2yhbql/	1648799489	1	False	True	False	ethereum	t5_2zf9m	r/ethereum	public		0	[]		sorry when is the expected eth2 0 release 	0.4636264145374298	0.48516547679901123	0.5038148164749146	0.4392277002334595	0.482805460691452	0.4686650335788727	0.3333539664745331	0.1190096065402031	0.4000947177410126	0.03620706871151924
1	[]	False		[deleted]						dark					[removed]	fe993932d6dced4c0a879e9aa5d7a6e0fbb467f5	True	False					0	1648799364		0	{}	i2yh6ye	False	t3_ttiuv6	False	True	t1_i2yh6f6	/r/ethereum/comments/ttiuv6/a_post_from_8_years_ago_of_me_congratulating/i2yh6ye/	1648799385	1	False	True	False	ethereum	t5_2zf9m	r/ethereum	public		0	[]		 removed 	0.46707504987716675	0.5148742198944092	0.5170193910598755	0.5029740929603577	0.4936113953590393	0.5123135447502136	0.45383262634277344	0.4847692549228668	0.4981911778450012	0.5145108103752136
2	[]	False		iraqmtpizza			[]				text	t2_gspd52qw	False	False	aha! we found the guy who started the whole Etherium spelling	77f5f23f545238f1fa667473ae95032ab21368c6	True	False					0	1648799352		0	{}	i2yh6f6	False	t3_ttiuv6	False	True	t3_ttiuv6	/r/ethereum/comments/ttiuv6/a_post_from_8_years_ago_of_me_congratulating/i2yh6f6/	1648799369	1	False	True	False	ethereum	t5_2zf9m	r/ethereum	public		0	[]		aha we found the guy who started the whole etherium spelling	0.165428027510643	0.440376341342926	0.46554243564605713	0.15083147585391998	0.6441494822502136	0.8175061345100403	0.3487379848957062	0.4917715787887573	0.3653022050857544	0.004216704983264208
3	[]	False		wildlight			[]				text	t2_c8xi1	False	False	except this new york can easily be bridged to any other city and some of them of free real-estate.	38cce8d44d7c91239f1df9a84eb805494c99d7a3	True	False					0	1648799033		0	{}	i2ygsew	False	t3_ttbtr5	False	True	t3_ttbtr5	/r/ethereum/comments/ttbtr5/grayscale_ethereum_is_like_new_york_city_vast/i2ygsew/	1648799050	1	False	True	False	ethereum	t5_2zf9m	r/ethereum	public		0	[]		except this new york can easily be bridged to any other city and some of them of free real estate 	0.24011272192001343	0.9035403728485107	0.4227146506309509	0.06036990508437157	0.4429422616958618	0.30523502826690674	0.1369318664073944	1.365763409921783e-06	0.4382771849632263	0.011404138058423996
4	[]	False		Kentucky7887			[]				text	t2_23k9njs	False	False	It's 10k was raised in the 2000s	dd7ac1764b35caeaab5ebd2a795ead78e3ec5937	True	False					0	1648799026		0	{}	i2ygs2i	False	t3_tt56qm	False	True	t1_i2xs7xi	/r/ethereum/comments/tt56qm/eu_parliament_votes_to_impose_kyc_on_private/i2ygs2i/	1648799042	1	False	True	False	ethereum	t5_2zf9m	r/ethereum	public		0	[]		it s 10k was raised in the 2000s	0.31256306171417236	0.6823657155036926	0.374743789434433	0.4636704921722412	0.49331289529800415	0.2832912802696228	0.3090956509113312	0.3511945605278015	0.5034343004226685	0.0027227483224123716
5	[]	False		SibenIliben711			[]				text	t2_dunsqvud	False	False	I'd rather be billed in USD than stablecoins.	c53a3a013e8fe156644b346968b36be43410767a	True	False					0	1648799020		0	{}	i2ygrt6	False	t3_ttjyvl	False	True	t3_ttjyvl	/r/ethereum/comments/ttjyvl/i_will_try_making_an_nft_using_bwares_new_blast/i2ygrt6/	1648799038	1	False	True	False	ethereum	t5_2zf9m	r/ethereum	public		0	[]		i d rather be billed in usd than stablecoins 	0.14753161370754242	0.6404581665992737	0.41408056020736694	0.1906132996082306	0.4344477951526642	0.09420617669820786	0.3677630126476288	0.04912319406867027	0.4774283468723297	0.009612121619284153
6	[]	False		crowcrow19			[]				text	t2_cwb40j0y	False	False	Why do i read everywhere, that they killed DeFi with this notion? Doesnt every DeFi system still work, just losing its anonymity?	3ca3235d25c1f3ea8fe8db02ca0b1376d8a02c1c	True	False					0	1648798626		0	{}	i2ygav6	False	t3_tt56qm	False	False	t1_i2wvg7s	/r/ethereum/comments/tt56qm/eu_parliament_votes_to_impose_kyc_on_private/i2ygav6/	1648798642	1	False	True	False	ethereum	t5_2zf9m	r/ethereum	public		0	[]		why do i read everywhere that they killed defi with this notion doesnt every defi system still work just losing its anonymity 	0.06071135774254799	0.7668272852897644	0.5412285923957825	0.03277791664004326	0.4581688940525055	0.4040857255458832	0.13251274824142456	8.489374181408493e-07	0.47065192461013794	0.004523617215454578
7	[]	False		777Go_Ape_shit			[]				text	t2_fhy0rqcf	False	False	I’m sorry I do not know that info. I just know they said that when I activated that wallet.	e632c9d55860e5221aad569773809bc68b7ae985	True	False					0	1648798609		0	{}	i2yga4w	False	t3_tsu33v	False	True	t1_i2tj9ov	/r/ethereum/comments/tsu33v/gnosis_safe_alternatives/i2yga4w/	1648798623	1	False	True	False	ethereum	t5_2zf9m	r/ethereum	public		0	[]		i m sorry i do not know that info i just know they said that when i activated that wallet 	0.48315533995628357	0.2876517176628113	0.3267447352409363	0.010954683646559715	0.499123215675354	0.7495608925819397	0.5505003929138184	0.5952459573745728	0.35736483335494995	0.00681620929390192
8	[]	False		crowcrow19			[]				text	t2_cwb40j0y	False	False	I see, thank you :)	833cf663eefe568282e75584a967e852a663eb21	True	False					0	1648798171		0	{}	i2yfr0s	False	t3_tq2m2p	False	True	t1_i2xv1gu	/r/ethereum/comments/tq2m2p/frequently_asked_questions_weekly_discussion/i2yfr0s/	1648798185	1	False	True	False	ethereum	t5_2zf9m	r/ethereum	public		0	[]		i see thank you 	0.666358232498169	0.21909977495670319	0.2781943082809448	0.367422491312027	0.4724693298339844	0.5388244986534119	0.7557655572891235	0.5627122521400452	0.3981023132801056	0.5336768627166748
9	[]	False		SigBetto97			[]				text	t2_4dmasfuz	False	False	"Computers ara fast and it's very unlike to happend :D

Also if you make some code that are reeeaaly slow you will and up paying 1000$ for that transaction...  


Anyway i think that the validator interrupt the code if the transaction dont complete in time and you can lose al the gas."	1ec8ef8cb9b826ea8aa2292291577dbfeef02d42	True	False					0	1648797821		0	{}	i2yfblt	False	t3_tt8wue	False	True	t1_i2xlii4	/r/ethereum/comments/tt8wue/since_ethereum_has_this_caracteristic_of_run/i2yfblt/	1648797840	1	False	True	False	ethereum	t5_2zf9m	r/ethereum	public		0	[]		computers ara fast and it s very unlike to happend d also if you make some code that are reeeaaly slow you will and up paying 1000 for that transaction anyway i think that the validator interrupt the code if the transaction dont complete in time and you can lose al the gas 	0.004392219707369804	0.9875602126121521	0.44291892647743225	0.024704627692699432	0.30204468965530396	0.37828677892684937	0.06773483753204346	8.609429755779274e-07	0.23313096165657043	0.0121808722615242
10	[]	False		gorgos19			[]				text	t2_6ikai	False	False	"Went to a crypto hackathon before the Ethereum mainnet was released. I remembered there were two people who wanted to try and do something on the first Ethereum testnet and I had no clue what this whole thing was. And neither did most others, it was just a vague new thing barely anyone could really grasp.

I also remember when the first white paper from Vitalik was released, reading it and in no way realizing the impact of what I was reading. Then reading about the ETH sale and thinking 'wow who is so crazy to put real BTC into this sale for some newly worthless currency?'

Then I focused on finishing my education in Computer Science for the next year and in my master thesis came back to crypto and realizing how quickly everything evolved meanwhile."	1467ede16ea241fe5e3313a1d4a83c0bac0631ad	True	False					0	1648797066		0	{}	i2yedim	False	t3_tt1zue	False	True	t3_tt1zue	/r/ethereum/comments/tt1zue/a_question_for_the_og_ethereum_people/i2yedim/	1648797086	1	False	True	False	ethereum	t5_2zf9m	r/ethereum	public		0	[]		went to a crypto hackathon before the ethereum mainnet was released i remembered there were two people who wanted to try and do something on the first ethereum testnet and i had no clue what this whole thing was and neither did most others it was just a vague new thing barely anyone could really grasp i also remember when the first white paper from vitalik was released reading it and in no way realizing the impact of what i was reading then reading about the eth sale and thinking wow who is so crazy to put real btc into this sale for some newly worthless currency then i focused on finishing my education in computer science for the next year and in my master thesis came back to crypto and realizing how quickly everything evolved meanwhile 	0.002508661476895213	0.9882054328918457	0.33721867203712463	0.05878220498561859	0.00874768290668726	0.3838219940662384	0.09336873888969421	8.462698701805493e-07	0.2112751454114914	0.024290282279253006
11	[]	False		[deleted]						dark					[removed]	fe993932d6dced4c0a879e9aa5d7a6e0fbb467f5	True	False					0	1648796558		0	{}	i2ydpy8	False	t3_tt1zue	False	True	t1_i2v2jok	/r/ethereum/comments/tt1zue/a_question_for_the_og_ethereum_people/i2ydpy8/	1648796573	1	False	True	False	ethereum	t5_2zf9m	r/ethereum	public		0	[]		 removed 	0.46707504987716675	0.5148742198944092	0.5170193910598755	0.5029740929603577	0.4936113953590393	0.5123135447502136	0.45383262634277344	0.4847692549228668	0.4981911778450012	0.5145108103752136
12	[]	False		quiet_outdoors			[]				text	t2_f9a0gp0t	False	False	 If they have announced their general availability, best believe all they promise is in effect. However, I would wait for them to finish their next phase then join in.	2ca4b863b16964daf21ae6cd40485ac4a1dfaf86	True	False					0	1648796516		0	{}	i2ydo03	False	t3_ttjyvl	False	True	t1_i2yadob	/r/ethereum/comments/ttjyvl/i_will_try_making_an_nft_using_bwares_new_blast/i2ydo03/	1648796534	1	False	True	False	ethereum	t5_2zf9m	r/ethereum	public		0	[]		 if they have announced their general availability best believe all they promise is in effect however i would wait for them to finish their next phase then join in 	0.21824635565280914	0.9394018054008484	0.10468820482492447	0.9207391142845154	0.19496288895606995	0.4400111734867096	0.10123981535434723	0.8360540270805359	0.3237709105014801	0.027346381917595863
13	[]	False		[deleted]						dark					[removed]	fe993932d6dced4c0a879e9aa5d7a6e0fbb467f5	True	False					0	1648796510		0	{}	i2ydnq7	False	t3_tt70ax	False	True	t3_tt70ax	/r/ethereum/comments/tt70ax/wen_merge/i2ydnq7/	1648796526	1	False	True	False	ethereum	t5_2zf9m	r/ethereum	public		0	[]		 removed 	0.46707504987716675	0.5148742198944092	0.5170193910598755	0.5029740929603577	0.4936113953590393	0.5123135447502136	0.45383262634277344	0.4847692549228668	0.4981911778450012	0.5145108103752136
14	[]	False		coinfeeds-bot			[]				text	t2_8ihxazi7	False	False	"tldr; Italian fashion brand Off-White has launched a service that allows customers to buy items using Bitcoin, ETH, and Ripple. Customers can also pay for their favorite items using other cryptocurrencies like Binance coin (BNB), tether (USDT), and USD Coin (USDC). The company said it has adopted the LUNU POS, a payment terminal capable of sourcing the best exchange rate at the time of the purchase.

*This summary is auto generated by a bot and not meant to replace reading the original article. As always, DYOR.*"	c5d4c3f0c95e345bcc533c794d6049c8c6253ff2	True	False					0	1648796469		0	{}	i2ydlth	False	t3_ttkl40	False	True	t3_ttkl40	/r/ethereum/comments/ttkl40/major_italian_fashion_brand_offwhite_now_accepts/i2ydlth/	1648796483	1	False	True	False	ethereum	t5_2zf9m	r/ethereum	public		0	[]		tldr italian fashion brand off white has launched a service that allows customers to buy items using bitcoin eth and ripple customers can also pay for their favorite items using other cryptocurrencies like binance coin bnb tether usdt and usd coin usdc the company said it has adopted the lunu pos a payment terminal capable of sourcing the best exchange rate at the time of the purchase this summary is auto generated by a bot and not meant to replace reading the original article as always dyor 	0.0008051060722209513	0.9952877759933472	0.24147094786167145	0.01700848527252674	0.004216865170747042	0.19562764465808868	0.10384947061538696	8.50589856327133e-07	0.3391859233379364	0.0001626279845368117
15	[]	False		[deleted]						dark					[removed]	fe993932d6dced4c0a879e9aa5d7a6e0fbb467f5	True	False					0	1648795760		0	{}	i2ycoxs	False	t3_tnjlsj	False	True	t3_tnjlsj	/r/ethereum/comments/tnjlsj/looks_like_reddit_is_building_an_nft_marketplace/i2ycoxs/	1648795777	1	False	True	False	ethereum	t5_2zf9m	r/ethereum	public		0	[]		 removed 	0.46707504987716675	0.5148742198944092	0.5170193910598755	0.5029740929603577	0.4936113953590393	0.5123135447502136	0.45383262634277344	0.4847692549228668	0.4981911778450012	0.5145108103752136
16	[]	False		dynamicallysteadfast			[]				text	t2_9593n9ry	False	False	"""**VITAAAAAAAAAAAALIIIIIIIIIIIKKKKKKKKK** Hi yeah I'm a big fan can I get a photo please?"""	39bfc799c2e1132e0c27005f00d1226b824841e3	True	False					0	1648795625		0	{}	i2ycijb	False	t3_ttiuv6	False	True	t1_i2yb6ji	/r/ethereum/comments/ttiuv6/a_post_from_8_years_ago_of_me_congratulating/i2ycijb/	1648795642	1	False	True	False	ethereum	t5_2zf9m	r/ethereum	public		0	[]		 vitaaaaaaaaaaaaliiiiiiiiiiikkkkkkkkk hi yeah i m a big fan can i get a photo please 	0.616524875164032	0.14067012071609497	0.058270420879125595	0.018991632387042046	0.4537252187728882	0.5975170731544495	0.7244792580604553	0.832216203212738	0.3044385313987732	0.010144450701773167
17	[]	False		viper2097			[]				text	t2_ejhl9	False	False	Hey bro :)	183665610e4c06d15d401eb5767b4d60f67fa9ca	True	False					0	1648795341		0	{}	i2yc57x	True	t3_ttiuv6	False	True	t1_i2yc03v	/r/ethereum/comments/ttiuv6/a_post_from_8_years_ago_of_me_congratulating/i2yc57x/	1648795355	1	False	True	False	ethereum	t5_2zf9m	r/ethereum	public		0	[]		hey bro 	0.48115819692611694	0.3407459557056427	0.49354827404022217	0.4362258017063141	0.49075639247894287	0.696800172328949	0.6048341989517212	0.5028586387634277	0.42335042357444763	0.4941953420639038
18	[]	False		zombiepoon			[]				text	t2_3xzgurut	False	False	Hi legends	e8dad131d77593f526b09d1a0081f7eab8a47f06	True	False					0	1648795233		0	{}	i2yc03v	False	t3_ttiuv6	False	True	t3_ttiuv6	/r/ethereum/comments/ttiuv6/a_post_from_8_years_ago_of_me_congratulating/i2yc03v/	1648795247	1	False	True	False	ethereum	t5_2zf9m	r/ethereum	public		0	[]		hi legends	0.502015233039856	0.4061932861804962	0.40028247237205505	0.43499043583869934	0.4976998269557953	0.7257062792778015	0.5766674280166626	0.488497257232666	0.49067792296409607	0.6098646521568298
19	[]	False		clausen_eth			[]				text	t2_b5bv9zeq	False	True	There is a lot of demand for leverage, and not very much money in the system. So yields are high until money moves in, and then it goes down.	5e7e79ffc0452a64dcde0866e1c1d0e4bde28bf0	True	False					0	1648795188		0	{}	i2yby10	False	t3_ttk54q	False	True	t3_ttk54q	/r/ethereum/comments/ttk54q/where_defi_yields_come_from_how_are_they_so_high/i2yby10/	1648795200	1	False	True	False	ethereum	t5_2zf9m	r/ethereum	public		0	[]		there is a lot of demand for leverage and not very much money in the system so yields are high until money moves in and then it goes down 	0.372978150844574	0.9780091047286987	0.330818235874176	0.07805097103118896	0.4861408770084381	0.4941500425338745	0.06431455910205841	0.20134995877742767	0.3349907100200653	0.008403925225138664
20	[]	False		MetricSystemYOLO			[]				text	t2_9miyu5x9	False	False	"&gt;It's about 1000€ not a tons of cash... It's over regulation for no reason.

Yeah ok that's true.

What I had in mind when I was talking ""pro (some) KYC and stuff"" is that in SOME cases you can really give criminals a hard time. I'm talking of real criminals. I know governments are constantly just saying ""this is to fight terrorism"" just as an excuse - but in SOME cases I really love when we can confiscate money from real criminals. A zero-KYC world wouldn't allow that."	b17115795691366c986850fe0a6b8a88d962393e	True	False					0	1648794959		0	{}	i2ybn0b	False	t3_tt56qm	False	True	t1_i2wtaql	/r/ethereum/comments/tt56qm/eu_parliament_votes_to_impose_kyc_on_private/i2ybn0b/	1648794976	1	False	True	False	ethereum	t5_2zf9m	r/ethereum	public		0	[]		 gt it s about 1000 not a tons of cash it s over regulation for no reason yeah ok that s true what i had in mind when i was talking pro some kyc and stuff is that in some cases you can really give criminals a hard time i m talking of real criminals i know governments are constantly just saying this is to fight terrorism just as an excuse but in some cases i really love when we can confiscate money from real criminals a zero kyc world wouldn t allow that 	0.0025997469201684	0.9881276488304138	0.9021949768066406	0.01626821793615818	0.008397533558309078	0.400749534368515	0.08714213967323303	8.297852218674961e-07	0.3463025391101837	0.00349686061963439
21	[]	False		viper2097			[]				text	t2_ejhl9	False	False	"I'm in the same boat with the staking, I can't wait for that passive income!  


Remember way back in the day when they were originally saying that you'd need 1000 ETH to create a validator? Glad they changed it to 32!"	3801e4eb58eece6b5c61c7ba623517e631111b49	True	False					0	1648794839		0	{}	i2ybh21	True	t3_ttiuv6	False	False	t1_i2yb6ji	/r/ethereum/comments/ttiuv6/a_post_from_8_years_ago_of_me_congratulating/i2ybh21/	1648794856	1	False	True	False	ethereum	t5_2zf9m	r/ethereum	public		0	[]		i m in the same boat with the staking i can t wait for that passive income remember way back in the day when they were originally saying that you d need 1000 eth to create a validator glad they changed it to 32 	0.0012915405677631497	0.9953269958496094	0.12588371336460114	0.009261846542358398	0.9844617247581482	0.05808263272047043	0.08409927040338516	8.486573506161221e-07	0.277545690536499	0.0001150467578554526
22	[]	False		cryptOwOcurrency			[]				text	t2_607gxykt	False	True	Solana = Dubai	ee6a9a8916658bb5b811d6dca698ff875f343f04	True	False					0	1648794694		0	{}	i2yba0e	False	t3_ttbtr5	False	True	t1_i2x64p4	/r/ethereum/comments/ttbtr5/grayscale_ethereum_is_like_new_york_city_vast/i2yba0e/	1648794713	1	False	True	False	ethereum	t5_2zf9m	r/ethereum	public		0	[]		solana dubai	0.46816539764404297	0.521430253982544	0.5112107396125793	0.47290199995040894	0.4600019156932831	0.45675337314605713	0.4566427171230316	0.4777263402938843	0.5123918652534485	0.5127975940704346
23	[]	False		clausen_eth			[]				text	t2_b5bv9zeq	False	True	Good idea. You mind doing that. I think sometimes people think it's spam when it's from the dev team? :)	d42c55516f11ac03cdc0c1391bb4d871e869c5b8	True	False					0	1648794626		0	{}	i2yb6m6	True	t3_ttfob6	False	True	t1_i2y9yim	/r/ethereum/comments/ttfob6/introducing_obfc_wire_money_over_ethereum/i2yb6m6/	1648794643	1	False	True	False	ethereum	t5_2zf9m	r/ethereum	public		0	[]		good idea you mind doing that i think sometimes people think it s spam when it s from the dev team 	0.3039933741092682	0.5964321494102478	0.24946287274360657	0.015819920226931572	0.5814653038978577	0.6811060309410095	0.15102599561214447	0.5439919233322144	0.33979079127311707	0.0014849500730633736
24	[]	False		nootnewb			[]				text	t2_ghc23	False	False	"Biggest mistake was giving away 20% of my stack on garbage ICOs like Firstblood, Tenx, DAOcasino, SingularDTV etc. Those guys have hundreds of thousands of ETH and never delivered anything. Surprised they are not all in jail. Anyhow, no regrets, I learned a lot along the way, that's for sure. 

Yup, come merge I'll put a percentage towards staking for sure. But I need to learn how to do it myself, ain't trusting anybody with my precious, lol. 

Random fun fact: I once met Vitalik randomly at an airport and was so surprised I yelled his name out and gave him a big scare (from like 5ft away). He literally jumped back and crossed his arms in defense, lol.  I asked for his pic, he was hesitant and about to decline but I told him it would mean a lot to me and he agreed. He must get that a lot and it must be pretty annoying by now."	8a4d8ce8397d0efb23e697e1da5b70da4f166c3e	True	False					0	1648794624		0	{}	i2yb6ji	False	t3_ttiuv6	False	True	t1_i2y9rf4	/r/ethereum/comments/ttiuv6/a_post_from_8_years_ago_of_me_congratulating/i2yb6ji/	1648794639	1	False	True	False	ethereum	t5_2zf9m	r/ethereum	public		0	[]		biggest mistake was giving away 20 of my stack on garbage icos like firstblood tenx daocasino singulardtv etc those guys have hundreds of thousands of eth and never delivered anything surprised they are not all in jail anyhow no regrets i learned a lot along the way that s for sure yup come merge i ll put a percentage towards staking for sure but i need to learn how to do it myself ain t trusting anybody with my precious lol random fun fact i once met vitalik randomly at an airport and was so surprised i yelled his name out and gave him a big scare from like 5ft away he literally jumped back and crossed his arms in defense lol i asked for his pic he was hesitant and about to decline but i told him it would mean a lot to me and he agreed he must get that a lot and it must be pretty annoying by now 	0.002712813438847661	0.9878525733947754	0.8921475410461426	0.03776521608233452	0.008606396615505219	0.9969448447227478	0.06087741628289223	8.466097369819181e-07	0.13802029192447662	0.15514470636844635
25	[]	False		aaaanoon			[]				text	t2_eei0vhe0	False	False	None of those attributes are positives.	83ba5f83ba3647f028ec2cf6f7c910d923c1224a	True	False					0	1648794615		0	{}	i2yb63x	False	t3_ttbtr5	False	True	t3_ttbtr5	/r/ethereum/comments/ttbtr5/grayscale_ethereum_is_like_new_york_city_vast/i2yb63x/	1648794631	1	False	True	False	ethereum	t5_2zf9m	r/ethereum	public		0	[]		none of those attributes are positives 	0.4638713002204895	0.5022647976875305	0.4857059419155121	0.44527557492256165	0.5643829703330994	0.43764355778694153	0.5358353853225708	0.42036503553390503	0.559317409992218	0.039875369518995285
26	[]	False		fluffmunstern			[]				text	t2_700vehc5	False	False	Which low security villages populate your metaphor?	7380c8736bffc4785df2f16abd55a75515dc2383	True	False					0	1648794501		0	{}	i2yb0fu	False	t3_ttbtr5	False	False	t1_i2x98xp	/r/ethereum/comments/ttbtr5/grayscale_ethereum_is_like_new_york_city_vast/i2yb0fu/	1648794519	1	False	True	False	ethereum	t5_2zf9m	r/ethereum	public		0	[]		which low security villages populate your metaphor 	0.3464059829711914	0.6343850493431091	0.5849998593330383	0.4773575961589813	0.4878065288066864	0.41344594955444336	0.32424986362457275	0.4630572497844696	0.5094510316848755	0.011355020105838776
27	[]	False		noweezernoworld			[]				text	t2_3m4py	False	False	Lol	a79fd0872d2d79c1e87cdb6157f4ee6abf479479	True	False					0	1648794157		0	{}	i2yajnk	False	t3_2fbxwf	False	True	t1_ck81t1t	/r/ethereum/comments/2fbxwf/this_is_why_you_just_made_an_awesome_investment/i2yajnk/	1648794170	1	False	True	False	ethereum	t5_2zf9m	r/ethereum	public		0	[]		lol	0.47317075729370117	0.43597516417503357	0.5476417541503906	0.4700857996940613	0.4872163236141205	0.6691137552261353	0.49147942662239075	0.4918611943721771	0.46693652868270874	0.5699469447135925
28	[]	False		GarugasRevenge			[]				text	t2_ipaay	False	False	Thanks! I'll look into it when I need it.	80d2bdd6694ebe937f80c351d5de1c0c3ffa6b82	True	False					0	1648794085		0	{}	i2yag3s	False	t3_tt56qm	False	True	t1_i2yaeg3	/r/ethereum/comments/tt56qm/eu_parliament_votes_to_impose_kyc_on_private/i2yag3s/	1648794104	1	False	True	False	ethereum	t5_2zf9m	r/ethereum	public		0	[]		thanks i ll look into it when i need it 	0.6170854568481445	0.34892964363098145	0.05848552659153938	0.1701246201992035	0.5058620572090149	0.5979502201080322	0.7389846444129944	0.7666980028152466	0.35729503631591797	0.2875877022743225
29	[]	False		FaceDeer			[]				text	t2_4ljvm	False	False	That defi method would be Tornado. :) Tornado basically does the same sort of cryptographic trickery as Monero, without having to leave the Ethereum blockchain.	dc3f9cb45896ffef923cf86a7c436aa0a135c8d2	True	False					0	1648794051		0	{}	i2yaeg3	False	t3_tt56qm	False	True	t1_i2ya4ez	/r/ethereum/comments/tt56qm/eu_parliament_votes_to_impose_kyc_on_private/i2yaeg3/	1648794069	1	False	True	False	ethereum	t5_2zf9m	r/ethereum	public		0	[]		that defi method would be tornado tornado basically does the same sort of cryptographic trickery as monero without having to leave the ethereum blockchain 	0.02620415948331356	0.9862605929374695	0.5244875550270081	0.008289657533168793	0.2731582224369049	0.02150602824985981	0.15031924843788147	8.430968136963202e-07	0.4277295470237732	5.8868437918135896e-05
