Unnamed: 0	all_awardings	allow_live_comments	author	author_flair_css_class	author_flair_richtext	author_flair_text	author_flair_type	author_fullname	author_is_blocked	author_patreon_flair	author_premium	awarders	can_mod_post	contest_mode	created_utc	domain	full_link	gildings	id	is_created_from_ads_ui	is_crosspostable	is_meta	is_original_content	is_reddit_media_domain	is_robot_indexable	is_self	is_video	link_flair_background_color	link_flair_richtext	link_flair_text_color	link_flair_type	locked	media_only	no_follow	num_comments	num_crossposts	over_18	parent_whitelist_status	permalink	pinned	pwls	retrieved_on	score	selftext	send_replies	spoiler	stickied	subreddit	subreddit_id	subreddit_subscribers	subreddit_type	thumbnail	title	total_awards_received	treatment_tags	upvote_ratio	url	whitelist_status	wls	author_flair_template_id	author_flair_text_color	post_hint	preview	thumbnail_height	thumbnail_width	url_overridden_by_dest	author_flair_background_color	link_flair_text	removed_by_category	media	media_embed	secure_media	secure_media_embed	media_metadata	link_flair_template_id	crosspost_parent	crosspost_parent_list	gallery_data	is_gallery	poll_data	concated	corpus	support	knowledge	conflict	power	similarity	fun	status	trust	identity	romance
0	[]	False	Esperadoce		[]		text	t2_h4itsb	False	False	False	[]	False	False	1642780675	self.Bitcoin	https://www.reddit.com/r/Bitcoin/comments/s9dx9o/putting_25_of_my_saving_in_this_extreme_fear/	{}	s9dx9o	False	True	False	False	False	True	True	False		[]	dark	text	False	False	True	0	0	False	all_ads	/r/Bitcoin/comments/s9dx9o/putting_25_of_my_saving_in_this_extreme_fear/	False	6	1642780686	1	I was waiting for crypto to get to this prices for month now and I had this insane idea to put my money in then next crash I do believe it's a good decision but people around me keep saying that this decision isn't rationnal what do you think ?	True	False	False	Bitcoin	t5_2s3qj	3814025	public	self	Putting 25% of my saving in this extreme fear moment is stupid or not ?	0	[]	1.0	https://www.reddit.com/r/Bitcoin/comments/s9dx9o/putting_25_of_my_saving_in_this_extreme_fear/	all_ads	6																						"Putting 25% of my saving in this extreme fear moment is stupid or not ?
I was waiting for crypto to get to this prices for month now and I had this insane idea to put my money in then next crash I do believe it's a good decision but people around me keep saying that this decision isn't rationnal what do you think ?"	putting 25 of my saving in this extreme fear moment is stupid or not i was waiting for crypto to get to this prices for month now and i had this insane idea to put my money in then next crash i do believe it s a good decision but people around me keep saying that this decision isn t rationnal what do you think 	0.0027213282883167267	0.9884493947029114	0.9415485262870789	0.01764776185154915	0.007917801849544048	0.6111887097358704	0.06527403742074966	8.357734486708068e-07	0.1907174289226532	0.009075233712792397
1	[]	False	Driogenes	noob	[{'e': 'text', 't': 'redditor for 6 days'}]	redditor for 6 days	richtext	t2_fyul3ovd	False	False	False	[]	False	False	1642779959	i.redd.it	https://www.reddit.com/r/Bitcoin/comments/s9dnwp/this_new_correlation_is_bugging_me_out/	{}	s9dnwp	False	True	False	False	True	True	False	False		[]	dark	text	False	False	True	0	0	False	all_ads	/r/Bitcoin/comments/s9dnwp/this_new_correlation_is_bugging_me_out/	False	6	1642779969	1		True	False	False	Bitcoin	t5_2s3qj	3813996	public	https://b.thumbs.redditmedia.com/1w_apicqjptZIIH1H4Q-uDHTGpcqlvKJh-RAwtlxkCA.jpg	This new correlation is bugging me out	0	[]	1.0	https://i.redd.it/rhqnt3kja2d81.png	all_ads	6	2ec8e69e-6c36-11e9-a04b-0afb553d4ea6	dark	image	{'enabled': True, 'images': [{'id': 'IKNk5vhIMha8-wDJ_IrkJeC5rYj9A1zDBioS5BHvIKM', 'resolutions': [{'height': 76, 'url': 'https://preview.redd.it/rhqnt3kja2d81.png?width=108&amp;crop=smart&amp;auto=webp&amp;s=bf2afdd9b3dc4d7c0efa83f2791d2d4523c0cf02', 'width': 108}, {'height': 152, 'url': 'https://preview.redd.it/rhqnt3kja2d81.png?width=216&amp;crop=smart&amp;auto=webp&amp;s=ba4dc2800a749d8ac75cdb10957dac9c9b8d4414', 'width': 216}, {'height': 225, 'url': 'https://preview.redd.it/rhqnt3kja2d81.png?width=320&amp;crop=smart&amp;auto=webp&amp;s=5fc9362f95a6c22dcf6d881a9d8ee5c037b4acd4', 'width': 320}, {'height': 451, 'url': 'https://preview.redd.it/rhqnt3kja2d81.png?width=640&amp;crop=smart&amp;auto=webp&amp;s=e75f92eab4e5b2544a394d2158ec1321bf9f733d', 'width': 640}, {'height': 676, 'url': 'https://preview.redd.it/rhqnt3kja2d81.png?width=960&amp;crop=smart&amp;auto=webp&amp;s=e93cc53926a8f94520c4bb0a862647d7de04d4e4', 'width': 960}, {'height': 761, 'url': 'https://preview.redd.it/rhqnt3kja2d81.png?width=1080&amp;crop=smart&amp;auto=webp&amp;s=1f30ca23724da723d72f08131f5c524492549847', 'width': 1080}], 'source': {'height': 997, 'url': 'https://preview.redd.it/rhqnt3kja2d81.png?auto=webp&amp;s=6c7c9f601a42103d79add3d934b354b464384caf', 'width': 1414}, 'variants': {}}]}	98.0	140.0	https://i.redd.it/rhqnt3kja2d81.png															"This new correlation is bugging me out
"	this new correlation is bugging me out nan	0.278168648481369	0.441935658454895	0.5814998149871826	0.3891119956970215	0.5367789268493652	0.8010480403900146	0.41624709963798523	0.5914466977119446	0.4198174774646759	0.09879054874181747
2	[]	False	VisualOrdinary_		[]		text	t2_dl6e7cz5	False	False	False	[]	False	False	1642779957	self.Bitcoin	https://www.reddit.com/r/Bitcoin/comments/s9dnw4/anybody_else_go_from_200_gains_to_breakeven_never/	{}	s9dnw4	False	True	False	False	False	True	True	False		[]	dark	text	False	False	True	0	0	False	all_ads	/r/Bitcoin/comments/s9dnw4/anybody_else_go_from_200_gains_to_breakeven_never/	False	6	1642779968	1	Almost just as shitty as losing money I’d say.	True	False	False	Bitcoin	t5_2s3qj	3813996	public	self	Anybody else go from +200% gains to break-even, never selling? Pain.	0	[]	1.0	https://www.reddit.com/r/Bitcoin/comments/s9dnw4/anybody_else_go_from_200_gains_to_breakeven_never/	all_ads	6		dark																				"Anybody else go from +200% gains to break-even, never selling? Pain.
Almost just as shitty as losing money I’d say."	anybody else go from 200 gains to break even never selling pain almost just as shitty as losing money i d say 	0.22395190596580505	0.6549973487854004	0.7823526263237	0.02339002676308155	0.2836117148399353	0.48519396781921387	0.08500167727470398	8.651999792164133e-07	0.271512895822525	0.004807258490473032
3	[]	False	At0m11c		[]		text	t2_2cfprxt	False	False	True	[]	False	False	1642779694	self.Bitcoin	https://www.reddit.com/r/Bitcoin/comments/s9dkj0/will_bitcoin_be_able_to_coexist_with_a_digital/	{}	s9dkj0	False	True	False	False	False	True	True	False		[]	dark	text	False	False	True	0	0	False	all_ads	/r/Bitcoin/comments/s9dkj0/will_bitcoin_be_able_to_coexist_with_a_digital/	False	6	1642779705	1	"Will Bitcoin be able to coexist with a digital dollar?

FED is getting closer and closer to issuing the digital dollar(cbdc).

What is your opinion on it. Will it crash Bitcoin or make it hard to own the day we get the digital dollar?"	True	False	False	Bitcoin	t5_2s3qj	3813987	public	self	Will Bitcoin be able to coexist with a digital dollar?	0	[]	1.0	https://www.reddit.com/r/Bitcoin/comments/s9dkj0/will_bitcoin_be_able_to_coexist_with_a_digital/	all_ads	6																						"Will Bitcoin be able to coexist with a digital dollar?
Will Bitcoin be able to coexist with a digital dollar?

FED is getting closer and closer to issuing the digital dollar(cbdc).

What is your opinion on it. Will it crash Bitcoin or make it hard to own the day we get the digital dollar?"	will bitcoin be able to coexist with a digital dollar will bitcoin be able to coexist with a digital dollar fed is getting closer and closer to issuing the digital dollar cbdc what is your opinion on it will it crash bitcoin or make it hard to own the day we get the digital dollar 	0.005025203805416822	0.9894123673439026	0.5631301403045654	0.03255928307771683	0.008244156837463379	0.3284308910369873	0.0749073177576065	8.517652645423368e-07	0.2089332938194275	0.01990760676562786
4	[]	False	bobsilver247		[]		text	t2_im02jv92	False	False	False	[]	False	False	1642779637	self.Bitcoin	https://www.reddit.com/r/Bitcoin/comments/s9djpk/all_day_i_been_buying_bitcoin_and_not_done_too/	{}	s9djpk	False	False	False	False	False	False	True	False		[{'e': 'text', 't': 'comment as submission'}]	dark	richtext	False	False	True	0	0	False	all_ads	/r/Bitcoin/comments/s9djpk/all_day_i_been_buying_bitcoin_and_not_done_too/	False	6	1642779648	1	[removed]	True	False	False	Bitcoin	t5_2s3qj	3813982	public	self	All day I been buying bitcoin and not done too bad I got all the way -10.75%	0	[]	1.0	https://www.reddit.com/r/Bitcoin/comments/s9djpk/all_day_i_been_buying_bitcoin_and_not_done_too/	all_ads	6									comment as submission	moderator												"All day I been buying bitcoin and not done too bad I got all the way -10.75%
[removed]"	all day i been buying bitcoin and not done too bad i got all the way 10 75 removed 	0.3392973840236664	0.3790103793144226	0.5519359111785889	0.010598452761769295	0.3963582515716553	0.3886340260505676	0.3118390142917633	0.6988487243652344	0.3143354058265686	0.002673882059752941
5	[]	False	Scallion_Pretty		[]		text	t2_78l66btr	False	False	False	[]	False	False	1642779543	self.Bitcoin	https://www.reddit.com/r/Bitcoin/comments/s9dicv/bitcoininorg_legit_or_scam/	{}	s9dicv	False	True	False	False	False	True	True	False		[]	dark	text	False	False	True	0	0	False	all_ads	/r/Bitcoin/comments/s9dicv/bitcoininorg_legit_or_scam/	False	6	1642779553	1	Has any purchased BTC from bitcoinin.org? I was thinking of buying from the platform. Any input is much appreciated! Thanks!	True	False	False	Bitcoin	t5_2s3qj	3813974	public	self	Bitcoinin.org Legit or Scam?	0	[]	1.0	https://www.reddit.com/r/Bitcoin/comments/s9dicv/bitcoininorg_legit_or_scam/	all_ads	6																						"Bitcoinin.org Legit or Scam?
Has any purchased BTC from bitcoinin.org? I was thinking of buying from the platform. Any input is much appreciated! Thanks!"	bitcoinin org legit or scam has any purchased btc from bitcoinin org i was thinking of buying from the platform any input is much appreciated thanks 	0.022086959332227707	0.9715014696121216	0.2954026758670807	0.03575554117560387	0.021267153322696686	0.4682353138923645	0.26854056119918823	0.5092267990112305	0.33929118514060974	0.025187572464346886
6	[]	False	ramadz		[]		text	t2_ovsh2	False	False	False	[]	False	False	1642778752	twitter.com	https://www.reddit.com/r/Bitcoin/comments/s9d7nq/btc_4_year_price_history_as_of_31st_december_will/	{}	s9d7nq	False	True	False	False	False	True	False	False		[]	dark	text	False	False	True	0	0	False	all_ads	/r/Bitcoin/comments/s9d7nq/btc_4_year_price_history_as_of_31st_december_will/	False	6	1642778762	1		True	False	False	Bitcoin	t5_2s3qj	3813925	public	https://b.thumbs.redditmedia.com/NZ8L56j8NmcHrhAhwPFqoccWHl3iJV6DYcOx4WKX1vM.jpg	BTC 4 year price history as of 31st December. Will history repeat for 2022?	0	[]	1.0	https://twitter.com/btchistorical/status/1476870971797684235?cxt=HHwWloCy0d6U8_4oAAAA	all_ads	6			link	{'enabled': False, 'images': [{'id': 'p9D7Au9I7jnmN1X1eYVWSaCLVVq3iXPjIsqO8ELcEis', 'resolutions': [{'height': 108, 'url': 'https://external-preview.redd.it/vC6Z2sIWxiQAIZbUdTvh0i3bjMW0B447SQImZ2_uAJA.jpg?width=108&amp;crop=smart&amp;auto=webp&amp;s=05c7eb0887821ba32152c1096dce2b0839ee0fc8', 'width': 108}], 'source': {'height': 140, 'url': 'https://external-preview.redd.it/vC6Z2sIWxiQAIZbUdTvh0i3bjMW0B447SQImZ2_uAJA.jpg?auto=webp&amp;s=d4f75cfa25dd3b46635a682a64d04098c42b0857', 'width': 140}, 'variants': {}}]}	140.0	140.0	https://twitter.com/btchistorical/status/1476870971797684235?cxt=HHwWloCy0d6U8_4oAAAA				"{'oembed': {'author_name': ""Bitcoin's Price History"", 'author_url': 'https://twitter.com/btchistorical', 'cache_age': 3153600000, 'height': None, 'html': '&lt;blockquote class=""twitter-video""&gt;&lt;p lang=""en"" dir=""ltr""&gt;Historical &lt;a href=""https://twitter.com/hashtag/Bitcoin?src=hash&amp;amp;ref_src=twsrc%5Etfw""&gt;#Bitcoin&lt;/a&gt; prices for today, December 31st:&lt;br&gt;&lt;br&gt;2021 - $48,023&lt;br&gt;2020 - $28,956&lt;br&gt;2019 - $7,182&lt;br&gt;2018 - $3,741&lt;br&gt;2017 - $13,860&lt;br&gt;2016 - $968&lt;br&gt;2015 - $430&lt;br&gt;2014 - $320&lt;br&gt;2013 - $757&lt;br&gt;2012 - $14&lt;br&gt;2011 - $5&lt;br&gt;&lt;br&gt;What will December 31st, 2022 look like? 🤔&lt;/p&gt;&amp;mdash; Bitcoin&amp;#39;s Price History (@btchistorical) &lt;a href=""https://twitter.com/btchistorical/status/1476870971797684235?ref_src=twsrc%5Etfw""&gt;December 31, 2021&lt;/a&gt;&lt;/blockquote&gt;\n&lt;script async src=""https://platform.twitter.com/widgets.js"" charset=""utf-8""&gt;&lt;/script&gt;\n', 'provider_name': 'Twitter', 'provider_url': 'https://twitter.com', 'type': 'rich', 'url': 'https://twitter.com/btchistorical/status/1476870971797684235', 'version': '1.0', 'width': 350}, 'type': 'twitter.com'}"	"{'content': '&lt;blockquote class=""twitter-video""&gt;&lt;p lang=""en"" dir=""ltr""&gt;Historical &lt;a href=""https://twitter.com/hashtag/Bitcoin?src=hash&amp;amp;ref_src=twsrc%5Etfw""&gt;#Bitcoin&lt;/a&gt; prices for today, December 31st:&lt;br&gt;&lt;br&gt;2021 - $48,023&lt;br&gt;2020 - $28,956&lt;br&gt;2019 - $7,182&lt;br&gt;2018 - $3,741&lt;br&gt;2017 - $13,860&lt;br&gt;2016 - $968&lt;br&gt;2015 - $430&lt;br&gt;2014 - $320&lt;br&gt;2013 - $757&lt;br&gt;2012 - $14&lt;br&gt;2011 - $5&lt;br&gt;&lt;br&gt;What will December 31st, 2022 look like? 🤔&lt;/p&gt;&amp;mdash; Bitcoin&amp;#39;s Price History (@btchistorical) &lt;a href=""https://twitter.com/btchistorical/status/1476870971797684235?ref_src=twsrc%5Etfw""&gt;December 31, 2021&lt;/a&gt;&lt;/blockquote&gt;\n&lt;script async src=""https://platform.twitter.com/widgets.js"" charset=""utf-8""&gt;&lt;/script&gt;\n', 'height': 200, 'scrolling': False, 'width': 350}"	"{'oembed': {'author_name': ""Bitcoin's Price History"", 'author_url': 'https://twitter.com/btchistorical', 'cache_age': 3153600000, 'height': None, 'html': '&lt;blockquote class=""twitter-video""&gt;&lt;p lang=""en"" dir=""ltr""&gt;Historical &lt;a href=""https://twitter.com/hashtag/Bitcoin?src=hash&amp;amp;ref_src=twsrc%5Etfw""&gt;#Bitcoin&lt;/a&gt; prices for today, December 31st:&lt;br&gt;&lt;br&gt;2021 - $48,023&lt;br&gt;2020 - $28,956&lt;br&gt;2019 - $7,182&lt;br&gt;2018 - $3,741&lt;br&gt;2017 - $13,860&lt;br&gt;2016 - $968&lt;br&gt;2015 - $430&lt;br&gt;2014 - $320&lt;br&gt;2013 - $757&lt;br&gt;2012 - $14&lt;br&gt;2011 - $5&lt;br&gt;&lt;br&gt;What will December 31st, 2022 look like? 🤔&lt;/p&gt;&amp;mdash; Bitcoin&amp;#39;s Price History (@btchistorical) &lt;a href=""https://twitter.com/btchistorical/status/1476870971797684235?ref_src=twsrc%5Etfw""&gt;December 31, 2021&lt;/a&gt;&lt;/blockquote&gt;\n&lt;script async src=""https://platform.twitter.com/widgets.js"" charset=""utf-8""&gt;&lt;/script&gt;\n', 'provider_name': 'Twitter', 'provider_url': 'https://twitter.com', 'type': 'rich', 'url': 'https://twitter.com/btchistorical/status/1476870971797684235', 'version': '1.0', 'width': 350}, 'type': 'twitter.com'}"	"{'content': '&lt;blockquote class=""twitter-video""&gt;&lt;p lang=""en"" dir=""ltr""&gt;Historical &lt;a href=""https://twitter.com/hashtag/Bitcoin?src=hash&amp;amp;ref_src=twsrc%5Etfw""&gt;#Bitcoin&lt;/a&gt; prices for today, December 31st:&lt;br&gt;&lt;br&gt;2021 - $48,023&lt;br&gt;2020 - $28,956&lt;br&gt;2019 - $7,182&lt;br&gt;2018 - $3,741&lt;br&gt;2017 - $13,860&lt;br&gt;2016 - $968&lt;br&gt;2015 - $430&lt;br&gt;2014 - $320&lt;br&gt;2013 - $757&lt;br&gt;2012 - $14&lt;br&gt;2011 - $5&lt;br&gt;&lt;br&gt;What will December 31st, 2022 look like? 🤔&lt;/p&gt;&amp;mdash; Bitcoin&amp;#39;s Price History (@btchistorical) &lt;a href=""https://twitter.com/btchistorical/status/1476870971797684235?ref_src=twsrc%5Etfw""&gt;December 31, 2021&lt;/a&gt;&lt;/blockquote&gt;\n&lt;script async src=""https://platform.twitter.com/widgets.js"" charset=""utf-8""&gt;&lt;/script&gt;\n', 'height': 200, 'media_domain_url': 'https://www.redditmedia.com/mediaembed/s9d7nq', 'scrolling': False, 'width': 350}"								"BTC 4 year price history as of 31st December. Will history repeat for 2022?
"	btc 4 year price history as of 31st december will history repeat for 2022 nan	0.20123428106307983	0.8700032830238342	0.21007627248764038	0.414143443107605	0.2109532654285431	0.32952210307121277	0.35088396072387695	0.5871301293373108	0.40802621841430664	0.003448131727054715
7	[]	False	bradbrown912		[]		text	t2_2pctkxv1	False	False	False	[]	False	False	1642778491	self.Bitcoin	https://www.reddit.com/r/Bitcoin/comments/s9d437/best_btc_lightning_full_node_software_package/	{}	s9d437	False	True	False	False	False	True	True	False		[]	dark	text	False	False	False	0	0	False	all_ads	/r/Bitcoin/comments/s9d437/best_btc_lightning_full_node_software_package/	False	6	1642778501	1	"Looking into software to run a full node. Umbrel looks like the easiest to set up and use. However I’m a bit wary of them going away from being just a Bitcoin company and getting into different apps and being a personal server company. Just seems like more attack surfaces. Should I be concerned about this?
Raspiblitz seems like a good one but it doesn’t seem as easy to set up and im not sure if I want to have the lcd screen on my node because I want it to look discreet and not scream that I’m a bitcoiner. 
What software do you use and recommend?"	True	False	False	Bitcoin	t5_2s3qj	3813912	public	self	Best BTC + lightning full node software package??? Umbrel, raspiblitz, other??	0	[]	1.0	https://www.reddit.com/r/Bitcoin/comments/s9d437/best_btc_lightning_full_node_software_package/	all_ads	6																						"Best BTC + lightning full node software package??? Umbrel, raspiblitz, other??
Looking into software to run a full node. Umbrel looks like the easiest to set up and use. However I’m a bit wary of them going away from being just a Bitcoin company and getting into different apps and being a personal server company. Just seems like more attack surfaces. Should I be concerned about this?
Raspiblitz seems like a good one but it doesn’t seem as easy to set up and im not sure if I want to have the lcd screen on my node because I want it to look discreet and not scream that I’m a bitcoiner. 
What software do you use and recommend?"	best btc lightning full node software package umbrel raspiblitz other looking into software to run a full node umbrel looks like the easiest to set up and use however i m a bit wary of them going away from being just a bitcoin company and getting into different apps and being a personal server company just seems like more attack surfaces should i be concerned about this raspiblitz seems like a good one but it doesn t seem as easy to set up and im not sure if i want to have the lcd screen on my node because i want it to look discreet and not scream that i m a bitcoiner what software do you use and recommend 	0.0024929377250373363	0.9896612167358398	0.3455246686935425	0.024321338161826134	0.007264827378094196	0.2313271164894104	0.07036903500556946	8.401439117733389e-07	0.2770049571990967	0.008632156066596508
8	[]	False	phileo		[]		text	t2_3af9q	False	False	False	[]	False	False	1642778433	self.Bitcoin	https://www.reddit.com/r/Bitcoin/comments/s9d38l/shouldnt_the_bags_of_the_sellers_be_empty_by_now/	{}	s9d38l	False	True	False	False	False	True	True	False		[]	dark	text	False	False	True	0	0	False	all_ads	/r/Bitcoin/comments/s9d38l/shouldnt_the_bags_of_the_sellers_be_empty_by_now/	False	6	1642778443	1	I really wonder where all those coins come from that keep getting sold. Most weak hand retailers have long exited the market and only the strong hands remain. I get that the market is made by whales/institutions and traders with their algorithms. But shouldn't their bags be getting empty?	True	False	False	Bitcoin	t5_2s3qj	3813910	public	self	Shouldn't the bags of the sellers be empty by now?	0	[]	1.0	https://www.reddit.com/r/Bitcoin/comments/s9d38l/shouldnt_the_bags_of_the_sellers_be_empty_by_now/	all_ads	6																						"Shouldn't the bags of the sellers be empty by now?
I really wonder where all those coins come from that keep getting sold. Most weak hand retailers have long exited the market and only the strong hands remain. I get that the market is made by whales/institutions and traders with their algorithms. But shouldn't their bags be getting empty?"	shouldn t the bags of the sellers be empty by now i really wonder where all those coins come from that keep getting sold most weak hand retailers have long exited the market and only the strong hands remain i get that the market is made by whales institutions and traders with their algorithms but shouldn t their bags be getting empty 	0.002522537251934409	0.9888945817947388	0.39451852440834045	0.018411334604024887	0.01093385647982359	0.6290513277053833	0.0860731229186058	8.56647375258035e-07	0.3719680905342102	0.0067551592364907265
9	[]	False	sserialz		[]		text	t2_50hwbfbv	False	False	False	[]	False	False	1642778419	self.Bitcoin	https://www.reddit.com/r/Bitcoin/comments/s9d31u/how_much_should_i_put_in_for_first_investment/	{}	s9d31u	False	True	False	False	False	True	True	False		[]	dark	text	False	False	True	0	0	False	all_ads	/r/Bitcoin/comments/s9d31u/how_much_should_i_put_in_for_first_investment/	False	6	1642778430	1	I understand that butcoin is a longterm investment and I have a couple grand saved uo atm, I'm nit sure how much I should buy or even when what with the market, I understand that butcoin will always go up and down buy its very valuable and I'm not afraid of some numbers since I'm in it for the long run, i undmtend on making a safety net out of this and hope I could get some advice from veterans on how much I should put and when a good time is I'm considering abt 1 grand or 500 depending and help us apreciate	True	False	False	Bitcoin	t5_2s3qj	3813910	public	self	How much should I put in for first investment	0	[]	1.0	https://www.reddit.com/r/Bitcoin/comments/s9d31u/how_much_should_i_put_in_for_first_investment/	all_ads	6																						"How much should I put in for first investment
I understand that butcoin is a longterm investment and I have a couple grand saved uo atm, I'm nit sure how much I should buy or even when what with the market, I understand that butcoin will always go up and down buy its very valuable and I'm not afraid of some numbers since I'm in it for the long run, i undmtend on making a safety net out of this and hope I could get some advice from veterans on how much I should put and when a good time is I'm considering abt 1 grand or 500 depending and help us apreciate"	how much should i put in for first investment i understand that butcoin is a longterm investment and i have a couple grand saved uo atm i m nit sure how much i should buy or even when what with the market i understand that butcoin will always go up and down buy its very valuable and i m not afraid of some numbers since i m in it for the long run i undmtend on making a safety net out of this and hope i could get some advice from veterans on how much i should put and when a good time is i m considering abt 1 grand or 500 depending and help us apreciate	0.0030245105735957623	0.9886935353279114	0.02830689400434494	0.021222323179244995	0.00779222184792161	0.3301650881767273	0.10783252865076065	8.443456067652733e-07	0.2050066888332367	0.012315122410655022
10	[]	False	Just-my-2c		[]		text	t2_3xgl5	False	False	False	[]	False	False	1642778306	self.Bitcoin	https://www.reddit.com/r/Bitcoin/comments/s9d1ng/hedgefunds_are_gonna_need_cash_today_they_will/	{}	s9d1ng	False	True	False	False	False	True	True	False		[]	dark	text	False	False	True	0	0	False	all_ads	/r/Bitcoin/comments/s9d1ng/hedgefunds_are_gonna_need_cash_today_they_will/	False	6	1642778317	1	You can buy back later if you want. Get some fiat!	True	False	False	Bitcoin	t5_2s3qj	3813903	public	self	Hedgefunds are gonna need cash today. They will sell their crypto. If you want to beat them to it, you got a few hours left!	0	[]	1.0	https://www.reddit.com/r/Bitcoin/comments/s9d1ng/hedgefunds_are_gonna_need_cash_today_they_will/	all_ads	6																						"Hedgefunds are gonna need cash today. They will sell their crypto. If you want to beat them to it, you got a few hours left!
You can buy back later if you want. Get some fiat!"	hedgefunds are gonna need cash today they will sell their crypto if you want to beat them to it you got a few hours left you can buy back later if you want get some fiat 	0.30565065145492554	0.9714917540550232	0.6807160973548889	0.9546279311180115	0.00870086532086134	0.37663522362709045	0.059531718492507935	8.592221547587542e-07	0.13899855315685272	0.008867808617651463
