Unnamed: 0	all_awardings	archived	associated_award	author	author_flair_background_color	author_flair_css_class	author_flair_richtext	author_flair_template_id	author_flair_text	author_flair_text_color	author_flair_type	author_fullname	author_patreon_flair	author_premium	body	body_sha1	can_gild	collapsed	collapsed_because_crowd_control	collapsed_reason	collapsed_reason_code	comment_type	controversiality	created_utc	distinguished	gilded	gildings	id	is_submitter	link_id	locked	no_follow	parent_id	permalink	retrieved_utc	score	score_hidden	send_replies	stickied	subreddit	subreddit_id	subreddit_name_prefixed	subreddit_type	top_awarded_type	total_awards_received	treatment_tags	unrepliable_reason	corpus	support	knowledge	conflict	power	similarity	fun	status	trust	identity	romance
0	[]	False		dankie44			[]				text	t2_d9v8kneq	False	False	15 percent dude, that's just too much. It's literally a theft dude.	bbf20d0d95e735c387ae61869880bee33062a0a4	True	False					0	1651305511		0	{}	i6rni4a	False	t3_uez0e5	False	True	t1_i6r67td	/r/Bitcoin/comments/uez0e5/repost_from_wsb/i6rni4a/	1651305527	1	True	True	False	Bitcoin	t5_2s3qj	r/Bitcoin	public		0	[]		15 percent dude that s just too much it s literally a theft dude 	0.1621786504983902	0.5533825159072876	0.6482306122779846	0.19075705111026764	0.503609299659729	0.4033462405204773	0.17029839754104614	0.1419827789068222	0.39219585061073303	0.0029806315433233976
1	[]	False		Bitcoin__Hodler		noob	[{'e': 'text', 't': 'redditor for 3 months'}]	2ec8e69e-6c36-11e9-a04b-0afb553d4ea6	redditor for 3 months	dark	richtext	t2_jtjwgqh6	False	False	Sounds like a scam, sounds like Ver.	458dfad06427062baa8dc8eb8b66e9be3df4790c	True	False					0	1651305444		0	{}	i6rnfgt	False	t3_uese45	False	True	t1_i6q3jtr	/r/Bitcoin/comments/uese45/since_throwbacks_seem_to_be_a_thing_segwit_will/i6rnfgt/	1651305455	1	True	True	False	Bitcoin	t5_2s3qj	r/Bitcoin	public		0	[]		sounds like a scam sounds like ver 	0.40400850772857666	0.46448975801467896	0.6234784126281738	0.13210758566856384	0.5853469967842102	0.6432659029960632	0.26260679960250854	0.19830472767353058	0.4708055555820465	0.0829925388097763
2	[]	False		shenbin90			[]				text	t2_h09197yg	False	False	Kraken is something which is better than most of the other shits.	9eece1aeeb24ac5c9f0a04eb0d99311190b3b247	True	False					0	1651305441		0	{}	i6rnfbu	False	t3_ueiuk5	False	True	t1_i6p91b2	/r/Bitcoin/comments/ueiuk5/to_accelerate_financial_inclusion_kraken_has/i6rnfbu/	1651305455	1	True	True	False	Bitcoin	t5_2s3qj	r/Bitcoin	public		0	[]		kraken is something which is better than most of the other shits 	0.1584354043006897	0.6996811032295227	0.5600122213363647	0.06732074171304703	0.5001524686813354	0.5013471841812134	0.13161972165107727	0.24374628067016602	0.531441330909729	0.004413996823132038
3	[]	False		_JohnFloyd			[]				text	t2_3yfvcxz5	False	False	 cybersecurity field is not blockchain	5e9667928793f3eacdc79fa7d8edb7d89926687b	True	False					0	1651305432		0	{}	i6rneyh	False	t3_ueqluz	False	True	t3_ueqluz	/r/Bitcoin/comments/ueqluz/for_anyone_wondering_what_its_like_to_be_a/i6rneyh/	1651305449	1	True	True	False	Bitcoin	t5_2s3qj	r/Bitcoin	public		0	[]		 cybersecurity field is not blockchain	0.31984779238700867	0.6785800457000732	0.5729201436042786	0.6465883255004883	0.4236321449279785	0.18124470114707947	0.42001935839653015	0.4926828145980835	0.5389780402183533	0.008346715942025185
4	[]	False		Bitcoin__Hodler		noob	[{'e': 'text', 't': 'redditor for 3 months'}]	2ec8e69e-6c36-11e9-a04b-0afb553d4ea6	redditor for 3 months	dark	richtext	t2_jtjwgqh6	False	False	Blockchain or DLT Rusty!	c4de8b6a0720fb3fa479b279685b09d26e53b0e1	True	False					0	1651305393		0	{}	i6rndd0	False	t3_ueqluz	False	True	t1_i6qaj75	/r/Bitcoin/comments/ueqluz/for_anyone_wondering_what_its_like_to_be_a/i6rndd0/	1651305409	1	True	True	False	Bitcoin	t5_2s3qj	r/Bitcoin	public		0	[]		blockchain or dlt rusty 	0.4175299406051636	0.5499801635742188	0.505979061126709	0.3911769390106201	0.4132562577724457	0.4162195920944214	0.36484864354133606	0.43569695949554443	0.49918332695961	0.33561354875564575
5	[]	False		Pushyourself2019			[]				text	t2_4c04mxsk	False	False	"Again, ""Looking forward"" is too vague. I prefer to speak in practice. 
To me, the above philosophies are practicing actions that minimize suffering, with a solid foundation of objective reasoning."	08a1c62222f2afda1e3eb657341496e8259f55a8	True	False					0	1651305380		0	{}	i6rnct6	False	t3_ueeeu9	False	True	t1_i6rbekm	/r/Bitcoin/comments/ueeeu9/daily_discussion_april_29_2022/i6rnct6/	1651305396	1	True	True	False	Bitcoin	t5_2s3qj	r/Bitcoin	public		0	[]		again looking forward is too vague i prefer to speak in practice to me the above philosophies are practicing actions that minimize suffering with a solid foundation of objective reasoning 	0.36418652534484863	0.8454956412315369	0.508751392364502	0.04530089348554611	0.3974326550960541	0.17494921386241913	0.2007605880498886	9.315353963756934e-07	0.3988945186138153	0.0124438451603055
6	[]	False		Right_Big_2334			[]				text	t2_bi3t2rwg	False	False	Promotion code	392b6394a12c96e6bf8c3522fd591e9fa1dc58e5	True	False					0	1651305364		0	{}	i6rnc8c	True	t3_uf1clq	False	True	t1_i6qxnml	/r/Bitcoin/comments/uf1clq/ledger_promt_code_please/i6rnc8c/	1651305377	1	True	True	False	Bitcoin	t5_2s3qj	r/Bitcoin	public		0	[]		promotion code	0.45308536291122437	0.530663013458252	0.4390108585357666	0.5354421734809875	0.4689657390117645	0.49073705077171326	0.49759766459465027	0.488076776266098	0.5022827982902527	0.36823999881744385
7	[]	False		Asum_chum			[]				text	t2_qfciqve	False	True	If someone is stupid enough to actually think that everyoneâ€™s money is insured in the traditional banking sector, they probably believe that Putin created inflation.	2ff6c598ff7daafb5f148ab76af7a09eec2d39f3	True	False					0	1651305360		0	{}	i6rnc2p	False	t3_uf05dd	False	True	t1_i6qlle9	/r/Bitcoin/comments/uf05dd/what_do_you_guys_think_about_super_cold_storage/i6rnc2p/	1651305371	1	True	True	False	Bitcoin	t5_2s3qj	r/Bitcoin	public		0	[]		if someone is stupid enough to actually think that everyone s money is insured in the traditional banking sector they probably believe that putin created inflation 	0.06193576753139496	0.8445366024971008	0.7060536742210388	0.026243843138217926	0.39194992184638977	0.3358672857284546	0.10151819884777069	8.468310284115432e-07	0.5067298412322998	0.004102773033082485
8	[]	False		kkehoe1			[]				text	t2_jxw5e	False	False	You didnâ€™t see any graphite	2846dc5bb38af109000200d44d4ce25e701b7fae	True	False					0	1651305283		0	{}	i6rn90u	False	t3_uez0e5	False	True	t3_uez0e5	/r/Bitcoin/comments/uez0e5/repost_from_wsb/i6rn90u/	1651305300	1	True	True	False	Bitcoin	t5_2s3qj	r/Bitcoin	public		0	[]		you didn t see any graphite	0.41661176085472107	0.4230688810348511	0.5129387378692627	0.46842890977859497	0.43790480494499207	0.6024630665779114	0.3931218683719635	0.23336368799209595	0.45337387919425964	0.17722341418266296
9	[]	False		CallingVoid			[]				text	t2_6wp5f	False	False	"Exchanges SHOULD NOT BE TRUSTED.

Even if (and it's a big if) they are keeping full reserves to cover all of their custodial bitcoins, they WILL have weaknesses in their infrastructure and someone WILL exploit it eventually.

They are only useful for providing liquidity for buying and selling bitcoin.

Bitcoin is designed to be **trustless**, it's time to exploit that to the fullest."	b33fbcffcf00f43ca67818956c3f4e76eebf108c	True	False					0	1651305229		0	{}	i6rn6uv	False	t3_uf44oo	False	True	t3_uf44oo	/r/Bitcoin/comments/uf44oo/daily_discussion_april_30_2022/i6rn6uv/	1651305241	1	True	True	False	Bitcoin	t5_2s3qj	r/Bitcoin	public		0	[]		exchanges should not be trusted even if and it s a big if they are keeping full reserves to cover all of their custodial bitcoins they will have weaknesses in their infrastructure and someone will exploit it eventually they are only useful for providing liquidity for buying and selling bitcoin bitcoin is designed to be trustless it s time to exploit that to the fullest 	0.00354718416929245	0.9900941252708435	0.33749502897262573	0.9551945924758911	0.007077527232468128	0.36867499351501465	0.07958894968032837	8.358643412975653e-07	0.32164832949638367	0.031100086867809296
10	[]	False		Albo-LuckyBastard			[]				text	t2_8rhbyfbq	False	False	Correct, i meant to buy in interwalls but also to buy bigger amounts when Price drops 50-70% !!	2df0205270abb317dac074d2353ae62936031df8	True	False					0	1651305051		0	{}	i6rmzz5	False	t3_udw6l8	False	True	t1_i6mbwfk	/r/Bitcoin/comments/udw6l8/retrospective_found_my_post_from_9_years_ago/i6rmzz5/	1651305064	1	True	True	False	Bitcoin	t5_2s3qj	r/Bitcoin	public		0	[]		correct i meant to buy in interwalls but also to buy bigger amounts when price drops 50 70 	0.048376016318798065	0.9255821108818054	0.22473470866680145	0.017163239419460297	0.3591248393058777	0.07515513896942139	0.1392131745815277	4.881200584350154e-05	0.3832591772079468	3.883133103954606e-05
11	[]	False		DagiUr			[]			dark	text	t2_esxic95f	False	False	Bitcoin!!!	f9c702382297cc84ecfc990bd052b41af52ee98a	True	False					0	1651305012		0	{}	i6rmyfr	False	t3_udyx3s	False	True	t1_i6o7hxo	/r/Bitcoin/comments/udyx3s/crown_prince_of_serbia_not_crypto_but_bitcoin_its/i6rmyfr/	1651305031	1	True	True	False	Bitcoin	t5_2s3qj	r/Bitcoin	public		0	[]		bitcoin 	0.4630463123321533	0.5352395176887512	0.5230008959770203	0.4709847569465637	0.4710223376750946	0.1883898675441742	0.49838268756866455	0.495523601770401	0.4924294054508209	0.4087046682834625
12	[]	False		wbpsconline			[]				text	t2_c374vs9	False	False	Oh...Thanks for reminding me!	b0bd3eeae9130d5f9e882e3474bb15d92acfad2e	True	False					0	1651304997		0	{}	i6rmxsy	True	t3_uesd06	False	True	t1_i6rmuyk	/r/Bitcoin/comments/uesd06/companies_that_hold_bitcoin/i6rmxsy/	1651305032	1	True	True	False	Bitcoin	t5_2s3qj	r/Bitcoin	public		0	[]		oh thanks for reminding me 	0.6169267296791077	0.2685730755329132	0.14777879416942596	0.34223732352256775	0.44588151574134827	0.7121179699897766	0.8241090178489685	0.4687643349170685	0.3446391522884369	0.201944962143898
13	[]	False		Schwanzerfaust			[]				text	t2_102l5jmv	False	False	If they have concerns, it's probably too lucrative.	98d7f1af24a9022d2585843baa4fa2487813c197	True	False					0	1651304957		0	{}	i6rmw4j	False	t3_uelbof	False	True	t3_uelbof	/r/Bitcoin/comments/uelbof/us_labor_department_has_grave_concerns_about/i6rmw4j/	1651304975	1	True	True	False	Bitcoin	t5_2s3qj	r/Bitcoin	public		0	[]		if they have concerns it s probably too lucrative 	0.44083449244499207	0.5491661429405212	0.42795225977897644	0.6694983839988708	0.4513765871524811	0.5699392557144165	0.33449679613113403	0.37058669328689575	0.5019202828407288	0.03257361799478531
14	[]	False		Olegius2001			[]				text	t2_fo91mo3c	False	False	"Indeed my man, this is the real beauty of Bitcoin now,

it feels so good to see Kraken understanding that in a good manner,

that's what we want at the end of the day as a bitcoin supporter."	0688d8123403d5f45afc8b06d1d9fd6725821cd8	True	False					0	1651304936		0	{}	i6rmv8n	False	t3_ueiuk5	False	True	t1_i6onvbm	/r/Bitcoin/comments/ueiuk5/to_accelerate_financial_inclusion_kraken_has/i6rmv8n/	1651304948	1	True	True	False	Bitcoin	t5_2s3qj	r/Bitcoin	public		0	[]		indeed my man this is the real beauty of bitcoin now it feels so good to see kraken understanding that in a good manner that s what we want at the end of the day as a bitcoin supporter 	0.05626135692000389	0.9441553950309753	0.48342210054397583	0.017317337915301323	0.9921209812164307	0.27024513483047485	0.10139264166355133	8.453640703010024e-07	0.3130115568637848	0.004073918331414461
15	[]	False		Bluefoot44			[]				text	t2_xdj62	False	True	You missed me? 2.5 and so proud.	b53e925449bd9139ad0fc535ca76be0405dcfda8	True	False					0	1651304929		0	{}	i6rmuyk	False	t3_uesd06	False	True	t3_uesd06	/r/Bitcoin/comments/uesd06/companies_that_hold_bitcoin/i6rmuyk/	1651304941	1	True	True	False	Bitcoin	t5_2s3qj	r/Bitcoin	public		0	[]		you missed me 2 5 and so proud 	0.5158880352973938	0.31384819746017456	0.2956717908382416	0.329023152589798	0.38312411308288574	0.6508528590202332	0.6382827162742615	0.1267879605293274	0.35354262590408325	0.4488650858402252
16	[]	False		442952936			[]				text	t2_72n3emo5	False	False	Haha, this is why you need a wallet for your bitcoin not the exchange.	9b840a4e5637233a41d09092629e2266c904b0d1	True	False					0	1651304850		0	{}	i6rmrn8	False	t3_ues0qm	False	True	t3_ues0qm	/r/Bitcoin/comments/ues0qm/oh_thank_god_it_was_not_my_binance_account/i6rmrn8/	1651304863	1	True	True	False	Bitcoin	t5_2s3qj	r/Bitcoin	public		0	[]		haha this is why you need a wallet for your bitcoin not the exchange 	0.3862553834915161	0.4326280653476715	0.33517172932624817	0.11143851280212402	0.1575653851032257	0.43768489360809326	0.26447024941444397	0.511964738368988	0.3385937213897705	0.006500979885458946
17	[]	False		starshiporion22		noob	[{'e': 'text', 't': 'redditor for 4 weeks'}]	2ec8e69e-6c36-11e9-a04b-0afb553d4ea6	redditor for 4 weeks	dark	richtext	t2_j94zihua	False	False	Either he or you are a liar	348bf729354645035375dc4f7c6b0f4c10aeba19	True	False					0	1651304846		0	{}	i6rmrhl	False	t3_uf0vqq	False	True	t1_i6qqs1b	/r/Bitcoin/comments/uf0vqq/guessing_12_seed_words_to_restore_random_wallets/i6rmrhl/	1651304857	1	True	True	False	Bitcoin	t5_2s3qj	r/Bitcoin	public		0	[]		either he or you are a liar	0.3536253273487091	0.4134227931499481	0.791222095489502	0.44418707489967346	0.4008083641529083	0.2759762108325958	0.2261868566274643	0.19621706008911133	0.45589616894721985	0.10879550874233246
18	[]	False		Schwanzerfaust			[]				text	t2_102l5jmv	False	False	This is about shitcoinery, not Bitcoin.	ab5719228b23efac6fbf83647f9dac00f6005b2e	True	False					0	1651304838		0	{}	i6rmr5r	False	t3_uemow4	False	True	t3_uemow4	/r/Bitcoin/comments/uemow4/justin_germany_gets_friendlier_for_crypto_eases/i6rmr5r/	1651304850	1	True	True	False	Bitcoin	t5_2s3qj	r/Bitcoin	public		0	[]		this is about shitcoinery not bitcoin 	0.3982018530368805	0.5987581014633179	0.540839433670044	0.4285068213939667	0.4241448938846588	0.1706567406654358	0.4172177314758301	0.49962228536605835	0.5241303443908691	0.017747916281223297
19	[]	False		5liveR			[]				text	t2_v3lqwor	False	False	"Coldcard - only BTC, most secure
Trezor - BTC + store some Alt- ""Casino"" -coins 

Ledger - not recommended, due to their marketing storing customer info on **centralized** servers. We must never forget this happened in 2021. Its in their nature"	fe248aded810ebd927586f16334cf9aeded62e15	True	False					0	1651304830		0	{}	i6rmqv8	False	t3_uey0gz	False	True	t3_uey0gz	/r/Bitcoin/comments/uey0gz/trezor_or_nano_or_something_else/i6rmqv8/	1651304844	1	True	True	False	Bitcoin	t5_2s3qj	r/Bitcoin	public		0	[]		coldcard only btc most secure trezor btc store some alt casino coins ledger not recommended due to their marketing storing customer info on centralized servers we must never forget this happened in 2021 its in their nature	0.004930252209305763	0.9875202178955078	0.20234496891498566	0.029586216434836388	0.008923773653805256	0.48172903060913086	0.12904797494411469	8.665847985867003e-07	0.4802107810974121	0.040844615548849106
20	[]	False		[deleted]						dark					[removed]	fe993932d6dced4c0a879e9aa5d7a6e0fbb467f5	True	False					0	1651304826		0	{}	i6rmqoo	False	t3_ueqluz	False	True	t3_ueqluz	/r/Bitcoin/comments/ueqluz/for_anyone_wondering_what_its_like_to_be_a/i6rmqoo/	1651304837	1	True	True	False	Bitcoin	t5_2s3qj	r/Bitcoin	public		0	[]		 removed 	0.46707504987716675	0.5148742198944092	0.5170193910598755	0.5029740929603577	0.4936113953590393	0.5123135447502136	0.45383262634277344	0.4847692549228668	0.4981911778450012	0.5145108103752136
21	[]	False		100hedgiescalps			[]			dark	text	t2_e2uc2te8	False	False	Probably a great move dude. That or land?	ed9e544eeefdfa9c8a83a92bf72d82824a90071e	True	False					0	1651304807		0	{}	i6rmpxi	False	t3_uex7yy	False	True	t3_uex7yy	/r/Bitcoin/comments/uex7yy/should_i_buy_a_whole_bitcoin/i6rmpxi/	1651304818	1	True	True	False	Bitcoin	t5_2s3qj	r/Bitcoin	public		0	[]		probably a great move dude that or land 	0.4547160863876343	0.36724624037742615	0.3424939811229706	0.29326221346855164	0.5030859112739563	0.4677336812019348	0.33268845081329346	0.37352779507637024	0.4113883376121521	0.03697768226265907
22	[]	False		itzteknikalbho			[]				text	t2_cvlye7p7	False	False	"I don't know how much truth into this but i heard from someone they said if we all move btc from the exchange into the wallet then we will touch the 100k mark in no time.

Then exchange will have mo power to manipulate the market."	2b92075094837ebe8c9c96acc84856d6e6fb563f	True	False					0	1651304793		0	{}	i6rmpda	False	t3_ues0qm	False	True	t1_i6q0ety	/r/Bitcoin/comments/ues0qm/oh_thank_god_it_was_not_my_binance_account/i6rmpda/	1651304804	1	True	True	False	Bitcoin	t5_2s3qj	r/Bitcoin	public		0	[]		i don t know how much truth into this but i heard from someone they said if we all move btc from the exchange into the wallet then we will touch the 100k mark in no time then exchange will have mo power to manipulate the market 	0.0036048325709998608	0.9823637008666992	0.22565574944019318	0.033270567655563354	0.17840640246868134	0.24951790273189545	0.08108726888895035	8.477529718220467e-07	0.22525693476200104	0.0028862047474831343
23	[]	False		Bluefoot44			[]				text	t2_xdj62	False	True	 I'm at 2.5, not enough.	aec019747731df2898faf88640ad882d4d627cac	True	False					0	1651304777		0	{}	i6rmopw	False	t3_uekjrq	False	True	t3_uekjrq	/r/Bitcoin/comments/uekjrq/how_much_bitcoin_is_enough/i6rmopw/	1651304791	1	True	True	False	Bitcoin	t5_2s3qj	r/Bitcoin	public		0	[]		 i m at 2 5 not enough 	0.4472794532775879	0.5258125066757202	0.4087061285972595	0.46296095848083496	0.4938904643058777	0.6991668343544006	0.38340723514556885	0.5470243096351624	0.3946072459220886	0.28151026368141174
24	[]	False		codeboss911			[]				text	t2_816km6z	False	False	bro... every legit engineers linkin looks like that including mine	f181350c5dd58c69ea497a4188481a77ad2c9009	True	False					0	1651304672		0	{}	i6rmkmm	False	t3_ueqluz	False	True	t3_ueqluz	/r/Bitcoin/comments/ueqluz/for_anyone_wondering_what_its_like_to_be_a/i6rmkmm/	1651304686	1	True	True	False	Bitcoin	t5_2s3qj	r/Bitcoin	public		0	[]		bro every legit engineers linkin looks like that including mine	0.3908403515815735	0.4300702214241028	0.28362515568733215	0.23849645256996155	0.5540826916694641	0.47473499178886414	0.44221919775009155	0.7285852432250977	0.43693119287490845	0.016986384987831116
25	[]	False		Bitcoin__Hodler		noob	[{'e': 'text', 't': 'redditor for 3 months'}]	2ec8e69e-6c36-11e9-a04b-0afb553d4ea6	redditor for 3 months	dark	richtext	t2_jtjwgqh6	False	False	https://squareup.com/us/en/press/bcei-white-paper	ba752f8d5717bc7796e5ca5466d70d4f0e42ee17	True	False					0	1651304636		0	{}	i6rmj5r	False	t3_ueqfei	False	True	t3_ueqfei	/r/Bitcoin/comments/ueqfei/the_environmental_case_for_bitcoin/i6rmj5r/	1651304646	1	True	True	False	Bitcoin	t5_2s3qj	r/Bitcoin	public		0	[]		https squareup com us en press bcei white paper	0.2882634997367859	0.5021194815635681	0.30297258496284485	0.5546563267707825	0.3411391079425812	0.32424396276474	0.3772244453430176	0.4255979061126709	0.4583158493041992	0.006383013911545277
26	[]	False		Schwanzerfaust			[]				text	t2_102l5jmv	False	False	"And then to think that the whole concept of ""when there's more of one thing, one unit of that thing becomes less valuable"" is elementary school level shit.

We are in a sad spot regarding common sense and knowledge."	422df4a05ec854cee991c8c8b9f75ec4c373a813	True	False					0	1651304603		0	{}	i6rmhuj	False	t3_ueny02	False	True	t1_i6pkmvl	/r/Bitcoin/comments/ueny02/whats_causing_inflation_in_canada_yahoomaru_poll/i6rmhuj/	1651304614	1	True	True	False	Bitcoin	t5_2s3qj	r/Bitcoin	public		0	[]		and then to think that the whole concept of when there s more of one thing one unit of that thing becomes less valuable is elementary school level shit we are in a sad spot regarding common sense and knowledge 	0.003808725392445922	0.9872323274612427	0.5898855328559875	0.01101280190050602	0.991583526134491	0.3549952805042267	0.10524392127990723	8.37005870835128e-07	0.3846691846847534	0.0016721513820812106
27	[]	False		heavyspells			[]				text	t2_61kt8ta6	False	True	Whatâ€™s a Bitcoin engineer?	23e34243ea6e0fcefc30f9e196f72268c8abdc6c	True	False					0	1651304598		0	{}	i6rmhnj	False	t3_ueqluz	False	True	t3_ueqluz	/r/Bitcoin/comments/ueqluz/for_anyone_wondering_what_its_like_to_be_a/i6rmhnj/	1651304614	1	True	True	False	Bitcoin	t5_2s3qj	r/Bitcoin	public		0	[]		what s a bitcoin engineer 	0.44622477889060974	0.5698035359382629	0.42811188101768494	0.4718404710292816	0.4632605016231537	0.46898457407951355	0.42338380217552185	0.3858943283557892	0.46971791982650757	0.0543019101023674
28	[]	False		deadontheinternet			[]			dark	text	t2_a5lglgtg	False	False	Youâ€™d have a lot more products that do everything if you did	923895e1eb678da41ef8f02d298491abb9986ae4	True	False					0	1651304596		0	{}	i6rmhkg	False	t3_uezk7t	False	True	t1_i6qwzov	/r/Bitcoin/comments/uezk7t/bitcoin_gives_you_the_ability_to_levitate_above/i6rmhkg/	1651304607	1	True	True	False	Bitcoin	t5_2s3qj	r/Bitcoin	public		0	[]		you d have a lot more products that do everything if you did	0.44844093918800354	0.6027908325195312	0.275788813829422	0.4922749996185303	0.387420117855072	0.4885738492012024	0.34686079621315	1.2019602309010224e-06	0.3843310475349426	0.014483310282230377
29	[]	False		5liveR			[]				text	t2_v3lqwor	False	False	yeah, never forgetti	abac597ab0ec07865e2b662b6993c5579cd5fdab	True	False					0	1651304594		0	{}	i6rmhgk	False	t3_uey0gz	False	True	t1_i6rgc5h	/r/Bitcoin/comments/uey0gz/trezor_or_nano_or_something_else/i6rmhgk/	1651304607	1	True	True	False	Bitcoin	t5_2s3qj	r/Bitcoin	public		0	[]		yeah never forgetti	0.46813738346099854	0.3727181851863861	0.5535600185394287	0.32434359192848206	0.49443551898002625	0.510563313961029	0.5068644881248474	0.484773725271225	0.4572819173336029	0.15418487787246704
30	[]	False		[deleted]						dark					[removed]	fe993932d6dced4c0a879e9aa5d7a6e0fbb467f5	True	False					0	1651304567		0	{}	i6rmgcp	False	t3_uf44oo	False	True	t1_i6retkc	/r/Bitcoin/comments/uf44oo/daily_discussion_april_30_2022/i6rmgcp/	1651304580	1	True	True	False	Bitcoin	t5_2s3qj	r/Bitcoin	public		0	[]		 removed 	0.46707504987716675	0.5148742198944092	0.5170193910598755	0.5029740929603577	0.4936113953590393	0.5123135447502136	0.45383262634277344	0.4847692549228668	0.4981911778450012	0.5145108103752136
31	[]	False		Bitcoin__Hodler		noob	[{'e': 'text', 't': 'redditor for 3 months'}]	2ec8e69e-6c36-11e9-a04b-0afb553d4ea6	redditor for 3 months	dark	richtext	t2_jtjwgqh6	False	False	https://www.theblockcrypto.com/post/138338/argentinas-government-would-discourage-crypto-usage-under-proposed-imf-deal	d90fc812af68fd46868b09403b54f0a360302cbd	True	False					0	1651304549		0	{}	i6rmfn0	False	t3_uep1bt	False	True	t1_i6onz2c	/r/Bitcoin/comments/uep1bt/which_country_will_be_next_to_make_bitcoin_legal/i6rmfn0/	1651304560	1	True	True	False	Bitcoin	t5_2s3qj	r/Bitcoin	public		0	[]		https www theblockcrypto com post 138338 argentinas government would discourage crypto usage under proposed imf deal	0.14295509457588196	0.8801432251930237	0.5515156388282776	0.7761190533638	0.11003748327493668	0.21889115869998932	0.28774911165237427	2.538627541071037e-06	0.497317373752594	0.0035804046783596277
32	[]	False		spucci			[]				text	t2_4gv1k	False	False	But are they in your area?	b64eb24369dd241b8ab39cfc54189326acd79227	True	False					0	1651304485		0	{}	i6rmd03	False	t3_ueqluz	False	True	t1_i6piyng	/r/Bitcoin/comments/ueqluz/for_anyone_wondering_what_its_like_to_be_a/i6rmd03/	1651304501	1	True	True	False	Bitcoin	t5_2s3qj	r/Bitcoin	public		0	[]		but are they in your area 	0.5144507884979248	0.47478243708610535	0.44654181599617004	0.5585564374923706	0.49282553791999817	0.5118667483329773	0.4286591708660126	0.49309539794921875	0.5378442406654358	0.23516005277633667
33	[]	False		spucci			[]				text	t2_4gv1k	False	False	What a fucking stroke fest.	5fd2d6ab2682a9addf698b839ed198c6f4b9dcdb	True	False					0	1651304416		0	{}	i6rma51	False	t3_ueqluz	False	True	t3_ueqluz	/r/Bitcoin/comments/ueqluz/for_anyone_wondering_what_its_like_to_be_a/i6rma51/	1651304430	1	True	True	False	Bitcoin	t5_2s3qj	r/Bitcoin	public		0	[]		what a fucking stroke fest 	0.37211039662361145	0.39177045226097107	0.7314665913581848	0.35827645659446716	0.4112834632396698	0.644718587398529	0.41751325130462646	0.3137701749801636	0.437838077545166	0.1656533032655716
34	[]	False		Coctailer			[]				text	t2_zplj1	False	False	"Bitcoin, Gold, Silver

I stack all 3"	38674d88957670c407874047c2d052850f130459	True	False					0	1651304317		0	{}	i6rm64v	False	t3_uex7yy	False	True	t3_uex7yy	/r/Bitcoin/comments/uex7yy/should_i_buy_a_whole_bitcoin/i6rm64v/	1651304332	1	True	True	False	Bitcoin	t5_2s3qj	r/Bitcoin	public		0	[]		bitcoin gold silver i stack all 3	0.3499077260494232	0.5284741520881653	0.30332812666893005	0.3874250650405884	0.4858437776565552	0.38157930970191956	0.4783289432525635	0.6708292961120605	0.43176400661468506	0.23484382033348083
35	[]	False		Bitcoin__Hodler		noob	[{'e': 'text', 't': 'redditor for 3 months'}]	2ec8e69e-6c36-11e9-a04b-0afb553d4ea6	redditor for 3 months	dark	richtext	t2_jtjwgqh6	False	False	"&gt; current
--------"	5201f4d308786ea1ea4c2f8655258522d0a958c2	True	False					0	1651304283		0	{}	i6rm4t0	False	t3_uetfpp	False	True	t1_i6pt9d1	/r/Bitcoin/comments/uetfpp/switzerlands_central_bank_could_eventually_start/i6rm4t0/	1651304293	1	True	True	False	Bitcoin	t5_2s3qj	r/Bitcoin	public		0	[]		 gt current 	0.4451252520084381	0.5125245451927185	0.5054261684417725	0.541054904460907	0.4930162727832794	0.4768331050872803	0.4412115216255188	0.5036444664001465	0.5015450716018677	0.5346931219100952
