Unnamed: 0	all_awardings	archived	associated_award	author	author_flair_background_color	author_flair_css_class	author_flair_richtext	author_flair_template_id	author_flair_text	author_flair_text_color	author_flair_type	author_fullname	author_patreon_flair	author_premium	body	body_sha1	can_gild	collapsed	collapsed_because_crowd_control	collapsed_reason	collapsed_reason_code	comment_type	controversiality	created_utc	distinguished	gilded	gildings	id	is_submitter	link_id	locked	no_follow	parent_id	permalink	retrieved_utc	score	score_hidden	send_replies	stickied	subreddit	subreddit_id	subreddit_name_prefixed	subreddit_type	top_awarded_type	total_awards_received	treatment_tags	unrepliable_reason	corpus	support	knowledge	conflict	power	similarity	fun	status	trust	identity	romance
0	[]	False		kristoffernolgren			[]				text	t2_3efd4	False	False	Be careful about playback attacks!	6f17a5ec4d1f064ee82f0081332431532748d875	True	False					0	1662537603		0	{}	infacjk	False	t3_x7724l	False	True	t1_inb1ltt	/r/ethereum/comments/x7724l/be_extra_careful_and_avoid_fork_tokens_if_you/infacjk/	1662537617	1	False	True	False	ethereum	t5_2zf9m	r/ethereum	public		0	[]		be careful about playback attacks 	0.4332869052886963	0.5650059580802917	0.49081116914749146	0.5589607357978821	0.42445433139801025	0.293692409992218	0.43626245856285095	0.5473564267158508	0.4946589171886444	0.12867605686187744
1	[]	False		kristoffernolgren			[]				text	t2_3efd4	False	False	Worth knowing is, if you decide to sell either POW or POW, you can be subject to a playback attack. Essentially, the same transaction is done on the other network. to protect yourself from this attack you can move the coins you want to keep to a new adress.	c0d09b99eccc0150a7b52f4a93005077a33b314d	True	False					0	1662537550		0	{}	infaa8z	False	t3_x7ujty	False	True	t1_inf7o3v	/r/ethereum/comments/x7ujty/what_happens_to_the_eth_in_various_wallets_post/infaa8z/	1662537561	1	False	True	False	ethereum	t5_2zf9m	r/ethereum	public		0	[]		worth knowing is if you decide to sell either pow or pow you can be subject to a playback attack essentially the same transaction is done on the other network to protect yourself from this attack you can move the coins you want to keep to a new adress 	0.0024491967633366585	0.9892908930778503	0.26130977272987366	0.025286659598350525	0.0069341217167675495	0.2638061046600342	0.06619606167078018	8.487301670356828e-07	0.173700213432312	0.004458146169781685
2	[]	False		[deleted]						dark					[removed]	fe993932d6dced4c0a879e9aa5d7a6e0fbb467f5	True	False					0	1662537066		0	{}	inf9pm1	False	t3_x78ng5	False	True	t3_x78ng5	/r/ethereum/comments/x78ng5/the_final_countdown_to_the_ethereum_merge_has/inf9pm1/	1662537079	1	False	True	False	ethereum	t5_2zf9m	r/ethereum	public		0	[]		 removed 	0.46707504987716675	0.5148742198944092	0.5170193910598755	0.5029740929603577	0.4936113953590393	0.5123135447502136	0.45383262634277344	0.4847692549228668	0.4981911778450012	0.5145108103752136
3	[]	False		Zombone138			[]				text	t2_9ynpuh3s	False	False	Lol its a security because vitalik sold premined coin to a vc. Thats an offering.	bb292896e2eb3e264129e1bf3bd121be59821b83	True	False					0	1662536963		0	{}	inf9l5a	False	t3_x71ckg	False	True	t1_inf0uwg	/r/ethereum/comments/x71ckg/ethereums_technological_big_bang_will_take_place/inf9l5a/	1662536974	1	False	True	False	ethereum	t5_2zf9m	r/ethereum	public		0	[]		lol its a security because vitalik sold premined coin to a vc thats an offering 	0.0795951709151268	0.7040010690689087	0.46876198053359985	0.14965187013149261	0.13976521790027618	0.488416850566864	0.21801109611988068	0.05905977264046669	0.39955562353134155	0.005039404612034559
4	[]	False		harpocryptes			[]				text	t2_l8is2gjn	False	False	This. You can swap your ETH to rETH and keep your rETH on your hardware wallet. You will earn staking rewards and help secure and decentralize ethereum.	162c29b8c4fa9c21411e2dfe6c5c8e1b810783db	True	False					0	1662535886		0	{}	inf8a14	False	t3_x7cj4g	False	True	t1_inbl37x	/r/ethereum/comments/x7cj4g/pos_disincentive_to_self_custody/inf8a14/	1662535897	1	False	True	False	ethereum	t5_2zf9m	r/ethereum	public		0	[]		this you can swap your eth to reth and keep your reth on your hardware wallet you will earn staking rewards and help secure and decentralize ethereum 	0.7954442501068115	0.960858941078186	0.14165863394737244	0.11327898502349854	0.004108334891498089	0.009396828711032867	0.2811742126941681	0.6414428949356079	0.29606175422668457	0.00022757456463295966
5	[]	False		Red5point1			[]				text	t2_4b6s2	False	False	"the entire point of cryptos is to not rely on 3rd party intermediaries.
Using them defeats the purpose may as well use fiat."	6aa37ef319ef748a90201a078783b8a198f01d7a	True	False					0	1662535729		0	{}	inf836s	False	t3_x7u8ya	False	True	t3_x7u8ya	/r/ethereum/comments/x7u8ya/why_dont_we_see_more_online_wallets_based_on/inf836s/	1662535741	1	False	True	False	ethereum	t5_2zf9m	r/ethereum	public		0	[]		the entire point of cryptos is to not rely on 3rd party intermediaries using them defeats the purpose may as well use fiat 	0.06751345098018646	0.9366594552993774	0.2931046485900879	0.45195165276527405	0.1471659243106842	0.20239728689193726	0.1232302114367485	8.397842634622066e-07	0.5145087838172913	0.002199918497353792
6	[]	False		-Echo24-			[]				text	t2_fg4s2x4z	False	False	I don’t think you can choose. All ETH will be POS. They would have to fork it and come out with a new ETH token if they want to stay POW. I think that’s how it works.	cd0aa72c39962cde7147060e5887155dd543d39e	True	False					0	1662535389		0	{}	inf7o3v	False	t3_x7ujty	False	True	t1_inf40s1	/r/ethereum/comments/x7ujty/what_happens_to_the_eth_in_various_wallets_post/inf7o3v/	1662535401	1	False	True	False	ethereum	t5_2zf9m	r/ethereum	public		0	[]		i don t think you can choose all eth will be pos they would have to fork it and come out with a new eth token if they want to stay pow i think that s how it works 	0.15864963829517365	0.9397002458572388	0.1900896281003952	0.02410644292831421	0.008811133913695812	0.5131356716156006	0.07005158811807632	8.571041121285816e-07	0.2713690996170044	0.006288525648415089
7	[]	False		AdrianBeatyoursons			[]				text	t2_jg8b0	False	False	my butt’s what?	b91e5005d9637940fd8e722a481d3e055ac571a8	True	False					0	1662535226		0	{}	inf7gli	False	t3_x78ng5	False	True	t1_ind84gb	/r/ethereum/comments/x78ng5/the_final_countdown_to_the_ethereum_merge_has/inf7gli/	1662535241	1	False	True	False	ethereum	t5_2zf9m	r/ethereum	public		0	[]		my butt s what 	0.4516279399394989	0.31037285923957825	0.5951457619667053	0.38326317071914673	0.4919873774051666	0.7050088047981262	0.46346965432167053	0.44290801882743835	0.4637604355812073	0.20139478147029877
8	[]	False		rypher			[]				text	t2_4atys	False	False	Except the price. Which direction, no idea.	aa5cd9b08c29252069d1fa68d9b9efecc73c4148	True	False					0	1662534284		0	{}	inf697v	False	t3_x7d7y8	False	True	t1_inf5sil	/r/ethereum/comments/x7d7y8/bellatrix_activated_next_stop_the_merge/inf697v/	1662534301	1	False	True	False	ethereum	t5_2zf9m	r/ethereum	public		0	[]		except the price which direction no idea 	0.32299643754959106	0.6045469641685486	0.38003474473953247	0.5845044255256653	0.5387146472930908	0.3644152879714966	0.3204304575920105	0.4570463299751282	0.4743299186229706	0.19670331478118896
9	[]	False		PeanutButterCumbot			[]				text	t2_90pa6de0	False	False	Does anything actually change for users? Everything really just stays the same doesn't it?	179dad11dd00e082d26ee359f5da7a9da662ee24	True	False					0	1662533930		0	{}	inf5sil	False	t3_x7d7y8	False	True	t3_x7d7y8	/r/ethereum/comments/x7d7y8/bellatrix_activated_next_stop_the_merge/inf5sil/	1662533941	1	False	True	False	ethereum	t5_2zf9m	r/ethereum	public		0	[]		does anything actually change for users everything really just stays the same doesn t it 	0.3219648599624634	0.6822074055671692	0.3314032256603241	0.09862615913152695	0.5696662664413452	0.7550712823867798	0.13765192031860352	2.5149497560050804e-06	0.4083870053291321	0.0016081295907497406
10	[]	False		CaptainJim27			[]				text	t2_5zh6z598	False	False	Screw them	5d0d5a9d2528047213d42a72d0f68df3464b690a	True	False					0	1662533838		0	{}	inf5o9k	False	t3_x78ng5	False	True	t1_inbg7xd	/r/ethereum/comments/x78ng5/the_final_countdown_to_the_ethereum_merge_has/inf5o9k/	1662533850	1	False	True	False	ethereum	t5_2zf9m	r/ethereum	public		0	[]		screw them	0.4666593670845032	0.4407685399055481	0.5931103825569153	0.5160945057868958	0.475238561630249	0.5882237553596497	0.4408818483352661	0.47597670555114746	0.4627021551132202	0.3334297835826874
11	[]	False		seito935			[]				text	t2_jma9nwy	False	False	I mean I kinda wanna get rid of mine idk why I was even given one tbh	46937968557a576c9eff0aedeb191840e626e192	True	False					0	1662533354		0	{}	inf51ds	False	t3_x79hmj	False	False	t1_inblvkn	/r/ethereum/comments/x79hmj/reddit_nft_avatars_selling_for_a_premium_on/inf51ds/	1662533366	1	False	True	False	ethereum	t5_2zf9m	r/ethereum	public		0	[]		i mean i kinda wanna get rid of mine idk why i was even given one tbh	0.18200403451919556	0.14459523558616638	0.6897405982017517	0.011358425952494144	0.43475040793418884	0.7731067538261414	0.1566876471042633	9.795263395062648e-06	0.33967146277427673	0.04391249269247055
12	[]	False		HeliosGnosis			[]				text	t2_113wih	False	False	It would kind of be messed up for them to keep it and then not give % stake rewards to all hodlers of it on PayPal,  they would make a small fortune doing that though. You can send cryptos to their wallet's aka PayPal but you will NOT and cannot withdrawal any.  I would cash out and hold either it or something else of your heart's desire in a real wallet to which you control the keys for.	dfcc19b84d4b9f1dfd93855382356374693ef363	True	False					0	1662533196		0	{}	inf4tsy	False	t3_x7eo8r	False	True	t3_x7eo8r	/r/ethereum/comments/x7eo8r/so_i_have_ethereum_with_paypal_how_will_the_merge/inf4tsy/	1662533209	1	False	True	False	ethereum	t5_2zf9m	r/ethereum	public		0	[]		it would kind of be messed up for them to keep it and then not give stake rewards to all hodlers of it on paypal they would make a small fortune doing that though you can send cryptos to their wallet s aka paypal but you will not and cannot withdrawal any i would cash out and hold either it or something else of your heart s desire in a real wallet to which you control the keys for 	0.7688190937042236	0.9886954426765442	0.36855098605155945	0.0659312754869461	0.008336062543094158	0.29772070050239563	0.06453695893287659	8.428862088294409e-07	0.21205343306064606	0.026189835742115974
13	[]	False		PeanutButterCumbot			[]				text	t2_90pa6de0	False	False	What's great is that literally NOTHING will change for the end-users experience. It will all be exactly the same just using a different method to process blocks.	a4a5c1620bc50337eff14a591863c9d068950320	True	False					0	1662532943		0	{}	inf4ho7	False	t3_x78ng5	False	True	t3_x78ng5	/r/ethereum/comments/x78ng5/the_final_countdown_to_the_ethereum_merge_has/inf4ho7/	1662532957	1	False	True	False	ethereum	t5_2zf9m	r/ethereum	public		0	[]		what s great is that literally nothing will change for the end users experience it will all be exactly the same just using a different method to process blocks 	0.06001803278923035	0.9814940690994263	0.04906594753265381	0.012817811220884323	0.9622257351875305	0.2064998745918274	0.07515765726566315	8.626303156233917e-07	0.3961769938468933	0.0019633753690868616
14	[]	False		jmmenes			[]				text	t2_bsajwlak	False	False	This ^	aa8296a5840f5af45ad31f5a879b23e7d45fb07f	True	False					0	1662532817		0	{}	inf4bd1	True	t3_x7ujty	False	True	t1_inf40s1	/r/ethereum/comments/x7ujty/what_happens_to_the_eth_in_various_wallets_post/inf4bd1/	1662532829	1	False	True	False	ethereum	t5_2zf9m	r/ethereum	public		0	[]		this 	0.5047774910926819	0.4987621009349823	0.48036742210388184	0.5125024914741516	0.4887435734272003	0.5407670140266418	0.5104243159294128	0.49320998787879944	0.4738154113292694	0.5025169849395752
15	[]	False		slykethephoxenix			[]				text	t2_cyruc	False	True	https://www.youtube.com/watch?v=9jK-NcRmVcw THE FINAL COUNT DOOOWWWNNN	c87c57991bdec5a2bff946fab86d74ad3a773b57	True	False					0	1662532798		0	{}	inf4ac1	False	t3_x78ng5	False	True	t3_x78ng5	/r/ethereum/comments/x78ng5/the_final_countdown_to_the_ethereum_merge_has/inf4ac1/	1662532815	1	False	True	False	ethereum	t5_2zf9m	r/ethereum	public		0	[]		https www youtube com watch v 9jk ncrmvcw the final count dooowwwnnn	0.07507272064685822	0.7986260056495667	0.31061694025993347	0.3046967685222626	0.29814502596855164	0.8421486616134644	0.3276180624961853	9.00516261026496e-06	0.42469415068626404	2.9087239454383962e-05
16	[]	False		slykethephoxenix			[]				text	t2_cyruc	False	True	Lmao. What a hill to die on!	45c0a69910614d4245c6e25bbfe623a2f6e6e658	True	False					0	1662532658		0	{}	inf43jd	False	t3_x78ng5	False	True	t1_inb7gk4	/r/ethereum/comments/x78ng5/the_final_countdown_to_the_ethereum_merge_has/inf43jd/	1662532673	1	False	True	False	ethereum	t5_2zf9m	r/ethereum	public		0	[]		lmao what a hill to die on 	0.3543524742126465	0.4110855162143707	0.5318669080734253	0.22252272069454193	0.3913530111312866	0.43842893838882446	0.35206323862075806	0.15727272629737854	0.40947169065475464	0.02294725552201271
17	[]	False		decorumic			[]				text	t2_fmydh	False	False	How do I know if I’m connecting to ETHPoW or ETHPoS from my wallet? How can I choose which one to connect to?	e97570dd6b4b4f4ae8fa9bdc71086b0f2f92875e	True	False					0	1662532600		0	{}	inf40s1	False	t3_x7ujty	False	False	t3_x7ujty	/r/ethereum/comments/x7ujty/what_happens_to_the_eth_in_various_wallets_post/inf40s1/	1662532617	1	False	True	False	ethereum	t5_2zf9m	r/ethereum	public		0	[]		how do i know if i m connecting to ethpow or ethpos from my wallet how can i choose which one to connect to 	0.28764644265174866	0.9148136377334595	0.04113931581377983	0.008573289960622787	0.22155886888504028	0.08283274620771408	0.10563269257545471	8.062715642154217e-05	0.38840004801750183	0.0009422244620509446
18	[]	False		Perleflamme			[]				text	t2_13pqgo	False	False	"It's not a snapshot. It's a hot fix, so the chain will change from being PoW at a given block to being PoS at the next one.

That block is defined by the TTD (a big quantity of total hashes of the main chain), so it's not a fixed block. We've already got the fork that ensures it will behave like that, the Bellatrix hard fork."	4e573623d10f134005ada9e3235dd6ceb6f7dd70	True	False					0	1662532407		0	{}	inf3rcv	False	t3_x7wka2	False	True	t3_x7wka2	/r/ethereum/comments/x7wka2/when_is_the_snapshot_for_the_merge_happening/inf3rcv/	1662532419	1	False	True	False	ethereum	t5_2zf9m	r/ethereum	public		0	[]		it s not a snapshot it s a hot fix so the chain will change from being pow at a given block to being pos at the next one that block is defined by the ttd a big quantity of total hashes of the main chain so it s not a fixed block we ve already got the fork that ensures it will behave like that the bellatrix hard fork 	0.002312641590833664	0.9897542595863342	0.693983793258667	0.010023161768913269	0.007846105843782425	0.3649132549762726	0.07740247994661331	8.519082257407717e-07	0.4153546392917633	0.00732473423704505
19	[]	False		yogofubi			[]				text	t2_7s5ab0a7	False	False	I have a validator in my home office	ea6b5ecc64baee5fb216908487609615546484f7	True	False					0	1662532079		0	{}	inf3bcd	False	t3_x78ng5	False	True	t1_inds0x6	/r/ethereum/comments/x78ng5/the_final_countdown_to_the_ethereum_merge_has/inf3bcd/	1662532091	1	False	True	False	ethereum	t5_2zf9m	r/ethereum	public		0	[]		i have a validator in my home office	0.39105284214019775	0.4510757029056549	0.3325524926185608	0.3966716527938843	0.47504645586013794	0.43029651045799255	0.46314018964767456	0.6587120294570923	0.4326682388782501	0.09992703795433044
20	[]	False		AMPed101			[]				text	t2_zrl9d	False	False	The wallet is the app that holds the private keys to your eth, it doesnt actually hold the coins. The private key is still valid after the merge so nothing should happen.	825200a58db40c8be2aff1042ca4aed01d25637f	True	False					0	1662532030		0	{}	inf38xi	False	t3_x7ujty	False	True	t3_x7ujty	/r/ethereum/comments/x7ujty/what_happens_to_the_eth_in_various_wallets_post/inf38xi/	1662532041	1	False	True	False	ethereum	t5_2zf9m	r/ethereum	public		0	[]		the wallet is the app that holds the private keys to your eth it doesnt actually hold the coins the private key is still valid after the merge so nothing should happen 	0.007477565202862024	0.9861037135124207	0.45453590154647827	0.7374398112297058	0.10679364204406738	0.3969504237174988	0.06664782017469406	8.359839398508484e-07	0.4197096824645996	0.0068707698956131935
21	[]	False		[deleted]						dark					[removed]	fe993932d6dced4c0a879e9aa5d7a6e0fbb467f5	True	False					0	1662531831		0	{}	inf2z0l	False	t3_x7u8ya	False	True	t3_x7u8ya	/r/ethereum/comments/x7u8ya/why_dont_we_see_more_online_wallets_based_on/inf2z0l/	1662531842	1	False	True	False	ethereum	t5_2zf9m	r/ethereum	public		0	[]		 removed 	0.46707504987716675	0.5148742198944092	0.5170193910598755	0.5029740929603577	0.4936113953590393	0.5123135447502136	0.45383262634277344	0.4847692549228668	0.4981911778450012	0.5145108103752136
