Unnamed: 0	all_awardings	archived	associated_award	author	author_flair_background_color	author_flair_css_class	author_flair_richtext	author_flair_template_id	author_flair_text	author_flair_text_color	author_flair_type	author_fullname	author_patreon_flair	author_premium	body	body_sha1	can_gild	collapsed	collapsed_because_crowd_control	collapsed_reason	collapsed_reason_code	comment_type	controversiality	created_utc	distinguished	gilded	gildings	id	is_submitter	link_id	locked	no_follow	parent_id	permalink	retrieved_utc	score	score_hidden	send_replies	stickied	subreddit	subreddit_id	subreddit_name_prefixed	subreddit_type	top_awarded_type	total_awards_received	treatment_tags	unrepliable_reason	author_cakeday	corpus	support	knowledge	conflict	power	similarity	fun	status	trust	identity	romance
60	[]	False		silver-blazer29		noob	[{'e': 'text', 't': 'redditor for a day'}]	2ec8e69e-6c36-11e9-a04b-0afb553d4ea6	redditor for a day	dark	richtext	t2_skoifa6q	False	False	"I guess if you don’t agree with it you can refuse to pay in your jurisdiction.

And again, I also said you don’t have to sell it for fiat for it to be taxed. If you purchase with straight crypto that is also regulated in the US. 

That was only one example of current existing regulation. There is a lot more potential regulation on how Bitcoin and other cryptocurrency can be used and where it is used."	56e032b42b00640cac6dd401fe15a40b6d793a72	True	False					0	1663456819		0	{}	iouwafp	False	t3_xgw29z	False	True	t1_iouvlu7	/r/Bitcoin/comments/xgw29z/crypto_slowing_bitcoins_adoption/iouwafp/	1663456838	1	True	True	False	Bitcoin	t5_2s3qj	r/Bitcoin	public		0	[]			i guess if you don t agree with it you can refuse to pay in your jurisdiction and again i also said you don t have to sell it for fiat for it to be taxed if you purchase with straight crypto that is also regulated in the us that was only one example of current existing regulation there is a lot more potential regulation on how bitcoin and other cryptocurrency can be used and where it is used 	0.0028003156185150146	0.9883837103843689	0.4323124587535858	0.07513261586427689	0.008113925345242023	0.3836265206336975	0.05869686231017113	8.545046625840769e-07	0.512408971786499	0.08005966246128082
61	[]	False		ride_the_LN			[]				text	t2_ovnz032	False	False	The house is 87k? How am I going to buy a a 94k house with 82k? That's the joke.	282077ad8c913de59cf6e0df6eb414b0b2c4c951	True	False					0	1663456784		0	{}	iouw7s9	False	t3_xgyql5	False	True	t1_iouumum	/r/Bitcoin/comments/xgyql5/we_will_all_be_bank_free_soon/iouw7s9/	1663456797	1	True	True	False	Bitcoin	t5_2s3qj	r/Bitcoin	public		0	[]			the house is 87k how am i going to buy a a 94k house with 82k that s the joke 	0.20404165983200073	0.7387875914573669	0.36392027139663696	0.23938605189323425	0.16830512881278992	0.5932541489601135	0.10441940277814865	1.1517215625644894e-06	0.38599732518196106	0.012725235894322395
62	[]	False		OfWhomIAmChief			[]				text	t2_cmfaucq9	False	False	"&gt;A purely peer-to-peer version of electronic cash would allow online
payments to be sent directly from one party to another without going through a
financial institution."	a71ae8332502f4214650e44a516095faedf247c9	True	False					0	1663456781		0	{}	iouw7i0	False	t3_xgaw97	False	True	t1_iotqb8i	/r/Bitcoin/comments/xgaw97/my_biggest_concern_about_bitcoin_help_ease_it_for/iouw7i0/	1663456798	1	True	True	False	Bitcoin	t5_2s3qj	r/Bitcoin	public		0	[]			 gt a purely peer to peer version of electronic cash would allow online payments to be sent directly from one party to another without going through a financial institution 	0.026648566126823425	0.9859066009521484	0.39577582478523254	0.04248468205332756	0.0931127592921257	0.12119029462337494	0.08340617269277573	0.8965515494346619	0.2977365255355835	0.009478108957409859
63	[]	False		Suitable_Moose1111		noob	[{'e': 'text', 't': 'redditor for 7 weeks'}]	2ec8e69e-6c36-11e9-a04b-0afb553d4ea6	redditor for 7 weeks	dark	richtext	t2_qi9253mh	False	False	I’m very new	f2be4c6d21c6ef232b5a1a96463d70fdd07d6f2c	True	False					0	1663456771		0	{}	iouw6s5	False	t3_xfw0di	False	True	t1_ioraavs	/r/Bitcoin/comments/xfw0di/can_someone_make_a_steel_man_argument_for_why_not/iouw6s5/	1663456782	1	True	True	False	Bitcoin	t5_2s3qj	r/Bitcoin	public		0	[]			i m very new	0.5168092250823975	0.4413754642009735	0.2211129516363144	0.42222291231155396	0.5361413359642029	0.5397228598594666	0.5976478457450867	0.6132007241249084	0.5021423697471619	0.6458747982978821
64	[]	False		leishman3			[]				text	t2_lhgimtsf	False	False	Yeah I think, it is possible to manipulate this data and it may very well be.	80d09bc8657fcb3b398a1ba7fa2e013f90300cbd	True	False					0	1663456759		0	{}	iouw5vp	False	t3_xf8au9	False	True	t1_ionot97	/r/Bitcoin/comments/xf8au9/ath_hashrate_but_where_are_the_miners_everywhere/iouw5vp/	1663456775	1	True	True	False	Bitcoin	t5_2s3qj	r/Bitcoin	public		0	[]			yeah i think it is possible to manipulate this data and it may very well be 	0.41973641514778137	0.7334465384483337	0.044326990842819214	0.032576367259025574	0.5257717370986938	0.4431684613227844	0.2083754688501358	0.15573976933956146	0.5138540863990784	0.011221924796700478
65	[]	False		SmashedACookie			[]				text	t2_d3iyc	False	False	apparently they've done that to multiple people.	fd22103a8e9e296de02e16abecddfb985c1833a4	True	False					0	1663456758		0	{}	iouw5to	False	t3_xgyql5	False	True	t3_xgyql5	/r/Bitcoin/comments/xgyql5/we_will_all_be_bank_free_soon/iouw5to/	1663456774	1	True	True	False	Bitcoin	t5_2s3qj	r/Bitcoin	public		0	[]			apparently they ve done that to multiple people 	0.42109888792037964	0.4380651116371155	0.37618252635002136	0.3646727502346039	0.5237679481506348	0.5451025366783142	0.388672411441803	0.4334266483783722	0.47715792059898376	0.033417653292417526
66	[]	False		Suitable_Moose1111		noob	[{'e': 'text', 't': 'redditor for 7 weeks'}]	2ec8e69e-6c36-11e9-a04b-0afb553d4ea6	redditor for 7 weeks	dark	richtext	t2_qi9253mh	False	False	The red is I	a8a9df892342837a5b03ddd1f5a2979474c9b085	True	False					0	1663456683		0	{}	iouvzzh	False	t3_xfw0di	False	True	t1_iosj47e	/r/Bitcoin/comments/xfw0di/can_someone_make_a_steel_man_argument_for_why_not/iouvzzh/	1663456697	1	True	True	False	Bitcoin	t5_2s3qj	r/Bitcoin	public		0	[]			the red is i	0.41717809438705444	0.4635668694972992	0.46181628108024597	0.5047982335090637	0.4886381924152374	0.5123036503791809	0.39930495619773865	0.3700639307498932	0.4874435365200043	0.6694419980049133
67	[]	False		jamesegattis			[]				text	t2_66cwynwi	False	False	"Can he sue them? I agree never consent to search. Never say anything in "" interview "" without your lawyer."	edd6cc57e131c5fe38bde60fddd2060cc5b6fe0e	True	False					0	1663456668		0	{}	iouvytz	False	t3_xgyql5	False	True	t3_xgyql5	/r/Bitcoin/comments/xgyql5/we_will_all_be_bank_free_soon/iouvytz/	1663456682	1	True	True	False	Bitcoin	t5_2s3qj	r/Bitcoin	public		0	[]			can he sue them i agree never consent to search never say anything in interview without your lawyer 	0.23028407990932465	0.39460089802742004	0.6104423999786377	0.3382798731327057	0.330154687166214	0.42488691210746765	0.20189110934734344	0.7909008860588074	0.3467548191547394	0.010915298014879227
68	[]	False		lntipbot			[]				text	t2_1qxz2yqv	False	False	"Hi u/Alfador8, thanks for tipping u/cryptoenthusiast84 **3000** satoshis!
***
*[^(More info)](https://xnf5cwpq73.execute-api.us-west-2.amazonaws.com/prod/info) ^| [^(Balance)](https://www.reddit.com/message/compose/?to=lntipbot&amp;subject=balance&amp;message=!balance) ^| [^(Deposit)](https://www.reddit.com/message/compose/?to=lntipbot&amp;subject=deposit&amp;message=!deposit 10000) ^| [^(Withdraw)](https://www.reddit.com/message/compose/?to=lntipbot&amp;subject=withdraw&amp;message=!withdraw put_invoice_here) ^| ^(Something wrong?  Have a question?) [^(Send me a message)](https://www.reddit.com/message/compose/?to=drmoore718)*"	1cd7448a0895db8d7392ad3279bb77603a617191	True	False					0	1663456661		0	{}	iouvy8t	False	t3_xgdb6t	False	True	t1_iouvwsp	/r/Bitcoin/comments/xgdb6t/daily_discussion_september_17_2022/iouvy8t/	1663456675	1	True	True	False	Bitcoin	t5_2s3qj	r/Bitcoin	public		0	[]			hi u alfador8 thanks for tipping u cryptoenthusiast84 3000 satoshis more info https xnf5cwpq73 execute api us west 2 amazonaws com prod info balance https www reddit com message compose to lntipbot amp subject balance amp message balance deposit https www reddit com message compose to lntipbot amp subject deposit amp message deposit 10000 withdraw https www reddit com message compose to lntipbot amp subject withdraw amp message withdraw put invoice here something wrong have a question send me a message https www reddit com message compose to drmoore718 	0.0006517571746371686	0.9959728121757507	0.7306197881698608	0.9802064895629883	0.0034013884142041206	0.052758730947971344	0.15154673159122467	8.37832430988783e-07	0.38171499967575073	1.4111227756075095e-05
69	[]	False		Youblack		noob	[{'e': 'text', 't': 'redditor for 6 days'}]	2ec8e69e-6c36-11e9-a04b-0afb553d4ea6	redditor for 6 days	dark	richtext	t2_se7rr449	False	False	https://amoun.cc/ref/Youblack	9edf2db20c42f666fc8de1673103e0b7b203e446	True	False					0	1663456657		0	{}	iouvxyf	False	t3_xgkgr9	False	True	t1_iosbve0	/r/Bitcoin/comments/xgkgr9/a_cbdc_would_be_about_the_worst_possible_thing_to/iouvxyf/	1663456675	1	True	True	False	Bitcoin	t5_2s3qj	r/Bitcoin	public		0	[]			https amoun cc ref youblack	0.2542997896671295	0.4830177426338196	0.41254308819770813	0.5133829712867737	0.3644440174102783	0.2646835446357727	0.41076987981796265	0.3957052230834961	0.4836460053920746	0.0050788321532309055
70	[]	False		Suitable_Moose1111		noob	[{'e': 'text', 't': 'redditor for 7 weeks'}]	2ec8e69e-6c36-11e9-a04b-0afb553d4ea6	redditor for 7 weeks	dark	richtext	t2_qi9253mh	False	False	I did the same but with varied results 😂	a66a9f44482efcd57eceededab240283a8d76446	True	False					0	1663456655		0	{}	iouvxs0	False	t3_xfw0di	False	True	t1_iosre8w	/r/Bitcoin/comments/xfw0di/can_someone_make_a_steel_man_argument_for_why_not/iouvxs0/	1663456667	1	True	True	False	Bitcoin	t5_2s3qj	r/Bitcoin	public		0	[]			i did the same but with varied results 	0.38136541843414307	0.5181529521942139	0.2769552767276764	0.3588983416557312	0.6159949898719788	0.5712812542915344	0.44607099890708923	0.41576823592185974	0.5392709970474243	0.09754066169261932
71	[]	False		Alfador8			[]			dark	text	t2_9a8nmfg7	False	False	"Share the wealth and experience around here too!

!lntip 3000"	421f4c2257f6adfa9af25d7c7be8d0a54d770db4	True	False					0	1663456642		0	{}	iouvwsp	False	t3_xgdb6t	False	True	t1_iouq4nb	/r/Bitcoin/comments/xgdb6t/daily_discussion_september_17_2022/iouvwsp/	1663456659	1	True	True	False	Bitcoin	t5_2s3qj	r/Bitcoin	public		0	[]			share the wealth and experience around here too lntip 3000	0.3924673795700073	0.7925090193748474	0.18365928530693054	0.3903577923774719	0.48378971219062805	0.2881661355495453	0.4740498661994934	0.7718209028244019	0.4520292580127716	0.0001512529415776953
72	[]	False		mostly_harmless79			[]			dark	text	t2_a2vy97s3	False	False	"Taken from the same “wordpress” article: https://spectrum.ieee.org/the-us-national-academies-reports-on-the-prospects-for-quantum-computing

“Given the current state of quantum computing and recent rates of progress, it is highly unexpected that a quantum computer that can compromise RSA 2048 or comparable discrete logarithm-based public key cryptosystems will be built within the next decade.”"	f6764ec4282c3ec096723bacbdcfa60f134fa748	True	False					0	1663456630		0	{}	iouvvxl	False	t3_xgizqk	False	True	t1_iouqy5o	/r/Bitcoin/comments/xgizqk/it_is_expected_that_quantum_computer_technology/iouvvxl/	1663456643	1	True	True	False	Bitcoin	t5_2s3qj	r/Bitcoin	public		0	[]			taken from the same wordpress article https spectrum ieee org the us national academies reports on the prospects for quantum computing given the current state of quantum computing and recent rates of progress it is highly unexpected that a quantum computer that can compromise rsa 2048 or comparable discrete logarithm based public key cryptosystems will be built within the next decade 	0.0026825887616723776	0.9887064695358276	0.3496650755405426	0.9505813717842102	0.00977930799126625	0.34565868973731995	0.10237906128168106	8.47263208925142e-07	0.4752049148082733	0.009778694249689579
73	[]	False		KimIBS12345		noob	[{'e': 'text', 't': 'redditor for 3 months'}]	2ec8e69e-6c36-11e9-a04b-0afb553d4ea6	redditor for 3 months	dark	richtext	t2_pniqt4qa	False	False	"Sweden here.

We have the satanistic ”Bank ID” and yes this is owned by the big banos in sweden. You can not do anything in sweden without this, and yes it is very convenient but it is scary as hell. Your social security number is connected to absolutely everything. Want to have nutricious steaks delivered instead of going to the store and buying vegan cancer burgers? Use bank id, send 1 dollar to a friend? Use bank id, log in to anything? Use bank id! The moment you step out of your social credit score line when that kicks in you are fucked. Say goodbye to your beef that keeps you strong and healthy, you will have to eat qourn and whatever else because you have reached your csrbon footprint limit for the year. Jesus christ people of sweden bank id is a evil idea."	b763a849d7fd9d2ea7c8f2bca42f1fba76c79373	True	False					0	1663456603		0	{}	iouvtv9	False	t3_xgng8w	False	True	t1_iosyz6d	/r/Bitcoin/comments/xgng8w/are_europeans_just_going_to_roll_over_and_let/iouvtv9/	1663456621	1	True	True	False	Bitcoin	t5_2s3qj	r/Bitcoin	public		0	[]			sweden here we have the satanistic bank id and yes this is owned by the big banos in sweden you can not do anything in sweden without this and yes it is very convenient but it is scary as hell your social security number is connected to absolutely everything want to have nutricious steaks delivered instead of going to the store and buying vegan cancer burgers use bank id send 1 dollar to a friend use bank id log in to anything use bank id the moment you step out of your social credit score line when that kicks in you are fucked say goodbye to your beef that keeps you strong and healthy you will have to eat qourn and whatever else because you have reached your csrbon footprint limit for the year jesus christ people of sweden bank id is a evil idea 	0.0021275137551128864	0.9883602857589722	0.7549232244491577	0.026021305471658707	0.9946881532669067	0.271879106760025	0.08862701058387756	8.186301556634135e-07	0.3472885489463806	0.003633760614320636
74	[]	False		King0liver			[]				text	t2_7kjd0	False	False	But he would have avoided this if he had the money in a bank...	e839a7c4ec62054f2994f427557c68bb8778e2ac	True	False					0	1663456524		0	{}	iouvnxh	False	t3_xgyql5	False	False	t3_xgyql5	/r/Bitcoin/comments/xgyql5/we_will_all_be_bank_free_soon/iouvnxh/	1663456543	1	True	True	False	Bitcoin	t5_2s3qj	r/Bitcoin	public		0	[]			but he would have avoided this if he had the money in a bank 	0.3335532546043396	0.6476529836654663	0.5090652704238892	0.43388330936431885	0.4252474308013916	0.3150390684604645	0.175273135304451	0.42450419068336487	0.3838081955909729	0.004494738299399614
75	[]	False		Sweaty_Camel_118			[]			dark	text	t2_dgpuvwvq	False	False	How is capital gains tax the regulation of bitcoin? The function of bitcoin is not to be sold back for shitty dollars anyway.	408dde003f0221d28e8524a7ac973370a2fdc990	True	False					0	1663456497		0	{}	iouvlu7	False	t3_xgw29z	False	True	t1_iouuyse	/r/Bitcoin/comments/xgw29z/crypto_slowing_bitcoins_adoption/iouvlu7/	1663456511	1	True	True	False	Bitcoin	t5_2s3qj	r/Bitcoin	public		0	[]			how is capital gains tax the regulation of bitcoin the function of bitcoin is not to be sold back for shitty dollars anyway 	0.12569032609462738	0.9565359354019165	0.8447099328041077	0.8986034393310547	0.027723677456378937	0.45441943407058716	0.08636578172445297	2.2482422536995728e-06	0.3166233003139496	0.01692255772650242
76	[]	False		Middle-University-15			[]			dark	text	t2_aqdryt6k	False	False	That’s why he was going to buy a house	378678f9efc62db1acb4073a9d8f137630581198	True	False					0	1663456448		0	{}	iouvi05	False	t3_xgyql5	False	True	t1_iouumum	/r/Bitcoin/comments/xgyql5/we_will_all_be_bank_free_soon/iouvi05/	1663456464	1	True	True	False	Bitcoin	t5_2s3qj	r/Bitcoin	public		0	[]			that s why he was going to buy a house	0.27624738216400146	0.5635842680931091	0.42821991443634033	0.46132418513298035	0.5101979374885559	0.590423583984375	0.17192402482032776	0.13932839035987854	0.373050332069397	0.022500960156321526
77	[]	False		silver-blazer29		noob	[{'e': 'text', 't': 'redditor for a day'}]	2ec8e69e-6c36-11e9-a04b-0afb553d4ea6	redditor for a day	dark	richtext	t2_skoifa6q	False	False	There are millions of people on this platform. Don’t assume the person you commented to downvoted you. There are lots of snowflakes. Don’t become a snowflake getting caught up with worrying about downvotes. You will become one.	3e2a2a19e0f5e432822edbbc9f1b139aa0689f90	True	False					0	1663456357		0	{}	iouvayn	False	t3_xgw29z	False	True	t1_ioutsly	/r/Bitcoin/comments/xgw29z/crypto_slowing_bitcoins_adoption/iouvayn/	1663456371	1	True	True	False	Bitcoin	t5_2s3qj	r/Bitcoin	public		0	[]			there are millions of people on this platform don t assume the person you commented to downvoted you there are lots of snowflakes don t become a snowflake getting caught up with worrying about downvotes you will become one 	0.0058053359389305115	0.9753544330596924	0.6727714538574219	0.019775155931711197	0.015137892216444016	0.36138397455215454	0.07831971347332001	9.134551532952173e-07	0.31446895003318787	0.032741647213697433
78	[]	False		Middle-University-15			[]			dark	text	t2_aqdryt6k	False	False	From what I have read in the past, most all of our currency will have a positive hit for some kind of drug.	598ab061550eca9fe121f992576d034b25da4199	True	False					0	1663456355		0	{}	iouvasx	False	t3_xgyql5	False	True	t1_ioulbst	/r/Bitcoin/comments/xgyql5/we_will_all_be_bank_free_soon/iouvasx/	1663456371	1	True	True	False	Bitcoin	t5_2s3qj	r/Bitcoin	public		0	[]			from what i have read in the past most all of our currency will have a positive hit for some kind of drug 	0.07359907031059265	0.8936629891395569	0.26277509331703186	0.03274761885404587	0.6056951880455017	0.40908849239349365	0.25723153352737427	9.441173460800201e-07	0.34725674986839294	0.0021060239523649216
79	[]	False		850725890118			[]				text	t2_ge110eyt	False	False	It's bad that they are not maintaining that one, but still they are trying.	f0ded6acdaf0d51e59661622e9c7d12d7dd1271f	True	False					0	1663456315		0	{}	iouv7rc	False	t3_xftykj	False	True	t1_ioqf9z8	/r/Bitcoin/comments/xftykj/bitcoin_island_is_over_100_businesses_now/iouv7rc/	1663456334	1	True	True	False	Bitcoin	t5_2s3qj	r/Bitcoin	public		0	[]			it s bad that they are not maintaining that one but still they are trying 	0.40945908427238464	0.566603422164917	0.7877735495567322	0.2778218388557434	0.572706401348114	0.48265501856803894	0.10041767358779907	3.3602852909098146e-06	0.6025950908660889	0.0047556329518556595
80	[]	False		ScoreOk5355			[]				text	t2_a1p31us6	False	False	"Short story is never concent to a search of your vehicle.
 If they say ""hey, do you mind if we seach your vehicle just so we know that their's no illegal guns or drugs in the car""
Say ""no, I do not consent to any searches""
Even, if you've got nothing to hide
Cops find stuff to use against you, not for you

The below viedo covers this perticular traffic stop pretty well from an attorneys point of view
https://youtu.be/7iPLgsptcno"	43812a8dec04a49a42e7caf8c702c7463c183615	True	False					0	1663456282		0	{}	iouv5bq	False	t3_xgyql5	False	False	t3_xgyql5	/r/Bitcoin/comments/xgyql5/we_will_all_be_bank_free_soon/iouv5bq/	1663456295	1	True	True	False	Bitcoin	t5_2s3qj	r/Bitcoin	public		0	[]			short story is never concent to a search of your vehicle if they say hey do you mind if we seach your vehicle just so we know that their s no illegal guns or drugs in the car say no i do not consent to any searches even if you ve got nothing to hide cops find stuff to use against you not for you the below viedo covers this perticular traffic stop pretty well from an attorneys point of view https youtu be 7iplgsptcno	0.0007013558060862124	0.9956721067428589	0.9147492051124573	0.014133485034108162	0.003735767910256982	0.03277479484677315	0.10817568004131317	8.442345347248192e-07	0.363381028175354	0.0001532886817585677
81	[]	False		ATABro		noob	[{'e': 'text', 't': 'redditor for 3 weeks'}]	2ec8e69e-6c36-11e9-a04b-0afb553d4ea6	redditor for 3 weeks	dark	richtext	t2_rrvi7dxu	False	False	"It’s failed as a currency because no one uses it.

It failed as an inflation hedge when it dropped 49k during rampant inflation.

It failed as a store of value when it dropped 49k from all time highs.

It’s never faced a recession, it’s only known easy money. 

When you die it’s gone forever so it can’t be passed down and eventually only the mega corps will own it making it useless. 

There are 20k other coins that compete with it for total value. 

It only lives off hype and stimulus. 

/mic drop"	ab649a489e63d615e5a7196c7cd1bffa7f8f4a3c	True	False					0	1663456265		0	{}	iouv41p	False	t3_xfw0di	False	False	t3_xfw0di	/r/Bitcoin/comments/xfw0di/can_someone_make_a_steel_man_argument_for_why_not/iouv41p/	1663456279	1	True	True	False	Bitcoin	t5_2s3qj	r/Bitcoin	public		0	[]			it s failed as a currency because no one uses it it failed as an inflation hedge when it dropped 49k during rampant inflation it failed as a store of value when it dropped 49k from all time highs it s never faced a recession it s only known easy money when you die it s gone forever so it can t be passed down and eventually only the mega corps will own it making it useless there are 20k other coins that compete with it for total value it only lives off hype and stimulus mic drop	0.002332152798771858	0.9886890053749084	0.7639835476875305	0.013507377356290817	0.008215410634875298	0.449939101934433	0.08128652721643448	8.563148412576993e-07	0.2627934217453003	0.0011868993751704693
82	[]	False		silver-blazer29		noob	[{'e': 'text', 't': 'redditor for a day'}]	2ec8e69e-6c36-11e9-a04b-0afb553d4ea6	redditor for a day	dark	richtext	t2_skoifa6q	False	False	"It’s a fiat regulation used to regulate cryptocurrency. You can word it however you want, you’re paying taxes on your gains from BTC going up. 

I don’t know your jurisdiction but the IRS considers a purchase with cryptocurrency as a taxable event if there are gains. Paying in crypto doesn’t avoid taxes (assuming there is a gain). 

This isn’t even scratching the surface on all the potential regulation that can be implemented. The government doesn’t care if you have some wallet on your computer that only you control. They don’t need to control it. They can just regulate the people and businesses all around you."	ed9749c372f2bd8c1a5e2f8b926d11f69d581bda	True	False					0	1663456195		0	{}	iouuyse	False	t3_xgw29z	False	True	t1_iouu4q5	/r/Bitcoin/comments/xgw29z/crypto_slowing_bitcoins_adoption/iouuyse/	1663456209	1	True	True	False	Bitcoin	t5_2s3qj	r/Bitcoin	public		0	[]			it s a fiat regulation used to regulate cryptocurrency you can word it however you want you re paying taxes on your gains from btc going up i don t know your jurisdiction but the irs considers a purchase with cryptocurrency as a taxable event if there are gains paying in crypto doesn t avoid taxes assuming there is a gain this isn t even scratching the surface on all the potential regulation that can be implemented the government doesn t care if you have some wallet on your computer that only you control they don t need to control it they can just regulate the people and businesses all around you 	0.002624770626425743	0.9892904162406921	0.8404391407966614	0.9607738852500916	0.008127768523991108	0.5515070557594299	0.06454945355653763	8.299055593852245e-07	0.22725218534469604	0.01209721714258194
83	[]	False		OkeyDokeyWokey		noob	[{'e': 'text', 't': 'redditor for 1 week'}]	2ec8e69e-6c36-11e9-a04b-0afb553d4ea6	redditor for 1 week	dark	richtext	t2_s0zqosvb	False	False	The Netherlands is sitting on one of the biggest gas deposits in the world. They just can’t touch it because it will result in earthquakes in their northern provinces.	4008d1723a3d177f4dccfeee22d0fdb7e5b747a6	True	False					0	1663456157		0	{}	iouuvzt	False	t3_xgoqzc	False	True	t1_iousmsv	/r/Bitcoin/comments/xgoqzc/bitcoin_nuclear_power_on_the_cover_of_polish/iouuvzt/	1663456170	1	True	True	False	Bitcoin	t5_2s3qj	r/Bitcoin	public		0	[]			the netherlands is sitting on one of the biggest gas deposits in the world they just can t touch it because it will result in earthquakes in their northern provinces 	0.004566519055515528	0.9842721223831177	0.3736203908920288	0.0284456517547369	0.689755380153656	0.29093411564826965	0.08735131472349167	8.564283575651643e-07	0.557703971862793	0.0024007235188037157
