169	[]	False	Harkonnen_Baron		[]		text	t2_a4ojqfqo	False	False	False	[]	False	False	1642764032	self.Bitcoin	https://www.reddit.com/r/Bitcoin/comments/s98klc/btc_is_almost_nasdaq_tracker/	{}	s98klc	False	True	False	False	False	True	True	False		[]	dark	text	False	False	True	0	0	False	all_ads	/r/Bitcoin/comments/s98klc/btc_is_almost_nasdaq_tracker/	False	6	1642764042	1	"It will die with usd or live at mercy of FED printer.

Say thank you ETF (algo pegged to usd)."	True	False	False	Bitcoin	t5_2s3qj	3813173	public	self	BTC is almost Nasdaq tracker..	0	[]	1.0	https://www.reddit.com/r/Bitcoin/comments/s98klc/btc_is_almost_nasdaq_tracker/	all_ads	6		dark																				"BTC is almost Nasdaq tracker..
It will die with usd or live at mercy of FED printer.

Say thank you ETF (algo pegged to usd)."	btc is almost nasdaq tracker it will die with usd or live at mercy of fed printer say thank you etf algo pegged to usd 	0.1265491098165512	0.9688558578491211	0.33397719264030457	0.019567079842090607	0.09612374007701874	0.37754157185554504	0.17988905310630798	9.149686661658052e-07	0.3661661148071289	0.0011702881893143058
170	[]	False	Dangerous_Moose_4765		[]		text	t2_8e0wdvxx	False	False	False	[]	False	False	1642763697	self.Bitcoin	https://www.reddit.com/r/Bitcoin/comments/s98hnk/i_was_told_btc_is_a_ponzi_scheme_today/	{}	s98hnk	False	False	False	False	False	False	True	False		[]	dark	text	False	False	True	0	0	False	all_ads	/r/Bitcoin/comments/s98hnk/i_was_told_btc_is_a_ponzi_scheme_today/	False	6	1642763707	1	[removed]	True	False	False	Bitcoin	t5_2s3qj	3813165	public	self	I was told btc is a Ponzi scheme today	0	[]	1.0	https://www.reddit.com/r/Bitcoin/comments/s98hnk/i_was_told_btc_is_a_ponzi_scheme_today/	all_ads	6		dark								moderator												"I was told btc is a Ponzi scheme today
[removed]"	i was told btc is a ponzi scheme today removed 	0.23858371376991272	0.6012530326843262	0.47968584299087524	0.2432837337255478	0.4738370180130005	0.41653233766555786	0.29496023058891296	0.5523037314414978	0.43276697397232056	0.031460925936698914
171	[]	False	leonardo-vinci	noob	[{'e': 'text', 't': 'redditor for 3 months'}]	redditor for 3 months	richtext	t2_crflfmne	False	False	False	[]	False	False	1642763522	guardianmag.press	https://www.reddit.com/r/Bitcoin/comments/s98fzf/for_the_first_time_since_august_a_sharp_decline/	{}	s98fzf	False	True	False	False	False	True	False	False		[]	dark	text	False	False	True	0	0	False	all_ads	/r/Bitcoin/comments/s98fzf/for_the_first_time_since_august_a_sharp_decline/	False	6	1642763532	1		True	False	False	Bitcoin	t5_2s3qj	3813160	public	https://a.thumbs.redditmedia.com/T5-LReiqQGMqYJ9HkUADNpaVY_TOwqGiQTk_btK1290.jpg	For the first time since August, a sharp decline in “Bitcoin” after Russia’s proposal to ban cryptocurrencies	0	[]	1.0	https://www.guardianmag.press/2022/01/for-the-first-time-since-august-a-sharp-decline-in-bitcoin-after-russias-proposal-to-ban-cryptocurrencies.html/	all_ads	6	2ec8e69e-6c36-11e9-a04b-0afb553d4ea6	dark	link	{'enabled': False, 'images': [{'id': 'PKfh6YWh6XCa2A2f0JKh8_XlKrM1zE5o-ZH_dUo_3M4', 'resolutions': [{'height': 60, 'url': 'https://external-preview.redd.it/wFpS8LL4gwMJddZydYWB5o60L0nfsVxR2ljU1na2EMA.jpg?width=108&amp;crop=smart&amp;auto=webp&amp;s=265c0ae2a0b952ba014133ca50a3eb5fda2eaa45', 'width': 108}, {'height': 121, 'url': 'https://external-preview.redd.it/wFpS8LL4gwMJddZydYWB5o60L0nfsVxR2ljU1na2EMA.jpg?width=216&amp;crop=smart&amp;auto=webp&amp;s=297c895925ec0a10406edf971bbb67d1e5b126d8', 'width': 216}, {'height': 180, 'url': 'https://external-preview.redd.it/wFpS8LL4gwMJddZydYWB5o60L0nfsVxR2ljU1na2EMA.jpg?width=320&amp;crop=smart&amp;auto=webp&amp;s=fa0d06e3ac14a0298a80b16a27b4e373e9d00484', 'width': 320}, {'height': 360, 'url': 'https://external-preview.redd.it/wFpS8LL4gwMJddZydYWB5o60L0nfsVxR2ljU1na2EMA.jpg?width=640&amp;crop=smart&amp;auto=webp&amp;s=eecd7eceb08271d14d97849e38d834399fd74f58', 'width': 640}], 'source': {'height': 536, 'url': 'https://external-preview.redd.it/wFpS8LL4gwMJddZydYWB5o60L0nfsVxR2ljU1na2EMA.jpg?auto=webp&amp;s=684caad413442314d0e63a6f919411e2feb7ab66', 'width': 952}, 'variants': {}}]}	78.0	140.0	https://www.guardianmag.press/2022/01/for-the-first-time-since-august-a-sharp-decline-in-bitcoin-after-russias-proposal-to-ban-cryptocurrencies.html/															"For the first time since August, a sharp decline in “Bitcoin” after Russia’s proposal to ban cryptocurrencies
"	for the first time since august a sharp decline in bitcoin after russia s proposal to ban cryptocurrencies nan	0.041893456131219864	0.8400200009346008	0.4223608374595642	0.2579635977745056	0.42722606658935547	0.42466074228286743	0.2641737759113312	0.5895866751670837	0.43397632241249084	0.002754450775682926
172	[]	False	Bitcoin_is_plan_A		[]		text	t2_aij0dbgt	False	False	True	[]	False	False	1642763387	self.Bitcoin	https://www.reddit.com/r/Bitcoin/comments/s98enw/the_utility_of_the_exchanges_made_possible_by/	{}	s98enw	False	True	False	False	False	True	True	False		[]	dark	text	False	False	False	0	0	False	all_ads	/r/Bitcoin/comments/s98enw/the_utility_of_the_exchanges_made_possible_by/	False	6	1642763397	1	"&gt;Satoshi Nakanomto

https://satoshi.nakamotoinstitute.org/quotes/bitcoin-economics/?order=desc

Bitcoin is Key to an Abundant, Clean Energy Future.
If you want to learn more about Bitcoin´s use of energy, you can start here:

https://squareup.com/us/en/press/bcei-white-paper"	True	False	False	Bitcoin	t5_2s3qj	3813159	public	self	The utility of the exchanges made possible by Bitcoin will far exceed the cost of electricity used. Therefore, not having Bitcoin would be the net waste.	0	[]	1.0	https://www.reddit.com/r/Bitcoin/comments/s98enw/the_utility_of_the_exchanges_made_possible_by/	all_ads	6		dark																				"The utility of the exchanges made possible by Bitcoin will far exceed the cost of electricity used. Therefore, not having Bitcoin would be the net waste.
&gt;Satoshi Nakanomto

https://satoshi.nakamotoinstitute.org/quotes/bitcoin-economics/?order=desc

Bitcoin is Key to an Abundant, Clean Energy Future.
If you want to learn more about Bitcoin´s use of energy, you can start here:

https://squareup.com/us/en/press/bcei-white-paper"	the utility of the exchanges made possible by bitcoin will far exceed the cost of electricity used therefore not having bitcoin would be the net waste gt satoshi nakanomto https satoshi nakamotoinstitute org quotes bitcoin economics order desc bitcoin is key to an abundant clean energy future if you want to learn more about bitcoin s use of energy you can start here https squareup com us en press bcei white paper	0.002437224145978689	0.9884872436523438	0.09401389956474304	0.9564123749732971	0.007624171674251556	0.30098703503608704	0.116211898624897	8.492556275996321e-07	0.35663720965385437	0.006281184498220682
173	[]	False	kavyadecor		[]		text	t2_devde1u4	False	False	False	[]	False	False	1642763279	self.Bitcoin	https://www.reddit.com/r/Bitcoin/comments/s98drs/do_you_know_about_decentralized_exchange/	{}	s98drs	False	True	False	False	False	True	True	False		[]	dark	text	False	False	True	0	0	False	all_ads	/r/Bitcoin/comments/s98drs/do_you_know_about_decentralized_exchange/	False	6	1642763290	1	For the people who have not heard about a decentralized exchange platform, let me explain what does a decentralized exchange platform is. As the name of the platform says, it is a **decentralized exchange platform** that is not controlled by a third party or a middleman. All the different types of DEX platforms offer different functionalities to the users. Not only the charges to use the platform differs but liquidity offered, speed, and other features differ simultaneously.	True	False	False	Bitcoin	t5_2s3qj	3813158	public	self	Do you know about decentralized exchange?	0	[]	1.0	https://www.reddit.com/r/Bitcoin/comments/s98drs/do_you_know_about_decentralized_exchange/	all_ads	6																						"Do you know about decentralized exchange?
For the people who have not heard about a decentralized exchange platform, let me explain what does a decentralized exchange platform is. As the name of the platform says, it is a **decentralized exchange platform** that is not controlled by a third party or a middleman. All the different types of DEX platforms offer different functionalities to the users. Not only the charges to use the platform differs but liquidity offered, speed, and other features differ simultaneously."	do you know about decentralized exchange for the people who have not heard about a decentralized exchange platform let me explain what does a decentralized exchange platform is as the name of the platform says it is a decentralized exchange platform that is not controlled by a third party or a middleman all the different types of dex platforms offer different functionalities to the users not only the charges to use the platform differs but liquidity offered speed and other features differ simultaneously 	0.002558740321546793	0.988494336605072	0.09641136974096298	0.9118533730506897	0.9918704032897949	0.3079937696456909	0.11883704364299774	8.427406896771572e-07	0.5879478454589844	0.003474688623100519
174	[]	False	PoloParachutes		[]		text	t2_22q9pua0	False	False	False	[]	False	False	1642763254	i.redd.it	https://www.reddit.com/r/Bitcoin/comments/s98dk4/bitcoin/	{}	s98dk4	False	True	False	False	True	True	False	False		[]	dark	text	False	False	True	0	0	False	all_ads	/r/Bitcoin/comments/s98dk4/bitcoin/	False	6	1642763264	1		True	False	False	Bitcoin	t5_2s3qj	3813158	public	https://a.thumbs.redditmedia.com/a7tdxFgMw1CbtolM23OSNx9QXTdaY1GID8qiIPd8Ds4.jpg	Bitcoin:	0	[]	1.0	https://i.redd.it/xggstoz1x0d81.gif	all_ads	6			image	{'enabled': True, 'images': [{'id': 'iSioGoJh_VEtpWDesBHDmiOcC-5bvqLT3zCWKqIMpS4', 'resolutions': [{'height': 76, 'url': 'https://preview.redd.it/xggstoz1x0d81.gif?width=108&amp;crop=smart&amp;format=png8&amp;s=03bb457ee24487051f1f0e8591b81134285216c0', 'width': 108}, {'height': 153, 'url': 'https://preview.redd.it/xggstoz1x0d81.gif?width=216&amp;crop=smart&amp;format=png8&amp;s=05aca081e78a77884590d95c751d2394eceece59', 'width': 216}], 'source': {'height': 200, 'url': 'https://preview.redd.it/xggstoz1x0d81.gif?format=png8&amp;s=00fb2ff228f260a5770bd65300807af1f884b0cf', 'width': 281}, 'variants': {'gif': {'resolutions': [{'height': 76, 'url': 'https://preview.redd.it/xggstoz1x0d81.gif?width=108&amp;crop=smart&amp;s=0a13b7ca54daa582d37da09a8829e357ba0d5d75', 'width': 108}, {'height': 153, 'url': 'https://preview.redd.it/xggstoz1x0d81.gif?width=216&amp;crop=smart&amp;s=0f0fab1109f96c718115a13ece3e918080cf31e8', 'width': 216}], 'source': {'height': 200, 'url': 'https://preview.redd.it/xggstoz1x0d81.gif?s=ec3d8f17c775d49b5cc0281ec558808366ef62a3', 'width': 281}}, 'mp4': {'resolutions': [{'height': 76, 'url': 'https://preview.redd.it/xggstoz1x0d81.gif?width=108&amp;format=mp4&amp;s=28e7fc61645eaf7fbb080a3084a91219556ebb10', 'width': 108}, {'height': 153, 'url': 'https://preview.redd.it/xggstoz1x0d81.gif?width=216&amp;format=mp4&amp;s=1eb07b5fd1cb8436598306ebc070924d0b3edac3', 'width': 216}], 'source': {'height': 200, 'url': 'https://preview.redd.it/xggstoz1x0d81.gif?format=mp4&amp;s=03026aacf2be638bd34dc8b8caf34c090b98cc12', 'width': 281}}}}]}	99.0	140.0	https://i.redd.it/xggstoz1x0d81.gif															"Bitcoin:
"	bitcoin nan	0.48432332277297974	0.48301419615745544	0.4883573055267334	0.4344960153102875	0.46959102153778076	0.5231790542602539	0.5154674649238586	0.5038089156150818	0.4821624755859375	0.5079196095466614
175	[]	False	Kingzswieetz	noob	[{'e': 'text', 't': 'redditor for 1 week'}]	redditor for 1 week	richtext	t2_ifwu5tw4	False	False	False	[]	False	False	1642762773	self.Bitcoin	https://www.reddit.com/r/Bitcoin/comments/s988ps/learn_how_to_trade_and_analyze_crypto_forex_and/	{}	s988ps	False	False	False	False	False	False	True	False		[]	dark	text	False	False	True	0	0	False	all_ads	/r/Bitcoin/comments/s988ps/learn_how_to_trade_and_analyze_crypto_forex_and/	False	6	1642762783	1	[removed]	True	False	False	Bitcoin	t5_2s3qj	3813135	public	self	Learn how to trade and analyze Crypto, Forex and stocks.	0	[]	1.0	https://www.reddit.com/r/Bitcoin/comments/s988ps/learn_how_to_trade_and_analyze_crypto_forex_and/	all_ads	6	2ec8e69e-6c36-11e9-a04b-0afb553d4ea6	dark	self	{'enabled': False, 'images': [{'id': '3W1xwVF2ayWFEq_1q-WLF_wrhF74AFFabyJjPiVrLo8', 'resolutions': [{'height': 108, 'url': 'https://external-preview.redd.it/ERk0C86sovAFjgJvQ36a596_b4Vg3iIGeiF6OvNjhDM.jpg?width=108&amp;crop=smart&amp;auto=webp&amp;s=086f3efaa683519a1cdaea9ddfacee515e4f1f89', 'width': 108}, {'height': 216, 'url': 'https://external-preview.redd.it/ERk0C86sovAFjgJvQ36a596_b4Vg3iIGeiF6OvNjhDM.jpg?width=216&amp;crop=smart&amp;auto=webp&amp;s=c116bed024f9f18ca0618a83d551272c6be1491b', 'width': 216}, {'height': 320, 'url': 'https://external-preview.redd.it/ERk0C86sovAFjgJvQ36a596_b4Vg3iIGeiF6OvNjhDM.jpg?width=320&amp;crop=smart&amp;auto=webp&amp;s=9be899b2f04944fcdb11e69936d249aca845c9b8', 'width': 320}], 'source': {'height': 320, 'url': 'https://external-preview.redd.it/ERk0C86sovAFjgJvQ36a596_b4Vg3iIGeiF6OvNjhDM.jpg?auto=webp&amp;s=f4b6540dff9a0bd0575d7a816ac983414162eba8', 'width': 320}, 'variants': {}}]}						reddit												"Learn how to trade and analyze Crypto, Forex and stocks.
[removed]"	learn how to trade and analyze crypto forex and stocks removed 	0.3516732454299927	0.8585233688354492	0.25849413871765137	0.6336824297904968	0.2581785023212433	0.24659478664398193	0.281657338142395	0.7627950310707092	0.4166974425315857	0.005363914184272289
176	[]	False	HotOutcome767	noob	[{'e': 'text', 't': 'redditor for a day'}]	redditor for a day	richtext	t2_iukpscwb	False	False	False	[]	False	False	1642762769	self.Bitcoin	https://www.reddit.com/r/Bitcoin/comments/s988op/hey_check_out_this_chat_room_its_been_around/	{}	s988op	False	False	False	False	False	False	True	False		[]	dark	text	False	False	True	0	0	False	all_ads	/r/Bitcoin/comments/s988op/hey_check_out_this_chat_room_its_been_around/	False	6	1642762779	1	[removed]	True	False	False	Bitcoin	t5_2s3qj	3813134	public	self	Hey, check out this chat room. It's been around since 2015, with real traders helping each other profit💸💸 https://discord.gg/FqS2R9xVtG	0	[]	1.0	https://www.reddit.com/r/Bitcoin/comments/s988op/hey_check_out_this_chat_room_its_been_around/	all_ads	6	2ec8e69e-6c36-11e9-a04b-0afb553d4ea6	dark								automod_filtered												"Hey, check out this chat room. It's been around since 2015, with real traders helping each other profit💸💸 https://discord.gg/FqS2R9xVtG
[removed]"	hey check out this chat room it s been around since 2015 with real traders helping each other profit https discord gg fqs2r9xvtg removed 	0.08045294880867004	0.8259607553482056	0.4065605700016022	0.029591619968414307	0.5953817367553711	0.8250592947006226	0.2405441552400589	8.50518404149625e-07	0.45184043049812317	0.0010199453681707382
177	[]	False	Bitcoin_is_plan_A		[]		text	t2_aij0dbgt	False	False	True	[]	False	False	1642762589	i.redd.it	https://www.reddit.com/r/Bitcoin/comments/s98776/bitcoin_mining_difficulty_increased_by_93_today/	{}	s98776	False	True	False	False	True	True	False	False		[]	dark	text	False	False	True	1	0	False	all_ads	/r/Bitcoin/comments/s98776/bitcoin_mining_difficulty_increased_by_93_today/	False	6	1642762600	1		True	False	False	Bitcoin	t5_2s3qj	3813134	public	https://b.thumbs.redditmedia.com/53C22_HcMYZspQcwrAzriaNTZlo9RbLB0YKbVoBoSeI.jpg	Bitcoin mining difficulty increased by +9.3% today, hitting a new ATH.	0	[]	1.0	https://i.redd.it/odrzk740v0d81.jpg	all_ads	6		dark	image	{'enabled': True, 'images': [{'id': 'F3V_e0l2MFeAQiU9tYxRK6bEw1eVcy_QH0CAAEyTVW0', 'resolutions': [{'height': 61, 'url': 'https://preview.redd.it/odrzk740v0d81.jpg?width=108&amp;crop=smart&amp;auto=webp&amp;s=af31b9723757821a9052fe2c7ec0b72b4ed8fb86', 'width': 108}, {'height': 123, 'url': 'https://preview.redd.it/odrzk740v0d81.jpg?width=216&amp;crop=smart&amp;auto=webp&amp;s=49ece7520c783914a94451992ac796421fc438a5', 'width': 216}, {'height': 183, 'url': 'https://preview.redd.it/odrzk740v0d81.jpg?width=320&amp;crop=smart&amp;auto=webp&amp;s=882015a4d62062e37f7122642bc6a0d277411af0', 'width': 320}, {'height': 366, 'url': 'https://preview.redd.it/odrzk740v0d81.jpg?width=640&amp;crop=smart&amp;auto=webp&amp;s=3202c50b92b91736e06a2918a6df2a388c3c8900', 'width': 640}, {'height': 549, 'url': 'https://preview.redd.it/odrzk740v0d81.jpg?width=960&amp;crop=smart&amp;auto=webp&amp;s=3a78a15f07be2faf3400b8dcec9bc1718fbf89e2', 'width': 960}, {'height': 618, 'url': 'https://preview.redd.it/odrzk740v0d81.jpg?width=1080&amp;crop=smart&amp;auto=webp&amp;s=c46ad99b94c41b5e286462adc03890c9db9263c2', 'width': 1080}], 'source': {'height': 1173, 'url': 'https://preview.redd.it/odrzk740v0d81.jpg?auto=webp&amp;s=e54905f41bcb44947666bd3ff7318a8c095254fc', 'width': 2048}, 'variants': {}}]}	80.0	140.0	https://i.redd.it/odrzk740v0d81.jpg															"Bitcoin mining difficulty increased by +9.3% today, hitting a new ATH.
"	bitcoin mining difficulty increased by 9 3 today hitting a new ath nan	0.19374936819076538	0.7276290059089661	0.23698635399341583	0.6323579549789429	0.4341193437576294	0.5627166628837585	0.39191514253616333	7.869172259233892e-05	0.35996025800704956	0.01069218385964632
178	[]	False	HotOutcome767	noob	[{'e': 'text', 't': 'redditor for a day'}]	redditor for a day	richtext	t2_iukpscwb	False	False	False	[]	False	False	1642762574	discord.gg	https://www.reddit.com/r/Bitcoin/comments/s9872r/join_the_cryptotraderscom_discord_server/	{}	s9872r	False	False	False	False	False	False	False	False		[]	dark	text	False	False	True	0	0	False	all_ads	/r/Bitcoin/comments/s9872r/join_the_cryptotraderscom_discord_server/	False	6	1642762585	1		True	False	False	Bitcoin	t5_2s3qj	3813132	public	https://a.thumbs.redditmedia.com/yWHTn_KkEHHt28GHZ1w-WkSUNcjCTnX9Qo0tj7eokD0.jpg	Join the CryptoTraders.com Discord Server!	0	[]	1.0	https://discord.gg/FqS2R9xVtG	all_ads	6	2ec8e69e-6c36-11e9-a04b-0afb553d4ea6	dark	link	{'enabled': False, 'images': [{'id': 'Uz_eSXYSaDXRsBXaoz-dmu8vVK24-VCC-q9OlYgZxQM', 'resolutions': [{'height': 60, 'url': 'https://external-preview.redd.it/Hr8xAaDVWas63KX76SImXInEossNzJkzOeibyA8xLWY.jpg?width=108&amp;crop=smart&amp;auto=webp&amp;s=e553ff76ee962fe7d5a43a67ae1a3f099237a5cf', 'width': 108}, {'height': 121, 'url': 'https://external-preview.redd.it/Hr8xAaDVWas63KX76SImXInEossNzJkzOeibyA8xLWY.jpg?width=216&amp;crop=smart&amp;auto=webp&amp;s=996253f17768537d411e59d036053cb854f9e16d', 'width': 216}, {'height': 180, 'url': 'https://external-preview.redd.it/Hr8xAaDVWas63KX76SImXInEossNzJkzOeibyA8xLWY.jpg?width=320&amp;crop=smart&amp;auto=webp&amp;s=bbf8ceb2be0a791129f55137b745e8f9029ec16b', 'width': 320}], 'source': {'height': 288, 'url': 'https://external-preview.redd.it/Hr8xAaDVWas63KX76SImXInEossNzJkzOeibyA8xLWY.jpg?auto=webp&amp;s=816d879d5fa1f8f1ddf2c1c87bfbf61053acbc96', 'width': 512}, 'variants': {}}]}	78.0	140.0	https://discord.gg/FqS2R9xVtG			reddit												"Join the CryptoTraders.com Discord Server!
"	join the cryptotraders com discord server nan	0.455661803483963	0.44033050537109375	0.4516969323158264	0.4873102903366089	0.4259326159954071	0.520685076713562	0.42272135615348816	0.39842063188552856	0.49568837881088257	0.025180960074067116
179	[]	False	tinusxxl		[]		text	t2_176h6llq	False	False	False	[]	False	False	1642762537	self.Bitcoin	https://www.reddit.com/r/Bitcoin/comments/s986t0/bitcoin_is_dumping_so_what/	{}	s986t0	False	True	False	False	False	True	True	False		[]	dark	text	False	False	False	0	0	False	all_ads	/r/Bitcoin/comments/s986t0/bitcoin_is_dumping_so_what/	False	6	1642762548	1	"You guys are all going crazy over nothing. Markets are shit, have you seen the stock market? Altcoins plummeting because they depend on bitcoins price.

Stop worrying, stack sats and keep your money in a cold wallet.
See you in 10 years🏎"	True	False	False	Bitcoin	t5_2s3qj	3813131	public	self	Bitcoin is dumping, so what?	0	[]	1.0	https://www.reddit.com/r/Bitcoin/comments/s986t0/bitcoin_is_dumping_so_what/	all_ads	6																						"Bitcoin is dumping, so what?
You guys are all going crazy over nothing. Markets are shit, have you seen the stock market? Altcoins plummeting because they depend on bitcoins price.

Stop worrying, stack sats and keep your money in a cold wallet.
See you in 10 years🏎"	bitcoin is dumping so what you guys are all going crazy over nothing markets are shit have you seen the stock market altcoins plummeting because they depend on bitcoins price stop worrying stack sats and keep your money in a cold wallet see you in 10 years 	0.0026096610818058252	0.9642304182052612	0.9150201082229614	0.035547927021980286	0.012771121226251125	0.30917948484420776	0.07077788561582565	8.465459586659563e-07	0.2642882466316223	0.0338042750954628
180	[]	False	Cute_Faithlessness14		[]		text	t2_8c9s3sht	False	False	False	[]	False	False	1642762265	self.Bitcoin	https://www.reddit.com/r/Bitcoin/comments/s984c9/does_anyone_want_to_give_me_a_bitcoin_i_could/	{}	s984c9	False	True	False	False	False	True	True	False		[]	dark	text	False	False	True	0	0	False	all_ads	/r/Bitcoin/comments/s984c9/does_anyone_want_to_give_me_a_bitcoin_i_could/	False	6	1642762276	1		True	False	False	Bitcoin	t5_2s3qj	3813121	public	self	Does anyone want to give me a Bitcoin i could really use it. I promise it’s gunna be put towards good use aka lairs and tp’ing houses	0	[]	1.0	https://www.reddit.com/r/Bitcoin/comments/s984c9/does_anyone_want_to_give_me_a_bitcoin_i_could/	all_ads	6																						"Does anyone want to give me a Bitcoin i could really use it. I promise it’s gunna be put towards good use aka lairs and tp’ing houses
"	does anyone want to give me a bitcoin i could really use it i promise it s gunna be put towards good use aka lairs and tp ing houses nan	0.287471741437912	0.5208179950714111	0.45023295283317566	0.014768309891223907	0.01021876372396946	0.6113835573196411	0.13742630183696747	8.652256155983196e-07	0.3097805976867676	0.005943967495113611
181	[]	False	nick2938		[]		text	t2_f83m5v1	False	False	False	[]	False	False	1642761967	i.imgur.com	https://www.reddit.com/r/Bitcoin/comments/s981ss/buy_the_ticket_take_the_ride/	{}	s981ss	False	True	False	False	False	True	False	False		[]	dark	text	False	False	False	0	0	False	all_ads	/r/Bitcoin/comments/s981ss/buy_the_ticket_take_the_ride/	False	6	1642761978	1		True	False	False	Bitcoin	t5_2s3qj	3813099	public	https://b.thumbs.redditmedia.com/gxO0UpX8lqyFSIi31ZOsPotukaBZR3EGiMpZBB6FPdc.jpg	Buy the ticket. Take the ride.	0	[]	1.0	https://i.imgur.com/2PGSrwS.jpg	all_ads	6			image	{'enabled': True, 'images': [{'id': 'BFyFPmDhoAsRQdvqX3pqmnrb-LhT_PJzc7mhVkWWr0c', 'resolutions': [{'height': 159, 'url': 'https://external-preview.redd.it/3m_qFPBiKTlr7dZiK9368EysHwIlpmecn1dfknXiCvI.jpg?width=108&amp;crop=smart&amp;auto=webp&amp;s=686b65a5340ab014d4afc19adc524b5678fb1fb2', 'width': 108}, {'height': 319, 'url': 'https://external-preview.redd.it/3m_qFPBiKTlr7dZiK9368EysHwIlpmecn1dfknXiCvI.jpg?width=216&amp;crop=smart&amp;auto=webp&amp;s=582c912188736c50806be01201f33baeed0a28b7', 'width': 216}, {'height': 474, 'url': 'https://external-preview.redd.it/3m_qFPBiKTlr7dZiK9368EysHwIlpmecn1dfknXiCvI.jpg?width=320&amp;crop=smart&amp;auto=webp&amp;s=ce741315481f96e98ea55b3473d89517fa957911', 'width': 320}, {'height': 948, 'url': 'https://external-preview.redd.it/3m_qFPBiKTlr7dZiK9368EysHwIlpmecn1dfknXiCvI.jpg?width=640&amp;crop=smart&amp;auto=webp&amp;s=4044d7d056ae9c9311ef01edf4fc49c7791c3cec', 'width': 640}, {'height': 1422, 'url': 'https://external-preview.redd.it/3m_qFPBiKTlr7dZiK9368EysHwIlpmecn1dfknXiCvI.jpg?width=960&amp;crop=smart&amp;auto=webp&amp;s=dbf7e83bfb6e7e77c6dace0defce52e8f9d0c3bd', 'width': 960}], 'source': {'height': 1588, 'url': 'https://external-preview.redd.it/3m_qFPBiKTlr7dZiK9368EysHwIlpmecn1dfknXiCvI.jpg?auto=webp&amp;s=ee249933465ead944c2f8458d0510c72681b0e11', 'width': 1072}, 'variants': {}}]}	140.0	140.0	https://i.imgur.com/2PGSrwS.jpg															"Buy the ticket. Take the ride.
"	buy the ticket take the ride nan	0.39913031458854675	0.5652899146080017	0.27642178535461426	0.5973575711250305	0.39214232563972473	0.6766756176948547	0.327791303396225	0.47910088300704956	0.3591643273830414	0.41036415100097656
182	[]	False	Cute_Air3836		[]		text	t2_hdn1gnsh	False	False	False	[]	False	False	1642761772	self.Bitcoin	https://www.reddit.com/r/Bitcoin/comments/s98051/cryptocom_25_usd_referral_code/	{}	s98051	False	False	False	False	False	False	True	False		[]	dark	text	False	False	True	0	0	False	all_ads	/r/Bitcoin/comments/s98051/cryptocom_25_usd_referral_code/	False	6	1642761782	1	[removed]	True	False	False	Bitcoin	t5_2s3qj	3813090	public	self	Crypto.com 25 USD REFERRAL CODE	0	[]	1.0	https://www.reddit.com/r/Bitcoin/comments/s98051/cryptocom_25_usd_referral_code/	all_ads	6										moderator												"Crypto.com 25 USD REFERRAL CODE
[removed]"	crypto com 25 usd referral code removed 	0.30245935916900635	0.711188793182373	0.2824860215187073	0.5227682590484619	0.42565372586250305	0.2675122022628784	0.36504828929901123	0.48245805501937866	0.4527650475502014	0.006305688060820103
